{
  "gpt_result": {
    "nl_utterance": "Show me the number of data samples according to mobility.",
    "encoded_fields": [
      {
        "field": "Mobility",
        "type": "quantitative",
        "nl_ref_type": "explicit",
        "nl_ref_phrase": "mobility"
      }
    ],
    "constraints": [
      {
        "c_type": "transform",
        "c_name": "aggregate",
        "c_list": [
          {
            "aggregate": "count"
          }
        ],
        "nl_ref_type": "explicit",
        "nl_ref_phrase": "number of data samples"
      }
    ]
  },
  "input": "Dataset Information: {\n  \"data samples\": [\n    {\n      \"ID\": 100,\n      \"Name\": \"Johnson City\",\n      \"Mobility\": 0.0621988103,\n      \"State\": \"TN\",\n      \"Population\": 576081,\n      \"Urban\": 1,\n      \"Black\": 0.021,\n      \"Seg_racial\": 0.09,\n      \"Seg_income\": 0.035,\n      \"Seg_poverty\": 0.03,\n      \"Seg_affluence\": 0.038,\n      \"Commute\": 0.325,\n      \"Income\": 31560,\n      \"Gini\": 0.468,\n      \"Share01\": 13.459,\n      \"Gini_99\": 0.333,\n      \"Middle_class\": 0.548,\n      \"Local_tax_rate\": 0.02,\n      \"Local_gov_spending\": 1886.0,\n      \"Progressivity\": 0.0,\n      \"EITC\": 0.0,\n      \"School_spending\": 5.185,\n      \"Student_teacher_ratio\": NaN,\n      \"Test_scores\": 2.728,\n      \"HS_dropout\": -0.015,\n      \"Colleges\": 0.014,\n      \"Tuition\": 4817.0,\n      \"Graduation\": -0.002,\n      \"Labor_force_participation\": 0.587,\n      \"Manufacturing\": 0.237,\n      \"Chinese_imports\": 5.294,\n      \"Teenage_labor\": 0.004,\n      \"Migration_in\": 0.006,\n      \"Migration_out\": 0.005,\n      \"Foreign_born\": 0.012,\n      \"Social_capital\": -0.298,\n      \"Religious\": 0.514,\n      \"Violent_crime\": 0.001,\n      \"Single_mothers\": 0.19,\n      \"Divorced\": 0.11,\n      \"Married\": 0.601,\n      \"Longitude\": -82.4363861083984,\n      \"Latitude\": 36.4703712463379\n    },\n    {\n      \"ID\": 7500,\n      \"Name\": \"Deltona\",\n      \"Mobility\": 0.0587789156,\n      \"State\": \"FL\",\n      \"Population\": 563598,\n      \"Urban\": 1,\n      \"Black\": 0.1,\n      \"Seg_racial\": 0.196,\n      \"Seg_income\": 0.048,\n      \"Seg_poverty\": 0.049,\n      \"Seg_affluence\": 0.046,\n      \"Commute\": 0.303,\n      \"Income\": 38459,\n      \"Gini\": 0.465,\n      \"Share01\": 11.814,\n      \"Gini_99\": 0.347,\n      \"Middle_class\": 0.524,\n      \"Local_tax_rate\": 0.025,\n      \"Local_gov_spending\": 2775.0,\n      \"Progressivity\": 0.0,\n      \"EITC\": 0.0,\n      \"School_spending\": 5.831,\n      \"Student_teacher_ratio\": 17.6,\n      \"Test_scores\": 0.434,\n      \"HS_dropout\": -0.025,\n      \"Colleges\": 0.009,\n      \"Tuition\": 8990.0,\n      \"Graduation\": 0.054,\n      \"Labor_force_participation\": 0.541,\n      \"Manufacturing\": 0.092,\n      \"Chinese_imports\": 0.539,\n      \"Teenage_labor\": 0.004,\n      \"Migration_in\": 0.051,\n      \"Migration_out\": 0.028,\n      \"Foreign_born\": 0.062,\n      \"Social_capital\": -1.39,\n      \"Religious\": 0.374,\n      \"Violent_crime\": NaN,\n      \"Single_mothers\": 0.249,\n      \"Divorced\": 0.12,\n      \"Married\": 0.565,\n      \"Longitude\": -81.4155960083008,\n      \"Latitude\": 29.2213096618652\n    },\n    {\n      \"ID\": 15300,\n      \"Name\": \"Parkersburg\",\n      \"Mobility\": 0.0708944052,\n      \"State\": \"WV\",\n      \"Population\": 202967,\n      \"Urban\": 1,\n      \"Black\": 0.008,\n      \"Seg_racial\": 0.044,\n      \"Seg_income\": 0.028,\n      \"Seg_poverty\": 0.025,\n      \"Seg_affluence\": 0.031,\n      \"Commute\": 0.346,\n      \"Income\": 32372,\n      \"Gini\": 0.375,\n      \"Share01\": 7.579,\n      \"Gini_99\": 0.3,\n      \"Middle_class\": 0.578,\n      \"Local_tax_rate\": 0.017,\n      \"Local_gov_spending\": 1826.0,\n      \"Progressivity\": 2.5,\n      \"EITC\": 0.0,\n      \"School_spending\": 5.851,\n      \"Student_teacher_ratio\": 16.9,\n      \"Test_scores\": -0.284,\n      \"HS_dropout\": -0.003,\n      \"Colleges\": 0.025,\n      \"Tuition\": 7253.0,\n      \"Graduation\": 0.03,\n      \"Labor_force_participation\": 0.582,\n      \"Manufacturing\": 0.19,\n      \"Chinese_imports\": 1.383,\n      \"Teenage_labor\": 0.003,\n      \"Migration_in\": 0.007,\n      \"Migration_out\": 0.008,\n      \"Foreign_born\": 0.008,\n      \"Social_capital\": 0.333,\n      \"Religious\": 0.398,\n      \"Violent_crime\": 0.001,\n      \"Single_mothers\": 0.19,\n      \"Divorced\": 0.108,\n      \"Married\": 0.599,\n      \"Longitude\": -81.4451217651367,\n      \"Latitude\": 39.1996803283691\n    }\n  ],\n  \"column names\": [\n    \"ID\",\n    \"Name\",\n    \"Mobility\",\n    \"State\",\n    \"Population\",\n    \"Urban\",\n    \"Black\",\n    \"Seg_racial\",\n    \"Seg_income\",\n    \"Seg_poverty\",\n    \"Seg_affluence\",\n    \"Commute\",\n    \"Income\",\n    \"Gini\",\n    \"Share01\",\n    \"Gini_99\",\n    \"Middle_class\",\n    \"Local_tax_rate\",\n    \"Local_gov_spending\",\n    \"Progressivity\",\n    \"EITC\",\n    \"School_spending\",\n    \"Student_teacher_ratio\",\n    \"Test_scores\",\n    \"HS_dropout\",\n    \"Colleges\",\n    \"Tuition\",\n    \"Graduation\",\n    \"Labor_force_participation\",\n    \"Manufacturing\",\n    \"Chinese_imports\",\n    \"Teenage_labor\",\n    \"Migration_in\",\n    \"Migration_out\",\n    \"Foreign_born\",\n    \"Social_capital\",\n    \"Religious\",\n    \"Violent_crime\",\n    \"Single_mothers\",\n    \"Divorced\",\n    \"Married\",\n    \"Longitude\",\n    \"Latitude\"\n  ]\n}\n\nYour Job:\nI am developing a NL to Data Visualization Dataset. \nPlease help me generate natural language utterance for given dataset and constraints.\nDefinition about the Taks:\n- 'utterance' is what a user would say to make a chart, it can be a question or a command. One NL 'utterance' is in one or two sentences. \n- 'given dataset' is in form of column names, column type, range/unique values of the column.\n- 'constraints' are information about the chart that should be included in the utterance. \n    So we can find a reference phrase in the NL utterance that corresponds to the given constraints. \n- 'reference phrase' can be explicit, ambiguous, and by_value. 'ambiguous' means the phrase can map to more than one columns in the dataset, always a hypernym of column names(depending on the dataset values).\n    For example:\n    {\"column\": \"gdpPercap\", \"nl_ref_type\": \"explicit\", \"nl_ref_phrase\": \"GDP per capita\"},\n    {\"column\": [\"country\",\"continent\"], \"nl_ref_type\": \"ambiguous\", \"nl_ref_phrase\": \"region\"}\n    {\"column\": [\"country\",\"country_short_name\"], \"nl_ref_type\": \"ambiguous\", \"nl_ref_phrase\": \"countries\"}\n    {\"c_type\": \"mark\", \"c_name\": \"point chart\", \"nl_ref_type\": \"explicit\", \"nl_ref_phrase\": \"scatter plot\"}\n    {\"c_type\": \"mark\", \"c_name\": \"arc chart\", \"nl_ref_type\": \"explicit\", \"nl_ref_phrase\": \"pie chart\"}\n    {\"c_type\": \"transform\",\"c_name\": \"filter\",\"c_list\": [{\"field\": \"country\",\"oneOf\": [\"Iceland\",\"Norway\"]}],\"nl_ref_type\": \"explicit\",\"nl_ref_phrase\": \"for countries Iceland and Norway\"},\n    {\"c_type\": \"transform\",\"c_name\": \"filter\",\"c_list\": [{\"field\": \"country\",\"oneOf\": [\"Iceland\",\"Norway\"]}],\"nl_ref_type\": \"by_value\",\"nl_ref_phrase\": \"for Iceland and Norway\"},\n- the 'nl_ref_phrase' for 'ambiguous' columns should be equally near all ambiguous columns, not too near to one of the column since it would not be ambiguous.\n    good example: {\"column\": [\"country\",\"region\"], \"nl_ref_type\": \"ambiguous\", \"nl_ref_phrase\": \"location\"}\n    bad example: {\"column\": [\"country\",\"region\"], \"nl_ref_type\": \"ambiguous\", \"nl_ref_phrase\": \"region\"}\n- You only include given constraints and no other information. \n    For example, if a column name is not in the given constraint, it will not be included in the NL utterance.\n    Also, it a chart mark or chart encoding channel is not in the given constraint, it will not be included in the NL utterance.\n- all 'nl_ref_phrase' shoule be included in the 'nl_utterance'. \n\nThe output format is identical to the input format, but fill in the str blanks(\"...\").\n### Input:\n{\n  \"nl_utterance\": \"...\",\n  \"encoded_fields\": [\n    {\n      \"field\": \"Mobility\",\n      \"type\": \"quantitative\",\n      \"nl_ref_type\": \"explicit\",\n      \"nl_ref_phrase\": \"...\"\n    }\n  ],\n  \"constraints\": [\n    {\n      \"c_type\": \"transform\",\n      \"c_name\": \"aggregate\",\n      \"c_list\": [\n        {\n          \"aggregate\": \"count\"\n        }\n      ],\n      \"nl_ref_type\": \"explicit\",\n      \"nl_ref_phrase\": \"...\"\n    }\n  ]\n}\n\n### Output:"
}