{
  "gpt_result": {
    "nl_utterance": "Show me a bar chart of the total trade value for countries with less than 21 trade partners, sorted by trade total in descending order.",
    "encoded_fields": [
      {
        "field": "tradeTotal",
        "type": "quantitative",
        "nl_ref_type": "explicit",
        "nl_ref_phrase": "total trade value"
      },
      {
        "field": "Country",
        "type": "nominal",
        "nl_ref_type": "explicit",
        "nl_ref_phrase": "countries"
      }
    ],
    "constraints": [
      {
        "c_type": "mark",
        "c_name": "bar chart",
        "nl_ref_type": "explicit",
        "nl_ref_phrase": "bar chart"
      },
      {
        "c_type": "transform",
        "c_name": "filter",
        "nl_ref_type": "by_value",
        "nl_ref_phrase": "less than 21 trade partners"
      },
      {
        "c_type": "transform",
        "c_name": "sort",
        "nl_ref_type": "explicit",
        "nl_ref_phrase": "sorted by trade total in descending order"
      }
    ]
  },
  "input": "Dataset Information: {\n  \"data samples\": [\n    {\n      \"Country\": \"Mexico\",\n      \"tradePartner\": 1,\n      \"tradeTotal\": 124564,\n      \"Balance\": -20774.0,\n      \"Balance_absolute\": 20774,\n      \"Balance_pctTrade\": -0.17,\n      \"Exports\": 51895.0,\n      \"Exports_absolute\": 51895.0,\n      \"Imports\": 72669.0,\n      \"Imports_absolute\": 72669.0,\n      \"Source\": \"https://www.census.gov/foreign-trade/Press-Release/current_press_release/index.html\"\n    },\n    {\n      \"Country\": \"Guinea\",\n      \"tradePartner\": 161,\n      \"tradeTotal\": 25,\n      \"Balance\": 16.0,\n      \"Balance_absolute\": 16,\n      \"Balance_pctTrade\": 0.64,\n      \"Exports\": 21.0,\n      \"Exports_absolute\": 21.0,\n      \"Imports\": 5.0,\n      \"Imports_absolute\": 5.0,\n      \"Source\": NaN\n    },\n    {\n      \"Country\": \"Thailand\",\n      \"tradePartner\": 18,\n      \"tradeTotal\": 11445,\n      \"Balance\": -6139.0,\n      \"Balance_absolute\": 6139,\n      \"Balance_pctTrade\": -0.54,\n      \"Exports\": 2653.0,\n      \"Exports_absolute\": 2653.0,\n      \"Imports\": 8792.0,\n      \"Imports_absolute\": 8792.0,\n      \"Source\": NaN\n    }\n  ],\n  \"column names\": [\n    \"Country\",\n    \"tradePartner\",\n    \"tradeTotal\",\n    \"Balance\",\n    \"Balance_absolute\",\n    \"Balance_pctTrade\",\n    \"Exports\",\n    \"Exports_absolute\",\n    \"Imports\",\n    \"Imports_absolute\",\n    \"Source\"\n  ]\n}\n\nYour Job:\nI am developing a NL to Data Visualization Dataset. \nPlease help me generate natural language utterance for given dataset and constraints.\nDefinition about the Taks:\n- 'utterance' is what a user would say to make a chart, it can be a question or a command. One NL 'utterance' is in one or two sentences. \n- 'given dataset' is in form of column names, column type, range/unique values of the column.\n- 'constraints' are information about the chart that should be included in the utterance. \n    So we can find a reference phrase in the NL utterance that corresponds to the given constraints. \n- 'reference phrase' can be explicit, ambiguous, and by_value. 'ambiguous' means the phrase can map to more than one columns in the dataset, always a hypernym of column names(depending on the dataset values).\n    For example:\n    {\"column\": \"gdpPercap\", \"nl_ref_type\": \"explicit\", \"nl_ref_phrase\": \"GDP per capita\"},\n    {\"column\": [\"country\",\"continent\"], \"nl_ref_type\": \"ambiguous\", \"nl_ref_phrase\": \"region\"}\n    {\"column\": [\"country\",\"country_short_name\"], \"nl_ref_type\": \"ambiguous\", \"nl_ref_phrase\": \"countries\"}\n    {\"c_type\": \"mark\", \"c_name\": \"point chart\", \"nl_ref_type\": \"explicit\", \"nl_ref_phrase\": \"scatter plot\"}\n    {\"c_type\": \"mark\", \"c_name\": \"arc chart\", \"nl_ref_type\": \"explicit\", \"nl_ref_phrase\": \"pie chart\"}\n    {\"c_type\": \"transform\",\"c_name\": \"filter\",\"c_list\": [{\"field\": \"country\",\"oneOf\": [\"Iceland\",\"Norway\"]}],\"nl_ref_type\": \"explicit\",\"nl_ref_phrase\": \"for countries Iceland and Norway\"},\n    {\"c_type\": \"transform\",\"c_name\": \"filter\",\"c_list\": [{\"field\": \"country\",\"oneOf\": [\"Iceland\",\"Norway\"]}],\"nl_ref_type\": \"by_value\",\"nl_ref_phrase\": \"for Iceland and Norway\"},\n- the 'nl_ref_phrase' for 'ambiguous' columns should be equally near all ambiguous columns, not too near to one of the column since it would not be ambiguous.\n    good example: {\"column\": [\"country\",\"region\"], \"nl_ref_type\": \"ambiguous\", \"nl_ref_phrase\": \"location\"}\n    bad example: {\"column\": [\"country\",\"region\"], \"nl_ref_type\": \"ambiguous\", \"nl_ref_phrase\": \"region\"}\n- You only include given constraints and no other information. \n    For example, if a column name is not in the given constraint, it will not be included in the NL utterance.\n    Also, it a chart mark or chart encoding channel is not in the given constraint, it will not be included in the NL utterance.\n- all 'nl_ref_phrase' shoule be included in the 'nl_utterance'. \n\nThe output format is identical to the input format, but fill in the str blanks(\"...\").\n### Input:\n{\n  \"nl_utterance\": \"...\",\n  \"encoded_fields\": [\n    {\n      \"field\": \"tradeTotal\",\n      \"type\": \"quantitative\",\n      \"nl_ref_type\": \"explicit\",\n      \"nl_ref_phrase\": \"...\"\n    },\n    {\n      \"field\": \"Country\",\n      \"type\": \"nominal\",\n      \"nl_ref_type\": \"explicit\",\n      \"nl_ref_phrase\": \"...\"\n    }\n  ],\n  \"constraints\": [\n    {\n      \"c_type\": \"mark\",\n      \"c_name\": \"bar chart\",\n      \"c_list\": [\n        {\n          \"mark\": \"bar\",\n          \"encoding\": {\n            \"x\": {},\n            \"y\": {\n              \"type\": \"quantitative\"\n            },\n            \"color\": {\n              \"type\": \"nominal\",\n              \"ignore\": true\n            },\n            \"column\": {\n              \"ignore\": true,\n              \"type\": \"nominal\"\n            },\n            \"row\": {\n              \"ignore\": true,\n              \"type\": \"nominal\"\n            }\n          },\n          \"unique_map\": {\n            \"x\": \"y\"\n          }\n        },\n        {\n          \"mark\": \"bar\",\n          \"encoding\": {\n            \"y\": {},\n            \"x\": {\n              \"type\": \"quantitative\"\n            },\n            \"color\": {\n              \"type\": \"nominal\",\n              \"ignore\": true\n            },\n            \"column\": {\n              \"ignore\": true,\n              \"type\": \"nominal\"\n            },\n            \"row\": {\n              \"ignore\": true,\n              \"type\": \"nominal\"\n            }\n          },\n          \"unique_map\": {\n            \"y\": \"x\"\n          }\n        }\n      ],\n      \"nl_ref_type\": \"explicit\",\n      \"nl_ref_phrase\": \"...\"\n    },\n    {\n      \"c_type\": \"transform\",\n      \"c_name\": \"filter\",\n      \"c_list\": [\n        {\n          \"field\": \"tradePartner\",\n          \"lt\": 21\n        }\n      ],\n      \"nl_ref_type\": \"by_value\",\n      \"nl_ref_phrase\": \"...\"\n    },\n    {\n      \"c_type\": \"transform\",\n      \"c_name\": \"sort\",\n      \"c_list\": [\n        {\n          \"field\": \"tradeTotal\",\n          \"order\": \"descending\"\n        }\n      ],\n      \"nl_ref_type\": \"explicit\",\n      \"nl_ref_phrase\": \"...\"\n    }\n  ]\n}\n\n### Output:"
}