{
  "gpt_result": {
    "nl_utterance": "Generate a distribution chart showing the mobility data.",
    "encoded_fields": [
      {
        "field": "Mobility",
        "type": "quantitative",
        "nl_ref_type": "explicit",
        "nl_ref_phrase": "mobility data"
      }
    ],
    "constraints": [
      {
        "c_type": "task",
        "c_name": "distribution",
        "c_list": [
          {
            "mark": "bar",
            "encoding": {
              "y": {
                "aggregate": "count",
                "type": "quantitative"
              }
            },
            "x_y_reversable": true
          },
          {
            "mark": "boxplot",
            "encoding": {
              "x": {
                "type": "quantitative"
              }
            },
            "x_y_reversable": true
          }
        ],
        "nl_ref_type": "explicit",
        "nl_ref_phrase": "distribution chart"
      }
    ]
  },
  "input": "Dataset Information: {\n  \"data samples\": [\n    {\n      \"ID\": 100,\n      \"Name\": \"Johnson City\",\n      \"Mobility\": 0.0621988103,\n      \"State\": \"TN\",\n      \"Population\": 576081,\n      \"Urban\": 1,\n      \"Black\": 0.021,\n      \"Seg_racial\": 0.09,\n      \"Seg_income\": 0.035,\n      \"Seg_poverty\": 0.03,\n      \"Seg_affluence\": 0.038,\n      \"Commute\": 0.325,\n      \"Income\": 31560,\n      \"Gini\": 0.468,\n      \"Share01\": 13.459,\n      \"Gini_99\": 0.333,\n      \"Middle_class\": 0.548,\n      \"Local_tax_rate\": 0.02,\n      \"Local_gov_spending\": 1886.0,\n      \"Progressivity\": 0.0,\n      \"EITC\": 0.0,\n      \"School_spending\": 5.185,\n      \"Student_teacher_ratio\": NaN,\n      \"Test_scores\": 2.728,\n      \"HS_dropout\": -0.015,\n      \"Colleges\": 0.014,\n      \"Tuition\": 4817.0,\n      \"Graduation\": -0.002,\n      \"Labor_force_participation\": 0.587,\n      \"Manufacturing\": 0.237,\n      \"Chinese_imports\": 5.294,\n      \"Teenage_labor\": 0.004,\n      \"Migration_in\": 0.006,\n      \"Migration_out\": 0.005,\n      \"Foreign_born\": 0.012,\n      \"Social_capital\": -0.298,\n      \"Religious\": 0.514,\n      \"Violent_crime\": 0.001,\n      \"Single_mothers\": 0.19,\n      \"Divorced\": 0.11,\n      \"Married\": 0.601,\n      \"Longitude\": -82.4363861083984,\n      \"Latitude\": 36.4703712463379\n    },\n    {\n      \"ID\": 15500,\n      \"Name\": \"Steubenville\",\n      \"Mobility\": 0.0727181509,\n      \"State\": \"OH\",\n      \"Population\": 132008,\n      \"Urban\": 1,\n      \"Black\": 0.039,\n      \"Seg_racial\": 0.184,\n      \"Seg_income\": 0.03,\n      \"Seg_poverty\": 0.037,\n      \"Seg_affluence\": 0.018,\n      \"Commute\": 0.378,\n      \"Income\": 32010,\n      \"Gini\": 0.35,\n      \"Share01\": 9.312,\n      \"Gini_99\": 0.257,\n      \"Middle_class\": 0.632,\n      \"Local_tax_rate\": 0.02,\n      \"Local_gov_spending\": 1512.0,\n      \"Progressivity\": 2.66,\n      \"EITC\": 0.0,\n      \"School_spending\": 5.935,\n      \"Student_teacher_ratio\": 17.5,\n      \"Test_scores\": 8.384,\n      \"HS_dropout\": -0.009,\n      \"Colleges\": 0.023,\n      \"Tuition\": 11197.0,\n      \"Graduation\": 0.196,\n      \"Labor_force_participation\": 0.546,\n      \"Manufacturing\": 0.216,\n      \"Chinese_imports\": 1.316,\n      \"Teenage_labor\": 0.003,\n      \"Migration_in\": 0.011,\n      \"Migration_out\": 0.012,\n      \"Foreign_born\": 0.013,\n      \"Social_capital\": 0.893,\n      \"Religious\": 0.448,\n      \"Violent_crime\": 0.001,\n      \"Single_mothers\": 0.211,\n      \"Divorced\": 0.098,\n      \"Married\": 0.571,\n      \"Longitude\": -80.7016906738281,\n      \"Latitude\": 40.4033126831055\n    },\n    {\n      \"ID\": 12002,\n      \"Name\": \"Ludington\",\n      \"Mobility\": 0.0760736167,\n      \"State\": \"MI\",\n      \"Population\": 52801,\n      \"Urban\": 0,\n      \"Black\": 0.011,\n      \"Seg_racial\": 0.063,\n      \"Seg_income\": 0.02,\n      \"Seg_poverty\": 0.02,\n      \"Seg_affluence\": 0.021,\n      \"Commute\": 0.493,\n      \"Income\": 33400,\n      \"Gini\": 0.371,\n      \"Share01\": 9.758,\n      \"Gini_99\": 0.274,\n      \"Middle_class\": 0.6,\n      \"Local_tax_rate\": 0.035,\n      \"Local_gov_spending\": 2207.0,\n      \"Progressivity\": 0.0,\n      \"EITC\": 0.0,\n      \"School_spending\": 6.004,\n      \"Student_teacher_ratio\": 18.3,\n      \"Test_scores\": 6.417,\n      \"HS_dropout\": NaN,\n      \"Colleges\": 0.019,\n      \"Tuition\": 1974.0,\n      \"Graduation\": -0.225,\n      \"Labor_force_participation\": 0.589,\n      \"Manufacturing\": 0.208,\n      \"Chinese_imports\": 1.481,\n      \"Teenage_labor\": 0.006,\n      \"Migration_in\": 0.016,\n      \"Migration_out\": 0.016,\n      \"Foreign_born\": 0.014,\n      \"Social_capital\": 1.041,\n      \"Religious\": 0.447,\n      \"Violent_crime\": 0.001,\n      \"Single_mothers\": 0.206,\n      \"Divorced\": 0.105,\n      \"Married\": 0.59,\n      \"Longitude\": -86.1842346191406,\n      \"Latitude\": 44.122974395752\n    }\n  ],\n  \"column names\": [\n    \"ID\",\n    \"Name\",\n    \"Mobility\",\n    \"State\",\n    \"Population\",\n    \"Urban\",\n    \"Black\",\n    \"Seg_racial\",\n    \"Seg_income\",\n    \"Seg_poverty\",\n    \"Seg_affluence\",\n    \"Commute\",\n    \"Income\",\n    \"Gini\",\n    \"Share01\",\n    \"Gini_99\",\n    \"Middle_class\",\n    \"Local_tax_rate\",\n    \"Local_gov_spending\",\n    \"Progressivity\",\n    \"EITC\",\n    \"School_spending\",\n    \"Student_teacher_ratio\",\n    \"Test_scores\",\n    \"HS_dropout\",\n    \"Colleges\",\n    \"Tuition\",\n    \"Graduation\",\n    \"Labor_force_participation\",\n    \"Manufacturing\",\n    \"Chinese_imports\",\n    \"Teenage_labor\",\n    \"Migration_in\",\n    \"Migration_out\",\n    \"Foreign_born\",\n    \"Social_capital\",\n    \"Religious\",\n    \"Violent_crime\",\n    \"Single_mothers\",\n    \"Divorced\",\n    \"Married\",\n    \"Longitude\",\n    \"Latitude\"\n  ]\n}\n\nYour Job:\nI am developing a NL to Data Visualization Dataset. \nPlease help me generate natural language utterance for given dataset and constraints.\nDefinition about the Taks:\n- 'utterance' is what a user would say to make a chart, it can be a question or a command. One NL 'utterance' is in one or two sentences. \n- 'given dataset' is in form of column names, column type, range/unique values of the column.\n- 'constraints' are information about the chart that should be included in the utterance. \n    So we can find a reference phrase in the NL utterance that corresponds to the given constraints. \n- 'reference phrase' can be explicit, ambiguous, and by_value. 'ambiguous' means the phrase can map to more than one columns in the dataset, always a hypernym of column names(depending on the dataset values).\n    For example:\n    {\"column\": \"gdpPercap\", \"nl_ref_type\": \"explicit\", \"nl_ref_phrase\": \"GDP per capita\"},\n    {\"column\": [\"country\",\"continent\"], \"nl_ref_type\": \"ambiguous\", \"nl_ref_phrase\": \"region\"}\n    {\"column\": [\"country\",\"country_short_name\"], \"nl_ref_type\": \"ambiguous\", \"nl_ref_phrase\": \"countries\"}\n    {\"c_type\": \"mark\", \"c_name\": \"point chart\", \"nl_ref_type\": \"explicit\", \"nl_ref_phrase\": \"scatter plot\"}\n    {\"c_type\": \"mark\", \"c_name\": \"arc chart\", \"nl_ref_type\": \"explicit\", \"nl_ref_phrase\": \"pie chart\"}\n    {\"c_type\": \"transform\",\"c_name\": \"filter\",\"c_list\": [{\"field\": \"country\",\"oneOf\": [\"Iceland\",\"Norway\"]}],\"nl_ref_type\": \"explicit\",\"nl_ref_phrase\": \"for countries Iceland and Norway\"},\n    {\"c_type\": \"transform\",\"c_name\": \"filter\",\"c_list\": [{\"field\": \"country\",\"oneOf\": [\"Iceland\",\"Norway\"]}],\"nl_ref_type\": \"by_value\",\"nl_ref_phrase\": \"for Iceland and Norway\"},\n- the 'nl_ref_phrase' for 'ambiguous' columns should be equally near all ambiguous columns, not too near to one of the column since it would not be ambiguous.\n    good example: {\"column\": [\"country\",\"region\"], \"nl_ref_type\": \"ambiguous\", \"nl_ref_phrase\": \"location\"}\n    bad example: {\"column\": [\"country\",\"region\"], \"nl_ref_type\": \"ambiguous\", \"nl_ref_phrase\": \"region\"}\n- You only include given constraints and no other information. \n    For example, if a column name is not in the given constraint, it will not be included in the NL utterance.\n    Also, it a chart mark or chart encoding channel is not in the given constraint, it will not be included in the NL utterance.\n- all 'nl_ref_phrase' shoule be included in the 'nl_utterance'. \n\nThe output format is identical to the input format, but fill in the str blanks(\"...\").\n### Input:\n{\n  \"nl_utterance\": \"...\",\n  \"encoded_fields\": [\n    {\n      \"field\": \"Mobility\",\n      \"type\": \"quantitative\",\n      \"nl_ref_type\": \"explicit\",\n      \"nl_ref_phrase\": \"...\"\n    }\n  ],\n  \"constraints\": [\n    {\n      \"c_type\": \"task\",\n      \"c_name\": \"distribution\",\n      \"c_list\": [\n        {\n          \"mark\": \"bar\",\n          \"encoding\": {\n            \"y\": {\n              \"aggregate\": \"count\",\n              \"type\": \"quantitative\"\n            }\n          },\n          \"x_y_reversable\": true\n        },\n        {\n          \"mark\": \"boxplot\",\n          \"encoding\": {\n            \"x\": {\n              \"type\": \"quantitative\"\n            }\n          },\n          \"x_y_reversable\": true\n        }\n      ],\n      \"nl_ref_type\": \"explicit\",\n      \"nl_ref_phrase\": \"...\"\n    }\n  ]\n}\n\n### Output:"
}