{
  "gpt_result": {
    "nl_utterance": "Show me a bar chart or boxplot of the distribution of values in the dataset.",
    "encoded_fields": [],
    "constraints": [
      {
        "c_type": "task",
        "c_name": "distribution",
        "c_list": [
          {
            "mark": "bar",
            "encoding": {
              "y": {
                "aggregate": "count",
                "type": "quantitative"
              }
            },
            "x_y_reversable": true
          },
          {
            "mark": "boxplot",
            "encoding": {
              "x": {
                "type": "quantitative"
              }
            },
            "x_y_reversable": true
          }
        ],
        "nl_ref_type": "explicit",
        "nl_ref_phrase": "distribution"
      }
    ]
  },
  "input": "Dataset Information: {\n  \"data samples\": [\n    {\n      \"ID\": 100,\n      \"Name\": \"Johnson City\",\n      \"Mobility\": 0.0621988103,\n      \"State\": \"TN\",\n      \"Population\": 576081,\n      \"Urban\": 1,\n      \"Black\": 0.021,\n      \"Seg_racial\": 0.09,\n      \"Seg_income\": 0.035,\n      \"Seg_poverty\": 0.03,\n      \"Seg_affluence\": 0.038,\n      \"Commute\": 0.325,\n      \"Income\": 31560,\n      \"Gini\": 0.468,\n      \"Share01\": 13.459,\n      \"Gini_99\": 0.333,\n      \"Middle_class\": 0.548,\n      \"Local_tax_rate\": 0.02,\n      \"Local_gov_spending\": 1886.0,\n      \"Progressivity\": 0.0,\n      \"EITC\": 0.0,\n      \"School_spending\": 5.185,\n      \"Student_teacher_ratio\": NaN,\n      \"Test_scores\": 2.728,\n      \"HS_dropout\": -0.015,\n      \"Colleges\": 0.014,\n      \"Tuition\": 4817.0,\n      \"Graduation\": -0.002,\n      \"Labor_force_participation\": 0.587,\n      \"Manufacturing\": 0.237,\n      \"Chinese_imports\": 5.294,\n      \"Teenage_labor\": 0.004,\n      \"Migration_in\": 0.006,\n      \"Migration_out\": 0.005,\n      \"Foreign_born\": 0.012,\n      \"Social_capital\": -0.298,\n      \"Religious\": 0.514,\n      \"Violent_crime\": 0.001,\n      \"Single_mothers\": 0.19,\n      \"Divorced\": 0.11,\n      \"Married\": 0.601,\n      \"Longitude\": -82.4363861083984,\n      \"Latitude\": 36.4703712463379\n    },\n    {\n      \"ID\": 26102,\n      \"Name\": \"Marshall\",\n      \"Mobility\": 0.0948379338,\n      \"State\": \"MO\",\n      \"Population\": 48599,\n      \"Urban\": 0,\n      \"Black\": 0.037,\n      \"Seg_racial\": 0.093,\n      \"Seg_income\": 0.025,\n      \"Seg_poverty\": 0.021,\n      \"Seg_affluence\": 0.032,\n      \"Commute\": 0.559,\n      \"Income\": 31245,\n      \"Gini\": 0.352,\n      \"Share01\": 8.005,\n      \"Gini_99\": 0.272,\n      \"Middle_class\": 0.607,\n      \"Local_tax_rate\": 0.014,\n      \"Local_gov_spending\": 1563.0,\n      \"Progressivity\": 0.0,\n      \"EITC\": 0.0,\n      \"School_spending\": 5.395,\n      \"Student_teacher_ratio\": 14.9,\n      \"Test_scores\": -2.981,\n      \"HS_dropout\": 0.002,\n      \"Colleges\": 0.021,\n      \"Tuition\": 11500.0,\n      \"Graduation\": -0.026,\n      \"Labor_force_participation\": 0.62,\n      \"Manufacturing\": 0.171,\n      \"Chinese_imports\": 1.541,\n      \"Teenage_labor\": 0.006,\n      \"Migration_in\": 0.015,\n      \"Migration_out\": 0.015,\n      \"Foreign_born\": 0.019,\n      \"Social_capital\": 0.857,\n      \"Religious\": 0.651,\n      \"Violent_crime\": 0.002,\n      \"Single_mothers\": 0.188,\n      \"Divorced\": 0.101,\n      \"Married\": 0.58,\n      \"Longitude\": -93.2859725952148,\n      \"Latitude\": 39.3893966674805\n    },\n    {\n      \"ID\": 27201,\n      \"Name\": \"Sioux Center\",\n      \"Mobility\": 0.2307692319,\n      \"State\": \"IA\",\n      \"Population\": 58454,\n      \"Urban\": 0,\n      \"Black\": 0.002,\n      \"Seg_racial\": 0.047,\n      \"Seg_income\": 0.007,\n      \"Seg_poverty\": 0.005,\n      \"Seg_affluence\": 0.006,\n      \"Commute\": 0.629,\n      \"Income\": 32542,\n      \"Gini\": 0.33,\n      \"Share01\": 13.264,\n      \"Gini_99\": 0.198,\n      \"Middle_class\": 0.734,\n      \"Local_tax_rate\": 0.023,\n      \"Local_gov_spending\": 2097.0,\n      \"Progressivity\": 2.86,\n      \"EITC\": 3.714,\n      \"School_spending\": 6.003,\n      \"Student_teacher_ratio\": 14.9,\n      \"Test_scores\": 10.514,\n      \"HS_dropout\": -0.031,\n      \"Colleges\": 0.051,\n      \"Tuition\": 10233.0,\n      \"Graduation\": 0.195,\n      \"Labor_force_participation\": 0.69,\n      \"Manufacturing\": 0.188,\n      \"Chinese_imports\": 1.407,\n      \"Teenage_labor\": 0.007,\n      \"Migration_in\": 0.008,\n      \"Migration_out\": 0.01,\n      \"Foreign_born\": 0.023,\n      \"Social_capital\": 2.82,\n      \"Religious\": 0.928,\n      \"Violent_crime\": 0.001,\n      \"Single_mothers\": 0.082,\n      \"Divorced\": 0.042,\n      \"Married\": 0.634,\n      \"Longitude\": -96.3176116943359,\n      \"Latitude\": 43.2065963745117\n    }\n  ],\n  \"column names\": [\n    \"ID\",\n    \"Name\",\n    \"Mobility\",\n    \"State\",\n    \"Population\",\n    \"Urban\",\n    \"Black\",\n    \"Seg_racial\",\n    \"Seg_income\",\n    \"Seg_poverty\",\n    \"Seg_affluence\",\n    \"Commute\",\n    \"Income\",\n    \"Gini\",\n    \"Share01\",\n    \"Gini_99\",\n    \"Middle_class\",\n    \"Local_tax_rate\",\n    \"Local_gov_spending\",\n    \"Progressivity\",\n    \"EITC\",\n    \"School_spending\",\n    \"Student_teacher_ratio\",\n    \"Test_scores\",\n    \"HS_dropout\",\n    \"Colleges\",\n    \"Tuition\",\n    \"Graduation\",\n    \"Labor_force_participation\",\n    \"Manufacturing\",\n    \"Chinese_imports\",\n    \"Teenage_labor\",\n    \"Migration_in\",\n    \"Migration_out\",\n    \"Foreign_born\",\n    \"Social_capital\",\n    \"Religious\",\n    \"Violent_crime\",\n    \"Single_mothers\",\n    \"Divorced\",\n    \"Married\",\n    \"Longitude\",\n    \"Latitude\"\n  ]\n}\n\nYour Job:\nI am developing a NL to Data Visualization Dataset. \nPlease help me generate natural language utterance for given dataset and constraints.\nDefinition about the Taks:\n- 'utterance' is what a user would say to make a chart, it can be a question or a command. One NL 'utterance' is in one or two sentences. \n- 'given dataset' is in form of column names, column type, range/unique values of the column.\n- 'constraints' are information about the chart that should be included in the utterance. \n    So we can find a reference phrase in the NL utterance that corresponds to the given constraints. \n- 'reference phrase' can be explicit, ambiguous, and by_value. 'ambiguous' means the phrase can map to more than one columns in the dataset, always a hypernym of column names(depending on the dataset values).\n    For example:\n    {\"column\": \"gdpPercap\", \"nl_ref_type\": \"explicit\", \"nl_ref_phrase\": \"GDP per capita\"},\n    {\"column\": [\"country\",\"continent\"], \"nl_ref_type\": \"ambiguous\", \"nl_ref_phrase\": \"region\"}\n    {\"column\": [\"country\",\"country_short_name\"], \"nl_ref_type\": \"ambiguous\", \"nl_ref_phrase\": \"countries\"}\n    {\"c_type\": \"mark\", \"c_name\": \"point chart\", \"nl_ref_type\": \"explicit\", \"nl_ref_phrase\": \"scatter plot\"}\n    {\"c_type\": \"mark\", \"c_name\": \"arc chart\", \"nl_ref_type\": \"explicit\", \"nl_ref_phrase\": \"pie chart\"}\n    {\"c_type\": \"transform\",\"c_name\": \"filter\",\"c_list\": [{\"field\": \"country\",\"oneOf\": [\"Iceland\",\"Norway\"]}],\"nl_ref_type\": \"explicit\",\"nl_ref_phrase\": \"for countries Iceland and Norway\"},\n    {\"c_type\": \"transform\",\"c_name\": \"filter\",\"c_list\": [{\"field\": \"country\",\"oneOf\": [\"Iceland\",\"Norway\"]}],\"nl_ref_type\": \"by_value\",\"nl_ref_phrase\": \"for Iceland and Norway\"},\n- the 'nl_ref_phrase' for 'ambiguous' columns should be equally near all ambiguous columns, not too near to one of the column since it would not be ambiguous.\n    good example: {\"column\": [\"country\",\"region\"], \"nl_ref_type\": \"ambiguous\", \"nl_ref_phrase\": \"location\"}\n    bad example: {\"column\": [\"country\",\"region\"], \"nl_ref_type\": \"ambiguous\", \"nl_ref_phrase\": \"region\"}\n- You only include given constraints and no other information. \n    For example, if a column name is not in the given constraint, it will not be included in the NL utterance.\n    Also, it a chart mark or chart encoding channel is not in the given constraint, it will not be included in the NL utterance.\n- all 'nl_ref_phrase' shoule be included in the 'nl_utterance'. \n\nThe output format is identical to the input format, but fill in the str blanks(\"...\").\n### Input:\n{\n  \"nl_utterance\": \"...\",\n  \"encoded_fields\": [],\n  \"constraints\": [\n    {\n      \"c_type\": \"task\",\n      \"c_name\": \"distribution\",\n      \"c_list\": [\n        {\n          \"mark\": \"bar\",\n          \"encoding\": {\n            \"y\": {\n              \"aggregate\": \"count\",\n              \"type\": \"quantitative\"\n            }\n          },\n          \"x_y_reversable\": true\n        },\n        {\n          \"mark\": \"boxplot\",\n          \"encoding\": {\n            \"x\": {\n              \"type\": \"quantitative\"\n            }\n          },\n          \"x_y_reversable\": true\n        }\n      ],\n      \"nl_ref_type\": \"explicit\",\n      \"nl_ref_phrase\": \"...\"\n    }\n  ]\n}\n\n### Output:"
}