{
  "gpt_result": {
    "nl_utterance": "Show me the count of cities in relation to movement indices.",
    "encoded_fields": [
      {
        "field": [
          "Mobility",
          "Commute",
          "Migration_in",
          "Migration_out"
        ],
        "type": "quantitative",
        "nl_ref_type": "ambiguous",
        "nl_ref_phrase": "movement indices"
      }
    ],
    "constraints": [
      {
        "c_type": "transform",
        "c_name": "aggregate",
        "c_list": [
          {
            "aggregate": "count"
          }
        ],
        "nl_ref_type": "explicit",
        "nl_ref_phrase": "count of cities"
      }
    ]
  },
  "input": "Dataset Information: {\n  \"data samples\": [\n    {\n      \"ID\": 100,\n      \"Name\": \"Johnson City\",\n      \"Mobility\": 0.0621988103,\n      \"State\": \"TN\",\n      \"Population\": 576081,\n      \"Urban\": 1,\n      \"Black\": 0.021,\n      \"Seg_racial\": 0.09,\n      \"Seg_income\": 0.035,\n      \"Seg_poverty\": 0.03,\n      \"Seg_affluence\": 0.038,\n      \"Commute\": 0.325,\n      \"Income\": 31560,\n      \"Gini\": 0.468,\n      \"Share01\": 13.459,\n      \"Gini_99\": 0.333,\n      \"Middle_class\": 0.548,\n      \"Local_tax_rate\": 0.02,\n      \"Local_gov_spending\": 1886.0,\n      \"Progressivity\": 0.0,\n      \"EITC\": 0.0,\n      \"School_spending\": 5.185,\n      \"Student_teacher_ratio\": NaN,\n      \"Test_scores\": 2.728,\n      \"HS_dropout\": -0.015,\n      \"Colleges\": 0.014,\n      \"Tuition\": 4817.0,\n      \"Graduation\": -0.002,\n      \"Labor_force_participation\": 0.587,\n      \"Manufacturing\": 0.237,\n      \"Chinese_imports\": 5.294,\n      \"Teenage_labor\": 0.004,\n      \"Migration_in\": 0.006,\n      \"Migration_out\": 0.005,\n      \"Foreign_born\": 0.012,\n      \"Social_capital\": -0.298,\n      \"Religious\": 0.514,\n      \"Violent_crime\": 0.001,\n      \"Single_mothers\": 0.19,\n      \"Divorced\": 0.11,\n      \"Married\": 0.601,\n      \"Longitude\": -82.4363861083984,\n      \"Latitude\": 36.4703712463379\n    },\n    {\n      \"ID\": 26601,\n      \"Name\": \"Milbank\",\n      \"Mobility\": 0.1702127606,\n      \"State\": \"MN\",\n      \"Population\": 17801,\n      \"Urban\": 0,\n      \"Black\": 0.001,\n      \"Seg_racial\": 0.07,\n      \"Seg_income\": 0.005,\n      \"Seg_poverty\": 0.003,\n      \"Seg_affluence\": 0.003,\n      \"Commute\": 0.65,\n      \"Income\": 34361,\n      \"Gini\": 0.31,\n      \"Share01\": 6.661,\n      \"Gini_99\": 0.243,\n      \"Middle_class\": 0.686,\n      \"Local_tax_rate\": 0.025,\n      \"Local_gov_spending\": 5010.0,\n      \"Progressivity\": 2.5,\n      \"EITC\": 17.286,\n      \"School_spending\": 6.052,\n      \"Student_teacher_ratio\": 15.6,\n      \"Test_scores\": 11.685,\n      \"HS_dropout\": -0.033,\n      \"Colleges\": NaN,\n      \"Tuition\": NaN,\n      \"Graduation\": NaN,\n      \"Labor_force_participation\": 0.596,\n      \"Manufacturing\": 0.078,\n      \"Chinese_imports\": 0.258,\n      \"Teenage_labor\": 0.007,\n      \"Migration_in\": 0.004,\n      \"Migration_out\": 0.006,\n      \"Foreign_born\": 0.01,\n      \"Social_capital\": 2.339,\n      \"Religious\": 1.004,\n      \"Violent_crime\": 0.001,\n      \"Single_mothers\": 0.119,\n      \"Divorced\": 0.057,\n      \"Married\": 0.635,\n      \"Longitude\": -96.5079879760742,\n      \"Latitude\": 45.4473838806152\n    },\n    {\n      \"ID\": 26802,\n      \"Name\": \"Lisbon\",\n      \"Mobility\": 0.2352941185,\n      \"State\": \"ND\",\n      \"Population\": 16013,\n      \"Urban\": 0,\n      \"Black\": 0.001,\n      \"Seg_racial\": 0.015,\n      \"Seg_income\": 0.018,\n      \"Seg_poverty\": 0.017,\n      \"Seg_affluence\": 0.014,\n      \"Commute\": 0.606,\n      \"Income\": 35168,\n      \"Gini\": 0.268,\n      \"Share01\": 6.895,\n      \"Gini_99\": 0.199,\n      \"Middle_class\": 0.699,\n      \"Local_tax_rate\": 0.021,\n      \"Local_gov_spending\": 1429.0,\n      \"Progressivity\": 3.44,\n      \"EITC\": 0.0,\n      \"School_spending\": 4.879,\n      \"Student_teacher_ratio\": 17.3,\n      \"Test_scores\": 10.804,\n      \"HS_dropout\": -0.031,\n      \"Colleges\": 0.062,\n      \"Tuition\": 5700.0,\n      \"Graduation\": 0.137,\n      \"Labor_force_participation\": 0.647,\n      \"Manufacturing\": 0.192,\n      \"Chinese_imports\": 0.318,\n      \"Teenage_labor\": 0.007,\n      \"Migration_in\": 0.01,\n      \"Migration_out\": 0.014,\n      \"Foreign_born\": 0.011,\n      \"Social_capital\": 2.606,\n      \"Religious\": 0.882,\n      \"Violent_crime\": 0.0,\n      \"Single_mothers\": 0.1,\n      \"Divorced\": 0.07,\n      \"Married\": 0.626,\n      \"Longitude\": -97.9004364013672,\n      \"Latitude\": 46.1610984802246\n    }\n  ],\n  \"column names\": [\n    \"ID\",\n    \"Name\",\n    \"Mobility\",\n    \"State\",\n    \"Population\",\n    \"Urban\",\n    \"Black\",\n    \"Seg_racial\",\n    \"Seg_income\",\n    \"Seg_poverty\",\n    \"Seg_affluence\",\n    \"Commute\",\n    \"Income\",\n    \"Gini\",\n    \"Share01\",\n    \"Gini_99\",\n    \"Middle_class\",\n    \"Local_tax_rate\",\n    \"Local_gov_spending\",\n    \"Progressivity\",\n    \"EITC\",\n    \"School_spending\",\n    \"Student_teacher_ratio\",\n    \"Test_scores\",\n    \"HS_dropout\",\n    \"Colleges\",\n    \"Tuition\",\n    \"Graduation\",\n    \"Labor_force_participation\",\n    \"Manufacturing\",\n    \"Chinese_imports\",\n    \"Teenage_labor\",\n    \"Migration_in\",\n    \"Migration_out\",\n    \"Foreign_born\",\n    \"Social_capital\",\n    \"Religious\",\n    \"Violent_crime\",\n    \"Single_mothers\",\n    \"Divorced\",\n    \"Married\",\n    \"Longitude\",\n    \"Latitude\"\n  ]\n}\n\nYour Job:\nI am developing a NL to Data Visualization Dataset. \nPlease help me generate natural language utterance for given dataset and constraints.\nDefinition about the Taks:\n- 'utterance' is what a user would say to make a chart, it can be a question or a command. One NL 'utterance' is in one or two sentences. \n- 'given dataset' is in form of column names, column type, range/unique values of the column.\n- 'constraints' are information about the chart that should be included in the utterance. \n    So we can find a reference phrase in the NL utterance that corresponds to the given constraints. \n- 'reference phrase' can be explicit, ambiguous, and by_value. 'ambiguous' means the phrase can map to more than one columns in the dataset, always a hypernym of column names(depending on the dataset values).\n    For example:\n    {\"column\": \"gdpPercap\", \"nl_ref_type\": \"explicit\", \"nl_ref_phrase\": \"GDP per capita\"},\n    {\"column\": [\"country\",\"continent\"], \"nl_ref_type\": \"ambiguous\", \"nl_ref_phrase\": \"region\"}\n    {\"column\": [\"country\",\"country_short_name\"], \"nl_ref_type\": \"ambiguous\", \"nl_ref_phrase\": \"countries\"}\n    {\"c_type\": \"mark\", \"c_name\": \"point chart\", \"nl_ref_type\": \"explicit\", \"nl_ref_phrase\": \"scatter plot\"}\n    {\"c_type\": \"mark\", \"c_name\": \"arc chart\", \"nl_ref_type\": \"explicit\", \"nl_ref_phrase\": \"pie chart\"}\n    {\"c_type\": \"transform\",\"c_name\": \"filter\",\"c_list\": [{\"field\": \"country\",\"oneOf\": [\"Iceland\",\"Norway\"]}],\"nl_ref_type\": \"explicit\",\"nl_ref_phrase\": \"for countries Iceland and Norway\"},\n    {\"c_type\": \"transform\",\"c_name\": \"filter\",\"c_list\": [{\"field\": \"country\",\"oneOf\": [\"Iceland\",\"Norway\"]}],\"nl_ref_type\": \"by_value\",\"nl_ref_phrase\": \"for Iceland and Norway\"},\n- the 'nl_ref_phrase' for 'ambiguous' columns should be equally near all ambiguous columns, not too near to one of the column since it would not be ambiguous.\n    good example: {\"column\": [\"country\",\"region\"], \"nl_ref_type\": \"ambiguous\", \"nl_ref_phrase\": \"location\"}\n    bad example: {\"column\": [\"country\",\"region\"], \"nl_ref_type\": \"ambiguous\", \"nl_ref_phrase\": \"region\"}\n- You only include given constraints and no other information. \n    For example, if a column name is not in the given constraint, it will not be included in the NL utterance.\n    Also, it a chart mark or chart encoding channel is not in the given constraint, it will not be included in the NL utterance.\n- all 'nl_ref_phrase' shoule be included in the 'nl_utterance'. \n\nThe output format is identical to the input format, but fill in the str blanks(\"...\").\n### Input:\n{\n  \"nl_utterance\": \"...\",\n  \"encoded_fields\": [\n    {\n      \"field\": [\n        \"Mobility\",\n        \"Commute\",\n        \"Migration_in\",\n        \"Migration_out\"\n      ],\n      \"type\": \"quantitative\",\n      \"nl_ref_type\": \"ambiguous\",\n      \"nl_ref_phrase\": \"...\"\n    }\n  ],\n  \"constraints\": [\n    {\n      \"c_type\": \"transform\",\n      \"c_name\": \"aggregate\",\n      \"c_list\": [\n        {\n          \"aggregate\": \"count\"\n        }\n      ],\n      \"nl_ref_type\": \"explicit\",\n      \"nl_ref_phrase\": \"...\"\n    }\n  ]\n}\n\n### Output:"
}