{
  "gpt_result": {
    "nl_utterance": "Show me a scatter plot that displays the correlation between Component 1 and Component 2, with each point colored by the player's position.",
    "encoded_fields": [
      {
        "field": "Component 1",
        "type": "quantitative",
        "nl_ref_type": "explicit",
        "nl_ref_phrase": "Component 1"
      },
      {
        "field": "Component 2",
        "type": "quantitative",
        "nl_ref_type": "explicit",
        "nl_ref_phrase": "Component 2"
      },
      {
        "field": "Pos",
        "type": "nominal",
        "nl_ref_type": "explicit",
        "nl_ref_phrase": "player's position"
      }
    ],
    "constraints": [
      {
        "c_type": "task",
        "c_name": "correlation",
        "c_list": [
          {
            "mark": "circle",
            "encoding": {
              "x": {
                "type": "quantitative"
              },
              "y": {
                "type": "quantitative"
              }
            }
          }
        ],
        "nl_ref_type": "explicit",
        "nl_ref_phrase": "correlation"
      },
      {
        "c_type": "mark",
        "c_name": "point chart",
        "c_list": [
          {
            "mark": "circle",
            "encoding": {
              "x": {},
              "y": {},
              "color": {
                "type": "nominal",
                "ignore": true
              },
              "size": {
                "ignore": true,
                "type": "quantitative"
              },
              "column": {
                "ignore": true,
                "type": "nominal"
              },
              "row": {
                "ignore": true,
                "type": "nominal"
              }
            }
          }
        ],
        "nl_ref_type": "explicit",
        "nl_ref_phrase": "scatter plot"
      }
    ]
  },
  "input": "Dataset Information: {\n  \"data samples\": [\n    {\n      \"Unnamed: 0\": 0,\n      \"Player\": \"Max Aarons\",\n      \"Progressive Carries\": 5.4375,\n      \"Touches\": 57.96875,\n      \"Expected Assists\": 0.04375,\n      \"Progressive Passes\": 2.9375,\n      \"Passes\": 33.96875,\n      \"Interceptions\": 1.75,\n      \"Possession-Winning-Tackles\": 1.15625,\n      \"Aerials Won\": 0.46875,\n      \"Pos\": \"Defender\",\n      \"Non-Penalty Expected Goals\": 0.02,\n      \"cluster\": 6,\n      \"Component 1\": -0.6794867331318681,\n      \"Component 2\": 0.4101967803346252\n    },\n    {\n      \"Unnamed: 0\": 122,\n      \"Player\": \"Denis Bouanga\",\n      \"Progressive Carries\": 5.313653136531365,\n      \"Touches\": 48.81918819188191,\n      \"Expected Assists\": 0.1660516605166051,\n      \"Progressive Passes\": 2.214022140221402,\n      \"Passes\": 20.44280442804428,\n      \"Interceptions\": 0.4797047970479705,\n      \"Possession-Winning-Tackles\": 1.107011070110701,\n      \"Aerials Won\": 2.5830258302583022,\n      \"Pos\": \"Winger\",\n      \"Non-Penalty Expected Goals\": 0.31,\n      \"cluster\": 3,\n      \"Component 1\": 2.245529469421115,\n      \"Component 2\": 0.4297377246543855\n    },\n    {\n      \"Unnamed: 0\": 557,\n      \"Player\": \"Tariq Lamptey\",\n      \"Progressive Carries\": 9.30635838150289,\n      \"Touches\": 60.28901734104046,\n      \"Expected Assists\": 0.1271676300578034,\n      \"Progressive Passes\": 2.485549132947977,\n      \"Passes\": 35.08670520231214,\n      \"Interceptions\": 2.138728323699422,\n      \"Possession-Winning-Tackles\": 1.329479768786127,\n      \"Aerials Won\": 0.5202312138728323,\n      \"Pos\": \"Wingback\",\n      \"Non-Penalty Expected Goals\": 0.05,\n      \"cluster\": 2,\n      \"Component 1\": -0.7188224932540705,\n      \"Component 2\": 2.0632949385454724\n    }\n  ],\n  \"column names\": [\n    \"Unnamed: 0\",\n    \"Player\",\n    \"Progressive Carries\",\n    \"Touches\",\n    \"Expected Assists\",\n    \"Progressive Passes\",\n    \"Passes\",\n    \"Interceptions\",\n    \"Possession-Winning-Tackles\",\n    \"Aerials Won\",\n    \"Pos\",\n    \"Non-Penalty Expected Goals\",\n    \"cluster\",\n    \"Component 1\",\n    \"Component 2\"\n  ]\n}\n\nYour Job:\nI am developing a NL to Data Visualization Dataset. \nPlease help me generate natural language utterance for given dataset and constraints.\nDefinition about the Taks:\n- 'utterance' is what a user would say to make a chart, it can be a question or a command. One NL 'utterance' is in one or two sentences. \n- 'given dataset' is in form of column names, column type, range/unique values of the column.\n- 'constraints' are information about the chart that should be included in the utterance. \n    So we can find a reference phrase in the NL utterance that corresponds to the given constraints. \n- 'reference phrase' can be explicit, ambiguous, and by_value. 'ambiguous' means the phrase can map to more than one columns in the dataset, always a hypernym of column names(depending on the dataset values).\n    For example:\n    {\"column\": \"gdpPercap\", \"nl_ref_type\": \"explicit\", \"nl_ref_phrase\": \"GDP per capita\"},\n    {\"column\": [\"country\",\"continent\"], \"nl_ref_type\": \"ambiguous\", \"nl_ref_phrase\": \"region\"}\n    {\"column\": [\"country\",\"country_short_name\"], \"nl_ref_type\": \"ambiguous\", \"nl_ref_phrase\": \"countries\"}\n    {\"c_type\": \"mark\", \"c_name\": \"point chart\", \"nl_ref_type\": \"explicit\", \"nl_ref_phrase\": \"scatter plot\"}\n    {\"c_type\": \"mark\", \"c_name\": \"arc chart\", \"nl_ref_type\": \"explicit\", \"nl_ref_phrase\": \"pie chart\"}\n    {\"c_type\": \"transform\",\"c_name\": \"filter\",\"c_list\": [{\"field\": \"country\",\"oneOf\": [\"Iceland\",\"Norway\"]}],\"nl_ref_type\": \"explicit\",\"nl_ref_phrase\": \"for countries Iceland and Norway\"},\n    {\"c_type\": \"transform\",\"c_name\": \"filter\",\"c_list\": [{\"field\": \"country\",\"oneOf\": [\"Iceland\",\"Norway\"]}],\"nl_ref_type\": \"by_value\",\"nl_ref_phrase\": \"for Iceland and Norway\"},\n- the 'nl_ref_phrase' for 'ambiguous' columns should be equally near all ambiguous columns, not too near to one of the column since it would not be ambiguous.\n    good example: {\"column\": [\"country\",\"region\"], \"nl_ref_type\": \"ambiguous\", \"nl_ref_phrase\": \"location\"}\n    bad example: {\"column\": [\"country\",\"region\"], \"nl_ref_type\": \"ambiguous\", \"nl_ref_phrase\": \"region\"}\n- You only include given constraints and no other information. \n    For example, if a column name is not in the given constraint, it will not be included in the NL utterance.\n    Also, it a chart mark or chart encoding channel is not in the given constraint, it will not be included in the NL utterance.\n- all 'nl_ref_phrase' shoule be included in the 'nl_utterance'. \n\nThe output format is identical to the input format, but fill in the str blanks(\"...\").\n### Input:\n{\n  \"nl_utterance\": \"...\",\n  \"encoded_fields\": [\n    {\n      \"field\": \"Component 1\",\n      \"type\": \"quantitative\",\n      \"nl_ref_type\": \"explicit\",\n      \"nl_ref_phrase\": \"...\"\n    },\n    {\n      \"field\": \"Component 2\",\n      \"type\": \"quantitative\",\n      \"nl_ref_type\": \"explicit\",\n      \"nl_ref_phrase\": \"...\"\n    },\n    {\n      \"field\": \"Pos\",\n      \"type\": \"nominal\",\n      \"nl_ref_type\": \"explicit\",\n      \"nl_ref_phrase\": \"...\"\n    }\n  ],\n  \"constraints\": [\n    {\n      \"c_type\": \"task\",\n      \"c_name\": \"correlation\",\n      \"c_list\": [\n        {\n          \"mark\": \"circle\",\n          \"encoding\": {\n            \"x\": {\n              \"type\": \"quantitative\"\n            },\n            \"y\": {\n              \"type\": \"quantitative\"\n            }\n          }\n        }\n      ],\n      \"nl_ref_type\": \"explicit\",\n      \"nl_ref_phrase\": \"...\"\n    },\n    {\n      \"c_type\": \"mark\",\n      \"c_name\": \"point chart\",\n      \"c_list\": [\n        {\n          \"mark\": \"circle\",\n          \"encoding\": {\n            \"x\": {},\n            \"y\": {},\n            \"color\": {\n              \"type\": \"nominal\",\n              \"ignore\": true\n            },\n            \"size\": {\n              \"ignore\": true,\n              \"type\": \"quantitative\"\n            },\n            \"column\": {\n              \"ignore\": true,\n              \"type\": \"nominal\"\n            },\n            \"row\": {\n              \"ignore\": true,\n              \"type\": \"nominal\"\n            }\n          }\n        }\n      ],\n      \"nl_ref_type\": \"explicit\",\n      \"nl_ref_phrase\": \"...\"\n    }\n  ]\n}\n\n### Output:"
}