{
  "gpt_result": {
    "nl_utterance": "Create a bar chart showing the sum of totals in USD across different times.",
    "encoded_fields": [
      {
        "field": [
          "Date",
          "Year"
        ],
        "type": "quantitative",
        "nl_ref_type": "ambiguous",
        "nl_ref_phrase": "times"
      },
      {
        "field": "Totals_USD",
        "type": "quantitative",
        "nl_ref_type": "explicit",
        "nl_ref_phrase": "totals in USD"
      }
    ],
    "constraints": [
      {
        "c_type": "mark",
        "c_name": "bar chart",
        "nl_ref_type": "explicit",
        "nl_ref_phrase": "bar chart"
      },
      {
        "c_type": "transform",
        "c_name": "aggregate",
        "nl_ref_phrase": "sum of"
      }
    ]
  },
  "input": "Dataset Information: {\n  \"data samples\": [\n    {\n      \"Date\": \"08/31/2022\",\n      \"GRA Purchases\": 93769635059,\n      \"PRGT 1/2/\": 15254184552,\n      \"Totals\": 109024000000.0,\n      \"Totals_bil_SDR\": 109.02,\n      \"Year\": 2022,\n      \"Conversion rate\": 1.28252,\n      \"Unnamed: 7\": NaN,\n      \"Totals_USD\": 139.8203304,\n      \"World GDP\": 86700000000000.0,\n      \"World aggregate real GDP (billion USD)\": 86652.9,\n      \"Unnamed: 11\": 0.001258123,\n      \"Total_USD/GDP\": 0.001613568,\n      \"Percentage\": 0.161356781,\n      \"Unnamed: 14\": NaN,\n      \"World nominal GDP\": 98100000000000.0,\n      \"Unnamed: 16\": 98100,\n      \"Unnamed: 17\": 0.001425284,\n      \"Percentages\": 0.142528369\n    },\n    {\n      \"Date\": \"12/31/1986\",\n      \"GRA Purchases\": 33334905644,\n      \"PRGT 1/2/\": 2013169931,\n      \"Totals\": 35348075575.0,\n      \"Totals_bil_SDR\": 35.35,\n      \"Year\": 1986,\n      \"Conversion rate\": 1.22319,\n      \"Unnamed: 7\": NaN,\n      \"Totals_USD\": 43.2397665,\n      \"World GDP\": 31000000000000.0,\n      \"World aggregate real GDP (billion USD)\": 30965.1,\n      \"Unnamed: 11\": 0.001141608,\n      \"Total_USD/GDP\": 0.001396403,\n      \"Percentage\": 0.139640326,\n      \"Unnamed: 14\": NaN,\n      \"World nominal GDP\": 15205000000000.0,\n      \"Unnamed: 16\": 15205,\n      \"Unnamed: 17\": 0.002843786,\n      \"Percentages\": 0.284378602\n    },\n    {\n      \"Date\": \"12/31/2016\",\n      \"GRA Purchases\": 49267630851,\n      \"PRGT 1/2/\": 6482647937,\n      \"Totals\": 55750278788.0,\n      \"Totals_bil_SDR\": 55.75,\n      \"Year\": 2016,\n      \"Conversion rate\": 1.34433,\n      \"Unnamed: 7\": NaN,\n      \"Totals_USD\": 74.9463975,\n      \"World GDP\": 77300000000000.0,\n      \"World aggregate real GDP (billion USD)\": 77283.5,\n      \"Unnamed: 11\": 0.00072137,\n      \"Total_USD/GDP\": 0.000969759,\n      \"Percentage\": 0.096975936,\n      \"Unnamed: 14\": NaN,\n      \"World nominal GDP\": 76466000000000.0,\n      \"Unnamed: 16\": 76466,\n      \"Unnamed: 17\": 0.000980127,\n      \"Percentages\": 0.098012708\n    }\n  ],\n  \"column names\": [\n    \"Date\",\n    \"GRA Purchases\",\n    \"PRGT 1/2/\",\n    \"Totals\",\n    \"Totals_bil_SDR\",\n    \"Year\",\n    \"Conversion rate\",\n    \"Unnamed: 7\",\n    \"Totals_USD\",\n    \"World GDP\",\n    \"World aggregate real GDP (billion USD)\",\n    \"Unnamed: 11\",\n    \"Total_USD/GDP\",\n    \"Percentage\",\n    \"Unnamed: 14\",\n    \"World nominal GDP\",\n    \"Unnamed: 16\",\n    \"Unnamed: 17\",\n    \"Percentages\"\n  ]\n}\n\nYour Job:\nI am developing a NL to Data Visualization Dataset. \nPlease help me generate natural language utterance for given dataset and constraints.\nDefinition about the Taks:\n- 'utterance' is what a user would say to make a chart, it can be a question or a command. One NL 'utterance' is in one or two sentences. \n- 'given dataset' is in form of column names, column type, range/unique values of the column.\n- 'constraints' are information about the chart that should be included in the utterance. \n    So we can find a reference phrase in the NL utterance that corresponds to the given constraints. \n- 'reference phrase' can be explicit, ambiguous, and by_value. 'ambiguous' means the phrase can map to more than one columns in the dataset, always a hypernym of column names(depending on the dataset values).\n    For example:\n    {\"column\": \"gdpPercap\", \"nl_ref_type\": \"explicit\", \"nl_ref_phrase\": \"GDP per capita\"},\n    {\"column\": [\"country\",\"continent\"], \"nl_ref_type\": \"ambiguous\", \"nl_ref_phrase\": \"region\"}\n    {\"column\": [\"country\",\"country_short_name\"], \"nl_ref_type\": \"ambiguous\", \"nl_ref_phrase\": \"countries\"}\n    {\"c_type\": \"mark\", \"c_name\": \"point chart\", \"nl_ref_type\": \"explicit\", \"nl_ref_phrase\": \"scatter plot\"}\n    {\"c_type\": \"mark\", \"c_name\": \"arc chart\", \"nl_ref_type\": \"explicit\", \"nl_ref_phrase\": \"pie chart\"}\n    {\"c_type\": \"transform\",\"c_name\": \"filter\",\"c_list\": [{\"field\": \"country\",\"oneOf\": [\"Iceland\",\"Norway\"]}],\"nl_ref_type\": \"explicit\",\"nl_ref_phrase\": \"for countries Iceland and Norway\"},\n    {\"c_type\": \"transform\",\"c_name\": \"filter\",\"c_list\": [{\"field\": \"country\",\"oneOf\": [\"Iceland\",\"Norway\"]}],\"nl_ref_type\": \"by_value\",\"nl_ref_phrase\": \"for Iceland and Norway\"},\n- the 'nl_ref_phrase' for 'ambiguous' columns should be equally near all ambiguous columns, not too near to one of the column since it would not be ambiguous.\n    good example: {\"column\": [\"country\",\"region\"], \"nl_ref_type\": \"ambiguous\", \"nl_ref_phrase\": \"location\"}\n    bad example: {\"column\": [\"country\",\"region\"], \"nl_ref_type\": \"ambiguous\", \"nl_ref_phrase\": \"region\"}\n- You only include given constraints and no other information. \n    For example, if a column name is not in the given constraint, it will not be included in the NL utterance.\n    Also, it a chart mark or chart encoding channel is not in the given constraint, it will not be included in the NL utterance.\n- all 'nl_ref_phrase' shoule be included in the 'nl_utterance'. \n\nThe output format is identical to the input format, but fill in the str blanks(\"...\").\n### Input:\n{\n  \"nl_utterance\": \"...\",\n  \"encoded_fields\": [\n    {\n      \"field\": [\n        \"Date\",\n        \"Year\"\n      ],\n      \"type\": \"quantitative\",\n      \"nl_ref_type\": \"ambiguous\",\n      \"nl_ref_phrase\": \"...\"\n    },\n    {\n      \"field\": \"Totals_USD\",\n      \"type\": \"quantitative\",\n      \"nl_ref_type\": \"explicit\",\n      \"nl_ref_phrase\": \"...\"\n    }\n  ],\n  \"constraints\": [\n    {\n      \"c_type\": \"mark\",\n      \"c_name\": \"bar chart\",\n      \"c_list\": [\n        {\n          \"mark\": \"bar\",\n          \"encoding\": {\n            \"x\": {},\n            \"y\": {\n              \"type\": \"quantitative\"\n            },\n            \"color\": {\n              \"type\": \"nominal\",\n              \"ignore\": true\n            },\n            \"column\": {\n              \"ignore\": true,\n              \"type\": \"nominal\"\n            },\n            \"row\": {\n              \"ignore\": true,\n              \"type\": \"nominal\"\n            }\n          },\n          \"unique_map\": {\n            \"x\": \"y\"\n          }\n        },\n        {\n          \"mark\": \"bar\",\n          \"encoding\": {\n            \"y\": {},\n            \"x\": {\n              \"type\": \"quantitative\"\n            },\n            \"color\": {\n              \"type\": \"nominal\",\n              \"ignore\": true\n            },\n            \"column\": {\n              \"ignore\": true,\n              \"type\": \"nominal\"\n            },\n            \"row\": {\n              \"ignore\": true,\n              \"type\": \"nominal\"\n            }\n          },\n          \"unique_map\": {\n            \"y\": \"x\"\n          }\n        }\n      ],\n      \"nl_ref_type\": \"explicit\",\n      \"nl_ref_phrase\": \"...\"\n    },\n    {\n      \"c_type\": \"transform\",\n      \"c_name\": \"aggregate\",\n      \"c_list\": [\n        {\n          \"field\": \"Totals_USD\",\n          \"aggregate\": \"sum\"\n        }\n      ],\n      \"nl_ref_type\": \"explicit\",\n      \"nl_ref_phrase\": \"...\"\n    }\n  ]\n}\n\n### Output:"
}