{
  "gpt_result": {
    "nl_utterance": "Create a scatter plot with Component 1 on the x-axis, Component 2 on the y-axis, and differentiate the points by player position.",
    "encoded_fields": [
      {
        "field": "Component 1",
        "type": "quantitative",
        "nl_ref_type": "explicit",
        "nl_ref_phrase": "Component 1 on the x-axis"
      },
      {
        "field": "Component 2",
        "type": "quantitative",
        "nl_ref_type": "explicit",
        "nl_ref_phrase": "Component 2 on the y-axis"
      },
      {
        "field": "Pos",
        "type": "nominal",
        "nl_ref_type": "explicit",
        "nl_ref_phrase": "differentiate the points by player position"
      }
    ],
    "constraints": [
      {
        "c_type": "mark",
        "c_name": "point chart",
        "c_list": [
          {
            "mark": "circle",
            "encoding": {
              "x": {},
              "y": {},
              "color": {
                "type": "nominal",
                "ignore": true
              },
              "size": {
                "ignore": true,
                "type": "quantitative"
              },
              "column": {
                "ignore": true,
                "type": "nominal"
              },
              "row": {
                "ignore": true,
                "type": "nominal"
              }
            }
          }
        ],
        "nl_ref_type": "explicit",
        "nl_ref_phrase": "scatter plot"
      }
    ]
  },
  "input": "Dataset Information: {\n  \"data samples\": [\n    {\n      \"Unnamed: 0\": 0,\n      \"Player\": \"Max Aarons\",\n      \"Progressive Carries\": 5.4375,\n      \"Touches\": 57.96875,\n      \"Expected Assists\": 0.04375,\n      \"Progressive Passes\": 2.9375,\n      \"Passes\": 33.96875,\n      \"Interceptions\": 1.75,\n      \"Possession-Winning-Tackles\": 1.15625,\n      \"Aerials Won\": 0.46875,\n      \"Pos\": \"Defender\",\n      \"Non-Penalty Expected Goals\": 0.02,\n      \"cluster\": 6,\n      \"Component 1\": -0.6794867331318681,\n      \"Component 2\": 0.4101967803346252\n    },\n    {\n      \"Unnamed: 0\": 137,\n      \"Player\": \"Dylan Bronn\",\n      \"Progressive Carries\": 1.9434628975265016,\n      \"Touches\": 50.24734982332156,\n      \"Expected Assists\": 0.0353356890459364,\n      \"Progressive Passes\": 1.872791519434629,\n      \"Passes\": 33.851590106007066,\n      \"Interceptions\": 2.0848056537102475,\n      \"Possession-Winning-Tackles\": 1.0954063604240285,\n      \"Aerials Won\": 1.1660777385159011,\n      \"Pos\": \"Defender\",\n      \"Non-Penalty Expected Goals\": 0.06,\n      \"cluster\": 5,\n      \"Component 1\": -0.5044527804454015,\n      \"Component 2\": -1.119449586830798\n    },\n    {\n      \"Unnamed: 0\": 879,\n      \"Player\": \"Stefan Savi\\u0107\",\n      \"Progressive Carries\": 2.915129151291513,\n      \"Touches\": 59.74169741697417,\n      \"Expected Assists\": 0.003690036900369,\n      \"Progressive Passes\": 2.952029520295203,\n      \"Passes\": 42.36162361623616,\n      \"Interceptions\": 1.3653136531365313,\n      \"Possession-Winning-Tackles\": 0.5166051660516605,\n      \"Aerials Won\": 3.025830258302583,\n      \"Pos\": \"Defender\",\n      \"Non-Penalty Expected Goals\": 0.07,\n      \"cluster\": 5,\n      \"Component 1\": -0.2637910714555373,\n      \"Component 2\": -1.3101988598729324\n    }\n  ],\n  \"column names\": [\n    \"Unnamed: 0\",\n    \"Player\",\n    \"Progressive Carries\",\n    \"Touches\",\n    \"Expected Assists\",\n    \"Progressive Passes\",\n    \"Passes\",\n    \"Interceptions\",\n    \"Possession-Winning-Tackles\",\n    \"Aerials Won\",\n    \"Pos\",\n    \"Non-Penalty Expected Goals\",\n    \"cluster\",\n    \"Component 1\",\n    \"Component 2\"\n  ]\n}\n\nYour Job:\nI am developing a NL to Data Visualization Dataset. \nPlease help me generate natural language utterance for given dataset and constraints.\nDefinition about the Taks:\n- 'utterance' is what a user would say to make a chart, it can be a question or a command. One NL 'utterance' is in one or two sentences. \n- 'given dataset' is in form of column names, column type, range/unique values of the column.\n- 'constraints' are information about the chart that should be included in the utterance. \n    So we can find a reference phrase in the NL utterance that corresponds to the given constraints. \n- 'reference phrase' can be explicit, ambiguous, and by_value. 'ambiguous' means the phrase can map to more than one columns in the dataset, always a hypernym of column names(depending on the dataset values).\n    For example:\n    {\"column\": \"gdpPercap\", \"nl_ref_type\": \"explicit\", \"nl_ref_phrase\": \"GDP per capita\"},\n    {\"column\": [\"country\",\"continent\"], \"nl_ref_type\": \"ambiguous\", \"nl_ref_phrase\": \"region\"}\n    {\"column\": [\"country\",\"country_short_name\"], \"nl_ref_type\": \"ambiguous\", \"nl_ref_phrase\": \"countries\"}\n    {\"c_type\": \"mark\", \"c_name\": \"point chart\", \"nl_ref_type\": \"explicit\", \"nl_ref_phrase\": \"scatter plot\"}\n    {\"c_type\": \"mark\", \"c_name\": \"arc chart\", \"nl_ref_type\": \"explicit\", \"nl_ref_phrase\": \"pie chart\"}\n    {\"c_type\": \"transform\",\"c_name\": \"filter\",\"c_list\": [{\"field\": \"country\",\"oneOf\": [\"Iceland\",\"Norway\"]}],\"nl_ref_type\": \"explicit\",\"nl_ref_phrase\": \"for countries Iceland and Norway\"},\n    {\"c_type\": \"transform\",\"c_name\": \"filter\",\"c_list\": [{\"field\": \"country\",\"oneOf\": [\"Iceland\",\"Norway\"]}],\"nl_ref_type\": \"by_value\",\"nl_ref_phrase\": \"for Iceland and Norway\"},\n- the 'nl_ref_phrase' for 'ambiguous' columns should be equally near all ambiguous columns, not too near to one of the column since it would not be ambiguous.\n    good example: {\"column\": [\"country\",\"region\"], \"nl_ref_type\": \"ambiguous\", \"nl_ref_phrase\": \"location\"}\n    bad example: {\"column\": [\"country\",\"region\"], \"nl_ref_type\": \"ambiguous\", \"nl_ref_phrase\": \"region\"}\n- You only include given constraints and no other information. \n    For example, if a column name is not in the given constraint, it will not be included in the NL utterance.\n    Also, it a chart mark or chart encoding channel is not in the given constraint, it will not be included in the NL utterance.\n- all 'nl_ref_phrase' shoule be included in the 'nl_utterance'. \n\nThe output format is identical to the input format, but fill in the str blanks(\"...\").\n### Input:\n{\n  \"nl_utterance\": \"...\",\n  \"encoded_fields\": [\n    {\n      \"field\": \"Component 1\",\n      \"type\": \"quantitative\",\n      \"nl_ref_type\": \"explicit\",\n      \"nl_ref_phrase\": \"...\"\n    },\n    {\n      \"field\": \"Component 2\",\n      \"type\": \"quantitative\",\n      \"nl_ref_type\": \"explicit\",\n      \"nl_ref_phrase\": \"...\"\n    },\n    {\n      \"field\": \"Pos\",\n      \"type\": \"nominal\",\n      \"nl_ref_type\": \"explicit\",\n      \"nl_ref_phrase\": \"...\"\n    }\n  ],\n  \"constraints\": [\n    {\n      \"c_type\": \"mark\",\n      \"c_name\": \"point chart\",\n      \"c_list\": [\n        {\n          \"mark\": \"circle\",\n          \"encoding\": {\n            \"x\": {},\n            \"y\": {},\n            \"color\": {\n              \"type\": \"nominal\",\n              \"ignore\": true\n            },\n            \"size\": {\n              \"ignore\": true,\n              \"type\": \"quantitative\"\n            },\n            \"column\": {\n              \"ignore\": true,\n              \"type\": \"nominal\"\n            },\n            \"row\": {\n              \"ignore\": true,\n              \"type\": \"nominal\"\n            }\n          }\n        }\n      ],\n      \"nl_ref_type\": \"explicit\",\n      \"nl_ref_phrase\": \"...\"\n    }\n  ]\n}\n\n### Output:"
}