{
  "gpt_result": {
    "nl_utterance": "Show me a line chart of the values over time.",
    "encoded_fields": [
      {
        "field": [
          "realtime_start",
          "realtime_end",
          "observation_start",
          "observation_end"
        ],
        "type": "temporal",
        "nl_ref_type": "ambiguous",
        "nl_ref_phrase": "over time"
      },
      {
        "field": "value",
        "type": "quantitative",
        "nl_ref_type": "explicit",
        "nl_ref_phrase": "values"
      }
    ],
    "constraints": [
      {
        "c_type": "mark",
        "c_name": "line chart",
        "c_list": [
          {
            "mark": "line",
            "encoding": {
              "x": {},
              "y": {
                "type": "quantitative"
              },
              "color": {
                "ignore": true,
                "type": "nominal"
              },
              "column": {
                "ignore": true,
                "type": "nominal"
              },
              "row": {
                "ignore": true,
                "type": "nominal"
              }
            },
            "unique_map": {
              "x": "y"
            }
          }
        ],
        "nl_ref_type": "explicit",
        "nl_ref_phrase": "line chart"
      }
    ]
  },
  "input": "Dataset Information: {\n  \"data samples\": [\n    {\n      \"realtime_start\": \"2021-08-25\",\n      \"realtime_end\": \"2021-08-25\",\n      \"observation_start\": \"1600-01-01\",\n      \"observation_end\": \"9999-12-31\",\n      \"units\": \"lin\",\n      \"output_type\": 1,\n      \"file_type\": \"json\",\n      \"order_by\": \"observation_date\",\n      \"sort_order\": \"asc\",\n      \"count\": 221,\n      \"offset\": 0,\n      \"limit\": 100000,\n      \"observations\": \"{'realtime_start': '2021-08-25', 'realtime_end': '2021-08-25', 'date': '1966-01-01', 'value': '40.33999'}\"\n    },\n    {\n      \"realtime_start\": \"2021-08-25\",\n      \"realtime_end\": \"2021-08-25\",\n      \"observation_start\": \"1600-01-01\",\n      \"observation_end\": \"9999-12-31\",\n      \"units\": \"lin\",\n      \"output_type\": 1,\n      \"file_type\": \"json\",\n      \"order_by\": \"observation_date\",\n      \"sort_order\": \"asc\",\n      \"count\": 221,\n      \"offset\": 0,\n      \"limit\": 100000,\n      \"observations\": \"{'realtime_start': '2021-08-25', 'realtime_end': '2021-08-25', 'date': '2013-10-01', 'value': '100.13427'}\"\n    },\n    {\n      \"realtime_start\": \"2021-08-25\",\n      \"realtime_end\": \"2021-08-25\",\n      \"observation_start\": \"1600-01-01\",\n      \"observation_end\": \"9999-12-31\",\n      \"units\": \"lin\",\n      \"output_type\": 1,\n      \"file_type\": \"json\",\n      \"order_by\": \"observation_date\",\n      \"sort_order\": \"asc\",\n      \"count\": 221,\n      \"offset\": 0,\n      \"limit\": 100000,\n      \"observations\": \"{'realtime_start': '2021-08-25', 'realtime_end': '2021-08-25', 'date': '2015-07-01', 'value': '99.146'}\"\n    }\n  ],\n  \"column names\": [\n    \"realtime_start\",\n    \"realtime_end\",\n    \"observation_start\",\n    \"observation_end\",\n    \"units\",\n    \"output_type\",\n    \"file_type\",\n    \"order_by\",\n    \"sort_order\",\n    \"count\",\n    \"offset\",\n    \"limit\",\n    \"observations\"\n  ]\n}\n\nYour Job:\nI am developing a NL to Data Visualization Dataset. \nPlease help me generate natural language utterance for given dataset and constraints.\nDefinition about the Taks:\n- 'utterance' is what a user would say to make a chart, it can be a question or a command. One NL 'utterance' is in one or two sentences. \n- 'given dataset' is in form of column names, column type, range/unique values of the column.\n- 'constraints' are information about the chart that should be included in the utterance. \n    So we can find a reference phrase in the NL utterance that corresponds to the given constraints. \n- 'reference phrase' can be explicit, ambiguous, and by_value. 'ambiguous' means the phrase can map to more than one columns in the dataset, always a hypernym of column names(depending on the dataset values).\n    For example:\n    {\"column\": \"gdpPercap\", \"nl_ref_type\": \"explicit\", \"nl_ref_phrase\": \"GDP per capita\"},\n    {\"column\": [\"country\",\"continent\"], \"nl_ref_type\": \"ambiguous\", \"nl_ref_phrase\": \"region\"}\n    {\"column\": [\"country\",\"country_short_name\"], \"nl_ref_type\": \"ambiguous\", \"nl_ref_phrase\": \"countries\"}\n    {\"c_type\": \"mark\", \"c_name\": \"point chart\", \"nl_ref_type\": \"explicit\", \"nl_ref_phrase\": \"scatter plot\"}\n    {\"c_type\": \"mark\", \"c_name\": \"arc chart\", \"nl_ref_type\": \"explicit\", \"nl_ref_phrase\": \"pie chart\"}\n    {\"c_type\": \"transform\",\"c_name\": \"filter\",\"c_list\": [{\"field\": \"country\",\"oneOf\": [\"Iceland\",\"Norway\"]}],\"nl_ref_type\": \"explicit\",\"nl_ref_phrase\": \"for countries Iceland and Norway\"},\n    {\"c_type\": \"transform\",\"c_name\": \"filter\",\"c_list\": [{\"field\": \"country\",\"oneOf\": [\"Iceland\",\"Norway\"]}],\"nl_ref_type\": \"by_value\",\"nl_ref_phrase\": \"for Iceland and Norway\"},\n- the 'nl_ref_phrase' for 'ambiguous' columns should be equally near all ambiguous columns, not too near to one of the column since it would not be ambiguous.\n    good example: {\"column\": [\"country\",\"region\"], \"nl_ref_type\": \"ambiguous\", \"nl_ref_phrase\": \"location\"}\n    bad example: {\"column\": [\"country\",\"region\"], \"nl_ref_type\": \"ambiguous\", \"nl_ref_phrase\": \"region\"}\n- You only include given constraints and no other information. \n    For example, if a column name is not in the given constraint, it will not be included in the NL utterance.\n    Also, it a chart mark or chart encoding channel is not in the given constraint, it will not be included in the NL utterance.\n- all 'nl_ref_phrase' shoule be included in the 'nl_utterance'. \n\nThe output format is identical to the input format, but fill in the str blanks(\"...\").\n### Input:\n{\n  \"nl_utterance\": \"...\",\n  \"encoded_fields\": [\n    {\n      \"field\": [\n        \"realtime_start\",\n        \"realtime_end\",\n        \"observation_start\",\n        \"observation_end\"\n      ],\n      \"type\": \"temporal\",\n      \"nl_ref_type\": \"ambiguous\",\n      \"nl_ref_phrase\": \"...\"\n    },\n    {\n      \"field\": \"value\",\n      \"type\": \"quantitative\",\n      \"nl_ref_type\": \"explicit\",\n      \"nl_ref_phrase\": \"...\"\n    }\n  ],\n  \"constraints\": [\n    {\n      \"c_type\": \"mark\",\n      \"c_name\": \"line chart\",\n      \"c_list\": [\n        {\n          \"mark\": \"line\",\n          \"encoding\": {\n            \"x\": {},\n            \"y\": {\n              \"type\": \"quantitative\"\n            },\n            \"color\": {\n              \"ignore\": true,\n              \"type\": \"nominal\"\n            },\n            \"column\": {\n              \"ignore\": true,\n              \"type\": \"nominal\"\n            },\n            \"row\": {\n              \"ignore\": true,\n              \"type\": \"nominal\"\n            }\n          },\n          \"unique_map\": {\n            \"x\": \"y\"\n          }\n        }\n      ],\n      \"nl_ref_type\": \"explicit\",\n      \"nl_ref_phrase\": \"...\"\n    }\n  ]\n}\n\n### Output:"
}