{
  "gpt_result": {
    "nl_utterance": "Show me the countries with R&D expenditure more than 1.5% of GDP in descending order.",
    "encoded_fields": [
      {
        "field": "Country",
        "type": "nominal",
        "nl_ref_type": "explicit",
        "nl_ref_phrase": "countries"
      },
      {
        "field": "R&D Expenditure (% of GDP)",
        "type": "quantitative",
        "nl_ref_type": "explicit",
        "nl_ref_phrase": "R&D expenditure"
      }
    ],
    "constraints": [
      {
        "c_type": "transform",
        "c_name": "filter",
        "c_list": [
          {
            "field": "R&D Expenditure (% of GDP)",
            "gt": 1.5
          }
        ],
        "nl_ref_type": "by_value",
        "nl_ref_phrase": "more than 1.5% of GDP"
      },
      {
        "c_type": "transform",
        "c_name": "sort",
        "c_list": [
          {
            "field": "R&D Expenditure (% of GDP)",
            "order": "descending"
          }
        ],
        "nl_ref_type": "explicit",
        "nl_ref_phrase": "in descending order"
      }
    ]
  },
  "input": "Dataset Information: {\n  \"data samples\": [\n    {\n      \"ISO3\": \"AUS\",\n      \"Country\": \"Australia\",\n      \"Year\": 2019,\n      \"R&D Expenditure (% of GDP)\": 1.82928,\n      \"GDP per capita (PPP)\": 51810.77671,\n      \"Population\": 25340217.0,\n      \"Continent\": \"Oceania\"\n    },\n    {\n      \"ISO3\": \"HND\",\n      \"Country\": \"Honduras\",\n      \"Year\": 2017,\n      \"R&D Expenditure (% of GDP)\": 0.03994,\n      \"GDP per capita (PPP)\": 5447.698792,\n      \"Population\": 9626842.0,\n      \"Continent\": \"America\"\n    },\n    {\n      \"ISO3\": \"BDI\",\n      \"Country\": \"Burundi\",\n      \"Year\": 2018,\n      \"R&D Expenditure (% of GDP)\": 0.21312,\n      \"GDP per capita (PPP)\": 758.1376112,\n      \"Population\": 11493472.0,\n      \"Continent\": \"Africa\"\n    }\n  ],\n  \"column names\": [\n    \"ISO3\",\n    \"Country\",\n    \"Year\",\n    \"R&D Expenditure (% of GDP)\",\n    \"GDP per capita (PPP)\",\n    \"Population\",\n    \"Continent\"\n  ]\n}\n\nYour Job:\nI am developing a NL to Data Visualization Dataset. \nPlease help me generate natural language utterance for given dataset and constraints.\nDefinition about the Taks:\n- 'utterance' is what a user would say to make a chart, it can be a question or a command. One NL 'utterance' is in one or two sentences. \n- 'given dataset' is in form of column names, column type, range/unique values of the column.\n- 'constraints' are information about the chart that should be included in the utterance. \n    So we can find a reference phrase in the NL utterance that corresponds to the given constraints. \n- 'reference phrase' can be explicit, ambiguous, and by_value. 'ambiguous' means the phrase can map to more than one columns in the dataset, always a hypernym of column names(depending on the dataset values).\n    For example:\n    {\"column\": \"gdpPercap\", \"nl_ref_type\": \"explicit\", \"nl_ref_phrase\": \"GDP per capita\"},\n    {\"column\": [\"country\",\"continent\"], \"nl_ref_type\": \"ambiguous\", \"nl_ref_phrase\": \"region\"}\n    {\"column\": [\"country\",\"country_short_name\"], \"nl_ref_type\": \"ambiguous\", \"nl_ref_phrase\": \"countries\"}\n    {\"c_type\": \"mark\", \"c_name\": \"point chart\", \"nl_ref_type\": \"explicit\", \"nl_ref_phrase\": \"scatter plot\"}\n    {\"c_type\": \"mark\", \"c_name\": \"arc chart\", \"nl_ref_type\": \"explicit\", \"nl_ref_phrase\": \"pie chart\"}\n    {\"c_type\": \"transform\",\"c_name\": \"filter\",\"c_list\": [{\"field\": \"country\",\"oneOf\": [\"Iceland\",\"Norway\"]}],\"nl_ref_type\": \"explicit\",\"nl_ref_phrase\": \"for countries Iceland and Norway\"},\n    {\"c_type\": \"transform\",\"c_name\": \"filter\",\"c_list\": [{\"field\": \"country\",\"oneOf\": [\"Iceland\",\"Norway\"]}],\"nl_ref_type\": \"by_value\",\"nl_ref_phrase\": \"for Iceland and Norway\"},\n- the 'nl_ref_phrase' for 'ambiguous' columns should be equally near all ambiguous columns, not too near to one of the column since it would not be ambiguous.\n    good example: {\"column\": [\"country\",\"region\"], \"nl_ref_type\": \"ambiguous\", \"nl_ref_phrase\": \"location\"}\n    bad example: {\"column\": [\"country\",\"region\"], \"nl_ref_type\": \"ambiguous\", \"nl_ref_phrase\": \"region\"}\n- You only include given constraints and no other information. \n    For example, if a column name is not in the given constraint, it will not be included in the NL utterance.\n    Also, it a chart mark or chart encoding channel is not in the given constraint, it will not be included in the NL utterance.\n- all 'nl_ref_phrase' shoule be included in the 'nl_utterance'. \n\nThe output format is identical to the input format, but fill in the str blanks(\"...\").\n### Input:\n{\n  \"nl_utterance\": \"...\",\n  \"encoded_fields\": [\n    {\n      \"field\": \"Country\",\n      \"type\": \"nominal\",\n      \"nl_ref_type\": \"explicit\",\n      \"nl_ref_phrase\": \"...\"\n    },\n    {\n      \"field\": \"R&D Expenditure (% of GDP)\",\n      \"type\": \"quantitative\",\n      \"nl_ref_type\": \"explicit\",\n      \"nl_ref_phrase\": \"...\"\n    }\n  ],\n  \"constraints\": [\n    {\n      \"c_type\": \"transform\",\n      \"c_name\": \"filter\",\n      \"c_list\": [\n        {\n          \"field\": \"R&D Expenditure (% of GDP)\",\n          \"gt\": 1.5\n        }\n      ],\n      \"nl_ref_type\": \"by_value\",\n      \"nl_ref_phrase\": \"...\"\n    },\n    {\n      \"c_type\": \"transform\",\n      \"c_name\": \"sort\",\n      \"c_list\": [\n        {\n          \"field\": \"R&D Expenditure (% of GDP)\",\n          \"order\": \"descending\"\n        }\n      ],\n      \"nl_ref_type\": \"explicit\",\n      \"nl_ref_phrase\": \"...\"\n    }\n  ]\n}\n\n### Output:"
}