{
  "gpt_result": {
    "nl_utterance": "Show me the trend of the percentage over the years using a line chart.",
    "encoded_fields": [
      {
        "field": "Year",
        "type": "quantitative",
        "nl_ref_type": "explicit",
        "nl_ref_phrase": "over the years"
      },
      {
        "field": "Percentage",
        "type": "quantitative",
        "nl_ref_type": "explicit",
        "nl_ref_phrase": "the percentage"
      }
    ],
    "constraints": [
      {
        "c_type": "task",
        "c_name": "trend",
        "c_list": [
          {
            "mark": [
              "bar",
              "line",
              "area"
            ],
            "encoding": {
              "x": {
                "type": "temporal"
              }
            }
          }
        ],
        "nl_ref_type": "explicit",
        "nl_ref_phrase": "using a line chart"
      }
    ]
  },
  "input": "Dataset Information: {\n  \"data samples\": [\n    {\n      \"Date\": \"08/31/2022\",\n      \"GRA Purchases\": 93769635059.0,\n      \"PRGT 1/2/\": 15254184552.0,\n      \"Totals\": 109023819611.0,\n      \"Totals_bil_SDR\": 109.02,\n      \"Year\": 2022,\n      \"Totals_USD\": 140.34,\n      \"World GDP\": NaN,\n      \"World aggregate real GDP (billion USD)\": NaN,\n      \"Unnamed: 9\": NaN,\n      \"Total_USD/GDP\": NaN,\n      \"Percentage\": NaN,\n      \"Unnamed: 12\": NaN,\n      \"Unnamed: 13\": NaN,\n      \"Unnamed: 14\": NaN,\n      \"Unnamed: 15\": NaN,\n      \"Unnamed: 16\": NaN,\n      \"Unnamed: 17\": NaN,\n      \"Unnamed: 18\": NaN,\n      \"Unnamed: 19\": NaN,\n      \"Unnamed: 20\": NaN,\n      \"Unnamed: 21\": NaN,\n      \"Unnamed: 22\": NaN,\n      \"Unnamed: 23\": NaN,\n      \"Unnamed: 24\": NaN,\n      \"Unnamed: 25\": NaN,\n      \"Unnamed: 26\": NaN,\n      \"Unnamed: 27\": NaN,\n      \"Unnamed: 28\": NaN,\n      \"Unnamed: 29\": NaN,\n      \"Unnamed: 30\": NaN,\n      \"Unnamed: 31\": NaN,\n      \"Unnamed: 32\": NaN,\n      \"Unnamed: 33\": NaN,\n      \"Unnamed: 34\": NaN,\n      \"Unnamed: 35\": NaN,\n      \"Unnamed: 36\": NaN,\n      \"Unnamed: 37\": NaN,\n      \"Unnamed: 38\": NaN,\n      \"Unnamed: 39\": NaN,\n      \"Unnamed: 40\": NaN,\n      \"Unnamed: 41\": NaN,\n      \"Unnamed: 42\": NaN,\n      \"Unnamed: 43\": NaN,\n      \"Unnamed: 44\": NaN\n    },\n    {\n      \"Date\": \"12/31/1985\",\n      \"GRA Purchases\": 35194787249.0,\n      \"PRGT 1/2/\": 2470247948.0,\n      \"Totals\": 37665035197.0,\n      \"Totals_bil_SDR\": 37.67,\n      \"Year\": 1985,\n      \"Totals_USD\": 48.48,\n      \"World GDP\": 29934200000000.0,\n      \"World aggregate real GDP (billion USD)\": 29934.2,\n      \"Unnamed: 9\": NaN,\n      \"Total_USD/GDP\": 0.001619696,\n      \"Percentage\": 0.161969642,\n      \"Unnamed: 12\": NaN,\n      \"Unnamed: 13\": NaN,\n      \"Unnamed: 14\": NaN,\n      \"Unnamed: 15\": NaN,\n      \"Unnamed: 16\": NaN,\n      \"Unnamed: 17\": NaN,\n      \"Unnamed: 18\": NaN,\n      \"Unnamed: 19\": NaN,\n      \"Unnamed: 20\": NaN,\n      \"Unnamed: 21\": NaN,\n      \"Unnamed: 22\": NaN,\n      \"Unnamed: 23\": NaN,\n      \"Unnamed: 24\": NaN,\n      \"Unnamed: 25\": NaN,\n      \"Unnamed: 26\": NaN,\n      \"Unnamed: 27\": NaN,\n      \"Unnamed: 28\": NaN,\n      \"Unnamed: 29\": NaN,\n      \"Unnamed: 30\": NaN,\n      \"Unnamed: 31\": NaN,\n      \"Unnamed: 32\": NaN,\n      \"Unnamed: 33\": NaN,\n      \"Unnamed: 34\": NaN,\n      \"Unnamed: 35\": NaN,\n      \"Unnamed: 36\": NaN,\n      \"Unnamed: 37\": NaN,\n      \"Unnamed: 38\": NaN,\n      \"Unnamed: 39\": NaN,\n      \"Unnamed: 40\": NaN,\n      \"Unnamed: 41\": NaN,\n      \"Unnamed: 42\": NaN,\n      \"Unnamed: 43\": NaN,\n      \"Unnamed: 44\": NaN\n    },\n    {\n      \"Date\": \"12/31/2017\",\n      \"GRA Purchases\": 39585385873.0,\n      \"PRGT 1/2/\": 6522280669.0,\n      \"Totals\": 46107666542.0,\n      \"Totals_bil_SDR\": 46.11,\n      \"Year\": 2017,\n      \"Totals_USD\": 59.35,\n      \"World GDP\": 79895200000000.0,\n      \"World aggregate real GDP (billion USD)\": 79895.2,\n      \"Unnamed: 9\": NaN,\n      \"Total_USD/GDP\": 0.000742874,\n      \"Percentage\": 0.074287434,\n      \"Unnamed: 12\": NaN,\n      \"Unnamed: 13\": NaN,\n      \"Unnamed: 14\": NaN,\n      \"Unnamed: 15\": NaN,\n      \"Unnamed: 16\": NaN,\n      \"Unnamed: 17\": NaN,\n      \"Unnamed: 18\": NaN,\n      \"Unnamed: 19\": NaN,\n      \"Unnamed: 20\": NaN,\n      \"Unnamed: 21\": NaN,\n      \"Unnamed: 22\": NaN,\n      \"Unnamed: 23\": NaN,\n      \"Unnamed: 24\": NaN,\n      \"Unnamed: 25\": NaN,\n      \"Unnamed: 26\": NaN,\n      \"Unnamed: 27\": NaN,\n      \"Unnamed: 28\": NaN,\n      \"Unnamed: 29\": NaN,\n      \"Unnamed: 30\": NaN,\n      \"Unnamed: 31\": NaN,\n      \"Unnamed: 32\": NaN,\n      \"Unnamed: 33\": NaN,\n      \"Unnamed: 34\": NaN,\n      \"Unnamed: 35\": NaN,\n      \"Unnamed: 36\": NaN,\n      \"Unnamed: 37\": NaN,\n      \"Unnamed: 38\": NaN,\n      \"Unnamed: 39\": NaN,\n      \"Unnamed: 40\": NaN,\n      \"Unnamed: 41\": NaN,\n      \"Unnamed: 42\": NaN,\n      \"Unnamed: 43\": NaN,\n      \"Unnamed: 44\": NaN\n    }\n  ],\n  \"column names\": [\n    \"Date\",\n    \"GRA Purchases\",\n    \"PRGT 1/2/\",\n    \"Totals\",\n    \"Totals_bil_SDR\",\n    \"Year\",\n    \"Totals_USD\",\n    \"World GDP\",\n    \"World aggregate real GDP (billion USD)\",\n    \"Unnamed: 9\",\n    \"Total_USD/GDP\",\n    \"Percentage\",\n    \"Unnamed: 12\",\n    \"Unnamed: 13\",\n    \"Unnamed: 14\",\n    \"Unnamed: 15\",\n    \"Unnamed: 16\",\n    \"Unnamed: 17\",\n    \"Unnamed: 18\",\n    \"Unnamed: 19\",\n    \"Unnamed: 20\",\n    \"Unnamed: 21\",\n    \"Unnamed: 22\",\n    \"Unnamed: 23\",\n    \"Unnamed: 24\",\n    \"Unnamed: 25\",\n    \"Unnamed: 26\",\n    \"Unnamed: 27\",\n    \"Unnamed: 28\",\n    \"Unnamed: 29\",\n    \"Unnamed: 30\",\n    \"Unnamed: 31\",\n    \"Unnamed: 32\",\n    \"Unnamed: 33\",\n    \"Unnamed: 34\",\n    \"Unnamed: 35\",\n    \"Unnamed: 36\",\n    \"Unnamed: 37\",\n    \"Unnamed: 38\",\n    \"Unnamed: 39\",\n    \"Unnamed: 40\",\n    \"Unnamed: 41\",\n    \"Unnamed: 42\",\n    \"Unnamed: 43\",\n    \"Unnamed: 44\"\n  ]\n}\n\nYour Job:\nI am developing a NL to Data Visualization Dataset. \nPlease help me generate natural language utterance for given dataset and constraints.\nDefinition about the Taks:\n- 'utterance' is what a user would say to make a chart, it can be a question or a command. One NL 'utterance' is in one or two sentences. \n- 'given dataset' is in form of column names, column type, range/unique values of the column.\n- 'constraints' are information about the chart that should be included in the utterance. \n    So we can find a reference phrase in the NL utterance that corresponds to the given constraints. \n- 'reference phrase' can be explicit, ambiguous, and by_value. 'ambiguous' means the phrase can map to more than one columns in the dataset, always a hypernym of column names(depending on the dataset values).\n    For example:\n    {\"column\": \"gdpPercap\", \"nl_ref_type\": \"explicit\", \"nl_ref_phrase\": \"GDP per capita\"},\n    {\"column\": [\"country\",\"continent\"], \"nl_ref_type\": \"ambiguous\", \"nl_ref_phrase\": \"region\"}\n    {\"column\": [\"country\",\"country_short_name\"], \"nl_ref_type\": \"ambiguous\", \"nl_ref_phrase\": \"countries\"}\n    {\"c_type\": \"mark\", \"c_name\": \"point chart\", \"nl_ref_type\": \"explicit\", \"nl_ref_phrase\": \"scatter plot\"}\n    {\"c_type\": \"mark\", \"c_name\": \"arc chart\", \"nl_ref_type\": \"explicit\", \"nl_ref_phrase\": \"pie chart\"}\n    {\"c_type\": \"transform\",\"c_name\": \"filter\",\"c_list\": [{\"field\": \"country\",\"oneOf\": [\"Iceland\",\"Norway\"]}],\"nl_ref_type\": \"explicit\",\"nl_ref_phrase\": \"for countries Iceland and Norway\"},\n    {\"c_type\": \"transform\",\"c_name\": \"filter\",\"c_list\": [{\"field\": \"country\",\"oneOf\": [\"Iceland\",\"Norway\"]}],\"nl_ref_type\": \"by_value\",\"nl_ref_phrase\": \"for Iceland and Norway\"},\n- the 'nl_ref_phrase' for 'ambiguous' columns should be equally near all ambiguous columns, not too near to one of the column since it would not be ambiguous.\n    good example: {\"column\": [\"country\",\"region\"], \"nl_ref_type\": \"ambiguous\", \"nl_ref_phrase\": \"location\"}\n    bad example: {\"column\": [\"country\",\"region\"], \"nl_ref_type\": \"ambiguous\", \"nl_ref_phrase\": \"region\"}\n- You only include given constraints and no other information. \n    For example, if a column name is not in the given constraint, it will not be included in the NL utterance.\n    Also, it a chart mark or chart encoding channel is not in the given constraint, it will not be included in the NL utterance.\n- all 'nl_ref_phrase' shoule be included in the 'nl_utterance'. \n\nThe output format is identical to the input format, but fill in the str blanks(\"...\").\n### Input:\n{\n  \"nl_utterance\": \"...\",\n  \"encoded_fields\": [\n    {\n      \"field\": \"Year\",\n      \"type\": \"quantitative\",\n      \"nl_ref_type\": \"explicit\",\n      \"nl_ref_phrase\": \"...\"\n    },\n    {\n      \"field\": \"Percentage\",\n      \"type\": \"quantitative\",\n      \"nl_ref_type\": \"explicit\",\n      \"nl_ref_phrase\": \"...\"\n    }\n  ],\n  \"constraints\": [\n    {\n      \"c_type\": \"task\",\n      \"c_name\": \"trend\",\n      \"c_list\": [\n        {\n          \"mark\": [\n            \"bar\",\n            \"line\",\n            \"area\"\n          ],\n          \"encoding\": {\n            \"x\": {\n              \"type\": \"temporal\"\n            }\n          }\n        }\n      ],\n      \"nl_ref_type\": \"explicit\",\n      \"nl_ref_phrase\": \"...\"\n    }\n  ]\n}\n\n### Output:"
}