{
  "gpt_result": {
    "nl_utterance": "Show me the trend of CAPE using a line chart for the period from 1900 to 2023.",
    "encoded_fields": [
      {
        "field": [
          "Date",
          "year",
          "date2"
        ],
        "type": "quantitative",
        "nl_ref_type": "ambiguous",
        "nl_ref_phrase": "period"
      },
      {
        "field": "CAPE",
        "type": "quantitative",
        "nl_ref_type": "explicit",
        "nl_ref_phrase": "CAPE"
      }
    ],
    "constraints": [
      {
        "c_type": "task",
        "c_name": "trend",
        "c_list": [
          {
            "mark": [
              "bar",
              "line",
              "area"
            ],
            "encoding": {
              "x": {
                "type": "temporal"
              }
            }
          }
        ],
        "nl_ref_type": "explicit",
        "nl_ref_phrase": "trend"
      },
      {
        "c_type": "mark",
        "c_name": "line chart",
        "c_list": [
          {
            "mark": "line",
            "encoding": {
              "x": {},
              "y": {
                "type": "quantitative"
              },
              "color": {
                "ignore": true,
                "type": "nominal"
              },
              "column": {
                "ignore": true,
                "type": "nominal"
              },
              "row": {
                "ignore": true,
                "type": "nominal"
              }
            },
            "unique_map": {
              "x": "y"
            }
          }
        ],
        "nl_ref_type": "explicit",
        "nl_ref_phrase": "line chart"
      },
      {
        "c_type": "transform",
        "c_name": "filter",
        "c_list": [
          {
            "field": "Date",
            "range": [
              {
                "year": 1900,
                "month": 1,
                "day": 1
              },
              {
                "year": 2023,
                "month": 11,
                "day": 1
              }
            ]
          }
        ],
        "nl_ref_type": "explicit",
        "nl_ref_phrase": "for the period from 1900 to 2023"
      }
    ]
  },
  "input": "Dataset Information: {\n  \"data samples\": [\n    {\n      \"Date\": 1871.01,\n      \"year\": 1871,\n      \"month\": 1,\n      \"date2\": \"1871-1-01\",\n      \"Price\": 4.44,\n      \"Dividend\": 0.26,\n      \"Earnings\": 0.4,\n      \"CPI\": 12.46406116,\n      \"R\": 5.32,\n      \"PriceReal\": 105.4820771,\n      \"DividendReal\": 6.176878388,\n      \"RealTotalReturn\": 105.4820771,\n      \"EarningsReal\": 9.502889827,\n      \"CAPE\": NaN\n    },\n    {\n      \"Date\": 2004.07,\n      \"year\": 2004,\n      \"month\": 7,\n      \"date2\": \"2004-7-01\",\n      \"Price\": 1105.85,\n      \"Dividend\": 18.78666667,\n      \"Earnings\": 56.69,\n      \"CPI\": 189.4,\n      \"R\": 4.5,\n      \"PriceReal\": 1728.906559,\n      \"DividendReal\": 29.3714258,\n      \"RealTotalReturn\": 786054.579,\n      \"EarningsReal\": 88.63020557,\n      \"CAPE\": 25.69588865\n    },\n    {\n      \"Date\": 1896.07,\n      \"year\": 1896,\n      \"month\": 7,\n      \"date2\": \"1896-7-01\",\n      \"Price\": 4.04,\n      \"Dividend\": 0.1842,\n      \"Earnings\": 0.2267,\n      \"CPI\": 6.279613223,\n      \"R\": 3.5,\n      \"PriceReal\": 190.5038443,\n      \"DividendReal\": 8.685843596,\n      \"RealTotalReturn\": 750.4196455,\n      \"EarningsReal\": 10.68990632,\n      \"CAPE\": 16.6371001\n    }\n  ],\n  \"column names\": [\n    \"Date\",\n    \"year\",\n    \"month\",\n    \"date2\",\n    \"Price\",\n    \"Dividend\",\n    \"Earnings\",\n    \"CPI\",\n    \"R\",\n    \"PriceReal\",\n    \"DividendReal\",\n    \"RealTotalReturn\",\n    \"EarningsReal\",\n    \"CAPE\"\n  ]\n}\n\nYour Job:\nI am developing a NL to Data Visualization Dataset. \nPlease help me generate natural language utterance for given dataset and constraints.\nDefinition about the Taks:\n- 'utterance' is what a user would say to make a chart, it can be a question or a command. One NL 'utterance' is in one or two sentences. \n- 'given dataset' is in form of column names, column type, range/unique values of the column.\n- 'constraints' are information about the chart that should be included in the utterance. \n    So we can find a reference phrase in the NL utterance that corresponds to the given constraints. \n- 'reference phrase' can be explicit, ambiguous, and by_value. 'ambiguous' means the phrase can map to more than one columns in the dataset, always a hypernym of column names(depending on the dataset values).\n    For example:\n    {\"column\": \"gdpPercap\", \"nl_ref_type\": \"explicit\", \"nl_ref_phrase\": \"GDP per capita\"},\n    {\"column\": [\"country\",\"continent\"], \"nl_ref_type\": \"ambiguous\", \"nl_ref_phrase\": \"region\"}\n    {\"column\": [\"country\",\"country_short_name\"], \"nl_ref_type\": \"ambiguous\", \"nl_ref_phrase\": \"countries\"}\n    {\"c_type\": \"mark\", \"c_name\": \"point chart\", \"nl_ref_type\": \"explicit\", \"nl_ref_phrase\": \"scatter plot\"}\n    {\"c_type\": \"mark\", \"c_name\": \"arc chart\", \"nl_ref_type\": \"explicit\", \"nl_ref_phrase\": \"pie chart\"}\n    {\"c_type\": \"transform\",\"c_name\": \"filter\",\"c_list\": [{\"field\": \"country\",\"oneOf\": [\"Iceland\",\"Norway\"]}],\"nl_ref_type\": \"explicit\",\"nl_ref_phrase\": \"for countries Iceland and Norway\"},\n    {\"c_type\": \"transform\",\"c_name\": \"filter\",\"c_list\": [{\"field\": \"country\",\"oneOf\": [\"Iceland\",\"Norway\"]}],\"nl_ref_type\": \"by_value\",\"nl_ref_phrase\": \"for Iceland and Norway\"},\n- the 'nl_ref_phrase' for 'ambiguous' columns should be equally near all ambiguous columns, not too near to one of the column since it would not be ambiguous.\n    good example: {\"column\": [\"country\",\"region\"], \"nl_ref_type\": \"ambiguous\", \"nl_ref_phrase\": \"location\"}\n    bad example: {\"column\": [\"country\",\"region\"], \"nl_ref_type\": \"ambiguous\", \"nl_ref_phrase\": \"region\"}\n- You only include given constraints and no other information. \n    For example, if a column name is not in the given constraint, it will not be included in the NL utterance.\n    Also, it a chart mark or chart encoding channel is not in the given constraint, it will not be included in the NL utterance.\n- all 'nl_ref_phrase' shoule be included in the 'nl_utterance'. \n\nThe output format is identical to the input format, but fill in the str blanks(\"...\").\n### Input:\n{\n  \"nl_utterance\": \"...\",\n  \"encoded_fields\": [\n    {\n      \"field\": [\n        \"Date\",\n        \"year\",\n        \"date2\"\n      ],\n      \"type\": \"quantitative\",\n      \"nl_ref_type\": \"ambiguous\",\n      \"nl_ref_phrase\": \"...\"\n    },\n    {\n      \"field\": \"CAPE\",\n      \"type\": \"quantitative\",\n      \"nl_ref_type\": \"explicit\",\n      \"nl_ref_phrase\": \"...\"\n    }\n  ],\n  \"constraints\": [\n    {\n      \"c_type\": \"task\",\n      \"c_name\": \"trend\",\n      \"c_list\": [\n        {\n          \"mark\": [\n            \"bar\",\n            \"line\",\n            \"area\"\n          ],\n          \"encoding\": {\n            \"x\": {\n              \"type\": \"temporal\"\n            }\n          }\n        }\n      ],\n      \"nl_ref_type\": \"explicit\",\n      \"nl_ref_phrase\": \"...\"\n    },\n    {\n      \"c_type\": \"mark\",\n      \"c_name\": \"line chart\",\n      \"c_list\": [\n        {\n          \"mark\": \"line\",\n          \"encoding\": {\n            \"x\": {},\n            \"y\": {\n              \"type\": \"quantitative\"\n            },\n            \"color\": {\n              \"ignore\": true,\n              \"type\": \"nominal\"\n            },\n            \"column\": {\n              \"ignore\": true,\n              \"type\": \"nominal\"\n            },\n            \"row\": {\n              \"ignore\": true,\n              \"type\": \"nominal\"\n            }\n          },\n          \"unique_map\": {\n            \"x\": \"y\"\n          }\n        }\n      ],\n      \"nl_ref_type\": \"explicit\",\n      \"nl_ref_phrase\": \"...\"\n    },\n    {\n      \"c_type\": \"transform\",\n      \"c_name\": \"filter\",\n      \"c_list\": [\n        {\n          \"field\": \"Date\",\n          \"range\": [\n            {\n              \"year\": 1900,\n              \"month\": 1,\n              \"day\": 1\n            },\n            {\n              \"year\": 2023,\n              \"month\": 11,\n              \"day\": 1\n            }\n          ]\n        }\n      ],\n      \"nl_ref_type\": \"explicit\",\n      \"nl_ref_phrase\": \"...\"\n    }\n  ]\n}\n\n### Output:"
}