{
  "gpt_result": {
    "nl_utterance": "...",
    "encoded_fields": [
      {
        "column": "Income",
        "nl_ref_type": "explicit",
        "nl_ref_phrase": "Income"
      },
      {
        "column": "Gini",
        "nl_ref_type": "explicit",
        "nl_ref_phrase": "Gini coefficient"
      }
    ],
    "constraints": [
      {
        "c_type": "mark",
        "c_name": "point chart",
        "nl_ref_type": "explicit",
        "nl_ref_phrase": "scatter plot"
      }
    ]
  },
  "input": "Dataset Information: {\n  \"data samples\": [\n    {\n      \"ID\": 100,\n      \"Name\": \"Johnson City\",\n      \"Mobility\": 0.0621988103,\n      \"State\": \"TN\",\n      \"Population\": 576081,\n      \"Urban\": 1,\n      \"Black\": 0.021,\n      \"Seg_racial\": 0.09,\n      \"Seg_income\": 0.035,\n      \"Seg_poverty\": 0.03,\n      \"Seg_affluence\": 0.038,\n      \"Commute\": 0.325,\n      \"Income\": 31560,\n      \"Gini\": 0.468,\n      \"Share01\": 13.459,\n      \"Gini_99\": 0.333,\n      \"Middle_class\": 0.548,\n      \"Local_tax_rate\": 0.02,\n      \"Local_gov_spending\": 1886.0,\n      \"Progressivity\": 0.0,\n      \"EITC\": 0.0,\n      \"School_spending\": 5.185,\n      \"Student_teacher_ratio\": NaN,\n      \"Test_scores\": 2.728,\n      \"HS_dropout\": -0.015,\n      \"Colleges\": 0.014,\n      \"Tuition\": 4817.0,\n      \"Graduation\": -0.002,\n      \"Labor_force_participation\": 0.587,\n      \"Manufacturing\": 0.237,\n      \"Chinese_imports\": 5.294,\n      \"Teenage_labor\": 0.004,\n      \"Migration_in\": 0.006,\n      \"Migration_out\": 0.005,\n      \"Foreign_born\": 0.012,\n      \"Social_capital\": -0.298,\n      \"Religious\": 0.514,\n      \"Violent_crime\": 0.001,\n      \"Single_mothers\": 0.19,\n      \"Divorced\": 0.11,\n      \"Married\": 0.601,\n      \"Longitude\": -82.4363861083984,\n      \"Latitude\": 36.4703712463379\n    },\n    {\n      \"ID\": 15700,\n      \"Name\": \"Scioto\",\n      \"Mobility\": 0.0648590028,\n      \"State\": \"OH\",\n      \"Population\": 225682,\n      \"Urban\": 0,\n      \"Black\": 0.032,\n      \"Seg_racial\": 0.16,\n      \"Seg_income\": 0.027,\n      \"Seg_poverty\": 0.024,\n      \"Seg_affluence\": 0.028,\n      \"Commute\": 0.322,\n      \"Income\": 28949,\n      \"Gini\": 0.403,\n      \"Share01\": 9.722,\n      \"Gini_99\": 0.305,\n      \"Middle_class\": 0.573,\n      \"Local_tax_rate\": 0.019,\n      \"Local_gov_spending\": 1577.0,\n      \"Progressivity\": 2.66,\n      \"EITC\": 0.0,\n      \"School_spending\": 4.927,\n      \"Student_teacher_ratio\": 20.4,\n      \"Test_scores\": 3.963,\n      \"HS_dropout\": NaN,\n      \"Colleges\": 0.018,\n      \"Tuition\": 3057.0,\n      \"Graduation\": -0.054,\n      \"Labor_force_participation\": 0.545,\n      \"Manufacturing\": 0.203,\n      \"Chinese_imports\": 0.379,\n      \"Teenage_labor\": 0.004,\n      \"Migration_in\": 0.011,\n      \"Migration_out\": 0.011,\n      \"Foreign_born\": 0.007,\n      \"Social_capital\": 0.105,\n      \"Religious\": 0.253,\n      \"Violent_crime\": 0.001,\n      \"Single_mothers\": 0.215,\n      \"Divorced\": 0.119,\n      \"Married\": 0.563,\n      \"Longitude\": -82.9105377197266,\n      \"Latitude\": 39.01025390625\n    },\n    {\n      \"ID\": 36000,\n      \"Name\": \"Provo\",\n      \"Mobility\": 0.1375119984,\n      \"State\": \"UT\",\n      \"Population\": 389179,\n      \"Urban\": 1,\n      \"Black\": 0.003,\n      \"Seg_racial\": 0.059,\n      \"Seg_income\": 0.095,\n      \"Seg_poverty\": 0.095,\n      \"Seg_affluence\": 0.092,\n      \"Commute\": 0.454,\n      \"Income\": 29115,\n      \"Gini\": 0.393,\n      \"Share01\": 19.986,\n      \"Gini_99\": 0.193,\n      \"Middle_class\": 0.577,\n      \"Local_tax_rate\": 0.021,\n      \"Local_gov_spending\": 1755.0,\n      \"Progressivity\": 0.0,\n      \"EITC\": 0.0,\n      \"School_spending\": 4.742,\n      \"Student_teacher_ratio\": 22.2,\n      \"Test_scores\": -1.256,\n      \"HS_dropout\": -0.018,\n      \"Colleges\": 0.01,\n      \"Tuition\": 2813.0,\n      \"Graduation\": 0.054,\n      \"Labor_force_participation\": 0.677,\n      \"Manufacturing\": 0.113,\n      \"Chinese_imports\": 0.889,\n      \"Teenage_labor\": 0.005,\n      \"Migration_in\": 0.042,\n      \"Migration_out\": 0.045,\n      \"Foreign_born\": 0.062,\n      \"Social_capital\": -0.846,\n      \"Religious\": 0.895,\n      \"Violent_crime\": 0.001,\n      \"Single_mothers\": 0.095,\n      \"Divorced\": 0.05,\n      \"Married\": 0.589,\n      \"Longitude\": -112.007392883301,\n      \"Latitude\": 39.7420043945312\n    }\n  ],\n  \"column names\": [\n    \"ID\",\n    \"Name\",\n    \"Mobility\",\n    \"State\",\n    \"Population\",\n    \"Urban\",\n    \"Black\",\n    \"Seg_racial\",\n    \"Seg_income\",\n    \"Seg_poverty\",\n    \"Seg_affluence\",\n    \"Commute\",\n    \"Income\",\n    \"Gini\",\n    \"Share01\",\n    \"Gini_99\",\n    \"Middle_class\",\n    \"Local_tax_rate\",\n    \"Local_gov_spending\",\n    \"Progressivity\",\n    \"EITC\",\n    \"School_spending\",\n    \"Student_teacher_ratio\",\n    \"Test_scores\",\n    \"HS_dropout\",\n    \"Colleges\",\n    \"Tuition\",\n    \"Graduation\",\n    \"Labor_force_participation\",\n    \"Manufacturing\",\n    \"Chinese_imports\",\n    \"Teenage_labor\",\n    \"Migration_in\",\n    \"Migration_out\",\n    \"Foreign_born\",\n    \"Social_capital\",\n    \"Religious\",\n    \"Violent_crime\",\n    \"Single_mothers\",\n    \"Divorced\",\n    \"Married\",\n    \"Longitude\",\n    \"Latitude\"\n  ]\n}\n\nYour Job:\nI am developing a NL to Data Visualization Dataset. \nPlease help me generate natural language utterance for given dataset and constraints.\nDefinition about the Taks:\n- 'utterance' is what a user would say to make a chart, it can be a question or a command. One NL 'utterance' is in one or two sentences. \n- 'given dataset' is in form of column names, column type, range/unique values of the column.\n- 'constraints' are information about the chart that should be included in the utterance. \n    So we can find a reference phrase in the NL utterance that corresponds to the given constraints. \n- 'reference phrase' can be explicit, ambiguous, and by_value. 'ambiguous' means the phrase can map to more than one columns in the dataset, always a hypernym of column names(depending on the dataset values).\n    For example:\n    {\"column\": \"gdpPercap\", \"nl_ref_type\": \"explicit\", \"nl_ref_phrase\": \"GDP per capita\"},\n    {\"column\": [\"country\",\"continent\"], \"nl_ref_type\": \"ambiguous\", \"nl_ref_phrase\": \"region\"}\n    {\"column\": [\"country\",\"country_short_name\"], \"nl_ref_type\": \"ambiguous\", \"nl_ref_phrase\": \"countries\"}\n    {\"c_type\": \"mark\", \"c_name\": \"point chart\", \"nl_ref_type\": \"explicit\", \"nl_ref_phrase\": \"scatter plot\"}\n    {\"c_type\": \"mark\", \"c_name\": \"arc chart\", \"nl_ref_type\": \"explicit\", \"nl_ref_phrase\": \"pie chart\"}\n    {\"c_type\": \"transform\",\"c_name\": \"filter\",\"c_list\": [{\"field\": \"country\",\"oneOf\": [\"Iceland\",\"Norway\"]}],\"nl_ref_type\": \"explicit\",\"nl_ref_phrase\": \"for countries Iceland and Norway\"},\n    {\"c_type\": \"transform\",\"c_name\": \"filter\",\"c_list\": [{\"field\": \"country\",\"oneOf\": [\"Iceland\",\"Norway\"]}],\"nl_ref_type\": \"by_value\",\"nl_ref_phrase\": \"for Iceland and Norway\"},\n- the 'nl_ref_phrase' for 'ambiguous' columns should be equally near all ambiguous columns, not too near to one of the column since it would not be ambiguous.\n    good example: {\"column\": [\"country\",\"region\"], \"nl_ref_type\": \"ambiguous\", \"nl_ref_phrase\": \"location\"}\n    bad example: {\"column\": [\"country\",\"region\"], \"nl_ref_type\": \"ambiguous\", \"nl_ref_phrase\": \"region\"}\n- You only include given constraints and no other information. \n    For example, if a column name is not in the given constraint, it will not be included in the NL utterance.\n    Also, it a chart mark or chart encoding channel is not in the given constraint, it will not be included in the NL utterance.\n- all 'nl_ref_phrase' shoule be included in the 'nl_utterance'. \n\nThe output format is identical to the input format, but fill in the str blanks(\"...\").\n### Input:\n{\n  \"nl_utterance\": \"...\",\n  \"encoded_fields\": [],\n  \"constraints\": []\n}\n\n### Output:"
}