{
  "gpt_result": {
    "nl_utterance": "Show me a sorted list of locations by their average democracy index scores in ascending order, along with the regime types.",
    "encoded_fields": [
      {
        "field": [
          "Country",
          "Region"
        ],
        "type": "nominal",
        "nl_ref_type": "ambiguous",
        "nl_ref_phrase": "locations"
      },
      {
        "field": "democracy_eiu",
        "type": "quantitative",
        "nl_ref_type": "explicit",
        "nl_ref_phrase": "democracy index scores"
      },
      {
        "field": "Regime",
        "type": "nominal",
        "nl_ref_type": "explicit",
        "nl_ref_phrase": "regime types"
      }
    ],
    "constraints": [
      {
        "c_type": "transform",
        "c_name": "sort",
        "c_list": [
          {
            "op": "mean",
            "order": "ascending",
            "field": "democracy_eiu"
          }
        ],
        "nl_ref_type": "explicit",
        "nl_ref_phrase": "sorted by average democracy index in ascending order"
      }
    ]
  },
  "input": "Dataset Information: {\n  \"data samples\": [\n    {\n      \"ISO3\": \"AFG\",\n      \"Year\": 2021,\n      \"democracy_eiu\": 0.32,\n      \"Country\": \"Afghanistan\",\n      \"GDP\": 14786861638.0,\n      \"Region\": \"South Asia\",\n      \"Regime\": \"Authoritarian Regime\",\n      \"Sources\": NaN\n    },\n    {\n      \"ISO3\": \"SVN\",\n      \"Year\": 2021,\n      \"democracy_eiu\": 7.54,\n      \"Country\": \"Slovenia\",\n      \"GDP\": 61748586535.0,\n      \"Region\": \"Europe & Central Asia\",\n      \"Regime\": \"Flawed Democracy\",\n      \"Sources\": NaN\n    },\n    {\n      \"ISO3\": \"KWT\",\n      \"Year\": 2021,\n      \"democracy_eiu\": 3.91,\n      \"Country\": \"Kuwait\",\n      \"GDP\": NaN,\n      \"Region\": \"Middle East & North Africa\",\n      \"Regime\": \"Authoritarian Regime\",\n      \"Sources\": NaN\n    }\n  ],\n  \"column names\": [\n    \"ISO3\",\n    \"Year\",\n    \"democracy_eiu\",\n    \"Country\",\n    \"GDP\",\n    \"Region\",\n    \"Regime\",\n    \"Sources\"\n  ]\n}\n\nYour Job:\nI am developing a NL to Data Visualization Dataset. \nPlease help me generate natural language utterance for given dataset and constraints.\nDefinition about the Taks:\n- 'utterance' is what a user would say to make a chart, it can be a question or a command. One NL 'utterance' is in one or two sentences. \n- 'given dataset' is in form of column names, column type, range/unique values of the column.\n- 'constraints' are information about the chart that should be included in the utterance. \n    So we can find a reference phrase in the NL utterance that corresponds to the given constraints. \n- 'reference phrase' can be explicit, ambiguous, and by_value. 'ambiguous' means the phrase can map to more than one columns in the dataset, always a hypernym of column names(depending on the dataset values).\n    For example:\n    {\"column\": \"gdpPercap\", \"nl_ref_type\": \"explicit\", \"nl_ref_phrase\": \"GDP per capita\"},\n    {\"column\": [\"country\",\"continent\"], \"nl_ref_type\": \"ambiguous\", \"nl_ref_phrase\": \"region\"}\n    {\"column\": [\"country\",\"country_short_name\"], \"nl_ref_type\": \"ambiguous\", \"nl_ref_phrase\": \"countries\"}\n    {\"c_type\": \"mark\", \"c_name\": \"point chart\", \"nl_ref_type\": \"explicit\", \"nl_ref_phrase\": \"scatter plot\"}\n    {\"c_type\": \"mark\", \"c_name\": \"arc chart\", \"nl_ref_type\": \"explicit\", \"nl_ref_phrase\": \"pie chart\"}\n    {\"c_type\": \"transform\",\"c_name\": \"filter\",\"c_list\": [{\"field\": \"country\",\"oneOf\": [\"Iceland\",\"Norway\"]}],\"nl_ref_type\": \"explicit\",\"nl_ref_phrase\": \"for countries Iceland and Norway\"},\n    {\"c_type\": \"transform\",\"c_name\": \"filter\",\"c_list\": [{\"field\": \"country\",\"oneOf\": [\"Iceland\",\"Norway\"]}],\"nl_ref_type\": \"by_value\",\"nl_ref_phrase\": \"for Iceland and Norway\"},\n- the 'nl_ref_phrase' for 'ambiguous' columns should be equally near all ambiguous columns, not too near to one of the column since it would not be ambiguous.\n    good example: {\"column\": [\"country\",\"region\"], \"nl_ref_type\": \"ambiguous\", \"nl_ref_phrase\": \"location\"}\n    bad example: {\"column\": [\"country\",\"region\"], \"nl_ref_type\": \"ambiguous\", \"nl_ref_phrase\": \"region\"}\n- You only include given constraints and no other information. \n    For example, if a column name is not in the given constraint, it will not be included in the NL utterance.\n    Also, it a chart mark or chart encoding channel is not in the given constraint, it will not be included in the NL utterance.\n- all 'nl_ref_phrase' shoule be included in the 'nl_utterance'. \n\nThe output format is identical to the input format, but fill in the str blanks(\"...\").\n### Input:\n{\n  \"nl_utterance\": \"...\",\n  \"encoded_fields\": [\n    {\n      \"field\": [\n        \"Country\",\n        \"Region\"\n      ],\n      \"type\": \"nominal\",\n      \"nl_ref_type\": \"ambiguous\",\n      \"nl_ref_phrase\": \"...\"\n    },\n    {\n      \"field\": \"democracy_eiu\",\n      \"type\": \"quantitative\",\n      \"nl_ref_type\": \"explicit\",\n      \"nl_ref_phrase\": \"...\"\n    },\n    {\n      \"field\": \"Regime\",\n      \"type\": \"nominal\",\n      \"nl_ref_type\": \"explicit\",\n      \"nl_ref_phrase\": \"...\"\n    }\n  ],\n  \"constraints\": [\n    {\n      \"c_type\": \"transform\",\n      \"c_name\": \"sort\",\n      \"c_list\": [\n        {\n          \"op\": \"mean\",\n          \"order\": \"ascending\",\n          \"field\": \"democracy_eiu\"\n        }\n      ],\n      \"nl_ref_type\": \"explicit\",\n      \"nl_ref_phrase\": \"...\"\n    }\n  ]\n}\n\n### Output:"
}