{
  "gpt_result": {
    "nl_utterance": "Show me the trend of all credit card amounts over time using a bar, line, or area chart.",
    "encoded_fields": [
      {
        "field": "All creditcard amounts 1",
        "type": "quantitative",
        "nl_ref_type": "explicit",
        "nl_ref_phrase": "all credit card amounts"
      }
    ],
    "constraints": [
      {
        "c_type": "task",
        "c_name": "trend",
        "c_list": [
          {
            "mark": [
              "bar",
              "line",
              "area"
            ],
            "encoding": {
              "x": {
                "type": "temporal"
              }
            }
          }
        ],
        "nl_ref_type": "explicit",
        "nl_ref_phrase": "trend over time"
      }
    ]
  },
  "input": "Dataset Information: {\n  \"data samples\": [\n    {\n      \"Date\": \"1994 Q4\",\n      \"48-monthnew car\": \"n.a.\",\n      \"60-monthnew car\": \"n.a.\",\n      \"All creditcard amounts 1\": 15.69,\n      \"Credit card accountsassessed interest\": 15.77,\n      \"24-monthpersonal\": \"n.a.\",\n      \"Interestrates\": \"n.a.\",\n      \"Maturity(months)\": \"n.a.\",\n      \"Amount financed(dollars)\": \"n.a.\",\n      \"dt\": \"1995-01-01T00:00:00\"\n    },\n    {\n      \"Date\": \"2010 Q4\",\n      \"48-monthnew car\": \"5.87\",\n      \"60-monthnew car\": \"6.05\",\n      \"All creditcard amounts 1\": 13.44,\n      \"Credit card accountsassessed interest\": 13.67,\n      \"24-monthpersonal\": \"10.94\",\n      \"Interestrates\": \"4.48\",\n      \"Maturity(months)\": \"60.55\",\n      \"Amount financed(dollars)\": \"25261.78\",\n      \"dt\": \"2011-01-01T00:00:00\"\n    },\n    {\n      \"Date\": \"2017 Q3\",\n      \"48-monthnew car\": \"4.42\",\n      \"60-monthnew car\": \"4.36\",\n      \"All creditcard amounts 1\": 13.08,\n      \"Credit card accountsassessed interest\": 14.89,\n      \"24-monthpersonal\": \"9.76\",\n      \"Interestrates\": \"5.44\",\n      \"Maturity(months)\": \"67.36\",\n      \"Amount financed(dollars)\": \"29153.73\",\n      \"dt\": \"2017-10-01T00:00:00\"\n    }\n  ],\n  \"column names\": [\n    \"Date\",\n    \"48-monthnew car\",\n    \"60-monthnew car\",\n    \"All creditcard amounts 1\",\n    \"Credit card accountsassessed interest\",\n    \"24-monthpersonal\",\n    \"Interestrates\",\n    \"Maturity(months)\",\n    \"Amount financed(dollars)\",\n    \"dt\"\n  ]\n}\n\nYour Job:\nI am developing a NL to Data Visualization Dataset. \nPlease help me generate natural language utterance for given dataset and constraints.\nDefinition about the Taks:\n- 'utterance' is what a user would say to make a chart, it can be a question or a command. One NL 'utterance' is in one or two sentences. \n- 'given dataset' is in form of column names, column type, range/unique values of the column.\n- 'constraints' are information about the chart that should be included in the utterance. \n    So we can find a reference phrase in the NL utterance that corresponds to the given constraints. \n- 'reference phrase' can be explicit, ambiguous, and by_value. 'ambiguous' means the phrase can map to more than one columns in the dataset, always a hypernym of column names(depending on the dataset values).\n    For example:\n    {\"column\": \"gdpPercap\", \"nl_ref_type\": \"explicit\", \"nl_ref_phrase\": \"GDP per capita\"},\n    {\"column\": [\"country\",\"continent\"], \"nl_ref_type\": \"ambiguous\", \"nl_ref_phrase\": \"region\"}\n    {\"column\": [\"country\",\"country_short_name\"], \"nl_ref_type\": \"ambiguous\", \"nl_ref_phrase\": \"countries\"}\n    {\"c_type\": \"mark\", \"c_name\": \"point chart\", \"nl_ref_type\": \"explicit\", \"nl_ref_phrase\": \"scatter plot\"}\n    {\"c_type\": \"mark\", \"c_name\": \"arc chart\", \"nl_ref_type\": \"explicit\", \"nl_ref_phrase\": \"pie chart\"}\n    {\"c_type\": \"transform\",\"c_name\": \"filter\",\"c_list\": [{\"field\": \"country\",\"oneOf\": [\"Iceland\",\"Norway\"]}],\"nl_ref_type\": \"explicit\",\"nl_ref_phrase\": \"for countries Iceland and Norway\"},\n    {\"c_type\": \"transform\",\"c_name\": \"filter\",\"c_list\": [{\"field\": \"country\",\"oneOf\": [\"Iceland\",\"Norway\"]}],\"nl_ref_type\": \"by_value\",\"nl_ref_phrase\": \"for Iceland and Norway\"},\n- the 'nl_ref_phrase' for 'ambiguous' columns should be equally near all ambiguous columns, not too near to one of the column since it would not be ambiguous.\n    good example: {\"column\": [\"country\",\"region\"], \"nl_ref_type\": \"ambiguous\", \"nl_ref_phrase\": \"location\"}\n    bad example: {\"column\": [\"country\",\"region\"], \"nl_ref_type\": \"ambiguous\", \"nl_ref_phrase\": \"region\"}\n- You only include given constraints and no other information. \n    For example, if a column name is not in the given constraint, it will not be included in the NL utterance.\n    Also, it a chart mark or chart encoding channel is not in the given constraint, it will not be included in the NL utterance.\n- all 'nl_ref_phrase' shoule be included in the 'nl_utterance'. \n\nThe output format is identical to the input format, but fill in the str blanks(\"...\").\n### Input:\n{\n  \"nl_utterance\": \"...\",\n  \"encoded_fields\": [\n    {\n      \"field\": \"All creditcard amounts 1\",\n      \"type\": \"quantitative\",\n      \"nl_ref_type\": \"explicit\",\n      \"nl_ref_phrase\": \"...\"\n    }\n  ],\n  \"constraints\": [\n    {\n      \"c_type\": \"task\",\n      \"c_name\": \"trend\",\n      \"c_list\": [\n        {\n          \"mark\": [\n            \"bar\",\n            \"line\",\n            \"area\"\n          ],\n          \"encoding\": {\n            \"x\": {\n              \"type\": \"temporal\"\n            }\n          }\n        }\n      ],\n      \"nl_ref_type\": \"explicit\",\n      \"nl_ref_phrase\": \"...\"\n    }\n  ]\n}\n\n### Output:"
}