{
  "gpt_result": "```json\n{\n  \"nl_utterance\": \"Create a line chart showing the percentage change over the time period.\",\n  \"encoded_fields\": [\n    {\n      \"field\": \"Time period\",\n      \"type\": \"temporal\",\n      \"nl_ref_type\": \"explicit\",\n      \"nl_ref_phrase\": \"time period\"\n    },\n    {\n      \"field\": \"Percentage change\",\n      \"type\": \"quantitative\",\n      \"nl_ref_type\": \"explicit\",\n      \"nl_ref_phrase\": \"percentage change\"\n    }\n  ],\n  \"constraints\": [\n    {\n      \"c_type\": \"mark\",\n      \"c_name\": \"line chart\",\n      \"c_list\": [\n        {\n          \"mark\": \"line\",\n          \"encoding\": {\n            \"x\": {},\n            \"y\": {\n              \"type\": \"quantitative\"\n            },\n            \"color\": {\n              \"ignore\": true,\n              \"type\": \"nominal\"\n            },\n            \"column\": {\n              \"ignore\": true,\n              \"type\": \"nominal\"\n            },\n            \"row\": {\n              \"ignore\": true,\n              \"type\": \"nominal\"\n            }\n          },\n          \"unique_map\": {\n            \"x\": \"y\"\n          }\n        }\n      ],\n      \"nl_ref_type\": \"explicit\",\n      \"nl_ref_phrase\": \"line chart\"\n    }\n  ]\n}\n```",
  "input": "Dataset Information: {\n  \"data samples\": [\n    {\n      \"Time\": \"1990 JAN\",\n      \"Percentage\": 7.8,\n      \"Unnamed: 2\": 1990,\n      \"Unnamed: 3\": \"JAN\",\n      \"Unnamed: 4\": 1,\n      \"Time period\": \"1990-01-01\",\n      \"Percentage change\": 7.8\n    },\n    {\n      \"Time\": \"2016 JUN\",\n      \"Percentage\": -1.2,\n      \"Unnamed: 2\": 2016,\n      \"Unnamed: 3\": \"JUN\",\n      \"Unnamed: 4\": 6,\n      \"Time period\": \"2016-06-01\",\n      \"Percentage change\": -1.2\n    },\n    {\n      \"Time\": \"2002 APR\",\n      \"Percentage\": 2.6,\n      \"Unnamed: 2\": 2002,\n      \"Unnamed: 3\": \"APR\",\n      \"Unnamed: 4\": 4,\n      \"Time period\": \"2002-04-01\",\n      \"Percentage change\": 2.6\n    },\n    {\n      \"Time\": \"2008 JAN\",\n      \"Percentage\": 5.7,\n      \"Unnamed: 2\": 2008,\n      \"Unnamed: 3\": \"JAN\",\n      \"Unnamed: 4\": 1,\n      \"Time period\": \"2008-01-01\",\n      \"Percentage change\": 5.7\n    },\n    {\n      \"Time\": \"1990 JUL\",\n      \"Percentage\": 8.1,\n      \"Unnamed: 2\": 1990,\n      \"Unnamed: 3\": \"JUL\",\n      \"Unnamed: 4\": 7,\n      \"Time period\": \"1990-07-01\",\n      \"Percentage change\": 8.1\n    }\n  ],\n  \"column names\": [\n    \"Time\",\n    \"Percentage\",\n    \"Unnamed: 2\",\n    \"Unnamed: 3\",\n    \"Unnamed: 4\",\n    \"Time period\",\n    \"Percentage change\"\n  ]\n}\n\nYour Job:\nI am developing a NL to Data Visualization Dataset. \nPlease help me generate natural language utterance for given dataset and constraints.\nDefinition about the Taks:\n- 'utterance' is what a user would say to make a chart. It should be a commands structure. One NL 'utterance' is in one or two sentences. Here are two examples from Commands for reference:\n    Make the bars stacked with the ship status.\n    Make a simple scatter plot of worldwide Gross by Production Budget categorized by Major Genre.\n- 'given dataset' is in form of column names, column type, range/unique values of the column.\n- 'constraints' are information about the chart that should be included in the utterance. \n    So we can find a reference phrase in the NL utterance that corresponds to the given constraints. \n- 'reference phrase' can be explicit, ambiguous, and by_value. 'ambiguous' means the phrase can map to more than one columns in the dataset, always a hypernym of column names(depending on the dataset values).\n    For example:\n    {\"column\": \"gdpPercap\", \"nl_ref_type\": \"explicit\", \"nl_ref_phrase\": \"GDP per capita\"},\n    {\"column\": [\"country\",\"continent\"], \"nl_ref_type\": \"ambiguous\", \"nl_ref_phrase\": \"region\"}\n    {\"column\": [\"country\",\"country_short_name\"], \"nl_ref_type\": \"ambiguous\", \"nl_ref_phrase\": \"countries\"}\n    {\"c_type\": \"mark\", \"c_name\": \"point chart\", \"nl_ref_type\": \"explicit\", \"nl_ref_phrase\": \"scatter plot\"}\n    {\"c_type\": \"mark\", \"c_name\": \"arc chart\", \"nl_ref_type\": \"explicit\", \"nl_ref_phrase\": \"pie chart\"}\n    {\"c_type\": \"transform\",\"c_name\": \"filter\",\"c_list\": [{\"field\": \"country\",\"oneOf\": [\"Iceland\",\"Norway\"]}],\"nl_ref_type\": \"explicit\",\"nl_ref_phrase\": \"for countries Iceland and Norway\"},\n    {\"c_type\": \"transform\",\"c_name\": \"filter\",\"c_list\": [{\"field\": \"country\",\"oneOf\": [\"Iceland\",\"Norway\"]}],\"nl_ref_type\": \"by_value\",\"nl_ref_phrase\": \"for Iceland and Norway\"},\n- the 'nl_ref_phrase' for 'ambiguous' columns should be equally near all ambiguous columns, not too near to one of the column since it would not be ambiguous.\n    good example: {\"column\": [\"country\",\"region\"], \"nl_ref_type\": \"ambiguous\", \"nl_ref_phrase\": \"location\"}\n    bad example: {\"column\": [\"country\",\"region\"], \"nl_ref_type\": \"ambiguous\", \"nl_ref_phrase\": \"region\"}\n- You only include given constraints and no other information. \n    For example, if a column name is not in the given constraint, it will not be included in the NL utterance.\n    Also, it a chart mark or chart encoding channel is not in the given constraint, it will not be included in the NL utterance.\n- all 'nl_ref_phrase' shoule be included in the 'nl_utterance'. \n\nThe output format is identical to the input format, but fill in the str blanks(\"...\").\n### Input:\n{\n  \"nl_utterance\": \"...\",\n  \"encoded_fields\": [\n    {\n      \"field\": \"Time period\",\n      \"type\": \"temporal\",\n      \"nl_ref_type\": \"explicit\",\n      \"nl_ref_phrase\": \"...\"\n    },\n    {\n      \"field\": \"Percentage change\",\n      \"type\": \"quantitative\",\n      \"nl_ref_type\": \"explicit\",\n      \"nl_ref_phrase\": \"...\"\n    }\n  ],\n  \"constraints\": [\n    {\n      \"c_type\": \"mark\",\n      \"c_name\": \"line chart\",\n      \"c_list\": [\n        {\n          \"mark\": \"line\",\n          \"encoding\": {\n            \"x\": {},\n            \"y\": {\n              \"type\": \"quantitative\"\n            },\n            \"color\": {\n              \"ignore\": true,\n              \"type\": \"nominal\"\n            },\n            \"column\": {\n              \"ignore\": true,\n              \"type\": \"nominal\"\n            },\n            \"row\": {\n              \"ignore\": true,\n              \"type\": \"nominal\"\n            }\n          },\n          \"unique_map\": {\n            \"x\": \"y\"\n          }\n        }\n      ],\n      \"nl_ref_type\": \"explicit\",\n      \"nl_ref_phrase\": \"...\"\n    }\n  ]\n}\n\n### Output:"
}