{
  "gpt_result": {
    "nl_utterance": "I want to see the distribution of mobility, commute, migration in, and migration out using a boxplot.",
    "encoded_fields": [
      {
        "field": [
          "Mobility",
          "Commute",
          "Migration_in",
          "Migration_out"
        ],
        "type": "quantitative",
        "nl_ref_type": "ambiguous",
        "nl_ref_phrase": "mobility, commute, migration in, and migration out"
      }
    ],
    "constraints": [
      {
        "c_type": "task",
        "c_name": "distribution",
        "c_list": [
          {
            "mark": "bar",
            "encoding": {
              "y": {
                "aggregate": "count",
                "type": "quantitative"
              }
            },
            "x_y_reversable": true
          },
          {
            "mark": "boxplot",
            "encoding": {
              "x": {
                "type": "quantitative"
              }
            },
            "x_y_reversable": true
          }
        ],
        "nl_ref_type": "explicit",
        "nl_ref_phrase": "distribution"
      }
    ]
  },
  "input": "Dataset Information: {\n  \"data samples\": [\n    {\n      \"ID\": 100,\n      \"Name\": \"Johnson City\",\n      \"Mobility\": 0.0621988103,\n      \"State\": \"TN\",\n      \"Population\": 576081,\n      \"Urban\": 1,\n      \"Black\": 0.021,\n      \"Seg_racial\": 0.09,\n      \"Seg_income\": 0.035,\n      \"Seg_poverty\": 0.03,\n      \"Seg_affluence\": 0.038,\n      \"Commute\": 0.325,\n      \"Income\": 31560,\n      \"Gini\": 0.468,\n      \"Share01\": 13.459,\n      \"Gini_99\": 0.333,\n      \"Middle_class\": 0.548,\n      \"Local_tax_rate\": 0.02,\n      \"Local_gov_spending\": 1886.0,\n      \"Progressivity\": 0.0,\n      \"EITC\": 0.0,\n      \"School_spending\": 5.185,\n      \"Student_teacher_ratio\": NaN,\n      \"Test_scores\": 2.728,\n      \"HS_dropout\": -0.015,\n      \"Colleges\": 0.014,\n      \"Tuition\": 4817.0,\n      \"Graduation\": -0.002,\n      \"Labor_force_participation\": 0.587,\n      \"Manufacturing\": 0.237,\n      \"Chinese_imports\": 5.294,\n      \"Teenage_labor\": 0.004,\n      \"Migration_in\": 0.006,\n      \"Migration_out\": 0.005,\n      \"Foreign_born\": 0.012,\n      \"Social_capital\": -0.298,\n      \"Religious\": 0.514,\n      \"Violent_crime\": 0.001,\n      \"Single_mothers\": 0.19,\n      \"Divorced\": 0.11,\n      \"Married\": 0.601,\n      \"Longitude\": -82.4363861083984,\n      \"Latitude\": 36.4703712463379\n    },\n    {\n      \"ID\": 27605,\n      \"Name\": \"Mission\",\n      \"Mobility\": 0.0242537316,\n      \"State\": \"SD\",\n      \"Population\": 11133,\n      \"Urban\": 0,\n      \"Black\": 0.001,\n      \"Seg_racial\": 0.102,\n      \"Seg_income\": 0.003,\n      \"Seg_poverty\": 0.001,\n      \"Seg_affluence\": 0.003,\n      \"Commute\": 0.465,\n      \"Income\": 17598,\n      \"Gini\": 0.381,\n      \"Share01\": 5.522,\n      \"Gini_99\": 0.326,\n      \"Middle_class\": 0.379,\n      \"Local_tax_rate\": 0.012,\n      \"Local_gov_spending\": 2285.0,\n      \"Progressivity\": 0.0,\n      \"EITC\": 0.0,\n      \"School_spending\": 5.546,\n      \"Student_teacher_ratio\": 13.9,\n      \"Test_scores\": -30.399,\n      \"HS_dropout\": NaN,\n      \"Colleges\": 0.09,\n      \"Tuition\": 1632.0,\n      \"Graduation\": -0.083,\n      \"Labor_force_participation\": 0.587,\n      \"Manufacturing\": 0.014,\n      \"Chinese_imports\": 0.0,\n      \"Teenage_labor\": 0.005,\n      \"Migration_in\": 0.008,\n      \"Migration_out\": 0.006,\n      \"Foreign_born\": 0.006,\n      \"Social_capital\": 0.035,\n      \"Religious\": 0.551,\n      \"Violent_crime\": 0.0,\n      \"Single_mothers\": 0.391,\n      \"Divorced\": 0.138,\n      \"Married\": 0.373,\n      \"Longitude\": -100.702262878418,\n      \"Latitude\": 43.6780586242676\n    },\n    {\n      \"ID\": 29201,\n      \"Name\": \"Hiawatha\",\n      \"Mobility\": 0.1718213111,\n      \"State\": \"KS\",\n      \"Population\": 21441,\n      \"Urban\": 0,\n      \"Black\": 0.01,\n      \"Seg_racial\": 0.115,\n      \"Seg_income\": 0.008,\n      \"Seg_poverty\": 0.005,\n      \"Seg_affluence\": 0.005,\n      \"Commute\": 0.578,\n      \"Income\": 34022,\n      \"Gini\": 0.317,\n      \"Share01\": 8.562,\n      \"Gini_99\": 0.231,\n      \"Middle_class\": 0.68,\n      \"Local_tax_rate\": 0.021,\n      \"Local_gov_spending\": 1956.0,\n      \"Progressivity\": 0.2,\n      \"EITC\": 1.905,\n      \"School_spending\": 6.534,\n      \"Student_teacher_ratio\": 14.3,\n      \"Test_scores\": 15.663,\n      \"HS_dropout\": -0.025,\n      \"Colleges\": NaN,\n      \"Tuition\": NaN,\n      \"Graduation\": NaN,\n      \"Labor_force_participation\": 0.629,\n      \"Manufacturing\": 0.139,\n      \"Chinese_imports\": 1.21,\n      \"Teenage_labor\": 0.006,\n      \"Migration_in\": 0.009,\n      \"Migration_out\": 0.017,\n      \"Foreign_born\": 0.009,\n      \"Social_capital\": 2.298,\n      \"Religious\": 0.744,\n      \"Violent_crime\": 0.0,\n      \"Single_mothers\": 0.149,\n      \"Divorced\": 0.079,\n      \"Married\": 0.609,\n      \"Longitude\": -95.8358383178711,\n      \"Latitude\": 39.7535018920898\n    },\n    {\n      \"ID\": 39100,\n      \"Name\": \"Kennewick\",\n      \"Mobility\": 0.1058548018,\n      \"State\": \"WA\",\n      \"Population\": 332609,\n      \"Urban\": 1,\n      \"Black\": 0.011,\n      \"Seg_racial\": 0.158,\n      \"Seg_income\": 0.064,\n      \"Seg_poverty\": 0.056,\n      \"Seg_affluence\": 0.074,\n      \"Commute\": 0.453,\n      \"Income\": 34510,\n      \"Gini\": 0.362,\n      \"Share01\": 8.535,\n      \"Gini_99\": 0.276,\n      \"Middle_class\": 0.554,\n      \"Local_tax_rate\": 0.018,\n      \"Local_gov_spending\": 5442.0,\n      \"Progressivity\": 0.0,\n      \"EITC\": 0.0,\n      \"School_spending\": 6.699,\n      \"Student_teacher_ratio\": 19.6,\n      \"Test_scores\": -4.494,\n      \"HS_dropout\": 0.007,\n      \"Colleges\": 0.015,\n      \"Tuition\": 7160.0,\n      \"Graduation\": -0.043,\n      \"Labor_force_participation\": 0.643,\n      \"Manufacturing\": 0.094,\n      \"Chinese_imports\": 0.812,\n      \"Teenage_labor\": 0.004,\n      \"Migration_in\": 0.02,\n      \"Migration_out\": 0.018,\n      \"Foreign_born\": 0.112,\n      \"Social_capital\": -0.22,\n      \"Religious\": 0.422,\n      \"Violent_crime\": 0.001,\n      \"Single_mothers\": 0.19,\n      \"Divorced\": 0.102,\n      \"Married\": 0.589,\n      \"Longitude\": -118.693199157715,\n      \"Latitude\": 45.9214706420898\n    },\n    {\n      \"ID\": 12002,\n      \"Name\": \"Ludington\",\n      \"Mobility\": 0.0760736167,\n      \"State\": \"MI\",\n      \"Population\": 52801,\n      \"Urban\": 0,\n      \"Black\": 0.011,\n      \"Seg_racial\": 0.063,\n      \"Seg_income\": 0.02,\n      \"Seg_poverty\": 0.02,\n      \"Seg_affluence\": 0.021,\n      \"Commute\": 0.493,\n      \"Income\": 33400,\n      \"Gini\": 0.371,\n      \"Share01\": 9.758,\n      \"Gini_99\": 0.274,\n      \"Middle_class\": 0.6,\n      \"Local_tax_rate\": 0.035,\n      \"Local_gov_spending\": 2207.0,\n      \"Progressivity\": 0.0,\n      \"EITC\": 0.0,\n      \"School_spending\": 6.004,\n      \"Student_teacher_ratio\": 18.3,\n      \"Test_scores\": 6.417,\n      \"HS_dropout\": NaN,\n      \"Colleges\": 0.019,\n      \"Tuition\": 1974.0,\n      \"Graduation\": -0.225,\n      \"Labor_force_participation\": 0.589,\n      \"Manufacturing\": 0.208,\n      \"Chinese_imports\": 1.481,\n      \"Teenage_labor\": 0.006,\n      \"Migration_in\": 0.016,\n      \"Migration_out\": 0.016,\n      \"Foreign_born\": 0.014,\n      \"Social_capital\": 1.041,\n      \"Religious\": 0.447,\n      \"Violent_crime\": 0.001,\n      \"Single_mothers\": 0.206,\n      \"Divorced\": 0.105,\n      \"Married\": 0.59,\n      \"Longitude\": -86.1842346191406,\n      \"Latitude\": 44.122974395752\n    }\n  ],\n  \"column names\": [\n    \"ID\",\n    \"Name\",\n    \"Mobility\",\n    \"State\",\n    \"Population\",\n    \"Urban\",\n    \"Black\",\n    \"Seg_racial\",\n    \"Seg_income\",\n    \"Seg_poverty\",\n    \"Seg_affluence\",\n    \"Commute\",\n    \"Income\",\n    \"Gini\",\n    \"Share01\",\n    \"Gini_99\",\n    \"Middle_class\",\n    \"Local_tax_rate\",\n    \"Local_gov_spending\",\n    \"Progressivity\",\n    \"EITC\",\n    \"School_spending\",\n    \"Student_teacher_ratio\",\n    \"Test_scores\",\n    \"HS_dropout\",\n    \"Colleges\",\n    \"Tuition\",\n    \"Graduation\",\n    \"Labor_force_participation\",\n    \"Manufacturing\",\n    \"Chinese_imports\",\n    \"Teenage_labor\",\n    \"Migration_in\",\n    \"Migration_out\",\n    \"Foreign_born\",\n    \"Social_capital\",\n    \"Religious\",\n    \"Violent_crime\",\n    \"Single_mothers\",\n    \"Divorced\",\n    \"Married\",\n    \"Longitude\",\n    \"Latitude\"\n  ]\n}\n\nYour Job:\nI am developing a NL to Data Visualization Dataset. \nPlease help me generate natural language utterance for given dataset and constraints.\nDefinition about the Taks:\n- 'utterance' is what a user would say to make a chart.  One NL 'utterance' is in one or two sentences. Here are two examples from Others for reference:\n    scatter(x=production budget, y=worldwide gross) for content rating.\n    I want to know how many orders there are by the quantity of the order.\n- 'given dataset' is in form of column names, column type, range/unique values of the column.\n- 'constraints' are information about the chart that should be included in the utterance. \n    So we can find a reference phrase in the NL utterance that corresponds to the given constraints. \n- 'reference phrase' can be explicit, ambiguous, and by_value. 'ambiguous' means the phrase can map to more than one columns in the dataset, always a hypernym of column names(depending on the dataset values).\n    For example:\n    {\"column\": \"gdpPercap\", \"nl_ref_type\": \"explicit\", \"nl_ref_phrase\": \"GDP per capita\"},\n    {\"column\": [\"country\",\"continent\"], \"nl_ref_type\": \"ambiguous\", \"nl_ref_phrase\": \"region\"}\n    {\"column\": [\"country\",\"country_short_name\"], \"nl_ref_type\": \"ambiguous\", \"nl_ref_phrase\": \"countries\"}\n    {\"c_type\": \"mark\", \"c_name\": \"point chart\", \"nl_ref_type\": \"explicit\", \"nl_ref_phrase\": \"scatter plot\"}\n    {\"c_type\": \"mark\", \"c_name\": \"arc chart\", \"nl_ref_type\": \"explicit\", \"nl_ref_phrase\": \"pie chart\"}\n    {\"c_type\": \"transform\",\"c_name\": \"filter\",\"c_list\": [{\"field\": \"country\",\"oneOf\": [\"Iceland\",\"Norway\"]}],\"nl_ref_type\": \"explicit\",\"nl_ref_phrase\": \"for countries Iceland and Norway\"},\n    {\"c_type\": \"transform\",\"c_name\": \"filter\",\"c_list\": [{\"field\": \"country\",\"oneOf\": [\"Iceland\",\"Norway\"]}],\"nl_ref_type\": \"by_value\",\"nl_ref_phrase\": \"for Iceland and Norway\"},\n- the 'nl_ref_phrase' for 'ambiguous' columns should be equally near all ambiguous columns, not too near to one of the column since it would not be ambiguous.\n    good example: {\"column\": [\"country\",\"region\"], \"nl_ref_type\": \"ambiguous\", \"nl_ref_phrase\": \"location\"}\n    bad example: {\"column\": [\"country\",\"region\"], \"nl_ref_type\": \"ambiguous\", \"nl_ref_phrase\": \"region\"}\n- You only include given constraints and no other information. \n    For example, if a column name is not in the given constraint, it will not be included in the NL utterance.\n    Also, it a chart mark or chart encoding channel is not in the given constraint, it will not be included in the NL utterance.\n- all 'nl_ref_phrase' shoule be included in the 'nl_utterance'. \n\nThe output format is identical to the input format, but fill in the str blanks(\"...\").\n### Input:\n{\n  \"nl_utterance\": \"...\",\n  \"encoded_fields\": [\n    {\n      \"field\": [\n        \"Mobility\",\n        \"Commute\",\n        \"Migration_in\",\n        \"Migration_out\"\n      ],\n      \"type\": \"quantitative\",\n      \"nl_ref_type\": \"ambiguous\",\n      \"nl_ref_phrase\": \"...\"\n    }\n  ],\n  \"constraints\": [\n    {\n      \"c_type\": \"task\",\n      \"c_name\": \"distribution\",\n      \"c_list\": [\n        {\n          \"mark\": \"bar\",\n          \"encoding\": {\n            \"y\": {\n              \"aggregate\": \"count\",\n              \"type\": \"quantitative\"\n            }\n          },\n          \"x_y_reversable\": true\n        },\n        {\n          \"mark\": \"boxplot\",\n          \"encoding\": {\n            \"x\": {\n              \"type\": \"quantitative\"\n            }\n          },\n          \"x_y_reversable\": true\n        }\n      ],\n      \"nl_ref_type\": \"explicit\",\n      \"nl_ref_phrase\": \"...\"\n    }\n  ]\n}\n\n### Output:"
}