{
  "gpt_result": {
    "nl_utterance": "Show me a bar chart comparing the quantitative values across different regions.",
    "encoded_fields": [
      {
        "column": "Income or Gini or Mobility or Population or Local_tax_rate or Local_gov_spending or Progressivity or School_spending or Student_teacher_ratio or Test_scores or HS_dropout or Tuition or Labor_force_participation or Manufacturing or Chinese_imports or Teenage_labor or Migration_in or Migration_out or Foreign_born or Social_capital or Violent_crime or Single_mothers or Divorced or Married",
        "nl_ref_type": "ambiguous",
        "nl_ref_phrase": "quantitative values"
      },
      {
        "column": "State or Name",
        "nl_ref_type": "ambiguous",
        "nl_ref_phrase": "regions"
      },
      {
        "c_type": "mark",
        "c_name": "bar chart",
        "nl_ref_type": "explicit",
        "nl_ref_phrase": "bar chart"
      }
    ],
    "constraints": [
      {
        "c_type": "mark",
        "c_name": "bar chart",
        "c_list": [
          {
            "mark": "bar",
            "encoding": {
              "x": {},
              "y": {
                "type": "quantitative"
              },
              "color": {
                "type": "nominal",
                "ignore": true
              },
              "column": {
                "ignore": true,
                "type": "nominal"
              },
              "row": {
                "ignore": true,
                "type": "nominal"
              }
            },
            "unique_map": {
              "x": "y"
            }
          },
          {
            "mark": "bar",
            "encoding": {
              "y": {},
              "x": {
                "type": "quantitative"
              },
              "color": {
                "type": "nominal",
                "ignore": true
              },
              "column": {
                "ignore": true,
                "type": "nominal"
              },
              "row": {
                "ignore": true,
                "type": "nominal"
              }
            },
            "unique_map": {
              "y": "x"
            }
          }
        ],
        "nl_ref_type": "explicit",
        "nl_ref_phrase": "bar chart"
      }
    ]
  },
  "input": "Dataset Information: {\n  \"data samples\": [\n    {\n      \"ID\": 100,\n      \"Name\": \"Johnson City\",\n      \"Mobility\": 0.0621988103,\n      \"State\": \"TN\",\n      \"Population\": 576081,\n      \"Urban\": 1,\n      \"Black\": 0.021,\n      \"Seg_racial\": 0.09,\n      \"Seg_income\": 0.035,\n      \"Seg_poverty\": 0.03,\n      \"Seg_affluence\": 0.038,\n      \"Commute\": 0.325,\n      \"Income\": 31560,\n      \"Gini\": 0.468,\n      \"Share01\": 13.459,\n      \"Gini_99\": 0.333,\n      \"Middle_class\": 0.548,\n      \"Local_tax_rate\": 0.02,\n      \"Local_gov_spending\": 1886.0,\n      \"Progressivity\": 0.0,\n      \"EITC\": 0.0,\n      \"School_spending\": 5.185,\n      \"Student_teacher_ratio\": NaN,\n      \"Test_scores\": 2.728,\n      \"HS_dropout\": -0.015,\n      \"Colleges\": 0.014,\n      \"Tuition\": 4817.0,\n      \"Graduation\": -0.002,\n      \"Labor_force_participation\": 0.587,\n      \"Manufacturing\": 0.237,\n      \"Chinese_imports\": 5.294,\n      \"Teenage_labor\": 0.004,\n      \"Migration_in\": 0.006,\n      \"Migration_out\": 0.005,\n      \"Foreign_born\": 0.012,\n      \"Social_capital\": -0.298,\n      \"Religious\": 0.514,\n      \"Violent_crime\": 0.001,\n      \"Single_mothers\": 0.19,\n      \"Divorced\": 0.11,\n      \"Married\": 0.601,\n      \"Longitude\": -82.4363861083984,\n      \"Latitude\": 36.4703712463379\n    },\n    {\n      \"ID\": 31006,\n      \"Name\": \"Guymon\",\n      \"Mobility\": 0.1617021263,\n      \"State\": \"OK\",\n      \"Population\": 29937,\n      \"Urban\": 0,\n      \"Black\": 0.005,\n      \"Seg_racial\": 0.043,\n      \"Seg_income\": 0.007,\n      \"Seg_poverty\": 0.008,\n      \"Seg_affluence\": 0.006,\n      \"Commute\": 0.609,\n      \"Income\": 30685,\n      \"Gini\": 0.339,\n      \"Share01\": 6.358,\n      \"Gini_99\": 0.276,\n      \"Middle_class\": 0.598,\n      \"Local_tax_rate\": 0.029,\n      \"Local_gov_spending\": 2403.0,\n      \"Progressivity\": 0.0,\n      \"EITC\": 0.0,\n      \"School_spending\": 6.397,\n      \"Student_teacher_ratio\": 14.7,\n      \"Test_scores\": 0.488,\n      \"HS_dropout\": -0.016,\n      \"Colleges\": 0.033,\n      \"Tuition\": 1470.0,\n      \"Graduation\": -0.127,\n      \"Labor_force_participation\": 0.658,\n      \"Manufacturing\": 0.128,\n      \"Chinese_imports\": 0.12,\n      \"Teenage_labor\": 0.005,\n      \"Migration_in\": 0.007,\n      \"Migration_out\": 0.015,\n      \"Foreign_born\": 0.149,\n      \"Social_capital\": 0.789,\n      \"Religious\": 0.843,\n      \"Violent_crime\": 0.003,\n      \"Single_mothers\": 0.125,\n      \"Divorced\": 0.073,\n      \"Married\": 0.641,\n      \"Longitude\": -101.82502746582,\n      \"Latitude\": 36.7060203552246\n    },\n    {\n      \"ID\": 37400,\n      \"Name\": \"Sacramento\",\n      \"Mobility\": 0.0969090089,\n      \"State\": \"CA\",\n      \"Population\": 2570609,\n      \"Urban\": 1,\n      \"Black\": 0.063,\n      \"Seg_racial\": 0.161,\n      \"Seg_income\": 0.093,\n      \"Seg_poverty\": 0.086,\n      \"Seg_affluence\": 0.099,\n      \"Commute\": 0.285,\n      \"Income\": 39560,\n      \"Gini\": 0.451,\n      \"Share01\": 12.004,\n      \"Gini_99\": 0.331,\n      \"Middle_class\": 0.492,\n      \"Local_tax_rate\": 0.02,\n      \"Local_gov_spending\": 3559.0,\n      \"Progressivity\": 6.3,\n      \"EITC\": 0.0,\n      \"School_spending\": 5.495,\n      \"Student_teacher_ratio\": 23.3,\n      \"Test_scores\": -11.615,\n      \"HS_dropout\": -0.02,\n      \"Colleges\": 0.008,\n      \"Tuition\": 2457.0,\n      \"Graduation\": 0.021,\n      \"Labor_force_participation\": 0.625,\n      \"Manufacturing\": 0.085,\n      \"Chinese_imports\": 0.528,\n      \"Teenage_labor\": 0.004,\n      \"Migration_in\": 0.034,\n      \"Migration_out\": 0.027,\n      \"Foreign_born\": 0.147,\n      \"Social_capital\": -0.596,\n      \"Religious\": 0.354,\n      \"Violent_crime\": 0.004,\n      \"Single_mothers\": 0.225,\n      \"Divorced\": 0.111,\n      \"Married\": 0.541,\n      \"Longitude\": -120.881065368652,\n      \"Latitude\": 38.5452499389648\n    }\n  ],\n  \"column names\": [\n    \"ID\",\n    \"Name\",\n    \"Mobility\",\n    \"State\",\n    \"Population\",\n    \"Urban\",\n    \"Black\",\n    \"Seg_racial\",\n    \"Seg_income\",\n    \"Seg_poverty\",\n    \"Seg_affluence\",\n    \"Commute\",\n    \"Income\",\n    \"Gini\",\n    \"Share01\",\n    \"Gini_99\",\n    \"Middle_class\",\n    \"Local_tax_rate\",\n    \"Local_gov_spending\",\n    \"Progressivity\",\n    \"EITC\",\n    \"School_spending\",\n    \"Student_teacher_ratio\",\n    \"Test_scores\",\n    \"HS_dropout\",\n    \"Colleges\",\n    \"Tuition\",\n    \"Graduation\",\n    \"Labor_force_participation\",\n    \"Manufacturing\",\n    \"Chinese_imports\",\n    \"Teenage_labor\",\n    \"Migration_in\",\n    \"Migration_out\",\n    \"Foreign_born\",\n    \"Social_capital\",\n    \"Religious\",\n    \"Violent_crime\",\n    \"Single_mothers\",\n    \"Divorced\",\n    \"Married\",\n    \"Longitude\",\n    \"Latitude\"\n  ]\n}\n\nYour Job:\nI am developing a NL to Data Visualization Dataset. \nPlease help me generate natural language utterance for given dataset and constraints.\nDefinition about the Taks:\n- 'utterance' is what a user would say to make a chart, it can be a question or a command. One NL 'utterance' is in one or two sentences. \n- 'given dataset' is in form of column names, column type, range/unique values of the column.\n- 'constraints' are information about the chart that should be included in the utterance. \n    So we can find a reference phrase in the NL utterance that corresponds to the given constraints. \n- 'reference phrase' can be explicit, ambiguous, and by_value. 'ambiguous' means the phrase can map to more than one columns in the dataset, always a hypernym of column names(depending on the dataset values).\n    For example:\n    {\"column\": \"gdpPercap\", \"nl_ref_type\": \"explicit\", \"nl_ref_phrase\": \"GDP per capita\"},\n    {\"column\": [\"country\",\"continent\"], \"nl_ref_type\": \"ambiguous\", \"nl_ref_phrase\": \"region\"}\n    {\"column\": [\"country\",\"country_short_name\"], \"nl_ref_type\": \"ambiguous\", \"nl_ref_phrase\": \"countries\"}\n    {\"c_type\": \"mark\", \"c_name\": \"point chart\", \"nl_ref_type\": \"explicit\", \"nl_ref_phrase\": \"scatter plot\"}\n    {\"c_type\": \"mark\", \"c_name\": \"arc chart\", \"nl_ref_type\": \"explicit\", \"nl_ref_phrase\": \"pie chart\"}\n    {\"c_type\": \"transform\",\"c_name\": \"filter\",\"c_list\": [{\"field\": \"country\",\"oneOf\": [\"Iceland\",\"Norway\"]}],\"nl_ref_type\": \"explicit\",\"nl_ref_phrase\": \"for countries Iceland and Norway\"},\n    {\"c_type\": \"transform\",\"c_name\": \"filter\",\"c_list\": [{\"field\": \"country\",\"oneOf\": [\"Iceland\",\"Norway\"]}],\"nl_ref_type\": \"by_value\",\"nl_ref_phrase\": \"for Iceland and Norway\"},\n- the 'nl_ref_phrase' for 'ambiguous' columns should be equally near all ambiguous columns, not too near to one of the column since it would not be ambiguous.\n    good example: {\"column\": [\"country\",\"region\"], \"nl_ref_type\": \"ambiguous\", \"nl_ref_phrase\": \"location\"}\n    bad example: {\"column\": [\"country\",\"region\"], \"nl_ref_type\": \"ambiguous\", \"nl_ref_phrase\": \"region\"}\n- You only include given constraints and no other information. \n    For example, if a column name is not in the given constraint, it will not be included in the NL utterance.\n    Also, it a chart mark or chart encoding channel is not in the given constraint, it will not be included in the NL utterance.\n- all 'nl_ref_phrase' shoule be included in the 'nl_utterance'. \n\nThe output format is identical to the input format, but fill in the str blanks(\"...\").\n### Input:\n{\n  \"nl_utterance\": \"...\",\n  \"encoded_fields\": [],\n  \"constraints\": [\n    {\n      \"c_type\": \"mark\",\n      \"c_name\": \"bar chart\",\n      \"c_list\": [\n        {\n          \"mark\": \"bar\",\n          \"encoding\": {\n            \"x\": {},\n            \"y\": {\n              \"type\": \"quantitative\"\n            },\n            \"color\": {\n              \"type\": \"nominal\",\n              \"ignore\": true\n            },\n            \"column\": {\n              \"ignore\": true,\n              \"type\": \"nominal\"\n            },\n            \"row\": {\n              \"ignore\": true,\n              \"type\": \"nominal\"\n            }\n          },\n          \"unique_map\": {\n            \"x\": \"y\"\n          }\n        },\n        {\n          \"mark\": \"bar\",\n          \"encoding\": {\n            \"y\": {},\n            \"x\": {\n              \"type\": \"quantitative\"\n            },\n            \"color\": {\n              \"type\": \"nominal\",\n              \"ignore\": true\n            },\n            \"column\": {\n              \"ignore\": true,\n              \"type\": \"nominal\"\n            },\n            \"row\": {\n              \"ignore\": true,\n              \"type\": \"nominal\"\n            }\n          },\n          \"unique_map\": {\n            \"y\": \"x\"\n          }\n        }\n      ],\n      \"nl_ref_type\": \"explicit\",\n      \"nl_ref_phrase\": \"...\"\n    }\n  ]\n}\n\n### Output:"
}