{
  "gpt_result": {
    "nl_utterance": "What is the total sum of purchases in billions over time?",
    "encoded_fields": [
      {
        "field": [
          "Date",
          "Year"
        ],
        "type": "quantitative",
        "nl_ref_type": "ambiguous",
        "nl_ref_phrase": "over time"
      },
      {
        "field": "Totals(Bn)",
        "type": "quantitative",
        "nl_ref_type": "explicit",
        "nl_ref_phrase": "purchases in billions"
      }
    ],
    "constraints": [
      {
        "c_type": "transform",
        "c_name": "aggregate",
        "c_list": [
          {
            "field": "Totals(Bn)",
            "aggregate": "sum"
          }
        ],
        "nl_ref_type": "explicit",
        "nl_ref_phrase": "total sum"
      }
    ]
  },
  "input": "Dataset Information: {\n  \"data samples\": [\n    {\n      \"Date\": \"08/31/2022\",\n      \"GRA Purchases\": 93769635059.0,\n      \"PRGT 1/2/\": 15254184552.0,\n      \"Totals\": 109000000000.0,\n      \"Year\": 2022.0,\n      \"Totals(Bn)\": 109.0238196,\n      \"World GDP\": NaN,\n      \"World GDP(Bn)\": NaN,\n      \"Totals/WGDP\": NaN,\n      \"Totals%\": NaN\n    },\n    {\n      \"Date\": \"12/31/2013\",\n      \"GRA Purchases\": 83899249061.0,\n      \"PRGT 1/2/\": 6174392682.0,\n      \"Totals\": 90073641743.0,\n      \"Year\": 2013.0,\n      \"Totals(Bn)\": 90.07364174,\n      \"World GDP\": 77600000000000.0,\n      \"World GDP(Bn)\": 77600.0,\n      \"Totals/WGDP\": 0.0,\n      \"Totals%\": 0.116074281\n    },\n    {\n      \"Date\": \"12/31/2014\",\n      \"GRA Purchases\": 69041563463.0,\n      \"PRGT 1/2/\": 6292755583.0,\n      \"Totals\": 75334319046.0,\n      \"Year\": 2014.0,\n      \"Totals(Bn)\": 75.33431905,\n      \"World GDP\": 79700000000000.0,\n      \"World GDP(Bn)\": 79700.0,\n      \"Totals/WGDP\": 0.0,\n      \"Totals%\": 0.094522358\n    },\n    {\n      \"Date\": \"12/31/2018\",\n      \"GRA Purchases\": 55395611392.0,\n      \"PRGT 1/2/\": 6426181029.0,\n      \"Totals\": 61821792421.0,\n      \"Year\": 2018.0,\n      \"Totals(Bn)\": 61.82179242,\n      \"World GDP\": 86400000000000.0,\n      \"World GDP(Bn)\": 86400.0,\n      \"Totals/WGDP\": 0.0,\n      \"Totals%\": 0.071553\n    },\n    {\n      \"Date\": \"12/31/2002\",\n      \"GRA Purchases\": 63601058794.0,\n      \"PRGT 1/2/\": 6868671012.0,\n      \"Totals\": 70469729806.0,\n      \"Year\": 2002.0,\n      \"Totals(Bn)\": 70.46972981,\n      \"World GDP\": 34900000000000.0,\n      \"World GDP(Bn)\": 34900.0,\n      \"Totals/WGDP\": 0.0,\n      \"Totals%\": 0.201918997\n    }\n  ],\n  \"column names\": [\n    \"Date\",\n    \"GRA Purchases\",\n    \"PRGT 1/2/\",\n    \"Totals\",\n    \"Year\",\n    \"Totals(Bn)\",\n    \"World GDP\",\n    \"World GDP(Bn)\",\n    \"Totals/WGDP\",\n    \"Totals%\"\n  ]\n}\n\nYour Job:\nI am developing a NL to Data Visualization Dataset. \nPlease help me generate natural language utterance for given dataset and constraints.\nDefinition about the Taks:\n- 'utterance' is what a user would say to make a chart. It should be a questions structure. One NL 'utterance' is in one or two sentences. Here are two examples from Questions for reference:\n    On average, how much was earned by movies of each genre?\n    How many cars do each country manufacture?\n- 'given dataset' is in form of column names, column type, range/unique values of the column.\n- 'constraints' are information about the chart that should be included in the utterance. \n    So we can find a reference phrase in the NL utterance that corresponds to the given constraints. \n- 'reference phrase' can be explicit, ambiguous, and by_value. 'ambiguous' means the phrase can map to more than one columns in the dataset, always a hypernym of column names(depending on the dataset values).\n    For example:\n    {\"column\": \"gdpPercap\", \"nl_ref_type\": \"explicit\", \"nl_ref_phrase\": \"GDP per capita\"},\n    {\"column\": [\"country\",\"continent\"], \"nl_ref_type\": \"ambiguous\", \"nl_ref_phrase\": \"region\"}\n    {\"column\": [\"country\",\"country_short_name\"], \"nl_ref_type\": \"ambiguous\", \"nl_ref_phrase\": \"countries\"}\n    {\"c_type\": \"mark\", \"c_name\": \"point chart\", \"nl_ref_type\": \"explicit\", \"nl_ref_phrase\": \"scatter plot\"}\n    {\"c_type\": \"mark\", \"c_name\": \"arc chart\", \"nl_ref_type\": \"explicit\", \"nl_ref_phrase\": \"pie chart\"}\n    {\"c_type\": \"transform\",\"c_name\": \"filter\",\"c_list\": [{\"field\": \"country\",\"oneOf\": [\"Iceland\",\"Norway\"]}],\"nl_ref_type\": \"explicit\",\"nl_ref_phrase\": \"for countries Iceland and Norway\"},\n    {\"c_type\": \"transform\",\"c_name\": \"filter\",\"c_list\": [{\"field\": \"country\",\"oneOf\": [\"Iceland\",\"Norway\"]}],\"nl_ref_type\": \"by_value\",\"nl_ref_phrase\": \"for Iceland and Norway\"},\n- the 'nl_ref_phrase' for 'ambiguous' columns should be equally near all ambiguous columns, not too near to one of the column since it would not be ambiguous.\n    good example: {\"column\": [\"country\",\"region\"], \"nl_ref_type\": \"ambiguous\", \"nl_ref_phrase\": \"location\"}\n    bad example: {\"column\": [\"country\",\"region\"], \"nl_ref_type\": \"ambiguous\", \"nl_ref_phrase\": \"region\"}\n- You only include given constraints and no other information. \n    For example, if a column name is not in the given constraint, it will not be included in the NL utterance.\n    Also, it a chart mark or chart encoding channel is not in the given constraint, it will not be included in the NL utterance.\n- all 'nl_ref_phrase' shoule be included in the 'nl_utterance'. \n\nThe output format is identical to the input format, but fill in the str blanks(\"...\").\n### Input:\n{\n  \"nl_utterance\": \"...\",\n  \"encoded_fields\": [\n    {\n      \"field\": [\n        \"Date\",\n        \"Year\"\n      ],\n      \"type\": \"quantitative\",\n      \"nl_ref_type\": \"ambiguous\",\n      \"nl_ref_phrase\": \"...\"\n    },\n    {\n      \"field\": \"Totals(Bn)\",\n      \"type\": \"quantitative\",\n      \"nl_ref_type\": \"explicit\",\n      \"nl_ref_phrase\": \"...\"\n    }\n  ],\n  \"constraints\": [\n    {\n      \"c_type\": \"transform\",\n      \"c_name\": \"aggregate\",\n      \"c_list\": [\n        {\n          \"field\": \"Totals(Bn)\",\n          \"aggregate\": \"sum\"\n        }\n      ],\n      \"nl_ref_type\": \"explicit\",\n      \"nl_ref_phrase\": \"...\"\n    }\n  ]\n}\n\n### Output:"
}