{
  "gpt_result": {
    "nl_utterance": "Please create a line chart for the sum of GDP per capita by year and filter it for the countries Iceland and Norway, for the years 1952 and 2017.",
    "encoded_fields": [
      {
        "field": "year",
        "type": "quantitative",
        "nl_ref_type": "explicit",
        "nl_ref_phrase": "year"
      },
      {
        "field": "gdpPercap",
        "type": "quantitative",
        "nl_ref_type": "explicit",
        "nl_ref_phrase": "GDP per capita"
      },
      {
        "field": "country",
        "type": "nominal",
        "nl_ref_type": "explicit",
        "nl_ref_phrase": "countries"
      }
    ],
    "constraints": [
      {
        "c_type": "mark",
        "c_name": "line chart",
        "c_list": [
          {
            "mark": "line",
            "encoding": {
              "x": {},
              "y": {
                "type": "quantitative"
              },
              "color": {
                "ignore": true,
                "type": "nominal"
              },
              "column": {
                "ignore": true,
                "type": "nominal"
              },
              "row": {
                "ignore": true,
                "type": "nominal"
              }
            },
            "unique_map": {
              "x": "y"
            }
          }
        ],
        "nl_ref_type": "explicit",
        "nl_ref_phrase": "line chart"
      },
      {
        "c_type": "transform",
        "c_name": "filter",
        "c_list": [
          {
            "field": "country",
            "oneOf": [
              "Iceland",
              "Norway"
            ]
          }
        ],
        "nl_ref_type": "explicit",
        "nl_ref_phrase": "for the countries Iceland and Norway"
      },
      {
        "c_type": "transform",
        "c_name": "filter",
        "c_list": [
          {
            "field": "year",
            "oneOf": [
              "1952",
              "2017"
            ]
          }
        ],
        "nl_ref_type": "explicit",
        "nl_ref_phrase": "for the years 1952 and 2017"
      },
      {
        "c_type": "transform",
        "c_name": "aggregate",
        "c_list": [
          {
            "field": "gdpPercap",
            "aggregate": "sum"
          }
        ],
        "nl_ref_type": "explicit",
        "nl_ref_phrase": "sum of GDP per capita"
      }
    ]
  },
  "input": "Dataset Information: {\n  \"data samples\": [\n    {\n      \"country\": \"Afghanistan\",\n      \"region\": \"Asia\",\n      \"country_code\": \"AFG\",\n      \"year\": 1952,\n      \"lifeExp\": 33.0,\n      \"gdpPercap\": 1070,\n      \"pop\": 7930000\n    },\n    {\n      \"country\": \"Cote d'Ivoire\",\n      \"region\": \"Africa\",\n      \"country_code\": \"CIV\",\n      \"year\": 1987,\n      \"lifeExp\": 56.1,\n      \"gdpPercap\": 3160,\n      \"pop\": 11000000\n    },\n    {\n      \"country\": \"Nepal\",\n      \"region\": \"Asia\",\n      \"country_code\": \"NPL\",\n      \"year\": 1967,\n      \"lifeExp\": 47.4,\n      \"gdpPercap\": 998,\n      \"pop\": 11300000\n    },\n    {\n      \"country\": \"Guinea\",\n      \"region\": \"Africa\",\n      \"country_code\": \"GIN\",\n      \"year\": 2007,\n      \"lifeExp\": 56.7,\n      \"gdpPercap\": 1200,\n      \"pop\": 10100000\n    },\n    {\n      \"country\": \"Qatar\",\n      \"region\": \"Asia\",\n      \"country_code\": \"QAT\",\n      \"year\": 1987,\n      \"lifeExp\": 74.0,\n      \"gdpPercap\": 68700,\n      \"pop\": 422000\n    }\n  ],\n  \"column names\": [\n    \"country\",\n    \"region\",\n    \"country_code\",\n    \"year\",\n    \"lifeExp\",\n    \"gdpPercap\",\n    \"pop\"\n  ]\n}\n\nYour Job:\nI am developing a NL to Data Visualization Dataset. \nPlease help me generate natural language utterance for given dataset and constraints.\nDefinition about the Taks:\n- 'utterance' is what a user would say to make a chart. It should be a commands structure. One NL 'utterance' is in one or two sentences. Here are two examples from Commands for reference:\n    Please show me a histogram of weights with 500 intervals.\n    Sort creative types by number of movies.\n- 'given dataset' is in form of column names, column type, range/unique values of the column.\n- 'constraints' are information about the chart that should be included in the utterance. \n    So we can find a reference phrase in the NL utterance that corresponds to the given constraints. \n- 'reference phrase' can be explicit, ambiguous, and by_value. 'ambiguous' means the phrase can map to more than one columns in the dataset, always a hypernym of column names(depending on the dataset values).\n    For example:\n    {\"column\": \"gdpPercap\", \"nl_ref_type\": \"explicit\", \"nl_ref_phrase\": \"GDP per capita\"},\n    {\"column\": [\"country\",\"continent\"], \"nl_ref_type\": \"ambiguous\", \"nl_ref_phrase\": \"region\"}\n    {\"column\": [\"country\",\"country_short_name\"], \"nl_ref_type\": \"ambiguous\", \"nl_ref_phrase\": \"countries\"}\n    {\"c_type\": \"mark\", \"c_name\": \"point chart\", \"nl_ref_type\": \"explicit\", \"nl_ref_phrase\": \"scatter plot\"}\n    {\"c_type\": \"mark\", \"c_name\": \"arc chart\", \"nl_ref_type\": \"explicit\", \"nl_ref_phrase\": \"pie chart\"}\n    {\"c_type\": \"transform\",\"c_name\": \"filter\",\"c_list\": [{\"field\": \"country\",\"oneOf\": [\"Iceland\",\"Norway\"]}],\"nl_ref_type\": \"explicit\",\"nl_ref_phrase\": \"for countries Iceland and Norway\"},\n    {\"c_type\": \"transform\",\"c_name\": \"filter\",\"c_list\": [{\"field\": \"country\",\"oneOf\": [\"Iceland\",\"Norway\"]}],\"nl_ref_type\": \"by_value\",\"nl_ref_phrase\": \"for Iceland and Norway\"},\n- the 'nl_ref_phrase' for 'ambiguous' columns should be equally near all ambiguous columns, not too near to one of the column since it would not be ambiguous.\n    good example: {\"column\": [\"country\",\"region\"], \"nl_ref_type\": \"ambiguous\", \"nl_ref_phrase\": \"location\"}\n    bad example: {\"column\": [\"country\",\"region\"], \"nl_ref_type\": \"ambiguous\", \"nl_ref_phrase\": \"region\"}\n- You only include given constraints and no other information. \n    For example, if a column name is not in the given constraint, it will not be included in the NL utterance.\n    Also, it a chart mark or chart encoding channel is not in the given constraint, it will not be included in the NL utterance.\n- all 'nl_ref_phrase' shoule be included in the 'nl_utterance'. \n\nThe output format is identical to the input format, but fill in the str blanks(\"...\").\n### Input:\n{\n  \"nl_utterance\": \"...\",\n  \"encoded_fields\": [\n    {\n      \"field\": \"year\",\n      \"type\": \"quantitative\",\n      \"nl_ref_type\": \"explicit\",\n      \"nl_ref_phrase\": \"...\"\n    },\n    {\n      \"field\": \"gdpPercap\",\n      \"type\": \"quantitative\",\n      \"nl_ref_type\": \"explicit\",\n      \"nl_ref_phrase\": \"...\"\n    },\n    {\n      \"field\": \"country\",\n      \"type\": \"nominal\",\n      \"nl_ref_type\": \"explicit\",\n      \"nl_ref_phrase\": \"...\"\n    }\n  ],\n  \"constraints\": [\n    {\n      \"c_type\": \"mark\",\n      \"c_name\": \"line chart\",\n      \"c_list\": [\n        {\n          \"mark\": \"line\",\n          \"encoding\": {\n            \"x\": {},\n            \"y\": {\n              \"type\": \"quantitative\"\n            },\n            \"color\": {\n              \"ignore\": true,\n              \"type\": \"nominal\"\n            },\n            \"column\": {\n              \"ignore\": true,\n              \"type\": \"nominal\"\n            },\n            \"row\": {\n              \"ignore\": true,\n              \"type\": \"nominal\"\n            }\n          },\n          \"unique_map\": {\n            \"x\": \"y\"\n          }\n        }\n      ],\n      \"nl_ref_type\": \"explicit\",\n      \"nl_ref_phrase\": \"...\"\n    },\n    {\n      \"c_type\": \"transform\",\n      \"c_name\": \"filter\",\n      \"c_list\": [\n        {\n          \"field\": \"country\",\n          \"oneOf\": [\n            \"Iceland\",\n            \"Norway\"\n          ]\n        }\n      ],\n      \"nl_ref_type\": \"explicit\",\n      \"nl_ref_phrase\": \"...\"\n    },\n    {\n      \"c_type\": \"transform\",\n      \"c_name\": \"filter\",\n      \"c_list\": [\n        {\n          \"field\": \"year\",\n          \"oneOf\": [\n            \"1952\",\n            \"2017\"\n          ]\n        }\n      ],\n      \"nl_ref_type\": \"explicit\",\n      \"nl_ref_phrase\": \"...\"\n    },\n    {\n      \"c_type\": \"transform\",\n      \"c_name\": \"aggregate\",\n      \"c_list\": [\n        {\n          \"field\": \"gdpPercap\",\n          \"aggregate\": \"sum\"\n        }\n      ],\n      \"nl_ref_type\": \"explicit\",\n      \"nl_ref_phrase\": \"...\"\n    }\n  ]\n}\n\n### Output:"
}