{
  "gpt_result": {
    "nl_utterance": "Show the distribution of Annual Salary using a bar or boxplot chart and count the values.",
    "encoded_fields": [
      {
        "field": "Annual Salary",
        "type": "quantitative",
        "nl_ref_type": "explicit",
        "nl_ref_phrase": "Annual Salary"
      }
    ],
    "constraints": [
      {
        "c_type": "task",
        "c_name": "distribution",
        "c_list": [
          {
            "mark": "bar",
            "encoding": {
              "y": {
                "aggregate": "count",
                "type": "quantitative"
              }
            },
            "x_y_reversable": true
          },
          {
            "mark": "boxplot",
            "encoding": {
              "x": {
                "type": "quantitative"
              }
            },
            "x_y_reversable": true
          }
        ],
        "nl_ref_type": "explicit",
        "nl_ref_phrase": "distribution of"
      },
      {
        "c_type": "transform",
        "c_name": "aggregate",
        "c_list": [
          {
            "aggregate": "count"
          }
        ],
        "nl_ref_type": "explicit",
        "nl_ref_phrase": "count the values"
      }
    ]
  },
  "input": "Dataset Information: {\n  \"data samples\": [\n    {\n      \"Name\": \"ADELMAN, BRUCE E\",\n      \"Job Titles\": \"LEGISLATIVE AIDE\",\n      \"Department\": \"CITY COUNCIL\",\n      \"Full or Part-Time\": \"F\",\n      \"Salary or Hourly\": \"SALARY\",\n      \"Typical Hours\": NaN,\n      \"Annual Salary\": 22248.0,\n      \"Hourly Rate\": NaN,\n      \"Rank\": 1,\n      \"share\": 9e-06,\n      \"cumShareIncome\": 9e-06,\n      \"cumSharePeople\": 4.124e-05,\n      \"shortName\": \"0\"\n    },\n    {\n      \"Name\": \"ROJAS, GUILLERMO F\",\n      \"Job Titles\": \"FIREFIGHTER-EMT\",\n      \"Department\": \"FIRE DEPARTMENT\",\n      \"Full or Part-Time\": \"F\",\n      \"Salary or Hourly\": \"SALARY\",\n      \"Typical Hours\": NaN,\n      \"Annual Salary\": 105936.0,\n      \"Hourly Rate\": NaN,\n      \"Rank\": 15323,\n      \"share\": 4.4e-05,\n      \"cumShareIncome\": 0.546778,\n      \"cumSharePeople\": 0.63195447,\n      \"shortName\": \"Fire\"\n    },\n    {\n      \"Name\": \"MITCHELL, JENNIFER S\",\n      \"Job Titles\": \"MANAGER OF SECURITY COMMUNICATIONS CENTER\",\n      \"Department\": \"DEPARTMENT OF AVIATION\",\n      \"Full or Part-Time\": \"F\",\n      \"Salary or Hourly\": \"SALARY\",\n      \"Typical Hours\": NaN,\n      \"Annual Salary\": 108864.0,\n      \"Hourly Rate\": NaN,\n      \"Rank\": 17018,\n      \"share\": 4.5e-05,\n      \"cumShareIncome\": 0.622867,\n      \"cumSharePeople\": 0.70186002,\n      \"shortName\": \"Aviation\"\n    },\n    {\n      \"Name\": \"RANNOCHIO, STEVEN J\",\n      \"Job Titles\": \"FIRE ENGINEER\",\n      \"Department\": \"FIRE DEPARTMENT\",\n      \"Full or Part-Time\": \"F\",\n      \"Salary or Hourly\": \"SALARY\",\n      \"Typical Hours\": NaN,\n      \"Annual Salary\": 112020.0,\n      \"Hourly Rate\": NaN,\n      \"Rank\": 18541,\n      \"share\": 4.6e-05,\n      \"cumShareIncome\": 0.693013,\n      \"cumSharePeople\": 0.76467192,\n      \"shortName\": \"Fire\"\n    },\n    {\n      \"Name\": \"SANCHEZ, LAWRENCE P\",\n      \"Job Titles\": \"FIREFIGHTER-EMT\",\n      \"Department\": \"FIRE DEPARTMENT\",\n      \"Full or Part-Time\": \"F\",\n      \"Salary or Hourly\": \"SALARY\",\n      \"Typical Hours\": NaN,\n      \"Annual Salary\": 98904.0,\n      \"Hourly Rate\": NaN,\n      \"Rank\": 11473,\n      \"share\": 4.1e-05,\n      \"cumShareIncome\": 0.382764,\n      \"cumSharePeople\": 0.47317194,\n      \"shortName\": \"Fire\"\n    }\n  ],\n  \"column names\": [\n    \"Name\",\n    \"Job Titles\",\n    \"Department\",\n    \"Full or Part-Time\",\n    \"Salary or Hourly\",\n    \"Typical Hours\",\n    \"Annual Salary\",\n    \"Hourly Rate\",\n    \"Rank\",\n    \"share\",\n    \"cumShareIncome\",\n    \"cumSharePeople\",\n    \"shortName\"\n  ]\n}\n\nYour Job:\nI am developing a NL to Data Visualization Dataset. \nPlease help me generate natural language utterance for given dataset and constraints.\nDefinition about the Taks:\n- 'utterance' is what a user would say to make a chart. It should be a queries structure. One NL 'utterance' is in one or two sentences. Here are two examples from Queries for reference:\n    Line Graph of SUM (Sales Forecast) vs Order Date.\n    Group cars by countries and cylinders.\n- 'given dataset' is in form of column names, column type, range/unique values of the column.\n- 'constraints' are information about the chart that should be included in the utterance. \n    So we can find a reference phrase in the NL utterance that corresponds to the given constraints. \n- 'reference phrase' can be explicit, ambiguous, and by_value. 'ambiguous' means the phrase can map to more than one columns in the dataset, always a hypernym of column names(depending on the dataset values).\n    For example:\n    {\"column\": \"gdpPercap\", \"nl_ref_type\": \"explicit\", \"nl_ref_phrase\": \"GDP per capita\"},\n    {\"column\": [\"country\",\"continent\"], \"nl_ref_type\": \"ambiguous\", \"nl_ref_phrase\": \"region\"}\n    {\"column\": [\"country\",\"country_short_name\"], \"nl_ref_type\": \"ambiguous\", \"nl_ref_phrase\": \"countries\"}\n    {\"c_type\": \"mark\", \"c_name\": \"point chart\", \"nl_ref_type\": \"explicit\", \"nl_ref_phrase\": \"scatter plot\"}\n    {\"c_type\": \"mark\", \"c_name\": \"arc chart\", \"nl_ref_type\": \"explicit\", \"nl_ref_phrase\": \"pie chart\"}\n    {\"c_type\": \"transform\",\"c_name\": \"filter\",\"c_list\": [{\"field\": \"country\",\"oneOf\": [\"Iceland\",\"Norway\"]}],\"nl_ref_type\": \"explicit\",\"nl_ref_phrase\": \"for countries Iceland and Norway\"},\n    {\"c_type\": \"transform\",\"c_name\": \"filter\",\"c_list\": [{\"field\": \"country\",\"oneOf\": [\"Iceland\",\"Norway\"]}],\"nl_ref_type\": \"by_value\",\"nl_ref_phrase\": \"for Iceland and Norway\"},\n- the 'nl_ref_phrase' for 'ambiguous' columns should be equally near all ambiguous columns, not too near to one of the column since it would not be ambiguous.\n    good example: {\"column\": [\"country\",\"region\"], \"nl_ref_type\": \"ambiguous\", \"nl_ref_phrase\": \"location\"}\n    bad example: {\"column\": [\"country\",\"region\"], \"nl_ref_type\": \"ambiguous\", \"nl_ref_phrase\": \"region\"}\n- You only include given constraints and no other information. \n    For example, if a column name is not in the given constraint, it will not be included in the NL utterance.\n    Also, it a chart mark or chart encoding channel is not in the given constraint, it will not be included in the NL utterance.\n- all 'nl_ref_phrase' shoule be included in the 'nl_utterance'. \n\nThe output format is identical to the input format, but fill in the str blanks(\"...\").\n### Input:\n{\n  \"nl_utterance\": \"...\",\n  \"encoded_fields\": [\n    {\n      \"field\": \"Annual Salary\",\n      \"type\": \"quantitative\",\n      \"nl_ref_type\": \"explicit\",\n      \"nl_ref_phrase\": \"...\"\n    }\n  ],\n  \"constraints\": [\n    {\n      \"c_type\": \"task\",\n      \"c_name\": \"distribution\",\n      \"c_list\": [\n        {\n          \"mark\": \"bar\",\n          \"encoding\": {\n            \"y\": {\n              \"aggregate\": \"count\",\n              \"type\": \"quantitative\"\n            }\n          },\n          \"x_y_reversable\": true\n        },\n        {\n          \"mark\": \"boxplot\",\n          \"encoding\": {\n            \"x\": {\n              \"type\": \"quantitative\"\n            }\n          },\n          \"x_y_reversable\": true\n        }\n      ],\n      \"nl_ref_type\": \"explicit\",\n      \"nl_ref_phrase\": \"...\"\n    },\n    {\n      \"c_type\": \"transform\",\n      \"c_name\": \"aggregate\",\n      \"c_list\": [\n        {\n          \"aggregate\": \"count\"\n        }\n      ],\n      \"nl_ref_type\": \"explicit\",\n      \"nl_ref_phrase\": \"...\"\n    }\n  ]\n}\n\n### Output:"
}