{
  "gpt_result": {
    "nl_utterance": "Show the GDP per capita and Human Capital Index by continent or region, focusing on populations where the Human Capital Index is above 0 and GDP per capita is greater than 1000.",
    "encoded_fields": [
      {
        "field": "GDP per capita (PPP)",
        "type": "quantitative",
        "nl_ref_type": "explicit",
        "nl_ref_phrase": "GDP per capita"
      },
      {
        "field": "Human Capital Index",
        "type": "quantitative",
        "nl_ref_type": "explicit",
        "nl_ref_phrase": "Human Capital Index"
      },
      {
        "field": [
          "Continent",
          "Region"
        ],
        "type": "nominal",
        "nl_ref_type": "ambiguous",
        "nl_ref_phrase": "continent or region"
      },
      {
        "field": "Population",
        "type": "quantitative",
        "nl_ref_type": "explicit",
        "nl_ref_phrase": "populations"
      }
    ],
    "constraints": [
      {
        "c_type": "transform",
        "c_name": "filter",
        "c_list": [
          {
            "field": "Human Capital Index",
            "gt": 0
          }
        ],
        "nl_ref_type": "by_value",
        "nl_ref_phrase": "where the Human Capital Index is above 0"
      },
      {
        "c_type": "transform",
        "c_name": "filter",
        "c_list": [
          {
            "field": "GDP per capita (PPP)",
            "gt": 1000
          }
        ],
        "nl_ref_type": "by_value",
        "nl_ref_phrase": "GDP per capita is greater than 1000"
      }
    ]
  },
  "input": "Dataset Information: {\n  \"data samples\": [\n    {\n      \"Country\": \"Afghanistan\",\n      \"ISO3\": \"AFG\",\n      \"Region\": \"South Asia\",\n      \"Income Group\": \"Low income\",\n      \"Probability of Survival to Age 5\": 0.93425,\n      \"Expected Years of School\": 9.65539,\n      \"Harmonized Test Scores\": 357.79474,\n      \"Learning-Adjusted Years of School\": 5.52743,\n      \"Fraction of Children Under 5 Not Stunted\": 0.61741,\n      \"Adult Survival Rate\": 0.76612,\n      \"Human Capital Index\": 0.41128,\n      \"GDP per capita (PPP)\": 2076.13838,\n      \"Log GDP per capita\": 7.638264899097053,\n      \"Population\": 38972230.0,\n      \"Continent\": \"Asia\"\n    },\n    {\n      \"Country\": \"Congo, Rep.\",\n      \"ISO3\": \"COG\",\n      \"Region\": \"Sub-Saharan Africa\",\n      \"Income Group\": \"Lower middle income\",\n      \"Probability of Survival to Age 5\": 0.94576,\n      \"Expected Years of School\": 8.71702,\n      \"Harmonized Test Scores\": 371.77655,\n      \"Learning-Adjusted Years of School\": 5.18525,\n      \"Fraction of Children Under 5 Not Stunted\": 0.7762,\n      \"Adult Survival Rate\": 0.72302,\n      \"Human Capital Index\": 0.41059,\n      \"GDP per capita (PPP)\": 3570.016965,\n      \"Log GDP per capita\": 8.180325626863233,\n      \"Population\": 5702174.0,\n      \"Continent\": \"Africa\"\n    },\n    {\n      \"Country\": \"Ethiopia\",\n      \"ISO3\": \"ETH\",\n      \"Region\": \"Sub-Saharan Africa\",\n      \"Income Group\": \"Low income\",\n      \"Probability of Survival to Age 5\": 0.9389,\n      \"Expected Years of School\": 8.09005,\n      \"Harmonized Test Scores\": 351.82593,\n      \"Learning-Adjusted Years of School\": 4.55406,\n      \"Fraction of Children Under 5 Not Stunted\": 0.6031,\n      \"Adult Survival Rate\": 0.76683,\n      \"Human Capital Index\": 0.3815,\n      \"GDP per capita (PPP)\": 2376.635601,\n      \"Log GDP per capita\": 7.77344115354681,\n      \"Population\": 117190911.0,\n      \"Continent\": \"Africa\"\n    },\n    {\n      \"Country\": \"Albania\",\n      \"ISO3\": \"ALB\",\n      \"Region\": \"Europe & Central Asia\",\n      \"Income Group\": \"Upper middle income\",\n      \"Probability of Survival to Age 5\": 0.99058,\n      \"Expected Years of School\": 12.55878,\n      \"Harmonized Test Scores\": 424.34464,\n      \"Learning-Adjusted Years of School\": 8.5268,\n      \"Fraction of Children Under 5 Not Stunted\": 0.88368,\n      \"Adult Survival Rate\": 0.90782,\n      \"Human Capital Index\": 0.608,\n      \"GDP per capita (PPP)\": 13759.54243,\n      \"Log GDP per capita\": 9.5294878573007,\n      \"Population\": 2837849.0,\n      \"Continent\": \"Europe\"\n    },\n    {\n      \"Country\": \"Portugal\",\n      \"ISO3\": \"PRT\",\n      \"Region\": \"Europe & Central Asia\",\n      \"Income Group\": \"High income\",\n      \"Probability of Survival to Age 5\": 0.99589,\n      \"Expected Years of School\": 13.97014,\n      \"Harmonized Test Scores\": 506.96417,\n      \"Learning-Adjusted Years of School\": 11.33178,\n      \"Fraction of Children Under 5 Not Stunted\": NaN,\n      \"Adult Survival Rate\": 0.90456,\n      \"Human Capital Index\": 0.75587,\n      \"GDP per capita (PPP)\": 34177.08571,\n      \"Log GDP per capita\": 10.439310690015176,\n      \"Population\": 10297081.0,\n      \"Continent\": \"Europe\"\n    }\n  ],\n  \"column names\": [\n    \"Country\",\n    \"ISO3\",\n    \"Region\",\n    \"Income Group\",\n    \"Probability of Survival to Age 5\",\n    \"Expected Years of School\",\n    \"Harmonized Test Scores\",\n    \"Learning-Adjusted Years of School\",\n    \"Fraction of Children Under 5 Not Stunted\",\n    \"Adult Survival Rate\",\n    \"Human Capital Index\",\n    \"GDP per capita (PPP)\",\n    \"Log GDP per capita\",\n    \"Population\",\n    \"Continent\"\n  ]\n}\n\nYour Job:\nI am developing a NL to Data Visualization Dataset. \nPlease help me generate natural language utterance for given dataset and constraints.\nDefinition about the Taks:\n- 'utterance' is what a user would say to make a chart. It should be a queries structure. One NL 'utterance' is in one or two sentences. Here are two examples from Queries for reference:\n    Total gross by genre and year.\n    Coloring by Orign, Plot Displacement by MPG.\n- 'given dataset' is in form of column names, column type, range/unique values of the column.\n- 'constraints' are information about the chart that should be included in the utterance. \n    So we can find a reference phrase in the NL utterance that corresponds to the given constraints. \n- 'reference phrase' can be explicit, ambiguous, and by_value. 'ambiguous' means the phrase can map to more than one columns in the dataset, always a hypernym of column names(depending on the dataset values).\n    For example:\n    {\"column\": \"gdpPercap\", \"nl_ref_type\": \"explicit\", \"nl_ref_phrase\": \"GDP per capita\"},\n    {\"column\": [\"country\",\"continent\"], \"nl_ref_type\": \"ambiguous\", \"nl_ref_phrase\": \"region\"}\n    {\"column\": [\"country\",\"country_short_name\"], \"nl_ref_type\": \"ambiguous\", \"nl_ref_phrase\": \"countries\"}\n    {\"c_type\": \"mark\", \"c_name\": \"point chart\", \"nl_ref_type\": \"explicit\", \"nl_ref_phrase\": \"scatter plot\"}\n    {\"c_type\": \"mark\", \"c_name\": \"arc chart\", \"nl_ref_type\": \"explicit\", \"nl_ref_phrase\": \"pie chart\"}\n    {\"c_type\": \"transform\",\"c_name\": \"filter\",\"c_list\": [{\"field\": \"country\",\"oneOf\": [\"Iceland\",\"Norway\"]}],\"nl_ref_type\": \"explicit\",\"nl_ref_phrase\": \"for countries Iceland and Norway\"},\n    {\"c_type\": \"transform\",\"c_name\": \"filter\",\"c_list\": [{\"field\": \"country\",\"oneOf\": [\"Iceland\",\"Norway\"]}],\"nl_ref_type\": \"by_value\",\"nl_ref_phrase\": \"for Iceland and Norway\"},\n- the 'nl_ref_phrase' for 'ambiguous' columns should be equally near all ambiguous columns, not too near to one of the column since it would not be ambiguous.\n    good example: {\"column\": [\"country\",\"region\"], \"nl_ref_type\": \"ambiguous\", \"nl_ref_phrase\": \"location\"}\n    bad example: {\"column\": [\"country\",\"region\"], \"nl_ref_type\": \"ambiguous\", \"nl_ref_phrase\": \"region\"}\n- You only include given constraints and no other information. \n    For example, if a column name is not in the given constraint, it will not be included in the NL utterance.\n    Also, it a chart mark or chart encoding channel is not in the given constraint, it will not be included in the NL utterance.\n- all 'nl_ref_phrase' shoule be included in the 'nl_utterance'. \n\nThe output format is identical to the input format, but fill in the str blanks(\"...\").\n### Input:\n{\n  \"nl_utterance\": \"...\",\n  \"encoded_fields\": [\n    {\n      \"field\": \"GDP per capita (PPP)\",\n      \"type\": \"quantitative\",\n      \"nl_ref_type\": \"explicit\",\n      \"nl_ref_phrase\": \"...\"\n    },\n    {\n      \"field\": \"Human Capital Index\",\n      \"type\": \"quantitative\",\n      \"nl_ref_type\": \"explicit\",\n      \"nl_ref_phrase\": \"...\"\n    },\n    {\n      \"field\": [\n        \"Continent\",\n        \"Region\"\n      ],\n      \"type\": \"nominal\",\n      \"nl_ref_type\": \"ambiguous\",\n      \"nl_ref_phrase\": \"...\"\n    },\n    {\n      \"field\": \"Population\",\n      \"type\": \"quantitative\",\n      \"nl_ref_type\": \"explicit\",\n      \"nl_ref_phrase\": \"...\"\n    }\n  ],\n  \"constraints\": [\n    {\n      \"c_type\": \"transform\",\n      \"c_name\": \"filter\",\n      \"c_list\": [\n        {\n          \"field\": \"Human Capital Index\",\n          \"gt\": 0\n        }\n      ],\n      \"nl_ref_type\": \"by_value\",\n      \"nl_ref_phrase\": \"...\"\n    },\n    {\n      \"c_type\": \"transform\",\n      \"c_name\": \"filter\",\n      \"c_list\": [\n        {\n          \"field\": \"GDP per capita (PPP)\",\n          \"gt\": 1000\n        }\n      ],\n      \"nl_ref_type\": \"by_value\",\n      \"nl_ref_phrase\": \"...\"\n    }\n  ]\n}\n\n### Output:"
}