{
  "gpt_result": {
    "nl_utterance": "Show a chart of the values for the private and government sectors with short names, filtering for numbers 3 through 18, and sort the data in ascending order by number.",
    "encoded_fields": [
      {
        "field": "Value",
        "type": "quantitative",
        "nl_ref_type": "explicit",
        "nl_ref_phrase": "values"
      },
      {
        "field": "shortName",
        "type": "nominal",
        "nl_ref_type": "explicit",
        "nl_ref_phrase": "short names"
      },
      {
        "field": "privatePublic",
        "type": "nominal",
        "nl_ref_type": "explicit",
        "nl_ref_phrase": "private and government sectors"
      }
    ],
    "constraints": [
      {
        "c_type": "transform",
        "c_name": "filter",
        "c_list": [
          {
            "field": "Number",
            "oneOf": [
              3,
              4,
              5,
              6,
              7,
              8,
              9,
              10,
              11,
              12,
              13,
              14,
              15,
              17,
              18
            ]
          }
        ],
        "nl_ref_type": "by_value",
        "nl_ref_phrase": "filtering for numbers 3 through 18"
      },
      {
        "c_type": "transform",
        "c_name": "sort",
        "c_list": [
          {
            "field": "Number",
            "order": "ascending"
          }
        ],
        "nl_ref_type": "explicit",
        "nl_ref_phrase": "sort the data in ascending order by number"
      },
      {
        "c_type": "transform",
        "c_name": "sort",
        "c_list": [
          {
            "field": "Number",
            "order": "ascending"
          }
        ],
        "nl_ref_type": "explicit",
        "nl_ref_phrase": "sort the data in ascending order by number"
      }
    ]
  },
  "input": "Dataset Information: {\n  \"data samples\": [\n    {\n      \"Line\": 1,\n      \"Number\": 1,\n      \"Item\": \"Gross domestic product\",\n      \"shortName\": \"GDP\",\n      \"Value\": 25723.9,\n      \"privatePublic\": \"Private\",\n      \"Source\": \"U.S. Bureau of Economic Analysis, \\\"Value Added by Industry\\\" (accessed Monday, January 23, 2023).\"\n    },\n    {\n      \"Line\": 12,\n      \"Number\": 7,\n      \"Item\": \"Manufacturing\",\n      \"shortName\": \"Manufacturing\",\n      \"Value\": 2808.9,\n      \"privatePublic\": \"Private\",\n      \"Source\": NaN\n    },\n    {\n      \"Line\": 11,\n      \"Number\": 6,\n      \"Item\": \"Construction\",\n      \"shortName\": \"Construction\",\n      \"Value\": 1008.9,\n      \"privatePublic\": \"Private\",\n      \"Source\": NaN\n    },\n    {\n      \"Line\": 95,\n      \"Number\": 18,\n      \"Item\": \"State and local\",\n      \"shortName\": \"State and local\",\n      \"Value\": 2056.5,\n      \"privatePublic\": \"Government\",\n      \"Source\": NaN\n    },\n    {\n      \"Line\": 81,\n      \"Number\": 15,\n      \"Item\": \"Arts, entertainment, recreation, accommodation, and food services\",\n      \"shortName\": \"Recreation\",\n      \"Value\": 1080.5,\n      \"privatePublic\": \"Private\",\n      \"Source\": NaN\n    }\n  ],\n  \"column names\": [\n    \"Line\",\n    \"Number\",\n    \"Item\",\n    \"shortName\",\n    \"Value\",\n    \"privatePublic\",\n    \"Source\"\n  ]\n}\n\nYour Job:\nI am developing a NL to Data Visualization Dataset. \nPlease help me generate natural language utterance for given dataset and constraints.\nDefinition about the Taks:\n- 'utterance' is what a user would say to make a chart.  One NL 'utterance' is in one or two sentences. Here are two examples from Others for reference:\n    I want to know how many orders there are by the quantity of the order.\n    scatter(x=production budget, y=worldwide gross) for content rating.\n- 'given dataset' is in form of column names, column type, range/unique values of the column.\n- 'constraints' are information about the chart that should be included in the utterance. \n    So we can find a reference phrase in the NL utterance that corresponds to the given constraints. \n- 'reference phrase' can be explicit, ambiguous, and by_value. 'ambiguous' means the phrase can map to more than one columns in the dataset, always a hypernym of column names(depending on the dataset values).\n    For example:\n    {\"column\": \"gdpPercap\", \"nl_ref_type\": \"explicit\", \"nl_ref_phrase\": \"GDP per capita\"},\n    {\"column\": [\"country\",\"continent\"], \"nl_ref_type\": \"ambiguous\", \"nl_ref_phrase\": \"region\"}\n    {\"column\": [\"country\",\"country_short_name\"], \"nl_ref_type\": \"ambiguous\", \"nl_ref_phrase\": \"countries\"}\n    {\"c_type\": \"mark\", \"c_name\": \"point chart\", \"nl_ref_type\": \"explicit\", \"nl_ref_phrase\": \"scatter plot\"}\n    {\"c_type\": \"mark\", \"c_name\": \"arc chart\", \"nl_ref_type\": \"explicit\", \"nl_ref_phrase\": \"pie chart\"}\n    {\"c_type\": \"transform\",\"c_name\": \"filter\",\"c_list\": [{\"field\": \"country\",\"oneOf\": [\"Iceland\",\"Norway\"]}],\"nl_ref_type\": \"explicit\",\"nl_ref_phrase\": \"for countries Iceland and Norway\"},\n    {\"c_type\": \"transform\",\"c_name\": \"filter\",\"c_list\": [{\"field\": \"country\",\"oneOf\": [\"Iceland\",\"Norway\"]}],\"nl_ref_type\": \"by_value\",\"nl_ref_phrase\": \"for Iceland and Norway\"},\n- the 'nl_ref_phrase' for 'ambiguous' columns should be equally near all ambiguous columns, not too near to one of the column since it would not be ambiguous.\n    good example: {\"column\": [\"country\",\"region\"], \"nl_ref_type\": \"ambiguous\", \"nl_ref_phrase\": \"location\"}\n    bad example: {\"column\": [\"country\",\"region\"], \"nl_ref_type\": \"ambiguous\", \"nl_ref_phrase\": \"region\"}\n- You only include given constraints and no other information. \n    For example, if a column name is not in the given constraint, it will not be included in the NL utterance.\n    Also, it a chart mark or chart encoding channel is not in the given constraint, it will not be included in the NL utterance.\n- all 'nl_ref_phrase' shoule be included in the 'nl_utterance'. \n\nThe output format is identical to the input format, but fill in the str blanks(\"...\").\n### Input:\n{\n  \"nl_utterance\": \"...\",\n  \"encoded_fields\": [\n    {\n      \"field\": \"Value\",\n      \"type\": \"quantitative\",\n      \"nl_ref_type\": \"explicit\",\n      \"nl_ref_phrase\": \"...\"\n    },\n    {\n      \"field\": \"shortName\",\n      \"type\": \"nominal\",\n      \"nl_ref_type\": \"explicit\",\n      \"nl_ref_phrase\": \"...\"\n    },\n    {\n      \"field\": \"privatePublic\",\n      \"type\": \"nominal\",\n      \"nl_ref_type\": \"explicit\",\n      \"nl_ref_phrase\": \"...\"\n    }\n  ],\n  \"constraints\": [\n    {\n      \"c_type\": \"transform\",\n      \"c_name\": \"filter\",\n      \"c_list\": [\n        {\n          \"field\": \"Number\",\n          \"oneOf\": [\n            3,\n            4,\n            5,\n            6,\n            7,\n            8,\n            9,\n            10,\n            11,\n            12,\n            13,\n            14,\n            15,\n            17,\n            18\n          ]\n        }\n      ],\n      \"nl_ref_type\": \"by_value\",\n      \"nl_ref_phrase\": \"...\"\n    },\n    {\n      \"c_type\": \"transform\",\n      \"c_name\": \"sort\",\n      \"c_list\": [\n        {\n          \"field\": \"Number\",\n          \"order\": \"ascending\"\n        }\n      ],\n      \"nl_ref_type\": \"explicit\",\n      \"nl_ref_phrase\": \"...\"\n    },\n    {\n      \"c_type\": \"transform\",\n      \"c_name\": \"sort\",\n      \"c_list\": [\n        {\n          \"field\": \"Number\",\n          \"order\": \"ascending\"\n        }\n      ],\n      \"nl_ref_type\": \"explicit\",\n      \"nl_ref_phrase\": \"...\"\n    }\n  ]\n}\n\n### Output:"
}