{
  "gpt_result": {
    "nl_utterance": "Show me the data for the year 2017.",
    "encoded_fields": [],
    "constraints": [
      {
        "c_type": "transform",
        "c_name": "filter",
        "c_list": [
          {
            "field": "year",
            "equal": "2017"
          }
        ],
        "nl_ref_type": "by_value",
        "nl_ref_phrase": "for the year 2017"
      }
    ]
  },
  "input": "Dataset Information: {\n  \"data samples\": [\n    {\n      \"country\": \"Afghanistan\",\n      \"region\": \"Asia\",\n      \"country_code\": \"AFG\",\n      \"year\": 1952,\n      \"lifeExp\": 33.0,\n      \"gdpPercap\": 1070,\n      \"pop\": 7930000\n    },\n    {\n      \"country\": \"Greece\",\n      \"region\": \"Europe\",\n      \"country_code\": \"GRC\",\n      \"year\": 1982,\n      \"lifeExp\": 77.3,\n      \"gdpPercap\": 18000,\n      \"pop\": 9800000\n    },\n    {\n      \"country\": \"Albania\",\n      \"region\": \"Europe\",\n      \"country_code\": \"ALB\",\n      \"year\": 1997,\n      \"lifeExp\": 72.5,\n      \"gdpPercap\": 4070,\n      \"pop\": 3090000\n    },\n    {\n      \"country\": \"South Africa\",\n      \"region\": \"Africa\",\n      \"country_code\": \"ZAF\",\n      \"year\": 2017,\n      \"lifeExp\": 63.0,\n      \"gdpPercap\": 12300,\n      \"pop\": 56700000\n    },\n    {\n      \"country\": \"Afghanistan\",\n      \"region\": \"Asia\",\n      \"country_code\": \"AFG\",\n      \"year\": 2017,\n      \"lifeExp\": 58.4,\n      \"gdpPercap\": 1800,\n      \"pop\": 35500000\n    }\n  ],\n  \"column names\": [\n    \"country\",\n    \"region\",\n    \"country_code\",\n    \"year\",\n    \"lifeExp\",\n    \"gdpPercap\",\n    \"pop\"\n  ]\n}\n\nYour Job:\nI am developing a NL to Data Visualization Dataset. \nPlease help me generate natural language utterance for given dataset and constraints.\nDefinition about the Taks:\n- 'utterance' is what a user would say to make a chart. It should be a commands structure. One NL 'utterance' is in one or two sentences. Here are two examples from Commands for reference:\n    Make a simple scatter plot of worldwide Gross by Production Budget categorized by Major Genre.\n    Give me the number of movies by running time.\n- 'given dataset' is in form of column names, column type, range/unique values of the column.\n- 'constraints' are information about the chart that should be included in the utterance. \n    So we can find a reference phrase in the NL utterance that corresponds to the given constraints. \n- 'reference phrase' can be explicit, ambiguous, and by_value. 'ambiguous' means the phrase can map to more than one columns in the dataset, always a hypernym of column names(depending on the dataset values).\n    For example:\n    {\"column\": \"gdpPercap\", \"nl_ref_type\": \"explicit\", \"nl_ref_phrase\": \"GDP per capita\"},\n    {\"column\": [\"country\",\"continent\"], \"nl_ref_type\": \"ambiguous\", \"nl_ref_phrase\": \"region\"}\n    {\"column\": [\"country\",\"country_short_name\"], \"nl_ref_type\": \"ambiguous\", \"nl_ref_phrase\": \"countries\"}\n    {\"c_type\": \"mark\", \"c_name\": \"point chart\", \"nl_ref_type\": \"explicit\", \"nl_ref_phrase\": \"scatter plot\"}\n    {\"c_type\": \"mark\", \"c_name\": \"arc chart\", \"nl_ref_type\": \"explicit\", \"nl_ref_phrase\": \"pie chart\"}\n    {\"c_type\": \"transform\",\"c_name\": \"filter\",\"c_list\": [{\"field\": \"country\",\"oneOf\": [\"Iceland\",\"Norway\"]}],\"nl_ref_type\": \"explicit\",\"nl_ref_phrase\": \"for countries Iceland and Norway\"},\n    {\"c_type\": \"transform\",\"c_name\": \"filter\",\"c_list\": [{\"field\": \"country\",\"oneOf\": [\"Iceland\",\"Norway\"]}],\"nl_ref_type\": \"by_value\",\"nl_ref_phrase\": \"for Iceland and Norway\"},\n- the 'nl_ref_phrase' for 'ambiguous' columns should be equally near all ambiguous columns, not too near to one of the column since it would not be ambiguous.\n    good example: {\"column\": [\"country\",\"region\"], \"nl_ref_type\": \"ambiguous\", \"nl_ref_phrase\": \"location\"}\n    bad example: {\"column\": [\"country\",\"region\"], \"nl_ref_type\": \"ambiguous\", \"nl_ref_phrase\": \"region\"}\n- You only include given constraints and no other information. \n    For example, if a column name is not in the given constraint, it will not be included in the NL utterance.\n    Also, it a chart mark or chart encoding channel is not in the given constraint, it will not be included in the NL utterance.\n- all 'nl_ref_phrase' shoule be included in the 'nl_utterance'. \n\nThe output format is identical to the input format, but fill in the str blanks(\"...\").\n### Input:\n{\n  \"nl_utterance\": \"...\",\n  \"encoded_fields\": [],\n  \"constraints\": [\n    {\n      \"c_type\": \"transform\",\n      \"c_name\": \"filter\",\n      \"c_list\": [\n        {\n          \"field\": \"year\",\n          \"equal\": \"2017\"\n        }\n      ],\n      \"nl_ref_type\": \"by_value\",\n      \"nl_ref_phrase\": \"...\"\n    }\n  ]\n}\n\n### Output:"
}