{
  "gpt_result": {
    "nl_utterance": "What is the trend of the average monthly temperature over time displayed in a line chart?",
    "encoded_fields": [
      {
        "field": "Month",
        "type": "temporal",
        "nl_ref_type": "explicit",
        "nl_ref_phrase": "time"
      },
      {
        "field": "TMM",
        "type": "quantitative",
        "nl_ref_type": "explicit",
        "nl_ref_phrase": "average monthly temperature"
      }
    ],
    "constraints": [
      {
        "c_type": "task",
        "c_name": "trend",
        "c_list": [
          {
            "mark": [
              "bar",
              "line",
              "area"
            ],
            "encoding": {
              "x": {
                "type": "temporal"
              }
            }
          }
        ],
        "nl_ref_type": "explicit",
        "nl_ref_phrase": "trend"
      },
      {
        "c_type": "mark",
        "c_name": "line chart",
        "c_list": [
          {
            "mark": "line",
            "encoding": {
              "x": {},
              "y": {
                "type": "quantitative"
              },
              "color": {
                "ignore": true,
                "type": "nominal"
              },
              "column": {
                "ignore": true,
                "type": "nominal"
              },
              "row": {
                "ignore": true,
                "type": "nominal"
              }
            },
            "unique_map": {
              "x": "y"
            }
          }
        ],
        "nl_ref_type": "explicit",
        "nl_ref_phrase": "line chart"
      }
    ]
  },
  "input": "Dataset Information: {\n  \"data samples\": [\n    {\n      \"STAT\": 10379,\n      \"JJJJMM\": 201808,\n      \"QN\": 3,\n      \"TNN\": 9.3,\n      \"TNM\": 15.5,\n      \"TMM\": 21.4,\n      \"TXM\": 28.0,\n      \"TXX\": 37.8,\n      \"SOS\": 280.5,\n      \"NMM\": 4.1,\n      \"RSS\": 10.1,\n      \"RSX\": 3.8,\n      \"FMM\": 2.7,\n      \"FXX\": 16.4,\n      \"Month\": \"2018-08-01T00:00:00\"\n    },\n    {\n      \"STAT\": 10379,\n      \"JJJJMM\": 201809,\n      \"QN\": 3,\n      \"TNN\": 4.0,\n      \"TNM\": 11.3,\n      \"TMM\": 16.7,\n      \"TXM\": 23.0,\n      \"TXX\": 31.0,\n      \"SOS\": 215.6,\n      \"NMM\": 4.5,\n      \"RSS\": 20.2,\n      \"RSX\": 15.3,\n      \"FMM\": 2.7,\n      \"FXX\": 28.2,\n      \"Month\": \"2018-09-01T00:00:00\"\n    },\n    {\n      \"STAT\": 10379,\n      \"JJJJMM\": 201911,\n      \"QN\": 3,\n      \"TNN\": -2.7,\n      \"TNM\": 3.1,\n      \"TMM\": 5.9,\n      \"TXM\": 8.6,\n      \"TXX\": 16.1,\n      \"SOS\": 50.5,\n      \"NMM\": 6.4,\n      \"RSS\": 46.4,\n      \"RSX\": 8.3,\n      \"FMM\": 2.8,\n      \"FXX\": 16.8,\n      \"Month\": \"2019-11-01T00:00:00\"\n    },\n    {\n      \"STAT\": 10379,\n      \"JJJJMM\": 201903,\n      \"QN\": 3,\n      \"TNN\": -0.2,\n      \"TNM\": 3.1,\n      \"TMM\": 6.9,\n      \"TXM\": 11.1,\n      \"TXX\": 19.1,\n      \"SOS\": 89.9,\n      \"NMM\": 6.0,\n      \"RSS\": 59.9,\n      \"RSX\": 15.9,\n      \"FMM\": 3.4,\n      \"FXX\": 25.7,\n      \"Month\": \"2019-03-01T00:00:00\"\n    },\n    {\n      \"STAT\": 10379,\n      \"JJJJMM\": 201812,\n      \"QN\": 3,\n      \"TNN\": -2.1,\n      \"TNM\": 2.1,\n      \"TMM\": 4.2,\n      \"TXM\": 6.4,\n      \"TXX\": 12.9,\n      \"SOS\": 19.6,\n      \"NMM\": 7.1,\n      \"RSS\": 38.0,\n      \"RSX\": 6.5,\n      \"FMM\": 3.2,\n      \"FXX\": 21.0,\n      \"Month\": \"2018-12-01T00:00:00\"\n    }\n  ],\n  \"column names\": [\n    \"STAT\",\n    \"JJJJMM\",\n    \"QN\",\n    \"TNN\",\n    \"TNM\",\n    \"TMM\",\n    \"TXM\",\n    \"TXX\",\n    \"SOS\",\n    \"NMM\",\n    \"RSS\",\n    \"RSX\",\n    \"FMM\",\n    \"FXX\",\n    \"Month\"\n  ]\n}\n\nYour Job:\nI am developing a NL to Data Visualization Dataset. \nPlease help me generate natural language utterance for given dataset and constraints.\nDefinition about the Taks:\n- 'utterance' is what a user would say to make a chart. It should be a questions structure. One NL 'utterance' is in one or two sentences. Here are two examples from Questions for reference:\n    What is our profit based on shipping mode by customer segment?\n    What's the average production budget of the different rated movies, separated by creative type.\n- 'given dataset' is in form of column names, column type, range/unique values of the column.\n- 'constraints' are information about the chart that should be included in the utterance. \n    So we can find a reference phrase in the NL utterance that corresponds to the given constraints. \n- 'reference phrase' can be explicit, ambiguous, and by_value. 'ambiguous' means the phrase can map to more than one columns in the dataset, always a hypernym of column names(depending on the dataset values).\n    For example:\n    {\"column\": \"gdpPercap\", \"nl_ref_type\": \"explicit\", \"nl_ref_phrase\": \"GDP per capita\"},\n    {\"column\": [\"country\",\"continent\"], \"nl_ref_type\": \"ambiguous\", \"nl_ref_phrase\": \"region\"}\n    {\"column\": [\"country\",\"country_short_name\"], \"nl_ref_type\": \"ambiguous\", \"nl_ref_phrase\": \"countries\"}\n    {\"c_type\": \"mark\", \"c_name\": \"point chart\", \"nl_ref_type\": \"explicit\", \"nl_ref_phrase\": \"scatter plot\"}\n    {\"c_type\": \"mark\", \"c_name\": \"arc chart\", \"nl_ref_type\": \"explicit\", \"nl_ref_phrase\": \"pie chart\"}\n    {\"c_type\": \"transform\",\"c_name\": \"filter\",\"c_list\": [{\"field\": \"country\",\"oneOf\": [\"Iceland\",\"Norway\"]}],\"nl_ref_type\": \"explicit\",\"nl_ref_phrase\": \"for countries Iceland and Norway\"},\n    {\"c_type\": \"transform\",\"c_name\": \"filter\",\"c_list\": [{\"field\": \"country\",\"oneOf\": [\"Iceland\",\"Norway\"]}],\"nl_ref_type\": \"by_value\",\"nl_ref_phrase\": \"for Iceland and Norway\"},\n- the 'nl_ref_phrase' for 'ambiguous' columns should be equally near all ambiguous columns, not too near to one of the column since it would not be ambiguous.\n    good example: {\"column\": [\"country\",\"region\"], \"nl_ref_type\": \"ambiguous\", \"nl_ref_phrase\": \"location\"}\n    bad example: {\"column\": [\"country\",\"region\"], \"nl_ref_type\": \"ambiguous\", \"nl_ref_phrase\": \"region\"}\n- You only include given constraints and no other information. \n    For example, if a column name is not in the given constraint, it will not be included in the NL utterance.\n    Also, it a chart mark or chart encoding channel is not in the given constraint, it will not be included in the NL utterance.\n- all 'nl_ref_phrase' shoule be included in the 'nl_utterance'. \n\nThe output format is identical to the input format, but fill in the str blanks(\"...\").\n### Input:\n{\n  \"nl_utterance\": \"...\",\n  \"encoded_fields\": [\n    {\n      \"field\": \"Month\",\n      \"type\": \"temporal\",\n      \"nl_ref_type\": \"explicit\",\n      \"nl_ref_phrase\": \"...\"\n    },\n    {\n      \"field\": \"TMM\",\n      \"type\": \"quantitative\",\n      \"nl_ref_type\": \"explicit\",\n      \"nl_ref_phrase\": \"...\"\n    }\n  ],\n  \"constraints\": [\n    {\n      \"c_type\": \"task\",\n      \"c_name\": \"trend\",\n      \"c_list\": [\n        {\n          \"mark\": [\n            \"bar\",\n            \"line\",\n            \"area\"\n          ],\n          \"encoding\": {\n            \"x\": {\n              \"type\": \"temporal\"\n            }\n          }\n        }\n      ],\n      \"nl_ref_type\": \"explicit\",\n      \"nl_ref_phrase\": \"...\"\n    },\n    {\n      \"c_type\": \"mark\",\n      \"c_name\": \"line chart\",\n      \"c_list\": [\n        {\n          \"mark\": \"line\",\n          \"encoding\": {\n            \"x\": {},\n            \"y\": {\n              \"type\": \"quantitative\"\n            },\n            \"color\": {\n              \"ignore\": true,\n              \"type\": \"nominal\"\n            },\n            \"column\": {\n              \"ignore\": true,\n              \"type\": \"nominal\"\n            },\n            \"row\": {\n              \"ignore\": true,\n              \"type\": \"nominal\"\n            }\n          },\n          \"unique_map\": {\n            \"x\": \"y\"\n          }\n        }\n      ],\n      \"nl_ref_type\": \"explicit\",\n      \"nl_ref_phrase\": \"...\"\n    }\n  ]\n}\n\n### Output:"
}