{
  "gpt_result": {
    "nl_utterance": "What is the composition of State by ValueC and Type1? Can you sort the results in ascending order based on ValueC?",
    "encoded_fields": [
      {
        "field": "State",
        "type": "nominal",
        "nl_ref_type": "explicit",
        "nl_ref_phrase": "State"
      },
      {
        "field": "ValueC",
        "type": "quantitative",
        "nl_ref_type": "explicit",
        "nl_ref_phrase": "ValueC"
      },
      {
        "field": "Type1",
        "type": "nominal",
        "nl_ref_type": "explicit",
        "nl_ref_phrase": "Type1"
      }
    ],
    "constraints": [
      {
        "c_type": "task",
        "c_name": "composition",
        "c_list": [
          {
            "mark": "bar",
            "encoding": {
              "x": {},
              "y": {
                "type": "quantitative"
              },
              "color": {
                "type": "nominal"
              }
            },
            "x_y_reversable": true
          },
          {
            "mark": "area",
            "encoding": {
              "x": {},
              "y": {
                "type": "quantitative"
              },
              "color": {
                "type": "nominal"
              }
            }
          },
          {
            "mark": "arc",
            "encoding": {
              "theta": {
                "type": "quantitative"
              },
              "color": {
                "type": "nominal"
              }
            }
          }
        ],
        "nl_ref_type": "explicit",
        "nl_ref_phrase": "composition"
      },
      {
        "c_type": "transform",
        "c_name": "sort",
        "c_list": [
          {
            "op": "sum",
            "order": "ascending",
            "field": "ValueC"
          }
        ],
        "nl_ref_type": "explicit",
        "nl_ref_phrase": "sort the results in ascending order based on ValueC"
      }
    ]
  },
  "input": "Dataset Information: {\n  \"data samples\": [\n    {\n      \"State\": \"Alabama\",\n      \"Population\": 5039877,\n      \"Type1\": \"Lawful Permanent Residents\",\n      \"Value\": 2887.0,\n      \"ValueC\": 0.057283144\n    },\n    {\n      \"State\": \"Wisconsin\",\n      \"Population\": 5895908,\n      \"Type1\": \"Refugees\",\n      \"Value\": 371.0,\n      \"ValueC\": 0.0062925\n    },\n    {\n      \"State\": \"Iowa\",\n      \"Population\": 3193079,\n      \"Type1\": \"Nonimmigrants\",\n      \"Value\": 26690.0,\n      \"ValueC\": 0.835870331\n    },\n    {\n      \"State\": \"Missouri\",\n      \"Population\": 6168187,\n      \"Type1\": \"Asylees\",\n      \"Value\": 91.0,\n      \"ValueC\": 0.001475312\n    },\n    {\n      \"State\": \"Tennessee\",\n      \"Population\": 6975218,\n      \"Type1\": \"Refugees\",\n      \"Value\": 315.0,\n      \"ValueC\": 0.004515988\n    }\n  ],\n  \"column names\": [\n    \"State\",\n    \"Population\",\n    \"Type1\",\n    \"Value\",\n    \"ValueC\"\n  ]\n}\n\nYour Job:\nI am developing a NL to Data Visualization Dataset. \nPlease help me generate natural language utterance for given dataset and constraints.\nDefinition about the Taks:\n- 'utterance' is what a user would say to make a chart. It should be a questions structure. One NL 'utterance' is in one or two sentences. Here are two examples from Questions for reference:\n    What is our profit based on shipping mode by customer segment?\n    Which countries have the highest acceleration for cars of different cylinders?\n- 'given dataset' is in form of column names, column type, range/unique values of the column.\n- 'constraints' are information about the chart that should be included in the utterance. \n    So we can find a reference phrase in the NL utterance that corresponds to the given constraints. \n- 'reference phrase' can be explicit, ambiguous, and by_value. 'ambiguous' means the phrase can map to more than one columns in the dataset, always a hypernym of column names(depending on the dataset values).\n    For example:\n    {\"column\": \"gdpPercap\", \"nl_ref_type\": \"explicit\", \"nl_ref_phrase\": \"GDP per capita\"},\n    {\"column\": [\"country\",\"continent\"], \"nl_ref_type\": \"ambiguous\", \"nl_ref_phrase\": \"region\"}\n    {\"column\": [\"country\",\"country_short_name\"], \"nl_ref_type\": \"ambiguous\", \"nl_ref_phrase\": \"countries\"}\n    {\"c_type\": \"mark\", \"c_name\": \"point chart\", \"nl_ref_type\": \"explicit\", \"nl_ref_phrase\": \"scatter plot\"}\n    {\"c_type\": \"mark\", \"c_name\": \"arc chart\", \"nl_ref_type\": \"explicit\", \"nl_ref_phrase\": \"pie chart\"}\n    {\"c_type\": \"transform\",\"c_name\": \"filter\",\"c_list\": [{\"field\": \"country\",\"oneOf\": [\"Iceland\",\"Norway\"]}],\"nl_ref_type\": \"explicit\",\"nl_ref_phrase\": \"for countries Iceland and Norway\"},\n    {\"c_type\": \"transform\",\"c_name\": \"filter\",\"c_list\": [{\"field\": \"country\",\"oneOf\": [\"Iceland\",\"Norway\"]}],\"nl_ref_type\": \"by_value\",\"nl_ref_phrase\": \"for Iceland and Norway\"},\n- the 'nl_ref_phrase' for 'ambiguous' columns should be equally near all ambiguous columns, not too near to one of the column since it would not be ambiguous.\n    good example: {\"column\": [\"country\",\"region\"], \"nl_ref_type\": \"ambiguous\", \"nl_ref_phrase\": \"location\"}\n    bad example: {\"column\": [\"country\",\"region\"], \"nl_ref_type\": \"ambiguous\", \"nl_ref_phrase\": \"region\"}\n- You only include given constraints and no other information. \n    For example, if a column name is not in the given constraint, it will not be included in the NL utterance.\n    Also, it a chart mark or chart encoding channel is not in the given constraint, it will not be included in the NL utterance.\n- all 'nl_ref_phrase' shoule be included in the 'nl_utterance'. \n\nThe output format is identical to the input format, but fill in the str blanks(\"...\").\n### Input:\n{\n  \"nl_utterance\": \"...\",\n  \"encoded_fields\": [\n    {\n      \"field\": \"State\",\n      \"type\": \"nominal\",\n      \"nl_ref_type\": \"explicit\",\n      \"nl_ref_phrase\": \"...\"\n    },\n    {\n      \"field\": \"ValueC\",\n      \"type\": \"quantitative\",\n      \"nl_ref_type\": \"explicit\",\n      \"nl_ref_phrase\": \"...\"\n    },\n    {\n      \"field\": \"Type1\",\n      \"type\": \"nominal\",\n      \"nl_ref_type\": \"explicit\",\n      \"nl_ref_phrase\": \"...\"\n    }\n  ],\n  \"constraints\": [\n    {\n      \"c_type\": \"task\",\n      \"c_name\": \"composition\",\n      \"c_list\": [\n        {\n          \"mark\": \"bar\",\n          \"encoding\": {\n            \"x\": {},\n            \"y\": {\n              \"type\": \"quantitative\"\n            },\n            \"color\": {\n              \"type\": \"nominal\"\n            }\n          },\n          \"x_y_reversable\": true\n        },\n        {\n          \"mark\": \"area\",\n          \"encoding\": {\n            \"x\": {},\n            \"y\": {\n              \"type\": \"quantitative\"\n            },\n            \"color\": {\n              \"type\": \"nominal\"\n            }\n          }\n        },\n        {\n          \"mark\": \"arc\",\n          \"encoding\": {\n            \"theta\": {\n              \"type\": \"quantitative\"\n            },\n            \"color\": {\n              \"type\": \"nominal\"\n            }\n          }\n        }\n      ],\n      \"nl_ref_type\": \"explicit\",\n      \"nl_ref_phrase\": \"...\"\n    },\n    {\n      \"c_type\": \"transform\",\n      \"c_name\": \"sort\",\n      \"c_list\": [\n        {\n          \"op\": \"sum\",\n          \"order\": \"ascending\",\n          \"field\": \"ValueC\"\n        }\n      ],\n      \"nl_ref_type\": \"explicit\",\n      \"nl_ref_phrase\": \"...\"\n    }\n  ]\n}\n\n### Output:"
}