{
  "gpt_result": {
    "nl_utterance": "Show me the sum of all Totals in USD over the years.",
    "encoded_fields": [
      {
        "field": "Year",
        "type": "quantitative",
        "nl_ref_type": "explicit",
        "nl_ref_phrase": "over the years"
      },
      {
        "field": "Totals_USD",
        "type": "quantitative",
        "nl_ref_type": "explicit",
        "nl_ref_phrase": "Totals in USD"
      }
    ],
    "constraints": [
      {
        "c_type": "transform",
        "c_name": "aggregate",
        "c_list": [
          {
            "field": "Totals_USD",
            "aggregate": "sum"
          }
        ],
        "nl_ref_type": "explicit",
        "nl_ref_phrase": "sum of all"
      }
    ]
  },
  "input": "Dataset Information: {\n  \"data samples\": [\n    {\n      \"Date\": \"08/31/2022\",\n      \"GRA Purchases\": 93769635059,\n      \"PRGT 1/2/\": 15254184552,\n      \"Totals\": 109024000000.0,\n      \"Totals_bil_SDR\": 109.02,\n      \"Year\": 2022,\n      \"Conversion rate\": 1.28252,\n      \"Unnamed: 7\": NaN,\n      \"Totals_USD\": 139.8203304,\n      \"World GDP\": 86700000000000.0,\n      \"World aggregate real GDP (billion USD)\": 86652.9,\n      \"Unnamed: 11\": 0.001258123,\n      \"Total_USD/GDP\": 0.001613568,\n      \"Percentage\": 0.161356781,\n      \"Unnamed: 14\": NaN,\n      \"World nominal GDP\": 98100000000000.0,\n      \"Unnamed: 16\": 98100,\n      \"Unnamed: 17\": 0.001425284,\n      \"Percentages\": 0.142528369\n    },\n    {\n      \"Date\": \"12/31/1991\",\n      \"GRA Purchases\": 23378573926,\n      \"PRGT 1/2/\": 3285717796,\n      \"Totals\": 26664291722.0,\n      \"Totals_bil_SDR\": 26.66,\n      \"Year\": 1991,\n      \"Conversion rate\": 1.43043,\n      \"Unnamed: 7\": NaN,\n      \"Totals_USD\": 38.1352638,\n      \"World GDP\": 36400000000000.0,\n      \"World aggregate real GDP (billion USD)\": 36396.6,\n      \"Unnamed: 11\": 0.000732486,\n      \"Total_USD/GDP\": 0.00104777,\n      \"Percentage\": 0.104776995,\n      \"Unnamed: 14\": NaN,\n      \"World nominal GDP\": 23760000000000.0,\n      \"Unnamed: 16\": 23760,\n      \"Unnamed: 17\": 0.00160502,\n      \"Percentages\": 0.160501952\n    },\n    {\n      \"Date\": \"12/31/1994\",\n      \"GRA Purchases\": 25611676952,\n      \"PRGT 1/2/\": 4599768498,\n      \"Totals\": 30211445450.0,\n      \"Totals_bil_SDR\": 30.21,\n      \"Year\": 1994,\n      \"Conversion rate\": 1.45985,\n      \"Unnamed: 7\": NaN,\n      \"Totals_USD\": 44.1020685,\n      \"World GDP\": 39100000000000.0,\n      \"World aggregate real GDP (billion USD)\": 39072.4,\n      \"Unnamed: 11\": 0.00077318,\n      \"Total_USD/GDP\": 0.001128727,\n      \"Percentage\": 0.112872689,\n      \"Unnamed: 14\": NaN,\n      \"World nominal GDP\": 27872000000000.0,\n      \"Unnamed: 16\": 27872,\n      \"Unnamed: 17\": 0.001582307,\n      \"Percentages\": 0.158230728\n    }\n  ],\n  \"column names\": [\n    \"Date\",\n    \"GRA Purchases\",\n    \"PRGT 1/2/\",\n    \"Totals\",\n    \"Totals_bil_SDR\",\n    \"Year\",\n    \"Conversion rate\",\n    \"Unnamed: 7\",\n    \"Totals_USD\",\n    \"World GDP\",\n    \"World aggregate real GDP (billion USD)\",\n    \"Unnamed: 11\",\n    \"Total_USD/GDP\",\n    \"Percentage\",\n    \"Unnamed: 14\",\n    \"World nominal GDP\",\n    \"Unnamed: 16\",\n    \"Unnamed: 17\",\n    \"Percentages\"\n  ]\n}\n\nYour Job:\nI am developing a NL to Data Visualization Dataset. \nPlease help me generate natural language utterance for given dataset and constraints.\nDefinition about the Taks:\n- 'utterance' is what a user would say to make a chart, it can be a question or a command. One NL 'utterance' is in one or two sentences. \n- 'given dataset' is in form of column names, column type, range/unique values of the column.\n- 'constraints' are information about the chart that should be included in the utterance. \n    So we can find a reference phrase in the NL utterance that corresponds to the given constraints. \n- 'reference phrase' can be explicit, ambiguous, and by_value. 'ambiguous' means the phrase can map to more than one columns in the dataset, always a hypernym of column names(depending on the dataset values).\n    For example:\n    {\"column\": \"gdpPercap\", \"nl_ref_type\": \"explicit\", \"nl_ref_phrase\": \"GDP per capita\"},\n    {\"column\": [\"country\",\"continent\"], \"nl_ref_type\": \"ambiguous\", \"nl_ref_phrase\": \"region\"}\n    {\"column\": [\"country\",\"country_short_name\"], \"nl_ref_type\": \"ambiguous\", \"nl_ref_phrase\": \"countries\"}\n    {\"c_type\": \"mark\", \"c_name\": \"point chart\", \"nl_ref_type\": \"explicit\", \"nl_ref_phrase\": \"scatter plot\"}\n    {\"c_type\": \"mark\", \"c_name\": \"arc chart\", \"nl_ref_type\": \"explicit\", \"nl_ref_phrase\": \"pie chart\"}\n    {\"c_type\": \"transform\",\"c_name\": \"filter\",\"c_list\": [{\"field\": \"country\",\"oneOf\": [\"Iceland\",\"Norway\"]}],\"nl_ref_type\": \"explicit\",\"nl_ref_phrase\": \"for countries Iceland and Norway\"},\n    {\"c_type\": \"transform\",\"c_name\": \"filter\",\"c_list\": [{\"field\": \"country\",\"oneOf\": [\"Iceland\",\"Norway\"]}],\"nl_ref_type\": \"by_value\",\"nl_ref_phrase\": \"for Iceland and Norway\"},\n- the 'nl_ref_phrase' for 'ambiguous' columns should be equally near all ambiguous columns, not too near to one of the column since it would not be ambiguous.\n    good example: {\"column\": [\"country\",\"region\"], \"nl_ref_type\": \"ambiguous\", \"nl_ref_phrase\": \"location\"}\n    bad example: {\"column\": [\"country\",\"region\"], \"nl_ref_type\": \"ambiguous\", \"nl_ref_phrase\": \"region\"}\n- You only include given constraints and no other information. \n    For example, if a column name is not in the given constraint, it will not be included in the NL utterance.\n    Also, it a chart mark or chart encoding channel is not in the given constraint, it will not be included in the NL utterance.\n- all 'nl_ref_phrase' shoule be included in the 'nl_utterance'. \n\nThe output format is identical to the input format, but fill in the str blanks(\"...\").\n### Input:\n{\n  \"nl_utterance\": \"...\",\n  \"encoded_fields\": [\n    {\n      \"field\": \"Year\",\n      \"type\": \"quantitative\",\n      \"nl_ref_type\": \"explicit\",\n      \"nl_ref_phrase\": \"...\"\n    },\n    {\n      \"field\": \"Totals_USD\",\n      \"type\": \"quantitative\",\n      \"nl_ref_type\": \"explicit\",\n      \"nl_ref_phrase\": \"...\"\n    }\n  ],\n  \"constraints\": [\n    {\n      \"c_type\": \"transform\",\n      \"c_name\": \"aggregate\",\n      \"c_list\": [\n        {\n          \"field\": \"Totals_USD\",\n          \"aggregate\": \"sum\"\n        }\n      ],\n      \"nl_ref_type\": \"explicit\",\n      \"nl_ref_phrase\": \"...\"\n    }\n  ]\n}\n\n### Output:"
}