{
  "gpt_result": {
    "nl_utterance": "Display the average weight of cars over the years.",
    "encoded_fields": [
      {
        "field": "Weight",
        "type": "quantitative",
        "nl_ref_type": "explicit",
        "nl_ref_phrase": "weight"
      },
      {
        "field": "Year",
        "type": "quantitative",
        "nl_ref_type": "explicit",
        "nl_ref_phrase": "years"
      }
    ],
    "constraints": [
      {
        "c_type": "transform",
        "c_name": "aggregate",
        "c_list": [
          {
            "field": "Weight",
            "aggregate": "mean"
          }
        ],
        "nl_ref_type": "explicit",
        "nl_ref_phrase": "average"
      }
    ]
  },
  "input": "Dataset Information: {\n  \"data samples\": [\n    {\n      \"Model\": \"volkswagen 1131 deluxe sedan\",\n      \"MPG\": 26.0,\n      \"Cylinders\": 4,\n      \"Displacement\": 97.0,\n      \"Horsepower\": 46,\n      \"Weight\": 1835,\n      \"Acceleration\": 20.5,\n      \"Year\": 1970,\n      \"Origin\": \"Europe\"\n    },\n    {\n      \"Model\": \"datsun 810\",\n      \"MPG\": 22.0,\n      \"Cylinders\": 6,\n      \"Displacement\": 146.0,\n      \"Horsepower\": 97,\n      \"Weight\": 2815,\n      \"Acceleration\": 14.5,\n      \"Year\": 1977,\n      \"Origin\": \"Japan\"\n    },\n    {\n      \"Model\": \"maxda rx3\",\n      \"MPG\": 18.0,\n      \"Cylinders\": 3,\n      \"Displacement\": 70.0,\n      \"Horsepower\": 90,\n      \"Weight\": 2124,\n      \"Acceleration\": 13.5,\n      \"Year\": 1973,\n      \"Origin\": \"Japan\"\n    },\n    {\n      \"Model\": \"toyota starlet\",\n      \"MPG\": 39.1,\n      \"Cylinders\": 4,\n      \"Displacement\": 79.0,\n      \"Horsepower\": 58,\n      \"Weight\": 1755,\n      \"Acceleration\": 16.9,\n      \"Year\": 1981,\n      \"Origin\": \"Japan\"\n    },\n    {\n      \"Model\": \"dodge aspen\",\n      \"MPG\": 19.1,\n      \"Cylinders\": 6,\n      \"Displacement\": 225.0,\n      \"Horsepower\": 90,\n      \"Weight\": 3381,\n      \"Acceleration\": 18.7,\n      \"Year\": 1980,\n      \"Origin\": \"US\"\n    }\n  ],\n  \"column names\": [\n    \"Model\",\n    \"MPG\",\n    \"Cylinders\",\n    \"Displacement\",\n    \"Horsepower\",\n    \"Weight\",\n    \"Acceleration\",\n    \"Year\",\n    \"Origin\"\n  ]\n}\n\nYour Job:\nI am developing a NL to Data Visualization Dataset. \nPlease help me generate natural language utterance for given dataset and constraints.\nDefinition about the Taks:\n- 'utterance' is what a user would say to make a chart. It should be a commands structure. One NL 'utterance' is in one or two sentences. Here are two examples from Commands for reference:\n    Give me the number of movies by running time.\n    Draw a line chart of daily sales forecasts.\n- 'given dataset' is in form of column names, column type, range/unique values of the column.\n- 'constraints' are information about the chart that should be included in the utterance. \n    So we can find a reference phrase in the NL utterance that corresponds to the given constraints. \n- 'reference phrase' can be explicit, ambiguous, and by_value. 'ambiguous' means the phrase can map to more than one columns in the dataset, always a hypernym of column names(depending on the dataset values).\n    For example:\n    {\"column\": \"gdpPercap\", \"nl_ref_type\": \"explicit\", \"nl_ref_phrase\": \"GDP per capita\"},\n    {\"column\": [\"country\",\"continent\"], \"nl_ref_type\": \"ambiguous\", \"nl_ref_phrase\": \"region\"}\n    {\"column\": [\"country\",\"country_short_name\"], \"nl_ref_type\": \"ambiguous\", \"nl_ref_phrase\": \"countries\"}\n    {\"c_type\": \"mark\", \"c_name\": \"point chart\", \"nl_ref_type\": \"explicit\", \"nl_ref_phrase\": \"scatter plot\"}\n    {\"c_type\": \"mark\", \"c_name\": \"arc chart\", \"nl_ref_type\": \"explicit\", \"nl_ref_phrase\": \"pie chart\"}\n    {\"c_type\": \"transform\",\"c_name\": \"filter\",\"c_list\": [{\"field\": \"country\",\"oneOf\": [\"Iceland\",\"Norway\"]}],\"nl_ref_type\": \"explicit\",\"nl_ref_phrase\": \"for countries Iceland and Norway\"},\n    {\"c_type\": \"transform\",\"c_name\": \"filter\",\"c_list\": [{\"field\": \"country\",\"oneOf\": [\"Iceland\",\"Norway\"]}],\"nl_ref_type\": \"by_value\",\"nl_ref_phrase\": \"for Iceland and Norway\"},\n- the 'nl_ref_phrase' for 'ambiguous' columns should be equally near all ambiguous columns, not too near to one of the column since it would not be ambiguous.\n    good example: {\"column\": [\"country\",\"region\"], \"nl_ref_type\": \"ambiguous\", \"nl_ref_phrase\": \"location\"}\n    bad example: {\"column\": [\"country\",\"region\"], \"nl_ref_type\": \"ambiguous\", \"nl_ref_phrase\": \"region\"}\n- You only include given constraints and no other information. \n    For example, if a column name is not in the given constraint, it will not be included in the NL utterance.\n    Also, it a chart mark or chart encoding channel is not in the given constraint, it will not be included in the NL utterance.\n- all 'nl_ref_phrase' shoule be included in the 'nl_utterance'. \n\nThe output format is identical to the input format, but fill in the str blanks(\"...\").\n### Input:\n{\n  \"nl_utterance\": \"...\",\n  \"encoded_fields\": [\n    {\n      \"field\": \"Weight\",\n      \"type\": \"quantitative\",\n      \"nl_ref_type\": \"explicit\",\n      \"nl_ref_phrase\": \"...\"\n    },\n    {\n      \"field\": \"Year\",\n      \"type\": \"quantitative\",\n      \"nl_ref_type\": \"explicit\",\n      \"nl_ref_phrase\": \"...\"\n    }\n  ],\n  \"constraints\": [\n    {\n      \"c_type\": \"transform\",\n      \"c_name\": \"aggregate\",\n      \"c_list\": [\n        {\n          \"field\": \"Weight\",\n          \"aggregate\": \"mean\"\n        }\n      ],\n      \"nl_ref_type\": \"explicit\",\n      \"nl_ref_phrase\": \"...\"\n    }\n  ]\n}\n\n### Output:"
}