{
  "gpt_result": {
    "nl_utterance": "Draw a heatmap of the down share, filtered to include only data where the up share is less than 0.25 and down share is less than 0.25.",
    "encoded_fields": [
      {
        "field": "down_sh",
        "type": "quantitative",
        "nl_ref_type": "explicit",
        "nl_ref_phrase": "down share"
      }
    ],
    "constraints": [
      {
        "c_type": "mark",
        "c_name": "rect chart",
        "c_list": [
          {
            "mark": "rect",
            "encoding": {
              "x": {},
              "y": {},
              "color": {
                "type": "quantitative"
              },
              "column": {
                "ignore": true,
                "type": "nominal"
              },
              "row": {
                "ignore": true,
                "type": "nominal"
              }
            },
            "unique_map": {
              "(x,y)": "color"
            }
          }
        ],
        "nl_ref_type": "explicit",
        "nl_ref_phrase": "heatmap"
      },
      {
        "c_type": "transform",
        "c_name": "filter",
        "c_list": [
          {
            "field": "up_sh",
            "lt": 0.25
          }
        ],
        "nl_ref_type": "by_value",
        "nl_ref_phrase": "where the up share is less than 0.25"
      },
      {
        "c_type": "transform",
        "c_name": "filter",
        "c_list": [
          {
            "field": "down_sh",
            "lt": 0.25
          }
        ],
        "nl_ref_type": "by_value",
        "nl_ref_phrase": "and down share is less than 0.25"
      }
    ]
  },
  "input": "Dataset Information: {\n  \"data samples\": [\n    {\n      \"date\": 1.0,\n      \"division\": 4,\n      \"up\": 0,\n      \"down\": 0,\n      \"level\": 0,\n      \"up_ch\": NaN,\n      \"down_ch\": NaN,\n      \"total\": 0,\n      \"up_sh\": NaN,\n      \"down_sh\": NaN,\n      \"level_sh\": NaN,\n      \"change_sh\": NaN,\n      \"division_s\": \"Housing, Water, Electricity, Gas and other fuels\",\n      \"division_sh\": \"Housing & utilities\",\n      \"date2\": \"01-02-1988\",\n      \"date4\": \"1988-02-01\",\n      \"year\": 1988.0,\n      \"month\": 2.0,\n      \"quarter\": 1.0\n    },\n    {\n      \"date\": 82.0,\n      \"division\": 7,\n      \"up\": 243,\n      \"down\": 841,\n      \"level\": 3828,\n      \"up_ch\": 0.032935172,\n      \"down_ch\": -0.066671111,\n      \"total\": 4912,\n      \"up_sh\": 0.049470685,\n      \"down_sh\": 0.17121336,\n      \"level_sh\": 0.77931595,\n      \"change_sh\": 0.22068405,\n      \"division_s\": \"Transport\",\n      \"division_sh\": \"Transport\",\n      \"date2\": \"01-11-1994\",\n      \"date4\": \"1994-11-01\",\n      \"year\": 1994.0,\n      \"month\": 11.0,\n      \"quarter\": 4.0\n    },\n    {\n      \"date\": 134.0,\n      \"division\": 9,\n      \"up\": 431,\n      \"down\": 545,\n      \"level\": 7549,\n      \"up_ch\": 0.14285716,\n      \"down_ch\": -0.12625003,\n      \"total\": 8525,\n      \"up_sh\": 0.050557185,\n      \"down_sh\": 0.063929617,\n      \"level_sh\": 0.88551319,\n      \"change_sh\": 0.1144868,\n      \"division_s\": \"Recreation and culture\",\n      \"division_sh\": \"Recreation & culture\",\n      \"date2\": \"01-03-1999\",\n      \"date4\": \"1999-03-01\",\n      \"year\": 1999.0,\n      \"month\": 3.0,\n      \"quarter\": 1.0\n    },\n    {\n      \"date\": 188.0,\n      \"division\": 8,\n      \"up\": 3,\n      \"down\": 42,\n      \"level\": 94,\n      \"up_ch\": 0.16669439,\n      \"down_ch\": -0.12897608,\n      \"total\": 139,\n      \"up_sh\": 0.021582734,\n      \"down_sh\": 0.30215827,\n      \"level_sh\": 0.67625898,\n      \"change_sh\": 0.32374099,\n      \"division_s\": \"Communication\",\n      \"division_sh\": \"Communication\",\n      \"date2\": \"01-09-2003\",\n      \"date4\": \"2003-09-01\",\n      \"year\": 2003.0,\n      \"month\": 9.0,\n      \"quarter\": 3.0\n    },\n    {\n      \"date\": 9.0,\n      \"division\": 3,\n      \"up\": 427,\n      \"down\": 172,\n      \"level\": 4566,\n      \"up_ch\": 0.14492758,\n      \"down_ch\": -0.12515645,\n      \"total\": 5165,\n      \"up_sh\": 0.082671829,\n      \"down_sh\": 0.033301067,\n      \"level_sh\": 0.88402712,\n      \"change_sh\": 0.11597289,\n      \"division_s\": \"Clothing and footwear\",\n      \"division_sh\": \"Clothing and footwear\",\n      \"date2\": \"01-10-1988\",\n      \"date4\": \"1988-10-01\",\n      \"year\": 1988.0,\n      \"month\": 10.0,\n      \"quarter\": 4.0\n    }\n  ],\n  \"column names\": [\n    \"date\",\n    \"division\",\n    \"up\",\n    \"down\",\n    \"level\",\n    \"up_ch\",\n    \"down_ch\",\n    \"total\",\n    \"up_sh\",\n    \"down_sh\",\n    \"level_sh\",\n    \"change_sh\",\n    \"division_s\",\n    \"division_sh\",\n    \"date2\",\n    \"date4\",\n    \"year\",\n    \"month\",\n    \"quarter\"\n  ]\n}\n\nYour Job:\nI am developing a NL to Data Visualization Dataset. \nPlease help me generate natural language utterance for given dataset and constraints.\nDefinition about the Taks:\n- 'utterance' is what a user would say to make a chart. It should be a commands structure. One NL 'utterance' is in one or two sentences. Here are two examples from Commands for reference:\n    Show me a bar graph of the profit for each region.\n    Draw axes for AVG(Horsepower) vs Year, colored by Origin.\n- 'given dataset' is in form of column names, column type, range/unique values of the column.\n- 'constraints' are information about the chart that should be included in the utterance. \n    So we can find a reference phrase in the NL utterance that corresponds to the given constraints. \n- 'reference phrase' can be explicit, ambiguous, and by_value. 'ambiguous' means the phrase can map to more than one columns in the dataset, always a hypernym of column names(depending on the dataset values).\n    For example:\n    {\"column\": \"gdpPercap\", \"nl_ref_type\": \"explicit\", \"nl_ref_phrase\": \"GDP per capita\"},\n    {\"column\": [\"country\",\"continent\"], \"nl_ref_type\": \"ambiguous\", \"nl_ref_phrase\": \"region\"}\n    {\"column\": [\"country\",\"country_short_name\"], \"nl_ref_type\": \"ambiguous\", \"nl_ref_phrase\": \"countries\"}\n    {\"c_type\": \"mark\", \"c_name\": \"point chart\", \"nl_ref_type\": \"explicit\", \"nl_ref_phrase\": \"scatter plot\"}\n    {\"c_type\": \"mark\", \"c_name\": \"arc chart\", \"nl_ref_type\": \"explicit\", \"nl_ref_phrase\": \"pie chart\"}\n    {\"c_type\": \"transform\",\"c_name\": \"filter\",\"c_list\": [{\"field\": \"country\",\"oneOf\": [\"Iceland\",\"Norway\"]}],\"nl_ref_type\": \"explicit\",\"nl_ref_phrase\": \"for countries Iceland and Norway\"},\n    {\"c_type\": \"transform\",\"c_name\": \"filter\",\"c_list\": [{\"field\": \"country\",\"oneOf\": [\"Iceland\",\"Norway\"]}],\"nl_ref_type\": \"by_value\",\"nl_ref_phrase\": \"for Iceland and Norway\"},\n- the 'nl_ref_phrase' for 'ambiguous' columns should be equally near all ambiguous columns, not too near to one of the column since it would not be ambiguous.\n    good example: {\"column\": [\"country\",\"region\"], \"nl_ref_type\": \"ambiguous\", \"nl_ref_phrase\": \"location\"}\n    bad example: {\"column\": [\"country\",\"region\"], \"nl_ref_type\": \"ambiguous\", \"nl_ref_phrase\": \"region\"}\n- You only include given constraints and no other information. \n    For example, if a column name is not in the given constraint, it will not be included in the NL utterance.\n    Also, it a chart mark or chart encoding channel is not in the given constraint, it will not be included in the NL utterance.\n- all 'nl_ref_phrase' shoule be included in the 'nl_utterance'. \n\nThe output format is identical to the input format, but fill in the str blanks(\"...\").\n### Input:\n{\n  \"nl_utterance\": \"...\",\n  \"encoded_fields\": [\n    {\n      \"field\": \"down_sh\",\n      \"type\": \"quantitative\",\n      \"nl_ref_type\": \"explicit\",\n      \"nl_ref_phrase\": \"...\"\n    }\n  ],\n  \"constraints\": [\n    {\n      \"c_type\": \"mark\",\n      \"c_name\": \"rect chart\",\n      \"c_list\": [\n        {\n          \"mark\": \"rect\",\n          \"encoding\": {\n            \"x\": {},\n            \"y\": {},\n            \"color\": {\n              \"type\": \"quantitative\"\n            },\n            \"column\": {\n              \"ignore\": true,\n              \"type\": \"nominal\"\n            },\n            \"row\": {\n              \"ignore\": true,\n              \"type\": \"nominal\"\n            }\n          },\n          \"unique_map\": {\n            \"(x,y)\": \"color\"\n          }\n        }\n      ],\n      \"nl_ref_type\": \"explicit\",\n      \"nl_ref_phrase\": \"...\"\n    },\n    {\n      \"c_type\": \"transform\",\n      \"c_name\": \"filter\",\n      \"c_list\": [\n        {\n          \"field\": \"up_sh\",\n          \"lt\": 0.25\n        }\n      ],\n      \"nl_ref_type\": \"by_value\",\n      \"nl_ref_phrase\": \"...\"\n    },\n    {\n      \"c_type\": \"transform\",\n      \"c_name\": \"filter\",\n      \"c_list\": [\n        {\n          \"field\": \"down_sh\",\n          \"lt\": 0.25\n        }\n      ],\n      \"nl_ref_type\": \"by_value\",\n      \"nl_ref_phrase\": \"...\"\n    }\n  ]\n}\n\n### Output:"
}