{
  "gpt_result": {
    "nl_utterance": "Show the trend of CAPE from 1900 to 2023 over time.",
    "encoded_fields": [
      {
        "field": "Date",
        "type": "quantitative",
        "nl_ref_type": "explicit",
        "nl_ref_phrase": "over time"
      },
      {
        "field": "CAPE",
        "type": "quantitative",
        "nl_ref_type": "explicit",
        "nl_ref_phrase": "CAPE"
      }
    ],
    "constraints": [
      {
        "c_type": "transform",
        "c_name": "filter",
        "c_list": [
          {
            "field": "Date",
            "range": [
              {
                "year": 1900,
                "month": 1,
                "day": 1
              },
              {
                "year": 2023,
                "month": 11,
                "day": 1
              }
            ]
          }
        ],
        "nl_ref_type": "explicit",
        "nl_ref_phrase": "from 1900 to 2023"
      }
    ]
  },
  "input": "Dataset Information: {\n  \"data samples\": [\n    {\n      \"Date\": 1871.01,\n      \"year\": 1871,\n      \"month\": 1,\n      \"date2\": \"1871-1-01\",\n      \"Price\": 4.44,\n      \"Dividend\": 0.26,\n      \"Earnings\": 0.4,\n      \"CPI\": 12.46406116,\n      \"R\": 5.32,\n      \"PriceReal\": 105.4820771,\n      \"DividendReal\": 6.176878388,\n      \"RealTotalReturn\": 105.4820771,\n      \"EarningsReal\": 9.502889827,\n      \"CAPE\": NaN\n    },\n    {\n      \"Date\": 2010.08,\n      \"year\": 2010,\n      \"month\": 8,\n      \"date2\": \"2010-8-01\",\n      \"Price\": 1087.28,\n      \"Dividend\": 22.24666667,\n      \"Earnings\": 70.27333333,\n      \"CPI\": 218.312,\n      \"R\": 2.7,\n      \"PriceReal\": 1474.752243,\n      \"DividendReal\": 30.17467586,\n      \"RealTotalReturn\": 759549.3242,\n      \"EarningsReal\": 95.31652929,\n      \"CAPE\": 19.77029917\n    },\n    {\n      \"Date\": 1892.08,\n      \"year\": 1892,\n      \"month\": 8,\n      \"date2\": \"1892-8-01\",\n      \"Price\": 5.62,\n      \"Dividend\": 0.2333,\n      \"Earnings\": 0.36,\n      \"CPI\": 7.326212727,\n      \"R\": 3.6875,\n      \"PriceReal\": 227.1496463,\n      \"DividendReal\": 9.429539589,\n      \"RealTotalReturn\": 741.8993381,\n      \"EarningsReal\": 14.55051115,\n      \"CAPE\": 19.2043038\n    },\n    {\n      \"Date\": 1913.06,\n      \"year\": 1913,\n      \"month\": 6,\n      \"date2\": \"1913-6-01\",\n      \"Price\": 8.12,\n      \"Dividend\": 0.48,\n      \"Earnings\": 0.665,\n      \"CPI\": 9.8,\n      \"R\": 4.329166667,\n      \"PriceReal\": 245.3495286,\n      \"DividendReal\": 14.50342041,\n      \"RealTotalReturn\": 2041.331218,\n      \"EarningsReal\": 20.09328036,\n      \"CAPE\": 11.49196285\n    },\n    {\n      \"Date\": 1928.03,\n      \"year\": 1928,\n      \"month\": 3,\n      \"date2\": \"1928-3-01\",\n      \"Price\": 18.25,\n      \"Dividend\": 0.79,\n      \"Earnings\": 1.177,\n      \"CPI\": 17.1,\n      \"R\": 3.375,\n      \"PriceReal\": 316.0254313,\n      \"DividendReal\": 13.68000497,\n      \"RealTotalReturn\": 6379.561852,\n      \"EarningsReal\": 20.38147576,\n      \"CAPE\": 19.9434178\n    }\n  ],\n  \"column names\": [\n    \"Date\",\n    \"year\",\n    \"month\",\n    \"date2\",\n    \"Price\",\n    \"Dividend\",\n    \"Earnings\",\n    \"CPI\",\n    \"R\",\n    \"PriceReal\",\n    \"DividendReal\",\n    \"RealTotalReturn\",\n    \"EarningsReal\",\n    \"CAPE\"\n  ]\n}\n\nYour Job:\nI am developing a NL to Data Visualization Dataset. \nPlease help me generate natural language utterance for given dataset and constraints.\nDefinition about the Taks:\n- 'utterance' is what a user would say to make a chart.  One NL 'utterance' is in one or two sentences. Here are two examples from Others for reference:\n    scatter(x=production budget, y=worldwide gross) for content rating.\n    Trend for average horsepower over time across different origin.\n- 'given dataset' is in form of column names, column type, range/unique values of the column.\n- 'constraints' are information about the chart that should be included in the utterance. \n    So we can find a reference phrase in the NL utterance that corresponds to the given constraints. \n- 'reference phrase' can be explicit, ambiguous, and by_value. 'ambiguous' means the phrase can map to more than one columns in the dataset, always a hypernym of column names(depending on the dataset values).\n    For example:\n    {\"column\": \"gdpPercap\", \"nl_ref_type\": \"explicit\", \"nl_ref_phrase\": \"GDP per capita\"},\n    {\"column\": [\"country\",\"continent\"], \"nl_ref_type\": \"ambiguous\", \"nl_ref_phrase\": \"region\"}\n    {\"column\": [\"country\",\"country_short_name\"], \"nl_ref_type\": \"ambiguous\", \"nl_ref_phrase\": \"countries\"}\n    {\"c_type\": \"mark\", \"c_name\": \"point chart\", \"nl_ref_type\": \"explicit\", \"nl_ref_phrase\": \"scatter plot\"}\n    {\"c_type\": \"mark\", \"c_name\": \"arc chart\", \"nl_ref_type\": \"explicit\", \"nl_ref_phrase\": \"pie chart\"}\n    {\"c_type\": \"transform\",\"c_name\": \"filter\",\"c_list\": [{\"field\": \"country\",\"oneOf\": [\"Iceland\",\"Norway\"]}],\"nl_ref_type\": \"explicit\",\"nl_ref_phrase\": \"for countries Iceland and Norway\"},\n    {\"c_type\": \"transform\",\"c_name\": \"filter\",\"c_list\": [{\"field\": \"country\",\"oneOf\": [\"Iceland\",\"Norway\"]}],\"nl_ref_type\": \"by_value\",\"nl_ref_phrase\": \"for Iceland and Norway\"},\n- the 'nl_ref_phrase' for 'ambiguous' columns should be equally near all ambiguous columns, not too near to one of the column since it would not be ambiguous.\n    good example: {\"column\": [\"country\",\"region\"], \"nl_ref_type\": \"ambiguous\", \"nl_ref_phrase\": \"location\"}\n    bad example: {\"column\": [\"country\",\"region\"], \"nl_ref_type\": \"ambiguous\", \"nl_ref_phrase\": \"region\"}\n- You only include given constraints and no other information. \n    For example, if a column name is not in the given constraint, it will not be included in the NL utterance.\n    Also, it a chart mark or chart encoding channel is not in the given constraint, it will not be included in the NL utterance.\n- all 'nl_ref_phrase' shoule be included in the 'nl_utterance'. \n\nThe output format is identical to the input format, but fill in the str blanks(\"...\").\n### Input:\n{\n  \"nl_utterance\": \"...\",\n  \"encoded_fields\": [\n    {\n      \"field\": \"Date\",\n      \"type\": \"quantitative\",\n      \"nl_ref_type\": \"explicit\",\n      \"nl_ref_phrase\": \"...\"\n    },\n    {\n      \"field\": \"CAPE\",\n      \"type\": \"quantitative\",\n      \"nl_ref_type\": \"explicit\",\n      \"nl_ref_phrase\": \"...\"\n    }\n  ],\n  \"constraints\": [\n    {\n      \"c_type\": \"transform\",\n      \"c_name\": \"filter\",\n      \"c_list\": [\n        {\n          \"field\": \"Date\",\n          \"range\": [\n            {\n              \"year\": 1900,\n              \"month\": 1,\n              \"day\": 1\n            },\n            {\n              \"year\": 2023,\n              \"month\": 11,\n              \"day\": 1\n            }\n          ]\n        }\n      ],\n      \"nl_ref_type\": \"explicit\",\n      \"nl_ref_phrase\": \"...\"\n    }\n  ]\n}\n\n### Output:"
}