{
  "gpt_result": {
    "nl_utterance": "Create a line chart showing the trend of the total percentage over the years, and sum the total percentage for each year.",
    "encoded_fields": [
      {
        "field": "Year",
        "type": "quantitative",
        "nl_ref_type": "explicit",
        "nl_ref_phrase": "years"
      },
      {
        "field": "Totals%",
        "type": "quantitative",
        "nl_ref_type": "explicit",
        "nl_ref_phrase": "total percentage"
      }
    ],
    "constraints": [
      {
        "c_type": "task",
        "c_name": "trend",
        "c_list": [
          {
            "mark": [
              "bar",
              "line",
              "area"
            ],
            "encoding": {
              "x": {
                "type": "temporal"
              }
            }
          }
        ],
        "nl_ref_type": "explicit",
        "nl_ref_phrase": "trend"
      },
      {
        "c_type": "transform",
        "c_name": "aggregate",
        "c_list": [
          {
            "field": "Totals%",
            "aggregate": "sum"
          }
        ],
        "nl_ref_type": "explicit",
        "nl_ref_phrase": "sum the total percentage"
      }
    ]
  },
  "input": "Dataset Information: {\n  \"data samples\": [\n    {\n      \"Date\": \"08/31/2022\",\n      \"GRA Purchases\": 93769635059.0,\n      \"PRGT 1/2/\": 15254184552.0,\n      \"Totals\": 109000000000.0,\n      \"Year\": 2022.0,\n      \"Totals(Bn)\": 109.0238196,\n      \"World GDP\": NaN,\n      \"World GDP(Bn)\": NaN,\n      \"Totals/WGDP\": NaN,\n      \"Totals%\": NaN\n    },\n    {\n      \"Date\": \"12/31/1987\",\n      \"GRA Purchases\": 28751979125.0,\n      \"PRGT 1/2/\": 1866342930.0,\n      \"Totals\": 30618322055.0,\n      \"Year\": 1987.0,\n      \"Totals(Bn)\": 30.61832206,\n      \"World GDP\": 17300000000000.0,\n      \"World GDP(Bn)\": 17300.0,\n      \"Totals/WGDP\": 0.0,\n      \"Totals%\": 0.176984521\n    },\n    {\n      \"Date\": \"12/31/2002\",\n      \"GRA Purchases\": 63601058794.0,\n      \"PRGT 1/2/\": 6868671012.0,\n      \"Totals\": 70469729806.0,\n      \"Year\": 2002.0,\n      \"Totals(Bn)\": 70.46972981,\n      \"World GDP\": 34900000000000.0,\n      \"World GDP(Bn)\": 34900.0,\n      \"Totals/WGDP\": 0.0,\n      \"Totals%\": 0.201918997\n    },\n    {\n      \"Date\": \"12/31/2013\",\n      \"GRA Purchases\": 83899249061.0,\n      \"PRGT 1/2/\": 6174392682.0,\n      \"Totals\": 90073641743.0,\n      \"Year\": 2013.0,\n      \"Totals(Bn)\": 90.07364174,\n      \"World GDP\": 77600000000000.0,\n      \"World GDP(Bn)\": 77600.0,\n      \"Totals/WGDP\": 0.0,\n      \"Totals%\": 0.116074281\n    },\n    {\n      \"Date\": \"12/31/1988\",\n      \"GRA Purchases\": 24750004884.0,\n      \"PRGT 1/2/\": 1773964293.0,\n      \"Totals\": 26523969177.0,\n      \"Year\": 1988.0,\n      \"Totals(Bn)\": 26.52396918,\n      \"World GDP\": 19300000000000.0,\n      \"World GDP(Bn)\": 19300.0,\n      \"Totals/WGDP\": 0.0,\n      \"Totals%\": 0.137429892\n    }\n  ],\n  \"column names\": [\n    \"Date\",\n    \"GRA Purchases\",\n    \"PRGT 1/2/\",\n    \"Totals\",\n    \"Year\",\n    \"Totals(Bn)\",\n    \"World GDP\",\n    \"World GDP(Bn)\",\n    \"Totals/WGDP\",\n    \"Totals%\"\n  ]\n}\n\nYour Job:\nI am developing a NL to Data Visualization Dataset. \nPlease help me generate natural language utterance for given dataset and constraints.\nDefinition about the Taks:\n- 'utterance' is what a user would say to make a chart. It should be a commands structure. One NL 'utterance' is in one or two sentences. Here are two examples from Commands for reference:\n    Make the bars stacked with the ship status.\n    Please show me a histogram of weights with 500 intervals.\n- 'given dataset' is in form of column names, column type, range/unique values of the column.\n- 'constraints' are information about the chart that should be included in the utterance. \n    So we can find a reference phrase in the NL utterance that corresponds to the given constraints. \n- 'reference phrase' can be explicit, ambiguous, and by_value. 'ambiguous' means the phrase can map to more than one columns in the dataset, always a hypernym of column names(depending on the dataset values).\n    For example:\n    {\"column\": \"gdpPercap\", \"nl_ref_type\": \"explicit\", \"nl_ref_phrase\": \"GDP per capita\"},\n    {\"column\": [\"country\",\"continent\"], \"nl_ref_type\": \"ambiguous\", \"nl_ref_phrase\": \"region\"}\n    {\"column\": [\"country\",\"country_short_name\"], \"nl_ref_type\": \"ambiguous\", \"nl_ref_phrase\": \"countries\"}\n    {\"c_type\": \"mark\", \"c_name\": \"point chart\", \"nl_ref_type\": \"explicit\", \"nl_ref_phrase\": \"scatter plot\"}\n    {\"c_type\": \"mark\", \"c_name\": \"arc chart\", \"nl_ref_type\": \"explicit\", \"nl_ref_phrase\": \"pie chart\"}\n    {\"c_type\": \"transform\",\"c_name\": \"filter\",\"c_list\": [{\"field\": \"country\",\"oneOf\": [\"Iceland\",\"Norway\"]}],\"nl_ref_type\": \"explicit\",\"nl_ref_phrase\": \"for countries Iceland and Norway\"},\n    {\"c_type\": \"transform\",\"c_name\": \"filter\",\"c_list\": [{\"field\": \"country\",\"oneOf\": [\"Iceland\",\"Norway\"]}],\"nl_ref_type\": \"by_value\",\"nl_ref_phrase\": \"for Iceland and Norway\"},\n- the 'nl_ref_phrase' for 'ambiguous' columns should be equally near all ambiguous columns, not too near to one of the column since it would not be ambiguous.\n    good example: {\"column\": [\"country\",\"region\"], \"nl_ref_type\": \"ambiguous\", \"nl_ref_phrase\": \"location\"}\n    bad example: {\"column\": [\"country\",\"region\"], \"nl_ref_type\": \"ambiguous\", \"nl_ref_phrase\": \"region\"}\n- You only include given constraints and no other information. \n    For example, if a column name is not in the given constraint, it will not be included in the NL utterance.\n    Also, it a chart mark or chart encoding channel is not in the given constraint, it will not be included in the NL utterance.\n- all 'nl_ref_phrase' shoule be included in the 'nl_utterance'. \n\nThe output format is identical to the input format, but fill in the str blanks(\"...\").\n### Input:\n{\n  \"nl_utterance\": \"...\",\n  \"encoded_fields\": [\n    {\n      \"field\": \"Year\",\n      \"type\": \"quantitative\",\n      \"nl_ref_type\": \"explicit\",\n      \"nl_ref_phrase\": \"...\"\n    },\n    {\n      \"field\": \"Totals%\",\n      \"type\": \"quantitative\",\n      \"nl_ref_type\": \"explicit\",\n      \"nl_ref_phrase\": \"...\"\n    }\n  ],\n  \"constraints\": [\n    {\n      \"c_type\": \"task\",\n      \"c_name\": \"trend\",\n      \"c_list\": [\n        {\n          \"mark\": [\n            \"bar\",\n            \"line\",\n            \"area\"\n          ],\n          \"encoding\": {\n            \"x\": {\n              \"type\": \"temporal\"\n            }\n          }\n        }\n      ],\n      \"nl_ref_type\": \"explicit\",\n      \"nl_ref_phrase\": \"...\"\n    },\n    {\n      \"c_type\": \"transform\",\n      \"c_name\": \"aggregate\",\n      \"c_list\": [\n        {\n          \"field\": \"Totals%\",\n          \"aggregate\": \"sum\"\n        }\n      ],\n      \"nl_ref_type\": \"explicit\",\n      \"nl_ref_phrase\": \"...\"\n    }\n  ]\n}\n\n### Output:"
}