{
  "gpt_result": {
    "nl_utterance": "What is the count of entries where the share of up is less than 0.25 and the share of down is less than 0.25?",
    "encoded_fields": [
      {
        "field": "down_sh",
        "type": "quantitative",
        "nl_ref_type": "explicit",
        "nl_ref_phrase": "share of down"
      }
    ],
    "constraints": [
      {
        "c_type": "transform",
        "c_name": "filter",
        "c_list": [
          {
            "field": "up_sh",
            "lt": 0.25
          }
        ],
        "nl_ref_type": "explicit",
        "nl_ref_phrase": "share of up is less than 0.25"
      },
      {
        "c_type": "transform",
        "c_name": "filter",
        "c_list": [
          {
            "field": "down_sh",
            "lt": 0.25
          }
        ],
        "nl_ref_type": "explicit",
        "nl_ref_phrase": "share of down is less than 0.25"
      },
      {
        "c_type": "transform",
        "c_name": "aggregate",
        "c_list": [
          {
            "aggregate": "count"
          }
        ],
        "nl_ref_type": "explicit",
        "nl_ref_phrase": "count of entries"
      }
    ]
  },
  "input": "Dataset Information: {\n  \"data samples\": [\n    {\n      \"date\": 1.0,\n      \"division\": 4,\n      \"up\": 0,\n      \"down\": 0,\n      \"level\": 0,\n      \"up_ch\": NaN,\n      \"down_ch\": NaN,\n      \"total\": 0,\n      \"up_sh\": NaN,\n      \"down_sh\": NaN,\n      \"level_sh\": NaN,\n      \"change_sh\": NaN,\n      \"division_s\": \"Housing, Water, Electricity, Gas and other fuels\",\n      \"division_sh\": \"Housing & utilities\",\n      \"date2\": \"01-02-1988\",\n      \"date4\": \"1988-02-01\",\n      \"year\": 1988.0,\n      \"month\": 2.0,\n      \"quarter\": 1.0\n    },\n    {\n      \"date\": 143.0,\n      \"division\": 5,\n      \"up\": 1170,\n      \"down\": 715,\n      \"level\": 9873,\n      \"up_ch\": 0.22556387,\n      \"down_ch\": -0.12533978,\n      \"total\": 11758,\n      \"up_sh\": 0.099506721,\n      \"down_sh\": 0.060809661,\n      \"level_sh\": 0.83968359,\n      \"change_sh\": 0.16031638,\n      \"division_s\": \"Furnishings, household equipment and maintenance\",\n      \"division_sh\": \"Household\",\n      \"date2\": \"01-12-1999\",\n      \"date4\": \"1999-12-01\",\n      \"year\": 1999.0,\n      \"month\": 12.0,\n      \"quarter\": 4.0\n    },\n    {\n      \"date\": 244.0,\n      \"division\": 11,\n      \"up\": 947,\n      \"down\": 162,\n      \"level\": 10576,\n      \"up_ch\": 0.0647652,\n      \"down_ch\": -0.06771668,\n      \"total\": 11685,\n      \"up_sh\": 0.08104407,\n      \"down_sh\": 0.013863928,\n      \"level_sh\": 0.905092,\n      \"change_sh\": 0.094907999,\n      \"division_s\": \"Restaurants and Hotels\",\n      \"division_sh\": \"Restaurants & Hotels\",\n      \"date2\": \"01-05-2008\",\n      \"date4\": \"2008-05-01\",\n      \"year\": 2008.0,\n      \"month\": 5.0,\n      \"quarter\": 2.0\n    },\n    {\n      \"date\": 402.0,\n      \"division\": 8,\n      \"up\": 5,\n      \"down\": 35,\n      \"level\": 396,\n      \"up_ch\": 0.30862978,\n      \"down_ch\": -0.200111,\n      \"total\": 436,\n      \"up_sh\": 0.01146789,\n      \"down_sh\": 0.08027523,\n      \"level_sh\": 0.90825689,\n      \"change_sh\": 0.091743119,\n      \"division_s\": \"Communication\",\n      \"division_sh\": \"Communication\",\n      \"date2\": \"01-07-2021\",\n      \"date4\": \"2021-07-01\",\n      \"year\": 2021.0,\n      \"month\": 7.0,\n      \"quarter\": 3.0\n    },\n    {\n      \"date\": 353.0,\n      \"division\": 1,\n      \"up\": 2696,\n      \"down\": 2650,\n      \"level\": 22367,\n      \"up_ch\": 0.18389273,\n      \"down_ch\": -0.20000002,\n      \"total\": 27713,\n      \"up_sh\": 0.097282864,\n      \"down_sh\": 0.095622994,\n      \"level_sh\": 0.80709416,\n      \"change_sh\": 0.19290586,\n      \"division_s\": \"Food and non-alcoholic beverages\",\n      \"division_sh\": \"Food & drink\",\n      \"date2\": \"01-06-2017\",\n      \"date4\": \"2017-06-01\",\n      \"year\": 2017.0,\n      \"month\": 6.0,\n      \"quarter\": 2.0\n    }\n  ],\n  \"column names\": [\n    \"date\",\n    \"division\",\n    \"up\",\n    \"down\",\n    \"level\",\n    \"up_ch\",\n    \"down_ch\",\n    \"total\",\n    \"up_sh\",\n    \"down_sh\",\n    \"level_sh\",\n    \"change_sh\",\n    \"division_s\",\n    \"division_sh\",\n    \"date2\",\n    \"date4\",\n    \"year\",\n    \"month\",\n    \"quarter\"\n  ]\n}\n\nYour Job:\nI am developing a NL to Data Visualization Dataset. \nPlease help me generate natural language utterance for given dataset and constraints.\nDefinition about the Taks:\n- 'utterance' is what a user would say to make a chart. It should be a questions structure. One NL 'utterance' is in one or two sentences. Here are two examples from Questions for reference:\n    How many cars do each country manufacture?\n    How much do various cars weigh?\n- 'given dataset' is in form of column names, column type, range/unique values of the column.\n- 'constraints' are information about the chart that should be included in the utterance. \n    So we can find a reference phrase in the NL utterance that corresponds to the given constraints. \n- 'reference phrase' can be explicit, ambiguous, and by_value. 'ambiguous' means the phrase can map to more than one columns in the dataset, always a hypernym of column names(depending on the dataset values).\n    For example:\n    {\"column\": \"gdpPercap\", \"nl_ref_type\": \"explicit\", \"nl_ref_phrase\": \"GDP per capita\"},\n    {\"column\": [\"country\",\"continent\"], \"nl_ref_type\": \"ambiguous\", \"nl_ref_phrase\": \"region\"}\n    {\"column\": [\"country\",\"country_short_name\"], \"nl_ref_type\": \"ambiguous\", \"nl_ref_phrase\": \"countries\"}\n    {\"c_type\": \"mark\", \"c_name\": \"point chart\", \"nl_ref_type\": \"explicit\", \"nl_ref_phrase\": \"scatter plot\"}\n    {\"c_type\": \"mark\", \"c_name\": \"arc chart\", \"nl_ref_type\": \"explicit\", \"nl_ref_phrase\": \"pie chart\"}\n    {\"c_type\": \"transform\",\"c_name\": \"filter\",\"c_list\": [{\"field\": \"country\",\"oneOf\": [\"Iceland\",\"Norway\"]}],\"nl_ref_type\": \"explicit\",\"nl_ref_phrase\": \"for countries Iceland and Norway\"},\n    {\"c_type\": \"transform\",\"c_name\": \"filter\",\"c_list\": [{\"field\": \"country\",\"oneOf\": [\"Iceland\",\"Norway\"]}],\"nl_ref_type\": \"by_value\",\"nl_ref_phrase\": \"for Iceland and Norway\"},\n- the 'nl_ref_phrase' for 'ambiguous' columns should be equally near all ambiguous columns, not too near to one of the column since it would not be ambiguous.\n    good example: {\"column\": [\"country\",\"region\"], \"nl_ref_type\": \"ambiguous\", \"nl_ref_phrase\": \"location\"}\n    bad example: {\"column\": [\"country\",\"region\"], \"nl_ref_type\": \"ambiguous\", \"nl_ref_phrase\": \"region\"}\n- You only include given constraints and no other information. \n    For example, if a column name is not in the given constraint, it will not be included in the NL utterance.\n    Also, it a chart mark or chart encoding channel is not in the given constraint, it will not be included in the NL utterance.\n- all 'nl_ref_phrase' shoule be included in the 'nl_utterance'. \n\nThe output format is identical to the input format, but fill in the str blanks(\"...\").\n### Input:\n{\n  \"nl_utterance\": \"...\",\n  \"encoded_fields\": [\n    {\n      \"field\": \"down_sh\",\n      \"type\": \"quantitative\",\n      \"nl_ref_type\": \"explicit\",\n      \"nl_ref_phrase\": \"...\"\n    }\n  ],\n  \"constraints\": [\n    {\n      \"c_type\": \"transform\",\n      \"c_name\": \"filter\",\n      \"c_list\": [\n        {\n          \"field\": \"up_sh\",\n          \"lt\": 0.25\n        }\n      ],\n      \"nl_ref_type\": \"explicit\",\n      \"nl_ref_phrase\": \"...\"\n    },\n    {\n      \"c_type\": \"transform\",\n      \"c_name\": \"filter\",\n      \"c_list\": [\n        {\n          \"field\": \"down_sh\",\n          \"lt\": 0.25\n        }\n      ],\n      \"nl_ref_type\": \"explicit\",\n      \"nl_ref_phrase\": \"...\"\n    },\n    {\n      \"c_type\": \"transform\",\n      \"c_name\": \"aggregate\",\n      \"c_list\": [\n        {\n          \"aggregate\": \"count\"\n        }\n      ],\n      \"nl_ref_type\": \"explicit\",\n      \"nl_ref_phrase\": \"...\"\n    }\n  ]\n}\n\n### Output:"
}