{
  "gpt_result": {
    "nl_utterance": "Create a bar chart to display the mean profit by location.",
    "encoded_fields": [
      {
        "field": "Profit",
        "type": "quantitative",
        "nl_ref_type": "explicit",
        "nl_ref_phrase": "profit"
      },
      {
        "field": [
          "State",
          "City",
          "Country",
          "Region",
          "Postal Code"
        ],
        "type": "nominal",
        "nl_ref_type": "ambiguous",
        "nl_ref_phrase": "location"
      }
    ],
    "constraints": [
      {
        "c_type": "transform",
        "c_name": "aggregate",
        "c_list": [
          {
            "field": "Profit",
            "aggregate": "mean"
          }
        ],
        "nl_ref_type": "explicit",
        "nl_ref_phrase": "mean profit"
      }
    ]
  },
  "input": "Dataset Information: {\n  \"data samples\": [\n    {\n      \"Days to Ship Actual\": 6,\n      \"Sales Forecast\": 293,\n      \"Ship Status\": \"Shipped On Time\",\n      \"Days to Ship Scheduled\": 6,\n      \"Sales per Customer\": \"$209.30 \",\n      \"Profit Ratio\": \"27.00%\",\n      \"Category\": \"Office Supplies\",\n      \"City\": \"Columbus\",\n      \"Country\": \"United States\",\n      \"Customer Name\": \"Chuck Clark\",\n      \"Days to Ship Actual (bin)\": 5,\n      \"Discount\": 0,\n      \"Number of Records\": 1,\n      \"Order Date\": \"12/30/2017\",\n      \"Order ID\": \"CA-2017-126221\",\n      \"Postal Code\": 47201,\n      \"Product Name\": \"Eureka The Boss Plus 12-Amp Hard Box Upright Vacuum, Red\",\n      \"Profit\": 56.511,\n      \"Quantity\": 2,\n      \"Region\": \"Central\",\n      \"Sales (bin)\": \"$0 \",\n      \"Sales\": 209.3,\n      \"Segment\": \"Home Office\",\n      \"Ship Date\": \"1/5/2018\",\n      \"Ship Mode\": \"Standard Class\",\n      \"State\": \"Indiana\",\n      \"Sub-Category\": \"Appliances\"\n    },\n    {\n      \"Days to Ship Actual\": 2,\n      \"Sales Forecast\": 22,\n      \"Ship Status\": \"Shipped Late\",\n      \"Days to Ship Scheduled\": 1,\n      \"Sales per Customer\": \"$15.92 \",\n      \"Profit Ratio\": \"47.00%\",\n      \"Category\": \"Office Supplies\",\n      \"City\": \"Atlanta\",\n      \"Country\": \"United States\",\n      \"Customer Name\": \"John Stevenson\",\n      \"Days to Ship Actual (bin)\": 1,\n      \"Discount\": 0,\n      \"Number of Records\": 1,\n      \"Order Date\": \"2/12/2016\",\n      \"Order ID\": \"CA-2016-110492\",\n      \"Postal Code\": 30318,\n      \"Product Name\": \"Avery Durable Slant Ring Binders, No Labels\",\n      \"Profit\": 7.4824,\n      \"Quantity\": 4,\n      \"Region\": \"South\",\n      \"Sales (bin)\": \"$0 \",\n      \"Sales\": 15.92,\n      \"Segment\": \"Consumer\",\n      \"Ship Date\": \"2/14/2016\",\n      \"Ship Mode\": \"First Class\",\n      \"State\": \"Georgia\",\n      \"Sub-Category\": \"Binders\"\n    },\n    {\n      \"Days to Ship Actual\": 0,\n      \"Sales Forecast\": 101,\n      \"Ship Status\": \"Shipped On Time\",\n      \"Days to Ship Scheduled\": 0,\n      \"Sales per Customer\": \"$71.98 \",\n      \"Profit Ratio\": \"12.50%\",\n      \"Category\": \"Technology\",\n      \"City\": \"Seattle\",\n      \"Country\": \"United States\",\n      \"Customer Name\": \"Rick Bensley\",\n      \"Days to Ship Actual (bin)\": 0,\n      \"Discount\": 20,\n      \"Number of Records\": 1,\n      \"Order Date\": \"7/4/2016\",\n      \"Order ID\": \"CA-2016-103107\",\n      \"Postal Code\": 98103,\n      \"Product Name\": \"OtterBox Defender Series Case - Samsung Galaxy S4\",\n      \"Profit\": 8.997,\n      \"Quantity\": 3,\n      \"Region\": \"West\",\n      \"Sales (bin)\": \"$0 \",\n      \"Sales\": 71.976,\n      \"Segment\": \"Home Office\",\n      \"Ship Date\": \"7/4/2016\",\n      \"Ship Mode\": \"Same Day\",\n      \"State\": \"Washington\",\n      \"Sub-Category\": \"Phones\"\n    },\n    {\n      \"Days to Ship Actual\": 5,\n      \"Sales Forecast\": 61,\n      \"Ship Status\": \"Shipped Early\",\n      \"Days to Ship Scheduled\": 6,\n      \"Sales per Customer\": \"$43.37 \",\n      \"Profit Ratio\": \"-160.00%\",\n      \"Category\": \"Office Supplies\",\n      \"City\": \"Danville\",\n      \"Country\": \"United States\",\n      \"Customer Name\": \"Tony Chapman\",\n      \"Days to Ship Actual (bin)\": 5,\n      \"Discount\": 80,\n      \"Number of Records\": 1,\n      \"Order Date\": \"4/30/2017\",\n      \"Order ID\": \"US-2017-144582\",\n      \"Postal Code\": 61832,\n      \"Product Name\": \"GBC Linen Binding Covers\",\n      \"Profit\": -69.3952,\n      \"Quantity\": 7,\n      \"Region\": \"Central\",\n      \"Sales (bin)\": \"$0 \",\n      \"Sales\": 43.372,\n      \"Segment\": \"Home Office\",\n      \"Ship Date\": \"5/5/2017\",\n      \"Ship Mode\": \"Standard Class\",\n      \"State\": \"Illinois\",\n      \"Sub-Category\": \"Binders\"\n    },\n    {\n      \"Days to Ship Actual\": 6,\n      \"Sales Forecast\": 84,\n      \"Ship Status\": \"Shipped On Time\",\n      \"Days to Ship Scheduled\": 6,\n      \"Sales per Customer\": \"$59.99 \",\n      \"Profit Ratio\": \"-21.70%\",\n      \"Category\": \"Technology\",\n      \"City\": \"Philadelphia\",\n      \"Country\": \"United States\",\n      \"Customer Name\": \"Chad Cunningham\",\n      \"Days to Ship Actual (bin)\": 5,\n      \"Discount\": 40,\n      \"Number of Records\": 1,\n      \"Order Date\": \"7/7/2016\",\n      \"Order ID\": \"CA-2016-129308\",\n      \"Postal Code\": 19120,\n      \"Product Name\": \"Panasonic KX T7731-B Digital phone\",\n      \"Profit\": -12.9987,\n      \"Quantity\": 1,\n      \"Region\": \"East\",\n      \"Sales (bin)\": \"$0 \",\n      \"Sales\": 59.994,\n      \"Segment\": \"Home Office\",\n      \"Ship Date\": \"7/13/2016\",\n      \"Ship Mode\": \"Standard Class\",\n      \"State\": \"Pennsylvania\",\n      \"Sub-Category\": \"Phones\"\n    }\n  ],\n  \"column names\": [\n    \"Days to Ship Actual\",\n    \"Sales Forecast\",\n    \"Ship Status\",\n    \"Days to Ship Scheduled\",\n    \"Sales per Customer\",\n    \"Profit Ratio\",\n    \"Category\",\n    \"City\",\n    \"Country\",\n    \"Customer Name\",\n    \"Days to Ship Actual (bin)\",\n    \"Discount\",\n    \"Number of Records\",\n    \"Order Date\",\n    \"Order ID\",\n    \"Postal Code\",\n    \"Product Name\",\n    \"Profit\",\n    \"Quantity\",\n    \"Region\",\n    \"Sales (bin)\",\n    \"Sales\",\n    \"Segment\",\n    \"Ship Date\",\n    \"Ship Mode\",\n    \"State\",\n    \"Sub-Category\"\n  ]\n}\n\nYour Job:\nI am developing a NL to Data Visualization Dataset. \nPlease help me generate natural language utterance for given dataset and constraints.\nDefinition about the Taks:\n- 'utterance' is what a user would say to make a chart. It should be a commands structure. One NL 'utterance' is in one or two sentences. Here are two examples from Commands for reference:\n    Draw axes for AVG(Horsepower) vs Year, colored by Origin.\n    Create a line chart showing order date and sum of sales, divided by category.\n- 'given dataset' is in form of column names, column type, range/unique values of the column.\n- 'constraints' are information about the chart that should be included in the utterance. \n    So we can find a reference phrase in the NL utterance that corresponds to the given constraints. \n- 'reference phrase' can be explicit, ambiguous, and by_value. 'ambiguous' means the phrase can map to more than one columns in the dataset, always a hypernym of column names(depending on the dataset values).\n    For example:\n    {\"column\": \"gdpPercap\", \"nl_ref_type\": \"explicit\", \"nl_ref_phrase\": \"GDP per capita\"},\n    {\"column\": [\"country\",\"continent\"], \"nl_ref_type\": \"ambiguous\", \"nl_ref_phrase\": \"region\"}\n    {\"column\": [\"country\",\"country_short_name\"], \"nl_ref_type\": \"ambiguous\", \"nl_ref_phrase\": \"countries\"}\n    {\"c_type\": \"mark\", \"c_name\": \"point chart\", \"nl_ref_type\": \"explicit\", \"nl_ref_phrase\": \"scatter plot\"}\n    {\"c_type\": \"mark\", \"c_name\": \"arc chart\", \"nl_ref_type\": \"explicit\", \"nl_ref_phrase\": \"pie chart\"}\n    {\"c_type\": \"transform\",\"c_name\": \"filter\",\"c_list\": [{\"field\": \"country\",\"oneOf\": [\"Iceland\",\"Norway\"]}],\"nl_ref_type\": \"explicit\",\"nl_ref_phrase\": \"for countries Iceland and Norway\"},\n    {\"c_type\": \"transform\",\"c_name\": \"filter\",\"c_list\": [{\"field\": \"country\",\"oneOf\": [\"Iceland\",\"Norway\"]}],\"nl_ref_type\": \"by_value\",\"nl_ref_phrase\": \"for Iceland and Norway\"},\n- the 'nl_ref_phrase' for 'ambiguous' columns should be equally near all ambiguous columns, not too near to one of the column since it would not be ambiguous.\n    good example: {\"column\": [\"country\",\"region\"], \"nl_ref_type\": \"ambiguous\", \"nl_ref_phrase\": \"location\"}\n    bad example: {\"column\": [\"country\",\"region\"], \"nl_ref_type\": \"ambiguous\", \"nl_ref_phrase\": \"region\"}\n- You only include given constraints and no other information. \n    For example, if a column name is not in the given constraint, it will not be included in the NL utterance.\n    Also, it a chart mark or chart encoding channel is not in the given constraint, it will not be included in the NL utterance.\n- all 'nl_ref_phrase' shoule be included in the 'nl_utterance'. \n\nThe output format is identical to the input format, but fill in the str blanks(\"...\").\n### Input:\n{\n  \"nl_utterance\": \"...\",\n  \"encoded_fields\": [\n    {\n      \"field\": \"Profit\",\n      \"type\": \"quantitative\",\n      \"nl_ref_type\": \"explicit\",\n      \"nl_ref_phrase\": \"...\"\n    },\n    {\n      \"field\": [\n        \"State\",\n        \"City\",\n        \"Country\",\n        \"Region\",\n        \"Postal Code\"\n      ],\n      \"type\": \"nominal\",\n      \"nl_ref_type\": \"ambiguous\",\n      \"nl_ref_phrase\": \"...\"\n    }\n  ],\n  \"constraints\": [\n    {\n      \"c_type\": \"transform\",\n      \"c_name\": \"aggregate\",\n      \"c_list\": [\n        {\n          \"field\": \"Profit\",\n          \"aggregate\": \"mean\"\n        }\n      ],\n      \"nl_ref_type\": \"explicit\",\n      \"nl_ref_phrase\": \"...\"\n    }\n  ]\n}\n\n### Output:"
}