{
  "gpt_result": {
    "nl_utterance": "Create a scatter plot of GDP per capita and Human Capital Index filtered for a GDP per capita greater than 1000 and a Human Capital Index greater than 0, and color the points by continent.",
    "encoded_fields": [
      {
        "field": "GDP per capita (PPP)",
        "type": "quantitative",
        "nl_ref_type": "explicit",
        "nl_ref_phrase": "GDP per capita"
      },
      {
        "field": "Human Capital Index",
        "type": "quantitative",
        "nl_ref_type": "explicit",
        "nl_ref_phrase": "Human Capital Index"
      },
      {
        "field": "Continent",
        "type": "nominal",
        "nl_ref_type": "explicit",
        "nl_ref_phrase": "continent"
      },
      {
        "field": "Population",
        "type": "quantitative",
        "nl_ref_type": "explicit",
        "nl_ref_phrase": "Population"
      }
    ],
    "constraints": [
      {
        "c_type": "mark",
        "c_name": "point chart",
        "c_list": [
          {
            "mark": "circle",
            "encoding": {
              "x": {},
              "y": {},
              "color": {
                "type": "nominal",
                "ignore": true
              },
              "size": {
                "ignore": true,
                "type": "quantitative"
              },
              "column": {
                "ignore": true,
                "type": "nominal"
              },
              "row": {
                "ignore": true,
                "type": "nominal"
              }
            }
          }
        ],
        "nl_ref_type": "explicit",
        "nl_ref_phrase": "scatter plot"
      },
      {
        "c_type": "transform",
        "c_name": "filter",
        "c_list": [
          {
            "field": "Human Capital Index",
            "gt": 0
          }
        ],
        "nl_ref_type": "explicit",
        "nl_ref_phrase": "filtered for a Human Capital Index greater than 0"
      },
      {
        "c_type": "transform",
        "c_name": "filter",
        "c_list": [
          {
            "field": "GDP per capita (PPP)",
            "gt": 1000
          }
        ],
        "nl_ref_type": "explicit",
        "nl_ref_phrase": "filtered for a GDP per capita greater than 1000"
      }
    ]
  },
  "input": "Dataset Information: {\n  \"data samples\": [\n    {\n      \"Country\": \"Afghanistan\",\n      \"ISO3\": \"AFG\",\n      \"Region\": \"South Asia\",\n      \"Income Group\": \"Low income\",\n      \"Probability of Survival to Age 5\": 0.93425,\n      \"Expected Years of School\": 9.65539,\n      \"Harmonized Test Scores\": 357.79474,\n      \"Learning-Adjusted Years of School\": 5.52743,\n      \"Fraction of Children Under 5 Not Stunted\": 0.61741,\n      \"Adult Survival Rate\": 0.76612,\n      \"Human Capital Index\": 0.41128,\n      \"GDP per capita (PPP)\": 2076.13838,\n      \"Log GDP per capita\": 7.638264899097053,\n      \"Population\": 38972230.0,\n      \"Continent\": \"Asia\"\n    },\n    {\n      \"Country\": \"Tajikistan\",\n      \"ISO3\": \"TJK\",\n      \"Region\": \"Europe & Central Asia\",\n      \"Income Group\": \"Low income\",\n      \"Probability of Survival to Age 5\": 0.9612,\n      \"Expected Years of School\": 11.26072,\n      \"Harmonized Test Scores\": NaN,\n      \"Learning-Adjusted Years of School\": NaN,\n      \"Fraction of Children Under 5 Not Stunted\": 0.8215,\n      \"Adult Survival Rate\": 0.83717,\n      \"Human Capital Index\": NaN,\n      \"GDP per capita (PPP)\": 3851.942913,\n      \"Log GDP per capita\": 8.25633295271474,\n      \"Population\": 9543207.0,\n      \"Continent\": \"Asia\"\n    },\n    {\n      \"Country\": \"Lithuania\",\n      \"ISO3\": \"LTU\",\n      \"Region\": \"Europe & Central Asia\",\n      \"Income Group\": \"High income\",\n      \"Probability of Survival to Age 5\": 0.99563,\n      \"Expected Years of School\": 13.77959,\n      \"Harmonized Test Scores\": 488.11639,\n      \"Learning-Adjusted Years of School\": 10.76167,\n      \"Fraction of Children Under 5 Not Stunted\": NaN,\n      \"Adult Survival Rate\": 0.767,\n      \"Human Capital Index\": 0.65998,\n      \"GDP per capita (PPP)\": 38880.54527,\n      \"Log GDP per capita\": 10.568249282910193,\n      \"Population\": 2794885.0,\n      \"Continent\": \"Europe\"\n    },\n    {\n      \"Country\": \"Tonga\",\n      \"ISO3\": \"TON\",\n      \"Region\": \"East Asia & Pacific\",\n      \"Income Group\": \"Upper middle income\",\n      \"Probability of Survival to Age 5\": 0.98599,\n      \"Expected Years of School\": 11.3146,\n      \"Harmonized Test Scores\": 374.78497,\n      \"Learning-Adjusted Years of School\": 6.78487,\n      \"Fraction of Children Under 5 Not Stunted\": 0.919,\n      \"Adult Survival Rate\": 0.78772,\n      \"Human Capital Index\": 0.50933,\n      \"GDP per capita (PPP)\": 6705.102442,\n      \"Log GDP per capita\": 8.810624074047983,\n      \"Population\": 105254.0,\n      \"Continent\": \"Oceania\"\n    },\n    {\n      \"Country\": \"Poland\",\n      \"ISO3\": \"POL\",\n      \"Region\": \"Europe & Central Asia\",\n      \"Income Group\": \"High income\",\n      \"Probability of Survival to Age 5\": 0.99515,\n      \"Expected Years of School\": 13.36938,\n      \"Harmonized Test Scores\": 524.81439,\n      \"Learning-Adjusted Years of School\": 11.22631,\n      \"Fraction of Children Under 5 Not Stunted\": NaN,\n      \"Adult Survival Rate\": 0.84916,\n      \"Human Capital Index\": 0.72236,\n      \"GDP per capita (PPP)\": 34449.32341,\n      \"Log GDP per capita\": 10.447244636481162,\n      \"Population\": 37899070.0,\n      \"Continent\": \"Europe\"\n    }\n  ],\n  \"column names\": [\n    \"Country\",\n    \"ISO3\",\n    \"Region\",\n    \"Income Group\",\n    \"Probability of Survival to Age 5\",\n    \"Expected Years of School\",\n    \"Harmonized Test Scores\",\n    \"Learning-Adjusted Years of School\",\n    \"Fraction of Children Under 5 Not Stunted\",\n    \"Adult Survival Rate\",\n    \"Human Capital Index\",\n    \"GDP per capita (PPP)\",\n    \"Log GDP per capita\",\n    \"Population\",\n    \"Continent\"\n  ]\n}\n\nYour Job:\nI am developing a NL to Data Visualization Dataset. \nPlease help me generate natural language utterance for given dataset and constraints.\nDefinition about the Taks:\n- 'utterance' is what a user would say to make a chart.  One NL 'utterance' is in one or two sentences. Here are two examples from Others for reference:\n    scatter(x=production budget, y=worldwide gross) for content rating.\n    Trend for average horsepower over time across different origin.\n- 'given dataset' is in form of column names, column type, range/unique values of the column.\n- 'constraints' are information about the chart that should be included in the utterance. \n    So we can find a reference phrase in the NL utterance that corresponds to the given constraints. \n- 'reference phrase' can be explicit, ambiguous, and by_value. 'ambiguous' means the phrase can map to more than one columns in the dataset, always a hypernym of column names(depending on the dataset values).\n    For example:\n    {\"column\": \"gdpPercap\", \"nl_ref_type\": \"explicit\", \"nl_ref_phrase\": \"GDP per capita\"},\n    {\"column\": [\"country\",\"continent\"], \"nl_ref_type\": \"ambiguous\", \"nl_ref_phrase\": \"region\"}\n    {\"column\": [\"country\",\"country_short_name\"], \"nl_ref_type\": \"ambiguous\", \"nl_ref_phrase\": \"countries\"}\n    {\"c_type\": \"mark\", \"c_name\": \"point chart\", \"nl_ref_type\": \"explicit\", \"nl_ref_phrase\": \"scatter plot\"}\n    {\"c_type\": \"mark\", \"c_name\": \"arc chart\", \"nl_ref_type\": \"explicit\", \"nl_ref_phrase\": \"pie chart\"}\n    {\"c_type\": \"transform\",\"c_name\": \"filter\",\"c_list\": [{\"field\": \"country\",\"oneOf\": [\"Iceland\",\"Norway\"]}],\"nl_ref_type\": \"explicit\",\"nl_ref_phrase\": \"for countries Iceland and Norway\"},\n    {\"c_type\": \"transform\",\"c_name\": \"filter\",\"c_list\": [{\"field\": \"country\",\"oneOf\": [\"Iceland\",\"Norway\"]}],\"nl_ref_type\": \"by_value\",\"nl_ref_phrase\": \"for Iceland and Norway\"},\n- the 'nl_ref_phrase' for 'ambiguous' columns should be equally near all ambiguous columns, not too near to one of the column since it would not be ambiguous.\n    good example: {\"column\": [\"country\",\"region\"], \"nl_ref_type\": \"ambiguous\", \"nl_ref_phrase\": \"location\"}\n    bad example: {\"column\": [\"country\",\"region\"], \"nl_ref_type\": \"ambiguous\", \"nl_ref_phrase\": \"region\"}\n- You only include given constraints and no other information. \n    For example, if a column name is not in the given constraint, it will not be included in the NL utterance.\n    Also, it a chart mark or chart encoding channel is not in the given constraint, it will not be included in the NL utterance.\n- all 'nl_ref_phrase' shoule be included in the 'nl_utterance'. \n\nThe output format is identical to the input format, but fill in the str blanks(\"...\").\n### Input:\n{\n  \"nl_utterance\": \"...\",\n  \"encoded_fields\": [\n    {\n      \"field\": \"GDP per capita (PPP)\",\n      \"type\": \"quantitative\",\n      \"nl_ref_type\": \"explicit\",\n      \"nl_ref_phrase\": \"...\"\n    },\n    {\n      \"field\": \"Human Capital Index\",\n      \"type\": \"quantitative\",\n      \"nl_ref_type\": \"explicit\",\n      \"nl_ref_phrase\": \"...\"\n    },\n    {\n      \"field\": \"Continent\",\n      \"type\": \"nominal\",\n      \"nl_ref_type\": \"explicit\",\n      \"nl_ref_phrase\": \"...\"\n    },\n    {\n      \"field\": \"Population\",\n      \"type\": \"quantitative\",\n      \"nl_ref_type\": \"explicit\",\n      \"nl_ref_phrase\": \"...\"\n    }\n  ],\n  \"constraints\": [\n    {\n      \"c_type\": \"mark\",\n      \"c_name\": \"point chart\",\n      \"c_list\": [\n        {\n          \"mark\": \"circle\",\n          \"encoding\": {\n            \"x\": {},\n            \"y\": {},\n            \"color\": {\n              \"type\": \"nominal\",\n              \"ignore\": true\n            },\n            \"size\": {\n              \"ignore\": true,\n              \"type\": \"quantitative\"\n            },\n            \"column\": {\n              \"ignore\": true,\n              \"type\": \"nominal\"\n            },\n            \"row\": {\n              \"ignore\": true,\n              \"type\": \"nominal\"\n            }\n          }\n        }\n      ],\n      \"nl_ref_type\": \"explicit\",\n      \"nl_ref_phrase\": \"...\"\n    },\n    {\n      \"c_type\": \"transform\",\n      \"c_name\": \"filter\",\n      \"c_list\": [\n        {\n          \"field\": \"Human Capital Index\",\n          \"gt\": 0\n        }\n      ],\n      \"nl_ref_type\": \"explicit\",\n      \"nl_ref_phrase\": \"...\"\n    },\n    {\n      \"c_type\": \"transform\",\n      \"c_name\": \"filter\",\n      \"c_list\": [\n        {\n          \"field\": \"GDP per capita (PPP)\",\n          \"gt\": 1000\n        }\n      ],\n      \"nl_ref_type\": \"explicit\",\n      \"nl_ref_phrase\": \"...\"\n    }\n  ]\n}\n\n### Output:"
}