{
  "gpt_result": {
    "nl_utterance": "Create a scatter plot showing the correlation between the dimensions with colors representing the position of each player.",
    "encoded_fields": [
      {
        "field": [
          "Component 1",
          "Component 2"
        ],
        "type": "quantitative",
        "nl_ref_type": "ambiguous",
        "nl_ref_phrase": "dimensions"
      },
      {
        "field": "Component 2",
        "type": "quantitative",
        "nl_ref_type": "explicit",
        "nl_ref_phrase": "Component 2"
      },
      {
        "field": "Pos",
        "type": "nominal",
        "nl_ref_type": "explicit",
        "nl_ref_phrase": "position"
      }
    ],
    "constraints": [
      {
        "c_type": "task",
        "c_name": "correlation",
        "c_list": [
          {
            "mark": "circle",
            "encoding": {
              "x": {
                "type": "quantitative"
              },
              "y": {
                "type": "quantitative"
              }
            }
          }
        ],
        "nl_ref_type": "explicit",
        "nl_ref_phrase": "scatter plot"
      }
    ]
  },
  "input": "Dataset Information: {\n  \"data samples\": [\n    {\n      \"Unnamed: 0\": 0,\n      \"Player\": \"Max Aarons\",\n      \"Progressive Carries\": 5.4375,\n      \"Touches\": 57.96875,\n      \"Expected Assists\": 0.04375,\n      \"Progressive Passes\": 2.9375,\n      \"Passes\": 33.96875,\n      \"Interceptions\": 1.75,\n      \"Possession-Winning-Tackles\": 1.15625,\n      \"Aerials Won\": 0.46875,\n      \"Pos\": \"Defender\",\n      \"Non-Penalty Expected Goals\": 0.02,\n      \"cluster\": 6,\n      \"Component 1\": -0.6794867331318681,\n      \"Component 2\": 0.4101967803346252\n    },\n    {\n      \"Unnamed: 0\": 728,\n      \"Player\": \"Mathias Normann\",\n      \"Progressive Carries\": 3.0054644808743167,\n      \"Touches\": 54.15300546448087,\n      \"Expected Assists\": 0.0983606557377049,\n      \"Progressive Passes\": 3.66120218579235,\n      \"Passes\": 29.344262295081965,\n      \"Interceptions\": 1.366120218579235,\n      \"Possession-Winning-Tackles\": 1.3114754098360657,\n      \"Aerials Won\": 1.7486338797814207,\n      \"Pos\": \"Midfielder\",\n      \"Non-Penalty Expected Goals\": 0.05,\n      \"cluster\": 3,\n      \"Component 1\": -0.0365330598608819,\n      \"Component 2\": -0.4774321964720298\n    },\n    {\n      \"Unnamed: 0\": 226,\n      \"Player\": \"Ben Davies\",\n      \"Progressive Carries\": 6.134751773049645,\n      \"Touches\": 65.74468085106383,\n      \"Expected Assists\": 0.0212765957446808,\n      \"Progressive Passes\": 4.148936170212767,\n      \"Passes\": 48.75886524822696,\n      \"Interceptions\": 1.5957446808510638,\n      \"Possession-Winning-Tackles\": 0.6382978723404256,\n      \"Aerials Won\": 2.730496453900709,\n      \"Pos\": \"Defender\",\n      \"Non-Penalty Expected Goals\": 0.06,\n      \"cluster\": 6,\n      \"Component 1\": -0.811361338654085,\n      \"Component 2\": 0.0262195985776016\n    }\n  ],\n  \"column names\": [\n    \"Unnamed: 0\",\n    \"Player\",\n    \"Progressive Carries\",\n    \"Touches\",\n    \"Expected Assists\",\n    \"Progressive Passes\",\n    \"Passes\",\n    \"Interceptions\",\n    \"Possession-Winning-Tackles\",\n    \"Aerials Won\",\n    \"Pos\",\n    \"Non-Penalty Expected Goals\",\n    \"cluster\",\n    \"Component 1\",\n    \"Component 2\"\n  ]\n}\n\nYour Job:\nI am developing a NL to Data Visualization Dataset. \nPlease help me generate natural language utterance for given dataset and constraints.\nDefinition about the Taks:\n- 'utterance' is what a user would say to make a chart, it can be a question or a command. One NL 'utterance' is in one or two sentences. \n- 'given dataset' is in form of column names, column type, range/unique values of the column.\n- 'constraints' are information about the chart that should be included in the utterance. \n    So we can find a reference phrase in the NL utterance that corresponds to the given constraints. \n- 'reference phrase' can be explicit, ambiguous, and by_value. 'ambiguous' means the phrase can map to more than one columns in the dataset, always a hypernym of column names(depending on the dataset values).\n    For example:\n    {\"column\": \"gdpPercap\", \"nl_ref_type\": \"explicit\", \"nl_ref_phrase\": \"GDP per capita\"},\n    {\"column\": [\"country\",\"continent\"], \"nl_ref_type\": \"ambiguous\", \"nl_ref_phrase\": \"region\"}\n    {\"column\": [\"country\",\"country_short_name\"], \"nl_ref_type\": \"ambiguous\", \"nl_ref_phrase\": \"countries\"}\n    {\"c_type\": \"mark\", \"c_name\": \"point chart\", \"nl_ref_type\": \"explicit\", \"nl_ref_phrase\": \"scatter plot\"}\n    {\"c_type\": \"mark\", \"c_name\": \"arc chart\", \"nl_ref_type\": \"explicit\", \"nl_ref_phrase\": \"pie chart\"}\n    {\"c_type\": \"transform\",\"c_name\": \"filter\",\"c_list\": [{\"field\": \"country\",\"oneOf\": [\"Iceland\",\"Norway\"]}],\"nl_ref_type\": \"explicit\",\"nl_ref_phrase\": \"for countries Iceland and Norway\"},\n    {\"c_type\": \"transform\",\"c_name\": \"filter\",\"c_list\": [{\"field\": \"country\",\"oneOf\": [\"Iceland\",\"Norway\"]}],\"nl_ref_type\": \"by_value\",\"nl_ref_phrase\": \"for Iceland and Norway\"},\n- the 'nl_ref_phrase' for 'ambiguous' columns should be equally near all ambiguous columns, not too near to one of the column since it would not be ambiguous.\n    good example: {\"column\": [\"country\",\"region\"], \"nl_ref_type\": \"ambiguous\", \"nl_ref_phrase\": \"location\"}\n    bad example: {\"column\": [\"country\",\"region\"], \"nl_ref_type\": \"ambiguous\", \"nl_ref_phrase\": \"region\"}\n- You only include given constraints and no other information. \n    For example, if a column name is not in the given constraint, it will not be included in the NL utterance.\n    Also, it a chart mark or chart encoding channel is not in the given constraint, it will not be included in the NL utterance.\n- all 'nl_ref_phrase' shoule be included in the 'nl_utterance'. \n\nThe output format is identical to the input format, but fill in the str blanks(\"...\").\n### Input:\n{\n  \"nl_utterance\": \"...\",\n  \"encoded_fields\": [\n    {\n      \"field\": [\n        \"Component 1\",\n        \"Component 2\"\n      ],\n      \"type\": \"quantitative\",\n      \"nl_ref_type\": \"ambiguous\",\n      \"nl_ref_phrase\": \"...\"\n    },\n    {\n      \"field\": \"Component 2\",\n      \"type\": \"quantitative\",\n      \"nl_ref_type\": \"explicit\",\n      \"nl_ref_phrase\": \"...\"\n    },\n    {\n      \"field\": \"Pos\",\n      \"type\": \"nominal\",\n      \"nl_ref_type\": \"explicit\",\n      \"nl_ref_phrase\": \"...\"\n    }\n  ],\n  \"constraints\": [\n    {\n      \"c_type\": \"task\",\n      \"c_name\": \"correlation\",\n      \"c_list\": [\n        {\n          \"mark\": \"circle\",\n          \"encoding\": {\n            \"x\": {\n              \"type\": \"quantitative\"\n            },\n            \"y\": {\n              \"type\": \"quantitative\"\n            }\n          }\n        }\n      ],\n      \"nl_ref_type\": \"explicit\",\n      \"nl_ref_phrase\": \"...\"\n    }\n  ]\n}\n\n### Output:"
}