{
  "gpt_result": {
    "nl_utterance": "Show me the count of records based on different measures of movement.",
    "encoded_fields": [
      {
        "field": [
          "Mobility",
          "Commute",
          "Migration_in",
          "Migration_out"
        ],
        "type": "quantitative",
        "nl_ref_type": "ambiguous",
        "nl_ref_phrase": "measures of movement"
      }
    ],
    "constraints": [
      {
        "c_type": "transform",
        "c_name": "aggregate",
        "c_list": [
          {
            "aggregate": "count"
          }
        ],
        "nl_ref_type": "explicit",
        "nl_ref_phrase": "count of records"
      }
    ]
  },
  "input": "Dataset Information: {\n  \"data samples\": [\n    {\n      \"ID\": 100,\n      \"Name\": \"Johnson City\",\n      \"Mobility\": 0.0621988103,\n      \"State\": \"TN\",\n      \"Population\": 576081,\n      \"Urban\": 1,\n      \"Black\": 0.021,\n      \"Seg_racial\": 0.09,\n      \"Seg_income\": 0.035,\n      \"Seg_poverty\": 0.03,\n      \"Seg_affluence\": 0.038,\n      \"Commute\": 0.325,\n      \"Income\": 31560,\n      \"Gini\": 0.468,\n      \"Share01\": 13.459,\n      \"Gini_99\": 0.333,\n      \"Middle_class\": 0.548,\n      \"Local_tax_rate\": 0.02,\n      \"Local_gov_spending\": 1886.0,\n      \"Progressivity\": 0.0,\n      \"EITC\": 0.0,\n      \"School_spending\": 5.185,\n      \"Student_teacher_ratio\": NaN,\n      \"Test_scores\": 2.728,\n      \"HS_dropout\": -0.015,\n      \"Colleges\": 0.014,\n      \"Tuition\": 4817.0,\n      \"Graduation\": -0.002,\n      \"Labor_force_participation\": 0.587,\n      \"Manufacturing\": 0.237,\n      \"Chinese_imports\": 5.294,\n      \"Teenage_labor\": 0.004,\n      \"Migration_in\": 0.006,\n      \"Migration_out\": 0.005,\n      \"Foreign_born\": 0.012,\n      \"Social_capital\": -0.298,\n      \"Religious\": 0.514,\n      \"Violent_crime\": 0.001,\n      \"Single_mothers\": 0.19,\n      \"Divorced\": 0.11,\n      \"Married\": 0.601,\n      \"Longitude\": -82.4363861083984,\n      \"Latitude\": 36.4703712463379\n    },\n    {\n      \"ID\": 26701,\n      \"Name\": \"Bemidji\",\n      \"Mobility\": 0.0952868834,\n      \"State\": \"MN\",\n      \"Population\": 101639,\n      \"Urban\": 0,\n      \"Black\": 0.002,\n      \"Seg_racial\": 0.317,\n      \"Seg_income\": 0.027,\n      \"Seg_poverty\": 0.027,\n      \"Seg_affluence\": 0.025,\n      \"Commute\": 0.449,\n      \"Income\": 31567,\n      \"Gini\": 0.395,\n      \"Share01\": 9.319,\n      \"Gini_99\": 0.302,\n      \"Middle_class\": 0.577,\n      \"Local_tax_rate\": 0.021,\n      \"Local_gov_spending\": 2723.0,\n      \"Progressivity\": 2.5,\n      \"EITC\": 17.286,\n      \"School_spending\": 7.145,\n      \"Student_teacher_ratio\": 16.5,\n      \"Test_scores\": 4.087,\n      \"HS_dropout\": 0.006,\n      \"Colleges\": 0.039,\n      \"Tuition\": 2810.0,\n      \"Graduation\": 0.074,\n      \"Labor_force_participation\": 0.635,\n      \"Manufacturing\": 0.11,\n      \"Chinese_imports\": 0.506,\n      \"Teenage_labor\": 0.006,\n      \"Migration_in\": 0.018,\n      \"Migration_out\": 0.017,\n      \"Foreign_born\": 0.014,\n      \"Social_capital\": 1.443,\n      \"Religious\": 0.564,\n      \"Violent_crime\": 0.001,\n      \"Single_mothers\": 0.211,\n      \"Divorced\": 0.087,\n      \"Married\": 0.57,\n      \"Longitude\": -95.277946472168,\n      \"Latitude\": 47.464656829834\n    },\n    {\n      \"ID\": 12402,\n      \"Name\": \"Grayling charter\",\n      \"Mobility\": 0.0748898685,\n      \"State\": \"MI\",\n      \"Population\": 104421,\n      \"Urban\": 0,\n      \"Black\": 0.004,\n      \"Seg_racial\": 0.037,\n      \"Seg_income\": 0.027,\n      \"Seg_poverty\": 0.025,\n      \"Seg_affluence\": 0.028,\n      \"Commute\": 0.457,\n      \"Income\": 34360,\n      \"Gini\": 0.433,\n      \"Share01\": 13.319,\n      \"Gini_99\": 0.3,\n      \"Middle_class\": 0.556,\n      \"Local_tax_rate\": 0.034,\n      \"Local_gov_spending\": 1681.0,\n      \"Progressivity\": 0.0,\n      \"EITC\": 0.0,\n      \"School_spending\": 5.917,\n      \"Student_teacher_ratio\": 18.8,\n      \"Test_scores\": -0.154,\n      \"HS_dropout\": NaN,\n      \"Colleges\": 0.01,\n      \"Tuition\": 2141.0,\n      \"Graduation\": -0.205,\n      \"Labor_force_participation\": 0.532,\n      \"Manufacturing\": 0.14,\n      \"Chinese_imports\": 1.079,\n      \"Teenage_labor\": 0.006,\n      \"Migration_in\": 0.022,\n      \"Migration_out\": 0.014,\n      \"Foreign_born\": 0.015,\n      \"Social_capital\": 0.606,\n      \"Religious\": 0.351,\n      \"Violent_crime\": 0.001,\n      \"Single_mothers\": 0.192,\n      \"Divorced\": 0.105,\n      \"Married\": 0.621,\n      \"Longitude\": -84.4363555908203,\n      \"Latitude\": 44.6857032775879\n    },\n    {\n      \"ID\": 3002,\n      \"Name\": \"Yazoo City\",\n      \"Mobility\": 0.0247895233,\n      \"State\": \"MS\",\n      \"Population\": 39355,\n      \"Urban\": 1,\n      \"Black\": 0.585,\n      \"Seg_racial\": 0.138,\n      \"Seg_income\": 0.025,\n      \"Seg_poverty\": 0.021,\n      \"Seg_affluence\": 0.038,\n      \"Commute\": 0.417,\n      \"Income\": 22600,\n      \"Gini\": 0.605,\n      \"Share01\": 17.47,\n      \"Gini_99\": 0.43,\n      \"Middle_class\": 0.296,\n      \"Local_tax_rate\": 0.016,\n      \"Local_gov_spending\": 1809.0,\n      \"Progressivity\": 0.0,\n      \"EITC\": 0.0,\n      \"School_spending\": 4.664,\n      \"Student_teacher_ratio\": 20.1,\n      \"Test_scores\": -23.049,\n      \"HS_dropout\": 0.041,\n      \"Colleges\": NaN,\n      \"Tuition\": NaN,\n      \"Graduation\": NaN,\n      \"Labor_force_participation\": 0.503,\n      \"Manufacturing\": 0.199,\n      \"Chinese_imports\": 0.407,\n      \"Teenage_labor\": 0.003,\n      \"Migration_in\": 0.011,\n      \"Migration_out\": 0.017,\n      \"Foreign_born\": 0.031,\n      \"Social_capital\": -0.351,\n      \"Religious\": 0.446,\n      \"Violent_crime\": 0.002,\n      \"Single_mothers\": 0.401,\n      \"Divorced\": 0.079,\n      \"Married\": 0.404,\n      \"Longitude\": -90.47216796875,\n      \"Latitude\": 32.897403717041\n    },\n    {\n      \"ID\": 14801,\n      \"Name\": \"Olney\",\n      \"Mobility\": 0.1169398874,\n      \"State\": \"IL\",\n      \"Population\": 55642,\n      \"Urban\": 0,\n      \"Black\": 0.002,\n      \"Seg_racial\": 0.016,\n      \"Seg_income\": 0.015,\n      \"Seg_poverty\": 0.016,\n      \"Seg_affluence\": 0.011,\n      \"Commute\": 0.486,\n      \"Income\": 31875,\n      \"Gini\": 0.343,\n      \"Share01\": 8.23,\n      \"Gini_99\": 0.261,\n      \"Middle_class\": 0.643,\n      \"Local_tax_rate\": 0.013,\n      \"Local_gov_spending\": 2254.0,\n      \"Progressivity\": 0.0,\n      \"EITC\": 0.476,\n      \"School_spending\": 4.303,\n      \"Student_teacher_ratio\": 15.7,\n      \"Test_scores\": 9.889,\n      \"HS_dropout\": 0.007,\n      \"Colleges\": 0.036,\n      \"Tuition\": 5275.0,\n      \"Graduation\": 0.01,\n      \"Labor_force_participation\": 0.603,\n      \"Manufacturing\": 0.215,\n      \"Chinese_imports\": 21.031,\n      \"Teenage_labor\": 0.005,\n      \"Migration_in\": 0.011,\n      \"Migration_out\": 0.011,\n      \"Foreign_born\": 0.006,\n      \"Social_capital\": 1.562,\n      \"Religious\": 0.626,\n      \"Violent_crime\": NaN,\n      \"Single_mothers\": 0.176,\n      \"Divorced\": 0.106,\n      \"Married\": 0.608,\n      \"Longitude\": -88.0994873046875,\n      \"Latitude\": 38.2621994018555\n    }\n  ],\n  \"column names\": [\n    \"ID\",\n    \"Name\",\n    \"Mobility\",\n    \"State\",\n    \"Population\",\n    \"Urban\",\n    \"Black\",\n    \"Seg_racial\",\n    \"Seg_income\",\n    \"Seg_poverty\",\n    \"Seg_affluence\",\n    \"Commute\",\n    \"Income\",\n    \"Gini\",\n    \"Share01\",\n    \"Gini_99\",\n    \"Middle_class\",\n    \"Local_tax_rate\",\n    \"Local_gov_spending\",\n    \"Progressivity\",\n    \"EITC\",\n    \"School_spending\",\n    \"Student_teacher_ratio\",\n    \"Test_scores\",\n    \"HS_dropout\",\n    \"Colleges\",\n    \"Tuition\",\n    \"Graduation\",\n    \"Labor_force_participation\",\n    \"Manufacturing\",\n    \"Chinese_imports\",\n    \"Teenage_labor\",\n    \"Migration_in\",\n    \"Migration_out\",\n    \"Foreign_born\",\n    \"Social_capital\",\n    \"Religious\",\n    \"Violent_crime\",\n    \"Single_mothers\",\n    \"Divorced\",\n    \"Married\",\n    \"Longitude\",\n    \"Latitude\"\n  ]\n}\n\nYour Job:\nI am developing a NL to Data Visualization Dataset. \nPlease help me generate natural language utterance for given dataset and constraints.\nDefinition about the Taks:\n- 'utterance' is what a user would say to make a chart.  One NL 'utterance' is in one or two sentences. Here are two examples from Others for reference:\n    I want to know how many orders there are by the quantity of the order.\n    scatter(x=production budget, y=worldwide gross) for content rating.\n- 'given dataset' is in form of column names, column type, range/unique values of the column.\n- 'constraints' are information about the chart that should be included in the utterance. \n    So we can find a reference phrase in the NL utterance that corresponds to the given constraints. \n- 'reference phrase' can be explicit, ambiguous, and by_value. 'ambiguous' means the phrase can map to more than one columns in the dataset, always a hypernym of column names(depending on the dataset values).\n    For example:\n    {\"column\": \"gdpPercap\", \"nl_ref_type\": \"explicit\", \"nl_ref_phrase\": \"GDP per capita\"},\n    {\"column\": [\"country\",\"continent\"], \"nl_ref_type\": \"ambiguous\", \"nl_ref_phrase\": \"region\"}\n    {\"column\": [\"country\",\"country_short_name\"], \"nl_ref_type\": \"ambiguous\", \"nl_ref_phrase\": \"countries\"}\n    {\"c_type\": \"mark\", \"c_name\": \"point chart\", \"nl_ref_type\": \"explicit\", \"nl_ref_phrase\": \"scatter plot\"}\n    {\"c_type\": \"mark\", \"c_name\": \"arc chart\", \"nl_ref_type\": \"explicit\", \"nl_ref_phrase\": \"pie chart\"}\n    {\"c_type\": \"transform\",\"c_name\": \"filter\",\"c_list\": [{\"field\": \"country\",\"oneOf\": [\"Iceland\",\"Norway\"]}],\"nl_ref_type\": \"explicit\",\"nl_ref_phrase\": \"for countries Iceland and Norway\"},\n    {\"c_type\": \"transform\",\"c_name\": \"filter\",\"c_list\": [{\"field\": \"country\",\"oneOf\": [\"Iceland\",\"Norway\"]}],\"nl_ref_type\": \"by_value\",\"nl_ref_phrase\": \"for Iceland and Norway\"},\n- the 'nl_ref_phrase' for 'ambiguous' columns should be equally near all ambiguous columns, not too near to one of the column since it would not be ambiguous.\n    good example: {\"column\": [\"country\",\"region\"], \"nl_ref_type\": \"ambiguous\", \"nl_ref_phrase\": \"location\"}\n    bad example: {\"column\": [\"country\",\"region\"], \"nl_ref_type\": \"ambiguous\", \"nl_ref_phrase\": \"region\"}\n- You only include given constraints and no other information. \n    For example, if a column name is not in the given constraint, it will not be included in the NL utterance.\n    Also, it a chart mark or chart encoding channel is not in the given constraint, it will not be included in the NL utterance.\n- all 'nl_ref_phrase' shoule be included in the 'nl_utterance'. \n\nThe output format is identical to the input format, but fill in the str blanks(\"...\").\n### Input:\n{\n  \"nl_utterance\": \"...\",\n  \"encoded_fields\": [\n    {\n      \"field\": [\n        \"Mobility\",\n        \"Commute\",\n        \"Migration_in\",\n        \"Migration_out\"\n      ],\n      \"type\": \"quantitative\",\n      \"nl_ref_type\": \"ambiguous\",\n      \"nl_ref_phrase\": \"...\"\n    }\n  ],\n  \"constraints\": [\n    {\n      \"c_type\": \"transform\",\n      \"c_name\": \"aggregate\",\n      \"c_list\": [\n        {\n          \"aggregate\": \"count\"\n        }\n      ],\n      \"nl_ref_type\": \"explicit\",\n      \"nl_ref_phrase\": \"...\"\n    }\n  ]\n}\n\n### Output:"
}