{
  "gpt_result": {
    "nl_utterance": "What is the median square footage across different locations, visualized as a bar chart?",
    "encoded_fields": [
      {
        "field": "Square Footage",
        "type": "quantitative",
        "nl_ref_type": "explicit",
        "nl_ref_phrase": "square footage"
      }
    ],
    "constraints": [
      {
        "c_type": "mark",
        "c_name": "bar chart",
        "c_list": [
          {
            "mark": "bar",
            "encoding": {
              "x": {},
              "y": {
                "type": "quantitative"
              },
              "color": {
                "type": "nominal",
                "ignore": true
              },
              "column": {
                "ignore": true,
                "type": "nominal"
              },
              "row": {
                "ignore": true,
                "type": "nominal"
              }
            },
            "unique_map": {
              "x": "y"
            }
          },
          {
            "mark": "bar",
            "encoding": {
              "y": {},
              "x": {
                "type": "quantitative"
              },
              "color": {
                "type": "nominal",
                "ignore": true
              },
              "column": {
                "ignore": true,
                "type": "nominal"
              },
              "row": {
                "ignore": true,
                "type": "nominal"
              }
            },
            "unique_map": {
              "y": "x"
            }
          }
        ],
        "nl_ref_type": "explicit",
        "nl_ref_phrase": "bar chart"
      },
      {
        "c_type": "transform",
        "c_name": "aggregate",
        "c_list": [
          {
            "field": "Square Footage",
            "aggregate": "median"
          }
        ],
        "nl_ref_type": "explicit",
        "nl_ref_phrase": "median"
      }
    ]
  },
  "input": "Dataset Information: {\n  \"data samples\": [\n    {\n      \"Agency Name\": \"Department of Natural Resources\",\n      \"Location Name\": \"Anderson Lake Conservation Area - Fulton County\",\n      \"Address\": \"Anderson Lake C.a.\",\n      \"City\": \"Astoria\",\n      \"Zip code\": 61501,\n      \"County\": \"Fulton\",\n      \"Congress Dist\": 17,\n      \"Congressional Full Name\": \"Cheri Bustos\",\n      \"Rep Dist\": 93,\n      \"Rep Full Name\": \"Hammond Norine K.\",\n      \"Senate Dist\": 47,\n      \"Senator Full Name\": \"Jil Tracy\",\n      \"Bldg Status\": \"In Use\",\n      \"Year Acquired\": 1975,\n      \"Year Constructed\": 1975,\n      \"Square Footage\": 144,\n      \"Total Floors\": 1,\n      \"Floors Above Grade\": 1,\n      \"Floors Below Grade\": 0,\n      \"Usage Description\": \"Unusual\",\n      \"Usage Description 2\": \"Unusual\",\n      \"Usage Description 3\": \"Not provided\"\n    },\n    {\n      \"Agency Name\": \"Department of Natural Resources\",\n      \"Location Name\": \"Lincoln Trail State Park - Clark County\",\n      \"Address\": \"Rr #1 Box 117\",\n      \"City\": \"Marshall\",\n      \"Zip code\": 62441,\n      \"County\": \"Clark\",\n      \"Congress Dist\": 15,\n      \"Congressional Full Name\": \"John Shimkus\",\n      \"Rep Dist\": 110,\n      \"Rep Full Name\": \"Phillips Reginald\",\n      \"Senate Dist\": 55,\n      \"Senator Full Name\": \"Dale A. Righter\",\n      \"Bldg Status\": \"In Use\",\n      \"Year Acquired\": 1975,\n      \"Year Constructed\": 1975,\n      \"Square Footage\": 336,\n      \"Total Floors\": 1,\n      \"Floors Above Grade\": 1,\n      \"Floors Below Grade\": 0,\n      \"Usage Description\": \"Business\",\n      \"Usage Description 2\": \"Business\",\n      \"Usage Description 3\": \"Not provided\"\n    },\n    {\n      \"Agency Name\": \"Department of Natural Resources\",\n      \"Location Name\": \"Pere Marquette State Park - Jersey County\",\n      \"Address\": \"P.o. Box 158\",\n      \"City\": \"Grafton\",\n      \"Zip code\": 62037,\n      \"County\": \"Jersey\",\n      \"Congress Dist\": 13,\n      \"Congressional Full Name\": \"Rodney L. Davis\",\n      \"Rep Dist\": 100,\n      \"Rep Full Name\": \"Davidsmeyer C. D.\",\n      \"Senate Dist\": 50,\n      \"Senator Full Name\": \"Wm. Sam McCann\",\n      \"Bldg Status\": \"In Use\",\n      \"Year Acquired\": 1935,\n      \"Year Constructed\": 1935,\n      \"Square Footage\": 2156,\n      \"Total Floors\": 3,\n      \"Floors Above Grade\": 2,\n      \"Floors Below Grade\": 1,\n      \"Usage Description\": \"Assembly\",\n      \"Usage Description 2\": \"Assembly\",\n      \"Usage Description 3\": \"Not provided\"\n    },\n    {\n      \"Agency Name\": \"Department of Corrections\",\n      \"Location Name\": \"Lincoln Correctional Center - Logan County\",\n      \"Address\": \"R.r. #3, Box 549\",\n      \"City\": \"Lincoln\",\n      \"Zip code\": 62656,\n      \"County\": \"Logan\",\n      \"Congress Dist\": 18,\n      \"Congressional Full Name\": \"Darin M. LaHood\",\n      \"Rep Dist\": 87,\n      \"Rep Full Name\": \"Butler Tim\",\n      \"Senate Dist\": 44,\n      \"Senator Full Name\": \"William E. Brady\",\n      \"Bldg Status\": \"In Use\",\n      \"Year Acquired\": 1984,\n      \"Year Constructed\": 1984,\n      \"Square Footage\": 420,\n      \"Total Floors\": 3,\n      \"Floors Above Grade\": 3,\n      \"Floors Below Grade\": 0,\n      \"Usage Description\": \"Detention & Correc\",\n      \"Usage Description 2\": \"Detention & Correc\",\n      \"Usage Description 3\": \"Not provided\"\n    },\n    {\n      \"Agency Name\": \"Department of Corrections\",\n      \"Location Name\": \"Danville Correctional Center - \\u00a0Vermilion County\",\n      \"Address\": \"Us 136 At Indiana Line\",\n      \"City\": \"Danville\",\n      \"Zip code\": 61834,\n      \"County\": \"Vermilion\",\n      \"Congress Dist\": 15,\n      \"Congressional Full Name\": \"John Shimkus\",\n      \"Rep Dist\": 104,\n      \"Rep Full Name\": \"Hays Chad\",\n      \"Senate Dist\": 52,\n      \"Senator Full Name\": \"Scott M. Bennett\",\n      \"Bldg Status\": \"In Use\",\n      \"Year Acquired\": 1985,\n      \"Year Constructed\": 1985,\n      \"Square Footage\": 353,\n      \"Total Floors\": 2,\n      \"Floors Above Grade\": 2,\n      \"Floors Below Grade\": 0,\n      \"Usage Description\": \"Storage\",\n      \"Usage Description 2\": \"Storage\",\n      \"Usage Description 3\": \"Not provided\"\n    }\n  ],\n  \"column names\": [\n    \"Agency Name\",\n    \"Location Name\",\n    \"Address\",\n    \"City\",\n    \"Zip code\",\n    \"County\",\n    \"Congress Dist\",\n    \"Congressional Full Name\",\n    \"Rep Dist\",\n    \"Rep Full Name\",\n    \"Senate Dist\",\n    \"Senator Full Name\",\n    \"Bldg Status\",\n    \"Year Acquired\",\n    \"Year Constructed\",\n    \"Square Footage\",\n    \"Total Floors\",\n    \"Floors Above Grade\",\n    \"Floors Below Grade\",\n    \"Usage Description\",\n    \"Usage Description 2\",\n    \"Usage Description 3\"\n  ]\n}\n\nYour Job:\nI am developing a NL to Data Visualization Dataset. \nPlease help me generate natural language utterance for given dataset and constraints.\nDefinition about the Taks:\n- 'utterance' is what a user would say to make a chart. It should be a questions structure. One NL 'utterance' is in one or two sentences. Here are two examples from Questions for reference:\n    On average, how much was earned by movies of each genre?\n    Which countries have the highest acceleration for cars of different cylinders?\n- 'given dataset' is in form of column names, column type, range/unique values of the column.\n- 'constraints' are information about the chart that should be included in the utterance. \n    So we can find a reference phrase in the NL utterance that corresponds to the given constraints. \n- 'reference phrase' can be explicit, ambiguous, and by_value. 'ambiguous' means the phrase can map to more than one columns in the dataset, always a hypernym of column names(depending on the dataset values).\n    For example:\n    {\"column\": \"gdpPercap\", \"nl_ref_type\": \"explicit\", \"nl_ref_phrase\": \"GDP per capita\"},\n    {\"column\": [\"country\",\"continent\"], \"nl_ref_type\": \"ambiguous\", \"nl_ref_phrase\": \"region\"}\n    {\"column\": [\"country\",\"country_short_name\"], \"nl_ref_type\": \"ambiguous\", \"nl_ref_phrase\": \"countries\"}\n    {\"c_type\": \"mark\", \"c_name\": \"point chart\", \"nl_ref_type\": \"explicit\", \"nl_ref_phrase\": \"scatter plot\"}\n    {\"c_type\": \"mark\", \"c_name\": \"arc chart\", \"nl_ref_type\": \"explicit\", \"nl_ref_phrase\": \"pie chart\"}\n    {\"c_type\": \"transform\",\"c_name\": \"filter\",\"c_list\": [{\"field\": \"country\",\"oneOf\": [\"Iceland\",\"Norway\"]}],\"nl_ref_type\": \"explicit\",\"nl_ref_phrase\": \"for countries Iceland and Norway\"},\n    {\"c_type\": \"transform\",\"c_name\": \"filter\",\"c_list\": [{\"field\": \"country\",\"oneOf\": [\"Iceland\",\"Norway\"]}],\"nl_ref_type\": \"by_value\",\"nl_ref_phrase\": \"for Iceland and Norway\"},\n- the 'nl_ref_phrase' for 'ambiguous' columns should be equally near all ambiguous columns, not too near to one of the column since it would not be ambiguous.\n    good example: {\"column\": [\"country\",\"region\"], \"nl_ref_type\": \"ambiguous\", \"nl_ref_phrase\": \"location\"}\n    bad example: {\"column\": [\"country\",\"region\"], \"nl_ref_type\": \"ambiguous\", \"nl_ref_phrase\": \"region\"}\n- You only include given constraints and no other information. \n    For example, if a column name is not in the given constraint, it will not be included in the NL utterance.\n    Also, it a chart mark or chart encoding channel is not in the given constraint, it will not be included in the NL utterance.\n- all 'nl_ref_phrase' shoule be included in the 'nl_utterance'. \n\nThe output format is identical to the input format, but fill in the str blanks(\"...\").\n### Input:\n{\n  \"nl_utterance\": \"...\",\n  \"encoded_fields\": [\n    {\n      \"field\": \"Square Footage\",\n      \"type\": \"quantitative\",\n      \"nl_ref_type\": \"explicit\",\n      \"nl_ref_phrase\": \"...\"\n    }\n  ],\n  \"constraints\": [\n    {\n      \"c_type\": \"mark\",\n      \"c_name\": \"bar chart\",\n      \"c_list\": [\n        {\n          \"mark\": \"bar\",\n          \"encoding\": {\n            \"x\": {},\n            \"y\": {\n              \"type\": \"quantitative\"\n            },\n            \"color\": {\n              \"type\": \"nominal\",\n              \"ignore\": true\n            },\n            \"column\": {\n              \"ignore\": true,\n              \"type\": \"nominal\"\n            },\n            \"row\": {\n              \"ignore\": true,\n              \"type\": \"nominal\"\n            }\n          },\n          \"unique_map\": {\n            \"x\": \"y\"\n          }\n        },\n        {\n          \"mark\": \"bar\",\n          \"encoding\": {\n            \"y\": {},\n            \"x\": {\n              \"type\": \"quantitative\"\n            },\n            \"color\": {\n              \"type\": \"nominal\",\n              \"ignore\": true\n            },\n            \"column\": {\n              \"ignore\": true,\n              \"type\": \"nominal\"\n            },\n            \"row\": {\n              \"ignore\": true,\n              \"type\": \"nominal\"\n            }\n          },\n          \"unique_map\": {\n            \"y\": \"x\"\n          }\n        }\n      ],\n      \"nl_ref_type\": \"explicit\",\n      \"nl_ref_phrase\": \"...\"\n    },\n    {\n      \"c_type\": \"transform\",\n      \"c_name\": \"aggregate\",\n      \"c_list\": [\n        {\n          \"field\": \"Square Footage\",\n          \"aggregate\": \"median\"\n        }\n      ],\n      \"nl_ref_type\": \"explicit\",\n      \"nl_ref_phrase\": \"...\"\n    }\n  ]\n}\n\n### Output:"
}