{
  "gpt_result": {
    "nl_utterance": "Create a scatter plot to compare Value 1, Value 2, and Value [billion US$], using Value 2 as a separate measure, distinguishing between the Type of GHG emission scheme.",
    "encoded_fields": [
      {
        "field": [
          "Value 1",
          "Value 2",
          "Value [billion US$]"
        ],
        "type": "quantitative",
        "nl_ref_type": "ambiguous",
        "nl_ref_phrase": "compare Value 1, Value 2, and Value [billion US$]"
      },
      {
        "field": "Value 2",
        "type": "quantitative",
        "nl_ref_type": "explicit",
        "nl_ref_phrase": "Value 2 as a separate measure"
      },
      {
        "field": "Type",
        "type": "nominal",
        "nl_ref_type": "explicit",
        "nl_ref_phrase": "Type of GHG emission scheme"
      }
    ],
    "constraints": [
      {
        "c_type": "mark",
        "c_name": "point chart",
        "c_list": [
          {
            "mark": "circle",
            "encoding": {
              "x": {},
              "y": {},
              "color": {
                "type": "nominal",
                "ignore": true
              },
              "size": {
                "ignore": true,
                "type": "quantitative"
              },
              "column": {
                "ignore": true,
                "type": "nominal"
              },
              "row": {
                "ignore": true,
                "type": "nominal"
              }
            }
          }
        ],
        "nl_ref_type": "explicit",
        "nl_ref_phrase": "scatter plot"
      }
    ]
  },
  "input": "Dataset Information: {\n  \"data samples\": [\n    {\n      \"Unnamed: 0\": 0,\n      \"Type\": \"ETS\",\n      \"GHG emissions covered [MtCO2e]\": 140.36,\n      \"Year of implementation\": 2007,\n      \"Value [billion US$]\": 6.365888747,\n      \"Proportion of global GHG emissions covered\": 0.27,\n      \"Value 1\": -0.0505383741816785,\n      \"Value 2\": 0.7482888868096143\n    },\n    {\n      \"Unnamed: 0\": 3,\n      \"Type\": \"ETS\",\n      \"GHG emissions covered [MtCO2e]\": 0.0,\n      \"Year of implementation\": 2012,\n      \"Value [billion US$]\": 0.0,\n      \"Proportion of global GHG emissions covered\": 0.0,\n      \"Value 1\": -0.4961989997393223,\n      \"Value 2\": 0.0872743539880935\n    },\n    {\n      \"Unnamed: 0\": 73,\n      \"Type\": \"Carbon tax\",\n      \"GHG emissions covered [MtCO2e]\": 0.9688,\n      \"Year of implementation\": 2019,\n      \"Value [billion US$]\": 0.013773078,\n      \"Proportion of global GHG emissions covered\": 0.0,\n      \"Value 1\": -0.4428354688361366,\n      \"Value 2\": -0.737201052505445\n    },\n    {\n      \"Unnamed: 0\": 86,\n      \"Type\": \"Carbon tax\",\n      \"GHG emissions covered [MtCO2e]\": 459.1671443,\n      \"Year of implementation\": 2019,\n      \"Value [billion US$]\": 0.119524906,\n      \"Proportion of global GHG emissions covered\": 0.9,\n      \"Value 1\": 0.5528850076813707,\n      \"Value 2\": -0.820775088083316\n    },\n    {\n      \"Unnamed: 0\": 30,\n      \"Type\": \"ETS\",\n      \"GHG emissions covered [MtCO2e]\": 349.4383534,\n      \"Year of implementation\": 2021,\n      \"Value [billion US$]\": 9.979956,\n      \"Proportion of global GHG emissions covered\": 0.68,\n      \"Value 1\": 0.6091252772256045,\n      \"Value 2\": -0.8842019134506215\n    }\n  ],\n  \"column names\": [\n    \"Unnamed: 0\",\n    \"Type\",\n    \"GHG emissions covered [MtCO2e]\",\n    \"Year of implementation\",\n    \"Value [billion US$]\",\n    \"Proportion of global GHG emissions covered\",\n    \"Value 1\",\n    \"Value 2\"\n  ]\n}\n\nYour Job:\nI am developing a NL to Data Visualization Dataset. \nPlease help me generate natural language utterance for given dataset and constraints.\nDefinition about the Taks:\n- 'utterance' is what a user would say to make a chart.  One NL 'utterance' is in one or two sentences. Here are two examples from Others for reference:\n    Trend for average horsepower over time across different origin.\n    I want to know how many orders there are by the quantity of the order.\n- 'given dataset' is in form of column names, column type, range/unique values of the column.\n- 'constraints' are information about the chart that should be included in the utterance. \n    So we can find a reference phrase in the NL utterance that corresponds to the given constraints. \n- 'reference phrase' can be explicit, ambiguous, and by_value. 'ambiguous' means the phrase can map to more than one columns in the dataset, always a hypernym of column names(depending on the dataset values).\n    For example:\n    {\"column\": \"gdpPercap\", \"nl_ref_type\": \"explicit\", \"nl_ref_phrase\": \"GDP per capita\"},\n    {\"column\": [\"country\",\"continent\"], \"nl_ref_type\": \"ambiguous\", \"nl_ref_phrase\": \"region\"}\n    {\"column\": [\"country\",\"country_short_name\"], \"nl_ref_type\": \"ambiguous\", \"nl_ref_phrase\": \"countries\"}\n    {\"c_type\": \"mark\", \"c_name\": \"point chart\", \"nl_ref_type\": \"explicit\", \"nl_ref_phrase\": \"scatter plot\"}\n    {\"c_type\": \"mark\", \"c_name\": \"arc chart\", \"nl_ref_type\": \"explicit\", \"nl_ref_phrase\": \"pie chart\"}\n    {\"c_type\": \"transform\",\"c_name\": \"filter\",\"c_list\": [{\"field\": \"country\",\"oneOf\": [\"Iceland\",\"Norway\"]}],\"nl_ref_type\": \"explicit\",\"nl_ref_phrase\": \"for countries Iceland and Norway\"},\n    {\"c_type\": \"transform\",\"c_name\": \"filter\",\"c_list\": [{\"field\": \"country\",\"oneOf\": [\"Iceland\",\"Norway\"]}],\"nl_ref_type\": \"by_value\",\"nl_ref_phrase\": \"for Iceland and Norway\"},\n- the 'nl_ref_phrase' for 'ambiguous' columns should be equally near all ambiguous columns, not too near to one of the column since it would not be ambiguous.\n    good example: {\"column\": [\"country\",\"region\"], \"nl_ref_type\": \"ambiguous\", \"nl_ref_phrase\": \"location\"}\n    bad example: {\"column\": [\"country\",\"region\"], \"nl_ref_type\": \"ambiguous\", \"nl_ref_phrase\": \"region\"}\n- You only include given constraints and no other information. \n    For example, if a column name is not in the given constraint, it will not be included in the NL utterance.\n    Also, it a chart mark or chart encoding channel is not in the given constraint, it will not be included in the NL utterance.\n- all 'nl_ref_phrase' shoule be included in the 'nl_utterance'. \n\nThe output format is identical to the input format, but fill in the str blanks(\"...\").\n### Input:\n{\n  \"nl_utterance\": \"...\",\n  \"encoded_fields\": [\n    {\n      \"field\": [\n        \"Value 1\",\n        \"Value 2\",\n        \"Value [billion US$]\"\n      ],\n      \"type\": \"quantitative\",\n      \"nl_ref_type\": \"ambiguous\",\n      \"nl_ref_phrase\": \"...\"\n    },\n    {\n      \"field\": \"Value 2\",\n      \"type\": \"quantitative\",\n      \"nl_ref_type\": \"explicit\",\n      \"nl_ref_phrase\": \"...\"\n    },\n    {\n      \"field\": \"Type\",\n      \"type\": \"nominal\",\n      \"nl_ref_type\": \"explicit\",\n      \"nl_ref_phrase\": \"...\"\n    }\n  ],\n  \"constraints\": [\n    {\n      \"c_type\": \"mark\",\n      \"c_name\": \"point chart\",\n      \"c_list\": [\n        {\n          \"mark\": \"circle\",\n          \"encoding\": {\n            \"x\": {},\n            \"y\": {},\n            \"color\": {\n              \"type\": \"nominal\",\n              \"ignore\": true\n            },\n            \"size\": {\n              \"ignore\": true,\n              \"type\": \"quantitative\"\n            },\n            \"column\": {\n              \"ignore\": true,\n              \"type\": \"nominal\"\n            },\n            \"row\": {\n              \"ignore\": true,\n              \"type\": \"nominal\"\n            }\n          }\n        }\n      ],\n      \"nl_ref_type\": \"explicit\",\n      \"nl_ref_phrase\": \"...\"\n    }\n  ]\n}\n\n### Output:"
}