{
  "gpt_result": {
    "nl_utterance": "Show the trend of growth in lending relative to world GDP over time.",
    "encoded_fields": [
      {
        "field": [
          "Date",
          "Year"
        ],
        "type": "quantitative",
        "nl_ref_type": "ambiguous",
        "nl_ref_phrase": "time"
      },
      {
        "field": "Growth in Lending Relative to World GDP",
        "type": "quantitative",
        "nl_ref_type": "explicit",
        "nl_ref_phrase": "growth in lending relative to world GDP"
      }
    ],
    "constraints": [
      {
        "c_type": "task",
        "c_name": "trend",
        "c_list": [
          {
            "mark": [
              "bar",
              "line",
              "area"
            ],
            "encoding": {
              "x": {
                "type": "temporal"
              }
            }
          }
        ],
        "nl_ref_type": "explicit",
        "nl_ref_phrase": "trend"
      }
    ]
  },
  "input": "Dataset Information: {\n  \"data samples\": [\n    {\n      \"Date\": \"12/31/2021\",\n      \"GRA Purchases\": 89474552025,\n      \"PRGT 1/2/\": 14554823681,\n      \"Totals\": 104029000000.0,\n      \"Year\": 2021,\n      \"World GDP data \": 96100100000000.0,\n      \"Totals ($bns)\": 104.0293757,\n      \"world GDP Bns\": 96100.091,\n      \"Growth in Lending Relative to World GDP\": 0.108251069\n    },\n    {\n      \"Date\": \"12/31/1991\",\n      \"GRA Purchases\": 23378573926,\n      \"PRGT 1/2/\": 3285717796,\n      \"Totals\": 26664291722.0,\n      \"Year\": 1991,\n      \"World GDP data \": 23759600000000.0,\n      \"Totals ($bns)\": 26.66429172,\n      \"world GDP Bns\": 23759.57245,\n      \"Growth in Lending Relative to World GDP\": 0.112225469\n    },\n    {\n      \"Date\": \"12/31/2011\",\n      \"GRA Purchases\": 87276915790,\n      \"PRGT 1/2/\": 5308609594,\n      \"Totals\": 92585525384.0,\n      \"Year\": 2011,\n      \"World GDP data \": 73853800000000.0,\n      \"Totals ($bns)\": 92.58552538,\n      \"world GDP Bns\": 73853.78405,\n      \"Growth in Lending Relative to World GDP\": 0.125363279\n    },\n    {\n      \"Date\": \"12/31/2014\",\n      \"GRA Purchases\": 69041563463,\n      \"PRGT 1/2/\": 6292755583,\n      \"Totals\": 75334319046.0,\n      \"Year\": 2014,\n      \"World GDP data \": 79708800000000.0,\n      \"Totals ($bns)\": 75.33431905,\n      \"world GDP Bns\": 79708.81224,\n      \"Growth in Lending Relative to World GDP\": 0.094511908\n    },\n    {\n      \"Date\": \"12/31/2004\",\n      \"GRA Purchases\": 55373766674,\n      \"PRGT 1/2/\": 6766029353,\n      \"Totals\": 62139796027.0,\n      \"Year\": 2004,\n      \"World GDP data \": 44117600000000.0,\n      \"Totals ($bns)\": 62.13979603,\n      \"world GDP Bns\": 44117.60113,\n      \"Growth in Lending Relative to World GDP\": 0.140850351\n    }\n  ],\n  \"column names\": [\n    \"Date\",\n    \"GRA Purchases\",\n    \"PRGT 1/2/\",\n    \"Totals\",\n    \"Year\",\n    \"World GDP data \",\n    \"Totals ($bns)\",\n    \"world GDP Bns\",\n    \"Growth in Lending Relative to World GDP\"\n  ]\n}\n\nYour Job:\nI am developing a NL to Data Visualization Dataset. \nPlease help me generate natural language utterance for given dataset and constraints.\nDefinition about the Taks:\n- 'utterance' is what a user would say to make a chart.  One NL 'utterance' is in one or two sentences. Here are two examples from Others for reference:\n    Trend for average horsepower over time across different origin.\n    scatter(x=production budget, y=worldwide gross) for content rating.\n- 'given dataset' is in form of column names, column type, range/unique values of the column.\n- 'constraints' are information about the chart that should be included in the utterance. \n    So we can find a reference phrase in the NL utterance that corresponds to the given constraints. \n- 'reference phrase' can be explicit, ambiguous, and by_value. 'ambiguous' means the phrase can map to more than one columns in the dataset, always a hypernym of column names(depending on the dataset values).\n    For example:\n    {\"column\": \"gdpPercap\", \"nl_ref_type\": \"explicit\", \"nl_ref_phrase\": \"GDP per capita\"},\n    {\"column\": [\"country\",\"continent\"], \"nl_ref_type\": \"ambiguous\", \"nl_ref_phrase\": \"region\"}\n    {\"column\": [\"country\",\"country_short_name\"], \"nl_ref_type\": \"ambiguous\", \"nl_ref_phrase\": \"countries\"}\n    {\"c_type\": \"mark\", \"c_name\": \"point chart\", \"nl_ref_type\": \"explicit\", \"nl_ref_phrase\": \"scatter plot\"}\n    {\"c_type\": \"mark\", \"c_name\": \"arc chart\", \"nl_ref_type\": \"explicit\", \"nl_ref_phrase\": \"pie chart\"}\n    {\"c_type\": \"transform\",\"c_name\": \"filter\",\"c_list\": [{\"field\": \"country\",\"oneOf\": [\"Iceland\",\"Norway\"]}],\"nl_ref_type\": \"explicit\",\"nl_ref_phrase\": \"for countries Iceland and Norway\"},\n    {\"c_type\": \"transform\",\"c_name\": \"filter\",\"c_list\": [{\"field\": \"country\",\"oneOf\": [\"Iceland\",\"Norway\"]}],\"nl_ref_type\": \"by_value\",\"nl_ref_phrase\": \"for Iceland and Norway\"},\n- the 'nl_ref_phrase' for 'ambiguous' columns should be equally near all ambiguous columns, not too near to one of the column since it would not be ambiguous.\n    good example: {\"column\": [\"country\",\"region\"], \"nl_ref_type\": \"ambiguous\", \"nl_ref_phrase\": \"location\"}\n    bad example: {\"column\": [\"country\",\"region\"], \"nl_ref_type\": \"ambiguous\", \"nl_ref_phrase\": \"region\"}\n- You only include given constraints and no other information. \n    For example, if a column name is not in the given constraint, it will not be included in the NL utterance.\n    Also, it a chart mark or chart encoding channel is not in the given constraint, it will not be included in the NL utterance.\n- all 'nl_ref_phrase' shoule be included in the 'nl_utterance'. \n\nThe output format is identical to the input format, but fill in the str blanks(\"...\").\n### Input:\n{\n  \"nl_utterance\": \"...\",\n  \"encoded_fields\": [\n    {\n      \"field\": [\n        \"Date\",\n        \"Year\"\n      ],\n      \"type\": \"quantitative\",\n      \"nl_ref_type\": \"ambiguous\",\n      \"nl_ref_phrase\": \"...\"\n    },\n    {\n      \"field\": \"Growth in Lending Relative to World GDP\",\n      \"type\": \"quantitative\",\n      \"nl_ref_type\": \"explicit\",\n      \"nl_ref_phrase\": \"...\"\n    }\n  ],\n  \"constraints\": [\n    {\n      \"c_type\": \"task\",\n      \"c_name\": \"trend\",\n      \"c_list\": [\n        {\n          \"mark\": [\n            \"bar\",\n            \"line\",\n            \"area\"\n          ],\n          \"encoding\": {\n            \"x\": {\n              \"type\": \"temporal\"\n            }\n          }\n        }\n      ],\n      \"nl_ref_type\": \"explicit\",\n      \"nl_ref_phrase\": \"...\"\n    }\n  ]\n}\n\n### Output:"
}