{
  "gpt_result": {
    "nl_utterance": "What is the average profit for each state?",
    "encoded_fields": [
      {
        "field": "Profit",
        "type": "quantitative",
        "nl_ref_type": "explicit",
        "nl_ref_phrase": "profit"
      },
      {
        "field": "State",
        "type": "nominal",
        "nl_ref_type": "explicit",
        "nl_ref_phrase": "state"
      }
    ],
    "constraints": [
      {
        "c_type": "transform",
        "c_name": "aggregate",
        "c_list": [
          {
            "field": "Profit",
            "aggregate": "mean"
          }
        ],
        "nl_ref_type": "explicit",
        "nl_ref_phrase": "average"
      }
    ]
  },
  "input": "Dataset Information: {\n  \"data samples\": [\n    {\n      \"Days to Ship Actual\": 6,\n      \"Sales Forecast\": 293,\n      \"Ship Status\": \"Shipped On Time\",\n      \"Days to Ship Scheduled\": 6,\n      \"Sales per Customer\": \"$209.30 \",\n      \"Profit Ratio\": \"27.00%\",\n      \"Category\": \"Office Supplies\",\n      \"City\": \"Columbus\",\n      \"Country\": \"United States\",\n      \"Customer Name\": \"Chuck Clark\",\n      \"Days to Ship Actual (bin)\": 5,\n      \"Discount\": 0,\n      \"Number of Records\": 1,\n      \"Order Date\": \"12/30/2017\",\n      \"Order ID\": \"CA-2017-126221\",\n      \"Postal Code\": 47201,\n      \"Product Name\": \"Eureka The Boss Plus 12-Amp Hard Box Upright Vacuum, Red\",\n      \"Profit\": 56.511,\n      \"Quantity\": 2,\n      \"Region\": \"Central\",\n      \"Sales (bin)\": \"$0 \",\n      \"Sales\": 209.3,\n      \"Segment\": \"Home Office\",\n      \"Ship Date\": \"1/5/2018\",\n      \"Ship Mode\": \"Standard Class\",\n      \"State\": \"Indiana\",\n      \"Sub-Category\": \"Appliances\"\n    },\n    {\n      \"Days to Ship Actual\": 5,\n      \"Sales Forecast\": 14717,\n      \"Ship Status\": \"Shipped Early\",\n      \"Days to Ship Scheduled\": 6,\n      \"Sales per Customer\": \"$10,499.97 \",\n      \"Profit Ratio\": \"48.00%\",\n      \"Category\": \"Technology\",\n      \"City\": \"Newark\",\n      \"Country\": \"United States\",\n      \"Customer Name\": \"Hunter Lopez\",\n      \"Days to Ship Actual (bin)\": 5,\n      \"Discount\": 0,\n      \"Number of Records\": 1,\n      \"Order Date\": \"11/17/2017\",\n      \"Order ID\": \"CA-2017-166709\",\n      \"Postal Code\": 19711,\n      \"Product Name\": \"Canon imageCLASS 2200 Advanced Copier\",\n      \"Profit\": 5039.9856,\n      \"Quantity\": 3,\n      \"Region\": \"East\",\n      \"Sales (bin)\": \"$10,038 \",\n      \"Sales\": 10499.97,\n      \"Segment\": \"Consumer\",\n      \"Ship Date\": \"11/22/2017\",\n      \"Ship Mode\": \"Standard Class\",\n      \"State\": \"Delaware\",\n      \"Sub-Category\": \"Copiers\"\n    },\n    {\n      \"Days to Ship Actual\": 5,\n      \"Sales Forecast\": 104,\n      \"Ship Status\": \"Shipped Early\",\n      \"Days to Ship Scheduled\": 6,\n      \"Sales per Customer\": \"$74.45 \",\n      \"Profit Ratio\": \"27.00%\",\n      \"Category\": \"Furniture\",\n      \"City\": \"Morristown\",\n      \"Country\": \"United States\",\n      \"Customer Name\": \"Harry Marie\",\n      \"Days to Ship Actual (bin)\": 5,\n      \"Discount\": 0,\n      \"Number of Records\": 1,\n      \"Order Date\": \"4/14/2017\",\n      \"Order ID\": \"CA-2017-127117\",\n      \"Postal Code\": 7960,\n      \"Product Name\": \"Tensor Computer Mounted Lamp\",\n      \"Profit\": 20.1015,\n      \"Quantity\": 5,\n      \"Region\": \"East\",\n      \"Sales (bin)\": \"$0 \",\n      \"Sales\": 74.45,\n      \"Segment\": \"Corporate\",\n      \"Ship Date\": \"4/19/2017\",\n      \"Ship Mode\": \"Standard Class\",\n      \"State\": \"New Jersey\",\n      \"Sub-Category\": \"Furnishings\"\n    },\n    {\n      \"Days to Ship Actual\": 2,\n      \"Sales Forecast\": 22,\n      \"Ship Status\": \"Shipped Early\",\n      \"Days to Ship Scheduled\": 3,\n      \"Sales per Customer\": \"$15.55 \",\n      \"Profit Ratio\": \"35.00%\",\n      \"Category\": \"Office Supplies\",\n      \"City\": \"Dallas\",\n      \"Country\": \"United States\",\n      \"Customer Name\": \"Aimee Bixby\",\n      \"Days to Ship Actual (bin)\": 1,\n      \"Discount\": 20,\n      \"Number of Records\": 1,\n      \"Order Date\": \"1/31/2016\",\n      \"Order ID\": \"CA-2016-147970\",\n      \"Postal Code\": 75220,\n      \"Product Name\": \"Xerox 1994\",\n      \"Profit\": 5.4432,\n      \"Quantity\": 3,\n      \"Region\": \"Central\",\n      \"Sales (bin)\": \"$0 \",\n      \"Sales\": 15.552,\n      \"Segment\": \"Consumer\",\n      \"Ship Date\": \"2/2/2016\",\n      \"Ship Mode\": \"Second Class\",\n      \"State\": \"Texas\",\n      \"Sub-Category\": \"Paper\"\n    },\n    {\n      \"Days to Ship Actual\": 5,\n      \"Sales Forecast\": 5,\n      \"Ship Status\": \"Shipped Early\",\n      \"Days to Ship Scheduled\": 6,\n      \"Sales per Customer\": \"$3.91 \",\n      \"Profit Ratio\": \"26.30%\",\n      \"Category\": \"Office Supplies\",\n      \"City\": \"Houston\",\n      \"Country\": \"United States\",\n      \"Customer Name\": \"Ivan Liston\",\n      \"Days to Ship Actual (bin)\": 5,\n      \"Discount\": 20,\n      \"Number of Records\": 1,\n      \"Order Date\": \"9/4/2016\",\n      \"Order ID\": \"CA-2016-169971\",\n      \"Postal Code\": 77041,\n      \"Product Name\": \"Faber Castell Col-Erase Pencils\",\n      \"Profit\": 1.0269,\n      \"Quantity\": 1,\n      \"Region\": \"Central\",\n      \"Sales (bin)\": \"$0 \",\n      \"Sales\": 3.912,\n      \"Segment\": \"Consumer\",\n      \"Ship Date\": \"9/9/2016\",\n      \"Ship Mode\": \"Standard Class\",\n      \"State\": \"Texas\",\n      \"Sub-Category\": \"Art\"\n    }\n  ],\n  \"column names\": [\n    \"Days to Ship Actual\",\n    \"Sales Forecast\",\n    \"Ship Status\",\n    \"Days to Ship Scheduled\",\n    \"Sales per Customer\",\n    \"Profit Ratio\",\n    \"Category\",\n    \"City\",\n    \"Country\",\n    \"Customer Name\",\n    \"Days to Ship Actual (bin)\",\n    \"Discount\",\n    \"Number of Records\",\n    \"Order Date\",\n    \"Order ID\",\n    \"Postal Code\",\n    \"Product Name\",\n    \"Profit\",\n    \"Quantity\",\n    \"Region\",\n    \"Sales (bin)\",\n    \"Sales\",\n    \"Segment\",\n    \"Ship Date\",\n    \"Ship Mode\",\n    \"State\",\n    \"Sub-Category\"\n  ]\n}\n\nYour Job:\nI am developing a NL to Data Visualization Dataset. \nPlease help me generate natural language utterance for given dataset and constraints.\nDefinition about the Taks:\n- 'utterance' is what a user would say to make a chart. It should be a questions structure. One NL 'utterance' is in one or two sentences. Here are two examples from Questions for reference:\n    How many cars do each country manufacture?\n    What major genre had the highest average worldwide gross?\n- 'given dataset' is in form of column names, column type, range/unique values of the column.\n- 'constraints' are information about the chart that should be included in the utterance. \n    So we can find a reference phrase in the NL utterance that corresponds to the given constraints. \n- 'reference phrase' can be explicit, ambiguous, and by_value. 'ambiguous' means the phrase can map to more than one columns in the dataset, always a hypernym of column names(depending on the dataset values).\n    For example:\n    {\"column\": \"gdpPercap\", \"nl_ref_type\": \"explicit\", \"nl_ref_phrase\": \"GDP per capita\"},\n    {\"column\": [\"country\",\"continent\"], \"nl_ref_type\": \"ambiguous\", \"nl_ref_phrase\": \"region\"}\n    {\"column\": [\"country\",\"country_short_name\"], \"nl_ref_type\": \"ambiguous\", \"nl_ref_phrase\": \"countries\"}\n    {\"c_type\": \"mark\", \"c_name\": \"point chart\", \"nl_ref_type\": \"explicit\", \"nl_ref_phrase\": \"scatter plot\"}\n    {\"c_type\": \"mark\", \"c_name\": \"arc chart\", \"nl_ref_type\": \"explicit\", \"nl_ref_phrase\": \"pie chart\"}\n    {\"c_type\": \"transform\",\"c_name\": \"filter\",\"c_list\": [{\"field\": \"country\",\"oneOf\": [\"Iceland\",\"Norway\"]}],\"nl_ref_type\": \"explicit\",\"nl_ref_phrase\": \"for countries Iceland and Norway\"},\n    {\"c_type\": \"transform\",\"c_name\": \"filter\",\"c_list\": [{\"field\": \"country\",\"oneOf\": [\"Iceland\",\"Norway\"]}],\"nl_ref_type\": \"by_value\",\"nl_ref_phrase\": \"for Iceland and Norway\"},\n- the 'nl_ref_phrase' for 'ambiguous' columns should be equally near all ambiguous columns, not too near to one of the column since it would not be ambiguous.\n    good example: {\"column\": [\"country\",\"region\"], \"nl_ref_type\": \"ambiguous\", \"nl_ref_phrase\": \"location\"}\n    bad example: {\"column\": [\"country\",\"region\"], \"nl_ref_type\": \"ambiguous\", \"nl_ref_phrase\": \"region\"}\n- You only include given constraints and no other information. \n    For example, if a column name is not in the given constraint, it will not be included in the NL utterance.\n    Also, it a chart mark or chart encoding channel is not in the given constraint, it will not be included in the NL utterance.\n- all 'nl_ref_phrase' shoule be included in the 'nl_utterance'. \n\nThe output format is identical to the input format, but fill in the str blanks(\"...\").\n### Input:\n{\n  \"nl_utterance\": \"...\",\n  \"encoded_fields\": [\n    {\n      \"field\": \"Profit\",\n      \"type\": \"quantitative\",\n      \"nl_ref_type\": \"explicit\",\n      \"nl_ref_phrase\": \"...\"\n    },\n    {\n      \"field\": \"State\",\n      \"type\": \"nominal\",\n      \"nl_ref_type\": \"explicit\",\n      \"nl_ref_phrase\": \"...\"\n    }\n  ],\n  \"constraints\": [\n    {\n      \"c_type\": \"transform\",\n      \"c_name\": \"aggregate\",\n      \"c_list\": [\n        {\n          \"field\": \"Profit\",\n          \"aggregate\": \"mean\"\n        }\n      ],\n      \"nl_ref_type\": \"explicit\",\n      \"nl_ref_phrase\": \"...\"\n    }\n  ]\n}\n\n### Output:"
}