{
  "gpt_result": {
    "nl_utterance": "Show a scatter plot to explore the correlation between the Reduced Dimension 2 values, and use different continents as a distinguishing factor.",
    "encoded_fields": [
      {
        "field": "Reduced Dimension 2",
        "type": "quantitative",
        "nl_ref_type": "explicit",
        "nl_ref_phrase": "Reduced Dimension 2 values"
      },
      {
        "field": "Continent",
        "type": "nominal",
        "nl_ref_type": "explicit",
        "nl_ref_phrase": "continents"
      }
    ],
    "constraints": [
      {
        "c_type": "task",
        "c_name": "correlation",
        "c_list": [
          {
            "mark": "circle",
            "encoding": {
              "x": {
                "type": "quantitative"
              },
              "y": {
                "type": "quantitative"
              }
            }
          }
        ],
        "nl_ref_type": "explicit",
        "nl_ref_phrase": "correlation between the Reduced Dimension 2 values"
      },
      {
        "c_type": "mark",
        "c_name": "point chart",
        "c_list": [
          {
            "mark": "circle",
            "encoding": {
              "x": {},
              "y": {},
              "color": {
                "type": "nominal",
                "ignore": true
              },
              "size": {
                "ignore": true,
                "type": "quantitative"
              },
              "column": {
                "ignore": true,
                "type": "nominal"
              },
              "row": {
                "ignore": true,
                "type": "nominal"
              }
            }
          }
        ],
        "nl_ref_type": "explicit",
        "nl_ref_phrase": "scatter plot"
      }
    ]
  },
  "input": "Dataset Information: {\n  \"data samples\": [\n    {\n      \"Country\": \"Afghanistan\",\n      \"Life Expectancy\": 64.3,\n      \"Income\": 1990,\n      \"Infant Mortality\": 54.2,\n      \"Fertility\": 3.77,\n      \"Gini Coefficient\": 39.5,\n      \"Reduced Dimension 1\": 2.058474218,\n      \"Reduced Dimension 2\": -0.617822572,\n      \"Continent\": \"Asia\"\n    },\n    {\n      \"Country\": \"Turkey\",\n      \"Life Expectancy\": 79.1,\n      \"Income\": 31800,\n      \"Infant Mortality\": 9.02,\n      \"Fertility\": 1.95,\n      \"Gini Coefficient\": 44.1,\n      \"Reduced Dimension 1\": -1.064897306,\n      \"Reduced Dimension 2\": 0.822855419,\n      \"Continent\": \"Europe\"\n    },\n    {\n      \"Country\": \"Mauritius\",\n      \"Life Expectancy\": 75.9,\n      \"Income\": 21500,\n      \"Infant Mortality\": 13.9,\n      \"Fertility\": 1.43,\n      \"Gini Coefficient\": 36.8,\n      \"Reduced Dimension 1\": -1.009406986,\n      \"Reduced Dimension 2\": 0.076196584,\n      \"Continent\": \"Africa\"\n    },\n    {\n      \"Country\": \"Uzbekistan\",\n      \"Life Expectancy\": 68.7,\n      \"Income\": 7840,\n      \"Infant Mortality\": 19.6,\n      \"Fertility\": 2.14,\n      \"Gini Coefficient\": 35.0,\n      \"Reduced Dimension 1\": 0.124606137,\n      \"Reduced Dimension 2\": -0.388189219,\n      \"Continent\": \"Asia\"\n    },\n    {\n      \"Country\": \"Nicaragua\",\n      \"Life Expectancy\": 76.0,\n      \"Income\": 6040,\n      \"Infant Mortality\": 16.1,\n      \"Fertility\": 2.04,\n      \"Gini Coefficient\": 46.3,\n      \"Reduced Dimension 1\": -0.085434305,\n      \"Reduced Dimension 2\": 1.038827624,\n      \"Continent\": \"North America\"\n    }\n  ],\n  \"column names\": [\n    \"Country\",\n    \"Life Expectancy\",\n    \"Income\",\n    \"Infant Mortality\",\n    \"Fertility\",\n    \"Gini Coefficient\",\n    \"Reduced Dimension 1\",\n    \"Reduced Dimension 2\",\n    \"Continent\"\n  ]\n}\n\nYour Job:\nI am developing a NL to Data Visualization Dataset. \nPlease help me generate natural language utterance for given dataset and constraints.\nDefinition about the Taks:\n- 'utterance' is what a user would say to make a chart.  One NL 'utterance' is in one or two sentences. Here are two examples from Others for reference:\n    I want to know how many orders there are by the quantity of the order.\n    Trend for average horsepower over time across different origin.\n- 'given dataset' is in form of column names, column type, range/unique values of the column.\n- 'constraints' are information about the chart that should be included in the utterance. \n    So we can find a reference phrase in the NL utterance that corresponds to the given constraints. \n- 'reference phrase' can be explicit, ambiguous, and by_value. 'ambiguous' means the phrase can map to more than one columns in the dataset, always a hypernym of column names(depending on the dataset values).\n    For example:\n    {\"column\": \"gdpPercap\", \"nl_ref_type\": \"explicit\", \"nl_ref_phrase\": \"GDP per capita\"},\n    {\"column\": [\"country\",\"continent\"], \"nl_ref_type\": \"ambiguous\", \"nl_ref_phrase\": \"region\"}\n    {\"column\": [\"country\",\"country_short_name\"], \"nl_ref_type\": \"ambiguous\", \"nl_ref_phrase\": \"countries\"}\n    {\"c_type\": \"mark\", \"c_name\": \"point chart\", \"nl_ref_type\": \"explicit\", \"nl_ref_phrase\": \"scatter plot\"}\n    {\"c_type\": \"mark\", \"c_name\": \"arc chart\", \"nl_ref_type\": \"explicit\", \"nl_ref_phrase\": \"pie chart\"}\n    {\"c_type\": \"transform\",\"c_name\": \"filter\",\"c_list\": [{\"field\": \"country\",\"oneOf\": [\"Iceland\",\"Norway\"]}],\"nl_ref_type\": \"explicit\",\"nl_ref_phrase\": \"for countries Iceland and Norway\"},\n    {\"c_type\": \"transform\",\"c_name\": \"filter\",\"c_list\": [{\"field\": \"country\",\"oneOf\": [\"Iceland\",\"Norway\"]}],\"nl_ref_type\": \"by_value\",\"nl_ref_phrase\": \"for Iceland and Norway\"},\n- the 'nl_ref_phrase' for 'ambiguous' columns should be equally near all ambiguous columns, not too near to one of the column since it would not be ambiguous.\n    good example: {\"column\": [\"country\",\"region\"], \"nl_ref_type\": \"ambiguous\", \"nl_ref_phrase\": \"location\"}\n    bad example: {\"column\": [\"country\",\"region\"], \"nl_ref_type\": \"ambiguous\", \"nl_ref_phrase\": \"region\"}\n- You only include given constraints and no other information. \n    For example, if a column name is not in the given constraint, it will not be included in the NL utterance.\n    Also, it a chart mark or chart encoding channel is not in the given constraint, it will not be included in the NL utterance.\n- all 'nl_ref_phrase' shoule be included in the 'nl_utterance'. \n\nThe output format is identical to the input format, but fill in the str blanks(\"...\").\n### Input:\n{\n  \"nl_utterance\": \"...\",\n  \"encoded_fields\": [\n    {\n      \"field\": \"Reduced Dimension 2\",\n      \"type\": \"quantitative\",\n      \"nl_ref_type\": \"explicit\",\n      \"nl_ref_phrase\": \"...\"\n    },\n    {\n      \"field\": \"Continent\",\n      \"type\": \"nominal\",\n      \"nl_ref_type\": \"explicit\",\n      \"nl_ref_phrase\": \"...\"\n    }\n  ],\n  \"constraints\": [\n    {\n      \"c_type\": \"task\",\n      \"c_name\": \"correlation\",\n      \"c_list\": [\n        {\n          \"mark\": \"circle\",\n          \"encoding\": {\n            \"x\": {\n              \"type\": \"quantitative\"\n            },\n            \"y\": {\n              \"type\": \"quantitative\"\n            }\n          }\n        }\n      ],\n      \"nl_ref_type\": \"explicit\",\n      \"nl_ref_phrase\": \"...\"\n    },\n    {\n      \"c_type\": \"mark\",\n      \"c_name\": \"point chart\",\n      \"c_list\": [\n        {\n          \"mark\": \"circle\",\n          \"encoding\": {\n            \"x\": {},\n            \"y\": {},\n            \"color\": {\n              \"type\": \"nominal\",\n              \"ignore\": true\n            },\n            \"size\": {\n              \"ignore\": true,\n              \"type\": \"quantitative\"\n            },\n            \"column\": {\n              \"ignore\": true,\n              \"type\": \"nominal\"\n            },\n            \"row\": {\n              \"ignore\": true,\n              \"type\": \"nominal\"\n            }\n          }\n        }\n      ],\n      \"nl_ref_type\": \"explicit\",\n      \"nl_ref_phrase\": \"...\"\n    }\n  ]\n}\n\n### Output:"
}