{
  "gpt_result": {
    "nl_utterance": "Can you create a bar chart showing the adjusted GDP in billions for each year?",
    "encoded_fields": [
      {
        "field": "Year",
        "type": "quantitative",
        "nl_ref_type": "explicit",
        "nl_ref_phrase": "year"
      },
      {
        "field": "Total_GDP_adjusted_billions",
        "type": "quantitative",
        "nl_ref_type": "explicit",
        "nl_ref_phrase": "adjusted GDP in billions"
      }
    ],
    "constraints": [
      {
        "c_type": "mark",
        "c_name": "bar chart",
        "c_list": [
          {
            "mark": "bar",
            "encoding": {
              "x": {},
              "y": {
                "type": "quantitative"
              },
              "color": {
                "type": "nominal",
                "ignore": true
              },
              "column": {
                "ignore": true,
                "type": "nominal"
              },
              "row": {
                "ignore": true,
                "type": "nominal"
              }
            },
            "unique_map": {
              "x": "y"
            }
          },
          {
            "mark": "bar",
            "encoding": {
              "y": {},
              "x": {
                "type": "quantitative"
              },
              "color": {
                "type": "nominal",
                "ignore": true
              },
              "column": {
                "ignore": true,
                "type": "nominal"
              },
              "row": {
                "ignore": true,
                "type": "nominal"
              }
            },
            "unique_map": {
              "y": "x"
            }
          }
        ],
        "nl_ref_type": "explicit",
        "nl_ref_phrase": "bar chart"
      }
    ]
  },
  "input": "Dataset Information: {\n  \"data samples\": [\n    {\n      \"Date\": \"08/31/2022\",\n      \"GRA Purchases\": 93769635059.0,\n      \"PRGT 1/2/\": 15254184552.0,\n      \"Totals\": 109000000000.0,\n      \"Year\": 2022.0,\n      \"Total_billions \": 109.0238196,\n      \"Unnamed: 6\": NaN,\n      \"WorldGDP_billions\": NaN,\n      \"Total_GDP_adjusted_billions\": NaN,\n      \"Unnamed: 9\": NaN,\n      \"Unnamed: 10\": NaN\n    },\n    {\n      \"Date\": \"12/31/2013\",\n      \"GRA Purchases\": 83899249061.0,\n      \"PRGT 1/2/\": 6174392682.0,\n      \"Totals\": 90073641743.0,\n      \"Year\": 2013.0,\n      \"Total_billions \": 90.07364174,\n      \"Unnamed: 6\": \"25,328.26\",\n      \"WorldGDP_billions\": 77290.82,\n      \"Total_GDP_adjusted_billions\": 0.00117,\n      \"Unnamed: 9\": NaN,\n      \"Unnamed: 10\": NaN\n    },\n    {\n      \"Date\": \"12/31/1993\",\n      \"GRA Purchases\": 25196745031.0,\n      \"PRGT 1/2/\": 3942792899.0,\n      \"Totals\": 29139537930.0,\n      \"Year\": 1993.0,\n      \"Total_billions \": 29.13953793,\n      \"Unnamed: 6\": \"75,116.96\",\n      \"WorldGDP_billions\": 26039.542,\n      \"Total_GDP_adjusted_billions\": 0.00112,\n      \"Unnamed: 9\": NaN,\n      \"Unnamed: 10\": NaN\n    },\n    {\n      \"Date\": \"12/31/1989\",\n      \"GRA Purchases\": 22315104224.0,\n      \"PRGT 1/2/\": 2334886562.0,\n      \"Totals\": 24649990786.0,\n      \"Year\": 1989.0,\n      \"Total_billions \": 24.64999079,\n      \"Unnamed: 6\": \"76,267.38\",\n      \"WorldGDP_billions\": 20122.142,\n      \"Total_GDP_adjusted_billions\": 0.00123,\n      \"Unnamed: 9\": NaN,\n      \"Unnamed: 10\": NaN\n    },\n    {\n      \"Date\": \"12/31/1990\",\n      \"GRA Purchases\": 20731851093.0,\n      \"PRGT 1/2/\": 2571911617.0,\n      \"Totals\": 23303762710.0,\n      \"Year\": 1990.0,\n      \"Total_billions \": 23.30376271,\n      \"Unnamed: 6\": \"75,042.63\",\n      \"WorldGDP_billions\": 23654.018,\n      \"Total_GDP_adjusted_billions\": 0.000985,\n      \"Unnamed: 9\": NaN,\n      \"Unnamed: 10\": NaN\n    }\n  ],\n  \"column names\": [\n    \"Date\",\n    \"GRA Purchases\",\n    \"PRGT 1/2/\",\n    \"Totals\",\n    \"Year\",\n    \"Total_billions \",\n    \"Unnamed: 6\",\n    \"WorldGDP_billions\",\n    \"Total_GDP_adjusted_billions\",\n    \"Unnamed: 9\",\n    \"Unnamed: 10\"\n  ]\n}\n\nYour Job:\nI am developing a NL to Data Visualization Dataset. \nPlease help me generate natural language utterance for given dataset and constraints.\nDefinition about the Taks:\n- 'utterance' is what a user would say to make a chart. It should be a questions structure. One NL 'utterance' is in one or two sentences. Here are two examples from Questions for reference:\n    What is our profit based on shipping mode by customer segment?\n    How does displacement relate to fuel economy for cars from Europe vs. USA?\n- 'given dataset' is in form of column names, column type, range/unique values of the column.\n- 'constraints' are information about the chart that should be included in the utterance. \n    So we can find a reference phrase in the NL utterance that corresponds to the given constraints. \n- 'reference phrase' can be explicit, ambiguous, and by_value. 'ambiguous' means the phrase can map to more than one columns in the dataset, always a hypernym of column names(depending on the dataset values).\n    For example:\n    {\"column\": \"gdpPercap\", \"nl_ref_type\": \"explicit\", \"nl_ref_phrase\": \"GDP per capita\"},\n    {\"column\": [\"country\",\"continent\"], \"nl_ref_type\": \"ambiguous\", \"nl_ref_phrase\": \"region\"}\n    {\"column\": [\"country\",\"country_short_name\"], \"nl_ref_type\": \"ambiguous\", \"nl_ref_phrase\": \"countries\"}\n    {\"c_type\": \"mark\", \"c_name\": \"point chart\", \"nl_ref_type\": \"explicit\", \"nl_ref_phrase\": \"scatter plot\"}\n    {\"c_type\": \"mark\", \"c_name\": \"arc chart\", \"nl_ref_type\": \"explicit\", \"nl_ref_phrase\": \"pie chart\"}\n    {\"c_type\": \"transform\",\"c_name\": \"filter\",\"c_list\": [{\"field\": \"country\",\"oneOf\": [\"Iceland\",\"Norway\"]}],\"nl_ref_type\": \"explicit\",\"nl_ref_phrase\": \"for countries Iceland and Norway\"},\n    {\"c_type\": \"transform\",\"c_name\": \"filter\",\"c_list\": [{\"field\": \"country\",\"oneOf\": [\"Iceland\",\"Norway\"]}],\"nl_ref_type\": \"by_value\",\"nl_ref_phrase\": \"for Iceland and Norway\"},\n- the 'nl_ref_phrase' for 'ambiguous' columns should be equally near all ambiguous columns, not too near to one of the column since it would not be ambiguous.\n    good example: {\"column\": [\"country\",\"region\"], \"nl_ref_type\": \"ambiguous\", \"nl_ref_phrase\": \"location\"}\n    bad example: {\"column\": [\"country\",\"region\"], \"nl_ref_type\": \"ambiguous\", \"nl_ref_phrase\": \"region\"}\n- You only include given constraints and no other information. \n    For example, if a column name is not in the given constraint, it will not be included in the NL utterance.\n    Also, it a chart mark or chart encoding channel is not in the given constraint, it will not be included in the NL utterance.\n- all 'nl_ref_phrase' shoule be included in the 'nl_utterance'. \n\nThe output format is identical to the input format, but fill in the str blanks(\"...\").\n### Input:\n{\n  \"nl_utterance\": \"...\",\n  \"encoded_fields\": [\n    {\n      \"field\": \"Year\",\n      \"type\": \"quantitative\",\n      \"nl_ref_type\": \"explicit\",\n      \"nl_ref_phrase\": \"...\"\n    },\n    {\n      \"field\": \"Total_GDP_adjusted_billions\",\n      \"type\": \"quantitative\",\n      \"nl_ref_type\": \"explicit\",\n      \"nl_ref_phrase\": \"...\"\n    }\n  ],\n  \"constraints\": [\n    {\n      \"c_type\": \"mark\",\n      \"c_name\": \"bar chart\",\n      \"c_list\": [\n        {\n          \"mark\": \"bar\",\n          \"encoding\": {\n            \"x\": {},\n            \"y\": {\n              \"type\": \"quantitative\"\n            },\n            \"color\": {\n              \"type\": \"nominal\",\n              \"ignore\": true\n            },\n            \"column\": {\n              \"ignore\": true,\n              \"type\": \"nominal\"\n            },\n            \"row\": {\n              \"ignore\": true,\n              \"type\": \"nominal\"\n            }\n          },\n          \"unique_map\": {\n            \"x\": \"y\"\n          }\n        },\n        {\n          \"mark\": \"bar\",\n          \"encoding\": {\n            \"y\": {},\n            \"x\": {\n              \"type\": \"quantitative\"\n            },\n            \"color\": {\n              \"type\": \"nominal\",\n              \"ignore\": true\n            },\n            \"column\": {\n              \"ignore\": true,\n              \"type\": \"nominal\"\n            },\n            \"row\": {\n              \"ignore\": true,\n              \"type\": \"nominal\"\n            }\n          },\n          \"unique_map\": {\n            \"y\": \"x\"\n          }\n        }\n      ],\n      \"nl_ref_type\": \"explicit\",\n      \"nl_ref_phrase\": \"...\"\n    }\n  ]\n}\n\n### Output:"
}