{
  "gpt_result": {
    "nl_utterance": "Show a correlation scatter plot of Component 2 against Pos.",
    "encoded_fields": [
      {
        "field": "Component 2",
        "type": "quantitative",
        "nl_ref_type": "explicit",
        "nl_ref_phrase": "Component 2"
      },
      {
        "field": "Pos",
        "type": "nominal",
        "nl_ref_type": "explicit",
        "nl_ref_phrase": "Pos"
      }
    ],
    "constraints": [
      {
        "c_type": "task",
        "c_name": "correlation",
        "c_list": [
          {
            "mark": "circle",
            "encoding": {
              "x": {
                "type": "quantitative"
              },
              "y": {
                "type": "quantitative"
              }
            }
          }
        ],
        "nl_ref_type": "explicit",
        "nl_ref_phrase": "correlation scatter plot"
      }
    ]
  },
  "input": "Dataset Information: {\n  \"data samples\": [\n    {\n      \"Unnamed: 0\": 0,\n      \"Player\": \"Max Aarons\",\n      \"Progressive Carries\": 5.4375,\n      \"Touches\": 57.96875,\n      \"Expected Assists\": 0.04375,\n      \"Progressive Passes\": 2.9375,\n      \"Passes\": 33.96875,\n      \"Interceptions\": 1.75,\n      \"Possession-Winning-Tackles\": 1.15625,\n      \"Aerials Won\": 0.46875,\n      \"Pos\": \"Defender\",\n      \"Non-Penalty Expected Goals\": 0.02,\n      \"cluster\": 6,\n      \"Component 1\": -0.6794867331318681,\n      \"Component 2\": 0.4101967803346252\n    },\n    {\n      \"Unnamed: 0\": 331,\n      \"Player\": \"Javi Gal\\u00e1n\",\n      \"Progressive Carries\": 7.486338797814207,\n      \"Touches\": 73.0327868852459,\n      \"Expected Assists\": 0.0628415300546448,\n      \"Progressive Passes\": 3.4153005464480874,\n      \"Passes\": 46.939890710382514,\n      \"Interceptions\": 1.9398907103825136,\n      \"Possession-Winning-Tackles\": 2.1038251366120218,\n      \"Aerials Won\": 0.819672131147541,\n      \"Pos\": \"Defender\",\n      \"Non-Penalty Expected Goals\": 0.01,\n      \"cluster\": 2,\n      \"Component 1\": -2.266386879382646,\n      \"Component 2\": 1.524820514004973\n    },\n    {\n      \"Unnamed: 0\": 33,\n      \"Player\": \"Daniel Amartey\",\n      \"Progressive Carries\": 2.542372881355932,\n      \"Touches\": 72.11864406779661,\n      \"Expected Assists\": 0.0084745762711864,\n      \"Progressive Passes\": 2.5,\n      \"Passes\": 57.33050847457627,\n      \"Interceptions\": 1.271186440677966,\n      \"Possession-Winning-Tackles\": 0.5084745762711864,\n      \"Aerials Won\": 1.906779661016949,\n      \"Pos\": \"Defender\",\n      \"Non-Penalty Expected Goals\": 0.0,\n      \"cluster\": 1,\n      \"Component 1\": -1.2513828226352297,\n      \"Component 2\": -0.4984354466539713\n    },\n    {\n      \"Unnamed: 0\": 947,\n      \"Player\": \"Romain Thomas\",\n      \"Progressive Carries\": 1.4385964912280702,\n      \"Touches\": 69.36842105263158,\n      \"Expected Assists\": 0.0035087719298245,\n      \"Progressive Passes\": 2.8421052631578947,\n      \"Passes\": 52.03508771929825,\n      \"Interceptions\": 1.649122807017544,\n      \"Possession-Winning-Tackles\": 1.3333333333333333,\n      \"Aerials Won\": 2.631578947368421,\n      \"Pos\": \"Defender\",\n      \"Non-Penalty Expected Goals\": 0.07,\n      \"cluster\": 1,\n      \"Component 1\": -1.601969956265748,\n      \"Component 2\": -1.2340116364071498\n    },\n    {\n      \"Unnamed: 0\": 745,\n      \"Player\": \"Remi Oudin\",\n      \"Progressive Carries\": 4.041450777202073,\n      \"Touches\": 46.16580310880829,\n      \"Expected Assists\": 0.1450777202072538,\n      \"Progressive Passes\": 2.6424870466321244,\n      \"Passes\": 22.849740932642487,\n      \"Interceptions\": 1.3471502590673574,\n      \"Possession-Winning-Tackles\": 1.1398963730569949,\n      \"Aerials Won\": 1.1398963730569949,\n      \"Pos\": \"Winger\",\n      \"Non-Penalty Expected Goals\": 0.18,\n      \"cluster\": 3,\n      \"Component 1\": 1.1678613508165063,\n      \"Component 2\": 0.1873570145248995\n    }\n  ],\n  \"column names\": [\n    \"Unnamed: 0\",\n    \"Player\",\n    \"Progressive Carries\",\n    \"Touches\",\n    \"Expected Assists\",\n    \"Progressive Passes\",\n    \"Passes\",\n    \"Interceptions\",\n    \"Possession-Winning-Tackles\",\n    \"Aerials Won\",\n    \"Pos\",\n    \"Non-Penalty Expected Goals\",\n    \"cluster\",\n    \"Component 1\",\n    \"Component 2\"\n  ]\n}\n\nYour Job:\nI am developing a NL to Data Visualization Dataset. \nPlease help me generate natural language utterance for given dataset and constraints.\nDefinition about the Taks:\n- 'utterance' is what a user would say to make a chart. It should be a queries structure. One NL 'utterance' is in one or two sentences. Here are two examples from Queries for reference:\n    Count Sub-Category Asc.\n    Gross versus genre.\n- 'given dataset' is in form of column names, column type, range/unique values of the column.\n- 'constraints' are information about the chart that should be included in the utterance. \n    So we can find a reference phrase in the NL utterance that corresponds to the given constraints. \n- 'reference phrase' can be explicit, ambiguous, and by_value. 'ambiguous' means the phrase can map to more than one columns in the dataset, always a hypernym of column names(depending on the dataset values).\n    For example:\n    {\"column\": \"gdpPercap\", \"nl_ref_type\": \"explicit\", \"nl_ref_phrase\": \"GDP per capita\"},\n    {\"column\": [\"country\",\"continent\"], \"nl_ref_type\": \"ambiguous\", \"nl_ref_phrase\": \"region\"}\n    {\"column\": [\"country\",\"country_short_name\"], \"nl_ref_type\": \"ambiguous\", \"nl_ref_phrase\": \"countries\"}\n    {\"c_type\": \"mark\", \"c_name\": \"point chart\", \"nl_ref_type\": \"explicit\", \"nl_ref_phrase\": \"scatter plot\"}\n    {\"c_type\": \"mark\", \"c_name\": \"arc chart\", \"nl_ref_type\": \"explicit\", \"nl_ref_phrase\": \"pie chart\"}\n    {\"c_type\": \"transform\",\"c_name\": \"filter\",\"c_list\": [{\"field\": \"country\",\"oneOf\": [\"Iceland\",\"Norway\"]}],\"nl_ref_type\": \"explicit\",\"nl_ref_phrase\": \"for countries Iceland and Norway\"},\n    {\"c_type\": \"transform\",\"c_name\": \"filter\",\"c_list\": [{\"field\": \"country\",\"oneOf\": [\"Iceland\",\"Norway\"]}],\"nl_ref_type\": \"by_value\",\"nl_ref_phrase\": \"for Iceland and Norway\"},\n- the 'nl_ref_phrase' for 'ambiguous' columns should be equally near all ambiguous columns, not too near to one of the column since it would not be ambiguous.\n    good example: {\"column\": [\"country\",\"region\"], \"nl_ref_type\": \"ambiguous\", \"nl_ref_phrase\": \"location\"}\n    bad example: {\"column\": [\"country\",\"region\"], \"nl_ref_type\": \"ambiguous\", \"nl_ref_phrase\": \"region\"}\n- You only include given constraints and no other information. \n    For example, if a column name is not in the given constraint, it will not be included in the NL utterance.\n    Also, it a chart mark or chart encoding channel is not in the given constraint, it will not be included in the NL utterance.\n- all 'nl_ref_phrase' shoule be included in the 'nl_utterance'. \n\nThe output format is identical to the input format, but fill in the str blanks(\"...\").\n### Input:\n{\n  \"nl_utterance\": \"...\",\n  \"encoded_fields\": [\n    {\n      \"field\": \"Component 2\",\n      \"type\": \"quantitative\",\n      \"nl_ref_type\": \"explicit\",\n      \"nl_ref_phrase\": \"...\"\n    },\n    {\n      \"field\": \"Pos\",\n      \"type\": \"nominal\",\n      \"nl_ref_type\": \"explicit\",\n      \"nl_ref_phrase\": \"...\"\n    }\n  ],\n  \"constraints\": [\n    {\n      \"c_type\": \"task\",\n      \"c_name\": \"correlation\",\n      \"c_list\": [\n        {\n          \"mark\": \"circle\",\n          \"encoding\": {\n            \"x\": {\n              \"type\": \"quantitative\"\n            },\n            \"y\": {\n              \"type\": \"quantitative\"\n            }\n          }\n        }\n      ],\n      \"nl_ref_type\": \"explicit\",\n      \"nl_ref_phrase\": \"...\"\n    }\n  ]\n}\n\n### Output:"
}