{
  "gpt_result": {
    "nl_utterance": "Create a scatter plot to show the correlation between GDP per capita and the Human Capital Index, filtered to include only entries with a Human Capital Index greater than 0 and GDP per capita (PPP) over 1000, colored by continent while showing population size.",
    "encoded_fields": [
      {
        "field": "GDP per capita (PPP)",
        "type": "quantitative",
        "nl_ref_type": "explicit",
        "nl_ref_phrase": "GDP per capita"
      },
      {
        "field": "Human Capital Index",
        "type": "quantitative",
        "nl_ref_type": "explicit",
        "nl_ref_phrase": "Human Capital Index"
      },
      {
        "field": "Continent",
        "type": "nominal",
        "nl_ref_type": "explicit",
        "nl_ref_phrase": "continent"
      },
      {
        "field": "Population",
        "type": "quantitative",
        "nl_ref_type": "explicit",
        "nl_ref_phrase": "population"
      }
    ],
    "constraints": [
      {
        "c_type": "task",
        "c_name": "correlation",
        "c_list": [
          {
            "mark": "circle",
            "encoding": {
              "x": {
                "type": "quantitative"
              },
              "y": {
                "type": "quantitative"
              }
            }
          }
        ],
        "nl_ref_type": "explicit",
        "nl_ref_phrase": "correlation"
      },
      {
        "c_type": "mark",
        "c_name": "point chart",
        "c_list": [
          {
            "mark": "circle",
            "encoding": {
              "x": {},
              "y": {},
              "color": {
                "type": "nominal",
                "ignore": true
              },
              "size": {
                "ignore": true,
                "type": "quantitative"
              },
              "column": {
                "ignore": true,
                "type": "nominal"
              },
              "row": {
                "ignore": true,
                "type": "nominal"
              }
            }
          }
        ],
        "nl_ref_type": "explicit",
        "nl_ref_phrase": "scatter plot"
      },
      {
        "c_type": "transform",
        "c_name": "filter",
        "c_list": [
          {
            "field": "Human Capital Index",
            "gt": 0
          }
        ],
        "nl_ref_type": "explicit",
        "nl_ref_phrase": "filtered to include only entries with a Human Capital Index greater than 0"
      },
      {
        "c_type": "transform",
        "c_name": "filter",
        "c_list": [
          {
            "field": "GDP per capita (PPP)",
            "gt": 1000
          }
        ],
        "nl_ref_type": "explicit",
        "nl_ref_phrase": "GDP per capita (PPP) over 1000"
      }
    ]
  },
  "input": "Dataset Information: {\n  \"data samples\": [\n    {\n      \"Country\": \"Afghanistan\",\n      \"ISO3\": \"AFG\",\n      \"Region\": \"South Asia\",\n      \"Income Group\": \"Low income\",\n      \"Probability of Survival to Age 5\": 0.93425,\n      \"Expected Years of School\": 9.65539,\n      \"Harmonized Test Scores\": 357.79474,\n      \"Learning-Adjusted Years of School\": 5.52743,\n      \"Fraction of Children Under 5 Not Stunted\": 0.61741,\n      \"Adult Survival Rate\": 0.76612,\n      \"Human Capital Index\": 0.41128,\n      \"GDP per capita (PPP)\": 2076.13838,\n      \"Log GDP per capita\": 7.638264899097053,\n      \"Population\": 38972230.0,\n      \"Continent\": \"Asia\"\n    },\n    {\n      \"Country\": \"Nauru\",\n      \"ISO3\": \"NRU\",\n      \"Region\": \"East Asia & Pacific\",\n      \"Income Group\": \"High income\",\n      \"Probability of Survival to Age 5\": 0.96491,\n      \"Expected Years of School\": 11.9044,\n      \"Harmonized Test Scores\": 319.87552,\n      \"Learning-Adjusted Years of School\": 6.09268,\n      \"Fraction of Children Under 5 Not Stunted\": NaN,\n      \"Adult Survival Rate\": 0.91,\n      \"Human Capital Index\": 0.48333,\n      \"GDP per capita (PPP)\": 12613.06808,\n      \"Log GDP per capita\": 9.44248870467827,\n      \"Population\": 12315.0,\n      \"Continent\": \"Oceania\"\n    },\n    {\n      \"Country\": \"Japan\",\n      \"ISO3\": \"JPN\",\n      \"Region\": \"East Asia & Pacific\",\n      \"Income Group\": \"High income\",\n      \"Probability of Survival to Age 5\": 0.99738,\n      \"Expected Years of School\": NaN,\n      \"Harmonized Test Scores\": 536.55029,\n      \"Learning-Adjusted Years of School\": NaN,\n      \"Fraction of Children Under 5 Not Stunted\": NaN,\n      \"Adult Survival Rate\": 0.93283,\n      \"Human Capital Index\": NaN,\n      \"GDP per capita (PPP)\": 42100.25769,\n      \"Log GDP per capita\": 10.647809140554353,\n      \"Population\": 126261000.0,\n      \"Continent\": \"Asia\"\n    },\n    {\n      \"Country\": \"Peru\",\n      \"ISO3\": \"PER\",\n      \"Region\": \"Latin America & Caribbean\",\n      \"Income Group\": \"Upper middle income\",\n      \"Probability of Survival to Age 5\": 0.98432,\n      \"Expected Years of School\": 13.12879,\n      \"Harmonized Test Scores\": 418.38531,\n      \"Learning-Adjusted Years of School\": 8.78863,\n      \"Fraction of Children Under 5 Not Stunted\": 0.87586,\n      \"Adult Survival Rate\": 0.85576,\n      \"Human Capital Index\": 0.60573,\n      \"GDP per capita (PPP)\": 11789.02928,\n      \"Log GDP per capita\": 9.374924655960262,\n      \"Population\": 33304756.0,\n      \"Continent\": \"America\"\n    },\n    {\n      \"Country\": \"Korea, Rep.\",\n      \"ISO3\": \"KOR\",\n      \"Region\": \"East Asia & Pacific\",\n      \"Income Group\": \"High income\",\n      \"Probability of Survival to Age 5\": 0.99657,\n      \"Expected Years of School\": 13.60233,\n      \"Harmonized Test Scores\": 534.81897,\n      \"Learning-Adjusted Years of School\": 11.63965,\n      \"Fraction of Children Under 5 Not Stunted\": NaN,\n      \"Adult Survival Rate\": 0.92198,\n      \"Human Capital Index\": 0.78412,\n      \"GDP per capita (PPP)\": 45403.03259,\n      \"Log GDP per capita\": 10.723334178935174,\n      \"Population\": 51836239.0,\n      \"Continent\": \"Asia\"\n    }\n  ],\n  \"column names\": [\n    \"Country\",\n    \"ISO3\",\n    \"Region\",\n    \"Income Group\",\n    \"Probability of Survival to Age 5\",\n    \"Expected Years of School\",\n    \"Harmonized Test Scores\",\n    \"Learning-Adjusted Years of School\",\n    \"Fraction of Children Under 5 Not Stunted\",\n    \"Adult Survival Rate\",\n    \"Human Capital Index\",\n    \"GDP per capita (PPP)\",\n    \"Log GDP per capita\",\n    \"Population\",\n    \"Continent\"\n  ]\n}\n\nYour Job:\nI am developing a NL to Data Visualization Dataset. \nPlease help me generate natural language utterance for given dataset and constraints.\nDefinition about the Taks:\n- 'utterance' is what a user would say to make a chart. It should be a queries structure. One NL 'utterance' is in one or two sentences. Here are two examples from Queries for reference:\n    sales forecast between Jan 2016 and July 2017.\n    Line Graph of SUM (Sales Forecast) vs Order Date.\n- 'given dataset' is in form of column names, column type, range/unique values of the column.\n- 'constraints' are information about the chart that should be included in the utterance. \n    So we can find a reference phrase in the NL utterance that corresponds to the given constraints. \n- 'reference phrase' can be explicit, ambiguous, and by_value. 'ambiguous' means the phrase can map to more than one columns in the dataset, always a hypernym of column names(depending on the dataset values).\n    For example:\n    {\"column\": \"gdpPercap\", \"nl_ref_type\": \"explicit\", \"nl_ref_phrase\": \"GDP per capita\"},\n    {\"column\": [\"country\",\"continent\"], \"nl_ref_type\": \"ambiguous\", \"nl_ref_phrase\": \"region\"}\n    {\"column\": [\"country\",\"country_short_name\"], \"nl_ref_type\": \"ambiguous\", \"nl_ref_phrase\": \"countries\"}\n    {\"c_type\": \"mark\", \"c_name\": \"point chart\", \"nl_ref_type\": \"explicit\", \"nl_ref_phrase\": \"scatter plot\"}\n    {\"c_type\": \"mark\", \"c_name\": \"arc chart\", \"nl_ref_type\": \"explicit\", \"nl_ref_phrase\": \"pie chart\"}\n    {\"c_type\": \"transform\",\"c_name\": \"filter\",\"c_list\": [{\"field\": \"country\",\"oneOf\": [\"Iceland\",\"Norway\"]}],\"nl_ref_type\": \"explicit\",\"nl_ref_phrase\": \"for countries Iceland and Norway\"},\n    {\"c_type\": \"transform\",\"c_name\": \"filter\",\"c_list\": [{\"field\": \"country\",\"oneOf\": [\"Iceland\",\"Norway\"]}],\"nl_ref_type\": \"by_value\",\"nl_ref_phrase\": \"for Iceland and Norway\"},\n- the 'nl_ref_phrase' for 'ambiguous' columns should be equally near all ambiguous columns, not too near to one of the column since it would not be ambiguous.\n    good example: {\"column\": [\"country\",\"region\"], \"nl_ref_type\": \"ambiguous\", \"nl_ref_phrase\": \"location\"}\n    bad example: {\"column\": [\"country\",\"region\"], \"nl_ref_type\": \"ambiguous\", \"nl_ref_phrase\": \"region\"}\n- You only include given constraints and no other information. \n    For example, if a column name is not in the given constraint, it will not be included in the NL utterance.\n    Also, it a chart mark or chart encoding channel is not in the given constraint, it will not be included in the NL utterance.\n- all 'nl_ref_phrase' shoule be included in the 'nl_utterance'. \n\nThe output format is identical to the input format, but fill in the str blanks(\"...\").\n### Input:\n{\n  \"nl_utterance\": \"...\",\n  \"encoded_fields\": [\n    {\n      \"field\": \"GDP per capita (PPP)\",\n      \"type\": \"quantitative\",\n      \"nl_ref_type\": \"explicit\",\n      \"nl_ref_phrase\": \"...\"\n    },\n    {\n      \"field\": \"Human Capital Index\",\n      \"type\": \"quantitative\",\n      \"nl_ref_type\": \"explicit\",\n      \"nl_ref_phrase\": \"...\"\n    },\n    {\n      \"field\": \"Continent\",\n      \"type\": \"nominal\",\n      \"nl_ref_type\": \"explicit\",\n      \"nl_ref_phrase\": \"...\"\n    },\n    {\n      \"field\": \"Population\",\n      \"type\": \"quantitative\",\n      \"nl_ref_type\": \"explicit\",\n      \"nl_ref_phrase\": \"...\"\n    }\n  ],\n  \"constraints\": [\n    {\n      \"c_type\": \"task\",\n      \"c_name\": \"correlation\",\n      \"c_list\": [\n        {\n          \"mark\": \"circle\",\n          \"encoding\": {\n            \"x\": {\n              \"type\": \"quantitative\"\n            },\n            \"y\": {\n              \"type\": \"quantitative\"\n            }\n          }\n        }\n      ],\n      \"nl_ref_type\": \"explicit\",\n      \"nl_ref_phrase\": \"...\"\n    },\n    {\n      \"c_type\": \"mark\",\n      \"c_name\": \"point chart\",\n      \"c_list\": [\n        {\n          \"mark\": \"circle\",\n          \"encoding\": {\n            \"x\": {},\n            \"y\": {},\n            \"color\": {\n              \"type\": \"nominal\",\n              \"ignore\": true\n            },\n            \"size\": {\n              \"ignore\": true,\n              \"type\": \"quantitative\"\n            },\n            \"column\": {\n              \"ignore\": true,\n              \"type\": \"nominal\"\n            },\n            \"row\": {\n              \"ignore\": true,\n              \"type\": \"nominal\"\n            }\n          }\n        }\n      ],\n      \"nl_ref_type\": \"explicit\",\n      \"nl_ref_phrase\": \"...\"\n    },\n    {\n      \"c_type\": \"transform\",\n      \"c_name\": \"filter\",\n      \"c_list\": [\n        {\n          \"field\": \"Human Capital Index\",\n          \"gt\": 0\n        }\n      ],\n      \"nl_ref_type\": \"explicit\",\n      \"nl_ref_phrase\": \"...\"\n    },\n    {\n      \"c_type\": \"transform\",\n      \"c_name\": \"filter\",\n      \"c_list\": [\n        {\n          \"field\": \"GDP per capita (PPP)\",\n          \"gt\": 1000\n        }\n      ],\n      \"nl_ref_type\": \"explicit\",\n      \"nl_ref_phrase\": \"...\"\n    }\n  ]\n}\n\n### Output:"
}