{
  "gpt_result": {
    "nl_utterance": "What is the average democracy index by regime type?",
    "encoded_fields": [
      {
        "field": "democracy_eiu",
        "type": "quantitative",
        "nl_ref_type": "explicit",
        "nl_ref_phrase": "democracy index"
      },
      {
        "field": "Regime",
        "type": "nominal",
        "nl_ref_type": "explicit",
        "nl_ref_phrase": "regime type"
      }
    ],
    "constraints": [
      {
        "c_type": "transform",
        "c_name": "aggregate",
        "c_list": [
          {
            "field": "democracy_eiu",
            "aggregate": "mean"
          }
        ],
        "nl_ref_type": "explicit",
        "nl_ref_phrase": "average"
      }
    ]
  },
  "input": "Dataset Information: {\n  \"data samples\": [\n    {\n      \"ISO3\": \"AFG\",\n      \"Year\": 2021,\n      \"democracy_eiu\": 0.32,\n      \"Country\": \"Afghanistan\",\n      \"GDP\": 14786861638.0,\n      \"Region\": \"South Asia\",\n      \"Regime\": \"Authoritarian Regime\",\n      \"Sources\": NaN\n    },\n    {\n      \"ISO3\": \"LUX\",\n      \"Year\": 2021,\n      \"democracy_eiu\": 8.68,\n      \"Country\": \"Luxembourg\",\n      \"GDP\": 85506243834.0,\n      \"Region\": \"Europe & Central Asia\",\n      \"Regime\": \"Full Democracy\",\n      \"Sources\": NaN\n    },\n    {\n      \"ISO3\": \"GAB\",\n      \"Year\": 2021,\n      \"democracy_eiu\": 3.4,\n      \"Country\": \"Gabon\",\n      \"GDP\": 20216843174.0,\n      \"Region\": \"Sub-Saharan Africa\",\n      \"Regime\": \"Authoritarian Regime\",\n      \"Sources\": NaN\n    },\n    {\n      \"ISO3\": \"CHL\",\n      \"Year\": 2021,\n      \"democracy_eiu\": 7.92,\n      \"Country\": \"Chile\",\n      \"GDP\": 317000000000.0,\n      \"Region\": \"Latin America & Caribbean\",\n      \"Regime\": \"Flawed Democracy\",\n      \"Sources\": NaN\n    },\n    {\n      \"ISO3\": \"ROU\",\n      \"Year\": 2021,\n      \"democracy_eiu\": 6.43,\n      \"Country\": \"Romania\",\n      \"GDP\": 284000000000.0,\n      \"Region\": \"Europe & Central Asia\",\n      \"Regime\": \"Flawed Democracy\",\n      \"Sources\": NaN\n    }\n  ],\n  \"column names\": [\n    \"ISO3\",\n    \"Year\",\n    \"democracy_eiu\",\n    \"Country\",\n    \"GDP\",\n    \"Region\",\n    \"Regime\",\n    \"Sources\"\n  ]\n}\n\nYour Job:\nI am developing a NL to Data Visualization Dataset. \nPlease help me generate natural language utterance for given dataset and constraints.\nDefinition about the Taks:\n- 'utterance' is what a user would say to make a chart. It should be a questions structure. One NL 'utterance' is in one or two sentences. Here are two examples from Questions for reference:\n    Have cars gotten lighter over time?\n    Which countries have the highest acceleration for cars of different cylinders?\n- 'given dataset' is in form of column names, column type, range/unique values of the column.\n- 'constraints' are information about the chart that should be included in the utterance. \n    So we can find a reference phrase in the NL utterance that corresponds to the given constraints. \n- 'reference phrase' can be explicit, ambiguous, and by_value. 'ambiguous' means the phrase can map to more than one columns in the dataset, always a hypernym of column names(depending on the dataset values).\n    For example:\n    {\"column\": \"gdpPercap\", \"nl_ref_type\": \"explicit\", \"nl_ref_phrase\": \"GDP per capita\"},\n    {\"column\": [\"country\",\"continent\"], \"nl_ref_type\": \"ambiguous\", \"nl_ref_phrase\": \"region\"}\n    {\"column\": [\"country\",\"country_short_name\"], \"nl_ref_type\": \"ambiguous\", \"nl_ref_phrase\": \"countries\"}\n    {\"c_type\": \"mark\", \"c_name\": \"point chart\", \"nl_ref_type\": \"explicit\", \"nl_ref_phrase\": \"scatter plot\"}\n    {\"c_type\": \"mark\", \"c_name\": \"arc chart\", \"nl_ref_type\": \"explicit\", \"nl_ref_phrase\": \"pie chart\"}\n    {\"c_type\": \"transform\",\"c_name\": \"filter\",\"c_list\": [{\"field\": \"country\",\"oneOf\": [\"Iceland\",\"Norway\"]}],\"nl_ref_type\": \"explicit\",\"nl_ref_phrase\": \"for countries Iceland and Norway\"},\n    {\"c_type\": \"transform\",\"c_name\": \"filter\",\"c_list\": [{\"field\": \"country\",\"oneOf\": [\"Iceland\",\"Norway\"]}],\"nl_ref_type\": \"by_value\",\"nl_ref_phrase\": \"for Iceland and Norway\"},\n- the 'nl_ref_phrase' for 'ambiguous' columns should be equally near all ambiguous columns, not too near to one of the column since it would not be ambiguous.\n    good example: {\"column\": [\"country\",\"region\"], \"nl_ref_type\": \"ambiguous\", \"nl_ref_phrase\": \"location\"}\n    bad example: {\"column\": [\"country\",\"region\"], \"nl_ref_type\": \"ambiguous\", \"nl_ref_phrase\": \"region\"}\n- You only include given constraints and no other information. \n    For example, if a column name is not in the given constraint, it will not be included in the NL utterance.\n    Also, it a chart mark or chart encoding channel is not in the given constraint, it will not be included in the NL utterance.\n- all 'nl_ref_phrase' shoule be included in the 'nl_utterance'. \n\nThe output format is identical to the input format, but fill in the str blanks(\"...\").\n### Input:\n{\n  \"nl_utterance\": \"...\",\n  \"encoded_fields\": [\n    {\n      \"field\": \"democracy_eiu\",\n      \"type\": \"quantitative\",\n      \"nl_ref_type\": \"explicit\",\n      \"nl_ref_phrase\": \"...\"\n    },\n    {\n      \"field\": \"Regime\",\n      \"type\": \"nominal\",\n      \"nl_ref_type\": \"explicit\",\n      \"nl_ref_phrase\": \"...\"\n    }\n  ],\n  \"constraints\": [\n    {\n      \"c_type\": \"transform\",\n      \"c_name\": \"aggregate\",\n      \"c_list\": [\n        {\n          \"field\": \"democracy_eiu\",\n          \"aggregate\": \"mean\"\n        }\n      ],\n      \"nl_ref_type\": \"explicit\",\n      \"nl_ref_phrase\": \"...\"\n    }\n  ]\n}\n\n### Output:"
}