{
  "gpt_result": {
    "nl_utterance": "Can you create a chart to show the composition of production budgets across different movies?",
    "encoded_fields": [
      {
        "field": "Production Budget",
        "type": "quantitative",
        "nl_ref_type": "explicit",
        "nl_ref_phrase": "production budgets"
      }
    ],
    "constraints": [
      {
        "c_type": "task",
        "c_name": "composition",
        "c_list": [
          {
            "mark": "bar",
            "encoding": {
              "x": {},
              "y": {
                "type": "quantitative"
              },
              "color": {
                "type": "nominal"
              }
            },
            "x_y_reversable": true
          },
          {
            "mark": "area",
            "encoding": {
              "x": {},
              "y": {
                "type": "quantitative"
              },
              "color": {
                "type": "nominal"
              }
            }
          },
          {
            "mark": "arc",
            "encoding": {
              "theta": {
                "type": "quantitative"
              },
              "color": {
                "type": "nominal"
              }
            }
          }
        ],
        "nl_ref_type": "explicit",
        "nl_ref_phrase": "composition"
      }
    ]
  },
  "input": "Dataset Information: {\n  \"data samples\": [\n    {\n      \"Title\": \"From Dusk Till Dawn\",\n      \"Worldwide Gross\": 25728961,\n      \"Production Budget\": 20000000,\n      \"Release Year\": 1996,\n      \"Content Rating\": \"R\",\n      \"Running Time\": 107,\n      \"Genre\": \"Horror\",\n      \"Creative Type\": \"Fantasy\",\n      \"Rotten Tomatoes Rating\": 63,\n      \"IMDB Rating\": 7.1\n    },\n    {\n      \"Title\": \"John Q\",\n      \"Worldwide Gross\": 102226631,\n      \"Production Budget\": 36000000,\n      \"Release Year\": 2002,\n      \"Content Rating\": \"PG-13\",\n      \"Running Time\": 116,\n      \"Genre\": \"Drama\",\n      \"Creative Type\": \"Contemporary Fiction\",\n      \"Rotten Tomatoes Rating\": 22,\n      \"IMDB Rating\": 6.6\n    },\n    {\n      \"Title\": \"Wonder Boys\",\n      \"Worldwide Gross\": 33422485,\n      \"Production Budget\": 35000000,\n      \"Release Year\": 2000,\n      \"Content Rating\": \"R\",\n      \"Running Time\": 111,\n      \"Genre\": \"Comedy\",\n      \"Creative Type\": \"Contemporary Fiction\",\n      \"Rotten Tomatoes Rating\": 81,\n      \"IMDB Rating\": 7.5\n    },\n    {\n      \"Title\": \"The Mummy\",\n      \"Worldwide Gross\": 416385488,\n      \"Production Budget\": 80000000,\n      \"Release Year\": 1999,\n      \"Content Rating\": \"PG-13\",\n      \"Running Time\": 124,\n      \"Genre\": \"Adventure\",\n      \"Creative Type\": \"Fantasy\",\n      \"Rotten Tomatoes Rating\": 54,\n      \"IMDB Rating\": 6.8\n    },\n    {\n      \"Title\": \"The Jackal\",\n      \"Worldwide Gross\": 159356941,\n      \"Production Budget\": 60000000,\n      \"Release Year\": 1997,\n      \"Content Rating\": \"R\",\n      \"Running Time\": 124,\n      \"Genre\": \"Thriller\",\n      \"Creative Type\": \"Contemporary Fiction\",\n      \"Rotten Tomatoes Rating\": 12,\n      \"IMDB Rating\": 6.0\n    }\n  ],\n  \"column names\": [\n    \"Title\",\n    \"Worldwide Gross\",\n    \"Production Budget\",\n    \"Release Year\",\n    \"Content Rating\",\n    \"Running Time\",\n    \"Genre\",\n    \"Creative Type\",\n    \"Rotten Tomatoes Rating\",\n    \"IMDB Rating\"\n  ]\n}\n\nYour Job:\nI am developing a NL to Data Visualization Dataset. \nPlease help me generate natural language utterance for given dataset and constraints.\nDefinition about the Taks:\n- 'utterance' is what a user would say to make a chart. It should be a questions structure. One NL 'utterance' is in one or two sentences. Here are two examples from Questions for reference:\n    What major genre had the highest average worldwide gross?\n    Have cars gotten lighter over time?\n- 'given dataset' is in form of column names, column type, range/unique values of the column.\n- 'constraints' are information about the chart that should be included in the utterance. \n    So we can find a reference phrase in the NL utterance that corresponds to the given constraints. \n- 'reference phrase' can be explicit, ambiguous, and by_value. 'ambiguous' means the phrase can map to more than one columns in the dataset, always a hypernym of column names(depending on the dataset values).\n    For example:\n    {\"column\": \"gdpPercap\", \"nl_ref_type\": \"explicit\", \"nl_ref_phrase\": \"GDP per capita\"},\n    {\"column\": [\"country\",\"continent\"], \"nl_ref_type\": \"ambiguous\", \"nl_ref_phrase\": \"region\"}\n    {\"column\": [\"country\",\"country_short_name\"], \"nl_ref_type\": \"ambiguous\", \"nl_ref_phrase\": \"countries\"}\n    {\"c_type\": \"mark\", \"c_name\": \"point chart\", \"nl_ref_type\": \"explicit\", \"nl_ref_phrase\": \"scatter plot\"}\n    {\"c_type\": \"mark\", \"c_name\": \"arc chart\", \"nl_ref_type\": \"explicit\", \"nl_ref_phrase\": \"pie chart\"}\n    {\"c_type\": \"transform\",\"c_name\": \"filter\",\"c_list\": [{\"field\": \"country\",\"oneOf\": [\"Iceland\",\"Norway\"]}],\"nl_ref_type\": \"explicit\",\"nl_ref_phrase\": \"for countries Iceland and Norway\"},\n    {\"c_type\": \"transform\",\"c_name\": \"filter\",\"c_list\": [{\"field\": \"country\",\"oneOf\": [\"Iceland\",\"Norway\"]}],\"nl_ref_type\": \"by_value\",\"nl_ref_phrase\": \"for Iceland and Norway\"},\n- the 'nl_ref_phrase' for 'ambiguous' columns should be equally near all ambiguous columns, not too near to one of the column since it would not be ambiguous.\n    good example: {\"column\": [\"country\",\"region\"], \"nl_ref_type\": \"ambiguous\", \"nl_ref_phrase\": \"location\"}\n    bad example: {\"column\": [\"country\",\"region\"], \"nl_ref_type\": \"ambiguous\", \"nl_ref_phrase\": \"region\"}\n- You only include given constraints and no other information. \n    For example, if a column name is not in the given constraint, it will not be included in the NL utterance.\n    Also, it a chart mark or chart encoding channel is not in the given constraint, it will not be included in the NL utterance.\n- all 'nl_ref_phrase' shoule be included in the 'nl_utterance'. \n\nThe output format is identical to the input format, but fill in the str blanks(\"...\").\n### Input:\n{\n  \"nl_utterance\": \"...\",\n  \"encoded_fields\": [\n    {\n      \"field\": \"Production Budget\",\n      \"type\": \"quantitative\",\n      \"nl_ref_type\": \"explicit\",\n      \"nl_ref_phrase\": \"...\"\n    }\n  ],\n  \"constraints\": [\n    {\n      \"c_type\": \"task\",\n      \"c_name\": \"composition\",\n      \"c_list\": [\n        {\n          \"mark\": \"bar\",\n          \"encoding\": {\n            \"x\": {},\n            \"y\": {\n              \"type\": \"quantitative\"\n            },\n            \"color\": {\n              \"type\": \"nominal\"\n            }\n          },\n          \"x_y_reversable\": true\n        },\n        {\n          \"mark\": \"area\",\n          \"encoding\": {\n            \"x\": {},\n            \"y\": {\n              \"type\": \"quantitative\"\n            },\n            \"color\": {\n              \"type\": \"nominal\"\n            }\n          }\n        },\n        {\n          \"mark\": \"arc\",\n          \"encoding\": {\n            \"theta\": {\n              \"type\": \"quantitative\"\n            },\n            \"color\": {\n              \"type\": \"nominal\"\n            }\n          }\n        }\n      ],\n      \"nl_ref_type\": \"explicit\",\n      \"nl_ref_phrase\": \"...\"\n    }\n  ]\n}\n\n### Output:"
}