{
  "gpt_result": {
    "nl_utterance": "How does the distribution of mobility, commute, migration in, and migration out look like when aggregated as a count?",
    "encoded_fields": [
      {
        "field": [
          "Mobility",
          "Commute",
          "Migration_in",
          "Migration_out"
        ],
        "type": "quantitative",
        "nl_ref_type": "ambiguous",
        "nl_ref_phrase": "mobility, commute, migration in, and migration out"
      }
    ],
    "constraints": [
      {
        "c_type": "task",
        "c_name": "distribution",
        "c_list": [
          {
            "mark": "bar",
            "encoding": {
              "y": {
                "aggregate": "count",
                "type": "quantitative"
              }
            },
            "x_y_reversable": true
          },
          {
            "mark": "boxplot",
            "encoding": {
              "x": {
                "type": "quantitative"
              }
            },
            "x_y_reversable": true
          }
        ],
        "nl_ref_type": "explicit",
        "nl_ref_phrase": "distribution"
      },
      {
        "c_type": "transform",
        "c_name": "aggregate",
        "c_list": [
          {
            "aggregate": "count"
          }
        ],
        "nl_ref_type": "explicit",
        "nl_ref_phrase": "aggregated as a count"
      }
    ]
  },
  "input": "Dataset Information: {\n  \"data samples\": [\n    {\n      \"ID\": 100,\n      \"Name\": \"Johnson City\",\n      \"Mobility\": 0.0621988103,\n      \"State\": \"TN\",\n      \"Population\": 576081,\n      \"Urban\": 1,\n      \"Black\": 0.021,\n      \"Seg_racial\": 0.09,\n      \"Seg_income\": 0.035,\n      \"Seg_poverty\": 0.03,\n      \"Seg_affluence\": 0.038,\n      \"Commute\": 0.325,\n      \"Income\": 31560,\n      \"Gini\": 0.468,\n      \"Share01\": 13.459,\n      \"Gini_99\": 0.333,\n      \"Middle_class\": 0.548,\n      \"Local_tax_rate\": 0.02,\n      \"Local_gov_spending\": 1886.0,\n      \"Progressivity\": 0.0,\n      \"EITC\": 0.0,\n      \"School_spending\": 5.185,\n      \"Student_teacher_ratio\": NaN,\n      \"Test_scores\": 2.728,\n      \"HS_dropout\": -0.015,\n      \"Colleges\": 0.014,\n      \"Tuition\": 4817.0,\n      \"Graduation\": -0.002,\n      \"Labor_force_participation\": 0.587,\n      \"Manufacturing\": 0.237,\n      \"Chinese_imports\": 5.294,\n      \"Teenage_labor\": 0.004,\n      \"Migration_in\": 0.006,\n      \"Migration_out\": 0.005,\n      \"Foreign_born\": 0.012,\n      \"Social_capital\": -0.298,\n      \"Religious\": 0.514,\n      \"Violent_crime\": 0.001,\n      \"Single_mothers\": 0.19,\n      \"Divorced\": 0.11,\n      \"Married\": 0.601,\n      \"Longitude\": -82.4363861083984,\n      \"Latitude\": 36.4703712463379\n    },\n    {\n      \"ID\": 28701,\n      \"Name\": \"Salida\",\n      \"Mobility\": 0.0894736871,\n      \"State\": \"CO\",\n      \"Population\": 16242,\n      \"Urban\": 0,\n      \"Black\": 0.016,\n      \"Seg_racial\": 0.032,\n      \"Seg_income\": 0.023,\n      \"Seg_poverty\": 0.012,\n      \"Seg_affluence\": 0.029,\n      \"Commute\": 0.644,\n      \"Income\": 33185,\n      \"Gini\": 0.326,\n      \"Share01\": 4.764,\n      \"Gini_99\": 0.279,\n      \"Middle_class\": 0.646,\n      \"Local_tax_rate\": 0.024,\n      \"Local_gov_spending\": 1897.0,\n      \"Progressivity\": 0.0,\n      \"EITC\": 1.429,\n      \"School_spending\": 5.695,\n      \"Student_teacher_ratio\": 15.5,\n      \"Test_scores\": 6.261,\n      \"HS_dropout\": NaN,\n      \"Colleges\": NaN,\n      \"Tuition\": NaN,\n      \"Graduation\": NaN,\n      \"Labor_force_participation\": 0.529,\n      \"Manufacturing\": 0.038,\n      \"Chinese_imports\": 1.359,\n      \"Teenage_labor\": 0.008,\n      \"Migration_in\": 0.026,\n      \"Migration_out\": 0.022,\n      \"Foreign_born\": 0.02,\n      \"Social_capital\": 0.35,\n      \"Religious\": 0.531,\n      \"Violent_crime\": 0.002,\n      \"Single_mothers\": 0.175,\n      \"Divorced\": 0.1,\n      \"Married\": 0.64,\n      \"Longitude\": -106.205490112305,\n      \"Latitude\": 38.7574195861816\n    },\n    {\n      \"ID\": 900,\n      \"Name\": \"Charlotte\",\n      \"Mobility\": 0.0437852368,\n      \"State\": \"NC\",\n      \"Population\": 1423942,\n      \"Urban\": 1,\n      \"Black\": 0.227,\n      \"Seg_racial\": 0.223,\n      \"Seg_income\": 0.098,\n      \"Seg_poverty\": 0.078,\n      \"Seg_affluence\": 0.12,\n      \"Commute\": 0.241,\n      \"Income\": 41423,\n      \"Gini\": 0.516,\n      \"Share01\": 15.613,\n      \"Gini_99\": 0.36,\n      \"Middle_class\": 0.477,\n      \"Local_tax_rate\": 0.02,\n      \"Local_gov_spending\": 2701.0,\n      \"Progressivity\": 1.0,\n      \"EITC\": 0.0,\n      \"School_spending\": 5.674,\n      \"Student_teacher_ratio\": 17.0,\n      \"Test_scores\": -2.291,\n      \"HS_dropout\": 0.023,\n      \"Colleges\": 0.013,\n      \"Tuition\": 4790.0,\n      \"Graduation\": -0.021,\n      \"Labor_force_participation\": 0.696,\n      \"Manufacturing\": 0.171,\n      \"Chinese_imports\": 0.837,\n      \"Teenage_labor\": 0.004,\n      \"Migration_in\": 0.034,\n      \"Migration_out\": 0.021,\n      \"Foreign_born\": 0.065,\n      \"Social_capital\": -0.484,\n      \"Religious\": 0.496,\n      \"Violent_crime\": 0.004,\n      \"Single_mothers\": 0.219,\n      \"Divorced\": 0.088,\n      \"Married\": 0.563,\n      \"Longitude\": -80.691764831543,\n      \"Latitude\": 35.0905609130859\n    },\n    {\n      \"ID\": 23801,\n      \"Name\": \"Davenport\",\n      \"Mobility\": 0.0809443519,\n      \"State\": \"IL\",\n      \"Population\": 382351,\n      \"Urban\": 1,\n      \"Black\": 0.055,\n      \"Seg_racial\": 0.164,\n      \"Seg_income\": 0.058,\n      \"Seg_poverty\": 0.051,\n      \"Seg_affluence\": 0.061,\n      \"Commute\": 0.393,\n      \"Income\": 37759,\n      \"Gini\": 0.37,\n      \"Share01\": 9.948,\n      \"Gini_99\": 0.271,\n      \"Middle_class\": 0.536,\n      \"Local_tax_rate\": 0.021,\n      \"Local_gov_spending\": 1921.0,\n      \"Progressivity\": 0.0,\n      \"EITC\": 0.476,\n      \"School_spending\": 5.271,\n      \"Student_teacher_ratio\": 17.1,\n      \"Test_scores\": 0.599,\n      \"HS_dropout\": -0.001,\n      \"Colleges\": 0.024,\n      \"Tuition\": 7381.0,\n      \"Graduation\": 0.012,\n      \"Labor_force_participation\": 0.664,\n      \"Manufacturing\": 0.179,\n      \"Chinese_imports\": 1.202,\n      \"Teenage_labor\": 0.006,\n      \"Migration_in\": 0.01,\n      \"Migration_out\": 0.011,\n      \"Foreign_born\": 0.033,\n      \"Social_capital\": 0.735,\n      \"Religious\": 0.508,\n      \"Violent_crime\": 0.005,\n      \"Single_mothers\": 0.226,\n      \"Divorced\": 0.108,\n      \"Married\": 0.562,\n      \"Longitude\": -90.5065460205078,\n      \"Latitude\": 41.4243698120117\n    },\n    {\n      \"ID\": 37700,\n      \"Name\": \"Santa Rosa\",\n      \"Mobility\": 0.0995508954,\n      \"State\": \"CA\",\n      \"Population\": 603188,\n      \"Urban\": 1,\n      \"Black\": 0.013,\n      \"Seg_racial\": 0.074,\n      \"Seg_income\": 0.065,\n      \"Seg_poverty\": 0.062,\n      \"Seg_affluence\": 0.069,\n      \"Commute\": 0.349,\n      \"Income\": 43636,\n      \"Gini\": 0.445,\n      \"Share01\": 14.83,\n      \"Gini_99\": 0.297,\n      \"Middle_class\": 0.498,\n      \"Local_tax_rate\": 0.02,\n      \"Local_gov_spending\": 3118.0,\n      \"Progressivity\": 6.3,\n      \"EITC\": 0.0,\n      \"School_spending\": 7.597,\n      \"Student_teacher_ratio\": 21.3,\n      \"Test_scores\": -14.668,\n      \"HS_dropout\": NaN,\n      \"Colleges\": 0.01,\n      \"Tuition\": 165.0,\n      \"Graduation\": -0.032,\n      \"Labor_force_participation\": 0.645,\n      \"Manufacturing\": 0.118,\n      \"Chinese_imports\": 1.01,\n      \"Teenage_labor\": 0.005,\n      \"Migration_in\": 0.022,\n      \"Migration_out\": 0.026,\n      \"Foreign_born\": 0.13,\n      \"Social_capital\": -0.103,\n      \"Religious\": 0.323,\n      \"Violent_crime\": 0.004,\n      \"Single_mothers\": 0.207,\n      \"Divorced\": 0.127,\n      \"Married\": 0.525,\n      \"Longitude\": -122.767791748047,\n      \"Latitude\": 38.9323234558105\n    }\n  ],\n  \"column names\": [\n    \"ID\",\n    \"Name\",\n    \"Mobility\",\n    \"State\",\n    \"Population\",\n    \"Urban\",\n    \"Black\",\n    \"Seg_racial\",\n    \"Seg_income\",\n    \"Seg_poverty\",\n    \"Seg_affluence\",\n    \"Commute\",\n    \"Income\",\n    \"Gini\",\n    \"Share01\",\n    \"Gini_99\",\n    \"Middle_class\",\n    \"Local_tax_rate\",\n    \"Local_gov_spending\",\n    \"Progressivity\",\n    \"EITC\",\n    \"School_spending\",\n    \"Student_teacher_ratio\",\n    \"Test_scores\",\n    \"HS_dropout\",\n    \"Colleges\",\n    \"Tuition\",\n    \"Graduation\",\n    \"Labor_force_participation\",\n    \"Manufacturing\",\n    \"Chinese_imports\",\n    \"Teenage_labor\",\n    \"Migration_in\",\n    \"Migration_out\",\n    \"Foreign_born\",\n    \"Social_capital\",\n    \"Religious\",\n    \"Violent_crime\",\n    \"Single_mothers\",\n    \"Divorced\",\n    \"Married\",\n    \"Longitude\",\n    \"Latitude\"\n  ]\n}\n\nYour Job:\nI am developing a NL to Data Visualization Dataset. \nPlease help me generate natural language utterance for given dataset and constraints.\nDefinition about the Taks:\n- 'utterance' is what a user would say to make a chart. It should be a questions structure. One NL 'utterance' is in one or two sentences. Here are two examples from Questions for reference:\n    What's the average production budget of the different rated movies, separated by creative type.\n    Are IMDb rating and rotten tomatoes rating related?\n- 'given dataset' is in form of column names, column type, range/unique values of the column.\n- 'constraints' are information about the chart that should be included in the utterance. \n    So we can find a reference phrase in the NL utterance that corresponds to the given constraints. \n- 'reference phrase' can be explicit, ambiguous, and by_value. 'ambiguous' means the phrase can map to more than one columns in the dataset, always a hypernym of column names(depending on the dataset values).\n    For example:\n    {\"column\": \"gdpPercap\", \"nl_ref_type\": \"explicit\", \"nl_ref_phrase\": \"GDP per capita\"},\n    {\"column\": [\"country\",\"continent\"], \"nl_ref_type\": \"ambiguous\", \"nl_ref_phrase\": \"region\"}\n    {\"column\": [\"country\",\"country_short_name\"], \"nl_ref_type\": \"ambiguous\", \"nl_ref_phrase\": \"countries\"}\n    {\"c_type\": \"mark\", \"c_name\": \"point chart\", \"nl_ref_type\": \"explicit\", \"nl_ref_phrase\": \"scatter plot\"}\n    {\"c_type\": \"mark\", \"c_name\": \"arc chart\", \"nl_ref_type\": \"explicit\", \"nl_ref_phrase\": \"pie chart\"}\n    {\"c_type\": \"transform\",\"c_name\": \"filter\",\"c_list\": [{\"field\": \"country\",\"oneOf\": [\"Iceland\",\"Norway\"]}],\"nl_ref_type\": \"explicit\",\"nl_ref_phrase\": \"for countries Iceland and Norway\"},\n    {\"c_type\": \"transform\",\"c_name\": \"filter\",\"c_list\": [{\"field\": \"country\",\"oneOf\": [\"Iceland\",\"Norway\"]}],\"nl_ref_type\": \"by_value\",\"nl_ref_phrase\": \"for Iceland and Norway\"},\n- the 'nl_ref_phrase' for 'ambiguous' columns should be equally near all ambiguous columns, not too near to one of the column since it would not be ambiguous.\n    good example: {\"column\": [\"country\",\"region\"], \"nl_ref_type\": \"ambiguous\", \"nl_ref_phrase\": \"location\"}\n    bad example: {\"column\": [\"country\",\"region\"], \"nl_ref_type\": \"ambiguous\", \"nl_ref_phrase\": \"region\"}\n- You only include given constraints and no other information. \n    For example, if a column name is not in the given constraint, it will not be included in the NL utterance.\n    Also, it a chart mark or chart encoding channel is not in the given constraint, it will not be included in the NL utterance.\n- all 'nl_ref_phrase' shoule be included in the 'nl_utterance'. \n\nThe output format is identical to the input format, but fill in the str blanks(\"...\").\n### Input:\n{\n  \"nl_utterance\": \"...\",\n  \"encoded_fields\": [\n    {\n      \"field\": [\n        \"Mobility\",\n        \"Commute\",\n        \"Migration_in\",\n        \"Migration_out\"\n      ],\n      \"type\": \"quantitative\",\n      \"nl_ref_type\": \"ambiguous\",\n      \"nl_ref_phrase\": \"...\"\n    }\n  ],\n  \"constraints\": [\n    {\n      \"c_type\": \"task\",\n      \"c_name\": \"distribution\",\n      \"c_list\": [\n        {\n          \"mark\": \"bar\",\n          \"encoding\": {\n            \"y\": {\n              \"aggregate\": \"count\",\n              \"type\": \"quantitative\"\n            }\n          },\n          \"x_y_reversable\": true\n        },\n        {\n          \"mark\": \"boxplot\",\n          \"encoding\": {\n            \"x\": {\n              \"type\": \"quantitative\"\n            }\n          },\n          \"x_y_reversable\": true\n        }\n      ],\n      \"nl_ref_type\": \"explicit\",\n      \"nl_ref_phrase\": \"...\"\n    },\n    {\n      \"c_type\": \"transform\",\n      \"c_name\": \"aggregate\",\n      \"c_list\": [\n        {\n          \"aggregate\": \"count\"\n        }\n      ],\n      \"nl_ref_type\": \"explicit\",\n      \"nl_ref_phrase\": \"...\"\n    }\n  ]\n}\n\n### Output:"
}