{
  "gpt_result": {
    "nl_utterance": "How has the average weight of cars changed over the years in a line chart?",
    "encoded_fields": [
      {
        "field": "Weight",
        "type": "quantitative",
        "nl_ref_type": "explicit",
        "nl_ref_phrase": "weight"
      },
      {
        "field": "Year",
        "type": "quantitative",
        "nl_ref_type": "explicit",
        "nl_ref_phrase": "years"
      }
    ],
    "constraints": [
      {
        "c_type": "mark",
        "c_name": "line chart",
        "c_list": [
          {
            "mark": "line",
            "encoding": {
              "x": {},
              "y": {
                "type": "quantitative"
              },
              "color": {
                "ignore": true,
                "type": "nominal"
              },
              "column": {
                "ignore": true,
                "type": "nominal"
              },
              "row": {
                "ignore": true,
                "type": "nominal"
              }
            },
            "unique_map": {
              "x": "y"
            }
          }
        ],
        "nl_ref_type": "explicit",
        "nl_ref_phrase": "line chart"
      },
      {
        "c_type": "transform",
        "c_name": "aggregate",
        "c_list": [
          {
            "field": "Weight",
            "aggregate": "mean"
          }
        ],
        "nl_ref_type": "explicit",
        "nl_ref_phrase": "average weight"
      }
    ]
  },
  "input": "Dataset Information: {\n  \"data samples\": [\n    {\n      \"Model\": \"volkswagen 1131 deluxe sedan\",\n      \"MPG\": 26.0,\n      \"Cylinders\": 4,\n      \"Displacement\": 97.0,\n      \"Horsepower\": 46,\n      \"Weight\": 1835,\n      \"Acceleration\": 20.5,\n      \"Year\": 1970,\n      \"Origin\": \"Europe\"\n    },\n    {\n      \"Model\": \"toyota celica gt liftback\",\n      \"MPG\": 21.1,\n      \"Cylinders\": 4,\n      \"Displacement\": 134.0,\n      \"Horsepower\": 95,\n      \"Weight\": 2515,\n      \"Acceleration\": 14.8,\n      \"Year\": 1978,\n      \"Origin\": \"Japan\"\n    },\n    {\n      \"Model\": \"ford torino\",\n      \"MPG\": 17.0,\n      \"Cylinders\": 8,\n      \"Displacement\": 302.0,\n      \"Horsepower\": 140,\n      \"Weight\": 3449,\n      \"Acceleration\": 10.5,\n      \"Year\": 1970,\n      \"Origin\": \"US\"\n    },\n    {\n      \"Model\": \"mazda glc 4\",\n      \"MPG\": 34.1,\n      \"Cylinders\": 4,\n      \"Displacement\": 91.0,\n      \"Horsepower\": 68,\n      \"Weight\": 1985,\n      \"Acceleration\": 16.0,\n      \"Year\": 1981,\n      \"Origin\": \"Japan\"\n    },\n    {\n      \"Model\": \"datsun b-210\",\n      \"MPG\": 32.0,\n      \"Cylinders\": 4,\n      \"Displacement\": 85.0,\n      \"Horsepower\": 70,\n      \"Weight\": 1990,\n      \"Acceleration\": 17.0,\n      \"Year\": 1976,\n      \"Origin\": \"Japan\"\n    }\n  ],\n  \"column names\": [\n    \"Model\",\n    \"MPG\",\n    \"Cylinders\",\n    \"Displacement\",\n    \"Horsepower\",\n    \"Weight\",\n    \"Acceleration\",\n    \"Year\",\n    \"Origin\"\n  ]\n}\n\nYour Job:\nI am developing a NL to Data Visualization Dataset. \nPlease help me generate natural language utterance for given dataset and constraints.\nDefinition about the Taks:\n- 'utterance' is what a user would say to make a chart. It should be a questions structure. One NL 'utterance' is in one or two sentences. Here are two examples from Questions for reference:\n    How does displacement relate to fuel economy for cars from Europe vs. USA?\n    What is our profit based on shipping mode by customer segment?\n- 'given dataset' is in form of column names, column type, range/unique values of the column.\n- 'constraints' are information about the chart that should be included in the utterance. \n    So we can find a reference phrase in the NL utterance that corresponds to the given constraints. \n- 'reference phrase' can be explicit, ambiguous, and by_value. 'ambiguous' means the phrase can map to more than one columns in the dataset, always a hypernym of column names(depending on the dataset values).\n    For example:\n    {\"column\": \"gdpPercap\", \"nl_ref_type\": \"explicit\", \"nl_ref_phrase\": \"GDP per capita\"},\n    {\"column\": [\"country\",\"continent\"], \"nl_ref_type\": \"ambiguous\", \"nl_ref_phrase\": \"region\"}\n    {\"column\": [\"country\",\"country_short_name\"], \"nl_ref_type\": \"ambiguous\", \"nl_ref_phrase\": \"countries\"}\n    {\"c_type\": \"mark\", \"c_name\": \"point chart\", \"nl_ref_type\": \"explicit\", \"nl_ref_phrase\": \"scatter plot\"}\n    {\"c_type\": \"mark\", \"c_name\": \"arc chart\", \"nl_ref_type\": \"explicit\", \"nl_ref_phrase\": \"pie chart\"}\n    {\"c_type\": \"transform\",\"c_name\": \"filter\",\"c_list\": [{\"field\": \"country\",\"oneOf\": [\"Iceland\",\"Norway\"]}],\"nl_ref_type\": \"explicit\",\"nl_ref_phrase\": \"for countries Iceland and Norway\"},\n    {\"c_type\": \"transform\",\"c_name\": \"filter\",\"c_list\": [{\"field\": \"country\",\"oneOf\": [\"Iceland\",\"Norway\"]}],\"nl_ref_type\": \"by_value\",\"nl_ref_phrase\": \"for Iceland and Norway\"},\n- the 'nl_ref_phrase' for 'ambiguous' columns should be equally near all ambiguous columns, not too near to one of the column since it would not be ambiguous.\n    good example: {\"column\": [\"country\",\"region\"], \"nl_ref_type\": \"ambiguous\", \"nl_ref_phrase\": \"location\"}\n    bad example: {\"column\": [\"country\",\"region\"], \"nl_ref_type\": \"ambiguous\", \"nl_ref_phrase\": \"region\"}\n- You only include given constraints and no other information. \n    For example, if a column name is not in the given constraint, it will not be included in the NL utterance.\n    Also, it a chart mark or chart encoding channel is not in the given constraint, it will not be included in the NL utterance.\n- all 'nl_ref_phrase' shoule be included in the 'nl_utterance'. \n\nThe output format is identical to the input format, but fill in the str blanks(\"...\").\n### Input:\n{\n  \"nl_utterance\": \"...\",\n  \"encoded_fields\": [\n    {\n      \"field\": \"Weight\",\n      \"type\": \"quantitative\",\n      \"nl_ref_type\": \"explicit\",\n      \"nl_ref_phrase\": \"...\"\n    },\n    {\n      \"field\": \"Year\",\n      \"type\": \"quantitative\",\n      \"nl_ref_type\": \"explicit\",\n      \"nl_ref_phrase\": \"...\"\n    }\n  ],\n  \"constraints\": [\n    {\n      \"c_type\": \"mark\",\n      \"c_name\": \"line chart\",\n      \"c_list\": [\n        {\n          \"mark\": \"line\",\n          \"encoding\": {\n            \"x\": {},\n            \"y\": {\n              \"type\": \"quantitative\"\n            },\n            \"color\": {\n              \"ignore\": true,\n              \"type\": \"nominal\"\n            },\n            \"column\": {\n              \"ignore\": true,\n              \"type\": \"nominal\"\n            },\n            \"row\": {\n              \"ignore\": true,\n              \"type\": \"nominal\"\n            }\n          },\n          \"unique_map\": {\n            \"x\": \"y\"\n          }\n        }\n      ],\n      \"nl_ref_type\": \"explicit\",\n      \"nl_ref_phrase\": \"...\"\n    },\n    {\n      \"c_type\": \"transform\",\n      \"c_name\": \"aggregate\",\n      \"c_list\": [\n        {\n          \"field\": \"Weight\",\n          \"aggregate\": \"mean\"\n        }\n      ],\n      \"nl_ref_type\": \"explicit\",\n      \"nl_ref_phrase\": \"...\"\n    }\n  ]\n}\n\n### Output:"
}