{
  "gpt_result": {
    "nl_utterance": "What is the total oil consumption over the years for each entity, and how does it compare with other energy sources?",
    "encoded_fields": [
      {
        "field": "Year",
        "type": "quantitative",
        "nl_ref_type": "explicit",
        "nl_ref_phrase": "years"
      },
      {
        "field": [
          "Oil Consumption - TWh (zero filled)",
          "Gas Consumption - TWh (zero filled)",
          "Coal Consumption - TWh (zero filled)",
          "Nuclear Consumption - TWh (zero filled)",
          "Hydro Consumption - TWh (zero filled)",
          "Solar Consumption - TWh (zero filled)",
          "Wind Consumption - TWh (zero filled)",
          "Biofuels Consumption - TWh - Total (zero filled)",
          "Geo Biomass Other - TWh (zero filled)"
        ],
        "type": "quantitative",
        "nl_ref_type": "ambiguous",
        "nl_ref_phrase": "energy sources"
      },
      {
        "field": "Entity",
        "type": "nominal",
        "nl_ref_type": "explicit",
        "nl_ref_phrase": "entity"
      }
    ],
    "constraints": [
      {
        "c_type": "transform",
        "c_name": "aggregate",
        "c_list": [
          {
            "field": "Oil Consumption - TWh (zero filled)",
            "aggregate": "sum"
          }
        ],
        "nl_ref_type": "explicit",
        "nl_ref_phrase": "total oil consumption"
      }
    ]
  },
  "input": "Dataset Information: {\n  \"data samples\": [\n    {\n      \"Unnamed: 0\": 0,\n      \"Entity\": \"Africa\",\n      \"Year\": 1965,\n      \"Geo Biomass Other - TWh (zero filled)\": 0.0,\n      \"Biofuels Consumption - TWh - Total (zero filled)\": 0.0,\n      \"Solar Consumption - TWh (zero filled)\": 0.0,\n      \"Wind Consumption - TWh (zero filled)\": 0.0,\n      \"Hydro Consumption - TWh (zero filled)\": 41.11881256,\n      \"Nuclear Consumption - TWh (zero filled)\": 0.0,\n      \"Gas Consumption - TWh (zero filled)\": 9.543754578,\n      \"Coal Consumption - TWh (zero filled)\": 323.4961243,\n      \"Oil Consumption - TWh (zero filled)\": 341.2627563\n    },\n    {\n      \"Unnamed: 0\": 5580,\n      \"Entity\": \"Sri Lanka\",\n      \"Year\": 2019,\n      \"Geo Biomass Other - TWh (zero filled)\": 0.1175,\n      \"Biofuels Consumption - TWh - Total (zero filled)\": 0.0,\n      \"Solar Consumption - TWh (zero filled)\": 1.319040537,\n      \"Wind Consumption - TWh (zero filled)\": 0.917845547,\n      \"Hydro Consumption - TWh (zero filled)\": 12.6840353,\n      \"Nuclear Consumption - TWh (zero filled)\": 0.0,\n      \"Gas Consumption - TWh (zero filled)\": 0.0,\n      \"Coal Consumption - TWh (zero filled)\": 16.29716682,\n      \"Oil Consumption - TWh (zero filled)\": 76.57341766\n    },\n    {\n      \"Unnamed: 0\": 1783,\n      \"Entity\": \"Finland\",\n      \"Year\": 1981,\n      \"Geo Biomass Other - TWh (zero filled)\": 0.0,\n      \"Biofuels Consumption - TWh - Total (zero filled)\": 0.0,\n      \"Solar Consumption - TWh (zero filled)\": 0.0,\n      \"Wind Consumption - TWh (zero filled)\": 0.0,\n      \"Hydro Consumption - TWh (zero filled)\": 40.37634277,\n      \"Nuclear Consumption - TWh (zero filled)\": 41.32317734,\n      \"Gas Consumption - TWh (zero filled)\": 7.118055344,\n      \"Coal Consumption - TWh (zero filled)\": 32.99416733,\n      \"Oil Consumption - TWh (zero filled)\": 145.4185944\n    },\n    {\n      \"Unnamed: 0\": 5756,\n      \"Entity\": \"Thailand\",\n      \"Year\": 1967,\n      \"Geo Biomass Other - TWh (zero filled)\": 0.0,\n      \"Biofuels Consumption - TWh - Total (zero filled)\": 0.0,\n      \"Solar Consumption - TWh (zero filled)\": 0.0,\n      \"Wind Consumption - TWh (zero filled)\": 0.0,\n      \"Hydro Consumption - TWh (zero filled)\": 4.045161247,\n      \"Nuclear Consumption - TWh (zero filled)\": 0.0,\n      \"Gas Consumption - TWh (zero filled)\": 0.0,\n      \"Coal Consumption - TWh (zero filled)\": 1.349079967,\n      \"Oil Consumption - TWh (zero filled)\": 36.28415298\n    },\n    {\n      \"Unnamed: 0\": 4943,\n      \"Entity\": \"Romania\",\n      \"Year\": 2009,\n      \"Geo Biomass Other - TWh (zero filled)\": 0.01,\n      \"Biofuels Consumption - TWh - Total (zero filled)\": 0.0,\n      \"Solar Consumption - TWh (zero filled)\": 0.002833333,\n      \"Wind Consumption - TWh (zero filled)\": 0.025138889,\n      \"Hydro Consumption - TWh (zero filled)\": 43.38198853,\n      \"Nuclear Consumption - TWh (zero filled)\": 31.49389267,\n      \"Gas Consumption - TWh (zero filled)\": 123.0494995,\n      \"Coal Consumption - TWh (zero filled)\": 87.61161804,\n      \"Oil Consumption - TWh (zero filled)\": 107.8736954\n    }\n  ],\n  \"column names\": [\n    \"Unnamed: 0\",\n    \"Entity\",\n    \"Year\",\n    \"Geo Biomass Other - TWh (zero filled)\",\n    \"Biofuels Consumption - TWh - Total (zero filled)\",\n    \"Solar Consumption - TWh (zero filled)\",\n    \"Wind Consumption - TWh (zero filled)\",\n    \"Hydro Consumption - TWh (zero filled)\",\n    \"Nuclear Consumption - TWh (zero filled)\",\n    \"Gas Consumption - TWh (zero filled)\",\n    \"Coal Consumption - TWh (zero filled)\",\n    \"Oil Consumption - TWh (zero filled)\"\n  ]\n}\n\nYour Job:\nI am developing a NL to Data Visualization Dataset. \nPlease help me generate natural language utterance for given dataset and constraints.\nDefinition about the Taks:\n- 'utterance' is what a user would say to make a chart. It should be a questions structure. One NL 'utterance' is in one or two sentences. Here are two examples from Questions for reference:\n    On average, how much was earned by movies of each genre?\n    Are IMDb rating and rotten tomatoes rating related?\n- 'given dataset' is in form of column names, column type, range/unique values of the column.\n- 'constraints' are information about the chart that should be included in the utterance. \n    So we can find a reference phrase in the NL utterance that corresponds to the given constraints. \n- 'reference phrase' can be explicit, ambiguous, and by_value. 'ambiguous' means the phrase can map to more than one columns in the dataset, always a hypernym of column names(depending on the dataset values).\n    For example:\n    {\"column\": \"gdpPercap\", \"nl_ref_type\": \"explicit\", \"nl_ref_phrase\": \"GDP per capita\"},\n    {\"column\": [\"country\",\"continent\"], \"nl_ref_type\": \"ambiguous\", \"nl_ref_phrase\": \"region\"}\n    {\"column\": [\"country\",\"country_short_name\"], \"nl_ref_type\": \"ambiguous\", \"nl_ref_phrase\": \"countries\"}\n    {\"c_type\": \"mark\", \"c_name\": \"point chart\", \"nl_ref_type\": \"explicit\", \"nl_ref_phrase\": \"scatter plot\"}\n    {\"c_type\": \"mark\", \"c_name\": \"arc chart\", \"nl_ref_type\": \"explicit\", \"nl_ref_phrase\": \"pie chart\"}\n    {\"c_type\": \"transform\",\"c_name\": \"filter\",\"c_list\": [{\"field\": \"country\",\"oneOf\": [\"Iceland\",\"Norway\"]}],\"nl_ref_type\": \"explicit\",\"nl_ref_phrase\": \"for countries Iceland and Norway\"},\n    {\"c_type\": \"transform\",\"c_name\": \"filter\",\"c_list\": [{\"field\": \"country\",\"oneOf\": [\"Iceland\",\"Norway\"]}],\"nl_ref_type\": \"by_value\",\"nl_ref_phrase\": \"for Iceland and Norway\"},\n- the 'nl_ref_phrase' for 'ambiguous' columns should be equally near all ambiguous columns, not too near to one of the column since it would not be ambiguous.\n    good example: {\"column\": [\"country\",\"region\"], \"nl_ref_type\": \"ambiguous\", \"nl_ref_phrase\": \"location\"}\n    bad example: {\"column\": [\"country\",\"region\"], \"nl_ref_type\": \"ambiguous\", \"nl_ref_phrase\": \"region\"}\n- You only include given constraints and no other information. \n    For example, if a column name is not in the given constraint, it will not be included in the NL utterance.\n    Also, it a chart mark or chart encoding channel is not in the given constraint, it will not be included in the NL utterance.\n- all 'nl_ref_phrase' shoule be included in the 'nl_utterance'. \n\nThe output format is identical to the input format, but fill in the str blanks(\"...\").\n### Input:\n{\n  \"nl_utterance\": \"...\",\n  \"encoded_fields\": [\n    {\n      \"field\": \"Year\",\n      \"type\": \"quantitative\",\n      \"nl_ref_type\": \"explicit\",\n      \"nl_ref_phrase\": \"...\"\n    },\n    {\n      \"field\": [\n        \"Oil Consumption - TWh (zero filled)\",\n        \"Gas Consumption - TWh (zero filled)\",\n        \"Coal Consumption - TWh (zero filled)\",\n        \"Nuclear Consumption - TWh (zero filled)\",\n        \"Hydro Consumption - TWh (zero filled)\",\n        \"Solar Consumption - TWh (zero filled)\",\n        \"Wind Consumption - TWh (zero filled)\",\n        \"Biofuels Consumption - TWh - Total (zero filled)\",\n        \"Geo Biomass Other - TWh (zero filled)\"\n      ],\n      \"type\": \"quantitative\",\n      \"nl_ref_type\": \"ambiguous\",\n      \"nl_ref_phrase\": \"...\"\n    },\n    {\n      \"field\": \"Entity\",\n      \"type\": \"nominal\",\n      \"nl_ref_type\": \"explicit\",\n      \"nl_ref_phrase\": \"...\"\n    }\n  ],\n  \"constraints\": [\n    {\n      \"c_type\": \"transform\",\n      \"c_name\": \"aggregate\",\n      \"c_list\": [\n        {\n          \"field\": \"Oil Consumption - TWh (zero filled)\",\n          \"aggregate\": \"sum\"\n        }\n      ],\n      \"nl_ref_type\": \"explicit\",\n      \"nl_ref_phrase\": \"...\"\n    }\n  ]\n}\n\n### Output:"
}