{
  "gpt_result": {
    "nl_utterance": "Create a rect chart showing the count of data filtered for 'up share' less than 0.25 and 'down share' less than 0.25. Use 'up share' and 'down share' for coloring.",
    "encoded_fields": [
      {
        "field": "up_sh",
        "type": "quantitative",
        "nl_ref_type": "explicit",
        "nl_ref_phrase": "up share"
      },
      {
        "field": "down_sh",
        "type": "quantitative",
        "nl_ref_type": "explicit",
        "nl_ref_phrase": "down share"
      }
    ],
    "constraints": [
      {
        "c_type": "mark",
        "c_name": "rect chart",
        "c_list": [
          {
            "mark": "rect",
            "encoding": {
              "x": {},
              "y": {},
              "color": {
                "type": "quantitative"
              },
              "column": {
                "ignore": true,
                "type": "nominal"
              },
              "row": {
                "ignore": true,
                "type": "nominal"
              }
            },
            "unique_map": {
              "(x,y)": "color"
            }
          }
        ],
        "nl_ref_type": "explicit",
        "nl_ref_phrase": "rect chart"
      },
      {
        "c_type": "transform",
        "c_name": "filter",
        "c_list": [
          {
            "field": "up_sh",
            "lt": 0.25
          }
        ],
        "nl_ref_type": "by_value",
        "nl_ref_phrase": "filtered for 'up share' less than 0.25"
      },
      {
        "c_type": "transform",
        "c_name": "filter",
        "c_list": [
          {
            "field": "down_sh",
            "lt": 0.25
          }
        ],
        "nl_ref_type": "by_value",
        "nl_ref_phrase": "filtered for 'down share' less than 0.25"
      },
      {
        "c_type": "transform",
        "c_name": "aggregate",
        "c_list": [
          {
            "aggregate": "count"
          }
        ],
        "nl_ref_type": "explicit",
        "nl_ref_phrase": "count"
      }
    ]
  },
  "input": "Dataset Information: {\n  \"data samples\": [\n    {\n      \"date\": 1.0,\n      \"division\": 4,\n      \"up\": 0,\n      \"down\": 0,\n      \"level\": 0,\n      \"up_ch\": NaN,\n      \"down_ch\": NaN,\n      \"total\": 0,\n      \"up_sh\": NaN,\n      \"down_sh\": NaN,\n      \"level_sh\": NaN,\n      \"change_sh\": NaN,\n      \"division_s\": \"Housing, Water, Electricity, Gas and other fuels\",\n      \"division_sh\": \"Housing & utilities\",\n      \"date2\": \"01-02-1988\",\n      \"date4\": \"1988-02-01\",\n      \"year\": 1988.0,\n      \"month\": 2.0,\n      \"quarter\": 1.0\n    },\n    {\n      \"date\": 257.0,\n      \"division\": 4,\n      \"up\": 270,\n      \"down\": 127,\n      \"level\": 3174,\n      \"up_ch\": 0.087121218,\n      \"down_ch\": -0.097619057,\n      \"total\": 3571,\n      \"up_sh\": 0.075609073,\n      \"down_sh\": 0.035564266,\n      \"level_sh\": 0.88882667,\n      \"change_sh\": 0.11117334,\n      \"division_s\": \"Housing, Water, Electricity, Gas and other fuels\",\n      \"division_sh\": \"Housing & utilities\",\n      \"date2\": \"01-06-2009\",\n      \"date4\": \"2009-06-01\",\n      \"year\": 2009.0,\n      \"month\": 6.0,\n      \"quarter\": 2.0\n    },\n    {\n      \"date\": 21.0,\n      \"division\": 4,\n      \"up\": 128,\n      \"down\": 46,\n      \"level\": 1135,\n      \"up_ch\": 0.064390667,\n      \"down_ch\": -0.035629477,\n      \"total\": 1309,\n      \"up_sh\": 0.097784571,\n      \"down_sh\": 0.03514133,\n      \"level_sh\": 0.86707413,\n      \"change_sh\": 0.1329259,\n      \"division_s\": \"Housing, Water, Electricity, Gas and other fuels\",\n      \"division_sh\": \"Housing & utilities\",\n      \"date2\": \"01-10-1989\",\n      \"date4\": \"1989-10-01\",\n      \"year\": 1989.0,\n      \"month\": 10.0,\n      \"quarter\": 4.0\n    },\n    {\n      \"date\": 240.0,\n      \"division\": 8,\n      \"up\": 29,\n      \"down\": 27,\n      \"level\": 89,\n      \"up_ch\": 0.25957659,\n      \"down_ch\": -0.25012505,\n      \"total\": 145,\n      \"up_sh\": 0.2,\n      \"down_sh\": 0.18620689,\n      \"level_sh\": 0.61379308,\n      \"change_sh\": 0.3862069,\n      \"division_s\": \"Communication\",\n      \"division_sh\": \"Communication\",\n      \"date2\": \"01-01-2008\",\n      \"date4\": \"2008-01-01\",\n      \"year\": 2008.0,\n      \"month\": 1.0,\n      \"quarter\": 1.0\n    },\n    {\n      \"date\": 165.0,\n      \"division\": 8,\n      \"up\": 3,\n      \"down\": 3,\n      \"level\": 289,\n      \"up_ch\": 0.3021051,\n      \"down_ch\": -0.25009263,\n      \"total\": 295,\n      \"up_sh\": 0.010169491,\n      \"down_sh\": 0.010169491,\n      \"level_sh\": 0.97966099,\n      \"change_sh\": 0.020338982,\n      \"division_s\": \"Communication\",\n      \"division_sh\": \"Communication\",\n      \"date2\": \"01-10-2001\",\n      \"date4\": \"2001-10-01\",\n      \"year\": 2001.0,\n      \"month\": 10.0,\n      \"quarter\": 4.0\n    }\n  ],\n  \"column names\": [\n    \"date\",\n    \"division\",\n    \"up\",\n    \"down\",\n    \"level\",\n    \"up_ch\",\n    \"down_ch\",\n    \"total\",\n    \"up_sh\",\n    \"down_sh\",\n    \"level_sh\",\n    \"change_sh\",\n    \"division_s\",\n    \"division_sh\",\n    \"date2\",\n    \"date4\",\n    \"year\",\n    \"month\",\n    \"quarter\"\n  ]\n}\n\nYour Job:\nI am developing a NL to Data Visualization Dataset. \nPlease help me generate natural language utterance for given dataset and constraints.\nDefinition about the Taks:\n- 'utterance' is what a user would say to make a chart. It should be a queries structure. One NL 'utterance' is in one or two sentences. Here are two examples from Queries for reference:\n    Coloring by Orign, Plot Displacement by MPG.\n    Scatter plot, sales by profit.\n- 'given dataset' is in form of column names, column type, range/unique values of the column.\n- 'constraints' are information about the chart that should be included in the utterance. \n    So we can find a reference phrase in the NL utterance that corresponds to the given constraints. \n- 'reference phrase' can be explicit, ambiguous, and by_value. 'ambiguous' means the phrase can map to more than one columns in the dataset, always a hypernym of column names(depending on the dataset values).\n    For example:\n    {\"column\": \"gdpPercap\", \"nl_ref_type\": \"explicit\", \"nl_ref_phrase\": \"GDP per capita\"},\n    {\"column\": [\"country\",\"continent\"], \"nl_ref_type\": \"ambiguous\", \"nl_ref_phrase\": \"region\"}\n    {\"column\": [\"country\",\"country_short_name\"], \"nl_ref_type\": \"ambiguous\", \"nl_ref_phrase\": \"countries\"}\n    {\"c_type\": \"mark\", \"c_name\": \"point chart\", \"nl_ref_type\": \"explicit\", \"nl_ref_phrase\": \"scatter plot\"}\n    {\"c_type\": \"mark\", \"c_name\": \"arc chart\", \"nl_ref_type\": \"explicit\", \"nl_ref_phrase\": \"pie chart\"}\n    {\"c_type\": \"transform\",\"c_name\": \"filter\",\"c_list\": [{\"field\": \"country\",\"oneOf\": [\"Iceland\",\"Norway\"]}],\"nl_ref_type\": \"explicit\",\"nl_ref_phrase\": \"for countries Iceland and Norway\"},\n    {\"c_type\": \"transform\",\"c_name\": \"filter\",\"c_list\": [{\"field\": \"country\",\"oneOf\": [\"Iceland\",\"Norway\"]}],\"nl_ref_type\": \"by_value\",\"nl_ref_phrase\": \"for Iceland and Norway\"},\n- the 'nl_ref_phrase' for 'ambiguous' columns should be equally near all ambiguous columns, not too near to one of the column since it would not be ambiguous.\n    good example: {\"column\": [\"country\",\"region\"], \"nl_ref_type\": \"ambiguous\", \"nl_ref_phrase\": \"location\"}\n    bad example: {\"column\": [\"country\",\"region\"], \"nl_ref_type\": \"ambiguous\", \"nl_ref_phrase\": \"region\"}\n- You only include given constraints and no other information. \n    For example, if a column name is not in the given constraint, it will not be included in the NL utterance.\n    Also, it a chart mark or chart encoding channel is not in the given constraint, it will not be included in the NL utterance.\n- all 'nl_ref_phrase' shoule be included in the 'nl_utterance'. \n\nThe output format is identical to the input format, but fill in the str blanks(\"...\").\n### Input:\n{\n  \"nl_utterance\": \"...\",\n  \"encoded_fields\": [\n    {\n      \"field\": \"up_sh\",\n      \"type\": \"quantitative\",\n      \"nl_ref_type\": \"explicit\",\n      \"nl_ref_phrase\": \"...\"\n    },\n    {\n      \"field\": \"down_sh\",\n      \"type\": \"quantitative\",\n      \"nl_ref_type\": \"explicit\",\n      \"nl_ref_phrase\": \"...\"\n    }\n  ],\n  \"constraints\": [\n    {\n      \"c_type\": \"mark\",\n      \"c_name\": \"rect chart\",\n      \"c_list\": [\n        {\n          \"mark\": \"rect\",\n          \"encoding\": {\n            \"x\": {},\n            \"y\": {},\n            \"color\": {\n              \"type\": \"quantitative\"\n            },\n            \"column\": {\n              \"ignore\": true,\n              \"type\": \"nominal\"\n            },\n            \"row\": {\n              \"ignore\": true,\n              \"type\": \"nominal\"\n            }\n          },\n          \"unique_map\": {\n            \"(x,y)\": \"color\"\n          }\n        }\n      ],\n      \"nl_ref_type\": \"explicit\",\n      \"nl_ref_phrase\": \"...\"\n    },\n    {\n      \"c_type\": \"transform\",\n      \"c_name\": \"filter\",\n      \"c_list\": [\n        {\n          \"field\": \"up_sh\",\n          \"lt\": 0.25\n        }\n      ],\n      \"nl_ref_type\": \"by_value\",\n      \"nl_ref_phrase\": \"...\"\n    },\n    {\n      \"c_type\": \"transform\",\n      \"c_name\": \"filter\",\n      \"c_list\": [\n        {\n          \"field\": \"down_sh\",\n          \"lt\": 0.25\n        }\n      ],\n      \"nl_ref_type\": \"by_value\",\n      \"nl_ref_phrase\": \"...\"\n    },\n    {\n      \"c_type\": \"transform\",\n      \"c_name\": \"aggregate\",\n      \"c_list\": [\n        {\n          \"aggregate\": \"count\"\n        }\n      ],\n      \"nl_ref_type\": \"explicit\",\n      \"nl_ref_phrase\": \"...\"\n    }\n  ]\n}\n\n### Output:"
}