{
  "gpt_result": {
    "nl_utterance": "Create a scatter plot to examine the correlation using Value 1, Value 2, and Value in billion dollars, categorized by Type.",
    "encoded_fields": [
      {
        "field": [
          "Value 1",
          "Value 2",
          "Value [billion US$]"
        ],
        "type": "quantitative",
        "nl_ref_type": "ambiguous",
        "nl_ref_phrase": "Value in billion dollars"
      },
      {
        "field": "Value 2",
        "type": "quantitative",
        "nl_ref_type": "explicit",
        "nl_ref_phrase": "Value 2"
      },
      {
        "field": "Type",
        "type": "nominal",
        "nl_ref_type": "explicit",
        "nl_ref_phrase": "Type"
      }
    ],
    "constraints": [
      {
        "c_type": "task",
        "c_name": "correlation",
        "c_list": [
          {
            "mark": "circle",
            "encoding": {
              "x": {
                "type": "quantitative"
              },
              "y": {
                "type": "quantitative"
              }
            }
          }
        ],
        "nl_ref_type": "explicit",
        "nl_ref_phrase": "scatter plot"
      }
    ]
  },
  "input": "Dataset Information: {\n  \"data samples\": [\n    {\n      \"Unnamed: 0\": 0,\n      \"Type\": \"ETS\",\n      \"GHG emissions covered [MtCO2e]\": 140.36,\n      \"Year of implementation\": 2007,\n      \"Value [billion US$]\": 6.365888747,\n      \"Proportion of global GHG emissions covered\": 0.27,\n      \"Value 1\": -0.0505383741816785,\n      \"Value 2\": 0.7482888868096143\n    },\n    {\n      \"Unnamed: 0\": 33,\n      \"Type\": \"ETS\",\n      \"GHG emissions covered [MtCO2e]\": 63.801135,\n      \"Year of implementation\": 2014,\n      \"Value [billion US$]\": 1.95489715,\n      \"Proportion of global GHG emissions covered\": 0.12,\n      \"Value 1\": -0.290247630516666,\n      \"Value 2\": -0.1298884942273687\n    },\n    {\n      \"Unnamed: 0\": 86,\n      \"Type\": \"Carbon tax\",\n      \"GHG emissions covered [MtCO2e]\": 459.1671443,\n      \"Year of implementation\": 2019,\n      \"Value [billion US$]\": 0.119524906,\n      \"Proportion of global GHG emissions covered\": 0.9,\n      \"Value 1\": 0.5528850076813707,\n      \"Value 2\": -0.820775088083316\n    },\n    {\n      \"Unnamed: 0\": 52,\n      \"Type\": \"ETS\",\n      \"GHG emissions covered [MtCO2e]\": 320.5521441,\n      \"Year of implementation\": 2020,\n      \"Value [billion US$]\": 0.0,\n      \"Proportion of global GHG emissions covered\": 0.63,\n      \"Value 1\": 0.2578307242001615,\n      \"Value 2\": -0.91474498458613\n    },\n    {\n      \"Unnamed: 0\": 24,\n      \"Type\": \"ETS\",\n      \"GHG emissions covered [MtCO2e]\": 1626.615082,\n      \"Year of implementation\": 2005,\n      \"Value [billion US$]\": 136.0190418,\n      \"Proportion of global GHG emissions covered\": 3.18,\n      \"Value 1\": 6.852289275539271,\n      \"Value 2\": 2.7007625744990835\n    }\n  ],\n  \"column names\": [\n    \"Unnamed: 0\",\n    \"Type\",\n    \"GHG emissions covered [MtCO2e]\",\n    \"Year of implementation\",\n    \"Value [billion US$]\",\n    \"Proportion of global GHG emissions covered\",\n    \"Value 1\",\n    \"Value 2\"\n  ]\n}\n\nYour Job:\nI am developing a NL to Data Visualization Dataset. \nPlease help me generate natural language utterance for given dataset and constraints.\nDefinition about the Taks:\n- 'utterance' is what a user would say to make a chart. It should be a commands structure. One NL 'utterance' is in one or two sentences. Here are two examples from Commands for reference:\n    Make the bars stacked with the ship status.\n    Give me the number of movies by running time.\n- 'given dataset' is in form of column names, column type, range/unique values of the column.\n- 'constraints' are information about the chart that should be included in the utterance. \n    So we can find a reference phrase in the NL utterance that corresponds to the given constraints. \n- 'reference phrase' can be explicit, ambiguous, and by_value. 'ambiguous' means the phrase can map to more than one columns in the dataset, always a hypernym of column names(depending on the dataset values).\n    For example:\n    {\"column\": \"gdpPercap\", \"nl_ref_type\": \"explicit\", \"nl_ref_phrase\": \"GDP per capita\"},\n    {\"column\": [\"country\",\"continent\"], \"nl_ref_type\": \"ambiguous\", \"nl_ref_phrase\": \"region\"}\n    {\"column\": [\"country\",\"country_short_name\"], \"nl_ref_type\": \"ambiguous\", \"nl_ref_phrase\": \"countries\"}\n    {\"c_type\": \"mark\", \"c_name\": \"point chart\", \"nl_ref_type\": \"explicit\", \"nl_ref_phrase\": \"scatter plot\"}\n    {\"c_type\": \"mark\", \"c_name\": \"arc chart\", \"nl_ref_type\": \"explicit\", \"nl_ref_phrase\": \"pie chart\"}\n    {\"c_type\": \"transform\",\"c_name\": \"filter\",\"c_list\": [{\"field\": \"country\",\"oneOf\": [\"Iceland\",\"Norway\"]}],\"nl_ref_type\": \"explicit\",\"nl_ref_phrase\": \"for countries Iceland and Norway\"},\n    {\"c_type\": \"transform\",\"c_name\": \"filter\",\"c_list\": [{\"field\": \"country\",\"oneOf\": [\"Iceland\",\"Norway\"]}],\"nl_ref_type\": \"by_value\",\"nl_ref_phrase\": \"for Iceland and Norway\"},\n- the 'nl_ref_phrase' for 'ambiguous' columns should be equally near all ambiguous columns, not too near to one of the column since it would not be ambiguous.\n    good example: {\"column\": [\"country\",\"region\"], \"nl_ref_type\": \"ambiguous\", \"nl_ref_phrase\": \"location\"}\n    bad example: {\"column\": [\"country\",\"region\"], \"nl_ref_type\": \"ambiguous\", \"nl_ref_phrase\": \"region\"}\n- You only include given constraints and no other information. \n    For example, if a column name is not in the given constraint, it will not be included in the NL utterance.\n    Also, it a chart mark or chart encoding channel is not in the given constraint, it will not be included in the NL utterance.\n- all 'nl_ref_phrase' shoule be included in the 'nl_utterance'. \n\nThe output format is identical to the input format, but fill in the str blanks(\"...\").\n### Input:\n{\n  \"nl_utterance\": \"...\",\n  \"encoded_fields\": [\n    {\n      \"field\": [\n        \"Value 1\",\n        \"Value 2\",\n        \"Value [billion US$]\"\n      ],\n      \"type\": \"quantitative\",\n      \"nl_ref_type\": \"ambiguous\",\n      \"nl_ref_phrase\": \"...\"\n    },\n    {\n      \"field\": \"Value 2\",\n      \"type\": \"quantitative\",\n      \"nl_ref_type\": \"explicit\",\n      \"nl_ref_phrase\": \"...\"\n    },\n    {\n      \"field\": \"Type\",\n      \"type\": \"nominal\",\n      \"nl_ref_type\": \"explicit\",\n      \"nl_ref_phrase\": \"...\"\n    }\n  ],\n  \"constraints\": [\n    {\n      \"c_type\": \"task\",\n      \"c_name\": \"correlation\",\n      \"c_list\": [\n        {\n          \"mark\": \"circle\",\n          \"encoding\": {\n            \"x\": {\n              \"type\": \"quantitative\"\n            },\n            \"y\": {\n              \"type\": \"quantitative\"\n            }\n          }\n        }\n      ],\n      \"nl_ref_type\": \"explicit\",\n      \"nl_ref_phrase\": \"...\"\n    }\n  ]\n}\n\n### Output:"
}