{
  "gpt_result": {
    "nl_utterance": "Create a scatter plot with Value 1 on the X-axis and Value 2 on the Y-axis, colored by the Type.",
    "encoded_fields": [
      {
        "field": "Value 1",
        "type": "quantitative",
        "nl_ref_type": "explicit",
        "nl_ref_phrase": "Value 1"
      },
      {
        "field": "Value 2",
        "type": "quantitative",
        "nl_ref_type": "explicit",
        "nl_ref_phrase": "Value 2"
      },
      {
        "field": "Type",
        "type": "nominal",
        "nl_ref_type": "explicit",
        "nl_ref_phrase": "Type"
      }
    ],
    "constraints": [
      {
        "c_type": "mark",
        "c_name": "point chart",
        "c_list": [
          {
            "mark": "circle",
            "encoding": {
              "x": {},
              "y": {},
              "color": {
                "type": "nominal",
                "ignore": true
              },
              "size": {
                "ignore": true,
                "type": "quantitative"
              },
              "column": {
                "ignore": true,
                "type": "nominal"
              },
              "row": {
                "ignore": true,
                "type": "nominal"
              }
            }
          }
        ],
        "nl_ref_type": "explicit",
        "nl_ref_phrase": "scatter plot"
      }
    ]
  },
  "input": "Dataset Information: {\n  \"data samples\": [\n    {\n      \"Unnamed: 0\": 0,\n      \"Type\": \"ETS\",\n      \"GHG emissions covered [MtCO2e]\": 140.36,\n      \"Year of implementation\": 2007,\n      \"Value [billion US$]\": 6.365888747,\n      \"Proportion of global GHG emissions covered\": 0.27,\n      \"Value 1\": -0.0505383741816785,\n      \"Value 2\": 0.7482888868096143\n    },\n    {\n      \"Unnamed: 0\": 27,\n      \"Type\": \"Carbon tax\",\n      \"GHG emissions covered [MtCO2e]\": 157.7754771,\n      \"Year of implementation\": 2014,\n      \"Value [billion US$]\": 9.06264,\n      \"Proportion of global GHG emissions covered\": 0.31,\n      \"Value 1\": 0.1193367982498298,\n      \"Value 2\": -0.0383724868401926\n    },\n    {\n      \"Unnamed: 0\": 6,\n      \"Type\": \"Carbon tax\",\n      \"GHG emissions covered [MtCO2e]\": 46.41,\n      \"Year of implementation\": 2008,\n      \"Value [billion US$]\": 1.562100384,\n      \"Proportion of global GHG emissions covered\": 0.09,\n      \"Value 1\": -0.3813495177761626,\n      \"Value 2\": 0.5739080202607355\n    },\n    {\n      \"Unnamed: 0\": 85,\n      \"Type\": \"Carbon tax\",\n      \"GHG emissions covered [MtCO2e]\": 10.64899126,\n      \"Year of implementation\": 1996,\n      \"Value [billion US$]\": 0.081728039,\n      \"Proportion of global GHG emissions covered\": 0.02,\n      \"Value 1\": -0.5899830416500661,\n      \"Value 2\": 1.971387989278658\n    },\n    {\n      \"Unnamed: 0\": 43,\n      \"Type\": \"ETS\",\n      \"GHG emissions covered [MtCO2e]\": 553.439848,\n      \"Year of implementation\": 2015,\n      \"Value [billion US$]\": 11.04344594,\n      \"Proportion of global GHG emissions covered\": 1.08,\n      \"Value 1\": 1.0365785389372426,\n      \"Value 2\": -0.1989576879989573\n    }\n  ],\n  \"column names\": [\n    \"Unnamed: 0\",\n    \"Type\",\n    \"GHG emissions covered [MtCO2e]\",\n    \"Year of implementation\",\n    \"Value [billion US$]\",\n    \"Proportion of global GHG emissions covered\",\n    \"Value 1\",\n    \"Value 2\"\n  ]\n}\n\nYour Job:\nI am developing a NL to Data Visualization Dataset. \nPlease help me generate natural language utterance for given dataset and constraints.\nDefinition about the Taks:\n- 'utterance' is what a user would say to make a chart.  One NL 'utterance' is in one or two sentences. Here are two examples from Others for reference:\n    I want to know how many orders there are by the quantity of the order.\n    scatter(x=production budget, y=worldwide gross) for content rating.\n- 'given dataset' is in form of column names, column type, range/unique values of the column.\n- 'constraints' are information about the chart that should be included in the utterance. \n    So we can find a reference phrase in the NL utterance that corresponds to the given constraints. \n- 'reference phrase' can be explicit, ambiguous, and by_value. 'ambiguous' means the phrase can map to more than one columns in the dataset, always a hypernym of column names(depending on the dataset values).\n    For example:\n    {\"column\": \"gdpPercap\", \"nl_ref_type\": \"explicit\", \"nl_ref_phrase\": \"GDP per capita\"},\n    {\"column\": [\"country\",\"continent\"], \"nl_ref_type\": \"ambiguous\", \"nl_ref_phrase\": \"region\"}\n    {\"column\": [\"country\",\"country_short_name\"], \"nl_ref_type\": \"ambiguous\", \"nl_ref_phrase\": \"countries\"}\n    {\"c_type\": \"mark\", \"c_name\": \"point chart\", \"nl_ref_type\": \"explicit\", \"nl_ref_phrase\": \"scatter plot\"}\n    {\"c_type\": \"mark\", \"c_name\": \"arc chart\", \"nl_ref_type\": \"explicit\", \"nl_ref_phrase\": \"pie chart\"}\n    {\"c_type\": \"transform\",\"c_name\": \"filter\",\"c_list\": [{\"field\": \"country\",\"oneOf\": [\"Iceland\",\"Norway\"]}],\"nl_ref_type\": \"explicit\",\"nl_ref_phrase\": \"for countries Iceland and Norway\"},\n    {\"c_type\": \"transform\",\"c_name\": \"filter\",\"c_list\": [{\"field\": \"country\",\"oneOf\": [\"Iceland\",\"Norway\"]}],\"nl_ref_type\": \"by_value\",\"nl_ref_phrase\": \"for Iceland and Norway\"},\n- the 'nl_ref_phrase' for 'ambiguous' columns should be equally near all ambiguous columns, not too near to one of the column since it would not be ambiguous.\n    good example: {\"column\": [\"country\",\"region\"], \"nl_ref_type\": \"ambiguous\", \"nl_ref_phrase\": \"location\"}\n    bad example: {\"column\": [\"country\",\"region\"], \"nl_ref_type\": \"ambiguous\", \"nl_ref_phrase\": \"region\"}\n- You only include given constraints and no other information. \n    For example, if a column name is not in the given constraint, it will not be included in the NL utterance.\n    Also, it a chart mark or chart encoding channel is not in the given constraint, it will not be included in the NL utterance.\n- all 'nl_ref_phrase' shoule be included in the 'nl_utterance'. \n\nThe output format is identical to the input format, but fill in the str blanks(\"...\").\n### Input:\n{\n  \"nl_utterance\": \"...\",\n  \"encoded_fields\": [\n    {\n      \"field\": \"Value 1\",\n      \"type\": \"quantitative\",\n      \"nl_ref_type\": \"explicit\",\n      \"nl_ref_phrase\": \"...\"\n    },\n    {\n      \"field\": \"Value 2\",\n      \"type\": \"quantitative\",\n      \"nl_ref_type\": \"explicit\",\n      \"nl_ref_phrase\": \"...\"\n    },\n    {\n      \"field\": \"Type\",\n      \"type\": \"nominal\",\n      \"nl_ref_type\": \"explicit\",\n      \"nl_ref_phrase\": \"...\"\n    }\n  ],\n  \"constraints\": [\n    {\n      \"c_type\": \"mark\",\n      \"c_name\": \"point chart\",\n      \"c_list\": [\n        {\n          \"mark\": \"circle\",\n          \"encoding\": {\n            \"x\": {},\n            \"y\": {},\n            \"color\": {\n              \"type\": \"nominal\",\n              \"ignore\": true\n            },\n            \"size\": {\n              \"ignore\": true,\n              \"type\": \"quantitative\"\n            },\n            \"column\": {\n              \"ignore\": true,\n              \"type\": \"nominal\"\n            },\n            \"row\": {\n              \"ignore\": true,\n              \"type\": \"nominal\"\n            }\n          }\n        }\n      ],\n      \"nl_ref_type\": \"explicit\",\n      \"nl_ref_phrase\": \"...\"\n    }\n  ]\n}\n\n### Output:"
}