{
  "gpt_result": {
    "nl_utterance": "Create a chart that shows the count of employees based on their Annual Salary.",
    "encoded_fields": [
      {
        "field": "Annual Salary",
        "type": "quantitative",
        "nl_ref_type": "explicit",
        "nl_ref_phrase": "Annual Salary"
      }
    ],
    "constraints": [
      {
        "c_type": "transform",
        "c_name": "aggregate",
        "c_list": [
          {
            "aggregate": "count"
          }
        ],
        "nl_ref_type": "explicit",
        "nl_ref_phrase": "count"
      }
    ]
  },
  "input": "Dataset Information: {\n  \"data samples\": [\n    {\n      \"Name\": \"ADELMAN, BRUCE E\",\n      \"Job Titles\": \"LEGISLATIVE AIDE\",\n      \"Department\": \"CITY COUNCIL\",\n      \"Full or Part-Time\": \"F\",\n      \"Salary or Hourly\": \"SALARY\",\n      \"Typical Hours\": NaN,\n      \"Annual Salary\": 22248.0,\n      \"Hourly Rate\": NaN,\n      \"Rank\": 1,\n      \"share\": 9e-06,\n      \"cumShareIncome\": 9e-06,\n      \"cumSharePeople\": 4.124e-05,\n      \"shortName\": \"0\"\n    },\n    {\n      \"Name\": \"FOWLER, NAJMA\",\n      \"Job Titles\": \"SERGEANT\",\n      \"Department\": \"DEPARTMENT OF POLICE\",\n      \"Full or Part-Time\": \"F\",\n      \"Salary or Hourly\": \"SALARY\",\n      \"Typical Hours\": NaN,\n      \"Annual Salary\": 129666.0,\n      \"Hourly Rate\": NaN,\n      \"Rank\": 21777,\n      \"share\": 5.4e-05,\n      \"cumShareIncome\": 0.853374,\n      \"cumSharePeople\": 0.89813173,\n      \"shortName\": \"Police\"\n    },\n    {\n      \"Name\": \"ALLEN, MONICA J\",\n      \"Job Titles\": \"FIREFIGHTER-EMT\",\n      \"Department\": \"FIRE DEPARTMENT\",\n      \"Full or Part-Time\": \"F\",\n      \"Salary or Hourly\": \"SALARY\",\n      \"Typical Hours\": NaN,\n      \"Annual Salary\": 110196.0,\n      \"Hourly Rate\": NaN,\n      \"Rank\": 17491,\n      \"share\": 4.6e-05,\n      \"cumShareIncome\": 0.644407,\n      \"cumSharePeople\": 0.72136759,\n      \"shortName\": \"Fire\"\n    },\n    {\n      \"Name\": \"GAJEWSKI, DANIEL F\",\n      \"Job Titles\": \"POLICE OFFICER\",\n      \"Department\": \"DEPARTMENT OF POLICE\",\n      \"Full or Part-Time\": \"F\",\n      \"Salary or Hourly\": \"SALARY\",\n      \"Typical Hours\": NaN,\n      \"Annual Salary\": 93264.0,\n      \"Hourly Rate\": NaN,\n      \"Rank\": 7550,\n      \"share\": 3.9e-05,\n      \"cumShareIncome\": 0.224799,\n      \"cumSharePeople\": 0.31137873,\n      \"shortName\": \"Police\"\n    },\n    {\n      \"Name\": \"QUITO, MILTON\",\n      \"Job Titles\": \"POLICE OFFICER\",\n      \"Department\": \"DEPARTMENT OF POLICE\",\n      \"Full or Part-Time\": \"F\",\n      \"Salary or Hourly\": \"SALARY\",\n      \"Typical Hours\": NaN,\n      \"Annual Salary\": 88896.0,\n      \"Hourly Rate\": NaN,\n      \"Rank\": 6693,\n      \"share\": 3.7e-05,\n      \"cumShareIncome\": 0.192117,\n      \"cumSharePeople\": 0.27603415,\n      \"shortName\": \"Police\"\n    }\n  ],\n  \"column names\": [\n    \"Name\",\n    \"Job Titles\",\n    \"Department\",\n    \"Full or Part-Time\",\n    \"Salary or Hourly\",\n    \"Typical Hours\",\n    \"Annual Salary\",\n    \"Hourly Rate\",\n    \"Rank\",\n    \"share\",\n    \"cumShareIncome\",\n    \"cumSharePeople\",\n    \"shortName\"\n  ]\n}\n\nYour Job:\nI am developing a NL to Data Visualization Dataset. \nPlease help me generate natural language utterance for given dataset and constraints.\nDefinition about the Taks:\n- 'utterance' is what a user would say to make a chart. It should be a commands structure. One NL 'utterance' is in one or two sentences. Here are two examples from Commands for reference:\n    Through a visualization show average horsepower of cars for each country from 1997 to 2011.for country in USA, JAPAN and EUROPE show MPG vs Displacement.\n    Please show me a histogram of weights with 500 intervals.\n- 'given dataset' is in form of column names, column type, range/unique values of the column.\n- 'constraints' are information about the chart that should be included in the utterance. \n    So we can find a reference phrase in the NL utterance that corresponds to the given constraints. \n- 'reference phrase' can be explicit, ambiguous, and by_value. 'ambiguous' means the phrase can map to more than one columns in the dataset, always a hypernym of column names(depending on the dataset values).\n    For example:\n    {\"column\": \"gdpPercap\", \"nl_ref_type\": \"explicit\", \"nl_ref_phrase\": \"GDP per capita\"},\n    {\"column\": [\"country\",\"continent\"], \"nl_ref_type\": \"ambiguous\", \"nl_ref_phrase\": \"region\"}\n    {\"column\": [\"country\",\"country_short_name\"], \"nl_ref_type\": \"ambiguous\", \"nl_ref_phrase\": \"countries\"}\n    {\"c_type\": \"mark\", \"c_name\": \"point chart\", \"nl_ref_type\": \"explicit\", \"nl_ref_phrase\": \"scatter plot\"}\n    {\"c_type\": \"mark\", \"c_name\": \"arc chart\", \"nl_ref_type\": \"explicit\", \"nl_ref_phrase\": \"pie chart\"}\n    {\"c_type\": \"transform\",\"c_name\": \"filter\",\"c_list\": [{\"field\": \"country\",\"oneOf\": [\"Iceland\",\"Norway\"]}],\"nl_ref_type\": \"explicit\",\"nl_ref_phrase\": \"for countries Iceland and Norway\"},\n    {\"c_type\": \"transform\",\"c_name\": \"filter\",\"c_list\": [{\"field\": \"country\",\"oneOf\": [\"Iceland\",\"Norway\"]}],\"nl_ref_type\": \"by_value\",\"nl_ref_phrase\": \"for Iceland and Norway\"},\n- the 'nl_ref_phrase' for 'ambiguous' columns should be equally near all ambiguous columns, not too near to one of the column since it would not be ambiguous.\n    good example: {\"column\": [\"country\",\"region\"], \"nl_ref_type\": \"ambiguous\", \"nl_ref_phrase\": \"location\"}\n    bad example: {\"column\": [\"country\",\"region\"], \"nl_ref_type\": \"ambiguous\", \"nl_ref_phrase\": \"region\"}\n- You only include given constraints and no other information. \n    For example, if a column name is not in the given constraint, it will not be included in the NL utterance.\n    Also, it a chart mark or chart encoding channel is not in the given constraint, it will not be included in the NL utterance.\n- all 'nl_ref_phrase' shoule be included in the 'nl_utterance'. \n\nThe output format is identical to the input format, but fill in the str blanks(\"...\").\n### Input:\n{\n  \"nl_utterance\": \"...\",\n  \"encoded_fields\": [\n    {\n      \"field\": \"Annual Salary\",\n      \"type\": \"quantitative\",\n      \"nl_ref_type\": \"explicit\",\n      \"nl_ref_phrase\": \"...\"\n    }\n  ],\n  \"constraints\": [\n    {\n      \"c_type\": \"transform\",\n      \"c_name\": \"aggregate\",\n      \"c_list\": [\n        {\n          \"aggregate\": \"count\"\n        }\n      ],\n      \"nl_ref_type\": \"explicit\",\n      \"nl_ref_phrase\": \"...\"\n    }\n  ]\n}\n\n### Output:"
}