{
  "gpt_result": {
    "nl_utterance": "Create a scatter plot to show the relationship between GDP per capita and life expectancy, categorized by the location, and indicate the population size.",
    "encoded_fields": [
      {
        "field": "GDP per capita (PPP)",
        "type": "quantitative",
        "nl_ref_type": "explicit",
        "nl_ref_phrase": "GDP per capita"
      },
      {
        "field": "Life Expectancy",
        "type": "quantitative",
        "nl_ref_type": "explicit",
        "nl_ref_phrase": "life expectancy"
      },
      {
        "field": [
          "Continent",
          "UN Region"
        ],
        "type": "nominal",
        "nl_ref_type": "ambiguous",
        "nl_ref_phrase": "location"
      },
      {
        "field": "Population",
        "type": "quantitative",
        "nl_ref_type": "explicit",
        "nl_ref_phrase": "population"
      }
    ],
    "constraints": [
      {
        "c_type": "mark",
        "c_name": "point chart",
        "c_list": [
          {
            "mark": "circle",
            "encoding": {
              "x": {},
              "y": {},
              "color": {
                "type": "nominal",
                "ignore": true
              },
              "size": {
                "ignore": true,
                "type": "quantitative"
              },
              "column": {
                "ignore": true,
                "type": "nominal"
              },
              "row": {
                "ignore": true,
                "type": "nominal"
              }
            }
          }
        ],
        "nl_ref_type": "explicit",
        "nl_ref_phrase": "scatter plot"
      }
    ]
  },
  "input": "Dataset Information: {\n  \"data samples\": [\n    {\n      \"Country\": \"Finland\",\n      \"Happiness score\": 7.821,\n      \"Country_temp\": \"Finland\",\n      \"ISO3\": \"FIN\",\n      \"GDP per capita (PPP)\": 55013.38586,\n      \"Life Ladder\": 7.7944,\n      \"Social support\": 0.9703,\n      \"Perceptions of corruption\": 0.1918,\n      \"Population\": 5535992.0,\n      \"Median Age\": 42.368,\n      \"Total Fertility Rate\": 1.389,\n      \"Life Expectancy\": 82.038,\n      \"Infant Mortality\": 1.932,\n      \"Child Mortality\": 2.353,\n      \"Net Migration Rate\": 2.7,\n      \"Continent\": \"Europe\",\n      \"UN Region\": \"Northern Europe\"\n    },\n    {\n      \"Country\": \"Nigeria\",\n      \"Happiness score\": 4.552,\n      \"Country_temp\": \"Nigeria\",\n      \"ISO3\": \"NGA\",\n      \"GDP per capita (PPP)\": 5407.979457,\n      \"Life Ladder\": 4.4793,\n      \"Social support\": 0.7416,\n      \"Perceptions of corruption\": 0.9119,\n      \"Population\": 213401323.0,\n      \"Median Age\": 17.02,\n      \"Total Fertility Rate\": 5.237,\n      \"Life Expectancy\": 52.676,\n      \"Infant Mortality\": 73.037,\n      \"Child Mortality\": 111.235,\n      \"Net Migration Rate\": -0.358,\n      \"Continent\": \"Africa\",\n      \"UN Region\": \"Western Africa\"\n    },\n    {\n      \"Country\": \"Germany\",\n      \"Happiness score\": 7.034,\n      \"Country_temp\": \"Germany\",\n      \"ISO3\": \"DEU\",\n      \"GDP per capita (PPP)\": 57881.08358,\n      \"Life Ladder\": 6.7545,\n      \"Social support\": 0.8676,\n      \"Perceptions of corruption\": 0.4176,\n      \"Population\": 83408554.0,\n      \"Median Age\": 44.874,\n      \"Total Fertility Rate\": 1.53,\n      \"Life Expectancy\": 80.6,\n      \"Infant Mortality\": 3.1,\n      \"Child Mortality\": 4.0,\n      \"Net Migration Rate\": 3.8,\n      \"Continent\": \"Europe\",\n      \"UN Region\": \"Western Europe\"\n    },\n    {\n      \"Country\": \"Rwanda*\",\n      \"Happiness score\": 3.268,\n      \"Country_temp\": \"Rwanda\",\n      \"ISO3\": \"RWA\",\n      \"GDP per capita (PPP)\": 2459.707347,\n      \"Life Ladder\": NaN,\n      \"Social support\": NaN,\n      \"Perceptions of corruption\": NaN,\n      \"Population\": 13461888.0,\n      \"Median Age\": 19.003,\n      \"Total Fertility Rate\": 3.821,\n      \"Life Expectancy\": 66.072,\n      \"Infant Mortality\": 28.988,\n      \"Child Mortality\": 38.674,\n      \"Net Migration Rate\": -0.454,\n      \"Continent\": \"Africa\",\n      \"UN Region\": \"Eastern Africa\"\n    },\n    {\n      \"Country\": \"North Cyprus*\",\n      \"Happiness score\": 5.467,\n      \"Country_temp\": \"North Cyprus\",\n      \"ISO3\": \"CYP\",\n      \"GDP per capita (PPP)\": 44109.67188,\n      \"Life Ladder\": 6.2692,\n      \"Social support\": 0.8554,\n      \"Perceptions of corruption\": 0.8765,\n      \"Population\": 1244188.0,\n      \"Median Age\": 37.587,\n      \"Total Fertility Rate\": 1.321,\n      \"Life Expectancy\": 81.203,\n      \"Infant Mortality\": 2.303,\n      \"Child Mortality\": 2.711,\n      \"Net Migration Rate\": 1.605,\n      \"Continent\": \"Asia\",\n      \"UN Region\": \"Western Asia\"\n    }\n  ],\n  \"column names\": [\n    \"Country\",\n    \"Happiness score\",\n    \"Country_temp\",\n    \"ISO3\",\n    \"GDP per capita (PPP)\",\n    \"Life Ladder\",\n    \"Social support\",\n    \"Perceptions of corruption\",\n    \"Population\",\n    \"Median Age\",\n    \"Total Fertility Rate\",\n    \"Life Expectancy\",\n    \"Infant Mortality\",\n    \"Child Mortality\",\n    \"Net Migration Rate\",\n    \"Continent\",\n    \"UN Region\"\n  ]\n}\n\nYour Job:\nI am developing a NL to Data Visualization Dataset. \nPlease help me generate natural language utterance for given dataset and constraints.\nDefinition about the Taks:\n- 'utterance' is what a user would say to make a chart. It should be a commands structure. One NL 'utterance' is in one or two sentences. Here are two examples from Commands for reference:\n    For each country show the relationship between average acceleration and number of cylinders.\n    Sort creative types by number of movies.\n- 'given dataset' is in form of column names, column type, range/unique values of the column.\n- 'constraints' are information about the chart that should be included in the utterance. \n    So we can find a reference phrase in the NL utterance that corresponds to the given constraints. \n- 'reference phrase' can be explicit, ambiguous, and by_value. 'ambiguous' means the phrase can map to more than one columns in the dataset, always a hypernym of column names(depending on the dataset values).\n    For example:\n    {\"column\": \"gdpPercap\", \"nl_ref_type\": \"explicit\", \"nl_ref_phrase\": \"GDP per capita\"},\n    {\"column\": [\"country\",\"continent\"], \"nl_ref_type\": \"ambiguous\", \"nl_ref_phrase\": \"region\"}\n    {\"column\": [\"country\",\"country_short_name\"], \"nl_ref_type\": \"ambiguous\", \"nl_ref_phrase\": \"countries\"}\n    {\"c_type\": \"mark\", \"c_name\": \"point chart\", \"nl_ref_type\": \"explicit\", \"nl_ref_phrase\": \"scatter plot\"}\n    {\"c_type\": \"mark\", \"c_name\": \"arc chart\", \"nl_ref_type\": \"explicit\", \"nl_ref_phrase\": \"pie chart\"}\n    {\"c_type\": \"transform\",\"c_name\": \"filter\",\"c_list\": [{\"field\": \"country\",\"oneOf\": [\"Iceland\",\"Norway\"]}],\"nl_ref_type\": \"explicit\",\"nl_ref_phrase\": \"for countries Iceland and Norway\"},\n    {\"c_type\": \"transform\",\"c_name\": \"filter\",\"c_list\": [{\"field\": \"country\",\"oneOf\": [\"Iceland\",\"Norway\"]}],\"nl_ref_type\": \"by_value\",\"nl_ref_phrase\": \"for Iceland and Norway\"},\n- the 'nl_ref_phrase' for 'ambiguous' columns should be equally near all ambiguous columns, not too near to one of the column since it would not be ambiguous.\n    good example: {\"column\": [\"country\",\"region\"], \"nl_ref_type\": \"ambiguous\", \"nl_ref_phrase\": \"location\"}\n    bad example: {\"column\": [\"country\",\"region\"], \"nl_ref_type\": \"ambiguous\", \"nl_ref_phrase\": \"region\"}\n- You only include given constraints and no other information. \n    For example, if a column name is not in the given constraint, it will not be included in the NL utterance.\n    Also, it a chart mark or chart encoding channel is not in the given constraint, it will not be included in the NL utterance.\n- all 'nl_ref_phrase' shoule be included in the 'nl_utterance'. \n\nThe output format is identical to the input format, but fill in the str blanks(\"...\").\n### Input:\n{\n  \"nl_utterance\": \"...\",\n  \"encoded_fields\": [\n    {\n      \"field\": \"GDP per capita (PPP)\",\n      \"type\": \"quantitative\",\n      \"nl_ref_type\": \"explicit\",\n      \"nl_ref_phrase\": \"...\"\n    },\n    {\n      \"field\": \"Life Expectancy\",\n      \"type\": \"quantitative\",\n      \"nl_ref_type\": \"explicit\",\n      \"nl_ref_phrase\": \"...\"\n    },\n    {\n      \"field\": [\n        \"Continent\",\n        \"UN Region\"\n      ],\n      \"type\": \"nominal\",\n      \"nl_ref_type\": \"ambiguous\",\n      \"nl_ref_phrase\": \"...\"\n    },\n    {\n      \"field\": \"Population\",\n      \"type\": \"quantitative\",\n      \"nl_ref_type\": \"explicit\",\n      \"nl_ref_phrase\": \"...\"\n    }\n  ],\n  \"constraints\": [\n    {\n      \"c_type\": \"mark\",\n      \"c_name\": \"point chart\",\n      \"c_list\": [\n        {\n          \"mark\": \"circle\",\n          \"encoding\": {\n            \"x\": {},\n            \"y\": {},\n            \"color\": {\n              \"type\": \"nominal\",\n              \"ignore\": true\n            },\n            \"size\": {\n              \"ignore\": true,\n              \"type\": \"quantitative\"\n            },\n            \"column\": {\n              \"ignore\": true,\n              \"type\": \"nominal\"\n            },\n            \"row\": {\n              \"ignore\": true,\n              \"type\": \"nominal\"\n            }\n          }\n        }\n      ],\n      \"nl_ref_type\": \"explicit\",\n      \"nl_ref_phrase\": \"...\"\n    }\n  ]\n}\n\n### Output:"
}