{
  "gpt_result": {
    "nl_utterance": "Create a scatter plot showing the correlation between median income and firearm deaths across different regions.",
    "encoded_fields": [
      {
        "field": "Med income",
        "type": "quantitative",
        "nl_ref_type": "explicit",
        "nl_ref_phrase": "median income"
      },
      {
        "field": "Firearm deaths",
        "type": "quantitative",
        "nl_ref_type": "explicit",
        "nl_ref_phrase": "firearm deaths"
      },
      {
        "field": [
          "Division",
          "State",
          "State2"
        ],
        "type": "nominal",
        "nl_ref_type": "ambiguous",
        "nl_ref_phrase": "regions"
      }
    ],
    "constraints": [
      {
        "c_type": "task",
        "c_name": "correlation",
        "c_list": [
          {
            "mark": "circle",
            "encoding": {
              "x": {
                "type": "quantitative"
              },
              "y": {
                "type": "quantitative"
              }
            }
          }
        ],
        "nl_ref_type": "explicit",
        "nl_ref_phrase": "correlation"
      }
    ]
  },
  "input": "Dataset Information: {\n  \"data samples\": [\n    {\n      \"State\": \"Alabama\",\n      \"State2\": \"AL\",\n      \"Gini\": 0.472,\n      \"Death Rate\": 21.5,\n      \"Firearms, vs average\": 1.64700475,\n      \"Med income\": 47221,\n      \"Income, vs median\": 0.799827233,\n      \"Imprisonment rates\": 736,\n      \"Prison rate\": 1.264604811,\n      \"Imprisonment rate\": 0.736,\n      \"Firearm deaths\": 0.215,\n      \"Division\": \"South\"\n    },\n    {\n      \"State\": \"Iowa\",\n      \"State2\": \"IA\",\n      \"Gini\": 0.427,\n      \"Death Rate\": 9.2,\n      \"Firearms, vs average\": 0.704764823,\n      \"Med income\": 59094,\n      \"Income, vs median\": 1.000931588,\n      \"Imprisonment rates\": 373,\n      \"Prison rate\": 0.640893471,\n      \"Imprisonment rate\": 0.373,\n      \"Firearm deaths\": 0.092,\n      \"Division\": \"Midwest\"\n    },\n    {\n      \"State\": \"Arizona\",\n      \"State2\": \"AZ\",\n      \"Gini\": 0.455,\n      \"Death Rate\": 15.2,\n      \"Firearms, vs average\": 1.164394055,\n      \"Med income\": 57100,\n      \"Income, vs median\": 0.967157303,\n      \"Imprisonment rates\": 764,\n      \"Prison rate\": 1.312714777,\n      \"Imprisonment rate\": 0.764,\n      \"Firearm deaths\": 0.152,\n      \"Division\": \"West\"\n    },\n    {\n      \"State\": \"New Jersey\",\n      \"State2\": \"NJ\",\n      \"Gini\": 0.464,\n      \"Death Rate\": 5.5,\n      \"Firearms, vs average\": 0.421326796,\n      \"Med income\": 68468,\n      \"Income, vs median\": 1.15970799,\n      \"Imprisonment rates\": 284,\n      \"Prison rate\": 0.487972509,\n      \"Imprisonment rate\": 0.284,\n      \"Firearm deaths\": 0.055,\n      \"Division\": \"Northeast\"\n    },\n    {\n      \"State\": \"New Mexico\",\n      \"State2\": \"NM\",\n      \"Gini\": 0.464,\n      \"Death Rate\": 18.1,\n      \"Firearms, vs average\": 1.386548184,\n      \"Med income\": 48451,\n      \"Income, vs median\": 0.820660919,\n      \"Imprisonment rates\": 438,\n      \"Prison rate\": 0.75257732,\n      \"Imprisonment rate\": 0.438,\n      \"Firearm deaths\": 0.181,\n      \"Division\": \"West\"\n    }\n  ],\n  \"column names\": [\n    \"State\",\n    \"State2\",\n    \"Gini\",\n    \"Death Rate\",\n    \"Firearms, vs average\",\n    \"Med income\",\n    \"Income, vs median\",\n    \"Imprisonment rates\",\n    \"Prison rate\",\n    \"Imprisonment rate\",\n    \"Firearm deaths\",\n    \"Division\"\n  ]\n}\n\nYour Job:\nI am developing a NL to Data Visualization Dataset. \nPlease help me generate natural language utterance for given dataset and constraints.\nDefinition about the Taks:\n- 'utterance' is what a user would say to make a chart. It should be a queries structure. One NL 'utterance' is in one or two sentences. Here are two examples from Queries for reference:\n    bar chart for mpg v/s cylinders.\n    mpg vs displacement as a scatter chart.\n- 'given dataset' is in form of column names, column type, range/unique values of the column.\n- 'constraints' are information about the chart that should be included in the utterance. \n    So we can find a reference phrase in the NL utterance that corresponds to the given constraints. \n- 'reference phrase' can be explicit, ambiguous, and by_value. 'ambiguous' means the phrase can map to more than one columns in the dataset, always a hypernym of column names(depending on the dataset values).\n    For example:\n    {\"column\": \"gdpPercap\", \"nl_ref_type\": \"explicit\", \"nl_ref_phrase\": \"GDP per capita\"},\n    {\"column\": [\"country\",\"continent\"], \"nl_ref_type\": \"ambiguous\", \"nl_ref_phrase\": \"region\"}\n    {\"column\": [\"country\",\"country_short_name\"], \"nl_ref_type\": \"ambiguous\", \"nl_ref_phrase\": \"countries\"}\n    {\"c_type\": \"mark\", \"c_name\": \"point chart\", \"nl_ref_type\": \"explicit\", \"nl_ref_phrase\": \"scatter plot\"}\n    {\"c_type\": \"mark\", \"c_name\": \"arc chart\", \"nl_ref_type\": \"explicit\", \"nl_ref_phrase\": \"pie chart\"}\n    {\"c_type\": \"transform\",\"c_name\": \"filter\",\"c_list\": [{\"field\": \"country\",\"oneOf\": [\"Iceland\",\"Norway\"]}],\"nl_ref_type\": \"explicit\",\"nl_ref_phrase\": \"for countries Iceland and Norway\"},\n    {\"c_type\": \"transform\",\"c_name\": \"filter\",\"c_list\": [{\"field\": \"country\",\"oneOf\": [\"Iceland\",\"Norway\"]}],\"nl_ref_type\": \"by_value\",\"nl_ref_phrase\": \"for Iceland and Norway\"},\n- the 'nl_ref_phrase' for 'ambiguous' columns should be equally near all ambiguous columns, not too near to one of the column since it would not be ambiguous.\n    good example: {\"column\": [\"country\",\"region\"], \"nl_ref_type\": \"ambiguous\", \"nl_ref_phrase\": \"location\"}\n    bad example: {\"column\": [\"country\",\"region\"], \"nl_ref_type\": \"ambiguous\", \"nl_ref_phrase\": \"region\"}\n- You only include given constraints and no other information. \n    For example, if a column name is not in the given constraint, it will not be included in the NL utterance.\n    Also, it a chart mark or chart encoding channel is not in the given constraint, it will not be included in the NL utterance.\n- all 'nl_ref_phrase' shoule be included in the 'nl_utterance'. \n\nThe output format is identical to the input format, but fill in the str blanks(\"...\").\n### Input:\n{\n  \"nl_utterance\": \"...\",\n  \"encoded_fields\": [\n    {\n      \"field\": \"Med income\",\n      \"type\": \"quantitative\",\n      \"nl_ref_type\": \"explicit\",\n      \"nl_ref_phrase\": \"...\"\n    },\n    {\n      \"field\": \"Firearm deaths\",\n      \"type\": \"quantitative\",\n      \"nl_ref_type\": \"explicit\",\n      \"nl_ref_phrase\": \"...\"\n    },\n    {\n      \"field\": [\n        \"Division\",\n        \"State\",\n        \"State2\"\n      ],\n      \"type\": \"nominal\",\n      \"nl_ref_type\": \"ambiguous\",\n      \"nl_ref_phrase\": \"...\"\n    }\n  ],\n  \"constraints\": [\n    {\n      \"c_type\": \"task\",\n      \"c_name\": \"correlation\",\n      \"c_list\": [\n        {\n          \"mark\": \"circle\",\n          \"encoding\": {\n            \"x\": {\n              \"type\": \"quantitative\"\n            },\n            \"y\": {\n              \"type\": \"quantitative\"\n            }\n          }\n        }\n      ],\n      \"nl_ref_type\": \"explicit\",\n      \"nl_ref_phrase\": \"...\"\n    }\n  ]\n}\n\n### Output:"
}