{
  "gpt_result": {
    "nl_utterance": "Create a scatter plot of Component 2 against positions.",
    "encoded_fields": [
      {
        "field": "Component 2",
        "type": "quantitative",
        "nl_ref_type": "explicit",
        "nl_ref_phrase": "Component 2"
      },
      {
        "field": "Pos",
        "type": "nominal",
        "nl_ref_type": "explicit",
        "nl_ref_phrase": "positions"
      }
    ],
    "constraints": [
      {
        "c_type": "mark",
        "c_name": "point chart",
        "c_list": [
          {
            "mark": "circle",
            "encoding": {
              "x": {},
              "y": {},
              "color": {
                "type": "nominal",
                "ignore": true
              },
              "size": {
                "ignore": true,
                "type": "quantitative"
              },
              "column": {
                "ignore": true,
                "type": "nominal"
              },
              "row": {
                "ignore": true,
                "type": "nominal"
              }
            }
          }
        ],
        "nl_ref_type": "explicit",
        "nl_ref_phrase": "scatter plot"
      }
    ]
  },
  "input": "Dataset Information: {\n  \"data samples\": [\n    {\n      \"Unnamed: 0\": 0,\n      \"Player\": \"Max Aarons\",\n      \"Progressive Carries\": 5.4375,\n      \"Touches\": 57.96875,\n      \"Expected Assists\": 0.04375,\n      \"Progressive Passes\": 2.9375,\n      \"Passes\": 33.96875,\n      \"Interceptions\": 1.75,\n      \"Possession-Winning-Tackles\": 1.15625,\n      \"Aerials Won\": 0.46875,\n      \"Pos\": \"Defender\",\n      \"Non-Penalty Expected Goals\": 0.02,\n      \"cluster\": 6,\n      \"Component 1\": -0.6794867331318681,\n      \"Component 2\": 0.4101967803346252\n    },\n    {\n      \"Unnamed: 0\": 347,\n      \"Player\": \"Ben Gibson\",\n      \"Progressive Carries\": 2.2382671480144407,\n      \"Touches\": 57.65342960288809,\n      \"Expected Assists\": 0.0,\n      \"Progressive Passes\": 2.815884476534296,\n      \"Passes\": 38.44765342960289,\n      \"Interceptions\": 1.7328519855595668,\n      \"Possession-Winning-Tackles\": 0.6137184115523466,\n      \"Aerials Won\": 2.4187725631768955,\n      \"Pos\": \"Defender\",\n      \"Non-Penalty Expected Goals\": 0.04,\n      \"cluster\": 5,\n      \"Component 1\": -0.4982740071736524,\n      \"Component 2\": -1.4956765194853852\n    },\n    {\n      \"Unnamed: 0\": 349,\n      \"Player\": \"\\u00d3scar Gil\",\n      \"Progressive Carries\": 2.553191489361702,\n      \"Touches\": 52.659574468085104,\n      \"Expected Assists\": 0.1329787234042553,\n      \"Progressive Passes\": 1.5957446808510638,\n      \"Passes\": 33.29787234042553,\n      \"Interceptions\": 1.702127659574468,\n      \"Possession-Winning-Tackles\": 1.5957446808510638,\n      \"Aerials Won\": 0.3723404255319149,\n      \"Pos\": \"Defender\",\n      \"Non-Penalty Expected Goals\": 0.01,\n      \"cluster\": 6,\n      \"Component 1\": -0.5403935400092905,\n      \"Component 2\": 0.0964309381158524\n    },\n    {\n      \"Unnamed: 0\": 342,\n      \"Player\": \"Rub\\u00e9n Garc\\u00eda\",\n      \"Progressive Carries\": 5.0,\n      \"Touches\": 58.71212121212122,\n      \"Expected Assists\": 0.1287878787878787,\n      \"Progressive Passes\": 3.75,\n      \"Passes\": 33.75,\n      \"Interceptions\": 0.8333333333333334,\n      \"Possession-Winning-Tackles\": 0.9090909090909092,\n      \"Aerials Won\": 1.325757575757576,\n      \"Pos\": \"Winger\",\n      \"Non-Penalty Expected Goals\": 0.06,\n      \"cluster\": 3,\n      \"Component 1\": 0.4555624474641212,\n      \"Component 2\": 0.7109458542746038\n    },\n    {\n      \"Unnamed: 0\": 155,\n      \"Player\": \"Mahdi Camara\",\n      \"Progressive Carries\": 4.428152492668621,\n      \"Touches\": 56.686217008797655,\n      \"Expected Assists\": 0.0557184750733137,\n      \"Progressive Passes\": 2.3460410557184748,\n      \"Passes\": 37.50733137829912,\n      \"Interceptions\": 2.0234604105571847,\n      \"Possession-Winning-Tackles\": 1.7302052785923754,\n      \"Aerials Won\": 1.0850439882697946,\n      \"Pos\": \"Wingback\",\n      \"Non-Penalty Expected Goals\": 0.07,\n      \"cluster\": 6,\n      \"Component 1\": -1.1054106075090937,\n      \"Component 2\": 0.0149650836898832\n    }\n  ],\n  \"column names\": [\n    \"Unnamed: 0\",\n    \"Player\",\n    \"Progressive Carries\",\n    \"Touches\",\n    \"Expected Assists\",\n    \"Progressive Passes\",\n    \"Passes\",\n    \"Interceptions\",\n    \"Possession-Winning-Tackles\",\n    \"Aerials Won\",\n    \"Pos\",\n    \"Non-Penalty Expected Goals\",\n    \"cluster\",\n    \"Component 1\",\n    \"Component 2\"\n  ]\n}\n\nYour Job:\nI am developing a NL to Data Visualization Dataset. \nPlease help me generate natural language utterance for given dataset and constraints.\nDefinition about the Taks:\n- 'utterance' is what a user would say to make a chart. It should be a commands structure. One NL 'utterance' is in one or two sentences. Here are two examples from Commands for reference:\n    Help me see outliers in IMDB and Rotten Tomatoes ratings.\n    Make the bars stacked with the ship status.\n- 'given dataset' is in form of column names, column type, range/unique values of the column.\n- 'constraints' are information about the chart that should be included in the utterance. \n    So we can find a reference phrase in the NL utterance that corresponds to the given constraints. \n- 'reference phrase' can be explicit, ambiguous, and by_value. 'ambiguous' means the phrase can map to more than one columns in the dataset, always a hypernym of column names(depending on the dataset values).\n    For example:\n    {\"column\": \"gdpPercap\", \"nl_ref_type\": \"explicit\", \"nl_ref_phrase\": \"GDP per capita\"},\n    {\"column\": [\"country\",\"continent\"], \"nl_ref_type\": \"ambiguous\", \"nl_ref_phrase\": \"region\"}\n    {\"column\": [\"country\",\"country_short_name\"], \"nl_ref_type\": \"ambiguous\", \"nl_ref_phrase\": \"countries\"}\n    {\"c_type\": \"mark\", \"c_name\": \"point chart\", \"nl_ref_type\": \"explicit\", \"nl_ref_phrase\": \"scatter plot\"}\n    {\"c_type\": \"mark\", \"c_name\": \"arc chart\", \"nl_ref_type\": \"explicit\", \"nl_ref_phrase\": \"pie chart\"}\n    {\"c_type\": \"transform\",\"c_name\": \"filter\",\"c_list\": [{\"field\": \"country\",\"oneOf\": [\"Iceland\",\"Norway\"]}],\"nl_ref_type\": \"explicit\",\"nl_ref_phrase\": \"for countries Iceland and Norway\"},\n    {\"c_type\": \"transform\",\"c_name\": \"filter\",\"c_list\": [{\"field\": \"country\",\"oneOf\": [\"Iceland\",\"Norway\"]}],\"nl_ref_type\": \"by_value\",\"nl_ref_phrase\": \"for Iceland and Norway\"},\n- the 'nl_ref_phrase' for 'ambiguous' columns should be equally near all ambiguous columns, not too near to one of the column since it would not be ambiguous.\n    good example: {\"column\": [\"country\",\"region\"], \"nl_ref_type\": \"ambiguous\", \"nl_ref_phrase\": \"location\"}\n    bad example: {\"column\": [\"country\",\"region\"], \"nl_ref_type\": \"ambiguous\", \"nl_ref_phrase\": \"region\"}\n- You only include given constraints and no other information. \n    For example, if a column name is not in the given constraint, it will not be included in the NL utterance.\n    Also, it a chart mark or chart encoding channel is not in the given constraint, it will not be included in the NL utterance.\n- all 'nl_ref_phrase' shoule be included in the 'nl_utterance'. \n\nThe output format is identical to the input format, but fill in the str blanks(\"...\").\n### Input:\n{\n  \"nl_utterance\": \"...\",\n  \"encoded_fields\": [\n    {\n      \"field\": \"Component 2\",\n      \"type\": \"quantitative\",\n      \"nl_ref_type\": \"explicit\",\n      \"nl_ref_phrase\": \"...\"\n    },\n    {\n      \"field\": \"Pos\",\n      \"type\": \"nominal\",\n      \"nl_ref_type\": \"explicit\",\n      \"nl_ref_phrase\": \"...\"\n    }\n  ],\n  \"constraints\": [\n    {\n      \"c_type\": \"mark\",\n      \"c_name\": \"point chart\",\n      \"c_list\": [\n        {\n          \"mark\": \"circle\",\n          \"encoding\": {\n            \"x\": {},\n            \"y\": {},\n            \"color\": {\n              \"type\": \"nominal\",\n              \"ignore\": true\n            },\n            \"size\": {\n              \"ignore\": true,\n              \"type\": \"quantitative\"\n            },\n            \"column\": {\n              \"ignore\": true,\n              \"type\": \"nominal\"\n            },\n            \"row\": {\n              \"ignore\": true,\n              \"type\": \"nominal\"\n            }\n          }\n        }\n      ],\n      \"nl_ref_type\": \"explicit\",\n      \"nl_ref_phrase\": \"...\"\n    }\n  ]\n}\n\n### Output:"
}