{
  "gpt_result": {
    "nl_utterance": "Create a scatter plot to visualize Progressive Carries, Progressive Passes, and Expected Assists.",
    "encoded_fields": [
      {
        "field": "Progressive Carries",
        "type": "quantitative",
        "nl_ref_type": "explicit",
        "nl_ref_phrase": "Progressive Carries"
      },
      {
        "field": "Progressive Passes",
        "type": "quantitative",
        "nl_ref_type": "explicit",
        "nl_ref_phrase": "Progressive Passes"
      },
      {
        "field": "Expected Assists",
        "type": "quantitative",
        "nl_ref_type": "explicit",
        "nl_ref_phrase": "Expected Assists"
      }
    ],
    "constraints": [
      {
        "c_type": "mark",
        "c_name": "point chart",
        "c_list": [
          {
            "mark": "circle",
            "encoding": {
              "x": {},
              "y": {},
              "color": {
                "type": "nominal",
                "ignore": true
              },
              "size": {
                "ignore": true,
                "type": "quantitative"
              },
              "column": {
                "ignore": true,
                "type": "nominal"
              },
              "row": {
                "ignore": true,
                "type": "nominal"
              }
            }
          }
        ],
        "nl_ref_type": "explicit",
        "nl_ref_phrase": "scatter plot"
      }
    ]
  },
  "input": "Dataset Information: {\n  \"data samples\": [\n    {\n      \"Player\": \"Max Aarons\",\n      \"Pos\": \"DF\",\n      \"Comp\": \"eng Premier League\",\n      \"Progressive Passes\": 2.9375,\n      \"Expected Assists\": 0.04375,\n      \"Progressive Carries\": 5.4375\n    },\n    {\n      \"Player\": \"Ben Gibson\",\n      \"Pos\": \"DF\",\n      \"Comp\": \"eng Premier League\",\n      \"Progressive Passes\": 2.815884476534296,\n      \"Expected Assists\": 0.0,\n      \"Progressive Carries\": 2.2382671480144407\n    },\n    {\n      \"Player\": \"Conor Gallagher\",\n      \"Pos\": \"MF\",\n      \"Comp\": \"eng Premier League\",\n      \"Progressive Passes\": 1.962025316455696,\n      \"Expected Assists\": 0.110759493670886,\n      \"Progressive Carries\": 3.3227848101265822\n    },\n    {\n      \"Player\": \"Reece James\",\n      \"Pos\": \"DF\",\n      \"Comp\": \"eng Premier League\",\n      \"Progressive Passes\": 5.797101449275362,\n      \"Expected Assists\": 0.2753623188405797,\n      \"Progressive Carries\": 7.536231884057972\n    },\n    {\n      \"Player\": \"Bukayo Saka\",\n      \"Pos\": \"FWMF\",\n      \"Comp\": \"eng Premier League\",\n      \"Progressive Passes\": 2.205438066465257,\n      \"Expected Assists\": 0.2084592145015106,\n      \"Progressive Carries\": 7.915407854984894\n    }\n  ],\n  \"column names\": [\n    \"Player\",\n    \"Pos\",\n    \"Comp\",\n    \"Progressive Passes\",\n    \"Expected Assists\",\n    \"Progressive Carries\"\n  ]\n}\n\nYour Job:\nI am developing a NL to Data Visualization Dataset. \nPlease help me generate natural language utterance for given dataset and constraints.\nDefinition about the Taks:\n- 'utterance' is what a user would say to make a chart. It should be a commands structure. One NL 'utterance' is in one or two sentences. Here are two examples from Commands for reference:\n    Graph to show the acceleration for cars from different countries segregated based on number of cylinders.\n    Please show me a histogram of weights with 500 intervals.\n- 'given dataset' is in form of column names, column type, range/unique values of the column.\n- 'constraints' are information about the chart that should be included in the utterance. \n    So we can find a reference phrase in the NL utterance that corresponds to the given constraints. \n- 'reference phrase' can be explicit, ambiguous, and by_value. 'ambiguous' means the phrase can map to more than one columns in the dataset, always a hypernym of column names(depending on the dataset values).\n    For example:\n    {\"column\": \"gdpPercap\", \"nl_ref_type\": \"explicit\", \"nl_ref_phrase\": \"GDP per capita\"},\n    {\"column\": [\"country\",\"continent\"], \"nl_ref_type\": \"ambiguous\", \"nl_ref_phrase\": \"region\"}\n    {\"column\": [\"country\",\"country_short_name\"], \"nl_ref_type\": \"ambiguous\", \"nl_ref_phrase\": \"countries\"}\n    {\"c_type\": \"mark\", \"c_name\": \"point chart\", \"nl_ref_type\": \"explicit\", \"nl_ref_phrase\": \"scatter plot\"}\n    {\"c_type\": \"mark\", \"c_name\": \"arc chart\", \"nl_ref_type\": \"explicit\", \"nl_ref_phrase\": \"pie chart\"}\n    {\"c_type\": \"transform\",\"c_name\": \"filter\",\"c_list\": [{\"field\": \"country\",\"oneOf\": [\"Iceland\",\"Norway\"]}],\"nl_ref_type\": \"explicit\",\"nl_ref_phrase\": \"for countries Iceland and Norway\"},\n    {\"c_type\": \"transform\",\"c_name\": \"filter\",\"c_list\": [{\"field\": \"country\",\"oneOf\": [\"Iceland\",\"Norway\"]}],\"nl_ref_type\": \"by_value\",\"nl_ref_phrase\": \"for Iceland and Norway\"},\n- the 'nl_ref_phrase' for 'ambiguous' columns should be equally near all ambiguous columns, not too near to one of the column since it would not be ambiguous.\n    good example: {\"column\": [\"country\",\"region\"], \"nl_ref_type\": \"ambiguous\", \"nl_ref_phrase\": \"location\"}\n    bad example: {\"column\": [\"country\",\"region\"], \"nl_ref_type\": \"ambiguous\", \"nl_ref_phrase\": \"region\"}\n- You only include given constraints and no other information. \n    For example, if a column name is not in the given constraint, it will not be included in the NL utterance.\n    Also, it a chart mark or chart encoding channel is not in the given constraint, it will not be included in the NL utterance.\n- all 'nl_ref_phrase' shoule be included in the 'nl_utterance'. \n\nThe output format is identical to the input format, but fill in the str blanks(\"...\").\n### Input:\n{\n  \"nl_utterance\": \"...\",\n  \"encoded_fields\": [\n    {\n      \"field\": \"Progressive Carries\",\n      \"type\": \"quantitative\",\n      \"nl_ref_type\": \"explicit\",\n      \"nl_ref_phrase\": \"...\"\n    },\n    {\n      \"field\": \"Progressive Passes\",\n      \"type\": \"quantitative\",\n      \"nl_ref_type\": \"explicit\",\n      \"nl_ref_phrase\": \"...\"\n    },\n    {\n      \"field\": \"Expected Assists\",\n      \"type\": \"quantitative\",\n      \"nl_ref_type\": \"explicit\",\n      \"nl_ref_phrase\": \"...\"\n    }\n  ],\n  \"constraints\": [\n    {\n      \"c_type\": \"mark\",\n      \"c_name\": \"point chart\",\n      \"c_list\": [\n        {\n          \"mark\": \"circle\",\n          \"encoding\": {\n            \"x\": {},\n            \"y\": {},\n            \"color\": {\n              \"type\": \"nominal\",\n              \"ignore\": true\n            },\n            \"size\": {\n              \"ignore\": true,\n              \"type\": \"quantitative\"\n            },\n            \"column\": {\n              \"ignore\": true,\n              \"type\": \"nominal\"\n            },\n            \"row\": {\n              \"ignore\": true,\n              \"type\": \"nominal\"\n            }\n          }\n        }\n      ],\n      \"nl_ref_type\": \"explicit\",\n      \"nl_ref_phrase\": \"...\"\n    }\n  ]\n}\n\n### Output:"
}