{
  "gpt_result": {
    "nl_utterance": "Create a scatter plot to examine the correlation using GDP per capita, Infant Mortality, Population, and Continent.",
    "encoded_fields": [
      {
        "field": "GDP per capita (PPP)",
        "type": "quantitative",
        "nl_ref_type": "explicit",
        "nl_ref_phrase": "GDP per capita"
      },
      {
        "field": "Infant Mortality",
        "type": "quantitative",
        "nl_ref_type": "explicit",
        "nl_ref_phrase": "Infant Mortality"
      },
      {
        "field": "Continent",
        "type": "nominal",
        "nl_ref_type": "explicit",
        "nl_ref_phrase": "Continent"
      },
      {
        "field": "Population",
        "type": "quantitative",
        "nl_ref_type": "explicit",
        "nl_ref_phrase": "Population"
      }
    ],
    "constraints": [
      {
        "c_type": "task",
        "c_name": "correlation",
        "c_list": [
          {
            "mark": "circle",
            "encoding": {
              "x": {
                "type": "quantitative"
              },
              "y": {
                "type": "quantitative"
              }
            }
          }
        ],
        "nl_ref_type": "explicit",
        "nl_ref_phrase": "correlation"
      }
    ]
  },
  "input": "Dataset Information: {\n  \"data samples\": [\n    {\n      \"Country\": \"Finland\",\n      \"Happiness score\": 7.821,\n      \"Country_temp\": \"Finland\",\n      \"ISO3\": \"FIN\",\n      \"GDP per capita (PPP)\": 55013.38586,\n      \"Life Ladder\": 7.7944,\n      \"Social support\": 0.9703,\n      \"Perceptions of corruption\": 0.1918,\n      \"Population\": 5535992.0,\n      \"Median Age\": 42.368,\n      \"Total Fertility Rate\": 1.389,\n      \"Life Expectancy\": 82.038,\n      \"Infant Mortality\": 1.932,\n      \"Child Mortality\": 2.353,\n      \"Net Migration Rate\": 2.7,\n      \"Continent\": \"Europe\",\n      \"UN Region\": \"Northern Europe\"\n    },\n    {\n      \"Country\": \"Luxembourg*\",\n      \"Happiness score\": 7.404,\n      \"Country_temp\": \"Luxembourg\",\n      \"ISO3\": \"LUX\",\n      \"GDP per capita (PPP)\": 134544.5291,\n      \"Life Ladder\": NaN,\n      \"Social support\": NaN,\n      \"Perceptions of corruption\": NaN,\n      \"Population\": 639321.0,\n      \"Median Age\": 38.735,\n      \"Total Fertility Rate\": 1.39,\n      \"Life Expectancy\": 82.6,\n      \"Infant Mortality\": 4.5,\n      \"Child Mortality\": 5.0,\n      \"Net Migration Rate\": 10.9,\n      \"Continent\": \"Europe\",\n      \"UN Region\": \"Western Europe\"\n    },\n    {\n      \"Country\": \"Kenya\",\n      \"Happiness score\": 4.543,\n      \"Country_temp\": \"Kenya\",\n      \"ISO3\": \"KEN\",\n      \"GDP per capita (PPP)\": 5211.170533,\n      \"Life Ladder\": 4.4645,\n      \"Social support\": 0.7022,\n      \"Perceptions of corruption\": 0.8413,\n      \"Population\": 53005614.0,\n      \"Median Age\": 19.154,\n      \"Total Fertility Rate\": 3.335,\n      \"Life Expectancy\": 61.427,\n      \"Infant Mortality\": 29.814,\n      \"Child Mortality\": 41.131,\n      \"Net Migration Rate\": -0.991,\n      \"Continent\": \"Africa\",\n      \"UN Region\": \"Eastern Africa\"\n    },\n    {\n      \"Country\": \"Namibia\",\n      \"Happiness score\": 4.459,\n      \"Country_temp\": \"Namibia\",\n      \"ISO3\": \"NAM\",\n      \"GDP per capita (PPP)\": 10038.73827,\n      \"Life Ladder\": 4.4912,\n      \"Social support\": 0.8078,\n      \"Perceptions of corruption\": 0.829,\n      \"Population\": 2530151.0,\n      \"Median Age\": 21.34,\n      \"Total Fertility Rate\": 3.303,\n      \"Life Expectancy\": 59.269,\n      \"Infant Mortality\": 27.663,\n      \"Child Mortality\": 38.574,\n      \"Net Migration Rate\": -1.698,\n      \"Continent\": \"Africa\",\n      \"UN Region\": \"Southern Africa\"\n    },\n    {\n      \"Country\": \"India\",\n      \"Happiness score\": 3.777,\n      \"Country_temp\": \"India\",\n      \"ISO3\": \"IND\",\n      \"GDP per capita (PPP)\": 7241.98423,\n      \"Life Ladder\": 3.5583,\n      \"Social support\": 0.5697,\n      \"Perceptions of corruption\": 0.7568,\n      \"Population\": 1407563842.0,\n      \"Median Age\": 27.603,\n      \"Total Fertility Rate\": 2.031,\n      \"Life Expectancy\": 67.24,\n      \"Infant Mortality\": 25.482,\n      \"Child Mortality\": 31.186,\n      \"Net Migration Rate\": -0.215,\n      \"Continent\": \"Asia\",\n      \"UN Region\": \"Southern Asia\"\n    }\n  ],\n  \"column names\": [\n    \"Country\",\n    \"Happiness score\",\n    \"Country_temp\",\n    \"ISO3\",\n    \"GDP per capita (PPP)\",\n    \"Life Ladder\",\n    \"Social support\",\n    \"Perceptions of corruption\",\n    \"Population\",\n    \"Median Age\",\n    \"Total Fertility Rate\",\n    \"Life Expectancy\",\n    \"Infant Mortality\",\n    \"Child Mortality\",\n    \"Net Migration Rate\",\n    \"Continent\",\n    \"UN Region\"\n  ]\n}\n\nYour Job:\nI am developing a NL to Data Visualization Dataset. \nPlease help me generate natural language utterance for given dataset and constraints.\nDefinition about the Taks:\n- 'utterance' is what a user would say to make a chart. It should be a commands structure. One NL 'utterance' is in one or two sentences. Here are two examples from Commands for reference:\n    Show me a bar graph of the profit for each region.\n    Help me see outliers in IMDB and Rotten Tomatoes ratings.\n- 'given dataset' is in form of column names, column type, range/unique values of the column.\n- 'constraints' are information about the chart that should be included in the utterance. \n    So we can find a reference phrase in the NL utterance that corresponds to the given constraints. \n- 'reference phrase' can be explicit, ambiguous, and by_value. 'ambiguous' means the phrase can map to more than one columns in the dataset, always a hypernym of column names(depending on the dataset values).\n    For example:\n    {\"column\": \"gdpPercap\", \"nl_ref_type\": \"explicit\", \"nl_ref_phrase\": \"GDP per capita\"},\n    {\"column\": [\"country\",\"continent\"], \"nl_ref_type\": \"ambiguous\", \"nl_ref_phrase\": \"region\"}\n    {\"column\": [\"country\",\"country_short_name\"], \"nl_ref_type\": \"ambiguous\", \"nl_ref_phrase\": \"countries\"}\n    {\"c_type\": \"mark\", \"c_name\": \"point chart\", \"nl_ref_type\": \"explicit\", \"nl_ref_phrase\": \"scatter plot\"}\n    {\"c_type\": \"mark\", \"c_name\": \"arc chart\", \"nl_ref_type\": \"explicit\", \"nl_ref_phrase\": \"pie chart\"}\n    {\"c_type\": \"transform\",\"c_name\": \"filter\",\"c_list\": [{\"field\": \"country\",\"oneOf\": [\"Iceland\",\"Norway\"]}],\"nl_ref_type\": \"explicit\",\"nl_ref_phrase\": \"for countries Iceland and Norway\"},\n    {\"c_type\": \"transform\",\"c_name\": \"filter\",\"c_list\": [{\"field\": \"country\",\"oneOf\": [\"Iceland\",\"Norway\"]}],\"nl_ref_type\": \"by_value\",\"nl_ref_phrase\": \"for Iceland and Norway\"},\n- the 'nl_ref_phrase' for 'ambiguous' columns should be equally near all ambiguous columns, not too near to one of the column since it would not be ambiguous.\n    good example: {\"column\": [\"country\",\"region\"], \"nl_ref_type\": \"ambiguous\", \"nl_ref_phrase\": \"location\"}\n    bad example: {\"column\": [\"country\",\"region\"], \"nl_ref_type\": \"ambiguous\", \"nl_ref_phrase\": \"region\"}\n- You only include given constraints and no other information. \n    For example, if a column name is not in the given constraint, it will not be included in the NL utterance.\n    Also, it a chart mark or chart encoding channel is not in the given constraint, it will not be included in the NL utterance.\n- all 'nl_ref_phrase' shoule be included in the 'nl_utterance'. \n\nThe output format is identical to the input format, but fill in the str blanks(\"...\").\n### Input:\n{\n  \"nl_utterance\": \"...\",\n  \"encoded_fields\": [\n    {\n      \"field\": \"GDP per capita (PPP)\",\n      \"type\": \"quantitative\",\n      \"nl_ref_type\": \"explicit\",\n      \"nl_ref_phrase\": \"...\"\n    },\n    {\n      \"field\": \"Infant Mortality\",\n      \"type\": \"quantitative\",\n      \"nl_ref_type\": \"explicit\",\n      \"nl_ref_phrase\": \"...\"\n    },\n    {\n      \"field\": \"Continent\",\n      \"type\": \"nominal\",\n      \"nl_ref_type\": \"explicit\",\n      \"nl_ref_phrase\": \"...\"\n    },\n    {\n      \"field\": \"Population\",\n      \"type\": \"quantitative\",\n      \"nl_ref_type\": \"explicit\",\n      \"nl_ref_phrase\": \"...\"\n    }\n  ],\n  \"constraints\": [\n    {\n      \"c_type\": \"task\",\n      \"c_name\": \"correlation\",\n      \"c_list\": [\n        {\n          \"mark\": \"circle\",\n          \"encoding\": {\n            \"x\": {\n              \"type\": \"quantitative\"\n            },\n            \"y\": {\n              \"type\": \"quantitative\"\n            }\n          }\n        }\n      ],\n      \"nl_ref_type\": \"explicit\",\n      \"nl_ref_phrase\": \"...\"\n    }\n  ]\n}\n\n### Output:"
}