{
  "gpt_result": {
    "nl_utterance": "What is the CAPE for dates ranging from January 1, 1900, to November 1, 2023?",
    "encoded_fields": [
      {
        "field": "CAPE",
        "type": "quantitative",
        "nl_ref_type": "explicit",
        "nl_ref_phrase": "CAPE"
      }
    ],
    "constraints": [
      {
        "c_type": "transform",
        "c_name": "filter",
        "c_list": [
          {
            "field": "Date",
            "range": [
              {
                "year": 1900,
                "month": 1,
                "day": 1
              },
              {
                "year": 2023,
                "month": 11,
                "day": 1
              }
            ]
          }
        ],
        "nl_ref_type": "by_value",
        "nl_ref_phrase": "dates ranging from January 1, 1900, to November 1, 2023"
      }
    ]
  },
  "input": "Dataset Information: {\n  \"data samples\": [\n    {\n      \"Date\": 1871.01,\n      \"year\": 1871,\n      \"month\": 1,\n      \"date2\": \"1871-1-01\",\n      \"Price\": 4.44,\n      \"Dividend\": 0.26,\n      \"Earnings\": 0.4,\n      \"CPI\": 12.46406116,\n      \"R\": 5.32,\n      \"PriceReal\": 105.4820771,\n      \"DividendReal\": 6.176878388,\n      \"RealTotalReturn\": 105.4820771,\n      \"EarningsReal\": 9.502889827,\n      \"CAPE\": NaN\n    },\n    {\n      \"Date\": 1987.11,\n      \"year\": 1987,\n      \"month\": 11,\n      \"date2\": \"1987-11-01\",\n      \"Price\": 245.0,\n      \"Dividend\": 8.76,\n      \"Earnings\": 16.9533,\n      \"CPI\": 115.4,\n      \"R\": 8.86,\n      \"PriceReal\": 628.6595971,\n      \"DividendReal\": 22.47778804,\n      \"RealTotalReturn\": 195181.4624,\n      \"EarningsReal\": 43.50144795,\n      \"CAPE\": 13.59088514\n    },\n    {\n      \"Date\": 1986.06,\n      \"year\": 1986,\n      \"month\": 6,\n      \"date2\": \"1986-6-01\",\n      \"Price\": 245.3,\n      \"Dividend\": 8.1,\n      \"Earnings\": 14.71,\n      \"CPI\": 109.5,\n      \"R\": 7.8,\n      \"PriceReal\": 663.3438443,\n      \"DividendReal\": 21.90413836,\n      \"RealTotalReturn\": 197104.499,\n      \"EarningsReal\": 39.77899694,\n      \"CAPE\": 13.88868863\n    },\n    {\n      \"Date\": 1972.11,\n      \"year\": 1972,\n      \"month\": 11,\n      \"date2\": \"1972-11-01\",\n      \"Price\": 115.1,\n      \"Dividend\": 3.12667,\n      \"Earnings\": 6.32667,\n      \"CPI\": 42.4,\n      \"R\": 6.28,\n      \"PriceReal\": 803.8309823,\n      \"DividendReal\": 21.83591848,\n      \"RealTotalReturn\": 129876.6789,\n      \"EarningsReal\": 44.18395622,\n      \"CAPE\": 18.33889471\n    },\n    {\n      \"Date\": 2010.07,\n      \"year\": 2010,\n      \"month\": 7,\n      \"date2\": \"2010-7-01\",\n      \"Price\": 1079.8,\n      \"Dividend\": 22.14333333,\n      \"Earnings\": 68.68666667,\n      \"CPI\": 218.011,\n      \"R\": 3.01,\n      \"PriceReal\": 1466.628738,\n      \"DividendReal\": 30.07598538,\n      \"RealTotalReturn\": 754079.6739,\n      \"EarningsReal\": 93.29305355,\n      \"CAPE\": 19.66866047\n    }\n  ],\n  \"column names\": [\n    \"Date\",\n    \"year\",\n    \"month\",\n    \"date2\",\n    \"Price\",\n    \"Dividend\",\n    \"Earnings\",\n    \"CPI\",\n    \"R\",\n    \"PriceReal\",\n    \"DividendReal\",\n    \"RealTotalReturn\",\n    \"EarningsReal\",\n    \"CAPE\"\n  ]\n}\n\nYour Job:\nI am developing a NL to Data Visualization Dataset. \nPlease help me generate natural language utterance for given dataset and constraints.\nDefinition about the Taks:\n- 'utterance' is what a user would say to make a chart. It should be a questions structure. One NL 'utterance' is in one or two sentences. Here are two examples from Questions for reference:\n    On average, how much was earned by movies of each genre?\n    What is our profit based on shipping mode by customer segment?\n- 'given dataset' is in form of column names, column type, range/unique values of the column.\n- 'constraints' are information about the chart that should be included in the utterance. \n    So we can find a reference phrase in the NL utterance that corresponds to the given constraints. \n- 'reference phrase' can be explicit, ambiguous, and by_value. 'ambiguous' means the phrase can map to more than one columns in the dataset, always a hypernym of column names(depending on the dataset values).\n    For example:\n    {\"column\": \"gdpPercap\", \"nl_ref_type\": \"explicit\", \"nl_ref_phrase\": \"GDP per capita\"},\n    {\"column\": [\"country\",\"continent\"], \"nl_ref_type\": \"ambiguous\", \"nl_ref_phrase\": \"region\"}\n    {\"column\": [\"country\",\"country_short_name\"], \"nl_ref_type\": \"ambiguous\", \"nl_ref_phrase\": \"countries\"}\n    {\"c_type\": \"mark\", \"c_name\": \"point chart\", \"nl_ref_type\": \"explicit\", \"nl_ref_phrase\": \"scatter plot\"}\n    {\"c_type\": \"mark\", \"c_name\": \"arc chart\", \"nl_ref_type\": \"explicit\", \"nl_ref_phrase\": \"pie chart\"}\n    {\"c_type\": \"transform\",\"c_name\": \"filter\",\"c_list\": [{\"field\": \"country\",\"oneOf\": [\"Iceland\",\"Norway\"]}],\"nl_ref_type\": \"explicit\",\"nl_ref_phrase\": \"for countries Iceland and Norway\"},\n    {\"c_type\": \"transform\",\"c_name\": \"filter\",\"c_list\": [{\"field\": \"country\",\"oneOf\": [\"Iceland\",\"Norway\"]}],\"nl_ref_type\": \"by_value\",\"nl_ref_phrase\": \"for Iceland and Norway\"},\n- the 'nl_ref_phrase' for 'ambiguous' columns should be equally near all ambiguous columns, not too near to one of the column since it would not be ambiguous.\n    good example: {\"column\": [\"country\",\"region\"], \"nl_ref_type\": \"ambiguous\", \"nl_ref_phrase\": \"location\"}\n    bad example: {\"column\": [\"country\",\"region\"], \"nl_ref_type\": \"ambiguous\", \"nl_ref_phrase\": \"region\"}\n- You only include given constraints and no other information. \n    For example, if a column name is not in the given constraint, it will not be included in the NL utterance.\n    Also, it a chart mark or chart encoding channel is not in the given constraint, it will not be included in the NL utterance.\n- all 'nl_ref_phrase' shoule be included in the 'nl_utterance'. \n\nThe output format is identical to the input format, but fill in the str blanks(\"...\").\n### Input:\n{\n  \"nl_utterance\": \"...\",\n  \"encoded_fields\": [\n    {\n      \"field\": \"CAPE\",\n      \"type\": \"quantitative\",\n      \"nl_ref_type\": \"explicit\",\n      \"nl_ref_phrase\": \"...\"\n    }\n  ],\n  \"constraints\": [\n    {\n      \"c_type\": \"transform\",\n      \"c_name\": \"filter\",\n      \"c_list\": [\n        {\n          \"field\": \"Date\",\n          \"range\": [\n            {\n              \"year\": 1900,\n              \"month\": 1,\n              \"day\": 1\n            },\n            {\n              \"year\": 2023,\n              \"month\": 11,\n              \"day\": 1\n            }\n          ]\n        }\n      ],\n      \"nl_ref_type\": \"by_value\",\n      \"nl_ref_phrase\": \"...\"\n    }\n  ]\n}\n\n### Output:"
}