{
  "gpt_result": {
    "nl_utterance": "Can you show the trend of CAPE from the 20th century to now?",
    "encoded_fields": [
      {
        "field": [
          "Date",
          "year",
          "date2"
        ],
        "type": "quantitative",
        "nl_ref_type": "ambiguous",
        "nl_ref_phrase": "time period"
      },
      {
        "field": "CAPE",
        "type": "quantitative",
        "nl_ref_type": "explicit",
        "nl_ref_phrase": "CAPE"
      }
    ],
    "constraints": [
      {
        "c_type": "task",
        "c_name": "trend",
        "c_list": [
          {
            "mark": [
              "bar",
              "line",
              "area"
            ],
            "encoding": {
              "x": {
                "type": "temporal"
              }
            }
          }
        ],
        "nl_ref_type": "explicit",
        "nl_ref_phrase": "trend"
      },
      {
        "c_type": "transform",
        "c_name": "filter",
        "c_list": [
          {
            "field": "Date",
            "range": [
              {
                "year": 1900,
                "month": 1,
                "day": 1
              },
              {
                "year": 2023,
                "month": 11,
                "day": 1
              }
            ]
          }
        ],
        "nl_ref_type": "by_value",
        "nl_ref_phrase": "from the 20th century to now"
      }
    ]
  },
  "input": "Dataset Information: {\n  \"data samples\": [\n    {\n      \"Date\": 1871.01,\n      \"year\": 1871,\n      \"month\": 1,\n      \"date2\": \"1871-1-01\",\n      \"Price\": 4.44,\n      \"Dividend\": 0.26,\n      \"Earnings\": 0.4,\n      \"CPI\": 12.46406116,\n      \"R\": 5.32,\n      \"PriceReal\": 105.4820771,\n      \"DividendReal\": 6.176878388,\n      \"RealTotalReturn\": 105.4820771,\n      \"EarningsReal\": 9.502889827,\n      \"CAPE\": NaN\n    },\n    {\n      \"Date\": 1945.04,\n      \"year\": 1945,\n      \"month\": 4,\n      \"date2\": \"1945-4-01\",\n      \"Price\": 14.28,\n      \"Dividend\": 0.65,\n      \"Earnings\": 0.973333,\n      \"CPI\": 17.8,\n      \"R\": 2.325,\n      \"PriceReal\": 237.5546191,\n      \"DividendReal\": 10.81306039,\n      \"RealTotalReturn\": 12264.78213,\n      \"EarningsReal\": 16.19185925,\n      \"CAPE\": 12.63186724\n    },\n    {\n      \"Date\": 1997.06,\n      \"year\": 1997,\n      \"month\": 6,\n      \"date2\": \"1997-6-01\",\n      \"Price\": 876.29,\n      \"Dividend\": 15.16,\n      \"Earnings\": 40.55,\n      \"CPI\": 160.3,\n      \"R\": 6.49,\n      \"PriceReal\": 1618.712079,\n      \"DividendReal\": 28.00405702,\n      \"RealTotalReturn\": 663892.6052,\n      \"EarningsReal\": 74.90531082,\n      \"CAPE\": 31.25656062\n    },\n    {\n      \"Date\": 1908.04,\n      \"year\": 1908,\n      \"month\": 4,\n      \"date2\": \"1908-4-01\",\n      \"Price\": 7.24,\n      \"Dividend\": 0.4267,\n      \"Earnings\": 0.6333,\n      \"CPI\": 8.658259504,\n      \"R\": 3.8425,\n      \"PriceReal\": 247.6071847,\n      \"DividendReal\": 14.59309195,\n      \"RealTotalReturn\": 1598.449682,\n      \"EarningsReal\": 21.65878868,\n      \"CAPE\": 12.44888916\n    },\n    {\n      \"Date\": 1881.08,\n      \"year\": 1881,\n      \"month\": 8,\n      \"date2\": \"1881-8-01\",\n      \"Price\": 6.2,\n      \"Dividend\": 0.3,\n      \"Earnings\": 0.4567,\n      \"CPI\": 9.8,\n      \"R\": 3.653333333,\n      \"PriceReal\": 187.3358469,\n      \"DividendReal\": 9.064637755,\n      \"RealTotalReturn\": 355.799021,\n      \"EarningsReal\": 13.79940021,\n      \"CAPE\": 17.28624355\n    }\n  ],\n  \"column names\": [\n    \"Date\",\n    \"year\",\n    \"month\",\n    \"date2\",\n    \"Price\",\n    \"Dividend\",\n    \"Earnings\",\n    \"CPI\",\n    \"R\",\n    \"PriceReal\",\n    \"DividendReal\",\n    \"RealTotalReturn\",\n    \"EarningsReal\",\n    \"CAPE\"\n  ]\n}\n\nYour Job:\nI am developing a NL to Data Visualization Dataset. \nPlease help me generate natural language utterance for given dataset and constraints.\nDefinition about the Taks:\n- 'utterance' is what a user would say to make a chart. It should be a questions structure. One NL 'utterance' is in one or two sentences. Here are two examples from Questions for reference:\n    Have cars gotten lighter over time?\n    What is our profit based on shipping mode by customer segment?\n- 'given dataset' is in form of column names, column type, range/unique values of the column.\n- 'constraints' are information about the chart that should be included in the utterance. \n    So we can find a reference phrase in the NL utterance that corresponds to the given constraints. \n- 'reference phrase' can be explicit, ambiguous, and by_value. 'ambiguous' means the phrase can map to more than one columns in the dataset, always a hypernym of column names(depending on the dataset values).\n    For example:\n    {\"column\": \"gdpPercap\", \"nl_ref_type\": \"explicit\", \"nl_ref_phrase\": \"GDP per capita\"},\n    {\"column\": [\"country\",\"continent\"], \"nl_ref_type\": \"ambiguous\", \"nl_ref_phrase\": \"region\"}\n    {\"column\": [\"country\",\"country_short_name\"], \"nl_ref_type\": \"ambiguous\", \"nl_ref_phrase\": \"countries\"}\n    {\"c_type\": \"mark\", \"c_name\": \"point chart\", \"nl_ref_type\": \"explicit\", \"nl_ref_phrase\": \"scatter plot\"}\n    {\"c_type\": \"mark\", \"c_name\": \"arc chart\", \"nl_ref_type\": \"explicit\", \"nl_ref_phrase\": \"pie chart\"}\n    {\"c_type\": \"transform\",\"c_name\": \"filter\",\"c_list\": [{\"field\": \"country\",\"oneOf\": [\"Iceland\",\"Norway\"]}],\"nl_ref_type\": \"explicit\",\"nl_ref_phrase\": \"for countries Iceland and Norway\"},\n    {\"c_type\": \"transform\",\"c_name\": \"filter\",\"c_list\": [{\"field\": \"country\",\"oneOf\": [\"Iceland\",\"Norway\"]}],\"nl_ref_type\": \"by_value\",\"nl_ref_phrase\": \"for Iceland and Norway\"},\n- the 'nl_ref_phrase' for 'ambiguous' columns should be equally near all ambiguous columns, not too near to one of the column since it would not be ambiguous.\n    good example: {\"column\": [\"country\",\"region\"], \"nl_ref_type\": \"ambiguous\", \"nl_ref_phrase\": \"location\"}\n    bad example: {\"column\": [\"country\",\"region\"], \"nl_ref_type\": \"ambiguous\", \"nl_ref_phrase\": \"region\"}\n- You only include given constraints and no other information. \n    For example, if a column name is not in the given constraint, it will not be included in the NL utterance.\n    Also, it a chart mark or chart encoding channel is not in the given constraint, it will not be included in the NL utterance.\n- all 'nl_ref_phrase' shoule be included in the 'nl_utterance'. \n\nThe output format is identical to the input format, but fill in the str blanks(\"...\").\n### Input:\n{\n  \"nl_utterance\": \"...\",\n  \"encoded_fields\": [\n    {\n      \"field\": [\n        \"Date\",\n        \"year\",\n        \"date2\"\n      ],\n      \"type\": \"quantitative\",\n      \"nl_ref_type\": \"ambiguous\",\n      \"nl_ref_phrase\": \"...\"\n    },\n    {\n      \"field\": \"CAPE\",\n      \"type\": \"quantitative\",\n      \"nl_ref_type\": \"explicit\",\n      \"nl_ref_phrase\": \"...\"\n    }\n  ],\n  \"constraints\": [\n    {\n      \"c_type\": \"task\",\n      \"c_name\": \"trend\",\n      \"c_list\": [\n        {\n          \"mark\": [\n            \"bar\",\n            \"line\",\n            \"area\"\n          ],\n          \"encoding\": {\n            \"x\": {\n              \"type\": \"temporal\"\n            }\n          }\n        }\n      ],\n      \"nl_ref_type\": \"explicit\",\n      \"nl_ref_phrase\": \"...\"\n    },\n    {\n      \"c_type\": \"transform\",\n      \"c_name\": \"filter\",\n      \"c_list\": [\n        {\n          \"field\": \"Date\",\n          \"range\": [\n            {\n              \"year\": 1900,\n              \"month\": 1,\n              \"day\": 1\n            },\n            {\n              \"year\": 2023,\n              \"month\": 11,\n              \"day\": 1\n            }\n          ]\n        }\n      ],\n      \"nl_ref_type\": \"by_value\",\n      \"nl_ref_phrase\": \"...\"\n    }\n  ]\n}\n\n### Output:"
}