{
  "gpt_result": {
    "nl_utterance": "What are the shares of upward, downward, and level changes, as well as overall changes, for values where the upward share is less than 0.25 and the downward share is also less than 0.25?",
    "encoded_fields": [
      {
        "field": [
          "up_sh",
          "down_sh",
          "level_sh",
          "change_sh"
        ],
        "type": "quantitative",
        "nl_ref_type": "ambiguous",
        "nl_ref_phrase": "shares of upward, downward, and level changes, as well as overall changes"
      },
      {
        "field": "down_sh",
        "type": "quantitative",
        "nl_ref_type": "explicit",
        "nl_ref_phrase": "downward share"
      }
    ],
    "constraints": [
      {
        "c_type": "transform",
        "c_name": "filter",
        "c_list": [
          {
            "field": "up_sh",
            "lt": 0.25
          }
        ],
        "nl_ref_type": "by_value",
        "nl_ref_phrase": "where the upward share is less than 0.25"
      },
      {
        "c_type": "transform",
        "c_name": "filter",
        "c_list": [
          {
            "field": "down_sh",
            "lt": 0.25
          }
        ],
        "nl_ref_type": "by_value",
        "nl_ref_phrase": "and the downward share is also less than 0.25"
      }
    ]
  },
  "input": "Dataset Information: {\n  \"data samples\": [\n    {\n      \"date\": 1.0,\n      \"division\": 4,\n      \"up\": 0,\n      \"down\": 0,\n      \"level\": 0,\n      \"up_ch\": NaN,\n      \"down_ch\": NaN,\n      \"total\": 0,\n      \"up_sh\": NaN,\n      \"down_sh\": NaN,\n      \"level_sh\": NaN,\n      \"change_sh\": NaN,\n      \"division_s\": \"Housing, Water, Electricity, Gas and other fuels\",\n      \"division_sh\": \"Housing & utilities\",\n      \"date2\": \"01-02-1988\",\n      \"date4\": \"1988-02-01\",\n      \"year\": 1988.0,\n      \"month\": 2.0,\n      \"quarter\": 1.0\n    },\n    {\n      \"date\": 18.0,\n      \"division\": 3,\n      \"up\": 501,\n      \"down\": 741,\n      \"level\": 4832,\n      \"up_ch\": 0.11589544,\n      \"down_ch\": -0.16680567,\n      \"total\": 6074,\n      \"up_sh\": 0.08248271,\n      \"down_sh\": 0.12199539,\n      \"level_sh\": 0.79552191,\n      \"change_sh\": 0.2044781,\n      \"division_s\": \"Clothing and footwear\",\n      \"division_sh\": \"Clothing and footwear\",\n      \"date2\": \"01-07-1989\",\n      \"date4\": \"1989-07-01\",\n      \"year\": 1989.0,\n      \"month\": 7.0,\n      \"quarter\": 3.0\n    },\n    {\n      \"date\": 375.0,\n      \"division\": 11,\n      \"up\": 772,\n      \"down\": 153,\n      \"level\": 8137,\n      \"up_ch\": 0.05775395,\n      \"down_ch\": -0.065359451,\n      \"total\": 9062,\n      \"up_sh\": 0.085190907,\n      \"down_sh\": 0.01688369,\n      \"level_sh\": 0.89792538,\n      \"change_sh\": 0.10207459,\n      \"division_s\": \"Restaurants and Hotels\",\n      \"division_sh\": \"Restaurants & Hotels\",\n      \"date2\": \"01-04-2019\",\n      \"date4\": \"2019-04-01\",\n      \"year\": 2019.0,\n      \"month\": 4.0,\n      \"quarter\": 2.0\n    },\n    {\n      \"date\": 167.0,\n      \"division\": 2,\n      \"up\": 148,\n      \"down\": 367,\n      \"level\": 3234,\n      \"up_ch\": 0.032432646,\n      \"down_ch\": -0.085287869,\n      \"total\": 3749,\n      \"up_sh\": 0.039477196,\n      \"down_sh\": 0.097892769,\n      \"level_sh\": 0.86263001,\n      \"change_sh\": 0.13736996,\n      \"division_s\": \"Alcoholic beverages, tobacco and narcotics\",\n      \"division_sh\": \"Alcohol & tobacco\",\n      \"date2\": \"01-12-2001\",\n      \"date4\": \"2001-12-01\",\n      \"year\": 2001.0,\n      \"month\": 12.0,\n      \"quarter\": 4.0\n    },\n    {\n      \"date\": 122.0,\n      \"division\": 1,\n      \"up\": 3231,\n      \"down\": 2601,\n      \"level\": 16594,\n      \"up_ch\": 0.10344822,\n      \"down_ch\": -0.13793108,\n      \"total\": 22426,\n      \"up_sh\": 0.14407384,\n      \"down_sh\": 0.11598145,\n      \"level_sh\": 0.7399447,\n      \"change_sh\": 0.2600553,\n      \"division_s\": \"Food and non-alcoholic beverages\",\n      \"division_sh\": \"Food & drink\",\n      \"date2\": \"01-03-1998\",\n      \"date4\": \"1998-03-01\",\n      \"year\": 1998.0,\n      \"month\": 3.0,\n      \"quarter\": 1.0\n    }\n  ],\n  \"column names\": [\n    \"date\",\n    \"division\",\n    \"up\",\n    \"down\",\n    \"level\",\n    \"up_ch\",\n    \"down_ch\",\n    \"total\",\n    \"up_sh\",\n    \"down_sh\",\n    \"level_sh\",\n    \"change_sh\",\n    \"division_s\",\n    \"division_sh\",\n    \"date2\",\n    \"date4\",\n    \"year\",\n    \"month\",\n    \"quarter\"\n  ]\n}\n\nYour Job:\nI am developing a NL to Data Visualization Dataset. \nPlease help me generate natural language utterance for given dataset and constraints.\nDefinition about the Taks:\n- 'utterance' is what a user would say to make a chart. It should be a questions structure. One NL 'utterance' is in one or two sentences. Here are two examples from Questions for reference:\n    Are IMDb rating and rotten tomatoes rating related?\n    How much do various cars weigh?\n- 'given dataset' is in form of column names, column type, range/unique values of the column.\n- 'constraints' are information about the chart that should be included in the utterance. \n    So we can find a reference phrase in the NL utterance that corresponds to the given constraints. \n- 'reference phrase' can be explicit, ambiguous, and by_value. 'ambiguous' means the phrase can map to more than one columns in the dataset, always a hypernym of column names(depending on the dataset values).\n    For example:\n    {\"column\": \"gdpPercap\", \"nl_ref_type\": \"explicit\", \"nl_ref_phrase\": \"GDP per capita\"},\n    {\"column\": [\"country\",\"continent\"], \"nl_ref_type\": \"ambiguous\", \"nl_ref_phrase\": \"region\"}\n    {\"column\": [\"country\",\"country_short_name\"], \"nl_ref_type\": \"ambiguous\", \"nl_ref_phrase\": \"countries\"}\n    {\"c_type\": \"mark\", \"c_name\": \"point chart\", \"nl_ref_type\": \"explicit\", \"nl_ref_phrase\": \"scatter plot\"}\n    {\"c_type\": \"mark\", \"c_name\": \"arc chart\", \"nl_ref_type\": \"explicit\", \"nl_ref_phrase\": \"pie chart\"}\n    {\"c_type\": \"transform\",\"c_name\": \"filter\",\"c_list\": [{\"field\": \"country\",\"oneOf\": [\"Iceland\",\"Norway\"]}],\"nl_ref_type\": \"explicit\",\"nl_ref_phrase\": \"for countries Iceland and Norway\"},\n    {\"c_type\": \"transform\",\"c_name\": \"filter\",\"c_list\": [{\"field\": \"country\",\"oneOf\": [\"Iceland\",\"Norway\"]}],\"nl_ref_type\": \"by_value\",\"nl_ref_phrase\": \"for Iceland and Norway\"},\n- the 'nl_ref_phrase' for 'ambiguous' columns should be equally near all ambiguous columns, not too near to one of the column since it would not be ambiguous.\n    good example: {\"column\": [\"country\",\"region\"], \"nl_ref_type\": \"ambiguous\", \"nl_ref_phrase\": \"location\"}\n    bad example: {\"column\": [\"country\",\"region\"], \"nl_ref_type\": \"ambiguous\", \"nl_ref_phrase\": \"region\"}\n- You only include given constraints and no other information. \n    For example, if a column name is not in the given constraint, it will not be included in the NL utterance.\n    Also, it a chart mark or chart encoding channel is not in the given constraint, it will not be included in the NL utterance.\n- all 'nl_ref_phrase' shoule be included in the 'nl_utterance'. \n\nThe output format is identical to the input format, but fill in the str blanks(\"...\").\n### Input:\n{\n  \"nl_utterance\": \"...\",\n  \"encoded_fields\": [\n    {\n      \"field\": [\n        \"up_sh\",\n        \"down_sh\",\n        \"level_sh\",\n        \"change_sh\"\n      ],\n      \"type\": \"quantitative\",\n      \"nl_ref_type\": \"ambiguous\",\n      \"nl_ref_phrase\": \"...\"\n    },\n    {\n      \"field\": \"down_sh\",\n      \"type\": \"quantitative\",\n      \"nl_ref_type\": \"explicit\",\n      \"nl_ref_phrase\": \"...\"\n    }\n  ],\n  \"constraints\": [\n    {\n      \"c_type\": \"transform\",\n      \"c_name\": \"filter\",\n      \"c_list\": [\n        {\n          \"field\": \"up_sh\",\n          \"lt\": 0.25\n        }\n      ],\n      \"nl_ref_type\": \"by_value\",\n      \"nl_ref_phrase\": \"...\"\n    },\n    {\n      \"c_type\": \"transform\",\n      \"c_name\": \"filter\",\n      \"c_list\": [\n        {\n          \"field\": \"down_sh\",\n          \"lt\": 0.25\n        }\n      ],\n      \"nl_ref_type\": \"by_value\",\n      \"nl_ref_phrase\": \"...\"\n    }\n  ]\n}\n\n### Output:"
}