{
  "gpt_result": {
    "nl_utterance": "Show me the trend of the total amount in USD over the years using a bar, line, or area chart.",
    "encoded_fields": [
      {
        "field": "Year",
        "type": "quantitative",
        "nl_ref_type": "explicit",
        "nl_ref_phrase": "over the years"
      },
      {
        "field": "Totals_USD",
        "type": "quantitative",
        "nl_ref_type": "explicit",
        "nl_ref_phrase": "total amount in USD"
      }
    ],
    "constraints": [
      {
        "c_type": "task",
        "c_name": "trend",
        "c_list": [
          {
            "mark": [
              "bar",
              "line",
              "area"
            ],
            "encoding": {
              "x": {
                "type": "temporal"
              }
            }
          }
        ],
        "nl_ref_type": "explicit",
        "nl_ref_phrase": "trend"
      },
      {
        "c_type": "transform",
        "c_name": "aggregate",
        "c_list": [
          {
            "field": "Totals_USD",
            "aggregate": "sum"
          }
        ],
        "nl_ref_type": "explicit",
        "nl_ref_phrase": "using a bar, line, or area chart"
      }
    ]
  },
  "input": "Dataset Information: {\n  \"data samples\": [\n    {\n      \"Date\": \"08/31/2022\",\n      \"GRA Purchases\": 93769635059,\n      \"PRGT 1/2/\": 15254184552,\n      \"Totals\": 109024000000.0,\n      \"Totals_bil_SDR\": 109.02,\n      \"Year\": 2022,\n      \"Conversion rate\": 1.28252,\n      \"Unnamed: 7\": NaN,\n      \"Totals_USD\": 139.8203304,\n      \"World GDP\": 86700000000000.0,\n      \"World aggregate real GDP (billion USD)\": 86652.9,\n      \"Unnamed: 11\": 0.001258123,\n      \"Total_USD/GDP\": 0.001613568,\n      \"Percentage\": 0.161356781,\n      \"Unnamed: 14\": NaN,\n      \"World nominal GDP\": 98100000000000.0,\n      \"Unnamed: 16\": 98100,\n      \"Unnamed: 17\": 0.001425284,\n      \"Percentages\": 0.142528369\n    },\n    {\n      \"Date\": \"12/31/1995\",\n      \"GRA Purchases\": 35929173412,\n      \"PRGT 1/2/\": 5657438528,\n      \"Totals\": 41586611940.0,\n      \"Totals_bil_SDR\": 41.59,\n      \"Year\": 1995,\n      \"Conversion rate\": 1.48649,\n      \"Unnamed: 7\": NaN,\n      \"Totals_USD\": 61.8231191,\n      \"World GDP\": 40300000000000.0,\n      \"World aggregate real GDP (billion USD)\": 40280.1,\n      \"Unnamed: 11\": 0.00103252,\n      \"Total_USD/GDP\": 0.00153483,\n      \"Percentage\": 0.153483033,\n      \"Unnamed: 14\": NaN,\n      \"World nominal GDP\": 31044000000000.0,\n      \"Unnamed: 16\": 31044,\n      \"Unnamed: 17\": 0.001991468,\n      \"Percentages\": 0.199146757\n    },\n    {\n      \"Date\": \"12/31/1993\",\n      \"GRA Purchases\": 25196745031,\n      \"PRGT 1/2/\": 3942792899,\n      \"Totals\": 29139537930.0,\n      \"Totals_bil_SDR\": 29.14,\n      \"Year\": 1993,\n      \"Conversion rate\": 1.37356,\n      \"Unnamed: 7\": NaN,\n      \"Totals_USD\": 40.0255384,\n      \"World GDP\": 37800000000000.0,\n      \"World aggregate real GDP (billion USD)\": 37821.8,\n      \"Unnamed: 11\": 0.000770455,\n      \"Total_USD/GDP\": 0.001058266,\n      \"Percentage\": 0.105826635,\n      \"Unnamed: 14\": NaN,\n      \"World nominal GDP\": 25822000000000.0,\n      \"Unnamed: 16\": 25822,\n      \"Unnamed: 17\": 0.001550056,\n      \"Percentages\": 0.15500557\n    }\n  ],\n  \"column names\": [\n    \"Date\",\n    \"GRA Purchases\",\n    \"PRGT 1/2/\",\n    \"Totals\",\n    \"Totals_bil_SDR\",\n    \"Year\",\n    \"Conversion rate\",\n    \"Unnamed: 7\",\n    \"Totals_USD\",\n    \"World GDP\",\n    \"World aggregate real GDP (billion USD)\",\n    \"Unnamed: 11\",\n    \"Total_USD/GDP\",\n    \"Percentage\",\n    \"Unnamed: 14\",\n    \"World nominal GDP\",\n    \"Unnamed: 16\",\n    \"Unnamed: 17\",\n    \"Percentages\"\n  ]\n}\n\nYour Job:\nI am developing a NL to Data Visualization Dataset. \nPlease help me generate natural language utterance for given dataset and constraints.\nDefinition about the Taks:\n- 'utterance' is what a user would say to make a chart, it can be a question or a command. One NL 'utterance' is in one or two sentences. \n- 'given dataset' is in form of column names, column type, range/unique values of the column.\n- 'constraints' are information about the chart that should be included in the utterance. \n    So we can find a reference phrase in the NL utterance that corresponds to the given constraints. \n- 'reference phrase' can be explicit, ambiguous, and by_value. 'ambiguous' means the phrase can map to more than one columns in the dataset, always a hypernym of column names(depending on the dataset values).\n    For example:\n    {\"column\": \"gdpPercap\", \"nl_ref_type\": \"explicit\", \"nl_ref_phrase\": \"GDP per capita\"},\n    {\"column\": [\"country\",\"continent\"], \"nl_ref_type\": \"ambiguous\", \"nl_ref_phrase\": \"region\"}\n    {\"column\": [\"country\",\"country_short_name\"], \"nl_ref_type\": \"ambiguous\", \"nl_ref_phrase\": \"countries\"}\n    {\"c_type\": \"mark\", \"c_name\": \"point chart\", \"nl_ref_type\": \"explicit\", \"nl_ref_phrase\": \"scatter plot\"}\n    {\"c_type\": \"mark\", \"c_name\": \"arc chart\", \"nl_ref_type\": \"explicit\", \"nl_ref_phrase\": \"pie chart\"}\n    {\"c_type\": \"transform\",\"c_name\": \"filter\",\"c_list\": [{\"field\": \"country\",\"oneOf\": [\"Iceland\",\"Norway\"]}],\"nl_ref_type\": \"explicit\",\"nl_ref_phrase\": \"for countries Iceland and Norway\"},\n    {\"c_type\": \"transform\",\"c_name\": \"filter\",\"c_list\": [{\"field\": \"country\",\"oneOf\": [\"Iceland\",\"Norway\"]}],\"nl_ref_type\": \"by_value\",\"nl_ref_phrase\": \"for Iceland and Norway\"},\n- the 'nl_ref_phrase' for 'ambiguous' columns should be equally near all ambiguous columns, not too near to one of the column since it would not be ambiguous.\n    good example: {\"column\": [\"country\",\"region\"], \"nl_ref_type\": \"ambiguous\", \"nl_ref_phrase\": \"location\"}\n    bad example: {\"column\": [\"country\",\"region\"], \"nl_ref_type\": \"ambiguous\", \"nl_ref_phrase\": \"region\"}\n- You only include given constraints and no other information. \n    For example, if a column name is not in the given constraint, it will not be included in the NL utterance.\n    Also, it a chart mark or chart encoding channel is not in the given constraint, it will not be included in the NL utterance.\n- all 'nl_ref_phrase' shoule be included in the 'nl_utterance'. \n\nThe output format is identical to the input format, but fill in the str blanks(\"...\").\n### Input:\n{\n  \"nl_utterance\": \"...\",\n  \"encoded_fields\": [\n    {\n      \"field\": \"Year\",\n      \"type\": \"quantitative\",\n      \"nl_ref_type\": \"explicit\",\n      \"nl_ref_phrase\": \"...\"\n    },\n    {\n      \"field\": \"Totals_USD\",\n      \"type\": \"quantitative\",\n      \"nl_ref_type\": \"explicit\",\n      \"nl_ref_phrase\": \"...\"\n    }\n  ],\n  \"constraints\": [\n    {\n      \"c_type\": \"task\",\n      \"c_name\": \"trend\",\n      \"c_list\": [\n        {\n          \"mark\": [\n            \"bar\",\n            \"line\",\n            \"area\"\n          ],\n          \"encoding\": {\n            \"x\": {\n              \"type\": \"temporal\"\n            }\n          }\n        }\n      ],\n      \"nl_ref_type\": \"explicit\",\n      \"nl_ref_phrase\": \"...\"\n    },\n    {\n      \"c_type\": \"transform\",\n      \"c_name\": \"aggregate\",\n      \"c_list\": [\n        {\n          \"field\": \"Totals_USD\",\n          \"aggregate\": \"sum\"\n        }\n      ],\n      \"nl_ref_type\": \"explicit\",\n      \"nl_ref_phrase\": \"...\"\n    }\n  ]\n}\n\n### Output:"
}