{
  "gpt_result": {
    "nl_utterance": "Create a rect chart to visualize the housing shares with a focus on down share, where the up share is less than 0.25 and the down share is also less than 0.25.",
    "encoded_fields": [
      {
        "field": [
          "up_sh",
          "down_sh",
          "level_sh",
          "change_sh"
        ],
        "type": "quantitative",
        "nl_ref_type": "ambiguous",
        "nl_ref_phrase": "housing shares"
      },
      {
        "field": "down_sh",
        "type": "quantitative",
        "nl_ref_type": "explicit",
        "nl_ref_phrase": "focus on down share"
      }
    ],
    "constraints": [
      {
        "c_type": "mark",
        "c_name": "rect chart",
        "c_list": [
          {
            "mark": "rect",
            "encoding": {
              "x": {},
              "y": {},
              "color": {
                "type": "quantitative"
              },
              "column": {
                "ignore": true,
                "type": "nominal"
              },
              "row": {
                "ignore": true,
                "type": "nominal"
              }
            },
            "unique_map": {
              "(x,y)": "color"
            }
          }
        ],
        "nl_ref_type": "explicit",
        "nl_ref_phrase": "rect chart"
      },
      {
        "c_type": "transform",
        "c_name": "filter",
        "c_list": [
          {
            "field": "up_sh",
            "lt": 0.25
          }
        ],
        "nl_ref_type": "by_value",
        "nl_ref_phrase": "where the up share is less than 0.25"
      },
      {
        "c_type": "transform",
        "c_name": "filter",
        "c_list": [
          {
            "field": "down_sh",
            "lt": 0.25
          }
        ],
        "nl_ref_type": "by_value",
        "nl_ref_phrase": "and the down share is also less than 0.25"
      }
    ]
  },
  "input": "Dataset Information: {\n  \"data samples\": [\n    {\n      \"date\": 1.0,\n      \"division\": 4,\n      \"up\": 0,\n      \"down\": 0,\n      \"level\": 0,\n      \"up_ch\": NaN,\n      \"down_ch\": NaN,\n      \"total\": 0,\n      \"up_sh\": NaN,\n      \"down_sh\": NaN,\n      \"level_sh\": NaN,\n      \"change_sh\": NaN,\n      \"division_s\": \"Housing, Water, Electricity, Gas and other fuels\",\n      \"division_sh\": \"Housing & utilities\",\n      \"date2\": \"01-02-1988\",\n      \"date4\": \"1988-02-01\",\n      \"year\": 1988.0,\n      \"month\": 2.0,\n      \"quarter\": 1.0\n    },\n    {\n      \"date\": 92.0,\n      \"division\": 12,\n      \"up\": 529,\n      \"down\": 157,\n      \"level\": 6164,\n      \"up_ch\": 0.077519402,\n      \"down_ch\": -0.068927184,\n      \"total\": 6850,\n      \"up_sh\": 0.077226274,\n      \"down_sh\": 0.022919709,\n      \"level_sh\": 0.899854,\n      \"change_sh\": 0.10014598,\n      \"division_s\": \"Miscellaneous goods and services\",\n      \"division_sh\": \"Misc\",\n      \"date2\": \"01-09-1995\",\n      \"date4\": \"1995-09-01\",\n      \"year\": 1995.0,\n      \"month\": 9.0,\n      \"quarter\": 3.0\n    },\n    {\n      \"date\": 186.0,\n      \"division\": 4,\n      \"up\": 202,\n      \"down\": 95,\n      \"level\": 3230,\n      \"up_ch\": 0.085714325,\n      \"down_ch\": -0.096604705,\n      \"total\": 3527,\n      \"up_sh\": 0.057272468,\n      \"down_sh\": 0.026935073,\n      \"level_sh\": 0.91579247,\n      \"change_sh\": 0.084207542,\n      \"division_s\": \"Housing, Water, Electricity, Gas and other fuels\",\n      \"division_sh\": \"Housing & utilities\",\n      \"date2\": \"01-07-2003\",\n      \"date4\": \"2003-07-01\",\n      \"year\": 2003.0,\n      \"month\": 7.0,\n      \"quarter\": 3.0\n    },\n    {\n      \"date\": 198.0,\n      \"division\": 2,\n      \"up\": 966,\n      \"down\": 365,\n      \"level\": 2808,\n      \"up_ch\": 0.073455773,\n      \"down_ch\": -0.074303411,\n      \"total\": 4139,\n      \"up_sh\": 0.23338971,\n      \"down_sh\": 0.088185549,\n      \"level_sh\": 0.67842472,\n      \"change_sh\": 0.32157525,\n      \"division_s\": \"Alcoholic beverages, tobacco and narcotics\",\n      \"division_sh\": \"Alcohol & tobacco\",\n      \"date2\": \"01-07-2004\",\n      \"date4\": \"2004-07-01\",\n      \"year\": 2004.0,\n      \"month\": 7.0,\n      \"quarter\": 3.0\n    },\n    {\n      \"date\": 80.0,\n      \"division\": 11,\n      \"up\": 678,\n      \"down\": 286,\n      \"level\": 10776,\n      \"up_ch\": 0.0588235,\n      \"down_ch\": -0.050000012,\n      \"total\": 11740,\n      \"up_sh\": 0.057751279,\n      \"down_sh\": 0.024361158,\n      \"level_sh\": 0.91788757,\n      \"change_sh\": 0.082112439,\n      \"division_s\": \"Restaurants and Hotels\",\n      \"division_sh\": \"Restaurants & Hotels\",\n      \"date2\": \"01-09-1994\",\n      \"date4\": \"1994-09-01\",\n      \"year\": 1994.0,\n      \"month\": 9.0,\n      \"quarter\": 3.0\n    }\n  ],\n  \"column names\": [\n    \"date\",\n    \"division\",\n    \"up\",\n    \"down\",\n    \"level\",\n    \"up_ch\",\n    \"down_ch\",\n    \"total\",\n    \"up_sh\",\n    \"down_sh\",\n    \"level_sh\",\n    \"change_sh\",\n    \"division_s\",\n    \"division_sh\",\n    \"date2\",\n    \"date4\",\n    \"year\",\n    \"month\",\n    \"quarter\"\n  ]\n}\n\nYour Job:\nI am developing a NL to Data Visualization Dataset. \nPlease help me generate natural language utterance for given dataset and constraints.\nDefinition about the Taks:\n- 'utterance' is what a user would say to make a chart. It should be a commands structure. One NL 'utterance' is in one or two sentences. Here are two examples from Commands for reference:\n    Give me the number of movies by running time.\n    Create a line chart showing order date and sum of sales, divided by category.\n- 'given dataset' is in form of column names, column type, range/unique values of the column.\n- 'constraints' are information about the chart that should be included in the utterance. \n    So we can find a reference phrase in the NL utterance that corresponds to the given constraints. \n- 'reference phrase' can be explicit, ambiguous, and by_value. 'ambiguous' means the phrase can map to more than one columns in the dataset, always a hypernym of column names(depending on the dataset values).\n    For example:\n    {\"column\": \"gdpPercap\", \"nl_ref_type\": \"explicit\", \"nl_ref_phrase\": \"GDP per capita\"},\n    {\"column\": [\"country\",\"continent\"], \"nl_ref_type\": \"ambiguous\", \"nl_ref_phrase\": \"region\"}\n    {\"column\": [\"country\",\"country_short_name\"], \"nl_ref_type\": \"ambiguous\", \"nl_ref_phrase\": \"countries\"}\n    {\"c_type\": \"mark\", \"c_name\": \"point chart\", \"nl_ref_type\": \"explicit\", \"nl_ref_phrase\": \"scatter plot\"}\n    {\"c_type\": \"mark\", \"c_name\": \"arc chart\", \"nl_ref_type\": \"explicit\", \"nl_ref_phrase\": \"pie chart\"}\n    {\"c_type\": \"transform\",\"c_name\": \"filter\",\"c_list\": [{\"field\": \"country\",\"oneOf\": [\"Iceland\",\"Norway\"]}],\"nl_ref_type\": \"explicit\",\"nl_ref_phrase\": \"for countries Iceland and Norway\"},\n    {\"c_type\": \"transform\",\"c_name\": \"filter\",\"c_list\": [{\"field\": \"country\",\"oneOf\": [\"Iceland\",\"Norway\"]}],\"nl_ref_type\": \"by_value\",\"nl_ref_phrase\": \"for Iceland and Norway\"},\n- the 'nl_ref_phrase' for 'ambiguous' columns should be equally near all ambiguous columns, not too near to one of the column since it would not be ambiguous.\n    good example: {\"column\": [\"country\",\"region\"], \"nl_ref_type\": \"ambiguous\", \"nl_ref_phrase\": \"location\"}\n    bad example: {\"column\": [\"country\",\"region\"], \"nl_ref_type\": \"ambiguous\", \"nl_ref_phrase\": \"region\"}\n- You only include given constraints and no other information. \n    For example, if a column name is not in the given constraint, it will not be included in the NL utterance.\n    Also, it a chart mark or chart encoding channel is not in the given constraint, it will not be included in the NL utterance.\n- all 'nl_ref_phrase' shoule be included in the 'nl_utterance'. \n\nThe output format is identical to the input format, but fill in the str blanks(\"...\").\n### Input:\n{\n  \"nl_utterance\": \"...\",\n  \"encoded_fields\": [\n    {\n      \"field\": [\n        \"up_sh\",\n        \"down_sh\",\n        \"level_sh\",\n        \"change_sh\"\n      ],\n      \"type\": \"quantitative\",\n      \"nl_ref_type\": \"ambiguous\",\n      \"nl_ref_phrase\": \"...\"\n    },\n    {\n      \"field\": \"down_sh\",\n      \"type\": \"quantitative\",\n      \"nl_ref_type\": \"explicit\",\n      \"nl_ref_phrase\": \"...\"\n    }\n  ],\n  \"constraints\": [\n    {\n      \"c_type\": \"mark\",\n      \"c_name\": \"rect chart\",\n      \"c_list\": [\n        {\n          \"mark\": \"rect\",\n          \"encoding\": {\n            \"x\": {},\n            \"y\": {},\n            \"color\": {\n              \"type\": \"quantitative\"\n            },\n            \"column\": {\n              \"ignore\": true,\n              \"type\": \"nominal\"\n            },\n            \"row\": {\n              \"ignore\": true,\n              \"type\": \"nominal\"\n            }\n          },\n          \"unique_map\": {\n            \"(x,y)\": \"color\"\n          }\n        }\n      ],\n      \"nl_ref_type\": \"explicit\",\n      \"nl_ref_phrase\": \"...\"\n    },\n    {\n      \"c_type\": \"transform\",\n      \"c_name\": \"filter\",\n      \"c_list\": [\n        {\n          \"field\": \"up_sh\",\n          \"lt\": 0.25\n        }\n      ],\n      \"nl_ref_type\": \"by_value\",\n      \"nl_ref_phrase\": \"...\"\n    },\n    {\n      \"c_type\": \"transform\",\n      \"c_name\": \"filter\",\n      \"c_list\": [\n        {\n          \"field\": \"down_sh\",\n          \"lt\": 0.25\n        }\n      ],\n      \"nl_ref_type\": \"by_value\",\n      \"nl_ref_phrase\": \"...\"\n    }\n  ]\n}\n\n### Output:"
}