{
  "gpt_result": {
    "nl_utterance": "Create a chart for the date showing the maximum of max temperature and minimum temperature.",
    "encoded_fields": [
      {
        "field": "date",
        "type": "temporal",
        "nl_ref_type": "explicit",
        "nl_ref_phrase": "date"
      },
      {
        "field": [
          "temp_max",
          "temp_min"
        ],
        "type": "quantitative",
        "nl_ref_type": "ambiguous",
        "nl_ref_phrase": "temperature"
      }
    ],
    "constraints": [
      {
        "c_type": "transform",
        "c_name": "aggregate",
        "c_list": [
          {
            "field": "temp_max",
            "aggregate": "max"
          }
        ],
        "nl_ref_type": "explicit",
        "nl_ref_phrase": "maximum of max temperature"
      }
    ]
  },
  "input": "Dataset Information: {\n  \"data samples\": [\n    {\n      \"date\": \"2012-01-01\",\n      \"precipitation\": 0.0,\n      \"temp_max\": 12.8,\n      \"temp_min\": 5.0,\n      \"wind\": 4.7,\n      \"weather\": \"drizzle\"\n    },\n    {\n      \"date\": \"2013-08-17\",\n      \"precipitation\": 0.0,\n      \"temp_max\": 25.6,\n      \"temp_min\": 17.2,\n      \"wind\": 3.0,\n      \"weather\": \"sun\"\n    },\n    {\n      \"date\": \"2014-11-21\",\n      \"precipitation\": 15.2,\n      \"temp_max\": 11.1,\n      \"temp_min\": 8.3,\n      \"wind\": 4.7,\n      \"weather\": \"rain\"\n    },\n    {\n      \"date\": \"2014-03-26\",\n      \"precipitation\": 3.6,\n      \"temp_max\": 11.1,\n      \"temp_min\": 5.6,\n      \"wind\": 2.4,\n      \"weather\": \"rain\"\n    },\n    {\n      \"date\": \"2015-12-23\",\n      \"precipitation\": 6.1,\n      \"temp_max\": 5.0,\n      \"temp_min\": 2.8,\n      \"wind\": 7.6,\n      \"weather\": \"rain\"\n    }\n  ],\n  \"column names\": [\n    \"date\",\n    \"precipitation\",\n    \"temp_max\",\n    \"temp_min\",\n    \"wind\",\n    \"weather\"\n  ]\n}\n\nYour Job:\nI am developing a NL to Data Visualization Dataset. \nPlease help me generate natural language utterance for given dataset and constraints.\nDefinition about the Taks:\n- 'utterance' is what a user would say to make a chart. It should be a commands structure. One NL 'utterance' is in one or two sentences. Here are two examples from Commands for reference:\n    Draw axes for AVG(Horsepower) vs Year, colored by Origin.\n    For each country show the relationship between average acceleration and number of cylinders.\n- 'given dataset' is in form of column names, column type, range/unique values of the column.\n- 'constraints' are information about the chart that should be included in the utterance. \n    So we can find a reference phrase in the NL utterance that corresponds to the given constraints. \n- 'reference phrase' can be explicit, ambiguous, and by_value. 'ambiguous' means the phrase can map to more than one columns in the dataset, always a hypernym of column names(depending on the dataset values).\n    For example:\n    {\"column\": \"gdpPercap\", \"nl_ref_type\": \"explicit\", \"nl_ref_phrase\": \"GDP per capita\"},\n    {\"column\": [\"country\",\"continent\"], \"nl_ref_type\": \"ambiguous\", \"nl_ref_phrase\": \"region\"}\n    {\"column\": [\"country\",\"country_short_name\"], \"nl_ref_type\": \"ambiguous\", \"nl_ref_phrase\": \"countries\"}\n    {\"c_type\": \"mark\", \"c_name\": \"point chart\", \"nl_ref_type\": \"explicit\", \"nl_ref_phrase\": \"scatter plot\"}\n    {\"c_type\": \"mark\", \"c_name\": \"arc chart\", \"nl_ref_type\": \"explicit\", \"nl_ref_phrase\": \"pie chart\"}\n    {\"c_type\": \"transform\",\"c_name\": \"filter\",\"c_list\": [{\"field\": \"country\",\"oneOf\": [\"Iceland\",\"Norway\"]}],\"nl_ref_type\": \"explicit\",\"nl_ref_phrase\": \"for countries Iceland and Norway\"},\n    {\"c_type\": \"transform\",\"c_name\": \"filter\",\"c_list\": [{\"field\": \"country\",\"oneOf\": [\"Iceland\",\"Norway\"]}],\"nl_ref_type\": \"by_value\",\"nl_ref_phrase\": \"for Iceland and Norway\"},\n- the 'nl_ref_phrase' for 'ambiguous' columns should be equally near all ambiguous columns, not too near to one of the column since it would not be ambiguous.\n    good example: {\"column\": [\"country\",\"region\"], \"nl_ref_type\": \"ambiguous\", \"nl_ref_phrase\": \"location\"}\n    bad example: {\"column\": [\"country\",\"region\"], \"nl_ref_type\": \"ambiguous\", \"nl_ref_phrase\": \"region\"}\n- You only include given constraints and no other information. \n    For example, if a column name is not in the given constraint, it will not be included in the NL utterance.\n    Also, it a chart mark or chart encoding channel is not in the given constraint, it will not be included in the NL utterance.\n- all 'nl_ref_phrase' shoule be included in the 'nl_utterance'. \n\nThe output format is identical to the input format, but fill in the str blanks(\"...\").\n### Input:\n{\n  \"nl_utterance\": \"...\",\n  \"encoded_fields\": [\n    {\n      \"field\": \"date\",\n      \"type\": \"temporal\",\n      \"nl_ref_type\": \"explicit\",\n      \"nl_ref_phrase\": \"...\"\n    },\n    {\n      \"field\": [\n        \"temp_max\",\n        \"temp_min\"\n      ],\n      \"type\": \"quantitative\",\n      \"nl_ref_type\": \"ambiguous\",\n      \"nl_ref_phrase\": \"...\"\n    }\n  ],\n  \"constraints\": [\n    {\n      \"c_type\": \"transform\",\n      \"c_name\": \"aggregate\",\n      \"c_list\": [\n        {\n          \"field\": \"temp_max\",\n          \"aggregate\": \"max\"\n        }\n      ],\n      \"nl_ref_type\": \"explicit\",\n      \"nl_ref_phrase\": \"...\"\n    }\n  ]\n}\n\n### Output:"
}