{
  "gpt_result": {
    "nl_utterance": "Show the distribution of GDP per capita for different locations in the year 2017.",
    "encoded_fields": [
      {
        "field": [
          "region",
          "country"
        ],
        "type": "nominal",
        "nl_ref_type": "ambiguous",
        "nl_ref_phrase": "locations"
      },
      {
        "field": "gdpPercap",
        "type": "quantitative",
        "nl_ref_type": "explicit",
        "nl_ref_phrase": "GDP per capita"
      }
    ],
    "constraints": [
      {
        "c_type": "task",
        "c_name": "distribution",
        "c_list": [
          {
            "mark": "bar",
            "encoding": {
              "y": {
                "aggregate": "count",
                "type": "quantitative"
              }
            },
            "x_y_reversable": true
          },
          {
            "mark": "boxplot",
            "encoding": {
              "x": {
                "type": "quantitative"
              }
            },
            "x_y_reversable": true
          }
        ],
        "nl_ref_type": "explicit",
        "nl_ref_phrase": "distribution"
      },
      {
        "c_type": "transform",
        "c_name": "filter",
        "c_list": [
          {
            "field": "year",
            "equal": "2017"
          }
        ],
        "nl_ref_type": "by_value",
        "nl_ref_phrase": "in the year 2017"
      }
    ]
  },
  "input": "Dataset Information: {\n  \"data samples\": [\n    {\n      \"country\": \"Afghanistan\",\n      \"region\": \"Asia\",\n      \"country_code\": \"AFG\",\n      \"year\": 1952,\n      \"lifeExp\": 33.0,\n      \"gdpPercap\": 1070,\n      \"pop\": 7930000\n    },\n    {\n      \"country\": \"Estonia\",\n      \"region\": \"Europe\",\n      \"country_code\": \"EST\",\n      \"year\": 1962,\n      \"lifeExp\": 69.7,\n      \"gdpPercap\": 7580,\n      \"pop\": 1250000\n    },\n    {\n      \"country\": \"Grenada\",\n      \"region\": \"Americas\",\n      \"country_code\": \"GRD\",\n      \"year\": 1977,\n      \"lifeExp\": 69.5,\n      \"gdpPercap\": 4280,\n      \"pop\": 90200\n    },\n    {\n      \"country\": \"Kiribati\",\n      \"region\": \"Asia\",\n      \"country_code\": \"KIR\",\n      \"year\": 1977,\n      \"lifeExp\": 57.9,\n      \"gdpPercap\": 4950,\n      \"pop\": 56800\n    },\n    {\n      \"country\": \"Djibouti\",\n      \"region\": \"Africa\",\n      \"country_code\": \"DJI\",\n      \"year\": 1997,\n      \"lifeExp\": 61.3,\n      \"gdpPercap\": 2250,\n      \"pop\": 661000\n    }\n  ],\n  \"column names\": [\n    \"country\",\n    \"region\",\n    \"country_code\",\n    \"year\",\n    \"lifeExp\",\n    \"gdpPercap\",\n    \"pop\"\n  ]\n}\n\nYour Job:\nI am developing a NL to Data Visualization Dataset. \nPlease help me generate natural language utterance for given dataset and constraints.\nDefinition about the Taks:\n- 'utterance' is what a user would say to make a chart.  One NL 'utterance' is in one or two sentences. Here are two examples from Others for reference:\n    Trend for average horsepower over time across different origin.\n    scatter(x=production budget, y=worldwide gross) for content rating.\n- 'given dataset' is in form of column names, column type, range/unique values of the column.\n- 'constraints' are information about the chart that should be included in the utterance. \n    So we can find a reference phrase in the NL utterance that corresponds to the given constraints. \n- 'reference phrase' can be explicit, ambiguous, and by_value. 'ambiguous' means the phrase can map to more than one columns in the dataset, always a hypernym of column names(depending on the dataset values).\n    For example:\n    {\"column\": \"gdpPercap\", \"nl_ref_type\": \"explicit\", \"nl_ref_phrase\": \"GDP per capita\"},\n    {\"column\": [\"country\",\"continent\"], \"nl_ref_type\": \"ambiguous\", \"nl_ref_phrase\": \"region\"}\n    {\"column\": [\"country\",\"country_short_name\"], \"nl_ref_type\": \"ambiguous\", \"nl_ref_phrase\": \"countries\"}\n    {\"c_type\": \"mark\", \"c_name\": \"point chart\", \"nl_ref_type\": \"explicit\", \"nl_ref_phrase\": \"scatter plot\"}\n    {\"c_type\": \"mark\", \"c_name\": \"arc chart\", \"nl_ref_type\": \"explicit\", \"nl_ref_phrase\": \"pie chart\"}\n    {\"c_type\": \"transform\",\"c_name\": \"filter\",\"c_list\": [{\"field\": \"country\",\"oneOf\": [\"Iceland\",\"Norway\"]}],\"nl_ref_type\": \"explicit\",\"nl_ref_phrase\": \"for countries Iceland and Norway\"},\n    {\"c_type\": \"transform\",\"c_name\": \"filter\",\"c_list\": [{\"field\": \"country\",\"oneOf\": [\"Iceland\",\"Norway\"]}],\"nl_ref_type\": \"by_value\",\"nl_ref_phrase\": \"for Iceland and Norway\"},\n- the 'nl_ref_phrase' for 'ambiguous' columns should be equally near all ambiguous columns, not too near to one of the column since it would not be ambiguous.\n    good example: {\"column\": [\"country\",\"region\"], \"nl_ref_type\": \"ambiguous\", \"nl_ref_phrase\": \"location\"}\n    bad example: {\"column\": [\"country\",\"region\"], \"nl_ref_type\": \"ambiguous\", \"nl_ref_phrase\": \"region\"}\n- You only include given constraints and no other information. \n    For example, if a column name is not in the given constraint, it will not be included in the NL utterance.\n    Also, it a chart mark or chart encoding channel is not in the given constraint, it will not be included in the NL utterance.\n- all 'nl_ref_phrase' shoule be included in the 'nl_utterance'. \n\nThe output format is identical to the input format, but fill in the str blanks(\"...\").\n### Input:\n{\n  \"nl_utterance\": \"...\",\n  \"encoded_fields\": [\n    {\n      \"field\": [\n        \"region\",\n        \"country\"\n      ],\n      \"type\": \"nominal\",\n      \"nl_ref_type\": \"ambiguous\",\n      \"nl_ref_phrase\": \"...\"\n    },\n    {\n      \"field\": \"gdpPercap\",\n      \"type\": \"quantitative\",\n      \"nl_ref_type\": \"explicit\",\n      \"nl_ref_phrase\": \"...\"\n    }\n  ],\n  \"constraints\": [\n    {\n      \"c_type\": \"task\",\n      \"c_name\": \"distribution\",\n      \"c_list\": [\n        {\n          \"mark\": \"bar\",\n          \"encoding\": {\n            \"y\": {\n              \"aggregate\": \"count\",\n              \"type\": \"quantitative\"\n            }\n          },\n          \"x_y_reversable\": true\n        },\n        {\n          \"mark\": \"boxplot\",\n          \"encoding\": {\n            \"x\": {\n              \"type\": \"quantitative\"\n            }\n          },\n          \"x_y_reversable\": true\n        }\n      ],\n      \"nl_ref_type\": \"explicit\",\n      \"nl_ref_phrase\": \"...\"\n    },\n    {\n      \"c_type\": \"transform\",\n      \"c_name\": \"filter\",\n      \"c_list\": [\n        {\n          \"field\": \"year\",\n          \"equal\": \"2017\"\n        }\n      ],\n      \"nl_ref_type\": \"by_value\",\n      \"nl_ref_phrase\": \"...\"\n    }\n  ]\n}\n\n### Output:"
}