{
  "gpt_result": {
    "nl_utterance": "Create a bar chart showing the average profit by state.",
    "encoded_fields": [
      {
        "field": "Profit",
        "type": "quantitative",
        "nl_ref_type": "explicit",
        "nl_ref_phrase": "profit"
      },
      {
        "field": "State",
        "type": "nominal",
        "nl_ref_type": "explicit",
        "nl_ref_phrase": "state"
      }
    ],
    "constraints": [
      {
        "c_type": "mark",
        "c_name": "bar chart",
        "c_list": [
          {
            "mark": "bar",
            "encoding": {
              "x": {},
              "y": {
                "type": "quantitative"
              },
              "color": {
                "type": "nominal",
                "ignore": true
              },
              "column": {
                "ignore": true,
                "type": "nominal"
              },
              "row": {
                "ignore": true,
                "type": "nominal"
              }
            },
            "unique_map": {
              "x": "y"
            }
          },
          {
            "mark": "bar",
            "encoding": {
              "y": {},
              "x": {
                "type": "quantitative"
              },
              "color": {
                "type": "nominal",
                "ignore": true
              },
              "column": {
                "ignore": true,
                "type": "nominal"
              },
              "row": {
                "ignore": true,
                "type": "nominal"
              }
            },
            "unique_map": {
              "y": "x"
            }
          }
        ],
        "nl_ref_type": "explicit",
        "nl_ref_phrase": "bar chart"
      },
      {
        "c_type": "transform",
        "c_name": "aggregate",
        "c_list": [
          {
            "field": "Profit",
            "aggregate": "mean"
          }
        ],
        "nl_ref_type": "explicit",
        "nl_ref_phrase": "average"
      }
    ]
  },
  "input": "Dataset Information: {\n  \"data samples\": [\n    {\n      \"Days to Ship Actual\": 6,\n      \"Sales Forecast\": 293,\n      \"Ship Status\": \"Shipped On Time\",\n      \"Days to Ship Scheduled\": 6,\n      \"Sales per Customer\": \"$209.30 \",\n      \"Profit Ratio\": \"27.00%\",\n      \"Category\": \"Office Supplies\",\n      \"City\": \"Columbus\",\n      \"Country\": \"United States\",\n      \"Customer Name\": \"Chuck Clark\",\n      \"Days to Ship Actual (bin)\": 5,\n      \"Discount\": 0,\n      \"Number of Records\": 1,\n      \"Order Date\": \"12/30/2017\",\n      \"Order ID\": \"CA-2017-126221\",\n      \"Postal Code\": 47201,\n      \"Product Name\": \"Eureka The Boss Plus 12-Amp Hard Box Upright Vacuum, Red\",\n      \"Profit\": 56.511,\n      \"Quantity\": 2,\n      \"Region\": \"Central\",\n      \"Sales (bin)\": \"$0 \",\n      \"Sales\": 209.3,\n      \"Segment\": \"Home Office\",\n      \"Ship Date\": \"1/5/2018\",\n      \"Ship Mode\": \"Standard Class\",\n      \"State\": \"Indiana\",\n      \"Sub-Category\": \"Appliances\"\n    },\n    {\n      \"Days to Ship Actual\": 6,\n      \"Sales Forecast\": 20,\n      \"Ship Status\": \"Shipped On Time\",\n      \"Days to Ship Scheduled\": 6,\n      \"Sales per Customer\": \"$14.27 \",\n      \"Profit Ratio\": \"30.00%\",\n      \"Category\": \"Furniture\",\n      \"City\": \"Fayetteville\",\n      \"Country\": \"United States\",\n      \"Customer Name\": \"Carlos Meador\",\n      \"Days to Ship Actual (bin)\": 5,\n      \"Discount\": 20,\n      \"Number of Records\": 1,\n      \"Order Date\": \"1/22/2016\",\n      \"Order ID\": \"US-2016-135923\",\n      \"Postal Code\": 28314,\n      \"Product Name\": \"Eldon Pizzaz Desk Accessories\",\n      \"Profit\": 4.2816,\n      \"Quantity\": 8,\n      \"Region\": \"South\",\n      \"Sales (bin)\": \"$0 \",\n      \"Sales\": 14.272,\n      \"Segment\": \"Consumer\",\n      \"Ship Date\": \"1/28/2016\",\n      \"Ship Mode\": \"Standard Class\",\n      \"State\": \"North Carolina\",\n      \"Sub-Category\": \"Furnishings\"\n    },\n    {\n      \"Days to Ship Actual\": 6,\n      \"Sales Forecast\": 60,\n      \"Ship Status\": \"Shipped On Time\",\n      \"Days to Ship Scheduled\": 6,\n      \"Sales per Customer\": \"$42.93 \",\n      \"Profit Ratio\": \"45.00%\",\n      \"Category\": \"Office Supplies\",\n      \"City\": \"New York City\",\n      \"Country\": \"United States\",\n      \"Customer Name\": \"John Castell\",\n      \"Days to Ship Actual (bin)\": 5,\n      \"Discount\": 0,\n      \"Number of Records\": 1,\n      \"Order Date\": \"4/1/2017\",\n      \"Order ID\": \"CA-2017-118360\",\n      \"Postal Code\": 10011,\n      \"Product Name\": \"Wirebound Message Books, Four 2 3/4 x 5 Forms per Page, 200 Sets per Book\",\n      \"Profit\": 19.3185,\n      \"Quantity\": 9,\n      \"Region\": \"East\",\n      \"Sales (bin)\": \"$0 \",\n      \"Sales\": 42.93,\n      \"Segment\": \"Consumer\",\n      \"Ship Date\": \"4/7/2017\",\n      \"Ship Mode\": \"Standard Class\",\n      \"State\": \"New York\",\n      \"Sub-Category\": \"Paper\"\n    },\n    {\n      \"Days to Ship Actual\": 5,\n      \"Sales Forecast\": 19,\n      \"Ship Status\": \"Shipped Late\",\n      \"Days to Ship Scheduled\": 3,\n      \"Sales per Customer\": \"$13.36 \",\n      \"Profit Ratio\": \"48.00%\",\n      \"Category\": \"Office Supplies\",\n      \"City\": \"Los Angeles\",\n      \"Country\": \"United States\",\n      \"Customer Name\": \"Rick Bensley\",\n      \"Days to Ship Actual (bin)\": 5,\n      \"Discount\": 0,\n      \"Number of Records\": 1,\n      \"Order Date\": \"12/16/2017\",\n      \"Order ID\": \"CA-2017-161578\",\n      \"Postal Code\": 90036,\n      \"Product Name\": \"Xerox 1898\",\n      \"Profit\": 6.4128,\n      \"Quantity\": 2,\n      \"Region\": \"West\",\n      \"Sales (bin)\": \"$0 \",\n      \"Sales\": 13.36,\n      \"Segment\": \"Home Office\",\n      \"Ship Date\": \"12/21/2017\",\n      \"Ship Mode\": \"Second Class\",\n      \"State\": \"California\",\n      \"Sub-Category\": \"Paper\"\n    },\n    {\n      \"Days to Ship Actual\": 3,\n      \"Sales Forecast\": 44,\n      \"Ship Status\": \"Shipped Late\",\n      \"Days to Ship Scheduled\": 1,\n      \"Sales per Customer\": \"$31.40 \",\n      \"Profit Ratio\": \"25.00%\",\n      \"Category\": \"Office Supplies\",\n      \"City\": \"Arlington\",\n      \"Country\": \"United States\",\n      \"Customer Name\": \"Aaron Smayling\",\n      \"Days to Ship Actual (bin)\": 2,\n      \"Discount\": 0,\n      \"Number of Records\": 1,\n      \"Order Date\": \"3/28/2016\",\n      \"Order ID\": \"CA-2016-162901\",\n      \"Postal Code\": 22204,\n      \"Product Name\": \"Hanging Personal Folder File\",\n      \"Profit\": 7.85,\n      \"Quantity\": 2,\n      \"Region\": \"South\",\n      \"Sales (bin)\": \"$0 \",\n      \"Sales\": 31.4,\n      \"Segment\": \"Corporate\",\n      \"Ship Date\": \"3/31/2016\",\n      \"Ship Mode\": \"First Class\",\n      \"State\": \"Virginia\",\n      \"Sub-Category\": \"Storage\"\n    }\n  ],\n  \"column names\": [\n    \"Days to Ship Actual\",\n    \"Sales Forecast\",\n    \"Ship Status\",\n    \"Days to Ship Scheduled\",\n    \"Sales per Customer\",\n    \"Profit Ratio\",\n    \"Category\",\n    \"City\",\n    \"Country\",\n    \"Customer Name\",\n    \"Days to Ship Actual (bin)\",\n    \"Discount\",\n    \"Number of Records\",\n    \"Order Date\",\n    \"Order ID\",\n    \"Postal Code\",\n    \"Product Name\",\n    \"Profit\",\n    \"Quantity\",\n    \"Region\",\n    \"Sales (bin)\",\n    \"Sales\",\n    \"Segment\",\n    \"Ship Date\",\n    \"Ship Mode\",\n    \"State\",\n    \"Sub-Category\"\n  ]\n}\n\nYour Job:\nI am developing a NL to Data Visualization Dataset. \nPlease help me generate natural language utterance for given dataset and constraints.\nDefinition about the Taks:\n- 'utterance' is what a user would say to make a chart. It should be a commands structure. One NL 'utterance' is in one or two sentences. Here are two examples from Commands for reference:\n    Graph to show the acceleration for cars from different countries segregated based on number of cylinders.\n    Create a line chart showing order date and sum of sales, divided by category.\n- 'given dataset' is in form of column names, column type, range/unique values of the column.\n- 'constraints' are information about the chart that should be included in the utterance. \n    So we can find a reference phrase in the NL utterance that corresponds to the given constraints. \n- 'reference phrase' can be explicit, ambiguous, and by_value. 'ambiguous' means the phrase can map to more than one columns in the dataset, always a hypernym of column names(depending on the dataset values).\n    For example:\n    {\"column\": \"gdpPercap\", \"nl_ref_type\": \"explicit\", \"nl_ref_phrase\": \"GDP per capita\"},\n    {\"column\": [\"country\",\"continent\"], \"nl_ref_type\": \"ambiguous\", \"nl_ref_phrase\": \"region\"}\n    {\"column\": [\"country\",\"country_short_name\"], \"nl_ref_type\": \"ambiguous\", \"nl_ref_phrase\": \"countries\"}\n    {\"c_type\": \"mark\", \"c_name\": \"point chart\", \"nl_ref_type\": \"explicit\", \"nl_ref_phrase\": \"scatter plot\"}\n    {\"c_type\": \"mark\", \"c_name\": \"arc chart\", \"nl_ref_type\": \"explicit\", \"nl_ref_phrase\": \"pie chart\"}\n    {\"c_type\": \"transform\",\"c_name\": \"filter\",\"c_list\": [{\"field\": \"country\",\"oneOf\": [\"Iceland\",\"Norway\"]}],\"nl_ref_type\": \"explicit\",\"nl_ref_phrase\": \"for countries Iceland and Norway\"},\n    {\"c_type\": \"transform\",\"c_name\": \"filter\",\"c_list\": [{\"field\": \"country\",\"oneOf\": [\"Iceland\",\"Norway\"]}],\"nl_ref_type\": \"by_value\",\"nl_ref_phrase\": \"for Iceland and Norway\"},\n- the 'nl_ref_phrase' for 'ambiguous' columns should be equally near all ambiguous columns, not too near to one of the column since it would not be ambiguous.\n    good example: {\"column\": [\"country\",\"region\"], \"nl_ref_type\": \"ambiguous\", \"nl_ref_phrase\": \"location\"}\n    bad example: {\"column\": [\"country\",\"region\"], \"nl_ref_type\": \"ambiguous\", \"nl_ref_phrase\": \"region\"}\n- You only include given constraints and no other information. \n    For example, if a column name is not in the given constraint, it will not be included in the NL utterance.\n    Also, it a chart mark or chart encoding channel is not in the given constraint, it will not be included in the NL utterance.\n- all 'nl_ref_phrase' shoule be included in the 'nl_utterance'. \n\nThe output format is identical to the input format, but fill in the str blanks(\"...\").\n### Input:\n{\n  \"nl_utterance\": \"...\",\n  \"encoded_fields\": [\n    {\n      \"field\": \"Profit\",\n      \"type\": \"quantitative\",\n      \"nl_ref_type\": \"explicit\",\n      \"nl_ref_phrase\": \"...\"\n    },\n    {\n      \"field\": \"State\",\n      \"type\": \"nominal\",\n      \"nl_ref_type\": \"explicit\",\n      \"nl_ref_phrase\": \"...\"\n    }\n  ],\n  \"constraints\": [\n    {\n      \"c_type\": \"mark\",\n      \"c_name\": \"bar chart\",\n      \"c_list\": [\n        {\n          \"mark\": \"bar\",\n          \"encoding\": {\n            \"x\": {},\n            \"y\": {\n              \"type\": \"quantitative\"\n            },\n            \"color\": {\n              \"type\": \"nominal\",\n              \"ignore\": true\n            },\n            \"column\": {\n              \"ignore\": true,\n              \"type\": \"nominal\"\n            },\n            \"row\": {\n              \"ignore\": true,\n              \"type\": \"nominal\"\n            }\n          },\n          \"unique_map\": {\n            \"x\": \"y\"\n          }\n        },\n        {\n          \"mark\": \"bar\",\n          \"encoding\": {\n            \"y\": {},\n            \"x\": {\n              \"type\": \"quantitative\"\n            },\n            \"color\": {\n              \"type\": \"nominal\",\n              \"ignore\": true\n            },\n            \"column\": {\n              \"ignore\": true,\n              \"type\": \"nominal\"\n            },\n            \"row\": {\n              \"ignore\": true,\n              \"type\": \"nominal\"\n            }\n          },\n          \"unique_map\": {\n            \"y\": \"x\"\n          }\n        }\n      ],\n      \"nl_ref_type\": \"explicit\",\n      \"nl_ref_phrase\": \"...\"\n    },\n    {\n      \"c_type\": \"transform\",\n      \"c_name\": \"aggregate\",\n      \"c_list\": [\n        {\n          \"field\": \"Profit\",\n          \"aggregate\": \"mean\"\n        }\n      ],\n      \"nl_ref_type\": \"explicit\",\n      \"nl_ref_phrase\": \"...\"\n    }\n  ]\n}\n\n### Output:"
}