{
  "gpt_result": {
    "nl_utterance": "How does continent influence infant mortality and population in a point chart?",
    "encoded_fields": [
      {
        "field": "Infant Mortality",
        "type": "quantitative",
        "nl_ref_type": "explicit",
        "nl_ref_phrase": "infant mortality"
      },
      {
        "field": "Continent",
        "type": "nominal",
        "nl_ref_type": "explicit",
        "nl_ref_phrase": "continent"
      },
      {
        "field": "Population",
        "type": "quantitative",
        "nl_ref_type": "explicit",
        "nl_ref_phrase": "population"
      }
    ],
    "constraints": [
      {
        "c_type": "mark",
        "c_name": "point chart",
        "c_list": [
          {
            "mark": "circle",
            "encoding": {
              "x": {},
              "y": {},
              "color": {
                "type": "nominal",
                "ignore": true
              },
              "size": {
                "ignore": true,
                "type": "quantitative"
              },
              "column": {
                "ignore": true,
                "type": "nominal"
              },
              "row": {
                "ignore": true,
                "type": "nominal"
              }
            }
          }
        ],
        "nl_ref_type": "explicit",
        "nl_ref_phrase": "point chart"
      }
    ]
  },
  "input": "Dataset Information: {\n  \"data samples\": [\n    {\n      \"Country\": \"Finland\",\n      \"Happiness score\": 7.821,\n      \"Country_temp\": \"Finland\",\n      \"ISO3\": \"FIN\",\n      \"GDP per capita (PPP)\": 55013.38586,\n      \"Life Ladder\": 7.7944,\n      \"Social support\": 0.9703,\n      \"Perceptions of corruption\": 0.1918,\n      \"Population\": 5535992.0,\n      \"Median Age\": 42.368,\n      \"Total Fertility Rate\": 1.389,\n      \"Life Expectancy\": 82.038,\n      \"Infant Mortality\": 1.932,\n      \"Child Mortality\": 2.353,\n      \"Net Migration Rate\": 2.7,\n      \"Continent\": \"Europe\",\n      \"UN Region\": \"Northern Europe\"\n    },\n    {\n      \"Country\": \"Sri Lanka\",\n      \"Happiness score\": 4.362,\n      \"Country_temp\": \"Sri Lanka\",\n      \"ISO3\": \"LKA\",\n      \"GDP per capita (PPP)\": 14706.54132,\n      \"Life Ladder\": 4.1034,\n      \"Social support\": 0.8124,\n      \"Perceptions of corruption\": 0.8485,\n      \"Population\": 21773441.0,\n      \"Median Age\": 32.473,\n      \"Total Fertility Rate\": 1.99,\n      \"Life Expectancy\": 76.399,\n      \"Infant Mortality\": 5.683,\n      \"Child Mortality\": 6.704,\n      \"Net Migration Rate\": -4.235,\n      \"Continent\": \"Asia\",\n      \"UN Region\": \"Southern Asia\"\n    },\n    {\n      \"Country\": \"Morocco\",\n      \"Happiness score\": 5.06,\n      \"Country_temp\": \"Morocco\",\n      \"ISO3\": \"MAR\",\n      \"GDP per capita (PPP)\": 8852.914063,\n      \"Life Ladder\": 5.3262,\n      \"Social support\": 0.5046,\n      \"Perceptions of corruption\": 0.8174,\n      \"Population\": 37076584.0,\n      \"Median Age\": 28.673,\n      \"Total Fertility Rate\": 2.328,\n      \"Life Expectancy\": 74.042,\n      \"Infant Mortality\": 15.404,\n      \"Child Mortality\": 17.919,\n      \"Net Migration Rate\": -1.246,\n      \"Continent\": \"Africa\",\n      \"UN Region\": \"Northern Africa\"\n    },\n    {\n      \"Country\": \"Hong Kong S.A.R. of China\",\n      \"Happiness score\": 5.425,\n      \"Country_temp\": \"Hong Kong S.A.R. of China\",\n      \"ISO3\": \"HKG\",\n      \"GDP per capita (PPP)\": 65891.69471,\n      \"Life Ladder\": 5.3216,\n      \"Social support\": 0.8211,\n      \"Perceptions of corruption\": 0.3896,\n      \"Population\": 7494578.0,\n      \"Median Age\": 44.864,\n      \"Total Fertility Rate\": 0.745,\n      \"Life Expectancy\": 85.473,\n      \"Infant Mortality\": 1.206,\n      \"Child Mortality\": 1.923,\n      \"Net Migration Rate\": 0.0,\n      \"Continent\": \"Asia\",\n      \"UN Region\": \"Eastern Asia\"\n    },\n    {\n      \"Country\": \"Comoros*\",\n      \"Happiness score\": 4.609,\n      \"Country_temp\": \"Comoros\",\n      \"ISO3\": \"COM\",\n      \"GDP per capita (PPP)\": 3546.843502,\n      \"Life Ladder\": NaN,\n      \"Social support\": NaN,\n      \"Perceptions of corruption\": NaN,\n      \"Population\": 821625.0,\n      \"Median Age\": 20.061,\n      \"Total Fertility Rate\": 3.978,\n      \"Life Expectancy\": 63.417,\n      \"Infant Mortality\": 45.613,\n      \"Child Mortality\": 58.515,\n      \"Net Migration Rate\": -2.154,\n      \"Continent\": \"Africa\",\n      \"UN Region\": \"Eastern Africa\"\n    }\n  ],\n  \"column names\": [\n    \"Country\",\n    \"Happiness score\",\n    \"Country_temp\",\n    \"ISO3\",\n    \"GDP per capita (PPP)\",\n    \"Life Ladder\",\n    \"Social support\",\n    \"Perceptions of corruption\",\n    \"Population\",\n    \"Median Age\",\n    \"Total Fertility Rate\",\n    \"Life Expectancy\",\n    \"Infant Mortality\",\n    \"Child Mortality\",\n    \"Net Migration Rate\",\n    \"Continent\",\n    \"UN Region\"\n  ]\n}\n\nYour Job:\nI am developing a NL to Data Visualization Dataset. \nPlease help me generate natural language utterance for given dataset and constraints.\nDefinition about the Taks:\n- 'utterance' is what a user would say to make a chart. It should be a questions structure. One NL 'utterance' is in one or two sentences. Here are two examples from Questions for reference:\n    Have cars gotten lighter over time?\n    Are IMDb rating and rotten tomatoes rating related?\n- 'given dataset' is in form of column names, column type, range/unique values of the column.\n- 'constraints' are information about the chart that should be included in the utterance. \n    So we can find a reference phrase in the NL utterance that corresponds to the given constraints. \n- 'reference phrase' can be explicit, ambiguous, and by_value. 'ambiguous' means the phrase can map to more than one columns in the dataset, always a hypernym of column names(depending on the dataset values).\n    For example:\n    {\"column\": \"gdpPercap\", \"nl_ref_type\": \"explicit\", \"nl_ref_phrase\": \"GDP per capita\"},\n    {\"column\": [\"country\",\"continent\"], \"nl_ref_type\": \"ambiguous\", \"nl_ref_phrase\": \"region\"}\n    {\"column\": [\"country\",\"country_short_name\"], \"nl_ref_type\": \"ambiguous\", \"nl_ref_phrase\": \"countries\"}\n    {\"c_type\": \"mark\", \"c_name\": \"point chart\", \"nl_ref_type\": \"explicit\", \"nl_ref_phrase\": \"scatter plot\"}\n    {\"c_type\": \"mark\", \"c_name\": \"arc chart\", \"nl_ref_type\": \"explicit\", \"nl_ref_phrase\": \"pie chart\"}\n    {\"c_type\": \"transform\",\"c_name\": \"filter\",\"c_list\": [{\"field\": \"country\",\"oneOf\": [\"Iceland\",\"Norway\"]}],\"nl_ref_type\": \"explicit\",\"nl_ref_phrase\": \"for countries Iceland and Norway\"},\n    {\"c_type\": \"transform\",\"c_name\": \"filter\",\"c_list\": [{\"field\": \"country\",\"oneOf\": [\"Iceland\",\"Norway\"]}],\"nl_ref_type\": \"by_value\",\"nl_ref_phrase\": \"for Iceland and Norway\"},\n- the 'nl_ref_phrase' for 'ambiguous' columns should be equally near all ambiguous columns, not too near to one of the column since it would not be ambiguous.\n    good example: {\"column\": [\"country\",\"region\"], \"nl_ref_type\": \"ambiguous\", \"nl_ref_phrase\": \"location\"}\n    bad example: {\"column\": [\"country\",\"region\"], \"nl_ref_type\": \"ambiguous\", \"nl_ref_phrase\": \"region\"}\n- You only include given constraints and no other information. \n    For example, if a column name is not in the given constraint, it will not be included in the NL utterance.\n    Also, it a chart mark or chart encoding channel is not in the given constraint, it will not be included in the NL utterance.\n- all 'nl_ref_phrase' shoule be included in the 'nl_utterance'. \n\nThe output format is identical to the input format, but fill in the str blanks(\"...\").\n### Input:\n{\n  \"nl_utterance\": \"...\",\n  \"encoded_fields\": [\n    {\n      \"field\": \"Infant Mortality\",\n      \"type\": \"quantitative\",\n      \"nl_ref_type\": \"explicit\",\n      \"nl_ref_phrase\": \"...\"\n    },\n    {\n      \"field\": \"Continent\",\n      \"type\": \"nominal\",\n      \"nl_ref_type\": \"explicit\",\n      \"nl_ref_phrase\": \"...\"\n    },\n    {\n      \"field\": \"Population\",\n      \"type\": \"quantitative\",\n      \"nl_ref_type\": \"explicit\",\n      \"nl_ref_phrase\": \"...\"\n    }\n  ],\n  \"constraints\": [\n    {\n      \"c_type\": \"mark\",\n      \"c_name\": \"point chart\",\n      \"c_list\": [\n        {\n          \"mark\": \"circle\",\n          \"encoding\": {\n            \"x\": {},\n            \"y\": {},\n            \"color\": {\n              \"type\": \"nominal\",\n              \"ignore\": true\n            },\n            \"size\": {\n              \"ignore\": true,\n              \"type\": \"quantitative\"\n            },\n            \"column\": {\n              \"ignore\": true,\n              \"type\": \"nominal\"\n            },\n            \"row\": {\n              \"ignore\": true,\n              \"type\": \"nominal\"\n            }\n          }\n        }\n      ],\n      \"nl_ref_type\": \"explicit\",\n      \"nl_ref_phrase\": \"...\"\n    }\n  ]\n}\n\n### Output:"
}