{
  "gpt_result": {
    "nl_utterance": "Analyze the correlation between Value 2 and Type using a scatter plot.",
    "encoded_fields": [
      {
        "field": "Value 2",
        "type": "quantitative",
        "nl_ref_type": "explicit",
        "nl_ref_phrase": "Value 2"
      },
      {
        "field": "Type",
        "type": "nominal",
        "nl_ref_type": "explicit",
        "nl_ref_phrase": "Type"
      }
    ],
    "constraints": [
      {
        "c_type": "task",
        "c_name": "correlation",
        "c_list": [
          {
            "mark": "circle",
            "encoding": {
              "x": {
                "type": "quantitative"
              },
              "y": {
                "type": "quantitative"
              }
            }
          }
        ],
        "nl_ref_type": "explicit",
        "nl_ref_phrase": "correlation"
      }
    ]
  },
  "input": "Dataset Information: {\n  \"data samples\": [\n    {\n      \"Unnamed: 0\": 0,\n      \"Type\": \"ETS\",\n      \"GHG emissions covered [MtCO2e]\": 140.36,\n      \"Year of implementation\": 2007,\n      \"Value [billion US$]\": 6.365888747,\n      \"Proportion of global GHG emissions covered\": 0.27,\n      \"Value 1\": -0.0505383741816785,\n      \"Value 2\": 0.7482888868096143\n    },\n    {\n      \"Unnamed: 0\": 21,\n      \"Type\": \"Carbon tax\",\n      \"GHG emissions covered [MtCO2e]\": 44.67561579,\n      \"Year of implementation\": 2017,\n      \"Value [billion US$]\": 0.125855396,\n      \"Proportion of global GHG emissions covered\": 0.09,\n      \"Value 1\": -0.3574824867791804,\n      \"Value 2\": -0.5082033348462469\n    },\n    {\n      \"Unnamed: 0\": 67,\n      \"Type\": \"ETS\",\n      \"GHG emissions covered [MtCO2e]\": 41.125,\n      \"Year of implementation\": 2022,\n      \"Value [billion US$]\": 1.314737852,\n      \"Proportion of global GHG emissions covered\": 0.08,\n      \"Value 1\": -0.2958063664379599,\n      \"Value 2\": -1.0781241292263373\n    },\n    {\n      \"Unnamed: 0\": 55,\n      \"Type\": \"Carbon tax\",\n      \"GHG emissions covered [MtCO2e]\": 25.96280946,\n      \"Year of implementation\": 2021,\n      \"Value [billion US$]\": 1.197978551,\n      \"Proportion of global GHG emissions covered\": 0.05,\n      \"Value 1\": -0.3395285826350468,\n      \"Value 2\": -0.9592894207307076\n    },\n    {\n      \"Unnamed: 0\": 87,\n      \"Type\": \"Carbon tax\",\n      \"GHG emissions covered [MtCO2e]\": 6.231775,\n      \"Year of implementation\": 2014,\n      \"Value [billion US$]\": 0.121572,\n      \"Proportion of global GHG emissions covered\": 0.01,\n      \"Value 1\": -0.4656293794662306,\n      \"Value 2\": -0.147508613330982\n    }\n  ],\n  \"column names\": [\n    \"Unnamed: 0\",\n    \"Type\",\n    \"GHG emissions covered [MtCO2e]\",\n    \"Year of implementation\",\n    \"Value [billion US$]\",\n    \"Proportion of global GHG emissions covered\",\n    \"Value 1\",\n    \"Value 2\"\n  ]\n}\n\nYour Job:\nI am developing a NL to Data Visualization Dataset. \nPlease help me generate natural language utterance for given dataset and constraints.\nDefinition about the Taks:\n- 'utterance' is what a user would say to make a chart. It should be a queries structure. One NL 'utterance' is in one or two sentences. Here are two examples from Queries for reference:\n    Gross versus genre.\n    sales forecast between Jan 2016 and July 2017.\n- 'given dataset' is in form of column names, column type, range/unique values of the column.\n- 'constraints' are information about the chart that should be included in the utterance. \n    So we can find a reference phrase in the NL utterance that corresponds to the given constraints. \n- 'reference phrase' can be explicit, ambiguous, and by_value. 'ambiguous' means the phrase can map to more than one columns in the dataset, always a hypernym of column names(depending on the dataset values).\n    For example:\n    {\"column\": \"gdpPercap\", \"nl_ref_type\": \"explicit\", \"nl_ref_phrase\": \"GDP per capita\"},\n    {\"column\": [\"country\",\"continent\"], \"nl_ref_type\": \"ambiguous\", \"nl_ref_phrase\": \"region\"}\n    {\"column\": [\"country\",\"country_short_name\"], \"nl_ref_type\": \"ambiguous\", \"nl_ref_phrase\": \"countries\"}\n    {\"c_type\": \"mark\", \"c_name\": \"point chart\", \"nl_ref_type\": \"explicit\", \"nl_ref_phrase\": \"scatter plot\"}\n    {\"c_type\": \"mark\", \"c_name\": \"arc chart\", \"nl_ref_type\": \"explicit\", \"nl_ref_phrase\": \"pie chart\"}\n    {\"c_type\": \"transform\",\"c_name\": \"filter\",\"c_list\": [{\"field\": \"country\",\"oneOf\": [\"Iceland\",\"Norway\"]}],\"nl_ref_type\": \"explicit\",\"nl_ref_phrase\": \"for countries Iceland and Norway\"},\n    {\"c_type\": \"transform\",\"c_name\": \"filter\",\"c_list\": [{\"field\": \"country\",\"oneOf\": [\"Iceland\",\"Norway\"]}],\"nl_ref_type\": \"by_value\",\"nl_ref_phrase\": \"for Iceland and Norway\"},\n- the 'nl_ref_phrase' for 'ambiguous' columns should be equally near all ambiguous columns, not too near to one of the column since it would not be ambiguous.\n    good example: {\"column\": [\"country\",\"region\"], \"nl_ref_type\": \"ambiguous\", \"nl_ref_phrase\": \"location\"}\n    bad example: {\"column\": [\"country\",\"region\"], \"nl_ref_type\": \"ambiguous\", \"nl_ref_phrase\": \"region\"}\n- You only include given constraints and no other information. \n    For example, if a column name is not in the given constraint, it will not be included in the NL utterance.\n    Also, it a chart mark or chart encoding channel is not in the given constraint, it will not be included in the NL utterance.\n- all 'nl_ref_phrase' shoule be included in the 'nl_utterance'. \n\nThe output format is identical to the input format, but fill in the str blanks(\"...\").\n### Input:\n{\n  \"nl_utterance\": \"...\",\n  \"encoded_fields\": [\n    {\n      \"field\": \"Value 2\",\n      \"type\": \"quantitative\",\n      \"nl_ref_type\": \"explicit\",\n      \"nl_ref_phrase\": \"...\"\n    },\n    {\n      \"field\": \"Type\",\n      \"type\": \"nominal\",\n      \"nl_ref_type\": \"explicit\",\n      \"nl_ref_phrase\": \"...\"\n    }\n  ],\n  \"constraints\": [\n    {\n      \"c_type\": \"task\",\n      \"c_name\": \"correlation\",\n      \"c_list\": [\n        {\n          \"mark\": \"circle\",\n          \"encoding\": {\n            \"x\": {\n              \"type\": \"quantitative\"\n            },\n            \"y\": {\n              \"type\": \"quantitative\"\n            }\n          }\n        }\n      ],\n      \"nl_ref_type\": \"explicit\",\n      \"nl_ref_phrase\": \"...\"\n    }\n  ]\n}\n\n### Output:"
}