{
  "gpt_result": {
    "nl_utterance": "Show the trade total for each country where the trade partner rank is below 21, and sort the results in descending order.",
    "encoded_fields": [
      {
        "field": "tradeTotal",
        "type": "quantitative",
        "nl_ref_type": "explicit",
        "nl_ref_phrase": "trade total"
      },
      {
        "field": "Country",
        "type": "nominal",
        "nl_ref_type": "explicit",
        "nl_ref_phrase": "country"
      }
    ],
    "constraints": [
      {
        "c_type": "transform",
        "c_name": "filter",
        "c_list": [
          {
            "field": "tradePartner",
            "lt": 21
          }
        ],
        "nl_ref_type": "by_value",
        "nl_ref_phrase": "where the trade partner rank is below 21"
      },
      {
        "c_type": "transform",
        "c_name": "sort",
        "c_list": [
          {
            "field": "tradeTotal",
            "order": "descending"
          }
        ],
        "nl_ref_type": "explicit",
        "nl_ref_phrase": "sort the results in descending order"
      }
    ]
  },
  "input": "Dataset Information: {\n  \"data samples\": [\n    {\n      \"Country\": \"Mexico\",\n      \"tradePartner\": 1,\n      \"tradeTotal\": 124564,\n      \"Balance\": -20774.0,\n      \"Balance_absolute\": 20774,\n      \"Balance_pctTrade\": -0.17,\n      \"Exports\": 51895.0,\n      \"Exports_absolute\": 51895.0,\n      \"Imports\": 72669.0,\n      \"Imports_absolute\": 72669.0,\n      \"Source\": \"https://www.census.gov/foreign-trade/Press-Release/current_press_release/index.html\"\n    },\n    {\n      \"Country\": \"Mali\",\n      \"tradePartner\": 168,\n      \"tradeTotal\": 17,\n      \"Balance\": 14.0,\n      \"Balance_absolute\": 14,\n      \"Balance_pctTrade\": 0.84,\n      \"Exports\": 16.0,\n      \"Exports_absolute\": 16.0,\n      \"Imports\": 1.0,\n      \"Imports_absolute\": 1.0,\n      \"Source\": NaN\n    },\n    {\n      \"Country\": \"Botswana\",\n      \"tradePartner\": 112,\n      \"tradeTotal\": 99,\n      \"Balance\": -87.0,\n      \"Balance_absolute\": 87,\n      \"Balance_pctTrade\": -0.87,\n      \"Exports\": 6.0,\n      \"Exports_absolute\": 6.0,\n      \"Imports\": 93.0,\n      \"Imports_absolute\": 93.0,\n      \"Source\": NaN\n    },\n    {\n      \"Country\": \"Bermuda\",\n      \"tradePartner\": 116,\n      \"tradeTotal\": 89,\n      \"Balance\": 83.0,\n      \"Balance_absolute\": 83,\n      \"Balance_pctTrade\": 0.93,\n      \"Exports\": 86.0,\n      \"Exports_absolute\": 86.0,\n      \"Imports\": 3.0,\n      \"Imports_absolute\": 3.0,\n      \"Source\": NaN\n    },\n    {\n      \"Country\": \"United Arab Emirates\",\n      \"tradePartner\": 28,\n      \"tradeTotal\": 4950,\n      \"Balance\": 3164.0,\n      \"Balance_absolute\": 3164,\n      \"Balance_pctTrade\": 0.64,\n      \"Exports\": 4057.0,\n      \"Exports_absolute\": 4057.0,\n      \"Imports\": 893.0,\n      \"Imports_absolute\": 893.0,\n      \"Source\": NaN\n    }\n  ],\n  \"column names\": [\n    \"Country\",\n    \"tradePartner\",\n    \"tradeTotal\",\n    \"Balance\",\n    \"Balance_absolute\",\n    \"Balance_pctTrade\",\n    \"Exports\",\n    \"Exports_absolute\",\n    \"Imports\",\n    \"Imports_absolute\",\n    \"Source\"\n  ]\n}\n\nYour Job:\nI am developing a NL to Data Visualization Dataset. \nPlease help me generate natural language utterance for given dataset and constraints.\nDefinition about the Taks:\n- 'utterance' is what a user would say to make a chart. It should be a queries structure. One NL 'utterance' is in one or two sentences. Here are two examples from Queries for reference:\n    budget over time.\n    Compare acceleration vs weight across different countries.\n- 'given dataset' is in form of column names, column type, range/unique values of the column.\n- 'constraints' are information about the chart that should be included in the utterance. \n    So we can find a reference phrase in the NL utterance that corresponds to the given constraints. \n- 'reference phrase' can be explicit, ambiguous, and by_value. 'ambiguous' means the phrase can map to more than one columns in the dataset, always a hypernym of column names(depending on the dataset values).\n    For example:\n    {\"column\": \"gdpPercap\", \"nl_ref_type\": \"explicit\", \"nl_ref_phrase\": \"GDP per capita\"},\n    {\"column\": [\"country\",\"continent\"], \"nl_ref_type\": \"ambiguous\", \"nl_ref_phrase\": \"region\"}\n    {\"column\": [\"country\",\"country_short_name\"], \"nl_ref_type\": \"ambiguous\", \"nl_ref_phrase\": \"countries\"}\n    {\"c_type\": \"mark\", \"c_name\": \"point chart\", \"nl_ref_type\": \"explicit\", \"nl_ref_phrase\": \"scatter plot\"}\n    {\"c_type\": \"mark\", \"c_name\": \"arc chart\", \"nl_ref_type\": \"explicit\", \"nl_ref_phrase\": \"pie chart\"}\n    {\"c_type\": \"transform\",\"c_name\": \"filter\",\"c_list\": [{\"field\": \"country\",\"oneOf\": [\"Iceland\",\"Norway\"]}],\"nl_ref_type\": \"explicit\",\"nl_ref_phrase\": \"for countries Iceland and Norway\"},\n    {\"c_type\": \"transform\",\"c_name\": \"filter\",\"c_list\": [{\"field\": \"country\",\"oneOf\": [\"Iceland\",\"Norway\"]}],\"nl_ref_type\": \"by_value\",\"nl_ref_phrase\": \"for Iceland and Norway\"},\n- the 'nl_ref_phrase' for 'ambiguous' columns should be equally near all ambiguous columns, not too near to one of the column since it would not be ambiguous.\n    good example: {\"column\": [\"country\",\"region\"], \"nl_ref_type\": \"ambiguous\", \"nl_ref_phrase\": \"location\"}\n    bad example: {\"column\": [\"country\",\"region\"], \"nl_ref_type\": \"ambiguous\", \"nl_ref_phrase\": \"region\"}\n- You only include given constraints and no other information. \n    For example, if a column name is not in the given constraint, it will not be included in the NL utterance.\n    Also, it a chart mark or chart encoding channel is not in the given constraint, it will not be included in the NL utterance.\n- all 'nl_ref_phrase' shoule be included in the 'nl_utterance'. \n\nThe output format is identical to the input format, but fill in the str blanks(\"...\").\n### Input:\n{\n  \"nl_utterance\": \"...\",\n  \"encoded_fields\": [\n    {\n      \"field\": \"tradeTotal\",\n      \"type\": \"quantitative\",\n      \"nl_ref_type\": \"explicit\",\n      \"nl_ref_phrase\": \"...\"\n    },\n    {\n      \"field\": \"Country\",\n      \"type\": \"nominal\",\n      \"nl_ref_type\": \"explicit\",\n      \"nl_ref_phrase\": \"...\"\n    }\n  ],\n  \"constraints\": [\n    {\n      \"c_type\": \"transform\",\n      \"c_name\": \"filter\",\n      \"c_list\": [\n        {\n          \"field\": \"tradePartner\",\n          \"lt\": 21\n        }\n      ],\n      \"nl_ref_type\": \"by_value\",\n      \"nl_ref_phrase\": \"...\"\n    },\n    {\n      \"c_type\": \"transform\",\n      \"c_name\": \"sort\",\n      \"c_list\": [\n        {\n          \"field\": \"tradeTotal\",\n          \"order\": \"descending\"\n        }\n      ],\n      \"nl_ref_type\": \"explicit\",\n      \"nl_ref_phrase\": \"...\"\n    }\n  ]\n}\n\n### Output:"
}