{
  "gpt_result": {
    "nl_utterance": "Create a scatter plot to show the correlation between Component 1 and Component 2, with data points represented as circles.",
    "encoded_fields": [
      {
        "field": [
          "Component 1",
          "Component 2"
        ],
        "type": "quantitative",
        "nl_ref_type": "ambiguous",
        "nl_ref_phrase": "Components"
      },
      {
        "field": "Component 2",
        "type": "quantitative",
        "nl_ref_type": "explicit",
        "nl_ref_phrase": "Component 2"
      },
      {
        "field": "Pos",
        "type": "nominal",
        "nl_ref_type": "explicit",
        "nl_ref_phrase": "Position"
      }
    ],
    "constraints": [
      {
        "c_type": "task",
        "c_name": "correlation",
        "c_list": [
          {
            "mark": "circle",
            "encoding": {
              "x": {
                "type": "quantitative"
              },
              "y": {
                "type": "quantitative"
              }
            }
          }
        ],
        "nl_ref_type": "explicit",
        "nl_ref_phrase": "correlation"
      },
      {
        "c_type": "mark",
        "c_name": "point chart",
        "c_list": [
          {
            "mark": "circle",
            "encoding": {
              "x": {},
              "y": {},
              "color": {
                "type": "nominal",
                "ignore": true
              },
              "size": {
                "ignore": true,
                "type": "quantitative"
              },
              "column": {
                "ignore": true,
                "type": "nominal"
              },
              "row": {
                "ignore": true,
                "type": "nominal"
              }
            }
          }
        ],
        "nl_ref_type": "explicit",
        "nl_ref_phrase": "scatter plot"
      }
    ]
  },
  "input": "Dataset Information: {\n  \"data samples\": [\n    {\n      \"Unnamed: 0\": 0,\n      \"Player\": \"Max Aarons\",\n      \"Progressive Carries\": 5.4375,\n      \"Touches\": 57.96875,\n      \"Expected Assists\": 0.04375,\n      \"Progressive Passes\": 2.9375,\n      \"Passes\": 33.96875,\n      \"Interceptions\": 1.75,\n      \"Possession-Winning-Tackles\": 1.15625,\n      \"Aerials Won\": 0.46875,\n      \"Pos\": \"Defender\",\n      \"Non-Penalty Expected Goals\": 0.02,\n      \"cluster\": 6,\n      \"Component 1\": -0.6794867331318681,\n      \"Component 2\": 0.4101967803346252\n    },\n    {\n      \"Unnamed: 0\": 280,\n      \"Player\": \"Odsonne \\u00c9douard\",\n      \"Progressive Carries\": 4.080459770114943,\n      \"Touches\": 39.367816091954026,\n      \"Expected Assists\": 0.132183908045977,\n      \"Progressive Passes\": 2.0689655172413794,\n      \"Passes\": 18.10344827586207,\n      \"Interceptions\": 0.632183908045977,\n      \"Possession-Winning-Tackles\": 0.7471264367816093,\n      \"Aerials Won\": 2.6436781609195403,\n      \"Pos\": \"Forward\",\n      \"Non-Penalty Expected Goals\": 0.34,\n      \"cluster\": 0,\n      \"Component 1\": 2.7525001921175214,\n      \"Component 2\": -0.4261303055168687\n    },\n    {\n      \"Unnamed: 0\": 993,\n      \"Player\": \"Daniele Verde\",\n      \"Progressive Carries\": 4.838709677419355,\n      \"Touches\": 46.40552995391705,\n      \"Expected Assists\": 0.2258064516129032,\n      \"Progressive Passes\": 3.5023041474654377,\n      \"Passes\": 26.589861751152075,\n      \"Interceptions\": 1.3824884792626728,\n      \"Possession-Winning-Tackles\": 0.2304147465437788,\n      \"Aerials Won\": 0.1382488479262673,\n      \"Pos\": \"Winger\",\n      \"Non-Penalty Expected Goals\": 0.18,\n      \"cluster\": 4,\n      \"Component 1\": 1.9684052021544771,\n      \"Component 2\": 1.3159746632848253\n    },\n    {\n      \"Unnamed: 0\": 1035,\n      \"Player\": \"Wilfried Zaha\",\n      \"Progressive Carries\": 7.45928338762215,\n      \"Touches\": 49.93485342019544,\n      \"Expected Assists\": 0.1563517915309446,\n      \"Progressive Passes\": 3.778501628664495,\n      \"Passes\": 24.39739413680782,\n      \"Interceptions\": 0.7817589576547231,\n      \"Possession-Winning-Tackles\": 1.1400651465798046,\n      \"Aerials Won\": 0.6188925081433225,\n      \"Pos\": \"Forward\",\n      \"Non-Penalty Expected Goals\": 0.13,\n      \"cluster\": 4,\n      \"Component 1\": 1.2209001875618104,\n      \"Component 2\": 1.6240357935638134\n    },\n    {\n      \"Unnamed: 0\": 766,\n      \"Player\": \"Alfonso Pedraza\",\n      \"Progressive Carries\": 7.301587301587302,\n      \"Touches\": 66.45502645502646,\n      \"Expected Assists\": 0.1693121693121693,\n      \"Progressive Passes\": 3.2804232804232805,\n      \"Passes\": 38.78306878306879,\n      \"Interceptions\": 2.9100529100529102,\n      \"Possession-Winning-Tackles\": 0.9523809523809524,\n      \"Aerials Won\": 0.634920634920635,\n      \"Pos\": \"Defender\",\n      \"Non-Penalty Expected Goals\": 0.08,\n      \"cluster\": 2,\n      \"Component 1\": -0.9530027360011945,\n      \"Component 2\": 1.7344103618632658\n    }\n  ],\n  \"column names\": [\n    \"Unnamed: 0\",\n    \"Player\",\n    \"Progressive Carries\",\n    \"Touches\",\n    \"Expected Assists\",\n    \"Progressive Passes\",\n    \"Passes\",\n    \"Interceptions\",\n    \"Possession-Winning-Tackles\",\n    \"Aerials Won\",\n    \"Pos\",\n    \"Non-Penalty Expected Goals\",\n    \"cluster\",\n    \"Component 1\",\n    \"Component 2\"\n  ]\n}\n\nYour Job:\nI am developing a NL to Data Visualization Dataset. \nPlease help me generate natural language utterance for given dataset and constraints.\nDefinition about the Taks:\n- 'utterance' is what a user would say to make a chart. It should be a commands structure. One NL 'utterance' is in one or two sentences. Here are two examples from Commands for reference:\n    Show me a bar graph of the profit for each region.\n    Draw axes for AVG(Horsepower) vs Year, colored by Origin.\n- 'given dataset' is in form of column names, column type, range/unique values of the column.\n- 'constraints' are information about the chart that should be included in the utterance. \n    So we can find a reference phrase in the NL utterance that corresponds to the given constraints. \n- 'reference phrase' can be explicit, ambiguous, and by_value. 'ambiguous' means the phrase can map to more than one columns in the dataset, always a hypernym of column names(depending on the dataset values).\n    For example:\n    {\"column\": \"gdpPercap\", \"nl_ref_type\": \"explicit\", \"nl_ref_phrase\": \"GDP per capita\"},\n    {\"column\": [\"country\",\"continent\"], \"nl_ref_type\": \"ambiguous\", \"nl_ref_phrase\": \"region\"}\n    {\"column\": [\"country\",\"country_short_name\"], \"nl_ref_type\": \"ambiguous\", \"nl_ref_phrase\": \"countries\"}\n    {\"c_type\": \"mark\", \"c_name\": \"point chart\", \"nl_ref_type\": \"explicit\", \"nl_ref_phrase\": \"scatter plot\"}\n    {\"c_type\": \"mark\", \"c_name\": \"arc chart\", \"nl_ref_type\": \"explicit\", \"nl_ref_phrase\": \"pie chart\"}\n    {\"c_type\": \"transform\",\"c_name\": \"filter\",\"c_list\": [{\"field\": \"country\",\"oneOf\": [\"Iceland\",\"Norway\"]}],\"nl_ref_type\": \"explicit\",\"nl_ref_phrase\": \"for countries Iceland and Norway\"},\n    {\"c_type\": \"transform\",\"c_name\": \"filter\",\"c_list\": [{\"field\": \"country\",\"oneOf\": [\"Iceland\",\"Norway\"]}],\"nl_ref_type\": \"by_value\",\"nl_ref_phrase\": \"for Iceland and Norway\"},\n- the 'nl_ref_phrase' for 'ambiguous' columns should be equally near all ambiguous columns, not too near to one of the column since it would not be ambiguous.\n    good example: {\"column\": [\"country\",\"region\"], \"nl_ref_type\": \"ambiguous\", \"nl_ref_phrase\": \"location\"}\n    bad example: {\"column\": [\"country\",\"region\"], \"nl_ref_type\": \"ambiguous\", \"nl_ref_phrase\": \"region\"}\n- You only include given constraints and no other information. \n    For example, if a column name is not in the given constraint, it will not be included in the NL utterance.\n    Also, it a chart mark or chart encoding channel is not in the given constraint, it will not be included in the NL utterance.\n- all 'nl_ref_phrase' shoule be included in the 'nl_utterance'. \n\nThe output format is identical to the input format, but fill in the str blanks(\"...\").\n### Input:\n{\n  \"nl_utterance\": \"...\",\n  \"encoded_fields\": [\n    {\n      \"field\": [\n        \"Component 1\",\n        \"Component 2\"\n      ],\n      \"type\": \"quantitative\",\n      \"nl_ref_type\": \"ambiguous\",\n      \"nl_ref_phrase\": \"...\"\n    },\n    {\n      \"field\": \"Component 2\",\n      \"type\": \"quantitative\",\n      \"nl_ref_type\": \"explicit\",\n      \"nl_ref_phrase\": \"...\"\n    },\n    {\n      \"field\": \"Pos\",\n      \"type\": \"nominal\",\n      \"nl_ref_type\": \"explicit\",\n      \"nl_ref_phrase\": \"...\"\n    }\n  ],\n  \"constraints\": [\n    {\n      \"c_type\": \"task\",\n      \"c_name\": \"correlation\",\n      \"c_list\": [\n        {\n          \"mark\": \"circle\",\n          \"encoding\": {\n            \"x\": {\n              \"type\": \"quantitative\"\n            },\n            \"y\": {\n              \"type\": \"quantitative\"\n            }\n          }\n        }\n      ],\n      \"nl_ref_type\": \"explicit\",\n      \"nl_ref_phrase\": \"...\"\n    },\n    {\n      \"c_type\": \"mark\",\n      \"c_name\": \"point chart\",\n      \"c_list\": [\n        {\n          \"mark\": \"circle\",\n          \"encoding\": {\n            \"x\": {},\n            \"y\": {},\n            \"color\": {\n              \"type\": \"nominal\",\n              \"ignore\": true\n            },\n            \"size\": {\n              \"ignore\": true,\n              \"type\": \"quantitative\"\n            },\n            \"column\": {\n              \"ignore\": true,\n              \"type\": \"nominal\"\n            },\n            \"row\": {\n              \"ignore\": true,\n              \"type\": \"nominal\"\n            }\n          }\n        }\n      ],\n      \"nl_ref_type\": \"explicit\",\n      \"nl_ref_phrase\": \"...\"\n    }\n  ]\n}\n\n### Output:"
}