{
  "gpt_result": {
    "nl_utterance": "Create a scatter plot showing the correlation between Reduced Dimension 1 and Reduced Dimension 2 by location.",
    "encoded_fields": [
      {
        "field": "Reduced Dimension 1",
        "type": "quantitative",
        "nl_ref_type": "explicit",
        "nl_ref_phrase": "Reduced Dimension 1"
      },
      {
        "field": "Reduced Dimension 2",
        "type": "quantitative",
        "nl_ref_type": "explicit",
        "nl_ref_phrase": "Reduced Dimension 2"
      },
      {
        "field": [
          "Continent",
          "Country"
        ],
        "type": "nominal",
        "nl_ref_type": "ambiguous",
        "nl_ref_phrase": "location"
      }
    ],
    "constraints": [
      {
        "c_type": "task",
        "c_name": "correlation",
        "c_list": [
          {
            "mark": "circle",
            "encoding": {
              "x": {
                "type": "quantitative"
              },
              "y": {
                "type": "quantitative"
              }
            }
          }
        ],
        "nl_ref_type": "explicit",
        "nl_ref_phrase": "correlation"
      }
    ]
  },
  "input": "Dataset Information: {\n  \"data samples\": [\n    {\n      \"Country\": \"Afghanistan\",\n      \"Life Expectancy\": 64.3,\n      \"Income\": 1990,\n      \"Infant Mortality\": 54.2,\n      \"Fertility\": 3.77,\n      \"Gini Coefficient\": 39.5,\n      \"Reduced Dimension 1\": 2.058474218,\n      \"Reduced Dimension 2\": -0.617822572,\n      \"Continent\": \"Asia\"\n    },\n    {\n      \"Country\": \"Cyprus\",\n      \"Life Expectancy\": 81.3,\n      \"Income\": 41200,\n      \"Infant Mortality\": 2.09,\n      \"Fertility\": 1.34,\n      \"Gini Coefficient\": 32.7,\n      \"Reduced Dimension 1\": -2.201834217,\n      \"Reduced Dimension 2\": -0.284000655,\n      \"Continent\": \"Europe\"\n    },\n    {\n      \"Country\": \"Turkmenistan\",\n      \"Life Expectancy\": 71.2,\n      \"Income\": 15300,\n      \"Infant Mortality\": 42.8,\n      \"Fertility\": 2.63,\n      \"Gini Coefficient\": 44.7,\n      \"Reduced Dimension 1\": 0.789865865,\n      \"Reduced Dimension 2\": 0.402220035,\n      \"Continent\": \"Asia\"\n    },\n    {\n      \"Country\": \"Portugal\",\n      \"Life Expectancy\": 82.2,\n      \"Income\": 34900,\n      \"Infant Mortality\": 3.13,\n      \"Fertility\": 1.25,\n      \"Gini Coefficient\": 35.6,\n      \"Reduced Dimension 1\": -2.059804505,\n      \"Reduced Dimension 2\": 0.09085119,\n      \"Continent\": \"Europe\"\n    },\n    {\n      \"Country\": \"Mexico\",\n      \"Life Expectancy\": 75.9,\n      \"Income\": 18880,\n      \"Infant Mortality\": 11.9,\n      \"Fertility\": 2.02,\n      \"Gini Coefficient\": 49.1,\n      \"Reduced Dimension 1\": -0.31436996,\n      \"Reduced Dimension 2\": 1.368760767,\n      \"Continent\": \"North America\"\n    }\n  ],\n  \"column names\": [\n    \"Country\",\n    \"Life Expectancy\",\n    \"Income\",\n    \"Infant Mortality\",\n    \"Fertility\",\n    \"Gini Coefficient\",\n    \"Reduced Dimension 1\",\n    \"Reduced Dimension 2\",\n    \"Continent\"\n  ]\n}\n\nYour Job:\nI am developing a NL to Data Visualization Dataset. \nPlease help me generate natural language utterance for given dataset and constraints.\nDefinition about the Taks:\n- 'utterance' is what a user would say to make a chart. It should be a queries structure. One NL 'utterance' is in one or two sentences. Here are two examples from Queries for reference:\n    Scatter plot, sales by profit.\n    mpg vs displacement as a scatter chart.\n- 'given dataset' is in form of column names, column type, range/unique values of the column.\n- 'constraints' are information about the chart that should be included in the utterance. \n    So we can find a reference phrase in the NL utterance that corresponds to the given constraints. \n- 'reference phrase' can be explicit, ambiguous, and by_value. 'ambiguous' means the phrase can map to more than one columns in the dataset, always a hypernym of column names(depending on the dataset values).\n    For example:\n    {\"column\": \"gdpPercap\", \"nl_ref_type\": \"explicit\", \"nl_ref_phrase\": \"GDP per capita\"},\n    {\"column\": [\"country\",\"continent\"], \"nl_ref_type\": \"ambiguous\", \"nl_ref_phrase\": \"region\"}\n    {\"column\": [\"country\",\"country_short_name\"], \"nl_ref_type\": \"ambiguous\", \"nl_ref_phrase\": \"countries\"}\n    {\"c_type\": \"mark\", \"c_name\": \"point chart\", \"nl_ref_type\": \"explicit\", \"nl_ref_phrase\": \"scatter plot\"}\n    {\"c_type\": \"mark\", \"c_name\": \"arc chart\", \"nl_ref_type\": \"explicit\", \"nl_ref_phrase\": \"pie chart\"}\n    {\"c_type\": \"transform\",\"c_name\": \"filter\",\"c_list\": [{\"field\": \"country\",\"oneOf\": [\"Iceland\",\"Norway\"]}],\"nl_ref_type\": \"explicit\",\"nl_ref_phrase\": \"for countries Iceland and Norway\"},\n    {\"c_type\": \"transform\",\"c_name\": \"filter\",\"c_list\": [{\"field\": \"country\",\"oneOf\": [\"Iceland\",\"Norway\"]}],\"nl_ref_type\": \"by_value\",\"nl_ref_phrase\": \"for Iceland and Norway\"},\n- the 'nl_ref_phrase' for 'ambiguous' columns should be equally near all ambiguous columns, not too near to one of the column since it would not be ambiguous.\n    good example: {\"column\": [\"country\",\"region\"], \"nl_ref_type\": \"ambiguous\", \"nl_ref_phrase\": \"location\"}\n    bad example: {\"column\": [\"country\",\"region\"], \"nl_ref_type\": \"ambiguous\", \"nl_ref_phrase\": \"region\"}\n- You only include given constraints and no other information. \n    For example, if a column name is not in the given constraint, it will not be included in the NL utterance.\n    Also, it a chart mark or chart encoding channel is not in the given constraint, it will not be included in the NL utterance.\n- all 'nl_ref_phrase' shoule be included in the 'nl_utterance'. \n\nThe output format is identical to the input format, but fill in the str blanks(\"...\").\n### Input:\n{\n  \"nl_utterance\": \"...\",\n  \"encoded_fields\": [\n    {\n      \"field\": \"Reduced Dimension 1\",\n      \"type\": \"quantitative\",\n      \"nl_ref_type\": \"explicit\",\n      \"nl_ref_phrase\": \"...\"\n    },\n    {\n      \"field\": \"Reduced Dimension 2\",\n      \"type\": \"quantitative\",\n      \"nl_ref_type\": \"explicit\",\n      \"nl_ref_phrase\": \"...\"\n    },\n    {\n      \"field\": [\n        \"Continent\",\n        \"Country\"\n      ],\n      \"type\": \"nominal\",\n      \"nl_ref_type\": \"ambiguous\",\n      \"nl_ref_phrase\": \"...\"\n    }\n  ],\n  \"constraints\": [\n    {\n      \"c_type\": \"task\",\n      \"c_name\": \"correlation\",\n      \"c_list\": [\n        {\n          \"mark\": \"circle\",\n          \"encoding\": {\n            \"x\": {\n              \"type\": \"quantitative\"\n            },\n            \"y\": {\n              \"type\": \"quantitative\"\n            }\n          }\n        }\n      ],\n      \"nl_ref_type\": \"explicit\",\n      \"nl_ref_phrase\": \"...\"\n    }\n  ]\n}\n\n### Output:"
}