{
  "gpt_result": {
    "nl_utterance": "Show me a heatmap chart where both the share of increases and share of decreases are less than 25%, and count the number of occurrences.",
    "encoded_fields": [
      {
        "field": "up_sh",
        "type": "quantitative",
        "nl_ref_type": "explicit",
        "nl_ref_phrase": "share of increases"
      },
      {
        "field": "down_sh",
        "type": "quantitative",
        "nl_ref_type": "explicit",
        "nl_ref_phrase": "share of decreases"
      }
    ],
    "constraints": [
      {
        "c_type": "mark",
        "c_name": "rect chart",
        "c_list": [
          {
            "mark": "rect",
            "encoding": {
              "x": {},
              "y": {},
              "color": {
                "type": "quantitative"
              },
              "column": {
                "ignore": true,
                "type": "nominal"
              },
              "row": {
                "ignore": true,
                "type": "nominal"
              }
            },
            "unique_map": {
              "(x,y)": "color"
            }
          }
        ],
        "nl_ref_type": "explicit",
        "nl_ref_phrase": "heatmap chart"
      },
      {
        "c_type": "transform",
        "c_name": "filter",
        "c_list": [
          {
            "field": "up_sh",
            "lt": 0.25
          }
        ],
        "nl_ref_type": "explicit",
        "nl_ref_phrase": "share of increases are less than 25%"
      },
      {
        "c_type": "transform",
        "c_name": "filter",
        "c_list": [
          {
            "field": "down_sh",
            "lt": 0.25
          }
        ],
        "nl_ref_type": "explicit",
        "nl_ref_phrase": "share of decreases are less than 25%"
      },
      {
        "c_type": "transform",
        "c_name": "aggregate",
        "c_list": [
          {
            "aggregate": "count"
          }
        ],
        "nl_ref_type": "explicit",
        "nl_ref_phrase": "count the number of occurrences"
      }
    ]
  },
  "input": "Dataset Information: {\n  \"data samples\": [\n    {\n      \"date\": 1.0,\n      \"division\": 4,\n      \"up\": 0,\n      \"down\": 0,\n      \"level\": 0,\n      \"up_ch\": NaN,\n      \"down_ch\": NaN,\n      \"total\": 0,\n      \"up_sh\": NaN,\n      \"down_sh\": NaN,\n      \"level_sh\": NaN,\n      \"change_sh\": NaN,\n      \"division_s\": \"Housing, Water, Electricity, Gas and other fuels\",\n      \"division_sh\": \"Housing & utilities\",\n      \"date2\": \"01-02-1988\",\n      \"date4\": \"1988-02-01\",\n      \"year\": 1988.0,\n      \"month\": 2.0,\n      \"quarter\": 1.0\n    },\n    {\n      \"date\": 150.0,\n      \"division\": 4,\n      \"up\": 312,\n      \"down\": 116,\n      \"level\": 2869,\n      \"up_ch\": 0.14285716,\n      \"down_ch\": -0.14306152,\n      \"total\": 3297,\n      \"up_sh\": 0.094631486,\n      \"down_sh\": 0.0351835,\n      \"level_sh\": 0.87018502,\n      \"change_sh\": 0.12981498,\n      \"division_s\": \"Housing, Water, Electricity, Gas and other fuels\",\n      \"division_sh\": \"Housing & utilities\",\n      \"date2\": \"01-07-2000\",\n      \"date4\": \"2000-07-01\",\n      \"year\": 2000.0,\n      \"month\": 7.0,\n      \"quarter\": 3.0\n    },\n    {\n      \"date\": 327.0,\n      \"division\": 5,\n      \"up\": 887,\n      \"down\": 1496,\n      \"level\": 9217,\n      \"up_ch\": 0.22054952,\n      \"down_ch\": -0.20013343,\n      \"total\": 11600,\n      \"up_sh\": 0.076465517,\n      \"down_sh\": 0.12896551,\n      \"level_sh\": 0.79456896,\n      \"change_sh\": 0.20543103,\n      \"division_s\": \"Furnishings, household equipment and maintenance\",\n      \"division_sh\": \"Household\",\n      \"date2\": \"01-04-2015\",\n      \"date4\": \"2015-04-01\",\n      \"year\": 2015.0,\n      \"month\": 4.0,\n      \"quarter\": 2.0\n    }\n  ],\n  \"column names\": [\n    \"date\",\n    \"division\",\n    \"up\",\n    \"down\",\n    \"level\",\n    \"up_ch\",\n    \"down_ch\",\n    \"total\",\n    \"up_sh\",\n    \"down_sh\",\n    \"level_sh\",\n    \"change_sh\",\n    \"division_s\",\n    \"division_sh\",\n    \"date2\",\n    \"date4\",\n    \"year\",\n    \"month\",\n    \"quarter\"\n  ]\n}\n\nYour Job:\nI am developing a NL to Data Visualization Dataset. \nPlease help me generate natural language utterance for given dataset and constraints.\nDefinition about the Taks:\n- 'utterance' is what a user would say to make a chart, it can be a question or a command. One NL 'utterance' is in one or two sentences. \n- 'given dataset' is in form of column names, column type, range/unique values of the column.\n- 'constraints' are information about the chart that should be included in the utterance. \n    So we can find a reference phrase in the NL utterance that corresponds to the given constraints. \n- 'reference phrase' can be explicit, ambiguous, and by_value. 'ambiguous' means the phrase can map to more than one columns in the dataset, always a hypernym of column names(depending on the dataset values).\n    For example:\n    {\"column\": \"gdpPercap\", \"nl_ref_type\": \"explicit\", \"nl_ref_phrase\": \"GDP per capita\"},\n    {\"column\": [\"country\",\"continent\"], \"nl_ref_type\": \"ambiguous\", \"nl_ref_phrase\": \"region\"}\n    {\"column\": [\"country\",\"country_short_name\"], \"nl_ref_type\": \"ambiguous\", \"nl_ref_phrase\": \"countries\"}\n    {\"c_type\": \"mark\", \"c_name\": \"point chart\", \"nl_ref_type\": \"explicit\", \"nl_ref_phrase\": \"scatter plot\"}\n    {\"c_type\": \"mark\", \"c_name\": \"arc chart\", \"nl_ref_type\": \"explicit\", \"nl_ref_phrase\": \"pie chart\"}\n    {\"c_type\": \"transform\",\"c_name\": \"filter\",\"c_list\": [{\"field\": \"country\",\"oneOf\": [\"Iceland\",\"Norway\"]}],\"nl_ref_type\": \"explicit\",\"nl_ref_phrase\": \"for countries Iceland and Norway\"},\n    {\"c_type\": \"transform\",\"c_name\": \"filter\",\"c_list\": [{\"field\": \"country\",\"oneOf\": [\"Iceland\",\"Norway\"]}],\"nl_ref_type\": \"by_value\",\"nl_ref_phrase\": \"for Iceland and Norway\"},\n- the 'nl_ref_phrase' for 'ambiguous' columns should be equally near all ambiguous columns, not too near to one of the column since it would not be ambiguous.\n    good example: {\"column\": [\"country\",\"region\"], \"nl_ref_type\": \"ambiguous\", \"nl_ref_phrase\": \"location\"}\n    bad example: {\"column\": [\"country\",\"region\"], \"nl_ref_type\": \"ambiguous\", \"nl_ref_phrase\": \"region\"}\n- You only include given constraints and no other information. \n    For example, if a column name is not in the given constraint, it will not be included in the NL utterance.\n    Also, it a chart mark or chart encoding channel is not in the given constraint, it will not be included in the NL utterance.\n- all 'nl_ref_phrase' shoule be included in the 'nl_utterance'. \n\nThe output format is identical to the input format, but fill in the str blanks(\"...\").\n### Input:\n{\n  \"nl_utterance\": \"...\",\n  \"encoded_fields\": [\n    {\n      \"field\": \"up_sh\",\n      \"type\": \"quantitative\",\n      \"nl_ref_type\": \"explicit\",\n      \"nl_ref_phrase\": \"...\"\n    },\n    {\n      \"field\": \"down_sh\",\n      \"type\": \"quantitative\",\n      \"nl_ref_type\": \"explicit\",\n      \"nl_ref_phrase\": \"...\"\n    }\n  ],\n  \"constraints\": [\n    {\n      \"c_type\": \"mark\",\n      \"c_name\": \"rect chart\",\n      \"c_list\": [\n        {\n          \"mark\": \"rect\",\n          \"encoding\": {\n            \"x\": {},\n            \"y\": {},\n            \"color\": {\n              \"type\": \"quantitative\"\n            },\n            \"column\": {\n              \"ignore\": true,\n              \"type\": \"nominal\"\n            },\n            \"row\": {\n              \"ignore\": true,\n              \"type\": \"nominal\"\n            }\n          },\n          \"unique_map\": {\n            \"(x,y)\": \"color\"\n          }\n        }\n      ],\n      \"nl_ref_type\": \"explicit\",\n      \"nl_ref_phrase\": \"...\"\n    },\n    {\n      \"c_type\": \"transform\",\n      \"c_name\": \"filter\",\n      \"c_list\": [\n        {\n          \"field\": \"up_sh\",\n          \"lt\": 0.25\n        }\n      ],\n      \"nl_ref_type\": \"explicit\",\n      \"nl_ref_phrase\": \"...\"\n    },\n    {\n      \"c_type\": \"transform\",\n      \"c_name\": \"filter\",\n      \"c_list\": [\n        {\n          \"field\": \"down_sh\",\n          \"lt\": 0.25\n        }\n      ],\n      \"nl_ref_type\": \"explicit\",\n      \"nl_ref_phrase\": \"...\"\n    },\n    {\n      \"c_type\": \"transform\",\n      \"c_name\": \"aggregate\",\n      \"c_list\": [\n        {\n          \"aggregate\": \"count\"\n        }\n      ],\n      \"nl_ref_type\": \"explicit\",\n      \"nl_ref_phrase\": \"...\"\n    }\n  ]\n}\n\n### Output:"
}