{
  "gpt_result": {
    "nl_utterance": "What is the average value over time, and can you represent it on a line chart?",
    "encoded_fields": [
      {
        "field": "time.interval_start",
        "type": "temporal",
        "nl_ref_type": "explicit",
        "nl_ref_phrase": "over time"
      },
      {
        "field": "value.average",
        "type": "quantitative",
        "nl_ref_type": "explicit",
        "nl_ref_phrase": "average value"
      }
    ],
    "constraints": [
      {
        "c_type": "mark",
        "c_name": "line chart",
        "c_list": [
          {
            "mark": "line",
            "encoding": {
              "x": {},
              "y": {
                "type": "quantitative"
              },
              "color": {
                "ignore": true,
                "type": "nominal"
              },
              "column": {
                "ignore": true,
                "type": "nominal"
              },
              "row": {
                "ignore": true,
                "type": "nominal"
              }
            },
            "unique_map": {
              "x": "y"
            }
          }
        ],
        "nl_ref_type": "explicit",
        "nl_ref_phrase": "line chart"
      }
    ]
  },
  "input": "Dataset Information: {\n  \"data samples\": [\n    {\n      \"time\": \"{'interval_start': '2018-12-31T00:00:00Z', 'max': '2019-01-06T13:05:41.560000Z', 'min': '2019-01-01T11:18:35.384000Z'}\",\n      \"value\": \"{'average': 0.033399107154636, 'count': 1050, 'max': 0.037315417081117006, 'min': 0.030083676800131003, 'standard deviation': 0.001193542699587}\"\n    },\n    {\n      \"time\": \"{'interval_start': '2022-02-07T00:00:00Z', 'max': '2022-02-13T14:43:25.731000Z', 'min': '2022-02-07T14:54:32.376000Z'}\",\n      \"value\": \"{'average': 0.035044945230476, 'count': 829, 'max': 0.044316299259662004, 'min': 0.027354717254638002, 'standard deviation': 0.0023335959621380003}\"\n    },\n    {\n      \"time\": \"{'interval_start': '2019-11-25T00:00:00Z', 'max': '2019-12-01T13:36:28.373000Z', 'min': '2019-11-25T12:07:18.964000Z'}\",\n      \"value\": \"{'average': 0.03074133818477, 'count': 1253, 'max': 0.039016980677843004, 'min': 0.024894982576370003, 'standard deviation': 0.0016263998221190002}\"\n    },\n    {\n      \"time\": \"{'interval_start': '2020-02-17T00:00:00Z', 'max': '2020-02-23T14:03:00.643000Z', 'min': '2020-02-17T12:32:19.380000Z'}\",\n      \"value\": \"{'average': 0.033124325385792006, 'count': 1128, 'max': 0.038922190666198, 'min': 0.023273553699254, 'standard deviation': 0.002414836474487}\"\n    },\n    {\n      \"time\": \"{'interval_start': '2022-05-02T00:00:00Z', 'max': '2022-05-08T16:09:11.305000Z', 'min': '2022-05-02T16:19:37.357000Z'}\",\n      \"value\": \"{'average': 0.031981010087625, 'count': 763, 'max': 0.040257539600133, 'min': 0.025472292676568004, 'standard deviation': 0.0017424752977890001}\"\n    }\n  ],\n  \"column names\": [\n    \"time\",\n    \"value\"\n  ]\n}\n\nYour Job:\nI am developing a NL to Data Visualization Dataset. \nPlease help me generate natural language utterance for given dataset and constraints.\nDefinition about the Taks:\n- 'utterance' is what a user would say to make a chart. It should be a questions structure. One NL 'utterance' is in one or two sentences. Here are two examples from Questions for reference:\n    What's the average production budget of the different rated movies, separated by creative type.\n    What is our profit based on shipping mode by customer segment?\n- 'given dataset' is in form of column names, column type, range/unique values of the column.\n- 'constraints' are information about the chart that should be included in the utterance. \n    So we can find a reference phrase in the NL utterance that corresponds to the given constraints. \n- 'reference phrase' can be explicit, ambiguous, and by_value. 'ambiguous' means the phrase can map to more than one columns in the dataset, always a hypernym of column names(depending on the dataset values).\n    For example:\n    {\"column\": \"gdpPercap\", \"nl_ref_type\": \"explicit\", \"nl_ref_phrase\": \"GDP per capita\"},\n    {\"column\": [\"country\",\"continent\"], \"nl_ref_type\": \"ambiguous\", \"nl_ref_phrase\": \"region\"}\n    {\"column\": [\"country\",\"country_short_name\"], \"nl_ref_type\": \"ambiguous\", \"nl_ref_phrase\": \"countries\"}\n    {\"c_type\": \"mark\", \"c_name\": \"point chart\", \"nl_ref_type\": \"explicit\", \"nl_ref_phrase\": \"scatter plot\"}\n    {\"c_type\": \"mark\", \"c_name\": \"arc chart\", \"nl_ref_type\": \"explicit\", \"nl_ref_phrase\": \"pie chart\"}\n    {\"c_type\": \"transform\",\"c_name\": \"filter\",\"c_list\": [{\"field\": \"country\",\"oneOf\": [\"Iceland\",\"Norway\"]}],\"nl_ref_type\": \"explicit\",\"nl_ref_phrase\": \"for countries Iceland and Norway\"},\n    {\"c_type\": \"transform\",\"c_name\": \"filter\",\"c_list\": [{\"field\": \"country\",\"oneOf\": [\"Iceland\",\"Norway\"]}],\"nl_ref_type\": \"by_value\",\"nl_ref_phrase\": \"for Iceland and Norway\"},\n- the 'nl_ref_phrase' for 'ambiguous' columns should be equally near all ambiguous columns, not too near to one of the column since it would not be ambiguous.\n    good example: {\"column\": [\"country\",\"region\"], \"nl_ref_type\": \"ambiguous\", \"nl_ref_phrase\": \"location\"}\n    bad example: {\"column\": [\"country\",\"region\"], \"nl_ref_type\": \"ambiguous\", \"nl_ref_phrase\": \"region\"}\n- You only include given constraints and no other information. \n    For example, if a column name is not in the given constraint, it will not be included in the NL utterance.\n    Also, it a chart mark or chart encoding channel is not in the given constraint, it will not be included in the NL utterance.\n- all 'nl_ref_phrase' shoule be included in the 'nl_utterance'. \n\nThe output format is identical to the input format, but fill in the str blanks(\"...\").\n### Input:\n{\n  \"nl_utterance\": \"...\",\n  \"encoded_fields\": [\n    {\n      \"field\": \"time.interval_start\",\n      \"type\": \"temporal\",\n      \"nl_ref_type\": \"explicit\",\n      \"nl_ref_phrase\": \"...\"\n    },\n    {\n      \"field\": \"value.average\",\n      \"type\": \"quantitative\",\n      \"nl_ref_type\": \"explicit\",\n      \"nl_ref_phrase\": \"...\"\n    }\n  ],\n  \"constraints\": [\n    {\n      \"c_type\": \"mark\",\n      \"c_name\": \"line chart\",\n      \"c_list\": [\n        {\n          \"mark\": \"line\",\n          \"encoding\": {\n            \"x\": {},\n            \"y\": {\n              \"type\": \"quantitative\"\n            },\n            \"color\": {\n              \"ignore\": true,\n              \"type\": \"nominal\"\n            },\n            \"column\": {\n              \"ignore\": true,\n              \"type\": \"nominal\"\n            },\n            \"row\": {\n              \"ignore\": true,\n              \"type\": \"nominal\"\n            }\n          },\n          \"unique_map\": {\n            \"x\": \"y\"\n          }\n        }\n      ],\n      \"nl_ref_type\": \"explicit\",\n      \"nl_ref_phrase\": \"...\"\n    }\n  ]\n}\n\n### Output:"
}