{
  "gpt_result": {
    "nl_utterance": "Visualize the correlation between the Human Development Index value, HDI rank, women's points, and population using a scatter plot.",
    "encoded_fields": [
      {
        "field": [
          "Value",
          "HDI rank"
        ],
        "type": "quantitative",
        "nl_ref_type": "ambiguous",
        "nl_ref_phrase": "Human Development Index value and HDI rank"
      },
      {
        "field": "Womens Points",
        "type": "quantitative",
        "nl_ref_type": "explicit",
        "nl_ref_phrase": "women's points"
      },
      {
        "field": "Population",
        "type": "quantitative",
        "nl_ref_type": "explicit",
        "nl_ref_phrase": "population"
      }
    ],
    "constraints": [
      {
        "c_type": "task",
        "c_name": "correlation",
        "c_list": [
          {
            "mark": "circle",
            "encoding": {
              "x": {
                "type": "quantitative"
              },
              "y": {
                "type": "quantitative"
              }
            }
          }
        ],
        "nl_ref_type": "explicit",
        "nl_ref_phrase": "scatter plot"
      }
    ]
  },
  "input": "Dataset Information: {\n  \"data samples\": [\n    {\n      \"Unnamed: 0\": 0,\n      \"Country Name\": \"Albania\",\n      \"Mens Points\": 1361.81,\n      \"Womens Points\": 1346.01,\n      \"Alpha-3 code\": \"ALB\",\n      \"Percentage Difference\": 1.160220589,\n      \"HDI rank\": 67.0,\n      \"Value\": 0.796,\n      \"Country\": \"Albania\",\n      \"Population\": 2811666\n    },\n    {\n      \"Unnamed: 0\": 63,\n      \"Country Name\": \"Guyana\",\n      \"Mens Points\": 968.74,\n      \"Womens Points\": 1247.77,\n      \"Alpha-3 code\": \"GUY\",\n      \"Percentage Difference\": -28.8033941,\n      \"HDI rank\": 108.0,\n      \"Value\": 0.714,\n      \"Country\": \"Guyana\",\n      \"Population\": 790329\n    },\n    {\n      \"Unnamed: 0\": 91,\n      \"Country Name\": \"Maldives\",\n      \"Mens Points\": 1018.25,\n      \"Womens Points\": 952.73,\n      \"Alpha-3 code\": \"MDV\",\n      \"Percentage Difference\": 6.434569114,\n      \"HDI rank\": 90.0,\n      \"Value\": 0.747,\n      \"Country\": \"Maldives\",\n      \"Population\": 543620\n    },\n    {\n      \"Unnamed: 0\": 103,\n      \"Country Name\": \"Nepal\",\n      \"Mens Points\": 950.45,\n      \"Womens Points\": 1196.73,\n      \"Alpha-3 code\": \"NPL\",\n      \"Percentage Difference\": -25.91193645,\n      \"HDI rank\": 143.0,\n      \"Value\": 0.602,\n      \"Country\": \"Nepal\",\n      \"Population\": 29674920\n    },\n    {\n      \"Unnamed: 0\": 112,\n      \"Country Name\": \"Panama\",\n      \"Mens Points\": 1389.27,\n      \"Womens Points\": 1425.65,\n      \"Alpha-3 code\": \"PAN\",\n      \"Percentage Difference\": -2.618641445,\n      \"HDI rank\": 61.0,\n      \"Value\": 0.805,\n      \"Country\": \"Panama\",\n      \"Population\": 4381583\n    }\n  ],\n  \"column names\": [\n    \"Unnamed: 0\",\n    \"Country Name\",\n    \"Mens Points\",\n    \"Womens Points\",\n    \"Alpha-3 code\",\n    \"Percentage Difference\",\n    \"HDI rank\",\n    \"Value\",\n    \"Country\",\n    \"Population\"\n  ]\n}\n\nYour Job:\nI am developing a NL to Data Visualization Dataset. \nPlease help me generate natural language utterance for given dataset and constraints.\nDefinition about the Taks:\n- 'utterance' is what a user would say to make a chart.  One NL 'utterance' is in one or two sentences. Here are two examples from Others for reference:\n    scatter(x=production budget, y=worldwide gross) for content rating.\n    I want to know how many orders there are by the quantity of the order.\n- 'given dataset' is in form of column names, column type, range/unique values of the column.\n- 'constraints' are information about the chart that should be included in the utterance. \n    So we can find a reference phrase in the NL utterance that corresponds to the given constraints. \n- 'reference phrase' can be explicit, ambiguous, and by_value. 'ambiguous' means the phrase can map to more than one columns in the dataset, always a hypernym of column names(depending on the dataset values).\n    For example:\n    {\"column\": \"gdpPercap\", \"nl_ref_type\": \"explicit\", \"nl_ref_phrase\": \"GDP per capita\"},\n    {\"column\": [\"country\",\"continent\"], \"nl_ref_type\": \"ambiguous\", \"nl_ref_phrase\": \"region\"}\n    {\"column\": [\"country\",\"country_short_name\"], \"nl_ref_type\": \"ambiguous\", \"nl_ref_phrase\": \"countries\"}\n    {\"c_type\": \"mark\", \"c_name\": \"point chart\", \"nl_ref_type\": \"explicit\", \"nl_ref_phrase\": \"scatter plot\"}\n    {\"c_type\": \"mark\", \"c_name\": \"arc chart\", \"nl_ref_type\": \"explicit\", \"nl_ref_phrase\": \"pie chart\"}\n    {\"c_type\": \"transform\",\"c_name\": \"filter\",\"c_list\": [{\"field\": \"country\",\"oneOf\": [\"Iceland\",\"Norway\"]}],\"nl_ref_type\": \"explicit\",\"nl_ref_phrase\": \"for countries Iceland and Norway\"},\n    {\"c_type\": \"transform\",\"c_name\": \"filter\",\"c_list\": [{\"field\": \"country\",\"oneOf\": [\"Iceland\",\"Norway\"]}],\"nl_ref_type\": \"by_value\",\"nl_ref_phrase\": \"for Iceland and Norway\"},\n- the 'nl_ref_phrase' for 'ambiguous' columns should be equally near all ambiguous columns, not too near to one of the column since it would not be ambiguous.\n    good example: {\"column\": [\"country\",\"region\"], \"nl_ref_type\": \"ambiguous\", \"nl_ref_phrase\": \"location\"}\n    bad example: {\"column\": [\"country\",\"region\"], \"nl_ref_type\": \"ambiguous\", \"nl_ref_phrase\": \"region\"}\n- You only include given constraints and no other information. \n    For example, if a column name is not in the given constraint, it will not be included in the NL utterance.\n    Also, it a chart mark or chart encoding channel is not in the given constraint, it will not be included in the NL utterance.\n- all 'nl_ref_phrase' shoule be included in the 'nl_utterance'. \n\nThe output format is identical to the input format, but fill in the str blanks(\"...\").\n### Input:\n{\n  \"nl_utterance\": \"...\",\n  \"encoded_fields\": [\n    {\n      \"field\": [\n        \"Value\",\n        \"HDI rank\"\n      ],\n      \"type\": \"quantitative\",\n      \"nl_ref_type\": \"ambiguous\",\n      \"nl_ref_phrase\": \"...\"\n    },\n    {\n      \"field\": \"Womens Points\",\n      \"type\": \"quantitative\",\n      \"nl_ref_type\": \"explicit\",\n      \"nl_ref_phrase\": \"...\"\n    },\n    {\n      \"field\": \"Population\",\n      \"type\": \"quantitative\",\n      \"nl_ref_type\": \"explicit\",\n      \"nl_ref_phrase\": \"...\"\n    }\n  ],\n  \"constraints\": [\n    {\n      \"c_type\": \"task\",\n      \"c_name\": \"correlation\",\n      \"c_list\": [\n        {\n          \"mark\": \"circle\",\n          \"encoding\": {\n            \"x\": {\n              \"type\": \"quantitative\"\n            },\n            \"y\": {\n              \"type\": \"quantitative\"\n            }\n          }\n        }\n      ],\n      \"nl_ref_type\": \"explicit\",\n      \"nl_ref_phrase\": \"...\"\n    }\n  ]\n}\n\n### Output:"
}