{
  "gpt_result": {
    "nl_utterance": "Generate a line chart to show the sum of IMF Credit to GDP ratio over time.",
    "encoded_fields": [
      {
        "field": [
          "Date",
          "Year"
        ],
        "type": "quantitative",
        "nl_ref_type": "ambiguous",
        "nl_ref_phrase": "time"
      },
      {
        "field": "IMF Credit/GDP",
        "type": "quantitative",
        "nl_ref_type": "explicit",
        "nl_ref_phrase": "IMF Credit to GDP ratio"
      }
    ],
    "constraints": [
      {
        "c_type": "transform",
        "c_name": "aggregate",
        "c_list": [
          {
            "field": "IMF Credit/GDP",
            "aggregate": "sum"
          }
        ],
        "nl_ref_type": "explicit",
        "nl_ref_phrase": "sum"
      }
    ]
  },
  "input": "Dataset Information: {\n  \"data samples\": [\n    {\n      \"Date\": \"09/30/2022\",\n      \"GRA Purchases\": 91088136681,\n      \"PRGT 1/2/\": 15386591496,\n      \"Totals\": 106000000000.0,\n      \"Year\": 2022,\n      \"Total (Billion)\": 106.48,\n      \"Total ($)\": 138.56,\n      \"GDP, current prices (Billions of U.S. dollars)\": 103496.115,\n      \"IMF Credit/GDP\": 0.13,\n      \"Unnamed: 9\": NaN,\n      \"Unnamed: 10\": NaN,\n      \"Unnamed: 11\": NaN,\n      \"Unnamed: 12\": NaN,\n      \"Unnamed: 13\": NaN,\n      \"As of 31/08/22\": \"1 SDR =\",\n      \"$\": 1.30134\n    },\n    {\n      \"Date\": \"12/31/2006\",\n      \"GRA Purchases\": 9822640239,\n      \"PRGT 1/2/\": 3844020520,\n      \"Totals\": 13666660759.0,\n      \"Year\": 2006,\n      \"Total (Billion)\": 13.67,\n      \"Total ($)\": 17.78,\n      \"GDP, current prices (Billions of U.S. dollars)\": 51783.269,\n      \"IMF Credit/GDP\": 0.03,\n      \"Unnamed: 9\": NaN,\n      \"Unnamed: 10\": NaN,\n      \"Unnamed: 11\": NaN,\n      \"Unnamed: 12\": NaN,\n      \"Unnamed: 13\": NaN,\n      \"As of 31/08/22\": NaN,\n      \"$\": NaN\n    },\n    {\n      \"Date\": \"12/31/1986\",\n      \"GRA Purchases\": 33334905644,\n      \"PRGT 1/2/\": 2013169931,\n      \"Totals\": 35348075575.0,\n      \"Year\": 1986,\n      \"Total (Billion)\": 35.35,\n      \"Total ($)\": 46.0,\n      \"GDP, current prices (Billions of U.S. dollars)\": 14776.085,\n      \"IMF Credit/GDP\": 0.31,\n      \"Unnamed: 9\": NaN,\n      \"Unnamed: 10\": NaN,\n      \"Unnamed: 11\": NaN,\n      \"Unnamed: 12\": NaN,\n      \"Unnamed: 13\": NaN,\n      \"As of 31/08/22\": NaN,\n      \"$\": NaN\n    },\n    {\n      \"Date\": \"12/31/1997\",\n      \"GRA Purchases\": 46559033783,\n      \"PRGT 1/2/\": 6009867422,\n      \"Totals\": 52568901205.0,\n      \"Year\": 1997,\n      \"Total (Billion)\": 52.57,\n      \"Total ($)\": 68.41,\n      \"GDP, current prices (Billions of U.S. dollars)\": 31990.92,\n      \"IMF Credit/GDP\": 0.21,\n      \"Unnamed: 9\": NaN,\n      \"Unnamed: 10\": NaN,\n      \"Unnamed: 11\": NaN,\n      \"Unnamed: 12\": NaN,\n      \"Unnamed: 13\": NaN,\n      \"As of 31/08/22\": NaN,\n      \"$\": NaN\n    },\n    {\n      \"Date\": \"12/31/2007\",\n      \"GRA Purchases\": 6036146757,\n      \"PRGT 1/2/\": 3796945581,\n      \"Totals\": 9833092338.0,\n      \"Year\": 2007,\n      \"Total (Billion)\": 9.83,\n      \"Total ($)\": 12.8,\n      \"GDP, current prices (Billions of U.S. dollars)\": 58461.908,\n      \"IMF Credit/GDP\": 0.02,\n      \"Unnamed: 9\": NaN,\n      \"Unnamed: 10\": NaN,\n      \"Unnamed: 11\": NaN,\n      \"Unnamed: 12\": NaN,\n      \"Unnamed: 13\": NaN,\n      \"As of 31/08/22\": NaN,\n      \"$\": NaN\n    }\n  ],\n  \"column names\": [\n    \"Date\",\n    \"GRA Purchases\",\n    \"PRGT 1/2/\",\n    \"Totals\",\n    \"Year\",\n    \"Total (Billion)\",\n    \"Total ($)\",\n    \"GDP, current prices (Billions of U.S. dollars)\",\n    \"IMF Credit/GDP\",\n    \"Unnamed: 9\",\n    \"Unnamed: 10\",\n    \"Unnamed: 11\",\n    \"Unnamed: 12\",\n    \"Unnamed: 13\",\n    \"As of 31/08/22\",\n    \"$\"\n  ]\n}\n\nYour Job:\nI am developing a NL to Data Visualization Dataset. \nPlease help me generate natural language utterance for given dataset and constraints.\nDefinition about the Taks:\n- 'utterance' is what a user would say to make a chart. It should be a commands structure. One NL 'utterance' is in one or two sentences. Here are two examples from Commands for reference:\n    Make a simple scatter plot of worldwide Gross by Production Budget categorized by Major Genre.\n    Please show me a histogram of weights with 500 intervals.\n- 'given dataset' is in form of column names, column type, range/unique values of the column.\n- 'constraints' are information about the chart that should be included in the utterance. \n    So we can find a reference phrase in the NL utterance that corresponds to the given constraints. \n- 'reference phrase' can be explicit, ambiguous, and by_value. 'ambiguous' means the phrase can map to more than one columns in the dataset, always a hypernym of column names(depending on the dataset values).\n    For example:\n    {\"column\": \"gdpPercap\", \"nl_ref_type\": \"explicit\", \"nl_ref_phrase\": \"GDP per capita\"},\n    {\"column\": [\"country\",\"continent\"], \"nl_ref_type\": \"ambiguous\", \"nl_ref_phrase\": \"region\"}\n    {\"column\": [\"country\",\"country_short_name\"], \"nl_ref_type\": \"ambiguous\", \"nl_ref_phrase\": \"countries\"}\n    {\"c_type\": \"mark\", \"c_name\": \"point chart\", \"nl_ref_type\": \"explicit\", \"nl_ref_phrase\": \"scatter plot\"}\n    {\"c_type\": \"mark\", \"c_name\": \"arc chart\", \"nl_ref_type\": \"explicit\", \"nl_ref_phrase\": \"pie chart\"}\n    {\"c_type\": \"transform\",\"c_name\": \"filter\",\"c_list\": [{\"field\": \"country\",\"oneOf\": [\"Iceland\",\"Norway\"]}],\"nl_ref_type\": \"explicit\",\"nl_ref_phrase\": \"for countries Iceland and Norway\"},\n    {\"c_type\": \"transform\",\"c_name\": \"filter\",\"c_list\": [{\"field\": \"country\",\"oneOf\": [\"Iceland\",\"Norway\"]}],\"nl_ref_type\": \"by_value\",\"nl_ref_phrase\": \"for Iceland and Norway\"},\n- the 'nl_ref_phrase' for 'ambiguous' columns should be equally near all ambiguous columns, not too near to one of the column since it would not be ambiguous.\n    good example: {\"column\": [\"country\",\"region\"], \"nl_ref_type\": \"ambiguous\", \"nl_ref_phrase\": \"location\"}\n    bad example: {\"column\": [\"country\",\"region\"], \"nl_ref_type\": \"ambiguous\", \"nl_ref_phrase\": \"region\"}\n- You only include given constraints and no other information. \n    For example, if a column name is not in the given constraint, it will not be included in the NL utterance.\n    Also, it a chart mark or chart encoding channel is not in the given constraint, it will not be included in the NL utterance.\n- all 'nl_ref_phrase' shoule be included in the 'nl_utterance'. \n\nThe output format is identical to the input format, but fill in the str blanks(\"...\").\n### Input:\n{\n  \"nl_utterance\": \"...\",\n  \"encoded_fields\": [\n    {\n      \"field\": [\n        \"Date\",\n        \"Year\"\n      ],\n      \"type\": \"quantitative\",\n      \"nl_ref_type\": \"ambiguous\",\n      \"nl_ref_phrase\": \"...\"\n    },\n    {\n      \"field\": \"IMF Credit/GDP\",\n      \"type\": \"quantitative\",\n      \"nl_ref_type\": \"explicit\",\n      \"nl_ref_phrase\": \"...\"\n    }\n  ],\n  \"constraints\": [\n    {\n      \"c_type\": \"transform\",\n      \"c_name\": \"aggregate\",\n      \"c_list\": [\n        {\n          \"field\": \"IMF Credit/GDP\",\n          \"aggregate\": \"sum\"\n        }\n      ],\n      \"nl_ref_type\": \"explicit\",\n      \"nl_ref_phrase\": \"...\"\n    }\n  ]\n}\n\n### Output:"
}