{
  "gpt_result": {
    "nl_utterance": "Show the Value for each LOCATION, excluding those from the OECD.",
    "encoded_fields": [
      {
        "field": "Value",
        "type": "quantitative",
        "nl_ref_type": "explicit",
        "nl_ref_phrase": "Value"
      },
      {
        "field": "LOCATION",
        "type": "nominal",
        "nl_ref_type": "explicit",
        "nl_ref_phrase": "LOCATION"
      }
    ],
    "constraints": [
      {
        "c_type": "transform",
        "c_name": "filter",
        "c_list": [
          "datum.LOCATION!='OECD'"
        ],
        "nl_ref_type": "explicit",
        "nl_ref_phrase": "excluding those from the OECD"
      }
    ]
  },
  "input": "Dataset Information: {\n  \"data samples\": [\n    {\n      \"LOCATION\": \"CAN\",\n      \"INDICATOR\": \"GDPHRWKD\",\n      \"SUBJECT\": \"TOT\",\n      \"MEASURE\": \"USD\",\n      \"FREQUENCY\": \"A\",\n      \"TIME\": 1970,\n      \"Value\": 28.629921,\n      \"Flag Codes\": NaN\n    },\n    {\n      \"LOCATION\": \"FRA\",\n      \"INDICATOR\": \"GDPHRWKD\",\n      \"SUBJECT\": \"TOT\",\n      \"MEASURE\": \"USD\",\n      \"FREQUENCY\": \"A\",\n      \"TIME\": 1977,\n      \"Value\": 32.177911,\n      \"Flag Codes\": NaN\n    },\n    {\n      \"LOCATION\": \"CAN\",\n      \"INDICATOR\": \"GDPHRWKD\",\n      \"SUBJECT\": \"TOT\",\n      \"MEASURE\": \"USD\",\n      \"FREQUENCY\": \"A\",\n      \"TIME\": 1982,\n      \"Value\": 34.95985,\n      \"Flag Codes\": NaN\n    },\n    {\n      \"LOCATION\": \"GBR\",\n      \"INDICATOR\": \"GDPHRWKD\",\n      \"SUBJECT\": \"TOT\",\n      \"MEASURE\": \"USD\",\n      \"FREQUENCY\": \"A\",\n      \"TIME\": 1992,\n      \"Value\": 41.846252,\n      \"Flag Codes\": NaN\n    },\n    {\n      \"LOCATION\": \"DEU\",\n      \"INDICATOR\": \"GDPHRWKD\",\n      \"SUBJECT\": \"TOT\",\n      \"MEASURE\": \"USD\",\n      \"FREQUENCY\": \"A\",\n      \"TIME\": 2016,\n      \"Value\": 65.248665,\n      \"Flag Codes\": NaN\n    }\n  ],\n  \"column names\": [\n    \"LOCATION\",\n    \"INDICATOR\",\n    \"SUBJECT\",\n    \"MEASURE\",\n    \"FREQUENCY\",\n    \"TIME\",\n    \"Value\",\n    \"Flag Codes\"\n  ]\n}\n\nYour Job:\nI am developing a NL to Data Visualization Dataset. \nPlease help me generate natural language utterance for given dataset and constraints.\nDefinition about the Taks:\n- 'utterance' is what a user would say to make a chart. It should be a queries structure. One NL 'utterance' is in one or two sentences. Here are two examples from Queries for reference:\n    Cylinders average mpg.\n    Group cars by countries and cylinders.\n- 'given dataset' is in form of column names, column type, range/unique values of the column.\n- 'constraints' are information about the chart that should be included in the utterance. \n    So we can find a reference phrase in the NL utterance that corresponds to the given constraints. \n- 'reference phrase' can be explicit, ambiguous, and by_value. 'ambiguous' means the phrase can map to more than one columns in the dataset, always a hypernym of column names(depending on the dataset values).\n    For example:\n    {\"column\": \"gdpPercap\", \"nl_ref_type\": \"explicit\", \"nl_ref_phrase\": \"GDP per capita\"},\n    {\"column\": [\"country\",\"continent\"], \"nl_ref_type\": \"ambiguous\", \"nl_ref_phrase\": \"region\"}\n    {\"column\": [\"country\",\"country_short_name\"], \"nl_ref_type\": \"ambiguous\", \"nl_ref_phrase\": \"countries\"}\n    {\"c_type\": \"mark\", \"c_name\": \"point chart\", \"nl_ref_type\": \"explicit\", \"nl_ref_phrase\": \"scatter plot\"}\n    {\"c_type\": \"mark\", \"c_name\": \"arc chart\", \"nl_ref_type\": \"explicit\", \"nl_ref_phrase\": \"pie chart\"}\n    {\"c_type\": \"transform\",\"c_name\": \"filter\",\"c_list\": [{\"field\": \"country\",\"oneOf\": [\"Iceland\",\"Norway\"]}],\"nl_ref_type\": \"explicit\",\"nl_ref_phrase\": \"for countries Iceland and Norway\"},\n    {\"c_type\": \"transform\",\"c_name\": \"filter\",\"c_list\": [{\"field\": \"country\",\"oneOf\": [\"Iceland\",\"Norway\"]}],\"nl_ref_type\": \"by_value\",\"nl_ref_phrase\": \"for Iceland and Norway\"},\n- the 'nl_ref_phrase' for 'ambiguous' columns should be equally near all ambiguous columns, not too near to one of the column since it would not be ambiguous.\n    good example: {\"column\": [\"country\",\"region\"], \"nl_ref_type\": \"ambiguous\", \"nl_ref_phrase\": \"location\"}\n    bad example: {\"column\": [\"country\",\"region\"], \"nl_ref_type\": \"ambiguous\", \"nl_ref_phrase\": \"region\"}\n- You only include given constraints and no other information. \n    For example, if a column name is not in the given constraint, it will not be included in the NL utterance.\n    Also, it a chart mark or chart encoding channel is not in the given constraint, it will not be included in the NL utterance.\n- all 'nl_ref_phrase' shoule be included in the 'nl_utterance'. \n\nThe output format is identical to the input format, but fill in the str blanks(\"...\").\n### Input:\n{\n  \"nl_utterance\": \"...\",\n  \"encoded_fields\": [\n    {\n      \"field\": \"Value\",\n      \"type\": \"quantitative\",\n      \"nl_ref_type\": \"explicit\",\n      \"nl_ref_phrase\": \"...\"\n    },\n    {\n      \"field\": \"LOCATION\",\n      \"type\": \"nominal\",\n      \"nl_ref_type\": \"explicit\",\n      \"nl_ref_phrase\": \"...\"\n    }\n  ],\n  \"constraints\": [\n    {\n      \"c_type\": \"transform\",\n      \"c_name\": \"filter\",\n      \"c_list\": [\n        \"datum.LOCATION!='OECD'\"\n      ],\n      \"nl_ref_type\": \"explicit\",\n      \"nl_ref_phrase\": \"...\"\n    }\n  ]\n}\n\n### Output:"
}