{
  "gpt_result": {
    "nl_utterance": "Create a bar chart showing Democracy Index by Regime, sorted by the ascending mean of the Democracy Index.",
    "encoded_fields": [
      {
        "field": "democracy_eiu",
        "type": "quantitative",
        "nl_ref_type": "explicit",
        "nl_ref_phrase": "Democracy Index"
      },
      {
        "field": "Regime",
        "type": "nominal",
        "nl_ref_type": "explicit",
        "nl_ref_phrase": "Regime"
      }
    ],
    "constraints": [
      {
        "c_type": "mark",
        "c_name": "bar chart",
        "c_list": [
          {
            "mark": "bar",
            "encoding": {
              "x": {},
              "y": {
                "type": "quantitative"
              },
              "color": {
                "type": "nominal",
                "ignore": true
              },
              "column": {
                "ignore": true,
                "type": "nominal"
              },
              "row": {
                "ignore": true,
                "type": "nominal"
              }
            },
            "unique_map": {
              "x": "y"
            }
          },
          {
            "mark": "bar",
            "encoding": {
              "y": {},
              "x": {
                "type": "quantitative"
              },
              "color": {
                "type": "nominal",
                "ignore": true
              },
              "column": {
                "ignore": true,
                "type": "nominal"
              },
              "row": {
                "ignore": true,
                "type": "nominal"
              }
            },
            "unique_map": {
              "y": "x"
            }
          }
        ],
        "nl_ref_type": "explicit",
        "nl_ref_phrase": "bar chart"
      },
      {
        "c_type": "transform",
        "c_name": "sort",
        "c_list": [
          {
            "op": "mean",
            "order": "ascending",
            "field": "democracy_eiu"
          }
        ],
        "nl_ref_type": "explicit",
        "nl_ref_phrase": "sorted by the ascending mean of the Democracy Index"
      }
    ]
  },
  "input": "Dataset Information: {\n  \"data samples\": [\n    {\n      \"ISO3\": \"AFG\",\n      \"Year\": 2021,\n      \"democracy_eiu\": 0.32,\n      \"Country\": \"Afghanistan\",\n      \"GDP\": 14786861638.0,\n      \"Region\": \"South Asia\",\n      \"Regime\": \"Authoritarian Regime\",\n      \"Sources\": NaN\n    },\n    {\n      \"ISO3\": \"MDG\",\n      \"Year\": 2021,\n      \"democracy_eiu\": 5.7,\n      \"Country\": \"Madagascar\",\n      \"GDP\": 14472603323.0,\n      \"Region\": \"Sub-Saharan Africa\",\n      \"Regime\": \"Hybrid Regime\",\n      \"Sources\": NaN\n    },\n    {\n      \"ISO3\": \"GAB\",\n      \"Year\": 2021,\n      \"democracy_eiu\": 3.4,\n      \"Country\": \"Gabon\",\n      \"GDP\": 20216843174.0,\n      \"Region\": \"Sub-Saharan Africa\",\n      \"Regime\": \"Authoritarian Regime\",\n      \"Sources\": NaN\n    },\n    {\n      \"ISO3\": \"DOM\",\n      \"Year\": 2021,\n      \"democracy_eiu\": 6.45,\n      \"Country\": \"Dominican Republic\",\n      \"GDP\": 94243453937.0,\n      \"Region\": \"Latin America & Caribbean\",\n      \"Regime\": \"Flawed Democracy\",\n      \"Sources\": NaN\n    },\n    {\n      \"ISO3\": \"VNM\",\n      \"Year\": 2021,\n      \"democracy_eiu\": 2.94,\n      \"Country\": \"Viet Nam\",\n      \"GDP\": 366000000000.0,\n      \"Region\": \"East Asia & Pacific\",\n      \"Regime\": \"Authoritarian Regime\",\n      \"Sources\": NaN\n    }\n  ],\n  \"column names\": [\n    \"ISO3\",\n    \"Year\",\n    \"democracy_eiu\",\n    \"Country\",\n    \"GDP\",\n    \"Region\",\n    \"Regime\",\n    \"Sources\"\n  ]\n}\n\nYour Job:\nI am developing a NL to Data Visualization Dataset. \nPlease help me generate natural language utterance for given dataset and constraints.\nDefinition about the Taks:\n- 'utterance' is what a user would say to make a chart. It should be a queries structure. One NL 'utterance' is in one or two sentences. Here are two examples from Queries for reference:\n    Coloring by Orign, Plot Displacement by MPG.\n    Line Graph of SUM (Sales Forecast) vs Order Date.\n- 'given dataset' is in form of column names, column type, range/unique values of the column.\n- 'constraints' are information about the chart that should be included in the utterance. \n    So we can find a reference phrase in the NL utterance that corresponds to the given constraints. \n- 'reference phrase' can be explicit, ambiguous, and by_value. 'ambiguous' means the phrase can map to more than one columns in the dataset, always a hypernym of column names(depending on the dataset values).\n    For example:\n    {\"column\": \"gdpPercap\", \"nl_ref_type\": \"explicit\", \"nl_ref_phrase\": \"GDP per capita\"},\n    {\"column\": [\"country\",\"continent\"], \"nl_ref_type\": \"ambiguous\", \"nl_ref_phrase\": \"region\"}\n    {\"column\": [\"country\",\"country_short_name\"], \"nl_ref_type\": \"ambiguous\", \"nl_ref_phrase\": \"countries\"}\n    {\"c_type\": \"mark\", \"c_name\": \"point chart\", \"nl_ref_type\": \"explicit\", \"nl_ref_phrase\": \"scatter plot\"}\n    {\"c_type\": \"mark\", \"c_name\": \"arc chart\", \"nl_ref_type\": \"explicit\", \"nl_ref_phrase\": \"pie chart\"}\n    {\"c_type\": \"transform\",\"c_name\": \"filter\",\"c_list\": [{\"field\": \"country\",\"oneOf\": [\"Iceland\",\"Norway\"]}],\"nl_ref_type\": \"explicit\",\"nl_ref_phrase\": \"for countries Iceland and Norway\"},\n    {\"c_type\": \"transform\",\"c_name\": \"filter\",\"c_list\": [{\"field\": \"country\",\"oneOf\": [\"Iceland\",\"Norway\"]}],\"nl_ref_type\": \"by_value\",\"nl_ref_phrase\": \"for Iceland and Norway\"},\n- the 'nl_ref_phrase' for 'ambiguous' columns should be equally near all ambiguous columns, not too near to one of the column since it would not be ambiguous.\n    good example: {\"column\": [\"country\",\"region\"], \"nl_ref_type\": \"ambiguous\", \"nl_ref_phrase\": \"location\"}\n    bad example: {\"column\": [\"country\",\"region\"], \"nl_ref_type\": \"ambiguous\", \"nl_ref_phrase\": \"region\"}\n- You only include given constraints and no other information. \n    For example, if a column name is not in the given constraint, it will not be included in the NL utterance.\n    Also, it a chart mark or chart encoding channel is not in the given constraint, it will not be included in the NL utterance.\n- all 'nl_ref_phrase' shoule be included in the 'nl_utterance'. \n\nThe output format is identical to the input format, but fill in the str blanks(\"...\").\n### Input:\n{\n  \"nl_utterance\": \"...\",\n  \"encoded_fields\": [\n    {\n      \"field\": \"democracy_eiu\",\n      \"type\": \"quantitative\",\n      \"nl_ref_type\": \"explicit\",\n      \"nl_ref_phrase\": \"...\"\n    },\n    {\n      \"field\": \"Regime\",\n      \"type\": \"nominal\",\n      \"nl_ref_type\": \"explicit\",\n      \"nl_ref_phrase\": \"...\"\n    }\n  ],\n  \"constraints\": [\n    {\n      \"c_type\": \"mark\",\n      \"c_name\": \"bar chart\",\n      \"c_list\": [\n        {\n          \"mark\": \"bar\",\n          \"encoding\": {\n            \"x\": {},\n            \"y\": {\n              \"type\": \"quantitative\"\n            },\n            \"color\": {\n              \"type\": \"nominal\",\n              \"ignore\": true\n            },\n            \"column\": {\n              \"ignore\": true,\n              \"type\": \"nominal\"\n            },\n            \"row\": {\n              \"ignore\": true,\n              \"type\": \"nominal\"\n            }\n          },\n          \"unique_map\": {\n            \"x\": \"y\"\n          }\n        },\n        {\n          \"mark\": \"bar\",\n          \"encoding\": {\n            \"y\": {},\n            \"x\": {\n              \"type\": \"quantitative\"\n            },\n            \"color\": {\n              \"type\": \"nominal\",\n              \"ignore\": true\n            },\n            \"column\": {\n              \"ignore\": true,\n              \"type\": \"nominal\"\n            },\n            \"row\": {\n              \"ignore\": true,\n              \"type\": \"nominal\"\n            }\n          },\n          \"unique_map\": {\n            \"y\": \"x\"\n          }\n        }\n      ],\n      \"nl_ref_type\": \"explicit\",\n      \"nl_ref_phrase\": \"...\"\n    },\n    {\n      \"c_type\": \"transform\",\n      \"c_name\": \"sort\",\n      \"c_list\": [\n        {\n          \"op\": \"mean\",\n          \"order\": \"ascending\",\n          \"field\": \"democracy_eiu\"\n        }\n      ],\n      \"nl_ref_type\": \"explicit\",\n      \"nl_ref_phrase\": \"...\"\n    }\n  ]\n}\n\n### Output:"
}