{
  "gpt_result": {
    "nl_utterance": "Show a chart of the sum of Debt/GDP per capita against the year and visualize it in relation to economic factors.",
    "encoded_fields": [
      {
        "field": "Years",
        "type": "quantitative",
        "nl_ref_type": "explicit",
        "nl_ref_phrase": "year"
      },
      {
        "field": [
          "Debt/GDP per capita",
          " Per Capita (US $)",
          "Outstanding Debt"
        ],
        "type": "quantitative",
        "nl_ref_type": "ambiguous",
        "nl_ref_phrase": "economic factors"
      }
    ],
    "constraints": [
      {
        "c_type": "transform",
        "c_name": "aggregate",
        "c_list": [
          {
            "field": "Debt/GDP per capita",
            "aggregate": "sum"
          }
        ],
        "nl_ref_type": "explicit",
        "nl_ref_phrase": "sum of Debt/GDP per capita"
      }
    ]
  },
  "input": "Dataset Information: {\n  \"data samples\": [\n    {\n      \"date\": \"31/12/2021\",\n      \" Per Capita (US $)\": 12262.9346,\n      \"Outstanding Debt\": 104029000000.0,\n      \"Debt/GDP per capita\": 8483236.607,\n      \"Years\": 2021.0\n    },\n    {\n      \"date\": \"31/12/1988\",\n      \" Per Capita (US $)\": 3790.8071,\n      \"Outstanding Debt\": 26523969177.0,\n      \"Debt/GDP per capita\": 6996918.724,\n      \"Years\": 1988.0\n    },\n    {\n      \"date\": NaN,\n      \" Per Capita (US $)\": NaN,\n      \"Outstanding Debt\": NaN,\n      \"Debt/GDP per capita\": NaN,\n      \"Years\": NaN\n    },\n    {\n      \"date\": \"31/12/2008\",\n      \" Per Capita (US $)\": 9489.966,\n      \"Outstanding Debt\": 21487336753.0,\n      \"Debt/GDP per capita\": 2264216.411,\n      \"Years\": 2008.0\n    },\n    {\n      \"date\": \"31/12/2001\",\n      \" Per Capita (US $)\": 5427.3912,\n      \"Outstanding Debt\": 59901804093.0,\n      \"Debt/GDP per capita\": 11036942.41,\n      \"Years\": 2001.0\n    }\n  ],\n  \"column names\": [\n    \"date\",\n    \" Per Capita (US $)\",\n    \"Outstanding Debt\",\n    \"Debt/GDP per capita\",\n    \"Years\"\n  ]\n}\n\nYour Job:\nI am developing a NL to Data Visualization Dataset. \nPlease help me generate natural language utterance for given dataset and constraints.\nDefinition about the Taks:\n- 'utterance' is what a user would say to make a chart. It should be a commands structure. One NL 'utterance' is in one or two sentences. Here are two examples from Commands for reference:\n    Give me the number of movies by running time.\n    Draw axes for AVG(Horsepower) vs Year, colored by Origin.\n- 'given dataset' is in form of column names, column type, range/unique values of the column.\n- 'constraints' are information about the chart that should be included in the utterance. \n    So we can find a reference phrase in the NL utterance that corresponds to the given constraints. \n- 'reference phrase' can be explicit, ambiguous, and by_value. 'ambiguous' means the phrase can map to more than one columns in the dataset, always a hypernym of column names(depending on the dataset values).\n    For example:\n    {\"column\": \"gdpPercap\", \"nl_ref_type\": \"explicit\", \"nl_ref_phrase\": \"GDP per capita\"},\n    {\"column\": [\"country\",\"continent\"], \"nl_ref_type\": \"ambiguous\", \"nl_ref_phrase\": \"region\"}\n    {\"column\": [\"country\",\"country_short_name\"], \"nl_ref_type\": \"ambiguous\", \"nl_ref_phrase\": \"countries\"}\n    {\"c_type\": \"mark\", \"c_name\": \"point chart\", \"nl_ref_type\": \"explicit\", \"nl_ref_phrase\": \"scatter plot\"}\n    {\"c_type\": \"mark\", \"c_name\": \"arc chart\", \"nl_ref_type\": \"explicit\", \"nl_ref_phrase\": \"pie chart\"}\n    {\"c_type\": \"transform\",\"c_name\": \"filter\",\"c_list\": [{\"field\": \"country\",\"oneOf\": [\"Iceland\",\"Norway\"]}],\"nl_ref_type\": \"explicit\",\"nl_ref_phrase\": \"for countries Iceland and Norway\"},\n    {\"c_type\": \"transform\",\"c_name\": \"filter\",\"c_list\": [{\"field\": \"country\",\"oneOf\": [\"Iceland\",\"Norway\"]}],\"nl_ref_type\": \"by_value\",\"nl_ref_phrase\": \"for Iceland and Norway\"},\n- the 'nl_ref_phrase' for 'ambiguous' columns should be equally near all ambiguous columns, not too near to one of the column since it would not be ambiguous.\n    good example: {\"column\": [\"country\",\"region\"], \"nl_ref_type\": \"ambiguous\", \"nl_ref_phrase\": \"location\"}\n    bad example: {\"column\": [\"country\",\"region\"], \"nl_ref_type\": \"ambiguous\", \"nl_ref_phrase\": \"region\"}\n- You only include given constraints and no other information. \n    For example, if a column name is not in the given constraint, it will not be included in the NL utterance.\n    Also, it a chart mark or chart encoding channel is not in the given constraint, it will not be included in the NL utterance.\n- all 'nl_ref_phrase' shoule be included in the 'nl_utterance'. \n\nThe output format is identical to the input format, but fill in the str blanks(\"...\").\n### Input:\n{\n  \"nl_utterance\": \"...\",\n  \"encoded_fields\": [\n    {\n      \"field\": \"Years\",\n      \"type\": \"quantitative\",\n      \"nl_ref_type\": \"explicit\",\n      \"nl_ref_phrase\": \"...\"\n    },\n    {\n      \"field\": [\n        \"Debt/GDP per capita\",\n        \" Per Capita (US $)\",\n        \"Outstanding Debt\"\n      ],\n      \"type\": \"quantitative\",\n      \"nl_ref_type\": \"ambiguous\",\n      \"nl_ref_phrase\": \"...\"\n    }\n  ],\n  \"constraints\": [\n    {\n      \"c_type\": \"transform\",\n      \"c_name\": \"aggregate\",\n      \"c_list\": [\n        {\n          \"field\": \"Debt/GDP per capita\",\n          \"aggregate\": \"sum\"\n        }\n      ],\n      \"nl_ref_type\": \"explicit\",\n      \"nl_ref_phrase\": \"...\"\n    }\n  ]\n}\n\n### Output:"
}