{
  "gpt_result": {
    "nl_utterance": "Can you show me a bar chart that represents the distribution of job titles with an aggregated count of employees?",
    "encoded_fields": [],
    "constraints": [
      {
        "c_type": "task",
        "c_name": "distribution",
        "c_list": [
          {
            "mark": "bar",
            "encoding": {
              "y": {
                "aggregate": "count",
                "type": "quantitative"
              }
            },
            "x_y_reversable": true
          },
          {
            "mark": "boxplot",
            "encoding": {
              "x": {
                "type": "quantitative"
              }
            },
            "x_y_reversable": true
          }
        ],
        "nl_ref_type": "explicit",
        "nl_ref_phrase": "distribution"
      },
      {
        "c_type": "mark",
        "c_name": "bar chart",
        "c_list": [
          {
            "mark": "bar",
            "encoding": {
              "x": {},
              "y": {
                "type": "quantitative"
              },
              "color": {
                "type": "nominal",
                "ignore": true
              },
              "column": {
                "ignore": true,
                "type": "nominal"
              },
              "row": {
                "ignore": true,
                "type": "nominal"
              }
            },
            "unique_map": {
              "x": "y"
            }
          },
          {
            "mark": "bar",
            "encoding": {
              "y": {},
              "x": {
                "type": "quantitative"
              },
              "color": {
                "type": "nominal",
                "ignore": true
              },
              "column": {
                "ignore": true,
                "type": "nominal"
              },
              "row": {
                "ignore": true,
                "type": "nominal"
              }
            },
            "unique_map": {
              "y": "x"
            }
          }
        ],
        "nl_ref_type": "explicit",
        "nl_ref_phrase": "bar chart"
      },
      {
        "c_type": "transform",
        "c_name": "aggregate",
        "c_list": [
          {
            "aggregate": "count"
          }
        ],
        "nl_ref_type": "explicit",
        "nl_ref_phrase": "aggregated count"
      }
    ]
  },
  "input": "Dataset Information: {\n  \"data samples\": [\n    {\n      \"Name\": \"ADELMAN, BRUCE E\",\n      \"Job Titles\": \"LEGISLATIVE AIDE\",\n      \"Department\": \"CITY COUNCIL\",\n      \"Full or Part-Time\": \"F\",\n      \"Salary or Hourly\": \"SALARY\",\n      \"Typical Hours\": NaN,\n      \"Annual Salary\": 22248.0,\n      \"Hourly Rate\": NaN,\n      \"Rank\": 1,\n      \"share\": 9e-06,\n      \"cumShareIncome\": 9e-06,\n      \"cumSharePeople\": 4.124e-05,\n      \"shortName\": \"0\"\n    },\n    {\n      \"Name\": \"MUHAMMAD, FARIDUDDIN M\",\n      \"Job Titles\": \"COORD OF ECON DEV I - PLNG & DEV\",\n      \"Department\": \"DEPARTMENT OF PLANNING AND DEVELOPMENT\",\n      \"Full or Part-Time\": \"F\",\n      \"Salary or Hourly\": \"SALARY\",\n      \"Typical Hours\": NaN,\n      \"Annual Salary\": 77892.0,\n      \"Hourly Rate\": NaN,\n      \"Rank\": 4501,\n      \"share\": 3.2e-05,\n      \"cumShareIncome\": 0.116067,\n      \"cumSharePeople\": 0.18563121,\n      \"shortName\": \"0\"\n    },\n    {\n      \"Name\": \"PINTOR, KARINA\",\n      \"Job Titles\": \"POLICE OFFICER\",\n      \"Department\": \"DEPARTMENT OF POLICE\",\n      \"Full or Part-Time\": \"F\",\n      \"Salary or Hourly\": \"SALARY\",\n      \"Typical Hours\": NaN,\n      \"Annual Salary\": 97974.0,\n      \"Hourly Rate\": NaN,\n      \"Rank\": 9725,\n      \"share\": 4.1e-05,\n      \"cumShareIncome\": 0.311735,\n      \"cumSharePeople\": 0.40108055,\n      \"shortName\": \"Police\"\n    },\n    {\n      \"Name\": \"GRAYER, SHELIA D\",\n      \"Job Titles\": \"ADMINISTRATIVE ASST III\",\n      \"Department\": \"DEPARTMENT OF PLANNING AND DEVELOPMENT\",\n      \"Full or Part-Time\": \"F\",\n      \"Salary or Hourly\": \"SALARY\",\n      \"Typical Hours\": NaN,\n      \"Annual Salary\": 93660.0,\n      \"Hourly Rate\": NaN,\n      \"Rank\": 7847,\n      \"share\": 3.9e-05,\n      \"cumShareIncome\": 0.236294,\n      \"cumSharePeople\": 0.32362767,\n      \"shortName\": \"0\"\n    },\n    {\n      \"Name\": \"MENDEZ, GUSTAVO D\",\n      \"Job Titles\": \"CAPTAIN-EMT\",\n      \"Department\": \"FIRE DEPARTMENT\",\n      \"Full or Part-Time\": \"F\",\n      \"Salary or Hourly\": \"SALARY\",\n      \"Typical Hours\": NaN,\n      \"Annual Salary\": 151764.0,\n      \"Hourly Rate\": NaN,\n      \"Rank\": 23778,\n      \"share\": 6.3e-05,\n      \"cumShareIncome\": 0.967062,\n      \"cumSharePeople\": 0.9806574,\n      \"shortName\": \"Fire\"\n    }\n  ],\n  \"column names\": [\n    \"Name\",\n    \"Job Titles\",\n    \"Department\",\n    \"Full or Part-Time\",\n    \"Salary or Hourly\",\n    \"Typical Hours\",\n    \"Annual Salary\",\n    \"Hourly Rate\",\n    \"Rank\",\n    \"share\",\n    \"cumShareIncome\",\n    \"cumSharePeople\",\n    \"shortName\"\n  ]\n}\n\nYour Job:\nI am developing a NL to Data Visualization Dataset. \nPlease help me generate natural language utterance for given dataset and constraints.\nDefinition about the Taks:\n- 'utterance' is what a user would say to make a chart. It should be a questions structure. One NL 'utterance' is in one or two sentences. Here are two examples from Questions for reference:\n    How does displacement relate to fuel economy for cars from Europe vs. USA?\n    What major genre had the highest average worldwide gross?\n- 'given dataset' is in form of column names, column type, range/unique values of the column.\n- 'constraints' are information about the chart that should be included in the utterance. \n    So we can find a reference phrase in the NL utterance that corresponds to the given constraints. \n- 'reference phrase' can be explicit, ambiguous, and by_value. 'ambiguous' means the phrase can map to more than one columns in the dataset, always a hypernym of column names(depending on the dataset values).\n    For example:\n    {\"column\": \"gdpPercap\", \"nl_ref_type\": \"explicit\", \"nl_ref_phrase\": \"GDP per capita\"},\n    {\"column\": [\"country\",\"continent\"], \"nl_ref_type\": \"ambiguous\", \"nl_ref_phrase\": \"region\"}\n    {\"column\": [\"country\",\"country_short_name\"], \"nl_ref_type\": \"ambiguous\", \"nl_ref_phrase\": \"countries\"}\n    {\"c_type\": \"mark\", \"c_name\": \"point chart\", \"nl_ref_type\": \"explicit\", \"nl_ref_phrase\": \"scatter plot\"}\n    {\"c_type\": \"mark\", \"c_name\": \"arc chart\", \"nl_ref_type\": \"explicit\", \"nl_ref_phrase\": \"pie chart\"}\n    {\"c_type\": \"transform\",\"c_name\": \"filter\",\"c_list\": [{\"field\": \"country\",\"oneOf\": [\"Iceland\",\"Norway\"]}],\"nl_ref_type\": \"explicit\",\"nl_ref_phrase\": \"for countries Iceland and Norway\"},\n    {\"c_type\": \"transform\",\"c_name\": \"filter\",\"c_list\": [{\"field\": \"country\",\"oneOf\": [\"Iceland\",\"Norway\"]}],\"nl_ref_type\": \"by_value\",\"nl_ref_phrase\": \"for Iceland and Norway\"},\n- the 'nl_ref_phrase' for 'ambiguous' columns should be equally near all ambiguous columns, not too near to one of the column since it would not be ambiguous.\n    good example: {\"column\": [\"country\",\"region\"], \"nl_ref_type\": \"ambiguous\", \"nl_ref_phrase\": \"location\"}\n    bad example: {\"column\": [\"country\",\"region\"], \"nl_ref_type\": \"ambiguous\", \"nl_ref_phrase\": \"region\"}\n- You only include given constraints and no other information. \n    For example, if a column name is not in the given constraint, it will not be included in the NL utterance.\n    Also, it a chart mark or chart encoding channel is not in the given constraint, it will not be included in the NL utterance.\n- all 'nl_ref_phrase' shoule be included in the 'nl_utterance'. \n\nThe output format is identical to the input format, but fill in the str blanks(\"...\").\n### Input:\n{\n  \"nl_utterance\": \"...\",\n  \"encoded_fields\": [],\n  \"constraints\": [\n    {\n      \"c_type\": \"task\",\n      \"c_name\": \"distribution\",\n      \"c_list\": [\n        {\n          \"mark\": \"bar\",\n          \"encoding\": {\n            \"y\": {\n              \"aggregate\": \"count\",\n              \"type\": \"quantitative\"\n            }\n          },\n          \"x_y_reversable\": true\n        },\n        {\n          \"mark\": \"boxplot\",\n          \"encoding\": {\n            \"x\": {\n              \"type\": \"quantitative\"\n            }\n          },\n          \"x_y_reversable\": true\n        }\n      ],\n      \"nl_ref_type\": \"explicit\",\n      \"nl_ref_phrase\": \"...\"\n    },\n    {\n      \"c_type\": \"mark\",\n      \"c_name\": \"bar chart\",\n      \"c_list\": [\n        {\n          \"mark\": \"bar\",\n          \"encoding\": {\n            \"x\": {},\n            \"y\": {\n              \"type\": \"quantitative\"\n            },\n            \"color\": {\n              \"type\": \"nominal\",\n              \"ignore\": true\n            },\n            \"column\": {\n              \"ignore\": true,\n              \"type\": \"nominal\"\n            },\n            \"row\": {\n              \"ignore\": true,\n              \"type\": \"nominal\"\n            }\n          },\n          \"unique_map\": {\n            \"x\": \"y\"\n          }\n        },\n        {\n          \"mark\": \"bar\",\n          \"encoding\": {\n            \"y\": {},\n            \"x\": {\n              \"type\": \"quantitative\"\n            },\n            \"color\": {\n              \"type\": \"nominal\",\n              \"ignore\": true\n            },\n            \"column\": {\n              \"ignore\": true,\n              \"type\": \"nominal\"\n            },\n            \"row\": {\n              \"ignore\": true,\n              \"type\": \"nominal\"\n            }\n          },\n          \"unique_map\": {\n            \"y\": \"x\"\n          }\n        }\n      ],\n      \"nl_ref_type\": \"explicit\",\n      \"nl_ref_phrase\": \"...\"\n    },\n    {\n      \"c_type\": \"transform\",\n      \"c_name\": \"aggregate\",\n      \"c_list\": [\n        {\n          \"aggregate\": \"count\"\n        }\n      ],\n      \"nl_ref_type\": \"explicit\",\n      \"nl_ref_phrase\": \"...\"\n    }\n  ]\n}\n\n### Output:"
}