{
  "gpt_result": {
    "nl_utterance": "What are the salaries of players from clubs working in Spain, Portugal, and Germany?",
    "encoded_fields": [
      {
        "field": "Salary",
        "type": "quantitative",
        "nl_ref_type": "explicit",
        "nl_ref_phrase": "salaries"
      },
      {
        "field": "Club",
        "type": "nominal",
        "nl_ref_type": "explicit",
        "nl_ref_phrase": "clubs"
      }
    ],
    "constraints": [
      {
        "c_type": "transform",
        "c_name": "filter",
        "c_list": [
          {
            "field": "Country",
            "oneOf": [
              "Spain",
              "Portugal",
              "Germany"
            ]
          }
        ],
        "nl_ref_type": "by_value",
        "nl_ref_phrase": "working in Spain, Portugal, and Germany"
      }
    ]
  },
  "input": "Dataset Information: {\n  \"data samples\": [\n    {\n      \"Foot\": \"Left\",\n      \"Name\": \"Etrit Berisha\",\n      \"Position\": \"Goalkeeper\",\n      \"Club\": \"Lazio\",\n      \"Country\": \"Albania\",\n      \"Age\": 27,\n      \"Salary\": 4000000,\n      \"Goals\": 0\n    },\n    {\n      \"Foot\": \"Right\",\n      \"Name\": \"Artur Boruc\",\n      \"Position\": \"Goalkeeper\",\n      \"Club\": \"Bournemouth\",\n      \"Country\": \"Poland\",\n      \"Age\": 36,\n      \"Salary\": 1000000,\n      \"Goals\": 0\n    },\n    {\n      \"Foot\": \"Right\",\n      \"Name\": \"Artur J\\u0119drzejczyk\",\n      \"Position\": \"Defender\",\n      \"Club\": \"Legia Warsaw\",\n      \"Country\": \"Poland\",\n      \"Age\": 28,\n      \"Salary\": 2700000,\n      \"Goals\": 2\n    },\n    {\n      \"Foot\": \"Right\",\n      \"Name\": \"Mateo Kova\\u010di\\u0107\",\n      \"Position\": \"Midfielder\",\n      \"Club\": \"Real Madrid\",\n      \"Country\": \"Croatia\",\n      \"Age\": 22,\n      \"Salary\": 20000000,\n      \"Goals\": 1\n    },\n    {\n      \"Foot\": \"Right\",\n      \"Name\": \"Ivan Rakiti\\u0107\",\n      \"Position\": \"Midfielder\",\n      \"Club\": \"Barcelona\",\n      \"Country\": \"Croatia\",\n      \"Age\": 28,\n      \"Salary\": 45000000,\n      \"Goals\": 10\n    }\n  ],\n  \"column names\": [\n    \"Foot\",\n    \"Name\",\n    \"Position\",\n    \"Club\",\n    \"Country\",\n    \"Age\",\n    \"Salary\",\n    \"Goals\"\n  ]\n}\n\nYour Job:\nI am developing a NL to Data Visualization Dataset. \nPlease help me generate natural language utterance for given dataset and constraints.\nDefinition about the Taks:\n- 'utterance' is what a user would say to make a chart. It should be a questions structure. One NL 'utterance' is in one or two sentences. Here are two examples from Questions for reference:\n    On average, how much was earned by movies of each genre?\n    How does displacement relate to fuel economy for cars from Europe vs. USA?\n- 'given dataset' is in form of column names, column type, range/unique values of the column.\n- 'constraints' are information about the chart that should be included in the utterance. \n    So we can find a reference phrase in the NL utterance that corresponds to the given constraints. \n- 'reference phrase' can be explicit, ambiguous, and by_value. 'ambiguous' means the phrase can map to more than one columns in the dataset, always a hypernym of column names(depending on the dataset values).\n    For example:\n    {\"column\": \"gdpPercap\", \"nl_ref_type\": \"explicit\", \"nl_ref_phrase\": \"GDP per capita\"},\n    {\"column\": [\"country\",\"continent\"], \"nl_ref_type\": \"ambiguous\", \"nl_ref_phrase\": \"region\"}\n    {\"column\": [\"country\",\"country_short_name\"], \"nl_ref_type\": \"ambiguous\", \"nl_ref_phrase\": \"countries\"}\n    {\"c_type\": \"mark\", \"c_name\": \"point chart\", \"nl_ref_type\": \"explicit\", \"nl_ref_phrase\": \"scatter plot\"}\n    {\"c_type\": \"mark\", \"c_name\": \"arc chart\", \"nl_ref_type\": \"explicit\", \"nl_ref_phrase\": \"pie chart\"}\n    {\"c_type\": \"transform\",\"c_name\": \"filter\",\"c_list\": [{\"field\": \"country\",\"oneOf\": [\"Iceland\",\"Norway\"]}],\"nl_ref_type\": \"explicit\",\"nl_ref_phrase\": \"for countries Iceland and Norway\"},\n    {\"c_type\": \"transform\",\"c_name\": \"filter\",\"c_list\": [{\"field\": \"country\",\"oneOf\": [\"Iceland\",\"Norway\"]}],\"nl_ref_type\": \"by_value\",\"nl_ref_phrase\": \"for Iceland and Norway\"},\n- the 'nl_ref_phrase' for 'ambiguous' columns should be equally near all ambiguous columns, not too near to one of the column since it would not be ambiguous.\n    good example: {\"column\": [\"country\",\"region\"], \"nl_ref_type\": \"ambiguous\", \"nl_ref_phrase\": \"location\"}\n    bad example: {\"column\": [\"country\",\"region\"], \"nl_ref_type\": \"ambiguous\", \"nl_ref_phrase\": \"region\"}\n- You only include given constraints and no other information. \n    For example, if a column name is not in the given constraint, it will not be included in the NL utterance.\n    Also, it a chart mark or chart encoding channel is not in the given constraint, it will not be included in the NL utterance.\n- all 'nl_ref_phrase' shoule be included in the 'nl_utterance'. \n\nThe output format is identical to the input format, but fill in the str blanks(\"...\").\n### Input:\n{\n  \"nl_utterance\": \"...\",\n  \"encoded_fields\": [\n    {\n      \"field\": \"Salary\",\n      \"type\": \"quantitative\",\n      \"nl_ref_type\": \"explicit\",\n      \"nl_ref_phrase\": \"...\"\n    },\n    {\n      \"field\": \"Club\",\n      \"type\": \"nominal\",\n      \"nl_ref_type\": \"explicit\",\n      \"nl_ref_phrase\": \"...\"\n    }\n  ],\n  \"constraints\": [\n    {\n      \"c_type\": \"transform\",\n      \"c_name\": \"filter\",\n      \"c_list\": [\n        {\n          \"field\": \"Country\",\n          \"oneOf\": [\n            \"Spain\",\n            \"Portugal\",\n            \"Germany\"\n          ]\n        }\n      ],\n      \"nl_ref_type\": \"by_value\",\n      \"nl_ref_phrase\": \"...\"\n    }\n  ]\n}\n\n### Output:"
}