{
  "gpt_result": {
    "nl_utterance": "Show a plot of output per worker across different regions for countries with a labor force greater than 5000, sorted by output per worker in descending order.",
    "encoded_fields": [
      {
        "field": [
          "Country",
          "Continent"
        ],
        "type": "nominal",
        "nl_ref_type": "ambiguous",
        "nl_ref_phrase": "regions"
      },
      {
        "field": "Output per worker ($)",
        "type": "quantitative",
        "nl_ref_type": "explicit",
        "nl_ref_phrase": "output per worker"
      }
    ],
    "constraints": [
      {
        "c_type": "transform",
        "c_name": "filter",
        "c_list": [
          {
            "field": "Labour Force (000s)",
            "gt": 5000
          }
        ],
        "nl_ref_type": "explicit",
        "nl_ref_phrase": "countries with a labor force greater than 5000"
      },
      {
        "c_type": "transform",
        "c_name": "sort",
        "c_list": [
          {
            "field": "Output per worker ($)",
            "order": "descending"
          }
        ],
        "nl_ref_type": "explicit",
        "nl_ref_phrase": "sorted by output per worker in descending order"
      }
    ]
  },
  "input": "Dataset Information: {\n  \"data samples\": [\n    {\n      \"ISO3\": \"AUS\",\n      \"Country\": \"Australia\",\n      \"GDP ($m)\": 1595175.273,\n      \"Labour Force (000s)\": 13738.67,\n      \"Output per worker ($)\": 116108.42046573648,\n      \"Continent\": \"Oceania\"\n    },\n    {\n      \"ISO3\": \"AUT\",\n      \"Country\": \"Austria\",\n      \"GDP ($m)\": 536878.733,\n      \"Labour Force (000s)\": 4589.6,\n      \"Output per worker ($)\": 116977.23832142234,\n      \"Continent\": \"Europe\"\n    },\n    {\n      \"ISO3\": \"ITA\",\n      \"Country\": \"Italy\",\n      \"GDP ($m)\": 2751334.768,\n      \"Labour Force (000s)\": 24920.75,\n      \"Output per worker ($)\": 110403.36940100115,\n      \"Continent\": \"Europe\"\n    },\n    {\n      \"ISO3\": \"ESP\",\n      \"Country\": \"Spain\",\n      \"GDP ($m)\": 1927531.482,\n      \"Labour Force (000s)\": 23203.18,\n      \"Output per worker ($)\": 83071.86695961501,\n      \"Continent\": \"Europe\"\n    },\n    {\n      \"ISO3\": \"ISR\",\n      \"Country\": \"Israel\",\n      \"GDP ($m)\": 412730.299,\n      \"Labour Force (000s)\": 4163.275,\n      \"Output per worker ($)\": 99135.9684383088,\n      \"Continent\": \"Asia\"\n    }\n  ],\n  \"column names\": [\n    \"ISO3\",\n    \"Country\",\n    \"GDP ($m)\",\n    \"Labour Force (000s)\",\n    \"Output per worker ($)\",\n    \"Continent\"\n  ]\n}\n\nYour Job:\nI am developing a NL to Data Visualization Dataset. \nPlease help me generate natural language utterance for given dataset and constraints.\nDefinition about the Taks:\n- 'utterance' is what a user would say to make a chart. It should be a queries structure. One NL 'utterance' is in one or two sentences. Here are two examples from Queries for reference:\n    budget over time.\n    Plot IMDB rating against Rotten Tomatoes rating.\n- 'given dataset' is in form of column names, column type, range/unique values of the column.\n- 'constraints' are information about the chart that should be included in the utterance. \n    So we can find a reference phrase in the NL utterance that corresponds to the given constraints. \n- 'reference phrase' can be explicit, ambiguous, and by_value. 'ambiguous' means the phrase can map to more than one columns in the dataset, always a hypernym of column names(depending on the dataset values).\n    For example:\n    {\"column\": \"gdpPercap\", \"nl_ref_type\": \"explicit\", \"nl_ref_phrase\": \"GDP per capita\"},\n    {\"column\": [\"country\",\"continent\"], \"nl_ref_type\": \"ambiguous\", \"nl_ref_phrase\": \"region\"}\n    {\"column\": [\"country\",\"country_short_name\"], \"nl_ref_type\": \"ambiguous\", \"nl_ref_phrase\": \"countries\"}\n    {\"c_type\": \"mark\", \"c_name\": \"point chart\", \"nl_ref_type\": \"explicit\", \"nl_ref_phrase\": \"scatter plot\"}\n    {\"c_type\": \"mark\", \"c_name\": \"arc chart\", \"nl_ref_type\": \"explicit\", \"nl_ref_phrase\": \"pie chart\"}\n    {\"c_type\": \"transform\",\"c_name\": \"filter\",\"c_list\": [{\"field\": \"country\",\"oneOf\": [\"Iceland\",\"Norway\"]}],\"nl_ref_type\": \"explicit\",\"nl_ref_phrase\": \"for countries Iceland and Norway\"},\n    {\"c_type\": \"transform\",\"c_name\": \"filter\",\"c_list\": [{\"field\": \"country\",\"oneOf\": [\"Iceland\",\"Norway\"]}],\"nl_ref_type\": \"by_value\",\"nl_ref_phrase\": \"for Iceland and Norway\"},\n- the 'nl_ref_phrase' for 'ambiguous' columns should be equally near all ambiguous columns, not too near to one of the column since it would not be ambiguous.\n    good example: {\"column\": [\"country\",\"region\"], \"nl_ref_type\": \"ambiguous\", \"nl_ref_phrase\": \"location\"}\n    bad example: {\"column\": [\"country\",\"region\"], \"nl_ref_type\": \"ambiguous\", \"nl_ref_phrase\": \"region\"}\n- You only include given constraints and no other information. \n    For example, if a column name is not in the given constraint, it will not be included in the NL utterance.\n    Also, it a chart mark or chart encoding channel is not in the given constraint, it will not be included in the NL utterance.\n- all 'nl_ref_phrase' shoule be included in the 'nl_utterance'. \n\nThe output format is identical to the input format, but fill in the str blanks(\"...\").\n### Input:\n{\n  \"nl_utterance\": \"...\",\n  \"encoded_fields\": [\n    {\n      \"field\": [\n        \"Country\",\n        \"Continent\"\n      ],\n      \"type\": \"nominal\",\n      \"nl_ref_type\": \"ambiguous\",\n      \"nl_ref_phrase\": \"...\"\n    },\n    {\n      \"field\": \"Output per worker ($)\",\n      \"type\": \"quantitative\",\n      \"nl_ref_type\": \"explicit\",\n      \"nl_ref_phrase\": \"...\"\n    }\n  ],\n  \"constraints\": [\n    {\n      \"c_type\": \"transform\",\n      \"c_name\": \"filter\",\n      \"c_list\": [\n        {\n          \"field\": \"Labour Force (000s)\",\n          \"gt\": 5000\n        }\n      ],\n      \"nl_ref_type\": \"explicit\",\n      \"nl_ref_phrase\": \"...\"\n    },\n    {\n      \"c_type\": \"transform\",\n      \"c_name\": \"sort\",\n      \"c_list\": [\n        {\n          \"field\": \"Output per worker ($)\",\n          \"order\": \"descending\"\n        }\n      ],\n      \"nl_ref_type\": \"explicit\",\n      \"nl_ref_phrase\": \"...\"\n    }\n  ]\n}\n\n### Output:"
}