{
  "gpt_result": {
    "nl_utterance": "Create a composition chart of the issue amount with types indicated by color.",
    "encoded_fields": [
      {
        "field": "issueAmount",
        "type": "quantitative",
        "nl_ref_type": "explicit",
        "nl_ref_phrase": "issue amount"
      },
      {
        "field": [
          "giltType",
          "rawType"
        ],
        "type": "nominal",
        "nl_ref_type": "ambiguous",
        "nl_ref_phrase": "types"
      }
    ],
    "constraints": [
      {
        "c_type": "task",
        "c_name": "composition",
        "c_list": [
          {
            "mark": "bar",
            "encoding": {
              "x": {},
              "y": {
                "type": "quantitative"
              },
              "color": {
                "type": "nominal"
              }
            },
            "x_y_reversable": true
          },
          {
            "mark": "area",
            "encoding": {
              "x": {},
              "y": {
                "type": "quantitative"
              },
              "color": {
                "type": "nominal"
              }
            }
          },
          {
            "mark": "arc",
            "encoding": {
              "theta": {
                "type": "quantitative"
              },
              "color": {
                "type": "nominal"
              }
            }
          }
        ],
        "nl_ref_type": "explicit",
        "nl_ref_phrase": "composition chart"
      }
    ]
  },
  "input": "Dataset Information: {\n  \"data samples\": [\n    {\n      \"rawType\": \"2\\u00bd% Index-linked Treasury Stock 2024\",\n      \"coupon\": \"2\\u00bd\",\n      \"giltType\": \"Index Linked\",\n      \"code\": \"GB0008983024\",\n      \"redemptionDate\": \" 17-Jul-2024\",\n      \"issueDate\": \" 30-Dec-1986\",\n      \"divDates\": \"17 Jan/Jul\",\n      \"divNextDate\": \" 06-Jan-2023\",\n      \"issueAmount\": 6821,\n      \"baseRPI\": 97.667931,\n      \"amountINCinfUplift\": 22363.0,\n      \"issueYear\": 1986,\n      \"totalCumulative\": 6821,\n      \"id\": 1\n    },\n    {\n      \"rawType\": \"4\\u00bd% Treasury Gilt 2034\",\n      \"coupon\": \"4\\u00bd\",\n      \"giltType\": \"Treasury Gilt\",\n      \"code\": \"GB00B52WS153\",\n      \"redemptionDate\": \" 07-Sep-2034\",\n      \"issueDate\": \" 17-Jun-2009\",\n      \"divDates\": \"7 Mar/Sep\",\n      \"divNextDate\": \" 24-Feb-2023\",\n      \"issueAmount\": 36261,\n      \"baseRPI\": NaN,\n      \"amountINCinfUplift\": NaN,\n      \"issueYear\": 2009,\n      \"totalCumulative\": 495732,\n      \"id\": 23\n    },\n    {\n      \"rawType\": \"4 1/8% Index-linked Treasury Stock 2030\",\n      \"coupon\": \"1/8\",\n      \"giltType\": \"Index Linked\",\n      \"code\": \"GB0008932666\",\n      \"redemptionDate\": \" 22-Jul-2030\",\n      \"issueDate\": \" 12-Jun-1992\",\n      \"divDates\": \"22 Jan/Jul\",\n      \"divNextDate\": \" 12-Jan-2023\",\n      \"issueAmount\": 4841,\n      \"baseRPI\": 135.10001,\n      \"amountINCinfUplift\": 11474.0,\n      \"issueYear\": 1992,\n      \"totalCumulative\": 11662,\n      \"id\": 2\n    },\n    {\n      \"rawType\": \"0\\u00be% Index-linked Treasury Gilt 2034\",\n      \"coupon\": \"0\\u00be\",\n      \"giltType\": \"Index Linked\",\n      \"code\": \"GB00B46CGH68\",\n      \"redemptionDate\": \" 22-Mar-2034\",\n      \"issueDate\": \" 25-May-2011\",\n      \"divDates\": \"22 Mar/Sep\",\n      \"divNextDate\": \" 13-Mar-2023\",\n      \"issueAmount\": 14570,\n      \"baseRPI\": 232.22903,\n      \"amountINCinfUplift\": 21614.0,\n      \"issueYear\": 2011,\n      \"totalCumulative\": 628147,\n      \"id\": 30\n    },\n    {\n      \"rawType\": \"0 5/8% Treasury Gilt 2025\",\n      \"coupon\": \"5/8\",\n      \"giltType\": \"Treasury Gilt\",\n      \"code\": \"GB00BK5CVX03\",\n      \"redemptionDate\": \" 07-Jun-2025\",\n      \"issueDate\": \" 03-Jul-2019\",\n      \"divDates\": \"7 Jun/Dec\",\n      \"divNextDate\": \" 28-Nov-2022\",\n      \"issueAmount\": 44623,\n      \"baseRPI\": NaN,\n      \"amountINCinfUplift\": NaN,\n      \"issueYear\": 2019,\n      \"totalCumulative\": 1478052,\n      \"id\": 64\n    }\n  ],\n  \"column names\": [\n    \"rawType\",\n    \"coupon\",\n    \"giltType\",\n    \"code\",\n    \"redemptionDate\",\n    \"issueDate\",\n    \"divDates\",\n    \"divNextDate\",\n    \"issueAmount\",\n    \"baseRPI\",\n    \"amountINCinfUplift\",\n    \"issueYear\",\n    \"totalCumulative\",\n    \"id\"\n  ]\n}\n\nYour Job:\nI am developing a NL to Data Visualization Dataset. \nPlease help me generate natural language utterance for given dataset and constraints.\nDefinition about the Taks:\n- 'utterance' is what a user would say to make a chart. It should be a commands structure. One NL 'utterance' is in one or two sentences. Here are two examples from Commands for reference:\n    Show me a bar graph of the profit for each region.\n    Draw axes for AVG(Horsepower) vs Year, colored by Origin.\n- 'given dataset' is in form of column names, column type, range/unique values of the column.\n- 'constraints' are information about the chart that should be included in the utterance. \n    So we can find a reference phrase in the NL utterance that corresponds to the given constraints. \n- 'reference phrase' can be explicit, ambiguous, and by_value. 'ambiguous' means the phrase can map to more than one columns in the dataset, always a hypernym of column names(depending on the dataset values).\n    For example:\n    {\"column\": \"gdpPercap\", \"nl_ref_type\": \"explicit\", \"nl_ref_phrase\": \"GDP per capita\"},\n    {\"column\": [\"country\",\"continent\"], \"nl_ref_type\": \"ambiguous\", \"nl_ref_phrase\": \"region\"}\n    {\"column\": [\"country\",\"country_short_name\"], \"nl_ref_type\": \"ambiguous\", \"nl_ref_phrase\": \"countries\"}\n    {\"c_type\": \"mark\", \"c_name\": \"point chart\", \"nl_ref_type\": \"explicit\", \"nl_ref_phrase\": \"scatter plot\"}\n    {\"c_type\": \"mark\", \"c_name\": \"arc chart\", \"nl_ref_type\": \"explicit\", \"nl_ref_phrase\": \"pie chart\"}\n    {\"c_type\": \"transform\",\"c_name\": \"filter\",\"c_list\": [{\"field\": \"country\",\"oneOf\": [\"Iceland\",\"Norway\"]}],\"nl_ref_type\": \"explicit\",\"nl_ref_phrase\": \"for countries Iceland and Norway\"},\n    {\"c_type\": \"transform\",\"c_name\": \"filter\",\"c_list\": [{\"field\": \"country\",\"oneOf\": [\"Iceland\",\"Norway\"]}],\"nl_ref_type\": \"by_value\",\"nl_ref_phrase\": \"for Iceland and Norway\"},\n- the 'nl_ref_phrase' for 'ambiguous' columns should be equally near all ambiguous columns, not too near to one of the column since it would not be ambiguous.\n    good example: {\"column\": [\"country\",\"region\"], \"nl_ref_type\": \"ambiguous\", \"nl_ref_phrase\": \"location\"}\n    bad example: {\"column\": [\"country\",\"region\"], \"nl_ref_type\": \"ambiguous\", \"nl_ref_phrase\": \"region\"}\n- You only include given constraints and no other information. \n    For example, if a column name is not in the given constraint, it will not be included in the NL utterance.\n    Also, it a chart mark or chart encoding channel is not in the given constraint, it will not be included in the NL utterance.\n- all 'nl_ref_phrase' shoule be included in the 'nl_utterance'. \n\nThe output format is identical to the input format, but fill in the str blanks(\"...\").\n### Input:\n{\n  \"nl_utterance\": \"...\",\n  \"encoded_fields\": [\n    {\n      \"field\": \"issueAmount\",\n      \"type\": \"quantitative\",\n      \"nl_ref_type\": \"explicit\",\n      \"nl_ref_phrase\": \"...\"\n    },\n    {\n      \"field\": [\n        \"giltType\",\n        \"rawType\"\n      ],\n      \"type\": \"nominal\",\n      \"nl_ref_type\": \"ambiguous\",\n      \"nl_ref_phrase\": \"...\"\n    }\n  ],\n  \"constraints\": [\n    {\n      \"c_type\": \"task\",\n      \"c_name\": \"composition\",\n      \"c_list\": [\n        {\n          \"mark\": \"bar\",\n          \"encoding\": {\n            \"x\": {},\n            \"y\": {\n              \"type\": \"quantitative\"\n            },\n            \"color\": {\n              \"type\": \"nominal\"\n            }\n          },\n          \"x_y_reversable\": true\n        },\n        {\n          \"mark\": \"area\",\n          \"encoding\": {\n            \"x\": {},\n            \"y\": {\n              \"type\": \"quantitative\"\n            },\n            \"color\": {\n              \"type\": \"nominal\"\n            }\n          }\n        },\n        {\n          \"mark\": \"arc\",\n          \"encoding\": {\n            \"theta\": {\n              \"type\": \"quantitative\"\n            },\n            \"color\": {\n              \"type\": \"nominal\"\n            }\n          }\n        }\n      ],\n      \"nl_ref_type\": \"explicit\",\n      \"nl_ref_phrase\": \"...\"\n    }\n  ]\n}\n\n### Output:"
}