{
  "gpt_result": {
    "nl_utterance": "Show a scatter plot to find the correlation between Reduced Dimension 1 and Reduced Dimension 2 across different Continents.",
    "encoded_fields": [
      {
        "field": "Reduced Dimension 1",
        "type": "quantitative",
        "nl_ref_type": "explicit",
        "nl_ref_phrase": "Reduced Dimension 1"
      },
      {
        "field": "Reduced Dimension 2",
        "type": "quantitative",
        "nl_ref_type": "explicit",
        "nl_ref_phrase": "Reduced Dimension 2"
      },
      {
        "field": "Continent",
        "type": "nominal",
        "nl_ref_type": "explicit",
        "nl_ref_phrase": "Continents"
      }
    ],
    "constraints": [
      {
        "c_type": "task",
        "c_name": "correlation",
        "c_list": [
          {
            "mark": "circle",
            "encoding": {
              "x": {
                "type": "quantitative"
              },
              "y": {
                "type": "quantitative"
              }
            }
          }
        ],
        "nl_ref_type": "explicit",
        "nl_ref_phrase": "correlation"
      }
    ]
  },
  "input": "Dataset Information: {\n  \"data samples\": [\n    {\n      \"Country\": \"Afghanistan\",\n      \"Life Expectancy\": 64.3,\n      \"Income\": 1990,\n      \"Infant Mortality\": 54.2,\n      \"Fertility\": 3.77,\n      \"Gini Coefficient\": 39.5,\n      \"Reduced Dimension 1\": 2.058474218,\n      \"Reduced Dimension 2\": -0.617822572,\n      \"Continent\": \"Asia\"\n    },\n    {\n      \"Country\": \"Yemen\",\n      \"Life Expectancy\": 68.0,\n      \"Income\": 2230,\n      \"Infant Mortality\": 53.5,\n      \"Fertility\": 3.44,\n      \"Gini Coefficient\": 39.2,\n      \"Reduced Dimension 1\": 1.619783795,\n      \"Reduced Dimension 2\": -0.530987895,\n      \"Continent\": \"Asia\"\n    },\n    {\n      \"Country\": \"Brazil\",\n      \"Life Expectancy\": 76.4,\n      \"Income\": 14700,\n      \"Infant Mortality\": 12.7,\n      \"Fertility\": 1.65,\n      \"Gini Coefficient\": 57.1,\n      \"Reduced Dimension 1\": -0.119766101,\n      \"Reduced Dimension 2\": 2.401305368,\n      \"Continent\": \"South America\"\n    },\n    {\n      \"Country\": \"Seychelles\",\n      \"Life Expectancy\": 73.8,\n      \"Income\": 28100,\n      \"Infant Mortality\": 13.4,\n      \"Fertility\": 2.16,\n      \"Gini Coefficient\": 32.1,\n      \"Reduced Dimension 1\": -0.860359888,\n      \"Reduced Dimension 2\": -0.69126584,\n      \"Continent\": \"Africa\"\n    },\n    {\n      \"Country\": \"Ukraine\",\n      \"Life Expectancy\": 74.2,\n      \"Income\": 13400,\n      \"Infant Mortality\": 7.62,\n      \"Fertility\": 1.61,\n      \"Gini Coefficient\": 28.8,\n      \"Reduced Dimension 1\": -1.061013306,\n      \"Reduced Dimension 2\": -0.833950566,\n      \"Continent\": \"Europe\"\n    }\n  ],\n  \"column names\": [\n    \"Country\",\n    \"Life Expectancy\",\n    \"Income\",\n    \"Infant Mortality\",\n    \"Fertility\",\n    \"Gini Coefficient\",\n    \"Reduced Dimension 1\",\n    \"Reduced Dimension 2\",\n    \"Continent\"\n  ]\n}\n\nYour Job:\nI am developing a NL to Data Visualization Dataset. \nPlease help me generate natural language utterance for given dataset and constraints.\nDefinition about the Taks:\n- 'utterance' is what a user would say to make a chart.  One NL 'utterance' is in one or two sentences. Here are two examples from Others for reference:\n    I want to know how many orders there are by the quantity of the order.\n    Trend for average horsepower over time across different origin.\n- 'given dataset' is in form of column names, column type, range/unique values of the column.\n- 'constraints' are information about the chart that should be included in the utterance. \n    So we can find a reference phrase in the NL utterance that corresponds to the given constraints. \n- 'reference phrase' can be explicit, ambiguous, and by_value. 'ambiguous' means the phrase can map to more than one columns in the dataset, always a hypernym of column names(depending on the dataset values).\n    For example:\n    {\"column\": \"gdpPercap\", \"nl_ref_type\": \"explicit\", \"nl_ref_phrase\": \"GDP per capita\"},\n    {\"column\": [\"country\",\"continent\"], \"nl_ref_type\": \"ambiguous\", \"nl_ref_phrase\": \"region\"}\n    {\"column\": [\"country\",\"country_short_name\"], \"nl_ref_type\": \"ambiguous\", \"nl_ref_phrase\": \"countries\"}\n    {\"c_type\": \"mark\", \"c_name\": \"point chart\", \"nl_ref_type\": \"explicit\", \"nl_ref_phrase\": \"scatter plot\"}\n    {\"c_type\": \"mark\", \"c_name\": \"arc chart\", \"nl_ref_type\": \"explicit\", \"nl_ref_phrase\": \"pie chart\"}\n    {\"c_type\": \"transform\",\"c_name\": \"filter\",\"c_list\": [{\"field\": \"country\",\"oneOf\": [\"Iceland\",\"Norway\"]}],\"nl_ref_type\": \"explicit\",\"nl_ref_phrase\": \"for countries Iceland and Norway\"},\n    {\"c_type\": \"transform\",\"c_name\": \"filter\",\"c_list\": [{\"field\": \"country\",\"oneOf\": [\"Iceland\",\"Norway\"]}],\"nl_ref_type\": \"by_value\",\"nl_ref_phrase\": \"for Iceland and Norway\"},\n- the 'nl_ref_phrase' for 'ambiguous' columns should be equally near all ambiguous columns, not too near to one of the column since it would not be ambiguous.\n    good example: {\"column\": [\"country\",\"region\"], \"nl_ref_type\": \"ambiguous\", \"nl_ref_phrase\": \"location\"}\n    bad example: {\"column\": [\"country\",\"region\"], \"nl_ref_type\": \"ambiguous\", \"nl_ref_phrase\": \"region\"}\n- You only include given constraints and no other information. \n    For example, if a column name is not in the given constraint, it will not be included in the NL utterance.\n    Also, it a chart mark or chart encoding channel is not in the given constraint, it will not be included in the NL utterance.\n- all 'nl_ref_phrase' shoule be included in the 'nl_utterance'. \n\nThe output format is identical to the input format, but fill in the str blanks(\"...\").\n### Input:\n{\n  \"nl_utterance\": \"...\",\n  \"encoded_fields\": [\n    {\n      \"field\": \"Reduced Dimension 1\",\n      \"type\": \"quantitative\",\n      \"nl_ref_type\": \"explicit\",\n      \"nl_ref_phrase\": \"...\"\n    },\n    {\n      \"field\": \"Reduced Dimension 2\",\n      \"type\": \"quantitative\",\n      \"nl_ref_type\": \"explicit\",\n      \"nl_ref_phrase\": \"...\"\n    },\n    {\n      \"field\": \"Continent\",\n      \"type\": \"nominal\",\n      \"nl_ref_type\": \"explicit\",\n      \"nl_ref_phrase\": \"...\"\n    }\n  ],\n  \"constraints\": [\n    {\n      \"c_type\": \"task\",\n      \"c_name\": \"correlation\",\n      \"c_list\": [\n        {\n          \"mark\": \"circle\",\n          \"encoding\": {\n            \"x\": {\n              \"type\": \"quantitative\"\n            },\n            \"y\": {\n              \"type\": \"quantitative\"\n            }\n          }\n        }\n      ],\n      \"nl_ref_type\": \"explicit\",\n      \"nl_ref_phrase\": \"...\"\n    }\n  ]\n}\n\n### Output:"
}