{
  "gpt_result": {
    "nl_utterance": "What is the trend of the sum of growth in lending relative to world GDP over the years?",
    "encoded_fields": [
      {
        "field": "Year",
        "type": "quantitative",
        "nl_ref_type": "explicit",
        "nl_ref_phrase": "years"
      },
      {
        "field": "Growth in Lending Relative to World GDP",
        "type": "quantitative",
        "nl_ref_type": "explicit",
        "nl_ref_phrase": "growth in lending relative to world GDP"
      }
    ],
    "constraints": [
      {
        "c_type": "task",
        "c_name": "trend",
        "c_list": [
          {
            "mark": [
              "bar",
              "line",
              "area"
            ],
            "encoding": {
              "x": {
                "type": "temporal"
              }
            }
          }
        ],
        "nl_ref_type": "explicit",
        "nl_ref_phrase": "trend"
      },
      {
        "c_type": "transform",
        "c_name": "aggregate",
        "c_list": [
          {
            "field": "Growth in Lending Relative to World GDP",
            "aggregate": "sum"
          }
        ],
        "nl_ref_type": "explicit",
        "nl_ref_phrase": "sum"
      }
    ]
  },
  "input": "Dataset Information: {\n  \"data samples\": [\n    {\n      \"Date\": \"12/31/2021\",\n      \"GRA Purchases\": 89474552025,\n      \"PRGT 1/2/\": 14554823681,\n      \"Totals\": 104029000000.0,\n      \"Year\": 2021,\n      \"World GDP data \": 96100100000000.0,\n      \"Totals ($bns)\": 104.0293757,\n      \"world GDP Bns\": 96100.091,\n      \"Growth in Lending Relative to World GDP\": 0.108251069\n    },\n    {\n      \"Date\": \"12/31/2016\",\n      \"GRA Purchases\": 49267630851,\n      \"PRGT 1/2/\": 6482647937,\n      \"Totals\": 55750278788.0,\n      \"Year\": 2016,\n      \"World GDP data \": 76465600000000.0,\n      \"Totals ($bns)\": 55.75027879,\n      \"world GDP Bns\": 76465.59001,\n      \"Growth in Lending Relative to World GDP\": 0.072908976\n    },\n    {\n      \"Date\": \"12/31/2013\",\n      \"GRA Purchases\": 83899249061,\n      \"PRGT 1/2/\": 6174392682,\n      \"Totals\": 90073641743.0,\n      \"Year\": 2013,\n      \"World GDP data \": 77607200000000.0,\n      \"Totals ($bns)\": 90.07364174,\n      \"world GDP Bns\": 77607.19847,\n      \"Growth in Lending Relative to World GDP\": 0.116063514\n    },\n    {\n      \"Date\": \"12/31/1993\",\n      \"GRA Purchases\": 25196745031,\n      \"PRGT 1/2/\": 3942792899,\n      \"Totals\": 29139537930.0,\n      \"Year\": 1993,\n      \"World GDP data \": 25822000000000.0,\n      \"Totals ($bns)\": 29.13953793,\n      \"world GDP Bns\": 25821.97892,\n      \"Growth in Lending Relative to World GDP\": 0.112847811\n    },\n    {\n      \"Date\": \"12/31/2002\",\n      \"GRA Purchases\": 63601058794,\n      \"PRGT 1/2/\": 6868671012,\n      \"Totals\": 70469729806.0,\n      \"Year\": 2002,\n      \"World GDP data \": 34911400000000.0,\n      \"Totals ($bns)\": 70.46972981,\n      \"world GDP Bns\": 34911.42705,\n      \"Growth in Lending Relative to World GDP\": 0.201852905\n    }\n  ],\n  \"column names\": [\n    \"Date\",\n    \"GRA Purchases\",\n    \"PRGT 1/2/\",\n    \"Totals\",\n    \"Year\",\n    \"World GDP data \",\n    \"Totals ($bns)\",\n    \"world GDP Bns\",\n    \"Growth in Lending Relative to World GDP\"\n  ]\n}\n\nYour Job:\nI am developing a NL to Data Visualization Dataset. \nPlease help me generate natural language utterance for given dataset and constraints.\nDefinition about the Taks:\n- 'utterance' is what a user would say to make a chart. It should be a questions structure. One NL 'utterance' is in one or two sentences. Here are two examples from Questions for reference:\n    Which countries have the highest acceleration for cars of different cylinders?\n    What major genre had the highest average worldwide gross?\n- 'given dataset' is in form of column names, column type, range/unique values of the column.\n- 'constraints' are information about the chart that should be included in the utterance. \n    So we can find a reference phrase in the NL utterance that corresponds to the given constraints. \n- 'reference phrase' can be explicit, ambiguous, and by_value. 'ambiguous' means the phrase can map to more than one columns in the dataset, always a hypernym of column names(depending on the dataset values).\n    For example:\n    {\"column\": \"gdpPercap\", \"nl_ref_type\": \"explicit\", \"nl_ref_phrase\": \"GDP per capita\"},\n    {\"column\": [\"country\",\"continent\"], \"nl_ref_type\": \"ambiguous\", \"nl_ref_phrase\": \"region\"}\n    {\"column\": [\"country\",\"country_short_name\"], \"nl_ref_type\": \"ambiguous\", \"nl_ref_phrase\": \"countries\"}\n    {\"c_type\": \"mark\", \"c_name\": \"point chart\", \"nl_ref_type\": \"explicit\", \"nl_ref_phrase\": \"scatter plot\"}\n    {\"c_type\": \"mark\", \"c_name\": \"arc chart\", \"nl_ref_type\": \"explicit\", \"nl_ref_phrase\": \"pie chart\"}\n    {\"c_type\": \"transform\",\"c_name\": \"filter\",\"c_list\": [{\"field\": \"country\",\"oneOf\": [\"Iceland\",\"Norway\"]}],\"nl_ref_type\": \"explicit\",\"nl_ref_phrase\": \"for countries Iceland and Norway\"},\n    {\"c_type\": \"transform\",\"c_name\": \"filter\",\"c_list\": [{\"field\": \"country\",\"oneOf\": [\"Iceland\",\"Norway\"]}],\"nl_ref_type\": \"by_value\",\"nl_ref_phrase\": \"for Iceland and Norway\"},\n- the 'nl_ref_phrase' for 'ambiguous' columns should be equally near all ambiguous columns, not too near to one of the column since it would not be ambiguous.\n    good example: {\"column\": [\"country\",\"region\"], \"nl_ref_type\": \"ambiguous\", \"nl_ref_phrase\": \"location\"}\n    bad example: {\"column\": [\"country\",\"region\"], \"nl_ref_type\": \"ambiguous\", \"nl_ref_phrase\": \"region\"}\n- You only include given constraints and no other information. \n    For example, if a column name is not in the given constraint, it will not be included in the NL utterance.\n    Also, it a chart mark or chart encoding channel is not in the given constraint, it will not be included in the NL utterance.\n- all 'nl_ref_phrase' shoule be included in the 'nl_utterance'. \n\nThe output format is identical to the input format, but fill in the str blanks(\"...\").\n### Input:\n{\n  \"nl_utterance\": \"...\",\n  \"encoded_fields\": [\n    {\n      \"field\": \"Year\",\n      \"type\": \"quantitative\",\n      \"nl_ref_type\": \"explicit\",\n      \"nl_ref_phrase\": \"...\"\n    },\n    {\n      \"field\": \"Growth in Lending Relative to World GDP\",\n      \"type\": \"quantitative\",\n      \"nl_ref_type\": \"explicit\",\n      \"nl_ref_phrase\": \"...\"\n    }\n  ],\n  \"constraints\": [\n    {\n      \"c_type\": \"task\",\n      \"c_name\": \"trend\",\n      \"c_list\": [\n        {\n          \"mark\": [\n            \"bar\",\n            \"line\",\n            \"area\"\n          ],\n          \"encoding\": {\n            \"x\": {\n              \"type\": \"temporal\"\n            }\n          }\n        }\n      ],\n      \"nl_ref_type\": \"explicit\",\n      \"nl_ref_phrase\": \"...\"\n    },\n    {\n      \"c_type\": \"transform\",\n      \"c_name\": \"aggregate\",\n      \"c_list\": [\n        {\n          \"field\": \"Growth in Lending Relative to World GDP\",\n          \"aggregate\": \"sum\"\n        }\n      ],\n      \"nl_ref_type\": \"explicit\",\n      \"nl_ref_phrase\": \"...\"\n    }\n  ]\n}\n\n### Output:"
}