{
  "gpt_result": {
    "nl_utterance": "What are the proportions of 'up share' and 'down share' when both are less than 0.25?",
    "encoded_fields": [
      {
        "field": "up_sh",
        "type": "quantitative",
        "nl_ref_type": "explicit",
        "nl_ref_phrase": "'up share'"
      },
      {
        "field": "down_sh",
        "type": "quantitative",
        "nl_ref_type": "explicit",
        "nl_ref_phrase": "'down share'"
      }
    ],
    "constraints": [
      {
        "c_type": "transform",
        "c_name": "filter",
        "c_list": [
          {
            "field": "up_sh",
            "lt": 0.25
          }
        ],
        "nl_ref_type": "by_value",
        "nl_ref_phrase": "when 'up share' is less than 0.25"
      },
      {
        "c_type": "transform",
        "c_name": "filter",
        "c_list": [
          {
            "field": "down_sh",
            "lt": 0.25
          }
        ],
        "nl_ref_type": "by_value",
        "nl_ref_phrase": "when 'down share' is less than 0.25"
      }
    ]
  },
  "input": "Dataset Information: {\n  \"data samples\": [\n    {\n      \"date\": 1.0,\n      \"division\": 4,\n      \"up\": 0,\n      \"down\": 0,\n      \"level\": 0,\n      \"up_ch\": NaN,\n      \"down_ch\": NaN,\n      \"total\": 0,\n      \"up_sh\": NaN,\n      \"down_sh\": NaN,\n      \"level_sh\": NaN,\n      \"change_sh\": NaN,\n      \"division_s\": \"Housing, Water, Electricity, Gas and other fuels\",\n      \"division_sh\": \"Housing & utilities\",\n      \"date2\": \"01-02-1988\",\n      \"date4\": \"1988-02-01\",\n      \"year\": 1988.0,\n      \"month\": 2.0,\n      \"quarter\": 1.0\n    },\n    {\n      \"date\": 298.0,\n      \"division\": 1,\n      \"up\": 3978,\n      \"down\": 2455,\n      \"level\": 16945,\n      \"up_ch\": 0.10768149,\n      \"down_ch\": -0.17791009,\n      \"total\": 23378,\n      \"up_sh\": 0.17015998,\n      \"down_sh\": 0.10501326,\n      \"level_sh\": 0.72482675,\n      \"change_sh\": 0.27517325,\n      \"division_s\": \"Food and non-alcoholic beverages\",\n      \"division_sh\": \"Food & drink\",\n      \"date2\": \"01-11-2012\",\n      \"date4\": \"2012-11-01\",\n      \"year\": 2012.0,\n      \"month\": 11.0,\n      \"quarter\": 4.0\n    },\n    {\n      \"date\": 305.0,\n      \"division\": 7,\n      \"up\": 145,\n      \"down\": 113,\n      \"level\": 3223,\n      \"up_ch\": 0.095990531,\n      \"down_ch\": -0.11111728,\n      \"total\": 3481,\n      \"up_sh\": 0.041654699,\n      \"down_sh\": 0.032461938,\n      \"level_sh\": 0.92588335,\n      \"change_sh\": 0.074116632,\n      \"division_s\": \"Transport\",\n      \"division_sh\": \"Transport\",\n      \"date2\": \"01-06-2013\",\n      \"date4\": \"2013-06-01\",\n      \"year\": 2013.0,\n      \"month\": 6.0,\n      \"quarter\": 2.0\n    },\n    {\n      \"date\": 266.0,\n      \"division\": 7,\n      \"up\": 123,\n      \"down\": 108,\n      \"level\": 3196,\n      \"up_ch\": 0.066394567,\n      \"down_ch\": -0.09545777,\n      \"total\": 3427,\n      \"up_sh\": 0.035891451,\n      \"down_sh\": 0.031514443,\n      \"level_sh\": 0.93259412,\n      \"change_sh\": 0.067405894,\n      \"division_s\": \"Transport\",\n      \"division_sh\": \"Transport\",\n      \"date2\": \"01-03-2010\",\n      \"date4\": \"2010-03-01\",\n      \"year\": 2010.0,\n      \"month\": 3.0,\n      \"quarter\": 1.0\n    },\n    {\n      \"date\": 377.0,\n      \"division\": 5,\n      \"up\": 1181,\n      \"down\": 1045,\n      \"level\": 10397,\n      \"up_ch\": 0.2,\n      \"down_ch\": -0.16905037,\n      \"total\": 12623,\n      \"up_sh\": 0.093559377,\n      \"down_sh\": 0.08278539,\n      \"level_sh\": 0.82365525,\n      \"change_sh\": 0.17634477,\n      \"division_s\": \"Furnishings, household equipment and maintenance\",\n      \"division_sh\": \"Household\",\n      \"date2\": \"01-06-2019\",\n      \"date4\": \"2019-06-01\",\n      \"year\": 2019.0,\n      \"month\": 6.0,\n      \"quarter\": 2.0\n    }\n  ],\n  \"column names\": [\n    \"date\",\n    \"division\",\n    \"up\",\n    \"down\",\n    \"level\",\n    \"up_ch\",\n    \"down_ch\",\n    \"total\",\n    \"up_sh\",\n    \"down_sh\",\n    \"level_sh\",\n    \"change_sh\",\n    \"division_s\",\n    \"division_sh\",\n    \"date2\",\n    \"date4\",\n    \"year\",\n    \"month\",\n    \"quarter\"\n  ]\n}\n\nYour Job:\nI am developing a NL to Data Visualization Dataset. \nPlease help me generate natural language utterance for given dataset and constraints.\nDefinition about the Taks:\n- 'utterance' is what a user would say to make a chart. It should be a questions structure. One NL 'utterance' is in one or two sentences. Here are two examples from Questions for reference:\n    Have cars gotten lighter over time?\n    What major genre had the highest average worldwide gross?\n- 'given dataset' is in form of column names, column type, range/unique values of the column.\n- 'constraints' are information about the chart that should be included in the utterance. \n    So we can find a reference phrase in the NL utterance that corresponds to the given constraints. \n- 'reference phrase' can be explicit, ambiguous, and by_value. 'ambiguous' means the phrase can map to more than one columns in the dataset, always a hypernym of column names(depending on the dataset values).\n    For example:\n    {\"column\": \"gdpPercap\", \"nl_ref_type\": \"explicit\", \"nl_ref_phrase\": \"GDP per capita\"},\n    {\"column\": [\"country\",\"continent\"], \"nl_ref_type\": \"ambiguous\", \"nl_ref_phrase\": \"region\"}\n    {\"column\": [\"country\",\"country_short_name\"], \"nl_ref_type\": \"ambiguous\", \"nl_ref_phrase\": \"countries\"}\n    {\"c_type\": \"mark\", \"c_name\": \"point chart\", \"nl_ref_type\": \"explicit\", \"nl_ref_phrase\": \"scatter plot\"}\n    {\"c_type\": \"mark\", \"c_name\": \"arc chart\", \"nl_ref_type\": \"explicit\", \"nl_ref_phrase\": \"pie chart\"}\n    {\"c_type\": \"transform\",\"c_name\": \"filter\",\"c_list\": [{\"field\": \"country\",\"oneOf\": [\"Iceland\",\"Norway\"]}],\"nl_ref_type\": \"explicit\",\"nl_ref_phrase\": \"for countries Iceland and Norway\"},\n    {\"c_type\": \"transform\",\"c_name\": \"filter\",\"c_list\": [{\"field\": \"country\",\"oneOf\": [\"Iceland\",\"Norway\"]}],\"nl_ref_type\": \"by_value\",\"nl_ref_phrase\": \"for Iceland and Norway\"},\n- the 'nl_ref_phrase' for 'ambiguous' columns should be equally near all ambiguous columns, not too near to one of the column since it would not be ambiguous.\n    good example: {\"column\": [\"country\",\"region\"], \"nl_ref_type\": \"ambiguous\", \"nl_ref_phrase\": \"location\"}\n    bad example: {\"column\": [\"country\",\"region\"], \"nl_ref_type\": \"ambiguous\", \"nl_ref_phrase\": \"region\"}\n- You only include given constraints and no other information. \n    For example, if a column name is not in the given constraint, it will not be included in the NL utterance.\n    Also, it a chart mark or chart encoding channel is not in the given constraint, it will not be included in the NL utterance.\n- all 'nl_ref_phrase' shoule be included in the 'nl_utterance'. \n\nThe output format is identical to the input format, but fill in the str blanks(\"...\").\n### Input:\n{\n  \"nl_utterance\": \"...\",\n  \"encoded_fields\": [\n    {\n      \"field\": \"up_sh\",\n      \"type\": \"quantitative\",\n      \"nl_ref_type\": \"explicit\",\n      \"nl_ref_phrase\": \"...\"\n    },\n    {\n      \"field\": \"down_sh\",\n      \"type\": \"quantitative\",\n      \"nl_ref_type\": \"explicit\",\n      \"nl_ref_phrase\": \"...\"\n    }\n  ],\n  \"constraints\": [\n    {\n      \"c_type\": \"transform\",\n      \"c_name\": \"filter\",\n      \"c_list\": [\n        {\n          \"field\": \"up_sh\",\n          \"lt\": 0.25\n        }\n      ],\n      \"nl_ref_type\": \"by_value\",\n      \"nl_ref_phrase\": \"...\"\n    },\n    {\n      \"c_type\": \"transform\",\n      \"c_name\": \"filter\",\n      \"c_list\": [\n        {\n          \"field\": \"down_sh\",\n          \"lt\": 0.25\n        }\n      ],\n      \"nl_ref_type\": \"by_value\",\n      \"nl_ref_phrase\": \"...\"\n    }\n  ]\n}\n\n### Output:"
}