{
  "gpt_result": {
    "nl_utterance": "Show me the count of districts by Mobility.",
    "encoded_fields": [
      {
        "field": "Mobility",
        "type": "quantitative",
        "nl_ref_type": "explicit",
        "nl_ref_phrase": "Mobility"
      }
    ],
    "constraints": [
      {
        "c_type": "transform",
        "c_name": "aggregate",
        "c_list": [
          {
            "aggregate": "count"
          }
        ],
        "nl_ref_type": "explicit",
        "nl_ref_phrase": "count"
      }
    ]
  },
  "input": "Dataset Information: {\n  \"data samples\": [\n    {\n      \"ID\": 100,\n      \"Name\": \"Johnson City\",\n      \"Mobility\": 0.0621988103,\n      \"State\": \"TN\",\n      \"Population\": 576081,\n      \"Urban\": 1,\n      \"Black\": 0.021,\n      \"Seg_racial\": 0.09,\n      \"Seg_income\": 0.035,\n      \"Seg_poverty\": 0.03,\n      \"Seg_affluence\": 0.038,\n      \"Commute\": 0.325,\n      \"Income\": 31560,\n      \"Gini\": 0.468,\n      \"Share01\": 13.459,\n      \"Gini_99\": 0.333,\n      \"Middle_class\": 0.548,\n      \"Local_tax_rate\": 0.02,\n      \"Local_gov_spending\": 1886.0,\n      \"Progressivity\": 0.0,\n      \"EITC\": 0.0,\n      \"School_spending\": 5.185,\n      \"Student_teacher_ratio\": NaN,\n      \"Test_scores\": 2.728,\n      \"HS_dropout\": -0.015,\n      \"Colleges\": 0.014,\n      \"Tuition\": 4817.0,\n      \"Graduation\": -0.002,\n      \"Labor_force_participation\": 0.587,\n      \"Manufacturing\": 0.237,\n      \"Chinese_imports\": 5.294,\n      \"Teenage_labor\": 0.004,\n      \"Migration_in\": 0.006,\n      \"Migration_out\": 0.005,\n      \"Foreign_born\": 0.012,\n      \"Social_capital\": -0.298,\n      \"Religious\": 0.514,\n      \"Violent_crime\": 0.001,\n      \"Single_mothers\": 0.19,\n      \"Divorced\": 0.11,\n      \"Married\": 0.601,\n      \"Longitude\": -82.4363861083984,\n      \"Latitude\": 36.4703712463379\n    },\n    {\n      \"ID\": 26410,\n      \"Name\": \"Dickinson\",\n      \"Mobility\": 0.329207927,\n      \"State\": \"ND\",\n      \"Population\": 27124,\n      \"Urban\": 0,\n      \"Black\": 0.002,\n      \"Seg_racial\": 0.219,\n      \"Seg_income\": 0.016,\n      \"Seg_poverty\": 0.009,\n      \"Seg_affluence\": 0.019,\n      \"Commute\": 0.659,\n      \"Income\": 29909,\n      \"Gini\": 0.312,\n      \"Share01\": 8.093,\n      \"Gini_99\": 0.231,\n      \"Middle_class\": 0.664,\n      \"Local_tax_rate\": 0.019,\n      \"Local_gov_spending\": 1600.0,\n      \"Progressivity\": 3.44,\n      \"EITC\": 0.0,\n      \"School_spending\": 5.08,\n      \"Student_teacher_ratio\": 18.1,\n      \"Test_scores\": 10.289,\n      \"HS_dropout\": -0.027,\n      \"Colleges\": 0.037,\n      \"Tuition\": 1982.0,\n      \"Graduation\": -0.06,\n      \"Labor_force_participation\": 0.662,\n      \"Manufacturing\": 0.082,\n      \"Chinese_imports\": 0.259,\n      \"Teenage_labor\": 0.006,\n      \"Migration_in\": 0.01,\n      \"Migration_out\": 0.014,\n      \"Foreign_born\": 0.008,\n      \"Social_capital\": 1.261,\n      \"Religious\": 0.836,\n      \"Violent_crime\": 0.0,\n      \"Single_mothers\": 0.154,\n      \"Divorced\": 0.072,\n      \"Married\": 0.598,\n      \"Longitude\": -102.613540649414,\n      \"Latitude\": 47.3269577026367\n    },\n    {\n      \"ID\": 33601,\n      \"Name\": \"Lawton\",\n      \"Mobility\": 0.1048808843,\n      \"State\": \"OK\",\n      \"Population\": 171610,\n      \"Urban\": 1,\n      \"Black\": 0.131,\n      \"Seg_racial\": 0.105,\n      \"Seg_income\": 0.057,\n      \"Seg_poverty\": 0.059,\n      \"Seg_affluence\": 0.058,\n      \"Commute\": 0.472,\n      \"Income\": 27931,\n      \"Gini\": 0.389,\n      \"Share01\": 8.63,\n      \"Gini_99\": 0.303,\n      \"Middle_class\": 0.57,\n      \"Local_tax_rate\": 0.014,\n      \"Local_gov_spending\": 1627.0,\n      \"Progressivity\": 0.0,\n      \"EITC\": 0.0,\n      \"School_spending\": 4.616,\n      \"Student_teacher_ratio\": 17.1,\n      \"Test_scores\": -1.779,\n      \"HS_dropout\": -0.009,\n      \"Colleges\": 0.006,\n      \"Tuition\": 1470.0,\n      \"Graduation\": -0.167,\n      \"Labor_force_participation\": 0.618,\n      \"Manufacturing\": 0.108,\n      \"Chinese_imports\": 0.569,\n      \"Teenage_labor\": 0.004,\n      \"Migration_in\": 0.028,\n      \"Migration_out\": 0.035,\n      \"Foreign_born\": 0.043,\n      \"Social_capital\": -1.228,\n      \"Religious\": 0.653,\n      \"Violent_crime\": 0.002,\n      \"Single_mothers\": 0.223,\n      \"Divorced\": 0.11,\n      \"Married\": 0.578,\n      \"Longitude\": -98.0752716064453,\n      \"Latitude\": 34.1608734130859\n    },\n    {\n      \"ID\": 26003,\n      \"Name\": \"West Cook UT\",\n      \"Mobility\": 0.1016949117,\n      \"State\": \"MN\",\n      \"Population\": 5168,\n      \"Urban\": 0,\n      \"Black\": 0.003,\n      \"Seg_racial\": 0.037,\n      \"Seg_income\": 0.0,\n      \"Seg_poverty\": 0.0,\n      \"Seg_affluence\": 0.0,\n      \"Commute\": 0.588,\n      \"Income\": 39706,\n      \"Gini\": 0.336,\n      \"Share01\": NaN,\n      \"Gini_99\": NaN,\n      \"Middle_class\": NaN,\n      \"Local_tax_rate\": 0.038,\n      \"Local_gov_spending\": 4652.0,\n      \"Progressivity\": 2.5,\n      \"EITC\": 17.286,\n      \"School_spending\": 6.391,\n      \"Student_teacher_ratio\": 16.9,\n      \"Test_scores\": NaN,\n      \"HS_dropout\": NaN,\n      \"Colleges\": NaN,\n      \"Tuition\": NaN,\n      \"Graduation\": NaN,\n      \"Labor_force_participation\": 0.672,\n      \"Manufacturing\": 0.062,\n      \"Chinese_imports\": 0.05,\n      \"Teenage_labor\": NaN,\n      \"Migration_in\": 0.013,\n      \"Migration_out\": 0.007,\n      \"Foreign_born\": 0.023,\n      \"Social_capital\": 3.963,\n      \"Religious\": 0.474,\n      \"Violent_crime\": 0.001,\n      \"Single_mothers\": 0.19,\n      \"Divorced\": 0.103,\n      \"Married\": 0.599,\n      \"Longitude\": -90.2893295288086,\n      \"Latitude\": 48.0081367492676\n    },\n    {\n      \"ID\": 28102,\n      \"Name\": \"Nebraska City\",\n      \"Mobility\": 0.1583514065,\n      \"State\": \"NE\",\n      \"Population\": 40078,\n      \"Urban\": 0,\n      \"Black\": 0.002,\n      \"Seg_racial\": 0.062,\n      \"Seg_income\": 0.013,\n      \"Seg_poverty\": 0.014,\n      \"Seg_affluence\": 0.017,\n      \"Commute\": 0.514,\n      \"Income\": 34517,\n      \"Gini\": 0.287,\n      \"Share01\": 5.397,\n      \"Gini_99\": 0.233,\n      \"Middle_class\": 0.657,\n      \"Local_tax_rate\": 0.025,\n      \"Local_gov_spending\": 2052.0,\n      \"Progressivity\": 1.72,\n      \"EITC\": 0.0,\n      \"School_spending\": 6.737,\n      \"Student_teacher_ratio\": 13.8,\n      \"Test_scores\": 6.023,\n      \"HS_dropout\": -0.031,\n      \"Colleges\": 0.025,\n      \"Tuition\": 1973.0,\n      \"Graduation\": 0.01,\n      \"Labor_force_participation\": 0.644,\n      \"Manufacturing\": 0.127,\n      \"Chinese_imports\": 0.56,\n      \"Teenage_labor\": 0.006,\n      \"Migration_in\": 0.015,\n      \"Migration_out\": 0.018,\n      \"Foreign_born\": 0.015,\n      \"Social_capital\": 1.614,\n      \"Religious\": 0.662,\n      \"Violent_crime\": 0.0,\n      \"Single_mothers\": 0.15,\n      \"Divorced\": 0.088,\n      \"Married\": 0.606,\n      \"Longitude\": -95.7429656982422,\n      \"Latitude\": 40.315299987793\n    }\n  ],\n  \"column names\": [\n    \"ID\",\n    \"Name\",\n    \"Mobility\",\n    \"State\",\n    \"Population\",\n    \"Urban\",\n    \"Black\",\n    \"Seg_racial\",\n    \"Seg_income\",\n    \"Seg_poverty\",\n    \"Seg_affluence\",\n    \"Commute\",\n    \"Income\",\n    \"Gini\",\n    \"Share01\",\n    \"Gini_99\",\n    \"Middle_class\",\n    \"Local_tax_rate\",\n    \"Local_gov_spending\",\n    \"Progressivity\",\n    \"EITC\",\n    \"School_spending\",\n    \"Student_teacher_ratio\",\n    \"Test_scores\",\n    \"HS_dropout\",\n    \"Colleges\",\n    \"Tuition\",\n    \"Graduation\",\n    \"Labor_force_participation\",\n    \"Manufacturing\",\n    \"Chinese_imports\",\n    \"Teenage_labor\",\n    \"Migration_in\",\n    \"Migration_out\",\n    \"Foreign_born\",\n    \"Social_capital\",\n    \"Religious\",\n    \"Violent_crime\",\n    \"Single_mothers\",\n    \"Divorced\",\n    \"Married\",\n    \"Longitude\",\n    \"Latitude\"\n  ]\n}\n\nYour Job:\nI am developing a NL to Data Visualization Dataset. \nPlease help me generate natural language utterance for given dataset and constraints.\nDefinition about the Taks:\n- 'utterance' is what a user would say to make a chart.  One NL 'utterance' is in one or two sentences. Here are two examples from Others for reference:\n    I want to know how many orders there are by the quantity of the order.\n    scatter(x=production budget, y=worldwide gross) for content rating.\n- 'given dataset' is in form of column names, column type, range/unique values of the column.\n- 'constraints' are information about the chart that should be included in the utterance. \n    So we can find a reference phrase in the NL utterance that corresponds to the given constraints. \n- 'reference phrase' can be explicit, ambiguous, and by_value. 'ambiguous' means the phrase can map to more than one columns in the dataset, always a hypernym of column names(depending on the dataset values).\n    For example:\n    {\"column\": \"gdpPercap\", \"nl_ref_type\": \"explicit\", \"nl_ref_phrase\": \"GDP per capita\"},\n    {\"column\": [\"country\",\"continent\"], \"nl_ref_type\": \"ambiguous\", \"nl_ref_phrase\": \"region\"}\n    {\"column\": [\"country\",\"country_short_name\"], \"nl_ref_type\": \"ambiguous\", \"nl_ref_phrase\": \"countries\"}\n    {\"c_type\": \"mark\", \"c_name\": \"point chart\", \"nl_ref_type\": \"explicit\", \"nl_ref_phrase\": \"scatter plot\"}\n    {\"c_type\": \"mark\", \"c_name\": \"arc chart\", \"nl_ref_type\": \"explicit\", \"nl_ref_phrase\": \"pie chart\"}\n    {\"c_type\": \"transform\",\"c_name\": \"filter\",\"c_list\": [{\"field\": \"country\",\"oneOf\": [\"Iceland\",\"Norway\"]}],\"nl_ref_type\": \"explicit\",\"nl_ref_phrase\": \"for countries Iceland and Norway\"},\n    {\"c_type\": \"transform\",\"c_name\": \"filter\",\"c_list\": [{\"field\": \"country\",\"oneOf\": [\"Iceland\",\"Norway\"]}],\"nl_ref_type\": \"by_value\",\"nl_ref_phrase\": \"for Iceland and Norway\"},\n- the 'nl_ref_phrase' for 'ambiguous' columns should be equally near all ambiguous columns, not too near to one of the column since it would not be ambiguous.\n    good example: {\"column\": [\"country\",\"region\"], \"nl_ref_type\": \"ambiguous\", \"nl_ref_phrase\": \"location\"}\n    bad example: {\"column\": [\"country\",\"region\"], \"nl_ref_type\": \"ambiguous\", \"nl_ref_phrase\": \"region\"}\n- You only include given constraints and no other information. \n    For example, if a column name is not in the given constraint, it will not be included in the NL utterance.\n    Also, it a chart mark or chart encoding channel is not in the given constraint, it will not be included in the NL utterance.\n- all 'nl_ref_phrase' shoule be included in the 'nl_utterance'. \n\nThe output format is identical to the input format, but fill in the str blanks(\"...\").\n### Input:\n{\n  \"nl_utterance\": \"...\",\n  \"encoded_fields\": [\n    {\n      \"field\": \"Mobility\",\n      \"type\": \"quantitative\",\n      \"nl_ref_type\": \"explicit\",\n      \"nl_ref_phrase\": \"...\"\n    }\n  ],\n  \"constraints\": [\n    {\n      \"c_type\": \"transform\",\n      \"c_name\": \"aggregate\",\n      \"c_list\": [\n        {\n          \"aggregate\": \"count\"\n        }\n      ],\n      \"nl_ref_type\": \"explicit\",\n      \"nl_ref_phrase\": \"...\"\n    }\n  ]\n}\n\n### Output:"
}