{
  "gpt_result": {
    "nl_utterance": "Create a scatter plot to show the correlation between median income, income relative to the median, and firearm deaths.",
    "encoded_fields": [
      {
        "field": [
          "medIncome",
          "Income_vs_med"
        ],
        "type": "quantitative",
        "nl_ref_type": "ambiguous",
        "nl_ref_phrase": "income aspects"
      },
      {
        "field": "FirearmDeaths",
        "type": "quantitative",
        "nl_ref_type": "explicit",
        "nl_ref_phrase": "firearm deaths"
      }
    ],
    "constraints": [
      {
        "c_type": "task",
        "c_name": "correlation",
        "c_list": [
          {
            "mark": "circle",
            "encoding": {
              "x": {
                "type": "quantitative"
              },
              "y": {
                "type": "quantitative"
              }
            }
          }
        ],
        "nl_ref_type": "explicit",
        "nl_ref_phrase": "correlation"
      }
    ]
  },
  "input": "Dataset Information: {\n  \"data samples\": [\n    {\n      \"State\": \"Alabama\",\n      \"StateInitials\": \"AL\",\n      \"Gini\": 0.472,\n      \"DeathRate\": 21.5,\n      \"Firearms_vs_avg\": 1.64700475,\n      \"medIncome\": 47221,\n      \"Income_vs_med\": 0.799827233,\n      \"ImprisonmentRate\": 736,\n      \"PrisonRate\": 1.264604811,\n      \"ImprisonmentRate.1\": 0.736,\n      \"FirearmDeaths\": 0.215,\n      \"GeographicDivision\": \"South\"\n    },\n    {\n      \"State\": \"New York\",\n      \"StateInitials\": \"NY\",\n      \"Gini\": 0.499,\n      \"DeathRate\": 4.4,\n      \"Firearms_vs_avg\": 0.337061437,\n      \"medIncome\": 61437,\n      \"Income_vs_med\": 1.040617219,\n      \"ImprisonmentRate\": 325,\n      \"PrisonRate\": 0.558419244,\n      \"ImprisonmentRate.1\": 0.325,\n      \"FirearmDeaths\": 0.044,\n      \"GeographicDivision\": \"Northeast\"\n    },\n    {\n      \"State\": \"Missouri\",\n      \"StateInitials\": \"MO\",\n      \"Gini\": 0.455,\n      \"DeathRate\": 19.0,\n      \"Firearms_vs_avg\": 1.455492569,\n      \"medIncome\": 55016,\n      \"Income_vs_med\": 0.931858602,\n      \"ImprisonmentRate\": 688,\n      \"PrisonRate\": 1.182130584,\n      \"ImprisonmentRate.1\": 0.688,\n      \"FirearmDeaths\": 0.19,\n      \"GeographicDivision\": \"Midwest\"\n    },\n    {\n      \"State\": \"North Dakota\",\n      \"StateInitials\": \"ND\",\n      \"Gini\": 0.433,\n      \"DeathRate\": 11.9,\n      \"Firearms_vs_avg\": 0.911597978,\n      \"medIncome\": 60184,\n      \"Income_vs_med\": 1.01939396,\n      \"ImprisonmentRate\": 306,\n      \"PrisonRate\": 0.525773196,\n      \"ImprisonmentRate.1\": 0.306,\n      \"FirearmDeaths\": 0.119,\n      \"GeographicDivision\": \"Midwest\"\n    },\n    {\n      \"State\": \"Nevada\",\n      \"StateInitials\": \"NV\",\n      \"Gini\": 0.448,\n      \"DeathRate\": 16.8,\n      \"Firearms_vs_avg\": 1.286961851,\n      \"medIncome\": 55431,\n      \"Income_vs_med\": 0.938887854,\n      \"ImprisonmentRate\": 597,\n      \"PrisonRate\": 1.025773196,\n      \"ImprisonmentRate.1\": 0.597,\n      \"FirearmDeaths\": 0.168,\n      \"GeographicDivision\": \"West\"\n    }\n  ],\n  \"column names\": [\n    \"State\",\n    \"StateInitials\",\n    \"Gini\",\n    \"DeathRate\",\n    \"Firearms_vs_avg\",\n    \"medIncome\",\n    \"Income_vs_med\",\n    \"ImprisonmentRate\",\n    \"PrisonRate\",\n    \"ImprisonmentRate.1\",\n    \"FirearmDeaths\",\n    \"GeographicDivision\"\n  ]\n}\n\nYour Job:\nI am developing a NL to Data Visualization Dataset. \nPlease help me generate natural language utterance for given dataset and constraints.\nDefinition about the Taks:\n- 'utterance' is what a user would say to make a chart. It should be a commands structure. One NL 'utterance' is in one or two sentences. Here are two examples from Commands for reference:\n    Sort creative types by number of movies.\n    Create a line chart showing order date and sum of sales, divided by category.\n- 'given dataset' is in form of column names, column type, range/unique values of the column.\n- 'constraints' are information about the chart that should be included in the utterance. \n    So we can find a reference phrase in the NL utterance that corresponds to the given constraints. \n- 'reference phrase' can be explicit, ambiguous, and by_value. 'ambiguous' means the phrase can map to more than one columns in the dataset, always a hypernym of column names(depending on the dataset values).\n    For example:\n    {\"column\": \"gdpPercap\", \"nl_ref_type\": \"explicit\", \"nl_ref_phrase\": \"GDP per capita\"},\n    {\"column\": [\"country\",\"continent\"], \"nl_ref_type\": \"ambiguous\", \"nl_ref_phrase\": \"region\"}\n    {\"column\": [\"country\",\"country_short_name\"], \"nl_ref_type\": \"ambiguous\", \"nl_ref_phrase\": \"countries\"}\n    {\"c_type\": \"mark\", \"c_name\": \"point chart\", \"nl_ref_type\": \"explicit\", \"nl_ref_phrase\": \"scatter plot\"}\n    {\"c_type\": \"mark\", \"c_name\": \"arc chart\", \"nl_ref_type\": \"explicit\", \"nl_ref_phrase\": \"pie chart\"}\n    {\"c_type\": \"transform\",\"c_name\": \"filter\",\"c_list\": [{\"field\": \"country\",\"oneOf\": [\"Iceland\",\"Norway\"]}],\"nl_ref_type\": \"explicit\",\"nl_ref_phrase\": \"for countries Iceland and Norway\"},\n    {\"c_type\": \"transform\",\"c_name\": \"filter\",\"c_list\": [{\"field\": \"country\",\"oneOf\": [\"Iceland\",\"Norway\"]}],\"nl_ref_type\": \"by_value\",\"nl_ref_phrase\": \"for Iceland and Norway\"},\n- the 'nl_ref_phrase' for 'ambiguous' columns should be equally near all ambiguous columns, not too near to one of the column since it would not be ambiguous.\n    good example: {\"column\": [\"country\",\"region\"], \"nl_ref_type\": \"ambiguous\", \"nl_ref_phrase\": \"location\"}\n    bad example: {\"column\": [\"country\",\"region\"], \"nl_ref_type\": \"ambiguous\", \"nl_ref_phrase\": \"region\"}\n- You only include given constraints and no other information. \n    For example, if a column name is not in the given constraint, it will not be included in the NL utterance.\n    Also, it a chart mark or chart encoding channel is not in the given constraint, it will not be included in the NL utterance.\n- all 'nl_ref_phrase' shoule be included in the 'nl_utterance'. \n\nThe output format is identical to the input format, but fill in the str blanks(\"...\").\n### Input:\n{\n  \"nl_utterance\": \"...\",\n  \"encoded_fields\": [\n    {\n      \"field\": [\n        \"medIncome\",\n        \"Income_vs_med\"\n      ],\n      \"type\": \"quantitative\",\n      \"nl_ref_type\": \"ambiguous\",\n      \"nl_ref_phrase\": \"...\"\n    },\n    {\n      \"field\": \"FirearmDeaths\",\n      \"type\": \"quantitative\",\n      \"nl_ref_type\": \"explicit\",\n      \"nl_ref_phrase\": \"...\"\n    }\n  ],\n  \"constraints\": [\n    {\n      \"c_type\": \"task\",\n      \"c_name\": \"correlation\",\n      \"c_list\": [\n        {\n          \"mark\": \"circle\",\n          \"encoding\": {\n            \"x\": {\n              \"type\": \"quantitative\"\n            },\n            \"y\": {\n              \"type\": \"quantitative\"\n            }\n          }\n        }\n      ],\n      \"nl_ref_type\": \"explicit\",\n      \"nl_ref_phrase\": \"...\"\n    }\n  ]\n}\n\n### Output:"
}