{
  "gpt_result": {
    "nl_utterance": "What is the total number of floors across all entries in the dataset?",
    "encoded_fields": [
      {
        "field": "Total Floors",
        "type": "quantitative",
        "nl_ref_type": "explicit",
        "nl_ref_phrase": "total number of floors"
      }
    ],
    "constraints": [
      {
        "c_type": "transform",
        "c_name": "aggregate",
        "c_list": [
          {
            "field": "Total Floors",
            "aggregate": "sum"
          }
        ],
        "nl_ref_type": "explicit",
        "nl_ref_phrase": "total number of floors"
      }
    ]
  },
  "input": "Dataset Information: {\n  \"data samples\": [\n    {\n      \"Agency Name\": \"Department of Natural Resources\",\n      \"Location Name\": \"Anderson Lake Conservation Area - Fulton County\",\n      \"Address\": \"Anderson Lake C.a.\",\n      \"City\": \"Astoria\",\n      \"Zip code\": 61501,\n      \"County\": \"Fulton\",\n      \"Congress Dist\": 17,\n      \"Congressional Full Name\": \"Cheri Bustos\",\n      \"Rep Dist\": 93,\n      \"Rep Full Name\": \"Hammond Norine K.\",\n      \"Senate Dist\": 47,\n      \"Senator Full Name\": \"Jil Tracy\",\n      \"Bldg Status\": \"In Use\",\n      \"Year Acquired\": 1975,\n      \"Year Constructed\": 1975,\n      \"Square Footage\": 144,\n      \"Total Floors\": 1,\n      \"Floors Above Grade\": 1,\n      \"Floors Below Grade\": 0,\n      \"Usage Description\": \"Unusual\",\n      \"Usage Description 2\": \"Unusual\",\n      \"Usage Description 3\": \"Not provided\"\n    },\n    {\n      \"Agency Name\": \"Department of Natural Resources\",\n      \"Location Name\": \"Prairie Chicken Sanctuary Nature Preserve - Marion Co.\",\n      \"Address\": \"3 Mile South Of Kinmundy\",\n      \"City\": \"Kinmundy\",\n      \"Zip code\": 62854,\n      \"County\": \"Marion\",\n      \"Congress Dist\": 0,\n      \"Congressional Full Name\": NaN,\n      \"Rep Dist\": 108,\n      \"Rep Full Name\": \"Meier Charles\",\n      \"Senate Dist\": 54,\n      \"Senator Full Name\": \"Kyle McCarter\",\n      \"Bldg Status\": \"In Use\",\n      \"Year Acquired\": 0,\n      \"Year Constructed\": 0,\n      \"Square Footage\": 4200,\n      \"Total Floors\": 1,\n      \"Floors Above Grade\": 1,\n      \"Floors Below Grade\": 0,\n      \"Usage Description\": \"Storage\",\n      \"Usage Description 2\": \"Storage\",\n      \"Usage Description 3\": \"Not provided\"\n    },\n    {\n      \"Agency Name\": \"Department of Transportation\",\n      \"Location Name\": \"Fairfield Maintenance Storage Facility\",\n      \"Address\": \"R.r. #4, Box 286\",\n      \"City\": \"Fairfield\",\n      \"Zip code\": 62837,\n      \"County\": \"Wayne\",\n      \"Congress Dist\": 15,\n      \"Congressional Full Name\": \"John Shimkus\",\n      \"Rep Dist\": 109,\n      \"Rep Full Name\": \"Reis David B.\",\n      \"Senate Dist\": 55,\n      \"Senator Full Name\": \"Dale A. Righter\",\n      \"Bldg Status\": \"In Use\",\n      \"Year Acquired\": 1987,\n      \"Year Constructed\": 1987,\n      \"Square Footage\": 4032,\n      \"Total Floors\": 1,\n      \"Floors Above Grade\": 1,\n      \"Floors Below Grade\": 0,\n      \"Usage Description\": \"Storage\",\n      \"Usage Description 2\": \"Storage\",\n      \"Usage Description 3\": \"Not provided\"\n    },\n    {\n      \"Agency Name\": \"Historic Preservation Agency\",\n      \"Location Name\": \"Bishop Hill Historic Site - Henry County\",\n      \"Address\": \"P.o. Box 104\",\n      \"City\": \"Bishop Hill\",\n      \"Zip code\": 61419,\n      \"County\": \"Henry\",\n      \"Congress Dist\": 17,\n      \"Congressional Full Name\": \"Cheri Bustos\",\n      \"Rep Dist\": 74,\n      \"Rep Full Name\": \"Swanson Daniel\",\n      \"Senate Dist\": 37,\n      \"Senator Full Name\": \"Chuck Weaver\",\n      \"Bldg Status\": \"In Use\",\n      \"Year Acquired\": 1860,\n      \"Year Constructed\": 1855,\n      \"Square Footage\": 2028,\n      \"Total Floors\": 2,\n      \"Floors Above Grade\": 2,\n      \"Floors Below Grade\": 0,\n      \"Usage Description\": \"Storage\",\n      \"Usage Description 2\": \"Storage\",\n      \"Usage Description 3\": \"Not provided\"\n    },\n    {\n      \"Agency Name\": \"Department of Corrections\",\n      \"Location Name\": \"Vandalia Correctional Center - Fayette County\",\n      \"Address\": \"P.o. Box 500, Rte. 51 N.\",\n      \"City\": \"Vandalia\",\n      \"Zip code\": 62471,\n      \"County\": \"Fayette\",\n      \"Congress Dist\": 15,\n      \"Congressional Full Name\": \"John Shimkus\",\n      \"Rep Dist\": 107,\n      \"Rep Full Name\": \"Cavaletto John\",\n      \"Senate Dist\": 54,\n      \"Senator Full Name\": \"Kyle McCarter\",\n      \"Bldg Status\": \"In Use\",\n      \"Year Acquired\": 1977,\n      \"Year Constructed\": 1977,\n      \"Square Footage\": 1686,\n      \"Total Floors\": 1,\n      \"Floors Above Grade\": 1,\n      \"Floors Below Grade\": 0,\n      \"Usage Description\": \"Unusual\",\n      \"Usage Description 2\": \"Unusual\",\n      \"Usage Description 3\": \"Not provided\"\n    }\n  ],\n  \"column names\": [\n    \"Agency Name\",\n    \"Location Name\",\n    \"Address\",\n    \"City\",\n    \"Zip code\",\n    \"County\",\n    \"Congress Dist\",\n    \"Congressional Full Name\",\n    \"Rep Dist\",\n    \"Rep Full Name\",\n    \"Senate Dist\",\n    \"Senator Full Name\",\n    \"Bldg Status\",\n    \"Year Acquired\",\n    \"Year Constructed\",\n    \"Square Footage\",\n    \"Total Floors\",\n    \"Floors Above Grade\",\n    \"Floors Below Grade\",\n    \"Usage Description\",\n    \"Usage Description 2\",\n    \"Usage Description 3\"\n  ]\n}\n\nYour Job:\nI am developing a NL to Data Visualization Dataset. \nPlease help me generate natural language utterance for given dataset and constraints.\nDefinition about the Taks:\n- 'utterance' is what a user would say to make a chart. It should be a questions structure. One NL 'utterance' is in one or two sentences. Here are two examples from Questions for reference:\n    How much do various cars weigh?\n    What's the average production budget of the different rated movies, separated by creative type.\n- 'given dataset' is in form of column names, column type, range/unique values of the column.\n- 'constraints' are information about the chart that should be included in the utterance. \n    So we can find a reference phrase in the NL utterance that corresponds to the given constraints. \n- 'reference phrase' can be explicit, ambiguous, and by_value. 'ambiguous' means the phrase can map to more than one columns in the dataset, always a hypernym of column names(depending on the dataset values).\n    For example:\n    {\"column\": \"gdpPercap\", \"nl_ref_type\": \"explicit\", \"nl_ref_phrase\": \"GDP per capita\"},\n    {\"column\": [\"country\",\"continent\"], \"nl_ref_type\": \"ambiguous\", \"nl_ref_phrase\": \"region\"}\n    {\"column\": [\"country\",\"country_short_name\"], \"nl_ref_type\": \"ambiguous\", \"nl_ref_phrase\": \"countries\"}\n    {\"c_type\": \"mark\", \"c_name\": \"point chart\", \"nl_ref_type\": \"explicit\", \"nl_ref_phrase\": \"scatter plot\"}\n    {\"c_type\": \"mark\", \"c_name\": \"arc chart\", \"nl_ref_type\": \"explicit\", \"nl_ref_phrase\": \"pie chart\"}\n    {\"c_type\": \"transform\",\"c_name\": \"filter\",\"c_list\": [{\"field\": \"country\",\"oneOf\": [\"Iceland\",\"Norway\"]}],\"nl_ref_type\": \"explicit\",\"nl_ref_phrase\": \"for countries Iceland and Norway\"},\n    {\"c_type\": \"transform\",\"c_name\": \"filter\",\"c_list\": [{\"field\": \"country\",\"oneOf\": [\"Iceland\",\"Norway\"]}],\"nl_ref_type\": \"by_value\",\"nl_ref_phrase\": \"for Iceland and Norway\"},\n- the 'nl_ref_phrase' for 'ambiguous' columns should be equally near all ambiguous columns, not too near to one of the column since it would not be ambiguous.\n    good example: {\"column\": [\"country\",\"region\"], \"nl_ref_type\": \"ambiguous\", \"nl_ref_phrase\": \"location\"}\n    bad example: {\"column\": [\"country\",\"region\"], \"nl_ref_type\": \"ambiguous\", \"nl_ref_phrase\": \"region\"}\n- You only include given constraints and no other information. \n    For example, if a column name is not in the given constraint, it will not be included in the NL utterance.\n    Also, it a chart mark or chart encoding channel is not in the given constraint, it will not be included in the NL utterance.\n- all 'nl_ref_phrase' shoule be included in the 'nl_utterance'. \n\nThe output format is identical to the input format, but fill in the str blanks(\"...\").\n### Input:\n{\n  \"nl_utterance\": \"...\",\n  \"encoded_fields\": [\n    {\n      \"field\": \"Total Floors\",\n      \"type\": \"quantitative\",\n      \"nl_ref_type\": \"explicit\",\n      \"nl_ref_phrase\": \"...\"\n    }\n  ],\n  \"constraints\": [\n    {\n      \"c_type\": \"transform\",\n      \"c_name\": \"aggregate\",\n      \"c_list\": [\n        {\n          \"field\": \"Total Floors\",\n          \"aggregate\": \"sum\"\n        }\n      ],\n      \"nl_ref_type\": \"explicit\",\n      \"nl_ref_phrase\": \"...\"\n    }\n  ]\n}\n\n### Output:"
}