{
  "gpt_result": {
    "nl_utterance": "Can you show me a bar chart of the different states represented in the dataset?",
    "encoded_fields": [
      {
        "field": "State",
        "type": "nominal",
        "nl_ref_type": "explicit",
        "nl_ref_phrase": "states"
      }
    ],
    "constraints": [
      {
        "c_type": "mark",
        "c_name": "bar chart",
        "c_list": [
          {
            "mark": "bar",
            "encoding": {
              "x": {},
              "y": {
                "type": "quantitative"
              },
              "color": {
                "type": "nominal",
                "ignore": true
              },
              "column": {
                "ignore": true,
                "type": "nominal"
              },
              "row": {
                "ignore": true,
                "type": "nominal"
              }
            },
            "unique_map": {
              "x": "y"
            }
          },
          {
            "mark": "bar",
            "encoding": {
              "y": {},
              "x": {
                "type": "quantitative"
              },
              "color": {
                "type": "nominal",
                "ignore": true
              },
              "column": {
                "ignore": true,
                "type": "nominal"
              },
              "row": {
                "ignore": true,
                "type": "nominal"
              }
            },
            "unique_map": {
              "y": "x"
            }
          }
        ],
        "nl_ref_type": "explicit",
        "nl_ref_phrase": "bar chart"
      }
    ]
  },
  "input": "Dataset Information: {\n  \"data samples\": [\n    {\n      \"Days to Ship Actual\": 6,\n      \"Sales Forecast\": 293,\n      \"Ship Status\": \"Shipped On Time\",\n      \"Days to Ship Scheduled\": 6,\n      \"Sales per Customer\": \"$209.30 \",\n      \"Profit Ratio\": \"27.00%\",\n      \"Category\": \"Office Supplies\",\n      \"City\": \"Columbus\",\n      \"Country\": \"United States\",\n      \"Customer Name\": \"Chuck Clark\",\n      \"Days to Ship Actual (bin)\": 5,\n      \"Discount\": 0,\n      \"Number of Records\": 1,\n      \"Order Date\": \"12/30/2017\",\n      \"Order ID\": \"CA-2017-126221\",\n      \"Postal Code\": 47201,\n      \"Product Name\": \"Eureka The Boss Plus 12-Amp Hard Box Upright Vacuum, Red\",\n      \"Profit\": 56.511,\n      \"Quantity\": 2,\n      \"Region\": \"Central\",\n      \"Sales (bin)\": \"$0 \",\n      \"Sales\": 209.3,\n      \"Segment\": \"Home Office\",\n      \"Ship Date\": \"1/5/2018\",\n      \"Ship Mode\": \"Standard Class\",\n      \"State\": \"Indiana\",\n      \"Sub-Category\": \"Appliances\"\n    },\n    {\n      \"Days to Ship Actual\": 3,\n      \"Sales Forecast\": 28,\n      \"Ship Status\": \"Shipped Late\",\n      \"Days to Ship Scheduled\": 1,\n      \"Sales per Customer\": \"$20.04 \",\n      \"Profit Ratio\": \"48.00%\",\n      \"Category\": \"Office Supplies\",\n      \"City\": \"Fairfield\",\n      \"Country\": \"United States\",\n      \"Customer Name\": \"Dave Hallsten\",\n      \"Days to Ship Actual (bin)\": 2,\n      \"Discount\": 0,\n      \"Number of Records\": 1,\n      \"Order Date\": \"3/28/2017\",\n      \"Order ID\": \"US-2017-147886\",\n      \"Postal Code\": 94533,\n      \"Product Name\": \"Xerox 1977\",\n      \"Profit\": 9.6192,\n      \"Quantity\": 3,\n      \"Region\": \"West\",\n      \"Sales (bin)\": \"$0 \",\n      \"Sales\": 20.04,\n      \"Segment\": \"Corporate\",\n      \"Ship Date\": \"3/31/2017\",\n      \"Ship Mode\": \"First Class\",\n      \"State\": \"California\",\n      \"Sub-Category\": \"Paper\"\n    },\n    {\n      \"Days to Ship Actual\": 2,\n      \"Sales Forecast\": 55,\n      \"Ship Status\": \"Shipped Early\",\n      \"Days to Ship Scheduled\": 3,\n      \"Sales per Customer\": \"$38.98 \",\n      \"Profit Ratio\": \"-6.30%\",\n      \"Category\": \"Office Supplies\",\n      \"City\": \"Toledo\",\n      \"Country\": \"United States\",\n      \"Customer Name\": \"Art Foster\",\n      \"Days to Ship Actual (bin)\": 1,\n      \"Discount\": 20,\n      \"Number of Records\": 1,\n      \"Order Date\": \"11/10/2016\",\n      \"Order ID\": \"CA-2016-115588\",\n      \"Postal Code\": 43615,\n      \"Product Name\": \"Acco Perma 4000 Stacking Storage Drawers\",\n      \"Profit\": -2.436,\n      \"Quantity\": 3,\n      \"Region\": \"East\",\n      \"Sales (bin)\": \"$0 \",\n      \"Sales\": 38.976,\n      \"Segment\": \"Consumer\",\n      \"Ship Date\": \"11/12/2016\",\n      \"Ship Mode\": \"Second Class\",\n      \"State\": \"Ohio\",\n      \"Sub-Category\": \"Storage\"\n    },\n    {\n      \"Days to Ship Actual\": 4,\n      \"Sales Forecast\": 74,\n      \"Ship Status\": \"Shipped Early\",\n      \"Days to Ship Scheduled\": 6,\n      \"Sales per Customer\": \"$52.76 \",\n      \"Profit Ratio\": \"46.00%\",\n      \"Category\": \"Office Supplies\",\n      \"City\": \"Seattle\",\n      \"Country\": \"United States\",\n      \"Customer Name\": \"Mathew Reese\",\n      \"Days to Ship Actual (bin)\": 4,\n      \"Discount\": 0,\n      \"Number of Records\": 1,\n      \"Order Date\": \"7/8/2017\",\n      \"Order ID\": \"CA-2017-111759\",\n      \"Postal Code\": 98103,\n      \"Product Name\": \"Easy-staple paper\",\n      \"Profit\": 24.2696,\n      \"Quantity\": 2,\n      \"Region\": \"West\",\n      \"Sales (bin)\": \"$0 \",\n      \"Sales\": 52.76,\n      \"Segment\": \"Home Office\",\n      \"Ship Date\": \"7/12/2017\",\n      \"Ship Mode\": \"Standard Class\",\n      \"State\": \"Washington\",\n      \"Sub-Category\": \"Paper\"\n    },\n    {\n      \"Days to Ship Actual\": 0,\n      \"Sales Forecast\": 24,\n      \"Ship Status\": \"Shipped On Time\",\n      \"Days to Ship Scheduled\": 0,\n      \"Sales per Customer\": \"$17.34 \",\n      \"Profit Ratio\": \"27.00%\",\n      \"Category\": \"Office Supplies\",\n      \"City\": \"Kenner\",\n      \"Country\": \"United States\",\n      \"Customer Name\": \"Hunter Glantz\",\n      \"Days to Ship Actual (bin)\": 0,\n      \"Discount\": 0,\n      \"Number of Records\": 1,\n      \"Order Date\": \"8/13/2016\",\n      \"Order ID\": \"US-2016-156692\",\n      \"Postal Code\": 70065,\n      \"Product Name\": \"Staple holder\",\n      \"Profit\": 4.6818,\n      \"Quantity\": 2,\n      \"Region\": \"South\",\n      \"Sales (bin)\": \"$0 \",\n      \"Sales\": 17.34,\n      \"Segment\": \"Consumer\",\n      \"Ship Date\": \"8/13/2016\",\n      \"Ship Mode\": \"Same Day\",\n      \"State\": \"Louisiana\",\n      \"Sub-Category\": \"Appliances\"\n    }\n  ],\n  \"column names\": [\n    \"Days to Ship Actual\",\n    \"Sales Forecast\",\n    \"Ship Status\",\n    \"Days to Ship Scheduled\",\n    \"Sales per Customer\",\n    \"Profit Ratio\",\n    \"Category\",\n    \"City\",\n    \"Country\",\n    \"Customer Name\",\n    \"Days to Ship Actual (bin)\",\n    \"Discount\",\n    \"Number of Records\",\n    \"Order Date\",\n    \"Order ID\",\n    \"Postal Code\",\n    \"Product Name\",\n    \"Profit\",\n    \"Quantity\",\n    \"Region\",\n    \"Sales (bin)\",\n    \"Sales\",\n    \"Segment\",\n    \"Ship Date\",\n    \"Ship Mode\",\n    \"State\",\n    \"Sub-Category\"\n  ]\n}\n\nYour Job:\nI am developing a NL to Data Visualization Dataset. \nPlease help me generate natural language utterance for given dataset and constraints.\nDefinition about the Taks:\n- 'utterance' is what a user would say to make a chart. It should be a questions structure. One NL 'utterance' is in one or two sentences. Here are two examples from Questions for reference:\n    How does displacement relate to fuel economy for cars from Europe vs. USA?\n    On average, how much was earned by movies of each genre?\n- 'given dataset' is in form of column names, column type, range/unique values of the column.\n- 'constraints' are information about the chart that should be included in the utterance. \n    So we can find a reference phrase in the NL utterance that corresponds to the given constraints. \n- 'reference phrase' can be explicit, ambiguous, and by_value. 'ambiguous' means the phrase can map to more than one columns in the dataset, always a hypernym of column names(depending on the dataset values).\n    For example:\n    {\"column\": \"gdpPercap\", \"nl_ref_type\": \"explicit\", \"nl_ref_phrase\": \"GDP per capita\"},\n    {\"column\": [\"country\",\"continent\"], \"nl_ref_type\": \"ambiguous\", \"nl_ref_phrase\": \"region\"}\n    {\"column\": [\"country\",\"country_short_name\"], \"nl_ref_type\": \"ambiguous\", \"nl_ref_phrase\": \"countries\"}\n    {\"c_type\": \"mark\", \"c_name\": \"point chart\", \"nl_ref_type\": \"explicit\", \"nl_ref_phrase\": \"scatter plot\"}\n    {\"c_type\": \"mark\", \"c_name\": \"arc chart\", \"nl_ref_type\": \"explicit\", \"nl_ref_phrase\": \"pie chart\"}\n    {\"c_type\": \"transform\",\"c_name\": \"filter\",\"c_list\": [{\"field\": \"country\",\"oneOf\": [\"Iceland\",\"Norway\"]}],\"nl_ref_type\": \"explicit\",\"nl_ref_phrase\": \"for countries Iceland and Norway\"},\n    {\"c_type\": \"transform\",\"c_name\": \"filter\",\"c_list\": [{\"field\": \"country\",\"oneOf\": [\"Iceland\",\"Norway\"]}],\"nl_ref_type\": \"by_value\",\"nl_ref_phrase\": \"for Iceland and Norway\"},\n- the 'nl_ref_phrase' for 'ambiguous' columns should be equally near all ambiguous columns, not too near to one of the column since it would not be ambiguous.\n    good example: {\"column\": [\"country\",\"region\"], \"nl_ref_type\": \"ambiguous\", \"nl_ref_phrase\": \"location\"}\n    bad example: {\"column\": [\"country\",\"region\"], \"nl_ref_type\": \"ambiguous\", \"nl_ref_phrase\": \"region\"}\n- You only include given constraints and no other information. \n    For example, if a column name is not in the given constraint, it will not be included in the NL utterance.\n    Also, it a chart mark or chart encoding channel is not in the given constraint, it will not be included in the NL utterance.\n- all 'nl_ref_phrase' shoule be included in the 'nl_utterance'. \n\nThe output format is identical to the input format, but fill in the str blanks(\"...\").\n### Input:\n{\n  \"nl_utterance\": \"...\",\n  \"encoded_fields\": [\n    {\n      \"field\": \"State\",\n      \"type\": \"nominal\",\n      \"nl_ref_type\": \"explicit\",\n      \"nl_ref_phrase\": \"...\"\n    }\n  ],\n  \"constraints\": [\n    {\n      \"c_type\": \"mark\",\n      \"c_name\": \"bar chart\",\n      \"c_list\": [\n        {\n          \"mark\": \"bar\",\n          \"encoding\": {\n            \"x\": {},\n            \"y\": {\n              \"type\": \"quantitative\"\n            },\n            \"color\": {\n              \"type\": \"nominal\",\n              \"ignore\": true\n            },\n            \"column\": {\n              \"ignore\": true,\n              \"type\": \"nominal\"\n            },\n            \"row\": {\n              \"ignore\": true,\n              \"type\": \"nominal\"\n            }\n          },\n          \"unique_map\": {\n            \"x\": \"y\"\n          }\n        },\n        {\n          \"mark\": \"bar\",\n          \"encoding\": {\n            \"y\": {},\n            \"x\": {\n              \"type\": \"quantitative\"\n            },\n            \"color\": {\n              \"type\": \"nominal\",\n              \"ignore\": true\n            },\n            \"column\": {\n              \"ignore\": true,\n              \"type\": \"nominal\"\n            },\n            \"row\": {\n              \"ignore\": true,\n              \"type\": \"nominal\"\n            }\n          },\n          \"unique_map\": {\n            \"y\": \"x\"\n          }\n        }\n      ],\n      \"nl_ref_type\": \"explicit\",\n      \"nl_ref_phrase\": \"...\"\n    }\n  ]\n}\n\n### Output:"
}