{
  "gpt_result": {
    "nl_utterance": "Show a boxplot for the distribution of change, up change, and down change.",
    "encoded_fields": [
      {
        "field": [
          "change_sh",
          "up_ch",
          "down_ch"
        ],
        "type": "quantitative",
        "nl_ref_type": "ambiguous",
        "nl_ref_phrase": "change"
      }
    ],
    "constraints": [
      {
        "c_type": "task",
        "c_name": "distribution",
        "c_list": [
          {
            "mark": "bar",
            "encoding": {
              "y": {
                "aggregate": "count",
                "type": "quantitative"
              }
            },
            "x_y_reversable": true
          },
          {
            "mark": "boxplot",
            "encoding": {
              "x": {
                "type": "quantitative"
              }
            },
            "x_y_reversable": true
          }
        ],
        "nl_ref_type": "explicit",
        "nl_ref_phrase": "distribution"
      }
    ]
  },
  "input": "Dataset Information: {\n  \"data samples\": [\n    {\n      \"date\": 1.0,\n      \"division\": 4,\n      \"up\": 0,\n      \"down\": 0,\n      \"level\": 0,\n      \"up_ch\": NaN,\n      \"down_ch\": NaN,\n      \"total\": 0,\n      \"up_sh\": NaN,\n      \"down_sh\": NaN,\n      \"level_sh\": NaN,\n      \"change_sh\": NaN,\n      \"division_s\": \"Housing, Water, Electricity, Gas and other fuels\",\n      \"division_sh\": \"Housing & utilities\",\n      \"date2\": \"01-02-1988\",\n      \"date4\": \"1988-02-01\",\n      \"year\": 1988.0,\n      \"month\": 2.0,\n      \"quarter\": 1.0\n    },\n    {\n      \"date\": 369.0,\n      \"division\": 7,\n      \"up\": 141,\n      \"down\": 100,\n      \"level\": 2960,\n      \"up_ch\": 0.11742424,\n      \"down_ch\": -0.13280885,\n      \"total\": 3201,\n      \"up_sh\": 0.044048734,\n      \"down_sh\": 0.031240238,\n      \"level_sh\": 0.92471105,\n      \"change_sh\": 0.075288974,\n      \"division_s\": \"Transport\",\n      \"division_sh\": \"Transport\",\n      \"date2\": \"01-10-2018\",\n      \"date4\": \"2018-10-01\",\n      \"year\": 2018.0,\n      \"month\": 10.0,\n      \"quarter\": 4.0\n    },\n    {\n      \"date\": 32.0,\n      \"division\": 11,\n      \"up\": 561,\n      \"down\": 87,\n      \"level\": 5036,\n      \"up_ch\": 0.072245337,\n      \"down_ch\": -0.073879153,\n      \"total\": 5684,\n      \"up_sh\": 0.098698102,\n      \"down_sh\": 0.015306123,\n      \"level_sh\": 0.88599581,\n      \"change_sh\": 0.11400422,\n      \"division_s\": \"Restaurants and Hotels\",\n      \"division_sh\": \"Restaurants & Hotels\",\n      \"date2\": \"01-09-1990\",\n      \"date4\": \"1990-09-01\",\n      \"year\": 1990.0,\n      \"month\": 9.0,\n      \"quarter\": 3.0\n    },\n    {\n      \"date\": 407.0,\n      \"division\": 4,\n      \"up\": 216,\n      \"down\": 117,\n      \"level\": 1427,\n      \"up_ch\": 0.1210077,\n      \"down_ch\": -0.08398892,\n      \"total\": 1760,\n      \"up_sh\": 0.12272727,\n      \"down_sh\": 0.066477276,\n      \"level_sh\": 0.81079543,\n      \"change_sh\": 0.18920454,\n      \"division_s\": \"Housing, Water, Electricity, Gas and other fuels\",\n      \"division_sh\": \"Housing & utilities\",\n      \"date2\": \"01-12-2021\",\n      \"date4\": \"2021-12-01\",\n      \"year\": 2021.0,\n      \"month\": 12.0,\n      \"quarter\": 4.0\n    },\n    {\n      \"date\": 135.0,\n      \"division\": 3,\n      \"up\": 853,\n      \"down\": 1985,\n      \"level\": 13404,\n      \"up_ch\": 0.19661726,\n      \"down_ch\": -0.21117347,\n      \"total\": 16242,\n      \"up_sh\": 0.052518163,\n      \"down_sh\": 0.12221401,\n      \"level_sh\": 0.82526785,\n      \"change_sh\": 0.17473218,\n      \"division_s\": \"Clothing and footwear\",\n      \"division_sh\": \"Clothing and footwear\",\n      \"date2\": \"01-04-1999\",\n      \"date4\": \"1999-04-01\",\n      \"year\": 1999.0,\n      \"month\": 4.0,\n      \"quarter\": 2.0\n    }\n  ],\n  \"column names\": [\n    \"date\",\n    \"division\",\n    \"up\",\n    \"down\",\n    \"level\",\n    \"up_ch\",\n    \"down_ch\",\n    \"total\",\n    \"up_sh\",\n    \"down_sh\",\n    \"level_sh\",\n    \"change_sh\",\n    \"division_s\",\n    \"division_sh\",\n    \"date2\",\n    \"date4\",\n    \"year\",\n    \"month\",\n    \"quarter\"\n  ]\n}\n\nYour Job:\nI am developing a NL to Data Visualization Dataset. \nPlease help me generate natural language utterance for given dataset and constraints.\nDefinition about the Taks:\n- 'utterance' is what a user would say to make a chart. It should be a queries structure. One NL 'utterance' is in one or two sentences. Here are two examples from Queries for reference:\n    Count Sub-Category Asc.\n    Scatter plot, sales by profit.\n- 'given dataset' is in form of column names, column type, range/unique values of the column.\n- 'constraints' are information about the chart that should be included in the utterance. \n    So we can find a reference phrase in the NL utterance that corresponds to the given constraints. \n- 'reference phrase' can be explicit, ambiguous, and by_value. 'ambiguous' means the phrase can map to more than one columns in the dataset, always a hypernym of column names(depending on the dataset values).\n    For example:\n    {\"column\": \"gdpPercap\", \"nl_ref_type\": \"explicit\", \"nl_ref_phrase\": \"GDP per capita\"},\n    {\"column\": [\"country\",\"continent\"], \"nl_ref_type\": \"ambiguous\", \"nl_ref_phrase\": \"region\"}\n    {\"column\": [\"country\",\"country_short_name\"], \"nl_ref_type\": \"ambiguous\", \"nl_ref_phrase\": \"countries\"}\n    {\"c_type\": \"mark\", \"c_name\": \"point chart\", \"nl_ref_type\": \"explicit\", \"nl_ref_phrase\": \"scatter plot\"}\n    {\"c_type\": \"mark\", \"c_name\": \"arc chart\", \"nl_ref_type\": \"explicit\", \"nl_ref_phrase\": \"pie chart\"}\n    {\"c_type\": \"transform\",\"c_name\": \"filter\",\"c_list\": [{\"field\": \"country\",\"oneOf\": [\"Iceland\",\"Norway\"]}],\"nl_ref_type\": \"explicit\",\"nl_ref_phrase\": \"for countries Iceland and Norway\"},\n    {\"c_type\": \"transform\",\"c_name\": \"filter\",\"c_list\": [{\"field\": \"country\",\"oneOf\": [\"Iceland\",\"Norway\"]}],\"nl_ref_type\": \"by_value\",\"nl_ref_phrase\": \"for Iceland and Norway\"},\n- the 'nl_ref_phrase' for 'ambiguous' columns should be equally near all ambiguous columns, not too near to one of the column since it would not be ambiguous.\n    good example: {\"column\": [\"country\",\"region\"], \"nl_ref_type\": \"ambiguous\", \"nl_ref_phrase\": \"location\"}\n    bad example: {\"column\": [\"country\",\"region\"], \"nl_ref_type\": \"ambiguous\", \"nl_ref_phrase\": \"region\"}\n- You only include given constraints and no other information. \n    For example, if a column name is not in the given constraint, it will not be included in the NL utterance.\n    Also, it a chart mark or chart encoding channel is not in the given constraint, it will not be included in the NL utterance.\n- all 'nl_ref_phrase' shoule be included in the 'nl_utterance'. \n\nThe output format is identical to the input format, but fill in the str blanks(\"...\").\n### Input:\n{\n  \"nl_utterance\": \"...\",\n  \"encoded_fields\": [\n    {\n      \"field\": [\n        \"change_sh\",\n        \"up_ch\",\n        \"down_ch\"\n      ],\n      \"type\": \"quantitative\",\n      \"nl_ref_type\": \"ambiguous\",\n      \"nl_ref_phrase\": \"...\"\n    }\n  ],\n  \"constraints\": [\n    {\n      \"c_type\": \"task\",\n      \"c_name\": \"distribution\",\n      \"c_list\": [\n        {\n          \"mark\": \"bar\",\n          \"encoding\": {\n            \"y\": {\n              \"aggregate\": \"count\",\n              \"type\": \"quantitative\"\n            }\n          },\n          \"x_y_reversable\": true\n        },\n        {\n          \"mark\": \"boxplot\",\n          \"encoding\": {\n            \"x\": {\n              \"type\": \"quantitative\"\n            }\n          },\n          \"x_y_reversable\": true\n        }\n      ],\n      \"nl_ref_type\": \"explicit\",\n      \"nl_ref_phrase\": \"...\"\n    }\n  ]\n}\n\n### Output:"
}