{
  "gpt_result": {
    "nl_utterance": "How does median income relate to firearm deaths and prison rates across different geographic divisions or states?",
    "encoded_fields": [
      {
        "field": "medIncome",
        "type": "quantitative",
        "nl_ref_type": "explicit",
        "nl_ref_phrase": "median income"
      },
      {
        "field": "FirearmDeaths",
        "type": "quantitative",
        "nl_ref_type": "explicit",
        "nl_ref_phrase": "firearm deaths"
      },
      {
        "field": [
          "GeographicDivision",
          "State"
        ],
        "type": "nominal",
        "nl_ref_type": "ambiguous",
        "nl_ref_phrase": "geographic divisions or states"
      },
      {
        "field": "PrisonRate",
        "type": "quantitative",
        "nl_ref_type": "explicit",
        "nl_ref_phrase": "prison rates"
      }
    ],
    "constraints": [
      {
        "c_type": "task",
        "c_name": "correlation",
        "c_list": [
          {
            "mark": "circle",
            "encoding": {
              "x": {
                "type": "quantitative"
              },
              "y": {
                "type": "quantitative"
              }
            }
          }
        ],
        "nl_ref_type": "explicit",
        "nl_ref_phrase": "correlation"
      }
    ]
  },
  "input": "Dataset Information: {\n  \"data samples\": [\n    {\n      \"State\": \"Alabama\",\n      \"StateInitials\": \"AL\",\n      \"Gini\": 0.472,\n      \"DeathRate\": 21.5,\n      \"Firearms_vs_avg\": 1.64700475,\n      \"medIncome\": 47221,\n      \"Income_vs_med\": 0.799827233,\n      \"ImprisonmentRate\": 736,\n      \"PrisonRate\": 1.264604811,\n      \"ImprisonmentRate.1\": 0.736,\n      \"FirearmDeaths\": 0.215,\n      \"GeographicDivision\": \"South\"\n    },\n    {\n      \"State\": \"Arizona\",\n      \"StateInitials\": \"AZ\",\n      \"Gini\": 0.455,\n      \"DeathRate\": 15.2,\n      \"Firearms_vs_avg\": 1.164394055,\n      \"medIncome\": 57100,\n      \"Income_vs_med\": 0.967157303,\n      \"ImprisonmentRate\": 764,\n      \"PrisonRate\": 1.312714777,\n      \"ImprisonmentRate.1\": 0.764,\n      \"FirearmDeaths\": 0.152,\n      \"GeographicDivision\": \"West\"\n    },\n    {\n      \"State\": \"Minnesota\",\n      \"StateInitials\": \"MN\",\n      \"Gini\": 0.44,\n      \"DeathRate\": 7.6,\n      \"Firearms_vs_avg\": 0.582197028,\n      \"medIncome\": 70218,\n      \"Income_vs_med\": 1.189349413,\n      \"ImprisonmentRate\": 249,\n      \"PrisonRate\": 0.427835052,\n      \"ImprisonmentRate.1\": 0.249,\n      \"FirearmDeaths\": 0.076,\n      \"GeographicDivision\": \"Midwest\"\n    },\n    {\n      \"State\": \"Texas\",\n      \"StateInitials\": \"TX\",\n      \"Gini\": 0.469,\n      \"DeathRate\": 12.1,\n      \"Firearms_vs_avg\": 0.926918952,\n      \"medIncome\": 58146,\n      \"Income_vs_med\": 0.984874405,\n      \"ImprisonmentRate\": 761,\n      \"PrisonRate\": 1.307560137,\n      \"ImprisonmentRate.1\": 0.761,\n      \"FirearmDeaths\": 0.121,\n      \"GeographicDivision\": \"South\"\n    },\n    {\n      \"State\": \"Florida\",\n      \"StateInitials\": \"FL\",\n      \"Gini\": 0.474,\n      \"DeathRate\": 12.6,\n      \"Firearms_vs_avg\": 0.965221388,\n      \"medIncome\": 51176,\n      \"Income_vs_med\": 0.86681685,\n      \"ImprisonmentRate\": 601,\n      \"PrisonRate\": 1.032646048,\n      \"ImprisonmentRate.1\": 0.601,\n      \"FirearmDeaths\": 0.126,\n      \"GeographicDivision\": \"South\"\n    }\n  ],\n  \"column names\": [\n    \"State\",\n    \"StateInitials\",\n    \"Gini\",\n    \"DeathRate\",\n    \"Firearms_vs_avg\",\n    \"medIncome\",\n    \"Income_vs_med\",\n    \"ImprisonmentRate\",\n    \"PrisonRate\",\n    \"ImprisonmentRate.1\",\n    \"FirearmDeaths\",\n    \"GeographicDivision\"\n  ]\n}\n\nYour Job:\nI am developing a NL to Data Visualization Dataset. \nPlease help me generate natural language utterance for given dataset and constraints.\nDefinition about the Taks:\n- 'utterance' is what a user would say to make a chart. It should be a questions structure. One NL 'utterance' is in one or two sentences. Here are two examples from Questions for reference:\n    How does displacement relate to fuel economy for cars from Europe vs. USA?\n    Which countries have the highest acceleration for cars of different cylinders?\n- 'given dataset' is in form of column names, column type, range/unique values of the column.\n- 'constraints' are information about the chart that should be included in the utterance. \n    So we can find a reference phrase in the NL utterance that corresponds to the given constraints. \n- 'reference phrase' can be explicit, ambiguous, and by_value. 'ambiguous' means the phrase can map to more than one columns in the dataset, always a hypernym of column names(depending on the dataset values).\n    For example:\n    {\"column\": \"gdpPercap\", \"nl_ref_type\": \"explicit\", \"nl_ref_phrase\": \"GDP per capita\"},\n    {\"column\": [\"country\",\"continent\"], \"nl_ref_type\": \"ambiguous\", \"nl_ref_phrase\": \"region\"}\n    {\"column\": [\"country\",\"country_short_name\"], \"nl_ref_type\": \"ambiguous\", \"nl_ref_phrase\": \"countries\"}\n    {\"c_type\": \"mark\", \"c_name\": \"point chart\", \"nl_ref_type\": \"explicit\", \"nl_ref_phrase\": \"scatter plot\"}\n    {\"c_type\": \"mark\", \"c_name\": \"arc chart\", \"nl_ref_type\": \"explicit\", \"nl_ref_phrase\": \"pie chart\"}\n    {\"c_type\": \"transform\",\"c_name\": \"filter\",\"c_list\": [{\"field\": \"country\",\"oneOf\": [\"Iceland\",\"Norway\"]}],\"nl_ref_type\": \"explicit\",\"nl_ref_phrase\": \"for countries Iceland and Norway\"},\n    {\"c_type\": \"transform\",\"c_name\": \"filter\",\"c_list\": [{\"field\": \"country\",\"oneOf\": [\"Iceland\",\"Norway\"]}],\"nl_ref_type\": \"by_value\",\"nl_ref_phrase\": \"for Iceland and Norway\"},\n- the 'nl_ref_phrase' for 'ambiguous' columns should be equally near all ambiguous columns, not too near to one of the column since it would not be ambiguous.\n    good example: {\"column\": [\"country\",\"region\"], \"nl_ref_type\": \"ambiguous\", \"nl_ref_phrase\": \"location\"}\n    bad example: {\"column\": [\"country\",\"region\"], \"nl_ref_type\": \"ambiguous\", \"nl_ref_phrase\": \"region\"}\n- You only include given constraints and no other information. \n    For example, if a column name is not in the given constraint, it will not be included in the NL utterance.\n    Also, it a chart mark or chart encoding channel is not in the given constraint, it will not be included in the NL utterance.\n- all 'nl_ref_phrase' shoule be included in the 'nl_utterance'. \n\nThe output format is identical to the input format, but fill in the str blanks(\"...\").\n### Input:\n{\n  \"nl_utterance\": \"...\",\n  \"encoded_fields\": [\n    {\n      \"field\": \"medIncome\",\n      \"type\": \"quantitative\",\n      \"nl_ref_type\": \"explicit\",\n      \"nl_ref_phrase\": \"...\"\n    },\n    {\n      \"field\": \"FirearmDeaths\",\n      \"type\": \"quantitative\",\n      \"nl_ref_type\": \"explicit\",\n      \"nl_ref_phrase\": \"...\"\n    },\n    {\n      \"field\": [\n        \"GeographicDivision\",\n        \"State\"\n      ],\n      \"type\": \"nominal\",\n      \"nl_ref_type\": \"ambiguous\",\n      \"nl_ref_phrase\": \"...\"\n    },\n    {\n      \"field\": \"PrisonRate\",\n      \"type\": \"quantitative\",\n      \"nl_ref_type\": \"explicit\",\n      \"nl_ref_phrase\": \"...\"\n    }\n  ],\n  \"constraints\": [\n    {\n      \"c_type\": \"task\",\n      \"c_name\": \"correlation\",\n      \"c_list\": [\n        {\n          \"mark\": \"circle\",\n          \"encoding\": {\n            \"x\": {\n              \"type\": \"quantitative\"\n            },\n            \"y\": {\n              \"type\": \"quantitative\"\n            }\n          }\n        }\n      ],\n      \"nl_ref_type\": \"explicit\",\n      \"nl_ref_phrase\": \"...\"\n    }\n  ]\n}\n\n### Output:"
}