{
  "gpt_result": {
    "nl_utterance": "Show the rate of growth for the ISO codes filtered for p21 being equal to 1 and sorted by the latest growth in descending order.",
    "encoded_fields": [
      {
        "field": "GrowthLatest",
        "type": "quantitative",
        "nl_ref_type": "explicit",
        "nl_ref_phrase": "rate of growth"
      },
      {
        "field": "ISO",
        "type": "nominal",
        "nl_ref_type": "explicit",
        "nl_ref_phrase": "ISO codes"
      }
    ],
    "constraints": [
      {
        "c_type": "transform",
        "c_name": "filter",
        "c_list": [
          {
            "field": "p21",
            "equal": 1
          }
        ],
        "nl_ref_type": "by_value",
        "nl_ref_phrase": "filtered for p21 being equal to 1"
      },
      {
        "c_type": "transform",
        "c_name": "sort",
        "c_list": [
          {
            "field": "GrowthLatest",
            "order": "descending"
          }
        ],
        "nl_ref_type": "explicit",
        "nl_ref_phrase": "sorted by the latest growth in descending order"
      }
    ]
  },
  "input": "Dataset Information: {\n  \"data samples\": [\n    {\n      \"WEO Country Code\": 546,\n      \"ISO\": \"MAC\",\n      \"WEO Subject Code\": \"NGDPRPPPPC\",\n      \"Country\": \"Macao SAR\",\n      \"gdp2021\": 64739.16,\n      \"gdp2022\": 49230.4,\n      \"GrowthLatest\": -0.239557634,\n      \"p21\": 0\n    },\n    {\n      \"WEO Country Code\": 869,\n      \"ISO\": \"TUV\",\n      \"WEO Subject Code\": \"NGDPRPPPPC\",\n      \"Country\": \"Tuvalu\",\n      \"gdp2021\": 4840.27,\n      \"gdp2022\": 4966.15,\n      \"GrowthLatest\": 0.026006814,\n      \"p21\": 0\n    },\n    {\n      \"WEO Country Code\": 268,\n      \"ISO\": \"HND\",\n      \"WEO Subject Code\": \"NGDPRPPPPC\",\n      \"Country\": \"Honduras\",\n      \"gdp2021\": 5661.24,\n      \"gdp2022\": 5752.66,\n      \"GrowthLatest\": 0.016148406,\n      \"p21\": 0\n    },\n    {\n      \"WEO Country Code\": 172,\n      \"ISO\": \"FIN\",\n      \"WEO Subject Code\": \"NGDPRPPPPC\",\n      \"Country\": \"Finland\",\n      \"gdp2021\": 48838.56,\n      \"gdp2022\": 49850.43,\n      \"GrowthLatest\": 0.02071867,\n      \"p21\": 0\n    },\n    {\n      \"WEO Country Code\": 111,\n      \"ISO\": \"USA\",\n      \"WEO Subject Code\": \"NGDPRPPPPC\",\n      \"Country\": \"United States\",\n      \"gdp2021\": 63014.33,\n      \"gdp2022\": 63890.19,\n      \"GrowthLatest\": 0.013899378,\n      \"p21\": 1\n    }\n  ],\n  \"column names\": [\n    \"WEO Country Code\",\n    \"ISO\",\n    \"WEO Subject Code\",\n    \"Country\",\n    \"gdp2021\",\n    \"gdp2022\",\n    \"GrowthLatest\",\n    \"p21\"\n  ]\n}\n\nYour Job:\nI am developing a NL to Data Visualization Dataset. \nPlease help me generate natural language utterance for given dataset and constraints.\nDefinition about the Taks:\n- 'utterance' is what a user would say to make a chart. It should be a queries structure. One NL 'utterance' is in one or two sentences. Here are two examples from Queries for reference:\n    Group cars by countries and cylinders.\n    sales forecast between Jan 2016 and July 2017.\n- 'given dataset' is in form of column names, column type, range/unique values of the column.\n- 'constraints' are information about the chart that should be included in the utterance. \n    So we can find a reference phrase in the NL utterance that corresponds to the given constraints. \n- 'reference phrase' can be explicit, ambiguous, and by_value. 'ambiguous' means the phrase can map to more than one columns in the dataset, always a hypernym of column names(depending on the dataset values).\n    For example:\n    {\"column\": \"gdpPercap\", \"nl_ref_type\": \"explicit\", \"nl_ref_phrase\": \"GDP per capita\"},\n    {\"column\": [\"country\",\"continent\"], \"nl_ref_type\": \"ambiguous\", \"nl_ref_phrase\": \"region\"}\n    {\"column\": [\"country\",\"country_short_name\"], \"nl_ref_type\": \"ambiguous\", \"nl_ref_phrase\": \"countries\"}\n    {\"c_type\": \"mark\", \"c_name\": \"point chart\", \"nl_ref_type\": \"explicit\", \"nl_ref_phrase\": \"scatter plot\"}\n    {\"c_type\": \"mark\", \"c_name\": \"arc chart\", \"nl_ref_type\": \"explicit\", \"nl_ref_phrase\": \"pie chart\"}\n    {\"c_type\": \"transform\",\"c_name\": \"filter\",\"c_list\": [{\"field\": \"country\",\"oneOf\": [\"Iceland\",\"Norway\"]}],\"nl_ref_type\": \"explicit\",\"nl_ref_phrase\": \"for countries Iceland and Norway\"},\n    {\"c_type\": \"transform\",\"c_name\": \"filter\",\"c_list\": [{\"field\": \"country\",\"oneOf\": [\"Iceland\",\"Norway\"]}],\"nl_ref_type\": \"by_value\",\"nl_ref_phrase\": \"for Iceland and Norway\"},\n- the 'nl_ref_phrase' for 'ambiguous' columns should be equally near all ambiguous columns, not too near to one of the column since it would not be ambiguous.\n    good example: {\"column\": [\"country\",\"region\"], \"nl_ref_type\": \"ambiguous\", \"nl_ref_phrase\": \"location\"}\n    bad example: {\"column\": [\"country\",\"region\"], \"nl_ref_type\": \"ambiguous\", \"nl_ref_phrase\": \"region\"}\n- You only include given constraints and no other information. \n    For example, if a column name is not in the given constraint, it will not be included in the NL utterance.\n    Also, it a chart mark or chart encoding channel is not in the given constraint, it will not be included in the NL utterance.\n- all 'nl_ref_phrase' shoule be included in the 'nl_utterance'. \n\nThe output format is identical to the input format, but fill in the str blanks(\"...\").\n### Input:\n{\n  \"nl_utterance\": \"...\",\n  \"encoded_fields\": [\n    {\n      \"field\": \"GrowthLatest\",\n      \"type\": \"quantitative\",\n      \"nl_ref_type\": \"explicit\",\n      \"nl_ref_phrase\": \"...\"\n    },\n    {\n      \"field\": \"ISO\",\n      \"type\": \"nominal\",\n      \"nl_ref_type\": \"explicit\",\n      \"nl_ref_phrase\": \"...\"\n    }\n  ],\n  \"constraints\": [\n    {\n      \"c_type\": \"transform\",\n      \"c_name\": \"filter\",\n      \"c_list\": [\n        {\n          \"field\": \"p21\",\n          \"equal\": 1\n        }\n      ],\n      \"nl_ref_type\": \"by_value\",\n      \"nl_ref_phrase\": \"...\"\n    },\n    {\n      \"c_type\": \"transform\",\n      \"c_name\": \"sort\",\n      \"c_list\": [\n        {\n          \"field\": \"GrowthLatest\",\n          \"order\": \"descending\"\n        }\n      ],\n      \"nl_ref_type\": \"explicit\",\n      \"nl_ref_phrase\": \"...\"\n    }\n  ]\n}\n\n### Output:"
}