{
  "gpt_result": {
    "nl_utterance": "What is the average annual salary shown in a bar chart?",
    "encoded_fields": [
      {
        "field": "Annual Salary",
        "type": "quantitative",
        "nl_ref_type": "explicit",
        "nl_ref_phrase": "average annual salary"
      }
    ],
    "constraints": [
      {
        "c_type": "mark",
        "c_name": "bar chart",
        "c_list": [
          {
            "mark": "bar",
            "encoding": {
              "x": {},
              "y": {
                "type": "quantitative"
              },
              "color": {
                "type": "nominal",
                "ignore": true
              },
              "column": {
                "ignore": true,
                "type": "nominal"
              },
              "row": {
                "ignore": true,
                "type": "nominal"
              }
            },
            "unique_map": {
              "x": "y"
            }
          },
          {
            "mark": "bar",
            "encoding": {
              "y": {},
              "x": {
                "type": "quantitative"
              },
              "color": {
                "type": "nominal",
                "ignore": true
              },
              "column": {
                "ignore": true,
                "type": "nominal"
              },
              "row": {
                "ignore": true,
                "type": "nominal"
              }
            },
            "unique_map": {
              "y": "x"
            }
          }
        ],
        "nl_ref_type": "explicit",
        "nl_ref_phrase": "in a bar chart"
      },
      {
        "c_type": "transform",
        "c_name": "aggregate",
        "c_list": [
          {
            "aggregate": "count"
          }
        ],
        "nl_ref_type": "explicit",
        "nl_ref_phrase": "average"
      }
    ]
  },
  "input": "Dataset Information: {\n  \"data samples\": [\n    {\n      \"Name\": \"ADELMAN, BRUCE E\",\n      \"Job Titles\": \"LEGISLATIVE AIDE\",\n      \"Department\": \"CITY COUNCIL\",\n      \"Full or Part-Time\": \"F\",\n      \"Salary or Hourly\": \"SALARY\",\n      \"Typical Hours\": NaN,\n      \"Annual Salary\": 22248.0,\n      \"Hourly Rate\": NaN,\n      \"Rank\": 1,\n      \"share\": 9e-06,\n      \"cumShareIncome\": 9e-06,\n      \"cumSharePeople\": 4.124e-05,\n      \"shortName\": \"0\"\n    },\n    {\n      \"Name\": \"SCHWARTZERS, THOMAS M\",\n      \"Job Titles\": \"FIREFIGHTER-EMT\",\n      \"Department\": \"FIRE DEPARTMENT\",\n      \"Full or Part-Time\": \"F\",\n      \"Salary or Hourly\": \"SALARY\",\n      \"Typical Hours\": NaN,\n      \"Annual Salary\": 102372.0,\n      \"Hourly Rate\": NaN,\n      \"Rank\": 13181,\n      \"share\": 4.2e-05,\n      \"cumShareIncome\": 0.454054,\n      \"cumSharePeople\": 0.54361364,\n      \"shortName\": \"Fire\"\n    },\n    {\n      \"Name\": \"MILLER, LEMORNET\",\n      \"Job Titles\": \"POLICE OFFICER\",\n      \"Department\": \"DEPARTMENT OF POLICE\",\n      \"Full or Part-Time\": \"F\",\n      \"Salary or Hourly\": \"SALARY\",\n      \"Typical Hours\": NaN,\n      \"Annual Salary\": 108822.0,\n      \"Hourly Rate\": NaN,\n      \"Rank\": 16855,\n      \"share\": 4.5e-05,\n      \"cumShareIncome\": 0.615518,\n      \"cumSharePeople\": 0.69513754,\n      \"shortName\": \"Police\"\n    },\n    {\n      \"Name\": \"OTTO, JOHN W\",\n      \"Job Titles\": \"SERGEANT\",\n      \"Department\": \"DEPARTMENT OF POLICE\",\n      \"Full or Part-Time\": \"F\",\n      \"Salary or Hourly\": \"SALARY\",\n      \"Typical Hours\": NaN,\n      \"Annual Salary\": 133860.0,\n      \"Hourly Rate\": NaN,\n      \"Rank\": 22534,\n      \"share\": 5.5e-05,\n      \"cumShareIncome\": 0.894323,\n      \"cumSharePeople\": 0.92935208,\n      \"shortName\": \"Police\"\n    },\n    {\n      \"Name\": \"KROLIKOWSKI, TOM J\",\n      \"Job Titles\": \"FIREFIGHTER/PARAMEDIC\",\n      \"Department\": \"FIRE DEPARTMENT\",\n      \"Full or Part-Time\": \"F\",\n      \"Salary or Hourly\": \"SALARY\",\n      \"Typical Hours\": NaN,\n      \"Annual Salary\": 101262.0,\n      \"Hourly Rate\": NaN,\n      \"Rank\": 12235,\n      \"share\": 4.2e-05,\n      \"cumShareIncome\": 0.414214,\n      \"cumSharePeople\": 0.50459851,\n      \"shortName\": \"Fire\"\n    }\n  ],\n  \"column names\": [\n    \"Name\",\n    \"Job Titles\",\n    \"Department\",\n    \"Full or Part-Time\",\n    \"Salary or Hourly\",\n    \"Typical Hours\",\n    \"Annual Salary\",\n    \"Hourly Rate\",\n    \"Rank\",\n    \"share\",\n    \"cumShareIncome\",\n    \"cumSharePeople\",\n    \"shortName\"\n  ]\n}\n\nYour Job:\nI am developing a NL to Data Visualization Dataset. \nPlease help me generate natural language utterance for given dataset and constraints.\nDefinition about the Taks:\n- 'utterance' is what a user would say to make a chart. It should be a questions structure. One NL 'utterance' is in one or two sentences. Here are two examples from Questions for reference:\n    How much do various cars weigh?\n    What major genre had the highest average worldwide gross?\n- 'given dataset' is in form of column names, column type, range/unique values of the column.\n- 'constraints' are information about the chart that should be included in the utterance. \n    So we can find a reference phrase in the NL utterance that corresponds to the given constraints. \n- 'reference phrase' can be explicit, ambiguous, and by_value. 'ambiguous' means the phrase can map to more than one columns in the dataset, always a hypernym of column names(depending on the dataset values).\n    For example:\n    {\"column\": \"gdpPercap\", \"nl_ref_type\": \"explicit\", \"nl_ref_phrase\": \"GDP per capita\"},\n    {\"column\": [\"country\",\"continent\"], \"nl_ref_type\": \"ambiguous\", \"nl_ref_phrase\": \"region\"}\n    {\"column\": [\"country\",\"country_short_name\"], \"nl_ref_type\": \"ambiguous\", \"nl_ref_phrase\": \"countries\"}\n    {\"c_type\": \"mark\", \"c_name\": \"point chart\", \"nl_ref_type\": \"explicit\", \"nl_ref_phrase\": \"scatter plot\"}\n    {\"c_type\": \"mark\", \"c_name\": \"arc chart\", \"nl_ref_type\": \"explicit\", \"nl_ref_phrase\": \"pie chart\"}\n    {\"c_type\": \"transform\",\"c_name\": \"filter\",\"c_list\": [{\"field\": \"country\",\"oneOf\": [\"Iceland\",\"Norway\"]}],\"nl_ref_type\": \"explicit\",\"nl_ref_phrase\": \"for countries Iceland and Norway\"},\n    {\"c_type\": \"transform\",\"c_name\": \"filter\",\"c_list\": [{\"field\": \"country\",\"oneOf\": [\"Iceland\",\"Norway\"]}],\"nl_ref_type\": \"by_value\",\"nl_ref_phrase\": \"for Iceland and Norway\"},\n- the 'nl_ref_phrase' for 'ambiguous' columns should be equally near all ambiguous columns, not too near to one of the column since it would not be ambiguous.\n    good example: {\"column\": [\"country\",\"region\"], \"nl_ref_type\": \"ambiguous\", \"nl_ref_phrase\": \"location\"}\n    bad example: {\"column\": [\"country\",\"region\"], \"nl_ref_type\": \"ambiguous\", \"nl_ref_phrase\": \"region\"}\n- You only include given constraints and no other information. \n    For example, if a column name is not in the given constraint, it will not be included in the NL utterance.\n    Also, it a chart mark or chart encoding channel is not in the given constraint, it will not be included in the NL utterance.\n- all 'nl_ref_phrase' shoule be included in the 'nl_utterance'. \n\nThe output format is identical to the input format, but fill in the str blanks(\"...\").\n### Input:\n{\n  \"nl_utterance\": \"...\",\n  \"encoded_fields\": [\n    {\n      \"field\": \"Annual Salary\",\n      \"type\": \"quantitative\",\n      \"nl_ref_type\": \"explicit\",\n      \"nl_ref_phrase\": \"...\"\n    }\n  ],\n  \"constraints\": [\n    {\n      \"c_type\": \"mark\",\n      \"c_name\": \"bar chart\",\n      \"c_list\": [\n        {\n          \"mark\": \"bar\",\n          \"encoding\": {\n            \"x\": {},\n            \"y\": {\n              \"type\": \"quantitative\"\n            },\n            \"color\": {\n              \"type\": \"nominal\",\n              \"ignore\": true\n            },\n            \"column\": {\n              \"ignore\": true,\n              \"type\": \"nominal\"\n            },\n            \"row\": {\n              \"ignore\": true,\n              \"type\": \"nominal\"\n            }\n          },\n          \"unique_map\": {\n            \"x\": \"y\"\n          }\n        },\n        {\n          \"mark\": \"bar\",\n          \"encoding\": {\n            \"y\": {},\n            \"x\": {\n              \"type\": \"quantitative\"\n            },\n            \"color\": {\n              \"type\": \"nominal\",\n              \"ignore\": true\n            },\n            \"column\": {\n              \"ignore\": true,\n              \"type\": \"nominal\"\n            },\n            \"row\": {\n              \"ignore\": true,\n              \"type\": \"nominal\"\n            }\n          },\n          \"unique_map\": {\n            \"y\": \"x\"\n          }\n        }\n      ],\n      \"nl_ref_type\": \"explicit\",\n      \"nl_ref_phrase\": \"...\"\n    },\n    {\n      \"c_type\": \"transform\",\n      \"c_name\": \"aggregate\",\n      \"c_list\": [\n        {\n          \"aggregate\": \"count\"\n        }\n      ],\n      \"nl_ref_type\": \"explicit\",\n      \"nl_ref_phrase\": \"...\"\n    }\n  ]\n}\n\n### Output:"
}