{
  "gpt_result": {
    "nl_utterance": "Draw a bar chart for Salary by Club for countries Spain, Portugal, and Germany.",
    "encoded_fields": [
      {
        "field": "Salary",
        "type": "quantitative",
        "nl_ref_type": "explicit",
        "nl_ref_phrase": "Salary"
      },
      {
        "field": "Club",
        "type": "nominal",
        "nl_ref_type": "explicit",
        "nl_ref_phrase": "Club"
      }
    ],
    "constraints": [
      {
        "c_type": "mark",
        "c_name": "bar chart",
        "c_list": [
          {
            "mark": "bar",
            "encoding": {
              "x": {},
              "y": {
                "type": "quantitative"
              },
              "color": {
                "type": "nominal",
                "ignore": true
              },
              "column": {
                "ignore": true,
                "type": "nominal"
              },
              "row": {
                "ignore": true,
                "type": "nominal"
              }
            },
            "unique_map": {
              "x": "y"
            }
          },
          {
            "mark": "bar",
            "encoding": {
              "y": {},
              "x": {
                "type": "quantitative"
              },
              "color": {
                "type": "nominal",
                "ignore": true
              },
              "column": {
                "ignore": true,
                "type": "nominal"
              },
              "row": {
                "ignore": true,
                "type": "nominal"
              }
            },
            "unique_map": {
              "y": "x"
            }
          }
        ],
        "nl_ref_type": "explicit",
        "nl_ref_phrase": "bar chart"
      },
      {
        "c_type": "transform",
        "c_name": "filter",
        "c_list": [
          {
            "field": "Country",
            "oneOf": [
              "Spain",
              "Portugal",
              "Germany"
            ]
          }
        ],
        "nl_ref_type": "explicit",
        "nl_ref_phrase": "for countries Spain, Portugal, and Germany"
      }
    ]
  },
  "input": "Dataset Information: {\n  \"data samples\": [\n    {\n      \"Foot\": \"Left\",\n      \"Name\": \"Etrit Berisha\",\n      \"Position\": \"Goalkeeper\",\n      \"Club\": \"Lazio\",\n      \"Country\": \"Albania\",\n      \"Age\": 27,\n      \"Salary\": 4000000,\n      \"Goals\": 0\n    },\n    {\n      \"Foot\": \"Right\",\n      \"Name\": \"Juanfran\",\n      \"Position\": \"Defender\",\n      \"Club\": \"Atl\\u00e9tico Madrid\",\n      \"Country\": \"Spain\",\n      \"Age\": 31,\n      \"Salary\": 16000000,\n      \"Goals\": 0\n    },\n    {\n      \"Foot\": \"Right\",\n      \"Name\": \"Admir Mehmedi\",\n      \"Position\": \"Forward\",\n      \"Club\": \"Bayer Leverkusen\",\n      \"Country\": \"Switzerland\",\n      \"Age\": 25,\n      \"Salary\": 5000000,\n      \"Goals\": 3\n    },\n    {\n      \"Foot\": \"Right\",\n      \"Name\": \"Gerard Piqu\\u00e9\",\n      \"Position\": \"Defender\",\n      \"Club\": \"Barcelona\",\n      \"Country\": \"Spain\",\n      \"Age\": 29,\n      \"Salary\": 40000000,\n      \"Goals\": 4\n    },\n    {\n      \"Foot\": \"Right\",\n      \"Name\": \"Thiago Cionek\",\n      \"Position\": \"Defender\",\n      \"Club\": \"Palermo\",\n      \"Country\": \"Poland\",\n      \"Age\": 30,\n      \"Salary\": 900000,\n      \"Goals\": 0\n    }\n  ],\n  \"column names\": [\n    \"Foot\",\n    \"Name\",\n    \"Position\",\n    \"Club\",\n    \"Country\",\n    \"Age\",\n    \"Salary\",\n    \"Goals\"\n  ]\n}\n\nYour Job:\nI am developing a NL to Data Visualization Dataset. \nPlease help me generate natural language utterance for given dataset and constraints.\nDefinition about the Taks:\n- 'utterance' is what a user would say to make a chart. It should be a commands structure. One NL 'utterance' is in one or two sentences. Here are two examples from Commands for reference:\n    Help me see outliers in IMDB and Rotten Tomatoes ratings.\n    Draw axes for AVG(Horsepower) vs Year, colored by Origin.\n- 'given dataset' is in form of column names, column type, range/unique values of the column.\n- 'constraints' are information about the chart that should be included in the utterance. \n    So we can find a reference phrase in the NL utterance that corresponds to the given constraints. \n- 'reference phrase' can be explicit, ambiguous, and by_value. 'ambiguous' means the phrase can map to more than one columns in the dataset, always a hypernym of column names(depending on the dataset values).\n    For example:\n    {\"column\": \"gdpPercap\", \"nl_ref_type\": \"explicit\", \"nl_ref_phrase\": \"GDP per capita\"},\n    {\"column\": [\"country\",\"continent\"], \"nl_ref_type\": \"ambiguous\", \"nl_ref_phrase\": \"region\"}\n    {\"column\": [\"country\",\"country_short_name\"], \"nl_ref_type\": \"ambiguous\", \"nl_ref_phrase\": \"countries\"}\n    {\"c_type\": \"mark\", \"c_name\": \"point chart\", \"nl_ref_type\": \"explicit\", \"nl_ref_phrase\": \"scatter plot\"}\n    {\"c_type\": \"mark\", \"c_name\": \"arc chart\", \"nl_ref_type\": \"explicit\", \"nl_ref_phrase\": \"pie chart\"}\n    {\"c_type\": \"transform\",\"c_name\": \"filter\",\"c_list\": [{\"field\": \"country\",\"oneOf\": [\"Iceland\",\"Norway\"]}],\"nl_ref_type\": \"explicit\",\"nl_ref_phrase\": \"for countries Iceland and Norway\"},\n    {\"c_type\": \"transform\",\"c_name\": \"filter\",\"c_list\": [{\"field\": \"country\",\"oneOf\": [\"Iceland\",\"Norway\"]}],\"nl_ref_type\": \"by_value\",\"nl_ref_phrase\": \"for Iceland and Norway\"},\n- the 'nl_ref_phrase' for 'ambiguous' columns should be equally near all ambiguous columns, not too near to one of the column since it would not be ambiguous.\n    good example: {\"column\": [\"country\",\"region\"], \"nl_ref_type\": \"ambiguous\", \"nl_ref_phrase\": \"location\"}\n    bad example: {\"column\": [\"country\",\"region\"], \"nl_ref_type\": \"ambiguous\", \"nl_ref_phrase\": \"region\"}\n- You only include given constraints and no other information. \n    For example, if a column name is not in the given constraint, it will not be included in the NL utterance.\n    Also, it a chart mark or chart encoding channel is not in the given constraint, it will not be included in the NL utterance.\n- all 'nl_ref_phrase' shoule be included in the 'nl_utterance'. \n\nThe output format is identical to the input format, but fill in the str blanks(\"...\").\n### Input:\n{\n  \"nl_utterance\": \"...\",\n  \"encoded_fields\": [\n    {\n      \"field\": \"Salary\",\n      \"type\": \"quantitative\",\n      \"nl_ref_type\": \"explicit\",\n      \"nl_ref_phrase\": \"...\"\n    },\n    {\n      \"field\": \"Club\",\n      \"type\": \"nominal\",\n      \"nl_ref_type\": \"explicit\",\n      \"nl_ref_phrase\": \"...\"\n    }\n  ],\n  \"constraints\": [\n    {\n      \"c_type\": \"mark\",\n      \"c_name\": \"bar chart\",\n      \"c_list\": [\n        {\n          \"mark\": \"bar\",\n          \"encoding\": {\n            \"x\": {},\n            \"y\": {\n              \"type\": \"quantitative\"\n            },\n            \"color\": {\n              \"type\": \"nominal\",\n              \"ignore\": true\n            },\n            \"column\": {\n              \"ignore\": true,\n              \"type\": \"nominal\"\n            },\n            \"row\": {\n              \"ignore\": true,\n              \"type\": \"nominal\"\n            }\n          },\n          \"unique_map\": {\n            \"x\": \"y\"\n          }\n        },\n        {\n          \"mark\": \"bar\",\n          \"encoding\": {\n            \"y\": {},\n            \"x\": {\n              \"type\": \"quantitative\"\n            },\n            \"color\": {\n              \"type\": \"nominal\",\n              \"ignore\": true\n            },\n            \"column\": {\n              \"ignore\": true,\n              \"type\": \"nominal\"\n            },\n            \"row\": {\n              \"ignore\": true,\n              \"type\": \"nominal\"\n            }\n          },\n          \"unique_map\": {\n            \"y\": \"x\"\n          }\n        }\n      ],\n      \"nl_ref_type\": \"explicit\",\n      \"nl_ref_phrase\": \"...\"\n    },\n    {\n      \"c_type\": \"transform\",\n      \"c_name\": \"filter\",\n      \"c_list\": [\n        {\n          \"field\": \"Country\",\n          \"oneOf\": [\n            \"Spain\",\n            \"Portugal\",\n            \"Germany\"\n          ]\n        }\n      ],\n      \"nl_ref_type\": \"explicit\",\n      \"nl_ref_phrase\": \"...\"\n    }\n  ]\n}\n\n### Output:"
}