{
  "gpt_result": {
    "nl_utterance": "What is the correlation between infant mortality and population across different continents?",
    "encoded_fields": [
      {
        "field": "Infant Mortality",
        "type": "quantitative",
        "nl_ref_type": "explicit",
        "nl_ref_phrase": "infant mortality"
      },
      {
        "field": "Continent",
        "type": "nominal",
        "nl_ref_type": "explicit",
        "nl_ref_phrase": "continents"
      },
      {
        "field": "Population",
        "type": "quantitative",
        "nl_ref_type": "explicit",
        "nl_ref_phrase": "population"
      }
    ],
    "constraints": [
      {
        "c_type": "task",
        "c_name": "correlation",
        "c_list": [
          {
            "mark": "circle",
            "encoding": {
              "x": {
                "type": "quantitative"
              },
              "y": {
                "type": "quantitative"
              }
            }
          }
        ],
        "nl_ref_type": "explicit",
        "nl_ref_phrase": "correlation"
      }
    ]
  },
  "input": "Dataset Information: {\n  \"data samples\": [\n    {\n      \"Country\": \"Finland\",\n      \"Happiness score\": 7.821,\n      \"Country_temp\": \"Finland\",\n      \"ISO3\": \"FIN\",\n      \"GDP per capita (PPP)\": 55013.38586,\n      \"Life Ladder\": 7.7944,\n      \"Social support\": 0.9703,\n      \"Perceptions of corruption\": 0.1918,\n      \"Population\": 5535992.0,\n      \"Median Age\": 42.368,\n      \"Total Fertility Rate\": 1.389,\n      \"Life Expectancy\": 82.038,\n      \"Infant Mortality\": 1.932,\n      \"Child Mortality\": 2.353,\n      \"Net Migration Rate\": 2.7,\n      \"Continent\": \"Europe\",\n      \"UN Region\": \"Northern Europe\"\n    },\n    {\n      \"Country\": \"Albania\",\n      \"Happiness score\": 5.199,\n      \"Country_temp\": \"Albania\",\n      \"ISO3\": \"ALB\",\n      \"GDP per capita (PPP)\": 15709.25126,\n      \"Life Ladder\": 5.2555,\n      \"Social support\": 0.7019,\n      \"Perceptions of corruption\": 0.8961,\n      \"Population\": 2854710.0,\n      \"Median Age\": 37.273,\n      \"Total Fertility Rate\": 1.39,\n      \"Life Expectancy\": 76.463,\n      \"Infant Mortality\": 8.941,\n      \"Child Mortality\": 9.985,\n      \"Net Migration Rate\": -3.71,\n      \"Continent\": \"Europe\",\n      \"UN Region\": \"Southern Europe\"\n    },\n    {\n      \"Country\": \"Zimbabwe\",\n      \"Happiness score\": 2.995,\n      \"Country_temp\": \"Zimbabwe\",\n      \"ISO3\": \"ZWE\",\n      \"GDP per capita (PPP)\": 2323.687257,\n      \"Life Ladder\": 3.1546,\n      \"Social support\": 0.6852,\n      \"Perceptions of corruption\": 0.7569,\n      \"Population\": 15993524.0,\n      \"Median Age\": 18.054,\n      \"Total Fertility Rate\": 3.491,\n      \"Life Expectancy\": 59.253,\n      \"Infant Mortality\": 36.76,\n      \"Child Mortality\": 52.148,\n      \"Net Migration Rate\": -1.562,\n      \"Continent\": \"Africa\",\n      \"UN Region\": \"Eastern Africa\"\n    },\n    {\n      \"Country\": \"Mauritania*\",\n      \"Happiness score\": 4.153,\n      \"Country_temp\": \"Mauritania\",\n      \"ISO3\": \"MRT\",\n      \"GDP per capita (PPP)\": 5830.817088,\n      \"Life Ladder\": NaN,\n      \"Social support\": NaN,\n      \"Perceptions of corruption\": NaN,\n      \"Population\": 4614974.0,\n      \"Median Age\": 17.565,\n      \"Total Fertility Rate\": 4.398,\n      \"Life Expectancy\": 64.364,\n      \"Infant Mortality\": 45.271,\n      \"Child Mortality\": 60.952,\n      \"Net Migration Rate\": -0.324,\n      \"Continent\": \"Africa\",\n      \"UN Region\": \"Western Africa\"\n    },\n    {\n      \"Country\": \"North Cyprus*\",\n      \"Happiness score\": 5.467,\n      \"Country_temp\": \"North Cyprus\",\n      \"ISO3\": \"CYP\",\n      \"GDP per capita (PPP)\": 44109.67188,\n      \"Life Ladder\": 6.2692,\n      \"Social support\": 0.8554,\n      \"Perceptions of corruption\": 0.8765,\n      \"Population\": 1244188.0,\n      \"Median Age\": 37.587,\n      \"Total Fertility Rate\": 1.321,\n      \"Life Expectancy\": 81.203,\n      \"Infant Mortality\": 2.303,\n      \"Child Mortality\": 2.711,\n      \"Net Migration Rate\": 1.605,\n      \"Continent\": \"Asia\",\n      \"UN Region\": \"Western Asia\"\n    }\n  ],\n  \"column names\": [\n    \"Country\",\n    \"Happiness score\",\n    \"Country_temp\",\n    \"ISO3\",\n    \"GDP per capita (PPP)\",\n    \"Life Ladder\",\n    \"Social support\",\n    \"Perceptions of corruption\",\n    \"Population\",\n    \"Median Age\",\n    \"Total Fertility Rate\",\n    \"Life Expectancy\",\n    \"Infant Mortality\",\n    \"Child Mortality\",\n    \"Net Migration Rate\",\n    \"Continent\",\n    \"UN Region\"\n  ]\n}\n\nYour Job:\nI am developing a NL to Data Visualization Dataset. \nPlease help me generate natural language utterance for given dataset and constraints.\nDefinition about the Taks:\n- 'utterance' is what a user would say to make a chart. It should be a questions structure. One NL 'utterance' is in one or two sentences. Here are two examples from Questions for reference:\n    On average, how much was earned by movies of each genre?\n    Which countries have the highest acceleration for cars of different cylinders?\n- 'given dataset' is in form of column names, column type, range/unique values of the column.\n- 'constraints' are information about the chart that should be included in the utterance. \n    So we can find a reference phrase in the NL utterance that corresponds to the given constraints. \n- 'reference phrase' can be explicit, ambiguous, and by_value. 'ambiguous' means the phrase can map to more than one columns in the dataset, always a hypernym of column names(depending on the dataset values).\n    For example:\n    {\"column\": \"gdpPercap\", \"nl_ref_type\": \"explicit\", \"nl_ref_phrase\": \"GDP per capita\"},\n    {\"column\": [\"country\",\"continent\"], \"nl_ref_type\": \"ambiguous\", \"nl_ref_phrase\": \"region\"}\n    {\"column\": [\"country\",\"country_short_name\"], \"nl_ref_type\": \"ambiguous\", \"nl_ref_phrase\": \"countries\"}\n    {\"c_type\": \"mark\", \"c_name\": \"point chart\", \"nl_ref_type\": \"explicit\", \"nl_ref_phrase\": \"scatter plot\"}\n    {\"c_type\": \"mark\", \"c_name\": \"arc chart\", \"nl_ref_type\": \"explicit\", \"nl_ref_phrase\": \"pie chart\"}\n    {\"c_type\": \"transform\",\"c_name\": \"filter\",\"c_list\": [{\"field\": \"country\",\"oneOf\": [\"Iceland\",\"Norway\"]}],\"nl_ref_type\": \"explicit\",\"nl_ref_phrase\": \"for countries Iceland and Norway\"},\n    {\"c_type\": \"transform\",\"c_name\": \"filter\",\"c_list\": [{\"field\": \"country\",\"oneOf\": [\"Iceland\",\"Norway\"]}],\"nl_ref_type\": \"by_value\",\"nl_ref_phrase\": \"for Iceland and Norway\"},\n- the 'nl_ref_phrase' for 'ambiguous' columns should be equally near all ambiguous columns, not too near to one of the column since it would not be ambiguous.\n    good example: {\"column\": [\"country\",\"region\"], \"nl_ref_type\": \"ambiguous\", \"nl_ref_phrase\": \"location\"}\n    bad example: {\"column\": [\"country\",\"region\"], \"nl_ref_type\": \"ambiguous\", \"nl_ref_phrase\": \"region\"}\n- You only include given constraints and no other information. \n    For example, if a column name is not in the given constraint, it will not be included in the NL utterance.\n    Also, it a chart mark or chart encoding channel is not in the given constraint, it will not be included in the NL utterance.\n- all 'nl_ref_phrase' shoule be included in the 'nl_utterance'. \n\nThe output format is identical to the input format, but fill in the str blanks(\"...\").\n### Input:\n{\n  \"nl_utterance\": \"...\",\n  \"encoded_fields\": [\n    {\n      \"field\": \"Infant Mortality\",\n      \"type\": \"quantitative\",\n      \"nl_ref_type\": \"explicit\",\n      \"nl_ref_phrase\": \"...\"\n    },\n    {\n      \"field\": \"Continent\",\n      \"type\": \"nominal\",\n      \"nl_ref_type\": \"explicit\",\n      \"nl_ref_phrase\": \"...\"\n    },\n    {\n      \"field\": \"Population\",\n      \"type\": \"quantitative\",\n      \"nl_ref_type\": \"explicit\",\n      \"nl_ref_phrase\": \"...\"\n    }\n  ],\n  \"constraints\": [\n    {\n      \"c_type\": \"task\",\n      \"c_name\": \"correlation\",\n      \"c_list\": [\n        {\n          \"mark\": \"circle\",\n          \"encoding\": {\n            \"x\": {\n              \"type\": \"quantitative\"\n            },\n            \"y\": {\n              \"type\": \"quantitative\"\n            }\n          }\n        }\n      ],\n      \"nl_ref_type\": \"explicit\",\n      \"nl_ref_phrase\": \"...\"\n    }\n  ]\n}\n\n### Output:"
}