{
  "gpt_result": {
    "nl_utterance": "What is the total sum of 'Totals_USD' over time?",
    "encoded_fields": [
      {
        "field": [
          "Date",
          "Year"
        ],
        "type": "quantitative",
        "nl_ref_type": "ambiguous",
        "nl_ref_phrase": "time"
      },
      {
        "field": "Totals_USD",
        "type": "quantitative",
        "nl_ref_type": "explicit",
        "nl_ref_phrase": "Totals_USD"
      }
    ],
    "constraints": [
      {
        "c_type": "transform",
        "c_name": "aggregate",
        "c_list": [
          {
            "field": "Totals_USD",
            "aggregate": "sum"
          }
        ],
        "nl_ref_type": "explicit",
        "nl_ref_phrase": "total sum"
      }
    ]
  },
  "input": "Dataset Information: {\n  \"data samples\": [\n    {\n      \"Date\": \"08/31/2022\",\n      \"GRA Purchases\": 93769635059,\n      \"PRGT 1/2/\": 15254184552,\n      \"Totals\": 109024000000.0,\n      \"Totals_bil_SDR\": 109.02,\n      \"Year\": 2022,\n      \"Conversion rate\": 1.28252,\n      \"Unnamed: 7\": NaN,\n      \"Totals_USD\": 139.8203304,\n      \"World GDP\": 86700000000000.0,\n      \"World aggregate real GDP (billion USD)\": 86652.9,\n      \"Unnamed: 11\": 0.001258123,\n      \"Total_USD/GDP\": 0.001613568,\n      \"Percentage\": 0.161356781,\n      \"Unnamed: 14\": NaN,\n      \"World nominal GDP\": 98100000000000.0,\n      \"Unnamed: 16\": 98100,\n      \"Unnamed: 17\": 0.001425284,\n      \"Percentages\": 0.142528369\n    },\n    {\n      \"Date\": \"12/31/2001\",\n      \"GRA Purchases\": 53477225409,\n      \"PRGT 1/2/\": 6424578684,\n      \"Totals\": 59901804093.0,\n      \"Totals_bil_SDR\": 59.9,\n      \"Year\": 2001,\n      \"Conversion rate\": 1.25673,\n      \"Unnamed: 7\": NaN,\n      \"Totals_USD\": 75.278127,\n      \"World GDP\": 49200000000000.0,\n      \"World aggregate real GDP (billion USD)\": 49184.6,\n      \"Unnamed: 11\": 0.001217861,\n      \"Total_USD/GDP\": 0.001530522,\n      \"Percentage\": 0.15305223,\n      \"Unnamed: 14\": NaN,\n      \"World nominal GDP\": 33615000000000.0,\n      \"Unnamed: 16\": 33615,\n      \"Unnamed: 17\": 0.002239421,\n      \"Percentages\": 0.223942071\n    },\n    {\n      \"Date\": \"12/31/1992\",\n      \"GRA Purchases\": 23967172718,\n      \"PRGT 1/2/\": 3804463796,\n      \"Totals\": 27771636514.0,\n      \"Totals_bil_SDR\": 27.77,\n      \"Year\": 1992,\n      \"Conversion rate\": 1.375,\n      \"Unnamed: 7\": NaN,\n      \"Totals_USD\": 38.18375,\n      \"World GDP\": 37200000000000.0,\n      \"World aggregate real GDP (billion USD)\": 37150.1,\n      \"Unnamed: 11\": 0.000747508,\n      \"Total_USD/GDP\": 0.001027824,\n      \"Percentage\": 0.102782361,\n      \"Unnamed: 14\": NaN,\n      \"World nominal GDP\": 25406000000000.0,\n      \"Unnamed: 16\": 25406,\n      \"Unnamed: 17\": 0.001502942,\n      \"Percentages\": 0.150294222\n    },\n    {\n      \"Date\": \"12/31/1996\",\n      \"GRA Purchases\": 36127472805,\n      \"PRGT 1/2/\": 5881609752,\n      \"Totals\": 42009082557.0,\n      \"Totals_bil_SDR\": 42.01,\n      \"Year\": 1996,\n      \"Conversion rate\": 1.43796,\n      \"Unnamed: 7\": NaN,\n      \"Totals_USD\": 60.4086996,\n      \"World GDP\": 41700000000000.0,\n      \"World aggregate real GDP (billion USD)\": 41738.5,\n      \"Unnamed: 11\": 0.001006505,\n      \"Total_USD/GDP\": 0.001447314,\n      \"Percentage\": 0.144731362,\n      \"Unnamed: 14\": NaN,\n      \"World nominal GDP\": 31737000000000.0,\n      \"Unnamed: 16\": 31737,\n      \"Unnamed: 17\": 0.001903416,\n      \"Percentages\": 0.190341556\n    },\n    {\n      \"Date\": \"12/31/1987\",\n      \"GRA Purchases\": 28751979125,\n      \"PRGT 1/2/\": 1866342930,\n      \"Totals\": 30618322055.0,\n      \"Totals_bil_SDR\": 30.62,\n      \"Year\": 1987,\n      \"Conversion rate\": 1.41866,\n      \"Unnamed: 7\": NaN,\n      \"Totals_USD\": 43.4393692,\n      \"World GDP\": 32100000000000.0,\n      \"World aggregate real GDP (billion USD)\": 32120.5,\n      \"Unnamed: 11\": 0.000953285,\n      \"Total_USD/GDP\": 0.001352388,\n      \"Percentage\": 0.13523877,\n      \"Unnamed: 14\": NaN,\n      \"World nominal GDP\": 17307000000000.0,\n      \"Unnamed: 16\": 17307,\n      \"Unnamed: 17\": 0.002509931,\n      \"Percentages\": 0.250993062\n    }\n  ],\n  \"column names\": [\n    \"Date\",\n    \"GRA Purchases\",\n    \"PRGT 1/2/\",\n    \"Totals\",\n    \"Totals_bil_SDR\",\n    \"Year\",\n    \"Conversion rate\",\n    \"Unnamed: 7\",\n    \"Totals_USD\",\n    \"World GDP\",\n    \"World aggregate real GDP (billion USD)\",\n    \"Unnamed: 11\",\n    \"Total_USD/GDP\",\n    \"Percentage\",\n    \"Unnamed: 14\",\n    \"World nominal GDP\",\n    \"Unnamed: 16\",\n    \"Unnamed: 17\",\n    \"Percentages\"\n  ]\n}\n\nYour Job:\nI am developing a NL to Data Visualization Dataset. \nPlease help me generate natural language utterance for given dataset and constraints.\nDefinition about the Taks:\n- 'utterance' is what a user would say to make a chart. It should be a questions structure. One NL 'utterance' is in one or two sentences. Here are two examples from Questions for reference:\n    What's the average production budget of the different rated movies, separated by creative type.\n    Have cars gotten lighter over time?\n- 'given dataset' is in form of column names, column type, range/unique values of the column.\n- 'constraints' are information about the chart that should be included in the utterance. \n    So we can find a reference phrase in the NL utterance that corresponds to the given constraints. \n- 'reference phrase' can be explicit, ambiguous, and by_value. 'ambiguous' means the phrase can map to more than one columns in the dataset, always a hypernym of column names(depending on the dataset values).\n    For example:\n    {\"column\": \"gdpPercap\", \"nl_ref_type\": \"explicit\", \"nl_ref_phrase\": \"GDP per capita\"},\n    {\"column\": [\"country\",\"continent\"], \"nl_ref_type\": \"ambiguous\", \"nl_ref_phrase\": \"region\"}\n    {\"column\": [\"country\",\"country_short_name\"], \"nl_ref_type\": \"ambiguous\", \"nl_ref_phrase\": \"countries\"}\n    {\"c_type\": \"mark\", \"c_name\": \"point chart\", \"nl_ref_type\": \"explicit\", \"nl_ref_phrase\": \"scatter plot\"}\n    {\"c_type\": \"mark\", \"c_name\": \"arc chart\", \"nl_ref_type\": \"explicit\", \"nl_ref_phrase\": \"pie chart\"}\n    {\"c_type\": \"transform\",\"c_name\": \"filter\",\"c_list\": [{\"field\": \"country\",\"oneOf\": [\"Iceland\",\"Norway\"]}],\"nl_ref_type\": \"explicit\",\"nl_ref_phrase\": \"for countries Iceland and Norway\"},\n    {\"c_type\": \"transform\",\"c_name\": \"filter\",\"c_list\": [{\"field\": \"country\",\"oneOf\": [\"Iceland\",\"Norway\"]}],\"nl_ref_type\": \"by_value\",\"nl_ref_phrase\": \"for Iceland and Norway\"},\n- the 'nl_ref_phrase' for 'ambiguous' columns should be equally near all ambiguous columns, not too near to one of the column since it would not be ambiguous.\n    good example: {\"column\": [\"country\",\"region\"], \"nl_ref_type\": \"ambiguous\", \"nl_ref_phrase\": \"location\"}\n    bad example: {\"column\": [\"country\",\"region\"], \"nl_ref_type\": \"ambiguous\", \"nl_ref_phrase\": \"region\"}\n- You only include given constraints and no other information. \n    For example, if a column name is not in the given constraint, it will not be included in the NL utterance.\n    Also, it a chart mark or chart encoding channel is not in the given constraint, it will not be included in the NL utterance.\n- all 'nl_ref_phrase' shoule be included in the 'nl_utterance'. \n\nThe output format is identical to the input format, but fill in the str blanks(\"...\").\n### Input:\n{\n  \"nl_utterance\": \"...\",\n  \"encoded_fields\": [\n    {\n      \"field\": [\n        \"Date\",\n        \"Year\"\n      ],\n      \"type\": \"quantitative\",\n      \"nl_ref_type\": \"ambiguous\",\n      \"nl_ref_phrase\": \"...\"\n    },\n    {\n      \"field\": \"Totals_USD\",\n      \"type\": \"quantitative\",\n      \"nl_ref_type\": \"explicit\",\n      \"nl_ref_phrase\": \"...\"\n    }\n  ],\n  \"constraints\": [\n    {\n      \"c_type\": \"transform\",\n      \"c_name\": \"aggregate\",\n      \"c_list\": [\n        {\n          \"field\": \"Totals_USD\",\n          \"aggregate\": \"sum\"\n        }\n      ],\n      \"nl_ref_type\": \"explicit\",\n      \"nl_ref_phrase\": \"...\"\n    }\n  ]\n}\n\n### Output:"
}