{
  "gpt_result": {
    "nl_utterance": "Create a scatter plot to show the correlation between Progressive Passes and Expected Assists, color-coded by position and plotted with Progressive Carries.",
    "encoded_fields": [
      {
        "field": "Progressive Carries",
        "type": "quantitative",
        "nl_ref_type": "explicit",
        "nl_ref_phrase": "Progressive Carries"
      },
      {
        "field": "Progressive Passes",
        "type": "quantitative",
        "nl_ref_type": "explicit",
        "nl_ref_phrase": "Progressive Passes"
      },
      {
        "field": "Pos",
        "type": "nominal",
        "nl_ref_type": "explicit",
        "nl_ref_phrase": "position"
      },
      {
        "field": "Expected Assists",
        "type": "quantitative",
        "nl_ref_type": "explicit",
        "nl_ref_phrase": "Expected Assists"
      }
    ],
    "constraints": [
      {
        "c_type": "task",
        "c_name": "correlation",
        "c_list": [
          {
            "mark": "circle",
            "encoding": {
              "x": {
                "type": "quantitative"
              },
              "y": {
                "type": "quantitative"
              }
            }
          }
        ],
        "nl_ref_type": "explicit",
        "nl_ref_phrase": "correlation"
      }
    ]
  },
  "input": "Dataset Information: {\n  \"data samples\": [\n    {\n      \"Player\": \"Max Aarons\",\n      \"Pos\": \"Defender\",\n      \"Comp\": \"eng Premier League\",\n      \"Progressive Passes\": 2.9375,\n      \"Expected Assists\": 0.04375,\n      \"Progressive Carries\": 5.4375\n    },\n    {\n      \"Player\": \"Andrew Robertson\",\n      \"Pos\": \"Defender\",\n      \"Comp\": \"eng Premier League\",\n      \"Progressive Passes\": 7.021276595744681,\n      \"Expected Assists\": 0.1843971631205674,\n      \"Progressive Carries\": 7.269503546099291\n    },\n    {\n      \"Player\": \"Rico Henry\",\n      \"Pos\": \"Defender\",\n      \"Comp\": \"eng Premier League\",\n      \"Progressive Passes\": 2.5324675324675323,\n      \"Expected Assists\": 0.0551948051948051,\n      \"Progressive Carries\": 3.5064935064935066\n    },\n    {\n      \"Player\": \"Martin Odegaard\",\n      \"Pos\": \"Midfielder\",\n      \"Comp\": \"eng Premier League\",\n      \"Progressive Passes\": 5.11326860841424,\n      \"Expected Assists\": 0.2200647249190938,\n      \"Progressive Carries\": 6.50485436893204\n    },\n    {\n      \"Player\": \"Said Benrahma\",\n      \"Pos\": \"Winger\",\n      \"Comp\": \"eng Premier League\",\n      \"Progressive Passes\": 2.531120331950208,\n      \"Expected Assists\": 0.1327800829875518,\n      \"Progressive Carries\": 5.352697095435684\n    }\n  ],\n  \"column names\": [\n    \"Player\",\n    \"Pos\",\n    \"Comp\",\n    \"Progressive Passes\",\n    \"Expected Assists\",\n    \"Progressive Carries\"\n  ]\n}\n\nYour Job:\nI am developing a NL to Data Visualization Dataset. \nPlease help me generate natural language utterance for given dataset and constraints.\nDefinition about the Taks:\n- 'utterance' is what a user would say to make a chart. It should be a commands structure. One NL 'utterance' is in one or two sentences. Here are two examples from Commands for reference:\n    Draw a line chart of daily sales forecasts.\n    Make the bars stacked with the ship status.\n- 'given dataset' is in form of column names, column type, range/unique values of the column.\n- 'constraints' are information about the chart that should be included in the utterance. \n    So we can find a reference phrase in the NL utterance that corresponds to the given constraints. \n- 'reference phrase' can be explicit, ambiguous, and by_value. 'ambiguous' means the phrase can map to more than one columns in the dataset, always a hypernym of column names(depending on the dataset values).\n    For example:\n    {\"column\": \"gdpPercap\", \"nl_ref_type\": \"explicit\", \"nl_ref_phrase\": \"GDP per capita\"},\n    {\"column\": [\"country\",\"continent\"], \"nl_ref_type\": \"ambiguous\", \"nl_ref_phrase\": \"region\"}\n    {\"column\": [\"country\",\"country_short_name\"], \"nl_ref_type\": \"ambiguous\", \"nl_ref_phrase\": \"countries\"}\n    {\"c_type\": \"mark\", \"c_name\": \"point chart\", \"nl_ref_type\": \"explicit\", \"nl_ref_phrase\": \"scatter plot\"}\n    {\"c_type\": \"mark\", \"c_name\": \"arc chart\", \"nl_ref_type\": \"explicit\", \"nl_ref_phrase\": \"pie chart\"}\n    {\"c_type\": \"transform\",\"c_name\": \"filter\",\"c_list\": [{\"field\": \"country\",\"oneOf\": [\"Iceland\",\"Norway\"]}],\"nl_ref_type\": \"explicit\",\"nl_ref_phrase\": \"for countries Iceland and Norway\"},\n    {\"c_type\": \"transform\",\"c_name\": \"filter\",\"c_list\": [{\"field\": \"country\",\"oneOf\": [\"Iceland\",\"Norway\"]}],\"nl_ref_type\": \"by_value\",\"nl_ref_phrase\": \"for Iceland and Norway\"},\n- the 'nl_ref_phrase' for 'ambiguous' columns should be equally near all ambiguous columns, not too near to one of the column since it would not be ambiguous.\n    good example: {\"column\": [\"country\",\"region\"], \"nl_ref_type\": \"ambiguous\", \"nl_ref_phrase\": \"location\"}\n    bad example: {\"column\": [\"country\",\"region\"], \"nl_ref_type\": \"ambiguous\", \"nl_ref_phrase\": \"region\"}\n- You only include given constraints and no other information. \n    For example, if a column name is not in the given constraint, it will not be included in the NL utterance.\n    Also, it a chart mark or chart encoding channel is not in the given constraint, it will not be included in the NL utterance.\n- all 'nl_ref_phrase' shoule be included in the 'nl_utterance'. \n\nThe output format is identical to the input format, but fill in the str blanks(\"...\").\n### Input:\n{\n  \"nl_utterance\": \"...\",\n  \"encoded_fields\": [\n    {\n      \"field\": \"Progressive Carries\",\n      \"type\": \"quantitative\",\n      \"nl_ref_type\": \"explicit\",\n      \"nl_ref_phrase\": \"...\"\n    },\n    {\n      \"field\": \"Progressive Passes\",\n      \"type\": \"quantitative\",\n      \"nl_ref_type\": \"explicit\",\n      \"nl_ref_phrase\": \"...\"\n    },\n    {\n      \"field\": \"Pos\",\n      \"type\": \"nominal\",\n      \"nl_ref_type\": \"explicit\",\n      \"nl_ref_phrase\": \"...\"\n    },\n    {\n      \"field\": \"Expected Assists\",\n      \"type\": \"quantitative\",\n      \"nl_ref_type\": \"explicit\",\n      \"nl_ref_phrase\": \"...\"\n    }\n  ],\n  \"constraints\": [\n    {\n      \"c_type\": \"task\",\n      \"c_name\": \"correlation\",\n      \"c_list\": [\n        {\n          \"mark\": \"circle\",\n          \"encoding\": {\n            \"x\": {\n              \"type\": \"quantitative\"\n            },\n            \"y\": {\n              \"type\": \"quantitative\"\n            }\n          }\n        }\n      ],\n      \"nl_ref_type\": \"explicit\",\n      \"nl_ref_phrase\": \"...\"\n    }\n  ]\n}\n\n### Output:"
}