{
  "gpt_result": {
    "nl_utterance": "What is the relationship between Human Capital Index and Population across different continents, using a scatter plot? Consider only data where Human Capital Index is greater than 0 and GDP per capita (PPP) is above 1000.",
    "encoded_fields": [
      {
        "field": "Human Capital Index",
        "type": "quantitative",
        "nl_ref_type": "explicit",
        "nl_ref_phrase": "Human Capital Index"
      },
      {
        "field": "Continent",
        "type": "nominal",
        "nl_ref_type": "explicit",
        "nl_ref_phrase": "continents"
      },
      {
        "field": "Population",
        "type": "quantitative",
        "nl_ref_type": "explicit",
        "nl_ref_phrase": "Population"
      }
    ],
    "constraints": [
      {
        "c_type": "task",
        "c_name": "correlation",
        "c_list": [
          {
            "mark": "circle",
            "encoding": {
              "x": {
                "type": "quantitative"
              },
              "y": {
                "type": "quantitative"
              }
            }
          }
        ],
        "nl_ref_type": "explicit",
        "nl_ref_phrase": "relationship"
      },
      {
        "c_type": "transform",
        "c_name": "filter",
        "c_list": [
          {
            "field": "Human Capital Index",
            "gt": 0
          }
        ],
        "nl_ref_type": "by_value",
        "nl_ref_phrase": "where Human Capital Index is greater than 0"
      },
      {
        "c_type": "transform",
        "c_name": "filter",
        "c_list": [
          {
            "field": "GDP per capita (PPP)",
            "gt": 1000
          }
        ],
        "nl_ref_type": "by_value",
        "nl_ref_phrase": "GDP per capita (PPP) is above 1000"
      }
    ]
  },
  "input": "Dataset Information: {\n  \"data samples\": [\n    {\n      \"Country\": \"Afghanistan\",\n      \"ISO3\": \"AFG\",\n      \"Region\": \"South Asia\",\n      \"Income Group\": \"Low income\",\n      \"Probability of Survival to Age 5\": 0.93425,\n      \"Expected Years of School\": 9.65539,\n      \"Harmonized Test Scores\": 357.79474,\n      \"Learning-Adjusted Years of School\": 5.52743,\n      \"Fraction of Children Under 5 Not Stunted\": 0.61741,\n      \"Adult Survival Rate\": 0.76612,\n      \"Human Capital Index\": 0.41128,\n      \"GDP per capita (PPP)\": 2076.13838,\n      \"Log GDP per capita\": 7.638264899097053,\n      \"Population\": 38972230.0,\n      \"Continent\": \"Asia\"\n    },\n    {\n      \"Country\": \"West Bank and Gaza\",\n      \"ISO3\": \"PSE\",\n      \"Region\": \"Middle East & North Africa\",\n      \"Income Group\": \"Lower middle income\",\n      \"Probability of Survival to Age 5\": 0.97804,\n      \"Expected Years of School\": 11.88833,\n      \"Harmonized Test Scores\": 399.37241,\n      \"Learning-Adjusted Years of School\": 7.59659,\n      \"Fraction of Children Under 5 Not Stunted\": 0.91876,\n      \"Adult Survival Rate\": 0.87523,\n      \"Human Capital Index\": 0.55472,\n      \"GDP per capita (PPP)\": 5698.412057,\n      \"Log GDP per capita\": 8.647942828518989,\n      \"Population\": 4803269.0,\n      \"Continent\": \"Asia\"\n    },\n    {\n      \"Country\": \"Switzerland\",\n      \"ISO3\": \"CHE\",\n      \"Region\": \"Europe & Central Asia\",\n      \"Income Group\": \"High income\",\n      \"Probability of Survival to Age 5\": 0.99554,\n      \"Expected Years of School\": 13.31041,\n      \"Harmonized Test Scores\": 511.42609,\n      \"Learning-Adjusted Years of School\": 10.89166,\n      \"Fraction of Children Under 5 Not Stunted\": NaN,\n      \"Adult Survival Rate\": 0.94281,\n      \"Human Capital Index\": 0.74791,\n      \"GDP per capita (PPP)\": 71731.96058,\n      \"Log GDP per capita\": 11.180691681522632,\n      \"Population\": 8638167.0,\n      \"Continent\": \"Europe\"\n    },\n    {\n      \"Country\": \"Mali\",\n      \"ISO3\": \"MLI\",\n      \"Region\": \"Sub-Saharan Africa\",\n      \"Income Group\": \"Low income\",\n      \"Probability of Survival to Age 5\": 0.89696,\n      \"Expected Years of School\": 5.57593,\n      \"Harmonized Test Scores\": 307.30673,\n      \"Learning-Adjusted Years of School\": 2.74163,\n      \"Fraction of Children Under 5 Not Stunted\": 0.7197,\n      \"Adult Survival Rate\": 0.73984,\n      \"Human Capital Index\": 0.31888,\n      \"GDP per capita (PPP)\": 2240.140931,\n      \"Log GDP per capita\": 7.71429405849498,\n      \"Population\": 21224040.0,\n      \"Continent\": \"Africa\"\n    },\n    {\n      \"Country\": \"Mauritania\",\n      \"ISO3\": \"MRT\",\n      \"Region\": \"Sub-Saharan Africa\",\n      \"Income Group\": \"Lower middle income\",\n      \"Probability of Survival to Age 5\": 0.91857,\n      \"Expected Years of School\": 7.52464,\n      \"Harmonized Test Scores\": 340.47769,\n      \"Learning-Adjusted Years of School\": 4.09916,\n      \"Fraction of Children Under 5 Not Stunted\": 0.74468,\n      \"Adult Survival Rate\": 0.78328,\n      \"Human Capital Index\": 0.37083,\n      \"GDP per capita (PPP)\": 5605.920294,\n      \"Log GDP per capita\": 8.631578513642921,\n      \"Population\": 4498604.0,\n      \"Continent\": \"Africa\"\n    }\n  ],\n  \"column names\": [\n    \"Country\",\n    \"ISO3\",\n    \"Region\",\n    \"Income Group\",\n    \"Probability of Survival to Age 5\",\n    \"Expected Years of School\",\n    \"Harmonized Test Scores\",\n    \"Learning-Adjusted Years of School\",\n    \"Fraction of Children Under 5 Not Stunted\",\n    \"Adult Survival Rate\",\n    \"Human Capital Index\",\n    \"GDP per capita (PPP)\",\n    \"Log GDP per capita\",\n    \"Population\",\n    \"Continent\"\n  ]\n}\n\nYour Job:\nI am developing a NL to Data Visualization Dataset. \nPlease help me generate natural language utterance for given dataset and constraints.\nDefinition about the Taks:\n- 'utterance' is what a user would say to make a chart. It should be a questions structure. One NL 'utterance' is in one or two sentences. Here are two examples from Questions for reference:\n    Have cars gotten lighter over time?\n    How many cars do each country manufacture?\n- 'given dataset' is in form of column names, column type, range/unique values of the column.\n- 'constraints' are information about the chart that should be included in the utterance. \n    So we can find a reference phrase in the NL utterance that corresponds to the given constraints. \n- 'reference phrase' can be explicit, ambiguous, and by_value. 'ambiguous' means the phrase can map to more than one columns in the dataset, always a hypernym of column names(depending on the dataset values).\n    For example:\n    {\"column\": \"gdpPercap\", \"nl_ref_type\": \"explicit\", \"nl_ref_phrase\": \"GDP per capita\"},\n    {\"column\": [\"country\",\"continent\"], \"nl_ref_type\": \"ambiguous\", \"nl_ref_phrase\": \"region\"}\n    {\"column\": [\"country\",\"country_short_name\"], \"nl_ref_type\": \"ambiguous\", \"nl_ref_phrase\": \"countries\"}\n    {\"c_type\": \"mark\", \"c_name\": \"point chart\", \"nl_ref_type\": \"explicit\", \"nl_ref_phrase\": \"scatter plot\"}\n    {\"c_type\": \"mark\", \"c_name\": \"arc chart\", \"nl_ref_type\": \"explicit\", \"nl_ref_phrase\": \"pie chart\"}\n    {\"c_type\": \"transform\",\"c_name\": \"filter\",\"c_list\": [{\"field\": \"country\",\"oneOf\": [\"Iceland\",\"Norway\"]}],\"nl_ref_type\": \"explicit\",\"nl_ref_phrase\": \"for countries Iceland and Norway\"},\n    {\"c_type\": \"transform\",\"c_name\": \"filter\",\"c_list\": [{\"field\": \"country\",\"oneOf\": [\"Iceland\",\"Norway\"]}],\"nl_ref_type\": \"by_value\",\"nl_ref_phrase\": \"for Iceland and Norway\"},\n- the 'nl_ref_phrase' for 'ambiguous' columns should be equally near all ambiguous columns, not too near to one of the column since it would not be ambiguous.\n    good example: {\"column\": [\"country\",\"region\"], \"nl_ref_type\": \"ambiguous\", \"nl_ref_phrase\": \"location\"}\n    bad example: {\"column\": [\"country\",\"region\"], \"nl_ref_type\": \"ambiguous\", \"nl_ref_phrase\": \"region\"}\n- You only include given constraints and no other information. \n    For example, if a column name is not in the given constraint, it will not be included in the NL utterance.\n    Also, it a chart mark or chart encoding channel is not in the given constraint, it will not be included in the NL utterance.\n- all 'nl_ref_phrase' shoule be included in the 'nl_utterance'. \n\nThe output format is identical to the input format, but fill in the str blanks(\"...\").\n### Input:\n{\n  \"nl_utterance\": \"...\",\n  \"encoded_fields\": [\n    {\n      \"field\": \"Human Capital Index\",\n      \"type\": \"quantitative\",\n      \"nl_ref_type\": \"explicit\",\n      \"nl_ref_phrase\": \"...\"\n    },\n    {\n      \"field\": \"Continent\",\n      \"type\": \"nominal\",\n      \"nl_ref_type\": \"explicit\",\n      \"nl_ref_phrase\": \"...\"\n    },\n    {\n      \"field\": \"Population\",\n      \"type\": \"quantitative\",\n      \"nl_ref_type\": \"explicit\",\n      \"nl_ref_phrase\": \"...\"\n    }\n  ],\n  \"constraints\": [\n    {\n      \"c_type\": \"task\",\n      \"c_name\": \"correlation\",\n      \"c_list\": [\n        {\n          \"mark\": \"circle\",\n          \"encoding\": {\n            \"x\": {\n              \"type\": \"quantitative\"\n            },\n            \"y\": {\n              \"type\": \"quantitative\"\n            }\n          }\n        }\n      ],\n      \"nl_ref_type\": \"explicit\",\n      \"nl_ref_phrase\": \"...\"\n    },\n    {\n      \"c_type\": \"transform\",\n      \"c_name\": \"filter\",\n      \"c_list\": [\n        {\n          \"field\": \"Human Capital Index\",\n          \"gt\": 0\n        }\n      ],\n      \"nl_ref_type\": \"by_value\",\n      \"nl_ref_phrase\": \"...\"\n    },\n    {\n      \"c_type\": \"transform\",\n      \"c_name\": \"filter\",\n      \"c_list\": [\n        {\n          \"field\": \"GDP per capita (PPP)\",\n          \"gt\": 1000\n        }\n      ],\n      \"nl_ref_type\": \"by_value\",\n      \"nl_ref_phrase\": \"...\"\n    }\n  ]\n}\n\n### Output:"
}