{
  "gpt_result": {
    "nl_utterance": "Create a scatter plot to explore the correlation between the number of matches and substitutions played with goals scored and shots per average match.",
    "encoded_fields": [
      {
        "field": [
          "Matches_Played",
          "Substitution "
        ],
        "type": "quantitative",
        "nl_ref_type": "ambiguous",
        "nl_ref_phrase": "number of matches and substitutions"
      },
      {
        "field": "Goals",
        "type": "quantitative",
        "nl_ref_type": "explicit",
        "nl_ref_phrase": "goals scored"
      },
      {
        "field": "Shots Per Avg Match",
        "type": "quantitative",
        "nl_ref_type": "explicit",
        "nl_ref_phrase": "shots per average match"
      }
    ],
    "constraints": [
      {
        "c_type": "task",
        "c_name": "correlation",
        "c_list": [
          {
            "mark": "circle",
            "encoding": {
              "x": {
                "type": "quantitative"
              },
              "y": {
                "type": "quantitative"
              }
            }
          }
        ],
        "nl_ref_type": "explicit",
        "nl_ref_phrase": "correlation"
      }
    ]
  },
  "input": "Dataset Information: {\n  \"data samples\": [\n    {\n      \"Country\": \"England\",\n      \"League\": \"Premier League\",\n      \"Club\": \"(INT)\",\n      \"Player Names\": \"Alexis Sanchez\",\n      \"Matches_Played\": 36,\n      \"Substitution \": 2,\n      \"Mins\": 3385,\n      \"Goals\": 24,\n      \"xG\": 19.24,\n      \"xG Per Avg Match\": 0.54,\n      \"Shots\": 129,\n      \"OnTarget\": 49,\n      \"Shots Per Avg Match\": 3.62,\n      \"On Target Per Avg Match\": 1.38,\n      \"Year\": 2016\n    },\n    {\n      \"Country\": \"England\",\n      \"League\": \"Premier League\",\n      \"Club\": \"(LIV)\",\n      \"Player Names\": \"Roberto Firmino\",\n      \"Matches_Played\": 34,\n      \"Substitution \": 1,\n      \"Mins\": 3228,\n      \"Goals\": 11,\n      \"xG\": 10.87,\n      \"xG Per Avg Match\": 0.32,\n      \"Shots\": 104,\n      \"OnTarget\": 43,\n      \"Shots Per Avg Match\": 3.06,\n      \"On Target Per Avg Match\": 1.27,\n      \"Year\": 2016\n    },\n    {\n      \"Country\": \"England\",\n      \"League\": \"Premier League\",\n      \"Club\": \"(TOT)\",\n      \"Player Names\": \"Son Heung-Min\",\n      \"Matches_Played\": 23,\n      \"Substitution \": 11,\n      \"Mins\": 2174,\n      \"Goals\": 14,\n      \"xG\": 7.32,\n      \"xG Per Avg Match\": 0.32,\n      \"Shots\": 80,\n      \"OnTarget\": 33,\n      \"Shots Per Avg Match\": 3.5,\n      \"On Target Per Avg Match\": 1.44,\n      \"Year\": 2016\n    },\n    {\n      \"Country\": \"England\",\n      \"League\": \"Premier League\",\n      \"Club\": \"(RAN)\",\n      \"Player Names\": \"Jermain Defoe\",\n      \"Matches_Played\": 37,\n      \"Substitution \": 0,\n      \"Mins\": 3511,\n      \"Goals\": 15,\n      \"xG\": 15.52,\n      \"xG Per Avg Match\": 0.42,\n      \"Shots\": 99,\n      \"OnTarget\": 31,\n      \"Shots Per Avg Match\": 2.68,\n      \"On Target Per Avg Match\": 0.84,\n      \"Year\": 2016\n    },\n    {\n      \"Country\": \"England\",\n      \"League\": \"Premier League\",\n      \"Club\": \"(NAP)\",\n      \"Player Names\": \"Fernando Llorente\",\n      \"Matches_Played\": 28,\n      \"Substitution \": 5,\n      \"Mins\": 2562,\n      \"Goals\": 15,\n      \"xG\": 8.36,\n      \"xG Per Avg Match\": 0.31,\n      \"Shots\": 52,\n      \"OnTarget\": 25,\n      \"Shots Per Avg Match\": 1.93,\n      \"On Target Per Avg Match\": 0.93,\n      \"Year\": 2016\n    }\n  ],\n  \"column names\": [\n    \"Country\",\n    \"League\",\n    \"Club\",\n    \"Player Names\",\n    \"Matches_Played\",\n    \"Substitution \",\n    \"Mins\",\n    \"Goals\",\n    \"xG\",\n    \"xG Per Avg Match\",\n    \"Shots\",\n    \"OnTarget\",\n    \"Shots Per Avg Match\",\n    \"On Target Per Avg Match\",\n    \"Year\"\n  ]\n}\n\nYour Job:\nI am developing a NL to Data Visualization Dataset. \nPlease help me generate natural language utterance for given dataset and constraints.\nDefinition about the Taks:\n- 'utterance' is what a user would say to make a chart. It should be a commands structure. One NL 'utterance' is in one or two sentences. Here are two examples from Commands for reference:\n    Create a line chart showing order date and sum of sales, divided by category.\n    Draw axes for AVG(Horsepower) vs Year, colored by Origin.\n- 'given dataset' is in form of column names, column type, range/unique values of the column.\n- 'constraints' are information about the chart that should be included in the utterance. \n    So we can find a reference phrase in the NL utterance that corresponds to the given constraints. \n- 'reference phrase' can be explicit, ambiguous, and by_value. 'ambiguous' means the phrase can map to more than one columns in the dataset, always a hypernym of column names(depending on the dataset values).\n    For example:\n    {\"column\": \"gdpPercap\", \"nl_ref_type\": \"explicit\", \"nl_ref_phrase\": \"GDP per capita\"},\n    {\"column\": [\"country\",\"continent\"], \"nl_ref_type\": \"ambiguous\", \"nl_ref_phrase\": \"region\"}\n    {\"column\": [\"country\",\"country_short_name\"], \"nl_ref_type\": \"ambiguous\", \"nl_ref_phrase\": \"countries\"}\n    {\"c_type\": \"mark\", \"c_name\": \"point chart\", \"nl_ref_type\": \"explicit\", \"nl_ref_phrase\": \"scatter plot\"}\n    {\"c_type\": \"mark\", \"c_name\": \"arc chart\", \"nl_ref_type\": \"explicit\", \"nl_ref_phrase\": \"pie chart\"}\n    {\"c_type\": \"transform\",\"c_name\": \"filter\",\"c_list\": [{\"field\": \"country\",\"oneOf\": [\"Iceland\",\"Norway\"]}],\"nl_ref_type\": \"explicit\",\"nl_ref_phrase\": \"for countries Iceland and Norway\"},\n    {\"c_type\": \"transform\",\"c_name\": \"filter\",\"c_list\": [{\"field\": \"country\",\"oneOf\": [\"Iceland\",\"Norway\"]}],\"nl_ref_type\": \"by_value\",\"nl_ref_phrase\": \"for Iceland and Norway\"},\n- the 'nl_ref_phrase' for 'ambiguous' columns should be equally near all ambiguous columns, not too near to one of the column since it would not be ambiguous.\n    good example: {\"column\": [\"country\",\"region\"], \"nl_ref_type\": \"ambiguous\", \"nl_ref_phrase\": \"location\"}\n    bad example: {\"column\": [\"country\",\"region\"], \"nl_ref_type\": \"ambiguous\", \"nl_ref_phrase\": \"region\"}\n- You only include given constraints and no other information. \n    For example, if a column name is not in the given constraint, it will not be included in the NL utterance.\n    Also, it a chart mark or chart encoding channel is not in the given constraint, it will not be included in the NL utterance.\n- all 'nl_ref_phrase' shoule be included in the 'nl_utterance'. \n\nThe output format is identical to the input format, but fill in the str blanks(\"...\").\n### Input:\n{\n  \"nl_utterance\": \"...\",\n  \"encoded_fields\": [\n    {\n      \"field\": [\n        \"Matches_Played\",\n        \"Substitution \"\n      ],\n      \"type\": \"quantitative\",\n      \"nl_ref_type\": \"ambiguous\",\n      \"nl_ref_phrase\": \"...\"\n    },\n    {\n      \"field\": \"Goals\",\n      \"type\": \"quantitative\",\n      \"nl_ref_type\": \"explicit\",\n      \"nl_ref_phrase\": \"...\"\n    },\n    {\n      \"field\": \"Shots Per Avg Match\",\n      \"type\": \"quantitative\",\n      \"nl_ref_type\": \"explicit\",\n      \"nl_ref_phrase\": \"...\"\n    }\n  ],\n  \"constraints\": [\n    {\n      \"c_type\": \"task\",\n      \"c_name\": \"correlation\",\n      \"c_list\": [\n        {\n          \"mark\": \"circle\",\n          \"encoding\": {\n            \"x\": {\n              \"type\": \"quantitative\"\n            },\n            \"y\": {\n              \"type\": \"quantitative\"\n            }\n          }\n        }\n      ],\n      \"nl_ref_type\": \"explicit\",\n      \"nl_ref_phrase\": \"...\"\n    }\n  ]\n}\n\n### Output:"
}