{
  "gpt_result": {
    "nl_utterance": "Create a bar chart showing the total floors for each year constructed.",
    "encoded_fields": [
      {
        "field": "Year Constructed",
        "type": "quantitative",
        "nl_ref_type": "explicit",
        "nl_ref_phrase": "year constructed"
      },
      {
        "field": "Total Floors",
        "type": "quantitative",
        "nl_ref_type": "explicit",
        "nl_ref_phrase": "total floors"
      }
    ],
    "constraints": [
      {
        "c_type": "mark",
        "c_name": "bar chart",
        "c_list": [
          {
            "mark": "bar",
            "encoding": {
              "x": {},
              "y": {
                "type": "quantitative"
              },
              "color": {
                "type": "nominal",
                "ignore": true
              },
              "column": {
                "ignore": true,
                "type": "nominal"
              },
              "row": {
                "ignore": true,
                "type": "nominal"
              }
            },
            "unique_map": {
              "x": "y"
            }
          },
          {
            "mark": "bar",
            "encoding": {
              "y": {},
              "x": {
                "type": "quantitative"
              },
              "color": {
                "type": "nominal",
                "ignore": true
              },
              "column": {
                "ignore": true,
                "type": "nominal"
              },
              "row": {
                "ignore": true,
                "type": "nominal"
              }
            },
            "unique_map": {
              "y": "x"
            }
          }
        ],
        "nl_ref_type": "explicit",
        "nl_ref_phrase": "bar chart"
      }
    ]
  },
  "input": "Dataset Information: {\n  \"data samples\": [\n    {\n      \"Agency Name\": \"Department of Natural Resources\",\n      \"Location Name\": \"Anderson Lake Conservation Area - Fulton County\",\n      \"Address\": \"Anderson Lake C.a.\",\n      \"City\": \"Astoria\",\n      \"Zip code\": 61501,\n      \"County\": \"Fulton\",\n      \"Congress Dist\": 17,\n      \"Congressional Full Name\": \"Cheri Bustos\",\n      \"Rep Dist\": 93,\n      \"Rep Full Name\": \"Hammond Norine K.\",\n      \"Senate Dist\": 47,\n      \"Senator Full Name\": \"Jil Tracy\",\n      \"Bldg Status\": \"In Use\",\n      \"Year Acquired\": 1975,\n      \"Year Constructed\": 1975,\n      \"Square Footage\": 144,\n      \"Total Floors\": 1,\n      \"Floors Above Grade\": 1,\n      \"Floors Below Grade\": 0,\n      \"Usage Description\": \"Unusual\",\n      \"Usage Description 2\": \"Unusual\",\n      \"Usage Description 3\": \"Not provided\"\n    },\n    {\n      \"Agency Name\": \"Department of Natural Resources\",\n      \"Location Name\": \"Pere Marquette State Park - Jersey County\",\n      \"Address\": \"P.o. Box 158\",\n      \"City\": \"Grafton\",\n      \"Zip code\": 62037,\n      \"County\": \"Jersey\",\n      \"Congress Dist\": 13,\n      \"Congressional Full Name\": \"Rodney L. Davis\",\n      \"Rep Dist\": 100,\n      \"Rep Full Name\": \"Davidsmeyer C. D.\",\n      \"Senate Dist\": 50,\n      \"Senator Full Name\": \"Wm. Sam McCann\",\n      \"Bldg Status\": \"In Use\",\n      \"Year Acquired\": 1935,\n      \"Year Constructed\": 1935,\n      \"Square Footage\": 228,\n      \"Total Floors\": 1,\n      \"Floors Above Grade\": 1,\n      \"Floors Below Grade\": 0,\n      \"Usage Description\": \"Residential\",\n      \"Usage Description 2\": \"Residential\",\n      \"Usage Description 3\": \"Not provided\"\n    },\n    {\n      \"Agency Name\": \"Department of Corrections\",\n      \"Location Name\": \"Centralia Correctional Center - Clinton County\",\n      \"Address\": \"Shattuc Road\",\n      \"City\": \"Centralia\",\n      \"Zip code\": 62801,\n      \"County\": \"Clinton\",\n      \"Congress Dist\": 15,\n      \"Congressional Full Name\": \"John Shimkus\",\n      \"Rep Dist\": 108,\n      \"Rep Full Name\": \"Meier Charles\",\n      \"Senate Dist\": 54,\n      \"Senator Full Name\": \"Kyle McCarter\",\n      \"Bldg Status\": \"In Use\",\n      \"Year Acquired\": 1981,\n      \"Year Constructed\": 1981,\n      \"Square Footage\": 17620,\n      \"Total Floors\": 1,\n      \"Floors Above Grade\": 1,\n      \"Floors Below Grade\": 0,\n      \"Usage Description\": \"Education\",\n      \"Usage Description 2\": \"Education\",\n      \"Usage Description 3\": \"Not provided\"\n    },\n    {\n      \"Agency Name\": \"Department of Natural Resources\",\n      \"Location Name\": \"Wolf Creek State Park\",\n      \"Address\": \"R.r. 1 Box 99\",\n      \"City\": \"Windsor\",\n      \"Zip code\": 62534,\n      \"County\": \"Shelby\",\n      \"Congress Dist\": 15,\n      \"Congressional Full Name\": \"John Shimkus\",\n      \"Rep Dist\": 102,\n      \"Rep Full Name\": \"Halbrook Brad\",\n      \"Senate Dist\": 51,\n      \"Senator Full Name\": \"Chapin Rose\",\n      \"Bldg Status\": \"In Use\",\n      \"Year Acquired\": 2001,\n      \"Year Constructed\": 2001,\n      \"Square Footage\": 144,\n      \"Total Floors\": 1,\n      \"Floors Above Grade\": 1,\n      \"Floors Below Grade\": 0,\n      \"Usage Description\": \"Unusual\",\n      \"Usage Description 2\": \"Unusual\",\n      \"Usage Description 3\": \"Not provided\"\n    },\n    {\n      \"Agency Name\": \"Department of Corrections\",\n      \"Location Name\": \"Greene County Work Camp\",\n      \"Address\": \"Rt 267 South\",\n      \"City\": \"Roodhouse\",\n      \"Zip code\": 62082,\n      \"County\": \"Greene\",\n      \"Congress Dist\": 13,\n      \"Congressional Full Name\": \"Rodney L. Davis\",\n      \"Rep Dist\": 100,\n      \"Rep Full Name\": \"Davidsmeyer C. D.\",\n      \"Senate Dist\": 50,\n      \"Senator Full Name\": \"Wm. Sam McCann\",\n      \"Bldg Status\": \"In Use\",\n      \"Year Acquired\": 1990,\n      \"Year Constructed\": 1991,\n      \"Square Footage\": 15089,\n      \"Total Floors\": 2,\n      \"Floors Above Grade\": 2,\n      \"Floors Below Grade\": 0,\n      \"Usage Description\": \"Detention & Correc\",\n      \"Usage Description 2\": \"Detention & Correc\",\n      \"Usage Description 3\": \"Not provided\"\n    }\n  ],\n  \"column names\": [\n    \"Agency Name\",\n    \"Location Name\",\n    \"Address\",\n    \"City\",\n    \"Zip code\",\n    \"County\",\n    \"Congress Dist\",\n    \"Congressional Full Name\",\n    \"Rep Dist\",\n    \"Rep Full Name\",\n    \"Senate Dist\",\n    \"Senator Full Name\",\n    \"Bldg Status\",\n    \"Year Acquired\",\n    \"Year Constructed\",\n    \"Square Footage\",\n    \"Total Floors\",\n    \"Floors Above Grade\",\n    \"Floors Below Grade\",\n    \"Usage Description\",\n    \"Usage Description 2\",\n    \"Usage Description 3\"\n  ]\n}\n\nYour Job:\nI am developing a NL to Data Visualization Dataset. \nPlease help me generate natural language utterance for given dataset and constraints.\nDefinition about the Taks:\n- 'utterance' is what a user would say to make a chart.  One NL 'utterance' is in one or two sentences. Here are two examples from Others for reference:\n    I want to know how many orders there are by the quantity of the order.\n    Trend for average horsepower over time across different origin.\n- 'given dataset' is in form of column names, column type, range/unique values of the column.\n- 'constraints' are information about the chart that should be included in the utterance. \n    So we can find a reference phrase in the NL utterance that corresponds to the given constraints. \n- 'reference phrase' can be explicit, ambiguous, and by_value. 'ambiguous' means the phrase can map to more than one columns in the dataset, always a hypernym of column names(depending on the dataset values).\n    For example:\n    {\"column\": \"gdpPercap\", \"nl_ref_type\": \"explicit\", \"nl_ref_phrase\": \"GDP per capita\"},\n    {\"column\": [\"country\",\"continent\"], \"nl_ref_type\": \"ambiguous\", \"nl_ref_phrase\": \"region\"}\n    {\"column\": [\"country\",\"country_short_name\"], \"nl_ref_type\": \"ambiguous\", \"nl_ref_phrase\": \"countries\"}\n    {\"c_type\": \"mark\", \"c_name\": \"point chart\", \"nl_ref_type\": \"explicit\", \"nl_ref_phrase\": \"scatter plot\"}\n    {\"c_type\": \"mark\", \"c_name\": \"arc chart\", \"nl_ref_type\": \"explicit\", \"nl_ref_phrase\": \"pie chart\"}\n    {\"c_type\": \"transform\",\"c_name\": \"filter\",\"c_list\": [{\"field\": \"country\",\"oneOf\": [\"Iceland\",\"Norway\"]}],\"nl_ref_type\": \"explicit\",\"nl_ref_phrase\": \"for countries Iceland and Norway\"},\n    {\"c_type\": \"transform\",\"c_name\": \"filter\",\"c_list\": [{\"field\": \"country\",\"oneOf\": [\"Iceland\",\"Norway\"]}],\"nl_ref_type\": \"by_value\",\"nl_ref_phrase\": \"for Iceland and Norway\"},\n- the 'nl_ref_phrase' for 'ambiguous' columns should be equally near all ambiguous columns, not too near to one of the column since it would not be ambiguous.\n    good example: {\"column\": [\"country\",\"region\"], \"nl_ref_type\": \"ambiguous\", \"nl_ref_phrase\": \"location\"}\n    bad example: {\"column\": [\"country\",\"region\"], \"nl_ref_type\": \"ambiguous\", \"nl_ref_phrase\": \"region\"}\n- You only include given constraints and no other information. \n    For example, if a column name is not in the given constraint, it will not be included in the NL utterance.\n    Also, it a chart mark or chart encoding channel is not in the given constraint, it will not be included in the NL utterance.\n- all 'nl_ref_phrase' shoule be included in the 'nl_utterance'. \n\nThe output format is identical to the input format, but fill in the str blanks(\"...\").\n### Input:\n{\n  \"nl_utterance\": \"...\",\n  \"encoded_fields\": [\n    {\n      \"field\": \"Year Constructed\",\n      \"type\": \"quantitative\",\n      \"nl_ref_type\": \"explicit\",\n      \"nl_ref_phrase\": \"...\"\n    },\n    {\n      \"field\": \"Total Floors\",\n      \"type\": \"quantitative\",\n      \"nl_ref_type\": \"explicit\",\n      \"nl_ref_phrase\": \"...\"\n    }\n  ],\n  \"constraints\": [\n    {\n      \"c_type\": \"mark\",\n      \"c_name\": \"bar chart\",\n      \"c_list\": [\n        {\n          \"mark\": \"bar\",\n          \"encoding\": {\n            \"x\": {},\n            \"y\": {\n              \"type\": \"quantitative\"\n            },\n            \"color\": {\n              \"type\": \"nominal\",\n              \"ignore\": true\n            },\n            \"column\": {\n              \"ignore\": true,\n              \"type\": \"nominal\"\n            },\n            \"row\": {\n              \"ignore\": true,\n              \"type\": \"nominal\"\n            }\n          },\n          \"unique_map\": {\n            \"x\": \"y\"\n          }\n        },\n        {\n          \"mark\": \"bar\",\n          \"encoding\": {\n            \"y\": {},\n            \"x\": {\n              \"type\": \"quantitative\"\n            },\n            \"color\": {\n              \"type\": \"nominal\",\n              \"ignore\": true\n            },\n            \"column\": {\n              \"ignore\": true,\n              \"type\": \"nominal\"\n            },\n            \"row\": {\n              \"ignore\": true,\n              \"type\": \"nominal\"\n            }\n          },\n          \"unique_map\": {\n            \"y\": \"x\"\n          }\n        }\n      ],\n      \"nl_ref_type\": \"explicit\",\n      \"nl_ref_phrase\": \"...\"\n    }\n  ]\n}\n\n### Output:"
}