{
  "gpt_result": {
    "nl_utterance": "What is the output per worker in countries with a labour force greater than 5000?",
    "encoded_fields": [
      {
        "field": "Country",
        "type": "nominal",
        "nl_ref_type": "explicit",
        "nl_ref_phrase": "countries"
      },
      {
        "field": "Output per worker ($)",
        "type": "quantitative",
        "nl_ref_type": "explicit",
        "nl_ref_phrase": "output per worker"
      }
    ],
    "constraints": [
      {
        "c_type": "transform",
        "c_name": "filter",
        "c_list": [
          {
            "field": "Labour Force (000s)",
            "gt": 5000
          }
        ],
        "nl_ref_type": "explicit",
        "nl_ref_phrase": "with a labour force greater than 5000"
      }
    ]
  },
  "input": "Dataset Information: {\n  \"data samples\": [\n    {\n      \"ISO3\": \"AUS\",\n      \"Country\": \"Australia\",\n      \"GDP ($m)\": 1595175.273,\n      \"Labour Force (000s)\": 13738.67,\n      \"Output per worker ($)\": 116108.42046573648,\n      \"Continent\": \"Oceania\"\n    },\n    {\n      \"ISO3\": \"FIN\",\n      \"Country\": \"Finland\",\n      \"GDP ($m)\": 304172.622,\n      \"Labour Force (000s)\": 2785.225,\n      \"Output per worker ($)\": 109209.35364288343,\n      \"Continent\": \"Europe\"\n    },\n    {\n      \"ISO3\": \"SVK\",\n      \"Country\": \"Slovakia\",\n      \"GDP ($m)\": 184663.738,\n      \"Labour Force (000s)\": 2748.15,\n      \"Output per worker ($)\": 67195.6545312301,\n      \"Continent\": \"Europe\"\n    },\n    {\n      \"ISO3\": \"HUN\",\n      \"Country\": \"Hungary\",\n      \"GDP ($m)\": 356137.471,\n      \"Labour Force (000s)\": 4837.55,\n      \"Output per worker ($)\": 73619.38812001943,\n      \"Continent\": \"Europe\"\n    },\n    {\n      \"ISO3\": \"CHE\",\n      \"Country\": \"Switzerland\",\n      \"GDP ($m)\": 661115.196,\n      \"Labour Force (000s)\": 4935.925,\n      \"Output per worker ($)\": 133939.47355358925,\n      \"Continent\": \"Europe\"\n    }\n  ],\n  \"column names\": [\n    \"ISO3\",\n    \"Country\",\n    \"GDP ($m)\",\n    \"Labour Force (000s)\",\n    \"Output per worker ($)\",\n    \"Continent\"\n  ]\n}\n\nYour Job:\nI am developing a NL to Data Visualization Dataset. \nPlease help me generate natural language utterance for given dataset and constraints.\nDefinition about the Taks:\n- 'utterance' is what a user would say to make a chart. It should be a questions structure. One NL 'utterance' is in one or two sentences. Here are two examples from Questions for reference:\n    What major genre had the highest average worldwide gross?\n    How much do various cars weigh?\n- 'given dataset' is in form of column names, column type, range/unique values of the column.\n- 'constraints' are information about the chart that should be included in the utterance. \n    So we can find a reference phrase in the NL utterance that corresponds to the given constraints. \n- 'reference phrase' can be explicit, ambiguous, and by_value. 'ambiguous' means the phrase can map to more than one columns in the dataset, always a hypernym of column names(depending on the dataset values).\n    For example:\n    {\"column\": \"gdpPercap\", \"nl_ref_type\": \"explicit\", \"nl_ref_phrase\": \"GDP per capita\"},\n    {\"column\": [\"country\",\"continent\"], \"nl_ref_type\": \"ambiguous\", \"nl_ref_phrase\": \"region\"}\n    {\"column\": [\"country\",\"country_short_name\"], \"nl_ref_type\": \"ambiguous\", \"nl_ref_phrase\": \"countries\"}\n    {\"c_type\": \"mark\", \"c_name\": \"point chart\", \"nl_ref_type\": \"explicit\", \"nl_ref_phrase\": \"scatter plot\"}\n    {\"c_type\": \"mark\", \"c_name\": \"arc chart\", \"nl_ref_type\": \"explicit\", \"nl_ref_phrase\": \"pie chart\"}\n    {\"c_type\": \"transform\",\"c_name\": \"filter\",\"c_list\": [{\"field\": \"country\",\"oneOf\": [\"Iceland\",\"Norway\"]}],\"nl_ref_type\": \"explicit\",\"nl_ref_phrase\": \"for countries Iceland and Norway\"},\n    {\"c_type\": \"transform\",\"c_name\": \"filter\",\"c_list\": [{\"field\": \"country\",\"oneOf\": [\"Iceland\",\"Norway\"]}],\"nl_ref_type\": \"by_value\",\"nl_ref_phrase\": \"for Iceland and Norway\"},\n- the 'nl_ref_phrase' for 'ambiguous' columns should be equally near all ambiguous columns, not too near to one of the column since it would not be ambiguous.\n    good example: {\"column\": [\"country\",\"region\"], \"nl_ref_type\": \"ambiguous\", \"nl_ref_phrase\": \"location\"}\n    bad example: {\"column\": [\"country\",\"region\"], \"nl_ref_type\": \"ambiguous\", \"nl_ref_phrase\": \"region\"}\n- You only include given constraints and no other information. \n    For example, if a column name is not in the given constraint, it will not be included in the NL utterance.\n    Also, it a chart mark or chart encoding channel is not in the given constraint, it will not be included in the NL utterance.\n- all 'nl_ref_phrase' shoule be included in the 'nl_utterance'. \n\nThe output format is identical to the input format, but fill in the str blanks(\"...\").\n### Input:\n{\n  \"nl_utterance\": \"...\",\n  \"encoded_fields\": [\n    {\n      \"field\": \"Country\",\n      \"type\": \"nominal\",\n      \"nl_ref_type\": \"explicit\",\n      \"nl_ref_phrase\": \"...\"\n    },\n    {\n      \"field\": \"Output per worker ($)\",\n      \"type\": \"quantitative\",\n      \"nl_ref_type\": \"explicit\",\n      \"nl_ref_phrase\": \"...\"\n    }\n  ],\n  \"constraints\": [\n    {\n      \"c_type\": \"transform\",\n      \"c_name\": \"filter\",\n      \"c_list\": [\n        {\n          \"field\": \"Labour Force (000s)\",\n          \"gt\": 5000\n        }\n      ],\n      \"nl_ref_type\": \"explicit\",\n      \"nl_ref_phrase\": \"...\"\n    }\n  ]\n}\n\n### Output:"
}