{
  "gpt_result": {
    "nl_utterance": "What is the total sum of floors for buildings constructed each year?",
    "encoded_fields": [
      {
        "field": "Year Constructed",
        "type": "quantitative",
        "nl_ref_type": "explicit",
        "nl_ref_phrase": "constructed each year"
      },
      {
        "field": "Total Floors",
        "type": "quantitative",
        "nl_ref_type": "explicit",
        "nl_ref_phrase": "total floors"
      }
    ],
    "constraints": [
      {
        "c_type": "transform",
        "c_name": "aggregate",
        "c_list": [
          {
            "field": "Total Floors",
            "aggregate": "sum"
          }
        ],
        "nl_ref_type": "explicit",
        "nl_ref_phrase": "total sum of floors"
      }
    ]
  },
  "input": "Dataset Information: {\n  \"data samples\": [\n    {\n      \"Agency Name\": \"Department of Natural Resources\",\n      \"Location Name\": \"Anderson Lake Conservation Area - Fulton County\",\n      \"Address\": \"Anderson Lake C.a.\",\n      \"City\": \"Astoria\",\n      \"Zip code\": 61501,\n      \"County\": \"Fulton\",\n      \"Congress Dist\": 17,\n      \"Congressional Full Name\": \"Cheri Bustos\",\n      \"Rep Dist\": 93,\n      \"Rep Full Name\": \"Hammond Norine K.\",\n      \"Senate Dist\": 47,\n      \"Senator Full Name\": \"Jil Tracy\",\n      \"Bldg Status\": \"In Use\",\n      \"Year Acquired\": 1975,\n      \"Year Constructed\": 1975,\n      \"Square Footage\": 144,\n      \"Total Floors\": 1,\n      \"Floors Above Grade\": 1,\n      \"Floors Below Grade\": 0,\n      \"Usage Description\": \"Unusual\",\n      \"Usage Description 2\": \"Unusual\",\n      \"Usage Description 3\": \"Not provided\"\n    },\n    {\n      \"Agency Name\": \"Department of Natural Resources\",\n      \"Location Name\": \"Jubilee College State Park - Peoria County\",\n      \"Address\": \"R R 2 Box 72\",\n      \"City\": \"Brimfield\",\n      \"Zip code\": 61517,\n      \"County\": \"Peoria\",\n      \"Congress Dist\": 18,\n      \"Congressional Full Name\": \"Darin M. LaHood\",\n      \"Rep Dist\": 73,\n      \"Rep Full Name\": \"Spain Ryan\",\n      \"Senate Dist\": 37,\n      \"Senator Full Name\": \"Chuck Weaver\",\n      \"Bldg Status\": \"In Use\",\n      \"Year Acquired\": 1930,\n      \"Year Constructed\": 1930,\n      \"Square Footage\": 2704,\n      \"Total Floors\": 1,\n      \"Floors Above Grade\": 1,\n      \"Floors Below Grade\": 0,\n      \"Usage Description\": \"Storage\",\n      \"Usage Description 2\": \"Storage\",\n      \"Usage Description 3\": \"Not provided\"\n    },\n    {\n      \"Agency Name\": \"Department of State Police\",\n      \"Location Name\": \"State Armory - Springfield\",\n      \"Address\": \"124 East Adams Street\",\n      \"City\": \"Springfield\",\n      \"Zip code\": 62706,\n      \"County\": \"Sangamon\",\n      \"Congress Dist\": 13,\n      \"Congressional Full Name\": \"Rodney L. Davis\",\n      \"Rep Dist\": 96,\n      \"Rep Full Name\": \"Scherer Sue\",\n      \"Senate Dist\": 48,\n      \"Senator Full Name\": \"Andy Manar\",\n      \"Bldg Status\": \"In Use\",\n      \"Year Acquired\": 1937,\n      \"Year Constructed\": 1937,\n      \"Square Footage\": 254636,\n      \"Total Floors\": 8,\n      \"Floors Above Grade\": 7,\n      \"Floors Below Grade\": 1,\n      \"Usage Description\": \"Business\",\n      \"Usage Description 2\": \"Business\",\n      \"Usage Description 3\": \"Not provided\"\n    },\n    {\n      \"Agency Name\": \"Department of Human Services\",\n      \"Location Name\": \"Ludeman Developmental Center - Park Forest\",\n      \"Address\": \"114 North Orchard Drive\",\n      \"City\": \"Park Forest\",\n      \"Zip code\": 60466,\n      \"County\": \"Cook\",\n      \"Congress Dist\": 2,\n      \"Congressional Full Name\": \"Robin Kelly\",\n      \"Rep Dist\": 80,\n      \"Rep Full Name\": \"DeLuca Anthony\",\n      \"Senate Dist\": 40,\n      \"Senator Full Name\": \"Toi W. Hutchinson\",\n      \"Bldg Status\": \"In Use\",\n      \"Year Acquired\": 1973,\n      \"Year Constructed\": 1972,\n      \"Square Footage\": 2920,\n      \"Total Floors\": 1,\n      \"Floors Above Grade\": 1,\n      \"Floors Below Grade\": 0,\n      \"Usage Description\": \"Health Care\",\n      \"Usage Description 2\": \"Health Care\",\n      \"Usage Description 3\": \"Not provided\"\n    },\n    {\n      \"Agency Name\": \"Department of Corrections\",\n      \"Location Name\": \"Big Muddy Correctional Center - Jefferson County\",\n      \"Address\": \"Rt. 37, P. O. Box 1000\",\n      \"City\": \"Ina\",\n      \"Zip code\": 62846,\n      \"County\": \"Jefferson\",\n      \"Congress Dist\": 12,\n      \"Congressional Full Name\": \"Mike Bost\",\n      \"Rep Dist\": 115,\n      \"Rep Full Name\": \"Bryant Terri\",\n      \"Senate Dist\": 58,\n      \"Senator Full Name\": \"Paul Schimpf\",\n      \"Bldg Status\": \"In Use\",\n      \"Year Acquired\": 1992,\n      \"Year Constructed\": 1992,\n      \"Square Footage\": 7000,\n      \"Total Floors\": 1,\n      \"Floors Above Grade\": 1,\n      \"Floors Below Grade\": 0,\n      \"Usage Description\": \"Detention & Correc\",\n      \"Usage Description 2\": \"Industrial\",\n      \"Usage Description 3\": \"Not provided\"\n    }\n  ],\n  \"column names\": [\n    \"Agency Name\",\n    \"Location Name\",\n    \"Address\",\n    \"City\",\n    \"Zip code\",\n    \"County\",\n    \"Congress Dist\",\n    \"Congressional Full Name\",\n    \"Rep Dist\",\n    \"Rep Full Name\",\n    \"Senate Dist\",\n    \"Senator Full Name\",\n    \"Bldg Status\",\n    \"Year Acquired\",\n    \"Year Constructed\",\n    \"Square Footage\",\n    \"Total Floors\",\n    \"Floors Above Grade\",\n    \"Floors Below Grade\",\n    \"Usage Description\",\n    \"Usage Description 2\",\n    \"Usage Description 3\"\n  ]\n}\n\nYour Job:\nI am developing a NL to Data Visualization Dataset. \nPlease help me generate natural language utterance for given dataset and constraints.\nDefinition about the Taks:\n- 'utterance' is what a user would say to make a chart. It should be a questions structure. One NL 'utterance' is in one or two sentences. Here are two examples from Questions for reference:\n    On average, how much was earned by movies of each genre?\n    How many cars do each country manufacture?\n- 'given dataset' is in form of column names, column type, range/unique values of the column.\n- 'constraints' are information about the chart that should be included in the utterance. \n    So we can find a reference phrase in the NL utterance that corresponds to the given constraints. \n- 'reference phrase' can be explicit, ambiguous, and by_value. 'ambiguous' means the phrase can map to more than one columns in the dataset, always a hypernym of column names(depending on the dataset values).\n    For example:\n    {\"column\": \"gdpPercap\", \"nl_ref_type\": \"explicit\", \"nl_ref_phrase\": \"GDP per capita\"},\n    {\"column\": [\"country\",\"continent\"], \"nl_ref_type\": \"ambiguous\", \"nl_ref_phrase\": \"region\"}\n    {\"column\": [\"country\",\"country_short_name\"], \"nl_ref_type\": \"ambiguous\", \"nl_ref_phrase\": \"countries\"}\n    {\"c_type\": \"mark\", \"c_name\": \"point chart\", \"nl_ref_type\": \"explicit\", \"nl_ref_phrase\": \"scatter plot\"}\n    {\"c_type\": \"mark\", \"c_name\": \"arc chart\", \"nl_ref_type\": \"explicit\", \"nl_ref_phrase\": \"pie chart\"}\n    {\"c_type\": \"transform\",\"c_name\": \"filter\",\"c_list\": [{\"field\": \"country\",\"oneOf\": [\"Iceland\",\"Norway\"]}],\"nl_ref_type\": \"explicit\",\"nl_ref_phrase\": \"for countries Iceland and Norway\"},\n    {\"c_type\": \"transform\",\"c_name\": \"filter\",\"c_list\": [{\"field\": \"country\",\"oneOf\": [\"Iceland\",\"Norway\"]}],\"nl_ref_type\": \"by_value\",\"nl_ref_phrase\": \"for Iceland and Norway\"},\n- the 'nl_ref_phrase' for 'ambiguous' columns should be equally near all ambiguous columns, not too near to one of the column since it would not be ambiguous.\n    good example: {\"column\": [\"country\",\"region\"], \"nl_ref_type\": \"ambiguous\", \"nl_ref_phrase\": \"location\"}\n    bad example: {\"column\": [\"country\",\"region\"], \"nl_ref_type\": \"ambiguous\", \"nl_ref_phrase\": \"region\"}\n- You only include given constraints and no other information. \n    For example, if a column name is not in the given constraint, it will not be included in the NL utterance.\n    Also, it a chart mark or chart encoding channel is not in the given constraint, it will not be included in the NL utterance.\n- all 'nl_ref_phrase' shoule be included in the 'nl_utterance'. \n\nThe output format is identical to the input format, but fill in the str blanks(\"...\").\n### Input:\n{\n  \"nl_utterance\": \"...\",\n  \"encoded_fields\": [\n    {\n      \"field\": \"Year Constructed\",\n      \"type\": \"quantitative\",\n      \"nl_ref_type\": \"explicit\",\n      \"nl_ref_phrase\": \"...\"\n    },\n    {\n      \"field\": \"Total Floors\",\n      \"type\": \"quantitative\",\n      \"nl_ref_type\": \"explicit\",\n      \"nl_ref_phrase\": \"...\"\n    }\n  ],\n  \"constraints\": [\n    {\n      \"c_type\": \"transform\",\n      \"c_name\": \"aggregate\",\n      \"c_list\": [\n        {\n          \"field\": \"Total Floors\",\n          \"aggregate\": \"sum\"\n        }\n      ],\n      \"nl_ref_type\": \"explicit\",\n      \"nl_ref_phrase\": \"...\"\n    }\n  ]\n}\n\n### Output:"
}