{
  "gpt_result": {
    "nl_utterance": "Create a scatter plot to examine the correlation between the Gender Inequality Index and Women's Points, with the population in 2021 represented as the size of the circles.",
    "encoded_fields": [
      {
        "field": "Gender Inequality Index",
        "type": "quantitative",
        "nl_ref_type": "explicit",
        "nl_ref_phrase": "Gender Inequality Index"
      },
      {
        "field": "Womens Points",
        "type": "quantitative",
        "nl_ref_type": "explicit",
        "nl_ref_phrase": "Women's Points"
      },
      {
        "field": "YR2021",
        "type": "quantitative",
        "nl_ref_type": "explicit",
        "nl_ref_phrase": "population in 2021"
      }
    ],
    "constraints": [
      {
        "c_type": "task",
        "c_name": "correlation",
        "c_list": [
          {
            "mark": "circle",
            "encoding": {
              "x": {
                "type": "quantitative"
              },
              "y": {
                "type": "quantitative"
              }
            }
          }
        ],
        "nl_ref_type": "explicit",
        "nl_ref_phrase": "scatter plot"
      }
    ]
  },
  "input": "Dataset Information: {\n  \"data samples\": [\n    {\n      \"Country Name\": \"Albania\",\n      \"Mens Points\": 1361.81,\n      \"Womens Points\": 1346.01,\n      \"Alpha-3 code\": \"ALB\",\n      \"Percentage Difference\": 1.1602205887752297,\n      \"Gender Inequality Index\": 0.144,\n      \"Country\": \"Albania\",\n      \"YR2021\": 2811666.0\n    },\n    {\n      \"Country Name\": \"Tonga\",\n      \"Mens Points\": 861.81,\n      \"Womens Points\": 1221.48,\n      \"Alpha-3 code\": \"TON\",\n      \"Percentage Difference\": -41.73425697079404,\n      \"Gender Inequality Index\": 0.631,\n      \"Country\": \"Tonga\",\n      \"YR2021\": 106759.0\n    },\n    {\n      \"Country Name\": \"South Africa\",\n      \"Mens Points\": 1350.55,\n      \"Womens Points\": 1464.36,\n      \"Alpha-3 code\": \"ZAF\",\n      \"Percentage Difference\": -8.426937173744028,\n      \"Gender Inequality Index\": 0.405,\n      \"Country\": \"South Africa\",\n      \"YR2021\": 60041996.0\n    },\n    {\n      \"Country Name\": \"China PR\",\n      \"Mens Points\": 1305.06,\n      \"Womens Points\": 1862.87,\n      \"Alpha-3 code\": \"CHN\",\n      \"Percentage Difference\": -42.74209614883607,\n      \"Gender Inequality Index\": 0.192,\n      \"Country\": \"China\",\n      \"YR2021\": 1412360000.0\n    },\n    {\n      \"Country Name\": \"Ghana\",\n      \"Mens Points\": 1393.47,\n      \"Womens Points\": 1416.77,\n      \"Alpha-3 code\": \"GHA\",\n      \"Percentage Difference\": -1.672084795510485,\n      \"Gender Inequality Index\": 0.529,\n      \"Country\": \"Ghana\",\n      \"YR2021\": 31732128.0\n    }\n  ],\n  \"column names\": [\n    \"Country Name\",\n    \"Mens Points\",\n    \"Womens Points\",\n    \"Alpha-3 code\",\n    \"Percentage Difference\",\n    \"Gender Inequality Index\",\n    \"Country\",\n    \"YR2021\"\n  ]\n}\n\nYour Job:\nI am developing a NL to Data Visualization Dataset. \nPlease help me generate natural language utterance for given dataset and constraints.\nDefinition about the Taks:\n- 'utterance' is what a user would say to make a chart.  One NL 'utterance' is in one or two sentences. Here are two examples from Others for reference:\n    scatter(x=production budget, y=worldwide gross) for content rating.\n    I want to know how many orders there are by the quantity of the order.\n- 'given dataset' is in form of column names, column type, range/unique values of the column.\n- 'constraints' are information about the chart that should be included in the utterance. \n    So we can find a reference phrase in the NL utterance that corresponds to the given constraints. \n- 'reference phrase' can be explicit, ambiguous, and by_value. 'ambiguous' means the phrase can map to more than one columns in the dataset, always a hypernym of column names(depending on the dataset values).\n    For example:\n    {\"column\": \"gdpPercap\", \"nl_ref_type\": \"explicit\", \"nl_ref_phrase\": \"GDP per capita\"},\n    {\"column\": [\"country\",\"continent\"], \"nl_ref_type\": \"ambiguous\", \"nl_ref_phrase\": \"region\"}\n    {\"column\": [\"country\",\"country_short_name\"], \"nl_ref_type\": \"ambiguous\", \"nl_ref_phrase\": \"countries\"}\n    {\"c_type\": \"mark\", \"c_name\": \"point chart\", \"nl_ref_type\": \"explicit\", \"nl_ref_phrase\": \"scatter plot\"}\n    {\"c_type\": \"mark\", \"c_name\": \"arc chart\", \"nl_ref_type\": \"explicit\", \"nl_ref_phrase\": \"pie chart\"}\n    {\"c_type\": \"transform\",\"c_name\": \"filter\",\"c_list\": [{\"field\": \"country\",\"oneOf\": [\"Iceland\",\"Norway\"]}],\"nl_ref_type\": \"explicit\",\"nl_ref_phrase\": \"for countries Iceland and Norway\"},\n    {\"c_type\": \"transform\",\"c_name\": \"filter\",\"c_list\": [{\"field\": \"country\",\"oneOf\": [\"Iceland\",\"Norway\"]}],\"nl_ref_type\": \"by_value\",\"nl_ref_phrase\": \"for Iceland and Norway\"},\n- the 'nl_ref_phrase' for 'ambiguous' columns should be equally near all ambiguous columns, not too near to one of the column since it would not be ambiguous.\n    good example: {\"column\": [\"country\",\"region\"], \"nl_ref_type\": \"ambiguous\", \"nl_ref_phrase\": \"location\"}\n    bad example: {\"column\": [\"country\",\"region\"], \"nl_ref_type\": \"ambiguous\", \"nl_ref_phrase\": \"region\"}\n- You only include given constraints and no other information. \n    For example, if a column name is not in the given constraint, it will not be included in the NL utterance.\n    Also, it a chart mark or chart encoding channel is not in the given constraint, it will not be included in the NL utterance.\n- all 'nl_ref_phrase' shoule be included in the 'nl_utterance'. \n\nThe output format is identical to the input format, but fill in the str blanks(\"...\").\n### Input:\n{\n  \"nl_utterance\": \"...\",\n  \"encoded_fields\": [\n    {\n      \"field\": \"Gender Inequality Index\",\n      \"type\": \"quantitative\",\n      \"nl_ref_type\": \"explicit\",\n      \"nl_ref_phrase\": \"...\"\n    },\n    {\n      \"field\": \"Womens Points\",\n      \"type\": \"quantitative\",\n      \"nl_ref_type\": \"explicit\",\n      \"nl_ref_phrase\": \"...\"\n    },\n    {\n      \"field\": \"YR2021\",\n      \"type\": \"quantitative\",\n      \"nl_ref_type\": \"explicit\",\n      \"nl_ref_phrase\": \"...\"\n    }\n  ],\n  \"constraints\": [\n    {\n      \"c_type\": \"task\",\n      \"c_name\": \"correlation\",\n      \"c_list\": [\n        {\n          \"mark\": \"circle\",\n          \"encoding\": {\n            \"x\": {\n              \"type\": \"quantitative\"\n            },\n            \"y\": {\n              \"type\": \"quantitative\"\n            }\n          }\n        }\n      ],\n      \"nl_ref_type\": \"explicit\",\n      \"nl_ref_phrase\": \"...\"\n    }\n  ]\n}\n\n### Output:"
}