{
  "gpt_result": {
    "nl_utterance": "Show a scatter plot to find the correlation between median income and firearm deaths, with different colors for geographic divisions and varying point sizes and column arrangements based on prison rate.",
    "encoded_fields": [
      {
        "field": "medIncome",
        "type": "quantitative",
        "nl_ref_type": "explicit",
        "nl_ref_phrase": "median income"
      },
      {
        "field": "FirearmDeaths",
        "type": "quantitative",
        "nl_ref_type": "explicit",
        "nl_ref_phrase": "firearm deaths"
      },
      {
        "field": "GeographicDivision",
        "type": "nominal",
        "nl_ref_type": "explicit",
        "nl_ref_phrase": "geographic divisions"
      },
      {
        "field": "PrisonRate",
        "type": "quantitative",
        "nl_ref_type": "explicit",
        "nl_ref_phrase": "prison rate"
      }
    ],
    "constraints": [
      {
        "c_type": "task",
        "c_name": "correlation",
        "c_list": [
          {
            "mark": "circle",
            "encoding": {
              "x": {
                "type": "quantitative"
              },
              "y": {
                "type": "quantitative"
              }
            }
          }
        ],
        "nl_ref_type": "explicit",
        "nl_ref_phrase": "correlation"
      },
      {
        "c_type": "mark",
        "c_name": "point chart",
        "c_list": [
          {
            "mark": "circle",
            "encoding": {
              "x": {},
              "y": {},
              "color": {
                "type": "nominal",
                "ignore": true
              },
              "size": {
                "ignore": true,
                "type": "quantitative"
              },
              "column": {
                "ignore": true,
                "type": "nominal"
              },
              "row": {
                "ignore": true,
                "type": "nominal"
              }
            }
          }
        ],
        "nl_ref_type": "explicit",
        "nl_ref_phrase": "scatter plot"
      }
    ]
  },
  "input": "Dataset Information: {\n  \"data samples\": [\n    {\n      \"State\": \"Alabama\",\n      \"StateInitials\": \"AL\",\n      \"Gini\": 0.472,\n      \"DeathRate\": 21.5,\n      \"Firearms_vs_avg\": 1.64700475,\n      \"medIncome\": 47221,\n      \"Income_vs_med\": 0.799827233,\n      \"ImprisonmentRate\": 736,\n      \"PrisonRate\": 1.264604811,\n      \"ImprisonmentRate.1\": 0.736,\n      \"FirearmDeaths\": 0.215,\n      \"GeographicDivision\": \"South\"\n    },\n    {\n      \"State\": \"Rhode Island\",\n      \"StateInitials\": \"RI\",\n      \"Gini\": 0.467,\n      \"DeathRate\": 4.1,\n      \"Firearms_vs_avg\": 0.314079975,\n      \"medIncome\": 61528,\n      \"Income_vs_med\": 1.042158573,\n      \"ImprisonmentRate\": 239,\n      \"PrisonRate\": 0.410652921,\n      \"ImprisonmentRate.1\": 0.239,\n      \"FirearmDeaths\": 0.041,\n      \"GeographicDivision\": \"Northeast\"\n    },\n    {\n      \"State\": \"Washington\",\n      \"StateInitials\": \"WA\",\n      \"Gini\": 0.441,\n      \"DeathRate\": 9.0,\n      \"Firearms_vs_avg\": 0.689443849,\n      \"medIncome\": 70310,\n      \"Income_vs_med\": 1.190907705,\n      \"ImprisonmentRate\": 333,\n      \"PrisonRate\": 0.572164948,\n      \"ImprisonmentRate.1\": 0.333,\n      \"FirearmDeaths\": 0.09,\n      \"GeographicDivision\": \"West\"\n    },\n    {\n      \"State\": \"Nebraska\",\n      \"StateInitials\": \"NE\",\n      \"Gini\": 0.432,\n      \"DeathRate\": 9.1,\n      \"Firearms_vs_avg\": 0.697104336,\n      \"medIncome\": 59374,\n      \"Income_vs_med\": 1.005674215,\n      \"ImprisonmentRate\": 364,\n      \"PrisonRate\": 0.625429553,\n      \"ImprisonmentRate.1\": 0.364,\n      \"FirearmDeaths\": 0.091,\n      \"GeographicDivision\": \"Midwest\"\n    },\n    {\n      \"State\": \"Idaho\",\n      \"StateInitials\": \"ID\",\n      \"Gini\": 0.433,\n      \"DeathRate\": 14.6,\n      \"Firearms_vs_avg\": 1.118431132,\n      \"medIncome\": 56564,\n      \"Income_vs_med\": 0.958078558,\n      \"ImprisonmentRate\": 587,\n      \"PrisonRate\": 1.008591065,\n      \"ImprisonmentRate.1\": 0.587,\n      \"FirearmDeaths\": 0.146,\n      \"GeographicDivision\": \"West\"\n    }\n  ],\n  \"column names\": [\n    \"State\",\n    \"StateInitials\",\n    \"Gini\",\n    \"DeathRate\",\n    \"Firearms_vs_avg\",\n    \"medIncome\",\n    \"Income_vs_med\",\n    \"ImprisonmentRate\",\n    \"PrisonRate\",\n    \"ImprisonmentRate.1\",\n    \"FirearmDeaths\",\n    \"GeographicDivision\"\n  ]\n}\n\nYour Job:\nI am developing a NL to Data Visualization Dataset. \nPlease help me generate natural language utterance for given dataset and constraints.\nDefinition about the Taks:\n- 'utterance' is what a user would say to make a chart.  One NL 'utterance' is in one or two sentences. Here are two examples from Others for reference:\n    I want to know how many orders there are by the quantity of the order.\n    Trend for average horsepower over time across different origin.\n- 'given dataset' is in form of column names, column type, range/unique values of the column.\n- 'constraints' are information about the chart that should be included in the utterance. \n    So we can find a reference phrase in the NL utterance that corresponds to the given constraints. \n- 'reference phrase' can be explicit, ambiguous, and by_value. 'ambiguous' means the phrase can map to more than one columns in the dataset, always a hypernym of column names(depending on the dataset values).\n    For example:\n    {\"column\": \"gdpPercap\", \"nl_ref_type\": \"explicit\", \"nl_ref_phrase\": \"GDP per capita\"},\n    {\"column\": [\"country\",\"continent\"], \"nl_ref_type\": \"ambiguous\", \"nl_ref_phrase\": \"region\"}\n    {\"column\": [\"country\",\"country_short_name\"], \"nl_ref_type\": \"ambiguous\", \"nl_ref_phrase\": \"countries\"}\n    {\"c_type\": \"mark\", \"c_name\": \"point chart\", \"nl_ref_type\": \"explicit\", \"nl_ref_phrase\": \"scatter plot\"}\n    {\"c_type\": \"mark\", \"c_name\": \"arc chart\", \"nl_ref_type\": \"explicit\", \"nl_ref_phrase\": \"pie chart\"}\n    {\"c_type\": \"transform\",\"c_name\": \"filter\",\"c_list\": [{\"field\": \"country\",\"oneOf\": [\"Iceland\",\"Norway\"]}],\"nl_ref_type\": \"explicit\",\"nl_ref_phrase\": \"for countries Iceland and Norway\"},\n    {\"c_type\": \"transform\",\"c_name\": \"filter\",\"c_list\": [{\"field\": \"country\",\"oneOf\": [\"Iceland\",\"Norway\"]}],\"nl_ref_type\": \"by_value\",\"nl_ref_phrase\": \"for Iceland and Norway\"},\n- the 'nl_ref_phrase' for 'ambiguous' columns should be equally near all ambiguous columns, not too near to one of the column since it would not be ambiguous.\n    good example: {\"column\": [\"country\",\"region\"], \"nl_ref_type\": \"ambiguous\", \"nl_ref_phrase\": \"location\"}\n    bad example: {\"column\": [\"country\",\"region\"], \"nl_ref_type\": \"ambiguous\", \"nl_ref_phrase\": \"region\"}\n- You only include given constraints and no other information. \n    For example, if a column name is not in the given constraint, it will not be included in the NL utterance.\n    Also, it a chart mark or chart encoding channel is not in the given constraint, it will not be included in the NL utterance.\n- all 'nl_ref_phrase' shoule be included in the 'nl_utterance'. \n\nThe output format is identical to the input format, but fill in the str blanks(\"...\").\n### Input:\n{\n  \"nl_utterance\": \"...\",\n  \"encoded_fields\": [\n    {\n      \"field\": \"medIncome\",\n      \"type\": \"quantitative\",\n      \"nl_ref_type\": \"explicit\",\n      \"nl_ref_phrase\": \"...\"\n    },\n    {\n      \"field\": \"FirearmDeaths\",\n      \"type\": \"quantitative\",\n      \"nl_ref_type\": \"explicit\",\n      \"nl_ref_phrase\": \"...\"\n    },\n    {\n      \"field\": \"GeographicDivision\",\n      \"type\": \"nominal\",\n      \"nl_ref_type\": \"explicit\",\n      \"nl_ref_phrase\": \"...\"\n    },\n    {\n      \"field\": \"PrisonRate\",\n      \"type\": \"quantitative\",\n      \"nl_ref_type\": \"explicit\",\n      \"nl_ref_phrase\": \"...\"\n    }\n  ],\n  \"constraints\": [\n    {\n      \"c_type\": \"task\",\n      \"c_name\": \"correlation\",\n      \"c_list\": [\n        {\n          \"mark\": \"circle\",\n          \"encoding\": {\n            \"x\": {\n              \"type\": \"quantitative\"\n            },\n            \"y\": {\n              \"type\": \"quantitative\"\n            }\n          }\n        }\n      ],\n      \"nl_ref_type\": \"explicit\",\n      \"nl_ref_phrase\": \"...\"\n    },\n    {\n      \"c_type\": \"mark\",\n      \"c_name\": \"point chart\",\n      \"c_list\": [\n        {\n          \"mark\": \"circle\",\n          \"encoding\": {\n            \"x\": {},\n            \"y\": {},\n            \"color\": {\n              \"type\": \"nominal\",\n              \"ignore\": true\n            },\n            \"size\": {\n              \"ignore\": true,\n              \"type\": \"quantitative\"\n            },\n            \"column\": {\n              \"ignore\": true,\n              \"type\": \"nominal\"\n            },\n            \"row\": {\n              \"ignore\": true,\n              \"type\": \"nominal\"\n            }\n          }\n        }\n      ],\n      \"nl_ref_type\": \"explicit\",\n      \"nl_ref_phrase\": \"...\"\n    }\n  ]\n}\n\n### Output:"
}