{
  "gpt_result": {
    "nl_utterance": "Draw a line chart showing the trend of temperature metrics over the month.",
    "encoded_fields": [
      {
        "field": "Month",
        "type": "temporal",
        "nl_ref_type": "explicit",
        "nl_ref_phrase": "month"
      },
      {
        "field": [
          "TNN",
          "TNM",
          "TMM",
          "TXM",
          "TXX"
        ],
        "type": "quantitative",
        "nl_ref_type": "ambiguous",
        "nl_ref_phrase": "temperature metrics"
      }
    ],
    "constraints": [
      {
        "c_type": "task",
        "c_name": "trend",
        "c_list": [
          {
            "mark": [
              "bar",
              "line",
              "area"
            ],
            "encoding": {
              "x": {
                "type": "temporal"
              }
            }
          }
        ],
        "nl_ref_type": "explicit",
        "nl_ref_phrase": "trend"
      }
    ]
  },
  "input": "Dataset Information: {\n  \"data samples\": [\n    {\n      \"STAT\": 10379,\n      \"JJJJMM\": 201808,\n      \"QN\": 3,\n      \"TNN\": 9.3,\n      \"TNM\": 15.5,\n      \"TMM\": 21.4,\n      \"TXM\": 28.0,\n      \"TXX\": 37.8,\n      \"SOS\": 280.5,\n      \"NMM\": 4.1,\n      \"RSS\": 10.1,\n      \"RSX\": 3.8,\n      \"FMM\": 2.7,\n      \"FXX\": 16.4,\n      \"Month\": \"2018-08-01T00:00:00\"\n    },\n    {\n      \"STAT\": 10379,\n      \"JJJJMM\": 201904,\n      \"QN\": 3,\n      \"TNN\": -1.1,\n      \"TNM\": 5.0,\n      \"TMM\": 11.1,\n      \"TXM\": 17.7,\n      \"TXX\": 26.0,\n      \"SOS\": 276.8,\n      \"NMM\": 3.5,\n      \"RSS\": 11.5,\n      \"RSX\": 3.7,\n      \"FMM\": 2.9,\n      \"FXX\": 18.7,\n      \"Month\": \"2019-04-01T00:00:00\"\n    },\n    {\n      \"STAT\": 10379,\n      \"JJJJMM\": 201811,\n      \"QN\": 3,\n      \"TNN\": -3.4,\n      \"TNM\": 2.6,\n      \"TMM\": 5.2,\n      \"TXM\": 8.2,\n      \"TXX\": 17.9,\n      \"SOS\": 68.4,\n      \"NMM\": 6.0,\n      \"RSS\": 15.4,\n      \"RSX\": 9.9,\n      \"FMM\": 2.8,\n      \"FXX\": 15.8,\n      \"Month\": \"2018-11-01T00:00:00\"\n    },\n    {\n      \"STAT\": 10379,\n      \"JJJJMM\": 201810,\n      \"QN\": 3,\n      \"TNN\": 2.4,\n      \"TNM\": 6.6,\n      \"TMM\": 11.2,\n      \"TXM\": 16.2,\n      \"TXX\": 25.6,\n      \"SOS\": 168.5,\n      \"NMM\": 4.5,\n      \"RSS\": 12.5,\n      \"RSX\": 6.2,\n      \"FMM\": 3.0,\n      \"FXX\": 21.3,\n      \"Month\": \"2018-10-01T00:00:00\"\n    },\n    {\n      \"STAT\": 10379,\n      \"JJJJMM\": 201812,\n      \"QN\": 3,\n      \"TNN\": -2.1,\n      \"TNM\": 2.1,\n      \"TMM\": 4.2,\n      \"TXM\": 6.4,\n      \"TXX\": 12.9,\n      \"SOS\": 19.6,\n      \"NMM\": 7.1,\n      \"RSS\": 38.0,\n      \"RSX\": 6.5,\n      \"FMM\": 3.2,\n      \"FXX\": 21.0,\n      \"Month\": \"2018-12-01T00:00:00\"\n    }\n  ],\n  \"column names\": [\n    \"STAT\",\n    \"JJJJMM\",\n    \"QN\",\n    \"TNN\",\n    \"TNM\",\n    \"TMM\",\n    \"TXM\",\n    \"TXX\",\n    \"SOS\",\n    \"NMM\",\n    \"RSS\",\n    \"RSX\",\n    \"FMM\",\n    \"FXX\",\n    \"Month\"\n  ]\n}\n\nYour Job:\nI am developing a NL to Data Visualization Dataset. \nPlease help me generate natural language utterance for given dataset and constraints.\nDefinition about the Taks:\n- 'utterance' is what a user would say to make a chart. It should be a commands structure. One NL 'utterance' is in one or two sentences. Here are two examples from Commands for reference:\n    Sort creative types by number of movies.\n    Draw a line chart of daily sales forecasts.\n- 'given dataset' is in form of column names, column type, range/unique values of the column.\n- 'constraints' are information about the chart that should be included in the utterance. \n    So we can find a reference phrase in the NL utterance that corresponds to the given constraints. \n- 'reference phrase' can be explicit, ambiguous, and by_value. 'ambiguous' means the phrase can map to more than one columns in the dataset, always a hypernym of column names(depending on the dataset values).\n    For example:\n    {\"column\": \"gdpPercap\", \"nl_ref_type\": \"explicit\", \"nl_ref_phrase\": \"GDP per capita\"},\n    {\"column\": [\"country\",\"continent\"], \"nl_ref_type\": \"ambiguous\", \"nl_ref_phrase\": \"region\"}\n    {\"column\": [\"country\",\"country_short_name\"], \"nl_ref_type\": \"ambiguous\", \"nl_ref_phrase\": \"countries\"}\n    {\"c_type\": \"mark\", \"c_name\": \"point chart\", \"nl_ref_type\": \"explicit\", \"nl_ref_phrase\": \"scatter plot\"}\n    {\"c_type\": \"mark\", \"c_name\": \"arc chart\", \"nl_ref_type\": \"explicit\", \"nl_ref_phrase\": \"pie chart\"}\n    {\"c_type\": \"transform\",\"c_name\": \"filter\",\"c_list\": [{\"field\": \"country\",\"oneOf\": [\"Iceland\",\"Norway\"]}],\"nl_ref_type\": \"explicit\",\"nl_ref_phrase\": \"for countries Iceland and Norway\"},\n    {\"c_type\": \"transform\",\"c_name\": \"filter\",\"c_list\": [{\"field\": \"country\",\"oneOf\": [\"Iceland\",\"Norway\"]}],\"nl_ref_type\": \"by_value\",\"nl_ref_phrase\": \"for Iceland and Norway\"},\n- the 'nl_ref_phrase' for 'ambiguous' columns should be equally near all ambiguous columns, not too near to one of the column since it would not be ambiguous.\n    good example: {\"column\": [\"country\",\"region\"], \"nl_ref_type\": \"ambiguous\", \"nl_ref_phrase\": \"location\"}\n    bad example: {\"column\": [\"country\",\"region\"], \"nl_ref_type\": \"ambiguous\", \"nl_ref_phrase\": \"region\"}\n- You only include given constraints and no other information. \n    For example, if a column name is not in the given constraint, it will not be included in the NL utterance.\n    Also, it a chart mark or chart encoding channel is not in the given constraint, it will not be included in the NL utterance.\n- all 'nl_ref_phrase' shoule be included in the 'nl_utterance'. \n\nThe output format is identical to the input format, but fill in the str blanks(\"...\").\n### Input:\n{\n  \"nl_utterance\": \"...\",\n  \"encoded_fields\": [\n    {\n      \"field\": \"Month\",\n      \"type\": \"temporal\",\n      \"nl_ref_type\": \"explicit\",\n      \"nl_ref_phrase\": \"...\"\n    },\n    {\n      \"field\": [\n        \"TNN\",\n        \"TNM\",\n        \"TMM\",\n        \"TXM\",\n        \"TXX\"\n      ],\n      \"type\": \"quantitative\",\n      \"nl_ref_type\": \"ambiguous\",\n      \"nl_ref_phrase\": \"...\"\n    }\n  ],\n  \"constraints\": [\n    {\n      \"c_type\": \"task\",\n      \"c_name\": \"trend\",\n      \"c_list\": [\n        {\n          \"mark\": [\n            \"bar\",\n            \"line\",\n            \"area\"\n          ],\n          \"encoding\": {\n            \"x\": {\n              \"type\": \"temporal\"\n            }\n          }\n        }\n      ],\n      \"nl_ref_type\": \"explicit\",\n      \"nl_ref_phrase\": \"...\"\n    }\n  ]\n}\n\n### Output:"
}