{
  "gpt_result": {
    "nl_utterance": "Scatter plot showing the correlation between various deprivation metrics and male life expectancy.",
    "encoded_fields": [
      {
        "field": [
          "incomeDeprevation",
          "employmentDeprivation",
          "childPoverty"
        ],
        "type": "quantitative",
        "nl_ref_type": "ambiguous",
        "nl_ref_phrase": "various deprivation metrics"
      },
      {
        "field": "maleLE",
        "type": "quantitative",
        "nl_ref_type": "explicit",
        "nl_ref_phrase": "male life expectancy"
      }
    ],
    "constraints": [
      {
        "c_type": "task",
        "c_name": "correlation",
        "c_list": [
          {
            "mark": "circle",
            "encoding": {
              "x": {
                "type": "quantitative"
              },
              "y": {
                "type": "quantitative"
              }
            }
          }
        ],
        "nl_ref_type": "explicit",
        "nl_ref_phrase": "correlation"
      }
    ]
  },
  "input": "Dataset Information: {\n  \"data samples\": [\n    {\n      \"areaName\": \"Anniesland, Jordanhill and Whiteinch\",\n      \"incomeDeprevation\": 0.14,\n      \"employmentDeprivation\": 0.15,\n      \"childPoverty\": 0.14,\n      \"femaleLE\": 80.8,\n      \"maleLE\": 75.8,\n      \"disabilityRate\": 0.19\n    },\n    {\n      \"areaName\": \"Glasgow\",\n      \"incomeDeprevation\": 0.21,\n      \"employmentDeprivation\": 0.19,\n      \"childPoverty\": 0.32,\n      \"femaleLE\": 78.2,\n      \"maleLE\": 72.3,\n      \"disabilityRate\": 0.23\n    },\n    {\n      \"areaName\": \"Sighthill, Roystonhill and Germiston\",\n      \"incomeDeprevation\": 0.32,\n      \"employmentDeprivation\": 0.29,\n      \"childPoverty\": 0.49,\n      \"femaleLE\": 74.2,\n      \"maleLE\": 69.9,\n      \"disabilityRate\": 0.24\n    },\n    {\n      \"areaName\": \"Broomhill and Partick West\",\n      \"incomeDeprevation\": 0.12,\n      \"employmentDeprivation\": 0.11,\n      \"childPoverty\": 0.19,\n      \"femaleLE\": 79.7,\n      \"maleLE\": 75.4,\n      \"disabilityRate\": 0.17\n    },\n    {\n      \"areaName\": \"Blackhill and Hogganfield\",\n      \"incomeDeprevation\": 0.24,\n      \"employmentDeprivation\": 0.23,\n      \"childPoverty\": 0.33,\n      \"femaleLE\": 77.5,\n      \"maleLE\": 75.0,\n      \"disabilityRate\": 0.25\n    }\n  ],\n  \"column names\": [\n    \"areaName\",\n    \"incomeDeprevation\",\n    \"employmentDeprivation\",\n    \"childPoverty\",\n    \"femaleLE\",\n    \"maleLE\",\n    \"disabilityRate\"\n  ]\n}\n\nYour Job:\nI am developing a NL to Data Visualization Dataset. \nPlease help me generate natural language utterance for given dataset and constraints.\nDefinition about the Taks:\n- 'utterance' is what a user would say to make a chart.  One NL 'utterance' is in one or two sentences. Here are two examples from Others for reference:\n    Trend for average horsepower over time across different origin.\n    scatter(x=production budget, y=worldwide gross) for content rating.\n- 'given dataset' is in form of column names, column type, range/unique values of the column.\n- 'constraints' are information about the chart that should be included in the utterance. \n    So we can find a reference phrase in the NL utterance that corresponds to the given constraints. \n- 'reference phrase' can be explicit, ambiguous, and by_value. 'ambiguous' means the phrase can map to more than one columns in the dataset, always a hypernym of column names(depending on the dataset values).\n    For example:\n    {\"column\": \"gdpPercap\", \"nl_ref_type\": \"explicit\", \"nl_ref_phrase\": \"GDP per capita\"},\n    {\"column\": [\"country\",\"continent\"], \"nl_ref_type\": \"ambiguous\", \"nl_ref_phrase\": \"region\"}\n    {\"column\": [\"country\",\"country_short_name\"], \"nl_ref_type\": \"ambiguous\", \"nl_ref_phrase\": \"countries\"}\n    {\"c_type\": \"mark\", \"c_name\": \"point chart\", \"nl_ref_type\": \"explicit\", \"nl_ref_phrase\": \"scatter plot\"}\n    {\"c_type\": \"mark\", \"c_name\": \"arc chart\", \"nl_ref_type\": \"explicit\", \"nl_ref_phrase\": \"pie chart\"}\n    {\"c_type\": \"transform\",\"c_name\": \"filter\",\"c_list\": [{\"field\": \"country\",\"oneOf\": [\"Iceland\",\"Norway\"]}],\"nl_ref_type\": \"explicit\",\"nl_ref_phrase\": \"for countries Iceland and Norway\"},\n    {\"c_type\": \"transform\",\"c_name\": \"filter\",\"c_list\": [{\"field\": \"country\",\"oneOf\": [\"Iceland\",\"Norway\"]}],\"nl_ref_type\": \"by_value\",\"nl_ref_phrase\": \"for Iceland and Norway\"},\n- the 'nl_ref_phrase' for 'ambiguous' columns should be equally near all ambiguous columns, not too near to one of the column since it would not be ambiguous.\n    good example: {\"column\": [\"country\",\"region\"], \"nl_ref_type\": \"ambiguous\", \"nl_ref_phrase\": \"location\"}\n    bad example: {\"column\": [\"country\",\"region\"], \"nl_ref_type\": \"ambiguous\", \"nl_ref_phrase\": \"region\"}\n- You only include given constraints and no other information. \n    For example, if a column name is not in the given constraint, it will not be included in the NL utterance.\n    Also, it a chart mark or chart encoding channel is not in the given constraint, it will not be included in the NL utterance.\n- all 'nl_ref_phrase' shoule be included in the 'nl_utterance'. \n\nThe output format is identical to the input format, but fill in the str blanks(\"...\").\n### Input:\n{\n  \"nl_utterance\": \"...\",\n  \"encoded_fields\": [\n    {\n      \"field\": [\n        \"incomeDeprevation\",\n        \"employmentDeprivation\",\n        \"childPoverty\"\n      ],\n      \"type\": \"quantitative\",\n      \"nl_ref_type\": \"ambiguous\",\n      \"nl_ref_phrase\": \"...\"\n    },\n    {\n      \"field\": \"maleLE\",\n      \"type\": \"quantitative\",\n      \"nl_ref_type\": \"explicit\",\n      \"nl_ref_phrase\": \"...\"\n    }\n  ],\n  \"constraints\": [\n    {\n      \"c_type\": \"task\",\n      \"c_name\": \"correlation\",\n      \"c_list\": [\n        {\n          \"mark\": \"circle\",\n          \"encoding\": {\n            \"x\": {\n              \"type\": \"quantitative\"\n            },\n            \"y\": {\n              \"type\": \"quantitative\"\n            }\n          }\n        }\n      ],\n      \"nl_ref_type\": \"explicit\",\n      \"nl_ref_phrase\": \"...\"\n    }\n  ]\n}\n\n### Output:"
}