{
  "gpt_result": {
    "nl_utterance": "What is the average profit for each state?",
    "encoded_fields": [
      {
        "field": "State",
        "type": "nominal",
        "nl_ref_type": "explicit",
        "nl_ref_phrase": "state"
      }
    ],
    "constraints": [
      {
        "c_type": "transform",
        "c_name": "aggregate",
        "c_list": [
          {
            "field": "Profit",
            "aggregate": "mean"
          }
        ],
        "nl_ref_type": "explicit",
        "nl_ref_phrase": "average profit"
      }
    ]
  },
  "input": "Dataset Information: {\n  \"data samples\": [\n    {\n      \"Days to Ship Actual\": 6,\n      \"Sales Forecast\": 293,\n      \"Ship Status\": \"Shipped On Time\",\n      \"Days to Ship Scheduled\": 6,\n      \"Sales per Customer\": \"$209.30 \",\n      \"Profit Ratio\": \"27.00%\",\n      \"Category\": \"Office Supplies\",\n      \"City\": \"Columbus\",\n      \"Country\": \"United States\",\n      \"Customer Name\": \"Chuck Clark\",\n      \"Days to Ship Actual (bin)\": 5,\n      \"Discount\": 0,\n      \"Number of Records\": 1,\n      \"Order Date\": \"12/30/2017\",\n      \"Order ID\": \"CA-2017-126221\",\n      \"Postal Code\": 47201,\n      \"Product Name\": \"Eureka The Boss Plus 12-Amp Hard Box Upright Vacuum, Red\",\n      \"Profit\": 56.511,\n      \"Quantity\": 2,\n      \"Region\": \"Central\",\n      \"Sales (bin)\": \"$0 \",\n      \"Sales\": 209.3,\n      \"Segment\": \"Home Office\",\n      \"Ship Date\": \"1/5/2018\",\n      \"Ship Mode\": \"Standard Class\",\n      \"State\": \"Indiana\",\n      \"Sub-Category\": \"Appliances\"\n    },\n    {\n      \"Days to Ship Actual\": 6,\n      \"Sales Forecast\": 1310,\n      \"Ship Status\": \"Shipped On Time\",\n      \"Days to Ship Scheduled\": 6,\n      \"Sales per Customer\": \"$934.96 \",\n      \"Profit Ratio\": \"-26.70%\",\n      \"Category\": \"Furniture\",\n      \"City\": \"Jackson\",\n      \"Country\": \"United States\",\n      \"Customer Name\": \"Jack Lebron\",\n      \"Days to Ship Actual (bin)\": 5,\n      \"Discount\": 40,\n      \"Number of Records\": 1,\n      \"Order Date\": \"12/22/2017\",\n      \"Order ID\": \"CA-2017-150910\",\n      \"Postal Code\": 38301,\n      \"Product Name\": \"Bevis Round Bullnose 29\\\" High Table Top\",\n      \"Profit\": -249.3216,\n      \"Quantity\": 6,\n      \"Region\": \"South\",\n      \"Sales (bin)\": \"$478 \",\n      \"Sales\": 934.956,\n      \"Segment\": \"Consumer\",\n      \"Ship Date\": \"12/28/2017\",\n      \"Ship Mode\": \"Standard Class\",\n      \"State\": \"Tennessee\",\n      \"Sub-Category\": \"Tables\"\n    },\n    {\n      \"Days to Ship Actual\": 4,\n      \"Sales Forecast\": 168,\n      \"Ship Status\": \"Shipped Early\",\n      \"Days to Ship Scheduled\": 6,\n      \"Sales per Customer\": \"$119.94 \",\n      \"Profit Ratio\": \"20.00%\",\n      \"Category\": \"Furniture\",\n      \"City\": \"Los Angeles\",\n      \"Country\": \"United States\",\n      \"Customer Name\": \"Lena Creighton\",\n      \"Days to Ship Actual (bin)\": 4,\n      \"Discount\": 0,\n      \"Number of Records\": 1,\n      \"Order Date\": \"11/16/2017\",\n      \"Order ID\": \"CA-2017-157448\",\n      \"Postal Code\": 90049,\n      \"Product Name\": \"Eldon Radial Chair Mat for Low to Medium Pile Carpets\",\n      \"Profit\": 23.988,\n      \"Quantity\": 3,\n      \"Region\": \"West\",\n      \"Sales (bin)\": \"$0 \",\n      \"Sales\": 119.94,\n      \"Segment\": \"Consumer\",\n      \"Ship Date\": \"11/20/2017\",\n      \"Ship Mode\": \"Standard Class\",\n      \"State\": \"California\",\n      \"Sub-Category\": \"Furnishings\"\n    },\n    {\n      \"Days to Ship Actual\": 5,\n      \"Sales Forecast\": 114,\n      \"Ship Status\": \"Shipped Early\",\n      \"Days to Ship Scheduled\": 6,\n      \"Sales per Customer\": \"$81.58 \",\n      \"Profit Ratio\": \"2.50%\",\n      \"Category\": \"Technology\",\n      \"City\": \"Chicago\",\n      \"Country\": \"United States\",\n      \"Customer Name\": \"Roger Demir\",\n      \"Days to Ship Actual (bin)\": 5,\n      \"Discount\": 20,\n      \"Number of Records\": 1,\n      \"Order Date\": \"11/21/2016\",\n      \"Order ID\": \"CA-2016-146157\",\n      \"Postal Code\": 60610,\n      \"Product Name\": \"Lenovo 17-Key USB Numeric Keypad\",\n      \"Profit\": 2.0394,\n      \"Quantity\": 3,\n      \"Region\": \"Central\",\n      \"Sales (bin)\": \"$0 \",\n      \"Sales\": 81.576,\n      \"Segment\": \"Consumer\",\n      \"Ship Date\": \"11/26/2016\",\n      \"Ship Mode\": \"Standard Class\",\n      \"State\": \"Illinois\",\n      \"Sub-Category\": \"Accessories\"\n    },\n    {\n      \"Days to Ship Actual\": 0,\n      \"Sales Forecast\": 1464,\n      \"Ship Status\": \"Shipped On Time\",\n      \"Days to Ship Scheduled\": 0,\n      \"Sales per Customer\": \"$1,044.63 \",\n      \"Profit Ratio\": \"-28.30%\",\n      \"Category\": \"Furniture\",\n      \"City\": \"New York City\",\n      \"Country\": \"United States\",\n      \"Customer Name\": \"Sheri Gordon\",\n      \"Days to Ship Actual (bin)\": 0,\n      \"Discount\": 40,\n      \"Number of Records\": 1,\n      \"Order Date\": \"6/30/2017\",\n      \"Order ID\": \"US-2017-102890\",\n      \"Postal Code\": 10011,\n      \"Product Name\": \"Bretford CR4500 Series Slim Rectangular Table\",\n      \"Profit\": -295.9785,\n      \"Quantity\": 5,\n      \"Region\": \"East\",\n      \"Sales (bin)\": \"$956 \",\n      \"Sales\": 1044.63,\n      \"Segment\": \"Consumer\",\n      \"Ship Date\": \"6/30/2017\",\n      \"Ship Mode\": \"Same Day\",\n      \"State\": \"New York\",\n      \"Sub-Category\": \"Tables\"\n    }\n  ],\n  \"column names\": [\n    \"Days to Ship Actual\",\n    \"Sales Forecast\",\n    \"Ship Status\",\n    \"Days to Ship Scheduled\",\n    \"Sales per Customer\",\n    \"Profit Ratio\",\n    \"Category\",\n    \"City\",\n    \"Country\",\n    \"Customer Name\",\n    \"Days to Ship Actual (bin)\",\n    \"Discount\",\n    \"Number of Records\",\n    \"Order Date\",\n    \"Order ID\",\n    \"Postal Code\",\n    \"Product Name\",\n    \"Profit\",\n    \"Quantity\",\n    \"Region\",\n    \"Sales (bin)\",\n    \"Sales\",\n    \"Segment\",\n    \"Ship Date\",\n    \"Ship Mode\",\n    \"State\",\n    \"Sub-Category\"\n  ]\n}\n\nYour Job:\nI am developing a NL to Data Visualization Dataset. \nPlease help me generate natural language utterance for given dataset and constraints.\nDefinition about the Taks:\n- 'utterance' is what a user would say to make a chart. It should be a questions structure. One NL 'utterance' is in one or two sentences. Here are two examples from Questions for reference:\n    How does displacement relate to fuel economy for cars from Europe vs. USA?\n    How many cars do each country manufacture?\n- 'given dataset' is in form of column names, column type, range/unique values of the column.\n- 'constraints' are information about the chart that should be included in the utterance. \n    So we can find a reference phrase in the NL utterance that corresponds to the given constraints. \n- 'reference phrase' can be explicit, ambiguous, and by_value. 'ambiguous' means the phrase can map to more than one columns in the dataset, always a hypernym of column names(depending on the dataset values).\n    For example:\n    {\"column\": \"gdpPercap\", \"nl_ref_type\": \"explicit\", \"nl_ref_phrase\": \"GDP per capita\"},\n    {\"column\": [\"country\",\"continent\"], \"nl_ref_type\": \"ambiguous\", \"nl_ref_phrase\": \"region\"}\n    {\"column\": [\"country\",\"country_short_name\"], \"nl_ref_type\": \"ambiguous\", \"nl_ref_phrase\": \"countries\"}\n    {\"c_type\": \"mark\", \"c_name\": \"point chart\", \"nl_ref_type\": \"explicit\", \"nl_ref_phrase\": \"scatter plot\"}\n    {\"c_type\": \"mark\", \"c_name\": \"arc chart\", \"nl_ref_type\": \"explicit\", \"nl_ref_phrase\": \"pie chart\"}\n    {\"c_type\": \"transform\",\"c_name\": \"filter\",\"c_list\": [{\"field\": \"country\",\"oneOf\": [\"Iceland\",\"Norway\"]}],\"nl_ref_type\": \"explicit\",\"nl_ref_phrase\": \"for countries Iceland and Norway\"},\n    {\"c_type\": \"transform\",\"c_name\": \"filter\",\"c_list\": [{\"field\": \"country\",\"oneOf\": [\"Iceland\",\"Norway\"]}],\"nl_ref_type\": \"by_value\",\"nl_ref_phrase\": \"for Iceland and Norway\"},\n- the 'nl_ref_phrase' for 'ambiguous' columns should be equally near all ambiguous columns, not too near to one of the column since it would not be ambiguous.\n    good example: {\"column\": [\"country\",\"region\"], \"nl_ref_type\": \"ambiguous\", \"nl_ref_phrase\": \"location\"}\n    bad example: {\"column\": [\"country\",\"region\"], \"nl_ref_type\": \"ambiguous\", \"nl_ref_phrase\": \"region\"}\n- You only include given constraints and no other information. \n    For example, if a column name is not in the given constraint, it will not be included in the NL utterance.\n    Also, it a chart mark or chart encoding channel is not in the given constraint, it will not be included in the NL utterance.\n- all 'nl_ref_phrase' shoule be included in the 'nl_utterance'. \n\nThe output format is identical to the input format, but fill in the str blanks(\"...\").\n### Input:\n{\n  \"nl_utterance\": \"...\",\n  \"encoded_fields\": [\n    {\n      \"field\": \"State\",\n      \"type\": \"nominal\",\n      \"nl_ref_type\": \"explicit\",\n      \"nl_ref_phrase\": \"...\"\n    }\n  ],\n  \"constraints\": [\n    {\n      \"c_type\": \"transform\",\n      \"c_name\": \"aggregate\",\n      \"c_list\": [\n        {\n          \"field\": \"Profit\",\n          \"aggregate\": \"mean\"\n        }\n      ],\n      \"nl_ref_type\": \"explicit\",\n      \"nl_ref_phrase\": \"...\"\n    }\n  ]\n}\n\n### Output:"
}