{
  "gpt_result": {
    "nl_utterance": "What is the sum of local prices over time for each currency code?",
    "encoded_fields": [
      {
        "field": "date",
        "type": "temporal",
        "nl_ref_type": "explicit",
        "nl_ref_phrase": "time"
      },
      {
        "field": "local_price",
        "type": "quantitative",
        "nl_ref_type": "explicit",
        "nl_ref_phrase": "local prices"
      },
      {
        "field": "currency_code",
        "type": "nominal",
        "nl_ref_type": "explicit",
        "nl_ref_phrase": "currency code"
      }
    ],
    "constraints": [
      {
        "c_type": "transform",
        "c_name": "aggregate",
        "c_list": [
          {
            "field": "local_price",
            "aggregate": "sum"
          }
        ],
        "nl_ref_type": "explicit",
        "nl_ref_phrase": "sum"
      }
    ]
  },
  "input": "Dataset Information: {\n  \"data samples\": [\n    {\n      \"rowid\": 1,\n      \"date\": \"2000-04-01\",\n      \"currency_code\": \"ARS\",\n      \"name\": \"Argentina\",\n      \"local_price\": 2.5,\n      \"dollar_ex\": 1.0,\n      \"dollar_price\": 2.5\n    },\n    {\n      \"rowid\": 12008,\n      \"date\": \"2001-04-01\",\n      \"currency_code\": \"EUR\",\n      \"name\": \"Euro area\",\n      \"local_price\": 2.57,\n      \"dollar_ex\": 1.136363636,\n      \"dollar_price\": 2.26160000072371\n    },\n    {\n      \"rowid\": 12059,\n      \"date\": \"2003-04-01\",\n      \"currency_code\": \"ARS\",\n      \"name\": \"Argentina\",\n      \"local_price\": 4.1,\n      \"dollar_ex\": 2.88,\n      \"dollar_price\": 1.42361111111111\n    },\n    {\n      \"rowid\": 9214,\n      \"date\": \"2019-07-09\",\n      \"currency_code\": \"EUR\",\n      \"name\": \"Euro area\",\n      \"local_price\": 4.08,\n      \"dollar_ex\": 0.892339267389462,\n      \"dollar_price\": 4.572252\n    },\n    {\n      \"rowid\": 2903,\n      \"date\": \"2006-05-01\",\n      \"currency_code\": \"EUR\",\n      \"name\": \"Euro area\",\n      \"local_price\": 2.939573529,\n      \"dollar_ex\": 0.780365992,\n      \"dollar_price\": 3.76691649704796\n    }\n  ],\n  \"column names\": [\n    \"rowid\",\n    \"date\",\n    \"currency_code\",\n    \"name\",\n    \"local_price\",\n    \"dollar_ex\",\n    \"dollar_price\"\n  ]\n}\n\nYour Job:\nI am developing a NL to Data Visualization Dataset. \nPlease help me generate natural language utterance for given dataset and constraints.\nDefinition about the Taks:\n- 'utterance' is what a user would say to make a chart. It should be a questions structure. One NL 'utterance' is in one or two sentences. Here are two examples from Questions for reference:\n    How many cars do each country manufacture?\n    Which countries have the highest acceleration for cars of different cylinders?\n- 'given dataset' is in form of column names, column type, range/unique values of the column.\n- 'constraints' are information about the chart that should be included in the utterance. \n    So we can find a reference phrase in the NL utterance that corresponds to the given constraints. \n- 'reference phrase' can be explicit, ambiguous, and by_value. 'ambiguous' means the phrase can map to more than one columns in the dataset, always a hypernym of column names(depending on the dataset values).\n    For example:\n    {\"column\": \"gdpPercap\", \"nl_ref_type\": \"explicit\", \"nl_ref_phrase\": \"GDP per capita\"},\n    {\"column\": [\"country\",\"continent\"], \"nl_ref_type\": \"ambiguous\", \"nl_ref_phrase\": \"region\"}\n    {\"column\": [\"country\",\"country_short_name\"], \"nl_ref_type\": \"ambiguous\", \"nl_ref_phrase\": \"countries\"}\n    {\"c_type\": \"mark\", \"c_name\": \"point chart\", \"nl_ref_type\": \"explicit\", \"nl_ref_phrase\": \"scatter plot\"}\n    {\"c_type\": \"mark\", \"c_name\": \"arc chart\", \"nl_ref_type\": \"explicit\", \"nl_ref_phrase\": \"pie chart\"}\n    {\"c_type\": \"transform\",\"c_name\": \"filter\",\"c_list\": [{\"field\": \"country\",\"oneOf\": [\"Iceland\",\"Norway\"]}],\"nl_ref_type\": \"explicit\",\"nl_ref_phrase\": \"for countries Iceland and Norway\"},\n    {\"c_type\": \"transform\",\"c_name\": \"filter\",\"c_list\": [{\"field\": \"country\",\"oneOf\": [\"Iceland\",\"Norway\"]}],\"nl_ref_type\": \"by_value\",\"nl_ref_phrase\": \"for Iceland and Norway\"},\n- the 'nl_ref_phrase' for 'ambiguous' columns should be equally near all ambiguous columns, not too near to one of the column since it would not be ambiguous.\n    good example: {\"column\": [\"country\",\"region\"], \"nl_ref_type\": \"ambiguous\", \"nl_ref_phrase\": \"location\"}\n    bad example: {\"column\": [\"country\",\"region\"], \"nl_ref_type\": \"ambiguous\", \"nl_ref_phrase\": \"region\"}\n- You only include given constraints and no other information. \n    For example, if a column name is not in the given constraint, it will not be included in the NL utterance.\n    Also, it a chart mark or chart encoding channel is not in the given constraint, it will not be included in the NL utterance.\n- all 'nl_ref_phrase' shoule be included in the 'nl_utterance'. \n\nThe output format is identical to the input format, but fill in the str blanks(\"...\").\n### Input:\n{\n  \"nl_utterance\": \"...\",\n  \"encoded_fields\": [\n    {\n      \"field\": \"date\",\n      \"type\": \"temporal\",\n      \"nl_ref_type\": \"explicit\",\n      \"nl_ref_phrase\": \"...\"\n    },\n    {\n      \"field\": \"local_price\",\n      \"type\": \"quantitative\",\n      \"nl_ref_type\": \"explicit\",\n      \"nl_ref_phrase\": \"...\"\n    },\n    {\n      \"field\": \"currency_code\",\n      \"type\": \"nominal\",\n      \"nl_ref_type\": \"explicit\",\n      \"nl_ref_phrase\": \"...\"\n    }\n  ],\n  \"constraints\": [\n    {\n      \"c_type\": \"transform\",\n      \"c_name\": \"aggregate\",\n      \"c_list\": [\n        {\n          \"field\": \"local_price\",\n          \"aggregate\": \"sum\"\n        }\n      ],\n      \"nl_ref_type\": \"explicit\",\n      \"nl_ref_phrase\": \"...\"\n    }\n  ]\n}\n\n### Output:"
}