{
  "gpt_result": {
    "nl_utterance": "Can you make a scatter plot showing the Human Development Index Value against Women's Points and Population?",
    "encoded_fields": [
      {
        "field": "Value",
        "type": "quantitative",
        "nl_ref_type": "explicit",
        "nl_ref_phrase": "Human Development Index Value"
      },
      {
        "field": "Womens Points",
        "type": "quantitative",
        "nl_ref_type": "explicit",
        "nl_ref_phrase": "Women's Points"
      },
      {
        "field": "Population",
        "type": "quantitative",
        "nl_ref_type": "explicit",
        "nl_ref_phrase": "Population"
      }
    ],
    "constraints": [
      {
        "c_type": "mark",
        "c_name": "point chart",
        "c_list": [
          {
            "mark": "circle",
            "encoding": {
              "x": {},
              "y": {},
              "color": {
                "type": "nominal",
                "ignore": true
              },
              "size": {
                "ignore": true,
                "type": "quantitative"
              },
              "column": {
                "ignore": true,
                "type": "nominal"
              },
              "row": {
                "ignore": true,
                "type": "nominal"
              }
            }
          }
        ],
        "nl_ref_type": "explicit",
        "nl_ref_phrase": "scatter plot"
      }
    ]
  },
  "input": "Dataset Information: {\n  \"data samples\": [\n    {\n      \"Unnamed: 0\": 0,\n      \"Country Name\": \"Albania\",\n      \"Mens Points\": 1361.81,\n      \"Womens Points\": 1346.01,\n      \"Alpha-3 code\": \"ALB\",\n      \"Percentage Difference\": 1.160220589,\n      \"HDI rank\": 67.0,\n      \"Value\": 0.796,\n      \"Country\": \"Albania\",\n      \"Population\": 2811666\n    },\n    {\n      \"Unnamed: 0\": 81,\n      \"Country Name\": \"Laos\",\n      \"Mens Points\": 914.66,\n      \"Womens Points\": 1257.98,\n      \"Alpha-3 code\": \"LAO\",\n      \"Percentage Difference\": -37.535259,\n      \"HDI rank\": 140.0,\n      \"Value\": 0.607,\n      \"Country\": \"Lao PDR\",\n      \"Population\": 7379358\n    },\n    {\n      \"Unnamed: 0\": 119,\n      \"Country Name\": \"Republic of Ireland\",\n      \"Mens Points\": 1442.48,\n      \"Womens Points\": 1695.26,\n      \"Alpha-3 code\": \"IRL\",\n      \"Percentage Difference\": -17.52398647,\n      \"HDI rank\": 8.0,\n      \"Value\": 0.945,\n      \"Country\": \"Ireland\",\n      \"Population\": 5028230\n    },\n    {\n      \"Unnamed: 0\": 117,\n      \"Country Name\": \"Poland\",\n      \"Mens Points\": 1546.18,\n      \"Womens Points\": 1647.92,\n      \"Alpha-3 code\": \"POL\",\n      \"Percentage Difference\": -6.5800877,\n      \"HDI rank\": 34.0,\n      \"Value\": 0.876,\n      \"Country\": \"Poland\",\n      \"Population\": 37781024\n    },\n    {\n      \"Unnamed: 0\": 128,\n      \"Country Name\": \"Singapore\",\n      \"Mens Points\": 1004.75,\n      \"Womens Points\": 1088.77,\n      \"Alpha-3 code\": \"SGP\",\n      \"Percentage Difference\": -8.362279174,\n      \"HDI rank\": 12.0,\n      \"Value\": 0.939,\n      \"Country\": \"Singapore\",\n      \"Population\": 5453566\n    }\n  ],\n  \"column names\": [\n    \"Unnamed: 0\",\n    \"Country Name\",\n    \"Mens Points\",\n    \"Womens Points\",\n    \"Alpha-3 code\",\n    \"Percentage Difference\",\n    \"HDI rank\",\n    \"Value\",\n    \"Country\",\n    \"Population\"\n  ]\n}\n\nYour Job:\nI am developing a NL to Data Visualization Dataset. \nPlease help me generate natural language utterance for given dataset and constraints.\nDefinition about the Taks:\n- 'utterance' is what a user would say to make a chart. It should be a questions structure. One NL 'utterance' is in one or two sentences. Here are two examples from Questions for reference:\n    What is our profit based on shipping mode by customer segment?\n    How much do various cars weigh?\n- 'given dataset' is in form of column names, column type, range/unique values of the column.\n- 'constraints' are information about the chart that should be included in the utterance. \n    So we can find a reference phrase in the NL utterance that corresponds to the given constraints. \n- 'reference phrase' can be explicit, ambiguous, and by_value. 'ambiguous' means the phrase can map to more than one columns in the dataset, always a hypernym of column names(depending on the dataset values).\n    For example:\n    {\"column\": \"gdpPercap\", \"nl_ref_type\": \"explicit\", \"nl_ref_phrase\": \"GDP per capita\"},\n    {\"column\": [\"country\",\"continent\"], \"nl_ref_type\": \"ambiguous\", \"nl_ref_phrase\": \"region\"}\n    {\"column\": [\"country\",\"country_short_name\"], \"nl_ref_type\": \"ambiguous\", \"nl_ref_phrase\": \"countries\"}\n    {\"c_type\": \"mark\", \"c_name\": \"point chart\", \"nl_ref_type\": \"explicit\", \"nl_ref_phrase\": \"scatter plot\"}\n    {\"c_type\": \"mark\", \"c_name\": \"arc chart\", \"nl_ref_type\": \"explicit\", \"nl_ref_phrase\": \"pie chart\"}\n    {\"c_type\": \"transform\",\"c_name\": \"filter\",\"c_list\": [{\"field\": \"country\",\"oneOf\": [\"Iceland\",\"Norway\"]}],\"nl_ref_type\": \"explicit\",\"nl_ref_phrase\": \"for countries Iceland and Norway\"},\n    {\"c_type\": \"transform\",\"c_name\": \"filter\",\"c_list\": [{\"field\": \"country\",\"oneOf\": [\"Iceland\",\"Norway\"]}],\"nl_ref_type\": \"by_value\",\"nl_ref_phrase\": \"for Iceland and Norway\"},\n- the 'nl_ref_phrase' for 'ambiguous' columns should be equally near all ambiguous columns, not too near to one of the column since it would not be ambiguous.\n    good example: {\"column\": [\"country\",\"region\"], \"nl_ref_type\": \"ambiguous\", \"nl_ref_phrase\": \"location\"}\n    bad example: {\"column\": [\"country\",\"region\"], \"nl_ref_type\": \"ambiguous\", \"nl_ref_phrase\": \"region\"}\n- You only include given constraints and no other information. \n    For example, if a column name is not in the given constraint, it will not be included in the NL utterance.\n    Also, it a chart mark or chart encoding channel is not in the given constraint, it will not be included in the NL utterance.\n- all 'nl_ref_phrase' shoule be included in the 'nl_utterance'. \n\nThe output format is identical to the input format, but fill in the str blanks(\"...\").\n### Input:\n{\n  \"nl_utterance\": \"...\",\n  \"encoded_fields\": [\n    {\n      \"field\": \"Value\",\n      \"type\": \"quantitative\",\n      \"nl_ref_type\": \"explicit\",\n      \"nl_ref_phrase\": \"...\"\n    },\n    {\n      \"field\": \"Womens Points\",\n      \"type\": \"quantitative\",\n      \"nl_ref_type\": \"explicit\",\n      \"nl_ref_phrase\": \"...\"\n    },\n    {\n      \"field\": \"Population\",\n      \"type\": \"quantitative\",\n      \"nl_ref_type\": \"explicit\",\n      \"nl_ref_phrase\": \"...\"\n    }\n  ],\n  \"constraints\": [\n    {\n      \"c_type\": \"mark\",\n      \"c_name\": \"point chart\",\n      \"c_list\": [\n        {\n          \"mark\": \"circle\",\n          \"encoding\": {\n            \"x\": {},\n            \"y\": {},\n            \"color\": {\n              \"type\": \"nominal\",\n              \"ignore\": true\n            },\n            \"size\": {\n              \"ignore\": true,\n              \"type\": \"quantitative\"\n            },\n            \"column\": {\n              \"ignore\": true,\n              \"type\": \"nominal\"\n            },\n            \"row\": {\n              \"ignore\": true,\n              \"type\": \"nominal\"\n            }\n          }\n        }\n      ],\n      \"nl_ref_type\": \"explicit\",\n      \"nl_ref_phrase\": \"...\"\n    }\n  ]\n}\n\n### Output:"
}