{
  "gpt_result": {
    "nl_utterance": "Create a scatter plot to show the correlation between GDP per capita and life expectancy across different regions, with bubble size indicating population.",
    "encoded_fields": [
      {
        "field": "GDP per capita (PPP)",
        "type": "quantitative",
        "nl_ref_type": "explicit",
        "nl_ref_phrase": "GDP per capita"
      },
      {
        "field": "Life Expectancy",
        "type": "quantitative",
        "nl_ref_type": "explicit",
        "nl_ref_phrase": "life expectancy"
      },
      {
        "field": [
          "Continent",
          "UN Region"
        ],
        "type": "nominal",
        "nl_ref_type": "ambiguous",
        "nl_ref_phrase": "regions"
      },
      {
        "field": "Population",
        "type": "quantitative",
        "nl_ref_type": "explicit",
        "nl_ref_phrase": "population"
      }
    ],
    "constraints": [
      {
        "c_type": "task",
        "c_name": "correlation",
        "c_list": [
          {
            "mark": "circle",
            "encoding": {
              "x": {
                "type": "quantitative"
              },
              "y": {
                "type": "quantitative"
              }
            }
          }
        ],
        "nl_ref_type": "explicit",
        "nl_ref_phrase": "correlation"
      }
    ]
  },
  "input": "Dataset Information: {\n  \"data samples\": [\n    {\n      \"Country\": \"Finland\",\n      \"Happiness score\": 7.821,\n      \"Country_temp\": \"Finland\",\n      \"ISO3\": \"FIN\",\n      \"GDP per capita (PPP)\": 55013.38586,\n      \"Life Ladder\": 7.7944,\n      \"Social support\": 0.9703,\n      \"Perceptions of corruption\": 0.1918,\n      \"Population\": 5535992.0,\n      \"Median Age\": 42.368,\n      \"Total Fertility Rate\": 1.389,\n      \"Life Expectancy\": 82.038,\n      \"Infant Mortality\": 1.932,\n      \"Child Mortality\": 2.353,\n      \"Net Migration Rate\": 2.7,\n      \"Continent\": \"Europe\",\n      \"UN Region\": \"Northern Europe\"\n    },\n    {\n      \"Country\": \"Germany\",\n      \"Happiness score\": 7.034,\n      \"Country_temp\": \"Germany\",\n      \"ISO3\": \"DEU\",\n      \"GDP per capita (PPP)\": 57881.08358,\n      \"Life Ladder\": 6.7545,\n      \"Social support\": 0.8676,\n      \"Perceptions of corruption\": 0.4176,\n      \"Population\": 83408554.0,\n      \"Median Age\": 44.874,\n      \"Total Fertility Rate\": 1.53,\n      \"Life Expectancy\": 80.6,\n      \"Infant Mortality\": 3.1,\n      \"Child Mortality\": 4.0,\n      \"Net Migration Rate\": 3.8,\n      \"Continent\": \"Europe\",\n      \"UN Region\": \"Western Europe\"\n    },\n    {\n      \"Country\": \"France\",\n      \"Happiness score\": 6.687,\n      \"Country_temp\": \"France\",\n      \"ISO3\": \"FRA\",\n      \"GDP per capita (PPP)\": 50541.25936,\n      \"Life Ladder\": 6.6562,\n      \"Social support\": 0.9146,\n      \"Perceptions of corruption\": 0.5608,\n      \"Population\": 64531444.0,\n      \"Median Age\": 41.591,\n      \"Total Fertility Rate\": 1.79,\n      \"Life Expectancy\": 82.5,\n      \"Infant Mortality\": 3.6,\n      \"Child Mortality\": 4.0,\n      \"Net Migration Rate\": 0.3,\n      \"Continent\": \"Europe\",\n      \"UN Region\": \"Western Europe\"\n    },\n    {\n      \"Country\": \"Gabon\",\n      \"Happiness score\": 4.958,\n      \"Country_temp\": \"Gabon\",\n      \"ISO3\": \"GAB\",\n      \"GDP per capita (PPP)\": 15175.68734,\n      \"Life Ladder\": 5.0754,\n      \"Social support\": 0.7539,\n      \"Perceptions of corruption\": 0.7659,\n      \"Population\": 2341179.0,\n      \"Median Age\": 21.615,\n      \"Total Fertility Rate\": 3.491,\n      \"Life Expectancy\": 65.821,\n      \"Infant Mortality\": 29.212,\n      \"Child Mortality\": 39.41,\n      \"Net Migration Rate\": 0.648,\n      \"Continent\": \"Africa\",\n      \"UN Region\": \"Middle Africa\"\n    },\n    {\n      \"Country\": \"Turkey\",\n      \"Happiness score\": 4.744,\n      \"Country_temp\": \"Turkey\",\n      \"ISO3\": \"TUR\",\n      \"GDP per capita (PPP)\": 30737.0175,\n      \"Life Ladder\": 4.3666,\n      \"Social support\": 0.7362,\n      \"Perceptions of corruption\": 0.8102,\n      \"Population\": 84775404.0,\n      \"Median Age\": 30.926,\n      \"Total Fertility Rate\": 1.889,\n      \"Life Expectancy\": 76.032,\n      \"Infant Mortality\": 7.657,\n      \"Child Mortality\": 8.99,\n      \"Net Migration Rate\": -0.822,\n      \"Continent\": \"Asia\",\n      \"UN Region\": \"Western Asia\"\n    }\n  ],\n  \"column names\": [\n    \"Country\",\n    \"Happiness score\",\n    \"Country_temp\",\n    \"ISO3\",\n    \"GDP per capita (PPP)\",\n    \"Life Ladder\",\n    \"Social support\",\n    \"Perceptions of corruption\",\n    \"Population\",\n    \"Median Age\",\n    \"Total Fertility Rate\",\n    \"Life Expectancy\",\n    \"Infant Mortality\",\n    \"Child Mortality\",\n    \"Net Migration Rate\",\n    \"Continent\",\n    \"UN Region\"\n  ]\n}\n\nYour Job:\nI am developing a NL to Data Visualization Dataset. \nPlease help me generate natural language utterance for given dataset and constraints.\nDefinition about the Taks:\n- 'utterance' is what a user would say to make a chart.  One NL 'utterance' is in one or two sentences. Here are two examples from Others for reference:\n    scatter(x=production budget, y=worldwide gross) for content rating.\n    Trend for average horsepower over time across different origin.\n- 'given dataset' is in form of column names, column type, range/unique values of the column.\n- 'constraints' are information about the chart that should be included in the utterance. \n    So we can find a reference phrase in the NL utterance that corresponds to the given constraints. \n- 'reference phrase' can be explicit, ambiguous, and by_value. 'ambiguous' means the phrase can map to more than one columns in the dataset, always a hypernym of column names(depending on the dataset values).\n    For example:\n    {\"column\": \"gdpPercap\", \"nl_ref_type\": \"explicit\", \"nl_ref_phrase\": \"GDP per capita\"},\n    {\"column\": [\"country\",\"continent\"], \"nl_ref_type\": \"ambiguous\", \"nl_ref_phrase\": \"region\"}\n    {\"column\": [\"country\",\"country_short_name\"], \"nl_ref_type\": \"ambiguous\", \"nl_ref_phrase\": \"countries\"}\n    {\"c_type\": \"mark\", \"c_name\": \"point chart\", \"nl_ref_type\": \"explicit\", \"nl_ref_phrase\": \"scatter plot\"}\n    {\"c_type\": \"mark\", \"c_name\": \"arc chart\", \"nl_ref_type\": \"explicit\", \"nl_ref_phrase\": \"pie chart\"}\n    {\"c_type\": \"transform\",\"c_name\": \"filter\",\"c_list\": [{\"field\": \"country\",\"oneOf\": [\"Iceland\",\"Norway\"]}],\"nl_ref_type\": \"explicit\",\"nl_ref_phrase\": \"for countries Iceland and Norway\"},\n    {\"c_type\": \"transform\",\"c_name\": \"filter\",\"c_list\": [{\"field\": \"country\",\"oneOf\": [\"Iceland\",\"Norway\"]}],\"nl_ref_type\": \"by_value\",\"nl_ref_phrase\": \"for Iceland and Norway\"},\n- the 'nl_ref_phrase' for 'ambiguous' columns should be equally near all ambiguous columns, not too near to one of the column since it would not be ambiguous.\n    good example: {\"column\": [\"country\",\"region\"], \"nl_ref_type\": \"ambiguous\", \"nl_ref_phrase\": \"location\"}\n    bad example: {\"column\": [\"country\",\"region\"], \"nl_ref_type\": \"ambiguous\", \"nl_ref_phrase\": \"region\"}\n- You only include given constraints and no other information. \n    For example, if a column name is not in the given constraint, it will not be included in the NL utterance.\n    Also, it a chart mark or chart encoding channel is not in the given constraint, it will not be included in the NL utterance.\n- all 'nl_ref_phrase' shoule be included in the 'nl_utterance'. \n\nThe output format is identical to the input format, but fill in the str blanks(\"...\").\n### Input:\n{\n  \"nl_utterance\": \"...\",\n  \"encoded_fields\": [\n    {\n      \"field\": \"GDP per capita (PPP)\",\n      \"type\": \"quantitative\",\n      \"nl_ref_type\": \"explicit\",\n      \"nl_ref_phrase\": \"...\"\n    },\n    {\n      \"field\": \"Life Expectancy\",\n      \"type\": \"quantitative\",\n      \"nl_ref_type\": \"explicit\",\n      \"nl_ref_phrase\": \"...\"\n    },\n    {\n      \"field\": [\n        \"Continent\",\n        \"UN Region\"\n      ],\n      \"type\": \"nominal\",\n      \"nl_ref_type\": \"ambiguous\",\n      \"nl_ref_phrase\": \"...\"\n    },\n    {\n      \"field\": \"Population\",\n      \"type\": \"quantitative\",\n      \"nl_ref_type\": \"explicit\",\n      \"nl_ref_phrase\": \"...\"\n    }\n  ],\n  \"constraints\": [\n    {\n      \"c_type\": \"task\",\n      \"c_name\": \"correlation\",\n      \"c_list\": [\n        {\n          \"mark\": \"circle\",\n          \"encoding\": {\n            \"x\": {\n              \"type\": \"quantitative\"\n            },\n            \"y\": {\n              \"type\": \"quantitative\"\n            }\n          }\n        }\n      ],\n      \"nl_ref_type\": \"explicit\",\n      \"nl_ref_phrase\": \"...\"\n    }\n  ]\n}\n\n### Output:"
}