{
  "gpt_result": {
    "nl_utterance": "What is the relationship between Women's Points and population count in 2021? Can you plot this on a scatter plot?",
    "encoded_fields": [
      {
        "field": "Womens Points",
        "type": "quantitative",
        "nl_ref_type": "explicit",
        "nl_ref_phrase": "Women's Points"
      },
      {
        "field": "YR2021",
        "type": "quantitative",
        "nl_ref_type": "explicit",
        "nl_ref_phrase": "population count in 2021"
      }
    ],
    "constraints": [
      {
        "c_type": "mark",
        "c_name": "point chart",
        "c_list": [
          {
            "mark": "circle",
            "encoding": {
              "x": {},
              "y": {},
              "color": {
                "type": "nominal",
                "ignore": true
              },
              "size": {
                "ignore": true,
                "type": "quantitative"
              },
              "column": {
                "ignore": true,
                "type": "nominal"
              },
              "row": {
                "ignore": true,
                "type": "nominal"
              }
            }
          }
        ],
        "nl_ref_type": "explicit",
        "nl_ref_phrase": "scatter plot"
      }
    ]
  },
  "input": "Dataset Information: {\n  \"data samples\": [\n    {\n      \"Country Name\": \"Albania\",\n      \"Mens Points\": 1361.81,\n      \"Womens Points\": 1346.01,\n      \"Alpha-3 code\": \"ALB\",\n      \"Percentage Difference\": 1.1602205887752297,\n      \"Gender Inequality Index\": 0.144,\n      \"Country\": \"Albania\",\n      \"YR2021\": 2811666.0\n    },\n    {\n      \"Country Name\": \"Bolivia\",\n      \"Mens Points\": 1298.81,\n      \"Womens Points\": 1213.1,\n      \"Alpha-3 code\": \"BOL\",\n      \"Percentage Difference\": 6.599117653852376,\n      \"Gender Inequality Index\": 0.418,\n      \"Country\": \"Bolivia\",\n      \"YR2021\": 11832936.0\n    },\n    {\n      \"Country Name\": \"North Macedonia\",\n      \"Mens Points\": 1375.2,\n      \"Womens Points\": 1082.42,\n      \"Alpha-3 code\": \"MKD\",\n      \"Percentage Difference\": 21.289994182664337,\n      \"Gender Inequality Index\": 0.134,\n      \"Country\": \"North Macedonia\",\n      \"YR2021\": 2065092.0\n    },\n    {\n      \"Country Name\": \"Congo DR\",\n      \"Mens Points\": 1332.84,\n      \"Womens Points\": 1159.0,\n      \"Alpha-3 code\": \"COD\",\n      \"Percentage Difference\": 13.042825845562852,\n      \"Gender Inequality Index\": 0.601,\n      \"Country\": \"Congo, Dem. Rep.\",\n      \"YR2021\": 92377986.0\n    },\n    {\n      \"Country Name\": \"Burkina Faso\",\n      \"Mens Points\": 1425.64,\n      \"Womens Points\": 1050.87,\n      \"Alpha-3 code\": \"BFA\",\n      \"Percentage Difference\": 26.287842653124223,\n      \"Gender Inequality Index\": 0.621,\n      \"Country\": \"Burkina Faso\",\n      \"YR2021\": 21497097.0\n    }\n  ],\n  \"column names\": [\n    \"Country Name\",\n    \"Mens Points\",\n    \"Womens Points\",\n    \"Alpha-3 code\",\n    \"Percentage Difference\",\n    \"Gender Inequality Index\",\n    \"Country\",\n    \"YR2021\"\n  ]\n}\n\nYour Job:\nI am developing a NL to Data Visualization Dataset. \nPlease help me generate natural language utterance for given dataset and constraints.\nDefinition about the Taks:\n- 'utterance' is what a user would say to make a chart. It should be a questions structure. One NL 'utterance' is in one or two sentences. Here are two examples from Questions for reference:\n    How many cars do each country manufacture?\n    Are IMDb rating and rotten tomatoes rating related?\n- 'given dataset' is in form of column names, column type, range/unique values of the column.\n- 'constraints' are information about the chart that should be included in the utterance. \n    So we can find a reference phrase in the NL utterance that corresponds to the given constraints. \n- 'reference phrase' can be explicit, ambiguous, and by_value. 'ambiguous' means the phrase can map to more than one columns in the dataset, always a hypernym of column names(depending on the dataset values).\n    For example:\n    {\"column\": \"gdpPercap\", \"nl_ref_type\": \"explicit\", \"nl_ref_phrase\": \"GDP per capita\"},\n    {\"column\": [\"country\",\"continent\"], \"nl_ref_type\": \"ambiguous\", \"nl_ref_phrase\": \"region\"}\n    {\"column\": [\"country\",\"country_short_name\"], \"nl_ref_type\": \"ambiguous\", \"nl_ref_phrase\": \"countries\"}\n    {\"c_type\": \"mark\", \"c_name\": \"point chart\", \"nl_ref_type\": \"explicit\", \"nl_ref_phrase\": \"scatter plot\"}\n    {\"c_type\": \"mark\", \"c_name\": \"arc chart\", \"nl_ref_type\": \"explicit\", \"nl_ref_phrase\": \"pie chart\"}\n    {\"c_type\": \"transform\",\"c_name\": \"filter\",\"c_list\": [{\"field\": \"country\",\"oneOf\": [\"Iceland\",\"Norway\"]}],\"nl_ref_type\": \"explicit\",\"nl_ref_phrase\": \"for countries Iceland and Norway\"},\n    {\"c_type\": \"transform\",\"c_name\": \"filter\",\"c_list\": [{\"field\": \"country\",\"oneOf\": [\"Iceland\",\"Norway\"]}],\"nl_ref_type\": \"by_value\",\"nl_ref_phrase\": \"for Iceland and Norway\"},\n- the 'nl_ref_phrase' for 'ambiguous' columns should be equally near all ambiguous columns, not too near to one of the column since it would not be ambiguous.\n    good example: {\"column\": [\"country\",\"region\"], \"nl_ref_type\": \"ambiguous\", \"nl_ref_phrase\": \"location\"}\n    bad example: {\"column\": [\"country\",\"region\"], \"nl_ref_type\": \"ambiguous\", \"nl_ref_phrase\": \"region\"}\n- You only include given constraints and no other information. \n    For example, if a column name is not in the given constraint, it will not be included in the NL utterance.\n    Also, it a chart mark or chart encoding channel is not in the given constraint, it will not be included in the NL utterance.\n- all 'nl_ref_phrase' shoule be included in the 'nl_utterance'. \n\nThe output format is identical to the input format, but fill in the str blanks(\"...\").\n### Input:\n{\n  \"nl_utterance\": \"...\",\n  \"encoded_fields\": [\n    {\n      \"field\": \"Womens Points\",\n      \"type\": \"quantitative\",\n      \"nl_ref_type\": \"explicit\",\n      \"nl_ref_phrase\": \"...\"\n    },\n    {\n      \"field\": \"YR2021\",\n      \"type\": \"quantitative\",\n      \"nl_ref_type\": \"explicit\",\n      \"nl_ref_phrase\": \"...\"\n    }\n  ],\n  \"constraints\": [\n    {\n      \"c_type\": \"mark\",\n      \"c_name\": \"point chart\",\n      \"c_list\": [\n        {\n          \"mark\": \"circle\",\n          \"encoding\": {\n            \"x\": {},\n            \"y\": {},\n            \"color\": {\n              \"type\": \"nominal\",\n              \"ignore\": true\n            },\n            \"size\": {\n              \"ignore\": true,\n              \"type\": \"quantitative\"\n            },\n            \"column\": {\n              \"ignore\": true,\n              \"type\": \"nominal\"\n            },\n            \"row\": {\n              \"ignore\": true,\n              \"type\": \"nominal\"\n            }\n          }\n        }\n      ],\n      \"nl_ref_type\": \"explicit\",\n      \"nl_ref_phrase\": \"...\"\n    }\n  ]\n}\n\n### Output:"
}