{
  "gpt_result": {
    "nl_utterance": "Plot a line chart to show the trend of average values over time intervals.",
    "encoded_fields": [
      {
        "field": "value.average",
        "type": "quantitative",
        "nl_ref_type": "explicit",
        "nl_ref_phrase": "average values"
      }
    ],
    "constraints": [
      {
        "c_type": "mark",
        "c_name": "line chart",
        "c_list": [
          {
            "mark": "line",
            "encoding": {
              "x": {},
              "y": {
                "type": "quantitative"
              },
              "color": {
                "ignore": true,
                "type": "nominal"
              },
              "column": {
                "ignore": true,
                "type": "nominal"
              },
              "row": {
                "ignore": true,
                "type": "nominal"
              }
            },
            "unique_map": {
              "x": "y"
            }
          }
        ],
        "nl_ref_type": "explicit",
        "nl_ref_phrase": "line chart"
      }
    ]
  },
  "input": "Dataset Information: {\n  \"data samples\": [\n    {\n      \"time\": \"{'interval_start': '2018-12-31T00:00:00Z', 'max': '2019-01-06T13:05:41.560000Z', 'min': '2019-01-01T11:18:35.384000Z'}\",\n      \"value\": \"{'average': 0.033399107154636, 'count': 1050, 'max': 0.037315417081117006, 'min': 0.030083676800131003, 'standard deviation': 0.001193542699587}\"\n    },\n    {\n      \"time\": \"{'interval_start': '2019-12-23T00:00:00Z', 'max': '2019-12-29T13:11:27.897000Z', 'min': '2019-12-23T11:42:40.330000Z'}\",\n      \"value\": \"{'average': 0.031628805997162, 'count': 685, 'max': 0.040163900703191, 'min': 0.027468578889966, 'standard deviation': 0.00149688987754}\"\n    },\n    {\n      \"time\": \"{'interval_start': '2019-08-26T00:00:00Z', 'max': '2019-09-01T13:43:18.817000Z', 'min': '2019-08-26T12:13:07.487000Z'}\",\n      \"value\": \"{'average': 0.030281668035174004, 'count': 1675, 'max': 0.037805709987878, 'min': 0.018173022195696, 'standard deviation': 0.002705131073981}\"\n    },\n    {\n      \"time\": \"{'interval_start': '2022-04-04T00:00:00Z', 'max': '2022-04-10T14:53:31.650000Z', 'min': '2022-04-04T15:03:55.189000Z'}\",\n      \"value\": \"{'average': 0.032324122888336006, 'count': 1004, 'max': 0.039940226823091, 'min': 0.023197485134005002, 'standard deviation': 0.0025123177483150003}\"\n    },\n    {\n      \"time\": \"{'interval_start': '2019-11-18T00:00:00Z', 'max': '2019-11-24T14:07:56.560000Z', 'min': '2019-11-18T12:38:24.644000Z'}\",\n      \"value\": \"{'average': 0.030352270078474002, 'count': 612, 'max': 0.038035672158002, 'min': 0.024975407868623, 'standard deviation': 0.0015102157541980001}\"\n    }\n  ],\n  \"column names\": [\n    \"time\",\n    \"value\"\n  ]\n}\n\nYour Job:\nI am developing a NL to Data Visualization Dataset. \nPlease help me generate natural language utterance for given dataset and constraints.\nDefinition about the Taks:\n- 'utterance' is what a user would say to make a chart. It should be a commands structure. One NL 'utterance' is in one or two sentences. Here are two examples from Commands for reference:\n    Draw axes for AVG(Horsepower) vs Year, colored by Origin.\n    Sort creative types by number of movies.\n- 'given dataset' is in form of column names, column type, range/unique values of the column.\n- 'constraints' are information about the chart that should be included in the utterance. \n    So we can find a reference phrase in the NL utterance that corresponds to the given constraints. \n- 'reference phrase' can be explicit, ambiguous, and by_value. 'ambiguous' means the phrase can map to more than one columns in the dataset, always a hypernym of column names(depending on the dataset values).\n    For example:\n    {\"column\": \"gdpPercap\", \"nl_ref_type\": \"explicit\", \"nl_ref_phrase\": \"GDP per capita\"},\n    {\"column\": [\"country\",\"continent\"], \"nl_ref_type\": \"ambiguous\", \"nl_ref_phrase\": \"region\"}\n    {\"column\": [\"country\",\"country_short_name\"], \"nl_ref_type\": \"ambiguous\", \"nl_ref_phrase\": \"countries\"}\n    {\"c_type\": \"mark\", \"c_name\": \"point chart\", \"nl_ref_type\": \"explicit\", \"nl_ref_phrase\": \"scatter plot\"}\n    {\"c_type\": \"mark\", \"c_name\": \"arc chart\", \"nl_ref_type\": \"explicit\", \"nl_ref_phrase\": \"pie chart\"}\n    {\"c_type\": \"transform\",\"c_name\": \"filter\",\"c_list\": [{\"field\": \"country\",\"oneOf\": [\"Iceland\",\"Norway\"]}],\"nl_ref_type\": \"explicit\",\"nl_ref_phrase\": \"for countries Iceland and Norway\"},\n    {\"c_type\": \"transform\",\"c_name\": \"filter\",\"c_list\": [{\"field\": \"country\",\"oneOf\": [\"Iceland\",\"Norway\"]}],\"nl_ref_type\": \"by_value\",\"nl_ref_phrase\": \"for Iceland and Norway\"},\n- the 'nl_ref_phrase' for 'ambiguous' columns should be equally near all ambiguous columns, not too near to one of the column since it would not be ambiguous.\n    good example: {\"column\": [\"country\",\"region\"], \"nl_ref_type\": \"ambiguous\", \"nl_ref_phrase\": \"location\"}\n    bad example: {\"column\": [\"country\",\"region\"], \"nl_ref_type\": \"ambiguous\", \"nl_ref_phrase\": \"region\"}\n- You only include given constraints and no other information. \n    For example, if a column name is not in the given constraint, it will not be included in the NL utterance.\n    Also, it a chart mark or chart encoding channel is not in the given constraint, it will not be included in the NL utterance.\n- all 'nl_ref_phrase' shoule be included in the 'nl_utterance'. \n\nThe output format is identical to the input format, but fill in the str blanks(\"...\").\n### Input:\n{\n  \"nl_utterance\": \"...\",\n  \"encoded_fields\": [\n    {\n      \"field\": \"value.average\",\n      \"type\": \"quantitative\",\n      \"nl_ref_type\": \"explicit\",\n      \"nl_ref_phrase\": \"...\"\n    }\n  ],\n  \"constraints\": [\n    {\n      \"c_type\": \"mark\",\n      \"c_name\": \"line chart\",\n      \"c_list\": [\n        {\n          \"mark\": \"line\",\n          \"encoding\": {\n            \"x\": {},\n            \"y\": {\n              \"type\": \"quantitative\"\n            },\n            \"color\": {\n              \"ignore\": true,\n              \"type\": \"nominal\"\n            },\n            \"column\": {\n              \"ignore\": true,\n              \"type\": \"nominal\"\n            },\n            \"row\": {\n              \"ignore\": true,\n              \"type\": \"nominal\"\n            }\n          },\n          \"unique_map\": {\n            \"x\": \"y\"\n          }\n        }\n      ],\n      \"nl_ref_type\": \"explicit\",\n      \"nl_ref_phrase\": \"...\"\n    }\n  ]\n}\n\n### Output:"
}