{
  "gpt_result": {
    "nl_utterance": "Show the distribution of data using a bar chart with an aggregate count.",
    "encoded_fields": [],
    "constraints": [
      {
        "c_type": "task",
        "c_name": "distribution",
        "c_list": [
          {
            "mark": "bar",
            "encoding": {
              "y": {
                "aggregate": "count",
                "type": "quantitative"
              }
            },
            "x_y_reversable": true
          },
          {
            "mark": "boxplot",
            "encoding": {
              "x": {
                "type": "quantitative"
              }
            },
            "x_y_reversable": true
          }
        ],
        "nl_ref_type": "explicit",
        "nl_ref_phrase": "distribution"
      },
      {
        "c_type": "transform",
        "c_name": "aggregate",
        "c_list": [
          {
            "aggregate": "count"
          }
        ],
        "nl_ref_type": "explicit",
        "nl_ref_phrase": "aggregate count"
      }
    ]
  },
  "input": "Dataset Information: {\n  \"data samples\": [\n    {\n      \"ID\": 100,\n      \"Name\": \"Johnson City\",\n      \"Mobility\": 0.0621988103,\n      \"State\": \"TN\",\n      \"Population\": 576081,\n      \"Urban\": 1,\n      \"Black\": 0.021,\n      \"Seg_racial\": 0.09,\n      \"Seg_income\": 0.035,\n      \"Seg_poverty\": 0.03,\n      \"Seg_affluence\": 0.038,\n      \"Commute\": 0.325,\n      \"Income\": 31560,\n      \"Gini\": 0.468,\n      \"Share01\": 13.459,\n      \"Gini_99\": 0.333,\n      \"Middle_class\": 0.548,\n      \"Local_tax_rate\": 0.02,\n      \"Local_gov_spending\": 1886.0,\n      \"Progressivity\": 0.0,\n      \"EITC\": 0.0,\n      \"School_spending\": 5.185,\n      \"Student_teacher_ratio\": NaN,\n      \"Test_scores\": 2.728,\n      \"HS_dropout\": -0.015,\n      \"Colleges\": 0.014,\n      \"Tuition\": 4817.0,\n      \"Graduation\": -0.002,\n      \"Labor_force_participation\": 0.587,\n      \"Manufacturing\": 0.237,\n      \"Chinese_imports\": 5.294,\n      \"Teenage_labor\": 0.004,\n      \"Migration_in\": 0.006,\n      \"Migration_out\": 0.005,\n      \"Foreign_born\": 0.012,\n      \"Social_capital\": -0.298,\n      \"Religious\": 0.514,\n      \"Violent_crime\": 0.001,\n      \"Single_mothers\": 0.19,\n      \"Divorced\": 0.11,\n      \"Married\": 0.601,\n      \"Longitude\": -82.4363861083984,\n      \"Latitude\": 36.4703712463379\n    },\n    {\n      \"ID\": 26407,\n      \"Name\": \"Plentywood\",\n      \"Mobility\": 0.3181818128,\n      \"State\": \"MT\",\n      \"Population\": 4105,\n      \"Urban\": 0,\n      \"Black\": 0.001,\n      \"Seg_racial\": 0.014,\n      \"Seg_income\": 0.004,\n      \"Seg_poverty\": 0.005,\n      \"Seg_affluence\": 0.002,\n      \"Commute\": 0.681,\n      \"Income\": 33727,\n      \"Gini\": 0.263,\n      \"Share01\": NaN,\n      \"Gini_99\": NaN,\n      \"Middle_class\": NaN,\n      \"Local_tax_rate\": 0.028,\n      \"Local_gov_spending\": 2408.0,\n      \"Progressivity\": 0.0,\n      \"EITC\": 0.0,\n      \"School_spending\": 7.281,\n      \"Student_teacher_ratio\": 13.0,\n      \"Test_scores\": NaN,\n      \"HS_dropout\": NaN,\n      \"Colleges\": NaN,\n      \"Tuition\": NaN,\n      \"Graduation\": NaN,\n      \"Labor_force_participation\": 0.59,\n      \"Manufacturing\": 0.028,\n      \"Chinese_imports\": 0.0,\n      \"Teenage_labor\": NaN,\n      \"Migration_in\": 0.0,\n      \"Migration_out\": 0.007,\n      \"Foreign_born\": 0.018,\n      \"Social_capital\": 1.27,\n      \"Religious\": 0.758,\n      \"Violent_crime\": 0.001,\n      \"Single_mothers\": 0.095,\n      \"Divorced\": 0.068,\n      \"Married\": 0.607,\n      \"Longitude\": -104.65380859375,\n      \"Latitude\": 48.6474342346191\n    },\n    {\n      \"ID\": 31003,\n      \"Name\": \"Scott City\",\n      \"Mobility\": 0.191304341,\n      \"State\": \"KS\",\n      \"Population\": 9185,\n      \"Urban\": 0,\n      \"Black\": 0.001,\n      \"Seg_racial\": 0.035,\n      \"Seg_income\": 0.004,\n      \"Seg_poverty\": 0.0,\n      \"Seg_affluence\": 0.007,\n      \"Commute\": 0.658,\n      \"Income\": 39001,\n      \"Gini\": 0.32,\n      \"Share01\": 5.73,\n      \"Gini_99\": 0.262,\n      \"Middle_class\": 0.662,\n      \"Local_tax_rate\": 0.042,\n      \"Local_gov_spending\": 2291.0,\n      \"Progressivity\": 0.2,\n      \"EITC\": 1.905,\n      \"School_spending\": 6.577,\n      \"Student_teacher_ratio\": 13.5,\n      \"Test_scores\": 15.348,\n      \"HS_dropout\": -0.034,\n      \"Colleges\": NaN,\n      \"Tuition\": NaN,\n      \"Graduation\": NaN,\n      \"Labor_force_participation\": 0.678,\n      \"Manufacturing\": 0.036,\n      \"Chinese_imports\": 0.097,\n      \"Teenage_labor\": 0.007,\n      \"Migration_in\": 0.006,\n      \"Migration_out\": 0.003,\n      \"Foreign_born\": 0.051,\n      \"Social_capital\": 1.959,\n      \"Religious\": 0.836,\n      \"Violent_crime\": 0.001,\n      \"Single_mothers\": 0.128,\n      \"Divorced\": 0.075,\n      \"Married\": 0.659,\n      \"Longitude\": -101.361518859863,\n      \"Latitude\": 38.4598960876465\n    },\n    {\n      \"ID\": 34106,\n      \"Name\": \"Nome\",\n      \"Mobility\": 0.0467836261,\n      \"State\": \"AK\",\n      \"Population\": 9196,\n      \"Urban\": 0,\n      \"Black\": 0.004,\n      \"Seg_racial\": 0.143,\n      \"Seg_income\": 0.066,\n      \"Seg_poverty\": 0.036,\n      \"Seg_affluence\": 0.081,\n      \"Commute\": 0.928,\n      \"Income\": 29589,\n      \"Gini\": 0.392,\n      \"Share01\": 6.635,\n      \"Gini_99\": 0.325,\n      \"Middle_class\": 0.551,\n      \"Local_tax_rate\": 0.015,\n      \"Local_gov_spending\": 3670.0,\n      \"Progressivity\": 0.0,\n      \"EITC\": 0.0,\n      \"School_spending\": NaN,\n      \"Student_teacher_ratio\": 14.2,\n      \"Test_scores\": -30.813,\n      \"HS_dropout\": 0.017,\n      \"Colleges\": NaN,\n      \"Tuition\": NaN,\n      \"Graduation\": NaN,\n      \"Labor_force_participation\": 0.605,\n      \"Manufacturing\": 0.009,\n      \"Chinese_imports\": NaN,\n      \"Teenage_labor\": 0.006,\n      \"Migration_in\": 0.014,\n      \"Migration_out\": 0.02,\n      \"Foreign_born\": 0.015,\n      \"Social_capital\": NaN,\n      \"Religious\": 0.486,\n      \"Violent_crime\": 0.004,\n      \"Single_mothers\": 0.209,\n      \"Divorced\": 0.074,\n      \"Married\": 0.398,\n      \"Longitude\": -162.030120849609,\n      \"Latitude\": 64.4751434326172\n    },\n    {\n      \"ID\": 8401,\n      \"Name\": \"Aiken\",\n      \"Mobility\": 0.0410487503,\n      \"State\": \"GA\",\n      \"Population\": 525842,\n      \"Urban\": 1,\n      \"Black\": 0.357,\n      \"Seg_racial\": 0.165,\n      \"Seg_income\": 0.09,\n      \"Seg_poverty\": 0.084,\n      \"Seg_affluence\": 0.097,\n      \"Commute\": 0.275,\n      \"Income\": 33294,\n      \"Gini\": 0.487,\n      \"Share01\": 9.765,\n      \"Gini_99\": 0.39,\n      \"Middle_class\": 0.456,\n      \"Local_tax_rate\": 0.02,\n      \"Local_gov_spending\": 1911.0,\n      \"Progressivity\": 0.0,\n      \"EITC\": 0.0,\n      \"School_spending\": 5.214,\n      \"Student_teacher_ratio\": 18.2,\n      \"Test_scores\": -6.018,\n      \"HS_dropout\": 0.011,\n      \"Colleges\": 0.011,\n      \"Tuition\": 2317.0,\n      \"Graduation\": -0.117,\n      \"Labor_force_participation\": 0.623,\n      \"Manufacturing\": 0.157,\n      \"Chinese_imports\": 0.745,\n      \"Teenage_labor\": 0.003,\n      \"Migration_in\": 0.015,\n      \"Migration_out\": 0.015,\n      \"Foreign_born\": 0.029,\n      \"Social_capital\": -1.373,\n      \"Religious\": 0.432,\n      \"Violent_crime\": 0.002,\n      \"Single_mothers\": 0.291,\n      \"Divorced\": 0.104,\n      \"Married\": 0.528,\n      \"Longitude\": -82.2422409057617,\n      \"Latitude\": 33.4064865112305\n    }\n  ],\n  \"column names\": [\n    \"ID\",\n    \"Name\",\n    \"Mobility\",\n    \"State\",\n    \"Population\",\n    \"Urban\",\n    \"Black\",\n    \"Seg_racial\",\n    \"Seg_income\",\n    \"Seg_poverty\",\n    \"Seg_affluence\",\n    \"Commute\",\n    \"Income\",\n    \"Gini\",\n    \"Share01\",\n    \"Gini_99\",\n    \"Middle_class\",\n    \"Local_tax_rate\",\n    \"Local_gov_spending\",\n    \"Progressivity\",\n    \"EITC\",\n    \"School_spending\",\n    \"Student_teacher_ratio\",\n    \"Test_scores\",\n    \"HS_dropout\",\n    \"Colleges\",\n    \"Tuition\",\n    \"Graduation\",\n    \"Labor_force_participation\",\n    \"Manufacturing\",\n    \"Chinese_imports\",\n    \"Teenage_labor\",\n    \"Migration_in\",\n    \"Migration_out\",\n    \"Foreign_born\",\n    \"Social_capital\",\n    \"Religious\",\n    \"Violent_crime\",\n    \"Single_mothers\",\n    \"Divorced\",\n    \"Married\",\n    \"Longitude\",\n    \"Latitude\"\n  ]\n}\n\nYour Job:\nI am developing a NL to Data Visualization Dataset. \nPlease help me generate natural language utterance for given dataset and constraints.\nDefinition about the Taks:\n- 'utterance' is what a user would say to make a chart. It should be a queries structure. One NL 'utterance' is in one or two sentences. Here are two examples from Queries for reference:\n    Total gross by genre and year.\n    sales forecast between Jan 2016 and July 2017.\n- 'given dataset' is in form of column names, column type, range/unique values of the column.\n- 'constraints' are information about the chart that should be included in the utterance. \n    So we can find a reference phrase in the NL utterance that corresponds to the given constraints. \n- 'reference phrase' can be explicit, ambiguous, and by_value. 'ambiguous' means the phrase can map to more than one columns in the dataset, always a hypernym of column names(depending on the dataset values).\n    For example:\n    {\"column\": \"gdpPercap\", \"nl_ref_type\": \"explicit\", \"nl_ref_phrase\": \"GDP per capita\"},\n    {\"column\": [\"country\",\"continent\"], \"nl_ref_type\": \"ambiguous\", \"nl_ref_phrase\": \"region\"}\n    {\"column\": [\"country\",\"country_short_name\"], \"nl_ref_type\": \"ambiguous\", \"nl_ref_phrase\": \"countries\"}\n    {\"c_type\": \"mark\", \"c_name\": \"point chart\", \"nl_ref_type\": \"explicit\", \"nl_ref_phrase\": \"scatter plot\"}\n    {\"c_type\": \"mark\", \"c_name\": \"arc chart\", \"nl_ref_type\": \"explicit\", \"nl_ref_phrase\": \"pie chart\"}\n    {\"c_type\": \"transform\",\"c_name\": \"filter\",\"c_list\": [{\"field\": \"country\",\"oneOf\": [\"Iceland\",\"Norway\"]}],\"nl_ref_type\": \"explicit\",\"nl_ref_phrase\": \"for countries Iceland and Norway\"},\n    {\"c_type\": \"transform\",\"c_name\": \"filter\",\"c_list\": [{\"field\": \"country\",\"oneOf\": [\"Iceland\",\"Norway\"]}],\"nl_ref_type\": \"by_value\",\"nl_ref_phrase\": \"for Iceland and Norway\"},\n- the 'nl_ref_phrase' for 'ambiguous' columns should be equally near all ambiguous columns, not too near to one of the column since it would not be ambiguous.\n    good example: {\"column\": [\"country\",\"region\"], \"nl_ref_type\": \"ambiguous\", \"nl_ref_phrase\": \"location\"}\n    bad example: {\"column\": [\"country\",\"region\"], \"nl_ref_type\": \"ambiguous\", \"nl_ref_phrase\": \"region\"}\n- You only include given constraints and no other information. \n    For example, if a column name is not in the given constraint, it will not be included in the NL utterance.\n    Also, it a chart mark or chart encoding channel is not in the given constraint, it will not be included in the NL utterance.\n- all 'nl_ref_phrase' shoule be included in the 'nl_utterance'. \n\nThe output format is identical to the input format, but fill in the str blanks(\"...\").\n### Input:\n{\n  \"nl_utterance\": \"...\",\n  \"encoded_fields\": [],\n  \"constraints\": [\n    {\n      \"c_type\": \"task\",\n      \"c_name\": \"distribution\",\n      \"c_list\": [\n        {\n          \"mark\": \"bar\",\n          \"encoding\": {\n            \"y\": {\n              \"aggregate\": \"count\",\n              \"type\": \"quantitative\"\n            }\n          },\n          \"x_y_reversable\": true\n        },\n        {\n          \"mark\": \"boxplot\",\n          \"encoding\": {\n            \"x\": {\n              \"type\": \"quantitative\"\n            }\n          },\n          \"x_y_reversable\": true\n        }\n      ],\n      \"nl_ref_type\": \"explicit\",\n      \"nl_ref_phrase\": \"...\"\n    },\n    {\n      \"c_type\": \"transform\",\n      \"c_name\": \"aggregate\",\n      \"c_list\": [\n        {\n          \"aggregate\": \"count\"\n        }\n      ],\n      \"nl_ref_type\": \"explicit\",\n      \"nl_ref_phrase\": \"...\"\n    }\n  ]\n}\n\n### Output:"
}