{
  "gpt_result": {
    "nl_utterance": "Show me a bar chart of the average profit by location.",
    "encoded_fields": [
      {
        "field": "Profit",
        "type": "quantitative",
        "nl_ref_type": "explicit",
        "nl_ref_phrase": "average profit"
      },
      {
        "field": [
          "State",
          "City",
          "Country",
          "Region",
          "Postal Code"
        ],
        "type": "nominal",
        "nl_ref_type": "ambiguous",
        "nl_ref_phrase": "location"
      }
    ],
    "constraints": [
      {
        "c_type": "mark",
        "c_name": "bar chart",
        "nl_ref_type": "explicit",
        "nl_ref_phrase": "bar chart"
      },
      {
        "c_type": "transform",
        "c_name": "aggregate",
        "nl_ref_type": "explicit",
        "nl_ref_phrase": "average"
      }
    ]
  },
  "input": "Dataset Information: {\n  \"data samples\": [\n    {\n      \"Days to Ship Actual\": 6,\n      \"Sales Forecast\": 293,\n      \"Ship Status\": \"Shipped On Time\",\n      \"Days to Ship Scheduled\": 6,\n      \"Sales per Customer\": \"$209.30 \",\n      \"Profit Ratio\": \"27.00%\",\n      \"Category\": \"Office Supplies\",\n      \"City\": \"Columbus\",\n      \"Country\": \"United States\",\n      \"Customer Name\": \"Chuck Clark\",\n      \"Days to Ship Actual (bin)\": 5,\n      \"Discount\": 0,\n      \"Number of Records\": 1,\n      \"Order Date\": \"12/30/2017\",\n      \"Order ID\": \"CA-2017-126221\",\n      \"Postal Code\": 47201,\n      \"Product Name\": \"Eureka The Boss Plus 12-Amp Hard Box Upright Vacuum, Red\",\n      \"Profit\": 56.511,\n      \"Quantity\": 2,\n      \"Region\": \"Central\",\n      \"Sales (bin)\": \"$0 \",\n      \"Sales\": 209.3,\n      \"Segment\": \"Home Office\",\n      \"Ship Date\": \"1/5/2018\",\n      \"Ship Mode\": \"Standard Class\",\n      \"State\": \"Indiana\",\n      \"Sub-Category\": \"Appliances\"\n    },\n    {\n      \"Days to Ship Actual\": 5,\n      \"Sales Forecast\": 6,\n      \"Ship Status\": \"Shipped Early\",\n      \"Days to Ship Scheduled\": 6,\n      \"Sales per Customer\": \"$3.98 \",\n      \"Profit Ratio\": \"-67.50%\",\n      \"Category\": \"Furniture\",\n      \"City\": \"Houston\",\n      \"Country\": \"United States\",\n      \"Customer Name\": \"Tom Prescott\",\n      \"Days to Ship Actual (bin)\": 5,\n      \"Discount\": 60,\n      \"Number of Records\": 1,\n      \"Order Date\": \"2/9/2017\",\n      \"Order ID\": \"CA-2017-118773\",\n      \"Postal Code\": 77070,\n      \"Product Name\": \"Stacking Trays by OIC\",\n      \"Profit\": -2.6892,\n      \"Quantity\": 2,\n      \"Region\": \"Central\",\n      \"Sales (bin)\": \"$0 \",\n      \"Sales\": 3.984,\n      \"Segment\": \"Consumer\",\n      \"Ship Date\": \"2/14/2017\",\n      \"Ship Mode\": \"Standard Class\",\n      \"State\": \"Texas\",\n      \"Sub-Category\": \"Furnishings\"\n    },\n    {\n      \"Days to Ship Actual\": 6,\n      \"Sales Forecast\": 90,\n      \"Ship Status\": \"Shipped On Time\",\n      \"Days to Ship Scheduled\": 6,\n      \"Sales per Customer\": \"$64.38 \",\n      \"Profit Ratio\": \"12.50%\",\n      \"Category\": \"Office Supplies\",\n      \"City\": \"Pompano Beach\",\n      \"Country\": \"United States\",\n      \"Customer Name\": \"Pauline Webber\",\n      \"Days to Ship Actual (bin)\": 5,\n      \"Discount\": 20,\n      \"Number of Records\": 1,\n      \"Order Date\": \"3/21/2017\",\n      \"Order ID\": \"CA-2017-156272\",\n      \"Postal Code\": 33068,\n      \"Product Name\": \"APC 7 Outlet Network SurgeArrest Surge Protector\",\n      \"Profit\": 8.048,\n      \"Quantity\": 1,\n      \"Region\": \"South\",\n      \"Sales (bin)\": \"$0 \",\n      \"Sales\": 64.384,\n      \"Segment\": \"Corporate\",\n      \"Ship Date\": \"3/27/2017\",\n      \"Ship Mode\": \"Standard Class\",\n      \"State\": \"Florida\",\n      \"Sub-Category\": \"Appliances\"\n    }\n  ],\n  \"column names\": [\n    \"Days to Ship Actual\",\n    \"Sales Forecast\",\n    \"Ship Status\",\n    \"Days to Ship Scheduled\",\n    \"Sales per Customer\",\n    \"Profit Ratio\",\n    \"Category\",\n    \"City\",\n    \"Country\",\n    \"Customer Name\",\n    \"Days to Ship Actual (bin)\",\n    \"Discount\",\n    \"Number of Records\",\n    \"Order Date\",\n    \"Order ID\",\n    \"Postal Code\",\n    \"Product Name\",\n    \"Profit\",\n    \"Quantity\",\n    \"Region\",\n    \"Sales (bin)\",\n    \"Sales\",\n    \"Segment\",\n    \"Ship Date\",\n    \"Ship Mode\",\n    \"State\",\n    \"Sub-Category\"\n  ]\n}\n\nYour Job:\nI am developing a NL to Data Visualization Dataset. \nPlease help me generate natural language utterance for given dataset and constraints.\nDefinition about the Taks:\n- 'utterance' is what a user would say to make a chart, it can be a question or a command. One NL 'utterance' is in one or two sentences. \n- 'given dataset' is in form of column names, column type, range/unique values of the column.\n- 'constraints' are information about the chart that should be included in the utterance. \n    So we can find a reference phrase in the NL utterance that corresponds to the given constraints. \n- 'reference phrase' can be explicit, ambiguous, and by_value. 'ambiguous' means the phrase can map to more than one columns in the dataset, always a hypernym of column names(depending on the dataset values).\n    For example:\n    {\"column\": \"gdpPercap\", \"nl_ref_type\": \"explicit\", \"nl_ref_phrase\": \"GDP per capita\"},\n    {\"column\": [\"country\",\"continent\"], \"nl_ref_type\": \"ambiguous\", \"nl_ref_phrase\": \"region\"}\n    {\"column\": [\"country\",\"country_short_name\"], \"nl_ref_type\": \"ambiguous\", \"nl_ref_phrase\": \"countries\"}\n    {\"c_type\": \"mark\", \"c_name\": \"point chart\", \"nl_ref_type\": \"explicit\", \"nl_ref_phrase\": \"scatter plot\"}\n    {\"c_type\": \"mark\", \"c_name\": \"arc chart\", \"nl_ref_type\": \"explicit\", \"nl_ref_phrase\": \"pie chart\"}\n    {\"c_type\": \"transform\",\"c_name\": \"filter\",\"c_list\": [{\"field\": \"country\",\"oneOf\": [\"Iceland\",\"Norway\"]}],\"nl_ref_type\": \"explicit\",\"nl_ref_phrase\": \"for countries Iceland and Norway\"},\n    {\"c_type\": \"transform\",\"c_name\": \"filter\",\"c_list\": [{\"field\": \"country\",\"oneOf\": [\"Iceland\",\"Norway\"]}],\"nl_ref_type\": \"by_value\",\"nl_ref_phrase\": \"for Iceland and Norway\"},\n- the 'nl_ref_phrase' for 'ambiguous' columns should be equally near all ambiguous columns, not too near to one of the column since it would not be ambiguous.\n    good example: {\"column\": [\"country\",\"region\"], \"nl_ref_type\": \"ambiguous\", \"nl_ref_phrase\": \"location\"}\n    bad example: {\"column\": [\"country\",\"region\"], \"nl_ref_type\": \"ambiguous\", \"nl_ref_phrase\": \"region\"}\n- You only include given constraints and no other information. \n    For example, if a column name is not in the given constraint, it will not be included in the NL utterance.\n    Also, it a chart mark or chart encoding channel is not in the given constraint, it will not be included in the NL utterance.\n- all 'nl_ref_phrase' shoule be included in the 'nl_utterance'. \n\nThe output format is identical to the input format, but fill in the str blanks(\"...\").\n### Input:\n{\n  \"nl_utterance\": \"...\",\n  \"encoded_fields\": [\n    {\n      \"field\": \"Profit\",\n      \"type\": \"quantitative\",\n      \"nl_ref_type\": \"explicit\",\n      \"nl_ref_phrase\": \"...\"\n    },\n    {\n      \"field\": [\n        \"State\",\n        \"City\",\n        \"Country\",\n        \"Region\",\n        \"Postal Code\"\n      ],\n      \"type\": \"nominal\",\n      \"nl_ref_type\": \"ambiguous\",\n      \"nl_ref_phrase\": \"...\"\n    }\n  ],\n  \"constraints\": [\n    {\n      \"c_type\": \"mark\",\n      \"c_name\": \"bar chart\",\n      \"c_list\": [\n        {\n          \"mark\": \"bar\",\n          \"encoding\": {\n            \"x\": {},\n            \"y\": {\n              \"type\": \"quantitative\"\n            },\n            \"color\": {\n              \"type\": \"nominal\",\n              \"ignore\": true\n            },\n            \"column\": {\n              \"ignore\": true,\n              \"type\": \"nominal\"\n            },\n            \"row\": {\n              \"ignore\": true,\n              \"type\": \"nominal\"\n            }\n          },\n          \"unique_map\": {\n            \"x\": \"y\"\n          }\n        },\n        {\n          \"mark\": \"bar\",\n          \"encoding\": {\n            \"y\": {},\n            \"x\": {\n              \"type\": \"quantitative\"\n            },\n            \"color\": {\n              \"type\": \"nominal\",\n              \"ignore\": true\n            },\n            \"column\": {\n              \"ignore\": true,\n              \"type\": \"nominal\"\n            },\n            \"row\": {\n              \"ignore\": true,\n              \"type\": \"nominal\"\n            }\n          },\n          \"unique_map\": {\n            \"y\": \"x\"\n          }\n        }\n      ],\n      \"nl_ref_type\": \"explicit\",\n      \"nl_ref_phrase\": \"...\"\n    },\n    {\n      \"c_type\": \"transform\",\n      \"c_name\": \"aggregate\",\n      \"c_list\": [\n        {\n          \"field\": \"Profit\",\n          \"aggregate\": \"mean\"\n        }\n      ],\n      \"nl_ref_type\": \"explicit\",\n      \"nl_ref_phrase\": \"...\"\n    }\n  ]\n}\n\n### Output:"
}