{
  "gpt_result": {
    "nl_utterance": "Create a bar chart to show the sum of oil consumption over the years.",
    "encoded_fields": [
      {
        "field": "Year",
        "type": "quantitative",
        "nl_ref_type": "explicit",
        "nl_ref_phrase": "years"
      },
      {
        "field": "Oil Consumption - TWh (zero filled)",
        "type": "quantitative",
        "nl_ref_type": "explicit",
        "nl_ref_phrase": "oil consumption"
      }
    ],
    "constraints": [
      {
        "c_type": "task",
        "c_name": "composition",
        "c_list": [
          {
            "mark": "bar",
            "encoding": {
              "x": {},
              "y": {
                "type": "quantitative"
              },
              "color": {
                "type": "nominal"
              }
            },
            "x_y_reversable": true
          },
          {
            "mark": "area",
            "encoding": {
              "x": {},
              "y": {
                "type": "quantitative"
              },
              "color": {
                "type": "nominal"
              }
            }
          },
          {
            "mark": "arc",
            "encoding": {
              "theta": {
                "type": "quantitative"
              },
              "color": {
                "type": "nominal"
              }
            }
          }
        ],
        "nl_ref_type": "explicit",
        "nl_ref_phrase": "bar chart"
      },
      {
        "c_type": "transform",
        "c_name": "aggregate",
        "c_list": [
          {
            "field": "Oil Consumption - TWh (zero filled)",
            "aggregate": "sum"
          }
        ],
        "nl_ref_type": "explicit",
        "nl_ref_phrase": "sum of oil consumption"
      }
    ]
  },
  "input": "Dataset Information: {\n  \"data samples\": [\n    {\n      \"Unnamed: 0\": 0,\n      \"Entity\": \"Africa\",\n      \"Year\": 1965,\n      \"Geo Biomass Other - TWh (zero filled)\": 0.0,\n      \"Biofuels Consumption - TWh - Total (zero filled)\": 0.0,\n      \"Solar Consumption - TWh (zero filled)\": 0.0,\n      \"Wind Consumption - TWh (zero filled)\": 0.0,\n      \"Hydro Consumption - TWh (zero filled)\": 41.11881256,\n      \"Nuclear Consumption - TWh (zero filled)\": 0.0,\n      \"Gas Consumption - TWh (zero filled)\": 9.543754578,\n      \"Coal Consumption - TWh (zero filled)\": 323.4961243,\n      \"Oil Consumption - TWh (zero filled)\": 341.2627563\n    },\n    {\n      \"Unnamed: 0\": 3654,\n      \"Entity\": \"North Macedonia\",\n      \"Year\": 1974,\n      \"Geo Biomass Other - TWh (zero filled)\": 0.0,\n      \"Biofuels Consumption - TWh - Total (zero filled)\": 0.0,\n      \"Solar Consumption - TWh (zero filled)\": 0.0,\n      \"Wind Consumption - TWh (zero filled)\": 0.0,\n      \"Hydro Consumption - TWh (zero filled)\": 0.0,\n      \"Nuclear Consumption - TWh (zero filled)\": 0.0,\n      \"Gas Consumption - TWh (zero filled)\": 0.0,\n      \"Coal Consumption - TWh (zero filled)\": 0.0,\n      \"Oil Consumption - TWh (zero filled)\": 0.0\n    },\n    {\n      \"Unnamed: 0\": 4130,\n      \"Entity\": \"Other Caribbean (BP)\",\n      \"Year\": 1994,\n      \"Geo Biomass Other - TWh (zero filled)\": 1.131000042,\n      \"Biofuels Consumption - TWh - Total (zero filled)\": 0.0,\n      \"Solar Consumption - TWh (zero filled)\": 0.0,\n      \"Wind Consumption - TWh (zero filled)\": 0.023,\n      \"Hydro Consumption - TWh (zero filled)\": 2.770698786,\n      \"Nuclear Consumption - TWh (zero filled)\": 0.0,\n      \"Gas Consumption - TWh (zero filled)\": 0.424589992,\n      \"Coal Consumption - TWh (zero filled)\": 2.833026409,\n      \"Oil Consumption - TWh (zero filled)\": 343.7015076\n    },\n    {\n      \"Unnamed: 0\": 54,\n      \"Entity\": \"Africa\",\n      \"Year\": 2019,\n      \"Geo Biomass Other - TWh (zero filled)\": 8.262966156,\n      \"Biofuels Consumption - TWh - Total (zero filled)\": 0.0,\n      \"Solar Consumption - TWh (zero filled)\": 33.98899078,\n      \"Wind Consumption - TWh (zero filled)\": 50.95765305,\n      \"Hydro Consumption - TWh (zero filled)\": 367.500946,\n      \"Nuclear Consumption - TWh (zero filled)\": 34.3906517,\n      \"Gas Consumption - TWh (zero filled)\": 1549.72998,\n      \"Coal Consumption - TWh (zero filled)\": 1231.316772,\n      \"Oil Consumption - TWh (zero filled)\": 2262.036133\n    },\n    {\n      \"Unnamed: 0\": 6233,\n      \"Entity\": \"United States\",\n      \"Year\": 1988,\n      \"Geo Biomass Other - TWh (zero filled)\": 42.39406204,\n      \"Biofuels Consumption - TWh - Total (zero filled)\": 0.0,\n      \"Solar Consumption - TWh (zero filled)\": 0.027166666,\n      \"Wind Consumption - TWh (zero filled)\": 0.002602778,\n      \"Hydro Consumption - TWh (zero filled)\": 675.3309326,\n      \"Nuclear Consumption - TWh (zero filled)\": 1573.99353,\n      \"Gas Consumption - TWh (zero filled)\": 4866.021484,\n      \"Coal Consumption - TWh (zero filled)\": 5247.143555,\n      \"Oil Consumption - TWh (zero filled)\": 9520.883789\n    }\n  ],\n  \"column names\": [\n    \"Unnamed: 0\",\n    \"Entity\",\n    \"Year\",\n    \"Geo Biomass Other - TWh (zero filled)\",\n    \"Biofuels Consumption - TWh - Total (zero filled)\",\n    \"Solar Consumption - TWh (zero filled)\",\n    \"Wind Consumption - TWh (zero filled)\",\n    \"Hydro Consumption - TWh (zero filled)\",\n    \"Nuclear Consumption - TWh (zero filled)\",\n    \"Gas Consumption - TWh (zero filled)\",\n    \"Coal Consumption - TWh (zero filled)\",\n    \"Oil Consumption - TWh (zero filled)\"\n  ]\n}\n\nYour Job:\nI am developing a NL to Data Visualization Dataset. \nPlease help me generate natural language utterance for given dataset and constraints.\nDefinition about the Taks:\n- 'utterance' is what a user would say to make a chart. It should be a commands structure. One NL 'utterance' is in one or two sentences. Here are two examples from Commands for reference:\n    Make a simple scatter plot of worldwide Gross by Production Budget categorized by Major Genre.\n    Through a visualization show average horsepower of cars for each country from 1997 to 2011.for country in USA, JAPAN and EUROPE show MPG vs Displacement.\n- 'given dataset' is in form of column names, column type, range/unique values of the column.\n- 'constraints' are information about the chart that should be included in the utterance. \n    So we can find a reference phrase in the NL utterance that corresponds to the given constraints. \n- 'reference phrase' can be explicit, ambiguous, and by_value. 'ambiguous' means the phrase can map to more than one columns in the dataset, always a hypernym of column names(depending on the dataset values).\n    For example:\n    {\"column\": \"gdpPercap\", \"nl_ref_type\": \"explicit\", \"nl_ref_phrase\": \"GDP per capita\"},\n    {\"column\": [\"country\",\"continent\"], \"nl_ref_type\": \"ambiguous\", \"nl_ref_phrase\": \"region\"}\n    {\"column\": [\"country\",\"country_short_name\"], \"nl_ref_type\": \"ambiguous\", \"nl_ref_phrase\": \"countries\"}\n    {\"c_type\": \"mark\", \"c_name\": \"point chart\", \"nl_ref_type\": \"explicit\", \"nl_ref_phrase\": \"scatter plot\"}\n    {\"c_type\": \"mark\", \"c_name\": \"arc chart\", \"nl_ref_type\": \"explicit\", \"nl_ref_phrase\": \"pie chart\"}\n    {\"c_type\": \"transform\",\"c_name\": \"filter\",\"c_list\": [{\"field\": \"country\",\"oneOf\": [\"Iceland\",\"Norway\"]}],\"nl_ref_type\": \"explicit\",\"nl_ref_phrase\": \"for countries Iceland and Norway\"},\n    {\"c_type\": \"transform\",\"c_name\": \"filter\",\"c_list\": [{\"field\": \"country\",\"oneOf\": [\"Iceland\",\"Norway\"]}],\"nl_ref_type\": \"by_value\",\"nl_ref_phrase\": \"for Iceland and Norway\"},\n- the 'nl_ref_phrase' for 'ambiguous' columns should be equally near all ambiguous columns, not too near to one of the column since it would not be ambiguous.\n    good example: {\"column\": [\"country\",\"region\"], \"nl_ref_type\": \"ambiguous\", \"nl_ref_phrase\": \"location\"}\n    bad example: {\"column\": [\"country\",\"region\"], \"nl_ref_type\": \"ambiguous\", \"nl_ref_phrase\": \"region\"}\n- You only include given constraints and no other information. \n    For example, if a column name is not in the given constraint, it will not be included in the NL utterance.\n    Also, it a chart mark or chart encoding channel is not in the given constraint, it will not be included in the NL utterance.\n- all 'nl_ref_phrase' shoule be included in the 'nl_utterance'. \n\nThe output format is identical to the input format, but fill in the str blanks(\"...\").\n### Input:\n{\n  \"nl_utterance\": \"...\",\n  \"encoded_fields\": [\n    {\n      \"field\": \"Year\",\n      \"type\": \"quantitative\",\n      \"nl_ref_type\": \"explicit\",\n      \"nl_ref_phrase\": \"...\"\n    },\n    {\n      \"field\": \"Oil Consumption - TWh (zero filled)\",\n      \"type\": \"quantitative\",\n      \"nl_ref_type\": \"explicit\",\n      \"nl_ref_phrase\": \"...\"\n    }\n  ],\n  \"constraints\": [\n    {\n      \"c_type\": \"task\",\n      \"c_name\": \"composition\",\n      \"c_list\": [\n        {\n          \"mark\": \"bar\",\n          \"encoding\": {\n            \"x\": {},\n            \"y\": {\n              \"type\": \"quantitative\"\n            },\n            \"color\": {\n              \"type\": \"nominal\"\n            }\n          },\n          \"x_y_reversable\": true\n        },\n        {\n          \"mark\": \"area\",\n          \"encoding\": {\n            \"x\": {},\n            \"y\": {\n              \"type\": \"quantitative\"\n            },\n            \"color\": {\n              \"type\": \"nominal\"\n            }\n          }\n        },\n        {\n          \"mark\": \"arc\",\n          \"encoding\": {\n            \"theta\": {\n              \"type\": \"quantitative\"\n            },\n            \"color\": {\n              \"type\": \"nominal\"\n            }\n          }\n        }\n      ],\n      \"nl_ref_type\": \"explicit\",\n      \"nl_ref_phrase\": \"...\"\n    },\n    {\n      \"c_type\": \"transform\",\n      \"c_name\": \"aggregate\",\n      \"c_list\": [\n        {\n          \"field\": \"Oil Consumption - TWh (zero filled)\",\n          \"aggregate\": \"sum\"\n        }\n      ],\n      \"nl_ref_type\": \"explicit\",\n      \"nl_ref_phrase\": \"...\"\n    }\n  ]\n}\n\n### Output:"
}