{
  "gpt_result": {
    "nl_utterance": "Show me a line chart of the CAPE value over time between January 1st, 1900 and November 1st, 2023.",
    "encoded_fields": [
      {
        "field": [
          "Date",
          "year",
          "date2"
        ],
        "type": "quantitative",
        "nl_ref_type": "ambiguous",
        "nl_ref_phrase": "time"
      },
      {
        "field": "CAPE",
        "type": "quantitative",
        "nl_ref_type": "explicit",
        "nl_ref_phrase": "CAPE value"
      }
    ],
    "constraints": [
      {
        "c_type": "mark",
        "c_name": "line chart",
        "c_list": [
          {
            "mark": "line",
            "encoding": {
              "x": {},
              "y": {
                "type": "quantitative"
              },
              "color": {
                "ignore": true,
                "type": "nominal"
              },
              "column": {
                "ignore": true,
                "type": "nominal"
              },
              "row": {
                "ignore": true,
                "type": "nominal"
              }
            },
            "unique_map": {
              "x": "y"
            }
          }
        ],
        "nl_ref_type": "explicit",
        "nl_ref_phrase": "line chart"
      },
      {
        "c_type": "transform",
        "c_name": "filter",
        "c_list": [
          {
            "field": "Date",
            "range": [
              {
                "year": 1900,
                "month": 1,
                "day": 1
              },
              {
                "year": 2023,
                "month": 11,
                "day": 1
              }
            ]
          }
        ],
        "nl_ref_type": "by_value",
        "nl_ref_phrase": "between January 1st, 1900 and November 1st, 2023"
      }
    ]
  },
  "input": "Dataset Information: {\n  \"data samples\": [\n    {\n      \"Date\": 1871.01,\n      \"year\": 1871,\n      \"month\": 1,\n      \"date2\": \"1871-1-01\",\n      \"Price\": 4.44,\n      \"Dividend\": 0.26,\n      \"Earnings\": 0.4,\n      \"CPI\": 12.46406116,\n      \"R\": 5.32,\n      \"PriceReal\": 105.4820771,\n      \"DividendReal\": 6.176878388,\n      \"RealTotalReturn\": 105.4820771,\n      \"EarningsReal\": 9.502889827,\n      \"CAPE\": NaN\n    },\n    {\n      \"Date\": 1957.12,\n      \"year\": 1957,\n      \"month\": 12,\n      \"date2\": \"1957-12-01\",\n      \"Price\": 40.33,\n      \"Dividend\": 1.79,\n      \"Earnings\": 3.37,\n      \"CPI\": 28.4,\n      \"R\": 3.21,\n      \"PriceReal\": 420.4991829,\n      \"DividendReal\": 18.66336567,\n      \"RealTotalReturn\": 42020.81565,\n      \"EarningsReal\": 35.13717447,\n      \"CAPE\": 13.67324606\n    },\n    {\n      \"Date\": 1936.09,\n      \"year\": 1936,\n      \"month\": 9,\n      \"date2\": \"1936-9-01\",\n      \"Price\": 16.05,\n      \"Dividend\": 0.61,\n      \"Earnings\": 0.94,\n      \"CPI\": 14.0,\n      \"R\": 2.67,\n      \"PriceReal\": 339.4706839,\n      \"DividendReal\": 12.90200107,\n      \"RealTotalReturn\": 10712.97198,\n      \"EarningsReal\": 19.88177214,\n      \"CAPE\": 19.86202424\n    }\n  ],\n  \"column names\": [\n    \"Date\",\n    \"year\",\n    \"month\",\n    \"date2\",\n    \"Price\",\n    \"Dividend\",\n    \"Earnings\",\n    \"CPI\",\n    \"R\",\n    \"PriceReal\",\n    \"DividendReal\",\n    \"RealTotalReturn\",\n    \"EarningsReal\",\n    \"CAPE\"\n  ]\n}\n\nYour Job:\nI am developing a NL to Data Visualization Dataset. \nPlease help me generate natural language utterance for given dataset and constraints.\nDefinition about the Taks:\n- 'utterance' is what a user would say to make a chart, it can be a question or a command. One NL 'utterance' is in one or two sentences. \n- 'given dataset' is in form of column names, column type, range/unique values of the column.\n- 'constraints' are information about the chart that should be included in the utterance. \n    So we can find a reference phrase in the NL utterance that corresponds to the given constraints. \n- 'reference phrase' can be explicit, ambiguous, and by_value. 'ambiguous' means the phrase can map to more than one columns in the dataset, always a hypernym of column names(depending on the dataset values).\n    For example:\n    {\"column\": \"gdpPercap\", \"nl_ref_type\": \"explicit\", \"nl_ref_phrase\": \"GDP per capita\"},\n    {\"column\": [\"country\",\"continent\"], \"nl_ref_type\": \"ambiguous\", \"nl_ref_phrase\": \"region\"}\n    {\"column\": [\"country\",\"country_short_name\"], \"nl_ref_type\": \"ambiguous\", \"nl_ref_phrase\": \"countries\"}\n    {\"c_type\": \"mark\", \"c_name\": \"point chart\", \"nl_ref_type\": \"explicit\", \"nl_ref_phrase\": \"scatter plot\"}\n    {\"c_type\": \"mark\", \"c_name\": \"arc chart\", \"nl_ref_type\": \"explicit\", \"nl_ref_phrase\": \"pie chart\"}\n    {\"c_type\": \"transform\",\"c_name\": \"filter\",\"c_list\": [{\"field\": \"country\",\"oneOf\": [\"Iceland\",\"Norway\"]}],\"nl_ref_type\": \"explicit\",\"nl_ref_phrase\": \"for countries Iceland and Norway\"},\n    {\"c_type\": \"transform\",\"c_name\": \"filter\",\"c_list\": [{\"field\": \"country\",\"oneOf\": [\"Iceland\",\"Norway\"]}],\"nl_ref_type\": \"by_value\",\"nl_ref_phrase\": \"for Iceland and Norway\"},\n- the 'nl_ref_phrase' for 'ambiguous' columns should be equally near all ambiguous columns, not too near to one of the column since it would not be ambiguous.\n    good example: {\"column\": [\"country\",\"region\"], \"nl_ref_type\": \"ambiguous\", \"nl_ref_phrase\": \"location\"}\n    bad example: {\"column\": [\"country\",\"region\"], \"nl_ref_type\": \"ambiguous\", \"nl_ref_phrase\": \"region\"}\n- You only include given constraints and no other information. \n    For example, if a column name is not in the given constraint, it will not be included in the NL utterance.\n    Also, it a chart mark or chart encoding channel is not in the given constraint, it will not be included in the NL utterance.\n- all 'nl_ref_phrase' shoule be included in the 'nl_utterance'. \n\nThe output format is identical to the input format, but fill in the str blanks(\"...\").\n### Input:\n{\n  \"nl_utterance\": \"...\",\n  \"encoded_fields\": [\n    {\n      \"field\": [\n        \"Date\",\n        \"year\",\n        \"date2\"\n      ],\n      \"type\": \"quantitative\",\n      \"nl_ref_type\": \"ambiguous\",\n      \"nl_ref_phrase\": \"...\"\n    },\n    {\n      \"field\": \"CAPE\",\n      \"type\": \"quantitative\",\n      \"nl_ref_type\": \"explicit\",\n      \"nl_ref_phrase\": \"...\"\n    }\n  ],\n  \"constraints\": [\n    {\n      \"c_type\": \"mark\",\n      \"c_name\": \"line chart\",\n      \"c_list\": [\n        {\n          \"mark\": \"line\",\n          \"encoding\": {\n            \"x\": {},\n            \"y\": {\n              \"type\": \"quantitative\"\n            },\n            \"color\": {\n              \"ignore\": true,\n              \"type\": \"nominal\"\n            },\n            \"column\": {\n              \"ignore\": true,\n              \"type\": \"nominal\"\n            },\n            \"row\": {\n              \"ignore\": true,\n              \"type\": \"nominal\"\n            }\n          },\n          \"unique_map\": {\n            \"x\": \"y\"\n          }\n        }\n      ],\n      \"nl_ref_type\": \"explicit\",\n      \"nl_ref_phrase\": \"...\"\n    },\n    {\n      \"c_type\": \"transform\",\n      \"c_name\": \"filter\",\n      \"c_list\": [\n        {\n          \"field\": \"Date\",\n          \"range\": [\n            {\n              \"year\": 1900,\n              \"month\": 1,\n              \"day\": 1\n            },\n            {\n              \"year\": 2023,\n              \"month\": 11,\n              \"day\": 1\n            }\n          ]\n        }\n      ],\n      \"nl_ref_type\": \"by_value\",\n      \"nl_ref_phrase\": \"...\"\n    }\n  ]\n}\n\n### Output:"
}