{
  "gpt_result": {
    "nl_utterance": "What is the trend in the sum of IMF Credit/GDP over time?",
    "encoded_fields": [
      {
        "field": "IMF Credit/GDP",
        "type": "quantitative",
        "nl_ref_type": "explicit",
        "nl_ref_phrase": "IMF Credit/GDP"
      }
    ],
    "constraints": [
      {
        "c_type": "task",
        "c_name": "trend",
        "c_list": [
          {
            "mark": [
              "bar",
              "line",
              "area"
            ],
            "encoding": {
              "x": {
                "type": "temporal"
              }
            }
          }
        ],
        "nl_ref_type": "explicit",
        "nl_ref_phrase": "trend"
      },
      {
        "c_type": "transform",
        "c_name": "aggregate",
        "c_list": [
          {
            "field": "IMF Credit/GDP",
            "aggregate": "sum"
          }
        ],
        "nl_ref_type": "explicit",
        "nl_ref_phrase": "sum"
      }
    ]
  },
  "input": "Dataset Information: {\n  \"data samples\": [\n    {\n      \"Date\": \"09/30/2022\",\n      \"GRA Purchases\": 91088136681,\n      \"PRGT 1/2/\": 15386591496,\n      \"Totals\": 106000000000.0,\n      \"Year\": 2022,\n      \"Total (Billion)\": 106.48,\n      \"Total ($)\": 138.56,\n      \"GDP, current prices (Billions of U.S. dollars)\": 103496.115,\n      \"IMF Credit/GDP\": 0.13,\n      \"Unnamed: 9\": NaN,\n      \"Unnamed: 10\": NaN,\n      \"Unnamed: 11\": NaN,\n      \"Unnamed: 12\": NaN,\n      \"Unnamed: 13\": NaN,\n      \"As of 31/08/22\": \"1 SDR =\",\n      \"$\": 1.30134\n    },\n    {\n      \"Date\": \"12/31/1999\",\n      \"GRA Purchases\": 51061861875,\n      \"PRGT 1/2/\": 6434274362,\n      \"Totals\": 57496136237.0,\n      \"Year\": 1999,\n      \"Total (Billion)\": 57.5,\n      \"Total ($)\": 74.82,\n      \"GDP, current prices (Billions of U.S. dollars)\": 32960.333,\n      \"IMF Credit/GDP\": 0.23,\n      \"Unnamed: 9\": NaN,\n      \"Unnamed: 10\": NaN,\n      \"Unnamed: 11\": NaN,\n      \"Unnamed: 12\": NaN,\n      \"Unnamed: 13\": NaN,\n      \"As of 31/08/22\": NaN,\n      \"$\": NaN\n    },\n    {\n      \"Date\": \"12/31/2011\",\n      \"GRA Purchases\": 87276915790,\n      \"PRGT 1/2/\": 5308609594,\n      \"Totals\": 92585525384.0,\n      \"Year\": 2011,\n      \"Total (Billion)\": 92.59,\n      \"Total ($)\": 120.49,\n      \"GDP, current prices (Billions of U.S. dollars)\": 73773.48,\n      \"IMF Credit/GDP\": 0.16,\n      \"Unnamed: 9\": NaN,\n      \"Unnamed: 10\": NaN,\n      \"Unnamed: 11\": NaN,\n      \"Unnamed: 12\": NaN,\n      \"Unnamed: 13\": NaN,\n      \"As of 31/08/22\": NaN,\n      \"$\": NaN\n    },\n    {\n      \"Date\": \"12/31/1988\",\n      \"GRA Purchases\": 24750004884,\n      \"PRGT 1/2/\": 1773964293,\n      \"Totals\": 26523969177.0,\n      \"Year\": 1988,\n      \"Total (Billion)\": 26.52,\n      \"Total ($)\": 34.52,\n      \"GDP, current prices (Billions of U.S. dollars)\": 19131.406,\n      \"IMF Credit/GDP\": 0.18,\n      \"Unnamed: 9\": NaN,\n      \"Unnamed: 10\": NaN,\n      \"Unnamed: 11\": NaN,\n      \"Unnamed: 12\": NaN,\n      \"Unnamed: 13\": NaN,\n      \"As of 31/08/22\": NaN,\n      \"$\": NaN\n    },\n    {\n      \"Date\": \"12/31/2020\",\n      \"GRA Purchases\": 93408630285,\n      \"PRGT 1/2/\": 12481816684,\n      \"Totals\": 106000000000.0,\n      \"Year\": 2020,\n      \"Total (Billion)\": 105.89,\n      \"Total ($)\": 137.8,\n      \"GDP, current prices (Billions of U.S. dollars)\": 87654.342,\n      \"IMF Credit/GDP\": 0.16,\n      \"Unnamed: 9\": NaN,\n      \"Unnamed: 10\": NaN,\n      \"Unnamed: 11\": NaN,\n      \"Unnamed: 12\": NaN,\n      \"Unnamed: 13\": NaN,\n      \"As of 31/08/22\": NaN,\n      \"$\": NaN\n    }\n  ],\n  \"column names\": [\n    \"Date\",\n    \"GRA Purchases\",\n    \"PRGT 1/2/\",\n    \"Totals\",\n    \"Year\",\n    \"Total (Billion)\",\n    \"Total ($)\",\n    \"GDP, current prices (Billions of U.S. dollars)\",\n    \"IMF Credit/GDP\",\n    \"Unnamed: 9\",\n    \"Unnamed: 10\",\n    \"Unnamed: 11\",\n    \"Unnamed: 12\",\n    \"Unnamed: 13\",\n    \"As of 31/08/22\",\n    \"$\"\n  ]\n}\n\nYour Job:\nI am developing a NL to Data Visualization Dataset. \nPlease help me generate natural language utterance for given dataset and constraints.\nDefinition about the Taks:\n- 'utterance' is what a user would say to make a chart. It should be a questions structure. One NL 'utterance' is in one or two sentences. Here are two examples from Questions for reference:\n    What major genre had the highest average worldwide gross?\n    What is our profit based on shipping mode by customer segment?\n- 'given dataset' is in form of column names, column type, range/unique values of the column.\n- 'constraints' are information about the chart that should be included in the utterance. \n    So we can find a reference phrase in the NL utterance that corresponds to the given constraints. \n- 'reference phrase' can be explicit, ambiguous, and by_value. 'ambiguous' means the phrase can map to more than one columns in the dataset, always a hypernym of column names(depending on the dataset values).\n    For example:\n    {\"column\": \"gdpPercap\", \"nl_ref_type\": \"explicit\", \"nl_ref_phrase\": \"GDP per capita\"},\n    {\"column\": [\"country\",\"continent\"], \"nl_ref_type\": \"ambiguous\", \"nl_ref_phrase\": \"region\"}\n    {\"column\": [\"country\",\"country_short_name\"], \"nl_ref_type\": \"ambiguous\", \"nl_ref_phrase\": \"countries\"}\n    {\"c_type\": \"mark\", \"c_name\": \"point chart\", \"nl_ref_type\": \"explicit\", \"nl_ref_phrase\": \"scatter plot\"}\n    {\"c_type\": \"mark\", \"c_name\": \"arc chart\", \"nl_ref_type\": \"explicit\", \"nl_ref_phrase\": \"pie chart\"}\n    {\"c_type\": \"transform\",\"c_name\": \"filter\",\"c_list\": [{\"field\": \"country\",\"oneOf\": [\"Iceland\",\"Norway\"]}],\"nl_ref_type\": \"explicit\",\"nl_ref_phrase\": \"for countries Iceland and Norway\"},\n    {\"c_type\": \"transform\",\"c_name\": \"filter\",\"c_list\": [{\"field\": \"country\",\"oneOf\": [\"Iceland\",\"Norway\"]}],\"nl_ref_type\": \"by_value\",\"nl_ref_phrase\": \"for Iceland and Norway\"},\n- the 'nl_ref_phrase' for 'ambiguous' columns should be equally near all ambiguous columns, not too near to one of the column since it would not be ambiguous.\n    good example: {\"column\": [\"country\",\"region\"], \"nl_ref_type\": \"ambiguous\", \"nl_ref_phrase\": \"location\"}\n    bad example: {\"column\": [\"country\",\"region\"], \"nl_ref_type\": \"ambiguous\", \"nl_ref_phrase\": \"region\"}\n- You only include given constraints and no other information. \n    For example, if a column name is not in the given constraint, it will not be included in the NL utterance.\n    Also, it a chart mark or chart encoding channel is not in the given constraint, it will not be included in the NL utterance.\n- all 'nl_ref_phrase' shoule be included in the 'nl_utterance'. \n\nThe output format is identical to the input format, but fill in the str blanks(\"...\").\n### Input:\n{\n  \"nl_utterance\": \"...\",\n  \"encoded_fields\": [\n    {\n      \"field\": \"IMF Credit/GDP\",\n      \"type\": \"quantitative\",\n      \"nl_ref_type\": \"explicit\",\n      \"nl_ref_phrase\": \"...\"\n    }\n  ],\n  \"constraints\": [\n    {\n      \"c_type\": \"task\",\n      \"c_name\": \"trend\",\n      \"c_list\": [\n        {\n          \"mark\": [\n            \"bar\",\n            \"line\",\n            \"area\"\n          ],\n          \"encoding\": {\n            \"x\": {\n              \"type\": \"temporal\"\n            }\n          }\n        }\n      ],\n      \"nl_ref_type\": \"explicit\",\n      \"nl_ref_phrase\": \"...\"\n    },\n    {\n      \"c_type\": \"transform\",\n      \"c_name\": \"aggregate\",\n      \"c_list\": [\n        {\n          \"field\": \"IMF Credit/GDP\",\n          \"aggregate\": \"sum\"\n        }\n      ],\n      \"nl_ref_type\": \"explicit\",\n      \"nl_ref_phrase\": \"...\"\n    }\n  ]\n}\n\n### Output:"
}