{
  "gpt_result": {
    "nl_utterance": "Show me the sum of Total GDP adjusted in billions across years.",
    "encoded_fields": [
      {
        "field": [
          "Date",
          "Year"
        ],
        "type": "quantitative",
        "nl_ref_type": "ambiguous",
        "nl_ref_phrase": "years"
      },
      {
        "field": "Total_GDP_adjusted_billions",
        "type": "quantitative",
        "nl_ref_type": "explicit",
        "nl_ref_phrase": "Total GDP adjusted in billions"
      }
    ],
    "constraints": [
      {
        "c_type": "transform",
        "c_name": "aggregate",
        "c_list": [
          {
            "field": "Total_GDP_adjusted_billions",
            "aggregate": "sum"
          }
        ],
        "nl_ref_type": "explicit",
        "nl_ref_phrase": "sum of Total GDP adjusted in billions"
      }
    ]
  },
  "input": "Dataset Information: {\n  \"data samples\": [\n    {\n      \"Date\": \"08/31/2022\",\n      \"GRA Purchases\": 93769635059.0,\n      \"PRGT 1/2/\": 15254184552.0,\n      \"Totals\": 109000000000.0,\n      \"Year\": 2022.0,\n      \"Total_billions \": 109.0238196,\n      \"Unnamed: 6\": NaN,\n      \"WorldGDP_billions\": NaN,\n      \"Total_GDP_adjusted_billions\": NaN,\n      \"Unnamed: 9\": NaN,\n      \"Unnamed: 10\": NaN\n    },\n    {\n      \"Date\": \"12/31/1998\",\n      \"GRA Purchases\": 60451017051.0,\n      \"PRGT 1/2/\": 6288825925.0,\n      \"Totals\": 66739842976.0,\n      \"Year\": 1998.0,\n      \"Total_billions \": 66.73984298,\n      \"Unnamed: 6\": \"58,443.07\",\n      \"WorldGDP_billions\": 31824.477,\n      \"Total_GDP_adjusted_billions\": 0.0021,\n      \"Unnamed: 9\": NaN,\n      \"Unnamed: 10\": NaN\n    },\n    {\n      \"Date\": \"12/31/2008\",\n      \"GRA Purchases\": 17514964723.0,\n      \"PRGT 1/2/\": 3972372030.0,\n      \"Totals\": 21487336753.0,\n      \"Year\": 2008.0,\n      \"Total_billions \": 21.48733675,\n      \"Unnamed: 6\": \"31,979.65\",\n      \"WorldGDP_billions\": 64108.44,\n      \"Total_GDP_adjusted_billions\": 0.000335,\n      \"Unnamed: 9\": NaN,\n      \"Unnamed: 10\": NaN\n    },\n    {\n      \"Date\": \"12/31/1997\",\n      \"GRA Purchases\": 46559033783.0,\n      \"PRGT 1/2/\": 6009867422.0,\n      \"Totals\": 52568901205.0,\n      \"Year\": 1997.0,\n      \"Total_billions \": 52.56890121,\n      \"Unnamed: 6\": \"64,108.44\",\n      \"WorldGDP_billions\": 31979.647,\n      \"Total_GDP_adjusted_billions\": 0.00164,\n      \"Unnamed: 9\": NaN,\n      \"Unnamed: 10\": NaN\n    },\n    {\n      \"Date\": \"12/31/1986\",\n      \"GRA Purchases\": 33334905644.0,\n      \"PRGT 1/2/\": 2013169931.0,\n      \"Totals\": 35348075575.0,\n      \"Year\": 1986.0,\n      \"Total_billions \": 35.34807558,\n      \"Unnamed: 6\": \"87,536.34\",\n      \"WorldGDP_billions\": 14771.979,\n      \"Total_GDP_adjusted_billions\": 0.00239,\n      \"Unnamed: 9\": NaN,\n      \"Unnamed: 10\": NaN\n    }\n  ],\n  \"column names\": [\n    \"Date\",\n    \"GRA Purchases\",\n    \"PRGT 1/2/\",\n    \"Totals\",\n    \"Year\",\n    \"Total_billions \",\n    \"Unnamed: 6\",\n    \"WorldGDP_billions\",\n    \"Total_GDP_adjusted_billions\",\n    \"Unnamed: 9\",\n    \"Unnamed: 10\"\n  ]\n}\n\nYour Job:\nI am developing a NL to Data Visualization Dataset. \nPlease help me generate natural language utterance for given dataset and constraints.\nDefinition about the Taks:\n- 'utterance' is what a user would say to make a chart.  One NL 'utterance' is in one or two sentences. Here are two examples from Others for reference:\n    I want to know how many orders there are by the quantity of the order.\n    scatter(x=production budget, y=worldwide gross) for content rating.\n- 'given dataset' is in form of column names, column type, range/unique values of the column.\n- 'constraints' are information about the chart that should be included in the utterance. \n    So we can find a reference phrase in the NL utterance that corresponds to the given constraints. \n- 'reference phrase' can be explicit, ambiguous, and by_value. 'ambiguous' means the phrase can map to more than one columns in the dataset, always a hypernym of column names(depending on the dataset values).\n    For example:\n    {\"column\": \"gdpPercap\", \"nl_ref_type\": \"explicit\", \"nl_ref_phrase\": \"GDP per capita\"},\n    {\"column\": [\"country\",\"continent\"], \"nl_ref_type\": \"ambiguous\", \"nl_ref_phrase\": \"region\"}\n    {\"column\": [\"country\",\"country_short_name\"], \"nl_ref_type\": \"ambiguous\", \"nl_ref_phrase\": \"countries\"}\n    {\"c_type\": \"mark\", \"c_name\": \"point chart\", \"nl_ref_type\": \"explicit\", \"nl_ref_phrase\": \"scatter plot\"}\n    {\"c_type\": \"mark\", \"c_name\": \"arc chart\", \"nl_ref_type\": \"explicit\", \"nl_ref_phrase\": \"pie chart\"}\n    {\"c_type\": \"transform\",\"c_name\": \"filter\",\"c_list\": [{\"field\": \"country\",\"oneOf\": [\"Iceland\",\"Norway\"]}],\"nl_ref_type\": \"explicit\",\"nl_ref_phrase\": \"for countries Iceland and Norway\"},\n    {\"c_type\": \"transform\",\"c_name\": \"filter\",\"c_list\": [{\"field\": \"country\",\"oneOf\": [\"Iceland\",\"Norway\"]}],\"nl_ref_type\": \"by_value\",\"nl_ref_phrase\": \"for Iceland and Norway\"},\n- the 'nl_ref_phrase' for 'ambiguous' columns should be equally near all ambiguous columns, not too near to one of the column since it would not be ambiguous.\n    good example: {\"column\": [\"country\",\"region\"], \"nl_ref_type\": \"ambiguous\", \"nl_ref_phrase\": \"location\"}\n    bad example: {\"column\": [\"country\",\"region\"], \"nl_ref_type\": \"ambiguous\", \"nl_ref_phrase\": \"region\"}\n- You only include given constraints and no other information. \n    For example, if a column name is not in the given constraint, it will not be included in the NL utterance.\n    Also, it a chart mark or chart encoding channel is not in the given constraint, it will not be included in the NL utterance.\n- all 'nl_ref_phrase' shoule be included in the 'nl_utterance'. \n\nThe output format is identical to the input format, but fill in the str blanks(\"...\").\n### Input:\n{\n  \"nl_utterance\": \"...\",\n  \"encoded_fields\": [\n    {\n      \"field\": [\n        \"Date\",\n        \"Year\"\n      ],\n      \"type\": \"quantitative\",\n      \"nl_ref_type\": \"ambiguous\",\n      \"nl_ref_phrase\": \"...\"\n    },\n    {\n      \"field\": \"Total_GDP_adjusted_billions\",\n      \"type\": \"quantitative\",\n      \"nl_ref_type\": \"explicit\",\n      \"nl_ref_phrase\": \"...\"\n    }\n  ],\n  \"constraints\": [\n    {\n      \"c_type\": \"transform\",\n      \"c_name\": \"aggregate\",\n      \"c_list\": [\n        {\n          \"field\": \"Total_GDP_adjusted_billions\",\n          \"aggregate\": \"sum\"\n        }\n      ],\n      \"nl_ref_type\": \"explicit\",\n      \"nl_ref_phrase\": \"...\"\n    }\n  ]\n}\n\n### Output:"
}