{
  "gpt_result": {
    "nl_utterance": "Show a scatter plot to explore the correlation between GDP per capita, Human Capital Index, and population across different regions, considering only entries with Human Capital Index greater than 0 and GDP per capita (PPP) greater than 1000.",
    "encoded_fields": [
      {
        "field": "GDP per capita (PPP)",
        "type": "quantitative",
        "nl_ref_type": "explicit",
        "nl_ref_phrase": "GDP per capita"
      },
      {
        "field": "Human Capital Index",
        "type": "quantitative",
        "nl_ref_type": "explicit",
        "nl_ref_phrase": "Human Capital Index"
      },
      {
        "field": [
          "Continent",
          "Region"
        ],
        "type": "nominal",
        "nl_ref_type": "ambiguous",
        "nl_ref_phrase": "regions"
      },
      {
        "field": "Population",
        "type": "quantitative",
        "nl_ref_type": "explicit",
        "nl_ref_phrase": "population"
      }
    ],
    "constraints": [
      {
        "c_type": "task",
        "c_name": "correlation",
        "c_list": [
          {
            "mark": "circle",
            "encoding": {
              "x": {
                "type": "quantitative"
              },
              "y": {
                "type": "quantitative"
              }
            }
          }
        ],
        "nl_ref_type": "explicit",
        "nl_ref_phrase": "correlation"
      },
      {
        "c_type": "transform",
        "c_name": "filter",
        "c_list": [
          {
            "field": "Human Capital Index",
            "gt": 0
          }
        ],
        "nl_ref_type": "by_value",
        "nl_ref_phrase": "Human Capital Index greater than 0"
      },
      {
        "c_type": "transform",
        "c_name": "filter",
        "c_list": [
          {
            "field": "GDP per capita (PPP)",
            "gt": 1000
          }
        ],
        "nl_ref_type": "by_value",
        "nl_ref_phrase": "GDP per capita (PPP) greater than 1000"
      }
    ]
  },
  "input": "Dataset Information: {\n  \"data samples\": [\n    {\n      \"Country\": \"Afghanistan\",\n      \"ISO3\": \"AFG\",\n      \"Region\": \"South Asia\",\n      \"Income Group\": \"Low income\",\n      \"Probability of Survival to Age 5\": 0.93425,\n      \"Expected Years of School\": 9.65539,\n      \"Harmonized Test Scores\": 357.79474,\n      \"Learning-Adjusted Years of School\": 5.52743,\n      \"Fraction of Children Under 5 Not Stunted\": 0.61741,\n      \"Adult Survival Rate\": 0.76612,\n      \"Human Capital Index\": 0.41128,\n      \"GDP per capita (PPP)\": 2076.13838,\n      \"Log GDP per capita\": 7.638264899097053,\n      \"Population\": 38972230.0,\n      \"Continent\": \"Asia\"\n    },\n    {\n      \"Country\": \"Guyana\",\n      \"ISO3\": \"GUY\",\n      \"Region\": \"Latin America & Caribbean\",\n      \"Income Group\": \"Upper middle income\",\n      \"Probability of Survival to Age 5\": 0.96603,\n      \"Expected Years of School\": 12.10649,\n      \"Harmonized Test Scores\": 337.77081,\n      \"Learning-Adjusted Years of School\": 6.54275,\n      \"Fraction of Children Under 5 Not Stunted\": 0.87458,\n      \"Adult Survival Rate\": 0.73222,\n      \"Human Capital Index\": 0.47698,\n      \"GDP per capita (PPP)\": 19439.93098,\n      \"Log GDP per capita\": 9.875084527596604,\n      \"Population\": 797202.0,\n      \"Continent\": \"America\"\n    },\n    {\n      \"Country\": \"Belarus\",\n      \"ISO3\": \"BLR\",\n      \"Region\": \"Europe & Central Asia\",\n      \"Income Group\": \"Upper middle income\",\n      \"Probability of Survival to Age 5\": 0.99618,\n      \"Expected Years of School\": 13.84632,\n      \"Harmonized Test Scores\": 486.04813,\n      \"Learning-Adjusted Years of School\": 10.76796,\n      \"Fraction of Children Under 5 Not Stunted\": NaN,\n      \"Adult Survival Rate\": 0.78099,\n      \"Human Capital Index\": 0.66674,\n      \"GDP per capita (PPP)\": 20278.47395,\n      \"Log GDP per capita\": 9.917315205859964,\n      \"Population\": 9379952.0,\n      \"Continent\": \"Europe\"\n    },\n    {\n      \"Country\": \"Tunisia\",\n      \"ISO3\": \"TUN\",\n      \"Region\": \"Middle East & North Africa\",\n      \"Income Group\": \"Lower middle income\",\n      \"Probability of Survival to Age 5\": 0.98158,\n      \"Expected Years of School\": 9.97263,\n      \"Harmonized Test Scores\": 381.46213,\n      \"Learning-Adjusted Years of School\": 6.08669,\n      \"Fraction of Children Under 5 Not Stunted\": 0.91958,\n      \"Adult Survival Rate\": 0.89497,\n      \"Human Capital Index\": 0.49664,\n      \"GDP per capita (PPP)\": 10571.90084,\n      \"Log GDP per capita\": 9.265954896187193,\n      \"Population\": 12161723.0,\n      \"Continent\": \"Africa\"\n    },\n    {\n      \"Country\": \"Philippines\",\n      \"ISO3\": \"PHL\",\n      \"Region\": \"East Asia & Pacific\",\n      \"Income Group\": \"Lower middle income\",\n      \"Probability of Survival to Age 5\": 0.96866,\n      \"Expected Years of School\": 12.75168,\n      \"Harmonized Test Scores\": 354.10443,\n      \"Learning-Adjusted Years of School\": 7.22468,\n      \"Fraction of Children Under 5 Not Stunted\": 0.68893,\n      \"Adult Survival Rate\": 0.7663,\n      \"Human Capital Index\": 0.49456,\n      \"GDP per capita (PPP)\": 8198.967501,\n      \"Log GDP per capita\": 9.011763510812251,\n      \"Population\": 112190977.0,\n      \"Continent\": \"Asia\"\n    }\n  ],\n  \"column names\": [\n    \"Country\",\n    \"ISO3\",\n    \"Region\",\n    \"Income Group\",\n    \"Probability of Survival to Age 5\",\n    \"Expected Years of School\",\n    \"Harmonized Test Scores\",\n    \"Learning-Adjusted Years of School\",\n    \"Fraction of Children Under 5 Not Stunted\",\n    \"Adult Survival Rate\",\n    \"Human Capital Index\",\n    \"GDP per capita (PPP)\",\n    \"Log GDP per capita\",\n    \"Population\",\n    \"Continent\"\n  ]\n}\n\nYour Job:\nI am developing a NL to Data Visualization Dataset. \nPlease help me generate natural language utterance for given dataset and constraints.\nDefinition about the Taks:\n- 'utterance' is what a user would say to make a chart. It should be a queries structure. One NL 'utterance' is in one or two sentences. Here are two examples from Queries for reference:\n    Gross versus genre.\n    Scatter plot, sales by profit.\n- 'given dataset' is in form of column names, column type, range/unique values of the column.\n- 'constraints' are information about the chart that should be included in the utterance. \n    So we can find a reference phrase in the NL utterance that corresponds to the given constraints. \n- 'reference phrase' can be explicit, ambiguous, and by_value. 'ambiguous' means the phrase can map to more than one columns in the dataset, always a hypernym of column names(depending on the dataset values).\n    For example:\n    {\"column\": \"gdpPercap\", \"nl_ref_type\": \"explicit\", \"nl_ref_phrase\": \"GDP per capita\"},\n    {\"column\": [\"country\",\"continent\"], \"nl_ref_type\": \"ambiguous\", \"nl_ref_phrase\": \"region\"}\n    {\"column\": [\"country\",\"country_short_name\"], \"nl_ref_type\": \"ambiguous\", \"nl_ref_phrase\": \"countries\"}\n    {\"c_type\": \"mark\", \"c_name\": \"point chart\", \"nl_ref_type\": \"explicit\", \"nl_ref_phrase\": \"scatter plot\"}\n    {\"c_type\": \"mark\", \"c_name\": \"arc chart\", \"nl_ref_type\": \"explicit\", \"nl_ref_phrase\": \"pie chart\"}\n    {\"c_type\": \"transform\",\"c_name\": \"filter\",\"c_list\": [{\"field\": \"country\",\"oneOf\": [\"Iceland\",\"Norway\"]}],\"nl_ref_type\": \"explicit\",\"nl_ref_phrase\": \"for countries Iceland and Norway\"},\n    {\"c_type\": \"transform\",\"c_name\": \"filter\",\"c_list\": [{\"field\": \"country\",\"oneOf\": [\"Iceland\",\"Norway\"]}],\"nl_ref_type\": \"by_value\",\"nl_ref_phrase\": \"for Iceland and Norway\"},\n- the 'nl_ref_phrase' for 'ambiguous' columns should be equally near all ambiguous columns, not too near to one of the column since it would not be ambiguous.\n    good example: {\"column\": [\"country\",\"region\"], \"nl_ref_type\": \"ambiguous\", \"nl_ref_phrase\": \"location\"}\n    bad example: {\"column\": [\"country\",\"region\"], \"nl_ref_type\": \"ambiguous\", \"nl_ref_phrase\": \"region\"}\n- You only include given constraints and no other information. \n    For example, if a column name is not in the given constraint, it will not be included in the NL utterance.\n    Also, it a chart mark or chart encoding channel is not in the given constraint, it will not be included in the NL utterance.\n- all 'nl_ref_phrase' shoule be included in the 'nl_utterance'. \n\nThe output format is identical to the input format, but fill in the str blanks(\"...\").\n### Input:\n{\n  \"nl_utterance\": \"...\",\n  \"encoded_fields\": [\n    {\n      \"field\": \"GDP per capita (PPP)\",\n      \"type\": \"quantitative\",\n      \"nl_ref_type\": \"explicit\",\n      \"nl_ref_phrase\": \"...\"\n    },\n    {\n      \"field\": \"Human Capital Index\",\n      \"type\": \"quantitative\",\n      \"nl_ref_type\": \"explicit\",\n      \"nl_ref_phrase\": \"...\"\n    },\n    {\n      \"field\": [\n        \"Continent\",\n        \"Region\"\n      ],\n      \"type\": \"nominal\",\n      \"nl_ref_type\": \"ambiguous\",\n      \"nl_ref_phrase\": \"...\"\n    },\n    {\n      \"field\": \"Population\",\n      \"type\": \"quantitative\",\n      \"nl_ref_type\": \"explicit\",\n      \"nl_ref_phrase\": \"...\"\n    }\n  ],\n  \"constraints\": [\n    {\n      \"c_type\": \"task\",\n      \"c_name\": \"correlation\",\n      \"c_list\": [\n        {\n          \"mark\": \"circle\",\n          \"encoding\": {\n            \"x\": {\n              \"type\": \"quantitative\"\n            },\n            \"y\": {\n              \"type\": \"quantitative\"\n            }\n          }\n        }\n      ],\n      \"nl_ref_type\": \"explicit\",\n      \"nl_ref_phrase\": \"...\"\n    },\n    {\n      \"c_type\": \"transform\",\n      \"c_name\": \"filter\",\n      \"c_list\": [\n        {\n          \"field\": \"Human Capital Index\",\n          \"gt\": 0\n        }\n      ],\n      \"nl_ref_type\": \"by_value\",\n      \"nl_ref_phrase\": \"...\"\n    },\n    {\n      \"c_type\": \"transform\",\n      \"c_name\": \"filter\",\n      \"c_list\": [\n        {\n          \"field\": \"GDP per capita (PPP)\",\n          \"gt\": 1000\n        }\n      ],\n      \"nl_ref_type\": \"by_value\",\n      \"nl_ref_phrase\": \"...\"\n    }\n  ]\n}\n\n### Output:"
}