{
  "gpt_result": {
    "nl_utterance": "How has the total dollar amount changed over time? Can you show the trend?",
    "encoded_fields": [
      {
        "field": [
          "Date",
          "Year"
        ],
        "type": "quantitative",
        "nl_ref_type": "ambiguous",
        "nl_ref_phrase": "time"
      },
      {
        "field": "Totals_USD",
        "type": "quantitative",
        "nl_ref_type": "explicit",
        "nl_ref_phrase": "total dollar amount"
      }
    ],
    "constraints": [
      {
        "c_type": "task",
        "c_name": "trend",
        "c_list": [
          {
            "mark": [
              "bar",
              "line",
              "area"
            ],
            "encoding": {
              "x": {
                "type": "temporal"
              }
            }
          }
        ],
        "nl_ref_type": "explicit",
        "nl_ref_phrase": "trend"
      }
    ]
  },
  "input": "Dataset Information: {\n  \"data samples\": [\n    {\n      \"Date\": \"08/31/2022\",\n      \"GRA Purchases\": 93769635059,\n      \"PRGT 1/2/\": 15254184552,\n      \"Totals\": 109024000000.0,\n      \"Totals_bil_SDR\": 109.02,\n      \"Year\": 2022,\n      \"Conversion rate\": 1.28252,\n      \"Unnamed: 7\": NaN,\n      \"Totals_USD\": 139.8203304,\n      \"World GDP\": 86700000000000.0,\n      \"World aggregate real GDP (billion USD)\": 86652.9,\n      \"Unnamed: 11\": 0.001258123,\n      \"Total_USD/GDP\": 0.001613568,\n      \"Percentage\": 0.161356781,\n      \"Unnamed: 14\": NaN,\n      \"World nominal GDP\": 98100000000000.0,\n      \"Unnamed: 16\": 98100,\n      \"Unnamed: 17\": 0.001425284,\n      \"Percentages\": 0.142528369\n    },\n    {\n      \"Date\": \"12/31/1992\",\n      \"GRA Purchases\": 23967172718,\n      \"PRGT 1/2/\": 3804463796,\n      \"Totals\": 27771636514.0,\n      \"Totals_bil_SDR\": 27.77,\n      \"Year\": 1992,\n      \"Conversion rate\": 1.375,\n      \"Unnamed: 7\": NaN,\n      \"Totals_USD\": 38.18375,\n      \"World GDP\": 37200000000000.0,\n      \"World aggregate real GDP (billion USD)\": 37150.1,\n      \"Unnamed: 11\": 0.000747508,\n      \"Total_USD/GDP\": 0.001027824,\n      \"Percentage\": 0.102782361,\n      \"Unnamed: 14\": NaN,\n      \"World nominal GDP\": 25406000000000.0,\n      \"Unnamed: 16\": 25406,\n      \"Unnamed: 17\": 0.001502942,\n      \"Percentages\": 0.150294222\n    },\n    {\n      \"Date\": \"12/31/1998\",\n      \"GRA Purchases\": 60451017051,\n      \"PRGT 1/2/\": 6288825925,\n      \"Totals\": 66739842976.0,\n      \"Totals_bil_SDR\": 66.74,\n      \"Year\": 1998,\n      \"Conversion rate\": 1.40677,\n      \"Unnamed: 7\": NaN,\n      \"Totals_USD\": 93.8878298,\n      \"World GDP\": 44600000000000.0,\n      \"World aggregate real GDP (billion USD)\": 44580.1,\n      \"Unnamed: 11\": 0.001497081,\n      \"Total_USD/GDP\": 0.002106048,\n      \"Percentage\": 0.210604799,\n      \"Unnamed: 14\": NaN,\n      \"World nominal GDP\": 31540000000000.0,\n      \"Unnamed: 16\": 31540,\n      \"Unnamed: 17\": 0.002976786,\n      \"Percentages\": 0.297678598\n    },\n    {\n      \"Date\": \"12/31/2007\",\n      \"GRA Purchases\": 6036146757,\n      \"PRGT 1/2/\": 3796945581,\n      \"Totals\": 9833092338.0,\n      \"Totals_bil_SDR\": 9.83,\n      \"Year\": 2007,\n      \"Conversion rate\": 1.58025,\n      \"Unnamed: 7\": NaN,\n      \"Totals_USD\": 15.5338575,\n      \"World GDP\": 61600000000000.0,\n      \"World aggregate real GDP (billion USD)\": 61608.9,\n      \"Unnamed: 11\": 0.000159555,\n      \"Total_USD/GDP\": 0.000252137,\n      \"Percentage\": 0.025213658,\n      \"Unnamed: 14\": NaN,\n      \"World nominal GDP\": 58355000000000.0,\n      \"Unnamed: 16\": 58355,\n      \"Unnamed: 17\": 0.000266196,\n      \"Percentages\": 0.026619583\n    },\n    {\n      \"Date\": \"12/31/2020\",\n      \"GRA Purchases\": 93408630285,\n      \"PRGT 1/2/\": 12481816684,\n      \"Totals\": 105890000000.0,\n      \"Totals_bil_SDR\": 105.89,\n      \"Year\": 2020,\n      \"Conversion rate\": 1.44878,\n      \"Unnamed: 7\": NaN,\n      \"Totals_USD\": 153.4113142,\n      \"World GDP\": 81900000000000.0,\n      \"World aggregate real GDP (billion USD)\": 81901.0,\n      \"Unnamed: 11\": 0.001292902,\n      \"Total_USD/GDP\": 0.001873131,\n      \"Percentage\": 0.187313115,\n      \"Unnamed: 14\": NaN,\n      \"World nominal GDP\": 84907000000000.0,\n      \"Unnamed: 16\": 84907,\n      \"Unnamed: 17\": 0.001806816,\n      \"Percentages\": 0.180681586\n    }\n  ],\n  \"column names\": [\n    \"Date\",\n    \"GRA Purchases\",\n    \"PRGT 1/2/\",\n    \"Totals\",\n    \"Totals_bil_SDR\",\n    \"Year\",\n    \"Conversion rate\",\n    \"Unnamed: 7\",\n    \"Totals_USD\",\n    \"World GDP\",\n    \"World aggregate real GDP (billion USD)\",\n    \"Unnamed: 11\",\n    \"Total_USD/GDP\",\n    \"Percentage\",\n    \"Unnamed: 14\",\n    \"World nominal GDP\",\n    \"Unnamed: 16\",\n    \"Unnamed: 17\",\n    \"Percentages\"\n  ]\n}\n\nYour Job:\nI am developing a NL to Data Visualization Dataset. \nPlease help me generate natural language utterance for given dataset and constraints.\nDefinition about the Taks:\n- 'utterance' is what a user would say to make a chart. It should be a questions structure. One NL 'utterance' is in one or two sentences. Here are two examples from Questions for reference:\n    How many cars do each country manufacture?\n    What's the average production budget of the different rated movies, separated by creative type.\n- 'given dataset' is in form of column names, column type, range/unique values of the column.\n- 'constraints' are information about the chart that should be included in the utterance. \n    So we can find a reference phrase in the NL utterance that corresponds to the given constraints. \n- 'reference phrase' can be explicit, ambiguous, and by_value. 'ambiguous' means the phrase can map to more than one columns in the dataset, always a hypernym of column names(depending on the dataset values).\n    For example:\n    {\"column\": \"gdpPercap\", \"nl_ref_type\": \"explicit\", \"nl_ref_phrase\": \"GDP per capita\"},\n    {\"column\": [\"country\",\"continent\"], \"nl_ref_type\": \"ambiguous\", \"nl_ref_phrase\": \"region\"}\n    {\"column\": [\"country\",\"country_short_name\"], \"nl_ref_type\": \"ambiguous\", \"nl_ref_phrase\": \"countries\"}\n    {\"c_type\": \"mark\", \"c_name\": \"point chart\", \"nl_ref_type\": \"explicit\", \"nl_ref_phrase\": \"scatter plot\"}\n    {\"c_type\": \"mark\", \"c_name\": \"arc chart\", \"nl_ref_type\": \"explicit\", \"nl_ref_phrase\": \"pie chart\"}\n    {\"c_type\": \"transform\",\"c_name\": \"filter\",\"c_list\": [{\"field\": \"country\",\"oneOf\": [\"Iceland\",\"Norway\"]}],\"nl_ref_type\": \"explicit\",\"nl_ref_phrase\": \"for countries Iceland and Norway\"},\n    {\"c_type\": \"transform\",\"c_name\": \"filter\",\"c_list\": [{\"field\": \"country\",\"oneOf\": [\"Iceland\",\"Norway\"]}],\"nl_ref_type\": \"by_value\",\"nl_ref_phrase\": \"for Iceland and Norway\"},\n- the 'nl_ref_phrase' for 'ambiguous' columns should be equally near all ambiguous columns, not too near to one of the column since it would not be ambiguous.\n    good example: {\"column\": [\"country\",\"region\"], \"nl_ref_type\": \"ambiguous\", \"nl_ref_phrase\": \"location\"}\n    bad example: {\"column\": [\"country\",\"region\"], \"nl_ref_type\": \"ambiguous\", \"nl_ref_phrase\": \"region\"}\n- You only include given constraints and no other information. \n    For example, if a column name is not in the given constraint, it will not be included in the NL utterance.\n    Also, it a chart mark or chart encoding channel is not in the given constraint, it will not be included in the NL utterance.\n- all 'nl_ref_phrase' shoule be included in the 'nl_utterance'. \n\nThe output format is identical to the input format, but fill in the str blanks(\"...\").\n### Input:\n{\n  \"nl_utterance\": \"...\",\n  \"encoded_fields\": [\n    {\n      \"field\": [\n        \"Date\",\n        \"Year\"\n      ],\n      \"type\": \"quantitative\",\n      \"nl_ref_type\": \"ambiguous\",\n      \"nl_ref_phrase\": \"...\"\n    },\n    {\n      \"field\": \"Totals_USD\",\n      \"type\": \"quantitative\",\n      \"nl_ref_type\": \"explicit\",\n      \"nl_ref_phrase\": \"...\"\n    }\n  ],\n  \"constraints\": [\n    {\n      \"c_type\": \"task\",\n      \"c_name\": \"trend\",\n      \"c_list\": [\n        {\n          \"mark\": [\n            \"bar\",\n            \"line\",\n            \"area\"\n          ],\n          \"encoding\": {\n            \"x\": {\n              \"type\": \"temporal\"\n            }\n          }\n        }\n      ],\n      \"nl_ref_type\": \"explicit\",\n      \"nl_ref_phrase\": \"...\"\n    }\n  ]\n}\n\n### Output:"
}