{
  "gpt_result": {
    "nl_utterance": "What is the trend of Oil Consumption in TWh over the years as depicted in an area chart? Use the composition tasks to show this.",
    "encoded_fields": [
      {
        "field": "Year",
        "type": "quantitative",
        "nl_ref_type": "explicit",
        "nl_ref_phrase": "years"
      },
      {
        "field": "Oil Consumption - TWh (zero filled)",
        "type": "quantitative",
        "nl_ref_type": "explicit",
        "nl_ref_phrase": "Oil Consumption in TWh"
      }
    ],
    "constraints": [
      {
        "c_type": "task",
        "c_name": "composition",
        "c_list": [
          {
            "mark": "bar",
            "encoding": {
              "x": {},
              "y": {
                "type": "quantitative"
              },
              "color": {
                "type": "nominal"
              }
            },
            "x_y_reversable": true
          },
          {
            "mark": "area",
            "encoding": {
              "x": {},
              "y": {
                "type": "quantitative"
              },
              "color": {
                "type": "nominal"
              }
            }
          },
          {
            "mark": "arc",
            "encoding": {
              "theta": {
                "type": "quantitative"
              },
              "color": {
                "type": "nominal"
              }
            }
          }
        ],
        "nl_ref_type": "explicit",
        "nl_ref_phrase": "composition tasks"
      },
      {
        "c_type": "mark",
        "c_name": "area chart",
        "c_list": [
          {
            "mark": "area",
            "encoding": {
              "x": {},
              "y": {
                "type": "quantitative"
              },
              "color": {
                "type": "nominal",
                "ignore": true
              },
              "column": {
                "ignore": true,
                "type": "nominal"
              },
              "row": {
                "ignore": true,
                "type": "nominal"
              }
            },
            "unique_map": {
              "x": "y"
            }
          },
          {
            "mark": "area",
            "encoding": {
              "y": {},
              "x": {
                "type": "quantitative"
              },
              "color": {
                "type": "nominal",
                "ignore": true
              },
              "column": {
                "ignore": true,
                "type": "nominal"
              },
              "row": {
                "ignore": true,
                "type": "nominal"
              }
            },
            "unique_map": {
              "y": "x"
            }
          }
        ],
        "nl_ref_type": "explicit",
        "nl_ref_phrase": "area chart"
      }
    ]
  },
  "input": "Dataset Information: {\n  \"data samples\": [\n    {\n      \"Unnamed: 0\": 0,\n      \"Entity\": \"Africa\",\n      \"Year\": 1965,\n      \"Geo Biomass Other - TWh (zero filled)\": 0.0,\n      \"Biofuels Consumption - TWh - Total (zero filled)\": 0.0,\n      \"Solar Consumption - TWh (zero filled)\": 0.0,\n      \"Wind Consumption - TWh (zero filled)\": 0.0,\n      \"Hydro Consumption - TWh (zero filled)\": 41.11881256,\n      \"Nuclear Consumption - TWh (zero filled)\": 0.0,\n      \"Gas Consumption - TWh (zero filled)\": 9.543754578,\n      \"Coal Consumption - TWh (zero filled)\": 323.4961243,\n      \"Oil Consumption - TWh (zero filled)\": 341.2627563\n    },\n    {\n      \"Unnamed: 0\": 5746,\n      \"Entity\": \"Taiwan\",\n      \"Year\": 2014,\n      \"Geo Biomass Other - TWh (zero filled)\": 1.912523985,\n      \"Biofuels Consumption - TWh - Total (zero filled)\": 0.0,\n      \"Solar Consumption - TWh (zero filled)\": 1.432468295,\n      \"Wind Consumption - TWh (zero filled)\": 4.064959049,\n      \"Hydro Consumption - TWh (zero filled)\": 11.69751072,\n      \"Nuclear Consumption - TWh (zero filled)\": 110.1960526,\n      \"Gas Consumption - TWh (zero filled)\": 188.6816864,\n      \"Coal Consumption - TWh (zero filled)\": 472.6248779,\n      \"Oil Consumption - TWh (zero filled)\": 549.4267578\n    },\n    {\n      \"Unnamed: 0\": 4576,\n      \"Entity\": \"Pakistan\",\n      \"Year\": 1984,\n      \"Geo Biomass Other - TWh (zero filled)\": 0.0,\n      \"Biofuels Consumption - TWh - Total (zero filled)\": 0.0,\n      \"Solar Consumption - TWh (zero filled)\": 0.0,\n      \"Wind Consumption - TWh (zero filled)\": 0.0,\n      \"Hydro Consumption - TWh (zero filled)\": 37.07425308,\n      \"Nuclear Consumption - TWh (zero filled)\": 0.940508604,\n      \"Gas Consumption - TWh (zero filled)\": 72.14399719,\n      \"Coal Consumption - TWh (zero filled)\": 13.56058025,\n      \"Oil Consumption - TWh (zero filled)\": 83.87065887\n    },\n    {\n      \"Unnamed: 0\": 3352,\n      \"Entity\": \"Morocco\",\n      \"Year\": 2014,\n      \"Geo Biomass Other - TWh (zero filled)\": 0.0,\n      \"Biofuels Consumption - TWh - Total (zero filled)\": 0.0,\n      \"Solar Consumption - TWh (zero filled)\": 0.000273611,\n      \"Wind Consumption - TWh (zero filled)\": 5.211762428,\n      \"Hydro Consumption - TWh (zero filled)\": 4.435876846,\n      \"Nuclear Consumption - TWh (zero filled)\": 0.0,\n      \"Gas Consumption - TWh (zero filled)\": 11.0961504,\n      \"Coal Consumption - TWh (zero filled)\": 46.95286942,\n      \"Oil Consumption - TWh (zero filled)\": 148.6853027\n    },\n    {\n      \"Unnamed: 0\": 740,\n      \"Entity\": \"Brazil\",\n      \"Year\": 2021,\n      \"Geo Biomass Other - TWh (zero filled)\": 54.95921707,\n      \"Biofuels Consumption - TWh - Total (zero filled)\": 255.4718475,\n      \"Solar Consumption - TWh (zero filled)\": 43.83530807,\n      \"Wind Consumption - TWh (zero filled)\": 189.1490479,\n      \"Hydro Consumption - TWh (zero filled)\": 949.3786621,\n      \"Nuclear Consumption - TWh (zero filled)\": 36.9225235,\n      \"Gas Consumption - TWh (zero filled)\": 404.4645081,\n      \"Coal Consumption - TWh (zero filled)\": 197.908493,\n      \"Oil Consumption - TWh (zero filled)\": 1237.875854\n    }\n  ],\n  \"column names\": [\n    \"Unnamed: 0\",\n    \"Entity\",\n    \"Year\",\n    \"Geo Biomass Other - TWh (zero filled)\",\n    \"Biofuels Consumption - TWh - Total (zero filled)\",\n    \"Solar Consumption - TWh (zero filled)\",\n    \"Wind Consumption - TWh (zero filled)\",\n    \"Hydro Consumption - TWh (zero filled)\",\n    \"Nuclear Consumption - TWh (zero filled)\",\n    \"Gas Consumption - TWh (zero filled)\",\n    \"Coal Consumption - TWh (zero filled)\",\n    \"Oil Consumption - TWh (zero filled)\"\n  ]\n}\n\nYour Job:\nI am developing a NL to Data Visualization Dataset. \nPlease help me generate natural language utterance for given dataset and constraints.\nDefinition about the Taks:\n- 'utterance' is what a user would say to make a chart. It should be a questions structure. One NL 'utterance' is in one or two sentences. Here are two examples from Questions for reference:\n    What major genre had the highest average worldwide gross?\n    What's the average production budget of the different rated movies, separated by creative type.\n- 'given dataset' is in form of column names, column type, range/unique values of the column.\n- 'constraints' are information about the chart that should be included in the utterance. \n    So we can find a reference phrase in the NL utterance that corresponds to the given constraints. \n- 'reference phrase' can be explicit, ambiguous, and by_value. 'ambiguous' means the phrase can map to more than one columns in the dataset, always a hypernym of column names(depending on the dataset values).\n    For example:\n    {\"column\": \"gdpPercap\", \"nl_ref_type\": \"explicit\", \"nl_ref_phrase\": \"GDP per capita\"},\n    {\"column\": [\"country\",\"continent\"], \"nl_ref_type\": \"ambiguous\", \"nl_ref_phrase\": \"region\"}\n    {\"column\": [\"country\",\"country_short_name\"], \"nl_ref_type\": \"ambiguous\", \"nl_ref_phrase\": \"countries\"}\n    {\"c_type\": \"mark\", \"c_name\": \"point chart\", \"nl_ref_type\": \"explicit\", \"nl_ref_phrase\": \"scatter plot\"}\n    {\"c_type\": \"mark\", \"c_name\": \"arc chart\", \"nl_ref_type\": \"explicit\", \"nl_ref_phrase\": \"pie chart\"}\n    {\"c_type\": \"transform\",\"c_name\": \"filter\",\"c_list\": [{\"field\": \"country\",\"oneOf\": [\"Iceland\",\"Norway\"]}],\"nl_ref_type\": \"explicit\",\"nl_ref_phrase\": \"for countries Iceland and Norway\"},\n    {\"c_type\": \"transform\",\"c_name\": \"filter\",\"c_list\": [{\"field\": \"country\",\"oneOf\": [\"Iceland\",\"Norway\"]}],\"nl_ref_type\": \"by_value\",\"nl_ref_phrase\": \"for Iceland and Norway\"},\n- the 'nl_ref_phrase' for 'ambiguous' columns should be equally near all ambiguous columns, not too near to one of the column since it would not be ambiguous.\n    good example: {\"column\": [\"country\",\"region\"], \"nl_ref_type\": \"ambiguous\", \"nl_ref_phrase\": \"location\"}\n    bad example: {\"column\": [\"country\",\"region\"], \"nl_ref_type\": \"ambiguous\", \"nl_ref_phrase\": \"region\"}\n- You only include given constraints and no other information. \n    For example, if a column name is not in the given constraint, it will not be included in the NL utterance.\n    Also, it a chart mark or chart encoding channel is not in the given constraint, it will not be included in the NL utterance.\n- all 'nl_ref_phrase' shoule be included in the 'nl_utterance'. \n\nThe output format is identical to the input format, but fill in the str blanks(\"...\").\n### Input:\n{\n  \"nl_utterance\": \"...\",\n  \"encoded_fields\": [\n    {\n      \"field\": \"Year\",\n      \"type\": \"quantitative\",\n      \"nl_ref_type\": \"explicit\",\n      \"nl_ref_phrase\": \"...\"\n    },\n    {\n      \"field\": \"Oil Consumption - TWh (zero filled)\",\n      \"type\": \"quantitative\",\n      \"nl_ref_type\": \"explicit\",\n      \"nl_ref_phrase\": \"...\"\n    }\n  ],\n  \"constraints\": [\n    {\n      \"c_type\": \"task\",\n      \"c_name\": \"composition\",\n      \"c_list\": [\n        {\n          \"mark\": \"bar\",\n          \"encoding\": {\n            \"x\": {},\n            \"y\": {\n              \"type\": \"quantitative\"\n            },\n            \"color\": {\n              \"type\": \"nominal\"\n            }\n          },\n          \"x_y_reversable\": true\n        },\n        {\n          \"mark\": \"area\",\n          \"encoding\": {\n            \"x\": {},\n            \"y\": {\n              \"type\": \"quantitative\"\n            },\n            \"color\": {\n              \"type\": \"nominal\"\n            }\n          }\n        },\n        {\n          \"mark\": \"arc\",\n          \"encoding\": {\n            \"theta\": {\n              \"type\": \"quantitative\"\n            },\n            \"color\": {\n              \"type\": \"nominal\"\n            }\n          }\n        }\n      ],\n      \"nl_ref_type\": \"explicit\",\n      \"nl_ref_phrase\": \"...\"\n    },\n    {\n      \"c_type\": \"mark\",\n      \"c_name\": \"area chart\",\n      \"c_list\": [\n        {\n          \"mark\": \"area\",\n          \"encoding\": {\n            \"x\": {},\n            \"y\": {\n              \"type\": \"quantitative\"\n            },\n            \"color\": {\n              \"type\": \"nominal\",\n              \"ignore\": true\n            },\n            \"column\": {\n              \"ignore\": true,\n              \"type\": \"nominal\"\n            },\n            \"row\": {\n              \"ignore\": true,\n              \"type\": \"nominal\"\n            }\n          },\n          \"unique_map\": {\n            \"x\": \"y\"\n          }\n        },\n        {\n          \"mark\": \"area\",\n          \"encoding\": {\n            \"y\": {},\n            \"x\": {\n              \"type\": \"quantitative\"\n            },\n            \"color\": {\n              \"type\": \"nominal\",\n              \"ignore\": true\n            },\n            \"column\": {\n              \"ignore\": true,\n              \"type\": \"nominal\"\n            },\n            \"row\": {\n              \"ignore\": true,\n              \"type\": \"nominal\"\n            }\n          },\n          \"unique_map\": {\n            \"y\": \"x\"\n          }\n        }\n      ],\n      \"nl_ref_type\": \"explicit\",\n      \"nl_ref_phrase\": \"...\"\n    }\n  ]\n}\n\n### Output:"
}