{
  "gpt_result": {
    "nl_utterance": "Show the trend of Growth in Lending Relative to World GDP over time.",
    "encoded_fields": [
      {
        "field": "Growth in Lending Relative to World GDP",
        "type": "quantitative",
        "nl_ref_type": "explicit",
        "nl_ref_phrase": "Growth in Lending Relative to World GDP"
      }
    ],
    "constraints": [
      {
        "c_type": "task",
        "c_name": "trend",
        "c_list": [
          {
            "mark": [
              "bar",
              "line",
              "area"
            ],
            "encoding": {
              "x": {
                "type": "temporal"
              }
            }
          }
        ],
        "nl_ref_type": "explicit",
        "nl_ref_phrase": "trend"
      }
    ]
  },
  "input": "Dataset Information: {\n  \"data samples\": [\n    {\n      \"Date\": \"12/31/2021\",\n      \"GRA Purchases\": 89474552025,\n      \"PRGT 1/2/\": 14554823681,\n      \"Totals\": 104029000000.0,\n      \"Year\": 2021,\n      \"World GDP data \": 96100100000000.0,\n      \"Totals ($bns)\": 104.0293757,\n      \"world GDP Bns\": 96100.091,\n      \"Growth in Lending Relative to World GDP\": 0.108251069\n    },\n    {\n      \"Date\": \"12/31/1998\",\n      \"GRA Purchases\": 60451017051,\n      \"PRGT 1/2/\": 6288825925,\n      \"Totals\": 66739842976.0,\n      \"Year\": 1998,\n      \"World GDP data \": 31540000000000.0,\n      \"Totals ($bns)\": 66.73984298,\n      \"world GDP Bns\": 31539.9579,\n      \"Growth in Lending Relative to World GDP\": 0.211604097\n    },\n    {\n      \"Date\": \"12/31/2001\",\n      \"GRA Purchases\": 53477225409,\n      \"PRGT 1/2/\": 6424578684,\n      \"Totals\": 59901804093.0,\n      \"Year\": 2001,\n      \"World GDP data \": 33615400000000.0,\n      \"Totals ($bns)\": 59.90180409,\n      \"world GDP Bns\": 33615.43597,\n      \"Growth in Lending Relative to World GDP\": 0.178197314\n    },\n    {\n      \"Date\": \"12/31/1996\",\n      \"GRA Purchases\": 36127472805,\n      \"PRGT 1/2/\": 5881609752,\n      \"Totals\": 42009082557.0,\n      \"Year\": 1996,\n      \"World GDP data \": 31736700000000.0,\n      \"Totals ($bns)\": 42.00908256,\n      \"world GDP Bns\": 31736.66005,\n      \"Growth in Lending Relative to World GDP\": 0.132367686\n    },\n    {\n      \"Date\": \"12/31/1995\",\n      \"GRA Purchases\": 35929173412,\n      \"PRGT 1/2/\": 5657438528,\n      \"Totals\": 41586611940.0,\n      \"Year\": 1995,\n      \"World GDP data \": 31043600000000.0,\n      \"Totals ($bns)\": 41.58661194,\n      \"world GDP Bns\": 31043.64788,\n      \"Growth in Lending Relative to World GDP\": 0.133961743\n    }\n  ],\n  \"column names\": [\n    \"Date\",\n    \"GRA Purchases\",\n    \"PRGT 1/2/\",\n    \"Totals\",\n    \"Year\",\n    \"World GDP data \",\n    \"Totals ($bns)\",\n    \"world GDP Bns\",\n    \"Growth in Lending Relative to World GDP\"\n  ]\n}\n\nYour Job:\nI am developing a NL to Data Visualization Dataset. \nPlease help me generate natural language utterance for given dataset and constraints.\nDefinition about the Taks:\n- 'utterance' is what a user would say to make a chart. It should be a queries structure. One NL 'utterance' is in one or two sentences. Here are two examples from Queries for reference:\n    Total gross by genre and year.\n    Coloring by Orign, Plot Displacement by MPG.\n- 'given dataset' is in form of column names, column type, range/unique values of the column.\n- 'constraints' are information about the chart that should be included in the utterance. \n    So we can find a reference phrase in the NL utterance that corresponds to the given constraints. \n- 'reference phrase' can be explicit, ambiguous, and by_value. 'ambiguous' means the phrase can map to more than one columns in the dataset, always a hypernym of column names(depending on the dataset values).\n    For example:\n    {\"column\": \"gdpPercap\", \"nl_ref_type\": \"explicit\", \"nl_ref_phrase\": \"GDP per capita\"},\n    {\"column\": [\"country\",\"continent\"], \"nl_ref_type\": \"ambiguous\", \"nl_ref_phrase\": \"region\"}\n    {\"column\": [\"country\",\"country_short_name\"], \"nl_ref_type\": \"ambiguous\", \"nl_ref_phrase\": \"countries\"}\n    {\"c_type\": \"mark\", \"c_name\": \"point chart\", \"nl_ref_type\": \"explicit\", \"nl_ref_phrase\": \"scatter plot\"}\n    {\"c_type\": \"mark\", \"c_name\": \"arc chart\", \"nl_ref_type\": \"explicit\", \"nl_ref_phrase\": \"pie chart\"}\n    {\"c_type\": \"transform\",\"c_name\": \"filter\",\"c_list\": [{\"field\": \"country\",\"oneOf\": [\"Iceland\",\"Norway\"]}],\"nl_ref_type\": \"explicit\",\"nl_ref_phrase\": \"for countries Iceland and Norway\"},\n    {\"c_type\": \"transform\",\"c_name\": \"filter\",\"c_list\": [{\"field\": \"country\",\"oneOf\": [\"Iceland\",\"Norway\"]}],\"nl_ref_type\": \"by_value\",\"nl_ref_phrase\": \"for Iceland and Norway\"},\n- the 'nl_ref_phrase' for 'ambiguous' columns should be equally near all ambiguous columns, not too near to one of the column since it would not be ambiguous.\n    good example: {\"column\": [\"country\",\"region\"], \"nl_ref_type\": \"ambiguous\", \"nl_ref_phrase\": \"location\"}\n    bad example: {\"column\": [\"country\",\"region\"], \"nl_ref_type\": \"ambiguous\", \"nl_ref_phrase\": \"region\"}\n- You only include given constraints and no other information. \n    For example, if a column name is not in the given constraint, it will not be included in the NL utterance.\n    Also, it a chart mark or chart encoding channel is not in the given constraint, it will not be included in the NL utterance.\n- all 'nl_ref_phrase' shoule be included in the 'nl_utterance'. \n\nThe output format is identical to the input format, but fill in the str blanks(\"...\").\n### Input:\n{\n  \"nl_utterance\": \"...\",\n  \"encoded_fields\": [\n    {\n      \"field\": \"Growth in Lending Relative to World GDP\",\n      \"type\": \"quantitative\",\n      \"nl_ref_type\": \"explicit\",\n      \"nl_ref_phrase\": \"...\"\n    }\n  ],\n  \"constraints\": [\n    {\n      \"c_type\": \"task\",\n      \"c_name\": \"trend\",\n      \"c_list\": [\n        {\n          \"mark\": [\n            \"bar\",\n            \"line\",\n            \"area\"\n          ],\n          \"encoding\": {\n            \"x\": {\n              \"type\": \"temporal\"\n            }\n          }\n        }\n      ],\n      \"nl_ref_type\": \"explicit\",\n      \"nl_ref_phrase\": \"...\"\n    }\n  ]\n}\n\n### Output:"
}