{
  "gpt_result": {
    "nl_utterance": "Create a scatter plot to examine the relationship between GDP per capita, life expectancy, and population by continent.",
    "encoded_fields": [
      {
        "field": "GDP per capita (PPP)",
        "type": "quantitative",
        "nl_ref_type": "explicit",
        "nl_ref_phrase": "GDP per capita"
      },
      {
        "field": "Life Expectancy",
        "type": "quantitative",
        "nl_ref_type": "explicit",
        "nl_ref_phrase": "life expectancy"
      },
      {
        "field": "Continent",
        "type": "nominal",
        "nl_ref_type": "explicit",
        "nl_ref_phrase": "continent"
      },
      {
        "field": "Population",
        "type": "quantitative",
        "nl_ref_type": "explicit",
        "nl_ref_phrase": "population"
      }
    ],
    "constraints": [
      {
        "c_type": "mark",
        "c_name": "point chart",
        "c_list": [
          {
            "mark": "circle",
            "encoding": {
              "x": {},
              "y": {},
              "color": {
                "type": "nominal",
                "ignore": true
              },
              "size": {
                "ignore": true,
                "type": "quantitative"
              },
              "column": {
                "ignore": true,
                "type": "nominal"
              },
              "row": {
                "ignore": true,
                "type": "nominal"
              }
            }
          }
        ],
        "nl_ref_type": "explicit",
        "nl_ref_phrase": "scatter plot"
      }
    ]
  },
  "input": "Dataset Information: {\n  \"data samples\": [\n    {\n      \"Country\": \"Finland\",\n      \"Happiness score\": 7.821,\n      \"Country_temp\": \"Finland\",\n      \"ISO3\": \"FIN\",\n      \"GDP per capita (PPP)\": 55013.38586,\n      \"Life Ladder\": 7.7944,\n      \"Social support\": 0.9703,\n      \"Perceptions of corruption\": 0.1918,\n      \"Population\": 5535992.0,\n      \"Median Age\": 42.368,\n      \"Total Fertility Rate\": 1.389,\n      \"Life Expectancy\": 82.038,\n      \"Infant Mortality\": 1.932,\n      \"Child Mortality\": 2.353,\n      \"Net Migration Rate\": 2.7,\n      \"Continent\": \"Europe\",\n      \"UN Region\": \"Northern Europe\"\n    },\n    {\n      \"Country\": \"Ivory Coast\",\n      \"Happiness score\": 5.235,\n      \"Country_temp\": \"Ivory Coast\",\n      \"ISO3\": \"CIV\",\n      \"GDP per capita (PPP)\": 5850.051925,\n      \"Life Ladder\": 5.0558,\n      \"Social support\": 0.5542,\n      \"Perceptions of corruption\": 0.7159,\n      \"Population\": 27478249.0,\n      \"Median Age\": 17.599,\n      \"Total Fertility Rate\": 4.418,\n      \"Life Expectancy\": 58.598,\n      \"Infant Mortality\": 56.921,\n      \"Child Mortality\": 75.674,\n      \"Net Migration Rate\": -0.764,\n      \"Continent\": \"Africa\",\n      \"UN Region\": \"Western Africa\"\n    },\n    {\n      \"Country\": \"Uganda\",\n      \"Happiness score\": 4.603,\n      \"Country_temp\": \"Uganda\",\n      \"ISO3\": \"UGA\",\n      \"GDP per capita (PPP)\": 2467.899337,\n      \"Life Ladder\": 4.2245,\n      \"Social support\": 0.7933,\n      \"Perceptions of corruption\": 0.835,\n      \"Population\": 45853778.0,\n      \"Median Age\": 15.935,\n      \"Total Fertility Rate\": 4.585,\n      \"Life Expectancy\": 62.705,\n      \"Infant Mortality\": 30.399,\n      \"Child Mortality\": 41.62,\n      \"Net Migration Rate\": 0.948,\n      \"Continent\": \"Africa\",\n      \"UN Region\": \"Eastern Africa\"\n    },\n    {\n      \"Country\": \"Thailand\",\n      \"Happiness score\": 5.891,\n      \"Country_temp\": \"Thailand\",\n      \"ISO3\": \"THA\",\n      \"GDP per capita (PPP)\": 18760.75522,\n      \"Life Ladder\": 5.6381,\n      \"Social support\": 0.8828,\n      \"Perceptions of corruption\": 0.9431,\n      \"Population\": 71601103.0,\n      \"Median Age\": 39.271,\n      \"Total Fertility Rate\": 1.331,\n      \"Life Expectancy\": 78.715,\n      \"Infant Mortality\": 7.079,\n      \"Child Mortality\": 8.319,\n      \"Net Migration Rate\": 0.016,\n      \"Continent\": \"Asia\",\n      \"UN Region\": \"South-eastern Asia\"\n    },\n    {\n      \"Country\": \"Armenia\",\n      \"Happiness score\": 5.399,\n      \"Country_temp\": \"Armenia\",\n      \"ISO3\": \"ARM\",\n      \"GDP per capita (PPP)\": 15592.48736,\n      \"Life Ladder\": 5.3006,\n      \"Social support\": 0.762,\n      \"Perceptions of corruption\": 0.7053,\n      \"Population\": 2790974.0,\n      \"Median Age\": 34.405,\n      \"Total Fertility Rate\": 1.575,\n      \"Life Expectancy\": 72.043,\n      \"Infant Mortality\": 9.351,\n      \"Child Mortality\": 10.439,\n      \"Net Migration Rate\": -4.585,\n      \"Continent\": \"Asia\",\n      \"UN Region\": \"Western Asia\"\n    }\n  ],\n  \"column names\": [\n    \"Country\",\n    \"Happiness score\",\n    \"Country_temp\",\n    \"ISO3\",\n    \"GDP per capita (PPP)\",\n    \"Life Ladder\",\n    \"Social support\",\n    \"Perceptions of corruption\",\n    \"Population\",\n    \"Median Age\",\n    \"Total Fertility Rate\",\n    \"Life Expectancy\",\n    \"Infant Mortality\",\n    \"Child Mortality\",\n    \"Net Migration Rate\",\n    \"Continent\",\n    \"UN Region\"\n  ]\n}\n\nYour Job:\nI am developing a NL to Data Visualization Dataset. \nPlease help me generate natural language utterance for given dataset and constraints.\nDefinition about the Taks:\n- 'utterance' is what a user would say to make a chart. It should be a commands structure. One NL 'utterance' is in one or two sentences. Here are two examples from Commands for reference:\n    Draw a line chart of daily sales forecasts.\n    For each country show the relationship between average acceleration and number of cylinders.\n- 'given dataset' is in form of column names, column type, range/unique values of the column.\n- 'constraints' are information about the chart that should be included in the utterance. \n    So we can find a reference phrase in the NL utterance that corresponds to the given constraints. \n- 'reference phrase' can be explicit, ambiguous, and by_value. 'ambiguous' means the phrase can map to more than one columns in the dataset, always a hypernym of column names(depending on the dataset values).\n    For example:\n    {\"column\": \"gdpPercap\", \"nl_ref_type\": \"explicit\", \"nl_ref_phrase\": \"GDP per capita\"},\n    {\"column\": [\"country\",\"continent\"], \"nl_ref_type\": \"ambiguous\", \"nl_ref_phrase\": \"region\"}\n    {\"column\": [\"country\",\"country_short_name\"], \"nl_ref_type\": \"ambiguous\", \"nl_ref_phrase\": \"countries\"}\n    {\"c_type\": \"mark\", \"c_name\": \"point chart\", \"nl_ref_type\": \"explicit\", \"nl_ref_phrase\": \"scatter plot\"}\n    {\"c_type\": \"mark\", \"c_name\": \"arc chart\", \"nl_ref_type\": \"explicit\", \"nl_ref_phrase\": \"pie chart\"}\n    {\"c_type\": \"transform\",\"c_name\": \"filter\",\"c_list\": [{\"field\": \"country\",\"oneOf\": [\"Iceland\",\"Norway\"]}],\"nl_ref_type\": \"explicit\",\"nl_ref_phrase\": \"for countries Iceland and Norway\"},\n    {\"c_type\": \"transform\",\"c_name\": \"filter\",\"c_list\": [{\"field\": \"country\",\"oneOf\": [\"Iceland\",\"Norway\"]}],\"nl_ref_type\": \"by_value\",\"nl_ref_phrase\": \"for Iceland and Norway\"},\n- the 'nl_ref_phrase' for 'ambiguous' columns should be equally near all ambiguous columns, not too near to one of the column since it would not be ambiguous.\n    good example: {\"column\": [\"country\",\"region\"], \"nl_ref_type\": \"ambiguous\", \"nl_ref_phrase\": \"location\"}\n    bad example: {\"column\": [\"country\",\"region\"], \"nl_ref_type\": \"ambiguous\", \"nl_ref_phrase\": \"region\"}\n- You only include given constraints and no other information. \n    For example, if a column name is not in the given constraint, it will not be included in the NL utterance.\n    Also, it a chart mark or chart encoding channel is not in the given constraint, it will not be included in the NL utterance.\n- all 'nl_ref_phrase' shoule be included in the 'nl_utterance'. \n\nThe output format is identical to the input format, but fill in the str blanks(\"...\").\n### Input:\n{\n  \"nl_utterance\": \"...\",\n  \"encoded_fields\": [\n    {\n      \"field\": \"GDP per capita (PPP)\",\n      \"type\": \"quantitative\",\n      \"nl_ref_type\": \"explicit\",\n      \"nl_ref_phrase\": \"...\"\n    },\n    {\n      \"field\": \"Life Expectancy\",\n      \"type\": \"quantitative\",\n      \"nl_ref_type\": \"explicit\",\n      \"nl_ref_phrase\": \"...\"\n    },\n    {\n      \"field\": \"Continent\",\n      \"type\": \"nominal\",\n      \"nl_ref_type\": \"explicit\",\n      \"nl_ref_phrase\": \"...\"\n    },\n    {\n      \"field\": \"Population\",\n      \"type\": \"quantitative\",\n      \"nl_ref_type\": \"explicit\",\n      \"nl_ref_phrase\": \"...\"\n    }\n  ],\n  \"constraints\": [\n    {\n      \"c_type\": \"mark\",\n      \"c_name\": \"point chart\",\n      \"c_list\": [\n        {\n          \"mark\": \"circle\",\n          \"encoding\": {\n            \"x\": {},\n            \"y\": {},\n            \"color\": {\n              \"type\": \"nominal\",\n              \"ignore\": true\n            },\n            \"size\": {\n              \"ignore\": true,\n              \"type\": \"quantitative\"\n            },\n            \"column\": {\n              \"ignore\": true,\n              \"type\": \"nominal\"\n            },\n            \"row\": {\n              \"ignore\": true,\n              \"type\": \"nominal\"\n            }\n          }\n        }\n      ],\n      \"nl_ref_type\": \"explicit\",\n      \"nl_ref_phrase\": \"...\"\n    }\n  ]\n}\n\n### Output:"
}