{
  "gpt_result": {
    "nl_utterance": "Can we explore the correlation between Firearm Deaths and Prison Rate by Geographic Division using a scatter plot?",
    "encoded_fields": [
      {
        "field": "FirearmDeaths",
        "type": "quantitative",
        "nl_ref_type": "explicit",
        "nl_ref_phrase": "Firearm Deaths"
      },
      {
        "field": "GeographicDivision",
        "type": "nominal",
        "nl_ref_type": "explicit",
        "nl_ref_phrase": "Geographic Division"
      },
      {
        "field": "PrisonRate",
        "type": "quantitative",
        "nl_ref_type": "explicit",
        "nl_ref_phrase": "Prison Rate"
      }
    ],
    "constraints": [
      {
        "c_type": "task",
        "c_name": "correlation",
        "c_list": [
          {
            "mark": "circle",
            "encoding": {
              "x": {
                "type": "quantitative"
              },
              "y": {
                "type": "quantitative"
              }
            }
          }
        ],
        "nl_ref_type": "explicit",
        "nl_ref_phrase": "correlation"
      },
      {
        "c_type": "mark",
        "c_name": "point chart",
        "c_list": [
          {
            "mark": "circle",
            "encoding": {
              "x": {},
              "y": {},
              "color": {
                "type": "nominal",
                "ignore": true
              },
              "size": {
                "ignore": true,
                "type": "quantitative"
              },
              "column": {
                "ignore": true,
                "type": "nominal"
              },
              "row": {
                "ignore": true,
                "type": "nominal"
              }
            }
          }
        ],
        "nl_ref_type": "explicit",
        "nl_ref_phrase": "scatter plot"
      }
    ]
  },
  "input": "Dataset Information: {\n  \"data samples\": [\n    {\n      \"State\": \"Alabama\",\n      \"StateInitials\": \"AL\",\n      \"Gini\": 0.472,\n      \"DeathRate\": 21.5,\n      \"Firearms_vs_avg\": 1.64700475,\n      \"medIncome\": 47221,\n      \"Income_vs_med\": 0.799827233,\n      \"ImprisonmentRate\": 736,\n      \"PrisonRate\": 1.264604811,\n      \"ImprisonmentRate.1\": 0.736,\n      \"FirearmDeaths\": 0.215,\n      \"GeographicDivision\": \"South\"\n    },\n    {\n      \"State\": \"Colorado\",\n      \"StateInitials\": \"CO\",\n      \"Gini\": 0.457,\n      \"DeathRate\": 14.3,\n      \"Firearms_vs_avg\": 1.095449671,\n      \"medIncome\": 70566,\n      \"Income_vs_med\": 1.195243822,\n      \"ImprisonmentRate\": 460,\n      \"PrisonRate\": 0.790378007,\n      \"ImprisonmentRate.1\": 0.46,\n      \"FirearmDeaths\": 0.143,\n      \"GeographicDivision\": \"West\"\n    },\n    {\n      \"State\": \"Oregon\",\n      \"StateInitials\": \"OR\",\n      \"Gini\": 0.449,\n      \"DeathRate\": 11.9,\n      \"Firearms_vs_avg\": 0.911597978,\n      \"medIncome\": 59135,\n      \"Income_vs_med\": 1.001626044,\n      \"ImprisonmentRate\": 466,\n      \"PrisonRate\": 0.800687285,\n      \"ImprisonmentRate.1\": 0.466,\n      \"FirearmDeaths\": 0.119,\n      \"GeographicDivision\": \"West\"\n    },\n    {\n      \"State\": \"Indiana\",\n      \"StateInitials\": \"IN\",\n      \"Gini\": 0.44,\n      \"DeathRate\": 15.0,\n      \"Firearms_vs_avg\": 1.149073081,\n      \"medIncome\": 56094,\n      \"Income_vs_med\": 0.950117719,\n      \"ImprisonmentRate\": 503,\n      \"PrisonRate\": 0.864261168,\n      \"ImprisonmentRate.1\": 0.503,\n      \"FirearmDeaths\": 0.15,\n      \"GeographicDivision\": \"Midwest\"\n    },\n    {\n      \"State\": \"Minnesota\",\n      \"StateInitials\": \"MN\",\n      \"Gini\": 0.44,\n      \"DeathRate\": 7.6,\n      \"Firearms_vs_avg\": 0.582197028,\n      \"medIncome\": 70218,\n      \"Income_vs_med\": 1.189349413,\n      \"ImprisonmentRate\": 249,\n      \"PrisonRate\": 0.427835052,\n      \"ImprisonmentRate.1\": 0.249,\n      \"FirearmDeaths\": 0.076,\n      \"GeographicDivision\": \"Midwest\"\n    }\n  ],\n  \"column names\": [\n    \"State\",\n    \"StateInitials\",\n    \"Gini\",\n    \"DeathRate\",\n    \"Firearms_vs_avg\",\n    \"medIncome\",\n    \"Income_vs_med\",\n    \"ImprisonmentRate\",\n    \"PrisonRate\",\n    \"ImprisonmentRate.1\",\n    \"FirearmDeaths\",\n    \"GeographicDivision\"\n  ]\n}\n\nYour Job:\nI am developing a NL to Data Visualization Dataset. \nPlease help me generate natural language utterance for given dataset and constraints.\nDefinition about the Taks:\n- 'utterance' is what a user would say to make a chart. It should be a questions structure. One NL 'utterance' is in one or two sentences. Here are two examples from Questions for reference:\n    How does displacement relate to fuel economy for cars from Europe vs. USA?\n    What is our profit based on shipping mode by customer segment?\n- 'given dataset' is in form of column names, column type, range/unique values of the column.\n- 'constraints' are information about the chart that should be included in the utterance. \n    So we can find a reference phrase in the NL utterance that corresponds to the given constraints. \n- 'reference phrase' can be explicit, ambiguous, and by_value. 'ambiguous' means the phrase can map to more than one columns in the dataset, always a hypernym of column names(depending on the dataset values).\n    For example:\n    {\"column\": \"gdpPercap\", \"nl_ref_type\": \"explicit\", \"nl_ref_phrase\": \"GDP per capita\"},\n    {\"column\": [\"country\",\"continent\"], \"nl_ref_type\": \"ambiguous\", \"nl_ref_phrase\": \"region\"}\n    {\"column\": [\"country\",\"country_short_name\"], \"nl_ref_type\": \"ambiguous\", \"nl_ref_phrase\": \"countries\"}\n    {\"c_type\": \"mark\", \"c_name\": \"point chart\", \"nl_ref_type\": \"explicit\", \"nl_ref_phrase\": \"scatter plot\"}\n    {\"c_type\": \"mark\", \"c_name\": \"arc chart\", \"nl_ref_type\": \"explicit\", \"nl_ref_phrase\": \"pie chart\"}\n    {\"c_type\": \"transform\",\"c_name\": \"filter\",\"c_list\": [{\"field\": \"country\",\"oneOf\": [\"Iceland\",\"Norway\"]}],\"nl_ref_type\": \"explicit\",\"nl_ref_phrase\": \"for countries Iceland and Norway\"},\n    {\"c_type\": \"transform\",\"c_name\": \"filter\",\"c_list\": [{\"field\": \"country\",\"oneOf\": [\"Iceland\",\"Norway\"]}],\"nl_ref_type\": \"by_value\",\"nl_ref_phrase\": \"for Iceland and Norway\"},\n- the 'nl_ref_phrase' for 'ambiguous' columns should be equally near all ambiguous columns, not too near to one of the column since it would not be ambiguous.\n    good example: {\"column\": [\"country\",\"region\"], \"nl_ref_type\": \"ambiguous\", \"nl_ref_phrase\": \"location\"}\n    bad example: {\"column\": [\"country\",\"region\"], \"nl_ref_type\": \"ambiguous\", \"nl_ref_phrase\": \"region\"}\n- You only include given constraints and no other information. \n    For example, if a column name is not in the given constraint, it will not be included in the NL utterance.\n    Also, it a chart mark or chart encoding channel is not in the given constraint, it will not be included in the NL utterance.\n- all 'nl_ref_phrase' shoule be included in the 'nl_utterance'. \n\nThe output format is identical to the input format, but fill in the str blanks(\"...\").\n### Input:\n{\n  \"nl_utterance\": \"...\",\n  \"encoded_fields\": [\n    {\n      \"field\": \"FirearmDeaths\",\n      \"type\": \"quantitative\",\n      \"nl_ref_type\": \"explicit\",\n      \"nl_ref_phrase\": \"...\"\n    },\n    {\n      \"field\": \"GeographicDivision\",\n      \"type\": \"nominal\",\n      \"nl_ref_type\": \"explicit\",\n      \"nl_ref_phrase\": \"...\"\n    },\n    {\n      \"field\": \"PrisonRate\",\n      \"type\": \"quantitative\",\n      \"nl_ref_type\": \"explicit\",\n      \"nl_ref_phrase\": \"...\"\n    }\n  ],\n  \"constraints\": [\n    {\n      \"c_type\": \"task\",\n      \"c_name\": \"correlation\",\n      \"c_list\": [\n        {\n          \"mark\": \"circle\",\n          \"encoding\": {\n            \"x\": {\n              \"type\": \"quantitative\"\n            },\n            \"y\": {\n              \"type\": \"quantitative\"\n            }\n          }\n        }\n      ],\n      \"nl_ref_type\": \"explicit\",\n      \"nl_ref_phrase\": \"...\"\n    },\n    {\n      \"c_type\": \"mark\",\n      \"c_name\": \"point chart\",\n      \"c_list\": [\n        {\n          \"mark\": \"circle\",\n          \"encoding\": {\n            \"x\": {},\n            \"y\": {},\n            \"color\": {\n              \"type\": \"nominal\",\n              \"ignore\": true\n            },\n            \"size\": {\n              \"ignore\": true,\n              \"type\": \"quantitative\"\n            },\n            \"column\": {\n              \"ignore\": true,\n              \"type\": \"nominal\"\n            },\n            \"row\": {\n              \"ignore\": true,\n              \"type\": \"nominal\"\n            }\n          }\n        }\n      ],\n      \"nl_ref_type\": \"explicit\",\n      \"nl_ref_phrase\": \"...\"\n    }\n  ]\n}\n\n### Output:"
}