{
  "gpt_result": {
    "nl_utterance": "Create a pie chart to show the distribution of departments based on their cumulative share of income.",
    "encoded_fields": [
      {
        "column": "Department",
        "nl_ref_type": "explicit",
        "nl_ref_phrase": "departments"
      },
      {
        "column": "cumShareIncome",
        "nl_ref_type": "explicit",
        "nl_ref_phrase": "cumulative share of income"
      }
    ],
    "constraints": [
      {
        "c_type": "mark",
        "c_name": "arc chart",
        "nl_ref_type": "explicit",
        "nl_ref_phrase": "pie chart"
      }
    ]
  },
  "input": "Dataset Information: {\n  \"data samples\": [\n    {\n      \"Name\": \"ADELMAN, BRUCE E\",\n      \"Job Titles\": \"LEGISLATIVE AIDE\",\n      \"Department\": \"CITY COUNCIL\",\n      \"Full or Part-Time\": \"F\",\n      \"Salary or Hourly\": \"SALARY\",\n      \"Typical Hours\": NaN,\n      \"Annual Salary\": 22248.0,\n      \"Hourly Rate\": NaN,\n      \"Rank\": 1,\n      \"share\": 9e-06,\n      \"cumShareIncome\": 9e-06,\n      \"cumSharePeople\": 4.124e-05,\n      \"shortName\": \"0\"\n    },\n    {\n      \"Name\": \"LAWRENCE, NARQUISE D\",\n      \"Job Titles\": \"LIBRARY CLERK\",\n      \"Department\": \"CHICAGO PUBLIC LIBRARY\",\n      \"Full or Part-Time\": \"F\",\n      \"Salary or Hourly\": \"SALARY\",\n      \"Typical Hours\": NaN,\n      \"Annual Salary\": 35532.0,\n      \"Hourly Rate\": NaN,\n      \"Rank\": 21,\n      \"share\": 1.5e-05,\n      \"cumShareIncome\": 0.000295,\n      \"cumSharePeople\": 0.00086609,\n      \"shortName\": \"Library\"\n    },\n    {\n      \"Name\": \"SCOTT, LESTER T\",\n      \"Job Titles\": \"POLICE OFFICER (ASSIGNED AS DETECTIVE)\",\n      \"Department\": \"DEPARTMENT OF POLICE\",\n      \"Full or Part-Time\": \"F\",\n      \"Salary or Hourly\": \"SALARY\",\n      \"Typical Hours\": NaN,\n      \"Annual Salary\": 117690.0,\n      \"Hourly Rate\": NaN,\n      \"Rank\": 19795,\n      \"share\": 4.9e-05,\n      \"cumShareIncome\": 0.752568,\n      \"cumSharePeople\": 0.81638966,\n      \"shortName\": \"Police\"\n    },\n    {\n      \"Name\": \"FARRELL, KEVIN\",\n      \"Job Titles\": \"FIREFIGHTER-EMT\",\n      \"Department\": \"FIRE DEPARTMENT\",\n      \"Full or Part-Time\": \"F\",\n      \"Salary or Hourly\": \"SALARY\",\n      \"Typical Hours\": NaN,\n      \"Annual Salary\": 102372.0,\n      \"Hourly Rate\": NaN,\n      \"Rank\": 13004,\n      \"share\": 4.2e-05,\n      \"cumShareIncome\": 0.446546,\n      \"cumSharePeople\": 0.53631377,\n      \"shortName\": \"Fire\"\n    },\n    {\n      \"Name\": \"LALLY, ADRIAN\",\n      \"Job Titles\": \"POLICE OFFICER (ASSIGNED AS DETECTIVE)\",\n      \"Department\": \"DEPARTMENT OF POLICE\",\n      \"Full or Part-Time\": \"F\",\n      \"Salary or Hourly\": \"SALARY\",\n      \"Typical Hours\": NaN,\n      \"Annual Salary\": 109704.0,\n      \"Hourly Rate\": NaN,\n      \"Rank\": 17131,\n      \"share\": 4.5e-05,\n      \"cumShareIncome\": 0.627996,\n      \"cumSharePeople\": 0.70652039,\n      \"shortName\": \"Police\"\n    }\n  ],\n  \"column names\": [\n    \"Name\",\n    \"Job Titles\",\n    \"Department\",\n    \"Full or Part-Time\",\n    \"Salary or Hourly\",\n    \"Typical Hours\",\n    \"Annual Salary\",\n    \"Hourly Rate\",\n    \"Rank\",\n    \"share\",\n    \"cumShareIncome\",\n    \"cumSharePeople\",\n    \"shortName\"\n  ]\n}\n\nYour Job:\nI am developing a NL to Data Visualization Dataset. \nPlease help me generate natural language utterance for given dataset and constraints.\nDefinition about the Taks:\n- 'utterance' is what a user would say to make a chart. It should be a commands structure. One NL 'utterance' is in one or two sentences. Here are two examples from Commands for reference:\n    For each country show the relationship between average acceleration and number of cylinders.\n    Make a simple scatter plot of worldwide Gross by Production Budget categorized by Major Genre.\n- 'given dataset' is in form of column names, column type, range/unique values of the column.\n- 'constraints' are information about the chart that should be included in the utterance. \n    So we can find a reference phrase in the NL utterance that corresponds to the given constraints. \n- 'reference phrase' can be explicit, ambiguous, and by_value. 'ambiguous' means the phrase can map to more than one columns in the dataset, always a hypernym of column names(depending on the dataset values).\n    For example:\n    {\"column\": \"gdpPercap\", \"nl_ref_type\": \"explicit\", \"nl_ref_phrase\": \"GDP per capita\"},\n    {\"column\": [\"country\",\"continent\"], \"nl_ref_type\": \"ambiguous\", \"nl_ref_phrase\": \"region\"}\n    {\"column\": [\"country\",\"country_short_name\"], \"nl_ref_type\": \"ambiguous\", \"nl_ref_phrase\": \"countries\"}\n    {\"c_type\": \"mark\", \"c_name\": \"point chart\", \"nl_ref_type\": \"explicit\", \"nl_ref_phrase\": \"scatter plot\"}\n    {\"c_type\": \"mark\", \"c_name\": \"arc chart\", \"nl_ref_type\": \"explicit\", \"nl_ref_phrase\": \"pie chart\"}\n    {\"c_type\": \"transform\",\"c_name\": \"filter\",\"c_list\": [{\"field\": \"country\",\"oneOf\": [\"Iceland\",\"Norway\"]}],\"nl_ref_type\": \"explicit\",\"nl_ref_phrase\": \"for countries Iceland and Norway\"},\n    {\"c_type\": \"transform\",\"c_name\": \"filter\",\"c_list\": [{\"field\": \"country\",\"oneOf\": [\"Iceland\",\"Norway\"]}],\"nl_ref_type\": \"by_value\",\"nl_ref_phrase\": \"for Iceland and Norway\"},\n- the 'nl_ref_phrase' for 'ambiguous' columns should be equally near all ambiguous columns, not too near to one of the column since it would not be ambiguous.\n    good example: {\"column\": [\"country\",\"region\"], \"nl_ref_type\": \"ambiguous\", \"nl_ref_phrase\": \"location\"}\n    bad example: {\"column\": [\"country\",\"region\"], \"nl_ref_type\": \"ambiguous\", \"nl_ref_phrase\": \"region\"}\n- You only include given constraints and no other information. \n    For example, if a column name is not in the given constraint, it will not be included in the NL utterance.\n    Also, it a chart mark or chart encoding channel is not in the given constraint, it will not be included in the NL utterance.\n- all 'nl_ref_phrase' shoule be included in the 'nl_utterance'. \n\nThe output format is identical to the input format, but fill in the str blanks(\"...\").\n### Input:\n{\n  \"nl_utterance\": \"...\",\n  \"encoded_fields\": [],\n  \"constraints\": []\n}\n\n### Output:"
}