{
  "gpt_result": {
    "nl_utterance": "What is the life expectancy against population for different continents in a scatter plot?",
    "encoded_fields": [
      {
        "field": "Life Expectancy",
        "type": "quantitative",
        "nl_ref_type": "explicit",
        "nl_ref_phrase": "life expectancy"
      },
      {
        "field": "Continent",
        "type": "nominal",
        "nl_ref_type": "explicit",
        "nl_ref_phrase": "continents"
      },
      {
        "field": "Population",
        "type": "quantitative",
        "nl_ref_type": "explicit",
        "nl_ref_phrase": "population"
      }
    ],
    "constraints": [
      {
        "c_type": "mark",
        "c_name": "point chart",
        "c_list": [
          {
            "mark": "circle",
            "encoding": {
              "x": {},
              "y": {},
              "color": {
                "type": "nominal",
                "ignore": true
              },
              "size": {
                "ignore": true,
                "type": "quantitative"
              },
              "column": {
                "ignore": true,
                "type": "nominal"
              },
              "row": {
                "ignore": true,
                "type": "nominal"
              }
            }
          }
        ],
        "nl_ref_type": "explicit",
        "nl_ref_phrase": "scatter plot"
      }
    ]
  },
  "input": "Dataset Information: {\n  \"data samples\": [\n    {\n      \"Country\": \"Finland\",\n      \"Happiness score\": 7.821,\n      \"Country_temp\": \"Finland\",\n      \"ISO3\": \"FIN\",\n      \"GDP per capita (PPP)\": 55013.38586,\n      \"Life Ladder\": 7.7944,\n      \"Social support\": 0.9703,\n      \"Perceptions of corruption\": 0.1918,\n      \"Population\": 5535992.0,\n      \"Median Age\": 42.368,\n      \"Total Fertility Rate\": 1.389,\n      \"Life Expectancy\": 82.038,\n      \"Infant Mortality\": 1.932,\n      \"Child Mortality\": 2.353,\n      \"Net Migration Rate\": 2.7,\n      \"Continent\": \"Europe\",\n      \"UN Region\": \"Northern Europe\"\n    },\n    {\n      \"Country\": \"Jordan\",\n      \"Happiness score\": 4.152,\n      \"Country_temp\": \"Jordan\",\n      \"ISO3\": \"JOR\",\n      \"GDP per capita (PPP)\": 10132.50388,\n      \"Life Ladder\": 3.9091,\n      \"Social support\": 0.7029,\n      \"Perceptions of corruption\": 0.6555,\n      \"Population\": 11148278.0,\n      \"Median Age\": 23.409,\n      \"Total Fertility Rate\": 2.83,\n      \"Life Expectancy\": 74.256,\n      \"Infant Mortality\": 12.389,\n      \"Child Mortality\": 14.354,\n      \"Net Migration Rate\": 1.29,\n      \"Continent\": \"Asia\",\n      \"UN Region\": \"Western Asia\"\n    },\n    {\n      \"Country\": \"Chile\",\n      \"Happiness score\": 6.172,\n      \"Country_temp\": \"Chile\",\n      \"ISO3\": \"CHL\",\n      \"GDP per capita (PPP)\": 28684.78027,\n      \"Life Ladder\": 6.4356,\n      \"Social support\": 0.8915,\n      \"Perceptions of corruption\": 0.8586,\n      \"Population\": 19493184.0,\n      \"Median Age\": 34.855,\n      \"Total Fertility Rate\": 1.54,\n      \"Life Expectancy\": 78.9,\n      \"Infant Mortality\": 4.7,\n      \"Child Mortality\": 6.0,\n      \"Net Migration Rate\": 5.9,\n      \"Continent\": \"America\",\n      \"UN Region\": \"South America\"\n    },\n    {\n      \"Country\": \"Albania\",\n      \"Happiness score\": 5.199,\n      \"Country_temp\": \"Albania\",\n      \"ISO3\": \"ALB\",\n      \"GDP per capita (PPP)\": 15709.25126,\n      \"Life Ladder\": 5.2555,\n      \"Social support\": 0.7019,\n      \"Perceptions of corruption\": 0.8961,\n      \"Population\": 2854710.0,\n      \"Median Age\": 37.273,\n      \"Total Fertility Rate\": 1.39,\n      \"Life Expectancy\": 76.463,\n      \"Infant Mortality\": 8.941,\n      \"Child Mortality\": 9.985,\n      \"Net Migration Rate\": -3.71,\n      \"Continent\": \"Europe\",\n      \"UN Region\": \"Southern Europe\"\n    },\n    {\n      \"Country\": \"Germany\",\n      \"Happiness score\": 7.034,\n      \"Country_temp\": \"Germany\",\n      \"ISO3\": \"DEU\",\n      \"GDP per capita (PPP)\": 57881.08358,\n      \"Life Ladder\": 6.7545,\n      \"Social support\": 0.8676,\n      \"Perceptions of corruption\": 0.4176,\n      \"Population\": 83408554.0,\n      \"Median Age\": 44.874,\n      \"Total Fertility Rate\": 1.53,\n      \"Life Expectancy\": 80.6,\n      \"Infant Mortality\": 3.1,\n      \"Child Mortality\": 4.0,\n      \"Net Migration Rate\": 3.8,\n      \"Continent\": \"Europe\",\n      \"UN Region\": \"Western Europe\"\n    }\n  ],\n  \"column names\": [\n    \"Country\",\n    \"Happiness score\",\n    \"Country_temp\",\n    \"ISO3\",\n    \"GDP per capita (PPP)\",\n    \"Life Ladder\",\n    \"Social support\",\n    \"Perceptions of corruption\",\n    \"Population\",\n    \"Median Age\",\n    \"Total Fertility Rate\",\n    \"Life Expectancy\",\n    \"Infant Mortality\",\n    \"Child Mortality\",\n    \"Net Migration Rate\",\n    \"Continent\",\n    \"UN Region\"\n  ]\n}\n\nYour Job:\nI am developing a NL to Data Visualization Dataset. \nPlease help me generate natural language utterance for given dataset and constraints.\nDefinition about the Taks:\n- 'utterance' is what a user would say to make a chart. It should be a questions structure. One NL 'utterance' is in one or two sentences. Here are two examples from Questions for reference:\n    On average, how much was earned by movies of each genre?\n    Which countries have the highest acceleration for cars of different cylinders?\n- 'given dataset' is in form of column names, column type, range/unique values of the column.\n- 'constraints' are information about the chart that should be included in the utterance. \n    So we can find a reference phrase in the NL utterance that corresponds to the given constraints. \n- 'reference phrase' can be explicit, ambiguous, and by_value. 'ambiguous' means the phrase can map to more than one columns in the dataset, always a hypernym of column names(depending on the dataset values).\n    For example:\n    {\"column\": \"gdpPercap\", \"nl_ref_type\": \"explicit\", \"nl_ref_phrase\": \"GDP per capita\"},\n    {\"column\": [\"country\",\"continent\"], \"nl_ref_type\": \"ambiguous\", \"nl_ref_phrase\": \"region\"}\n    {\"column\": [\"country\",\"country_short_name\"], \"nl_ref_type\": \"ambiguous\", \"nl_ref_phrase\": \"countries\"}\n    {\"c_type\": \"mark\", \"c_name\": \"point chart\", \"nl_ref_type\": \"explicit\", \"nl_ref_phrase\": \"scatter plot\"}\n    {\"c_type\": \"mark\", \"c_name\": \"arc chart\", \"nl_ref_type\": \"explicit\", \"nl_ref_phrase\": \"pie chart\"}\n    {\"c_type\": \"transform\",\"c_name\": \"filter\",\"c_list\": [{\"field\": \"country\",\"oneOf\": [\"Iceland\",\"Norway\"]}],\"nl_ref_type\": \"explicit\",\"nl_ref_phrase\": \"for countries Iceland and Norway\"},\n    {\"c_type\": \"transform\",\"c_name\": \"filter\",\"c_list\": [{\"field\": \"country\",\"oneOf\": [\"Iceland\",\"Norway\"]}],\"nl_ref_type\": \"by_value\",\"nl_ref_phrase\": \"for Iceland and Norway\"},\n- the 'nl_ref_phrase' for 'ambiguous' columns should be equally near all ambiguous columns, not too near to one of the column since it would not be ambiguous.\n    good example: {\"column\": [\"country\",\"region\"], \"nl_ref_type\": \"ambiguous\", \"nl_ref_phrase\": \"location\"}\n    bad example: {\"column\": [\"country\",\"region\"], \"nl_ref_type\": \"ambiguous\", \"nl_ref_phrase\": \"region\"}\n- You only include given constraints and no other information. \n    For example, if a column name is not in the given constraint, it will not be included in the NL utterance.\n    Also, it a chart mark or chart encoding channel is not in the given constraint, it will not be included in the NL utterance.\n- all 'nl_ref_phrase' shoule be included in the 'nl_utterance'. \n\nThe output format is identical to the input format, but fill in the str blanks(\"...\").\n### Input:\n{\n  \"nl_utterance\": \"...\",\n  \"encoded_fields\": [\n    {\n      \"field\": \"Life Expectancy\",\n      \"type\": \"quantitative\",\n      \"nl_ref_type\": \"explicit\",\n      \"nl_ref_phrase\": \"...\"\n    },\n    {\n      \"field\": \"Continent\",\n      \"type\": \"nominal\",\n      \"nl_ref_type\": \"explicit\",\n      \"nl_ref_phrase\": \"...\"\n    },\n    {\n      \"field\": \"Population\",\n      \"type\": \"quantitative\",\n      \"nl_ref_type\": \"explicit\",\n      \"nl_ref_phrase\": \"...\"\n    }\n  ],\n  \"constraints\": [\n    {\n      \"c_type\": \"mark\",\n      \"c_name\": \"point chart\",\n      \"c_list\": [\n        {\n          \"mark\": \"circle\",\n          \"encoding\": {\n            \"x\": {},\n            \"y\": {},\n            \"color\": {\n              \"type\": \"nominal\",\n              \"ignore\": true\n            },\n            \"size\": {\n              \"ignore\": true,\n              \"type\": \"quantitative\"\n            },\n            \"column\": {\n              \"ignore\": true,\n              \"type\": \"nominal\"\n            },\n            \"row\": {\n              \"ignore\": true,\n              \"type\": \"nominal\"\n            }\n          }\n        }\n      ],\n      \"nl_ref_type\": \"explicit\",\n      \"nl_ref_phrase\": \"...\"\n    }\n  ]\n}\n\n### Output:"
}