{
  "gpt_result": {
    "nl_utterance": "How has the Totals in USD changed over time?",
    "encoded_fields": [
      {
        "field": "Totals_USD",
        "type": "quantitative",
        "nl_ref_type": "explicit",
        "nl_ref_phrase": "Totals in USD"
      }
    ],
    "constraints": [
      {
        "c_type": "task",
        "c_name": "trend",
        "c_list": [
          {
            "mark": [
              "bar",
              "line",
              "area"
            ],
            "encoding": {
              "x": {
                "type": "temporal"
              }
            }
          }
        ],
        "nl_ref_type": "explicit",
        "nl_ref_phrase": "changed over time"
      }
    ]
  },
  "input": "Dataset Information: {\n  \"data samples\": [\n    {\n      \"Date\": \"08/31/2022\",\n      \"GRA Purchases\": 93769635059,\n      \"PRGT 1/2/\": 15254184552,\n      \"Totals\": 109024000000.0,\n      \"Totals_bil_SDR\": 109.02,\n      \"Year\": 2022,\n      \"Conversion rate\": 1.28252,\n      \"Unnamed: 7\": NaN,\n      \"Totals_USD\": 139.8203304,\n      \"World GDP\": 86700000000000.0,\n      \"World aggregate real GDP (billion USD)\": 86652.9,\n      \"Unnamed: 11\": 0.001258123,\n      \"Total_USD/GDP\": 0.001613568,\n      \"Percentage\": 0.161356781,\n      \"Unnamed: 14\": NaN,\n      \"World nominal GDP\": 98100000000000.0,\n      \"Unnamed: 16\": 98100,\n      \"Unnamed: 17\": 0.001425284,\n      \"Percentages\": 0.142528369\n    },\n    {\n      \"Date\": \"12/31/1999\",\n      \"GRA Purchases\": 51061861875,\n      \"PRGT 1/2/\": 6434274362,\n      \"Totals\": 57496136237.0,\n      \"Totals_bil_SDR\": 57.5,\n      \"Year\": 1999,\n      \"Conversion rate\": 1.37251,\n      \"Unnamed: 7\": NaN,\n      \"Totals_USD\": 78.919325,\n      \"World GDP\": 46200000000000.0,\n      \"World aggregate real GDP (billion USD)\": 46150.8,\n      \"Unnamed: 11\": 0.001245916,\n      \"Total_USD/GDP\": 0.001710032,\n      \"Percentage\": 0.171003157,\n      \"Unnamed: 14\": NaN,\n      \"World nominal GDP\": 32737000000000.0,\n      \"Unnamed: 16\": 32737,\n      \"Unnamed: 17\": 0.002410707,\n      \"Percentages\": 0.24107073\n    },\n    {\n      \"Date\": \"12/31/2017\",\n      \"GRA Purchases\": 39585385873,\n      \"PRGT 1/2/\": 6522280669,\n      \"Totals\": 46107666542.0,\n      \"Totals_bil_SDR\": 46.11,\n      \"Year\": 2017,\n      \"Conversion rate\": 1.42413,\n      \"Unnamed: 7\": NaN,\n      \"Totals_USD\": 65.6666343,\n      \"World GDP\": 79900000000000.0,\n      \"World aggregate real GDP (billion USD)\": 79895.2,\n      \"Unnamed: 11\": 0.000577131,\n      \"Total_USD/GDP\": 0.00082191,\n      \"Percentage\": 0.082190963,\n      \"Unnamed: 14\": NaN,\n      \"World nominal GDP\": 81404000000000.0,\n      \"Unnamed: 16\": 81404,\n      \"Unnamed: 17\": 0.000806676,\n      \"Percentages\": 0.080667577\n    },\n    {\n      \"Date\": \"12/31/1990\",\n      \"GRA Purchases\": 20731851093,\n      \"PRGT 1/2/\": 2571911617,\n      \"Totals\": 23303762710.0,\n      \"Totals_bil_SDR\": 23.3,\n      \"Year\": 1990,\n      \"Conversion rate\": 1.42266,\n      \"Unnamed: 7\": NaN,\n      \"Totals_USD\": 33.147978,\n      \"World GDP\": 35900000000000.0,\n      \"World aggregate real GDP (billion USD)\": 35872.8,\n      \"Unnamed: 11\": 0.000649517,\n      \"Total_USD/GDP\": 0.000924042,\n      \"Percentage\": 0.092404212,\n      \"Unnamed: 14\": NaN,\n      \"World nominal GDP\": 22780000000000.0,\n      \"Unnamed: 16\": 22780,\n      \"Unnamed: 17\": 0.001455135,\n      \"Percentages\": 0.145513512\n    },\n    {\n      \"Date\": \"12/31/1994\",\n      \"GRA Purchases\": 25611676952,\n      \"PRGT 1/2/\": 4599768498,\n      \"Totals\": 30211445450.0,\n      \"Totals_bil_SDR\": 30.21,\n      \"Year\": 1994,\n      \"Conversion rate\": 1.45985,\n      \"Unnamed: 7\": NaN,\n      \"Totals_USD\": 44.1020685,\n      \"World GDP\": 39100000000000.0,\n      \"World aggregate real GDP (billion USD)\": 39072.4,\n      \"Unnamed: 11\": 0.00077318,\n      \"Total_USD/GDP\": 0.001128727,\n      \"Percentage\": 0.112872689,\n      \"Unnamed: 14\": NaN,\n      \"World nominal GDP\": 27872000000000.0,\n      \"Unnamed: 16\": 27872,\n      \"Unnamed: 17\": 0.001582307,\n      \"Percentages\": 0.158230728\n    }\n  ],\n  \"column names\": [\n    \"Date\",\n    \"GRA Purchases\",\n    \"PRGT 1/2/\",\n    \"Totals\",\n    \"Totals_bil_SDR\",\n    \"Year\",\n    \"Conversion rate\",\n    \"Unnamed: 7\",\n    \"Totals_USD\",\n    \"World GDP\",\n    \"World aggregate real GDP (billion USD)\",\n    \"Unnamed: 11\",\n    \"Total_USD/GDP\",\n    \"Percentage\",\n    \"Unnamed: 14\",\n    \"World nominal GDP\",\n    \"Unnamed: 16\",\n    \"Unnamed: 17\",\n    \"Percentages\"\n  ]\n}\n\nYour Job:\nI am developing a NL to Data Visualization Dataset. \nPlease help me generate natural language utterance for given dataset and constraints.\nDefinition about the Taks:\n- 'utterance' is what a user would say to make a chart. It should be a questions structure. One NL 'utterance' is in one or two sentences. Here are two examples from Questions for reference:\n    On average, how much was earned by movies of each genre?\n    What major genre had the highest average worldwide gross?\n- 'given dataset' is in form of column names, column type, range/unique values of the column.\n- 'constraints' are information about the chart that should be included in the utterance. \n    So we can find a reference phrase in the NL utterance that corresponds to the given constraints. \n- 'reference phrase' can be explicit, ambiguous, and by_value. 'ambiguous' means the phrase can map to more than one columns in the dataset, always a hypernym of column names(depending on the dataset values).\n    For example:\n    {\"column\": \"gdpPercap\", \"nl_ref_type\": \"explicit\", \"nl_ref_phrase\": \"GDP per capita\"},\n    {\"column\": [\"country\",\"continent\"], \"nl_ref_type\": \"ambiguous\", \"nl_ref_phrase\": \"region\"}\n    {\"column\": [\"country\",\"country_short_name\"], \"nl_ref_type\": \"ambiguous\", \"nl_ref_phrase\": \"countries\"}\n    {\"c_type\": \"mark\", \"c_name\": \"point chart\", \"nl_ref_type\": \"explicit\", \"nl_ref_phrase\": \"scatter plot\"}\n    {\"c_type\": \"mark\", \"c_name\": \"arc chart\", \"nl_ref_type\": \"explicit\", \"nl_ref_phrase\": \"pie chart\"}\n    {\"c_type\": \"transform\",\"c_name\": \"filter\",\"c_list\": [{\"field\": \"country\",\"oneOf\": [\"Iceland\",\"Norway\"]}],\"nl_ref_type\": \"explicit\",\"nl_ref_phrase\": \"for countries Iceland and Norway\"},\n    {\"c_type\": \"transform\",\"c_name\": \"filter\",\"c_list\": [{\"field\": \"country\",\"oneOf\": [\"Iceland\",\"Norway\"]}],\"nl_ref_type\": \"by_value\",\"nl_ref_phrase\": \"for Iceland and Norway\"},\n- the 'nl_ref_phrase' for 'ambiguous' columns should be equally near all ambiguous columns, not too near to one of the column since it would not be ambiguous.\n    good example: {\"column\": [\"country\",\"region\"], \"nl_ref_type\": \"ambiguous\", \"nl_ref_phrase\": \"location\"}\n    bad example: {\"column\": [\"country\",\"region\"], \"nl_ref_type\": \"ambiguous\", \"nl_ref_phrase\": \"region\"}\n- You only include given constraints and no other information. \n    For example, if a column name is not in the given constraint, it will not be included in the NL utterance.\n    Also, it a chart mark or chart encoding channel is not in the given constraint, it will not be included in the NL utterance.\n- all 'nl_ref_phrase' shoule be included in the 'nl_utterance'. \n\nThe output format is identical to the input format, but fill in the str blanks(\"...\").\n### Input:\n{\n  \"nl_utterance\": \"...\",\n  \"encoded_fields\": [\n    {\n      \"field\": \"Totals_USD\",\n      \"type\": \"quantitative\",\n      \"nl_ref_type\": \"explicit\",\n      \"nl_ref_phrase\": \"...\"\n    }\n  ],\n  \"constraints\": [\n    {\n      \"c_type\": \"task\",\n      \"c_name\": \"trend\",\n      \"c_list\": [\n        {\n          \"mark\": [\n            \"bar\",\n            \"line\",\n            \"area\"\n          ],\n          \"encoding\": {\n            \"x\": {\n              \"type\": \"temporal\"\n            }\n          }\n        }\n      ],\n      \"nl_ref_type\": \"explicit\",\n      \"nl_ref_phrase\": \"...\"\n    }\n  ]\n}\n\n### Output:"
}