{
  "gpt_result": {
    "nl_utterance": "Can you show me a scatter plot of Component 1 against Component 2, with positions highlighted on the chart?",
    "encoded_fields": [
      {
        "field": "Component 1",
        "type": "quantitative",
        "nl_ref_type": "explicit",
        "nl_ref_phrase": "Component 1"
      },
      {
        "field": "Component 2",
        "type": "quantitative",
        "nl_ref_type": "explicit",
        "nl_ref_phrase": "Component 2"
      },
      {
        "field": "Pos",
        "type": "nominal",
        "nl_ref_type": "explicit",
        "nl_ref_phrase": "positions"
      }
    ],
    "constraints": [
      {
        "c_type": "mark",
        "c_name": "point chart",
        "c_list": [
          {
            "mark": "circle",
            "encoding": {
              "x": {},
              "y": {},
              "color": {
                "type": "nominal",
                "ignore": true
              },
              "size": {
                "ignore": true,
                "type": "quantitative"
              },
              "column": {
                "ignore": true,
                "type": "nominal"
              },
              "row": {
                "ignore": true,
                "type": "nominal"
              }
            }
          }
        ],
        "nl_ref_type": "explicit",
        "nl_ref_phrase": "scatter plot"
      }
    ]
  },
  "input": "Dataset Information: {\n  \"data samples\": [\n    {\n      \"Unnamed: 0\": 0,\n      \"Player\": \"Max Aarons\",\n      \"Progressive Carries\": 5.4375,\n      \"Touches\": 57.96875,\n      \"Expected Assists\": 0.04375,\n      \"Progressive Passes\": 2.9375,\n      \"Passes\": 33.96875,\n      \"Interceptions\": 1.75,\n      \"Possession-Winning-Tackles\": 1.15625,\n      \"Aerials Won\": 0.46875,\n      \"Pos\": \"Defender\",\n      \"Non-Penalty Expected Goals\": 0.02,\n      \"cluster\": 6,\n      \"Component 1\": -0.6794867331318681,\n      \"Component 2\": 0.4101967803346252\n    },\n    {\n      \"Unnamed: 0\": 422,\n      \"Player\": \"Jonas Hofmann\",\n      \"Progressive Carries\": 5.757575757575757,\n      \"Touches\": 66.49350649350649,\n      \"Expected Assists\": 0.29004329004329,\n      \"Progressive Passes\": 3.8528138528138527,\n      \"Passes\": 43.2034632034632,\n      \"Interceptions\": 1.2121212121212122,\n      \"Possession-Winning-Tackles\": 1.2121212121212122,\n      \"Aerials Won\": 0.4329004329004329,\n      \"Pos\": \"Winger\",\n      \"Non-Penalty Expected Goals\": 0.34,\n      \"cluster\": 4,\n      \"Component 1\": 1.0786670024926934,\n      \"Component 2\": 2.7932493129399987\n    },\n    {\n      \"Unnamed: 0\": 594,\n      \"Player\": \"Matthew Lowton\",\n      \"Progressive Carries\": 2.944162436548224,\n      \"Touches\": 54.67005076142132,\n      \"Expected Assists\": 0.065989847715736,\n      \"Progressive Passes\": 4.060913705583756,\n      \"Passes\": 30.35532994923858,\n      \"Interceptions\": 1.7258883248730963,\n      \"Possession-Winning-Tackles\": 1.3197969543147208,\n      \"Aerials Won\": 1.5736040609137056,\n      \"Pos\": \"Defender\",\n      \"Non-Penalty Expected Goals\": 0.03,\n      \"cluster\": 1,\n      \"Component 1\": -0.4831606052429955,\n      \"Component 2\": -0.6968053573536178\n    },\n    {\n      \"Unnamed: 0\": 534,\n      \"Player\": \"Ezri Konsa\",\n      \"Progressive Carries\": 1.0545454545454545,\n      \"Touches\": 43.81818181818182,\n      \"Expected Assists\": 0.0109090909090909,\n      \"Progressive Passes\": 1.2,\n      \"Passes\": 30.90909090909091,\n      \"Interceptions\": 1.6363636363636365,\n      \"Possession-Winning-Tackles\": 0.509090909090909,\n      \"Aerials Won\": 2.1818181818181817,\n      \"Pos\": \"Defender\",\n      \"Non-Penalty Expected Goals\": 0.05,\n      \"cluster\": 5,\n      \"Component 1\": 0.3352865887468656,\n      \"Component 2\": -2.0591815599231555\n    },\n    {\n      \"Unnamed: 0\": 841,\n      \"Player\": \"Cristiano Ronaldo\",\n      \"Progressive Carries\": 5.164835164835165,\n      \"Touches\": 43.36996336996337,\n      \"Expected Assists\": 0.1135531135531135,\n      \"Progressive Passes\": 1.794871794871795,\n      \"Passes\": 26.3003663003663,\n      \"Interceptions\": 0.1831501831501831,\n      \"Possession-Winning-Tackles\": 0.293040293040293,\n      \"Aerials Won\": 1.7582417582417582,\n      \"Pos\": \"Forward\",\n      \"Non-Penalty Expected Goals\": 0.52,\n      \"cluster\": 0,\n      \"Component 1\": 3.5847077497736404,\n      \"Component 2\": 0.5376672850780223\n    }\n  ],\n  \"column names\": [\n    \"Unnamed: 0\",\n    \"Player\",\n    \"Progressive Carries\",\n    \"Touches\",\n    \"Expected Assists\",\n    \"Progressive Passes\",\n    \"Passes\",\n    \"Interceptions\",\n    \"Possession-Winning-Tackles\",\n    \"Aerials Won\",\n    \"Pos\",\n    \"Non-Penalty Expected Goals\",\n    \"cluster\",\n    \"Component 1\",\n    \"Component 2\"\n  ]\n}\n\nYour Job:\nI am developing a NL to Data Visualization Dataset. \nPlease help me generate natural language utterance for given dataset and constraints.\nDefinition about the Taks:\n- 'utterance' is what a user would say to make a chart. It should be a questions structure. One NL 'utterance' is in one or two sentences. Here are two examples from Questions for reference:\n    On average, how much was earned by movies of each genre?\n    How much do various cars weigh?\n- 'given dataset' is in form of column names, column type, range/unique values of the column.\n- 'constraints' are information about the chart that should be included in the utterance. \n    So we can find a reference phrase in the NL utterance that corresponds to the given constraints. \n- 'reference phrase' can be explicit, ambiguous, and by_value. 'ambiguous' means the phrase can map to more than one columns in the dataset, always a hypernym of column names(depending on the dataset values).\n    For example:\n    {\"column\": \"gdpPercap\", \"nl_ref_type\": \"explicit\", \"nl_ref_phrase\": \"GDP per capita\"},\n    {\"column\": [\"country\",\"continent\"], \"nl_ref_type\": \"ambiguous\", \"nl_ref_phrase\": \"region\"}\n    {\"column\": [\"country\",\"country_short_name\"], \"nl_ref_type\": \"ambiguous\", \"nl_ref_phrase\": \"countries\"}\n    {\"c_type\": \"mark\", \"c_name\": \"point chart\", \"nl_ref_type\": \"explicit\", \"nl_ref_phrase\": \"scatter plot\"}\n    {\"c_type\": \"mark\", \"c_name\": \"arc chart\", \"nl_ref_type\": \"explicit\", \"nl_ref_phrase\": \"pie chart\"}\n    {\"c_type\": \"transform\",\"c_name\": \"filter\",\"c_list\": [{\"field\": \"country\",\"oneOf\": [\"Iceland\",\"Norway\"]}],\"nl_ref_type\": \"explicit\",\"nl_ref_phrase\": \"for countries Iceland and Norway\"},\n    {\"c_type\": \"transform\",\"c_name\": \"filter\",\"c_list\": [{\"field\": \"country\",\"oneOf\": [\"Iceland\",\"Norway\"]}],\"nl_ref_type\": \"by_value\",\"nl_ref_phrase\": \"for Iceland and Norway\"},\n- the 'nl_ref_phrase' for 'ambiguous' columns should be equally near all ambiguous columns, not too near to one of the column since it would not be ambiguous.\n    good example: {\"column\": [\"country\",\"region\"], \"nl_ref_type\": \"ambiguous\", \"nl_ref_phrase\": \"location\"}\n    bad example: {\"column\": [\"country\",\"region\"], \"nl_ref_type\": \"ambiguous\", \"nl_ref_phrase\": \"region\"}\n- You only include given constraints and no other information. \n    For example, if a column name is not in the given constraint, it will not be included in the NL utterance.\n    Also, it a chart mark or chart encoding channel is not in the given constraint, it will not be included in the NL utterance.\n- all 'nl_ref_phrase' shoule be included in the 'nl_utterance'. \n\nThe output format is identical to the input format, but fill in the str blanks(\"...\").\n### Input:\n{\n  \"nl_utterance\": \"...\",\n  \"encoded_fields\": [\n    {\n      \"field\": \"Component 1\",\n      \"type\": \"quantitative\",\n      \"nl_ref_type\": \"explicit\",\n      \"nl_ref_phrase\": \"...\"\n    },\n    {\n      \"field\": \"Component 2\",\n      \"type\": \"quantitative\",\n      \"nl_ref_type\": \"explicit\",\n      \"nl_ref_phrase\": \"...\"\n    },\n    {\n      \"field\": \"Pos\",\n      \"type\": \"nominal\",\n      \"nl_ref_type\": \"explicit\",\n      \"nl_ref_phrase\": \"...\"\n    }\n  ],\n  \"constraints\": [\n    {\n      \"c_type\": \"mark\",\n      \"c_name\": \"point chart\",\n      \"c_list\": [\n        {\n          \"mark\": \"circle\",\n          \"encoding\": {\n            \"x\": {},\n            \"y\": {},\n            \"color\": {\n              \"type\": \"nominal\",\n              \"ignore\": true\n            },\n            \"size\": {\n              \"ignore\": true,\n              \"type\": \"quantitative\"\n            },\n            \"column\": {\n              \"ignore\": true,\n              \"type\": \"nominal\"\n            },\n            \"row\": {\n              \"ignore\": true,\n              \"type\": \"nominal\"\n            }\n          }\n        }\n      ],\n      \"nl_ref_type\": \"explicit\",\n      \"nl_ref_phrase\": \"...\"\n    }\n  ]\n}\n\n### Output:"
}