{
  "gpt_result": {
    "nl_utterance": "Create a chart showing GDP per capita for countries Iceland and Norway, filtered by the years 1952 and 2017.",
    "encoded_fields": [
      {
        "field": "gdpPercap",
        "type": "quantitative",
        "nl_ref_type": "explicit",
        "nl_ref_phrase": "GDP per capita"
      },
      {
        "field": "country",
        "type": "nominal",
        "nl_ref_type": "explicit",
        "nl_ref_phrase": "countries"
      }
    ],
    "constraints": [
      {
        "c_type": "transform",
        "c_name": "filter",
        "c_list": [
          {
            "field": "country",
            "oneOf": [
              "Iceland",
              "Norway"
            ]
          }
        ],
        "nl_ref_type": "explicit",
        "nl_ref_phrase": "for countries Iceland and Norway"
      },
      {
        "c_type": "transform",
        "c_name": "filter",
        "c_list": [
          {
            "field": "year",
            "oneOf": [
              "1952",
              "2017"
            ]
          }
        ],
        "nl_ref_type": "explicit",
        "nl_ref_phrase": "by the years 1952 and 2017"
      }
    ]
  },
  "input": "Dataset Information: {\n  \"data samples\": [\n    {\n      \"country\": \"Afghanistan\",\n      \"region\": \"Asia\",\n      \"country_code\": \"AFG\",\n      \"year\": 1952,\n      \"lifeExp\": 33.0,\n      \"gdpPercap\": 1070,\n      \"pop\": 7930000\n    },\n    {\n      \"country\": \"South Africa\",\n      \"region\": \"Africa\",\n      \"country_code\": \"ZAF\",\n      \"year\": 1992,\n      \"lifeExp\": 64.5,\n      \"gdpPercap\": 9130,\n      \"pop\": 39400000\n    },\n    {\n      \"country\": \"Macedonia, FYR\",\n      \"region\": \"Europe\",\n      \"country_code\": \"MKD\",\n      \"year\": 1972,\n      \"lifeExp\": 68.1,\n      \"gdpPercap\": 7100,\n      \"pop\": 1750000\n    },\n    {\n      \"country\": \"Lithuania\",\n      \"region\": \"Europe\",\n      \"country_code\": \"LTU\",\n      \"year\": 2017,\n      \"lifeExp\": 75.2,\n      \"gdpPercap\": 29100,\n      \"pop\": 2890000\n    },\n    {\n      \"country\": \"Azerbaijan\",\n      \"region\": \"Europe\",\n      \"country_code\": \"AZE\",\n      \"year\": 2012,\n      \"lifeExp\": 70.2,\n      \"gdpPercap\": 15900,\n      \"pop\": 9260000\n    }\n  ],\n  \"column names\": [\n    \"country\",\n    \"region\",\n    \"country_code\",\n    \"year\",\n    \"lifeExp\",\n    \"gdpPercap\",\n    \"pop\"\n  ]\n}\n\nYour Job:\nI am developing a NL to Data Visualization Dataset. \nPlease help me generate natural language utterance for given dataset and constraints.\nDefinition about the Taks:\n- 'utterance' is what a user would say to make a chart. It should be a commands structure. One NL 'utterance' is in one or two sentences. Here are two examples from Commands for reference:\n    Help me see outliers in IMDB and Rotten Tomatoes ratings.\n    Through a visualization show average horsepower of cars for each country from 1997 to 2011.for country in USA, JAPAN and EUROPE show MPG vs Displacement.\n- 'given dataset' is in form of column names, column type, range/unique values of the column.\n- 'constraints' are information about the chart that should be included in the utterance. \n    So we can find a reference phrase in the NL utterance that corresponds to the given constraints. \n- 'reference phrase' can be explicit, ambiguous, and by_value. 'ambiguous' means the phrase can map to more than one columns in the dataset, always a hypernym of column names(depending on the dataset values).\n    For example:\n    {\"column\": \"gdpPercap\", \"nl_ref_type\": \"explicit\", \"nl_ref_phrase\": \"GDP per capita\"},\n    {\"column\": [\"country\",\"continent\"], \"nl_ref_type\": \"ambiguous\", \"nl_ref_phrase\": \"region\"}\n    {\"column\": [\"country\",\"country_short_name\"], \"nl_ref_type\": \"ambiguous\", \"nl_ref_phrase\": \"countries\"}\n    {\"c_type\": \"mark\", \"c_name\": \"point chart\", \"nl_ref_type\": \"explicit\", \"nl_ref_phrase\": \"scatter plot\"}\n    {\"c_type\": \"mark\", \"c_name\": \"arc chart\", \"nl_ref_type\": \"explicit\", \"nl_ref_phrase\": \"pie chart\"}\n    {\"c_type\": \"transform\",\"c_name\": \"filter\",\"c_list\": [{\"field\": \"country\",\"oneOf\": [\"Iceland\",\"Norway\"]}],\"nl_ref_type\": \"explicit\",\"nl_ref_phrase\": \"for countries Iceland and Norway\"},\n    {\"c_type\": \"transform\",\"c_name\": \"filter\",\"c_list\": [{\"field\": \"country\",\"oneOf\": [\"Iceland\",\"Norway\"]}],\"nl_ref_type\": \"by_value\",\"nl_ref_phrase\": \"for Iceland and Norway\"},\n- the 'nl_ref_phrase' for 'ambiguous' columns should be equally near all ambiguous columns, not too near to one of the column since it would not be ambiguous.\n    good example: {\"column\": [\"country\",\"region\"], \"nl_ref_type\": \"ambiguous\", \"nl_ref_phrase\": \"location\"}\n    bad example: {\"column\": [\"country\",\"region\"], \"nl_ref_type\": \"ambiguous\", \"nl_ref_phrase\": \"region\"}\n- You only include given constraints and no other information. \n    For example, if a column name is not in the given constraint, it will not be included in the NL utterance.\n    Also, it a chart mark or chart encoding channel is not in the given constraint, it will not be included in the NL utterance.\n- all 'nl_ref_phrase' shoule be included in the 'nl_utterance'. \n\nThe output format is identical to the input format, but fill in the str blanks(\"...\").\n### Input:\n{\n  \"nl_utterance\": \"...\",\n  \"encoded_fields\": [\n    {\n      \"field\": \"gdpPercap\",\n      \"type\": \"quantitative\",\n      \"nl_ref_type\": \"explicit\",\n      \"nl_ref_phrase\": \"...\"\n    },\n    {\n      \"field\": \"country\",\n      \"type\": \"nominal\",\n      \"nl_ref_type\": \"explicit\",\n      \"nl_ref_phrase\": \"...\"\n    }\n  ],\n  \"constraints\": [\n    {\n      \"c_type\": \"transform\",\n      \"c_name\": \"filter\",\n      \"c_list\": [\n        {\n          \"field\": \"country\",\n          \"oneOf\": [\n            \"Iceland\",\n            \"Norway\"\n          ]\n        }\n      ],\n      \"nl_ref_type\": \"explicit\",\n      \"nl_ref_phrase\": \"...\"\n    },\n    {\n      \"c_type\": \"transform\",\n      \"c_name\": \"filter\",\n      \"c_list\": [\n        {\n          \"field\": \"year\",\n          \"oneOf\": [\n            \"1952\",\n            \"2017\"\n          ]\n        }\n      ],\n      \"nl_ref_type\": \"explicit\",\n      \"nl_ref_phrase\": \"...\"\n    }\n  ]\n}\n\n### Output:"
}