{
  "gpt_result": {
    "nl_utterance": "Show me the total oil consumption per year.",
    "encoded_fields": [
      {
        "field": "Year",
        "type": "quantitative",
        "nl_ref_type": "explicit",
        "nl_ref_phrase": "per year"
      },
      {
        "field": "Oil Consumption - TWh (zero filled)",
        "type": "quantitative",
        "nl_ref_type": "explicit",
        "nl_ref_phrase": "oil consumption"
      }
    ],
    "constraints": [
      {
        "c_type": "transform",
        "c_name": "aggregate",
        "c_list": [
          {
            "field": "Oil Consumption - TWh (zero filled)",
            "aggregate": "sum"
          }
        ],
        "nl_ref_type": "explicit",
        "nl_ref_phrase": "total"
      }
    ]
  },
  "input": "Dataset Information: {\n  \"data samples\": [\n    {\n      \"Unnamed: 0\": 0,\n      \"Entity\": \"Africa\",\n      \"Year\": 1965,\n      \"Geo Biomass Other - TWh (zero filled)\": 0.0,\n      \"Biofuels Consumption - TWh - Total (zero filled)\": 0.0,\n      \"Solar Consumption - TWh (zero filled)\": 0.0,\n      \"Wind Consumption - TWh (zero filled)\": 0.0,\n      \"Hydro Consumption - TWh (zero filled)\": 41.11881256,\n      \"Nuclear Consumption - TWh (zero filled)\": 0.0,\n      \"Gas Consumption - TWh (zero filled)\": 9.543754578,\n      \"Coal Consumption - TWh (zero filled)\": 323.4961243,\n      \"Oil Consumption - TWh (zero filled)\": 341.2627563\n    },\n    {\n      \"Unnamed: 0\": 21,\n      \"Entity\": \"Africa\",\n      \"Year\": 1986,\n      \"Geo Biomass Other - TWh (zero filled)\": 0.658999979,\n      \"Biofuels Consumption - TWh - Total (zero filled)\": 0.0,\n      \"Solar Consumption - TWh (zero filled)\": 0.0,\n      \"Wind Consumption - TWh (zero filled)\": 0.0,\n      \"Hydro Consumption - TWh (zero filled)\": 151.2363129,\n      \"Nuclear Consumption - TWh (zero filled)\": 24.97864342,\n      \"Gas Consumption - TWh (zero filled)\": 313.2712097,\n      \"Coal Consumption - TWh (zero filled)\": 805.3560791,\n      \"Oil Consumption - TWh (zero filled)\": 988.5931396\n    },\n    {\n      \"Unnamed: 0\": 5277,\n      \"Entity\": \"South Africa\",\n      \"Year\": 2001,\n      \"Geo Biomass Other - TWh (zero filled)\": 0.423099995,\n      \"Biofuels Consumption - TWh - Total (zero filled)\": 0.0,\n      \"Solar Consumption - TWh (zero filled)\": 0.031728055,\n      \"Wind Consumption - TWh (zero filled)\": 0.0,\n      \"Hydro Consumption - TWh (zero filled)\": 5.055932999,\n      \"Nuclear Consumption - TWh (zero filled)\": 30.21781921,\n      \"Gas Consumption - TWh (zero filled)\": 13.82906246,\n      \"Coal Consumption - TWh (zero filled)\": 871.0688477,\n      \"Oil Consumption - TWh (zero filled)\": 269.9823914\n    }\n  ],\n  \"column names\": [\n    \"Unnamed: 0\",\n    \"Entity\",\n    \"Year\",\n    \"Geo Biomass Other - TWh (zero filled)\",\n    \"Biofuels Consumption - TWh - Total (zero filled)\",\n    \"Solar Consumption - TWh (zero filled)\",\n    \"Wind Consumption - TWh (zero filled)\",\n    \"Hydro Consumption - TWh (zero filled)\",\n    \"Nuclear Consumption - TWh (zero filled)\",\n    \"Gas Consumption - TWh (zero filled)\",\n    \"Coal Consumption - TWh (zero filled)\",\n    \"Oil Consumption - TWh (zero filled)\"\n  ]\n}\n\nYour Job:\nI am developing a NL to Data Visualization Dataset. \nPlease help me generate natural language utterance for given dataset and constraints.\nDefinition about the Taks:\n- 'utterance' is what a user would say to make a chart, it can be a question or a command. One NL 'utterance' is in one or two sentences. \n- 'given dataset' is in form of column names, column type, range/unique values of the column.\n- 'constraints' are information about the chart that should be included in the utterance. \n    So we can find a reference phrase in the NL utterance that corresponds to the given constraints. \n- 'reference phrase' can be explicit, ambiguous, and by_value. 'ambiguous' means the phrase can map to more than one columns in the dataset, always a hypernym of column names(depending on the dataset values).\n    For example:\n    {\"column\": \"gdpPercap\", \"nl_ref_type\": \"explicit\", \"nl_ref_phrase\": \"GDP per capita\"},\n    {\"column\": [\"country\",\"continent\"], \"nl_ref_type\": \"ambiguous\", \"nl_ref_phrase\": \"region\"}\n    {\"column\": [\"country\",\"country_short_name\"], \"nl_ref_type\": \"ambiguous\", \"nl_ref_phrase\": \"countries\"}\n    {\"c_type\": \"mark\", \"c_name\": \"point chart\", \"nl_ref_type\": \"explicit\", \"nl_ref_phrase\": \"scatter plot\"}\n    {\"c_type\": \"mark\", \"c_name\": \"arc chart\", \"nl_ref_type\": \"explicit\", \"nl_ref_phrase\": \"pie chart\"}\n    {\"c_type\": \"transform\",\"c_name\": \"filter\",\"c_list\": [{\"field\": \"country\",\"oneOf\": [\"Iceland\",\"Norway\"]}],\"nl_ref_type\": \"explicit\",\"nl_ref_phrase\": \"for countries Iceland and Norway\"},\n    {\"c_type\": \"transform\",\"c_name\": \"filter\",\"c_list\": [{\"field\": \"country\",\"oneOf\": [\"Iceland\",\"Norway\"]}],\"nl_ref_type\": \"by_value\",\"nl_ref_phrase\": \"for Iceland and Norway\"},\n- the 'nl_ref_phrase' for 'ambiguous' columns should be equally near all ambiguous columns, not too near to one of the column since it would not be ambiguous.\n    good example: {\"column\": [\"country\",\"region\"], \"nl_ref_type\": \"ambiguous\", \"nl_ref_phrase\": \"location\"}\n    bad example: {\"column\": [\"country\",\"region\"], \"nl_ref_type\": \"ambiguous\", \"nl_ref_phrase\": \"region\"}\n- You only include given constraints and no other information. \n    For example, if a column name is not in the given constraint, it will not be included in the NL utterance.\n    Also, it a chart mark or chart encoding channel is not in the given constraint, it will not be included in the NL utterance.\n- all 'nl_ref_phrase' shoule be included in the 'nl_utterance'. \n\nThe output format is identical to the input format, but fill in the str blanks(\"...\").\n### Input:\n{\n  \"nl_utterance\": \"...\",\n  \"encoded_fields\": [\n    {\n      \"field\": \"Year\",\n      \"type\": \"quantitative\",\n      \"nl_ref_type\": \"explicit\",\n      \"nl_ref_phrase\": \"...\"\n    },\n    {\n      \"field\": \"Oil Consumption - TWh (zero filled)\",\n      \"type\": \"quantitative\",\n      \"nl_ref_type\": \"explicit\",\n      \"nl_ref_phrase\": \"...\"\n    }\n  ],\n  \"constraints\": [\n    {\n      \"c_type\": \"transform\",\n      \"c_name\": \"aggregate\",\n      \"c_list\": [\n        {\n          \"field\": \"Oil Consumption - TWh (zero filled)\",\n          \"aggregate\": \"sum\"\n        }\n      ],\n      \"nl_ref_type\": \"explicit\",\n      \"nl_ref_phrase\": \"...\"\n    }\n  ]\n}\n\n### Output:"
}