{
  "gpt_result": {
    "nl_utterance": "Show the distribution chart using bars or boxplots.",
    "encoded_fields": [],
    "constraints": [
      {
        "c_type": "task",
        "c_name": "distribution",
        "c_list": [
          {
            "mark": "bar",
            "encoding": {
              "y": {
                "aggregate": "count",
                "type": "quantitative"
              }
            },
            "x_y_reversable": true
          },
          {
            "mark": "boxplot",
            "encoding": {
              "x": {
                "type": "quantitative"
              }
            },
            "x_y_reversable": true
          }
        ],
        "nl_ref_type": "explicit",
        "nl_ref_phrase": "distribution chart"
      }
    ]
  },
  "input": "Dataset Information: {\n  \"data samples\": [\n    {\n      \"ID\": 100,\n      \"Name\": \"Johnson City\",\n      \"Mobility\": 0.0621988103,\n      \"State\": \"TN\",\n      \"Population\": 576081,\n      \"Urban\": 1,\n      \"Black\": 0.021,\n      \"Seg_racial\": 0.09,\n      \"Seg_income\": 0.035,\n      \"Seg_poverty\": 0.03,\n      \"Seg_affluence\": 0.038,\n      \"Commute\": 0.325,\n      \"Income\": 31560,\n      \"Gini\": 0.468,\n      \"Share01\": 13.459,\n      \"Gini_99\": 0.333,\n      \"Middle_class\": 0.548,\n      \"Local_tax_rate\": 0.02,\n      \"Local_gov_spending\": 1886.0,\n      \"Progressivity\": 0.0,\n      \"EITC\": 0.0,\n      \"School_spending\": 5.185,\n      \"Student_teacher_ratio\": NaN,\n      \"Test_scores\": 2.728,\n      \"HS_dropout\": -0.015,\n      \"Colleges\": 0.014,\n      \"Tuition\": 4817.0,\n      \"Graduation\": -0.002,\n      \"Labor_force_participation\": 0.587,\n      \"Manufacturing\": 0.237,\n      \"Chinese_imports\": 5.294,\n      \"Teenage_labor\": 0.004,\n      \"Migration_in\": 0.006,\n      \"Migration_out\": 0.005,\n      \"Foreign_born\": 0.012,\n      \"Social_capital\": -0.298,\n      \"Religious\": 0.514,\n      \"Violent_crime\": 0.001,\n      \"Single_mothers\": 0.19,\n      \"Divorced\": 0.11,\n      \"Married\": 0.601,\n      \"Longitude\": -82.4363861083984,\n      \"Latitude\": 36.4703712463379\n    },\n    {\n      \"ID\": 23802,\n      \"Name\": \"Clinton\",\n      \"Mobility\": 0.1138790026,\n      \"State\": \"IA\",\n      \"Population\": 70445,\n      \"Urban\": 0,\n      \"Black\": 0.013,\n      \"Seg_racial\": 0.075,\n      \"Seg_income\": 0.026,\n      \"Seg_poverty\": 0.019,\n      \"Seg_affluence\": 0.03,\n      \"Commute\": 0.479,\n      \"Income\": 34146,\n      \"Gini\": 0.306,\n      \"Share01\": 7.263,\n      \"Gini_99\": 0.234,\n      \"Middle_class\": 0.631,\n      \"Local_tax_rate\": 0.023,\n      \"Local_gov_spending\": 2139.0,\n      \"Progressivity\": 2.86,\n      \"EITC\": 3.714,\n      \"School_spending\": 6.098,\n      \"Student_teacher_ratio\": 15.4,\n      \"Test_scores\": 5.201,\n      \"HS_dropout\": -0.006,\n      \"Colleges\": 0.014,\n      \"Tuition\": 13200.0,\n      \"Graduation\": -0.098,\n      \"Labor_force_participation\": 0.663,\n      \"Manufacturing\": 0.232,\n      \"Chinese_imports\": 0.605,\n      \"Teenage_labor\": 0.006,\n      \"Migration_in\": 0.016,\n      \"Migration_out\": 0.016,\n      \"Foreign_born\": 0.012,\n      \"Social_capital\": 1.108,\n      \"Religious\": 0.593,\n      \"Violent_crime\": 0.002,\n      \"Single_mothers\": 0.188,\n      \"Divorced\": 0.096,\n      \"Married\": 0.586,\n      \"Longitude\": -90.4713363647461,\n      \"Latitude\": 42.0050468444824\n    },\n    {\n      \"ID\": 27003,\n      \"Name\": \"Ainsworth\",\n      \"Mobility\": 0.1920529753,\n      \"State\": \"NE\",\n      \"Population\": 6264,\n      \"Urban\": 0,\n      \"Black\": 0.0,\n      \"Seg_racial\": 0.039,\n      \"Seg_income\": 0.005,\n      \"Seg_poverty\": 0.004,\n      \"Seg_affluence\": 0.007,\n      \"Commute\": 0.67,\n      \"Income\": 30825,\n      \"Gini\": 0.291,\n      \"Share01\": 5.895,\n      \"Gini_99\": 0.232,\n      \"Middle_class\": 0.571,\n      \"Local_tax_rate\": 0.032,\n      \"Local_gov_spending\": 2817.0,\n      \"Progressivity\": 1.72,\n      \"EITC\": 0.0,\n      \"School_spending\": 6.274,\n      \"Student_teacher_ratio\": 11.6,\n      \"Test_scores\": 0.131,\n      \"HS_dropout\": NaN,\n      \"Colleges\": NaN,\n      \"Tuition\": NaN,\n      \"Graduation\": NaN,\n      \"Labor_force_participation\": 0.635,\n      \"Manufacturing\": 0.038,\n      \"Chinese_imports\": 1.279,\n      \"Teenage_labor\": 0.007,\n      \"Migration_in\": NaN,\n      \"Migration_out\": NaN,\n      \"Foreign_born\": 0.008,\n      \"Social_capital\": 1.548,\n      \"Religious\": 0.545,\n      \"Violent_crime\": 0.0,\n      \"Single_mothers\": 0.137,\n      \"Divorced\": 0.076,\n      \"Married\": 0.639,\n      \"Longitude\": -99.7006912231445,\n      \"Latitude\": 42.5554466247559\n    },\n    {\n      \"ID\": 18100,\n      \"Name\": \"Elmira\",\n      \"Mobility\": 0.0936922133,\n      \"State\": \"NY\",\n      \"Population\": 346894,\n      \"Urban\": 1,\n      \"Black\": 0.03,\n      \"Seg_racial\": 0.158,\n      \"Seg_income\": 0.048,\n      \"Seg_poverty\": 0.048,\n      \"Seg_affluence\": 0.046,\n      \"Commute\": 0.411,\n      \"Income\": 32548,\n      \"Gini\": 0.416,\n      \"Share01\": 10.805,\n      \"Gini_99\": 0.308,\n      \"Middle_class\": 0.568,\n      \"Local_tax_rate\": 0.033,\n      \"Local_gov_spending\": 2590.0,\n      \"Progressivity\": 0.0,\n      \"EITC\": 6.905,\n      \"School_spending\": 8.67,\n      \"Student_teacher_ratio\": 16.0,\n      \"Test_scores\": 0.774,\n      \"HS_dropout\": -0.002,\n      \"Colleges\": 0.023,\n      \"Tuition\": 15547.0,\n      \"Graduation\": 0.266,\n      \"Labor_force_participation\": 0.615,\n      \"Manufacturing\": 0.175,\n      \"Chinese_imports\": 1.287,\n      \"Teenage_labor\": 0.004,\n      \"Migration_in\": 0.012,\n      \"Migration_out\": 0.015,\n      \"Foreign_born\": 0.042,\n      \"Social_capital\": 0.5,\n      \"Religious\": 0.396,\n      \"Violent_crime\": 0.001,\n      \"Single_mothers\": 0.222,\n      \"Divorced\": 0.092,\n      \"Married\": 0.516,\n      \"Longitude\": -76.8524780273438,\n      \"Latitude\": 42.3245124816895\n    },\n    {\n      \"ID\": 26801,\n      \"Name\": \"Fargo\",\n      \"Mobility\": 0.1358173043,\n      \"State\": \"ND\",\n      \"Population\": 206945,\n      \"Urban\": 1,\n      \"Black\": 0.006,\n      \"Seg_racial\": 0.056,\n      \"Seg_income\": 0.065,\n      \"Seg_poverty\": 0.056,\n      \"Seg_affluence\": 0.074,\n      \"Commute\": 0.518,\n      \"Income\": 34085,\n      \"Gini\": 0.365,\n      \"Share01\": 11.083,\n      \"Gini_99\": 0.254,\n      \"Middle_class\": 0.597,\n      \"Local_tax_rate\": 0.02,\n      \"Local_gov_spending\": 2263.0,\n      \"Progressivity\": 3.44,\n      \"EITC\": 0.0,\n      \"School_spending\": 6.269,\n      \"Student_teacher_ratio\": 17.2,\n      \"Test_scores\": 6.018,\n      \"HS_dropout\": -0.014,\n      \"Colleges\": 0.024,\n      \"Tuition\": 2686.0,\n      \"Graduation\": 0.054,\n      \"Labor_force_participation\": 0.721,\n      \"Manufacturing\": 0.096,\n      \"Chinese_imports\": 0.151,\n      \"Teenage_labor\": 0.006,\n      \"Migration_in\": 0.023,\n      \"Migration_out\": 0.02,\n      \"Foreign_born\": 0.027,\n      \"Social_capital\": 1.8,\n      \"Religious\": 0.624,\n      \"Violent_crime\": 0.001,\n      \"Single_mothers\": 0.171,\n      \"Divorced\": 0.08,\n      \"Married\": 0.533,\n      \"Longitude\": -96.8047027587891,\n      \"Latitude\": 46.7821769714355\n    }\n  ],\n  \"column names\": [\n    \"ID\",\n    \"Name\",\n    \"Mobility\",\n    \"State\",\n    \"Population\",\n    \"Urban\",\n    \"Black\",\n    \"Seg_racial\",\n    \"Seg_income\",\n    \"Seg_poverty\",\n    \"Seg_affluence\",\n    \"Commute\",\n    \"Income\",\n    \"Gini\",\n    \"Share01\",\n    \"Gini_99\",\n    \"Middle_class\",\n    \"Local_tax_rate\",\n    \"Local_gov_spending\",\n    \"Progressivity\",\n    \"EITC\",\n    \"School_spending\",\n    \"Student_teacher_ratio\",\n    \"Test_scores\",\n    \"HS_dropout\",\n    \"Colleges\",\n    \"Tuition\",\n    \"Graduation\",\n    \"Labor_force_participation\",\n    \"Manufacturing\",\n    \"Chinese_imports\",\n    \"Teenage_labor\",\n    \"Migration_in\",\n    \"Migration_out\",\n    \"Foreign_born\",\n    \"Social_capital\",\n    \"Religious\",\n    \"Violent_crime\",\n    \"Single_mothers\",\n    \"Divorced\",\n    \"Married\",\n    \"Longitude\",\n    \"Latitude\"\n  ]\n}\n\nYour Job:\nI am developing a NL to Data Visualization Dataset. \nPlease help me generate natural language utterance for given dataset and constraints.\nDefinition about the Taks:\n- 'utterance' is what a user would say to make a chart.  One NL 'utterance' is in one or two sentences. Here are two examples from Others for reference:\n    Trend for average horsepower over time across different origin.\n    scatter(x=production budget, y=worldwide gross) for content rating.\n- 'given dataset' is in form of column names, column type, range/unique values of the column.\n- 'constraints' are information about the chart that should be included in the utterance. \n    So we can find a reference phrase in the NL utterance that corresponds to the given constraints. \n- 'reference phrase' can be explicit, ambiguous, and by_value. 'ambiguous' means the phrase can map to more than one columns in the dataset, always a hypernym of column names(depending on the dataset values).\n    For example:\n    {\"column\": \"gdpPercap\", \"nl_ref_type\": \"explicit\", \"nl_ref_phrase\": \"GDP per capita\"},\n    {\"column\": [\"country\",\"continent\"], \"nl_ref_type\": \"ambiguous\", \"nl_ref_phrase\": \"region\"}\n    {\"column\": [\"country\",\"country_short_name\"], \"nl_ref_type\": \"ambiguous\", \"nl_ref_phrase\": \"countries\"}\n    {\"c_type\": \"mark\", \"c_name\": \"point chart\", \"nl_ref_type\": \"explicit\", \"nl_ref_phrase\": \"scatter plot\"}\n    {\"c_type\": \"mark\", \"c_name\": \"arc chart\", \"nl_ref_type\": \"explicit\", \"nl_ref_phrase\": \"pie chart\"}\n    {\"c_type\": \"transform\",\"c_name\": \"filter\",\"c_list\": [{\"field\": \"country\",\"oneOf\": [\"Iceland\",\"Norway\"]}],\"nl_ref_type\": \"explicit\",\"nl_ref_phrase\": \"for countries Iceland and Norway\"},\n    {\"c_type\": \"transform\",\"c_name\": \"filter\",\"c_list\": [{\"field\": \"country\",\"oneOf\": [\"Iceland\",\"Norway\"]}],\"nl_ref_type\": \"by_value\",\"nl_ref_phrase\": \"for Iceland and Norway\"},\n- the 'nl_ref_phrase' for 'ambiguous' columns should be equally near all ambiguous columns, not too near to one of the column since it would not be ambiguous.\n    good example: {\"column\": [\"country\",\"region\"], \"nl_ref_type\": \"ambiguous\", \"nl_ref_phrase\": \"location\"}\n    bad example: {\"column\": [\"country\",\"region\"], \"nl_ref_type\": \"ambiguous\", \"nl_ref_phrase\": \"region\"}\n- You only include given constraints and no other information. \n    For example, if a column name is not in the given constraint, it will not be included in the NL utterance.\n    Also, it a chart mark or chart encoding channel is not in the given constraint, it will not be included in the NL utterance.\n- all 'nl_ref_phrase' shoule be included in the 'nl_utterance'. \n\nThe output format is identical to the input format, but fill in the str blanks(\"...\").\n### Input:\n{\n  \"nl_utterance\": \"...\",\n  \"encoded_fields\": [],\n  \"constraints\": [\n    {\n      \"c_type\": \"task\",\n      \"c_name\": \"distribution\",\n      \"c_list\": [\n        {\n          \"mark\": \"bar\",\n          \"encoding\": {\n            \"y\": {\n              \"aggregate\": \"count\",\n              \"type\": \"quantitative\"\n            }\n          },\n          \"x_y_reversable\": true\n        },\n        {\n          \"mark\": \"boxplot\",\n          \"encoding\": {\n            \"x\": {\n              \"type\": \"quantitative\"\n            }\n          },\n          \"x_y_reversable\": true\n        }\n      ],\n      \"nl_ref_type\": \"explicit\",\n      \"nl_ref_phrase\": \"...\"\n    }\n  ]\n}\n\n### Output:"
}