{
  "gpt_result": {
    "nl_utterance": "What are the shares and changes in shares for datasets where the upward share and downward share are below 0.25?",
    "encoded_fields": [
      {
        "field": [
          "up_sh",
          "down_sh",
          "level_sh",
          "change_sh"
        ],
        "type": "quantitative",
        "nl_ref_type": "ambiguous",
        "nl_ref_phrase": "shares and changes in shares"
      },
      {
        "field": "down_sh",
        "type": "quantitative",
        "nl_ref_type": "explicit",
        "nl_ref_phrase": "downward share"
      }
    ],
    "constraints": [
      {
        "c_type": "transform",
        "c_name": "filter",
        "c_list": [
          {
            "field": "up_sh",
            "lt": 0.25
          }
        ],
        "nl_ref_type": "explicit",
        "nl_ref_phrase": "upward share below 0.25"
      },
      {
        "c_type": "transform",
        "c_name": "filter",
        "c_list": [
          {
            "field": "down_sh",
            "lt": 0.25
          }
        ],
        "nl_ref_type": "explicit",
        "nl_ref_phrase": "downward share below 0.25"
      }
    ]
  },
  "input": "Dataset Information: {\n  \"data samples\": [\n    {\n      \"date\": 1.0,\n      \"division\": 4,\n      \"up\": 0,\n      \"down\": 0,\n      \"level\": 0,\n      \"up_ch\": NaN,\n      \"down_ch\": NaN,\n      \"total\": 0,\n      \"up_sh\": NaN,\n      \"down_sh\": NaN,\n      \"level_sh\": NaN,\n      \"change_sh\": NaN,\n      \"division_s\": \"Housing, Water, Electricity, Gas and other fuels\",\n      \"division_sh\": \"Housing & utilities\",\n      \"date2\": \"01-02-1988\",\n      \"date4\": \"1988-02-01\",\n      \"year\": 1988.0,\n      \"month\": 2.0,\n      \"quarter\": 1.0\n    },\n    {\n      \"date\": 89.0,\n      \"division\": 2,\n      \"up\": 664,\n      \"down\": 335,\n      \"level\": 5005,\n      \"up_ch\": 0.025104577,\n      \"down_ch\": -0.040032025,\n      \"total\": 6004,\n      \"up_sh\": 0.11059294,\n      \"down_sh\": 0.055796135,\n      \"level_sh\": 0.83361095,\n      \"change_sh\": 0.16638908,\n      \"division_s\": \"Alcoholic beverages, tobacco and narcotics\",\n      \"division_sh\": \"Alcohol & tobacco\",\n      \"date2\": \"01-06-1995\",\n      \"date4\": \"1995-06-01\",\n      \"year\": 1995.0,\n      \"month\": 6.0,\n      \"quarter\": 2.0\n    },\n    {\n      \"date\": 63.0,\n      \"division\": 5,\n      \"up\": 1409,\n      \"down\": 1123,\n      \"level\": 8738,\n      \"up_ch\": 0.1012658,\n      \"down_ch\": -0.12098342,\n      \"total\": 11270,\n      \"up_sh\": 0.12502219,\n      \"down_sh\": 0.099645078,\n      \"level_sh\": 0.77533275,\n      \"change_sh\": 0.22466727,\n      \"division_s\": \"Furnishings, household equipment and maintenance\",\n      \"division_sh\": \"Household\",\n      \"date2\": \"01-04-1993\",\n      \"date4\": \"1993-04-01\",\n      \"year\": 1993.0,\n      \"month\": 4.0,\n      \"quarter\": 2.0\n    },\n    {\n      \"date\": 92.0,\n      \"division\": 7,\n      \"up\": 226,\n      \"down\": 727,\n      \"level\": 4270,\n      \"up_ch\": 0.071684606,\n      \"down_ch\": -0.048808932,\n      \"total\": 5223,\n      \"up_sh\": 0.043270152,\n      \"down_sh\": 0.13919203,\n      \"level_sh\": 0.81753778,\n      \"change_sh\": 0.18246219,\n      \"division_s\": \"Transport\",\n      \"division_sh\": \"Transport\",\n      \"date2\": \"01-09-1995\",\n      \"date4\": \"1995-09-01\",\n      \"year\": 1995.0,\n      \"month\": 9.0,\n      \"quarter\": 3.0\n    },\n    {\n      \"date\": 53.0,\n      \"division\": 8,\n      \"up\": 43,\n      \"down\": 12,\n      \"level\": 350,\n      \"up_ch\": 0.11231067,\n      \"down_ch\": -0.06796588,\n      \"total\": 405,\n      \"up_sh\": 0.10617284,\n      \"down_sh\": 0.029629629,\n      \"level_sh\": 0.86419755,\n      \"change_sh\": 0.13580246,\n      \"division_s\": \"Communication\",\n      \"division_sh\": \"Communication\",\n      \"date2\": \"01-06-1992\",\n      \"date4\": \"1992-06-01\",\n      \"year\": 1992.0,\n      \"month\": 6.0,\n      \"quarter\": 2.0\n    }\n  ],\n  \"column names\": [\n    \"date\",\n    \"division\",\n    \"up\",\n    \"down\",\n    \"level\",\n    \"up_ch\",\n    \"down_ch\",\n    \"total\",\n    \"up_sh\",\n    \"down_sh\",\n    \"level_sh\",\n    \"change_sh\",\n    \"division_s\",\n    \"division_sh\",\n    \"date2\",\n    \"date4\",\n    \"year\",\n    \"month\",\n    \"quarter\"\n  ]\n}\n\nYour Job:\nI am developing a NL to Data Visualization Dataset. \nPlease help me generate natural language utterance for given dataset and constraints.\nDefinition about the Taks:\n- 'utterance' is what a user would say to make a chart. It should be a questions structure. One NL 'utterance' is in one or two sentences. Here are two examples from Questions for reference:\n    What is our profit based on shipping mode by customer segment?\n    How much do various cars weigh?\n- 'given dataset' is in form of column names, column type, range/unique values of the column.\n- 'constraints' are information about the chart that should be included in the utterance. \n    So we can find a reference phrase in the NL utterance that corresponds to the given constraints. \n- 'reference phrase' can be explicit, ambiguous, and by_value. 'ambiguous' means the phrase can map to more than one columns in the dataset, always a hypernym of column names(depending on the dataset values).\n    For example:\n    {\"column\": \"gdpPercap\", \"nl_ref_type\": \"explicit\", \"nl_ref_phrase\": \"GDP per capita\"},\n    {\"column\": [\"country\",\"continent\"], \"nl_ref_type\": \"ambiguous\", \"nl_ref_phrase\": \"region\"}\n    {\"column\": [\"country\",\"country_short_name\"], \"nl_ref_type\": \"ambiguous\", \"nl_ref_phrase\": \"countries\"}\n    {\"c_type\": \"mark\", \"c_name\": \"point chart\", \"nl_ref_type\": \"explicit\", \"nl_ref_phrase\": \"scatter plot\"}\n    {\"c_type\": \"mark\", \"c_name\": \"arc chart\", \"nl_ref_type\": \"explicit\", \"nl_ref_phrase\": \"pie chart\"}\n    {\"c_type\": \"transform\",\"c_name\": \"filter\",\"c_list\": [{\"field\": \"country\",\"oneOf\": [\"Iceland\",\"Norway\"]}],\"nl_ref_type\": \"explicit\",\"nl_ref_phrase\": \"for countries Iceland and Norway\"},\n    {\"c_type\": \"transform\",\"c_name\": \"filter\",\"c_list\": [{\"field\": \"country\",\"oneOf\": [\"Iceland\",\"Norway\"]}],\"nl_ref_type\": \"by_value\",\"nl_ref_phrase\": \"for Iceland and Norway\"},\n- the 'nl_ref_phrase' for 'ambiguous' columns should be equally near all ambiguous columns, not too near to one of the column since it would not be ambiguous.\n    good example: {\"column\": [\"country\",\"region\"], \"nl_ref_type\": \"ambiguous\", \"nl_ref_phrase\": \"location\"}\n    bad example: {\"column\": [\"country\",\"region\"], \"nl_ref_type\": \"ambiguous\", \"nl_ref_phrase\": \"region\"}\n- You only include given constraints and no other information. \n    For example, if a column name is not in the given constraint, it will not be included in the NL utterance.\n    Also, it a chart mark or chart encoding channel is not in the given constraint, it will not be included in the NL utterance.\n- all 'nl_ref_phrase' shoule be included in the 'nl_utterance'. \n\nThe output format is identical to the input format, but fill in the str blanks(\"...\").\n### Input:\n{\n  \"nl_utterance\": \"...\",\n  \"encoded_fields\": [\n    {\n      \"field\": [\n        \"up_sh\",\n        \"down_sh\",\n        \"level_sh\",\n        \"change_sh\"\n      ],\n      \"type\": \"quantitative\",\n      \"nl_ref_type\": \"ambiguous\",\n      \"nl_ref_phrase\": \"...\"\n    },\n    {\n      \"field\": \"down_sh\",\n      \"type\": \"quantitative\",\n      \"nl_ref_type\": \"explicit\",\n      \"nl_ref_phrase\": \"...\"\n    }\n  ],\n  \"constraints\": [\n    {\n      \"c_type\": \"transform\",\n      \"c_name\": \"filter\",\n      \"c_list\": [\n        {\n          \"field\": \"up_sh\",\n          \"lt\": 0.25\n        }\n      ],\n      \"nl_ref_type\": \"explicit\",\n      \"nl_ref_phrase\": \"...\"\n    },\n    {\n      \"c_type\": \"transform\",\n      \"c_name\": \"filter\",\n      \"c_list\": [\n        {\n          \"field\": \"down_sh\",\n          \"lt\": 0.25\n        }\n      ],\n      \"nl_ref_type\": \"explicit\",\n      \"nl_ref_phrase\": \"...\"\n    }\n  ]\n}\n\n### Output:"
}