{
  "gpt_result": {
    "nl_utterance": "Create a boxplot to show the distribution of Mobility.",
    "encoded_fields": [
      {
        "field": "Mobility",
        "type": "quantitative",
        "nl_ref_type": "explicit",
        "nl_ref_phrase": "Mobility"
      }
    ],
    "constraints": [
      {
        "c_type": "task",
        "c_name": "distribution",
        "c_list": [
          {
            "mark": "bar",
            "encoding": {
              "y": {
                "aggregate": "count",
                "type": "quantitative"
              }
            },
            "x_y_reversable": true
          },
          {
            "mark": "boxplot",
            "encoding": {
              "x": {
                "type": "quantitative"
              }
            },
            "x_y_reversable": true
          }
        ],
        "nl_ref_type": "explicit",
        "nl_ref_phrase": "distribution"
      }
    ]
  },
  "input": "Dataset Information: {\n  \"data samples\": [\n    {\n      \"ID\": 100,\n      \"Name\": \"Johnson City\",\n      \"Mobility\": 0.0621988103,\n      \"State\": \"TN\",\n      \"Population\": 576081,\n      \"Urban\": 1,\n      \"Black\": 0.021,\n      \"Seg_racial\": 0.09,\n      \"Seg_income\": 0.035,\n      \"Seg_poverty\": 0.03,\n      \"Seg_affluence\": 0.038,\n      \"Commute\": 0.325,\n      \"Income\": 31560,\n      \"Gini\": 0.468,\n      \"Share01\": 13.459,\n      \"Gini_99\": 0.333,\n      \"Middle_class\": 0.548,\n      \"Local_tax_rate\": 0.02,\n      \"Local_gov_spending\": 1886.0,\n      \"Progressivity\": 0.0,\n      \"EITC\": 0.0,\n      \"School_spending\": 5.185,\n      \"Student_teacher_ratio\": NaN,\n      \"Test_scores\": 2.728,\n      \"HS_dropout\": -0.015,\n      \"Colleges\": 0.014,\n      \"Tuition\": 4817.0,\n      \"Graduation\": -0.002,\n      \"Labor_force_participation\": 0.587,\n      \"Manufacturing\": 0.237,\n      \"Chinese_imports\": 5.294,\n      \"Teenage_labor\": 0.004,\n      \"Migration_in\": 0.006,\n      \"Migration_out\": 0.005,\n      \"Foreign_born\": 0.012,\n      \"Social_capital\": -0.298,\n      \"Religious\": 0.514,\n      \"Violent_crime\": 0.001,\n      \"Single_mothers\": 0.19,\n      \"Divorced\": 0.11,\n      \"Married\": 0.601,\n      \"Longitude\": -82.4363861083984,\n      \"Latitude\": 36.4703712463379\n    },\n    {\n      \"ID\": 9100,\n      \"Name\": \"Atlanta\",\n      \"Mobility\": 0.0453297347,\n      \"State\": \"GA\",\n      \"Population\": 3798017,\n      \"Urban\": 1,\n      \"Black\": 0.297,\n      \"Seg_racial\": 0.317,\n      \"Seg_income\": 0.113,\n      \"Seg_poverty\": 0.101,\n      \"Seg_affluence\": 0.125,\n      \"Commute\": 0.178,\n      \"Income\": 44162,\n      \"Gini\": 0.568,\n      \"Share01\": 17.257,\n      \"Gini_99\": 0.395,\n      \"Middle_class\": 0.439,\n      \"Local_tax_rate\": 0.028,\n      \"Local_gov_spending\": 2885.0,\n      \"Progressivity\": 0.0,\n      \"EITC\": 0.0,\n      \"School_spending\": 6.352,\n      \"Student_teacher_ratio\": 18.1,\n      \"Test_scores\": -7.863,\n      \"HS_dropout\": 0.026,\n      \"Colleges\": 0.01,\n      \"Tuition\": 6876.0,\n      \"Graduation\": -0.046,\n      \"Labor_force_participation\": 0.709,\n      \"Manufacturing\": 0.104,\n      \"Chinese_imports\": 0.61,\n      \"Teenage_labor\": 0.004,\n      \"Migration_in\": 0.03,\n      \"Migration_out\": 0.023,\n      \"Foreign_born\": 0.109,\n      \"Social_capital\": -1.208,\n      \"Religious\": 0.443,\n      \"Violent_crime\": 0.002,\n      \"Single_mothers\": 0.23,\n      \"Divorced\": 0.102,\n      \"Married\": 0.534,\n      \"Longitude\": -84.2125625610352,\n      \"Latitude\": 33.8539428710938\n    },\n    {\n      \"ID\": 23802,\n      \"Name\": \"Clinton\",\n      \"Mobility\": 0.1138790026,\n      \"State\": \"IA\",\n      \"Population\": 70445,\n      \"Urban\": 0,\n      \"Black\": 0.013,\n      \"Seg_racial\": 0.075,\n      \"Seg_income\": 0.026,\n      \"Seg_poverty\": 0.019,\n      \"Seg_affluence\": 0.03,\n      \"Commute\": 0.479,\n      \"Income\": 34146,\n      \"Gini\": 0.306,\n      \"Share01\": 7.263,\n      \"Gini_99\": 0.234,\n      \"Middle_class\": 0.631,\n      \"Local_tax_rate\": 0.023,\n      \"Local_gov_spending\": 2139.0,\n      \"Progressivity\": 2.86,\n      \"EITC\": 3.714,\n      \"School_spending\": 6.098,\n      \"Student_teacher_ratio\": 15.4,\n      \"Test_scores\": 5.201,\n      \"HS_dropout\": -0.006,\n      \"Colleges\": 0.014,\n      \"Tuition\": 13200.0,\n      \"Graduation\": -0.098,\n      \"Labor_force_participation\": 0.663,\n      \"Manufacturing\": 0.232,\n      \"Chinese_imports\": 0.605,\n      \"Teenage_labor\": 0.006,\n      \"Migration_in\": 0.016,\n      \"Migration_out\": 0.016,\n      \"Foreign_born\": 0.012,\n      \"Social_capital\": 1.108,\n      \"Religious\": 0.593,\n      \"Violent_crime\": 0.002,\n      \"Single_mothers\": 0.188,\n      \"Divorced\": 0.096,\n      \"Married\": 0.586,\n      \"Longitude\": -90.4713363647461,\n      \"Latitude\": 42.0050468444824\n    },\n    {\n      \"ID\": 13700,\n      \"Name\": \"Concord\",\n      \"Mobility\": 0.0734009892,\n      \"State\": \"IN\",\n      \"Population\": 372184,\n      \"Urban\": 1,\n      \"Black\": 0.033,\n      \"Seg_racial\": 0.176,\n      \"Seg_income\": 0.027,\n      \"Seg_poverty\": 0.027,\n      \"Seg_affluence\": 0.024,\n      \"Commute\": 0.405,\n      \"Income\": 35487,\n      \"Gini\": 0.395,\n      \"Share01\": 15.141,\n      \"Gini_99\": 0.244,\n      \"Middle_class\": 0.627,\n      \"Local_tax_rate\": 0.021,\n      \"Local_gov_spending\": 2052.0,\n      \"Progressivity\": 0.0,\n      \"EITC\": 0.0,\n      \"School_spending\": 6.437,\n      \"Student_teacher_ratio\": 18.8,\n      \"Test_scores\": -4.199,\n      \"HS_dropout\": NaN,\n      \"Colleges\": 0.005,\n      \"Tuition\": 8100.0,\n      \"Graduation\": 0.051,\n      \"Labor_force_participation\": 0.686,\n      \"Manufacturing\": 0.421,\n      \"Chinese_imports\": 3.359,\n      \"Teenage_labor\": 0.005,\n      \"Migration_in\": 0.019,\n      \"Migration_out\": 0.019,\n      \"Foreign_born\": 0.052,\n      \"Social_capital\": -0.043,\n      \"Religious\": 0.36,\n      \"Violent_crime\": 0.001,\n      \"Single_mothers\": 0.18,\n      \"Divorced\": 0.105,\n      \"Married\": 0.59,\n      \"Longitude\": -85.4939270019531,\n      \"Latitude\": 41.6202926635742\n    },\n    {\n      \"ID\": 26601,\n      \"Name\": \"Milbank\",\n      \"Mobility\": 0.1702127606,\n      \"State\": \"MN\",\n      \"Population\": 17801,\n      \"Urban\": 0,\n      \"Black\": 0.001,\n      \"Seg_racial\": 0.07,\n      \"Seg_income\": 0.005,\n      \"Seg_poverty\": 0.003,\n      \"Seg_affluence\": 0.003,\n      \"Commute\": 0.65,\n      \"Income\": 34361,\n      \"Gini\": 0.31,\n      \"Share01\": 6.661,\n      \"Gini_99\": 0.243,\n      \"Middle_class\": 0.686,\n      \"Local_tax_rate\": 0.025,\n      \"Local_gov_spending\": 5010.0,\n      \"Progressivity\": 2.5,\n      \"EITC\": 17.286,\n      \"School_spending\": 6.052,\n      \"Student_teacher_ratio\": 15.6,\n      \"Test_scores\": 11.685,\n      \"HS_dropout\": -0.033,\n      \"Colleges\": NaN,\n      \"Tuition\": NaN,\n      \"Graduation\": NaN,\n      \"Labor_force_participation\": 0.596,\n      \"Manufacturing\": 0.078,\n      \"Chinese_imports\": 0.258,\n      \"Teenage_labor\": 0.007,\n      \"Migration_in\": 0.004,\n      \"Migration_out\": 0.006,\n      \"Foreign_born\": 0.01,\n      \"Social_capital\": 2.339,\n      \"Religious\": 1.004,\n      \"Violent_crime\": 0.001,\n      \"Single_mothers\": 0.119,\n      \"Divorced\": 0.057,\n      \"Married\": 0.635,\n      \"Longitude\": -96.5079879760742,\n      \"Latitude\": 45.4473838806152\n    }\n  ],\n  \"column names\": [\n    \"ID\",\n    \"Name\",\n    \"Mobility\",\n    \"State\",\n    \"Population\",\n    \"Urban\",\n    \"Black\",\n    \"Seg_racial\",\n    \"Seg_income\",\n    \"Seg_poverty\",\n    \"Seg_affluence\",\n    \"Commute\",\n    \"Income\",\n    \"Gini\",\n    \"Share01\",\n    \"Gini_99\",\n    \"Middle_class\",\n    \"Local_tax_rate\",\n    \"Local_gov_spending\",\n    \"Progressivity\",\n    \"EITC\",\n    \"School_spending\",\n    \"Student_teacher_ratio\",\n    \"Test_scores\",\n    \"HS_dropout\",\n    \"Colleges\",\n    \"Tuition\",\n    \"Graduation\",\n    \"Labor_force_participation\",\n    \"Manufacturing\",\n    \"Chinese_imports\",\n    \"Teenage_labor\",\n    \"Migration_in\",\n    \"Migration_out\",\n    \"Foreign_born\",\n    \"Social_capital\",\n    \"Religious\",\n    \"Violent_crime\",\n    \"Single_mothers\",\n    \"Divorced\",\n    \"Married\",\n    \"Longitude\",\n    \"Latitude\"\n  ]\n}\n\nYour Job:\nI am developing a NL to Data Visualization Dataset. \nPlease help me generate natural language utterance for given dataset and constraints.\nDefinition about the Taks:\n- 'utterance' is what a user would say to make a chart. It should be a commands structure. One NL 'utterance' is in one or two sentences. Here are two examples from Commands for reference:\n    Please show me a histogram of weights with 500 intervals.\n    Draw a line chart of daily sales forecasts.\n- 'given dataset' is in form of column names, column type, range/unique values of the column.\n- 'constraints' are information about the chart that should be included in the utterance. \n    So we can find a reference phrase in the NL utterance that corresponds to the given constraints. \n- 'reference phrase' can be explicit, ambiguous, and by_value. 'ambiguous' means the phrase can map to more than one columns in the dataset, always a hypernym of column names(depending on the dataset values).\n    For example:\n    {\"column\": \"gdpPercap\", \"nl_ref_type\": \"explicit\", \"nl_ref_phrase\": \"GDP per capita\"},\n    {\"column\": [\"country\",\"continent\"], \"nl_ref_type\": \"ambiguous\", \"nl_ref_phrase\": \"region\"}\n    {\"column\": [\"country\",\"country_short_name\"], \"nl_ref_type\": \"ambiguous\", \"nl_ref_phrase\": \"countries\"}\n    {\"c_type\": \"mark\", \"c_name\": \"point chart\", \"nl_ref_type\": \"explicit\", \"nl_ref_phrase\": \"scatter plot\"}\n    {\"c_type\": \"mark\", \"c_name\": \"arc chart\", \"nl_ref_type\": \"explicit\", \"nl_ref_phrase\": \"pie chart\"}\n    {\"c_type\": \"transform\",\"c_name\": \"filter\",\"c_list\": [{\"field\": \"country\",\"oneOf\": [\"Iceland\",\"Norway\"]}],\"nl_ref_type\": \"explicit\",\"nl_ref_phrase\": \"for countries Iceland and Norway\"},\n    {\"c_type\": \"transform\",\"c_name\": \"filter\",\"c_list\": [{\"field\": \"country\",\"oneOf\": [\"Iceland\",\"Norway\"]}],\"nl_ref_type\": \"by_value\",\"nl_ref_phrase\": \"for Iceland and Norway\"},\n- the 'nl_ref_phrase' for 'ambiguous' columns should be equally near all ambiguous columns, not too near to one of the column since it would not be ambiguous.\n    good example: {\"column\": [\"country\",\"region\"], \"nl_ref_type\": \"ambiguous\", \"nl_ref_phrase\": \"location\"}\n    bad example: {\"column\": [\"country\",\"region\"], \"nl_ref_type\": \"ambiguous\", \"nl_ref_phrase\": \"region\"}\n- You only include given constraints and no other information. \n    For example, if a column name is not in the given constraint, it will not be included in the NL utterance.\n    Also, it a chart mark or chart encoding channel is not in the given constraint, it will not be included in the NL utterance.\n- all 'nl_ref_phrase' shoule be included in the 'nl_utterance'. \n\nThe output format is identical to the input format, but fill in the str blanks(\"...\").\n### Input:\n{\n  \"nl_utterance\": \"...\",\n  \"encoded_fields\": [\n    {\n      \"field\": \"Mobility\",\n      \"type\": \"quantitative\",\n      \"nl_ref_type\": \"explicit\",\n      \"nl_ref_phrase\": \"...\"\n    }\n  ],\n  \"constraints\": [\n    {\n      \"c_type\": \"task\",\n      \"c_name\": \"distribution\",\n      \"c_list\": [\n        {\n          \"mark\": \"bar\",\n          \"encoding\": {\n            \"y\": {\n              \"aggregate\": \"count\",\n              \"type\": \"quantitative\"\n            }\n          },\n          \"x_y_reversable\": true\n        },\n        {\n          \"mark\": \"boxplot\",\n          \"encoding\": {\n            \"x\": {\n              \"type\": \"quantitative\"\n            }\n          },\n          \"x_y_reversable\": true\n        }\n      ],\n      \"nl_ref_type\": \"explicit\",\n      \"nl_ref_phrase\": \"...\"\n    }\n  ]\n}\n\n### Output:"
}