{
  "gpt_result": {
    "nl_utterance": "Show me the sum of the totals in billions.",
    "encoded_fields": [
      {
        "field": "Totals(Bn)",
        "type": "quantitative",
        "nl_ref_type": "explicit",
        "nl_ref_phrase": "the totals in billions"
      }
    ],
    "constraints": [
      {
        "c_type": "transform",
        "c_name": "aggregate",
        "c_list": [
          {
            "field": "Totals(Bn)",
            "aggregate": "sum"
          }
        ],
        "nl_ref_type": "explicit",
        "nl_ref_phrase": "the sum of"
      }
    ]
  },
  "input": "Dataset Information: {\n  \"data samples\": [\n    {\n      \"Date\": \"08/31/2022\",\n      \"GRA Purchases\": 93769635059.0,\n      \"PRGT 1/2/\": 15254184552.0,\n      \"Totals\": 109000000000.0,\n      \"Year\": 2022.0,\n      \"Totals(Bn)\": 109.0238196,\n      \"World GDP\": NaN,\n      \"World GDP(Bn)\": NaN,\n      \"Totals/WGDP\": NaN,\n      \"Totals%\": NaN\n    },\n    {\n      \"Date\": \"12/31/2003\",\n      \"GRA Purchases\": 65032062712.0,\n      \"PRGT 1/2/\": 6880893268.0,\n      \"Totals\": 71912955980.0,\n      \"Year\": 2003.0,\n      \"Totals(Bn)\": 71.91295598,\n      \"World GDP\": 39100000000000.0,\n      \"World GDP(Bn)\": 39100.0,\n      \"Totals/WGDP\": 0.0,\n      \"Totals%\": 0.183920604\n    },\n    {\n      \"Date\": \"12/31/2005\",\n      \"GRA Purchases\": 28432143237.0,\n      \"PRGT 1/2/\": 6282121668.0,\n      \"Totals\": 34714264905.0,\n      \"Year\": 2005.0,\n      \"Totals(Bn)\": 34.71426491,\n      \"World GDP\": 47800000000000.0,\n      \"World GDP(Bn)\": 47800.0,\n      \"Totals/WGDP\": 0.0,\n      \"Totals%\": 0.072623985\n    },\n    {\n      \"Date\": \"12/31/1991\",\n      \"GRA Purchases\": 23378573926.0,\n      \"PRGT 1/2/\": 3285717796.0,\n      \"Totals\": 26664291722.0,\n      \"Year\": 1991.0,\n      \"Totals(Bn)\": 26.66429172,\n      \"World GDP\": 23800000000000.0,\n      \"World GDP(Bn)\": 23800.0,\n      \"Totals/WGDP\": 0.0,\n      \"Totals%\": 0.112034839\n    },\n    {\n      \"Date\": \"12/31/1985\",\n      \"GRA Purchases\": 35194787249.0,\n      \"PRGT 1/2/\": 2470247948.0,\n      \"Totals\": 37665035197.0,\n      \"Year\": 1985.0,\n      \"Totals(Bn)\": 37.6650352,\n      \"World GDP\": 12900000000000.0,\n      \"World GDP(Bn)\": 12900.0,\n      \"Totals/WGDP\": 0.0,\n      \"Totals%\": 0.291977017\n    }\n  ],\n  \"column names\": [\n    \"Date\",\n    \"GRA Purchases\",\n    \"PRGT 1/2/\",\n    \"Totals\",\n    \"Year\",\n    \"Totals(Bn)\",\n    \"World GDP\",\n    \"World GDP(Bn)\",\n    \"Totals/WGDP\",\n    \"Totals%\"\n  ]\n}\n\nYour Job:\nI am developing a NL to Data Visualization Dataset. \nPlease help me generate natural language utterance for given dataset and constraints.\nDefinition about the Taks:\n- 'utterance' is what a user would say to make a chart.  One NL 'utterance' is in one or two sentences. Here are two examples from Others for reference:\n    Trend for average horsepower over time across different origin.\n    I want to know how many orders there are by the quantity of the order.\n- 'given dataset' is in form of column names, column type, range/unique values of the column.\n- 'constraints' are information about the chart that should be included in the utterance. \n    So we can find a reference phrase in the NL utterance that corresponds to the given constraints. \n- 'reference phrase' can be explicit, ambiguous, and by_value. 'ambiguous' means the phrase can map to more than one columns in the dataset, always a hypernym of column names(depending on the dataset values).\n    For example:\n    {\"column\": \"gdpPercap\", \"nl_ref_type\": \"explicit\", \"nl_ref_phrase\": \"GDP per capita\"},\n    {\"column\": [\"country\",\"continent\"], \"nl_ref_type\": \"ambiguous\", \"nl_ref_phrase\": \"region\"}\n    {\"column\": [\"country\",\"country_short_name\"], \"nl_ref_type\": \"ambiguous\", \"nl_ref_phrase\": \"countries\"}\n    {\"c_type\": \"mark\", \"c_name\": \"point chart\", \"nl_ref_type\": \"explicit\", \"nl_ref_phrase\": \"scatter plot\"}\n    {\"c_type\": \"mark\", \"c_name\": \"arc chart\", \"nl_ref_type\": \"explicit\", \"nl_ref_phrase\": \"pie chart\"}\n    {\"c_type\": \"transform\",\"c_name\": \"filter\",\"c_list\": [{\"field\": \"country\",\"oneOf\": [\"Iceland\",\"Norway\"]}],\"nl_ref_type\": \"explicit\",\"nl_ref_phrase\": \"for countries Iceland and Norway\"},\n    {\"c_type\": \"transform\",\"c_name\": \"filter\",\"c_list\": [{\"field\": \"country\",\"oneOf\": [\"Iceland\",\"Norway\"]}],\"nl_ref_type\": \"by_value\",\"nl_ref_phrase\": \"for Iceland and Norway\"},\n- the 'nl_ref_phrase' for 'ambiguous' columns should be equally near all ambiguous columns, not too near to one of the column since it would not be ambiguous.\n    good example: {\"column\": [\"country\",\"region\"], \"nl_ref_type\": \"ambiguous\", \"nl_ref_phrase\": \"location\"}\n    bad example: {\"column\": [\"country\",\"region\"], \"nl_ref_type\": \"ambiguous\", \"nl_ref_phrase\": \"region\"}\n- You only include given constraints and no other information. \n    For example, if a column name is not in the given constraint, it will not be included in the NL utterance.\n    Also, it a chart mark or chart encoding channel is not in the given constraint, it will not be included in the NL utterance.\n- all 'nl_ref_phrase' shoule be included in the 'nl_utterance'. \n\nThe output format is identical to the input format, but fill in the str blanks(\"...\").\n### Input:\n{\n  \"nl_utterance\": \"...\",\n  \"encoded_fields\": [\n    {\n      \"field\": \"Totals(Bn)\",\n      \"type\": \"quantitative\",\n      \"nl_ref_type\": \"explicit\",\n      \"nl_ref_phrase\": \"...\"\n    }\n  ],\n  \"constraints\": [\n    {\n      \"c_type\": \"transform\",\n      \"c_name\": \"aggregate\",\n      \"c_list\": [\n        {\n          \"field\": \"Totals(Bn)\",\n          \"aggregate\": \"sum\"\n        }\n      ],\n      \"nl_ref_type\": \"explicit\",\n      \"nl_ref_phrase\": \"...\"\n    }\n  ]\n}\n\n### Output:"
}