{
  "gpt_result": {
    "nl_utterance": "How do the Human Development Index rank and value relate to women's points and population in a scatter plot?",
    "encoded_fields": [
      {
        "field": [
          "Value",
          "HDI rank"
        ],
        "type": "quantitative",
        "nl_ref_type": "ambiguous",
        "nl_ref_phrase": "Human Development Index rank and value"
      },
      {
        "field": "Womens Points",
        "type": "quantitative",
        "nl_ref_type": "explicit",
        "nl_ref_phrase": "women's points"
      },
      {
        "field": "Population",
        "type": "quantitative",
        "nl_ref_type": "explicit",
        "nl_ref_phrase": "population"
      }
    ],
    "constraints": [
      {
        "c_type": "mark",
        "c_name": "point chart",
        "c_list": [
          {
            "mark": "circle",
            "encoding": {
              "x": {},
              "y": {},
              "color": {
                "type": "nominal",
                "ignore": true
              },
              "size": {
                "ignore": true,
                "type": "quantitative"
              },
              "column": {
                "ignore": true,
                "type": "nominal"
              },
              "row": {
                "ignore": true,
                "type": "nominal"
              }
            }
          }
        ],
        "nl_ref_type": "explicit",
        "nl_ref_phrase": "scatter plot"
      }
    ]
  },
  "input": "Dataset Information: {\n  \"data samples\": [\n    {\n      \"Unnamed: 0\": 0,\n      \"Country Name\": \"Albania\",\n      \"Mens Points\": 1361.81,\n      \"Womens Points\": 1346.01,\n      \"Alpha-3 code\": \"ALB\",\n      \"Percentage Difference\": 1.160220589,\n      \"HDI rank\": 67.0,\n      \"Value\": 0.796,\n      \"Country\": \"Albania\",\n      \"Population\": 2811666\n    },\n    {\n      \"Unnamed: 0\": 54,\n      \"Country Name\": \"Gambia\",\n      \"Mens Points\": 1137.47,\n      \"Womens Points\": 1124.04,\n      \"Alpha-3 code\": \"GMB\",\n      \"Percentage Difference\": 1.18069048,\n      \"HDI rank\": 174.0,\n      \"Value\": 0.5,\n      \"Country\": \"Gambia, The\",\n      \"Population\": 2486937\n    },\n    {\n      \"Unnamed: 0\": 36,\n      \"Country Name\": \"Croatia\",\n      \"Mens Points\": 1632.15,\n      \"Womens Points\": 1404.39,\n      \"Alpha-3 code\": \"HRV\",\n      \"Percentage Difference\": 13.95459976,\n      \"HDI rank\": 40.0,\n      \"Value\": 0.858,\n      \"Country\": \"Croatia\",\n      \"Population\": 3899000\n    },\n    {\n      \"Unnamed: 0\": 160,\n      \"Country Name\": \"Vietnam\",\n      \"Mens Points\": 1218.84,\n      \"Womens Points\": 1643.66,\n      \"Alpha-3 code\": \"VNM\",\n      \"Percentage Difference\": -34.85445177,\n      \"HDI rank\": 115.0,\n      \"Value\": 0.703,\n      \"Country\": \"Vietnam\",\n      \"Population\": 98168829\n    },\n    {\n      \"Unnamed: 0\": 156,\n      \"Country Name\": \"USA\",\n      \"Mens Points\": 1635.01,\n      \"Womens Points\": 2111.47,\n      \"Alpha-3 code\": \"USA\",\n      \"Percentage Difference\": -29.14110617,\n      \"HDI rank\": 21.0,\n      \"Value\": 0.921,\n      \"Country\": \"United States\",\n      \"Population\": 331893745\n    }\n  ],\n  \"column names\": [\n    \"Unnamed: 0\",\n    \"Country Name\",\n    \"Mens Points\",\n    \"Womens Points\",\n    \"Alpha-3 code\",\n    \"Percentage Difference\",\n    \"HDI rank\",\n    \"Value\",\n    \"Country\",\n    \"Population\"\n  ]\n}\n\nYour Job:\nI am developing a NL to Data Visualization Dataset. \nPlease help me generate natural language utterance for given dataset and constraints.\nDefinition about the Taks:\n- 'utterance' is what a user would say to make a chart. It should be a questions structure. One NL 'utterance' is in one or two sentences. Here are two examples from Questions for reference:\n    How does displacement relate to fuel economy for cars from Europe vs. USA?\n    How much do various cars weigh?\n- 'given dataset' is in form of column names, column type, range/unique values of the column.\n- 'constraints' are information about the chart that should be included in the utterance. \n    So we can find a reference phrase in the NL utterance that corresponds to the given constraints. \n- 'reference phrase' can be explicit, ambiguous, and by_value. 'ambiguous' means the phrase can map to more than one columns in the dataset, always a hypernym of column names(depending on the dataset values).\n    For example:\n    {\"column\": \"gdpPercap\", \"nl_ref_type\": \"explicit\", \"nl_ref_phrase\": \"GDP per capita\"},\n    {\"column\": [\"country\",\"continent\"], \"nl_ref_type\": \"ambiguous\", \"nl_ref_phrase\": \"region\"}\n    {\"column\": [\"country\",\"country_short_name\"], \"nl_ref_type\": \"ambiguous\", \"nl_ref_phrase\": \"countries\"}\n    {\"c_type\": \"mark\", \"c_name\": \"point chart\", \"nl_ref_type\": \"explicit\", \"nl_ref_phrase\": \"scatter plot\"}\n    {\"c_type\": \"mark\", \"c_name\": \"arc chart\", \"nl_ref_type\": \"explicit\", \"nl_ref_phrase\": \"pie chart\"}\n    {\"c_type\": \"transform\",\"c_name\": \"filter\",\"c_list\": [{\"field\": \"country\",\"oneOf\": [\"Iceland\",\"Norway\"]}],\"nl_ref_type\": \"explicit\",\"nl_ref_phrase\": \"for countries Iceland and Norway\"},\n    {\"c_type\": \"transform\",\"c_name\": \"filter\",\"c_list\": [{\"field\": \"country\",\"oneOf\": [\"Iceland\",\"Norway\"]}],\"nl_ref_type\": \"by_value\",\"nl_ref_phrase\": \"for Iceland and Norway\"},\n- the 'nl_ref_phrase' for 'ambiguous' columns should be equally near all ambiguous columns, not too near to one of the column since it would not be ambiguous.\n    good example: {\"column\": [\"country\",\"region\"], \"nl_ref_type\": \"ambiguous\", \"nl_ref_phrase\": \"location\"}\n    bad example: {\"column\": [\"country\",\"region\"], \"nl_ref_type\": \"ambiguous\", \"nl_ref_phrase\": \"region\"}\n- You only include given constraints and no other information. \n    For example, if a column name is not in the given constraint, it will not be included in the NL utterance.\n    Also, it a chart mark or chart encoding channel is not in the given constraint, it will not be included in the NL utterance.\n- all 'nl_ref_phrase' shoule be included in the 'nl_utterance'. \n\nThe output format is identical to the input format, but fill in the str blanks(\"...\").\n### Input:\n{\n  \"nl_utterance\": \"...\",\n  \"encoded_fields\": [\n    {\n      \"field\": [\n        \"Value\",\n        \"HDI rank\"\n      ],\n      \"type\": \"quantitative\",\n      \"nl_ref_type\": \"ambiguous\",\n      \"nl_ref_phrase\": \"...\"\n    },\n    {\n      \"field\": \"Womens Points\",\n      \"type\": \"quantitative\",\n      \"nl_ref_type\": \"explicit\",\n      \"nl_ref_phrase\": \"...\"\n    },\n    {\n      \"field\": \"Population\",\n      \"type\": \"quantitative\",\n      \"nl_ref_type\": \"explicit\",\n      \"nl_ref_phrase\": \"...\"\n    }\n  ],\n  \"constraints\": [\n    {\n      \"c_type\": \"mark\",\n      \"c_name\": \"point chart\",\n      \"c_list\": [\n        {\n          \"mark\": \"circle\",\n          \"encoding\": {\n            \"x\": {},\n            \"y\": {},\n            \"color\": {\n              \"type\": \"nominal\",\n              \"ignore\": true\n            },\n            \"size\": {\n              \"ignore\": true,\n              \"type\": \"quantitative\"\n            },\n            \"column\": {\n              \"ignore\": true,\n              \"type\": \"nominal\"\n            },\n            \"row\": {\n              \"ignore\": true,\n              \"type\": \"nominal\"\n            }\n          }\n        }\n      ],\n      \"nl_ref_type\": \"explicit\",\n      \"nl_ref_phrase\": \"...\"\n    }\n  ]\n}\n\n### Output:"
}