{
  "gpt_result": {
    "nl_utterance": "What is the count of records when considering the change share?",
    "encoded_fields": [
      {
        "field": "change_sh",
        "type": "quantitative",
        "nl_ref_type": "explicit",
        "nl_ref_phrase": "change share"
      }
    ],
    "constraints": [
      {
        "c_type": "transform",
        "c_name": "aggregate",
        "c_list": [
          {
            "aggregate": "count"
          }
        ],
        "nl_ref_type": "explicit",
        "nl_ref_phrase": "count of records"
      }
    ]
  },
  "input": "Dataset Information: {\n  \"data samples\": [\n    {\n      \"date\": 1.0,\n      \"division\": 4,\n      \"up\": 0,\n      \"down\": 0,\n      \"level\": 0,\n      \"up_ch\": NaN,\n      \"down_ch\": NaN,\n      \"total\": 0,\n      \"up_sh\": NaN,\n      \"down_sh\": NaN,\n      \"level_sh\": NaN,\n      \"change_sh\": NaN,\n      \"division_s\": \"Housing, Water, Electricity, Gas and other fuels\",\n      \"division_sh\": \"Housing & utilities\",\n      \"date2\": \"01-02-1988\",\n      \"date4\": \"1988-02-01\",\n      \"year\": 1988.0,\n      \"month\": 2.0,\n      \"quarter\": 1.0\n    },\n    {\n      \"date\": 385.0,\n      \"division\": 11,\n      \"up\": 600,\n      \"down\": 165,\n      \"level\": 6092,\n      \"up_ch\": 0.049362428,\n      \"down_ch\": -0.10902593,\n      \"total\": 6857,\n      \"up_sh\": 0.087501824,\n      \"down_sh\": 0.024063,\n      \"level_sh\": 0.88843518,\n      \"change_sh\": 0.11156482,\n      \"division_s\": \"Restaurants and Hotels\",\n      \"division_sh\": \"Restaurants & Hotels\",\n      \"date2\": \"01-02-2020\",\n      \"date4\": \"2020-02-01\",\n      \"year\": 2020.0,\n      \"month\": 2.0,\n      \"quarter\": 1.0\n    },\n    {\n      \"date\": 58.0,\n      \"division\": 5,\n      \"up\": 1076,\n      \"down\": 886,\n      \"level\": 7905,\n      \"up_ch\": 0.097082242,\n      \"down_ch\": -0.105068,\n      \"total\": 9867,\n      \"up_sh\": 0.10905037,\n      \"down_sh\": 0.089794263,\n      \"level_sh\": 0.80115539,\n      \"change_sh\": 0.19884464,\n      \"division_s\": \"Furnishings, household equipment and maintenance\",\n      \"division_sh\": \"Household\",\n      \"date2\": \"01-11-1992\",\n      \"date4\": \"1992-11-01\",\n      \"year\": 1992.0,\n      \"month\": 11.0,\n      \"quarter\": 4.0\n    },\n    {\n      \"date\": 285.0,\n      \"division\": 7,\n      \"up\": 143,\n      \"down\": 131,\n      \"level\": 3204,\n      \"up_ch\": 0.084992245,\n      \"down_ch\": -0.14357142,\n      \"total\": 3478,\n      \"up_sh\": 0.041115582,\n      \"down_sh\": 0.037665326,\n      \"level_sh\": 0.92121911,\n      \"change_sh\": 0.078780904,\n      \"division_s\": \"Transport\",\n      \"division_sh\": \"Transport\",\n      \"date2\": \"01-10-2011\",\n      \"date4\": \"2011-10-01\",\n      \"year\": 2011.0,\n      \"month\": 10.0,\n      \"quarter\": 4.0\n    },\n    {\n      \"date\": 8.0,\n      \"division\": 7,\n      \"up\": 0,\n      \"down\": 0,\n      \"level\": 0,\n      \"up_ch\": NaN,\n      \"down_ch\": NaN,\n      \"total\": 0,\n      \"up_sh\": NaN,\n      \"down_sh\": NaN,\n      \"level_sh\": NaN,\n      \"change_sh\": NaN,\n      \"division_s\": \"Transport\",\n      \"division_sh\": \"Transport\",\n      \"date2\": \"01-09-1988\",\n      \"date4\": \"1988-09-01\",\n      \"year\": 1988.0,\n      \"month\": 9.0,\n      \"quarter\": 3.0\n    }\n  ],\n  \"column names\": [\n    \"date\",\n    \"division\",\n    \"up\",\n    \"down\",\n    \"level\",\n    \"up_ch\",\n    \"down_ch\",\n    \"total\",\n    \"up_sh\",\n    \"down_sh\",\n    \"level_sh\",\n    \"change_sh\",\n    \"division_s\",\n    \"division_sh\",\n    \"date2\",\n    \"date4\",\n    \"year\",\n    \"month\",\n    \"quarter\"\n  ]\n}\n\nYour Job:\nI am developing a NL to Data Visualization Dataset. \nPlease help me generate natural language utterance for given dataset and constraints.\nDefinition about the Taks:\n- 'utterance' is what a user would say to make a chart. It should be a questions structure. One NL 'utterance' is in one or two sentences. Here are two examples from Questions for reference:\n    How does displacement relate to fuel economy for cars from Europe vs. USA?\n    Are IMDb rating and rotten tomatoes rating related?\n- 'given dataset' is in form of column names, column type, range/unique values of the column.\n- 'constraints' are information about the chart that should be included in the utterance. \n    So we can find a reference phrase in the NL utterance that corresponds to the given constraints. \n- 'reference phrase' can be explicit, ambiguous, and by_value. 'ambiguous' means the phrase can map to more than one columns in the dataset, always a hypernym of column names(depending on the dataset values).\n    For example:\n    {\"column\": \"gdpPercap\", \"nl_ref_type\": \"explicit\", \"nl_ref_phrase\": \"GDP per capita\"},\n    {\"column\": [\"country\",\"continent\"], \"nl_ref_type\": \"ambiguous\", \"nl_ref_phrase\": \"region\"}\n    {\"column\": [\"country\",\"country_short_name\"], \"nl_ref_type\": \"ambiguous\", \"nl_ref_phrase\": \"countries\"}\n    {\"c_type\": \"mark\", \"c_name\": \"point chart\", \"nl_ref_type\": \"explicit\", \"nl_ref_phrase\": \"scatter plot\"}\n    {\"c_type\": \"mark\", \"c_name\": \"arc chart\", \"nl_ref_type\": \"explicit\", \"nl_ref_phrase\": \"pie chart\"}\n    {\"c_type\": \"transform\",\"c_name\": \"filter\",\"c_list\": [{\"field\": \"country\",\"oneOf\": [\"Iceland\",\"Norway\"]}],\"nl_ref_type\": \"explicit\",\"nl_ref_phrase\": \"for countries Iceland and Norway\"},\n    {\"c_type\": \"transform\",\"c_name\": \"filter\",\"c_list\": [{\"field\": \"country\",\"oneOf\": [\"Iceland\",\"Norway\"]}],\"nl_ref_type\": \"by_value\",\"nl_ref_phrase\": \"for Iceland and Norway\"},\n- the 'nl_ref_phrase' for 'ambiguous' columns should be equally near all ambiguous columns, not too near to one of the column since it would not be ambiguous.\n    good example: {\"column\": [\"country\",\"region\"], \"nl_ref_type\": \"ambiguous\", \"nl_ref_phrase\": \"location\"}\n    bad example: {\"column\": [\"country\",\"region\"], \"nl_ref_type\": \"ambiguous\", \"nl_ref_phrase\": \"region\"}\n- You only include given constraints and no other information. \n    For example, if a column name is not in the given constraint, it will not be included in the NL utterance.\n    Also, it a chart mark or chart encoding channel is not in the given constraint, it will not be included in the NL utterance.\n- all 'nl_ref_phrase' shoule be included in the 'nl_utterance'. \n\nThe output format is identical to the input format, but fill in the str blanks(\"...\").\n### Input:\n{\n  \"nl_utterance\": \"...\",\n  \"encoded_fields\": [\n    {\n      \"field\": \"change_sh\",\n      \"type\": \"quantitative\",\n      \"nl_ref_type\": \"explicit\",\n      \"nl_ref_phrase\": \"...\"\n    }\n  ],\n  \"constraints\": [\n    {\n      \"c_type\": \"transform\",\n      \"c_name\": \"aggregate\",\n      \"c_list\": [\n        {\n          \"aggregate\": \"count\"\n        }\n      ],\n      \"nl_ref_type\": \"explicit\",\n      \"nl_ref_phrase\": \"...\"\n    }\n  ]\n}\n\n### Output:"
}