{
  "gpt_result": {
    "nl_utterance": "Show a chart of clubs for countries Spain, Portugal, and Germany.",
    "encoded_fields": [
      {
        "field": "Club",
        "type": "nominal",
        "nl_ref_type": "explicit",
        "nl_ref_phrase": "clubs"
      }
    ],
    "constraints": [
      {
        "c_type": "transform",
        "c_name": "filter",
        "c_list": [
          {
            "field": "Country",
            "oneOf": [
              "Spain",
              "Portugal",
              "Germany"
            ]
          }
        ],
        "nl_ref_type": "explicit",
        "nl_ref_phrase": "for countries Spain, Portugal, and Germany"
      }
    ]
  },
  "input": "Dataset Information: {\n  \"data samples\": [\n    {\n      \"Foot\": \"Left\",\n      \"Name\": \"Etrit Berisha\",\n      \"Position\": \"Goalkeeper\",\n      \"Club\": \"Lazio\",\n      \"Country\": \"Albania\",\n      \"Age\": 27,\n      \"Salary\": 4000000,\n      \"Goals\": 0\n    },\n    {\n      \"Foot\": \"Right\",\n      \"Name\": \"Yunus Mall\\u0131\",\n      \"Position\": \"Midfielder\",\n      \"Club\": \"1. FSV Mainz 05\",\n      \"Country\": \"Turkey\",\n      \"Age\": 24,\n      \"Salary\": 9000000,\n      \"Goals\": 0\n    },\n    {\n      \"Foot\": \"Right\",\n      \"Name\": \"Tam\\u00e1s Priskin\",\n      \"Position\": \"Forward\",\n      \"Club\": \"Slovan Bratislava\",\n      \"Country\": \"Hungary\",\n      \"Age\": 29,\n      \"Salary\": 700000,\n      \"Goals\": 17\n    },\n    {\n      \"Foot\": \"Right\",\n      \"Name\": \"Corry Evans\",\n      \"Position\": \"Midfielder\",\n      \"Club\": \"Blackburn Rovers\",\n      \"Country\": \"Northern Ireland\",\n      \"Age\": 25,\n      \"Salary\": 1250000,\n      \"Goals\": 1\n    },\n    {\n      \"Foot\": \"Left\",\n      \"Name\": \"Keiren Westwood\",\n      \"Position\": \"Goalkeeper\",\n      \"Club\": \"Sheffield Wednesday\",\n      \"Country\": \"Republic of Ireland\",\n      \"Age\": 31,\n      \"Salary\": 1500000,\n      \"Goals\": 0\n    }\n  ],\n  \"column names\": [\n    \"Foot\",\n    \"Name\",\n    \"Position\",\n    \"Club\",\n    \"Country\",\n    \"Age\",\n    \"Salary\",\n    \"Goals\"\n  ]\n}\n\nYour Job:\nI am developing a NL to Data Visualization Dataset. \nPlease help me generate natural language utterance for given dataset and constraints.\nDefinition about the Taks:\n- 'utterance' is what a user would say to make a chart.  One NL 'utterance' is in one or two sentences. Here are two examples from Others for reference:\n    scatter(x=production budget, y=worldwide gross) for content rating.\n    Trend for average horsepower over time across different origin.\n- 'given dataset' is in form of column names, column type, range/unique values of the column.\n- 'constraints' are information about the chart that should be included in the utterance. \n    So we can find a reference phrase in the NL utterance that corresponds to the given constraints. \n- 'reference phrase' can be explicit, ambiguous, and by_value. 'ambiguous' means the phrase can map to more than one columns in the dataset, always a hypernym of column names(depending on the dataset values).\n    For example:\n    {\"column\": \"gdpPercap\", \"nl_ref_type\": \"explicit\", \"nl_ref_phrase\": \"GDP per capita\"},\n    {\"column\": [\"country\",\"continent\"], \"nl_ref_type\": \"ambiguous\", \"nl_ref_phrase\": \"region\"}\n    {\"column\": [\"country\",\"country_short_name\"], \"nl_ref_type\": \"ambiguous\", \"nl_ref_phrase\": \"countries\"}\n    {\"c_type\": \"mark\", \"c_name\": \"point chart\", \"nl_ref_type\": \"explicit\", \"nl_ref_phrase\": \"scatter plot\"}\n    {\"c_type\": \"mark\", \"c_name\": \"arc chart\", \"nl_ref_type\": \"explicit\", \"nl_ref_phrase\": \"pie chart\"}\n    {\"c_type\": \"transform\",\"c_name\": \"filter\",\"c_list\": [{\"field\": \"country\",\"oneOf\": [\"Iceland\",\"Norway\"]}],\"nl_ref_type\": \"explicit\",\"nl_ref_phrase\": \"for countries Iceland and Norway\"},\n    {\"c_type\": \"transform\",\"c_name\": \"filter\",\"c_list\": [{\"field\": \"country\",\"oneOf\": [\"Iceland\",\"Norway\"]}],\"nl_ref_type\": \"by_value\",\"nl_ref_phrase\": \"for Iceland and Norway\"},\n- the 'nl_ref_phrase' for 'ambiguous' columns should be equally near all ambiguous columns, not too near to one of the column since it would not be ambiguous.\n    good example: {\"column\": [\"country\",\"region\"], \"nl_ref_type\": \"ambiguous\", \"nl_ref_phrase\": \"location\"}\n    bad example: {\"column\": [\"country\",\"region\"], \"nl_ref_type\": \"ambiguous\", \"nl_ref_phrase\": \"region\"}\n- You only include given constraints and no other information. \n    For example, if a column name is not in the given constraint, it will not be included in the NL utterance.\n    Also, it a chart mark or chart encoding channel is not in the given constraint, it will not be included in the NL utterance.\n- all 'nl_ref_phrase' shoule be included in the 'nl_utterance'. \n\nThe output format is identical to the input format, but fill in the str blanks(\"...\").\n### Input:\n{\n  \"nl_utterance\": \"...\",\n  \"encoded_fields\": [\n    {\n      \"field\": \"Club\",\n      \"type\": \"nominal\",\n      \"nl_ref_type\": \"explicit\",\n      \"nl_ref_phrase\": \"...\"\n    }\n  ],\n  \"constraints\": [\n    {\n      \"c_type\": \"transform\",\n      \"c_name\": \"filter\",\n      \"c_list\": [\n        {\n          \"field\": \"Country\",\n          \"oneOf\": [\n            \"Spain\",\n            \"Portugal\",\n            \"Germany\"\n          ]\n        }\n      ],\n      \"nl_ref_type\": \"explicit\",\n      \"nl_ref_phrase\": \"...\"\n    }\n  ]\n}\n\n### Output:"
}