{
  "gpt_result": {
    "nl_utterance": "Show a scatter plot to examine the correlation between Component 1 and Component 2, using different positions for color coding.",
    "encoded_fields": [
      {
        "field": "Component 1",
        "type": "quantitative",
        "nl_ref_type": "explicit",
        "nl_ref_phrase": "Component 1"
      },
      {
        "field": "Component 2",
        "type": "quantitative",
        "nl_ref_type": "explicit",
        "nl_ref_phrase": "Component 2"
      },
      {
        "field": "Pos",
        "type": "nominal",
        "nl_ref_type": "explicit",
        "nl_ref_phrase": "positions"
      }
    ],
    "constraints": [
      {
        "c_type": "task",
        "c_name": "correlation",
        "c_list": [
          {
            "mark": "circle",
            "encoding": {
              "x": {
                "type": "quantitative"
              },
              "y": {
                "type": "quantitative"
              }
            }
          }
        ],
        "nl_ref_type": "explicit",
        "nl_ref_phrase": "correlation"
      },
      {
        "c_type": "mark",
        "c_name": "point chart",
        "c_list": [
          {
            "mark": "circle",
            "encoding": {
              "x": {},
              "y": {},
              "color": {
                "type": "nominal",
                "ignore": true
              },
              "size": {
                "ignore": true,
                "type": "quantitative"
              },
              "column": {
                "ignore": true,
                "type": "nominal"
              },
              "row": {
                "ignore": true,
                "type": "nominal"
              }
            }
          }
        ],
        "nl_ref_type": "explicit",
        "nl_ref_phrase": "scatter plot"
      }
    ]
  },
  "input": "Dataset Information: {\n  \"data samples\": [\n    {\n      \"Unnamed: 0\": 0,\n      \"Player\": \"Max Aarons\",\n      \"Progressive Carries\": 5.4375,\n      \"Touches\": 57.96875,\n      \"Expected Assists\": 0.04375,\n      \"Progressive Passes\": 2.9375,\n      \"Passes\": 33.96875,\n      \"Interceptions\": 1.75,\n      \"Possession-Winning-Tackles\": 1.15625,\n      \"Aerials Won\": 0.46875,\n      \"Pos\": \"Defender\",\n      \"Non-Penalty Expected Goals\": 0.02,\n      \"cluster\": 6,\n      \"Component 1\": -0.6794867331318681,\n      \"Component 2\": 0.4101967803346252\n    },\n    {\n      \"Unnamed: 0\": 1024,\n      \"Player\": \"Joe Willock\",\n      \"Progressive Carries\": 3.761061946902655,\n      \"Touches\": 37.25663716814159,\n      \"Expected Assists\": 0.0530973451327433,\n      \"Progressive Passes\": 1.6371681415929202,\n      \"Passes\": 19.380530973451325,\n      \"Interceptions\": 1.327433628318584,\n      \"Possession-Winning-Tackles\": 1.9469026548672568,\n      \"Aerials Won\": 0.8407079646017699,\n      \"Pos\": \"Midfielder\",\n      \"Non-Penalty Expected Goals\": 0.16,\n      \"cluster\": 3,\n      \"Component 1\": 0.5763142568329139,\n      \"Component 2\": -0.5585337424359249\n    },\n    {\n      \"Unnamed: 0\": 351,\n      \"Player\": \"Matthias Ginter\",\n      \"Progressive Carries\": 5.496183206106871,\n      \"Touches\": 77.36641221374046,\n      \"Expected Assists\": 0.0610687022900763,\n      \"Progressive Passes\": 5.610687022900764,\n      \"Passes\": 56.29770992366412,\n      \"Interceptions\": 1.7557251908396947,\n      \"Possession-Winning-Tackles\": 1.2213740458015268,\n      \"Aerials Won\": 3.435114503816794,\n      \"Pos\": \"Defender\",\n      \"Non-Penalty Expected Goals\": 0.08,\n      \"cluster\": 6,\n      \"Component 1\": -1.6916544381553678,\n      \"Component 2\": 0.2062817994969493\n    },\n    {\n      \"Unnamed: 0\": 921,\n      \"Player\": \"Niklas Stark\",\n      \"Progressive Carries\": 1.5044247787610618,\n      \"Touches\": 56.3716814159292,\n      \"Expected Assists\": 0.0132743362831858,\n      \"Progressive Passes\": 2.345132743362832,\n      \"Passes\": 37.30088495575221,\n      \"Interceptions\": 1.902654867256637,\n      \"Possession-Winning-Tackles\": 1.1504424778761062,\n      \"Aerials Won\": 3.716814159292035,\n      \"Pos\": \"Wingback\",\n      \"Non-Penalty Expected Goals\": 0.03,\n      \"cluster\": 5,\n      \"Component 1\": -0.9116725272981956,\n      \"Component 2\": -2.1750476781222345\n    },\n    {\n      \"Unnamed: 0\": 880,\n      \"Player\": \"Joe Scally\",\n      \"Progressive Carries\": 4.245283018867925,\n      \"Touches\": 63.0188679245283,\n      \"Expected Assists\": 0.0660377358490566,\n      \"Progressive Passes\": 3.349056603773585,\n      \"Passes\": 38.91509433962264,\n      \"Interceptions\": 1.7452830188679247,\n      \"Possession-Winning-Tackles\": 1.0849056603773586,\n      \"Aerials Won\": 1.0849056603773586,\n      \"Pos\": \"Defender\",\n      \"Non-Penalty Expected Goals\": 0.06,\n      \"cluster\": 6,\n      \"Component 1\": -0.7076933988013712,\n      \"Component 2\": 0.1828645935472235\n    }\n  ],\n  \"column names\": [\n    \"Unnamed: 0\",\n    \"Player\",\n    \"Progressive Carries\",\n    \"Touches\",\n    \"Expected Assists\",\n    \"Progressive Passes\",\n    \"Passes\",\n    \"Interceptions\",\n    \"Possession-Winning-Tackles\",\n    \"Aerials Won\",\n    \"Pos\",\n    \"Non-Penalty Expected Goals\",\n    \"cluster\",\n    \"Component 1\",\n    \"Component 2\"\n  ]\n}\n\nYour Job:\nI am developing a NL to Data Visualization Dataset. \nPlease help me generate natural language utterance for given dataset and constraints.\nDefinition about the Taks:\n- 'utterance' is what a user would say to make a chart.  One NL 'utterance' is in one or two sentences. Here are two examples from Others for reference:\n    I want to know how many orders there are by the quantity of the order.\n    Trend for average horsepower over time across different origin.\n- 'given dataset' is in form of column names, column type, range/unique values of the column.\n- 'constraints' are information about the chart that should be included in the utterance. \n    So we can find a reference phrase in the NL utterance that corresponds to the given constraints. \n- 'reference phrase' can be explicit, ambiguous, and by_value. 'ambiguous' means the phrase can map to more than one columns in the dataset, always a hypernym of column names(depending on the dataset values).\n    For example:\n    {\"column\": \"gdpPercap\", \"nl_ref_type\": \"explicit\", \"nl_ref_phrase\": \"GDP per capita\"},\n    {\"column\": [\"country\",\"continent\"], \"nl_ref_type\": \"ambiguous\", \"nl_ref_phrase\": \"region\"}\n    {\"column\": [\"country\",\"country_short_name\"], \"nl_ref_type\": \"ambiguous\", \"nl_ref_phrase\": \"countries\"}\n    {\"c_type\": \"mark\", \"c_name\": \"point chart\", \"nl_ref_type\": \"explicit\", \"nl_ref_phrase\": \"scatter plot\"}\n    {\"c_type\": \"mark\", \"c_name\": \"arc chart\", \"nl_ref_type\": \"explicit\", \"nl_ref_phrase\": \"pie chart\"}\n    {\"c_type\": \"transform\",\"c_name\": \"filter\",\"c_list\": [{\"field\": \"country\",\"oneOf\": [\"Iceland\",\"Norway\"]}],\"nl_ref_type\": \"explicit\",\"nl_ref_phrase\": \"for countries Iceland and Norway\"},\n    {\"c_type\": \"transform\",\"c_name\": \"filter\",\"c_list\": [{\"field\": \"country\",\"oneOf\": [\"Iceland\",\"Norway\"]}],\"nl_ref_type\": \"by_value\",\"nl_ref_phrase\": \"for Iceland and Norway\"},\n- the 'nl_ref_phrase' for 'ambiguous' columns should be equally near all ambiguous columns, not too near to one of the column since it would not be ambiguous.\n    good example: {\"column\": [\"country\",\"region\"], \"nl_ref_type\": \"ambiguous\", \"nl_ref_phrase\": \"location\"}\n    bad example: {\"column\": [\"country\",\"region\"], \"nl_ref_type\": \"ambiguous\", \"nl_ref_phrase\": \"region\"}\n- You only include given constraints and no other information. \n    For example, if a column name is not in the given constraint, it will not be included in the NL utterance.\n    Also, it a chart mark or chart encoding channel is not in the given constraint, it will not be included in the NL utterance.\n- all 'nl_ref_phrase' shoule be included in the 'nl_utterance'. \n\nThe output format is identical to the input format, but fill in the str blanks(\"...\").\n### Input:\n{\n  \"nl_utterance\": \"...\",\n  \"encoded_fields\": [\n    {\n      \"field\": \"Component 1\",\n      \"type\": \"quantitative\",\n      \"nl_ref_type\": \"explicit\",\n      \"nl_ref_phrase\": \"...\"\n    },\n    {\n      \"field\": \"Component 2\",\n      \"type\": \"quantitative\",\n      \"nl_ref_type\": \"explicit\",\n      \"nl_ref_phrase\": \"...\"\n    },\n    {\n      \"field\": \"Pos\",\n      \"type\": \"nominal\",\n      \"nl_ref_type\": \"explicit\",\n      \"nl_ref_phrase\": \"...\"\n    }\n  ],\n  \"constraints\": [\n    {\n      \"c_type\": \"task\",\n      \"c_name\": \"correlation\",\n      \"c_list\": [\n        {\n          \"mark\": \"circle\",\n          \"encoding\": {\n            \"x\": {\n              \"type\": \"quantitative\"\n            },\n            \"y\": {\n              \"type\": \"quantitative\"\n            }\n          }\n        }\n      ],\n      \"nl_ref_type\": \"explicit\",\n      \"nl_ref_phrase\": \"...\"\n    },\n    {\n      \"c_type\": \"mark\",\n      \"c_name\": \"point chart\",\n      \"c_list\": [\n        {\n          \"mark\": \"circle\",\n          \"encoding\": {\n            \"x\": {},\n            \"y\": {},\n            \"color\": {\n              \"type\": \"nominal\",\n              \"ignore\": true\n            },\n            \"size\": {\n              \"ignore\": true,\n              \"type\": \"quantitative\"\n            },\n            \"column\": {\n              \"ignore\": true,\n              \"type\": \"nominal\"\n            },\n            \"row\": {\n              \"ignore\": true,\n              \"type\": \"nominal\"\n            }\n          }\n        }\n      ],\n      \"nl_ref_type\": \"explicit\",\n      \"nl_ref_phrase\": \"...\"\n    }\n  ]\n}\n\n### Output:"
}