{
  "gpt_result": {
    "nl_utterance": "Show me the trend of sum of IMF Credit/GDP over the years.",
    "encoded_fields": [
      {
        "field": "Year",
        "type": "quantitative",
        "nl_ref_type": "explicit",
        "nl_ref_phrase": "years"
      },
      {
        "field": "IMF Credit/GDP",
        "type": "quantitative",
        "nl_ref_type": "explicit",
        "nl_ref_phrase": "IMF Credit/GDP"
      }
    ],
    "constraints": [
      {
        "c_type": "task",
        "c_name": "trend",
        "c_list": [
          {
            "mark": [
              "bar",
              "line",
              "area"
            ],
            "encoding": {
              "x": {
                "type": "temporal"
              }
            }
          }
        ],
        "nl_ref_type": "explicit",
        "nl_ref_phrase": "trend"
      },
      {
        "c_type": "transform",
        "c_name": "aggregate",
        "c_list": [
          {
            "field": "IMF Credit/GDP",
            "aggregate": "sum"
          }
        ],
        "nl_ref_type": "explicit",
        "nl_ref_phrase": "sum of IMF Credit/GDP"
      }
    ]
  },
  "input": "Dataset Information: {\n  \"data samples\": [\n    {\n      \"Date\": \"09/30/2022\",\n      \"GRA Purchases\": 91088136681,\n      \"PRGT 1/2/\": 15386591496,\n      \"Totals\": 106000000000.0,\n      \"Year\": 2022,\n      \"Total (Billion)\": 106.48,\n      \"Total ($)\": 138.56,\n      \"GDP, current prices (Billions of U.S. dollars)\": 103496.115,\n      \"IMF Credit/GDP\": 0.13,\n      \"Unnamed: 9\": NaN,\n      \"Unnamed: 10\": NaN,\n      \"Unnamed: 11\": NaN,\n      \"Unnamed: 12\": NaN,\n      \"Unnamed: 13\": NaN,\n      \"As of 31/08/22\": \"1 SDR =\",\n      \"$\": 1.30134\n    },\n    {\n      \"Date\": \"12/31/2012\",\n      \"GRA Purchases\": 90042348252,\n      \"PRGT 1/2/\": 5766292503,\n      \"Totals\": 95808640755.0,\n      \"Year\": 2012,\n      \"Total (Billion)\": 95.81,\n      \"Total ($)\": 124.68,\n      \"GDP, current prices (Billions of U.S. dollars)\": 74944.46,\n      \"IMF Credit/GDP\": 0.17,\n      \"Unnamed: 9\": NaN,\n      \"Unnamed: 10\": NaN,\n      \"Unnamed: 11\": NaN,\n      \"Unnamed: 12\": NaN,\n      \"Unnamed: 13\": NaN,\n      \"As of 31/08/22\": NaN,\n      \"$\": NaN\n    },\n    {\n      \"Date\": \"12/31/1987\",\n      \"GRA Purchases\": 28751979125,\n      \"PRGT 1/2/\": 1866342930,\n      \"Totals\": 30618322055.0,\n      \"Year\": 1987,\n      \"Total (Billion)\": 30.62,\n      \"Total ($)\": 39.84,\n      \"GDP, current prices (Billions of U.S. dollars)\": 17013.016,\n      \"IMF Credit/GDP\": 0.23,\n      \"Unnamed: 9\": NaN,\n      \"Unnamed: 10\": NaN,\n      \"Unnamed: 11\": NaN,\n      \"Unnamed: 12\": NaN,\n      \"Unnamed: 13\": NaN,\n      \"As of 31/08/22\": NaN,\n      \"$\": NaN\n    },\n    {\n      \"Date\": \"12/31/2015\",\n      \"GRA Purchases\": 50757840741,\n      \"PRGT 1/2/\": 6575911158,\n      \"Totals\": 57333751899.0,\n      \"Year\": 2015,\n      \"Total (Billion)\": 57.33,\n      \"Total ($)\": 74.61,\n      \"GDP, current prices (Billions of U.S. dollars)\": 77365.52,\n      \"IMF Credit/GDP\": 0.1,\n      \"Unnamed: 9\": NaN,\n      \"Unnamed: 10\": NaN,\n      \"Unnamed: 11\": NaN,\n      \"Unnamed: 12\": NaN,\n      \"Unnamed: 13\": NaN,\n      \"As of 31/08/22\": NaN,\n      \"$\": NaN\n    },\n    {\n      \"Date\": \"12/31/2014\",\n      \"GRA Purchases\": 69041563463,\n      \"PRGT 1/2/\": 6292755583,\n      \"Totals\": 75334319046.0,\n      \"Year\": 2014,\n      \"Total (Billion)\": 75.33,\n      \"Total ($)\": 98.04,\n      \"GDP, current prices (Billions of U.S. dollars)\": 76211.252,\n      \"IMF Credit/GDP\": 0.13,\n      \"Unnamed: 9\": NaN,\n      \"Unnamed: 10\": NaN,\n      \"Unnamed: 11\": NaN,\n      \"Unnamed: 12\": NaN,\n      \"Unnamed: 13\": NaN,\n      \"As of 31/08/22\": NaN,\n      \"$\": NaN\n    }\n  ],\n  \"column names\": [\n    \"Date\",\n    \"GRA Purchases\",\n    \"PRGT 1/2/\",\n    \"Totals\",\n    \"Year\",\n    \"Total (Billion)\",\n    \"Total ($)\",\n    \"GDP, current prices (Billions of U.S. dollars)\",\n    \"IMF Credit/GDP\",\n    \"Unnamed: 9\",\n    \"Unnamed: 10\",\n    \"Unnamed: 11\",\n    \"Unnamed: 12\",\n    \"Unnamed: 13\",\n    \"As of 31/08/22\",\n    \"$\"\n  ]\n}\n\nYour Job:\nI am developing a NL to Data Visualization Dataset. \nPlease help me generate natural language utterance for given dataset and constraints.\nDefinition about the Taks:\n- 'utterance' is what a user would say to make a chart. It should be a commands structure. One NL 'utterance' is in one or two sentences. Here are two examples from Commands for reference:\n    Give me the number of movies by running time.\n    Graph to show the acceleration for cars from different countries segregated based on number of cylinders.\n- 'given dataset' is in form of column names, column type, range/unique values of the column.\n- 'constraints' are information about the chart that should be included in the utterance. \n    So we can find a reference phrase in the NL utterance that corresponds to the given constraints. \n- 'reference phrase' can be explicit, ambiguous, and by_value. 'ambiguous' means the phrase can map to more than one columns in the dataset, always a hypernym of column names(depending on the dataset values).\n    For example:\n    {\"column\": \"gdpPercap\", \"nl_ref_type\": \"explicit\", \"nl_ref_phrase\": \"GDP per capita\"},\n    {\"column\": [\"country\",\"continent\"], \"nl_ref_type\": \"ambiguous\", \"nl_ref_phrase\": \"region\"}\n    {\"column\": [\"country\",\"country_short_name\"], \"nl_ref_type\": \"ambiguous\", \"nl_ref_phrase\": \"countries\"}\n    {\"c_type\": \"mark\", \"c_name\": \"point chart\", \"nl_ref_type\": \"explicit\", \"nl_ref_phrase\": \"scatter plot\"}\n    {\"c_type\": \"mark\", \"c_name\": \"arc chart\", \"nl_ref_type\": \"explicit\", \"nl_ref_phrase\": \"pie chart\"}\n    {\"c_type\": \"transform\",\"c_name\": \"filter\",\"c_list\": [{\"field\": \"country\",\"oneOf\": [\"Iceland\",\"Norway\"]}],\"nl_ref_type\": \"explicit\",\"nl_ref_phrase\": \"for countries Iceland and Norway\"},\n    {\"c_type\": \"transform\",\"c_name\": \"filter\",\"c_list\": [{\"field\": \"country\",\"oneOf\": [\"Iceland\",\"Norway\"]}],\"nl_ref_type\": \"by_value\",\"nl_ref_phrase\": \"for Iceland and Norway\"},\n- the 'nl_ref_phrase' for 'ambiguous' columns should be equally near all ambiguous columns, not too near to one of the column since it would not be ambiguous.\n    good example: {\"column\": [\"country\",\"region\"], \"nl_ref_type\": \"ambiguous\", \"nl_ref_phrase\": \"location\"}\n    bad example: {\"column\": [\"country\",\"region\"], \"nl_ref_type\": \"ambiguous\", \"nl_ref_phrase\": \"region\"}\n- You only include given constraints and no other information. \n    For example, if a column name is not in the given constraint, it will not be included in the NL utterance.\n    Also, it a chart mark or chart encoding channel is not in the given constraint, it will not be included in the NL utterance.\n- all 'nl_ref_phrase' shoule be included in the 'nl_utterance'. \n\nThe output format is identical to the input format, but fill in the str blanks(\"...\").\n### Input:\n{\n  \"nl_utterance\": \"...\",\n  \"encoded_fields\": [\n    {\n      \"field\": \"Year\",\n      \"type\": \"quantitative\",\n      \"nl_ref_type\": \"explicit\",\n      \"nl_ref_phrase\": \"...\"\n    },\n    {\n      \"field\": \"IMF Credit/GDP\",\n      \"type\": \"quantitative\",\n      \"nl_ref_type\": \"explicit\",\n      \"nl_ref_phrase\": \"...\"\n    }\n  ],\n  \"constraints\": [\n    {\n      \"c_type\": \"task\",\n      \"c_name\": \"trend\",\n      \"c_list\": [\n        {\n          \"mark\": [\n            \"bar\",\n            \"line\",\n            \"area\"\n          ],\n          \"encoding\": {\n            \"x\": {\n              \"type\": \"temporal\"\n            }\n          }\n        }\n      ],\n      \"nl_ref_type\": \"explicit\",\n      \"nl_ref_phrase\": \"...\"\n    },\n    {\n      \"c_type\": \"transform\",\n      \"c_name\": \"aggregate\",\n      \"c_list\": [\n        {\n          \"field\": \"IMF Credit/GDP\",\n          \"aggregate\": \"sum\"\n        }\n      ],\n      \"nl_ref_type\": \"explicit\",\n      \"nl_ref_phrase\": \"...\"\n    }\n  ]\n}\n\n### Output:"
}