{
  "gpt_result": {
    "nl_utterance": "How do the number of matches played, goals scored, and shots per average match correlate with each other in a scatter plot?",
    "encoded_fields": [
      {
        "field": "Matches_Played",
        "type": "quantitative",
        "nl_ref_type": "explicit",
        "nl_ref_phrase": "number of matches played"
      },
      {
        "field": "Goals",
        "type": "quantitative",
        "nl_ref_type": "explicit",
        "nl_ref_phrase": "goals scored"
      },
      {
        "field": "Shots Per Avg Match",
        "type": "quantitative",
        "nl_ref_type": "explicit",
        "nl_ref_phrase": "shots per average match"
      }
    ],
    "constraints": [
      {
        "c_type": "task",
        "c_name": "correlation",
        "c_list": [
          {
            "mark": "circle",
            "encoding": {
              "x": {
                "type": "quantitative"
              },
              "y": {
                "type": "quantitative"
              }
            }
          }
        ],
        "nl_ref_type": "explicit",
        "nl_ref_phrase": "correlate with each other"
      },
      {
        "c_type": "mark",
        "c_name": "point chart",
        "c_list": [
          {
            "mark": "circle",
            "encoding": {
              "x": {},
              "y": {},
              "color": {
                "type": "nominal",
                "ignore": true
              },
              "size": {
                "ignore": true,
                "type": "quantitative"
              },
              "column": {
                "ignore": true,
                "type": "nominal"
              },
              "row": {
                "ignore": true,
                "type": "nominal"
              }
            }
          }
        ],
        "nl_ref_type": "explicit",
        "nl_ref_phrase": "scatter plot"
      }
    ]
  },
  "input": "Dataset Information: {\n  \"data samples\": [\n    {\n      \"Country\": \"England\",\n      \"League\": \"Premier League\",\n      \"Club\": \"(INT)\",\n      \"Player Names\": \"Alexis Sanchez\",\n      \"Matches_Played\": 36,\n      \"Substitution \": 2,\n      \"Mins\": 3385,\n      \"Goals\": 24,\n      \"xG\": 19.24,\n      \"xG Per Avg Match\": 0.54,\n      \"Shots\": 129,\n      \"OnTarget\": 49,\n      \"Shots Per Avg Match\": 3.62,\n      \"On Target Per Avg Match\": 1.38,\n      \"Year\": 2016\n    },\n    {\n      \"Country\": \"England\",\n      \"League\": \"Premier League\",\n      \"Club\": \"(ATL)\",\n      \"Player Names\": \"Diego Costa\",\n      \"Matches_Played\": 35,\n      \"Substitution \": 0,\n      \"Mins\": 3232,\n      \"Goals\": 20,\n      \"xG\": 16.67,\n      \"xG Per Avg Match\": 0.49,\n      \"Shots\": 111,\n      \"OnTarget\": 41,\n      \"Shots Per Avg Match\": 3.26,\n      \"On Target Per Avg Match\": 1.21,\n      \"Year\": 2016\n    },\n    {\n      \"Country\": \"England\",\n      \"League\": \"Premier League\",\n      \"Club\": \"(RMA)\",\n      \"Player Names\": \"Eden Hazard\",\n      \"Matches_Played\": 36,\n      \"Substitution \": 0,\n      \"Mins\": 3101,\n      \"Goals\": 16,\n      \"xG\": 11.1,\n      \"xG Per Avg Match\": 0.34,\n      \"Shots\": 77,\n      \"OnTarget\": 32,\n      \"Shots Per Avg Match\": 2.36,\n      \"On Target Per Avg Match\": 0.98,\n      \"Year\": 2016\n    },\n    {\n      \"Country\": \"England\",\n      \"League\": \"Premier League\",\n      \"Club\": \"(INT)\",\n      \"Player Names\": \"Romelu Lukaku\",\n      \"Matches_Played\": 36,\n      \"Substitution \": 1,\n      \"Mins\": 3448,\n      \"Goals\": 25,\n      \"xG\": 18.15,\n      \"xG Per Avg Match\": 0.5,\n      \"Shots\": 110,\n      \"OnTarget\": 53,\n      \"Shots Per Avg Match\": 3.03,\n      \"On Target Per Avg Match\": 1.46,\n      \"Year\": 2016\n    },\n    {\n      \"Country\": \"England\",\n      \"League\": \"Premier League\",\n      \"Club\": \"(LIV)\",\n      \"Player Names\": \"Sadio Mane\",\n      \"Matches_Played\": 26,\n      \"Substitution \": 1,\n      \"Mins\": 2347,\n      \"Goals\": 13,\n      \"xG\": 9.14,\n      \"xG Per Avg Match\": 0.37,\n      \"Shots\": 58,\n      \"OnTarget\": 24,\n      \"Shots Per Avg Match\": 2.35,\n      \"On Target Per Avg Match\": 0.97,\n      \"Year\": 2016\n    }\n  ],\n  \"column names\": [\n    \"Country\",\n    \"League\",\n    \"Club\",\n    \"Player Names\",\n    \"Matches_Played\",\n    \"Substitution \",\n    \"Mins\",\n    \"Goals\",\n    \"xG\",\n    \"xG Per Avg Match\",\n    \"Shots\",\n    \"OnTarget\",\n    \"Shots Per Avg Match\",\n    \"On Target Per Avg Match\",\n    \"Year\"\n  ]\n}\n\nYour Job:\nI am developing a NL to Data Visualization Dataset. \nPlease help me generate natural language utterance for given dataset and constraints.\nDefinition about the Taks:\n- 'utterance' is what a user would say to make a chart. It should be a questions structure. One NL 'utterance' is in one or two sentences. Here are two examples from Questions for reference:\n    What major genre had the highest average worldwide gross?\n    How much do various cars weigh?\n- 'given dataset' is in form of column names, column type, range/unique values of the column.\n- 'constraints' are information about the chart that should be included in the utterance. \n    So we can find a reference phrase in the NL utterance that corresponds to the given constraints. \n- 'reference phrase' can be explicit, ambiguous, and by_value. 'ambiguous' means the phrase can map to more than one columns in the dataset, always a hypernym of column names(depending on the dataset values).\n    For example:\n    {\"column\": \"gdpPercap\", \"nl_ref_type\": \"explicit\", \"nl_ref_phrase\": \"GDP per capita\"},\n    {\"column\": [\"country\",\"continent\"], \"nl_ref_type\": \"ambiguous\", \"nl_ref_phrase\": \"region\"}\n    {\"column\": [\"country\",\"country_short_name\"], \"nl_ref_type\": \"ambiguous\", \"nl_ref_phrase\": \"countries\"}\n    {\"c_type\": \"mark\", \"c_name\": \"point chart\", \"nl_ref_type\": \"explicit\", \"nl_ref_phrase\": \"scatter plot\"}\n    {\"c_type\": \"mark\", \"c_name\": \"arc chart\", \"nl_ref_type\": \"explicit\", \"nl_ref_phrase\": \"pie chart\"}\n    {\"c_type\": \"transform\",\"c_name\": \"filter\",\"c_list\": [{\"field\": \"country\",\"oneOf\": [\"Iceland\",\"Norway\"]}],\"nl_ref_type\": \"explicit\",\"nl_ref_phrase\": \"for countries Iceland and Norway\"},\n    {\"c_type\": \"transform\",\"c_name\": \"filter\",\"c_list\": [{\"field\": \"country\",\"oneOf\": [\"Iceland\",\"Norway\"]}],\"nl_ref_type\": \"by_value\",\"nl_ref_phrase\": \"for Iceland and Norway\"},\n- the 'nl_ref_phrase' for 'ambiguous' columns should be equally near all ambiguous columns, not too near to one of the column since it would not be ambiguous.\n    good example: {\"column\": [\"country\",\"region\"], \"nl_ref_type\": \"ambiguous\", \"nl_ref_phrase\": \"location\"}\n    bad example: {\"column\": [\"country\",\"region\"], \"nl_ref_type\": \"ambiguous\", \"nl_ref_phrase\": \"region\"}\n- You only include given constraints and no other information. \n    For example, if a column name is not in the given constraint, it will not be included in the NL utterance.\n    Also, it a chart mark or chart encoding channel is not in the given constraint, it will not be included in the NL utterance.\n- all 'nl_ref_phrase' shoule be included in the 'nl_utterance'. \n\nThe output format is identical to the input format, but fill in the str blanks(\"...\").\n### Input:\n{\n  \"nl_utterance\": \"...\",\n  \"encoded_fields\": [\n    {\n      \"field\": \"Matches_Played\",\n      \"type\": \"quantitative\",\n      \"nl_ref_type\": \"explicit\",\n      \"nl_ref_phrase\": \"...\"\n    },\n    {\n      \"field\": \"Goals\",\n      \"type\": \"quantitative\",\n      \"nl_ref_type\": \"explicit\",\n      \"nl_ref_phrase\": \"...\"\n    },\n    {\n      \"field\": \"Shots Per Avg Match\",\n      \"type\": \"quantitative\",\n      \"nl_ref_type\": \"explicit\",\n      \"nl_ref_phrase\": \"...\"\n    }\n  ],\n  \"constraints\": [\n    {\n      \"c_type\": \"task\",\n      \"c_name\": \"correlation\",\n      \"c_list\": [\n        {\n          \"mark\": \"circle\",\n          \"encoding\": {\n            \"x\": {\n              \"type\": \"quantitative\"\n            },\n            \"y\": {\n              \"type\": \"quantitative\"\n            }\n          }\n        }\n      ],\n      \"nl_ref_type\": \"explicit\",\n      \"nl_ref_phrase\": \"...\"\n    },\n    {\n      \"c_type\": \"mark\",\n      \"c_name\": \"point chart\",\n      \"c_list\": [\n        {\n          \"mark\": \"circle\",\n          \"encoding\": {\n            \"x\": {},\n            \"y\": {},\n            \"color\": {\n              \"type\": \"nominal\",\n              \"ignore\": true\n            },\n            \"size\": {\n              \"ignore\": true,\n              \"type\": \"quantitative\"\n            },\n            \"column\": {\n              \"ignore\": true,\n              \"type\": \"nominal\"\n            },\n            \"row\": {\n              \"ignore\": true,\n              \"type\": \"nominal\"\n            }\n          }\n        }\n      ],\n      \"nl_ref_type\": \"explicit\",\n      \"nl_ref_phrase\": \"...\"\n    }\n  ]\n}\n\n### Output:"
}