{
  "gpt_result": {
    "nl_utterance": "Can you create a scatter plot showing the relationship between factors like income deprivation, employment deprivation, and child poverty against male life expectancy?",
    "encoded_fields": [
      {
        "field": [
          "incomeDeprevation",
          "employmentDeprivation",
          "childPoverty"
        ],
        "type": "quantitative",
        "nl_ref_type": "ambiguous",
        "nl_ref_phrase": "factors like income deprivation, employment deprivation, and child poverty"
      },
      {
        "field": "maleLE",
        "type": "quantitative",
        "nl_ref_type": "explicit",
        "nl_ref_phrase": "male life expectancy"
      }
    ],
    "constraints": [
      {
        "c_type": "mark",
        "c_name": "point chart",
        "c_list": [
          {
            "mark": "circle",
            "encoding": {
              "x": {},
              "y": {},
              "color": {
                "type": "nominal",
                "ignore": true
              },
              "size": {
                "ignore": true,
                "type": "quantitative"
              },
              "column": {
                "ignore": true,
                "type": "nominal"
              },
              "row": {
                "ignore": true,
                "type": "nominal"
              }
            }
          }
        ],
        "nl_ref_type": "explicit",
        "nl_ref_phrase": "scatter plot"
      }
    ]
  },
  "input": "Dataset Information: {\n  \"data samples\": [\n    {\n      \"areaName\": \"Anniesland, Jordanhill and Whiteinch\",\n      \"incomeDeprevation\": 0.14,\n      \"employmentDeprivation\": 0.15,\n      \"childPoverty\": 0.14,\n      \"femaleLE\": 80.8,\n      \"maleLE\": 75.8,\n      \"disabilityRate\": 0.19\n    },\n    {\n      \"areaName\": \"Hyndland, Dowanhill and Partick East\",\n      \"incomeDeprevation\": 0.08,\n      \"employmentDeprivation\": 0.08,\n      \"childPoverty\": 0.11,\n      \"femaleLE\": 80.9,\n      \"maleLE\": 76.7,\n      \"disabilityRate\": 0.14\n    },\n    {\n      \"areaName\": \"Scotland\",\n      \"incomeDeprevation\": 0.13,\n      \"employmentDeprivation\": 0.13,\n      \"childPoverty\": 0.18,\n      \"femaleLE\": 80.6,\n      \"maleLE\": 76.2,\n      \"disabilityRate\": 0.2\n    },\n    {\n      \"areaName\": \"Haghill and Carntyne\",\n      \"incomeDeprevation\": 0.28,\n      \"employmentDeprivation\": 0.26,\n      \"childPoverty\": 0.43,\n      \"femaleLE\": 75.4,\n      \"maleLE\": 69.9,\n      \"disabilityRate\": 0.31\n    },\n    {\n      \"areaName\": \"Springboig and Barlanark\",\n      \"incomeDeprevation\": 0.31,\n      \"employmentDeprivation\": 0.29,\n      \"childPoverty\": 0.43,\n      \"femaleLE\": 78.3,\n      \"maleLE\": 71.5,\n      \"disabilityRate\": 0.3\n    }\n  ],\n  \"column names\": [\n    \"areaName\",\n    \"incomeDeprevation\",\n    \"employmentDeprivation\",\n    \"childPoverty\",\n    \"femaleLE\",\n    \"maleLE\",\n    \"disabilityRate\"\n  ]\n}\n\nYour Job:\nI am developing a NL to Data Visualization Dataset. \nPlease help me generate natural language utterance for given dataset and constraints.\nDefinition about the Taks:\n- 'utterance' is what a user would say to make a chart. It should be a questions structure. One NL 'utterance' is in one or two sentences. Here are two examples from Questions for reference:\n    What's the average production budget of the different rated movies, separated by creative type.\n    Are IMDb rating and rotten tomatoes rating related?\n- 'given dataset' is in form of column names, column type, range/unique values of the column.\n- 'constraints' are information about the chart that should be included in the utterance. \n    So we can find a reference phrase in the NL utterance that corresponds to the given constraints. \n- 'reference phrase' can be explicit, ambiguous, and by_value. 'ambiguous' means the phrase can map to more than one columns in the dataset, always a hypernym of column names(depending on the dataset values).\n    For example:\n    {\"column\": \"gdpPercap\", \"nl_ref_type\": \"explicit\", \"nl_ref_phrase\": \"GDP per capita\"},\n    {\"column\": [\"country\",\"continent\"], \"nl_ref_type\": \"ambiguous\", \"nl_ref_phrase\": \"region\"}\n    {\"column\": [\"country\",\"country_short_name\"], \"nl_ref_type\": \"ambiguous\", \"nl_ref_phrase\": \"countries\"}\n    {\"c_type\": \"mark\", \"c_name\": \"point chart\", \"nl_ref_type\": \"explicit\", \"nl_ref_phrase\": \"scatter plot\"}\n    {\"c_type\": \"mark\", \"c_name\": \"arc chart\", \"nl_ref_type\": \"explicit\", \"nl_ref_phrase\": \"pie chart\"}\n    {\"c_type\": \"transform\",\"c_name\": \"filter\",\"c_list\": [{\"field\": \"country\",\"oneOf\": [\"Iceland\",\"Norway\"]}],\"nl_ref_type\": \"explicit\",\"nl_ref_phrase\": \"for countries Iceland and Norway\"},\n    {\"c_type\": \"transform\",\"c_name\": \"filter\",\"c_list\": [{\"field\": \"country\",\"oneOf\": [\"Iceland\",\"Norway\"]}],\"nl_ref_type\": \"by_value\",\"nl_ref_phrase\": \"for Iceland and Norway\"},\n- the 'nl_ref_phrase' for 'ambiguous' columns should be equally near all ambiguous columns, not too near to one of the column since it would not be ambiguous.\n    good example: {\"column\": [\"country\",\"region\"], \"nl_ref_type\": \"ambiguous\", \"nl_ref_phrase\": \"location\"}\n    bad example: {\"column\": [\"country\",\"region\"], \"nl_ref_type\": \"ambiguous\", \"nl_ref_phrase\": \"region\"}\n- You only include given constraints and no other information. \n    For example, if a column name is not in the given constraint, it will not be included in the NL utterance.\n    Also, it a chart mark or chart encoding channel is not in the given constraint, it will not be included in the NL utterance.\n- all 'nl_ref_phrase' shoule be included in the 'nl_utterance'. \n\nThe output format is identical to the input format, but fill in the str blanks(\"...\").\n### Input:\n{\n  \"nl_utterance\": \"...\",\n  \"encoded_fields\": [\n    {\n      \"field\": [\n        \"incomeDeprevation\",\n        \"employmentDeprivation\",\n        \"childPoverty\"\n      ],\n      \"type\": \"quantitative\",\n      \"nl_ref_type\": \"ambiguous\",\n      \"nl_ref_phrase\": \"...\"\n    },\n    {\n      \"field\": \"maleLE\",\n      \"type\": \"quantitative\",\n      \"nl_ref_type\": \"explicit\",\n      \"nl_ref_phrase\": \"...\"\n    }\n  ],\n  \"constraints\": [\n    {\n      \"c_type\": \"mark\",\n      \"c_name\": \"point chart\",\n      \"c_list\": [\n        {\n          \"mark\": \"circle\",\n          \"encoding\": {\n            \"x\": {},\n            \"y\": {},\n            \"color\": {\n              \"type\": \"nominal\",\n              \"ignore\": true\n            },\n            \"size\": {\n              \"ignore\": true,\n              \"type\": \"quantitative\"\n            },\n            \"column\": {\n              \"ignore\": true,\n              \"type\": \"nominal\"\n            },\n            \"row\": {\n              \"ignore\": true,\n              \"type\": \"nominal\"\n            }\n          }\n        }\n      ],\n      \"nl_ref_type\": \"explicit\",\n      \"nl_ref_phrase\": \"...\"\n    }\n  ]\n}\n\n### Output:"
}