{
  "gpt_result": {
    "nl_utterance": "What is the correlation between GDP per capita and life expectancy for different continents, represented by population size?",
    "encoded_fields": [
      {
        "field": "GDP per capita (PPP)",
        "type": "quantitative",
        "nl_ref_type": "explicit",
        "nl_ref_phrase": "GDP per capita"
      },
      {
        "field": "Life Expectancy",
        "type": "quantitative",
        "nl_ref_type": "explicit",
        "nl_ref_phrase": "life expectancy"
      },
      {
        "field": "Continent",
        "type": "nominal",
        "nl_ref_type": "explicit",
        "nl_ref_phrase": "continents"
      },
      {
        "field": "Population",
        "type": "quantitative",
        "nl_ref_type": "explicit",
        "nl_ref_phrase": "population"
      }
    ],
    "constraints": [
      {
        "c_type": "task",
        "c_name": "correlation",
        "c_list": [
          {
            "mark": "circle",
            "encoding": {
              "x": {
                "type": "quantitative"
              },
              "y": {
                "type": "quantitative"
              }
            }
          }
        ],
        "nl_ref_type": "explicit",
        "nl_ref_phrase": "correlation"
      }
    ]
  },
  "input": "Dataset Information: {\n  \"data samples\": [\n    {\n      \"Country\": \"Finland\",\n      \"Happiness score\": 7.821,\n      \"Country_temp\": \"Finland\",\n      \"ISO3\": \"FIN\",\n      \"GDP per capita (PPP)\": 55013.38586,\n      \"Life Ladder\": 7.7944,\n      \"Social support\": 0.9703,\n      \"Perceptions of corruption\": 0.1918,\n      \"Population\": 5535992.0,\n      \"Median Age\": 42.368,\n      \"Total Fertility Rate\": 1.389,\n      \"Life Expectancy\": 82.038,\n      \"Infant Mortality\": 1.932,\n      \"Child Mortality\": 2.353,\n      \"Net Migration Rate\": 2.7,\n      \"Continent\": \"Europe\",\n      \"UN Region\": \"Northern Europe\"\n    },\n    {\n      \"Country\": \"Japan\",\n      \"Happiness score\": 6.039,\n      \"Country_temp\": \"Japan\",\n      \"ISO3\": \"JPN\",\n      \"GDP per capita (PPP)\": 42940.40525,\n      \"Life Ladder\": 6.0913,\n      \"Social support\": 0.8957,\n      \"Perceptions of corruption\": 0.6695,\n      \"Population\": 124612530.0,\n      \"Median Age\": 48.361,\n      \"Total Fertility Rate\": 1.297,\n      \"Life Expectancy\": 84.784,\n      \"Infant Mortality\": 1.754,\n      \"Child Mortality\": 2.419,\n      \"Net Migration Rate\": 0.703,\n      \"Continent\": \"Asia\",\n      \"UN Region\": \"Eastern Asia\"\n    },\n    {\n      \"Country\": \"Bolivia\",\n      \"Happiness score\": 5.6,\n      \"Country_temp\": \"Bolivia\",\n      \"ISO3\": \"BOL\",\n      \"GDP per capita (PPP)\": 8846.081965,\n      \"Life Ladder\": 5.5686,\n      \"Social support\": 0.7978,\n      \"Perceptions of corruption\": 0.8122,\n      \"Population\": 12079472.0,\n      \"Median Age\": 23.938,\n      \"Total Fertility Rate\": 2.62,\n      \"Life Expectancy\": 63.6,\n      \"Infant Mortality\": 26.7,\n      \"Child Mortality\": 36.0,\n      \"Net Migration Rate\": -0.4,\n      \"Continent\": \"America\",\n      \"UN Region\": \"South America\"\n    },\n    {\n      \"Country\": \"Peru\",\n      \"Happiness score\": 5.559,\n      \"Country_temp\": \"Peru\",\n      \"ISO3\": \"PER\",\n      \"GDP per capita (PPP)\": 13748.53362,\n      \"Life Ladder\": 5.6943,\n      \"Social support\": 0.8185,\n      \"Perceptions of corruption\": 0.8799,\n      \"Population\": 33715471.0,\n      \"Median Age\": 28.196,\n      \"Total Fertility Rate\": 2.19,\n      \"Life Expectancy\": 72.4,\n      \"Infant Mortality\": 10.0,\n      \"Child Mortality\": 12.0,\n      \"Net Migration Rate\": 2.0,\n      \"Continent\": \"America\",\n      \"UN Region\": \"South America\"\n    },\n    {\n      \"Country\": \"Benin\",\n      \"Happiness score\": 4.623,\n      \"Country_temp\": \"Benin\",\n      \"ISO3\": \"BEN\",\n      \"GDP per capita (PPP)\": 3649.04065,\n      \"Life Ladder\": 4.4934,\n      \"Social support\": 0.4355,\n      \"Perceptions of corruption\": 0.6125,\n      \"Population\": 12996895.0,\n      \"Median Age\": 17.461,\n      \"Total Fertility Rate\": 4.973,\n      \"Life Expectancy\": 59.821,\n      \"Infant Mortality\": 54.972,\n      \"Child Mortality\": 83.379,\n      \"Net Migration Rate\": 0.133,\n      \"Continent\": \"Africa\",\n      \"UN Region\": \"Western Africa\"\n    }\n  ],\n  \"column names\": [\n    \"Country\",\n    \"Happiness score\",\n    \"Country_temp\",\n    \"ISO3\",\n    \"GDP per capita (PPP)\",\n    \"Life Ladder\",\n    \"Social support\",\n    \"Perceptions of corruption\",\n    \"Population\",\n    \"Median Age\",\n    \"Total Fertility Rate\",\n    \"Life Expectancy\",\n    \"Infant Mortality\",\n    \"Child Mortality\",\n    \"Net Migration Rate\",\n    \"Continent\",\n    \"UN Region\"\n  ]\n}\n\nYour Job:\nI am developing a NL to Data Visualization Dataset. \nPlease help me generate natural language utterance for given dataset and constraints.\nDefinition about the Taks:\n- 'utterance' is what a user would say to make a chart. It should be a questions structure. One NL 'utterance' is in one or two sentences. Here are two examples from Questions for reference:\n    Which countries have the highest acceleration for cars of different cylinders?\n    Have cars gotten lighter over time?\n- 'given dataset' is in form of column names, column type, range/unique values of the column.\n- 'constraints' are information about the chart that should be included in the utterance. \n    So we can find a reference phrase in the NL utterance that corresponds to the given constraints. \n- 'reference phrase' can be explicit, ambiguous, and by_value. 'ambiguous' means the phrase can map to more than one columns in the dataset, always a hypernym of column names(depending on the dataset values).\n    For example:\n    {\"column\": \"gdpPercap\", \"nl_ref_type\": \"explicit\", \"nl_ref_phrase\": \"GDP per capita\"},\n    {\"column\": [\"country\",\"continent\"], \"nl_ref_type\": \"ambiguous\", \"nl_ref_phrase\": \"region\"}\n    {\"column\": [\"country\",\"country_short_name\"], \"nl_ref_type\": \"ambiguous\", \"nl_ref_phrase\": \"countries\"}\n    {\"c_type\": \"mark\", \"c_name\": \"point chart\", \"nl_ref_type\": \"explicit\", \"nl_ref_phrase\": \"scatter plot\"}\n    {\"c_type\": \"mark\", \"c_name\": \"arc chart\", \"nl_ref_type\": \"explicit\", \"nl_ref_phrase\": \"pie chart\"}\n    {\"c_type\": \"transform\",\"c_name\": \"filter\",\"c_list\": [{\"field\": \"country\",\"oneOf\": [\"Iceland\",\"Norway\"]}],\"nl_ref_type\": \"explicit\",\"nl_ref_phrase\": \"for countries Iceland and Norway\"},\n    {\"c_type\": \"transform\",\"c_name\": \"filter\",\"c_list\": [{\"field\": \"country\",\"oneOf\": [\"Iceland\",\"Norway\"]}],\"nl_ref_type\": \"by_value\",\"nl_ref_phrase\": \"for Iceland and Norway\"},\n- the 'nl_ref_phrase' for 'ambiguous' columns should be equally near all ambiguous columns, not too near to one of the column since it would not be ambiguous.\n    good example: {\"column\": [\"country\",\"region\"], \"nl_ref_type\": \"ambiguous\", \"nl_ref_phrase\": \"location\"}\n    bad example: {\"column\": [\"country\",\"region\"], \"nl_ref_type\": \"ambiguous\", \"nl_ref_phrase\": \"region\"}\n- You only include given constraints and no other information. \n    For example, if a column name is not in the given constraint, it will not be included in the NL utterance.\n    Also, it a chart mark or chart encoding channel is not in the given constraint, it will not be included in the NL utterance.\n- all 'nl_ref_phrase' shoule be included in the 'nl_utterance'. \n\nThe output format is identical to the input format, but fill in the str blanks(\"...\").\n### Input:\n{\n  \"nl_utterance\": \"...\",\n  \"encoded_fields\": [\n    {\n      \"field\": \"GDP per capita (PPP)\",\n      \"type\": \"quantitative\",\n      \"nl_ref_type\": \"explicit\",\n      \"nl_ref_phrase\": \"...\"\n    },\n    {\n      \"field\": \"Life Expectancy\",\n      \"type\": \"quantitative\",\n      \"nl_ref_type\": \"explicit\",\n      \"nl_ref_phrase\": \"...\"\n    },\n    {\n      \"field\": \"Continent\",\n      \"type\": \"nominal\",\n      \"nl_ref_type\": \"explicit\",\n      \"nl_ref_phrase\": \"...\"\n    },\n    {\n      \"field\": \"Population\",\n      \"type\": \"quantitative\",\n      \"nl_ref_type\": \"explicit\",\n      \"nl_ref_phrase\": \"...\"\n    }\n  ],\n  \"constraints\": [\n    {\n      \"c_type\": \"task\",\n      \"c_name\": \"correlation\",\n      \"c_list\": [\n        {\n          \"mark\": \"circle\",\n          \"encoding\": {\n            \"x\": {\n              \"type\": \"quantitative\"\n            },\n            \"y\": {\n              \"type\": \"quantitative\"\n            }\n          }\n        }\n      ],\n      \"nl_ref_type\": \"explicit\",\n      \"nl_ref_phrase\": \"...\"\n    }\n  ]\n}\n\n### Output:"
}