{
  "gpt_result": {
    "nl_utterance": "Can you create a bar chart that sorts players' PPG in descending order?",
    "encoded_fields": [
      {
        "field": "ppg",
        "type": "quantitative",
        "nl_ref_type": "explicit",
        "nl_ref_phrase": "PPG"
      }
    ],
    "constraints": [
      {
        "c_type": "mark",
        "c_name": "bar chart",
        "c_list": [
          {
            "mark": "bar",
            "encoding": {
              "x": {},
              "y": {
                "type": "quantitative"
              },
              "color": {
                "type": "nominal",
                "ignore": true
              },
              "column": {
                "ignore": true,
                "type": "nominal"
              },
              "row": {
                "ignore": true,
                "type": "nominal"
              }
            },
            "unique_map": {
              "x": "y"
            }
          },
          {
            "mark": "bar",
            "encoding": {
              "y": {},
              "x": {
                "type": "quantitative"
              },
              "color": {
                "type": "nominal",
                "ignore": true
              },
              "column": {
                "ignore": true,
                "type": "nominal"
              },
              "row": {
                "ignore": true,
                "type": "nominal"
              }
            },
            "unique_map": {
              "y": "x"
            }
          }
        ],
        "nl_ref_type": "explicit",
        "nl_ref_phrase": "bar chart"
      },
      {
        "c_type": "transform",
        "c_name": "sort",
        "c_list": [
          {
            "field": "ppg",
            "order": "descending"
          }
        ],
        "nl_ref_type": "explicit",
        "nl_ref_phrase": "sorts players' PPG in descending order"
      }
    ]
  },
  "input": "Dataset Information: {\n  \"data samples\": [\n    {\n      \"PPG\": 90.76923076923076,\n      \"player\": \"Andrew Yaphe\",\n      \"ppg\": 90.77,\n      \"team\": \"Stanford A\",\n      \"team_tournament\": \"2010 Andrew Yaphe\",\n      \"tournament\": \"ACF Nationals 2010\"\n    },\n    {\n      \"PPG\": 86.66666666666667,\n      \"player\": \"Ike Jose\",\n      \"ppg\": 86.67,\n      \"team\": \"Illinois A\",\n      \"team_tournament\": \"2012 Ike Jose\",\n      \"tournament\": \"ACF Nationals 2012\"\n    },\n    {\n      \"PPG\": 96.25,\n      \"player\": \"Matt Weiner\",\n      \"ppg\": 96.25,\n      \"team\": \"VCU A\",\n      \"team_tournament\": \"2007 Matt Weiner\",\n      \"tournament\": \"ACF Nationals 2007\"\n    },\n    {\n      \"PPG\": 91.66666666666669,\n      \"player\": \"Jordan Brownstein\",\n      \"ppg\": 91.67,\n      \"team\": \"Maryland A\",\n      \"team_tournament\": \"2017 Jordan Brownstein\",\n      \"tournament\": \"ACF Nationals 2017\"\n    },\n    {\n      \"PPG\": 89.54545454545455,\n      \"player\": \"Matt Bollinger\",\n      \"ppg\": 89.55,\n      \"team\": \"Virginia A\",\n      \"team_tournament\": \"2014 Matt Bollinger\",\n      \"tournament\": \"ACF Nationals 2014\"\n    }\n  ],\n  \"column names\": [\n    \"PPG\",\n    \"player\",\n    \"ppg\",\n    \"team\",\n    \"team_tournament\",\n    \"tournament\"\n  ]\n}\n\nYour Job:\nI am developing a NL to Data Visualization Dataset. \nPlease help me generate natural language utterance for given dataset and constraints.\nDefinition about the Taks:\n- 'utterance' is what a user would say to make a chart. It should be a questions structure. One NL 'utterance' is in one or two sentences. Here are two examples from Questions for reference:\n    What is our profit based on shipping mode by customer segment?\n    How does displacement relate to fuel economy for cars from Europe vs. USA?\n- 'given dataset' is in form of column names, column type, range/unique values of the column.\n- 'constraints' are information about the chart that should be included in the utterance. \n    So we can find a reference phrase in the NL utterance that corresponds to the given constraints. \n- 'reference phrase' can be explicit, ambiguous, and by_value. 'ambiguous' means the phrase can map to more than one columns in the dataset, always a hypernym of column names(depending on the dataset values).\n    For example:\n    {\"column\": \"gdpPercap\", \"nl_ref_type\": \"explicit\", \"nl_ref_phrase\": \"GDP per capita\"},\n    {\"column\": [\"country\",\"continent\"], \"nl_ref_type\": \"ambiguous\", \"nl_ref_phrase\": \"region\"}\n    {\"column\": [\"country\",\"country_short_name\"], \"nl_ref_type\": \"ambiguous\", \"nl_ref_phrase\": \"countries\"}\n    {\"c_type\": \"mark\", \"c_name\": \"point chart\", \"nl_ref_type\": \"explicit\", \"nl_ref_phrase\": \"scatter plot\"}\n    {\"c_type\": \"mark\", \"c_name\": \"arc chart\", \"nl_ref_type\": \"explicit\", \"nl_ref_phrase\": \"pie chart\"}\n    {\"c_type\": \"transform\",\"c_name\": \"filter\",\"c_list\": [{\"field\": \"country\",\"oneOf\": [\"Iceland\",\"Norway\"]}],\"nl_ref_type\": \"explicit\",\"nl_ref_phrase\": \"for countries Iceland and Norway\"},\n    {\"c_type\": \"transform\",\"c_name\": \"filter\",\"c_list\": [{\"field\": \"country\",\"oneOf\": [\"Iceland\",\"Norway\"]}],\"nl_ref_type\": \"by_value\",\"nl_ref_phrase\": \"for Iceland and Norway\"},\n- the 'nl_ref_phrase' for 'ambiguous' columns should be equally near all ambiguous columns, not too near to one of the column since it would not be ambiguous.\n    good example: {\"column\": [\"country\",\"region\"], \"nl_ref_type\": \"ambiguous\", \"nl_ref_phrase\": \"location\"}\n    bad example: {\"column\": [\"country\",\"region\"], \"nl_ref_type\": \"ambiguous\", \"nl_ref_phrase\": \"region\"}\n- You only include given constraints and no other information. \n    For example, if a column name is not in the given constraint, it will not be included in the NL utterance.\n    Also, it a chart mark or chart encoding channel is not in the given constraint, it will not be included in the NL utterance.\n- all 'nl_ref_phrase' shoule be included in the 'nl_utterance'. \n\nThe output format is identical to the input format, but fill in the str blanks(\"...\").\n### Input:\n{\n  \"nl_utterance\": \"...\",\n  \"encoded_fields\": [\n    {\n      \"field\": \"ppg\",\n      \"type\": \"quantitative\",\n      \"nl_ref_type\": \"explicit\",\n      \"nl_ref_phrase\": \"...\"\n    }\n  ],\n  \"constraints\": [\n    {\n      \"c_type\": \"mark\",\n      \"c_name\": \"bar chart\",\n      \"c_list\": [\n        {\n          \"mark\": \"bar\",\n          \"encoding\": {\n            \"x\": {},\n            \"y\": {\n              \"type\": \"quantitative\"\n            },\n            \"color\": {\n              \"type\": \"nominal\",\n              \"ignore\": true\n            },\n            \"column\": {\n              \"ignore\": true,\n              \"type\": \"nominal\"\n            },\n            \"row\": {\n              \"ignore\": true,\n              \"type\": \"nominal\"\n            }\n          },\n          \"unique_map\": {\n            \"x\": \"y\"\n          }\n        },\n        {\n          \"mark\": \"bar\",\n          \"encoding\": {\n            \"y\": {},\n            \"x\": {\n              \"type\": \"quantitative\"\n            },\n            \"color\": {\n              \"type\": \"nominal\",\n              \"ignore\": true\n            },\n            \"column\": {\n              \"ignore\": true,\n              \"type\": \"nominal\"\n            },\n            \"row\": {\n              \"ignore\": true,\n              \"type\": \"nominal\"\n            }\n          },\n          \"unique_map\": {\n            \"y\": \"x\"\n          }\n        }\n      ],\n      \"nl_ref_type\": \"explicit\",\n      \"nl_ref_phrase\": \"...\"\n    },\n    {\n      \"c_type\": \"transform\",\n      \"c_name\": \"sort\",\n      \"c_list\": [\n        {\n          \"field\": \"ppg\",\n          \"order\": \"descending\"\n        }\n      ],\n      \"nl_ref_type\": \"explicit\",\n      \"nl_ref_phrase\": \"...\"\n    }\n  ]\n}\n\n### Output:"
}