{
  "gpt_result": {
    "nl_utterance": "What is the sum of Datum over different years and how does it compare to Debt to GDP percentages?",
    "encoded_fields": [
      {
        "field": "Datum",
        "type": "quantitative",
        "nl_ref_type": "explicit",
        "nl_ref_phrase": "Datum"
      },
      {
        "field": "Debt_to_GDP(%)",
        "type": "nominal",
        "nl_ref_type": "explicit",
        "nl_ref_phrase": "Debt to GDP percentages"
      }
    ],
    "constraints": [
      {
        "c_type": "transform",
        "c_name": "aggregate",
        "c_list": [
          {
            "field": "Datum",
            "aggregate": "sum"
          }
        ],
        "nl_ref_type": "explicit",
        "nl_ref_phrase": "sum of Datum"
      }
    ]
  },
  "input": "Dataset Information: {\n  \"data samples\": [\n    {\n      \"Date\": \"08/31/2022\",\n      \"GRA Purchases\": 93769635059.0,\n      \"PRGT 1/2/\": 15254184552.0,\n      \"Totals\": 109023819611.0,\n      \"Datum\": 2022.0,\n      \"World_GDP\": NaN,\n      \"Debt_to_GDP(%)\": \"#DIV/0!\"\n    },\n    {\n      \"Date\": \"12/31/2002\",\n      \"GRA Purchases\": 63601058794.0,\n      \"PRGT 1/2/\": 6868671012.0,\n      \"Totals\": 70469729806.0,\n      \"Datum\": 2002.0,\n      \"World_GDP\": 34918000000000.0,\n      \"Debt_to_GDP(%)\": \"0.201815133\"\n    },\n    {\n      \"Date\": \"12/31/1986\",\n      \"GRA Purchases\": 33334905644.0,\n      \"PRGT 1/2/\": 2013169931.0,\n      \"Totals\": 35348075575.0,\n      \"Datum\": 1986.0,\n      \"World_GDP\": 15207800000000.0,\n      \"Debt_to_GDP(%)\": \"0.232434258\"\n    },\n    {\n      \"Date\": \"12/31/2014\",\n      \"GRA Purchases\": 69041563463.0,\n      \"PRGT 1/2/\": 6292755583.0,\n      \"Totals\": 75334319046.0,\n      \"Datum\": 2014.0,\n      \"World_GDP\": 79733200000000.0,\n      \"Debt_to_GDP(%)\": \"0.094483055\"\n    },\n    {\n      \"Date\": \"12/31/1994\",\n      \"GRA Purchases\": 25611676952.0,\n      \"PRGT 1/2/\": 4599768498.0,\n      \"Totals\": 30211445450.0,\n      \"Datum\": 1994.0,\n      \"World_GDP\": 27876800000000.0,\n      \"Debt_to_GDP(%)\": \"0.108374726\"\n    }\n  ],\n  \"column names\": [\n    \"Date\",\n    \"GRA Purchases\",\n    \"PRGT 1/2/\",\n    \"Totals\",\n    \"Datum\",\n    \"World_GDP\",\n    \"Debt_to_GDP(%)\"\n  ]\n}\n\nYour Job:\nI am developing a NL to Data Visualization Dataset. \nPlease help me generate natural language utterance for given dataset and constraints.\nDefinition about the Taks:\n- 'utterance' is what a user would say to make a chart. It should be a questions structure. One NL 'utterance' is in one or two sentences. Here are two examples from Questions for reference:\n    What major genre had the highest average worldwide gross?\n    Have cars gotten lighter over time?\n- 'given dataset' is in form of column names, column type, range/unique values of the column.\n- 'constraints' are information about the chart that should be included in the utterance. \n    So we can find a reference phrase in the NL utterance that corresponds to the given constraints. \n- 'reference phrase' can be explicit, ambiguous, and by_value. 'ambiguous' means the phrase can map to more than one columns in the dataset, always a hypernym of column names(depending on the dataset values).\n    For example:\n    {\"column\": \"gdpPercap\", \"nl_ref_type\": \"explicit\", \"nl_ref_phrase\": \"GDP per capita\"},\n    {\"column\": [\"country\",\"continent\"], \"nl_ref_type\": \"ambiguous\", \"nl_ref_phrase\": \"region\"}\n    {\"column\": [\"country\",\"country_short_name\"], \"nl_ref_type\": \"ambiguous\", \"nl_ref_phrase\": \"countries\"}\n    {\"c_type\": \"mark\", \"c_name\": \"point chart\", \"nl_ref_type\": \"explicit\", \"nl_ref_phrase\": \"scatter plot\"}\n    {\"c_type\": \"mark\", \"c_name\": \"arc chart\", \"nl_ref_type\": \"explicit\", \"nl_ref_phrase\": \"pie chart\"}\n    {\"c_type\": \"transform\",\"c_name\": \"filter\",\"c_list\": [{\"field\": \"country\",\"oneOf\": [\"Iceland\",\"Norway\"]}],\"nl_ref_type\": \"explicit\",\"nl_ref_phrase\": \"for countries Iceland and Norway\"},\n    {\"c_type\": \"transform\",\"c_name\": \"filter\",\"c_list\": [{\"field\": \"country\",\"oneOf\": [\"Iceland\",\"Norway\"]}],\"nl_ref_type\": \"by_value\",\"nl_ref_phrase\": \"for Iceland and Norway\"},\n- the 'nl_ref_phrase' for 'ambiguous' columns should be equally near all ambiguous columns, not too near to one of the column since it would not be ambiguous.\n    good example: {\"column\": [\"country\",\"region\"], \"nl_ref_type\": \"ambiguous\", \"nl_ref_phrase\": \"location\"}\n    bad example: {\"column\": [\"country\",\"region\"], \"nl_ref_type\": \"ambiguous\", \"nl_ref_phrase\": \"region\"}\n- You only include given constraints and no other information. \n    For example, if a column name is not in the given constraint, it will not be included in the NL utterance.\n    Also, it a chart mark or chart encoding channel is not in the given constraint, it will not be included in the NL utterance.\n- all 'nl_ref_phrase' shoule be included in the 'nl_utterance'. \n\nThe output format is identical to the input format, but fill in the str blanks(\"...\").\n### Input:\n{\n  \"nl_utterance\": \"...\",\n  \"encoded_fields\": [\n    {\n      \"field\": \"Datum\",\n      \"type\": \"quantitative\",\n      \"nl_ref_type\": \"explicit\",\n      \"nl_ref_phrase\": \"...\"\n    },\n    {\n      \"field\": \"Debt_to_GDP(%)\",\n      \"type\": \"nominal\",\n      \"nl_ref_type\": \"explicit\",\n      \"nl_ref_phrase\": \"...\"\n    }\n  ],\n  \"constraints\": [\n    {\n      \"c_type\": \"transform\",\n      \"c_name\": \"aggregate\",\n      \"c_list\": [\n        {\n          \"field\": \"Datum\",\n          \"aggregate\": \"sum\"\n        }\n      ],\n      \"nl_ref_type\": \"explicit\",\n      \"nl_ref_phrase\": \"...\"\n    }\n  ]\n}\n\n### Output:"
}