{
  "gpt_result": {
    "nl_utterance": "What has been the trend in totals in billions over the Year, and can you show this as a bar chart?",
    "encoded_fields": [
      {
        "field": "Year",
        "type": "quantitative",
        "nl_ref_type": "explicit",
        "nl_ref_phrase": "Year"
      },
      {
        "field": "totals in billions",
        "type": "quantitative",
        "nl_ref_type": "explicit",
        "nl_ref_phrase": "totals in billions"
      }
    ],
    "constraints": [
      {
        "c_type": "task",
        "c_name": "trend",
        "c_list": [
          {
            "mark": [
              "bar",
              "line",
              "area"
            ],
            "encoding": {
              "x": {
                "type": "temporal"
              }
            }
          }
        ],
        "nl_ref_type": "explicit",
        "nl_ref_phrase": "trend"
      },
      {
        "c_type": "mark",
        "c_name": "bar chart",
        "c_list": [
          {
            "mark": "bar",
            "encoding": {
              "x": {},
              "y": {
                "type": "quantitative"
              },
              "color": {
                "type": "nominal",
                "ignore": true
              },
              "column": {
                "ignore": true,
                "type": "nominal"
              },
              "row": {
                "ignore": true,
                "type": "nominal"
              }
            },
            "unique_map": {
              "x": "y"
            }
          },
          {
            "mark": "bar",
            "encoding": {
              "y": {},
              "x": {
                "type": "quantitative"
              },
              "color": {
                "type": "nominal",
                "ignore": true
              },
              "column": {
                "ignore": true,
                "type": "nominal"
              },
              "row": {
                "ignore": true,
                "type": "nominal"
              }
            },
            "unique_map": {
              "y": "x"
            }
          }
        ],
        "nl_ref_type": "explicit",
        "nl_ref_phrase": "bar chart"
      }
    ]
  },
  "input": "Dataset Information: {\n  \"data samples\": [\n    {\n      \"Date\": \"08/31/2022\",\n      \"GRA Purchases\": 93769635059,\n      \"PRGT 1/2/\": 15254184552,\n      \"Totals\": 109024000000.0,\n      \"Year\": 2022,\n      \"totals in billions\": 109.0238196\n    },\n    {\n      \"Date\": \"12/31/2013\",\n      \"GRA Purchases\": 83899249061,\n      \"PRGT 1/2/\": 6174392682,\n      \"Totals\": 90073641743.0,\n      \"Year\": 2013,\n      \"totals in billions\": 90.07364174\n    },\n    {\n      \"Date\": \"12/31/1989\",\n      \"GRA Purchases\": 22315104224,\n      \"PRGT 1/2/\": 2334886562,\n      \"Totals\": 24649990786.0,\n      \"Year\": 1989,\n      \"totals in billions\": 24.64999079\n    },\n    {\n      \"Date\": \"12/31/1997\",\n      \"GRA Purchases\": 46559033783,\n      \"PRGT 1/2/\": 6009867422,\n      \"Totals\": 52568901205.0,\n      \"Year\": 1997,\n      \"totals in billions\": 52.56890121\n    },\n    {\n      \"Date\": \"12/31/1991\",\n      \"GRA Purchases\": 23378573926,\n      \"PRGT 1/2/\": 3285717796,\n      \"Totals\": 26664291722.0,\n      \"Year\": 1991,\n      \"totals in billions\": 26.66429172\n    }\n  ],\n  \"column names\": [\n    \"Date\",\n    \"GRA Purchases\",\n    \"PRGT 1/2/\",\n    \"Totals\",\n    \"Year\",\n    \"totals in billions\"\n  ]\n}\n\nYour Job:\nI am developing a NL to Data Visualization Dataset. \nPlease help me generate natural language utterance for given dataset and constraints.\nDefinition about the Taks:\n- 'utterance' is what a user would say to make a chart. It should be a questions structure. One NL 'utterance' is in one or two sentences. Here are two examples from Questions for reference:\n    Are IMDb rating and rotten tomatoes rating related?\n    What's the average production budget of the different rated movies, separated by creative type.\n- 'given dataset' is in form of column names, column type, range/unique values of the column.\n- 'constraints' are information about the chart that should be included in the utterance. \n    So we can find a reference phrase in the NL utterance that corresponds to the given constraints. \n- 'reference phrase' can be explicit, ambiguous, and by_value. 'ambiguous' means the phrase can map to more than one columns in the dataset, always a hypernym of column names(depending on the dataset values).\n    For example:\n    {\"column\": \"gdpPercap\", \"nl_ref_type\": \"explicit\", \"nl_ref_phrase\": \"GDP per capita\"},\n    {\"column\": [\"country\",\"continent\"], \"nl_ref_type\": \"ambiguous\", \"nl_ref_phrase\": \"region\"}\n    {\"column\": [\"country\",\"country_short_name\"], \"nl_ref_type\": \"ambiguous\", \"nl_ref_phrase\": \"countries\"}\n    {\"c_type\": \"mark\", \"c_name\": \"point chart\", \"nl_ref_type\": \"explicit\", \"nl_ref_phrase\": \"scatter plot\"}\n    {\"c_type\": \"mark\", \"c_name\": \"arc chart\", \"nl_ref_type\": \"explicit\", \"nl_ref_phrase\": \"pie chart\"}\n    {\"c_type\": \"transform\",\"c_name\": \"filter\",\"c_list\": [{\"field\": \"country\",\"oneOf\": [\"Iceland\",\"Norway\"]}],\"nl_ref_type\": \"explicit\",\"nl_ref_phrase\": \"for countries Iceland and Norway\"},\n    {\"c_type\": \"transform\",\"c_name\": \"filter\",\"c_list\": [{\"field\": \"country\",\"oneOf\": [\"Iceland\",\"Norway\"]}],\"nl_ref_type\": \"by_value\",\"nl_ref_phrase\": \"for Iceland and Norway\"},\n- the 'nl_ref_phrase' for 'ambiguous' columns should be equally near all ambiguous columns, not too near to one of the column since it would not be ambiguous.\n    good example: {\"column\": [\"country\",\"region\"], \"nl_ref_type\": \"ambiguous\", \"nl_ref_phrase\": \"location\"}\n    bad example: {\"column\": [\"country\",\"region\"], \"nl_ref_type\": \"ambiguous\", \"nl_ref_phrase\": \"region\"}\n- You only include given constraints and no other information. \n    For example, if a column name is not in the given constraint, it will not be included in the NL utterance.\n    Also, it a chart mark or chart encoding channel is not in the given constraint, it will not be included in the NL utterance.\n- all 'nl_ref_phrase' shoule be included in the 'nl_utterance'. \n\nThe output format is identical to the input format, but fill in the str blanks(\"...\").\n### Input:\n{\n  \"nl_utterance\": \"...\",\n  \"encoded_fields\": [\n    {\n      \"field\": \"Year\",\n      \"type\": \"quantitative\",\n      \"nl_ref_type\": \"explicit\",\n      \"nl_ref_phrase\": \"...\"\n    },\n    {\n      \"field\": \"totals in billions\",\n      \"type\": \"quantitative\",\n      \"nl_ref_type\": \"explicit\",\n      \"nl_ref_phrase\": \"...\"\n    }\n  ],\n  \"constraints\": [\n    {\n      \"c_type\": \"task\",\n      \"c_name\": \"trend\",\n      \"c_list\": [\n        {\n          \"mark\": [\n            \"bar\",\n            \"line\",\n            \"area\"\n          ],\n          \"encoding\": {\n            \"x\": {\n              \"type\": \"temporal\"\n            }\n          }\n        }\n      ],\n      \"nl_ref_type\": \"explicit\",\n      \"nl_ref_phrase\": \"...\"\n    },\n    {\n      \"c_type\": \"mark\",\n      \"c_name\": \"bar chart\",\n      \"c_list\": [\n        {\n          \"mark\": \"bar\",\n          \"encoding\": {\n            \"x\": {},\n            \"y\": {\n              \"type\": \"quantitative\"\n            },\n            \"color\": {\n              \"type\": \"nominal\",\n              \"ignore\": true\n            },\n            \"column\": {\n              \"ignore\": true,\n              \"type\": \"nominal\"\n            },\n            \"row\": {\n              \"ignore\": true,\n              \"type\": \"nominal\"\n            }\n          },\n          \"unique_map\": {\n            \"x\": \"y\"\n          }\n        },\n        {\n          \"mark\": \"bar\",\n          \"encoding\": {\n            \"y\": {},\n            \"x\": {\n              \"type\": \"quantitative\"\n            },\n            \"color\": {\n              \"type\": \"nominal\",\n              \"ignore\": true\n            },\n            \"column\": {\n              \"ignore\": true,\n              \"type\": \"nominal\"\n            },\n            \"row\": {\n              \"ignore\": true,\n              \"type\": \"nominal\"\n            }\n          },\n          \"unique_map\": {\n            \"y\": \"x\"\n          }\n        }\n      ],\n      \"nl_ref_type\": \"explicit\",\n      \"nl_ref_phrase\": \"...\"\n    }\n  ]\n}\n\n### Output:"
}