{
  "gpt_result": {
    "nl_utterance": "Show me the sum of Totals as a percentage of GDP over the years.",
    "encoded_fields": [
      {
        "field": "Year",
        "type": "quantitative",
        "nl_ref_type": "explicit",
        "nl_ref_phrase": "years"
      },
      {
        "field": "Totals_GDP",
        "type": "quantitative",
        "nl_ref_type": "explicit",
        "nl_ref_phrase": "Totals as a percentage of GDP"
      }
    ],
    "constraints": [
      {
        "c_type": "transform",
        "c_name": "aggregate",
        "c_list": [
          {
            "field": "Totals_GDP",
            "aggregate": "sum"
          }
        ],
        "nl_ref_type": "explicit",
        "nl_ref_phrase": "sum"
      }
    ]
  },
  "input": "Dataset Information: {\n  \"data samples\": [\n    {\n      \"Date\": \"08/31/2022\",\n      \"GRA Purchases\": 93769635059,\n      \"PRGT 1/2/\": 15254184552,\n      \"Totals\": 109023819611,\n      \"Year\": 2022,\n      \"Totals_billions\": 109.0238196,\n      \"Unnamed: 6\": NaN,\n      \"GDP\": 3376.003,\n      \"Unnamed: 8\": NaN,\n      \"Totals_GDP\": 3.229375673\n    },\n    {\n      \"Date\": \"12/31/2021\",\n      \"GRA Purchases\": 89474552025,\n      \"PRGT 1/2/\": 14554823681,\n      \"Totals\": 104029375706,\n      \"Year\": 2021,\n      \"Totals_billions\": 104.0293757,\n      \"Unnamed: 6\": NaN,\n      \"GDP\": 3187.626,\n      \"Unnamed: 8\": NaN,\n      \"Totals_GDP\": 3.263537683\n    },\n    {\n      \"Date\": \"12/31/2019\",\n      \"GRA Purchases\": 66945509865,\n      \"PRGT 1/2/\": 6590835450,\n      \"Totals\": 73536345315,\n      \"Year\": 2019,\n      \"Totals_billions\": 73.53634532,\n      \"Unnamed: 6\": NaN,\n      \"GDP\": 3088.773,\n      \"Unnamed: 8\": NaN,\n      \"Totals_GDP\": 2.380762371\n    },\n    {\n      \"Date\": \"12/31/2015\",\n      \"GRA Purchases\": 50757840741,\n      \"PRGT 1/2/\": 6575911158,\n      \"Totals\": 57333751899,\n      \"Year\": 2015,\n      \"Totals_billions\": 57.3337519,\n      \"Unnamed: 6\": NaN,\n      \"GDP\": 2880.357,\n      \"Unnamed: 8\": NaN,\n      \"Totals_GDP\": 1.990508534\n    },\n    {\n      \"Date\": \"12/31/1992\",\n      \"GRA Purchases\": 23967172718,\n      \"PRGT 1/2/\": 3804463796,\n      \"Totals\": 27771636514,\n      \"Year\": 1992,\n      \"Totals_billions\": 27.77163651,\n      \"Unnamed: 6\": NaN,\n      \"GDP\": 1244.009,\n      \"Unnamed: 8\": NaN,\n      \"Totals_GDP\": 2.232430514\n    }\n  ],\n  \"column names\": [\n    \"Date\",\n    \"GRA Purchases\",\n    \"PRGT 1/2/\",\n    \"Totals\",\n    \"Year\",\n    \"Totals_billions\",\n    \"Unnamed: 6\",\n    \"GDP\",\n    \"Unnamed: 8\",\n    \"Totals_GDP\"\n  ]\n}\n\nYour Job:\nI am developing a NL to Data Visualization Dataset. \nPlease help me generate natural language utterance for given dataset and constraints.\nDefinition about the Taks:\n- 'utterance' is what a user would say to make a chart. It should be a commands structure. One NL 'utterance' is in one or two sentences. Here are two examples from Commands for reference:\n    For each country show the relationship between average acceleration and number of cylinders.\n    Help me see outliers in IMDB and Rotten Tomatoes ratings.\n- 'given dataset' is in form of column names, column type, range/unique values of the column.\n- 'constraints' are information about the chart that should be included in the utterance. \n    So we can find a reference phrase in the NL utterance that corresponds to the given constraints. \n- 'reference phrase' can be explicit, ambiguous, and by_value. 'ambiguous' means the phrase can map to more than one columns in the dataset, always a hypernym of column names(depending on the dataset values).\n    For example:\n    {\"column\": \"gdpPercap\", \"nl_ref_type\": \"explicit\", \"nl_ref_phrase\": \"GDP per capita\"},\n    {\"column\": [\"country\",\"continent\"], \"nl_ref_type\": \"ambiguous\", \"nl_ref_phrase\": \"region\"}\n    {\"column\": [\"country\",\"country_short_name\"], \"nl_ref_type\": \"ambiguous\", \"nl_ref_phrase\": \"countries\"}\n    {\"c_type\": \"mark\", \"c_name\": \"point chart\", \"nl_ref_type\": \"explicit\", \"nl_ref_phrase\": \"scatter plot\"}\n    {\"c_type\": \"mark\", \"c_name\": \"arc chart\", \"nl_ref_type\": \"explicit\", \"nl_ref_phrase\": \"pie chart\"}\n    {\"c_type\": \"transform\",\"c_name\": \"filter\",\"c_list\": [{\"field\": \"country\",\"oneOf\": [\"Iceland\",\"Norway\"]}],\"nl_ref_type\": \"explicit\",\"nl_ref_phrase\": \"for countries Iceland and Norway\"},\n    {\"c_type\": \"transform\",\"c_name\": \"filter\",\"c_list\": [{\"field\": \"country\",\"oneOf\": [\"Iceland\",\"Norway\"]}],\"nl_ref_type\": \"by_value\",\"nl_ref_phrase\": \"for Iceland and Norway\"},\n- the 'nl_ref_phrase' for 'ambiguous' columns should be equally near all ambiguous columns, not too near to one of the column since it would not be ambiguous.\n    good example: {\"column\": [\"country\",\"region\"], \"nl_ref_type\": \"ambiguous\", \"nl_ref_phrase\": \"location\"}\n    bad example: {\"column\": [\"country\",\"region\"], \"nl_ref_type\": \"ambiguous\", \"nl_ref_phrase\": \"region\"}\n- You only include given constraints and no other information. \n    For example, if a column name is not in the given constraint, it will not be included in the NL utterance.\n    Also, it a chart mark or chart encoding channel is not in the given constraint, it will not be included in the NL utterance.\n- all 'nl_ref_phrase' shoule be included in the 'nl_utterance'. \n\nThe output format is identical to the input format, but fill in the str blanks(\"...\").\n### Input:\n{\n  \"nl_utterance\": \"...\",\n  \"encoded_fields\": [\n    {\n      \"field\": \"Year\",\n      \"type\": \"quantitative\",\n      \"nl_ref_type\": \"explicit\",\n      \"nl_ref_phrase\": \"...\"\n    },\n    {\n      \"field\": \"Totals_GDP\",\n      \"type\": \"quantitative\",\n      \"nl_ref_type\": \"explicit\",\n      \"nl_ref_phrase\": \"...\"\n    }\n  ],\n  \"constraints\": [\n    {\n      \"c_type\": \"transform\",\n      \"c_name\": \"aggregate\",\n      \"c_list\": [\n        {\n          \"field\": \"Totals_GDP\",\n          \"aggregate\": \"sum\"\n        }\n      ],\n      \"nl_ref_type\": \"explicit\",\n      \"nl_ref_phrase\": \"...\"\n    }\n  ]\n}\n\n### Output:"
}