{
  "gpt_result": {
    "nl_utterance": "Create a line chart to show the trend of the sum of Debt-GDP over the Year.",
    "encoded_fields": [
      {
        "field": "Year",
        "type": "quantitative",
        "nl_ref_type": "explicit",
        "nl_ref_phrase": "Year"
      },
      {
        "field": "Debt-GDP",
        "type": "quantitative",
        "nl_ref_type": "explicit",
        "nl_ref_phrase": "Debt-GDP"
      }
    ],
    "constraints": [
      {
        "c_type": "task",
        "c_name": "trend",
        "c_list": [
          {
            "mark": [
              "bar",
              "line",
              "area"
            ],
            "encoding": {
              "x": {
                "type": "temporal"
              }
            }
          }
        ],
        "nl_ref_type": "explicit",
        "nl_ref_phrase": "trend"
      },
      {
        "c_type": "transform",
        "c_name": "aggregate",
        "c_list": [
          {
            "field": "Debt-GDP",
            "aggregate": "sum"
          }
        ],
        "nl_ref_type": "explicit",
        "nl_ref_phrase": "sum of Debt-GDP"
      }
    ]
  },
  "input": "Dataset Information: {\n  \"data samples\": [\n    {\n      \"Date\": \"08/31/2022\",\n      \"GRA Purchases\": 93769635059,\n      \"PRGT 1/2/\": 15254184552,\n      \"Totals\": 109024000000.0,\n      \"Year\": 2022,\n      \"Unnamed: 5\": \"31/2022\",\n      \"Day\": 31,\n      \"Total_billion\": 109.02,\n      \"World_GDP\": 98406500000000.0,\n      \"Debt-GDP\": 0.11\n    },\n    {\n      \"Date\": \"12/31/2015\",\n      \"GRA Purchases\": 50757840741,\n      \"PRGT 1/2/\": 6575911158,\n      \"Totals\": 57333751899.0,\n      \"Year\": 2015,\n      \"Unnamed: 5\": \"31/2015\",\n      \"Day\": 31,\n      \"Total_billion\": 57.33,\n      \"World_GDP\": 75179300000000.0,\n      \"Debt-GDP\": 0.08\n    },\n    {\n      \"Date\": \"12/31/1984\",\n      \"GRA Purchases\": 34936772393,\n      \"PRGT 1/2/\": 2769874900,\n      \"Totals\": 37706647293.0,\n      \"Year\": 1984,\n      \"Unnamed: 5\": \"31/1984\",\n      \"Day\": 31,\n      \"Total_billion\": 37.71,\n      \"World_GDP\": 12269800000000.0,\n      \"Debt-GDP\": 0.31\n    },\n    {\n      \"Date\": \"12/31/2011\",\n      \"GRA Purchases\": 87276915790,\n      \"PRGT 1/2/\": 5308609594,\n      \"Totals\": 92585525384.0,\n      \"Year\": 2011,\n      \"Unnamed: 5\": \"31/2011\",\n      \"Day\": 31,\n      \"Total_billion\": 92.59,\n      \"World_GDP\": 73853800000000.0,\n      \"Debt-GDP\": 0.13\n    },\n    {\n      \"Date\": \"12/31/2007\",\n      \"GRA Purchases\": 6036146757,\n      \"PRGT 1/2/\": 3796945581,\n      \"Totals\": 9833092338.0,\n      \"Year\": 2007,\n      \"Unnamed: 5\": \"31/2007\",\n      \"Day\": 31,\n      \"Total_billion\": 9.83,\n      \"World_GDP\": 58355000000000.0,\n      \"Debt-GDP\": 0.02\n    }\n  ],\n  \"column names\": [\n    \"Date\",\n    \"GRA Purchases\",\n    \"PRGT 1/2/\",\n    \"Totals\",\n    \"Year\",\n    \"Unnamed: 5\",\n    \"Day\",\n    \"Total_billion\",\n    \"World_GDP\",\n    \"Debt-GDP\"\n  ]\n}\n\nYour Job:\nI am developing a NL to Data Visualization Dataset. \nPlease help me generate natural language utterance for given dataset and constraints.\nDefinition about the Taks:\n- 'utterance' is what a user would say to make a chart. It should be a commands structure. One NL 'utterance' is in one or two sentences. Here are two examples from Commands for reference:\n    Create a line chart showing order date and sum of sales, divided by category.\n    Please show me a histogram of weights with 500 intervals.\n- 'given dataset' is in form of column names, column type, range/unique values of the column.\n- 'constraints' are information about the chart that should be included in the utterance. \n    So we can find a reference phrase in the NL utterance that corresponds to the given constraints. \n- 'reference phrase' can be explicit, ambiguous, and by_value. 'ambiguous' means the phrase can map to more than one columns in the dataset, always a hypernym of column names(depending on the dataset values).\n    For example:\n    {\"column\": \"gdpPercap\", \"nl_ref_type\": \"explicit\", \"nl_ref_phrase\": \"GDP per capita\"},\n    {\"column\": [\"country\",\"continent\"], \"nl_ref_type\": \"ambiguous\", \"nl_ref_phrase\": \"region\"}\n    {\"column\": [\"country\",\"country_short_name\"], \"nl_ref_type\": \"ambiguous\", \"nl_ref_phrase\": \"countries\"}\n    {\"c_type\": \"mark\", \"c_name\": \"point chart\", \"nl_ref_type\": \"explicit\", \"nl_ref_phrase\": \"scatter plot\"}\n    {\"c_type\": \"mark\", \"c_name\": \"arc chart\", \"nl_ref_type\": \"explicit\", \"nl_ref_phrase\": \"pie chart\"}\n    {\"c_type\": \"transform\",\"c_name\": \"filter\",\"c_list\": [{\"field\": \"country\",\"oneOf\": [\"Iceland\",\"Norway\"]}],\"nl_ref_type\": \"explicit\",\"nl_ref_phrase\": \"for countries Iceland and Norway\"},\n    {\"c_type\": \"transform\",\"c_name\": \"filter\",\"c_list\": [{\"field\": \"country\",\"oneOf\": [\"Iceland\",\"Norway\"]}],\"nl_ref_type\": \"by_value\",\"nl_ref_phrase\": \"for Iceland and Norway\"},\n- the 'nl_ref_phrase' for 'ambiguous' columns should be equally near all ambiguous columns, not too near to one of the column since it would not be ambiguous.\n    good example: {\"column\": [\"country\",\"region\"], \"nl_ref_type\": \"ambiguous\", \"nl_ref_phrase\": \"location\"}\n    bad example: {\"column\": [\"country\",\"region\"], \"nl_ref_type\": \"ambiguous\", \"nl_ref_phrase\": \"region\"}\n- You only include given constraints and no other information. \n    For example, if a column name is not in the given constraint, it will not be included in the NL utterance.\n    Also, it a chart mark or chart encoding channel is not in the given constraint, it will not be included in the NL utterance.\n- all 'nl_ref_phrase' shoule be included in the 'nl_utterance'. \n\nThe output format is identical to the input format, but fill in the str blanks(\"...\").\n### Input:\n{\n  \"nl_utterance\": \"...\",\n  \"encoded_fields\": [\n    {\n      \"field\": \"Year\",\n      \"type\": \"quantitative\",\n      \"nl_ref_type\": \"explicit\",\n      \"nl_ref_phrase\": \"...\"\n    },\n    {\n      \"field\": \"Debt-GDP\",\n      \"type\": \"quantitative\",\n      \"nl_ref_type\": \"explicit\",\n      \"nl_ref_phrase\": \"...\"\n    }\n  ],\n  \"constraints\": [\n    {\n      \"c_type\": \"task\",\n      \"c_name\": \"trend\",\n      \"c_list\": [\n        {\n          \"mark\": [\n            \"bar\",\n            \"line\",\n            \"area\"\n          ],\n          \"encoding\": {\n            \"x\": {\n              \"type\": \"temporal\"\n            }\n          }\n        }\n      ],\n      \"nl_ref_type\": \"explicit\",\n      \"nl_ref_phrase\": \"...\"\n    },\n    {\n      \"c_type\": \"transform\",\n      \"c_name\": \"aggregate\",\n      \"c_list\": [\n        {\n          \"field\": \"Debt-GDP\",\n          \"aggregate\": \"sum\"\n        }\n      ],\n      \"nl_ref_type\": \"explicit\",\n      \"nl_ref_phrase\": \"...\"\n    }\n  ]\n}\n\n### Output:"
}