{
  "gpt_result": {
    "nl_utterance": "Plot the SNP2 values against the sum of the reference percentage.",
    "encoded_fields": [
      {
        "field": "SNP2",
        "type": "quantitative",
        "nl_ref_type": "explicit",
        "nl_ref_phrase": "SNP2 values"
      },
      {
        "field": "PcentRef",
        "type": "quantitative",
        "nl_ref_type": "explicit",
        "nl_ref_phrase": "reference percentage"
      }
    ],
    "constraints": [
      {
        "c_type": "transform",
        "c_name": "aggregate",
        "c_list": [
          {
            "field": "PcentRef",
            "aggregate": "sum"
          }
        ],
        "nl_ref_type": "explicit",
        "nl_ref_phrase": "sum"
      }
    ]
  },
  "input": "Dataset Information: {\n  \"data samples\": [\n    {\n      \"SNP1\": 55,\n      \"SNP2\": 55,\n      \"Alt\": 249,\n      \"Ref\": 156,\n      \"Total\": 442,\n      \"PcentAlt\": 56.0,\n      \"PcentRef\": 35.0\n    },\n    {\n      \"SNP1\": 428,\n      \"SNP2\": 111,\n      \"Alt\": 243,\n      \"Ref\": 6,\n      \"Total\": 512,\n      \"PcentAlt\": 47.0,\n      \"PcentRef\": 1.0\n    },\n    {\n      \"SNP1\": 56,\n      \"SNP2\": 656,\n      \"Alt\": 175,\n      \"Ref\": 147,\n      \"Total\": 466,\n      \"PcentAlt\": 38.0,\n      \"PcentRef\": 32.0\n    },\n    {\n      \"SNP1\": 90,\n      \"SNP2\": 519,\n      \"Alt\": 279,\n      \"Ref\": 142,\n      \"Total\": 570,\n      \"PcentAlt\": 49.0,\n      \"PcentRef\": 25.0\n    },\n    {\n      \"SNP1\": 656,\n      \"SNP2\": 55,\n      \"Alt\": 178,\n      \"Ref\": 128,\n      \"Total\": 570,\n      \"PcentAlt\": 31.0,\n      \"PcentRef\": 22.0\n    }\n  ],\n  \"column names\": [\n    \"SNP1\",\n    \"SNP2\",\n    \"Alt\",\n    \"Ref\",\n    \"Total\",\n    \"PcentAlt\",\n    \"PcentRef\"\n  ]\n}\n\nYour Job:\nI am developing a NL to Data Visualization Dataset. \nPlease help me generate natural language utterance for given dataset and constraints.\nDefinition about the Taks:\n- 'utterance' is what a user would say to make a chart. It should be a commands structure. One NL 'utterance' is in one or two sentences. Here are two examples from Commands for reference:\n    Sort creative types by number of movies.\n    Draw a line chart of daily sales forecasts.\n- 'given dataset' is in form of column names, column type, range/unique values of the column.\n- 'constraints' are information about the chart that should be included in the utterance. \n    So we can find a reference phrase in the NL utterance that corresponds to the given constraints. \n- 'reference phrase' can be explicit, ambiguous, and by_value. 'ambiguous' means the phrase can map to more than one columns in the dataset, always a hypernym of column names(depending on the dataset values).\n    For example:\n    {\"column\": \"gdpPercap\", \"nl_ref_type\": \"explicit\", \"nl_ref_phrase\": \"GDP per capita\"},\n    {\"column\": [\"country\",\"continent\"], \"nl_ref_type\": \"ambiguous\", \"nl_ref_phrase\": \"region\"}\n    {\"column\": [\"country\",\"country_short_name\"], \"nl_ref_type\": \"ambiguous\", \"nl_ref_phrase\": \"countries\"}\n    {\"c_type\": \"mark\", \"c_name\": \"point chart\", \"nl_ref_type\": \"explicit\", \"nl_ref_phrase\": \"scatter plot\"}\n    {\"c_type\": \"mark\", \"c_name\": \"arc chart\", \"nl_ref_type\": \"explicit\", \"nl_ref_phrase\": \"pie chart\"}\n    {\"c_type\": \"transform\",\"c_name\": \"filter\",\"c_list\": [{\"field\": \"country\",\"oneOf\": [\"Iceland\",\"Norway\"]}],\"nl_ref_type\": \"explicit\",\"nl_ref_phrase\": \"for countries Iceland and Norway\"},\n    {\"c_type\": \"transform\",\"c_name\": \"filter\",\"c_list\": [{\"field\": \"country\",\"oneOf\": [\"Iceland\",\"Norway\"]}],\"nl_ref_type\": \"by_value\",\"nl_ref_phrase\": \"for Iceland and Norway\"},\n- the 'nl_ref_phrase' for 'ambiguous' columns should be equally near all ambiguous columns, not too near to one of the column since it would not be ambiguous.\n    good example: {\"column\": [\"country\",\"region\"], \"nl_ref_type\": \"ambiguous\", \"nl_ref_phrase\": \"location\"}\n    bad example: {\"column\": [\"country\",\"region\"], \"nl_ref_type\": \"ambiguous\", \"nl_ref_phrase\": \"region\"}\n- You only include given constraints and no other information. \n    For example, if a column name is not in the given constraint, it will not be included in the NL utterance.\n    Also, it a chart mark or chart encoding channel is not in the given constraint, it will not be included in the NL utterance.\n- all 'nl_ref_phrase' shoule be included in the 'nl_utterance'. \n\nThe output format is identical to the input format, but fill in the str blanks(\"...\").\n### Input:\n{\n  \"nl_utterance\": \"...\",\n  \"encoded_fields\": [\n    {\n      \"field\": \"SNP2\",\n      \"type\": \"quantitative\",\n      \"nl_ref_type\": \"explicit\",\n      \"nl_ref_phrase\": \"...\"\n    },\n    {\n      \"field\": \"PcentRef\",\n      \"type\": \"quantitative\",\n      \"nl_ref_type\": \"explicit\",\n      \"nl_ref_phrase\": \"...\"\n    }\n  ],\n  \"constraints\": [\n    {\n      \"c_type\": \"transform\",\n      \"c_name\": \"aggregate\",\n      \"c_list\": [\n        {\n          \"field\": \"PcentRef\",\n          \"aggregate\": \"sum\"\n        }\n      ],\n      \"nl_ref_type\": \"explicit\",\n      \"nl_ref_phrase\": \"...\"\n    }\n  ]\n}\n\n### Output:"
}