{
  "gpt_result": {
    "nl_utterance": "How has the value changed over different dates? Can you show this in a line chart?",
    "encoded_fields": [
      {
        "field": "date",
        "type": "quantitative",
        "nl_ref_type": "explicit",
        "nl_ref_phrase": "dates"
      },
      {
        "field": "value",
        "type": "quantitative",
        "nl_ref_type": "explicit",
        "nl_ref_phrase": "value"
      }
    ],
    "constraints": [
      {
        "c_type": "mark",
        "c_name": "line chart",
        "c_list": [
          {
            "mark": "line",
            "encoding": {
              "x": {},
              "y": {
                "type": "quantitative"
              },
              "color": {
                "ignore": true,
                "type": "nominal"
              },
              "column": {
                "ignore": true,
                "type": "nominal"
              },
              "row": {
                "ignore": true,
                "type": "nominal"
              }
            },
            "unique_map": {
              "x": "y"
            }
          }
        ],
        "nl_ref_type": "explicit",
        "nl_ref_phrase": "line chart"
      }
    ]
  },
  "input": "Dataset Information: {\n  \"data samples\": [\n    {\n      \"date\": 1955,\n      \"label\": 1955,\n      \"month\": NaN,\n      \"quarter\": NaN,\n      \"sourceDataset\": \"PUSF\",\n      \"updateDate\": \"2019-11-21T00:00:00.000Z\",\n      \"value\": NaN,\n      \"year\": 1955\n    },\n    {\n      \"date\": 1994,\n      \"label\": 1994,\n      \"month\": NaN,\n      \"quarter\": NaN,\n      \"sourceDataset\": \"PUSF\",\n      \"updateDate\": \"2019-11-21T00:00:00.000Z\",\n      \"value\": NaN,\n      \"year\": 1994\n    },\n    {\n      \"date\": 1985,\n      \"label\": 1985,\n      \"month\": NaN,\n      \"quarter\": NaN,\n      \"sourceDataset\": \"PUSF\",\n      \"updateDate\": \"2019-11-21T00:00:00.000Z\",\n      \"value\": NaN,\n      \"year\": 1985\n    },\n    {\n      \"date\": 1967,\n      \"label\": 1967,\n      \"month\": NaN,\n      \"quarter\": NaN,\n      \"sourceDataset\": \"PUSF\",\n      \"updateDate\": \"2019-11-21T00:00:00.000Z\",\n      \"value\": NaN,\n      \"year\": 1967\n    },\n    {\n      \"date\": 2007,\n      \"label\": 2007,\n      \"month\": NaN,\n      \"quarter\": NaN,\n      \"sourceDataset\": \"PUSF\",\n      \"updateDate\": \"2023-06-20T23:00:00.000Z\",\n      \"value\": 1.1,\n      \"year\": 2007\n    }\n  ],\n  \"column names\": [\n    \"date\",\n    \"label\",\n    \"month\",\n    \"quarter\",\n    \"sourceDataset\",\n    \"updateDate\",\n    \"value\",\n    \"year\"\n  ]\n}\n\nYour Job:\nI am developing a NL to Data Visualization Dataset. \nPlease help me generate natural language utterance for given dataset and constraints.\nDefinition about the Taks:\n- 'utterance' is what a user would say to make a chart. It should be a questions structure. One NL 'utterance' is in one or two sentences. Here are two examples from Questions for reference:\n    Have cars gotten lighter over time?\n    On average, how much was earned by movies of each genre?\n- 'given dataset' is in form of column names, column type, range/unique values of the column.\n- 'constraints' are information about the chart that should be included in the utterance. \n    So we can find a reference phrase in the NL utterance that corresponds to the given constraints. \n- 'reference phrase' can be explicit, ambiguous, and by_value. 'ambiguous' means the phrase can map to more than one columns in the dataset, always a hypernym of column names(depending on the dataset values).\n    For example:\n    {\"column\": \"gdpPercap\", \"nl_ref_type\": \"explicit\", \"nl_ref_phrase\": \"GDP per capita\"},\n    {\"column\": [\"country\",\"continent\"], \"nl_ref_type\": \"ambiguous\", \"nl_ref_phrase\": \"region\"}\n    {\"column\": [\"country\",\"country_short_name\"], \"nl_ref_type\": \"ambiguous\", \"nl_ref_phrase\": \"countries\"}\n    {\"c_type\": \"mark\", \"c_name\": \"point chart\", \"nl_ref_type\": \"explicit\", \"nl_ref_phrase\": \"scatter plot\"}\n    {\"c_type\": \"mark\", \"c_name\": \"arc chart\", \"nl_ref_type\": \"explicit\", \"nl_ref_phrase\": \"pie chart\"}\n    {\"c_type\": \"transform\",\"c_name\": \"filter\",\"c_list\": [{\"field\": \"country\",\"oneOf\": [\"Iceland\",\"Norway\"]}],\"nl_ref_type\": \"explicit\",\"nl_ref_phrase\": \"for countries Iceland and Norway\"},\n    {\"c_type\": \"transform\",\"c_name\": \"filter\",\"c_list\": [{\"field\": \"country\",\"oneOf\": [\"Iceland\",\"Norway\"]}],\"nl_ref_type\": \"by_value\",\"nl_ref_phrase\": \"for Iceland and Norway\"},\n- the 'nl_ref_phrase' for 'ambiguous' columns should be equally near all ambiguous columns, not too near to one of the column since it would not be ambiguous.\n    good example: {\"column\": [\"country\",\"region\"], \"nl_ref_type\": \"ambiguous\", \"nl_ref_phrase\": \"location\"}\n    bad example: {\"column\": [\"country\",\"region\"], \"nl_ref_type\": \"ambiguous\", \"nl_ref_phrase\": \"region\"}\n- You only include given constraints and no other information. \n    For example, if a column name is not in the given constraint, it will not be included in the NL utterance.\n    Also, it a chart mark or chart encoding channel is not in the given constraint, it will not be included in the NL utterance.\n- all 'nl_ref_phrase' shoule be included in the 'nl_utterance'. \n\nThe output format is identical to the input format, but fill in the str blanks(\"...\").\n### Input:\n{\n  \"nl_utterance\": \"...\",\n  \"encoded_fields\": [\n    {\n      \"field\": \"date\",\n      \"type\": \"quantitative\",\n      \"nl_ref_type\": \"explicit\",\n      \"nl_ref_phrase\": \"...\"\n    },\n    {\n      \"field\": \"value\",\n      \"type\": \"quantitative\",\n      \"nl_ref_type\": \"explicit\",\n      \"nl_ref_phrase\": \"...\"\n    }\n  ],\n  \"constraints\": [\n    {\n      \"c_type\": \"mark\",\n      \"c_name\": \"line chart\",\n      \"c_list\": [\n        {\n          \"mark\": \"line\",\n          \"encoding\": {\n            \"x\": {},\n            \"y\": {\n              \"type\": \"quantitative\"\n            },\n            \"color\": {\n              \"ignore\": true,\n              \"type\": \"nominal\"\n            },\n            \"column\": {\n              \"ignore\": true,\n              \"type\": \"nominal\"\n            },\n            \"row\": {\n              \"ignore\": true,\n              \"type\": \"nominal\"\n            }\n          },\n          \"unique_map\": {\n            \"x\": \"y\"\n          }\n        }\n      ],\n      \"nl_ref_type\": \"explicit\",\n      \"nl_ref_phrase\": \"...\"\n    }\n  ]\n}\n\n### Output:"
}