{
  "gpt_result": {
    "nl_utterance": "What is the trend of the total price for GOOG over time?",
    "encoded_fields": [
      {
        "field": "date",
        "type": "temporal",
        "nl_ref_type": "explicit",
        "nl_ref_phrase": "time"
      },
      {
        "field": "price",
        "type": "quantitative",
        "nl_ref_type": "explicit",
        "nl_ref_phrase": "total price"
      }
    ],
    "constraints": [
      {
        "c_type": "task",
        "c_name": "trend",
        "c_list": [
          {
            "mark": [
              "bar",
              "line",
              "area"
            ],
            "encoding": {
              "x": {
                "type": "temporal"
              }
            }
          }
        ],
        "nl_ref_type": "explicit",
        "nl_ref_phrase": "trend"
      },
      {
        "c_type": "transform",
        "c_name": "filter",
        "c_list": [
          {
            "field": "symbol",
            "equal": "GOOG"
          }
        ],
        "nl_ref_type": "by_value",
        "nl_ref_phrase": "for GOOG"
      },
      {
        "c_type": "transform",
        "c_name": "aggregate",
        "c_list": [
          {
            "field": "price",
            "aggregate": "sum"
          }
        ],
        "nl_ref_type": "explicit",
        "nl_ref_phrase": "total"
      }
    ]
  },
  "input": "Dataset Information: {\n  \"data samples\": [\n    {\n      \"symbol\": \"MSFT\",\n      \"date\": \"Jan 1 2000\",\n      \"price\": 39.81\n    },\n    {\n      \"symbol\": \"AMZN\",\n      \"date\": \"May 1 2002\",\n      \"price\": 18.23\n    },\n    {\n      \"symbol\": \"AAPL\",\n      \"date\": \"Apr 1 2009\",\n      \"price\": 125.83\n    },\n    {\n      \"symbol\": \"GOOG\",\n      \"date\": \"Jul 1 2008\",\n      \"price\": 473.75\n    },\n    {\n      \"symbol\": \"MSFT\",\n      \"date\": \"Aug 1 2004\",\n      \"price\": 22.47\n    }\n  ],\n  \"column names\": [\n    \"symbol\",\n    \"date\",\n    \"price\"\n  ]\n}\n\nYour Job:\nI am developing a NL to Data Visualization Dataset. \nPlease help me generate natural language utterance for given dataset and constraints.\nDefinition about the Taks:\n- 'utterance' is what a user would say to make a chart. It should be a questions structure. One NL 'utterance' is in one or two sentences. Here are two examples from Questions for reference:\n    Are IMDb rating and rotten tomatoes rating related?\n    What major genre had the highest average worldwide gross?\n- 'given dataset' is in form of column names, column type, range/unique values of the column.\n- 'constraints' are information about the chart that should be included in the utterance. \n    So we can find a reference phrase in the NL utterance that corresponds to the given constraints. \n- 'reference phrase' can be explicit, ambiguous, and by_value. 'ambiguous' means the phrase can map to more than one columns in the dataset, always a hypernym of column names(depending on the dataset values).\n    For example:\n    {\"column\": \"gdpPercap\", \"nl_ref_type\": \"explicit\", \"nl_ref_phrase\": \"GDP per capita\"},\n    {\"column\": [\"country\",\"continent\"], \"nl_ref_type\": \"ambiguous\", \"nl_ref_phrase\": \"region\"}\n    {\"column\": [\"country\",\"country_short_name\"], \"nl_ref_type\": \"ambiguous\", \"nl_ref_phrase\": \"countries\"}\n    {\"c_type\": \"mark\", \"c_name\": \"point chart\", \"nl_ref_type\": \"explicit\", \"nl_ref_phrase\": \"scatter plot\"}\n    {\"c_type\": \"mark\", \"c_name\": \"arc chart\", \"nl_ref_type\": \"explicit\", \"nl_ref_phrase\": \"pie chart\"}\n    {\"c_type\": \"transform\",\"c_name\": \"filter\",\"c_list\": [{\"field\": \"country\",\"oneOf\": [\"Iceland\",\"Norway\"]}],\"nl_ref_type\": \"explicit\",\"nl_ref_phrase\": \"for countries Iceland and Norway\"},\n    {\"c_type\": \"transform\",\"c_name\": \"filter\",\"c_list\": [{\"field\": \"country\",\"oneOf\": [\"Iceland\",\"Norway\"]}],\"nl_ref_type\": \"by_value\",\"nl_ref_phrase\": \"for Iceland and Norway\"},\n- the 'nl_ref_phrase' for 'ambiguous' columns should be equally near all ambiguous columns, not too near to one of the column since it would not be ambiguous.\n    good example: {\"column\": [\"country\",\"region\"], \"nl_ref_type\": \"ambiguous\", \"nl_ref_phrase\": \"location\"}\n    bad example: {\"column\": [\"country\",\"region\"], \"nl_ref_type\": \"ambiguous\", \"nl_ref_phrase\": \"region\"}\n- You only include given constraints and no other information. \n    For example, if a column name is not in the given constraint, it will not be included in the NL utterance.\n    Also, it a chart mark or chart encoding channel is not in the given constraint, it will not be included in the NL utterance.\n- all 'nl_ref_phrase' shoule be included in the 'nl_utterance'. \n\nThe output format is identical to the input format, but fill in the str blanks(\"...\").\n### Input:\n{\n  \"nl_utterance\": \"...\",\n  \"encoded_fields\": [\n    {\n      \"field\": \"date\",\n      \"type\": \"temporal\",\n      \"nl_ref_type\": \"explicit\",\n      \"nl_ref_phrase\": \"...\"\n    },\n    {\n      \"field\": \"price\",\n      \"type\": \"quantitative\",\n      \"nl_ref_type\": \"explicit\",\n      \"nl_ref_phrase\": \"...\"\n    }\n  ],\n  \"constraints\": [\n    {\n      \"c_type\": \"task\",\n      \"c_name\": \"trend\",\n      \"c_list\": [\n        {\n          \"mark\": [\n            \"bar\",\n            \"line\",\n            \"area\"\n          ],\n          \"encoding\": {\n            \"x\": {\n              \"type\": \"temporal\"\n            }\n          }\n        }\n      ],\n      \"nl_ref_type\": \"explicit\",\n      \"nl_ref_phrase\": \"...\"\n    },\n    {\n      \"c_type\": \"transform\",\n      \"c_name\": \"filter\",\n      \"c_list\": [\n        {\n          \"field\": \"symbol\",\n          \"equal\": \"GOOG\"\n        }\n      ],\n      \"nl_ref_type\": \"by_value\",\n      \"nl_ref_phrase\": \"...\"\n    },\n    {\n      \"c_type\": \"transform\",\n      \"c_name\": \"aggregate\",\n      \"c_list\": [\n        {\n          \"field\": \"price\",\n          \"aggregate\": \"sum\"\n        }\n      ],\n      \"nl_ref_type\": \"explicit\",\n      \"nl_ref_phrase\": \"...\"\n    }\n  ]\n}\n\n### Output:"
}