{
  "gpt_result": {
    "nl_utterance": "Create a scatter plot of firearm deaths grouped by division.",
    "encoded_fields": [
      {
        "field": "Firearm deaths",
        "type": "quantitative",
        "nl_ref_type": "explicit",
        "nl_ref_phrase": "firearm deaths"
      },
      {
        "field": "Division",
        "type": "nominal",
        "nl_ref_type": "explicit",
        "nl_ref_phrase": "division"
      }
    ],
    "constraints": [
      {
        "c_type": "mark",
        "c_name": "point chart",
        "c_list": [
          {
            "mark": "circle",
            "encoding": {
              "x": {},
              "y": {},
              "color": {
                "type": "nominal",
                "ignore": true
              },
              "size": {
                "ignore": true,
                "type": "quantitative"
              },
              "column": {
                "ignore": true,
                "type": "nominal"
              },
              "row": {
                "ignore": true,
                "type": "nominal"
              }
            }
          }
        ],
        "nl_ref_type": "explicit",
        "nl_ref_phrase": "scatter plot"
      }
    ]
  },
  "input": "Dataset Information: {\n  \"data samples\": [\n    {\n      \"State\": \"Alabama\",\n      \"State2\": \"AL\",\n      \"Gini\": 0.472,\n      \"Death Rate\": 21.5,\n      \"Firearms, vs average\": 1.64700475,\n      \"Med income\": 47221,\n      \"Income, vs median\": 0.799827233,\n      \"Imprisonment rates\": 736,\n      \"Prison rate\": 1.264604811,\n      \"Imprisonment rate\": 0.736,\n      \"Firearm deaths\": 0.215,\n      \"Division\": \"South\"\n    },\n    {\n      \"State\": \"Maryland\",\n      \"State2\": \"MD\",\n      \"Gini\": 0.443,\n      \"Death Rate\": 11.9,\n      \"Firearms, vs average\": 0.911597978,\n      \"Med income\": 73760,\n      \"Income, vs median\": 1.249343654,\n      \"Imprisonment rates\": 424,\n      \"Prison rate\": 0.728522337,\n      \"Imprisonment rate\": 0.424,\n      \"Firearm deaths\": 0.119,\n      \"Division\": \"South\"\n    },\n    {\n      \"State\": \"Indiana\",\n      \"State2\": \"IN\",\n      \"Gini\": 0.44,\n      \"Death Rate\": 15.0,\n      \"Firearms, vs average\": 1.149073081,\n      \"Med income\": 56094,\n      \"Income, vs median\": 0.950117719,\n      \"Imprisonment rates\": 503,\n      \"Prison rate\": 0.864261168,\n      \"Imprisonment rate\": 0.503,\n      \"Firearm deaths\": 0.15,\n      \"Division\": \"Midwest\"\n    },\n    {\n      \"State\": \"Missouri\",\n      \"State2\": \"MO\",\n      \"Gini\": 0.455,\n      \"Death Rate\": 19.0,\n      \"Firearms, vs average\": 1.455492569,\n      \"Med income\": 55016,\n      \"Income, vs median\": 0.931858602,\n      \"Imprisonment rates\": 688,\n      \"Prison rate\": 1.182130584,\n      \"Imprisonment rate\": 0.688,\n      \"Firearm deaths\": 0.19,\n      \"Division\": \"Midwest\"\n    },\n    {\n      \"State\": \"Wisconsin\",\n      \"State2\": \"WI\",\n      \"Gini\": 0.43,\n      \"Death Rate\": 11.4,\n      \"Firearms, vs average\": 0.873295542,\n      \"Med income\": 59817,\n      \"Income, vs median\": 1.01317773,\n      \"Imprisonment rates\": 492,\n      \"Prison rate\": 0.845360825,\n      \"Imprisonment rate\": 0.492,\n      \"Firearm deaths\": 0.114,\n      \"Division\": \"Midwest\"\n    }\n  ],\n  \"column names\": [\n    \"State\",\n    \"State2\",\n    \"Gini\",\n    \"Death Rate\",\n    \"Firearms, vs average\",\n    \"Med income\",\n    \"Income, vs median\",\n    \"Imprisonment rates\",\n    \"Prison rate\",\n    \"Imprisonment rate\",\n    \"Firearm deaths\",\n    \"Division\"\n  ]\n}\n\nYour Job:\nI am developing a NL to Data Visualization Dataset. \nPlease help me generate natural language utterance for given dataset and constraints.\nDefinition about the Taks:\n- 'utterance' is what a user would say to make a chart.  One NL 'utterance' is in one or two sentences. Here are two examples from Others for reference:\n    scatter(x=production budget, y=worldwide gross) for content rating.\n    I want to know how many orders there are by the quantity of the order.\n- 'given dataset' is in form of column names, column type, range/unique values of the column.\n- 'constraints' are information about the chart that should be included in the utterance. \n    So we can find a reference phrase in the NL utterance that corresponds to the given constraints. \n- 'reference phrase' can be explicit, ambiguous, and by_value. 'ambiguous' means the phrase can map to more than one columns in the dataset, always a hypernym of column names(depending on the dataset values).\n    For example:\n    {\"column\": \"gdpPercap\", \"nl_ref_type\": \"explicit\", \"nl_ref_phrase\": \"GDP per capita\"},\n    {\"column\": [\"country\",\"continent\"], \"nl_ref_type\": \"ambiguous\", \"nl_ref_phrase\": \"region\"}\n    {\"column\": [\"country\",\"country_short_name\"], \"nl_ref_type\": \"ambiguous\", \"nl_ref_phrase\": \"countries\"}\n    {\"c_type\": \"mark\", \"c_name\": \"point chart\", \"nl_ref_type\": \"explicit\", \"nl_ref_phrase\": \"scatter plot\"}\n    {\"c_type\": \"mark\", \"c_name\": \"arc chart\", \"nl_ref_type\": \"explicit\", \"nl_ref_phrase\": \"pie chart\"}\n    {\"c_type\": \"transform\",\"c_name\": \"filter\",\"c_list\": [{\"field\": \"country\",\"oneOf\": [\"Iceland\",\"Norway\"]}],\"nl_ref_type\": \"explicit\",\"nl_ref_phrase\": \"for countries Iceland and Norway\"},\n    {\"c_type\": \"transform\",\"c_name\": \"filter\",\"c_list\": [{\"field\": \"country\",\"oneOf\": [\"Iceland\",\"Norway\"]}],\"nl_ref_type\": \"by_value\",\"nl_ref_phrase\": \"for Iceland and Norway\"},\n- the 'nl_ref_phrase' for 'ambiguous' columns should be equally near all ambiguous columns, not too near to one of the column since it would not be ambiguous.\n    good example: {\"column\": [\"country\",\"region\"], \"nl_ref_type\": \"ambiguous\", \"nl_ref_phrase\": \"location\"}\n    bad example: {\"column\": [\"country\",\"region\"], \"nl_ref_type\": \"ambiguous\", \"nl_ref_phrase\": \"region\"}\n- You only include given constraints and no other information. \n    For example, if a column name is not in the given constraint, it will not be included in the NL utterance.\n    Also, it a chart mark or chart encoding channel is not in the given constraint, it will not be included in the NL utterance.\n- all 'nl_ref_phrase' shoule be included in the 'nl_utterance'. \n\nThe output format is identical to the input format, but fill in the str blanks(\"...\").\n### Input:\n{\n  \"nl_utterance\": \"...\",\n  \"encoded_fields\": [\n    {\n      \"field\": \"Firearm deaths\",\n      \"type\": \"quantitative\",\n      \"nl_ref_type\": \"explicit\",\n      \"nl_ref_phrase\": \"...\"\n    },\n    {\n      \"field\": \"Division\",\n      \"type\": \"nominal\",\n      \"nl_ref_type\": \"explicit\",\n      \"nl_ref_phrase\": \"...\"\n    }\n  ],\n  \"constraints\": [\n    {\n      \"c_type\": \"mark\",\n      \"c_name\": \"point chart\",\n      \"c_list\": [\n        {\n          \"mark\": \"circle\",\n          \"encoding\": {\n            \"x\": {},\n            \"y\": {},\n            \"color\": {\n              \"type\": \"nominal\",\n              \"ignore\": true\n            },\n            \"size\": {\n              \"ignore\": true,\n              \"type\": \"quantitative\"\n            },\n            \"column\": {\n              \"ignore\": true,\n              \"type\": \"nominal\"\n            },\n            \"row\": {\n              \"ignore\": true,\n              \"type\": \"nominal\"\n            }\n          }\n        }\n      ],\n      \"nl_ref_type\": \"explicit\",\n      \"nl_ref_phrase\": \"...\"\n    }\n  ]\n}\n\n### Output:"
}