{
  "gpt_result": {
    "nl_utterance": "Show the trend of cases by year and week for the countries United Kingdom, France, Germany, and India.",
    "encoded_fields": [
      {
        "field": "year_week",
        "type": "nominal",
        "nl_ref_type": "explicit",
        "nl_ref_phrase": "year and week"
      },
      {
        "field": "country",
        "type": "nominal",
        "nl_ref_type": "explicit",
        "nl_ref_phrase": "countries"
      }
    ],
    "constraints": [
      {
        "c_type": "transform",
        "c_name": "filter",
        "c_list": [
          {
            "field": "country",
            "oneOf": [
              "United Kingdom",
              "France",
              "Germany",
              "India"
            ]
          }
        ],
        "nl_ref_type": "explicit",
        "nl_ref_phrase": "for the countries United Kingdom, France, Germany, and India"
      },
      {
        "c_type": "transform",
        "c_name": "filter",
        "c_list": [
          {
            "field": "indicator",
            "oneOf": [
              "cases"
            ]
          }
        ],
        "nl_ref_type": "explicit",
        "nl_ref_phrase": "trend of cases"
      }
    ]
  },
  "input": "Dataset Information: {\n  \"data samples\": [\n    {\n      \"country\": \"Afghanistan\",\n      \"country_code\": \"AFG\",\n      \"continent\": \"Asia\",\n      \"population\": 38928341,\n      \"indicator\": \"cases\",\n      \"weekly_count\": 0,\n      \"year_week\": \"2020-01\",\n      \"rate_14_day\": NaN,\n      \"cumulative_count\": 0,\n      \"source\": \"Epidemic intelligence, national weekly data\"\n    },\n    {\n      \"country\": \"Latvia\",\n      \"country_code\": \"LVA\",\n      \"continent\": \"Europe\",\n      \"population\": 1907675,\n      \"indicator\": \"deaths\",\n      \"weekly_count\": 1,\n      \"year_week\": \"2020-23\",\n      \"rate_14_day\": 1.5725949,\n      \"cumulative_count\": 25,\n      \"source\": \"Epidemic intelligence, national weekly data\"\n    },\n    {\n      \"country\": \"Iran\",\n      \"country_code\": \"IRN\",\n      \"continent\": \"Asia\",\n      \"population\": 83992953,\n      \"indicator\": \"cases\",\n      \"weekly_count\": 10525,\n      \"year_week\": \"2020-16\",\n      \"rate_14_day\": 28.555967,\n      \"cumulative_count\": 82211,\n      \"source\": \"Epidemic intelligence, national weekly data\"\n    },\n    {\n      \"country\": \"Seychelles\",\n      \"country_code\": \"SYC\",\n      \"continent\": \"Africa\",\n      \"population\": 98340,\n      \"indicator\": \"deaths\",\n      \"weekly_count\": 2,\n      \"year_week\": \"2021-05\",\n      \"rate_14_day\": 40.675209,\n      \"cumulative_count\": 7,\n      \"source\": \"Epidemic intelligence, national weekly data\"\n    },\n    {\n      \"country\": \"Canada\",\n      \"country_code\": \"CAN\",\n      \"continent\": \"America\",\n      \"population\": 37742157,\n      \"indicator\": \"cases\",\n      \"weekly_count\": 2550,\n      \"year_week\": \"2020-25\",\n      \"rate_14_day\": 14.938203,\n      \"cumulative_count\": 101326,\n      \"source\": \"Epidemic intelligence, national weekly data\"\n    }\n  ],\n  \"column names\": [\n    \"country\",\n    \"country_code\",\n    \"continent\",\n    \"population\",\n    \"indicator\",\n    \"weekly_count\",\n    \"year_week\",\n    \"rate_14_day\",\n    \"cumulative_count\",\n    \"source\"\n  ]\n}\n\nYour Job:\nI am developing a NL to Data Visualization Dataset. \nPlease help me generate natural language utterance for given dataset and constraints.\nDefinition about the Taks:\n- 'utterance' is what a user would say to make a chart.  One NL 'utterance' is in one or two sentences. Here are two examples from Others for reference:\n    I want to know how many orders there are by the quantity of the order.\n    Trend for average horsepower over time across different origin.\n- 'given dataset' is in form of column names, column type, range/unique values of the column.\n- 'constraints' are information about the chart that should be included in the utterance. \n    So we can find a reference phrase in the NL utterance that corresponds to the given constraints. \n- 'reference phrase' can be explicit, ambiguous, and by_value. 'ambiguous' means the phrase can map to more than one columns in the dataset, always a hypernym of column names(depending on the dataset values).\n    For example:\n    {\"column\": \"gdpPercap\", \"nl_ref_type\": \"explicit\", \"nl_ref_phrase\": \"GDP per capita\"},\n    {\"column\": [\"country\",\"continent\"], \"nl_ref_type\": \"ambiguous\", \"nl_ref_phrase\": \"region\"}\n    {\"column\": [\"country\",\"country_short_name\"], \"nl_ref_type\": \"ambiguous\", \"nl_ref_phrase\": \"countries\"}\n    {\"c_type\": \"mark\", \"c_name\": \"point chart\", \"nl_ref_type\": \"explicit\", \"nl_ref_phrase\": \"scatter plot\"}\n    {\"c_type\": \"mark\", \"c_name\": \"arc chart\", \"nl_ref_type\": \"explicit\", \"nl_ref_phrase\": \"pie chart\"}\n    {\"c_type\": \"transform\",\"c_name\": \"filter\",\"c_list\": [{\"field\": \"country\",\"oneOf\": [\"Iceland\",\"Norway\"]}],\"nl_ref_type\": \"explicit\",\"nl_ref_phrase\": \"for countries Iceland and Norway\"},\n    {\"c_type\": \"transform\",\"c_name\": \"filter\",\"c_list\": [{\"field\": \"country\",\"oneOf\": [\"Iceland\",\"Norway\"]}],\"nl_ref_type\": \"by_value\",\"nl_ref_phrase\": \"for Iceland and Norway\"},\n- the 'nl_ref_phrase' for 'ambiguous' columns should be equally near all ambiguous columns, not too near to one of the column since it would not be ambiguous.\n    good example: {\"column\": [\"country\",\"region\"], \"nl_ref_type\": \"ambiguous\", \"nl_ref_phrase\": \"location\"}\n    bad example: {\"column\": [\"country\",\"region\"], \"nl_ref_type\": \"ambiguous\", \"nl_ref_phrase\": \"region\"}\n- You only include given constraints and no other information. \n    For example, if a column name is not in the given constraint, it will not be included in the NL utterance.\n    Also, it a chart mark or chart encoding channel is not in the given constraint, it will not be included in the NL utterance.\n- all 'nl_ref_phrase' shoule be included in the 'nl_utterance'. \n\nThe output format is identical to the input format, but fill in the str blanks(\"...\").\n### Input:\n{\n  \"nl_utterance\": \"...\",\n  \"encoded_fields\": [\n    {\n      \"field\": \"year_week\",\n      \"type\": \"nominal\",\n      \"nl_ref_type\": \"explicit\",\n      \"nl_ref_phrase\": \"...\"\n    },\n    {\n      \"field\": \"country\",\n      \"type\": \"nominal\",\n      \"nl_ref_type\": \"explicit\",\n      \"nl_ref_phrase\": \"...\"\n    }\n  ],\n  \"constraints\": [\n    {\n      \"c_type\": \"transform\",\n      \"c_name\": \"filter\",\n      \"c_list\": [\n        {\n          \"field\": \"country\",\n          \"oneOf\": [\n            \"United Kingdom\",\n            \"France\",\n            \"Germany\",\n            \"India\"\n          ]\n        }\n      ],\n      \"nl_ref_type\": \"explicit\",\n      \"nl_ref_phrase\": \"...\"\n    },\n    {\n      \"c_type\": \"transform\",\n      \"c_name\": \"filter\",\n      \"c_list\": [\n        {\n          \"field\": \"indicator\",\n          \"oneOf\": [\n            \"cases\"\n          ]\n        }\n      ],\n      \"nl_ref_type\": \"explicit\",\n      \"nl_ref_phrase\": \"...\"\n    }\n  ]\n}\n\n### Output:"
}