{
  "gpt_result": {
    "nl_utterance": "Create a scatter plot with Component 1 on the x-axis and Component 2 on the y-axis, colored by location.",
    "encoded_fields": [
      {
        "field": "Component 1",
        "type": "quantitative",
        "nl_ref_type": "explicit",
        "nl_ref_phrase": "Component 1"
      },
      {
        "field": "Component 2",
        "type": "quantitative",
        "nl_ref_type": "explicit",
        "nl_ref_phrase": "Component 2"
      },
      {
        "field": [
          "RegionName",
          "ConstituencyName"
        ],
        "type": "nominal",
        "nl_ref_type": "ambiguous",
        "nl_ref_phrase": "location"
      }
    ],
    "constraints": [
      {
        "c_type": "mark",
        "c_name": "point chart",
        "c_list": [
          {
            "mark": "circle",
            "encoding": {
              "x": {},
              "y": {},
              "color": {
                "type": "nominal",
                "ignore": true
              },
              "size": {
                "ignore": true,
                "type": "quantitative"
              },
              "column": {
                "ignore": true,
                "type": "nominal"
              },
              "row": {
                "ignore": true,
                "type": "nominal"
              }
            }
          }
        ],
        "nl_ref_type": "explicit",
        "nl_ref_phrase": "scatter plot"
      }
    ]
  },
  "input": "Dataset Information: {\n  \"data samples\": [\n    {\n      \"Unnamed: 0\": 0,\n      \"ConstituencyName\": \"Aldershot\",\n      \"RegionName\": \"South East\",\n      \"MedianHPrice\": 335000,\n      \"MedianWeeklyWage\": 576,\n      \"YearlySalary\": 29968,\n      \"Housepriceincreaseover5years\": 7000,\n      \"%Growth5years\": 2,\n      \"%affordability\": 9,\n      \"Component 1\": 1.2496118035031694,\n      \"Component 2\": -0.5133032835863713\n    },\n    {\n      \"Unnamed: 0\": 386,\n      \"ConstituencyName\": \"Sefton Central\",\n      \"RegionName\": \"North West\",\n      \"MedianHPrice\": 233000,\n      \"MedianWeeklyWage\": 411,\n      \"YearlySalary\": 21377,\n      \"Housepriceincreaseover5years\": 6200,\n      \"%Growth5years\": 3,\n      \"%affordability\": 9,\n      \"Component 1\": -1.4229268939496458,\n      \"Component 2\": 0.9429733220187294\n    },\n    {\n      \"Unnamed: 0\": 182,\n      \"ConstituencyName\": \"Gloucester\",\n      \"RegionName\": \"South West\",\n      \"MedianHPrice\": 222000,\n      \"MedianWeeklyWage\": 488,\n      \"YearlySalary\": 25355,\n      \"Housepriceincreaseover5years\": 7200,\n      \"%Growth5years\": 4,\n      \"%affordability\": 11,\n      \"Component 1\": -0.7279706681711441,\n      \"Component 2\": 0.4735089044982016\n    },\n    {\n      \"Unnamed: 0\": 427,\n      \"ConstituencyName\": \"Southend West\",\n      \"RegionName\": \"East of England\",\n      \"MedianHPrice\": 350000,\n      \"MedianWeeklyWage\": 478,\n      \"YearlySalary\": 24851,\n      \"Housepriceincreaseover5years\": 10600,\n      \"%Growth5years\": 4,\n      \"%affordability\": 7,\n      \"Component 1\": 0.1016219974822475,\n      \"Component 2\": 1.6078459433325207\n    },\n    {\n      \"Unnamed: 0\": 271,\n      \"ConstituencyName\": \"Luton South\",\n      \"RegionName\": \"East of England\",\n      \"MedianHPrice\": 276000,\n      \"MedianWeeklyWage\": 503,\n      \"YearlySalary\": 26177,\n      \"Housepriceincreaseover5years\": 10200,\n      \"%Growth5years\": 5,\n      \"%affordability\": 9,\n      \"Component 1\": -0.1547739242394985,\n      \"Component 2\": 1.2972908077324403\n    }\n  ],\n  \"column names\": [\n    \"Unnamed: 0\",\n    \"ConstituencyName\",\n    \"RegionName\",\n    \"MedianHPrice\",\n    \"MedianWeeklyWage\",\n    \"YearlySalary\",\n    \"Housepriceincreaseover5years\",\n    \"%Growth5years\",\n    \"%affordability\",\n    \"Component 1\",\n    \"Component 2\"\n  ]\n}\n\nYour Job:\nI am developing a NL to Data Visualization Dataset. \nPlease help me generate natural language utterance for given dataset and constraints.\nDefinition about the Taks:\n- 'utterance' is what a user would say to make a chart. It should be a queries structure. One NL 'utterance' is in one or two sentences. Here are two examples from Queries for reference:\n    Scatter Production Budget vs Worldwide Gross, sliced by Content Rating.\n    Count the movies by how long they are.\n- 'given dataset' is in form of column names, column type, range/unique values of the column.\n- 'constraints' are information about the chart that should be included in the utterance. \n    So we can find a reference phrase in the NL utterance that corresponds to the given constraints. \n- 'reference phrase' can be explicit, ambiguous, and by_value. 'ambiguous' means the phrase can map to more than one columns in the dataset, always a hypernym of column names(depending on the dataset values).\n    For example:\n    {\"column\": \"gdpPercap\", \"nl_ref_type\": \"explicit\", \"nl_ref_phrase\": \"GDP per capita\"},\n    {\"column\": [\"country\",\"continent\"], \"nl_ref_type\": \"ambiguous\", \"nl_ref_phrase\": \"region\"}\n    {\"column\": [\"country\",\"country_short_name\"], \"nl_ref_type\": \"ambiguous\", \"nl_ref_phrase\": \"countries\"}\n    {\"c_type\": \"mark\", \"c_name\": \"point chart\", \"nl_ref_type\": \"explicit\", \"nl_ref_phrase\": \"scatter plot\"}\n    {\"c_type\": \"mark\", \"c_name\": \"arc chart\", \"nl_ref_type\": \"explicit\", \"nl_ref_phrase\": \"pie chart\"}\n    {\"c_type\": \"transform\",\"c_name\": \"filter\",\"c_list\": [{\"field\": \"country\",\"oneOf\": [\"Iceland\",\"Norway\"]}],\"nl_ref_type\": \"explicit\",\"nl_ref_phrase\": \"for countries Iceland and Norway\"},\n    {\"c_type\": \"transform\",\"c_name\": \"filter\",\"c_list\": [{\"field\": \"country\",\"oneOf\": [\"Iceland\",\"Norway\"]}],\"nl_ref_type\": \"by_value\",\"nl_ref_phrase\": \"for Iceland and Norway\"},\n- the 'nl_ref_phrase' for 'ambiguous' columns should be equally near all ambiguous columns, not too near to one of the column since it would not be ambiguous.\n    good example: {\"column\": [\"country\",\"region\"], \"nl_ref_type\": \"ambiguous\", \"nl_ref_phrase\": \"location\"}\n    bad example: {\"column\": [\"country\",\"region\"], \"nl_ref_type\": \"ambiguous\", \"nl_ref_phrase\": \"region\"}\n- You only include given constraints and no other information. \n    For example, if a column name is not in the given constraint, it will not be included in the NL utterance.\n    Also, it a chart mark or chart encoding channel is not in the given constraint, it will not be included in the NL utterance.\n- all 'nl_ref_phrase' shoule be included in the 'nl_utterance'. \n\nThe output format is identical to the input format, but fill in the str blanks(\"...\").\n### Input:\n{\n  \"nl_utterance\": \"...\",\n  \"encoded_fields\": [\n    {\n      \"field\": \"Component 1\",\n      \"type\": \"quantitative\",\n      \"nl_ref_type\": \"explicit\",\n      \"nl_ref_phrase\": \"...\"\n    },\n    {\n      \"field\": \"Component 2\",\n      \"type\": \"quantitative\",\n      \"nl_ref_type\": \"explicit\",\n      \"nl_ref_phrase\": \"...\"\n    },\n    {\n      \"field\": [\n        \"RegionName\",\n        \"ConstituencyName\"\n      ],\n      \"type\": \"nominal\",\n      \"nl_ref_type\": \"ambiguous\",\n      \"nl_ref_phrase\": \"...\"\n    }\n  ],\n  \"constraints\": [\n    {\n      \"c_type\": \"mark\",\n      \"c_name\": \"point chart\",\n      \"c_list\": [\n        {\n          \"mark\": \"circle\",\n          \"encoding\": {\n            \"x\": {},\n            \"y\": {},\n            \"color\": {\n              \"type\": \"nominal\",\n              \"ignore\": true\n            },\n            \"size\": {\n              \"ignore\": true,\n              \"type\": \"quantitative\"\n            },\n            \"column\": {\n              \"ignore\": true,\n              \"type\": \"nominal\"\n            },\n            \"row\": {\n              \"ignore\": true,\n              \"type\": \"nominal\"\n            }\n          }\n        }\n      ],\n      \"nl_ref_type\": \"explicit\",\n      \"nl_ref_phrase\": \"...\"\n    }\n  ]\n}\n\n### Output:"
}