{
  "gpt_result": {
    "nl_utterance": "Show me the total number of cases that were confirmed.",
    "encoded_fields": [
      {
        "field": "total",
        "type": "quantitative",
        "nl_ref_type": "explicit",
        "nl_ref_phrase": "total number of"
      }
    ],
    "constraints": [
      {
        "c_type": "transform",
        "c_name": "filter",
        "c_list": [
          {
            "field": "classificacao",
            "equal": "confirmados"
          }
        ],
        "nl_ref_type": "by_value",
        "nl_ref_phrase": "confirmed cases"
      }
    ]
  },
  "input": "Dataset Information: {\n  \"data samples\": [\n    {\n      \"data\": \"2020-04-13\",\n      \"classificacao\": \"confirmados\",\n      \"faixa_etaria\": \"00 a 19\",\n      \"feminino\": 0,\n      \"masculino\": 3,\n      \"total\": 3,\n      \"ultima_atualizacao\": false\n    },\n    {\n      \"data\": \"2020-06-15\",\n      \"classificacao\": \"mortos\",\n      \"faixa_etaria\": \"50 a 59\",\n      \"feminino\": 25,\n      \"masculino\": 62,\n      \"total\": 87,\n      \"ultima_atualizacao\": false\n    },\n    {\n      \"data\": \"2020-05-03\",\n      \"classificacao\": \"mortos\",\n      \"faixa_etaria\": \"70 a 79\",\n      \"feminino\": 4,\n      \"masculino\": 8,\n      \"total\": 12,\n      \"ultima_atualizacao\": false\n    },\n    {\n      \"data\": \"2020-05-05\",\n      \"classificacao\": \"mortos\",\n      \"faixa_etaria\": \"70 a 79\",\n      \"feminino\": 5,\n      \"masculino\": 8,\n      \"total\": 13,\n      \"ultima_atualizacao\": false\n    },\n    {\n      \"data\": \"2020-06-21\",\n      \"classificacao\": \"mortos\",\n      \"faixa_etaria\": \"40 a 49\",\n      \"feminino\": 29,\n      \"masculino\": 50,\n      \"total\": 79,\n      \"ultima_atualizacao\": false\n    }\n  ],\n  \"column names\": [\n    \"data\",\n    \"classificacao\",\n    \"faixa_etaria\",\n    \"feminino\",\n    \"masculino\",\n    \"total\",\n    \"ultima_atualizacao\"\n  ]\n}\n\nYour Job:\nI am developing a NL to Data Visualization Dataset. \nPlease help me generate natural language utterance for given dataset and constraints.\nDefinition about the Taks:\n- 'utterance' is what a user would say to make a chart.  One NL 'utterance' is in one or two sentences. Here are two examples from Others for reference:\n    Trend for average horsepower over time across different origin.\n    I want to know how many orders there are by the quantity of the order.\n- 'given dataset' is in form of column names, column type, range/unique values of the column.\n- 'constraints' are information about the chart that should be included in the utterance. \n    So we can find a reference phrase in the NL utterance that corresponds to the given constraints. \n- 'reference phrase' can be explicit, ambiguous, and by_value. 'ambiguous' means the phrase can map to more than one columns in the dataset, always a hypernym of column names(depending on the dataset values).\n    For example:\n    {\"column\": \"gdpPercap\", \"nl_ref_type\": \"explicit\", \"nl_ref_phrase\": \"GDP per capita\"},\n    {\"column\": [\"country\",\"continent\"], \"nl_ref_type\": \"ambiguous\", \"nl_ref_phrase\": \"region\"}\n    {\"column\": [\"country\",\"country_short_name\"], \"nl_ref_type\": \"ambiguous\", \"nl_ref_phrase\": \"countries\"}\n    {\"c_type\": \"mark\", \"c_name\": \"point chart\", \"nl_ref_type\": \"explicit\", \"nl_ref_phrase\": \"scatter plot\"}\n    {\"c_type\": \"mark\", \"c_name\": \"arc chart\", \"nl_ref_type\": \"explicit\", \"nl_ref_phrase\": \"pie chart\"}\n    {\"c_type\": \"transform\",\"c_name\": \"filter\",\"c_list\": [{\"field\": \"country\",\"oneOf\": [\"Iceland\",\"Norway\"]}],\"nl_ref_type\": \"explicit\",\"nl_ref_phrase\": \"for countries Iceland and Norway\"},\n    {\"c_type\": \"transform\",\"c_name\": \"filter\",\"c_list\": [{\"field\": \"country\",\"oneOf\": [\"Iceland\",\"Norway\"]}],\"nl_ref_type\": \"by_value\",\"nl_ref_phrase\": \"for Iceland and Norway\"},\n- the 'nl_ref_phrase' for 'ambiguous' columns should be equally near all ambiguous columns, not too near to one of the column since it would not be ambiguous.\n    good example: {\"column\": [\"country\",\"region\"], \"nl_ref_type\": \"ambiguous\", \"nl_ref_phrase\": \"location\"}\n    bad example: {\"column\": [\"country\",\"region\"], \"nl_ref_type\": \"ambiguous\", \"nl_ref_phrase\": \"region\"}\n- You only include given constraints and no other information. \n    For example, if a column name is not in the given constraint, it will not be included in the NL utterance.\n    Also, it a chart mark or chart encoding channel is not in the given constraint, it will not be included in the NL utterance.\n- all 'nl_ref_phrase' shoule be included in the 'nl_utterance'. \n\nThe output format is identical to the input format, but fill in the str blanks(\"...\").\n### Input:\n{\n  \"nl_utterance\": \"...\",\n  \"encoded_fields\": [\n    {\n      \"field\": \"total\",\n      \"type\": \"quantitative\",\n      \"nl_ref_type\": \"explicit\",\n      \"nl_ref_phrase\": \"...\"\n    }\n  ],\n  \"constraints\": [\n    {\n      \"c_type\": \"transform\",\n      \"c_name\": \"filter\",\n      \"c_list\": [\n        {\n          \"field\": \"classificacao\",\n          \"equal\": \"confirmados\"\n        }\n      ],\n      \"nl_ref_type\": \"by_value\",\n      \"nl_ref_phrase\": \"...\"\n    }\n  ]\n}\n\n### Output:"
}