{
  "gpt_result": {
    "nl_utterance": "Show the 7-day moving average number of cases over time for the UK, France, Germany, and Portugal. Use a trendline to visualize the data for each country.",
    "encoded_fields": [
      {
        "field": "cases_ma7",
        "type": "quantitative",
        "nl_ref_type": "explicit",
        "nl_ref_phrase": "7-day moving average number of cases"
      },
      {
        "field": "country",
        "type": "nominal",
        "nl_ref_type": "explicit",
        "nl_ref_phrase": "country"
      }
    ],
    "constraints": [
      {
        "c_type": "task",
        "c_name": "trend",
        "c_list": [
          {
            "mark": [
              "bar",
              "line",
              "area"
            ],
            "encoding": {
              "x": {
                "type": "temporal"
              }
            }
          }
        ],
        "nl_ref_type": "explicit",
        "nl_ref_phrase": "trendline"
      },
      {
        "c_type": "transform",
        "c_name": "filter",
        "c_list": [
          {
            "field": "country",
            "oneOf": [
              "UK",
              "France",
              "Germany",
              "Portugal"
            ]
          }
        ],
        "nl_ref_type": "explicit",
        "nl_ref_phrase": "for the UK, France, Germany, and Portugal"
      }
    ]
  },
  "input": "Dataset Information: {\n  \"data samples\": [\n    {\n      \"date\": 20191231,\n      \"daterep\": \"31/12/2019\",\n      \"date2\": \"2019-12-31\",\n      \"day\": 31,\n      \"days\": 1,\n      \"month\": 12,\n      \"year\": 2019,\n      \"cases\": 0,\n      \"deaths\": 0,\n      \"country\": \"Afghanistan\",\n      \"geoid\": \"AF\",\n      \"countryterritorycode\": \"AFG\",\n      \"popdata2019\": 38041757.0,\n      \"continentexp\": \"Asia\",\n      \"cumulative_number_for_14_days_of\": NaN,\n      \"pop\": 38041757.0,\n      \"poprank\": 37.0,\n      \"t\": 1,\n      \"c\": 1,\n      \"cases_cml\": 0,\n      \"cases_ma7\": NaN,\n      \"cases_pop\": 0.0,\n      \"cases_cml_pop\": 0.0,\n      \"deaths_cml\": 0,\n      \"deaths_ma7\": NaN,\n      \"deaths_pop\": 0.0,\n      \"deaths_cml_pop\": 0.0,\n      \"deaths_rate\": NaN,\n      \"neighbours\": 0,\n      \"p20\": 0\n    },\n    {\n      \"date\": 20200620,\n      \"daterep\": \"20/06/2020\",\n      \"date2\": \"2020-6-20\",\n      \"day\": 20,\n      \"days\": 173,\n      \"month\": 6,\n      \"year\": 2020,\n      \"cases\": 643,\n      \"deaths\": 18,\n      \"country\": \"Cameroon\",\n      \"geoid\": \"CM\",\n      \"countryterritorycode\": \"CMR\",\n      \"popdata2019\": 25876387.0,\n      \"continentexp\": \"Africa\",\n      \"cumulative_number_for_14_days_of\": 14.229189,\n      \"pop\": 25876387.0,\n      \"poprank\": 52.0,\n      \"t\": 173,\n      \"c\": 35,\n      \"cases_cml\": 11281,\n      \"cases_ma7\": 336.0,\n      \"cases_pop\": 2.4848909e-05,\n      \"cases_cml_pop\": 0.00043595731,\n      \"deaths_cml\": 300,\n      \"deaths_ma7\": 12.285714,\n      \"deaths_pop\": 6.9561486e-07,\n      \"deaths_cml_pop\": 1.1593582e-05,\n      \"deaths_rate\": 0.026593387,\n      \"neighbours\": 0,\n      \"p20\": 0\n    },\n    {\n      \"date\": 20200401,\n      \"daterep\": \"01/04/2020\",\n      \"date2\": \"2020-4-1\",\n      \"day\": 1,\n      \"days\": 93,\n      \"month\": 4,\n      \"year\": 2020,\n      \"cases\": 4053,\n      \"deaths\": 839,\n      \"country\": \"Italy\",\n      \"geoid\": \"IT\",\n      \"countryterritorycode\": \"ITA\",\n      \"popdata2019\": 60359546.0,\n      \"continentexp\": \"Europe\",\n      \"cumulative_number_for_14_days_of\": 123.07249,\n      \"pop\": 60359546.0,\n      \"poprank\": 23.0,\n      \"t\": 93,\n      \"c\": 100,\n      \"cases_cml\": 105792,\n      \"cases_ma7\": 5980.7144,\n      \"cases_pop\": 6.7147623e-05,\n      \"cases_cml_pop\": 0.001752697,\n      \"deaths_cml\": 12430,\n      \"deaths_ma7\": 907.57141,\n      \"deaths_pop\": 1.3900039e-05,\n      \"deaths_cml_pop\": 0.00020593264,\n      \"deaths_rate\": 0.11749471,\n      \"neighbours\": 1,\n      \"p20\": 0\n    },\n    {\n      \"date\": 20200316,\n      \"daterep\": \"16/03/2020\",\n      \"date2\": \"2020-3-16\",\n      \"day\": 16,\n      \"days\": 77,\n      \"month\": 3,\n      \"year\": 2020,\n      \"cases\": 3,\n      \"deaths\": 0,\n      \"country\": \"Kazakhstan\",\n      \"geoid\": \"KZ\",\n      \"countryterritorycode\": \"KAZ\",\n      \"popdata2019\": 18551428.0,\n      \"continentexp\": \"Asia\",\n      \"cumulative_number_for_14_days_of\": NaN,\n      \"pop\": 18551428.0,\n      \"poprank\": 63.0,\n      \"t\": 77,\n      \"c\": 105,\n      \"cases_cml\": 9,\n      \"cases_ma7\": NaN,\n      \"cases_pop\": 1.6171262e-07,\n      \"cases_cml_pop\": 4.8513783e-07,\n      \"deaths_cml\": 0,\n      \"deaths_ma7\": NaN,\n      \"deaths_pop\": 0.0,\n      \"deaths_cml_pop\": 0.0,\n      \"deaths_rate\": 0.0,\n      \"neighbours\": 0,\n      \"p20\": 0\n    },\n    {\n      \"date\": 20201013,\n      \"daterep\": \"13/10/2020\",\n      \"date2\": \"2020-10-13\",\n      \"day\": 13,\n      \"days\": 288,\n      \"month\": 10,\n      \"year\": 2020,\n      \"cases\": 49,\n      \"deaths\": 0,\n      \"country\": \"Maldives\",\n      \"geoid\": \"MV\",\n      \"countryterritorycode\": \"MDV\",\n      \"popdata2019\": 530957.0,\n      \"continentexp\": \"Asia\",\n      \"cumulative_number_for_14_days_of\": 148.03459,\n      \"pop\": 530957.0,\n      \"poprank\": 169.0,\n      \"t\": 288,\n      \"c\": 122,\n      \"cases_cml\": 10943,\n      \"cases_ma7\": 59.0,\n      \"cases_pop\": 9.2286195e-05,\n      \"cases_cml_pop\": 0.020609954,\n      \"deaths_cml\": 35,\n      \"deaths_ma7\": 0.14285715,\n      \"deaths_pop\": 0.0,\n      \"deaths_cml_pop\": 6.5918706e-05,\n      \"deaths_rate\": 0.0031983918,\n      \"neighbours\": 0,\n      \"p20\": 0\n    }\n  ],\n  \"column names\": [\n    \"date\",\n    \"daterep\",\n    \"date2\",\n    \"day\",\n    \"days\",\n    \"month\",\n    \"year\",\n    \"cases\",\n    \"deaths\",\n    \"country\",\n    \"geoid\",\n    \"countryterritorycode\",\n    \"popdata2019\",\n    \"continentexp\",\n    \"cumulative_number_for_14_days_of\",\n    \"pop\",\n    \"poprank\",\n    \"t\",\n    \"c\",\n    \"cases_cml\",\n    \"cases_ma7\",\n    \"cases_pop\",\n    \"cases_cml_pop\",\n    \"deaths_cml\",\n    \"deaths_ma7\",\n    \"deaths_pop\",\n    \"deaths_cml_pop\",\n    \"deaths_rate\",\n    \"neighbours\",\n    \"p20\"\n  ]\n}\n\nYour Job:\nI am developing a NL to Data Visualization Dataset. \nPlease help me generate natural language utterance for given dataset and constraints.\nDefinition about the Taks:\n- 'utterance' is what a user would say to make a chart. It should be a commands structure. One NL 'utterance' is in one or two sentences. Here are two examples from Commands for reference:\n    Graph to show the acceleration for cars from different countries segregated based on number of cylinders.\n    For each country show the relationship between average acceleration and number of cylinders.\n- 'given dataset' is in form of column names, column type, range/unique values of the column.\n- 'constraints' are information about the chart that should be included in the utterance. \n    So we can find a reference phrase in the NL utterance that corresponds to the given constraints. \n- 'reference phrase' can be explicit, ambiguous, and by_value. 'ambiguous' means the phrase can map to more than one columns in the dataset, always a hypernym of column names(depending on the dataset values).\n    For example:\n    {\"column\": \"gdpPercap\", \"nl_ref_type\": \"explicit\", \"nl_ref_phrase\": \"GDP per capita\"},\n    {\"column\": [\"country\",\"continent\"], \"nl_ref_type\": \"ambiguous\", \"nl_ref_phrase\": \"region\"}\n    {\"column\": [\"country\",\"country_short_name\"], \"nl_ref_type\": \"ambiguous\", \"nl_ref_phrase\": \"countries\"}\n    {\"c_type\": \"mark\", \"c_name\": \"point chart\", \"nl_ref_type\": \"explicit\", \"nl_ref_phrase\": \"scatter plot\"}\n    {\"c_type\": \"mark\", \"c_name\": \"arc chart\", \"nl_ref_type\": \"explicit\", \"nl_ref_phrase\": \"pie chart\"}\n    {\"c_type\": \"transform\",\"c_name\": \"filter\",\"c_list\": [{\"field\": \"country\",\"oneOf\": [\"Iceland\",\"Norway\"]}],\"nl_ref_type\": \"explicit\",\"nl_ref_phrase\": \"for countries Iceland and Norway\"},\n    {\"c_type\": \"transform\",\"c_name\": \"filter\",\"c_list\": [{\"field\": \"country\",\"oneOf\": [\"Iceland\",\"Norway\"]}],\"nl_ref_type\": \"by_value\",\"nl_ref_phrase\": \"for Iceland and Norway\"},\n- the 'nl_ref_phrase' for 'ambiguous' columns should be equally near all ambiguous columns, not too near to one of the column since it would not be ambiguous.\n    good example: {\"column\": [\"country\",\"region\"], \"nl_ref_type\": \"ambiguous\", \"nl_ref_phrase\": \"location\"}\n    bad example: {\"column\": [\"country\",\"region\"], \"nl_ref_type\": \"ambiguous\", \"nl_ref_phrase\": \"region\"}\n- You only include given constraints and no other information. \n    For example, if a column name is not in the given constraint, it will not be included in the NL utterance.\n    Also, it a chart mark or chart encoding channel is not in the given constraint, it will not be included in the NL utterance.\n- all 'nl_ref_phrase' shoule be included in the 'nl_utterance'. \n\nThe output format is identical to the input format, but fill in the str blanks(\"...\").\n### Input:\n{\n  \"nl_utterance\": \"...\",\n  \"encoded_fields\": [\n    {\n      \"field\": \"cases_ma7\",\n      \"type\": \"quantitative\",\n      \"nl_ref_type\": \"explicit\",\n      \"nl_ref_phrase\": \"...\"\n    },\n    {\n      \"field\": \"country\",\n      \"type\": \"nominal\",\n      \"nl_ref_type\": \"explicit\",\n      \"nl_ref_phrase\": \"...\"\n    }\n  ],\n  \"constraints\": [\n    {\n      \"c_type\": \"task\",\n      \"c_name\": \"trend\",\n      \"c_list\": [\n        {\n          \"mark\": [\n            \"bar\",\n            \"line\",\n            \"area\"\n          ],\n          \"encoding\": {\n            \"x\": {\n              \"type\": \"temporal\"\n            }\n          }\n        }\n      ],\n      \"nl_ref_type\": \"explicit\",\n      \"nl_ref_phrase\": \"...\"\n    },\n    {\n      \"c_type\": \"transform\",\n      \"c_name\": \"filter\",\n      \"c_list\": [\n        {\n          \"field\": \"country\",\n          \"oneOf\": [\n            \"UK\",\n            \"France\",\n            \"Germany\",\n            \"Portugal\"\n          ]\n        }\n      ],\n      \"nl_ref_type\": \"explicit\",\n      \"nl_ref_phrase\": \"...\"\n    }\n  ]\n}\n\n### Output:"
}