{
  "gpt_result": {
    "nl_utterance": "Can you create a bar chart comparing horsepower and acceleration for different cylinder configurations?",
    "encoded_fields": [
      {
        "field": [
          "Acceleration",
          "Horsepower"
        ],
        "type": "quantitative",
        "nl_ref_type": "ambiguous",
        "nl_ref_phrase": "horsepower and acceleration"
      },
      {
        "field": "Cylinders",
        "type": "quantitative",
        "nl_ref_type": "explicit",
        "nl_ref_phrase": "cylinder configurations"
      }
    ],
    "constraints": [
      {
        "c_type": "mark",
        "c_name": "bar chart",
        "c_list": [
          {
            "mark": "bar",
            "encoding": {
              "x": {},
              "y": {
                "type": "quantitative"
              },
              "color": {
                "type": "nominal",
                "ignore": true
              },
              "column": {
                "ignore": true,
                "type": "nominal"
              },
              "row": {
                "ignore": true,
                "type": "nominal"
              }
            },
            "unique_map": {
              "x": "y"
            }
          },
          {
            "mark": "bar",
            "encoding": {
              "y": {},
              "x": {
                "type": "quantitative"
              },
              "color": {
                "type": "nominal",
                "ignore": true
              },
              "column": {
                "ignore": true,
                "type": "nominal"
              },
              "row": {
                "ignore": true,
                "type": "nominal"
              }
            },
            "unique_map": {
              "y": "x"
            }
          }
        ],
        "nl_ref_type": "explicit",
        "nl_ref_phrase": "bar chart"
      }
    ]
  },
  "input": "Dataset Information: {\n  \"data samples\": [\n    {\n      \"Name\": \"chevrolet chevelle malibu\",\n      \"Miles_per_Gallon\": 18.0,\n      \"Cylinders\": 8,\n      \"Displacement\": 307.0,\n      \"Horsepower\": 130.0,\n      \"Weight_in_lbs\": 3504,\n      \"Acceleration\": 12.0,\n      \"Year\": \"1970-01-01T00:00:00\",\n      \"Origin\": \"USA\"\n    },\n    {\n      \"Name\": \"plymouth fury gran sedan\",\n      \"Miles_per_Gallon\": 14.0,\n      \"Cylinders\": 8,\n      \"Displacement\": 318.0,\n      \"Horsepower\": 150.0,\n      \"Weight_in_lbs\": 4237,\n      \"Acceleration\": 14.5,\n      \"Year\": \"1973-01-01T00:00:00\",\n      \"Origin\": \"USA\"\n    },\n    {\n      \"Name\": \"dodge st. regis\",\n      \"Miles_per_Gallon\": 18.2,\n      \"Cylinders\": 8,\n      \"Displacement\": 318.0,\n      \"Horsepower\": 135.0,\n      \"Weight_in_lbs\": 3830,\n      \"Acceleration\": 15.2,\n      \"Year\": \"1979-01-01T00:00:00\",\n      \"Origin\": \"USA\"\n    },\n    {\n      \"Name\": \"dodge aspen\",\n      \"Miles_per_Gallon\": 19.1,\n      \"Cylinders\": 6,\n      \"Displacement\": 225.0,\n      \"Horsepower\": 90.0,\n      \"Weight_in_lbs\": 3381,\n      \"Acceleration\": 18.7,\n      \"Year\": \"1980-01-01T00:00:00\",\n      \"Origin\": \"USA\"\n    },\n    {\n      \"Name\": \"buick skylark 320\",\n      \"Miles_per_Gallon\": 15.0,\n      \"Cylinders\": 8,\n      \"Displacement\": 350.0,\n      \"Horsepower\": 165.0,\n      \"Weight_in_lbs\": 3693,\n      \"Acceleration\": 11.5,\n      \"Year\": \"1970-01-01T00:00:00\",\n      \"Origin\": \"USA\"\n    }\n  ],\n  \"column names\": [\n    \"Name\",\n    \"Miles_per_Gallon\",\n    \"Cylinders\",\n    \"Displacement\",\n    \"Horsepower\",\n    \"Weight_in_lbs\",\n    \"Acceleration\",\n    \"Year\",\n    \"Origin\"\n  ]\n}\n\nYour Job:\nI am developing a NL to Data Visualization Dataset. \nPlease help me generate natural language utterance for given dataset and constraints.\nDefinition about the Taks:\n- 'utterance' is what a user would say to make a chart. It should be a questions structure. One NL 'utterance' is in one or two sentences. Here are two examples from Questions for reference:\n    What is our profit based on shipping mode by customer segment?\n    How does displacement relate to fuel economy for cars from Europe vs. USA?\n- 'given dataset' is in form of column names, column type, range/unique values of the column.\n- 'constraints' are information about the chart that should be included in the utterance. \n    So we can find a reference phrase in the NL utterance that corresponds to the given constraints. \n- 'reference phrase' can be explicit, ambiguous, and by_value. 'ambiguous' means the phrase can map to more than one columns in the dataset, always a hypernym of column names(depending on the dataset values).\n    For example:\n    {\"column\": \"gdpPercap\", \"nl_ref_type\": \"explicit\", \"nl_ref_phrase\": \"GDP per capita\"},\n    {\"column\": [\"country\",\"continent\"], \"nl_ref_type\": \"ambiguous\", \"nl_ref_phrase\": \"region\"}\n    {\"column\": [\"country\",\"country_short_name\"], \"nl_ref_type\": \"ambiguous\", \"nl_ref_phrase\": \"countries\"}\n    {\"c_type\": \"mark\", \"c_name\": \"point chart\", \"nl_ref_type\": \"explicit\", \"nl_ref_phrase\": \"scatter plot\"}\n    {\"c_type\": \"mark\", \"c_name\": \"arc chart\", \"nl_ref_type\": \"explicit\", \"nl_ref_phrase\": \"pie chart\"}\n    {\"c_type\": \"transform\",\"c_name\": \"filter\",\"c_list\": [{\"field\": \"country\",\"oneOf\": [\"Iceland\",\"Norway\"]}],\"nl_ref_type\": \"explicit\",\"nl_ref_phrase\": \"for countries Iceland and Norway\"},\n    {\"c_type\": \"transform\",\"c_name\": \"filter\",\"c_list\": [{\"field\": \"country\",\"oneOf\": [\"Iceland\",\"Norway\"]}],\"nl_ref_type\": \"by_value\",\"nl_ref_phrase\": \"for Iceland and Norway\"},\n- the 'nl_ref_phrase' for 'ambiguous' columns should be equally near all ambiguous columns, not too near to one of the column since it would not be ambiguous.\n    good example: {\"column\": [\"country\",\"region\"], \"nl_ref_type\": \"ambiguous\", \"nl_ref_phrase\": \"location\"}\n    bad example: {\"column\": [\"country\",\"region\"], \"nl_ref_type\": \"ambiguous\", \"nl_ref_phrase\": \"region\"}\n- You only include given constraints and no other information. \n    For example, if a column name is not in the given constraint, it will not be included in the NL utterance.\n    Also, it a chart mark or chart encoding channel is not in the given constraint, it will not be included in the NL utterance.\n- all 'nl_ref_phrase' shoule be included in the 'nl_utterance'. \n\nThe output format is identical to the input format, but fill in the str blanks(\"...\").\n### Input:\n{\n  \"nl_utterance\": \"...\",\n  \"encoded_fields\": [\n    {\n      \"field\": [\n        \"Acceleration\",\n        \"Horsepower\"\n      ],\n      \"type\": \"quantitative\",\n      \"nl_ref_type\": \"ambiguous\",\n      \"nl_ref_phrase\": \"...\"\n    },\n    {\n      \"field\": \"Cylinders\",\n      \"type\": \"quantitative\",\n      \"nl_ref_type\": \"explicit\",\n      \"nl_ref_phrase\": \"...\"\n    }\n  ],\n  \"constraints\": [\n    {\n      \"c_type\": \"mark\",\n      \"c_name\": \"bar chart\",\n      \"c_list\": [\n        {\n          \"mark\": \"bar\",\n          \"encoding\": {\n            \"x\": {},\n            \"y\": {\n              \"type\": \"quantitative\"\n            },\n            \"color\": {\n              \"type\": \"nominal\",\n              \"ignore\": true\n            },\n            \"column\": {\n              \"ignore\": true,\n              \"type\": \"nominal\"\n            },\n            \"row\": {\n              \"ignore\": true,\n              \"type\": \"nominal\"\n            }\n          },\n          \"unique_map\": {\n            \"x\": \"y\"\n          }\n        },\n        {\n          \"mark\": \"bar\",\n          \"encoding\": {\n            \"y\": {},\n            \"x\": {\n              \"type\": \"quantitative\"\n            },\n            \"color\": {\n              \"type\": \"nominal\",\n              \"ignore\": true\n            },\n            \"column\": {\n              \"ignore\": true,\n              \"type\": \"nominal\"\n            },\n            \"row\": {\n              \"ignore\": true,\n              \"type\": \"nominal\"\n            }\n          },\n          \"unique_map\": {\n            \"y\": \"x\"\n          }\n        }\n      ],\n      \"nl_ref_type\": \"explicit\",\n      \"nl_ref_phrase\": \"...\"\n    }\n  ]\n}\n\n### Output:"
}