{
  "gpt_result": {
    "nl_utterance": "Show the total investment amount over the years.",
    "encoded_fields": [
      {
        "field": "Year",
        "type": "quantitative",
        "nl_ref_type": "explicit",
        "nl_ref_phrase": "years"
      },
      {
        "field": "Amount (2020 USD million)",
        "type": "quantitative",
        "nl_ref_type": "explicit",
        "nl_ref_phrase": "investment amount"
      }
    ],
    "constraints": [
      {
        "c_type": "transform",
        "c_name": "aggregate",
        "c_list": [
          {
            "field": "Amount (2020 USD million)",
            "aggregate": "sum"
          }
        ],
        "nl_ref_type": "explicit",
        "nl_ref_phrase": "total"
      }
    ]
  },
  "input": "Dataset Information: {\n  \"data samples\": [\n    {\n      \"Unnamed: 0\": 200,\n      \"Region\": \"Africa\",\n      \"Year\": 2013,\n      \"Category\": \"Renewables\",\n      \"Technology\": \"Multiple renewables\",\n      \"Amount (2020 USD million)\": 0.928327085\n    },\n    {\n      \"Unnamed: 0\": 8087,\n      \"Region\": \"Africa\",\n      \"Year\": 2010,\n      \"Category\": \"Non-renewables\",\n      \"Technology\": \"Fossil fuels n.e.s.\",\n      \"Amount (2020 USD million)\": 4.897724733\n    },\n    {\n      \"Unnamed: 0\": 998,\n      \"Region\": \"Africa\",\n      \"Year\": 2012,\n      \"Category\": \"Renewables\",\n      \"Technology\": \"Solar energy\",\n      \"Amount (2020 USD million)\": 0.011850577\n    },\n    {\n      \"Unnamed: 0\": 2473,\n      \"Region\": \"Africa\",\n      \"Year\": 2019,\n      \"Category\": \"Renewables\",\n      \"Technology\": \"Multiple renewables\",\n      \"Amount (2020 USD million)\": 0.008956\n    },\n    {\n      \"Unnamed: 0\": 11777,\n      \"Region\": \"Africa\",\n      \"Year\": 2019,\n      \"Category\": \"Renewables\",\n      \"Technology\": \"Multiple renewables\",\n      \"Amount (2020 USD million)\": 35.23661\n    }\n  ],\n  \"column names\": [\n    \"Unnamed: 0\",\n    \"Region\",\n    \"Year\",\n    \"Category\",\n    \"Technology\",\n    \"Amount (2020 USD million)\"\n  ]\n}\n\nYour Job:\nI am developing a NL to Data Visualization Dataset. \nPlease help me generate natural language utterance for given dataset and constraints.\nDefinition about the Taks:\n- 'utterance' is what a user would say to make a chart. It should be a queries structure. One NL 'utterance' is in one or two sentences. Here are two examples from Queries for reference:\n    Compare acceleration vs weight across different countries.\n    Plot IMDB rating against Rotten Tomatoes rating.\n- 'given dataset' is in form of column names, column type, range/unique values of the column.\n- 'constraints' are information about the chart that should be included in the utterance. \n    So we can find a reference phrase in the NL utterance that corresponds to the given constraints. \n- 'reference phrase' can be explicit, ambiguous, and by_value. 'ambiguous' means the phrase can map to more than one columns in the dataset, always a hypernym of column names(depending on the dataset values).\n    For example:\n    {\"column\": \"gdpPercap\", \"nl_ref_type\": \"explicit\", \"nl_ref_phrase\": \"GDP per capita\"},\n    {\"column\": [\"country\",\"continent\"], \"nl_ref_type\": \"ambiguous\", \"nl_ref_phrase\": \"region\"}\n    {\"column\": [\"country\",\"country_short_name\"], \"nl_ref_type\": \"ambiguous\", \"nl_ref_phrase\": \"countries\"}\n    {\"c_type\": \"mark\", \"c_name\": \"point chart\", \"nl_ref_type\": \"explicit\", \"nl_ref_phrase\": \"scatter plot\"}\n    {\"c_type\": \"mark\", \"c_name\": \"arc chart\", \"nl_ref_type\": \"explicit\", \"nl_ref_phrase\": \"pie chart\"}\n    {\"c_type\": \"transform\",\"c_name\": \"filter\",\"c_list\": [{\"field\": \"country\",\"oneOf\": [\"Iceland\",\"Norway\"]}],\"nl_ref_type\": \"explicit\",\"nl_ref_phrase\": \"for countries Iceland and Norway\"},\n    {\"c_type\": \"transform\",\"c_name\": \"filter\",\"c_list\": [{\"field\": \"country\",\"oneOf\": [\"Iceland\",\"Norway\"]}],\"nl_ref_type\": \"by_value\",\"nl_ref_phrase\": \"for Iceland and Norway\"},\n- the 'nl_ref_phrase' for 'ambiguous' columns should be equally near all ambiguous columns, not too near to one of the column since it would not be ambiguous.\n    good example: {\"column\": [\"country\",\"region\"], \"nl_ref_type\": \"ambiguous\", \"nl_ref_phrase\": \"location\"}\n    bad example: {\"column\": [\"country\",\"region\"], \"nl_ref_type\": \"ambiguous\", \"nl_ref_phrase\": \"region\"}\n- You only include given constraints and no other information. \n    For example, if a column name is not in the given constraint, it will not be included in the NL utterance.\n    Also, it a chart mark or chart encoding channel is not in the given constraint, it will not be included in the NL utterance.\n- all 'nl_ref_phrase' shoule be included in the 'nl_utterance'. \n\nThe output format is identical to the input format, but fill in the str blanks(\"...\").\n### Input:\n{\n  \"nl_utterance\": \"...\",\n  \"encoded_fields\": [\n    {\n      \"field\": \"Year\",\n      \"type\": \"quantitative\",\n      \"nl_ref_type\": \"explicit\",\n      \"nl_ref_phrase\": \"...\"\n    },\n    {\n      \"field\": \"Amount (2020 USD million)\",\n      \"type\": \"quantitative\",\n      \"nl_ref_type\": \"explicit\",\n      \"nl_ref_phrase\": \"...\"\n    }\n  ],\n  \"constraints\": [\n    {\n      \"c_type\": \"transform\",\n      \"c_name\": \"aggregate\",\n      \"c_list\": [\n        {\n          \"field\": \"Amount (2020 USD million)\",\n          \"aggregate\": \"sum\"\n        }\n      ],\n      \"nl_ref_type\": \"explicit\",\n      \"nl_ref_phrase\": \"...\"\n    }\n  ]\n}\n\n### Output:"
}