{
  "gpt_result": {
    "nl_utterance": "Show a scatter plot to analyze the correlation between Component 1 and Component 2, categorized by location.",
    "encoded_fields": [
      {
        "field": "Component 1",
        "type": "quantitative",
        "nl_ref_type": "explicit",
        "nl_ref_phrase": "Component 1"
      },
      {
        "field": "Component 2",
        "type": "quantitative",
        "nl_ref_type": "explicit",
        "nl_ref_phrase": "Component 2"
      },
      {
        "field": [
          "RegionName",
          "ConstituencyName"
        ],
        "type": "nominal",
        "nl_ref_type": "ambiguous",
        "nl_ref_phrase": "location"
      }
    ],
    "constraints": [
      {
        "c_type": "task",
        "c_name": "correlation",
        "c_list": [
          {
            "mark": "circle",
            "encoding": {
              "x": {
                "type": "quantitative"
              },
              "y": {
                "type": "quantitative"
              }
            }
          }
        ],
        "nl_ref_type": "explicit",
        "nl_ref_phrase": "scatter plot"
      }
    ]
  },
  "input": "Dataset Information: {\n  \"data samples\": [\n    {\n      \"Unnamed: 0\": 0,\n      \"ConstituencyName\": \"Aldershot\",\n      \"RegionName\": \"South East\",\n      \"MedianHPrice\": 335000,\n      \"MedianWeeklyWage\": 576,\n      \"YearlySalary\": 29968,\n      \"Housepriceincreaseover5years\": 7000,\n      \"%Growth5years\": 2,\n      \"%affordability\": 9,\n      \"Component 1\": 1.2496118035031694,\n      \"Component 2\": -0.5133032835863713\n    },\n    {\n      \"Unnamed: 0\": 144,\n      \"ConstituencyName\": \"Ealing Central and Acton\",\n      \"RegionName\": \"London\",\n      \"MedianHPrice\": 645000,\n      \"MedianWeeklyWage\": 634,\n      \"YearlySalary\": 32973,\n      \"Housepriceincreaseover5years\": 9255,\n      \"%Growth5years\": 2,\n      \"%affordability\": 5,\n      \"Component 1\": 3.524507644845219,\n      \"Component 2\": 0.1531055107137773\n    },\n    {\n      \"Unnamed: 0\": 38,\n      \"ConstituencyName\": \"Birmingham, Yardley\",\n      \"RegionName\": \"West Midlands\",\n      \"MedianHPrice\": 195000,\n      \"MedianWeeklyWage\": 506,\n      \"YearlySalary\": 26322,\n      \"Housepriceincreaseover5years\": 7400,\n      \"%Growth5years\": 5,\n      \"%affordability\": 13,\n      \"Component 1\": -0.8879702765050401,\n      \"Component 2\": 0.3837251127425324\n    },\n    {\n      \"Unnamed: 0\": 107,\n      \"ConstituencyName\": \"Chorley\",\n      \"RegionName\": \"North West\",\n      \"MedianHPrice\": 175500,\n      \"MedianWeeklyWage\": 468,\n      \"YearlySalary\": 24315,\n      \"Housepriceincreaseover5years\": 2300,\n      \"%Growth5years\": 1,\n      \"%affordability\": 14,\n      \"Component 1\": -1.2476640290399914,\n      \"Component 2\": -1.196292869989616\n    },\n    {\n      \"Unnamed: 0\": 93,\n      \"ConstituencyName\": \"Central Devon\",\n      \"RegionName\": \"South West\",\n      \"MedianHPrice\": 285000,\n      \"MedianWeeklyWage\": 471,\n      \"YearlySalary\": 24476,\n      \"Housepriceincreaseover5years\": 7000,\n      \"%Growth5years\": 3,\n      \"%affordability\": 9,\n      \"Component 1\": -0.4287472797810506,\n      \"Component 2\": 0.609073886532227\n    }\n  ],\n  \"column names\": [\n    \"Unnamed: 0\",\n    \"ConstituencyName\",\n    \"RegionName\",\n    \"MedianHPrice\",\n    \"MedianWeeklyWage\",\n    \"YearlySalary\",\n    \"Housepriceincreaseover5years\",\n    \"%Growth5years\",\n    \"%affordability\",\n    \"Component 1\",\n    \"Component 2\"\n  ]\n}\n\nYour Job:\nI am developing a NL to Data Visualization Dataset. \nPlease help me generate natural language utterance for given dataset and constraints.\nDefinition about the Taks:\n- 'utterance' is what a user would say to make a chart.  One NL 'utterance' is in one or two sentences. Here are two examples from Others for reference:\n    I want to know how many orders there are by the quantity of the order.\n    Trend for average horsepower over time across different origin.\n- 'given dataset' is in form of column names, column type, range/unique values of the column.\n- 'constraints' are information about the chart that should be included in the utterance. \n    So we can find a reference phrase in the NL utterance that corresponds to the given constraints. \n- 'reference phrase' can be explicit, ambiguous, and by_value. 'ambiguous' means the phrase can map to more than one columns in the dataset, always a hypernym of column names(depending on the dataset values).\n    For example:\n    {\"column\": \"gdpPercap\", \"nl_ref_type\": \"explicit\", \"nl_ref_phrase\": \"GDP per capita\"},\n    {\"column\": [\"country\",\"continent\"], \"nl_ref_type\": \"ambiguous\", \"nl_ref_phrase\": \"region\"}\n    {\"column\": [\"country\",\"country_short_name\"], \"nl_ref_type\": \"ambiguous\", \"nl_ref_phrase\": \"countries\"}\n    {\"c_type\": \"mark\", \"c_name\": \"point chart\", \"nl_ref_type\": \"explicit\", \"nl_ref_phrase\": \"scatter plot\"}\n    {\"c_type\": \"mark\", \"c_name\": \"arc chart\", \"nl_ref_type\": \"explicit\", \"nl_ref_phrase\": \"pie chart\"}\n    {\"c_type\": \"transform\",\"c_name\": \"filter\",\"c_list\": [{\"field\": \"country\",\"oneOf\": [\"Iceland\",\"Norway\"]}],\"nl_ref_type\": \"explicit\",\"nl_ref_phrase\": \"for countries Iceland and Norway\"},\n    {\"c_type\": \"transform\",\"c_name\": \"filter\",\"c_list\": [{\"field\": \"country\",\"oneOf\": [\"Iceland\",\"Norway\"]}],\"nl_ref_type\": \"by_value\",\"nl_ref_phrase\": \"for Iceland and Norway\"},\n- the 'nl_ref_phrase' for 'ambiguous' columns should be equally near all ambiguous columns, not too near to one of the column since it would not be ambiguous.\n    good example: {\"column\": [\"country\",\"region\"], \"nl_ref_type\": \"ambiguous\", \"nl_ref_phrase\": \"location\"}\n    bad example: {\"column\": [\"country\",\"region\"], \"nl_ref_type\": \"ambiguous\", \"nl_ref_phrase\": \"region\"}\n- You only include given constraints and no other information. \n    For example, if a column name is not in the given constraint, it will not be included in the NL utterance.\n    Also, it a chart mark or chart encoding channel is not in the given constraint, it will not be included in the NL utterance.\n- all 'nl_ref_phrase' shoule be included in the 'nl_utterance'. \n\nThe output format is identical to the input format, but fill in the str blanks(\"...\").\n### Input:\n{\n  \"nl_utterance\": \"...\",\n  \"encoded_fields\": [\n    {\n      \"field\": \"Component 1\",\n      \"type\": \"quantitative\",\n      \"nl_ref_type\": \"explicit\",\n      \"nl_ref_phrase\": \"...\"\n    },\n    {\n      \"field\": \"Component 2\",\n      \"type\": \"quantitative\",\n      \"nl_ref_type\": \"explicit\",\n      \"nl_ref_phrase\": \"...\"\n    },\n    {\n      \"field\": [\n        \"RegionName\",\n        \"ConstituencyName\"\n      ],\n      \"type\": \"nominal\",\n      \"nl_ref_type\": \"ambiguous\",\n      \"nl_ref_phrase\": \"...\"\n    }\n  ],\n  \"constraints\": [\n    {\n      \"c_type\": \"task\",\n      \"c_name\": \"correlation\",\n      \"c_list\": [\n        {\n          \"mark\": \"circle\",\n          \"encoding\": {\n            \"x\": {\n              \"type\": \"quantitative\"\n            },\n            \"y\": {\n              \"type\": \"quantitative\"\n            }\n          }\n        }\n      ],\n      \"nl_ref_type\": \"explicit\",\n      \"nl_ref_phrase\": \"...\"\n    }\n  ]\n}\n\n### Output:"
}