{
  "gpt_result": {
    "nl_utterance": "Create a bar chart of intensity by marginal region, and sort the regions from North Scotland to Southern Eastern.",
    "encoded_fields": [
      {
        "field": "intensity",
        "type": "quantitative",
        "nl_ref_type": "explicit",
        "nl_ref_phrase": "intensity"
      },
      {
        "field": "marginal_region",
        "type": "nominal",
        "nl_ref_type": "explicit",
        "nl_ref_phrase": "marginal region"
      }
    ],
    "constraints": [
      {
        "c_type": "transform",
        "c_name": "sort",
        "c_list": [
          [
            "North Scotland",
            "South Scotland",
            "Northern",
            "North Western",
            "Yorkshire",
            "Merseyside and North Wales",
            "South Wales",
            "Midlands",
            "East Midlands",
            "Eastern",
            "South Western",
            "Southern",
            "London",
            "Southern Eastern"
          ]
        ],
        "nl_ref_type": "explicit",
        "nl_ref_phrase": "sort the regions from North Scotland to Southern Eastern"
      }
    ]
  },
  "input": "Dataset Information: {\n  \"data samples\": [\n    {\n      \"region\": \"North Scotland\",\n      \"marginal_region\": \"North Scotland\",\n      \"marginal_bmu\": \"T_BDCHW-1\",\n      \"bmu_name\": \"Bad a Cheo Wind Farm \",\n      \"bmu_type\": \"Wind (Onshore)\",\n      \"intensity\": 0.0\n    },\n    {\n      \"region\": \"Yorkshire and the Humber\",\n      \"marginal_region\": \"East Midlands\",\n      \"marginal_bmu\": \"T_STAY-3\",\n      \"bmu_name\": \"Staythorpe Unit 3 \",\n      \"bmu_type\": \"CCGT\",\n      \"intensity\": 378.0\n    },\n    {\n      \"region\": \"South England\",\n      \"marginal_region\": \"South East England\",\n      \"marginal_bmu\": \"T_MEDP-1\",\n      \"bmu_name\": \"Medway \",\n      \"bmu_type\": \"CCGT\",\n      \"intensity\": 394.9\n    },\n    {\n      \"region\": \"North East England\",\n      \"marginal_region\": \"East Midlands\",\n      \"marginal_bmu\": \"T_STAY-3\",\n      \"bmu_name\": \"Staythorpe Unit 3 \",\n      \"bmu_type\": \"CCGT\",\n      \"intensity\": 378.0\n    },\n    {\n      \"region\": \"South West England\",\n      \"marginal_region\": \"South West England\",\n      \"marginal_bmu\": \"2__LSTAT001\",\n      \"bmu_name\": \"South Western GSP Group - Statkraft Markets Gmbh \",\n      \"bmu_type\": \"GSP: South West England\",\n      \"intensity\": 0.0\n    }\n  ],\n  \"column names\": [\n    \"region\",\n    \"marginal_region\",\n    \"marginal_bmu\",\n    \"bmu_name\",\n    \"bmu_type\",\n    \"intensity\"\n  ]\n}\n\nYour Job:\nI am developing a NL to Data Visualization Dataset. \nPlease help me generate natural language utterance for given dataset and constraints.\nDefinition about the Taks:\n- 'utterance' is what a user would say to make a chart. It should be a queries structure. One NL 'utterance' is in one or two sentences. Here are two examples from Queries for reference:\n    bar chart for mpg v/s cylinders.\n    mpg vs displacement as a scatter chart.\n- 'given dataset' is in form of column names, column type, range/unique values of the column.\n- 'constraints' are information about the chart that should be included in the utterance. \n    So we can find a reference phrase in the NL utterance that corresponds to the given constraints. \n- 'reference phrase' can be explicit, ambiguous, and by_value. 'ambiguous' means the phrase can map to more than one columns in the dataset, always a hypernym of column names(depending on the dataset values).\n    For example:\n    {\"column\": \"gdpPercap\", \"nl_ref_type\": \"explicit\", \"nl_ref_phrase\": \"GDP per capita\"},\n    {\"column\": [\"country\",\"continent\"], \"nl_ref_type\": \"ambiguous\", \"nl_ref_phrase\": \"region\"}\n    {\"column\": [\"country\",\"country_short_name\"], \"nl_ref_type\": \"ambiguous\", \"nl_ref_phrase\": \"countries\"}\n    {\"c_type\": \"mark\", \"c_name\": \"point chart\", \"nl_ref_type\": \"explicit\", \"nl_ref_phrase\": \"scatter plot\"}\n    {\"c_type\": \"mark\", \"c_name\": \"arc chart\", \"nl_ref_type\": \"explicit\", \"nl_ref_phrase\": \"pie chart\"}\n    {\"c_type\": \"transform\",\"c_name\": \"filter\",\"c_list\": [{\"field\": \"country\",\"oneOf\": [\"Iceland\",\"Norway\"]}],\"nl_ref_type\": \"explicit\",\"nl_ref_phrase\": \"for countries Iceland and Norway\"},\n    {\"c_type\": \"transform\",\"c_name\": \"filter\",\"c_list\": [{\"field\": \"country\",\"oneOf\": [\"Iceland\",\"Norway\"]}],\"nl_ref_type\": \"by_value\",\"nl_ref_phrase\": \"for Iceland and Norway\"},\n- the 'nl_ref_phrase' for 'ambiguous' columns should be equally near all ambiguous columns, not too near to one of the column since it would not be ambiguous.\n    good example: {\"column\": [\"country\",\"region\"], \"nl_ref_type\": \"ambiguous\", \"nl_ref_phrase\": \"location\"}\n    bad example: {\"column\": [\"country\",\"region\"], \"nl_ref_type\": \"ambiguous\", \"nl_ref_phrase\": \"region\"}\n- You only include given constraints and no other information. \n    For example, if a column name is not in the given constraint, it will not be included in the NL utterance.\n    Also, it a chart mark or chart encoding channel is not in the given constraint, it will not be included in the NL utterance.\n- all 'nl_ref_phrase' shoule be included in the 'nl_utterance'. \n\nThe output format is identical to the input format, but fill in the str blanks(\"...\").\n### Input:\n{\n  \"nl_utterance\": \"...\",\n  \"encoded_fields\": [\n    {\n      \"field\": \"intensity\",\n      \"type\": \"quantitative\",\n      \"nl_ref_type\": \"explicit\",\n      \"nl_ref_phrase\": \"...\"\n    },\n    {\n      \"field\": \"marginal_region\",\n      \"type\": \"nominal\",\n      \"nl_ref_type\": \"explicit\",\n      \"nl_ref_phrase\": \"...\"\n    }\n  ],\n  \"constraints\": [\n    {\n      \"c_type\": \"transform\",\n      \"c_name\": \"sort\",\n      \"c_list\": [\n        [\n          \"North Scotland\",\n          \"South Scotland\",\n          \"Northern\",\n          \"North Western\",\n          \"Yorkshire\",\n          \"Merseyside and North Wales\",\n          \"South Wales\",\n          \"Midlands\",\n          \"East Midlands\",\n          \"Eastern\",\n          \"South Western\",\n          \"Southern\",\n          \"London\",\n          \"Southern Eastern\"\n        ]\n      ],\n      \"nl_ref_type\": \"explicit\",\n      \"nl_ref_phrase\": \"...\"\n    }\n  ]\n}\n\n### Output:"
}