{
  "gpt_result": {
    "nl_utterance": "Show the count by cloth size and gender for sizes 28, 29, 30, 31, 32, 33, 34, 36, l, m, s, xl, xs, and xxs.",
    "encoded_fields": [
      {
        "field": "cloth size",
        "type": "nominal",
        "nl_ref_type": "explicit",
        "nl_ref_phrase": "cloth size"
      },
      {
        "field": "COUNT",
        "type": "quantitative",
        "nl_ref_type": "explicit",
        "nl_ref_phrase": "count"
      },
      {
        "field": "gender",
        "type": "nominal",
        "nl_ref_type": "explicit",
        "nl_ref_phrase": "gender"
      }
    ],
    "constraints": [
      {
        "c_type": "transform",
        "c_name": "filter",
        "c_list": [
          {
            "field": "cloth size",
            "oneOf": [
              "28",
              "29",
              "30",
              "31",
              "32",
              "33",
              "34",
              "36",
              "l",
              "m",
              "s",
              "xl",
              "xs",
              "xxs"
            ]
          }
        ],
        "nl_ref_type": "by_value",
        "nl_ref_phrase": "for sizes 28, 29, 30, 31, 32, 33, 34, 36, l, m, s, xl, xs, and xxs"
      }
    ]
  },
  "input": "Dataset Information: {\n  \"data samples\": [\n    {\n      \"cloth size\": NaN,\n      \"COUNT\": 1,\n      \"gender\": \"M\"\n    },\n    {\n      \"cloth size\": \"xl\",\n      \"COUNT\": 1,\n      \"gender\": \"F\"\n    },\n    {\n      \"cloth size\": NaN,\n      \"COUNT\": 1,\n      \"gender\": \"F\"\n    },\n    {\n      \"cloth size\": \"xs\",\n      \"COUNT\": 1,\n      \"gender\": \"F\"\n    },\n    {\n      \"cloth size\": \"s\",\n      \"COUNT\": 1,\n      \"gender\": \"F\"\n    }\n  ],\n  \"column names\": [\n    \"cloth size\",\n    \"COUNT\",\n    \"gender\"\n  ]\n}\n\nYour Job:\nI am developing a NL to Data Visualization Dataset. \nPlease help me generate natural language utterance for given dataset and constraints.\nDefinition about the Taks:\n- 'utterance' is what a user would say to make a chart. It should be a queries structure. One NL 'utterance' is in one or two sentences. Here are two examples from Queries for reference:\n    Scatter Production Budget vs Worldwide Gross, sliced by Content Rating.\n    Total gross by genre and year.\n- 'given dataset' is in form of column names, column type, range/unique values of the column.\n- 'constraints' are information about the chart that should be included in the utterance. \n    So we can find a reference phrase in the NL utterance that corresponds to the given constraints. \n- 'reference phrase' can be explicit, ambiguous, and by_value. 'ambiguous' means the phrase can map to more than one columns in the dataset, always a hypernym of column names(depending on the dataset values).\n    For example:\n    {\"column\": \"gdpPercap\", \"nl_ref_type\": \"explicit\", \"nl_ref_phrase\": \"GDP per capita\"},\n    {\"column\": [\"country\",\"continent\"], \"nl_ref_type\": \"ambiguous\", \"nl_ref_phrase\": \"region\"}\n    {\"column\": [\"country\",\"country_short_name\"], \"nl_ref_type\": \"ambiguous\", \"nl_ref_phrase\": \"countries\"}\n    {\"c_type\": \"mark\", \"c_name\": \"point chart\", \"nl_ref_type\": \"explicit\", \"nl_ref_phrase\": \"scatter plot\"}\n    {\"c_type\": \"mark\", \"c_name\": \"arc chart\", \"nl_ref_type\": \"explicit\", \"nl_ref_phrase\": \"pie chart\"}\n    {\"c_type\": \"transform\",\"c_name\": \"filter\",\"c_list\": [{\"field\": \"country\",\"oneOf\": [\"Iceland\",\"Norway\"]}],\"nl_ref_type\": \"explicit\",\"nl_ref_phrase\": \"for countries Iceland and Norway\"},\n    {\"c_type\": \"transform\",\"c_name\": \"filter\",\"c_list\": [{\"field\": \"country\",\"oneOf\": [\"Iceland\",\"Norway\"]}],\"nl_ref_type\": \"by_value\",\"nl_ref_phrase\": \"for Iceland and Norway\"},\n- the 'nl_ref_phrase' for 'ambiguous' columns should be equally near all ambiguous columns, not too near to one of the column since it would not be ambiguous.\n    good example: {\"column\": [\"country\",\"region\"], \"nl_ref_type\": \"ambiguous\", \"nl_ref_phrase\": \"location\"}\n    bad example: {\"column\": [\"country\",\"region\"], \"nl_ref_type\": \"ambiguous\", \"nl_ref_phrase\": \"region\"}\n- You only include given constraints and no other information. \n    For example, if a column name is not in the given constraint, it will not be included in the NL utterance.\n    Also, it a chart mark or chart encoding channel is not in the given constraint, it will not be included in the NL utterance.\n- all 'nl_ref_phrase' shoule be included in the 'nl_utterance'. \n\nThe output format is identical to the input format, but fill in the str blanks(\"...\").\n### Input:\n{\n  \"nl_utterance\": \"...\",\n  \"encoded_fields\": [\n    {\n      \"field\": \"cloth size\",\n      \"type\": \"nominal\",\n      \"nl_ref_type\": \"explicit\",\n      \"nl_ref_phrase\": \"...\"\n    },\n    {\n      \"field\": \"COUNT\",\n      \"type\": \"quantitative\",\n      \"nl_ref_type\": \"explicit\",\n      \"nl_ref_phrase\": \"...\"\n    },\n    {\n      \"field\": \"gender\",\n      \"type\": \"nominal\",\n      \"nl_ref_type\": \"explicit\",\n      \"nl_ref_phrase\": \"...\"\n    }\n  ],\n  \"constraints\": [\n    {\n      \"c_type\": \"transform\",\n      \"c_name\": \"filter\",\n      \"c_list\": [\n        {\n          \"field\": \"cloth size\",\n          \"oneOf\": [\n            \"28\",\n            \"29\",\n            \"30\",\n            \"31\",\n            \"32\",\n            \"33\",\n            \"34\",\n            \"36\",\n            \"l\",\n            \"m\",\n            \"s\",\n            \"xl\",\n            \"xs\",\n            \"xxs\"\n          ]\n        }\n      ],\n      \"nl_ref_type\": \"by_value\",\n      \"nl_ref_phrase\": \"...\"\n    }\n  ]\n}\n\n### Output:"
}