{
  "gpt_result": {
    "nl_utterance": "Create a heatmap displaying the count of entries based on Height and Time (seconds) for those with a Height less than 100.",
    "encoded_fields": [
      {
        "field": "Height",
        "type": "quantitative",
        "nl_ref_type": "explicit",
        "nl_ref_phrase": "Height"
      },
      {
        "field": "Time (seconds)",
        "type": "quantitative",
        "nl_ref_type": "explicit",
        "nl_ref_phrase": "Time (seconds)"
      }
    ],
    "constraints": [
      {
        "c_type": "mark",
        "c_name": "rect chart",
        "c_list": [
          {
            "mark": "rect",
            "encoding": {
              "x": {},
              "y": {},
              "color": {
                "type": "quantitative"
              },
              "column": {
                "ignore": true,
                "type": "nominal"
              },
              "row": {
                "ignore": true,
                "type": "nominal"
              }
            },
            "unique_map": {
              "(x,y)": "color"
            }
          }
        ],
        "nl_ref_type": "explicit",
        "nl_ref_phrase": "heatmap"
      },
      {
        "c_type": "transform",
        "c_name": "filter",
        "c_list": [
          {
            "field": "Height",
            "lt": 100
          }
        ],
        "nl_ref_type": "by_value",
        "nl_ref_phrase": "Height less than 100"
      },
      {
        "c_type": "transform",
        "c_name": "aggregate",
        "c_list": [
          {
            "aggregate": "count"
          }
        ],
        "nl_ref_type": "explicit",
        "nl_ref_phrase": "count"
      }
    ]
  },
  "input": "Dataset Information: {\n  \"data samples\": [\n    {\n      \"id\": 20,\n      \"OpponentName\": \"Fast person\",\n      \"start\": \"2018-08-25 15:07:29.106 +00:00\",\n      \"end\": \"2018-08-25 15:07:32.662 +00:00\",\n      \"PersonId\": 20,\n      \"Time (seconds)\": 4.0,\n      \"id.1\": 20,\n      \"Gender\": \"male\",\n      \"Age Group\": \"Teen\",\n      \"Favorite Activity\": \"Gaming\",\n      \"Height\": 71.0,\n      \"zipcode\": 35242,\n      \"state\": \"AL\",\n      \"Event\": \"Makevention 2018\"\n    },\n    {\n      \"id\": 190,\n      \"OpponentName\": NaN,\n      \"start\": \"2019-10-26 13:41:49.692 +00:00\",\n      \"end\": \"2019-10-26 13:41:51.729 +00:00\",\n      \"PersonId\": 190,\n      \"Time (seconds)\": 2.0,\n      \"id.1\": 190,\n      \"Gender\": \"Unkown\",\n      \"Age Group\": \"Teen\",\n      \"Favorite Activity\": \"Other\",\n      \"Height\": 74.0,\n      \"zipcode\": 47203,\n      \"state\": \"IN\",\n      \"Event\": \"Sciencefest 2019\"\n    },\n    {\n      \"id\": 105,\n      \"OpponentName\": NaN,\n      \"start\": \"2019-08-24 16:46:22.603 +00:00\",\n      \"end\": \"2019-08-24 16:46:23.995 +00:00\",\n      \"PersonId\": 105,\n      \"Time (seconds)\": 1.0,\n      \"id.1\": 105,\n      \"Gender\": \"Unkown\",\n      \"Age Group\": \"Pre-Teen\",\n      \"Favorite Activity\": \"Cooking\",\n      \"Height\": 66.0,\n      \"zipcode\": 47017,\n      \"state\": \"IN\",\n      \"Event\": \"Makevention 2019\"\n    },\n    {\n      \"id\": 94,\n      \"OpponentName\": \"Fast animal\",\n      \"start\": \"2018-08-25 19:36:51.876 +00:00\",\n      \"end\": NaN,\n      \"PersonId\": 94,\n      \"Time (seconds)\": NaN,\n      \"id.1\": 94,\n      \"Gender\": \"female\",\n      \"Age Group\": \"Pre-Teen\",\n      \"Favorite Activity\": \"Cooking\",\n      \"Height\": 64.0,\n      \"zipcode\": 47408,\n      \"state\": \"IN\",\n      \"Event\": \"Makevention 2018\"\n    },\n    {\n      \"id\": 8,\n      \"OpponentName\": NaN,\n      \"start\": \"2019-08-19 17:22:58.194 +00:00\",\n      \"end\": NaN,\n      \"PersonId\": 8,\n      \"Time (seconds)\": NaN,\n      \"id.1\": 8,\n      \"Gender\": \"Unkown\",\n      \"Age Group\": \"Pre-Teen\",\n      \"Favorite Activity\": \"Cooking\",\n      \"Height\": 43.0,\n      \"zipcode\": 47401,\n      \"state\": \"IN\",\n      \"Event\": \"Sciencefest 2019\"\n    }\n  ],\n  \"column names\": [\n    \"id\",\n    \"OpponentName\",\n    \"start\",\n    \"end\",\n    \"PersonId\",\n    \"Time (seconds)\",\n    \"id.1\",\n    \"Gender\",\n    \"Age Group\",\n    \"Favorite Activity\",\n    \"Height\",\n    \"zipcode\",\n    \"state\",\n    \"Event\"\n  ]\n}\n\nYour Job:\nI am developing a NL to Data Visualization Dataset. \nPlease help me generate natural language utterance for given dataset and constraints.\nDefinition about the Taks:\n- 'utterance' is what a user would say to make a chart. It should be a queries structure. One NL 'utterance' is in one or two sentences. Here are two examples from Queries for reference:\n    Compare acceleration vs weight across different countries.\n    Gross versus genre.\n- 'given dataset' is in form of column names, column type, range/unique values of the column.\n- 'constraints' are information about the chart that should be included in the utterance. \n    So we can find a reference phrase in the NL utterance that corresponds to the given constraints. \n- 'reference phrase' can be explicit, ambiguous, and by_value. 'ambiguous' means the phrase can map to more than one columns in the dataset, always a hypernym of column names(depending on the dataset values).\n    For example:\n    {\"column\": \"gdpPercap\", \"nl_ref_type\": \"explicit\", \"nl_ref_phrase\": \"GDP per capita\"},\n    {\"column\": [\"country\",\"continent\"], \"nl_ref_type\": \"ambiguous\", \"nl_ref_phrase\": \"region\"}\n    {\"column\": [\"country\",\"country_short_name\"], \"nl_ref_type\": \"ambiguous\", \"nl_ref_phrase\": \"countries\"}\n    {\"c_type\": \"mark\", \"c_name\": \"point chart\", \"nl_ref_type\": \"explicit\", \"nl_ref_phrase\": \"scatter plot\"}\n    {\"c_type\": \"mark\", \"c_name\": \"arc chart\", \"nl_ref_type\": \"explicit\", \"nl_ref_phrase\": \"pie chart\"}\n    {\"c_type\": \"transform\",\"c_name\": \"filter\",\"c_list\": [{\"field\": \"country\",\"oneOf\": [\"Iceland\",\"Norway\"]}],\"nl_ref_type\": \"explicit\",\"nl_ref_phrase\": \"for countries Iceland and Norway\"},\n    {\"c_type\": \"transform\",\"c_name\": \"filter\",\"c_list\": [{\"field\": \"country\",\"oneOf\": [\"Iceland\",\"Norway\"]}],\"nl_ref_type\": \"by_value\",\"nl_ref_phrase\": \"for Iceland and Norway\"},\n- the 'nl_ref_phrase' for 'ambiguous' columns should be equally near all ambiguous columns, not too near to one of the column since it would not be ambiguous.\n    good example: {\"column\": [\"country\",\"region\"], \"nl_ref_type\": \"ambiguous\", \"nl_ref_phrase\": \"location\"}\n    bad example: {\"column\": [\"country\",\"region\"], \"nl_ref_type\": \"ambiguous\", \"nl_ref_phrase\": \"region\"}\n- You only include given constraints and no other information. \n    For example, if a column name is not in the given constraint, it will not be included in the NL utterance.\n    Also, it a chart mark or chart encoding channel is not in the given constraint, it will not be included in the NL utterance.\n- all 'nl_ref_phrase' shoule be included in the 'nl_utterance'. \n\nThe output format is identical to the input format, but fill in the str blanks(\"...\").\n### Input:\n{\n  \"nl_utterance\": \"...\",\n  \"encoded_fields\": [\n    {\n      \"field\": \"Height\",\n      \"type\": \"quantitative\",\n      \"nl_ref_type\": \"explicit\",\n      \"nl_ref_phrase\": \"...\"\n    },\n    {\n      \"field\": \"Time (seconds)\",\n      \"type\": \"quantitative\",\n      \"nl_ref_type\": \"explicit\",\n      \"nl_ref_phrase\": \"...\"\n    }\n  ],\n  \"constraints\": [\n    {\n      \"c_type\": \"mark\",\n      \"c_name\": \"rect chart\",\n      \"c_list\": [\n        {\n          \"mark\": \"rect\",\n          \"encoding\": {\n            \"x\": {},\n            \"y\": {},\n            \"color\": {\n              \"type\": \"quantitative\"\n            },\n            \"column\": {\n              \"ignore\": true,\n              \"type\": \"nominal\"\n            },\n            \"row\": {\n              \"ignore\": true,\n              \"type\": \"nominal\"\n            }\n          },\n          \"unique_map\": {\n            \"(x,y)\": \"color\"\n          }\n        }\n      ],\n      \"nl_ref_type\": \"explicit\",\n      \"nl_ref_phrase\": \"...\"\n    },\n    {\n      \"c_type\": \"transform\",\n      \"c_name\": \"filter\",\n      \"c_list\": [\n        {\n          \"field\": \"Height\",\n          \"lt\": 100\n        }\n      ],\n      \"nl_ref_type\": \"by_value\",\n      \"nl_ref_phrase\": \"...\"\n    },\n    {\n      \"c_type\": \"transform\",\n      \"c_name\": \"aggregate\",\n      \"c_list\": [\n        {\n          \"aggregate\": \"count\"\n        }\n      ],\n      \"nl_ref_type\": \"explicit\",\n      \"nl_ref_phrase\": \"...\"\n    }\n  ]\n}\n\n### Output:"
}