{
  "gpt_result": {
    "nl_utterance": "Plot a time series of the 7-day moving average of cases over time for UK, France, Germany, and Portugal.",
    "encoded_fields": [
      {
        "field": "date2",
        "type": "temporal",
        "nl_ref_type": "explicit",
        "nl_ref_phrase": "time"
      },
      {
        "field": "cases_ma7",
        "type": "quantitative",
        "nl_ref_type": "explicit",
        "nl_ref_phrase": "7-day moving average of cases"
      },
      {
        "field": "country",
        "type": "nominal",
        "nl_ref_type": "explicit",
        "nl_ref_phrase": "for"
      }
    ],
    "constraints": [
      {
        "c_type": "transform",
        "c_name": "filter",
        "c_list": [
          {
            "field": "country",
            "oneOf": [
              "UK",
              "France",
              "Germany",
              "Portugal"
            ]
          }
        ],
        "nl_ref_type": "by_value",
        "nl_ref_phrase": "UK, France, Germany, and Portugal"
      }
    ]
  },
  "input": "Dataset Information: {\n  \"data samples\": [\n    {\n      \"date\": 20191231,\n      \"daterep\": \"31/12/2019\",\n      \"date2\": \"2019-12-31\",\n      \"day\": 31,\n      \"days\": 1,\n      \"month\": 12,\n      \"year\": 2019,\n      \"cases\": 0,\n      \"deaths\": 0,\n      \"country\": \"Afghanistan\",\n      \"geoid\": \"AF\",\n      \"countryterritorycode\": \"AFG\",\n      \"popdata2019\": 38041757.0,\n      \"continentexp\": \"Asia\",\n      \"cumulative_number_for_14_days_of\": NaN,\n      \"pop\": 38041757.0,\n      \"poprank\": 37.0,\n      \"t\": 1,\n      \"c\": 1,\n      \"cases_cml\": 0,\n      \"cases_ma7\": NaN,\n      \"cases_pop\": 0.0,\n      \"cases_cml_pop\": 0.0,\n      \"deaths_cml\": 0,\n      \"deaths_ma7\": NaN,\n      \"deaths_pop\": 0.0,\n      \"deaths_cml_pop\": 0.0,\n      \"deaths_rate\": NaN,\n      \"neighbours\": 0,\n      \"p20\": 0\n    },\n    {\n      \"date\": 20201124,\n      \"daterep\": \"24/11/2020\",\n      \"date2\": \"2020-11-24\",\n      \"day\": 24,\n      \"days\": 330,\n      \"month\": 11,\n      \"year\": 2020,\n      \"cases\": 15,\n      \"deaths\": 0,\n      \"country\": \"Senegal\",\n      \"geoid\": \"SN\",\n      \"countryterritorycode\": \"SEN\",\n      \"popdata2019\": 16296362.0,\n      \"continentexp\": \"Africa\",\n      \"cumulative_number_for_14_days_of\": 1.141359,\n      \"pop\": 16296362.0,\n      \"poprank\": 70.0,\n      \"t\": 330,\n      \"c\": 169,\n      \"cases_cml\": 15897,\n      \"cases_ma7\": 14.857142,\n      \"cases_pop\": 9.2045082e-07,\n      \"cases_cml_pop\": 0.00097549381,\n      \"deaths_cml\": 330,\n      \"deaths_ma7\": 0.2857143,\n      \"deaths_pop\": 0.0,\n      \"deaths_cml_pop\": 2.0249918e-05,\n      \"deaths_rate\": 0.020758634,\n      \"neighbours\": 0,\n      \"p20\": 0\n    },\n    {\n      \"date\": 20201103,\n      \"daterep\": \"03/11/2020\",\n      \"date2\": \"2020-11-3\",\n      \"day\": 3,\n      \"days\": 309,\n      \"month\": 11,\n      \"year\": 2020,\n      \"cases\": 76,\n      \"deaths\": 0,\n      \"country\": \"Ghana\",\n      \"geoid\": \"GH\",\n      \"countryterritorycode\": \"GHA\",\n      \"popdata2019\": 30417858.0,\n      \"continentexp\": \"Africa\",\n      \"cumulative_number_for_14_days_of\": 2.7220852,\n      \"pop\": 30417858.0,\n      \"poprank\": 46.0,\n      \"t\": 309,\n      \"c\": 77,\n      \"cases_cml\": 48200,\n      \"cases_ma7\": 72.85714,\n      \"cases_pop\": 2.4985322e-06,\n      \"cases_cml_pop\": 0.0015845954,\n      \"deaths_cml\": 320,\n      \"deaths_ma7\": 0.5714286,\n      \"deaths_pop\": 0.0,\n      \"deaths_cml_pop\": 1.0520136e-05,\n      \"deaths_rate\": 0.0066390042,\n      \"neighbours\": 0,\n      \"p20\": 0\n    },\n    {\n      \"date\": 20200530,\n      \"daterep\": \"30/05/2020\",\n      \"date2\": \"2020-5-30\",\n      \"day\": 30,\n      \"days\": 152,\n      \"month\": 5,\n      \"year\": 2020,\n      \"cases\": 0,\n      \"deaths\": 0,\n      \"country\": \"United_Republic_of_Tanzania\",\n      \"geoid\": \"TZ\",\n      \"countryterritorycode\": \"TZA\",\n      \"popdata2019\": 58005461.0,\n      \"continentexp\": \"Africa\",\n      \"cumulative_number_for_14_days_of\": 0.0,\n      \"pop\": 58005461.0,\n      \"poprank\": 25.0,\n      \"t\": 152,\n      \"c\": 202,\n      \"cases_cml\": 509,\n      \"cases_ma7\": 0.0,\n      \"cases_pop\": 0.0,\n      \"cases_cml_pop\": 8.7750359e-06,\n      \"deaths_cml\": 21,\n      \"deaths_ma7\": 0.0,\n      \"deaths_pop\": 0.0,\n      \"deaths_cml_pop\": 3.6203488e-07,\n      \"deaths_rate\": 0.041257367,\n      \"neighbours\": 0,\n      \"p20\": 0\n    },\n    {\n      \"date\": 20200503,\n      \"daterep\": \"03/05/2020\",\n      \"date2\": \"2020-5-3\",\n      \"day\": 3,\n      \"days\": 125,\n      \"month\": 5,\n      \"year\": 2020,\n      \"cases\": 270,\n      \"deaths\": 13,\n      \"country\": \"Poland\",\n      \"geoid\": \"PL\",\n      \"countryterritorycode\": \"POL\",\n      \"popdata2019\": 37972812.0,\n      \"continentexp\": \"Europe\",\n      \"cumulative_number_for_14_days_of\": 12.200834,\n      \"pop\": 37972812.0,\n      \"poprank\": 38.0,\n      \"t\": 125,\n      \"c\": 156,\n      \"cases_cml\": 13375,\n      \"cases_ma7\": 354.71429,\n      \"cases_pop\": 7.1103505e-06,\n      \"cases_cml_pop\": 0.0003522257,\n      \"deaths_cml\": 664,\n      \"deaths_ma7\": 24.285715,\n      \"deaths_pop\": 3.4235021e-07,\n      \"deaths_cml_pop\": 1.7486194e-05,\n      \"deaths_rate\": 0.049644861,\n      \"neighbours\": 0,\n      \"p20\": 0\n    }\n  ],\n  \"column names\": [\n    \"date\",\n    \"daterep\",\n    \"date2\",\n    \"day\",\n    \"days\",\n    \"month\",\n    \"year\",\n    \"cases\",\n    \"deaths\",\n    \"country\",\n    \"geoid\",\n    \"countryterritorycode\",\n    \"popdata2019\",\n    \"continentexp\",\n    \"cumulative_number_for_14_days_of\",\n    \"pop\",\n    \"poprank\",\n    \"t\",\n    \"c\",\n    \"cases_cml\",\n    \"cases_ma7\",\n    \"cases_pop\",\n    \"cases_cml_pop\",\n    \"deaths_cml\",\n    \"deaths_ma7\",\n    \"deaths_pop\",\n    \"deaths_cml_pop\",\n    \"deaths_rate\",\n    \"neighbours\",\n    \"p20\"\n  ]\n}\n\nYour Job:\nI am developing a NL to Data Visualization Dataset. \nPlease help me generate natural language utterance for given dataset and constraints.\nDefinition about the Taks:\n- 'utterance' is what a user would say to make a chart. It should be a commands structure. One NL 'utterance' is in one or two sentences. Here are two examples from Commands for reference:\n    Draw a line chart of daily sales forecasts.\n    Sort creative types by number of movies.\n- 'given dataset' is in form of column names, column type, range/unique values of the column.\n- 'constraints' are information about the chart that should be included in the utterance. \n    So we can find a reference phrase in the NL utterance that corresponds to the given constraints. \n- 'reference phrase' can be explicit, ambiguous, and by_value. 'ambiguous' means the phrase can map to more than one columns in the dataset, always a hypernym of column names(depending on the dataset values).\n    For example:\n    {\"column\": \"gdpPercap\", \"nl_ref_type\": \"explicit\", \"nl_ref_phrase\": \"GDP per capita\"},\n    {\"column\": [\"country\",\"continent\"], \"nl_ref_type\": \"ambiguous\", \"nl_ref_phrase\": \"region\"}\n    {\"column\": [\"country\",\"country_short_name\"], \"nl_ref_type\": \"ambiguous\", \"nl_ref_phrase\": \"countries\"}\n    {\"c_type\": \"mark\", \"c_name\": \"point chart\", \"nl_ref_type\": \"explicit\", \"nl_ref_phrase\": \"scatter plot\"}\n    {\"c_type\": \"mark\", \"c_name\": \"arc chart\", \"nl_ref_type\": \"explicit\", \"nl_ref_phrase\": \"pie chart\"}\n    {\"c_type\": \"transform\",\"c_name\": \"filter\",\"c_list\": [{\"field\": \"country\",\"oneOf\": [\"Iceland\",\"Norway\"]}],\"nl_ref_type\": \"explicit\",\"nl_ref_phrase\": \"for countries Iceland and Norway\"},\n    {\"c_type\": \"transform\",\"c_name\": \"filter\",\"c_list\": [{\"field\": \"country\",\"oneOf\": [\"Iceland\",\"Norway\"]}],\"nl_ref_type\": \"by_value\",\"nl_ref_phrase\": \"for Iceland and Norway\"},\n- the 'nl_ref_phrase' for 'ambiguous' columns should be equally near all ambiguous columns, not too near to one of the column since it would not be ambiguous.\n    good example: {\"column\": [\"country\",\"region\"], \"nl_ref_type\": \"ambiguous\", \"nl_ref_phrase\": \"location\"}\n    bad example: {\"column\": [\"country\",\"region\"], \"nl_ref_type\": \"ambiguous\", \"nl_ref_phrase\": \"region\"}\n- You only include given constraints and no other information. \n    For example, if a column name is not in the given constraint, it will not be included in the NL utterance.\n    Also, it a chart mark or chart encoding channel is not in the given constraint, it will not be included in the NL utterance.\n- all 'nl_ref_phrase' shoule be included in the 'nl_utterance'. \n\nThe output format is identical to the input format, but fill in the str blanks(\"...\").\n### Input:\n{\n  \"nl_utterance\": \"...\",\n  \"encoded_fields\": [\n    {\n      \"field\": \"date2\",\n      \"type\": \"temporal\",\n      \"nl_ref_type\": \"explicit\",\n      \"nl_ref_phrase\": \"...\"\n    },\n    {\n      \"field\": \"cases_ma7\",\n      \"type\": \"quantitative\",\n      \"nl_ref_type\": \"explicit\",\n      \"nl_ref_phrase\": \"...\"\n    },\n    {\n      \"field\": \"country\",\n      \"type\": \"nominal\",\n      \"nl_ref_type\": \"explicit\",\n      \"nl_ref_phrase\": \"...\"\n    }\n  ],\n  \"constraints\": [\n    {\n      \"c_type\": \"transform\",\n      \"c_name\": \"filter\",\n      \"c_list\": [\n        {\n          \"field\": \"country\",\n          \"oneOf\": [\n            \"UK\",\n            \"France\",\n            \"Germany\",\n            \"Portugal\"\n          ]\n        }\n      ],\n      \"nl_ref_type\": \"by_value\",\n      \"nl_ref_phrase\": \"...\"\n    }\n  ]\n}\n\n### Output:"
}