{
  "gpt_result": {
    "nl_utterance": "What is the sum of the 7-day moving average of COVID-19 cases in the countries UK, France, Germany, and Portugal?",
    "encoded_fields": [
      {
        "field": "cases_ma7",
        "type": "quantitative",
        "nl_ref_type": "explicit",
        "nl_ref_phrase": "7-day moving average of COVID-19 cases"
      },
      {
        "field": "country",
        "type": "nominal",
        "nl_ref_type": "explicit",
        "nl_ref_phrase": "countries"
      }
    ],
    "constraints": [
      {
        "c_type": "transform",
        "c_name": "filter",
        "c_list": [
          {
            "field": "country",
            "oneOf": [
              "UK",
              "France",
              "Germany",
              "Portugal"
            ]
          }
        ],
        "nl_ref_type": "explicit",
        "nl_ref_phrase": "in the countries UK, France, Germany, and Portugal"
      },
      {
        "c_type": "transform",
        "c_name": "aggregate",
        "c_list": [
          {
            "field": "cases_ma7",
            "aggregate": "sum"
          }
        ],
        "nl_ref_type": "explicit",
        "nl_ref_phrase": "sum"
      }
    ]
  },
  "input": "Dataset Information: {\n  \"data samples\": [\n    {\n      \"date\": 20191231,\n      \"daterep\": \"31/12/2019\",\n      \"date2\": \"2019-12-31\",\n      \"day\": 31,\n      \"days\": 1,\n      \"month\": 12,\n      \"year\": 2019,\n      \"cases\": 0,\n      \"deaths\": 0,\n      \"country\": \"Afghanistan\",\n      \"geoid\": \"AF\",\n      \"countryterritorycode\": \"AFG\",\n      \"popdata2019\": 38041757.0,\n      \"continentexp\": \"Asia\",\n      \"cumulative_number_for_14_days_of\": NaN,\n      \"pop\": 38041757.0,\n      \"poprank\": 37.0,\n      \"t\": 1,\n      \"c\": 1,\n      \"cases_cml\": 0,\n      \"cases_ma7\": NaN,\n      \"cases_pop\": 0.0,\n      \"cases_cml_pop\": 0.0,\n      \"deaths_cml\": 0,\n      \"deaths_ma7\": NaN,\n      \"deaths_pop\": 0.0,\n      \"deaths_cml_pop\": 0.0,\n      \"deaths_rate\": NaN,\n      \"neighbours\": 0,\n      \"p20\": 0\n    },\n    {\n      \"date\": 20200324,\n      \"daterep\": \"24/03/2020\",\n      \"date2\": \"2020-3-24\",\n      \"day\": 24,\n      \"days\": 85,\n      \"month\": 3,\n      \"year\": 2020,\n      \"cases\": 71,\n      \"deaths\": 0,\n      \"country\": \"Russia\",\n      \"geoid\": \"RU\",\n      \"countryterritorycode\": \"RUS\",\n      \"popdata2019\": 145872260.0,\n      \"continentexp\": \"Europe\",\n      \"cumulative_number_for_14_days_of\": 0.29340741,\n      \"pop\": 145872260.0,\n      \"poprank\": 9.0,\n      \"t\": 85,\n      \"c\": 161,\n      \"cases_cml\": 438,\n      \"cases_ma7\": 53.57143,\n      \"cases_pop\": 4.8672723e-07,\n      \"cases_cml_pop\": 3.0026272e-06,\n      \"deaths_cml\": 0,\n      \"deaths_ma7\": 0.0,\n      \"deaths_pop\": 0.0,\n      \"deaths_cml_pop\": 0.0,\n      \"deaths_rate\": 0.0,\n      \"neighbours\": 0,\n      \"p20\": 1\n    },\n    {\n      \"date\": 20200730,\n      \"daterep\": \"30/07/2020\",\n      \"date2\": \"2020-7-30\",\n      \"day\": 30,\n      \"days\": 213,\n      \"month\": 7,\n      \"year\": 2020,\n      \"cases\": 18,\n      \"deaths\": 0,\n      \"country\": \"Norway\",\n      \"geoid\": \"NO\",\n      \"countryterritorycode\": \"NOR\",\n      \"popdata2019\": 5328212.0,\n      \"continentexp\": \"Europe\",\n      \"cumulative_number_for_14_days_of\": 2.7964354,\n      \"pop\": 5328212.0,\n      \"poprank\": 116.0,\n      \"t\": 213,\n      \"c\": 147,\n      \"cases_cml\": 9150,\n      \"cases_ma7\": 16.0,\n      \"cases_pop\": 3.3782439e-06,\n      \"cases_cml_pop\": 0.001717274,\n      \"deaths_cml\": 255,\n      \"deaths_ma7\": 0.0,\n      \"deaths_pop\": 0.0,\n      \"deaths_cml_pop\": 4.7858455e-05,\n      \"deaths_rate\": 0.027868852,\n      \"neighbours\": 0,\n      \"p20\": 0\n    },\n    {\n      \"date\": 20201017,\n      \"daterep\": \"17/10/2020\",\n      \"date2\": \"2020-10-17\",\n      \"day\": 17,\n      \"days\": 292,\n      \"month\": 10,\n      \"year\": 2020,\n      \"cases\": 0,\n      \"deaths\": 0,\n      \"country\": \"British_Virgin_Islands\",\n      \"geoid\": \"VG\",\n      \"countryterritorycode\": \"VGB\",\n      \"popdata2019\": 30033.0,\n      \"continentexp\": \"America\",\n      \"cumulative_number_for_14_days_of\": 0.0,\n      \"pop\": 30033.0,\n      \"poprank\": 207.0,\n      \"t\": 292,\n      \"c\": 29,\n      \"cases_cml\": 71,\n      \"cases_ma7\": 0.0,\n      \"cases_pop\": 0.0,\n      \"cases_cml_pop\": 0.0023640662,\n      \"deaths_cml\": 1,\n      \"deaths_ma7\": 0.0,\n      \"deaths_pop\": 0.0,\n      \"deaths_cml_pop\": 3.3296707e-05,\n      \"deaths_rate\": 0.014084507,\n      \"neighbours\": 0,\n      \"p20\": 0\n    },\n    {\n      \"date\": 20201128,\n      \"daterep\": \"28/11/2020\",\n      \"date2\": \"2020-11-28\",\n      \"day\": 28,\n      \"days\": 334,\n      \"month\": 11,\n      \"year\": 2020,\n      \"cases\": 1248,\n      \"deaths\": 31,\n      \"country\": \"Armenia\",\n      \"geoid\": \"AM\",\n      \"countryterritorycode\": \"ARM\",\n      \"popdata2019\": 2957728.0,\n      \"continentexp\": \"Europe\",\n      \"cumulative_number_for_14_days_of\": 599.75092,\n      \"pop\": 2957728.0,\n      \"poprank\": 134.0,\n      \"t\": 334,\n      \"c\": 9,\n      \"cases_cml\": 133594,\n      \"cases_ma7\": 1421.1428,\n      \"cases_pop\": 0.0004219455,\n      \"cases_cml_pop\": 0.045167778,\n      \"deaths_cml\": 2121,\n      \"deaths_ma7\": 31.571428,\n      \"deaths_pop\": 1.0481018e-05,\n      \"deaths_cml_pop\": 0.00071710447,\n      \"deaths_rate\": 0.015876461,\n      \"neighbours\": 0,\n      \"p20\": 0\n    }\n  ],\n  \"column names\": [\n    \"date\",\n    \"daterep\",\n    \"date2\",\n    \"day\",\n    \"days\",\n    \"month\",\n    \"year\",\n    \"cases\",\n    \"deaths\",\n    \"country\",\n    \"geoid\",\n    \"countryterritorycode\",\n    \"popdata2019\",\n    \"continentexp\",\n    \"cumulative_number_for_14_days_of\",\n    \"pop\",\n    \"poprank\",\n    \"t\",\n    \"c\",\n    \"cases_cml\",\n    \"cases_ma7\",\n    \"cases_pop\",\n    \"cases_cml_pop\",\n    \"deaths_cml\",\n    \"deaths_ma7\",\n    \"deaths_pop\",\n    \"deaths_cml_pop\",\n    \"deaths_rate\",\n    \"neighbours\",\n    \"p20\"\n  ]\n}\n\nYour Job:\nI am developing a NL to Data Visualization Dataset. \nPlease help me generate natural language utterance for given dataset and constraints.\nDefinition about the Taks:\n- 'utterance' is what a user would say to make a chart. It should be a questions structure. One NL 'utterance' is in one or two sentences. Here are two examples from Questions for reference:\n    How much do various cars weigh?\n    What major genre had the highest average worldwide gross?\n- 'given dataset' is in form of column names, column type, range/unique values of the column.\n- 'constraints' are information about the chart that should be included in the utterance. \n    So we can find a reference phrase in the NL utterance that corresponds to the given constraints. \n- 'reference phrase' can be explicit, ambiguous, and by_value. 'ambiguous' means the phrase can map to more than one columns in the dataset, always a hypernym of column names(depending on the dataset values).\n    For example:\n    {\"column\": \"gdpPercap\", \"nl_ref_type\": \"explicit\", \"nl_ref_phrase\": \"GDP per capita\"},\n    {\"column\": [\"country\",\"continent\"], \"nl_ref_type\": \"ambiguous\", \"nl_ref_phrase\": \"region\"}\n    {\"column\": [\"country\",\"country_short_name\"], \"nl_ref_type\": \"ambiguous\", \"nl_ref_phrase\": \"countries\"}\n    {\"c_type\": \"mark\", \"c_name\": \"point chart\", \"nl_ref_type\": \"explicit\", \"nl_ref_phrase\": \"scatter plot\"}\n    {\"c_type\": \"mark\", \"c_name\": \"arc chart\", \"nl_ref_type\": \"explicit\", \"nl_ref_phrase\": \"pie chart\"}\n    {\"c_type\": \"transform\",\"c_name\": \"filter\",\"c_list\": [{\"field\": \"country\",\"oneOf\": [\"Iceland\",\"Norway\"]}],\"nl_ref_type\": \"explicit\",\"nl_ref_phrase\": \"for countries Iceland and Norway\"},\n    {\"c_type\": \"transform\",\"c_name\": \"filter\",\"c_list\": [{\"field\": \"country\",\"oneOf\": [\"Iceland\",\"Norway\"]}],\"nl_ref_type\": \"by_value\",\"nl_ref_phrase\": \"for Iceland and Norway\"},\n- the 'nl_ref_phrase' for 'ambiguous' columns should be equally near all ambiguous columns, not too near to one of the column since it would not be ambiguous.\n    good example: {\"column\": [\"country\",\"region\"], \"nl_ref_type\": \"ambiguous\", \"nl_ref_phrase\": \"location\"}\n    bad example: {\"column\": [\"country\",\"region\"], \"nl_ref_type\": \"ambiguous\", \"nl_ref_phrase\": \"region\"}\n- You only include given constraints and no other information. \n    For example, if a column name is not in the given constraint, it will not be included in the NL utterance.\n    Also, it a chart mark or chart encoding channel is not in the given constraint, it will not be included in the NL utterance.\n- all 'nl_ref_phrase' shoule be included in the 'nl_utterance'. \n\nThe output format is identical to the input format, but fill in the str blanks(\"...\").\n### Input:\n{\n  \"nl_utterance\": \"...\",\n  \"encoded_fields\": [\n    {\n      \"field\": \"cases_ma7\",\n      \"type\": \"quantitative\",\n      \"nl_ref_type\": \"explicit\",\n      \"nl_ref_phrase\": \"...\"\n    },\n    {\n      \"field\": \"country\",\n      \"type\": \"nominal\",\n      \"nl_ref_type\": \"explicit\",\n      \"nl_ref_phrase\": \"...\"\n    }\n  ],\n  \"constraints\": [\n    {\n      \"c_type\": \"transform\",\n      \"c_name\": \"filter\",\n      \"c_list\": [\n        {\n          \"field\": \"country\",\n          \"oneOf\": [\n            \"UK\",\n            \"France\",\n            \"Germany\",\n            \"Portugal\"\n          ]\n        }\n      ],\n      \"nl_ref_type\": \"explicit\",\n      \"nl_ref_phrase\": \"...\"\n    },\n    {\n      \"c_type\": \"transform\",\n      \"c_name\": \"aggregate\",\n      \"c_list\": [\n        {\n          \"field\": \"cases_ma7\",\n          \"aggregate\": \"sum\"\n        }\n      ],\n      \"nl_ref_type\": \"explicit\",\n      \"nl_ref_phrase\": \"...\"\n    }\n  ]\n}\n\n### Output:"
}