{
  "gpt_result": {
    "nl_utterance": "What are the completion times for individuals who are shorter than 100 inches?",
    "encoded_fields": [
      {
        "field": "Time (seconds)",
        "type": "quantitative",
        "nl_ref_type": "explicit",
        "nl_ref_phrase": "completion times"
      }
    ],
    "constraints": [
      {
        "c_type": "transform",
        "c_name": "filter",
        "c_list": [
          {
            "field": "Height",
            "lt": 100
          }
        ],
        "nl_ref_type": "explicit",
        "nl_ref_phrase": "shorter than 100 inches"
      }
    ]
  },
  "input": "Dataset Information: {\n  \"data samples\": [\n    {\n      \"id\": 20,\n      \"OpponentName\": \"Fast person\",\n      \"start\": \"2018-08-25 15:07:29.106 +00:00\",\n      \"end\": \"2018-08-25 15:07:32.662 +00:00\",\n      \"PersonId\": 20,\n      \"Time (seconds)\": 4.0,\n      \"id.1\": 20,\n      \"Gender\": \"male\",\n      \"Age Group\": \"Teen\",\n      \"Favorite Activity\": \"Gaming\",\n      \"Height\": 71.0,\n      \"zipcode\": 35242,\n      \"state\": \"AL\",\n      \"Event\": \"Makevention 2018\"\n    },\n    {\n      \"id\": 121,\n      \"OpponentName\": NaN,\n      \"start\": \"2019-08-24 17:36:38.622 +00:00\",\n      \"end\": \"2019-08-24 17:36:40.197 +00:00\",\n      \"PersonId\": 121,\n      \"Time (seconds)\": 2.0,\n      \"id.1\": 121,\n      \"Gender\": \"Unkown\",\n      \"Age Group\": \"Kid\",\n      \"Favorite Activity\": \"Sports\",\n      \"Height\": 45.0,\n      \"zipcode\": 47432,\n      \"state\": \"IN\",\n      \"Event\": \"Sciencefest 2019\"\n    },\n    {\n      \"id\": 182,\n      \"OpponentName\": NaN,\n      \"start\": \"2019-08-24 19:52:04.372 +00:00\",\n      \"end\": \"2019-08-24 19:52:05.994 +00:00\",\n      \"PersonId\": 182,\n      \"Time (seconds)\": 2.0,\n      \"id.1\": 182,\n      \"Gender\": \"Unkown\",\n      \"Age Group\": \"Adult\",\n      \"Favorite Activity\": \"Gaming\",\n      \"Height\": 67.0,\n      \"zipcode\": 45245,\n      \"state\": \"OH\",\n      \"Event\": \"Makevention 2019\"\n    },\n    {\n      \"id\": 301,\n      \"OpponentName\": NaN,\n      \"start\": \"2019-10-26 16:26:02.934 +00:00\",\n      \"end\": \"2019-10-26 16:26:05.459 +00:00\",\n      \"PersonId\": 301,\n      \"Time (seconds)\": 3.0,\n      \"id.1\": 301,\n      \"Gender\": \"Unkown\",\n      \"Age Group\": \"Kid\",\n      \"Favorite Activity\": \"Gaming\",\n      \"Height\": 59.0,\n      \"zipcode\": 47401,\n      \"state\": \"IN\",\n      \"Event\": \"Sciencefest 2019\"\n    },\n    {\n      \"id\": 101,\n      \"OpponentName\": NaN,\n      \"start\": \"2019-08-24 16:33:36.399 +00:00\",\n      \"end\": \"2019-08-24 16:33:42.307 +00:00\",\n      \"PersonId\": 101,\n      \"Time (seconds)\": 6.0,\n      \"id.1\": 101,\n      \"Gender\": \"Unkown\",\n      \"Age Group\": \"Kid\",\n      \"Favorite Activity\": \"Sports\",\n      \"Height\": 49.0,\n      \"zipcode\": 47401,\n      \"state\": \"IN\",\n      \"Event\": \"Sciencefest 2019\"\n    }\n  ],\n  \"column names\": [\n    \"id\",\n    \"OpponentName\",\n    \"start\",\n    \"end\",\n    \"PersonId\",\n    \"Time (seconds)\",\n    \"id.1\",\n    \"Gender\",\n    \"Age Group\",\n    \"Favorite Activity\",\n    \"Height\",\n    \"zipcode\",\n    \"state\",\n    \"Event\"\n  ]\n}\n\nYour Job:\nI am developing a NL to Data Visualization Dataset. \nPlease help me generate natural language utterance for given dataset and constraints.\nDefinition about the Taks:\n- 'utterance' is what a user would say to make a chart. It should be a questions structure. One NL 'utterance' is in one or two sentences. Here are two examples from Questions for reference:\n    How much do various cars weigh?\n    Have cars gotten lighter over time?\n- 'given dataset' is in form of column names, column type, range/unique values of the column.\n- 'constraints' are information about the chart that should be included in the utterance. \n    So we can find a reference phrase in the NL utterance that corresponds to the given constraints. \n- 'reference phrase' can be explicit, ambiguous, and by_value. 'ambiguous' means the phrase can map to more than one columns in the dataset, always a hypernym of column names(depending on the dataset values).\n    For example:\n    {\"column\": \"gdpPercap\", \"nl_ref_type\": \"explicit\", \"nl_ref_phrase\": \"GDP per capita\"},\n    {\"column\": [\"country\",\"continent\"], \"nl_ref_type\": \"ambiguous\", \"nl_ref_phrase\": \"region\"}\n    {\"column\": [\"country\",\"country_short_name\"], \"nl_ref_type\": \"ambiguous\", \"nl_ref_phrase\": \"countries\"}\n    {\"c_type\": \"mark\", \"c_name\": \"point chart\", \"nl_ref_type\": \"explicit\", \"nl_ref_phrase\": \"scatter plot\"}\n    {\"c_type\": \"mark\", \"c_name\": \"arc chart\", \"nl_ref_type\": \"explicit\", \"nl_ref_phrase\": \"pie chart\"}\n    {\"c_type\": \"transform\",\"c_name\": \"filter\",\"c_list\": [{\"field\": \"country\",\"oneOf\": [\"Iceland\",\"Norway\"]}],\"nl_ref_type\": \"explicit\",\"nl_ref_phrase\": \"for countries Iceland and Norway\"},\n    {\"c_type\": \"transform\",\"c_name\": \"filter\",\"c_list\": [{\"field\": \"country\",\"oneOf\": [\"Iceland\",\"Norway\"]}],\"nl_ref_type\": \"by_value\",\"nl_ref_phrase\": \"for Iceland and Norway\"},\n- the 'nl_ref_phrase' for 'ambiguous' columns should be equally near all ambiguous columns, not too near to one of the column since it would not be ambiguous.\n    good example: {\"column\": [\"country\",\"region\"], \"nl_ref_type\": \"ambiguous\", \"nl_ref_phrase\": \"location\"}\n    bad example: {\"column\": [\"country\",\"region\"], \"nl_ref_type\": \"ambiguous\", \"nl_ref_phrase\": \"region\"}\n- You only include given constraints and no other information. \n    For example, if a column name is not in the given constraint, it will not be included in the NL utterance.\n    Also, it a chart mark or chart encoding channel is not in the given constraint, it will not be included in the NL utterance.\n- all 'nl_ref_phrase' shoule be included in the 'nl_utterance'. \n\nThe output format is identical to the input format, but fill in the str blanks(\"...\").\n### Input:\n{\n  \"nl_utterance\": \"...\",\n  \"encoded_fields\": [\n    {\n      \"field\": \"Time (seconds)\",\n      \"type\": \"quantitative\",\n      \"nl_ref_type\": \"explicit\",\n      \"nl_ref_phrase\": \"...\"\n    }\n  ],\n  \"constraints\": [\n    {\n      \"c_type\": \"transform\",\n      \"c_name\": \"filter\",\n      \"c_list\": [\n        {\n          \"field\": \"Height\",\n          \"lt\": 100\n        }\n      ],\n      \"nl_ref_type\": \"explicit\",\n      \"nl_ref_phrase\": \"...\"\n    }\n  ]\n}\n\n### Output:"
}