{
  "gpt_result": {
    "nl_utterance": "Show a correlation between horsepower, miles per gallon, and origin using a scatter plot.",
    "encoded_fields": [
      {
        "field": "Origin",
        "type": "nominal",
        "nl_ref_type": "explicit",
        "nl_ref_phrase": "origin"
      },
      {
        "field": "Horsepower",
        "type": "quantitative",
        "nl_ref_type": "explicit",
        "nl_ref_phrase": "horsepower"
      },
      {
        "field": "Miles_per_Gallon",
        "type": "quantitative",
        "nl_ref_type": "explicit",
        "nl_ref_phrase": "miles per gallon"
      }
    ],
    "constraints": [
      {
        "c_type": "task",
        "c_name": "correlation",
        "c_list": [
          {
            "mark": "circle",
            "encoding": {
              "x": {
                "type": "quantitative"
              },
              "y": {
                "type": "quantitative"
              }
            }
          }
        ],
        "nl_ref_type": "explicit",
        "nl_ref_phrase": "correlation"
      }
    ]
  },
  "input": "Dataset Information: {\n  \"data samples\": [\n    {\n      \"Name\": \"chevrolet chevelle malibu\",\n      \"Miles_per_Gallon\": 18.0,\n      \"Cylinders\": 8,\n      \"Displacement\": 307.0,\n      \"Horsepower\": 130.0,\n      \"Weight_in_lbs\": 3504,\n      \"Acceleration\": 12.0,\n      \"Year\": \"1970-01-01\",\n      \"Origin\": \"USA\"\n    },\n    {\n      \"Name\": \"maxda glc deluxe\",\n      \"Miles_per_Gallon\": 34.1,\n      \"Cylinders\": 4,\n      \"Displacement\": 86.0,\n      \"Horsepower\": 65.0,\n      \"Weight_in_lbs\": 1975,\n      \"Acceleration\": 15.2,\n      \"Year\": \"1979-01-01\",\n      \"Origin\": \"Japan\"\n    },\n    {\n      \"Name\": \"dodge aspen se\",\n      \"Miles_per_Gallon\": 20.0,\n      \"Cylinders\": 6,\n      \"Displacement\": 225.0,\n      \"Horsepower\": 100.0,\n      \"Weight_in_lbs\": 3651,\n      \"Acceleration\": 17.7,\n      \"Year\": \"1976-01-01\",\n      \"Origin\": \"USA\"\n    },\n    {\n      \"Name\": \"chevrolet caprice classic\",\n      \"Miles_per_Gallon\": 13.0,\n      \"Cylinders\": 8,\n      \"Displacement\": 400.0,\n      \"Horsepower\": 150.0,\n      \"Weight_in_lbs\": 4464,\n      \"Acceleration\": 12.0,\n      \"Year\": \"1973-01-01\",\n      \"Origin\": \"USA\"\n    },\n    {\n      \"Name\": \"bmw 2002\",\n      \"Miles_per_Gallon\": 26.0,\n      \"Cylinders\": 4,\n      \"Displacement\": 121.0,\n      \"Horsepower\": 113.0,\n      \"Weight_in_lbs\": 2234,\n      \"Acceleration\": 12.5,\n      \"Year\": \"1970-01-01\",\n      \"Origin\": \"Europe\"\n    }\n  ],\n  \"column names\": [\n    \"Name\",\n    \"Miles_per_Gallon\",\n    \"Cylinders\",\n    \"Displacement\",\n    \"Horsepower\",\n    \"Weight_in_lbs\",\n    \"Acceleration\",\n    \"Year\",\n    \"Origin\"\n  ]\n}\n\nYour Job:\nI am developing a NL to Data Visualization Dataset. \nPlease help me generate natural language utterance for given dataset and constraints.\nDefinition about the Taks:\n- 'utterance' is what a user would say to make a chart.  One NL 'utterance' is in one or two sentences. Here are two examples from Others for reference:\n    Trend for average horsepower over time across different origin.\n    I want to know how many orders there are by the quantity of the order.\n- 'given dataset' is in form of column names, column type, range/unique values of the column.\n- 'constraints' are information about the chart that should be included in the utterance. \n    So we can find a reference phrase in the NL utterance that corresponds to the given constraints. \n- 'reference phrase' can be explicit, ambiguous, and by_value. 'ambiguous' means the phrase can map to more than one columns in the dataset, always a hypernym of column names(depending on the dataset values).\n    For example:\n    {\"column\": \"gdpPercap\", \"nl_ref_type\": \"explicit\", \"nl_ref_phrase\": \"GDP per capita\"},\n    {\"column\": [\"country\",\"continent\"], \"nl_ref_type\": \"ambiguous\", \"nl_ref_phrase\": \"region\"}\n    {\"column\": [\"country\",\"country_short_name\"], \"nl_ref_type\": \"ambiguous\", \"nl_ref_phrase\": \"countries\"}\n    {\"c_type\": \"mark\", \"c_name\": \"point chart\", \"nl_ref_type\": \"explicit\", \"nl_ref_phrase\": \"scatter plot\"}\n    {\"c_type\": \"mark\", \"c_name\": \"arc chart\", \"nl_ref_type\": \"explicit\", \"nl_ref_phrase\": \"pie chart\"}\n    {\"c_type\": \"transform\",\"c_name\": \"filter\",\"c_list\": [{\"field\": \"country\",\"oneOf\": [\"Iceland\",\"Norway\"]}],\"nl_ref_type\": \"explicit\",\"nl_ref_phrase\": \"for countries Iceland and Norway\"},\n    {\"c_type\": \"transform\",\"c_name\": \"filter\",\"c_list\": [{\"field\": \"country\",\"oneOf\": [\"Iceland\",\"Norway\"]}],\"nl_ref_type\": \"by_value\",\"nl_ref_phrase\": \"for Iceland and Norway\"},\n- the 'nl_ref_phrase' for 'ambiguous' columns should be equally near all ambiguous columns, not too near to one of the column since it would not be ambiguous.\n    good example: {\"column\": [\"country\",\"region\"], \"nl_ref_type\": \"ambiguous\", \"nl_ref_phrase\": \"location\"}\n    bad example: {\"column\": [\"country\",\"region\"], \"nl_ref_type\": \"ambiguous\", \"nl_ref_phrase\": \"region\"}\n- You only include given constraints and no other information. \n    For example, if a column name is not in the given constraint, it will not be included in the NL utterance.\n    Also, it a chart mark or chart encoding channel is not in the given constraint, it will not be included in the NL utterance.\n- all 'nl_ref_phrase' shoule be included in the 'nl_utterance'. \n\nThe output format is identical to the input format, but fill in the str blanks(\"...\").\n### Input:\n{\n  \"nl_utterance\": \"...\",\n  \"encoded_fields\": [\n    {\n      \"field\": \"Origin\",\n      \"type\": \"nominal\",\n      \"nl_ref_type\": \"explicit\",\n      \"nl_ref_phrase\": \"...\"\n    },\n    {\n      \"field\": \"Horsepower\",\n      \"type\": \"quantitative\",\n      \"nl_ref_type\": \"explicit\",\n      \"nl_ref_phrase\": \"...\"\n    },\n    {\n      \"field\": \"Miles_per_Gallon\",\n      \"type\": \"quantitative\",\n      \"nl_ref_type\": \"explicit\",\n      \"nl_ref_phrase\": \"...\"\n    }\n  ],\n  \"constraints\": [\n    {\n      \"c_type\": \"task\",\n      \"c_name\": \"correlation\",\n      \"c_list\": [\n        {\n          \"mark\": \"circle\",\n          \"encoding\": {\n            \"x\": {\n              \"type\": \"quantitative\"\n            },\n            \"y\": {\n              \"type\": \"quantitative\"\n            }\n          }\n        }\n      ],\n      \"nl_ref_type\": \"explicit\",\n      \"nl_ref_phrase\": \"...\"\n    }\n  ]\n}\n\n### Output:"
}