{
  "gpt_result": {
    "nl_utterance": "Show me the count of events sorted by age group from Kid to Retired.",
    "encoded_fields": [
      {
        "field": "Time (seconds)",
        "type": "quantitative",
        "nl_ref_type": "explicit",
        "nl_ref_phrase": "Time (seconds)"
      }
    ],
    "constraints": [
      {
        "c_type": "transform",
        "c_name": "aggregate",
        "c_list": [
          {
            "aggregate": "count"
          }
        ],
        "nl_ref_type": "explicit",
        "nl_ref_phrase": "count of events"
      },
      {
        "c_type": "transform",
        "c_name": "sort",
        "c_list": [
          [
            "",
            "Retired",
            "Adult",
            "Teen",
            "Pre-Teen",
            "Kid"
          ]
        ],
        "nl_ref_type": "explicit",
        "nl_ref_phrase": "sorted by age group from Kid to Retired"
      }
    ]
  },
  "input": "Dataset Information: {\n  \"data samples\": [\n    {\n      \"id\": 20,\n      \"OpponentName\": \"Fast person\",\n      \"start\": \"2018-08-25 15:07:29.106 +00:00\",\n      \"end\": \"2018-08-25 15:07:32.662 +00:00\",\n      \"PersonId\": 20,\n      \"Time (seconds)\": 4.0,\n      \"id.1\": 20,\n      \"Gender\": \"male\",\n      \"Age Group\": \"Teen\",\n      \"Favorite Activity\": \"Gaming\",\n      \"Height\": 71.0,\n      \"zipcode\": 35242,\n      \"state\": \"AL\",\n      \"Event\": \"Makevention 2018\"\n    },\n    {\n      \"id\": 33,\n      \"OpponentName\": NaN,\n      \"start\": \"2019-08-21 15:41:36.288 +00:00\",\n      \"end\": \"2019-08-21 15:41:38.362 +00:00\",\n      \"PersonId\": 33,\n      \"Time (seconds)\": 2.0,\n      \"id.1\": 33,\n      \"Gender\": \"Unkown\",\n      \"Age Group\": \"Adult\",\n      \"Favorite Activity\": \"Cooking\",\n      \"Height\": 53.0,\n      \"zipcode\": 47408,\n      \"state\": \"IN\",\n      \"Event\": \"Makevention 2019\"\n    },\n    {\n      \"id\": 146,\n      \"OpponentName\": NaN,\n      \"start\": \"2019-08-24 18:24:04.601 +00:00\",\n      \"end\": \"2019-08-24 18:24:11.184 +00:00\",\n      \"PersonId\": 146,\n      \"Time (seconds)\": 7.0,\n      \"id.1\": 146,\n      \"Gender\": \"Unkown\",\n      \"Age Group\": \"Adult\",\n      \"Favorite Activity\": \"Gaming\",\n      \"Height\": 57.0,\n      \"zipcode\": 47265,\n      \"state\": \"IN\",\n      \"Event\": \"Sciencefest 2019\"\n    },\n    {\n      \"id\": 372,\n      \"OpponentName\": NaN,\n      \"start\": \"2019-10-26 17:55:39.030 +00:00\",\n      \"end\": \"2019-10-26 17:55:43.300 +00:00\",\n      \"PersonId\": 372,\n      \"Time (seconds)\": 4.0,\n      \"id.1\": 372,\n      \"Gender\": \"Unkown\",\n      \"Age Group\": \"Kid\",\n      \"Favorite Activity\": \"Art\",\n      \"Height\": 48.0,\n      \"zipcode\": 47403,\n      \"state\": \"IN\",\n      \"Event\": \"Sciencefest 2019\"\n    },\n    {\n      \"id\": 89,\n      \"OpponentName\": NaN,\n      \"start\": \"2019-08-24 16:05:08.756 +00:00\",\n      \"end\": \"2019-08-24 16:05:10.439 +00:00\",\n      \"PersonId\": 89,\n      \"Time (seconds)\": 2.0,\n      \"id.1\": 89,\n      \"Gender\": \"Unkown\",\n      \"Age Group\": \"Kid\",\n      \"Favorite Activity\": \"Art\",\n      \"Height\": 56.0,\n      \"zipcode\": 47401,\n      \"state\": \"IN\",\n      \"Event\": \"Sciencefest 2019\"\n    }\n  ],\n  \"column names\": [\n    \"id\",\n    \"OpponentName\",\n    \"start\",\n    \"end\",\n    \"PersonId\",\n    \"Time (seconds)\",\n    \"id.1\",\n    \"Gender\",\n    \"Age Group\",\n    \"Favorite Activity\",\n    \"Height\",\n    \"zipcode\",\n    \"state\",\n    \"Event\"\n  ]\n}\n\nYour Job:\nI am developing a NL to Data Visualization Dataset. \nPlease help me generate natural language utterance for given dataset and constraints.\nDefinition about the Taks:\n- 'utterance' is what a user would say to make a chart.  One NL 'utterance' is in one or two sentences. Here are two examples from Others for reference:\n    I want to know how many orders there are by the quantity of the order.\n    scatter(x=production budget, y=worldwide gross) for content rating.\n- 'given dataset' is in form of column names, column type, range/unique values of the column.\n- 'constraints' are information about the chart that should be included in the utterance. \n    So we can find a reference phrase in the NL utterance that corresponds to the given constraints. \n- 'reference phrase' can be explicit, ambiguous, and by_value. 'ambiguous' means the phrase can map to more than one columns in the dataset, always a hypernym of column names(depending on the dataset values).\n    For example:\n    {\"column\": \"gdpPercap\", \"nl_ref_type\": \"explicit\", \"nl_ref_phrase\": \"GDP per capita\"},\n    {\"column\": [\"country\",\"continent\"], \"nl_ref_type\": \"ambiguous\", \"nl_ref_phrase\": \"region\"}\n    {\"column\": [\"country\",\"country_short_name\"], \"nl_ref_type\": \"ambiguous\", \"nl_ref_phrase\": \"countries\"}\n    {\"c_type\": \"mark\", \"c_name\": \"point chart\", \"nl_ref_type\": \"explicit\", \"nl_ref_phrase\": \"scatter plot\"}\n    {\"c_type\": \"mark\", \"c_name\": \"arc chart\", \"nl_ref_type\": \"explicit\", \"nl_ref_phrase\": \"pie chart\"}\n    {\"c_type\": \"transform\",\"c_name\": \"filter\",\"c_list\": [{\"field\": \"country\",\"oneOf\": [\"Iceland\",\"Norway\"]}],\"nl_ref_type\": \"explicit\",\"nl_ref_phrase\": \"for countries Iceland and Norway\"},\n    {\"c_type\": \"transform\",\"c_name\": \"filter\",\"c_list\": [{\"field\": \"country\",\"oneOf\": [\"Iceland\",\"Norway\"]}],\"nl_ref_type\": \"by_value\",\"nl_ref_phrase\": \"for Iceland and Norway\"},\n- the 'nl_ref_phrase' for 'ambiguous' columns should be equally near all ambiguous columns, not too near to one of the column since it would not be ambiguous.\n    good example: {\"column\": [\"country\",\"region\"], \"nl_ref_type\": \"ambiguous\", \"nl_ref_phrase\": \"location\"}\n    bad example: {\"column\": [\"country\",\"region\"], \"nl_ref_type\": \"ambiguous\", \"nl_ref_phrase\": \"region\"}\n- You only include given constraints and no other information. \n    For example, if a column name is not in the given constraint, it will not be included in the NL utterance.\n    Also, it a chart mark or chart encoding channel is not in the given constraint, it will not be included in the NL utterance.\n- all 'nl_ref_phrase' shoule be included in the 'nl_utterance'. \n\nThe output format is identical to the input format, but fill in the str blanks(\"...\").\n### Input:\n{\n  \"nl_utterance\": \"...\",\n  \"encoded_fields\": [\n    {\n      \"field\": \"Time (seconds)\",\n      \"type\": \"quantitative\",\n      \"nl_ref_type\": \"explicit\",\n      \"nl_ref_phrase\": \"...\"\n    }\n  ],\n  \"constraints\": [\n    {\n      \"c_type\": \"transform\",\n      \"c_name\": \"aggregate\",\n      \"c_list\": [\n        {\n          \"aggregate\": \"count\"\n        }\n      ],\n      \"nl_ref_type\": \"explicit\",\n      \"nl_ref_phrase\": \"...\"\n    },\n    {\n      \"c_type\": \"transform\",\n      \"c_name\": \"sort\",\n      \"c_list\": [\n        [\n          \"\",\n          \"Retired\",\n          \"Adult\",\n          \"Teen\",\n          \"Pre-Teen\",\n          \"Kid\"\n        ]\n      ],\n      \"nl_ref_type\": \"explicit\",\n      \"nl_ref_phrase\": \"...\"\n    }\n  ]\n}\n\n### Output:"
}