{
  "gpt_result": {
    "nl_utterance": "Show me a scatter plot to find the correlation between firearm deaths and divisions.",
    "encoded_fields": [
      {
        "field": "Firearm deaths",
        "type": "quantitative",
        "nl_ref_type": "explicit",
        "nl_ref_phrase": "firearm deaths"
      },
      {
        "field": "Division",
        "type": "nominal",
        "nl_ref_type": "explicit",
        "nl_ref_phrase": "divisions"
      }
    ],
    "constraints": [
      {
        "c_type": "task",
        "c_name": "correlation",
        "c_list": [
          {
            "mark": "circle",
            "encoding": {
              "x": {
                "type": "quantitative"
              },
              "y": {
                "type": "quantitative"
              }
            }
          }
        ],
        "nl_ref_type": "explicit",
        "nl_ref_phrase": "correlation"
      }
    ]
  },
  "input": "Dataset Information: {\n  \"data samples\": [\n    {\n      \"State\": \"Alabama\",\n      \"State2\": \"AL\",\n      \"Gini\": 0.472,\n      \"Death Rate\": 21.5,\n      \"Firearms, vs average\": 1.64700475,\n      \"Med income\": 47221,\n      \"Income, vs median\": 0.799827233,\n      \"Imprisonment rates\": 736,\n      \"Prison rate\": 1.264604811,\n      \"Imprisonment rate\": 0.736,\n      \"Firearm deaths\": 0.215,\n      \"Division\": \"South\"\n    },\n    {\n      \"State\": \"Wisconsin\",\n      \"State2\": \"WI\",\n      \"Gini\": 0.43,\n      \"Death Rate\": 11.4,\n      \"Firearms, vs average\": 0.873295542,\n      \"Med income\": 59817,\n      \"Income, vs median\": 1.01317773,\n      \"Imprisonment rates\": 492,\n      \"Prison rate\": 0.845360825,\n      \"Imprisonment rate\": 0.492,\n      \"Firearm deaths\": 0.114,\n      \"Division\": \"Midwest\"\n    },\n    {\n      \"State\": \"Tennessee\",\n      \"State2\": \"TN\",\n      \"Gini\": 0.468,\n      \"Death Rate\": 17.1,\n      \"Firearms, vs average\": 1.309943312,\n      \"Med income\": 51344,\n      \"Income, vs median\": 0.869662427,\n      \"Imprisonment rates\": 545,\n      \"Prison rate\": 0.936426117,\n      \"Imprisonment rate\": 0.545,\n      \"Firearm deaths\": 0.171,\n      \"Division\": \"South\"\n    },\n    {\n      \"State\": \"Alaska\",\n      \"State2\": \"AK\",\n      \"Gini\": 0.422,\n      \"Death Rate\": 23.3,\n      \"Firearms, vs average\": 1.784893519,\n      \"Med income\": 75723,\n      \"Income, vs median\": 1.282592862,\n      \"Imprisonment rates\": 376,\n      \"Prison rate\": 0.64604811,\n      \"Imprisonment rate\": 0.376,\n      \"Firearm deaths\": 0.233,\n      \"Division\": \"West\"\n    },\n    {\n      \"State\": \"Iowa\",\n      \"State2\": \"IA\",\n      \"Gini\": 0.427,\n      \"Death Rate\": 9.2,\n      \"Firearms, vs average\": 0.704764823,\n      \"Med income\": 59094,\n      \"Income, vs median\": 1.000931588,\n      \"Imprisonment rates\": 373,\n      \"Prison rate\": 0.640893471,\n      \"Imprisonment rate\": 0.373,\n      \"Firearm deaths\": 0.092,\n      \"Division\": \"Midwest\"\n    }\n  ],\n  \"column names\": [\n    \"State\",\n    \"State2\",\n    \"Gini\",\n    \"Death Rate\",\n    \"Firearms, vs average\",\n    \"Med income\",\n    \"Income, vs median\",\n    \"Imprisonment rates\",\n    \"Prison rate\",\n    \"Imprisonment rate\",\n    \"Firearm deaths\",\n    \"Division\"\n  ]\n}\n\nYour Job:\nI am developing a NL to Data Visualization Dataset. \nPlease help me generate natural language utterance for given dataset and constraints.\nDefinition about the Taks:\n- 'utterance' is what a user would say to make a chart. It should be a commands structure. One NL 'utterance' is in one or two sentences. Here are two examples from Commands for reference:\n    Help me see outliers in IMDB and Rotten Tomatoes ratings.\n    Show me a bar graph of the profit for each region.\n- 'given dataset' is in form of column names, column type, range/unique values of the column.\n- 'constraints' are information about the chart that should be included in the utterance. \n    So we can find a reference phrase in the NL utterance that corresponds to the given constraints. \n- 'reference phrase' can be explicit, ambiguous, and by_value. 'ambiguous' means the phrase can map to more than one columns in the dataset, always a hypernym of column names(depending on the dataset values).\n    For example:\n    {\"column\": \"gdpPercap\", \"nl_ref_type\": \"explicit\", \"nl_ref_phrase\": \"GDP per capita\"},\n    {\"column\": [\"country\",\"continent\"], \"nl_ref_type\": \"ambiguous\", \"nl_ref_phrase\": \"region\"}\n    {\"column\": [\"country\",\"country_short_name\"], \"nl_ref_type\": \"ambiguous\", \"nl_ref_phrase\": \"countries\"}\n    {\"c_type\": \"mark\", \"c_name\": \"point chart\", \"nl_ref_type\": \"explicit\", \"nl_ref_phrase\": \"scatter plot\"}\n    {\"c_type\": \"mark\", \"c_name\": \"arc chart\", \"nl_ref_type\": \"explicit\", \"nl_ref_phrase\": \"pie chart\"}\n    {\"c_type\": \"transform\",\"c_name\": \"filter\",\"c_list\": [{\"field\": \"country\",\"oneOf\": [\"Iceland\",\"Norway\"]}],\"nl_ref_type\": \"explicit\",\"nl_ref_phrase\": \"for countries Iceland and Norway\"},\n    {\"c_type\": \"transform\",\"c_name\": \"filter\",\"c_list\": [{\"field\": \"country\",\"oneOf\": [\"Iceland\",\"Norway\"]}],\"nl_ref_type\": \"by_value\",\"nl_ref_phrase\": \"for Iceland and Norway\"},\n- the 'nl_ref_phrase' for 'ambiguous' columns should be equally near all ambiguous columns, not too near to one of the column since it would not be ambiguous.\n    good example: {\"column\": [\"country\",\"region\"], \"nl_ref_type\": \"ambiguous\", \"nl_ref_phrase\": \"location\"}\n    bad example: {\"column\": [\"country\",\"region\"], \"nl_ref_type\": \"ambiguous\", \"nl_ref_phrase\": \"region\"}\n- You only include given constraints and no other information. \n    For example, if a column name is not in the given constraint, it will not be included in the NL utterance.\n    Also, it a chart mark or chart encoding channel is not in the given constraint, it will not be included in the NL utterance.\n- all 'nl_ref_phrase' shoule be included in the 'nl_utterance'. \n\nThe output format is identical to the input format, but fill in the str blanks(\"...\").\n### Input:\n{\n  \"nl_utterance\": \"...\",\n  \"encoded_fields\": [\n    {\n      \"field\": \"Firearm deaths\",\n      \"type\": \"quantitative\",\n      \"nl_ref_type\": \"explicit\",\n      \"nl_ref_phrase\": \"...\"\n    },\n    {\n      \"field\": \"Division\",\n      \"type\": \"nominal\",\n      \"nl_ref_type\": \"explicit\",\n      \"nl_ref_phrase\": \"...\"\n    }\n  ],\n  \"constraints\": [\n    {\n      \"c_type\": \"task\",\n      \"c_name\": \"correlation\",\n      \"c_list\": [\n        {\n          \"mark\": \"circle\",\n          \"encoding\": {\n            \"x\": {\n              \"type\": \"quantitative\"\n            },\n            \"y\": {\n              \"type\": \"quantitative\"\n            }\n          }\n        }\n      ],\n      \"nl_ref_type\": \"explicit\",\n      \"nl_ref_phrase\": \"...\"\n    }\n  ]\n}\n\n### Output:"
}