{
  "gpt_result": {
    "nl_utterance": "What is the trend of 7-day moving average of cases over time in the countries UK, France, Germany, and Portugal?",
    "encoded_fields": [
      {
        "field": "date2",
        "type": "temporal",
        "nl_ref_type": "explicit",
        "nl_ref_phrase": "over time"
      },
      {
        "field": "cases_ma7",
        "type": "quantitative",
        "nl_ref_type": "explicit",
        "nl_ref_phrase": "7-day moving average of cases"
      },
      {
        "field": "country",
        "type": "nominal",
        "nl_ref_type": "explicit",
        "nl_ref_phrase": "countries"
      }
    ],
    "constraints": [
      {
        "c_type": "task",
        "c_name": "trend",
        "c_list": [
          {
            "mark": [
              "bar",
              "line",
              "area"
            ],
            "encoding": {
              "x": {
                "type": "temporal"
              }
            }
          }
        ],
        "nl_ref_type": "explicit",
        "nl_ref_phrase": "trend"
      },
      {
        "c_type": "transform",
        "c_name": "filter",
        "c_list": [
          {
            "field": "country",
            "oneOf": [
              "UK",
              "France",
              "Germany",
              "Portugal"
            ]
          }
        ],
        "nl_ref_type": "explicit",
        "nl_ref_phrase": "in the countries UK, France, Germany, and Portugal"
      }
    ]
  },
  "input": "Dataset Information: {\n  \"data samples\": [\n    {\n      \"date\": 20191231,\n      \"daterep\": \"31/12/2019\",\n      \"date2\": \"2019-12-31\",\n      \"day\": 31,\n      \"days\": 1,\n      \"month\": 12,\n      \"year\": 2019,\n      \"cases\": 0,\n      \"deaths\": 0,\n      \"country\": \"Afghanistan\",\n      \"geoid\": \"AF\",\n      \"countryterritorycode\": \"AFG\",\n      \"popdata2019\": 38041757.0,\n      \"continentexp\": \"Asia\",\n      \"cumulative_number_for_14_days_of\": NaN,\n      \"pop\": 38041757.0,\n      \"poprank\": 37.0,\n      \"t\": 1,\n      \"c\": 1,\n      \"cases_cml\": 0,\n      \"cases_ma7\": NaN,\n      \"cases_pop\": 0.0,\n      \"cases_cml_pop\": 0.0,\n      \"deaths_cml\": 0,\n      \"deaths_ma7\": NaN,\n      \"deaths_pop\": 0.0,\n      \"deaths_cml_pop\": 0.0,\n      \"deaths_rate\": NaN,\n      \"neighbours\": 0,\n      \"p20\": 0\n    },\n    {\n      \"date\": 20200301,\n      \"daterep\": \"01/03/2020\",\n      \"date2\": \"2020-3-1\",\n      \"day\": 1,\n      \"days\": 62,\n      \"month\": 3,\n      \"year\": 2020,\n      \"cases\": 3,\n      \"deaths\": 1,\n      \"country\": \"US\",\n      \"geoid\": \"US\",\n      \"countryterritorycode\": \"USA\",\n      \"popdata2019\": 329064917.0,\n      \"continentexp\": \"America\",\n      \"cumulative_number_for_14_days_of\": 0.01641014,\n      \"pop\": 329064917.0,\n      \"poprank\": 3.0,\n      \"t\": 62,\n      \"c\": 204,\n      \"cases_cml\": 69,\n      \"cases_ma7\": 4.8571429,\n      \"cases_pop\": 9.116742e-09,\n      \"cases_cml_pop\": 2.0968507e-07,\n      \"deaths_cml\": 1,\n      \"deaths_ma7\": 0.14285715,\n      \"deaths_pop\": 3.038914e-09,\n      \"deaths_cml_pop\": 3.038914e-09,\n      \"deaths_rate\": 0.014492754,\n      \"neighbours\": 0,\n      \"p20\": 1\n    },\n    {\n      \"date\": 20200428,\n      \"daterep\": \"28/04/2020\",\n      \"date2\": \"2020-4-28\",\n      \"day\": 28,\n      \"days\": 120,\n      \"month\": 4,\n      \"year\": 2020,\n      \"cases\": 0,\n      \"deaths\": 0,\n      \"country\": \"Bahamas\",\n      \"geoid\": \"BS\",\n      \"countryterritorycode\": \"BHS\",\n      \"popdata2019\": 389486.0,\n      \"continentexp\": \"America\",\n      \"cumulative_number_for_14_days_of\": 7.959208,\n      \"pop\": 389486.0,\n      \"poprank\": 173.0,\n      \"t\": 120,\n      \"c\": 14,\n      \"cases_cml\": 80,\n      \"cases_ma7\": 2.8571429,\n      \"cases_pop\": 0.0,\n      \"cases_cml_pop\": 0.00020539892,\n      \"deaths_cml\": 11,\n      \"deaths_ma7\": 0.2857143,\n      \"deaths_pop\": 0.0,\n      \"deaths_cml_pop\": 2.824235e-05,\n      \"deaths_rate\": 0.1375,\n      \"neighbours\": 0,\n      \"p20\": 0\n    },\n    {\n      \"date\": 20201125,\n      \"daterep\": \"25/11/2020\",\n      \"date2\": \"2020-11-25\",\n      \"day\": 25,\n      \"days\": 331,\n      \"month\": 11,\n      \"year\": 2020,\n      \"cases\": 0,\n      \"deaths\": 0,\n      \"country\": \"Montserrat\",\n      \"geoid\": \"MS\",\n      \"countryterritorycode\": \"MSF\",\n      \"popdata2019\": 4991.0,\n      \"continentexp\": \"America\",\n      \"cumulative_number_for_14_days_of\": 0.0,\n      \"pop\": 4991.0,\n      \"poprank\": 210.0,\n      \"t\": 331,\n      \"c\": 133,\n      \"cases_cml\": 13,\n      \"cases_ma7\": 0.0,\n      \"cases_pop\": 0.0,\n      \"cases_cml_pop\": 0.0026046885,\n      \"deaths_cml\": 1,\n      \"deaths_ma7\": 0.0,\n      \"deaths_pop\": 0.0,\n      \"deaths_cml_pop\": 0.00020036065,\n      \"deaths_rate\": 0.07692308,\n      \"neighbours\": 0,\n      \"p20\": 0\n    },\n    {\n      \"date\": 20200402,\n      \"daterep\": \"02/04/2020\",\n      \"date2\": \"2020-4-2\",\n      \"day\": 2,\n      \"days\": 94,\n      \"month\": 4,\n      \"year\": 2020,\n      \"cases\": 2987,\n      \"deaths\": 138,\n      \"country\": \"Iran\",\n      \"geoid\": \"IR\",\n      \"countryterritorycode\": \"IRN\",\n      \"popdata2019\": 82913893.0,\n      \"continentexp\": \"Asia\",\n      \"cumulative_number_for_14_days_of\": 36.461922,\n      \"pop\": 82913893.0,\n      \"poprank\": 18.0,\n      \"t\": 94,\n      \"c\": 95,\n      \"cases_cml\": 47593,\n      \"cases_ma7\": 3254.5715,\n      \"cases_pop\": 3.6025325e-05,\n      \"cases_cml_pop\": 0.00057400513,\n      \"deaths_cml\": 3036,\n      \"deaths_ma7\": 157.42857,\n      \"deaths_pop\": 1.6643772e-06,\n      \"deaths_cml_pop\": 3.66163e-05,\n      \"deaths_rate\": 0.063790895,\n      \"neighbours\": 0,\n      \"p20\": 1\n    }\n  ],\n  \"column names\": [\n    \"date\",\n    \"daterep\",\n    \"date2\",\n    \"day\",\n    \"days\",\n    \"month\",\n    \"year\",\n    \"cases\",\n    \"deaths\",\n    \"country\",\n    \"geoid\",\n    \"countryterritorycode\",\n    \"popdata2019\",\n    \"continentexp\",\n    \"cumulative_number_for_14_days_of\",\n    \"pop\",\n    \"poprank\",\n    \"t\",\n    \"c\",\n    \"cases_cml\",\n    \"cases_ma7\",\n    \"cases_pop\",\n    \"cases_cml_pop\",\n    \"deaths_cml\",\n    \"deaths_ma7\",\n    \"deaths_pop\",\n    \"deaths_cml_pop\",\n    \"deaths_rate\",\n    \"neighbours\",\n    \"p20\"\n  ]\n}\n\nYour Job:\nI am developing a NL to Data Visualization Dataset. \nPlease help me generate natural language utterance for given dataset and constraints.\nDefinition about the Taks:\n- 'utterance' is what a user would say to make a chart. It should be a questions structure. One NL 'utterance' is in one or two sentences. Here are two examples from Questions for reference:\n    What is our profit based on shipping mode by customer segment?\n    Are IMDb rating and rotten tomatoes rating related?\n- 'given dataset' is in form of column names, column type, range/unique values of the column.\n- 'constraints' are information about the chart that should be included in the utterance. \n    So we can find a reference phrase in the NL utterance that corresponds to the given constraints. \n- 'reference phrase' can be explicit, ambiguous, and by_value. 'ambiguous' means the phrase can map to more than one columns in the dataset, always a hypernym of column names(depending on the dataset values).\n    For example:\n    {\"column\": \"gdpPercap\", \"nl_ref_type\": \"explicit\", \"nl_ref_phrase\": \"GDP per capita\"},\n    {\"column\": [\"country\",\"continent\"], \"nl_ref_type\": \"ambiguous\", \"nl_ref_phrase\": \"region\"}\n    {\"column\": [\"country\",\"country_short_name\"], \"nl_ref_type\": \"ambiguous\", \"nl_ref_phrase\": \"countries\"}\n    {\"c_type\": \"mark\", \"c_name\": \"point chart\", \"nl_ref_type\": \"explicit\", \"nl_ref_phrase\": \"scatter plot\"}\n    {\"c_type\": \"mark\", \"c_name\": \"arc chart\", \"nl_ref_type\": \"explicit\", \"nl_ref_phrase\": \"pie chart\"}\n    {\"c_type\": \"transform\",\"c_name\": \"filter\",\"c_list\": [{\"field\": \"country\",\"oneOf\": [\"Iceland\",\"Norway\"]}],\"nl_ref_type\": \"explicit\",\"nl_ref_phrase\": \"for countries Iceland and Norway\"},\n    {\"c_type\": \"transform\",\"c_name\": \"filter\",\"c_list\": [{\"field\": \"country\",\"oneOf\": [\"Iceland\",\"Norway\"]}],\"nl_ref_type\": \"by_value\",\"nl_ref_phrase\": \"for Iceland and Norway\"},\n- the 'nl_ref_phrase' for 'ambiguous' columns should be equally near all ambiguous columns, not too near to one of the column since it would not be ambiguous.\n    good example: {\"column\": [\"country\",\"region\"], \"nl_ref_type\": \"ambiguous\", \"nl_ref_phrase\": \"location\"}\n    bad example: {\"column\": [\"country\",\"region\"], \"nl_ref_type\": \"ambiguous\", \"nl_ref_phrase\": \"region\"}\n- You only include given constraints and no other information. \n    For example, if a column name is not in the given constraint, it will not be included in the NL utterance.\n    Also, it a chart mark or chart encoding channel is not in the given constraint, it will not be included in the NL utterance.\n- all 'nl_ref_phrase' shoule be included in the 'nl_utterance'. \n\nThe output format is identical to the input format, but fill in the str blanks(\"...\").\n### Input:\n{\n  \"nl_utterance\": \"...\",\n  \"encoded_fields\": [\n    {\n      \"field\": \"date2\",\n      \"type\": \"temporal\",\n      \"nl_ref_type\": \"explicit\",\n      \"nl_ref_phrase\": \"...\"\n    },\n    {\n      \"field\": \"cases_ma7\",\n      \"type\": \"quantitative\",\n      \"nl_ref_type\": \"explicit\",\n      \"nl_ref_phrase\": \"...\"\n    },\n    {\n      \"field\": \"country\",\n      \"type\": \"nominal\",\n      \"nl_ref_type\": \"explicit\",\n      \"nl_ref_phrase\": \"...\"\n    }\n  ],\n  \"constraints\": [\n    {\n      \"c_type\": \"task\",\n      \"c_name\": \"trend\",\n      \"c_list\": [\n        {\n          \"mark\": [\n            \"bar\",\n            \"line\",\n            \"area\"\n          ],\n          \"encoding\": {\n            \"x\": {\n              \"type\": \"temporal\"\n            }\n          }\n        }\n      ],\n      \"nl_ref_type\": \"explicit\",\n      \"nl_ref_phrase\": \"...\"\n    },\n    {\n      \"c_type\": \"transform\",\n      \"c_name\": \"filter\",\n      \"c_list\": [\n        {\n          \"field\": \"country\",\n          \"oneOf\": [\n            \"UK\",\n            \"France\",\n            \"Germany\",\n            \"Portugal\"\n          ]\n        }\n      ],\n      \"nl_ref_type\": \"explicit\",\n      \"nl_ref_phrase\": \"...\"\n    }\n  ]\n}\n\n### Output:"
}