{
  "gpt_result": {
    "nl_utterance": "Show me the count of participants in each time interval.",
    "encoded_fields": [
      {
        "field": "Time (seconds)",
        "type": "quantitative",
        "nl_ref_type": "explicit",
        "nl_ref_phrase": "time interval"
      }
    ],
    "constraints": [
      {
        "c_type": "transform",
        "c_name": "aggregate",
        "c_list": [
          {
            "aggregate": "count"
          }
        ],
        "nl_ref_type": "explicit",
        "nl_ref_phrase": "count of participants"
      }
    ]
  },
  "input": "Dataset Information: {\n  \"data samples\": [\n    {\n      \"id\": 20,\n      \"OpponentName\": \"Fast person\",\n      \"start\": \"2018-08-25 15:07:29.106 +00:00\",\n      \"end\": \"2018-08-25 15:07:32.662 +00:00\",\n      \"PersonId\": 20,\n      \"Time (seconds)\": 4.0,\n      \"id.1\": 20,\n      \"Gender\": \"male\",\n      \"Age Group\": \"Teen\",\n      \"Favorite Activity\": \"Gaming\",\n      \"Height\": 71.0,\n      \"zipcode\": 35242,\n      \"state\": \"AL\",\n      \"Event\": \"Makevention 2018\"\n    },\n    {\n      \"id\": 354,\n      \"OpponentName\": \"None\",\n      \"start\": \"2019-10-26 17:26:55.713 +00:00\",\n      \"end\": \"2019-10-26 17:26:58.351 +00:00\",\n      \"PersonId\": 354,\n      \"Time (seconds)\": 3.0,\n      \"id.1\": 354,\n      \"Gender\": \"Unkown\",\n      \"Age Group\": \"Kid\",\n      \"Favorite Activity\": \"Sports\",\n      \"Height\": 56.0,\n      \"zipcode\": 47408,\n      \"state\": \"IN\",\n      \"Event\": \"Sciencefest 2019\"\n    },\n    {\n      \"id\": 93,\n      \"OpponentName\": \"Slow person\",\n      \"start\": \"2018-08-25 19:22:40.274 +00:00\",\n      \"end\": \"2018-08-25 19:22:45.000 +00:00\",\n      \"PersonId\": 93,\n      \"Time (seconds)\": 5.0,\n      \"id.1\": 93,\n      \"Gender\": \"other\",\n      \"Age Group\": \"Retired\",\n      \"Favorite Activity\": \"Sports\",\n      \"Height\": 45.0,\n      \"zipcode\": 47401,\n      \"state\": \"IN\",\n      \"Event\": \"Makevention 2018\"\n    }\n  ],\n  \"column names\": [\n    \"id\",\n    \"OpponentName\",\n    \"start\",\n    \"end\",\n    \"PersonId\",\n    \"Time (seconds)\",\n    \"id.1\",\n    \"Gender\",\n    \"Age Group\",\n    \"Favorite Activity\",\n    \"Height\",\n    \"zipcode\",\n    \"state\",\n    \"Event\"\n  ]\n}\n\nYour Job:\nI am developing a NL to Data Visualization Dataset. \nPlease help me generate natural language utterance for given dataset and constraints.\nDefinition about the Taks:\n- 'utterance' is what a user would say to make a chart, it can be a question or a command. One NL 'utterance' is in one or two sentences. \n- 'given dataset' is in form of column names, column type, range/unique values of the column.\n- 'constraints' are information about the chart that should be included in the utterance. \n    So we can find a reference phrase in the NL utterance that corresponds to the given constraints. \n- 'reference phrase' can be explicit, ambiguous, and by_value. 'ambiguous' means the phrase can map to more than one columns in the dataset, always a hypernym of column names(depending on the dataset values).\n    For example:\n    {\"column\": \"gdpPercap\", \"nl_ref_type\": \"explicit\", \"nl_ref_phrase\": \"GDP per capita\"},\n    {\"column\": [\"country\",\"continent\"], \"nl_ref_type\": \"ambiguous\", \"nl_ref_phrase\": \"region\"}\n    {\"column\": [\"country\",\"country_short_name\"], \"nl_ref_type\": \"ambiguous\", \"nl_ref_phrase\": \"countries\"}\n    {\"c_type\": \"mark\", \"c_name\": \"point chart\", \"nl_ref_type\": \"explicit\", \"nl_ref_phrase\": \"scatter plot\"}\n    {\"c_type\": \"mark\", \"c_name\": \"arc chart\", \"nl_ref_type\": \"explicit\", \"nl_ref_phrase\": \"pie chart\"}\n    {\"c_type\": \"transform\",\"c_name\": \"filter\",\"c_list\": [{\"field\": \"country\",\"oneOf\": [\"Iceland\",\"Norway\"]}],\"nl_ref_type\": \"explicit\",\"nl_ref_phrase\": \"for countries Iceland and Norway\"},\n    {\"c_type\": \"transform\",\"c_name\": \"filter\",\"c_list\": [{\"field\": \"country\",\"oneOf\": [\"Iceland\",\"Norway\"]}],\"nl_ref_type\": \"by_value\",\"nl_ref_phrase\": \"for Iceland and Norway\"},\n- the 'nl_ref_phrase' for 'ambiguous' columns should be equally near all ambiguous columns, not too near to one of the column since it would not be ambiguous.\n    good example: {\"column\": [\"country\",\"region\"], \"nl_ref_type\": \"ambiguous\", \"nl_ref_phrase\": \"location\"}\n    bad example: {\"column\": [\"country\",\"region\"], \"nl_ref_type\": \"ambiguous\", \"nl_ref_phrase\": \"region\"}\n- You only include given constraints and no other information. \n    For example, if a column name is not in the given constraint, it will not be included in the NL utterance.\n    Also, it a chart mark or chart encoding channel is not in the given constraint, it will not be included in the NL utterance.\n- all 'nl_ref_phrase' shoule be included in the 'nl_utterance'. \n\nThe output format is identical to the input format, but fill in the str blanks(\"...\").\n### Input:\n{\n  \"nl_utterance\": \"...\",\n  \"encoded_fields\": [\n    {\n      \"field\": \"Time (seconds)\",\n      \"type\": \"quantitative\",\n      \"nl_ref_type\": \"explicit\",\n      \"nl_ref_phrase\": \"...\"\n    }\n  ],\n  \"constraints\": [\n    {\n      \"c_type\": \"transform\",\n      \"c_name\": \"aggregate\",\n      \"c_list\": [\n        {\n          \"aggregate\": \"count\"\n        }\n      ],\n      \"nl_ref_type\": \"explicit\",\n      \"nl_ref_phrase\": \"...\"\n    }\n  ]\n}\n\n### Output:"
}