{
  "gpt_result": {
    "nl_utterance": "How did the trend of COVID-19 cases change over the weeks in the United Kingdom, France, Germany, India, and America?",
    "encoded_fields": [
      {
        "field": "year_week",
        "type": "nominal",
        "nl_ref_type": "explicit",
        "nl_ref_phrase": "weeks"
      },
      {
        "field": "country",
        "type": "nominal",
        "nl_ref_type": "explicit",
        "nl_ref_phrase": "country"
      }
    ],
    "constraints": [
      {
        "c_type": "task",
        "c_name": "trend",
        "c_list": [
          {
            "mark": [
              "bar",
              "line",
              "area"
            ],
            "encoding": {
              "x": {
                "type": "temporal"
              }
            }
          }
        ],
        "nl_ref_type": "explicit",
        "nl_ref_phrase": "trend"
      },
      {
        "c_type": "transform",
        "c_name": "filter",
        "c_list": [
          {
            "field": "country",
            "oneOf": [
              "United Kingdom",
              "France",
              "Germany",
              "India",
              "America (total)"
            ]
          }
        ],
        "nl_ref_type": "explicit",
        "nl_ref_phrase": "in the United Kingdom, France, Germany, India, and America"
      },
      {
        "c_type": "transform",
        "c_name": "filter",
        "c_list": [
          {
            "field": "indicator",
            "oneOf": [
              "cases"
            ]
          }
        ],
        "nl_ref_type": "explicit",
        "nl_ref_phrase": "COVID-19 cases"
      }
    ]
  },
  "input": "Dataset Information: {\n  \"data samples\": [\n    {\n      \"country\": \"Afghanistan\",\n      \"country_code\": \"AFG\",\n      \"continent\": \"Asia\",\n      \"population\": 38928341,\n      \"indicator\": \"cases\",\n      \"weekly_count\": 0,\n      \"year_week\": \"2020-01\",\n      \"rate_14_day\": NaN,\n      \"cumulative_count\": 0,\n      \"source\": \"Epidemic intelligence, national weekly data\"\n    },\n    {\n      \"country\": \"Japan\",\n      \"country_code\": \"JPN\",\n      \"continent\": \"Asia\",\n      \"population\": 126476458,\n      \"indicator\": \"cases\",\n      \"weekly_count\": 4893,\n      \"year_week\": \"2020-30\",\n      \"rate_14_day\": 6.420958,\n      \"cumulative_count\": 29989,\n      \"source\": \"Epidemic intelligence, national weekly data\"\n    },\n    {\n      \"country\": \"Croatia\",\n      \"country_code\": \"HRV\",\n      \"continent\": \"Europe\",\n      \"population\": 4058165,\n      \"indicator\": \"deaths\",\n      \"weekly_count\": 39,\n      \"year_week\": \"2020-42\",\n      \"rate_14_day\": 16.017092,\n      \"cumulative_count\": 363,\n      \"source\": \"Epidemic intelligence, national weekly data\"\n    },\n    {\n      \"country\": \"Pakistan\",\n      \"country_code\": \"PAK\",\n      \"continent\": \"Asia\",\n      \"population\": 220892331,\n      \"indicator\": \"deaths\",\n      \"weekly_count\": 181,\n      \"year_week\": \"2020-18\",\n      \"rate_14_day\": 1.2947484,\n      \"cumulative_count\": 462,\n      \"source\": \"Epidemic intelligence, national weekly data\"\n    },\n    {\n      \"country\": \"Asia (total)\",\n      \"country_code\": NaN,\n      \"continent\": \"Asia\",\n      \"population\": 4493359026,\n      \"indicator\": \"deaths\",\n      \"weekly_count\": 7221,\n      \"year_week\": \"2021-04\",\n      \"rate_14_day\": 3.0565107,\n      \"cumulative_count\": 338028,\n      \"source\": \"Epidemic intelligence, national weekly data\"\n    }\n  ],\n  \"column names\": [\n    \"country\",\n    \"country_code\",\n    \"continent\",\n    \"population\",\n    \"indicator\",\n    \"weekly_count\",\n    \"year_week\",\n    \"rate_14_day\",\n    \"cumulative_count\",\n    \"source\"\n  ]\n}\n\nYour Job:\nI am developing a NL to Data Visualization Dataset. \nPlease help me generate natural language utterance for given dataset and constraints.\nDefinition about the Taks:\n- 'utterance' is what a user would say to make a chart. It should be a questions structure. One NL 'utterance' is in one or two sentences. Here are two examples from Questions for reference:\n    On average, how much was earned by movies of each genre?\n    Are IMDb rating and rotten tomatoes rating related?\n- 'given dataset' is in form of column names, column type, range/unique values of the column.\n- 'constraints' are information about the chart that should be included in the utterance. \n    So we can find a reference phrase in the NL utterance that corresponds to the given constraints. \n- 'reference phrase' can be explicit, ambiguous, and by_value. 'ambiguous' means the phrase can map to more than one columns in the dataset, always a hypernym of column names(depending on the dataset values).\n    For example:\n    {\"column\": \"gdpPercap\", \"nl_ref_type\": \"explicit\", \"nl_ref_phrase\": \"GDP per capita\"},\n    {\"column\": [\"country\",\"continent\"], \"nl_ref_type\": \"ambiguous\", \"nl_ref_phrase\": \"region\"}\n    {\"column\": [\"country\",\"country_short_name\"], \"nl_ref_type\": \"ambiguous\", \"nl_ref_phrase\": \"countries\"}\n    {\"c_type\": \"mark\", \"c_name\": \"point chart\", \"nl_ref_type\": \"explicit\", \"nl_ref_phrase\": \"scatter plot\"}\n    {\"c_type\": \"mark\", \"c_name\": \"arc chart\", \"nl_ref_type\": \"explicit\", \"nl_ref_phrase\": \"pie chart\"}\n    {\"c_type\": \"transform\",\"c_name\": \"filter\",\"c_list\": [{\"field\": \"country\",\"oneOf\": [\"Iceland\",\"Norway\"]}],\"nl_ref_type\": \"explicit\",\"nl_ref_phrase\": \"for countries Iceland and Norway\"},\n    {\"c_type\": \"transform\",\"c_name\": \"filter\",\"c_list\": [{\"field\": \"country\",\"oneOf\": [\"Iceland\",\"Norway\"]}],\"nl_ref_type\": \"by_value\",\"nl_ref_phrase\": \"for Iceland and Norway\"},\n- the 'nl_ref_phrase' for 'ambiguous' columns should be equally near all ambiguous columns, not too near to one of the column since it would not be ambiguous.\n    good example: {\"column\": [\"country\",\"region\"], \"nl_ref_type\": \"ambiguous\", \"nl_ref_phrase\": \"location\"}\n    bad example: {\"column\": [\"country\",\"region\"], \"nl_ref_type\": \"ambiguous\", \"nl_ref_phrase\": \"region\"}\n- You only include given constraints and no other information. \n    For example, if a column name is not in the given constraint, it will not be included in the NL utterance.\n    Also, it a chart mark or chart encoding channel is not in the given constraint, it will not be included in the NL utterance.\n- all 'nl_ref_phrase' shoule be included in the 'nl_utterance'. \n\nThe output format is identical to the input format, but fill in the str blanks(\"...\").\n### Input:\n{\n  \"nl_utterance\": \"...\",\n  \"encoded_fields\": [\n    {\n      \"field\": \"year_week\",\n      \"type\": \"nominal\",\n      \"nl_ref_type\": \"explicit\",\n      \"nl_ref_phrase\": \"...\"\n    },\n    {\n      \"field\": \"country\",\n      \"type\": \"nominal\",\n      \"nl_ref_type\": \"explicit\",\n      \"nl_ref_phrase\": \"...\"\n    }\n  ],\n  \"constraints\": [\n    {\n      \"c_type\": \"task\",\n      \"c_name\": \"trend\",\n      \"c_list\": [\n        {\n          \"mark\": [\n            \"bar\",\n            \"line\",\n            \"area\"\n          ],\n          \"encoding\": {\n            \"x\": {\n              \"type\": \"temporal\"\n            }\n          }\n        }\n      ],\n      \"nl_ref_type\": \"explicit\",\n      \"nl_ref_phrase\": \"...\"\n    },\n    {\n      \"c_type\": \"transform\",\n      \"c_name\": \"filter\",\n      \"c_list\": [\n        {\n          \"field\": \"country\",\n          \"oneOf\": [\n            \"United Kingdom\",\n            \"France\",\n            \"Germany\",\n            \"India\",\n            \"America (total)\"\n          ]\n        }\n      ],\n      \"nl_ref_type\": \"explicit\",\n      \"nl_ref_phrase\": \"...\"\n    },\n    {\n      \"c_type\": \"transform\",\n      \"c_name\": \"filter\",\n      \"c_list\": [\n        {\n          \"field\": \"indicator\",\n          \"oneOf\": [\n            \"cases\"\n          ]\n        }\n      ],\n      \"nl_ref_type\": \"explicit\",\n      \"nl_ref_phrase\": \"...\"\n    }\n  ]\n}\n\n### Output:"
}