{
  "gpt_result": {
    "nl_utterance": "Show the total sum of Total_billion.",
    "encoded_fields": [
      {
        "field": "Total_billion",
        "type": "quantitative",
        "nl_ref_type": "explicit",
        "nl_ref_phrase": "Total_billion"
      }
    ],
    "constraints": [
      {
        "c_type": "transform",
        "c_name": "aggregate",
        "c_list": [
          {
            "field": "Total_billion",
            "aggregate": "sum"
          }
        ],
        "nl_ref_type": "explicit",
        "nl_ref_phrase": "total sum"
      }
    ]
  },
  "input": "Dataset Information: {\n  \"data samples\": [\n    {\n      \"Date\": \"12/31/2021\",\n      \"GRA Purchases\": 89474552025.0,\n      \"PRGT 1/2/\": 14554823681.0,\n      \"Totals\": 104029375706.0,\n      \"Year\": 2021.0,\n      \"Total_billion\": 104.0293757,\n      \"World GDP (current US$)\": 96100100000000.0,\n      \"Total_%_WorldGDP \": 0.108251069\n    },\n    {\n      \"Date\": \"12/31/2013\",\n      \"GRA Purchases\": 83899249061.0,\n      \"PRGT 1/2/\": 6174392682.0,\n      \"Totals\": 90073641743.0,\n      \"Year\": 2013.0,\n      \"Total_billion\": 90.07364174,\n      \"World GDP (current US$)\": 77607200000000.0,\n      \"Total_%_WorldGDP \": 0.116063514\n    },\n    {\n      \"Date\": \"12/31/2011\",\n      \"GRA Purchases\": 87276915790.0,\n      \"PRGT 1/2/\": 5308609594.0,\n      \"Totals\": 92585525384.0,\n      \"Year\": 2011.0,\n      \"Total_billion\": 92.58552538,\n      \"World GDP (current US$)\": 73853800000000.0,\n      \"Total_%_WorldGDP \": 0.125363279\n    },\n    {\n      \"Date\": \"12/31/1990\",\n      \"GRA Purchases\": 20731851093.0,\n      \"PRGT 1/2/\": 2571911617.0,\n      \"Totals\": 23303762710.0,\n      \"Year\": 1990.0,\n      \"Total_billion\": 23.30376271,\n      \"World GDP (current US$)\": 22780000000000.0,\n      \"Total_%_WorldGDP \": 0.102299317\n    },\n    {\n      \"Date\": \"12/31/2008\",\n      \"GRA Purchases\": 17514964723.0,\n      \"PRGT 1/2/\": 3972372030.0,\n      \"Totals\": 21487336753.0,\n      \"Year\": 2008.0,\n      \"Total_billion\": 21.48733675,\n      \"World GDP (current US$)\": 64123700000000.0,\n      \"Total_%_WorldGDP \": 0.033509194\n    }\n  ],\n  \"column names\": [\n    \"Date\",\n    \"GRA Purchases\",\n    \"PRGT 1/2/\",\n    \"Totals\",\n    \"Year\",\n    \"Total_billion\",\n    \"World GDP (current US$)\",\n    \"Total_%_WorldGDP \"\n  ]\n}\n\nYour Job:\nI am developing a NL to Data Visualization Dataset. \nPlease help me generate natural language utterance for given dataset and constraints.\nDefinition about the Taks:\n- 'utterance' is what a user would say to make a chart.  One NL 'utterance' is in one or two sentences. Here are two examples from Others for reference:\n    scatter(x=production budget, y=worldwide gross) for content rating.\n    Trend for average horsepower over time across different origin.\n- 'given dataset' is in form of column names, column type, range/unique values of the column.\n- 'constraints' are information about the chart that should be included in the utterance. \n    So we can find a reference phrase in the NL utterance that corresponds to the given constraints. \n- 'reference phrase' can be explicit, ambiguous, and by_value. 'ambiguous' means the phrase can map to more than one columns in the dataset, always a hypernym of column names(depending on the dataset values).\n    For example:\n    {\"column\": \"gdpPercap\", \"nl_ref_type\": \"explicit\", \"nl_ref_phrase\": \"GDP per capita\"},\n    {\"column\": [\"country\",\"continent\"], \"nl_ref_type\": \"ambiguous\", \"nl_ref_phrase\": \"region\"}\n    {\"column\": [\"country\",\"country_short_name\"], \"nl_ref_type\": \"ambiguous\", \"nl_ref_phrase\": \"countries\"}\n    {\"c_type\": \"mark\", \"c_name\": \"point chart\", \"nl_ref_type\": \"explicit\", \"nl_ref_phrase\": \"scatter plot\"}\n    {\"c_type\": \"mark\", \"c_name\": \"arc chart\", \"nl_ref_type\": \"explicit\", \"nl_ref_phrase\": \"pie chart\"}\n    {\"c_type\": \"transform\",\"c_name\": \"filter\",\"c_list\": [{\"field\": \"country\",\"oneOf\": [\"Iceland\",\"Norway\"]}],\"nl_ref_type\": \"explicit\",\"nl_ref_phrase\": \"for countries Iceland and Norway\"},\n    {\"c_type\": \"transform\",\"c_name\": \"filter\",\"c_list\": [{\"field\": \"country\",\"oneOf\": [\"Iceland\",\"Norway\"]}],\"nl_ref_type\": \"by_value\",\"nl_ref_phrase\": \"for Iceland and Norway\"},\n- the 'nl_ref_phrase' for 'ambiguous' columns should be equally near all ambiguous columns, not too near to one of the column since it would not be ambiguous.\n    good example: {\"column\": [\"country\",\"region\"], \"nl_ref_type\": \"ambiguous\", \"nl_ref_phrase\": \"location\"}\n    bad example: {\"column\": [\"country\",\"region\"], \"nl_ref_type\": \"ambiguous\", \"nl_ref_phrase\": \"region\"}\n- You only include given constraints and no other information. \n    For example, if a column name is not in the given constraint, it will not be included in the NL utterance.\n    Also, it a chart mark or chart encoding channel is not in the given constraint, it will not be included in the NL utterance.\n- all 'nl_ref_phrase' shoule be included in the 'nl_utterance'. \n\nThe output format is identical to the input format, but fill in the str blanks(\"...\").\n### Input:\n{\n  \"nl_utterance\": \"...\",\n  \"encoded_fields\": [\n    {\n      \"field\": \"Total_billion\",\n      \"type\": \"quantitative\",\n      \"nl_ref_type\": \"explicit\",\n      \"nl_ref_phrase\": \"...\"\n    }\n  ],\n  \"constraints\": [\n    {\n      \"c_type\": \"transform\",\n      \"c_name\": \"aggregate\",\n      \"c_list\": [\n        {\n          \"field\": \"Total_billion\",\n          \"aggregate\": \"sum\"\n        }\n      ],\n      \"nl_ref_type\": \"explicit\",\n      \"nl_ref_phrase\": \"...\"\n    }\n  ]\n}\n\n### Output:"
}