{
  "gpt_result": {
    "nl_utterance": "What is the correlation between firearm deaths and divisions? Can you provide a point chart for these variables?",
    "encoded_fields": [
      {
        "field": "Firearm deaths",
        "type": "quantitative",
        "nl_ref_type": "explicit",
        "nl_ref_phrase": "firearm deaths"
      },
      {
        "field": "Division",
        "type": "nominal",
        "nl_ref_type": "explicit",
        "nl_ref_phrase": "divisions"
      }
    ],
    "constraints": [
      {
        "c_type": "task",
        "c_name": "correlation",
        "c_list": [
          {
            "mark": "circle",
            "encoding": {
              "x": {
                "type": "quantitative"
              },
              "y": {
                "type": "quantitative"
              }
            }
          }
        ],
        "nl_ref_type": "explicit",
        "nl_ref_phrase": "correlation"
      },
      {
        "c_type": "mark",
        "c_name": "point chart",
        "c_list": [
          {
            "mark": "circle",
            "encoding": {
              "x": {},
              "y": {},
              "color": {
                "type": "nominal",
                "ignore": true
              },
              "size": {
                "ignore": true,
                "type": "quantitative"
              },
              "column": {
                "ignore": true,
                "type": "nominal"
              },
              "row": {
                "ignore": true,
                "type": "nominal"
              }
            }
          }
        ],
        "nl_ref_type": "explicit",
        "nl_ref_phrase": "point chart"
      }
    ]
  },
  "input": "Dataset Information: {\n  \"data samples\": [\n    {\n      \"State\": \"Alabama\",\n      \"State2\": \"AL\",\n      \"Gini\": 0.472,\n      \"Death Rate\": 21.5,\n      \"Firearms, vs average\": 1.64700475,\n      \"Med income\": 47221,\n      \"Income, vs median\": 0.799827233,\n      \"Imprisonment rates\": 736,\n      \"Prison rate\": 1.264604811,\n      \"Imprisonment rate\": 0.736,\n      \"Firearm deaths\": 0.215,\n      \"Division\": \"South\"\n    },\n    {\n      \"State\": \"North Carolina\",\n      \"State2\": \"NC\",\n      \"Gini\": 0.464,\n      \"Death Rate\": 13.7,\n      \"Firearms, vs average\": 1.049486747,\n      \"Med income\": 53764,\n      \"Income, vs median\": 0.910652281,\n      \"Imprisonment rates\": 438,\n      \"Prison rate\": 0.75257732,\n      \"Imprisonment rate\": 0.438,\n      \"Firearm deaths\": 0.137,\n      \"Division\": \"South\"\n    },\n    {\n      \"State\": \"Hawaii\",\n      \"State2\": \"HI\",\n      \"Gini\": 0.433,\n      \"Death Rate\": 4.5,\n      \"Firearms, vs average\": 0.344721924,\n      \"Med income\": 72133,\n      \"Income, vs median\": 1.221785599,\n      \"Imprisonment rates\": 323,\n      \"Prison rate\": 0.554982818,\n      \"Imprisonment rate\": 0.323,\n      \"Firearm deaths\": 0.045,\n      \"Division\": \"West\"\n    },\n    {\n      \"State\": \"Arizona\",\n      \"State2\": \"AZ\",\n      \"Gini\": 0.455,\n      \"Death Rate\": 15.2,\n      \"Firearms, vs average\": 1.164394055,\n      \"Med income\": 57100,\n      \"Income, vs median\": 0.967157303,\n      \"Imprisonment rates\": 764,\n      \"Prison rate\": 1.312714777,\n      \"Imprisonment rate\": 0.764,\n      \"Firearm deaths\": 0.152,\n      \"Division\": \"West\"\n    },\n    {\n      \"State\": \"Oregon\",\n      \"State2\": \"OR\",\n      \"Gini\": 0.449,\n      \"Death Rate\": 11.9,\n      \"Firearms, vs average\": 0.911597978,\n      \"Med income\": 59135,\n      \"Income, vs median\": 1.001626044,\n      \"Imprisonment rates\": 466,\n      \"Prison rate\": 0.800687285,\n      \"Imprisonment rate\": 0.466,\n      \"Firearm deaths\": 0.119,\n      \"Division\": \"West\"\n    }\n  ],\n  \"column names\": [\n    \"State\",\n    \"State2\",\n    \"Gini\",\n    \"Death Rate\",\n    \"Firearms, vs average\",\n    \"Med income\",\n    \"Income, vs median\",\n    \"Imprisonment rates\",\n    \"Prison rate\",\n    \"Imprisonment rate\",\n    \"Firearm deaths\",\n    \"Division\"\n  ]\n}\n\nYour Job:\nI am developing a NL to Data Visualization Dataset. \nPlease help me generate natural language utterance for given dataset and constraints.\nDefinition about the Taks:\n- 'utterance' is what a user would say to make a chart. It should be a questions structure. One NL 'utterance' is in one or two sentences. Here are two examples from Questions for reference:\n    How many cars do each country manufacture?\n    Which countries have the highest acceleration for cars of different cylinders?\n- 'given dataset' is in form of column names, column type, range/unique values of the column.\n- 'constraints' are information about the chart that should be included in the utterance. \n    So we can find a reference phrase in the NL utterance that corresponds to the given constraints. \n- 'reference phrase' can be explicit, ambiguous, and by_value. 'ambiguous' means the phrase can map to more than one columns in the dataset, always a hypernym of column names(depending on the dataset values).\n    For example:\n    {\"column\": \"gdpPercap\", \"nl_ref_type\": \"explicit\", \"nl_ref_phrase\": \"GDP per capita\"},\n    {\"column\": [\"country\",\"continent\"], \"nl_ref_type\": \"ambiguous\", \"nl_ref_phrase\": \"region\"}\n    {\"column\": [\"country\",\"country_short_name\"], \"nl_ref_type\": \"ambiguous\", \"nl_ref_phrase\": \"countries\"}\n    {\"c_type\": \"mark\", \"c_name\": \"point chart\", \"nl_ref_type\": \"explicit\", \"nl_ref_phrase\": \"scatter plot\"}\n    {\"c_type\": \"mark\", \"c_name\": \"arc chart\", \"nl_ref_type\": \"explicit\", \"nl_ref_phrase\": \"pie chart\"}\n    {\"c_type\": \"transform\",\"c_name\": \"filter\",\"c_list\": [{\"field\": \"country\",\"oneOf\": [\"Iceland\",\"Norway\"]}],\"nl_ref_type\": \"explicit\",\"nl_ref_phrase\": \"for countries Iceland and Norway\"},\n    {\"c_type\": \"transform\",\"c_name\": \"filter\",\"c_list\": [{\"field\": \"country\",\"oneOf\": [\"Iceland\",\"Norway\"]}],\"nl_ref_type\": \"by_value\",\"nl_ref_phrase\": \"for Iceland and Norway\"},\n- the 'nl_ref_phrase' for 'ambiguous' columns should be equally near all ambiguous columns, not too near to one of the column since it would not be ambiguous.\n    good example: {\"column\": [\"country\",\"region\"], \"nl_ref_type\": \"ambiguous\", \"nl_ref_phrase\": \"location\"}\n    bad example: {\"column\": [\"country\",\"region\"], \"nl_ref_type\": \"ambiguous\", \"nl_ref_phrase\": \"region\"}\n- You only include given constraints and no other information. \n    For example, if a column name is not in the given constraint, it will not be included in the NL utterance.\n    Also, it a chart mark or chart encoding channel is not in the given constraint, it will not be included in the NL utterance.\n- all 'nl_ref_phrase' shoule be included in the 'nl_utterance'. \n\nThe output format is identical to the input format, but fill in the str blanks(\"...\").\n### Input:\n{\n  \"nl_utterance\": \"...\",\n  \"encoded_fields\": [\n    {\n      \"field\": \"Firearm deaths\",\n      \"type\": \"quantitative\",\n      \"nl_ref_type\": \"explicit\",\n      \"nl_ref_phrase\": \"...\"\n    },\n    {\n      \"field\": \"Division\",\n      \"type\": \"nominal\",\n      \"nl_ref_type\": \"explicit\",\n      \"nl_ref_phrase\": \"...\"\n    }\n  ],\n  \"constraints\": [\n    {\n      \"c_type\": \"task\",\n      \"c_name\": \"correlation\",\n      \"c_list\": [\n        {\n          \"mark\": \"circle\",\n          \"encoding\": {\n            \"x\": {\n              \"type\": \"quantitative\"\n            },\n            \"y\": {\n              \"type\": \"quantitative\"\n            }\n          }\n        }\n      ],\n      \"nl_ref_type\": \"explicit\",\n      \"nl_ref_phrase\": \"...\"\n    },\n    {\n      \"c_type\": \"mark\",\n      \"c_name\": \"point chart\",\n      \"c_list\": [\n        {\n          \"mark\": \"circle\",\n          \"encoding\": {\n            \"x\": {},\n            \"y\": {},\n            \"color\": {\n              \"type\": \"nominal\",\n              \"ignore\": true\n            },\n            \"size\": {\n              \"ignore\": true,\n              \"type\": \"quantitative\"\n            },\n            \"column\": {\n              \"ignore\": true,\n              \"type\": \"nominal\"\n            },\n            \"row\": {\n              \"ignore\": true,\n              \"type\": \"nominal\"\n            }\n          }\n        }\n      ],\n      \"nl_ref_type\": \"explicit\",\n      \"nl_ref_phrase\": \"...\"\n    }\n  ]\n}\n\n### Output:"
}