{
  "gpt_result": {
    "nl_utterance": "Show me the trend of the total moving average of 7-day cases for the UK, France, Germany, and Portugal.",
    "encoded_fields": [
      {
        "field": "cases_ma7",
        "type": "quantitative",
        "nl_ref_type": "explicit",
        "nl_ref_phrase": "total moving average of 7-day cases"
      },
      {
        "field": "country",
        "type": "nominal",
        "nl_ref_type": "explicit",
        "nl_ref_phrase": "the UK, France, Germany, and Portugal"
      }
    ],
    "constraints": [
      {
        "c_type": "task",
        "c_name": "trend",
        "c_list": [
          {
            "mark": [
              "bar",
              "line",
              "area"
            ],
            "encoding": {
              "x": {
                "type": "temporal"
              }
            }
          }
        ],
        "nl_ref_type": "explicit",
        "nl_ref_phrase": "trend"
      },
      {
        "c_type": "mark",
        "c_name": "line chart",
        "c_list": [
          {
            "mark": "line",
            "encoding": {
              "x": {},
              "y": {
                "type": "quantitative"
              },
              "color": {
                "ignore": true,
                "type": "nominal"
              },
              "column": {
                "ignore": true,
                "type": "nominal"
              },
              "row": {
                "ignore": true,
                "type": "nominal"
              }
            },
            "unique_map": {
              "x": "y"
            }
          }
        ],
        "nl_ref_type": "explicit",
        "nl_ref_phrase": "line chart"
      },
      {
        "c_type": "transform",
        "c_name": "filter",
        "c_list": [
          {
            "field": "country",
            "oneOf": [
              "UK",
              "France",
              "Germany",
              "Portugal"
            ]
          }
        ],
        "nl_ref_type": "by_value",
        "nl_ref_phrase": "for the UK, France, Germany, and Portugal"
      },
      {
        "c_type": "transform",
        "c_name": "aggregate",
        "c_list": [
          {
            "field": "cases_ma7",
            "aggregate": "sum"
          }
        ],
        "nl_ref_type": "explicit",
        "nl_ref_phrase": "total"
      }
    ]
  },
  "input": "Dataset Information: {\n  \"data samples\": [\n    {\n      \"date\": 20191231,\n      \"daterep\": \"31/12/2019\",\n      \"date2\": \"2019-12-31\",\n      \"day\": 31,\n      \"days\": 1,\n      \"month\": 12,\n      \"year\": 2019,\n      \"cases\": 0,\n      \"deaths\": 0,\n      \"country\": \"Afghanistan\",\n      \"geoid\": \"AF\",\n      \"countryterritorycode\": \"AFG\",\n      \"popdata2019\": 38041757.0,\n      \"continentexp\": \"Asia\",\n      \"cumulative_number_for_14_days_of\": NaN,\n      \"pop\": 38041757.0,\n      \"poprank\": 37.0,\n      \"t\": 1,\n      \"c\": 1,\n      \"cases_cml\": 0,\n      \"cases_ma7\": NaN,\n      \"cases_pop\": 0.0,\n      \"cases_cml_pop\": 0.0,\n      \"deaths_cml\": 0,\n      \"deaths_ma7\": NaN,\n      \"deaths_pop\": 0.0,\n      \"deaths_cml_pop\": 0.0,\n      \"deaths_rate\": NaN,\n      \"neighbours\": 0,\n      \"p20\": 0\n    },\n    {\n      \"date\": 20200723,\n      \"daterep\": \"23/07/2020\",\n      \"date2\": \"2020-7-23\",\n      \"day\": 23,\n      \"days\": 206,\n      \"month\": 7,\n      \"year\": 2020,\n      \"cases\": 0,\n      \"deaths\": 0,\n      \"country\": \"Seychelles\",\n      \"geoid\": \"SC\",\n      \"countryterritorycode\": \"SYC\",\n      \"popdata2019\": 97741.0,\n      \"continentexp\": \"Africa\",\n      \"cumulative_number_for_14_days_of\": 23.531578,\n      \"pop\": 97741.0,\n      \"poprank\": 188.0,\n      \"t\": 206,\n      \"c\": 171,\n      \"cases_cml\": 114,\n      \"cases_ma7\": 2.0,\n      \"cases_pop\": 0.0,\n      \"cases_cml_pop\": 0.0011663478,\n      \"deaths_cml\": 0,\n      \"deaths_ma7\": 0.0,\n      \"deaths_pop\": 0.0,\n      \"deaths_cml_pop\": 0.0,\n      \"deaths_rate\": 0.0,\n      \"neighbours\": 0,\n      \"p20\": 0\n    },\n    {\n      \"date\": 20200501,\n      \"daterep\": \"01/05/2020\",\n      \"date2\": \"2020-5-1\",\n      \"day\": 1,\n      \"days\": 123,\n      \"month\": 5,\n      \"year\": 2020,\n      \"cases\": 2,\n      \"deaths\": 0,\n      \"country\": \"Isle_of_Man\",\n      \"geoid\": \"IM\",\n      \"countryterritorycode\": \"IMN\",\n      \"popdata2019\": 84589.0,\n      \"continentexp\": \"Europe\",\n      \"cumulative_number_for_14_days_of\": 36.647793,\n      \"pop\": 84589.0,\n      \"poprank\": 190.0,\n      \"t\": 123,\n      \"c\": 98,\n      \"cases_cml\": 315,\n      \"cases_ma7\": 1.1428572,\n      \"cases_pop\": 2.3643735e-05,\n      \"cases_cml_pop\": 0.0037238884,\n      \"deaths_cml\": 21,\n      \"deaths_ma7\": 0.85714287,\n      \"deaths_pop\": 0.0,\n      \"deaths_cml_pop\": 0.00024825922,\n      \"deaths_rate\": 0.06666667,\n      \"neighbours\": 0,\n      \"p20\": 0\n    }\n  ],\n  \"column names\": [\n    \"date\",\n    \"daterep\",\n    \"date2\",\n    \"day\",\n    \"days\",\n    \"month\",\n    \"year\",\n    \"cases\",\n    \"deaths\",\n    \"country\",\n    \"geoid\",\n    \"countryterritorycode\",\n    \"popdata2019\",\n    \"continentexp\",\n    \"cumulative_number_for_14_days_of\",\n    \"pop\",\n    \"poprank\",\n    \"t\",\n    \"c\",\n    \"cases_cml\",\n    \"cases_ma7\",\n    \"cases_pop\",\n    \"cases_cml_pop\",\n    \"deaths_cml\",\n    \"deaths_ma7\",\n    \"deaths_pop\",\n    \"deaths_cml_pop\",\n    \"deaths_rate\",\n    \"neighbours\",\n    \"p20\"\n  ]\n}\n\nYour Job:\nI am developing a NL to Data Visualization Dataset. \nPlease help me generate natural language utterance for given dataset and constraints.\nDefinition about the Taks:\n- 'utterance' is what a user would say to make a chart, it can be a question or a command. One NL 'utterance' is in one or two sentences. \n- 'given dataset' is in form of column names, column type, range/unique values of the column.\n- 'constraints' are information about the chart that should be included in the utterance. \n    So we can find a reference phrase in the NL utterance that corresponds to the given constraints. \n- 'reference phrase' can be explicit, ambiguous, and by_value. 'ambiguous' means the phrase can map to more than one columns in the dataset, always a hypernym of column names(depending on the dataset values).\n    For example:\n    {\"column\": \"gdpPercap\", \"nl_ref_type\": \"explicit\", \"nl_ref_phrase\": \"GDP per capita\"},\n    {\"column\": [\"country\",\"continent\"], \"nl_ref_type\": \"ambiguous\", \"nl_ref_phrase\": \"region\"}\n    {\"column\": [\"country\",\"country_short_name\"], \"nl_ref_type\": \"ambiguous\", \"nl_ref_phrase\": \"countries\"}\n    {\"c_type\": \"mark\", \"c_name\": \"point chart\", \"nl_ref_type\": \"explicit\", \"nl_ref_phrase\": \"scatter plot\"}\n    {\"c_type\": \"mark\", \"c_name\": \"arc chart\", \"nl_ref_type\": \"explicit\", \"nl_ref_phrase\": \"pie chart\"}\n    {\"c_type\": \"transform\",\"c_name\": \"filter\",\"c_list\": [{\"field\": \"country\",\"oneOf\": [\"Iceland\",\"Norway\"]}],\"nl_ref_type\": \"explicit\",\"nl_ref_phrase\": \"for countries Iceland and Norway\"},\n    {\"c_type\": \"transform\",\"c_name\": \"filter\",\"c_list\": [{\"field\": \"country\",\"oneOf\": [\"Iceland\",\"Norway\"]}],\"nl_ref_type\": \"by_value\",\"nl_ref_phrase\": \"for Iceland and Norway\"},\n- the 'nl_ref_phrase' for 'ambiguous' columns should be equally near all ambiguous columns, not too near to one of the column since it would not be ambiguous.\n    good example: {\"column\": [\"country\",\"region\"], \"nl_ref_type\": \"ambiguous\", \"nl_ref_phrase\": \"location\"}\n    bad example: {\"column\": [\"country\",\"region\"], \"nl_ref_type\": \"ambiguous\", \"nl_ref_phrase\": \"region\"}\n- You only include given constraints and no other information. \n    For example, if a column name is not in the given constraint, it will not be included in the NL utterance.\n    Also, it a chart mark or chart encoding channel is not in the given constraint, it will not be included in the NL utterance.\n- all 'nl_ref_phrase' shoule be included in the 'nl_utterance'. \n\nThe output format is identical to the input format, but fill in the str blanks(\"...\").\n### Input:\n{\n  \"nl_utterance\": \"...\",\n  \"encoded_fields\": [\n    {\n      \"field\": \"cases_ma7\",\n      \"type\": \"quantitative\",\n      \"nl_ref_type\": \"explicit\",\n      \"nl_ref_phrase\": \"...\"\n    },\n    {\n      \"field\": \"country\",\n      \"type\": \"nominal\",\n      \"nl_ref_type\": \"explicit\",\n      \"nl_ref_phrase\": \"...\"\n    }\n  ],\n  \"constraints\": [\n    {\n      \"c_type\": \"task\",\n      \"c_name\": \"trend\",\n      \"c_list\": [\n        {\n          \"mark\": [\n            \"bar\",\n            \"line\",\n            \"area\"\n          ],\n          \"encoding\": {\n            \"x\": {\n              \"type\": \"temporal\"\n            }\n          }\n        }\n      ],\n      \"nl_ref_type\": \"explicit\",\n      \"nl_ref_phrase\": \"...\"\n    },\n    {\n      \"c_type\": \"mark\",\n      \"c_name\": \"line chart\",\n      \"c_list\": [\n        {\n          \"mark\": \"line\",\n          \"encoding\": {\n            \"x\": {},\n            \"y\": {\n              \"type\": \"quantitative\"\n            },\n            \"color\": {\n              \"ignore\": true,\n              \"type\": \"nominal\"\n            },\n            \"column\": {\n              \"ignore\": true,\n              \"type\": \"nominal\"\n            },\n            \"row\": {\n              \"ignore\": true,\n              \"type\": \"nominal\"\n            }\n          },\n          \"unique_map\": {\n            \"x\": \"y\"\n          }\n        }\n      ],\n      \"nl_ref_type\": \"explicit\",\n      \"nl_ref_phrase\": \"...\"\n    },\n    {\n      \"c_type\": \"transform\",\n      \"c_name\": \"filter\",\n      \"c_list\": [\n        {\n          \"field\": \"country\",\n          \"oneOf\": [\n            \"UK\",\n            \"France\",\n            \"Germany\",\n            \"Portugal\"\n          ]\n        }\n      ],\n      \"nl_ref_type\": \"by_value\",\n      \"nl_ref_phrase\": \"...\"\n    },\n    {\n      \"c_type\": \"transform\",\n      \"c_name\": \"aggregate\",\n      \"c_list\": [\n        {\n          \"field\": \"cases_ma7\",\n          \"aggregate\": \"sum\"\n        }\n      ],\n      \"nl_ref_type\": \"explicit\",\n      \"nl_ref_phrase\": \"...\"\n    }\n  ]\n}\n\n### Output:"
}