{
  "gpt_result": {
    "nl_utterance": "Create a line chart of the sum of the 7-day moving average of cases over time, filtered by the UK, France, Germany, and Portugal, and grouped by geographical location.",
    "encoded_fields": [
      {
        "field": "date2",
        "type": "temporal",
        "nl_ref_type": "explicit",
        "nl_ref_phrase": "time"
      },
      {
        "field": "cases_ma7",
        "type": "quantitative",
        "nl_ref_type": "explicit",
        "nl_ref_phrase": "7-day moving average of cases"
      },
      {
        "field": [
          "country",
          "continentexp",
          "neighbours"
        ],
        "type": "nominal",
        "nl_ref_type": "ambiguous",
        "nl_ref_phrase": "geographical location"
      }
    ],
    "constraints": [
      {
        "c_type": "transform",
        "c_name": "filter",
        "c_list": [
          {
            "field": "country",
            "oneOf": [
              "UK",
              "France",
              "Germany",
              "Portugal"
            ]
          }
        ],
        "nl_ref_type": "by_value",
        "nl_ref_phrase": "the UK, France, Germany, and Portugal"
      },
      {
        "c_type": "transform",
        "c_name": "aggregate",
        "c_list": [
          {
            "field": "cases_ma7",
            "aggregate": "sum"
          }
        ],
        "nl_ref_type": "explicit",
        "nl_ref_phrase": "sum of the 7-day moving average of cases"
      }
    ]
  },
  "input": "Dataset Information: {\n  \"data samples\": [\n    {\n      \"date\": 20191231,\n      \"daterep\": \"31/12/2019\",\n      \"date2\": \"2019-12-31\",\n      \"day\": 31,\n      \"days\": 1,\n      \"month\": 12,\n      \"year\": 2019,\n      \"cases\": 0,\n      \"deaths\": 0,\n      \"country\": \"Afghanistan\",\n      \"geoid\": \"AF\",\n      \"countryterritorycode\": \"AFG\",\n      \"popdata2019\": 38041757.0,\n      \"continentexp\": \"Asia\",\n      \"cumulative_number_for_14_days_of\": NaN,\n      \"pop\": 38041757.0,\n      \"poprank\": 37.0,\n      \"t\": 1,\n      \"c\": 1,\n      \"cases_cml\": 0,\n      \"cases_ma7\": NaN,\n      \"cases_pop\": 0.0,\n      \"cases_cml_pop\": 0.0,\n      \"deaths_cml\": 0,\n      \"deaths_ma7\": NaN,\n      \"deaths_pop\": 0.0,\n      \"deaths_cml_pop\": 0.0,\n      \"deaths_rate\": NaN,\n      \"neighbours\": 0,\n      \"p20\": 0\n    },\n    {\n      \"date\": 20200102,\n      \"daterep\": \"02/01/2020\",\n      \"date2\": \"2020-1-2\",\n      \"day\": 2,\n      \"days\": 3,\n      \"month\": 1,\n      \"year\": 2020,\n      \"cases\": 0,\n      \"deaths\": 0,\n      \"country\": \"France\",\n      \"geoid\": \"FR\",\n      \"countryterritorycode\": \"FRA\",\n      \"popdata2019\": 67012883.0,\n      \"continentexp\": \"Europe\",\n      \"cumulative_number_for_14_days_of\": NaN,\n      \"pop\": 67012883.0,\n      \"poprank\": 21.0,\n      \"t\": 3,\n      \"c\": 71,\n      \"cases_cml\": 0,\n      \"cases_ma7\": NaN,\n      \"cases_pop\": 0.0,\n      \"cases_cml_pop\": 0.0,\n      \"deaths_cml\": 0,\n      \"deaths_ma7\": NaN,\n      \"deaths_pop\": 0.0,\n      \"deaths_cml_pop\": 0.0,\n      \"deaths_rate\": NaN,\n      \"neighbours\": 1,\n      \"p20\": 0\n    },\n    {\n      \"date\": 20200724,\n      \"daterep\": \"24/07/2020\",\n      \"date2\": \"2020-7-24\",\n      \"day\": 24,\n      \"days\": 207,\n      \"month\": 7,\n      \"year\": 2020,\n      \"cases\": 24,\n      \"deaths\": 0,\n      \"country\": \"Gambia\",\n      \"geoid\": \"GM\",\n      \"countryterritorycode\": \"GMB\",\n      \"popdata2019\": 2347696.0,\n      \"continentexp\": \"Africa\",\n      \"cumulative_number_for_14_days_of\": 4.5150652,\n      \"pop\": 2347696.0,\n      \"poprank\": 141.0,\n      \"t\": 207,\n      \"c\": 74,\n      \"cases_cml\": 170,\n      \"cases_ma7\": 15.142858,\n      \"cases_pop\": 1.0222789e-05,\n      \"cases_cml_pop\": 7.2411422e-05,\n      \"deaths_cml\": 5,\n      \"deaths_ma7\": 0.2857143,\n      \"deaths_pop\": 0.0,\n      \"deaths_cml_pop\": 2.1297476e-06,\n      \"deaths_rate\": 0.029411765,\n      \"neighbours\": 0,\n      \"p20\": 0\n    },\n    {\n      \"date\": 20200520,\n      \"daterep\": \"20/05/2020\",\n      \"date2\": \"2020-5-20\",\n      \"day\": 20,\n      \"days\": 142,\n      \"month\": 5,\n      \"year\": 2020,\n      \"cases\": 48,\n      \"deaths\": 2,\n      \"country\": \"Guinea_Bissau\",\n      \"geoid\": \"GW\",\n      \"countryterritorycode\": \"GNB\",\n      \"popdata2019\": 1920917.0,\n      \"continentexp\": \"Africa\",\n      \"cumulative_number_for_14_days_of\": 29.308918,\n      \"pop\": 1920917.0,\n      \"poprank\": 147.0,\n      \"t\": 142,\n      \"c\": 86,\n      \"cases_cml\": 1038,\n      \"cases_ma7\": 39.57143,\n      \"cases_pop\": 2.4988065e-05,\n      \"cases_cml_pop\": 0.00054036692,\n      \"deaths_cml\": 6,\n      \"deaths_ma7\": 0.42857143,\n      \"deaths_pop\": 1.0411694e-06,\n      \"deaths_cml_pop\": 3.1235081e-06,\n      \"deaths_rate\": 0.0057803467,\n      \"neighbours\": 0,\n      \"p20\": 0\n    },\n    {\n      \"date\": 20200617,\n      \"daterep\": \"17/06/2020\",\n      \"date2\": \"2020-6-17\",\n      \"day\": 17,\n      \"days\": 170,\n      \"month\": 6,\n      \"year\": 2020,\n      \"cases\": 15,\n      \"deaths\": 0,\n      \"country\": \"Tunisia\",\n      \"geoid\": \"TN\",\n      \"countryterritorycode\": \"TUN\",\n      \"popdata2019\": 11694721.0,\n      \"continentexp\": \"Africa\",\n      \"cumulative_number_for_14_days_of\": 0.33348379,\n      \"pop\": 11694721.0,\n      \"poprank\": 77.0,\n      \"t\": 170,\n      \"c\": 195,\n      \"cases_cml\": 1125,\n      \"cases_ma7\": 5.4285712,\n      \"cases_pop\": 1.28263e-06,\n      \"cases_cml_pop\": 9.6197247e-05,\n      \"deaths_cml\": 49,\n      \"deaths_ma7\": 0.0,\n      \"deaths_pop\": 0.0,\n      \"deaths_cml_pop\": 4.1899248e-06,\n      \"deaths_rate\": 0.043555554,\n      \"neighbours\": 0,\n      \"p20\": 0\n    }\n  ],\n  \"column names\": [\n    \"date\",\n    \"daterep\",\n    \"date2\",\n    \"day\",\n    \"days\",\n    \"month\",\n    \"year\",\n    \"cases\",\n    \"deaths\",\n    \"country\",\n    \"geoid\",\n    \"countryterritorycode\",\n    \"popdata2019\",\n    \"continentexp\",\n    \"cumulative_number_for_14_days_of\",\n    \"pop\",\n    \"poprank\",\n    \"t\",\n    \"c\",\n    \"cases_cml\",\n    \"cases_ma7\",\n    \"cases_pop\",\n    \"cases_cml_pop\",\n    \"deaths_cml\",\n    \"deaths_ma7\",\n    \"deaths_pop\",\n    \"deaths_cml_pop\",\n    \"deaths_rate\",\n    \"neighbours\",\n    \"p20\"\n  ]\n}\n\nYour Job:\nI am developing a NL to Data Visualization Dataset. \nPlease help me generate natural language utterance for given dataset and constraints.\nDefinition about the Taks:\n- 'utterance' is what a user would say to make a chart. It should be a commands structure. One NL 'utterance' is in one or two sentences. Here are two examples from Commands for reference:\n    Please show me a histogram of weights with 500 intervals.\n    Create a line chart showing order date and sum of sales, divided by category.\n- 'given dataset' is in form of column names, column type, range/unique values of the column.\n- 'constraints' are information about the chart that should be included in the utterance. \n    So we can find a reference phrase in the NL utterance that corresponds to the given constraints. \n- 'reference phrase' can be explicit, ambiguous, and by_value. 'ambiguous' means the phrase can map to more than one columns in the dataset, always a hypernym of column names(depending on the dataset values).\n    For example:\n    {\"column\": \"gdpPercap\", \"nl_ref_type\": \"explicit\", \"nl_ref_phrase\": \"GDP per capita\"},\n    {\"column\": [\"country\",\"continent\"], \"nl_ref_type\": \"ambiguous\", \"nl_ref_phrase\": \"region\"}\n    {\"column\": [\"country\",\"country_short_name\"], \"nl_ref_type\": \"ambiguous\", \"nl_ref_phrase\": \"countries\"}\n    {\"c_type\": \"mark\", \"c_name\": \"point chart\", \"nl_ref_type\": \"explicit\", \"nl_ref_phrase\": \"scatter plot\"}\n    {\"c_type\": \"mark\", \"c_name\": \"arc chart\", \"nl_ref_type\": \"explicit\", \"nl_ref_phrase\": \"pie chart\"}\n    {\"c_type\": \"transform\",\"c_name\": \"filter\",\"c_list\": [{\"field\": \"country\",\"oneOf\": [\"Iceland\",\"Norway\"]}],\"nl_ref_type\": \"explicit\",\"nl_ref_phrase\": \"for countries Iceland and Norway\"},\n    {\"c_type\": \"transform\",\"c_name\": \"filter\",\"c_list\": [{\"field\": \"country\",\"oneOf\": [\"Iceland\",\"Norway\"]}],\"nl_ref_type\": \"by_value\",\"nl_ref_phrase\": \"for Iceland and Norway\"},\n- the 'nl_ref_phrase' for 'ambiguous' columns should be equally near all ambiguous columns, not too near to one of the column since it would not be ambiguous.\n    good example: {\"column\": [\"country\",\"region\"], \"nl_ref_type\": \"ambiguous\", \"nl_ref_phrase\": \"location\"}\n    bad example: {\"column\": [\"country\",\"region\"], \"nl_ref_type\": \"ambiguous\", \"nl_ref_phrase\": \"region\"}\n- You only include given constraints and no other information. \n    For example, if a column name is not in the given constraint, it will not be included in the NL utterance.\n    Also, it a chart mark or chart encoding channel is not in the given constraint, it will not be included in the NL utterance.\n- all 'nl_ref_phrase' shoule be included in the 'nl_utterance'. \n\nThe output format is identical to the input format, but fill in the str blanks(\"...\").\n### Input:\n{\n  \"nl_utterance\": \"...\",\n  \"encoded_fields\": [\n    {\n      \"field\": \"date2\",\n      \"type\": \"temporal\",\n      \"nl_ref_type\": \"explicit\",\n      \"nl_ref_phrase\": \"...\"\n    },\n    {\n      \"field\": \"cases_ma7\",\n      \"type\": \"quantitative\",\n      \"nl_ref_type\": \"explicit\",\n      \"nl_ref_phrase\": \"...\"\n    },\n    {\n      \"field\": [\n        \"country\",\n        \"continentexp\",\n        \"neighbours\"\n      ],\n      \"type\": \"nominal\",\n      \"nl_ref_type\": \"ambiguous\",\n      \"nl_ref_phrase\": \"...\"\n    }\n  ],\n  \"constraints\": [\n    {\n      \"c_type\": \"transform\",\n      \"c_name\": \"filter\",\n      \"c_list\": [\n        {\n          \"field\": \"country\",\n          \"oneOf\": [\n            \"UK\",\n            \"France\",\n            \"Germany\",\n            \"Portugal\"\n          ]\n        }\n      ],\n      \"nl_ref_type\": \"by_value\",\n      \"nl_ref_phrase\": \"...\"\n    },\n    {\n      \"c_type\": \"transform\",\n      \"c_name\": \"aggregate\",\n      \"c_list\": [\n        {\n          \"field\": \"cases_ma7\",\n          \"aggregate\": \"sum\"\n        }\n      ],\n      \"nl_ref_type\": \"explicit\",\n      \"nl_ref_phrase\": \"...\"\n    }\n  ]\n}\n\n### Output:"
}