{
  "gpt_result": {
    "nl_utterance": "Create a line chart showing the 'Havi naps\u00fct\u00e9ses \u00f3r\u00e1k sz\u00e1ma' and 'Rekord min. h\u0151m\u00e9rs\u00e9klet (\u00b0C)' values.",
    "encoded_fields": [
      {
        "field": "ertek",
        "type": "quantitative",
        "nl_ref_type": "explicit",
        "nl_ref_phrase": "values"
      },
      {
        "field": "homerseklet",
        "type": "nominal",
        "nl_ref_type": "explicit",
        "nl_ref_phrase": "'Havi naps\u00fct\u00e9ses \u00f3r\u00e1k sz\u00e1ma' and 'Rekord min. h\u0151m\u00e9rs\u00e9klet (\u00b0C)'"
      }
    ],
    "constraints": [
      {
        "c_type": "mark",
        "c_name": "line chart",
        "c_list": [
          {
            "mark": "line",
            "encoding": {
              "x": {},
              "y": {
                "type": "quantitative"
              },
              "color": {
                "ignore": true,
                "type": "nominal"
              },
              "column": {
                "ignore": true,
                "type": "nominal"
              },
              "row": {
                "ignore": true,
                "type": "nominal"
              }
            },
            "unique_map": {
              "x": "y"
            }
          }
        ],
        "nl_ref_type": "explicit",
        "nl_ref_phrase": "line chart"
      }
    ]
  },
  "input": "Dataset Information: {\n  \"data samples\": [\n    {\n      \"honap\": \"Aug.\",\n      \"honap_angol\": \"Aug.\",\n      \"datum\": \"2021-08-01\",\n      \"honap_szam\": 8,\n      \"homerseklet\": \"Havi naps\\u00fct\\u00e9ses \\u00f3r\\u00e1k sz\\u00e1ma\",\n      \"ertek\": 26.2\n    },\n    {\n      \"honap\": \"M\\u00e1j.\",\n      \"honap_angol\": \"May.\",\n      \"datum\": \"2021-05-01\",\n      \"honap_szam\": 5,\n      \"homerseklet\": \"Havi naps\\u00fct\\u00e9ses \\u00f3r\\u00e1k sz\\u00e1ma\",\n      \"ertek\": 23.1\n    },\n    {\n      \"honap\": \"Nov.\",\n      \"honap_angol\": \"Nov.\",\n      \"datum\": \"2021-11-01\",\n      \"honap_szam\": 11,\n      \"homerseklet\": \"Rekord min. h\\u0151m\\u00e9rs\\u00e9klet (\\u00b0C)\",\n      \"ertek\": -22.0\n    },\n    {\n      \"honap\": \"Dec.\",\n      \"honap_angol\": \"Dec.\",\n      \"datum\": \"2021-12-01\",\n      \"honap_szam\": 12,\n      \"homerseklet\": \"Rekord min. h\\u0151m\\u00e9rs\\u00e9klet (\\u00b0C)\",\n      \"ertek\": -28.0\n    },\n    {\n      \"honap\": \"J\\u00fal.\",\n      \"honap_angol\": \"Jul.\",\n      \"datum\": \"2021-07-01\",\n      \"honap_szam\": 7,\n      \"homerseklet\": \"\\u00c1tlagos max. h\\u0151m\\u00e9rs\\u00e9klet (\\u00b0C)\",\n      \"ertek\": 24.5\n    }\n  ],\n  \"column names\": [\n    \"honap\",\n    \"honap_angol\",\n    \"datum\",\n    \"honap_szam\",\n    \"homerseklet\",\n    \"ertek\"\n  ]\n}\n\nYour Job:\nI am developing a NL to Data Visualization Dataset. \nPlease help me generate natural language utterance for given dataset and constraints.\nDefinition about the Taks:\n- 'utterance' is what a user would say to make a chart. It should be a commands structure. One NL 'utterance' is in one or two sentences. Here are two examples from Commands for reference:\n    For each country show the relationship between average acceleration and number of cylinders.\n    Draw a line chart of daily sales forecasts.\n- 'given dataset' is in form of column names, column type, range/unique values of the column.\n- 'constraints' are information about the chart that should be included in the utterance. \n    So we can find a reference phrase in the NL utterance that corresponds to the given constraints. \n- 'reference phrase' can be explicit, ambiguous, and by_value. 'ambiguous' means the phrase can map to more than one columns in the dataset, always a hypernym of column names(depending on the dataset values).\n    For example:\n    {\"column\": \"gdpPercap\", \"nl_ref_type\": \"explicit\", \"nl_ref_phrase\": \"GDP per capita\"},\n    {\"column\": [\"country\",\"continent\"], \"nl_ref_type\": \"ambiguous\", \"nl_ref_phrase\": \"region\"}\n    {\"column\": [\"country\",\"country_short_name\"], \"nl_ref_type\": \"ambiguous\", \"nl_ref_phrase\": \"countries\"}\n    {\"c_type\": \"mark\", \"c_name\": \"point chart\", \"nl_ref_type\": \"explicit\", \"nl_ref_phrase\": \"scatter plot\"}\n    {\"c_type\": \"mark\", \"c_name\": \"arc chart\", \"nl_ref_type\": \"explicit\", \"nl_ref_phrase\": \"pie chart\"}\n    {\"c_type\": \"transform\",\"c_name\": \"filter\",\"c_list\": [{\"field\": \"country\",\"oneOf\": [\"Iceland\",\"Norway\"]}],\"nl_ref_type\": \"explicit\",\"nl_ref_phrase\": \"for countries Iceland and Norway\"},\n    {\"c_type\": \"transform\",\"c_name\": \"filter\",\"c_list\": [{\"field\": \"country\",\"oneOf\": [\"Iceland\",\"Norway\"]}],\"nl_ref_type\": \"by_value\",\"nl_ref_phrase\": \"for Iceland and Norway\"},\n- the 'nl_ref_phrase' for 'ambiguous' columns should be equally near all ambiguous columns, not too near to one of the column since it would not be ambiguous.\n    good example: {\"column\": [\"country\",\"region\"], \"nl_ref_type\": \"ambiguous\", \"nl_ref_phrase\": \"location\"}\n    bad example: {\"column\": [\"country\",\"region\"], \"nl_ref_type\": \"ambiguous\", \"nl_ref_phrase\": \"region\"}\n- You only include given constraints and no other information. \n    For example, if a column name is not in the given constraint, it will not be included in the NL utterance.\n    Also, it a chart mark or chart encoding channel is not in the given constraint, it will not be included in the NL utterance.\n- all 'nl_ref_phrase' shoule be included in the 'nl_utterance'. \n\nThe output format is identical to the input format, but fill in the str blanks(\"...\").\n### Input:\n{\n  \"nl_utterance\": \"...\",\n  \"encoded_fields\": [\n    {\n      \"field\": \"ertek\",\n      \"type\": \"quantitative\",\n      \"nl_ref_type\": \"explicit\",\n      \"nl_ref_phrase\": \"...\"\n    },\n    {\n      \"field\": \"homerseklet\",\n      \"type\": \"nominal\",\n      \"nl_ref_type\": \"explicit\",\n      \"nl_ref_phrase\": \"...\"\n    }\n  ],\n  \"constraints\": [\n    {\n      \"c_type\": \"mark\",\n      \"c_name\": \"line chart\",\n      \"c_list\": [\n        {\n          \"mark\": \"line\",\n          \"encoding\": {\n            \"x\": {},\n            \"y\": {\n              \"type\": \"quantitative\"\n            },\n            \"color\": {\n              \"ignore\": true,\n              \"type\": \"nominal\"\n            },\n            \"column\": {\n              \"ignore\": true,\n              \"type\": \"nominal\"\n            },\n            \"row\": {\n              \"ignore\": true,\n              \"type\": \"nominal\"\n            }\n          },\n          \"unique_map\": {\n            \"x\": \"y\"\n          }\n        }\n      ],\n      \"nl_ref_type\": \"explicit\",\n      \"nl_ref_phrase\": \"...\"\n    }\n  ]\n}\n\n### Output:"
}