{
  "gpt_result": {
    "nl_utterance": "Show me a line chart of the 7-day moving average of cases over time for the UK, France, Germany, and Portugal.",
    "encoded_fields": [
      {
        "field": "date2",
        "type": "temporal",
        "nl_ref_type": "explicit",
        "nl_ref_phrase": "over time"
      },
      {
        "field": "cases_ma7",
        "type": "quantitative",
        "nl_ref_type": "explicit",
        "nl_ref_phrase": "7-day moving average of cases"
      },
      {
        "field": "country",
        "type": "nominal",
        "nl_ref_type": "explicit",
        "nl_ref_phrase": "for the UK, France, Germany, and Portugal"
      }
    ],
    "constraints": [
      {
        "c_type": "mark",
        "c_name": "line chart",
        "c_list": [
          {
            "mark": "line",
            "encoding": {
              "x": {},
              "y": {
                "type": "quantitative"
              },
              "color": {
                "ignore": true,
                "type": "nominal"
              },
              "column": {
                "ignore": true,
                "type": "nominal"
              },
              "row": {
                "ignore": true,
                "type": "nominal"
              }
            },
            "unique_map": {
              "x": "y"
            }
          }
        ],
        "nl_ref_type": "explicit",
        "nl_ref_phrase": "line chart"
      },
      {
        "c_type": "transform",
        "c_name": "filter",
        "c_list": [
          {
            "field": "country",
            "oneOf": [
              "UK",
              "France",
              "Germany",
              "Portugal"
            ]
          }
        ],
        "nl_ref_type": "by_value",
        "nl_ref_phrase": "UK, France, Germany, and Portugal"
      }
    ]
  },
  "input": "Dataset Information: {\n  \"data samples\": [\n    {\n      \"date\": 20191231,\n      \"daterep\": \"31/12/2019\",\n      \"date2\": \"2019-12-31\",\n      \"day\": 31,\n      \"days\": 1,\n      \"month\": 12,\n      \"year\": 2019,\n      \"cases\": 0,\n      \"deaths\": 0,\n      \"country\": \"Afghanistan\",\n      \"geoid\": \"AF\",\n      \"countryterritorycode\": \"AFG\",\n      \"popdata2019\": 38041757.0,\n      \"continentexp\": \"Asia\",\n      \"cumulative_number_for_14_days_of\": NaN,\n      \"pop\": 38041757.0,\n      \"poprank\": 37.0,\n      \"t\": 1,\n      \"c\": 1,\n      \"cases_cml\": 0,\n      \"cases_ma7\": NaN,\n      \"cases_pop\": 0.0,\n      \"cases_cml_pop\": 0.0,\n      \"deaths_cml\": 0,\n      \"deaths_ma7\": NaN,\n      \"deaths_pop\": 0.0,\n      \"deaths_cml_pop\": 0.0,\n      \"deaths_rate\": NaN,\n      \"neighbours\": 0,\n      \"p20\": 0\n    },\n    {\n      \"date\": 20200510,\n      \"daterep\": \"10/05/2020\",\n      \"date2\": \"2020-5-10\",\n      \"day\": 10,\n      \"days\": 132,\n      \"month\": 5,\n      \"year\": 2020,\n      \"cases\": 36,\n      \"deaths\": 1,\n      \"country\": \"North_Macedonia\",\n      \"geoid\": \"MK\",\n      \"countryterritorycode\": \"MKD\",\n      \"popdata2019\": 2077132.0,\n      \"continentexp\": \"Europe\",\n      \"cumulative_number_for_14_days_of\": 12.276543,\n      \"pop\": 2077132.0,\n      \"poprank\": 146.0,\n      \"t\": 132,\n      \"c\": 145,\n      \"cases_cml\": 1622,\n      \"cases_ma7\": 18.285715,\n      \"cases_pop\": 1.7331589e-05,\n      \"cases_cml_pop\": 0.00078088441,\n      \"deaths_cml\": 91,\n      \"deaths_ma7\": 1.4285715,\n      \"deaths_pop\": 4.8143306e-07,\n      \"deaths_cml_pop\": 4.3810407e-05,\n      \"deaths_rate\": 0.056103576,\n      \"neighbours\": 0,\n      \"p20\": 0\n    },\n    {\n      \"date\": 20200620,\n      \"daterep\": \"20/06/2020\",\n      \"date2\": \"2020-6-20\",\n      \"day\": 20,\n      \"days\": 173,\n      \"month\": 6,\n      \"year\": 2020,\n      \"cases\": 539,\n      \"deaths\": 0,\n      \"country\": \"Morocco\",\n      \"geoid\": \"MA\",\n      \"countryterritorycode\": \"MAR\",\n      \"popdata2019\": 36471766.0,\n      \"continentexp\": \"Africa\",\n      \"cumulative_number_for_14_days_of\": 4.2279282,\n      \"pop\": 36471766.0,\n      \"poprank\": 40.0,\n      \"t\": 173,\n      \"c\": 134,\n      \"cases_cml\": 9613,\n      \"cases_ma7\": 153.71428,\n      \"cases_pop\": 1.4778555e-05,\n      \"cases_cml_pop\": 0.00026357375,\n      \"deaths_cml\": 213,\n      \"deaths_ma7\": 0.2857143,\n      \"deaths_pop\": 0.0,\n      \"deaths_cml_pop\": 5.8401338e-06,\n      \"deaths_rate\": 0.022157496,\n      \"neighbours\": 0,\n      \"p20\": 0\n    }\n  ],\n  \"column names\": [\n    \"date\",\n    \"daterep\",\n    \"date2\",\n    \"day\",\n    \"days\",\n    \"month\",\n    \"year\",\n    \"cases\",\n    \"deaths\",\n    \"country\",\n    \"geoid\",\n    \"countryterritorycode\",\n    \"popdata2019\",\n    \"continentexp\",\n    \"cumulative_number_for_14_days_of\",\n    \"pop\",\n    \"poprank\",\n    \"t\",\n    \"c\",\n    \"cases_cml\",\n    \"cases_ma7\",\n    \"cases_pop\",\n    \"cases_cml_pop\",\n    \"deaths_cml\",\n    \"deaths_ma7\",\n    \"deaths_pop\",\n    \"deaths_cml_pop\",\n    \"deaths_rate\",\n    \"neighbours\",\n    \"p20\"\n  ]\n}\n\nYour Job:\nI am developing a NL to Data Visualization Dataset. \nPlease help me generate natural language utterance for given dataset and constraints.\nDefinition about the Taks:\n- 'utterance' is what a user would say to make a chart, it can be a question or a command. One NL 'utterance' is in one or two sentences. \n- 'given dataset' is in form of column names, column type, range/unique values of the column.\n- 'constraints' are information about the chart that should be included in the utterance. \n    So we can find a reference phrase in the NL utterance that corresponds to the given constraints. \n- 'reference phrase' can be explicit, ambiguous, and by_value. 'ambiguous' means the phrase can map to more than one columns in the dataset, always a hypernym of column names(depending on the dataset values).\n    For example:\n    {\"column\": \"gdpPercap\", \"nl_ref_type\": \"explicit\", \"nl_ref_phrase\": \"GDP per capita\"},\n    {\"column\": [\"country\",\"continent\"], \"nl_ref_type\": \"ambiguous\", \"nl_ref_phrase\": \"region\"}\n    {\"column\": [\"country\",\"country_short_name\"], \"nl_ref_type\": \"ambiguous\", \"nl_ref_phrase\": \"countries\"}\n    {\"c_type\": \"mark\", \"c_name\": \"point chart\", \"nl_ref_type\": \"explicit\", \"nl_ref_phrase\": \"scatter plot\"}\n    {\"c_type\": \"mark\", \"c_name\": \"arc chart\", \"nl_ref_type\": \"explicit\", \"nl_ref_phrase\": \"pie chart\"}\n    {\"c_type\": \"transform\",\"c_name\": \"filter\",\"c_list\": [{\"field\": \"country\",\"oneOf\": [\"Iceland\",\"Norway\"]}],\"nl_ref_type\": \"explicit\",\"nl_ref_phrase\": \"for countries Iceland and Norway\"},\n    {\"c_type\": \"transform\",\"c_name\": \"filter\",\"c_list\": [{\"field\": \"country\",\"oneOf\": [\"Iceland\",\"Norway\"]}],\"nl_ref_type\": \"by_value\",\"nl_ref_phrase\": \"for Iceland and Norway\"},\n- the 'nl_ref_phrase' for 'ambiguous' columns should be equally near all ambiguous columns, not too near to one of the column since it would not be ambiguous.\n    good example: {\"column\": [\"country\",\"region\"], \"nl_ref_type\": \"ambiguous\", \"nl_ref_phrase\": \"location\"}\n    bad example: {\"column\": [\"country\",\"region\"], \"nl_ref_type\": \"ambiguous\", \"nl_ref_phrase\": \"region\"}\n- You only include given constraints and no other information. \n    For example, if a column name is not in the given constraint, it will not be included in the NL utterance.\n    Also, it a chart mark or chart encoding channel is not in the given constraint, it will not be included in the NL utterance.\n- all 'nl_ref_phrase' shoule be included in the 'nl_utterance'. \n\nThe output format is identical to the input format, but fill in the str blanks(\"...\").\n### Input:\n{\n  \"nl_utterance\": \"...\",\n  \"encoded_fields\": [\n    {\n      \"field\": \"date2\",\n      \"type\": \"temporal\",\n      \"nl_ref_type\": \"explicit\",\n      \"nl_ref_phrase\": \"...\"\n    },\n    {\n      \"field\": \"cases_ma7\",\n      \"type\": \"quantitative\",\n      \"nl_ref_type\": \"explicit\",\n      \"nl_ref_phrase\": \"...\"\n    },\n    {\n      \"field\": \"country\",\n      \"type\": \"nominal\",\n      \"nl_ref_type\": \"explicit\",\n      \"nl_ref_phrase\": \"...\"\n    }\n  ],\n  \"constraints\": [\n    {\n      \"c_type\": \"mark\",\n      \"c_name\": \"line chart\",\n      \"c_list\": [\n        {\n          \"mark\": \"line\",\n          \"encoding\": {\n            \"x\": {},\n            \"y\": {\n              \"type\": \"quantitative\"\n            },\n            \"color\": {\n              \"ignore\": true,\n              \"type\": \"nominal\"\n            },\n            \"column\": {\n              \"ignore\": true,\n              \"type\": \"nominal\"\n            },\n            \"row\": {\n              \"ignore\": true,\n              \"type\": \"nominal\"\n            }\n          },\n          \"unique_map\": {\n            \"x\": \"y\"\n          }\n        }\n      ],\n      \"nl_ref_type\": \"explicit\",\n      \"nl_ref_phrase\": \"...\"\n    },\n    {\n      \"c_type\": \"transform\",\n      \"c_name\": \"filter\",\n      \"c_list\": [\n        {\n          \"field\": \"country\",\n          \"oneOf\": [\n            \"UK\",\n            \"France\",\n            \"Germany\",\n            \"Portugal\"\n          ]\n        }\n      ],\n      \"nl_ref_type\": \"by_value\",\n      \"nl_ref_phrase\": \"...\"\n    }\n  ]\n}\n\n### Output:"
}