{
  "gpt_result": {
    "nl_utterance": "What is the mean acceleration compared to the total number of cylinders?",
    "encoded_fields": [
      {
        "field": "Acceleration",
        "type": "quantitative",
        "nl_ref_type": "explicit",
        "nl_ref_phrase": "mean acceleration"
      },
      {
        "field": "Cylinders",
        "type": "quantitative",
        "nl_ref_type": "explicit",
        "nl_ref_phrase": "total number of cylinders"
      }
    ],
    "constraints": [
      {
        "c_type": "transform",
        "c_name": "aggregate",
        "c_list": [
          {
            "field": "Acceleration",
            "aggregate": "mean"
          }
        ],
        "nl_ref_type": "explicit",
        "nl_ref_phrase": "mean"
      },
      {
        "c_type": "transform",
        "c_name": "aggregate",
        "c_list": [
          {
            "field": "Cylinders",
            "aggregate": "sum"
          }
        ],
        "nl_ref_type": "explicit",
        "nl_ref_phrase": "total number"
      }
    ]
  },
  "input": "Dataset Information: {\n  \"data samples\": [\n    {\n      \"Name\": \"chevrolet chevelle malibu\",\n      \"Miles_per_Gallon\": 18.0,\n      \"Cylinders\": 8,\n      \"Displacement\": 307.0,\n      \"Horsepower\": 130.0,\n      \"Weight_in_lbs\": 3504,\n      \"Acceleration\": 12.0,\n      \"Year\": \"1970-01-01T00:00:00\",\n      \"Origin\": \"USA\"\n    },\n    {\n      \"Name\": \"volkswagen type 3\",\n      \"Miles_per_Gallon\": 23.0,\n      \"Cylinders\": 4,\n      \"Displacement\": 97.0,\n      \"Horsepower\": 54.0,\n      \"Weight_in_lbs\": 2254,\n      \"Acceleration\": 23.5,\n      \"Year\": \"1972-01-01T00:00:00\",\n      \"Origin\": \"Europe\"\n    },\n    {\n      \"Name\": \"chevrolet caprice classic\",\n      \"Miles_per_Gallon\": 17.0,\n      \"Cylinders\": 8,\n      \"Displacement\": 305.0,\n      \"Horsepower\": 130.0,\n      \"Weight_in_lbs\": 3840,\n      \"Acceleration\": 15.4,\n      \"Year\": \"1979-01-01T00:00:00\",\n      \"Origin\": \"USA\"\n    },\n    {\n      \"Name\": \"chevy c20\",\n      \"Miles_per_Gallon\": 10.0,\n      \"Cylinders\": 8,\n      \"Displacement\": 307.0,\n      \"Horsepower\": 200.0,\n      \"Weight_in_lbs\": 4376,\n      \"Acceleration\": 15.0,\n      \"Year\": \"1970-01-01T00:00:00\",\n      \"Origin\": \"USA\"\n    },\n    {\n      \"Name\": \"pontiac catalina\",\n      \"Miles_per_Gallon\": 14.0,\n      \"Cylinders\": 8,\n      \"Displacement\": 455.0,\n      \"Horsepower\": 225.0,\n      \"Weight_in_lbs\": 4425,\n      \"Acceleration\": 10.0,\n      \"Year\": \"1970-01-01T00:00:00\",\n      \"Origin\": \"USA\"\n    }\n  ],\n  \"column names\": [\n    \"Name\",\n    \"Miles_per_Gallon\",\n    \"Cylinders\",\n    \"Displacement\",\n    \"Horsepower\",\n    \"Weight_in_lbs\",\n    \"Acceleration\",\n    \"Year\",\n    \"Origin\"\n  ]\n}\n\nYour Job:\nI am developing a NL to Data Visualization Dataset. \nPlease help me generate natural language utterance for given dataset and constraints.\nDefinition about the Taks:\n- 'utterance' is what a user would say to make a chart. It should be a questions structure. One NL 'utterance' is in one or two sentences. Here are two examples from Questions for reference:\n    How does displacement relate to fuel economy for cars from Europe vs. USA?\n    What is our profit based on shipping mode by customer segment?\n- 'given dataset' is in form of column names, column type, range/unique values of the column.\n- 'constraints' are information about the chart that should be included in the utterance. \n    So we can find a reference phrase in the NL utterance that corresponds to the given constraints. \n- 'reference phrase' can be explicit, ambiguous, and by_value. 'ambiguous' means the phrase can map to more than one columns in the dataset, always a hypernym of column names(depending on the dataset values).\n    For example:\n    {\"column\": \"gdpPercap\", \"nl_ref_type\": \"explicit\", \"nl_ref_phrase\": \"GDP per capita\"},\n    {\"column\": [\"country\",\"continent\"], \"nl_ref_type\": \"ambiguous\", \"nl_ref_phrase\": \"region\"}\n    {\"column\": [\"country\",\"country_short_name\"], \"nl_ref_type\": \"ambiguous\", \"nl_ref_phrase\": \"countries\"}\n    {\"c_type\": \"mark\", \"c_name\": \"point chart\", \"nl_ref_type\": \"explicit\", \"nl_ref_phrase\": \"scatter plot\"}\n    {\"c_type\": \"mark\", \"c_name\": \"arc chart\", \"nl_ref_type\": \"explicit\", \"nl_ref_phrase\": \"pie chart\"}\n    {\"c_type\": \"transform\",\"c_name\": \"filter\",\"c_list\": [{\"field\": \"country\",\"oneOf\": [\"Iceland\",\"Norway\"]}],\"nl_ref_type\": \"explicit\",\"nl_ref_phrase\": \"for countries Iceland and Norway\"},\n    {\"c_type\": \"transform\",\"c_name\": \"filter\",\"c_list\": [{\"field\": \"country\",\"oneOf\": [\"Iceland\",\"Norway\"]}],\"nl_ref_type\": \"by_value\",\"nl_ref_phrase\": \"for Iceland and Norway\"},\n- the 'nl_ref_phrase' for 'ambiguous' columns should be equally near all ambiguous columns, not too near to one of the column since it would not be ambiguous.\n    good example: {\"column\": [\"country\",\"region\"], \"nl_ref_type\": \"ambiguous\", \"nl_ref_phrase\": \"location\"}\n    bad example: {\"column\": [\"country\",\"region\"], \"nl_ref_type\": \"ambiguous\", \"nl_ref_phrase\": \"region\"}\n- You only include given constraints and no other information. \n    For example, if a column name is not in the given constraint, it will not be included in the NL utterance.\n    Also, it a chart mark or chart encoding channel is not in the given constraint, it will not be included in the NL utterance.\n- all 'nl_ref_phrase' shoule be included in the 'nl_utterance'. \n\nThe output format is identical to the input format, but fill in the str blanks(\"...\").\n### Input:\n{\n  \"nl_utterance\": \"...\",\n  \"encoded_fields\": [\n    {\n      \"field\": \"Acceleration\",\n      \"type\": \"quantitative\",\n      \"nl_ref_type\": \"explicit\",\n      \"nl_ref_phrase\": \"...\"\n    },\n    {\n      \"field\": \"Cylinders\",\n      \"type\": \"quantitative\",\n      \"nl_ref_type\": \"explicit\",\n      \"nl_ref_phrase\": \"...\"\n    }\n  ],\n  \"constraints\": [\n    {\n      \"c_type\": \"transform\",\n      \"c_name\": \"aggregate\",\n      \"c_list\": [\n        {\n          \"field\": \"Acceleration\",\n          \"aggregate\": \"mean\"\n        }\n      ],\n      \"nl_ref_type\": \"explicit\",\n      \"nl_ref_phrase\": \"...\"\n    },\n    {\n      \"c_type\": \"transform\",\n      \"c_name\": \"aggregate\",\n      \"c_list\": [\n        {\n          \"field\": \"Cylinders\",\n          \"aggregate\": \"sum\"\n        }\n      ],\n      \"nl_ref_type\": \"explicit\",\n      \"nl_ref_phrase\": \"...\"\n    }\n  ]\n}\n\n### Output:"
}