{
  "gpt_result": {
    "nl_utterance": "Show a line chart of the 7-day average of cases over time for regions like the UK, France, Germany, and Portugal.",
    "encoded_fields": [
      {
        "field": "date2",
        "type": "temporal",
        "nl_ref_type": "explicit",
        "nl_ref_phrase": "time"
      },
      {
        "field": "cases_ma7",
        "type": "quantitative",
        "nl_ref_type": "explicit",
        "nl_ref_phrase": "7-day average of cases"
      },
      {
        "field": [
          "country",
          "continentexp",
          "neighbours"
        ],
        "type": "nominal",
        "nl_ref_type": "ambiguous",
        "nl_ref_phrase": "regions"
      }
    ],
    "constraints": [
      {
        "c_type": "transform",
        "c_name": "filter",
        "c_list": [
          {
            "field": "country",
            "oneOf": [
              "UK",
              "France",
              "Germany",
              "Portugal"
            ]
          }
        ],
        "nl_ref_type": "explicit",
        "nl_ref_phrase": "regions like the UK, France, Germany, and Portugal"
      }
    ]
  },
  "input": "Dataset Information: {\n  \"data samples\": [\n    {\n      \"date\": 20191231,\n      \"daterep\": \"31/12/2019\",\n      \"date2\": \"2019-12-31\",\n      \"day\": 31,\n      \"days\": 1,\n      \"month\": 12,\n      \"year\": 2019,\n      \"cases\": 0,\n      \"deaths\": 0,\n      \"country\": \"Afghanistan\",\n      \"geoid\": \"AF\",\n      \"countryterritorycode\": \"AFG\",\n      \"popdata2019\": 38041757.0,\n      \"continentexp\": \"Asia\",\n      \"cumulative_number_for_14_days_of\": NaN,\n      \"pop\": 38041757.0,\n      \"poprank\": 37.0,\n      \"t\": 1,\n      \"c\": 1,\n      \"cases_cml\": 0,\n      \"cases_ma7\": NaN,\n      \"cases_pop\": 0.0,\n      \"cases_cml_pop\": 0.0,\n      \"deaths_cml\": 0,\n      \"deaths_ma7\": NaN,\n      \"deaths_pop\": 0.0,\n      \"deaths_cml_pop\": 0.0,\n      \"deaths_rate\": NaN,\n      \"neighbours\": 0,\n      \"p20\": 0\n    },\n    {\n      \"date\": 20200613,\n      \"daterep\": \"13/06/2020\",\n      \"date2\": \"2020-6-13\",\n      \"day\": 13,\n      \"days\": 166,\n      \"month\": 6,\n      \"year\": 2020,\n      \"cases\": 18,\n      \"deaths\": 1,\n      \"country\": \"Sierra_Leone\",\n      \"geoid\": \"SL\",\n      \"countryterritorycode\": \"SLE\",\n      \"popdata2019\": 7813207.0,\n      \"continentexp\": \"Africa\",\n      \"cumulative_number_for_14_days_of\": 3.5068827,\n      \"pop\": 7813207.0,\n      \"poprank\": 101.0,\n      \"t\": 166,\n      \"c\": 172,\n      \"cases_cml\": 1103,\n      \"cases_ma7\": 27.0,\n      \"cases_pop\": 2.3037915e-06,\n      \"cases_cml_pop\": 0.00014117123,\n      \"deaths_cml\": 51,\n      \"deaths_ma7\": 0.5714286,\n      \"deaths_pop\": 1.2798841e-07,\n      \"deaths_cml_pop\": 6.5274094e-06,\n      \"deaths_rate\": 0.046237536,\n      \"neighbours\": 0,\n      \"p20\": 0\n    },\n    {\n      \"date\": 20201013,\n      \"daterep\": \"13/10/2020\",\n      \"date2\": \"2020-10-13\",\n      \"day\": 13,\n      \"days\": 288,\n      \"month\": 10,\n      \"year\": 2020,\n      \"cases\": 9524,\n      \"deaths\": 318,\n      \"country\": \"Argentina\",\n      \"geoid\": \"AR\",\n      \"countryterritorycode\": \"ARG\",\n      \"popdata2019\": 44780675.0,\n      \"continentexp\": \"America\",\n      \"cumulative_number_for_14_days_of\": 403.29449,\n      \"pop\": 44780675.0,\n      \"poprank\": 31.0,\n      \"t\": 288,\n      \"c\": 8,\n      \"cases_cml\": 903717,\n      \"cases_ma7\": 15034.857,\n      \"cases_pop\": 0.00021268103,\n      \"cases_cml_pop\": 0.020180959,\n      \"deaths_cml\": 24186,\n      \"deaths_ma7\": 452.57144,\n      \"deaths_pop\": 7.1012773e-06,\n      \"deaths_cml_pop\": 0.00054009905,\n      \"deaths_rate\": 0.026762802,\n      \"neighbours\": 0,\n      \"p20\": 0\n    },\n    {\n      \"date\": 20200609,\n      \"daterep\": \"09/06/2020\",\n      \"date2\": \"2020-6-9\",\n      \"day\": 9,\n      \"days\": 162,\n      \"month\": 6,\n      \"year\": 2020,\n      \"cases\": 29,\n      \"deaths\": 0,\n      \"country\": \"Kosovo\",\n      \"geoid\": \"XK\",\n      \"countryterritorycode\": \"XKX\",\n      \"popdata2019\": 1798506.0,\n      \"continentexp\": \"Europe\",\n      \"cumulative_number_for_14_days_of\": 12.510384,\n      \"pop\": 1798506.0,\n      \"poprank\": 149.0,\n      \"t\": 162,\n      \"c\": 107,\n      \"cases_cml\": 1263,\n      \"cases_ma7\": 25.714285,\n      \"cases_pop\": 1.6124495e-05,\n      \"cases_cml_pop\": 0.00070224953,\n      \"deaths_cml\": 31,\n      \"deaths_ma7\": 0.14285715,\n      \"deaths_pop\": 0.0,\n      \"deaths_cml_pop\": 1.7236529e-05,\n      \"deaths_rate\": 0.024544735,\n      \"neighbours\": 0,\n      \"p20\": 0\n    },\n    {\n      \"date\": 20201007,\n      \"daterep\": \"07/10/2020\",\n      \"date2\": \"2020-10-7\",\n      \"day\": 7,\n      \"days\": 282,\n      \"month\": 10,\n      \"year\": 2020,\n      \"cases\": 46,\n      \"deaths\": 2,\n      \"country\": \"Syria\",\n      \"geoid\": \"SY\",\n      \"countryterritorycode\": \"SYR\",\n      \"popdata2019\": 17070132.0,\n      \"continentexp\": \"Asia\",\n      \"cumulative_number_for_14_days_of\": 3.3977475,\n      \"pop\": 17070132.0,\n      \"poprank\": 68.0,\n      \"t\": 282,\n      \"c\": 188,\n      \"cases_cml\": 4457,\n      \"cases_ma7\": 50.714287,\n      \"cases_pop\": 2.6947653e-06,\n      \"cases_cml_pop\": 0.00026109934,\n      \"deaths_cml\": 209,\n      \"deaths_ma7\": 2.1428571,\n      \"deaths_pop\": 1.1716371e-07,\n      \"deaths_cml_pop\": 1.2243608e-05,\n      \"deaths_rate\": 0.046892527,\n      \"neighbours\": 0,\n      \"p20\": 0\n    }\n  ],\n  \"column names\": [\n    \"date\",\n    \"daterep\",\n    \"date2\",\n    \"day\",\n    \"days\",\n    \"month\",\n    \"year\",\n    \"cases\",\n    \"deaths\",\n    \"country\",\n    \"geoid\",\n    \"countryterritorycode\",\n    \"popdata2019\",\n    \"continentexp\",\n    \"cumulative_number_for_14_days_of\",\n    \"pop\",\n    \"poprank\",\n    \"t\",\n    \"c\",\n    \"cases_cml\",\n    \"cases_ma7\",\n    \"cases_pop\",\n    \"cases_cml_pop\",\n    \"deaths_cml\",\n    \"deaths_ma7\",\n    \"deaths_pop\",\n    \"deaths_cml_pop\",\n    \"deaths_rate\",\n    \"neighbours\",\n    \"p20\"\n  ]\n}\n\nYour Job:\nI am developing a NL to Data Visualization Dataset. \nPlease help me generate natural language utterance for given dataset and constraints.\nDefinition about the Taks:\n- 'utterance' is what a user would say to make a chart. It should be a queries structure. One NL 'utterance' is in one or two sentences. Here are two examples from Queries for reference:\n    Line Graph of SUM (Sales Forecast) vs Order Date.\n    Compare acceleration vs weight across different countries.\n- 'given dataset' is in form of column names, column type, range/unique values of the column.\n- 'constraints' are information about the chart that should be included in the utterance. \n    So we can find a reference phrase in the NL utterance that corresponds to the given constraints. \n- 'reference phrase' can be explicit, ambiguous, and by_value. 'ambiguous' means the phrase can map to more than one columns in the dataset, always a hypernym of column names(depending on the dataset values).\n    For example:\n    {\"column\": \"gdpPercap\", \"nl_ref_type\": \"explicit\", \"nl_ref_phrase\": \"GDP per capita\"},\n    {\"column\": [\"country\",\"continent\"], \"nl_ref_type\": \"ambiguous\", \"nl_ref_phrase\": \"region\"}\n    {\"column\": [\"country\",\"country_short_name\"], \"nl_ref_type\": \"ambiguous\", \"nl_ref_phrase\": \"countries\"}\n    {\"c_type\": \"mark\", \"c_name\": \"point chart\", \"nl_ref_type\": \"explicit\", \"nl_ref_phrase\": \"scatter plot\"}\n    {\"c_type\": \"mark\", \"c_name\": \"arc chart\", \"nl_ref_type\": \"explicit\", \"nl_ref_phrase\": \"pie chart\"}\n    {\"c_type\": \"transform\",\"c_name\": \"filter\",\"c_list\": [{\"field\": \"country\",\"oneOf\": [\"Iceland\",\"Norway\"]}],\"nl_ref_type\": \"explicit\",\"nl_ref_phrase\": \"for countries Iceland and Norway\"},\n    {\"c_type\": \"transform\",\"c_name\": \"filter\",\"c_list\": [{\"field\": \"country\",\"oneOf\": [\"Iceland\",\"Norway\"]}],\"nl_ref_type\": \"by_value\",\"nl_ref_phrase\": \"for Iceland and Norway\"},\n- the 'nl_ref_phrase' for 'ambiguous' columns should be equally near all ambiguous columns, not too near to one of the column since it would not be ambiguous.\n    good example: {\"column\": [\"country\",\"region\"], \"nl_ref_type\": \"ambiguous\", \"nl_ref_phrase\": \"location\"}\n    bad example: {\"column\": [\"country\",\"region\"], \"nl_ref_type\": \"ambiguous\", \"nl_ref_phrase\": \"region\"}\n- You only include given constraints and no other information. \n    For example, if a column name is not in the given constraint, it will not be included in the NL utterance.\n    Also, it a chart mark or chart encoding channel is not in the given constraint, it will not be included in the NL utterance.\n- all 'nl_ref_phrase' shoule be included in the 'nl_utterance'. \n\nThe output format is identical to the input format, but fill in the str blanks(\"...\").\n### Input:\n{\n  \"nl_utterance\": \"...\",\n  \"encoded_fields\": [\n    {\n      \"field\": \"date2\",\n      \"type\": \"temporal\",\n      \"nl_ref_type\": \"explicit\",\n      \"nl_ref_phrase\": \"...\"\n    },\n    {\n      \"field\": \"cases_ma7\",\n      \"type\": \"quantitative\",\n      \"nl_ref_type\": \"explicit\",\n      \"nl_ref_phrase\": \"...\"\n    },\n    {\n      \"field\": [\n        \"country\",\n        \"continentexp\",\n        \"neighbours\"\n      ],\n      \"type\": \"nominal\",\n      \"nl_ref_type\": \"ambiguous\",\n      \"nl_ref_phrase\": \"...\"\n    }\n  ],\n  \"constraints\": [\n    {\n      \"c_type\": \"transform\",\n      \"c_name\": \"filter\",\n      \"c_list\": [\n        {\n          \"field\": \"country\",\n          \"oneOf\": [\n            \"UK\",\n            \"France\",\n            \"Germany\",\n            \"Portugal\"\n          ]\n        }\n      ],\n      \"nl_ref_type\": \"explicit\",\n      \"nl_ref_phrase\": \"...\"\n    }\n  ]\n}\n\n### Output:"
}