{
  "gpt_result": {
    "nl_utterance": "Create a line chart to show the trend of Totals as a percentage of GDP over time.",
    "encoded_fields": [
      {
        "field": "Totals_GDP",
        "type": "quantitative",
        "nl_ref_type": "explicit",
        "nl_ref_phrase": "Totals as a percentage of GDP"
      }
    ],
    "constraints": [
      {
        "c_type": "task",
        "c_name": "trend",
        "c_list": [
          {
            "mark": [
              "bar",
              "line",
              "area"
            ],
            "encoding": {
              "x": {
                "type": "temporal"
              }
            }
          }
        ],
        "nl_ref_type": "explicit",
        "nl_ref_phrase": "trend over time"
      }
    ]
  },
  "input": "Dataset Information: {\n  \"data samples\": [\n    {\n      \"Date\": \"08/31/2022\",\n      \"GRA Purchases\": 93769635059,\n      \"PRGT 1/2/\": 15254184552,\n      \"Totals\": 109023819611,\n      \"Year\": 2022,\n      \"Totals_billions\": 109.0238196,\n      \"Unnamed: 6\": NaN,\n      \"GDP\": 3376.003,\n      \"Unnamed: 8\": NaN,\n      \"Totals_GDP\": 3.229375673\n    },\n    {\n      \"Date\": \"12/31/1997\",\n      \"GRA Purchases\": 46559033783,\n      \"PRGT 1/2/\": 6009867422,\n      \"Totals\": 52568901205,\n      \"Year\": 1997,\n      \"Totals_billions\": 52.56890121,\n      \"Unnamed: 6\": NaN,\n      \"GDP\": 1559.896,\n      \"Unnamed: 8\": NaN,\n      \"Totals_GDP\": 3.370026028\n    },\n    {\n      \"Date\": \"12/31/1996\",\n      \"GRA Purchases\": 36127472805,\n      \"PRGT 1/2/\": 5881609752,\n      \"Totals\": 42009082557,\n      \"Year\": 1996,\n      \"Totals_billions\": 42.00908256,\n      \"Unnamed: 6\": NaN,\n      \"GDP\": 1422.969,\n      \"Unnamed: 8\": NaN,\n      \"Totals_GDP\": 2.952213475\n    },\n    {\n      \"Date\": \"12/31/2005\",\n      \"GRA Purchases\": 28432143237,\n      \"PRGT 1/2/\": 6282121668,\n      \"Totals\": 34714264905,\n      \"Year\": 2005,\n      \"Totals_billions\": 34.71426491,\n      \"Unnamed: 6\": NaN,\n      \"GDP\": 2434.48,\n      \"Unnamed: 8\": NaN,\n      \"Totals_GDP\": 1.425941676\n    },\n    {\n      \"Date\": \"12/31/2015\",\n      \"GRA Purchases\": 50757840741,\n      \"PRGT 1/2/\": 6575911158,\n      \"Totals\": 57333751899,\n      \"Year\": 2015,\n      \"Totals_billions\": 57.3337519,\n      \"Unnamed: 6\": NaN,\n      \"GDP\": 2880.357,\n      \"Unnamed: 8\": NaN,\n      \"Totals_GDP\": 1.990508534\n    }\n  ],\n  \"column names\": [\n    \"Date\",\n    \"GRA Purchases\",\n    \"PRGT 1/2/\",\n    \"Totals\",\n    \"Year\",\n    \"Totals_billions\",\n    \"Unnamed: 6\",\n    \"GDP\",\n    \"Unnamed: 8\",\n    \"Totals_GDP\"\n  ]\n}\n\nYour Job:\nI am developing a NL to Data Visualization Dataset. \nPlease help me generate natural language utterance for given dataset and constraints.\nDefinition about the Taks:\n- 'utterance' is what a user would say to make a chart. It should be a commands structure. One NL 'utterance' is in one or two sentences. Here are two examples from Commands for reference:\n    Through a visualization show average horsepower of cars for each country from 1997 to 2011.for country in USA, JAPAN and EUROPE show MPG vs Displacement.\n    For each country show the relationship between average acceleration and number of cylinders.\n- 'given dataset' is in form of column names, column type, range/unique values of the column.\n- 'constraints' are information about the chart that should be included in the utterance. \n    So we can find a reference phrase in the NL utterance that corresponds to the given constraints. \n- 'reference phrase' can be explicit, ambiguous, and by_value. 'ambiguous' means the phrase can map to more than one columns in the dataset, always a hypernym of column names(depending on the dataset values).\n    For example:\n    {\"column\": \"gdpPercap\", \"nl_ref_type\": \"explicit\", \"nl_ref_phrase\": \"GDP per capita\"},\n    {\"column\": [\"country\",\"continent\"], \"nl_ref_type\": \"ambiguous\", \"nl_ref_phrase\": \"region\"}\n    {\"column\": [\"country\",\"country_short_name\"], \"nl_ref_type\": \"ambiguous\", \"nl_ref_phrase\": \"countries\"}\n    {\"c_type\": \"mark\", \"c_name\": \"point chart\", \"nl_ref_type\": \"explicit\", \"nl_ref_phrase\": \"scatter plot\"}\n    {\"c_type\": \"mark\", \"c_name\": \"arc chart\", \"nl_ref_type\": \"explicit\", \"nl_ref_phrase\": \"pie chart\"}\n    {\"c_type\": \"transform\",\"c_name\": \"filter\",\"c_list\": [{\"field\": \"country\",\"oneOf\": [\"Iceland\",\"Norway\"]}],\"nl_ref_type\": \"explicit\",\"nl_ref_phrase\": \"for countries Iceland and Norway\"},\n    {\"c_type\": \"transform\",\"c_name\": \"filter\",\"c_list\": [{\"field\": \"country\",\"oneOf\": [\"Iceland\",\"Norway\"]}],\"nl_ref_type\": \"by_value\",\"nl_ref_phrase\": \"for Iceland and Norway\"},\n- the 'nl_ref_phrase' for 'ambiguous' columns should be equally near all ambiguous columns, not too near to one of the column since it would not be ambiguous.\n    good example: {\"column\": [\"country\",\"region\"], \"nl_ref_type\": \"ambiguous\", \"nl_ref_phrase\": \"location\"}\n    bad example: {\"column\": [\"country\",\"region\"], \"nl_ref_type\": \"ambiguous\", \"nl_ref_phrase\": \"region\"}\n- You only include given constraints and no other information. \n    For example, if a column name is not in the given constraint, it will not be included in the NL utterance.\n    Also, it a chart mark or chart encoding channel is not in the given constraint, it will not be included in the NL utterance.\n- all 'nl_ref_phrase' shoule be included in the 'nl_utterance'. \n\nThe output format is identical to the input format, but fill in the str blanks(\"...\").\n### Input:\n{\n  \"nl_utterance\": \"...\",\n  \"encoded_fields\": [\n    {\n      \"field\": \"Totals_GDP\",\n      \"type\": \"quantitative\",\n      \"nl_ref_type\": \"explicit\",\n      \"nl_ref_phrase\": \"...\"\n    }\n  ],\n  \"constraints\": [\n    {\n      \"c_type\": \"task\",\n      \"c_name\": \"trend\",\n      \"c_list\": [\n        {\n          \"mark\": [\n            \"bar\",\n            \"line\",\n            \"area\"\n          ],\n          \"encoding\": {\n            \"x\": {\n              \"type\": \"temporal\"\n            }\n          }\n        }\n      ],\n      \"nl_ref_type\": \"explicit\",\n      \"nl_ref_phrase\": \"...\"\n    }\n  ]\n}\n\n### Output:"
}