{
  "gpt_result": {
    "nl_utterance": "Is there a correlation between different financial figures and the league position?",
    "encoded_fields": [
      {
        "field": [
          "Expenditure",
          "Transfer expenditures",
          "Total value",
          "Expenditure rank"
        ],
        "type": "quantitative",
        "nl_ref_type": "ambiguous",
        "nl_ref_phrase": "financial figures"
      },
      {
        "field": "League position",
        "type": "quantitative",
        "nl_ref_type": "explicit",
        "nl_ref_phrase": "league position"
      }
    ],
    "constraints": [
      {
        "c_type": "task",
        "c_name": "correlation",
        "c_list": [
          {
            "mark": "circle",
            "encoding": {
              "x": {
                "type": "quantitative"
              },
              "y": {
                "type": "quantitative"
              }
            }
          }
        ],
        "nl_ref_type": "explicit",
        "nl_ref_phrase": "correlation"
      }
    ]
  },
  "input": "Dataset Information: {\n  \"data samples\": [\n    {\n      \"Unnamed: 0\": 0,\n      \"League position\": 1,\n      \"wappen\": NaN,\n      \"Club\": \"Arsenal FC\",\n      \"Club.1\": \"\\u00c2\\u00a3598.95m\",\n      \"Total value\": 9,\n      \"Expenditure rank\": \"\\u00c2\\u00a3118.86m\",\n      \"Transfer expenditures\": 8,\n      \"Difference\": NaN,\n      \"Left\": \"\\u00c2\\u00a3\",\n      \"Right\": \"m\",\n      \"Expenditure\": 118.8\n    },\n    {\n      \"Unnamed: 0\": 18,\n      \"League position\": 19,\n      \"wappen\": NaN,\n      \"Club\": \"Wolverhampton Wanderers\",\n      \"Club.1\": \"\\u00c2\\u00a3347.63m\",\n      \"Total value\": 7,\n      \"Expenditure rank\": \"\\u00c2\\u00a3122.94m\",\n      \"Transfer expenditures\": -12,\n      \"Difference\": NaN,\n      \"Left\": \"\\u00c2\\u00a3\",\n      \"Right\": \"m\",\n      \"Expenditure\": 122.9\n    },\n    {\n      \"Unnamed: 0\": 14,\n      \"League position\": 15,\n      \"wappen\": NaN,\n      \"Club\": \"Aston Villa\",\n      \"Club.1\": \"\\u00c2\\u00a3455.04m\",\n      \"Total value\": 14,\n      \"Expenditure rank\": \"\\u00c2\\u00a363.00m\",\n      \"Transfer expenditures\": -1,\n      \"Difference\": NaN,\n      \"Left\": \"\\u00c2\\u00a3\",\n      \"Right\": \"m\",\n      \"Expenditure\": 63.0\n    },\n    {\n      \"Unnamed: 0\": 11,\n      \"League position\": 12,\n      \"wappen\": NaN,\n      \"Club\": \"Everton FC\",\n      \"Club.1\": \"\\u00c2\\u00a3388.62m\",\n      \"Total value\": 12,\n      \"Expenditure rank\": \"\\u00c2\\u00a370.38m\",\n      \"Transfer expenditures\": 0,\n      \"Difference\": NaN,\n      \"Left\": \"\\u00c2\\u00a3\",\n      \"Right\": \"m\",\n      \"Expenditure\": 70.38\n    },\n    {\n      \"Unnamed: 0\": 1,\n      \"League position\": 2,\n      \"wappen\": NaN,\n      \"Club\": \"Manchester City\",\n      \"Club.1\": \"\\u00c2\\u00a3949.77m\",\n      \"Total value\": 6,\n      \"Expenditure rank\": \"\\u00c2\\u00a3125.55m\",\n      \"Transfer expenditures\": 4,\n      \"Difference\": NaN,\n      \"Left\": \"\\u00c2\\u00a3\",\n      \"Right\": \"m\",\n      \"Expenditure\": 125.5\n    }\n  ],\n  \"column names\": [\n    \"Unnamed: 0\",\n    \"League position\",\n    \"wappen\",\n    \"Club\",\n    \"Club.1\",\n    \"Total value\",\n    \"Expenditure rank\",\n    \"Transfer expenditures\",\n    \"Difference\",\n    \"Left\",\n    \"Right\",\n    \"Expenditure\"\n  ]\n}\n\nYour Job:\nI am developing a NL to Data Visualization Dataset. \nPlease help me generate natural language utterance for given dataset and constraints.\nDefinition about the Taks:\n- 'utterance' is what a user would say to make a chart. It should be a questions structure. One NL 'utterance' is in one or two sentences. Here are two examples from Questions for reference:\n    What's the average production budget of the different rated movies, separated by creative type.\n    Are IMDb rating and rotten tomatoes rating related?\n- 'given dataset' is in form of column names, column type, range/unique values of the column.\n- 'constraints' are information about the chart that should be included in the utterance. \n    So we can find a reference phrase in the NL utterance that corresponds to the given constraints. \n- 'reference phrase' can be explicit, ambiguous, and by_value. 'ambiguous' means the phrase can map to more than one columns in the dataset, always a hypernym of column names(depending on the dataset values).\n    For example:\n    {\"column\": \"gdpPercap\", \"nl_ref_type\": \"explicit\", \"nl_ref_phrase\": \"GDP per capita\"},\n    {\"column\": [\"country\",\"continent\"], \"nl_ref_type\": \"ambiguous\", \"nl_ref_phrase\": \"region\"}\n    {\"column\": [\"country\",\"country_short_name\"], \"nl_ref_type\": \"ambiguous\", \"nl_ref_phrase\": \"countries\"}\n    {\"c_type\": \"mark\", \"c_name\": \"point chart\", \"nl_ref_type\": \"explicit\", \"nl_ref_phrase\": \"scatter plot\"}\n    {\"c_type\": \"mark\", \"c_name\": \"arc chart\", \"nl_ref_type\": \"explicit\", \"nl_ref_phrase\": \"pie chart\"}\n    {\"c_type\": \"transform\",\"c_name\": \"filter\",\"c_list\": [{\"field\": \"country\",\"oneOf\": [\"Iceland\",\"Norway\"]}],\"nl_ref_type\": \"explicit\",\"nl_ref_phrase\": \"for countries Iceland and Norway\"},\n    {\"c_type\": \"transform\",\"c_name\": \"filter\",\"c_list\": [{\"field\": \"country\",\"oneOf\": [\"Iceland\",\"Norway\"]}],\"nl_ref_type\": \"by_value\",\"nl_ref_phrase\": \"for Iceland and Norway\"},\n- the 'nl_ref_phrase' for 'ambiguous' columns should be equally near all ambiguous columns, not too near to one of the column since it would not be ambiguous.\n    good example: {\"column\": [\"country\",\"region\"], \"nl_ref_type\": \"ambiguous\", \"nl_ref_phrase\": \"location\"}\n    bad example: {\"column\": [\"country\",\"region\"], \"nl_ref_type\": \"ambiguous\", \"nl_ref_phrase\": \"region\"}\n- You only include given constraints and no other information. \n    For example, if a column name is not in the given constraint, it will not be included in the NL utterance.\n    Also, it a chart mark or chart encoding channel is not in the given constraint, it will not be included in the NL utterance.\n- all 'nl_ref_phrase' shoule be included in the 'nl_utterance'. \n\nThe output format is identical to the input format, but fill in the str blanks(\"...\").\n### Input:\n{\n  \"nl_utterance\": \"...\",\n  \"encoded_fields\": [\n    {\n      \"field\": [\n        \"Expenditure\",\n        \"Transfer expenditures\",\n        \"Total value\",\n        \"Expenditure rank\"\n      ],\n      \"type\": \"quantitative\",\n      \"nl_ref_type\": \"ambiguous\",\n      \"nl_ref_phrase\": \"...\"\n    },\n    {\n      \"field\": \"League position\",\n      \"type\": \"quantitative\",\n      \"nl_ref_type\": \"explicit\",\n      \"nl_ref_phrase\": \"...\"\n    }\n  ],\n  \"constraints\": [\n    {\n      \"c_type\": \"task\",\n      \"c_name\": \"correlation\",\n      \"c_list\": [\n        {\n          \"mark\": \"circle\",\n          \"encoding\": {\n            \"x\": {\n              \"type\": \"quantitative\"\n            },\n            \"y\": {\n              \"type\": \"quantitative\"\n            }\n          }\n        }\n      ],\n      \"nl_ref_type\": \"explicit\",\n      \"nl_ref_phrase\": \"...\"\n    }\n  ]\n}\n\n### Output:"
}