{
  "gpt_result": {
    "nl_utterance": "Create a bar chart showing the total Debt-GDP for each time period.",
    "encoded_fields": [
      {
        "field": [
          "Date",
          "Year"
        ],
        "type": "quantitative",
        "nl_ref_type": "ambiguous",
        "nl_ref_phrase": "time period"
      },
      {
        "field": "Debt-GDP",
        "type": "quantitative",
        "nl_ref_type": "explicit",
        "nl_ref_phrase": "total Debt-GDP"
      }
    ],
    "constraints": [
      {
        "c_type": "mark",
        "c_name": "bar chart",
        "nl_ref_type": "explicit",
        "nl_ref_phrase": "bar chart"
      },
      {
        "c_type": "transform",
        "c_name": "aggregate",
        "nl_ref_type": "explicit",
        "nl_ref_phrase": "showing the total"
      }
    ]
  },
  "input": "Dataset Information: {\n  \"data samples\": [\n    {\n      \"Date\": \"08/31/2022\",\n      \"GRA Purchases\": 93769635059,\n      \"PRGT 1/2/\": 15254184552,\n      \"Totals\": 109024000000.0,\n      \"Year\": 2022,\n      \"Unnamed: 5\": \"31/2022\",\n      \"Day\": 31,\n      \"Total_billion\": 109.02,\n      \"World_GDP\": 98406500000000.0,\n      \"Debt-GDP\": 0.11\n    },\n    {\n      \"Date\": \"12/31/1995\",\n      \"GRA Purchases\": 35929173412,\n      \"PRGT 1/2/\": 5657438528,\n      \"Totals\": 41586611940.0,\n      \"Year\": 1995,\n      \"Unnamed: 5\": \"31/1995\",\n      \"Day\": 31,\n      \"Total_billion\": 41.59,\n      \"World_GDP\": 31043600000000.0,\n      \"Debt-GDP\": 0.13\n    },\n    {\n      \"Date\": \"12/31/2002\",\n      \"GRA Purchases\": 63601058794,\n      \"PRGT 1/2/\": 6868671012,\n      \"Totals\": 70469729806.0,\n      \"Year\": 2002,\n      \"Unnamed: 5\": \"31/2002\",\n      \"Day\": 31,\n      \"Total_billion\": 70.47,\n      \"World_GDP\": 34911400000000.0,\n      \"Debt-GDP\": 0.2\n    }\n  ],\n  \"column names\": [\n    \"Date\",\n    \"GRA Purchases\",\n    \"PRGT 1/2/\",\n    \"Totals\",\n    \"Year\",\n    \"Unnamed: 5\",\n    \"Day\",\n    \"Total_billion\",\n    \"World_GDP\",\n    \"Debt-GDP\"\n  ]\n}\n\nYour Job:\nI am developing a NL to Data Visualization Dataset. \nPlease help me generate natural language utterance for given dataset and constraints.\nDefinition about the Taks:\n- 'utterance' is what a user would say to make a chart, it can be a question or a command. One NL 'utterance' is in one or two sentences. \n- 'given dataset' is in form of column names, column type, range/unique values of the column.\n- 'constraints' are information about the chart that should be included in the utterance. \n    So we can find a reference phrase in the NL utterance that corresponds to the given constraints. \n- 'reference phrase' can be explicit, ambiguous, and by_value. 'ambiguous' means the phrase can map to more than one columns in the dataset, always a hypernym of column names(depending on the dataset values).\n    For example:\n    {\"column\": \"gdpPercap\", \"nl_ref_type\": \"explicit\", \"nl_ref_phrase\": \"GDP per capita\"},\n    {\"column\": [\"country\",\"continent\"], \"nl_ref_type\": \"ambiguous\", \"nl_ref_phrase\": \"region\"}\n    {\"column\": [\"country\",\"country_short_name\"], \"nl_ref_type\": \"ambiguous\", \"nl_ref_phrase\": \"countries\"}\n    {\"c_type\": \"mark\", \"c_name\": \"point chart\", \"nl_ref_type\": \"explicit\", \"nl_ref_phrase\": \"scatter plot\"}\n    {\"c_type\": \"mark\", \"c_name\": \"arc chart\", \"nl_ref_type\": \"explicit\", \"nl_ref_phrase\": \"pie chart\"}\n    {\"c_type\": \"transform\",\"c_name\": \"filter\",\"c_list\": [{\"field\": \"country\",\"oneOf\": [\"Iceland\",\"Norway\"]}],\"nl_ref_type\": \"explicit\",\"nl_ref_phrase\": \"for countries Iceland and Norway\"},\n    {\"c_type\": \"transform\",\"c_name\": \"filter\",\"c_list\": [{\"field\": \"country\",\"oneOf\": [\"Iceland\",\"Norway\"]}],\"nl_ref_type\": \"by_value\",\"nl_ref_phrase\": \"for Iceland and Norway\"},\n- the 'nl_ref_phrase' for 'ambiguous' columns should be equally near all ambiguous columns, not too near to one of the column since it would not be ambiguous.\n    good example: {\"column\": [\"country\",\"region\"], \"nl_ref_type\": \"ambiguous\", \"nl_ref_phrase\": \"location\"}\n    bad example: {\"column\": [\"country\",\"region\"], \"nl_ref_type\": \"ambiguous\", \"nl_ref_phrase\": \"region\"}\n- You only include given constraints and no other information. \n    For example, if a column name is not in the given constraint, it will not be included in the NL utterance.\n    Also, it a chart mark or chart encoding channel is not in the given constraint, it will not be included in the NL utterance.\n- all 'nl_ref_phrase' shoule be included in the 'nl_utterance'. \n\nThe output format is identical to the input format, but fill in the str blanks(\"...\").\n### Input:\n{\n  \"nl_utterance\": \"...\",\n  \"encoded_fields\": [\n    {\n      \"field\": [\n        \"Date\",\n        \"Year\"\n      ],\n      \"type\": \"quantitative\",\n      \"nl_ref_type\": \"ambiguous\",\n      \"nl_ref_phrase\": \"...\"\n    },\n    {\n      \"field\": \"Debt-GDP\",\n      \"type\": \"quantitative\",\n      \"nl_ref_type\": \"explicit\",\n      \"nl_ref_phrase\": \"...\"\n    }\n  ],\n  \"constraints\": [\n    {\n      \"c_type\": \"mark\",\n      \"c_name\": \"bar chart\",\n      \"c_list\": [\n        {\n          \"mark\": \"bar\",\n          \"encoding\": {\n            \"x\": {},\n            \"y\": {\n              \"type\": \"quantitative\"\n            },\n            \"color\": {\n              \"type\": \"nominal\",\n              \"ignore\": true\n            },\n            \"column\": {\n              \"ignore\": true,\n              \"type\": \"nominal\"\n            },\n            \"row\": {\n              \"ignore\": true,\n              \"type\": \"nominal\"\n            }\n          },\n          \"unique_map\": {\n            \"x\": \"y\"\n          }\n        },\n        {\n          \"mark\": \"bar\",\n          \"encoding\": {\n            \"y\": {},\n            \"x\": {\n              \"type\": \"quantitative\"\n            },\n            \"color\": {\n              \"type\": \"nominal\",\n              \"ignore\": true\n            },\n            \"column\": {\n              \"ignore\": true,\n              \"type\": \"nominal\"\n            },\n            \"row\": {\n              \"ignore\": true,\n              \"type\": \"nominal\"\n            }\n          },\n          \"unique_map\": {\n            \"y\": \"x\"\n          }\n        }\n      ],\n      \"nl_ref_type\": \"explicit\",\n      \"nl_ref_phrase\": \"...\"\n    },\n    {\n      \"c_type\": \"transform\",\n      \"c_name\": \"aggregate\",\n      \"c_list\": [\n        {\n          \"field\": \"Debt-GDP\",\n          \"aggregate\": \"sum\"\n        }\n      ],\n      \"nl_ref_type\": \"explicit\",\n      \"nl_ref_phrase\": \"...\"\n    }\n  ]\n}\n\n### Output:"
}