{
  "gpt_result": {
    "nl_utterance": "Show me the sum of 7-day moving average of cases over time for countries in Europe, including details about the surrounding areas, focusing on the UK, France, Germany, and Portugal.",
    "encoded_fields": [
      {
        "field": "date2",
        "type": "temporal",
        "nl_ref_type": "explicit",
        "nl_ref_phrase": "over time"
      },
      {
        "field": "cases_ma7",
        "type": "quantitative",
        "nl_ref_type": "explicit",
        "nl_ref_phrase": "7-day moving average of cases"
      },
      {
        "field": [
          "country",
          "continentexp",
          "neighbours"
        ],
        "type": "nominal",
        "nl_ref_type": "ambiguous",
        "nl_ref_phrase": "countries in Europe, including details about the surrounding areas"
      }
    ],
    "constraints": [
      {
        "c_type": "transform",
        "c_name": "filter",
        "c_list": [
          {
            "field": "country",
            "oneOf": [
              "UK",
              "France",
              "Germany",
              "Portugal"
            ]
          }
        ],
        "nl_ref_type": "explicit",
        "nl_ref_phrase": "focusing on the UK, France, Germany, and Portugal"
      },
      {
        "c_type": "transform",
        "c_name": "aggregate",
        "c_list": [
          {
            "field": "cases_ma7",
            "aggregate": "sum"
          }
        ],
        "nl_ref_type": "explicit",
        "nl_ref_phrase": "the sum of 7-day moving average of cases"
      }
    ]
  },
  "input": "Dataset Information: {\n  \"data samples\": [\n    {\n      \"date\": 20191231,\n      \"daterep\": \"31/12/2019\",\n      \"date2\": \"2019-12-31\",\n      \"day\": 31,\n      \"days\": 1,\n      \"month\": 12,\n      \"year\": 2019,\n      \"cases\": 0,\n      \"deaths\": 0,\n      \"country\": \"Afghanistan\",\n      \"geoid\": \"AF\",\n      \"countryterritorycode\": \"AFG\",\n      \"popdata2019\": 38041757.0,\n      \"continentexp\": \"Asia\",\n      \"cumulative_number_for_14_days_of\": NaN,\n      \"pop\": 38041757.0,\n      \"poprank\": 37.0,\n      \"t\": 1,\n      \"c\": 1,\n      \"cases_cml\": 0,\n      \"cases_ma7\": NaN,\n      \"cases_pop\": 0.0,\n      \"cases_cml_pop\": 0.0,\n      \"deaths_cml\": 0,\n      \"deaths_ma7\": NaN,\n      \"deaths_pop\": 0.0,\n      \"deaths_cml_pop\": 0.0,\n      \"deaths_rate\": NaN,\n      \"neighbours\": 0,\n      \"p20\": 0\n    },\n    {\n      \"date\": 20201012,\n      \"daterep\": \"12/10/2020\",\n      \"date2\": \"2020-10-12\",\n      \"day\": 12,\n      \"days\": 287,\n      \"month\": 10,\n      \"year\": 2020,\n      \"cases\": 24,\n      \"deaths\": 0,\n      \"country\": \"Senegal\",\n      \"geoid\": \"SN\",\n      \"countryterritorycode\": \"SEN\",\n      \"popdata2019\": 16296362.0,\n      \"continentexp\": \"Africa\",\n      \"cumulative_number_for_14_days_of\": 2.2029457,\n      \"pop\": 16296362.0,\n      \"poprank\": 70.0,\n      \"t\": 287,\n      \"c\": 169,\n      \"cases_cml\": 15268,\n      \"cases_ma7\": 28.571428,\n      \"cases_pop\": 1.4727214e-06,\n      \"cases_cml_pop\": 0.00093689625,\n      \"deaths_cml\": 314,\n      \"deaths_ma7\": 0.2857143,\n      \"deaths_pop\": 0.0,\n      \"deaths_cml_pop\": 1.9268104e-05,\n      \"deaths_rate\": 0.02056589,\n      \"neighbours\": 0,\n      \"p20\": 0\n    },\n    {\n      \"date\": 20200916,\n      \"daterep\": \"16/09/2020\",\n      \"date2\": \"2020-9-16\",\n      \"day\": 16,\n      \"days\": 261,\n      \"month\": 9,\n      \"year\": 2020,\n      \"cases\": 71,\n      \"deaths\": 1,\n      \"country\": \"Kosovo\",\n      \"geoid\": \"XK\",\n      \"countryterritorycode\": \"XKX\",\n      \"popdata2019\": 1798506.0,\n      \"continentexp\": \"Europe\",\n      \"cumulative_number_for_14_days_of\": 64.609184,\n      \"pop\": 1798506.0,\n      \"poprank\": 149.0,\n      \"t\": 261,\n      \"c\": 107,\n      \"cases_cml\": 14763,\n      \"cases_ma7\": 79.85714,\n      \"cases_pop\": 3.9477211e-05,\n      \"cases_cml_pop\": 0.0082084797,\n      \"deaths_cml\": 601,\n      \"deaths_ma7\": 4.7142859,\n      \"deaths_pop\": 5.5601703e-07,\n      \"deaths_cml_pop\": 0.00033416625,\n      \"deaths_rate\": 0.040709883,\n      \"neighbours\": 0,\n      \"p20\": 0\n    },\n    {\n      \"date\": 20201110,\n      \"daterep\": \"10/11/2020\",\n      \"date2\": \"2020-11-10\",\n      \"day\": 10,\n      \"days\": 316,\n      \"month\": 11,\n      \"year\": 2020,\n      \"cases\": 0,\n      \"deaths\": 0,\n      \"country\": \"Equatorial_Guinea\",\n      \"geoid\": \"GQ\",\n      \"countryterritorycode\": \"GNQ\",\n      \"popdata2019\": 1355982.0,\n      \"continentexp\": \"Africa\",\n      \"cumulative_number_for_14_days_of\": 0.66372561,\n      \"pop\": 1355982.0,\n      \"poprank\": 152.0,\n      \"t\": 316,\n      \"c\": 62,\n      \"cases_cml\": 5092,\n      \"cases_ma7\": 0.42857143,\n      \"cases_pop\": 0.0,\n      \"cases_cml_pop\": 0.0037552121,\n      \"deaths_cml\": 85,\n      \"deaths_ma7\": 0.2857143,\n      \"deaths_pop\": 0.0,\n      \"deaths_cml_pop\": 6.2685198e-05,\n      \"deaths_rate\": 0.016692851,\n      \"neighbours\": 0,\n      \"p20\": 0\n    },\n    {\n      \"date\": 20201110,\n      \"daterep\": \"10/11/2020\",\n      \"date2\": \"2020-11-10\",\n      \"day\": 10,\n      \"days\": 316,\n      \"month\": 11,\n      \"year\": 2020,\n      \"cases\": 362,\n      \"deaths\": 9,\n      \"country\": \"Ecuador\",\n      \"geoid\": \"EC\",\n      \"countryterritorycode\": \"ECU\",\n      \"popdata2019\": 17373657.0,\n      \"continentexp\": \"America\",\n      \"cumulative_number_for_14_days_of\": 75.349709,\n      \"pop\": 17373657.0,\n      \"poprank\": 66.0,\n      \"t\": 316,\n      \"c\": 59,\n      \"cases_cml\": 175269,\n      \"cases_ma7\": 867.85712,\n      \"cases_pop\": 2.0836143e-05,\n      \"cases_cml_pop\": 0.010088204,\n      \"deaths_cml\": 12839,\n      \"deaths_ma7\": 22.142857,\n      \"deaths_pop\": 5.1802567e-07,\n      \"deaths_cml_pop\": 0.00073899236,\n      \"deaths_rate\": 0.073253118,\n      \"neighbours\": 0,\n      \"p20\": 0\n    }\n  ],\n  \"column names\": [\n    \"date\",\n    \"daterep\",\n    \"date2\",\n    \"day\",\n    \"days\",\n    \"month\",\n    \"year\",\n    \"cases\",\n    \"deaths\",\n    \"country\",\n    \"geoid\",\n    \"countryterritorycode\",\n    \"popdata2019\",\n    \"continentexp\",\n    \"cumulative_number_for_14_days_of\",\n    \"pop\",\n    \"poprank\",\n    \"t\",\n    \"c\",\n    \"cases_cml\",\n    \"cases_ma7\",\n    \"cases_pop\",\n    \"cases_cml_pop\",\n    \"deaths_cml\",\n    \"deaths_ma7\",\n    \"deaths_pop\",\n    \"deaths_cml_pop\",\n    \"deaths_rate\",\n    \"neighbours\",\n    \"p20\"\n  ]\n}\n\nYour Job:\nI am developing a NL to Data Visualization Dataset. \nPlease help me generate natural language utterance for given dataset and constraints.\nDefinition about the Taks:\n- 'utterance' is what a user would say to make a chart.  One NL 'utterance' is in one or two sentences. Here are two examples from Others for reference:\n    I want to know how many orders there are by the quantity of the order.\n    scatter(x=production budget, y=worldwide gross) for content rating.\n- 'given dataset' is in form of column names, column type, range/unique values of the column.\n- 'constraints' are information about the chart that should be included in the utterance. \n    So we can find a reference phrase in the NL utterance that corresponds to the given constraints. \n- 'reference phrase' can be explicit, ambiguous, and by_value. 'ambiguous' means the phrase can map to more than one columns in the dataset, always a hypernym of column names(depending on the dataset values).\n    For example:\n    {\"column\": \"gdpPercap\", \"nl_ref_type\": \"explicit\", \"nl_ref_phrase\": \"GDP per capita\"},\n    {\"column\": [\"country\",\"continent\"], \"nl_ref_type\": \"ambiguous\", \"nl_ref_phrase\": \"region\"}\n    {\"column\": [\"country\",\"country_short_name\"], \"nl_ref_type\": \"ambiguous\", \"nl_ref_phrase\": \"countries\"}\n    {\"c_type\": \"mark\", \"c_name\": \"point chart\", \"nl_ref_type\": \"explicit\", \"nl_ref_phrase\": \"scatter plot\"}\n    {\"c_type\": \"mark\", \"c_name\": \"arc chart\", \"nl_ref_type\": \"explicit\", \"nl_ref_phrase\": \"pie chart\"}\n    {\"c_type\": \"transform\",\"c_name\": \"filter\",\"c_list\": [{\"field\": \"country\",\"oneOf\": [\"Iceland\",\"Norway\"]}],\"nl_ref_type\": \"explicit\",\"nl_ref_phrase\": \"for countries Iceland and Norway\"},\n    {\"c_type\": \"transform\",\"c_name\": \"filter\",\"c_list\": [{\"field\": \"country\",\"oneOf\": [\"Iceland\",\"Norway\"]}],\"nl_ref_type\": \"by_value\",\"nl_ref_phrase\": \"for Iceland and Norway\"},\n- the 'nl_ref_phrase' for 'ambiguous' columns should be equally near all ambiguous columns, not too near to one of the column since it would not be ambiguous.\n    good example: {\"column\": [\"country\",\"region\"], \"nl_ref_type\": \"ambiguous\", \"nl_ref_phrase\": \"location\"}\n    bad example: {\"column\": [\"country\",\"region\"], \"nl_ref_type\": \"ambiguous\", \"nl_ref_phrase\": \"region\"}\n- You only include given constraints and no other information. \n    For example, if a column name is not in the given constraint, it will not be included in the NL utterance.\n    Also, it a chart mark or chart encoding channel is not in the given constraint, it will not be included in the NL utterance.\n- all 'nl_ref_phrase' shoule be included in the 'nl_utterance'. \n\nThe output format is identical to the input format, but fill in the str blanks(\"...\").\n### Input:\n{\n  \"nl_utterance\": \"...\",\n  \"encoded_fields\": [\n    {\n      \"field\": \"date2\",\n      \"type\": \"temporal\",\n      \"nl_ref_type\": \"explicit\",\n      \"nl_ref_phrase\": \"...\"\n    },\n    {\n      \"field\": \"cases_ma7\",\n      \"type\": \"quantitative\",\n      \"nl_ref_type\": \"explicit\",\n      \"nl_ref_phrase\": \"...\"\n    },\n    {\n      \"field\": [\n        \"country\",\n        \"continentexp\",\n        \"neighbours\"\n      ],\n      \"type\": \"nominal\",\n      \"nl_ref_type\": \"ambiguous\",\n      \"nl_ref_phrase\": \"...\"\n    }\n  ],\n  \"constraints\": [\n    {\n      \"c_type\": \"transform\",\n      \"c_name\": \"filter\",\n      \"c_list\": [\n        {\n          \"field\": \"country\",\n          \"oneOf\": [\n            \"UK\",\n            \"France\",\n            \"Germany\",\n            \"Portugal\"\n          ]\n        }\n      ],\n      \"nl_ref_type\": \"explicit\",\n      \"nl_ref_phrase\": \"...\"\n    },\n    {\n      \"c_type\": \"transform\",\n      \"c_name\": \"aggregate\",\n      \"c_list\": [\n        {\n          \"field\": \"cases_ma7\",\n          \"aggregate\": \"sum\"\n        }\n      ],\n      \"nl_ref_type\": \"explicit\",\n      \"nl_ref_phrase\": \"...\"\n    }\n  ]\n}\n\n### Output:"
}