{
  "gpt_result": {
    "nl_utterance": "What was the average of cases over the past 7 days for the countries UK, France, Germany, and Portugal?",
    "encoded_fields": [
      {
        "field": "cases_ma7",
        "type": "quantitative",
        "nl_ref_type": "explicit",
        "nl_ref_phrase": "average of cases over the past 7 days"
      },
      {
        "field": "country",
        "type": "nominal",
        "nl_ref_type": "explicit",
        "nl_ref_phrase": "countries"
      }
    ],
    "constraints": [
      {
        "c_type": "transform",
        "c_name": "filter",
        "c_list": [
          {
            "field": "country",
            "oneOf": [
              "UK",
              "France",
              "Germany",
              "Portugal"
            ]
          }
        ],
        "nl_ref_type": "by_value",
        "nl_ref_phrase": "for the countries UK, France, Germany, and Portugal"
      }
    ]
  },
  "input": "Dataset Information: {\n  \"data samples\": [\n    {\n      \"date\": 20191231,\n      \"daterep\": \"31/12/2019\",\n      \"date2\": \"2019-12-31\",\n      \"day\": 31,\n      \"days\": 1,\n      \"month\": 12,\n      \"year\": 2019,\n      \"cases\": 0,\n      \"deaths\": 0,\n      \"country\": \"Afghanistan\",\n      \"geoid\": \"AF\",\n      \"countryterritorycode\": \"AFG\",\n      \"popdata2019\": 38041757.0,\n      \"continentexp\": \"Asia\",\n      \"cumulative_number_for_14_days_of\": NaN,\n      \"pop\": 38041757.0,\n      \"poprank\": 37.0,\n      \"t\": 1,\n      \"c\": 1,\n      \"cases_cml\": 0,\n      \"cases_ma7\": NaN,\n      \"cases_pop\": 0.0,\n      \"cases_cml_pop\": 0.0,\n      \"deaths_cml\": 0,\n      \"deaths_ma7\": NaN,\n      \"deaths_pop\": 0.0,\n      \"deaths_cml_pop\": 0.0,\n      \"deaths_rate\": NaN,\n      \"neighbours\": 0,\n      \"p20\": 0\n    },\n    {\n      \"date\": 20200223,\n      \"daterep\": \"23/02/2020\",\n      \"date2\": \"2020-2-23\",\n      \"day\": 23,\n      \"days\": 55,\n      \"month\": 2,\n      \"year\": 2020,\n      \"cases\": 0,\n      \"deaths\": 0,\n      \"country\": \"Lebanon\",\n      \"geoid\": \"LB\",\n      \"countryterritorycode\": \"LBN\",\n      \"popdata2019\": 6855709.0,\n      \"continentexp\": \"Asia\",\n      \"cumulative_number_for_14_days_of\": 0.01458638,\n      \"pop\": 6855709.0,\n      \"poprank\": 106.0,\n      \"t\": 55,\n      \"c\": 112,\n      \"cases_cml\": 1,\n      \"cases_ma7\": 0.14285715,\n      \"cases_pop\": 0.0,\n      \"cases_cml_pop\": 1.4586384e-07,\n      \"deaths_cml\": 0,\n      \"deaths_ma7\": 0.0,\n      \"deaths_pop\": 0.0,\n      \"deaths_cml_pop\": 0.0,\n      \"deaths_rate\": 0.0,\n      \"neighbours\": 0,\n      \"p20\": 0\n    },\n    {\n      \"date\": 20200316,\n      \"daterep\": \"16/03/2020\",\n      \"date2\": \"2020-3-16\",\n      \"day\": 16,\n      \"days\": 77,\n      \"month\": 3,\n      \"year\": 2020,\n      \"cases\": 27,\n      \"deaths\": 0,\n      \"country\": \"South_Africa\",\n      \"geoid\": \"ZA\",\n      \"countryterritorycode\": \"ZAF\",\n      \"popdata2019\": 58558267.0,\n      \"continentexp\": \"Africa\",\n      \"cumulative_number_for_14_days_of\": NaN,\n      \"pop\": 58558267.0,\n      \"poprank\": 24.0,\n      \"t\": 77,\n      \"c\": 179,\n      \"cases_cml\": 51,\n      \"cases_ma7\": NaN,\n      \"cases_pop\": 4.6107922e-07,\n      \"cases_cml_pop\": 8.7092741e-07,\n      \"deaths_cml\": 0,\n      \"deaths_ma7\": NaN,\n      \"deaths_pop\": 0.0,\n      \"deaths_cml_pop\": 0.0,\n      \"deaths_rate\": 0.0,\n      \"neighbours\": 0,\n      \"p20\": 0\n    },\n    {\n      \"date\": 20200225,\n      \"daterep\": \"25/02/2020\",\n      \"date2\": \"2020-2-25\",\n      \"day\": 25,\n      \"days\": 57,\n      \"month\": 2,\n      \"year\": 2020,\n      \"cases\": 0,\n      \"deaths\": 0,\n      \"country\": \"North_Macedonia\",\n      \"geoid\": \"MK\",\n      \"countryterritorycode\": \"MKD\",\n      \"popdata2019\": 2077132.0,\n      \"continentexp\": \"Europe\",\n      \"cumulative_number_for_14_days_of\": 0.0,\n      \"pop\": 2077132.0,\n      \"poprank\": 146.0,\n      \"t\": 57,\n      \"c\": 145,\n      \"cases_cml\": 0,\n      \"cases_ma7\": 0.0,\n      \"cases_pop\": 0.0,\n      \"cases_cml_pop\": 0.0,\n      \"deaths_cml\": 0,\n      \"deaths_ma7\": 0.0,\n      \"deaths_pop\": 0.0,\n      \"deaths_cml_pop\": 0.0,\n      \"deaths_rate\": NaN,\n      \"neighbours\": 0,\n      \"p20\": 0\n    },\n    {\n      \"date\": 20200417,\n      \"daterep\": \"17/04/2020\",\n      \"date2\": \"2020-4-17\",\n      \"day\": 17,\n      \"days\": 109,\n      \"month\": 4,\n      \"year\": 2020,\n      \"cases\": 585,\n      \"deaths\": 12,\n      \"country\": \"Japan\",\n      \"geoid\": \"JP\",\n      \"countryterritorycode\": \"JPN\",\n      \"popdata2019\": 126860299.0,\n      \"continentexp\": \"Asia\",\n      \"cumulative_number_for_14_days_of\": 5.1631598,\n      \"pop\": 126860299.0,\n      \"poprank\": 11.0,\n      \"t\": 109,\n      \"c\": 102,\n      \"cases_cml\": 9167,\n      \"cases_ma7\": 628.42859,\n      \"cases_pop\": 4.6113719e-06,\n      \"cases_cml_pop\": 7.2260591e-05,\n      \"deaths_cml\": 148,\n      \"deaths_ma7\": 9.0,\n      \"deaths_pop\": 9.4592238e-08,\n      \"deaths_cml_pop\": 1.1666376e-06,\n      \"deaths_rate\": 0.016144868,\n      \"neighbours\": 0,\n      \"p20\": 1\n    }\n  ],\n  \"column names\": [\n    \"date\",\n    \"daterep\",\n    \"date2\",\n    \"day\",\n    \"days\",\n    \"month\",\n    \"year\",\n    \"cases\",\n    \"deaths\",\n    \"country\",\n    \"geoid\",\n    \"countryterritorycode\",\n    \"popdata2019\",\n    \"continentexp\",\n    \"cumulative_number_for_14_days_of\",\n    \"pop\",\n    \"poprank\",\n    \"t\",\n    \"c\",\n    \"cases_cml\",\n    \"cases_ma7\",\n    \"cases_pop\",\n    \"cases_cml_pop\",\n    \"deaths_cml\",\n    \"deaths_ma7\",\n    \"deaths_pop\",\n    \"deaths_cml_pop\",\n    \"deaths_rate\",\n    \"neighbours\",\n    \"p20\"\n  ]\n}\n\nYour Job:\nI am developing a NL to Data Visualization Dataset. \nPlease help me generate natural language utterance for given dataset and constraints.\nDefinition about the Taks:\n- 'utterance' is what a user would say to make a chart. It should be a questions structure. One NL 'utterance' is in one or two sentences. Here are two examples from Questions for reference:\n    On average, how much was earned by movies of each genre?\n    What major genre had the highest average worldwide gross?\n- 'given dataset' is in form of column names, column type, range/unique values of the column.\n- 'constraints' are information about the chart that should be included in the utterance. \n    So we can find a reference phrase in the NL utterance that corresponds to the given constraints. \n- 'reference phrase' can be explicit, ambiguous, and by_value. 'ambiguous' means the phrase can map to more than one columns in the dataset, always a hypernym of column names(depending on the dataset values).\n    For example:\n    {\"column\": \"gdpPercap\", \"nl_ref_type\": \"explicit\", \"nl_ref_phrase\": \"GDP per capita\"},\n    {\"column\": [\"country\",\"continent\"], \"nl_ref_type\": \"ambiguous\", \"nl_ref_phrase\": \"region\"}\n    {\"column\": [\"country\",\"country_short_name\"], \"nl_ref_type\": \"ambiguous\", \"nl_ref_phrase\": \"countries\"}\n    {\"c_type\": \"mark\", \"c_name\": \"point chart\", \"nl_ref_type\": \"explicit\", \"nl_ref_phrase\": \"scatter plot\"}\n    {\"c_type\": \"mark\", \"c_name\": \"arc chart\", \"nl_ref_type\": \"explicit\", \"nl_ref_phrase\": \"pie chart\"}\n    {\"c_type\": \"transform\",\"c_name\": \"filter\",\"c_list\": [{\"field\": \"country\",\"oneOf\": [\"Iceland\",\"Norway\"]}],\"nl_ref_type\": \"explicit\",\"nl_ref_phrase\": \"for countries Iceland and Norway\"},\n    {\"c_type\": \"transform\",\"c_name\": \"filter\",\"c_list\": [{\"field\": \"country\",\"oneOf\": [\"Iceland\",\"Norway\"]}],\"nl_ref_type\": \"by_value\",\"nl_ref_phrase\": \"for Iceland and Norway\"},\n- the 'nl_ref_phrase' for 'ambiguous' columns should be equally near all ambiguous columns, not too near to one of the column since it would not be ambiguous.\n    good example: {\"column\": [\"country\",\"region\"], \"nl_ref_type\": \"ambiguous\", \"nl_ref_phrase\": \"location\"}\n    bad example: {\"column\": [\"country\",\"region\"], \"nl_ref_type\": \"ambiguous\", \"nl_ref_phrase\": \"region\"}\n- You only include given constraints and no other information. \n    For example, if a column name is not in the given constraint, it will not be included in the NL utterance.\n    Also, it a chart mark or chart encoding channel is not in the given constraint, it will not be included in the NL utterance.\n- all 'nl_ref_phrase' shoule be included in the 'nl_utterance'. \n\nThe output format is identical to the input format, but fill in the str blanks(\"...\").\n### Input:\n{\n  \"nl_utterance\": \"...\",\n  \"encoded_fields\": [\n    {\n      \"field\": \"cases_ma7\",\n      \"type\": \"quantitative\",\n      \"nl_ref_type\": \"explicit\",\n      \"nl_ref_phrase\": \"...\"\n    },\n    {\n      \"field\": \"country\",\n      \"type\": \"nominal\",\n      \"nl_ref_type\": \"explicit\",\n      \"nl_ref_phrase\": \"...\"\n    }\n  ],\n  \"constraints\": [\n    {\n      \"c_type\": \"transform\",\n      \"c_name\": \"filter\",\n      \"c_list\": [\n        {\n          \"field\": \"country\",\n          \"oneOf\": [\n            \"UK\",\n            \"France\",\n            \"Germany\",\n            \"Portugal\"\n          ]\n        }\n      ],\n      \"nl_ref_type\": \"by_value\",\n      \"nl_ref_phrase\": \"...\"\n    }\n  ]\n}\n\n### Output:"
}