{
  "gpt_result": {
    "nl_utterance": "What is the total of the 7-day moving average of cases for the countries UK, France, Germany, and Portugal over time?",
    "encoded_fields": [
      {
        "field": "date2",
        "type": "temporal",
        "nl_ref_type": "explicit",
        "nl_ref_phrase": "over time"
      },
      {
        "field": "cases_ma7",
        "type": "quantitative",
        "nl_ref_type": "explicit",
        "nl_ref_phrase": "7-day moving average of cases"
      },
      {
        "field": "country",
        "type": "nominal",
        "nl_ref_type": "explicit",
        "nl_ref_phrase": "countries"
      }
    ],
    "constraints": [
      {
        "c_type": "transform",
        "c_name": "filter",
        "c_list": [
          {
            "field": "country",
            "oneOf": [
              "UK",
              "France",
              "Germany",
              "Portugal"
            ]
          }
        ],
        "nl_ref_type": "by_value",
        "nl_ref_phrase": "for the countries UK, France, Germany, and Portugal"
      },
      {
        "c_type": "transform",
        "c_name": "aggregate",
        "c_list": [
          {
            "field": "cases_ma7",
            "aggregate": "sum"
          }
        ],
        "nl_ref_type": "explicit",
        "nl_ref_phrase": "total"
      }
    ]
  },
  "input": "Dataset Information: {\n  \"data samples\": [\n    {\n      \"date\": 20191231,\n      \"daterep\": \"31/12/2019\",\n      \"date2\": \"2019-12-31\",\n      \"day\": 31,\n      \"days\": 1,\n      \"month\": 12,\n      \"year\": 2019,\n      \"cases\": 0,\n      \"deaths\": 0,\n      \"country\": \"Afghanistan\",\n      \"geoid\": \"AF\",\n      \"countryterritorycode\": \"AFG\",\n      \"popdata2019\": 38041757.0,\n      \"continentexp\": \"Asia\",\n      \"cumulative_number_for_14_days_of\": NaN,\n      \"pop\": 38041757.0,\n      \"poprank\": 37.0,\n      \"t\": 1,\n      \"c\": 1,\n      \"cases_cml\": 0,\n      \"cases_ma7\": NaN,\n      \"cases_pop\": 0.0,\n      \"cases_cml_pop\": 0.0,\n      \"deaths_cml\": 0,\n      \"deaths_ma7\": NaN,\n      \"deaths_pop\": 0.0,\n      \"deaths_cml_pop\": 0.0,\n      \"deaths_rate\": NaN,\n      \"neighbours\": 0,\n      \"p20\": 0\n    },\n    {\n      \"date\": 20200929,\n      \"daterep\": \"29/09/2020\",\n      \"date2\": \"2020-9-29\",\n      \"day\": 29,\n      \"days\": 274,\n      \"month\": 9,\n      \"year\": 2020,\n      \"cases\": 305,\n      \"deaths\": 1,\n      \"country\": \"Mozambique\",\n      \"geoid\": \"MZ\",\n      \"countryterritorycode\": \"MOZ\",\n      \"popdata2019\": 30366043.0,\n      \"continentexp\": \"Africa\",\n      \"cumulative_number_for_14_days_of\": 9.2405853,\n      \"pop\": 30366043.0,\n      \"poprank\": 47.0,\n      \"t\": 274,\n      \"c\": 135,\n      \"cases_cml\": 8288,\n      \"cases_ma7\": 216.71428,\n      \"cases_pop\": 1.0044114e-05,\n      \"cases_cml_pop\": 0.00027293645,\n      \"deaths_cml\": 59,\n      \"deaths_ma7\": 2.2857144,\n      \"deaths_pop\": 3.2931521e-08,\n      \"deaths_cml_pop\": 1.9429597e-06,\n      \"deaths_rate\": 0.0071187257,\n      \"neighbours\": 0,\n      \"p20\": 0\n    },\n    {\n      \"date\": 20200612,\n      \"daterep\": \"12/06/2020\",\n      \"date2\": \"2020-6-12\",\n      \"day\": 12,\n      \"days\": 165,\n      \"month\": 6,\n      \"year\": 2020,\n      \"cases\": 0,\n      \"deaths\": 0,\n      \"country\": \"Uruguay\",\n      \"geoid\": \"UY\",\n      \"countryterritorycode\": \"URY\",\n      \"popdata2019\": 3461731.0,\n      \"continentexp\": \"America\",\n      \"cumulative_number_for_14_days_of\": 1.0399421,\n      \"pop\": 3461731.0,\n      \"poprank\": 131.0,\n      \"t\": 165,\n      \"c\": 205,\n      \"cases_cml\": 847,\n      \"cases_ma7\": 2.7142856,\n      \"cases_pop\": 0.0,\n      \"cases_cml_pop\": 0.00024467529,\n      \"deaths_cml\": 23,\n      \"deaths_ma7\": 0.0,\n      \"deaths_pop\": 0.0,\n      \"deaths_cml_pop\": 6.6440748e-06,\n      \"deaths_rate\": 0.027154664,\n      \"neighbours\": 0,\n      \"p20\": 0\n    },\n    {\n      \"date\": 20200219,\n      \"daterep\": \"19/02/2020\",\n      \"date2\": \"2020-2-19\",\n      \"day\": 19,\n      \"days\": 51,\n      \"month\": 2,\n      \"year\": 2020,\n      \"cases\": 15,\n      \"deaths\": 0,\n      \"country\": \"South_Korea\",\n      \"geoid\": \"KR\",\n      \"countryterritorycode\": \"KOR\",\n      \"popdata2019\": 51225321.0,\n      \"continentexp\": \"Asia\",\n      \"cumulative_number_for_14_days_of\": 0.054660469,\n      \"pop\": 51225321.0,\n      \"poprank\": 28.0,\n      \"t\": 51,\n      \"c\": 180,\n      \"cases_cml\": 46,\n      \"cases_ma7\": 2.5714285,\n      \"cases_pop\": 2.9282393e-07,\n      \"cases_cml_pop\": 8.979934e-07,\n      \"deaths_cml\": 0,\n      \"deaths_ma7\": 0.0,\n      \"deaths_pop\": 0.0,\n      \"deaths_cml_pop\": 0.0,\n      \"deaths_rate\": 0.0,\n      \"neighbours\": 0,\n      \"p20\": 0\n    },\n    {\n      \"date\": 20200729,\n      \"daterep\": \"29/07/2020\",\n      \"date2\": \"2020-7-29\",\n      \"day\": 29,\n      \"days\": 212,\n      \"month\": 7,\n      \"year\": 2020,\n      \"cases\": 1,\n      \"deaths\": 0,\n      \"country\": \"Thailand\",\n      \"geoid\": \"TH\",\n      \"countryterritorycode\": \"THA\",\n      \"popdata2019\": 69625581.0,\n      \"continentexp\": \"Asia\",\n      \"cumulative_number_for_14_days_of\": 0.094792753,\n      \"pop\": 69625581.0,\n      \"poprank\": 20.0,\n      \"t\": 212,\n      \"c\": 191,\n      \"cases_cml\": 3298,\n      \"cases_ma7\": 6.1428571,\n      \"cases_pop\": 1.4362537e-08,\n      \"cases_cml_pop\": 4.7367648e-05,\n      \"deaths_cml\": 58,\n      \"deaths_ma7\": 0.0,\n      \"deaths_pop\": 0.0,\n      \"deaths_cml_pop\": 8.3302717e-07,\n      \"deaths_rate\": 0.017586416,\n      \"neighbours\": 0,\n      \"p20\": 1\n    }\n  ],\n  \"column names\": [\n    \"date\",\n    \"daterep\",\n    \"date2\",\n    \"day\",\n    \"days\",\n    \"month\",\n    \"year\",\n    \"cases\",\n    \"deaths\",\n    \"country\",\n    \"geoid\",\n    \"countryterritorycode\",\n    \"popdata2019\",\n    \"continentexp\",\n    \"cumulative_number_for_14_days_of\",\n    \"pop\",\n    \"poprank\",\n    \"t\",\n    \"c\",\n    \"cases_cml\",\n    \"cases_ma7\",\n    \"cases_pop\",\n    \"cases_cml_pop\",\n    \"deaths_cml\",\n    \"deaths_ma7\",\n    \"deaths_pop\",\n    \"deaths_cml_pop\",\n    \"deaths_rate\",\n    \"neighbours\",\n    \"p20\"\n  ]\n}\n\nYour Job:\nI am developing a NL to Data Visualization Dataset. \nPlease help me generate natural language utterance for given dataset and constraints.\nDefinition about the Taks:\n- 'utterance' is what a user would say to make a chart. It should be a questions structure. One NL 'utterance' is in one or two sentences. Here are two examples from Questions for reference:\n    What's the average production budget of the different rated movies, separated by creative type.\n    How many cars do each country manufacture?\n- 'given dataset' is in form of column names, column type, range/unique values of the column.\n- 'constraints' are information about the chart that should be included in the utterance. \n    So we can find a reference phrase in the NL utterance that corresponds to the given constraints. \n- 'reference phrase' can be explicit, ambiguous, and by_value. 'ambiguous' means the phrase can map to more than one columns in the dataset, always a hypernym of column names(depending on the dataset values).\n    For example:\n    {\"column\": \"gdpPercap\", \"nl_ref_type\": \"explicit\", \"nl_ref_phrase\": \"GDP per capita\"},\n    {\"column\": [\"country\",\"continent\"], \"nl_ref_type\": \"ambiguous\", \"nl_ref_phrase\": \"region\"}\n    {\"column\": [\"country\",\"country_short_name\"], \"nl_ref_type\": \"ambiguous\", \"nl_ref_phrase\": \"countries\"}\n    {\"c_type\": \"mark\", \"c_name\": \"point chart\", \"nl_ref_type\": \"explicit\", \"nl_ref_phrase\": \"scatter plot\"}\n    {\"c_type\": \"mark\", \"c_name\": \"arc chart\", \"nl_ref_type\": \"explicit\", \"nl_ref_phrase\": \"pie chart\"}\n    {\"c_type\": \"transform\",\"c_name\": \"filter\",\"c_list\": [{\"field\": \"country\",\"oneOf\": [\"Iceland\",\"Norway\"]}],\"nl_ref_type\": \"explicit\",\"nl_ref_phrase\": \"for countries Iceland and Norway\"},\n    {\"c_type\": \"transform\",\"c_name\": \"filter\",\"c_list\": [{\"field\": \"country\",\"oneOf\": [\"Iceland\",\"Norway\"]}],\"nl_ref_type\": \"by_value\",\"nl_ref_phrase\": \"for Iceland and Norway\"},\n- the 'nl_ref_phrase' for 'ambiguous' columns should be equally near all ambiguous columns, not too near to one of the column since it would not be ambiguous.\n    good example: {\"column\": [\"country\",\"region\"], \"nl_ref_type\": \"ambiguous\", \"nl_ref_phrase\": \"location\"}\n    bad example: {\"column\": [\"country\",\"region\"], \"nl_ref_type\": \"ambiguous\", \"nl_ref_phrase\": \"region\"}\n- You only include given constraints and no other information. \n    For example, if a column name is not in the given constraint, it will not be included in the NL utterance.\n    Also, it a chart mark or chart encoding channel is not in the given constraint, it will not be included in the NL utterance.\n- all 'nl_ref_phrase' shoule be included in the 'nl_utterance'. \n\nThe output format is identical to the input format, but fill in the str blanks(\"...\").\n### Input:\n{\n  \"nl_utterance\": \"...\",\n  \"encoded_fields\": [\n    {\n      \"field\": \"date2\",\n      \"type\": \"temporal\",\n      \"nl_ref_type\": \"explicit\",\n      \"nl_ref_phrase\": \"...\"\n    },\n    {\n      \"field\": \"cases_ma7\",\n      \"type\": \"quantitative\",\n      \"nl_ref_type\": \"explicit\",\n      \"nl_ref_phrase\": \"...\"\n    },\n    {\n      \"field\": \"country\",\n      \"type\": \"nominal\",\n      \"nl_ref_type\": \"explicit\",\n      \"nl_ref_phrase\": \"...\"\n    }\n  ],\n  \"constraints\": [\n    {\n      \"c_type\": \"transform\",\n      \"c_name\": \"filter\",\n      \"c_list\": [\n        {\n          \"field\": \"country\",\n          \"oneOf\": [\n            \"UK\",\n            \"France\",\n            \"Germany\",\n            \"Portugal\"\n          ]\n        }\n      ],\n      \"nl_ref_type\": \"by_value\",\n      \"nl_ref_phrase\": \"...\"\n    },\n    {\n      \"c_type\": \"transform\",\n      \"c_name\": \"aggregate\",\n      \"c_list\": [\n        {\n          \"field\": \"cases_ma7\",\n          \"aggregate\": \"sum\"\n        }\n      ],\n      \"nl_ref_type\": \"explicit\",\n      \"nl_ref_phrase\": \"...\"\n    }\n  ]\n}\n\n### Output:"
}