{
  "gpt_result": {
    "nl_utterance": "Is there a correlation between Component 1 and Component 2 across different regions or constituencies?",
    "encoded_fields": [
      {
        "field": "Component 1",
        "type": "quantitative",
        "nl_ref_type": "explicit",
        "nl_ref_phrase": "Component 1"
      },
      {
        "field": "Component 2",
        "type": "quantitative",
        "nl_ref_type": "explicit",
        "nl_ref_phrase": "Component 2"
      },
      {
        "field": [
          "RegionName",
          "ConstituencyName"
        ],
        "type": "nominal",
        "nl_ref_type": "ambiguous",
        "nl_ref_phrase": "regions or constituencies"
      }
    ],
    "constraints": [
      {
        "c_type": "task",
        "c_name": "correlation",
        "c_list": [
          {
            "mark": "circle",
            "encoding": {
              "x": {
                "type": "quantitative"
              },
              "y": {
                "type": "quantitative"
              }
            }
          }
        ],
        "nl_ref_type": "explicit",
        "nl_ref_phrase": "correlation"
      },
      {
        "c_type": "mark",
        "c_name": "point chart",
        "c_list": [
          {
            "mark": "circle",
            "encoding": {
              "x": {},
              "y": {},
              "color": {
                "type": "nominal",
                "ignore": true
              },
              "size": {
                "ignore": true,
                "type": "quantitative"
              },
              "column": {
                "ignore": true,
                "type": "nominal"
              },
              "row": {
                "ignore": true,
                "type": "nominal"
              }
            }
          }
        ],
        "nl_ref_type": "explicit",
        "nl_ref_phrase": "scatter plot"
      }
    ]
  },
  "input": "Dataset Information: {\n  \"data samples\": [\n    {\n      \"Unnamed: 0\": 0,\n      \"ConstituencyName\": \"Aldershot\",\n      \"RegionName\": \"South East\",\n      \"MedianHPrice\": 335000,\n      \"MedianWeeklyWage\": 576,\n      \"YearlySalary\": 29968,\n      \"Housepriceincreaseover5years\": 7000,\n      \"%Growth5years\": 2,\n      \"%affordability\": 9,\n      \"Component 1\": 1.2496118035031694,\n      \"Component 2\": -0.5133032835863713\n    },\n    {\n      \"Unnamed: 0\": 374,\n      \"ConstituencyName\": \"Rotherham\",\n      \"RegionName\": \"Yorkshire and The Humber\",\n      \"MedianHPrice\": 140000,\n      \"MedianWeeklyWage\": 475,\n      \"YearlySalary\": 24705,\n      \"Housepriceincreaseover5years\": 4800,\n      \"%Growth5years\": 4,\n      \"%affordability\": 18,\n      \"Component 1\": -1.923673441916067,\n      \"Component 2\": -0.5221125688591063\n    },\n    {\n      \"Unnamed: 0\": 336,\n      \"ConstituencyName\": \"Nottingham North\",\n      \"RegionName\": \"East Midlands\",\n      \"MedianHPrice\": 155000,\n      \"MedianWeeklyWage\": 441,\n      \"YearlySalary\": 22942,\n      \"Housepriceincreaseover5years\": 7000,\n      \"%Growth5years\": 6,\n      \"%affordability\": 15,\n      \"Component 1\": -2.207717145536974,\n      \"Component 2\": 0.9262671910699865\n    },\n    {\n      \"Unnamed: 0\": 269,\n      \"ConstituencyName\": \"Ludlow\",\n      \"RegionName\": \"West Midlands\",\n      \"MedianHPrice\": 255000,\n      \"MedianWeeklyWage\": 481,\n      \"YearlySalary\": 25012,\n      \"Housepriceincreaseover5years\": 6000,\n      \"%Growth5years\": 3,\n      \"%affordability\": 10,\n      \"Component 1\": -0.5360456511389275,\n      \"Component 2\": 0.2396433902485332\n    },\n    {\n      \"Unnamed: 0\": 454,\n      \"ConstituencyName\": \"Sutton and Cheam\",\n      \"RegionName\": \"London\",\n      \"MedianHPrice\": 440000,\n      \"MedianWeeklyWage\": 628,\n      \"YearlySalary\": 32640,\n      \"Housepriceincreaseover5years\": 10000,\n      \"%Growth5years\": 3,\n      \"%affordability\": 7,\n      \"Component 1\": 2.4689026268750385,\n      \"Component 2\": 0.0710984514572458\n    }\n  ],\n  \"column names\": [\n    \"Unnamed: 0\",\n    \"ConstituencyName\",\n    \"RegionName\",\n    \"MedianHPrice\",\n    \"MedianWeeklyWage\",\n    \"YearlySalary\",\n    \"Housepriceincreaseover5years\",\n    \"%Growth5years\",\n    \"%affordability\",\n    \"Component 1\",\n    \"Component 2\"\n  ]\n}\n\nYour Job:\nI am developing a NL to Data Visualization Dataset. \nPlease help me generate natural language utterance for given dataset and constraints.\nDefinition about the Taks:\n- 'utterance' is what a user would say to make a chart. It should be a questions structure. One NL 'utterance' is in one or two sentences. Here are two examples from Questions for reference:\n    Have cars gotten lighter over time?\n    Are IMDb rating and rotten tomatoes rating related?\n- 'given dataset' is in form of column names, column type, range/unique values of the column.\n- 'constraints' are information about the chart that should be included in the utterance. \n    So we can find a reference phrase in the NL utterance that corresponds to the given constraints. \n- 'reference phrase' can be explicit, ambiguous, and by_value. 'ambiguous' means the phrase can map to more than one columns in the dataset, always a hypernym of column names(depending on the dataset values).\n    For example:\n    {\"column\": \"gdpPercap\", \"nl_ref_type\": \"explicit\", \"nl_ref_phrase\": \"GDP per capita\"},\n    {\"column\": [\"country\",\"continent\"], \"nl_ref_type\": \"ambiguous\", \"nl_ref_phrase\": \"region\"}\n    {\"column\": [\"country\",\"country_short_name\"], \"nl_ref_type\": \"ambiguous\", \"nl_ref_phrase\": \"countries\"}\n    {\"c_type\": \"mark\", \"c_name\": \"point chart\", \"nl_ref_type\": \"explicit\", \"nl_ref_phrase\": \"scatter plot\"}\n    {\"c_type\": \"mark\", \"c_name\": \"arc chart\", \"nl_ref_type\": \"explicit\", \"nl_ref_phrase\": \"pie chart\"}\n    {\"c_type\": \"transform\",\"c_name\": \"filter\",\"c_list\": [{\"field\": \"country\",\"oneOf\": [\"Iceland\",\"Norway\"]}],\"nl_ref_type\": \"explicit\",\"nl_ref_phrase\": \"for countries Iceland and Norway\"},\n    {\"c_type\": \"transform\",\"c_name\": \"filter\",\"c_list\": [{\"field\": \"country\",\"oneOf\": [\"Iceland\",\"Norway\"]}],\"nl_ref_type\": \"by_value\",\"nl_ref_phrase\": \"for Iceland and Norway\"},\n- the 'nl_ref_phrase' for 'ambiguous' columns should be equally near all ambiguous columns, not too near to one of the column since it would not be ambiguous.\n    good example: {\"column\": [\"country\",\"region\"], \"nl_ref_type\": \"ambiguous\", \"nl_ref_phrase\": \"location\"}\n    bad example: {\"column\": [\"country\",\"region\"], \"nl_ref_type\": \"ambiguous\", \"nl_ref_phrase\": \"region\"}\n- You only include given constraints and no other information. \n    For example, if a column name is not in the given constraint, it will not be included in the NL utterance.\n    Also, it a chart mark or chart encoding channel is not in the given constraint, it will not be included in the NL utterance.\n- all 'nl_ref_phrase' shoule be included in the 'nl_utterance'. \n\nThe output format is identical to the input format, but fill in the str blanks(\"...\").\n### Input:\n{\n  \"nl_utterance\": \"...\",\n  \"encoded_fields\": [\n    {\n      \"field\": \"Component 1\",\n      \"type\": \"quantitative\",\n      \"nl_ref_type\": \"explicit\",\n      \"nl_ref_phrase\": \"...\"\n    },\n    {\n      \"field\": \"Component 2\",\n      \"type\": \"quantitative\",\n      \"nl_ref_type\": \"explicit\",\n      \"nl_ref_phrase\": \"...\"\n    },\n    {\n      \"field\": [\n        \"RegionName\",\n        \"ConstituencyName\"\n      ],\n      \"type\": \"nominal\",\n      \"nl_ref_type\": \"ambiguous\",\n      \"nl_ref_phrase\": \"...\"\n    }\n  ],\n  \"constraints\": [\n    {\n      \"c_type\": \"task\",\n      \"c_name\": \"correlation\",\n      \"c_list\": [\n        {\n          \"mark\": \"circle\",\n          \"encoding\": {\n            \"x\": {\n              \"type\": \"quantitative\"\n            },\n            \"y\": {\n              \"type\": \"quantitative\"\n            }\n          }\n        }\n      ],\n      \"nl_ref_type\": \"explicit\",\n      \"nl_ref_phrase\": \"...\"\n    },\n    {\n      \"c_type\": \"mark\",\n      \"c_name\": \"point chart\",\n      \"c_list\": [\n        {\n          \"mark\": \"circle\",\n          \"encoding\": {\n            \"x\": {},\n            \"y\": {},\n            \"color\": {\n              \"type\": \"nominal\",\n              \"ignore\": true\n            },\n            \"size\": {\n              \"ignore\": true,\n              \"type\": \"quantitative\"\n            },\n            \"column\": {\n              \"ignore\": true,\n              \"type\": \"nominal\"\n            },\n            \"row\": {\n              \"ignore\": true,\n              \"type\": \"nominal\"\n            }\n          }\n        }\n      ],\n      \"nl_ref_type\": \"explicit\",\n      \"nl_ref_phrase\": \"...\"\n    }\n  ]\n}\n\n### Output:"
}