{
  "gpt_result": {
    "nl_utterance": "Create a line chart of the 7-day moving average of cases over time by country and filter for the countries UK, France, Germany, and Portugal.",
    "encoded_fields": [
      {
        "field": "date2",
        "type": "temporal",
        "nl_ref_type": "explicit",
        "nl_ref_phrase": "over time"
      },
      {
        "field": "cases_ma7",
        "type": "quantitative",
        "nl_ref_type": "explicit",
        "nl_ref_phrase": "7-day moving average of cases"
      },
      {
        "field": "country",
        "type": "nominal",
        "nl_ref_type": "explicit",
        "nl_ref_phrase": "by country"
      }
    ],
    "constraints": [
      {
        "c_type": "transform",
        "c_name": "filter",
        "c_list": [
          {
            "field": "country",
            "oneOf": [
              "UK",
              "France",
              "Germany",
              "Portugal"
            ]
          }
        ],
        "nl_ref_type": "explicit",
        "nl_ref_phrase": "filter for the countries UK, France, Germany, and Portugal"
      }
    ]
  },
  "input": "Dataset Information: {\n  \"data samples\": [\n    {\n      \"date\": 20191231,\n      \"daterep\": \"31/12/2019\",\n      \"date2\": \"2019-12-31\",\n      \"day\": 31,\n      \"days\": 1,\n      \"month\": 12,\n      \"year\": 2019,\n      \"cases\": 0,\n      \"deaths\": 0,\n      \"country\": \"Afghanistan\",\n      \"geoid\": \"AF\",\n      \"countryterritorycode\": \"AFG\",\n      \"popdata2019\": 38041757.0,\n      \"continentexp\": \"Asia\",\n      \"cumulative_number_for_14_days_of\": NaN,\n      \"pop\": 38041757.0,\n      \"poprank\": 37.0,\n      \"t\": 1,\n      \"c\": 1,\n      \"cases_cml\": 0,\n      \"cases_ma7\": NaN,\n      \"cases_pop\": 0.0,\n      \"cases_cml_pop\": 0.0,\n      \"deaths_cml\": 0,\n      \"deaths_ma7\": NaN,\n      \"deaths_pop\": 0.0,\n      \"deaths_cml_pop\": 0.0,\n      \"deaths_rate\": NaN,\n      \"neighbours\": 0,\n      \"p20\": 0\n    },\n    {\n      \"date\": 20200809,\n      \"daterep\": \"09/08/2020\",\n      \"date2\": \"2020-8-9\",\n      \"day\": 9,\n      \"days\": 223,\n      \"month\": 8,\n      \"year\": 2020,\n      \"cases\": 0,\n      \"deaths\": 0,\n      \"country\": \"Barbados\",\n      \"geoid\": \"BB\",\n      \"countryterritorycode\": \"BRB\",\n      \"popdata2019\": 287021.0,\n      \"continentexp\": \"America\",\n      \"cumulative_number_for_14_days_of\": 10.452197,\n      \"pop\": 287021.0,\n      \"poprank\": 176.0,\n      \"t\": 223,\n      \"c\": 17,\n      \"cases_cml\": 138,\n      \"cases_ma7\": 4.0,\n      \"cases_pop\": 0.0,\n      \"cases_cml_pop\": 0.00048080107,\n      \"deaths_cml\": 7,\n      \"deaths_ma7\": 0.0,\n      \"deaths_pop\": 0.0,\n      \"deaths_cml_pop\": 2.4388459e-05,\n      \"deaths_rate\": 0.050724637,\n      \"neighbours\": 0,\n      \"p20\": 0\n    },\n    {\n      \"date\": 20200317,\n      \"daterep\": \"17/03/2020\",\n      \"date2\": \"2020-3-17\",\n      \"day\": 17,\n      \"days\": 78,\n      \"month\": 3,\n      \"year\": 2020,\n      \"cases\": 21,\n      \"deaths\": 0,\n      \"country\": \"Greece\",\n      \"geoid\": \"EL\",\n      \"countryterritorycode\": \"GRC\",\n      \"popdata2019\": 10724599.0,\n      \"continentexp\": \"Europe\",\n      \"cumulative_number_for_14_days_of\": 3.2169034,\n      \"pop\": 10724599.0,\n      \"poprank\": 85.0,\n      \"t\": 78,\n      \"c\": 79,\n      \"cases_cml\": 352,\n      \"cases_ma7\": 39.857143,\n      \"cases_pop\": 1.9581153e-06,\n      \"cases_cml_pop\": 3.2821739e-05,\n      \"deaths_cml\": 4,\n      \"deaths_ma7\": 0.5714286,\n      \"deaths_pop\": 0.0,\n      \"deaths_cml_pop\": 3.7297431e-07,\n      \"deaths_rate\": 0.011363637,\n      \"neighbours\": 0,\n      \"p20\": 0\n    },\n    {\n      \"date\": 20200103,\n      \"daterep\": \"03/01/2020\",\n      \"date2\": \"2020-1-3\",\n      \"day\": 3,\n      \"days\": 4,\n      \"month\": 1,\n      \"year\": 2020,\n      \"cases\": 0,\n      \"deaths\": 0,\n      \"country\": \"UK\",\n      \"geoid\": \"UK\",\n      \"countryterritorycode\": \"GBR\",\n      \"popdata2019\": 66647112.0,\n      \"continentexp\": \"Europe\",\n      \"cumulative_number_for_14_days_of\": NaN,\n      \"pop\": 66647112.0,\n      \"poprank\": 22.0,\n      \"t\": 4,\n      \"c\": 201,\n      \"cases_cml\": 0,\n      \"cases_ma7\": NaN,\n      \"cases_pop\": 0.0,\n      \"cases_cml_pop\": 0.0,\n      \"deaths_cml\": 0,\n      \"deaths_ma7\": NaN,\n      \"deaths_pop\": 0.0,\n      \"deaths_cml_pop\": 0.0,\n      \"deaths_rate\": NaN,\n      \"neighbours\": 1,\n      \"p20\": 0\n    },\n    {\n      \"date\": 20200510,\n      \"daterep\": \"10/05/2020\",\n      \"date2\": \"2020-5-10\",\n      \"day\": 10,\n      \"days\": 132,\n      \"month\": 5,\n      \"year\": 2020,\n      \"cases\": 171,\n      \"deaths\": 8,\n      \"country\": \"Bolivia\",\n      \"geoid\": \"BO\",\n      \"countryterritorycode\": \"BOL\",\n      \"popdata2019\": 11513102.0,\n      \"continentexp\": \"America\",\n      \"cumulative_number_for_14_days_of\": 13.645324,\n      \"pop\": 11513102.0,\n      \"poprank\": 79.0,\n      \"t\": 132,\n      \"c\": 24,\n      \"cases_cml\": 2437,\n      \"cases_ma7\": 172.57143,\n      \"cases_pop\": 1.4852643e-05,\n      \"cases_cml_pop\": 0.00021167188,\n      \"deaths_cml\": 114,\n      \"deaths_ma7\": 6.8571429,\n      \"deaths_pop\": 6.9486049e-07,\n      \"deaths_cml_pop\": 9.9017625e-06,\n      \"deaths_rate\": 0.046778828,\n      \"neighbours\": 0,\n      \"p20\": 0\n    }\n  ],\n  \"column names\": [\n    \"date\",\n    \"daterep\",\n    \"date2\",\n    \"day\",\n    \"days\",\n    \"month\",\n    \"year\",\n    \"cases\",\n    \"deaths\",\n    \"country\",\n    \"geoid\",\n    \"countryterritorycode\",\n    \"popdata2019\",\n    \"continentexp\",\n    \"cumulative_number_for_14_days_of\",\n    \"pop\",\n    \"poprank\",\n    \"t\",\n    \"c\",\n    \"cases_cml\",\n    \"cases_ma7\",\n    \"cases_pop\",\n    \"cases_cml_pop\",\n    \"deaths_cml\",\n    \"deaths_ma7\",\n    \"deaths_pop\",\n    \"deaths_cml_pop\",\n    \"deaths_rate\",\n    \"neighbours\",\n    \"p20\"\n  ]\n}\n\nYour Job:\nI am developing a NL to Data Visualization Dataset. \nPlease help me generate natural language utterance for given dataset and constraints.\nDefinition about the Taks:\n- 'utterance' is what a user would say to make a chart. It should be a commands structure. One NL 'utterance' is in one or two sentences. Here are two examples from Commands for reference:\n    Make a simple scatter plot of worldwide Gross by Production Budget categorized by Major Genre.\n    Sort creative types by number of movies.\n- 'given dataset' is in form of column names, column type, range/unique values of the column.\n- 'constraints' are information about the chart that should be included in the utterance. \n    So we can find a reference phrase in the NL utterance that corresponds to the given constraints. \n- 'reference phrase' can be explicit, ambiguous, and by_value. 'ambiguous' means the phrase can map to more than one columns in the dataset, always a hypernym of column names(depending on the dataset values).\n    For example:\n    {\"column\": \"gdpPercap\", \"nl_ref_type\": \"explicit\", \"nl_ref_phrase\": \"GDP per capita\"},\n    {\"column\": [\"country\",\"continent\"], \"nl_ref_type\": \"ambiguous\", \"nl_ref_phrase\": \"region\"}\n    {\"column\": [\"country\",\"country_short_name\"], \"nl_ref_type\": \"ambiguous\", \"nl_ref_phrase\": \"countries\"}\n    {\"c_type\": \"mark\", \"c_name\": \"point chart\", \"nl_ref_type\": \"explicit\", \"nl_ref_phrase\": \"scatter plot\"}\n    {\"c_type\": \"mark\", \"c_name\": \"arc chart\", \"nl_ref_type\": \"explicit\", \"nl_ref_phrase\": \"pie chart\"}\n    {\"c_type\": \"transform\",\"c_name\": \"filter\",\"c_list\": [{\"field\": \"country\",\"oneOf\": [\"Iceland\",\"Norway\"]}],\"nl_ref_type\": \"explicit\",\"nl_ref_phrase\": \"for countries Iceland and Norway\"},\n    {\"c_type\": \"transform\",\"c_name\": \"filter\",\"c_list\": [{\"field\": \"country\",\"oneOf\": [\"Iceland\",\"Norway\"]}],\"nl_ref_type\": \"by_value\",\"nl_ref_phrase\": \"for Iceland and Norway\"},\n- the 'nl_ref_phrase' for 'ambiguous' columns should be equally near all ambiguous columns, not too near to one of the column since it would not be ambiguous.\n    good example: {\"column\": [\"country\",\"region\"], \"nl_ref_type\": \"ambiguous\", \"nl_ref_phrase\": \"location\"}\n    bad example: {\"column\": [\"country\",\"region\"], \"nl_ref_type\": \"ambiguous\", \"nl_ref_phrase\": \"region\"}\n- You only include given constraints and no other information. \n    For example, if a column name is not in the given constraint, it will not be included in the NL utterance.\n    Also, it a chart mark or chart encoding channel is not in the given constraint, it will not be included in the NL utterance.\n- all 'nl_ref_phrase' shoule be included in the 'nl_utterance'. \n\nThe output format is identical to the input format, but fill in the str blanks(\"...\").\n### Input:\n{\n  \"nl_utterance\": \"...\",\n  \"encoded_fields\": [\n    {\n      \"field\": \"date2\",\n      \"type\": \"temporal\",\n      \"nl_ref_type\": \"explicit\",\n      \"nl_ref_phrase\": \"...\"\n    },\n    {\n      \"field\": \"cases_ma7\",\n      \"type\": \"quantitative\",\n      \"nl_ref_type\": \"explicit\",\n      \"nl_ref_phrase\": \"...\"\n    },\n    {\n      \"field\": \"country\",\n      \"type\": \"nominal\",\n      \"nl_ref_type\": \"explicit\",\n      \"nl_ref_phrase\": \"...\"\n    }\n  ],\n  \"constraints\": [\n    {\n      \"c_type\": \"transform\",\n      \"c_name\": \"filter\",\n      \"c_list\": [\n        {\n          \"field\": \"country\",\n          \"oneOf\": [\n            \"UK\",\n            \"France\",\n            \"Germany\",\n            \"Portugal\"\n          ]\n        }\n      ],\n      \"nl_ref_type\": \"explicit\",\n      \"nl_ref_phrase\": \"...\"\n    }\n  ]\n}\n\n### Output:"
}