{
  "gpt_result": {
    "nl_utterance": "Show me the sum of the total amount in billions for each year.",
    "encoded_fields": [
      {
        "field": "Year",
        "type": "quantitative",
        "nl_ref_type": "explicit",
        "nl_ref_phrase": "year"
      },
      {
        "field": "Total_billion",
        "type": "quantitative",
        "nl_ref_type": "explicit",
        "nl_ref_phrase": "total amount in billions"
      }
    ],
    "constraints": [
      {
        "c_type": "transform",
        "c_name": "aggregate",
        "c_list": [
          {
            "field": "Total_billion",
            "aggregate": "sum"
          }
        ],
        "nl_ref_type": "explicit",
        "nl_ref_phrase": "sum"
      }
    ]
  },
  "input": "Dataset Information: {\n  \"data samples\": [\n    {\n      \"Date\": \"12/31/2021\",\n      \"GRA Purchases\": 89474552025.0,\n      \"PRGT 1/2/\": 14554823681.0,\n      \"Totals\": 104029375706.0,\n      \"Year\": 2021.0,\n      \"Total_billion\": 104.0293757,\n      \"World GDP (current US$)\": 96100100000000.0,\n      \"Total_%_WorldGDP \": 0.108251069\n    },\n    {\n      \"Date\": \" 2/ Formerly PRGF-ESF.\",\n      \"GRA Purchases\": NaN,\n      \"PRGT 1/2/\": NaN,\n      \"Totals\": NaN,\n      \"Year\": NaN,\n      \"Total_billion\": NaN,\n      \"World GDP (current US$)\": NaN,\n      \"Total_%_WorldGDP \": NaN\n    },\n    {\n      \"Date\": \"12/31/1988\",\n      \"GRA Purchases\": 24750004884.0,\n      \"PRGT 1/2/\": 1773964293.0,\n      \"Totals\": 26523969177.0,\n      \"Year\": 1988.0,\n      \"Total_billion\": 26.52396918,\n      \"World GDP (current US$)\": 19338000000000.0,\n      \"Total_%_WorldGDP \": 0.137159854\n    },\n    {\n      \"Date\": \"12/31/2018\",\n      \"GRA Purchases\": 55395611392.0,\n      \"PRGT 1/2/\": 6426181029.0,\n      \"Totals\": 61821792421.0,\n      \"Year\": 2018.0,\n      \"Total_billion\": 61.82179242,\n      \"World GDP (current US$)\": 86413000000000.0,\n      \"Total_%_WorldGDP \": 0.071542209\n    },\n    {\n      \"Date\": \"12/31/1995\",\n      \"GRA Purchases\": 35929173412.0,\n      \"PRGT 1/2/\": 5657438528.0,\n      \"Totals\": 41586611940.0,\n      \"Year\": 1995.0,\n      \"Total_billion\": 41.58661194,\n      \"World GDP (current US$)\": 31043600000000.0,\n      \"Total_%_WorldGDP \": 0.133961743\n    }\n  ],\n  \"column names\": [\n    \"Date\",\n    \"GRA Purchases\",\n    \"PRGT 1/2/\",\n    \"Totals\",\n    \"Year\",\n    \"Total_billion\",\n    \"World GDP (current US$)\",\n    \"Total_%_WorldGDP \"\n  ]\n}\n\nYour Job:\nI am developing a NL to Data Visualization Dataset. \nPlease help me generate natural language utterance for given dataset and constraints.\nDefinition about the Taks:\n- 'utterance' is what a user would say to make a chart.  One NL 'utterance' is in one or two sentences. Here are two examples from Others for reference:\n    I want to know how many orders there are by the quantity of the order.\n    Trend for average horsepower over time across different origin.\n- 'given dataset' is in form of column names, column type, range/unique values of the column.\n- 'constraints' are information about the chart that should be included in the utterance. \n    So we can find a reference phrase in the NL utterance that corresponds to the given constraints. \n- 'reference phrase' can be explicit, ambiguous, and by_value. 'ambiguous' means the phrase can map to more than one columns in the dataset, always a hypernym of column names(depending on the dataset values).\n    For example:\n    {\"column\": \"gdpPercap\", \"nl_ref_type\": \"explicit\", \"nl_ref_phrase\": \"GDP per capita\"},\n    {\"column\": [\"country\",\"continent\"], \"nl_ref_type\": \"ambiguous\", \"nl_ref_phrase\": \"region\"}\n    {\"column\": [\"country\",\"country_short_name\"], \"nl_ref_type\": \"ambiguous\", \"nl_ref_phrase\": \"countries\"}\n    {\"c_type\": \"mark\", \"c_name\": \"point chart\", \"nl_ref_type\": \"explicit\", \"nl_ref_phrase\": \"scatter plot\"}\n    {\"c_type\": \"mark\", \"c_name\": \"arc chart\", \"nl_ref_type\": \"explicit\", \"nl_ref_phrase\": \"pie chart\"}\n    {\"c_type\": \"transform\",\"c_name\": \"filter\",\"c_list\": [{\"field\": \"country\",\"oneOf\": [\"Iceland\",\"Norway\"]}],\"nl_ref_type\": \"explicit\",\"nl_ref_phrase\": \"for countries Iceland and Norway\"},\n    {\"c_type\": \"transform\",\"c_name\": \"filter\",\"c_list\": [{\"field\": \"country\",\"oneOf\": [\"Iceland\",\"Norway\"]}],\"nl_ref_type\": \"by_value\",\"nl_ref_phrase\": \"for Iceland and Norway\"},\n- the 'nl_ref_phrase' for 'ambiguous' columns should be equally near all ambiguous columns, not too near to one of the column since it would not be ambiguous.\n    good example: {\"column\": [\"country\",\"region\"], \"nl_ref_type\": \"ambiguous\", \"nl_ref_phrase\": \"location\"}\n    bad example: {\"column\": [\"country\",\"region\"], \"nl_ref_type\": \"ambiguous\", \"nl_ref_phrase\": \"region\"}\n- You only include given constraints and no other information. \n    For example, if a column name is not in the given constraint, it will not be included in the NL utterance.\n    Also, it a chart mark or chart encoding channel is not in the given constraint, it will not be included in the NL utterance.\n- all 'nl_ref_phrase' shoule be included in the 'nl_utterance'. \n\nThe output format is identical to the input format, but fill in the str blanks(\"...\").\n### Input:\n{\n  \"nl_utterance\": \"...\",\n  \"encoded_fields\": [\n    {\n      \"field\": \"Year\",\n      \"type\": \"quantitative\",\n      \"nl_ref_type\": \"explicit\",\n      \"nl_ref_phrase\": \"...\"\n    },\n    {\n      \"field\": \"Total_billion\",\n      \"type\": \"quantitative\",\n      \"nl_ref_type\": \"explicit\",\n      \"nl_ref_phrase\": \"...\"\n    }\n  ],\n  \"constraints\": [\n    {\n      \"c_type\": \"transform\",\n      \"c_name\": \"aggregate\",\n      \"c_list\": [\n        {\n          \"field\": \"Total_billion\",\n          \"aggregate\": \"sum\"\n        }\n      ],\n      \"nl_ref_type\": \"explicit\",\n      \"nl_ref_phrase\": \"...\"\n    }\n  ]\n}\n\n### Output:"
}