{
  "gpt_result": {
    "nl_utterance": "Can you show me a line chart of the sum of weekly death counts over the weeks for countries such as United Kingdom, France, Germany, and India?",
    "encoded_fields": [
      {
        "field": "year_week",
        "type": "nominal",
        "nl_ref_type": "explicit",
        "nl_ref_phrase": "weeks"
      },
      {
        "field": "weekly_count",
        "type": "quantitative",
        "nl_ref_type": "explicit",
        "nl_ref_phrase": "weekly death counts"
      },
      {
        "field": [
          "country",
          "continent",
          "country_code"
        ],
        "type": "nominal",
        "nl_ref_type": "ambiguous",
        "nl_ref_phrase": "countries"
      }
    ],
    "constraints": [
      {
        "c_type": "mark",
        "c_name": "line chart",
        "c_list": [
          {
            "mark": "line",
            "encoding": {
              "x": {},
              "y": {
                "type": "quantitative"
              },
              "color": {
                "ignore": true,
                "type": "nominal"
              },
              "column": {
                "ignore": true,
                "type": "nominal"
              },
              "row": {
                "ignore": true,
                "type": "nominal"
              }
            },
            "unique_map": {
              "x": "y"
            }
          }
        ],
        "nl_ref_type": "explicit",
        "nl_ref_phrase": "line chart"
      },
      {
        "c_type": "transform",
        "c_name": "filter",
        "c_list": [
          {
            "field": "country",
            "oneOf": [
              "United Kingdom",
              "France",
              "Germany",
              "India"
            ]
          }
        ],
        "nl_ref_type": "by_value",
        "nl_ref_phrase": "for countries such as United Kingdom, France, Germany, and India"
      },
      {
        "c_type": "transform",
        "c_name": "filter",
        "c_list": [
          {
            "field": "indicator",
            "oneOf": [
              "deaths"
            ]
          }
        ],
        "nl_ref_type": "by_value",
        "nl_ref_phrase": "death"
      },
      {
        "c_type": "transform",
        "c_name": "aggregate",
        "c_list": [
          {
            "field": "weekly_count",
            "aggregate": "sum"
          }
        ],
        "nl_ref_type": "explicit",
        "nl_ref_phrase": "sum of"
      }
    ]
  },
  "input": "Dataset Information: {\n  \"data samples\": [\n    {\n      \"country\": \"Afghanistan\",\n      \"country_code\": \"AFG\",\n      \"continent\": \"Asia\",\n      \"population\": 38928341,\n      \"indicator\": \"cases\",\n      \"weekly_count\": 0,\n      \"year_week\": \"2020-01\",\n      \"rate_14_day\": NaN,\n      \"cumulative_count\": 0,\n      \"source\": \"Epidemic intelligence, national weekly data\"\n    },\n    {\n      \"country\": \"Singapore\",\n      \"country_code\": \"SGP\",\n      \"continent\": \"Asia\",\n      \"population\": 5850343,\n      \"indicator\": \"deaths\",\n      \"weekly_count\": 0,\n      \"year_week\": \"2020-44\",\n      \"rate_14_day\": 0.0,\n      \"cumulative_count\": 28,\n      \"source\": \"Epidemic intelligence, national weekly data\"\n    },\n    {\n      \"country\": \"Paraguay\",\n      \"country_code\": \"PRY\",\n      \"continent\": \"America\",\n      \"population\": 7132530,\n      \"indicator\": \"cases\",\n      \"weekly_count\": 5049,\n      \"year_week\": \"2020-42\",\n      \"rate_14_day\": 147.8017,\n      \"cumulative_count\": 54724,\n      \"source\": \"Epidemic intelligence, national weekly data\"\n    },\n    {\n      \"country\": \"Malawi\",\n      \"country_code\": \"MWI\",\n      \"continent\": \"Africa\",\n      \"population\": 19129955,\n      \"indicator\": \"cases\",\n      \"weekly_count\": 427,\n      \"year_week\": \"2020-32\",\n      \"rate_14_day\": 5.321497,\n      \"cumulative_count\": 4658,\n      \"source\": \"Epidemic intelligence, national weekly data\"\n    },\n    {\n      \"country\": \"Kosovo\",\n      \"country_code\": \"XKX\",\n      \"continent\": \"Europe\",\n      \"population\": 1795666,\n      \"indicator\": \"deaths\",\n      \"weekly_count\": 53,\n      \"year_week\": \"2021-10\",\n      \"rate_14_day\": 57.360332,\n      \"cumulative_count\": 1702,\n      \"source\": \"Epidemic intelligence, national weekly data\"\n    }\n  ],\n  \"column names\": [\n    \"country\",\n    \"country_code\",\n    \"continent\",\n    \"population\",\n    \"indicator\",\n    \"weekly_count\",\n    \"year_week\",\n    \"rate_14_day\",\n    \"cumulative_count\",\n    \"source\"\n  ]\n}\n\nYour Job:\nI am developing a NL to Data Visualization Dataset. \nPlease help me generate natural language utterance for given dataset and constraints.\nDefinition about the Taks:\n- 'utterance' is what a user would say to make a chart. It should be a questions structure. One NL 'utterance' is in one or two sentences. Here are two examples from Questions for reference:\n    Which countries have the highest acceleration for cars of different cylinders?\n    How does displacement relate to fuel economy for cars from Europe vs. USA?\n- 'given dataset' is in form of column names, column type, range/unique values of the column.\n- 'constraints' are information about the chart that should be included in the utterance. \n    So we can find a reference phrase in the NL utterance that corresponds to the given constraints. \n- 'reference phrase' can be explicit, ambiguous, and by_value. 'ambiguous' means the phrase can map to more than one columns in the dataset, always a hypernym of column names(depending on the dataset values).\n    For example:\n    {\"column\": \"gdpPercap\", \"nl_ref_type\": \"explicit\", \"nl_ref_phrase\": \"GDP per capita\"},\n    {\"column\": [\"country\",\"continent\"], \"nl_ref_type\": \"ambiguous\", \"nl_ref_phrase\": \"region\"}\n    {\"column\": [\"country\",\"country_short_name\"], \"nl_ref_type\": \"ambiguous\", \"nl_ref_phrase\": \"countries\"}\n    {\"c_type\": \"mark\", \"c_name\": \"point chart\", \"nl_ref_type\": \"explicit\", \"nl_ref_phrase\": \"scatter plot\"}\n    {\"c_type\": \"mark\", \"c_name\": \"arc chart\", \"nl_ref_type\": \"explicit\", \"nl_ref_phrase\": \"pie chart\"}\n    {\"c_type\": \"transform\",\"c_name\": \"filter\",\"c_list\": [{\"field\": \"country\",\"oneOf\": [\"Iceland\",\"Norway\"]}],\"nl_ref_type\": \"explicit\",\"nl_ref_phrase\": \"for countries Iceland and Norway\"},\n    {\"c_type\": \"transform\",\"c_name\": \"filter\",\"c_list\": [{\"field\": \"country\",\"oneOf\": [\"Iceland\",\"Norway\"]}],\"nl_ref_type\": \"by_value\",\"nl_ref_phrase\": \"for Iceland and Norway\"},\n- the 'nl_ref_phrase' for 'ambiguous' columns should be equally near all ambiguous columns, not too near to one of the column since it would not be ambiguous.\n    good example: {\"column\": [\"country\",\"region\"], \"nl_ref_type\": \"ambiguous\", \"nl_ref_phrase\": \"location\"}\n    bad example: {\"column\": [\"country\",\"region\"], \"nl_ref_type\": \"ambiguous\", \"nl_ref_phrase\": \"region\"}\n- You only include given constraints and no other information. \n    For example, if a column name is not in the given constraint, it will not be included in the NL utterance.\n    Also, it a chart mark or chart encoding channel is not in the given constraint, it will not be included in the NL utterance.\n- all 'nl_ref_phrase' shoule be included in the 'nl_utterance'. \n\nThe output format is identical to the input format, but fill in the str blanks(\"...\").\n### Input:\n{\n  \"nl_utterance\": \"...\",\n  \"encoded_fields\": [\n    {\n      \"field\": \"year_week\",\n      \"type\": \"nominal\",\n      \"nl_ref_type\": \"explicit\",\n      \"nl_ref_phrase\": \"...\"\n    },\n    {\n      \"field\": \"weekly_count\",\n      \"type\": \"quantitative\",\n      \"nl_ref_type\": \"explicit\",\n      \"nl_ref_phrase\": \"...\"\n    },\n    {\n      \"field\": [\n        \"country\",\n        \"continent\",\n        \"country_code\"\n      ],\n      \"type\": \"nominal\",\n      \"nl_ref_type\": \"ambiguous\",\n      \"nl_ref_phrase\": \"...\"\n    }\n  ],\n  \"constraints\": [\n    {\n      \"c_type\": \"mark\",\n      \"c_name\": \"line chart\",\n      \"c_list\": [\n        {\n          \"mark\": \"line\",\n          \"encoding\": {\n            \"x\": {},\n            \"y\": {\n              \"type\": \"quantitative\"\n            },\n            \"color\": {\n              \"ignore\": true,\n              \"type\": \"nominal\"\n            },\n            \"column\": {\n              \"ignore\": true,\n              \"type\": \"nominal\"\n            },\n            \"row\": {\n              \"ignore\": true,\n              \"type\": \"nominal\"\n            }\n          },\n          \"unique_map\": {\n            \"x\": \"y\"\n          }\n        }\n      ],\n      \"nl_ref_type\": \"explicit\",\n      \"nl_ref_phrase\": \"...\"\n    },\n    {\n      \"c_type\": \"transform\",\n      \"c_name\": \"filter\",\n      \"c_list\": [\n        {\n          \"field\": \"country\",\n          \"oneOf\": [\n            \"United Kingdom\",\n            \"France\",\n            \"Germany\",\n            \"India\"\n          ]\n        }\n      ],\n      \"nl_ref_type\": \"by_value\",\n      \"nl_ref_phrase\": \"...\"\n    },\n    {\n      \"c_type\": \"transform\",\n      \"c_name\": \"filter\",\n      \"c_list\": [\n        {\n          \"field\": \"indicator\",\n          \"oneOf\": [\n            \"deaths\"\n          ]\n        }\n      ],\n      \"nl_ref_type\": \"by_value\",\n      \"nl_ref_phrase\": \"...\"\n    },\n    {\n      \"c_type\": \"transform\",\n      \"c_name\": \"aggregate\",\n      \"c_list\": [\n        {\n          \"field\": \"weekly_count\",\n          \"aggregate\": \"sum\"\n        }\n      ],\n      \"nl_ref_type\": \"explicit\",\n      \"nl_ref_phrase\": \"...\"\n    }\n  ]\n}\n\n### Output:"
}